number,value,datetime_start,datetime_complete,duration,params_C,params_gamma,params_kernel,params_mask_number,params_rsi_window,params_so_smooth,params_so_window,params_srsi_smooth1,params_srsi_smooth2,params_srsi_window,params_tsi_window_fast,params_tsi_window_slow,params_ult_weight_1,params_ult_weight_2,params_ult_weight_3,params_ult_window_1,params_ult_window_2,params_ult_window_3,params_williams_lbp,state
5794,0.3410039025703136,2024-04-11 17:31:04.833747,2024-04-11 17:31:06.631417,0 days 00:00:01.797670,98.25497567019792,8.268087329005517,sigmoid,14,,26.0,31.0,,,,5.0,36.0,7.679256690422966,7.727075136615323,0.6915633558278333,5.0,28.0,67.0,,COMPLETE
5795,0.5241987385763933,2024-04-11 17:31:06.633421,2024-04-11 17:31:07.961034,0 days 00:00:01.327613,98.27334533476976,8.083400839250869,sigmoid,20,,,,5.0,2.0,97.0,26.0,3.0,,,,,,,,COMPLETE
5796,0.4535599498828785,2024-04-11 17:31:07.964035,2024-04-11 17:31:10.000382,0 days 00:00:02.036347,99.98663176275713,7.618464982352206,sigmoid,62,20.0,28.0,35.0,2.0,4.0,95.0,11.0,24.0,8.891135295287928,4.376731660145637,9.69661098324826,3.0,34.0,50.0,,COMPLETE
5797,0.3944396750974048,2024-04-11 17:31:10.003385,2024-04-11 17:31:11.737504,0 days 00:00:01.734119,96.5574285801927,5.494679350199772,sigmoid,11,,8.0,29.0,,,,,,2.476876022382165,5.765903569363676,1.5232660065851977,7.0,26.0,57.0,20.0,COMPLETE
5798,0.5895095625828441,2024-04-11 17:31:11.740496,2024-04-11 17:31:12.888484,0 days 00:00:01.147988,94.06539871304044,7.868689642028931,sigmoid,8,,26.0,34.0,,,,,,,,,,,,,COMPLETE
5799,0.3624591148788466,2024-04-11 17:31:12.890471,2024-04-11 17:31:14.671562,0 days 00:00:01.781091,52.78574076826592,8.774411496195553,sigmoid,26,,24.0,32.0,1.0,1.0,10.0,,,6.443655336389126,3.413900993227363,3.7659503128899177,13.0,38.0,94.0,,COMPLETE
5800,0.5931679318644695,2024-04-11 17:31:14.675541,2024-04-11 17:31:15.888625,0 days 00:00:01.213084,96.52578775973944,8.32519840833075,sigmoid,8,,25.0,27.0,,,,,,,,,,,,,COMPLETE
5801,0.43554949144132965,2024-04-11 17:31:15.892179,2024-04-11 17:31:17.230855,0 days 00:00:01.338676,98.10063250435176,8.088113362440264,sigmoid,48,11.0,,,6.0,6.0,17.0,,,,,,,,,,COMPLETE
5802,0.4798642593918185,2024-04-11 17:31:17.232868,2024-04-11 17:31:18.731923,0 days 00:00:01.499055,98.23263206918374,8.52437507498501,sigmoid,56,48.0,28.0,29.0,4.0,3.0,2.0,,,,,,,,,,COMPLETE
5803,0.6009432182607054,2024-04-11 17:31:18.734458,2024-04-11 17:31:19.878909,0 days 00:00:01.144451,95.28082767663753,7.931012455509292,sigmoid,8,,22.0,31.0,,,,,,,,,,,,,COMPLETE
5804,0.07112383518580889,2024-04-11 17:31:19.880909,2024-04-11 17:31:22.009191,0 days 00:00:02.128282,92.46835230615575,8.20891060374397,rbf,59,47.0,24.0,30.0,3.0,7.0,55.0,,,4.136547612526964,2.021755221087846,2.5974460396364356,20.0,36.0,75.0,166.0,COMPLETE
5805,0.34796937759621,2024-04-11 17:31:22.012188,2024-04-11 17:31:23.507385,0 days 00:00:01.495197,96.65298253405238,7.325638164898662,sigmoid,44,13.0,26.0,33.0,,,,36.0,9.0,,,,,,,,COMPLETE
5806,0.5952371952371952,2024-04-11 17:31:23.509977,2024-04-11 17:31:24.716366,0 days 00:00:01.206389,98.08922060151971,7.7044995720933676,sigmoid,8,,25.0,32.0,,,,,,,,,,,,,COMPLETE
5807,0.3704412011407482,2024-04-11 17:31:24.719880,2024-04-11 17:31:26.021704,0 days 00:00:01.301824,94.7804525396621,8.354891398743652,sigmoid,37,8.0,,,,,,19.0,31.0,,,,,,,62.0,COMPLETE
5808,0.5409601295116332,2024-04-11 17:31:26.023701,2024-04-11 17:31:27.535784,0 days 00:00:01.512083,98.13254237239248,8.031226930792249,sigmoid,52,6.0,,,7.0,5.0,24.0,50.0,50.0,,,,,,,,COMPLETE
5809,0.5963245096172158,2024-04-11 17:31:27.538799,2024-04-11 17:31:28.774776,0 days 00:00:01.235977,98.30674050906606,8.661352368733498,sigmoid,8,,23.0,31.0,,,,,,,,,,,,,COMPLETE
5810,0.12003789673140693,2024-04-11 17:31:28.776777,2024-04-11 17:31:29.936084,0 days 00:00:01.159307,96.65906071723145,7.814058002049165,sigmoid,8,,27.0,28.0,,,,,,,,,,,,,COMPLETE
5811,0.33392464344000566,2024-04-11 17:31:29.938079,2024-04-11 17:31:31.302855,0 days 00:00:01.364776,98.21479043869208,7.490633805664359,sigmoid,12,,26.0,30.0,,,,34.0,26.0,,,,,,,,COMPLETE
5812,0.46269796961772397,2024-04-11 17:31:31.306843,2024-04-11 17:31:32.960492,0 days 00:00:01.653649,90.16845747216337,8.210175893511206,sigmoid,60,15.0,21.0,32.0,8.0,3.0,100.0,24.0,4.0,,,,,,,,COMPLETE
5813,0.47357867709989,2024-04-11 17:31:32.962493,2024-04-11 17:31:34.987483,0 days 00:00:02.024990,95.47211151989072,7.983728081253806,sigmoid,55,50.0,,,2.0,4.0,76.0,30.0,14.0,8.33751248805197,8.096855195836202,6.841454895818242,15.0,41.0,96.0,101.0,COMPLETE
5814,0.5287132485235908,2024-04-11 17:31:34.990058,2024-04-11 17:31:36.500269,0 days 00:00:01.510211,98.36355963402615,8.425449548970589,sigmoid,13,,36.0,12.0,,,,48.0,30.0,,,,,,,40.0,COMPLETE
5815,0.6009432182607054,2024-04-11 17:31:36.503833,2024-04-11 17:31:37.705979,0 days 00:00:01.202146,96.5364639900011,7.648997240579445,sigmoid,8,,24.0,31.0,,,,,,,,,,,,,COMPLETE
5816,0.5606772000233785,2024-04-11 17:31:37.708988,2024-04-11 17:31:39.054148,0 days 00:00:01.345160,42.451977904734775,8.127242999970543,sigmoid,40,45.0,28.0,29.0,,,,,,,,,,,,,COMPLETE
5817,0.5848142164781907,2024-04-11 17:31:39.057136,2024-04-11 17:31:40.124143,0 days 00:00:01.067007,93.87018010628653,4.819635476922292,sigmoid,32,23.0,,,,,,,,,,,,,,,COMPLETE
5818,0.4718009478672986,2024-04-11 17:31:40.126138,2024-04-11 17:31:41.949687,0 days 00:00:01.823549,98.34105573902332,7.857043791188322,sigmoid,23,,,,5.0,8.0,51.0,41.0,5.0,5.102069746709087,6.928055066000205,5.127503009368175,17.0,23.0,72.0,48.0,COMPLETE
5819,0.5906279643331437,2024-04-11 17:31:41.951683,2024-04-11 17:31:43.112997,0 days 00:00:01.161314,98.2541960270872,8.298727657010508,sigmoid,8,,27.0,34.0,,,,,,,,,,,,,COMPLETE
5820,0.4527772105370635,2024-04-11 17:31:43.115581,2024-04-11 17:31:45.056123,0 days 00:00:01.940542,95.89119433003728,7.164208196488721,sigmoid,54,35.0,,,4.0,2.0,72.0,39.0,35.0,3.2853690757894403,1.5239462238667345,8.658776927557593,18.0,29.0,82.0,,COMPLETE
5821,0.3891393300506276,2024-04-11 17:31:45.060080,2024-04-11 17:31:46.680035,0 days 00:00:01.619955,99.94029686860969,8.053733859181513,sigmoid,7,,,,,,,43.0,38.0,5.644639830979138,9.453624742753671,2.223612400775736,6.0,21.0,70.0,114.0,COMPLETE
5822,0.5447818907677193,2024-04-11 17:31:46.682581,2024-04-11 17:31:48.134694,0 days 00:00:01.452113,92.56007339099659,7.786233077822198,sigmoid,34,27.0,,,,,,,,3.5497433361290924,8.603361470263208,1.837770285990374,3.0,46.0,84.0,,COMPLETE
5823,0.4502698896972542,2024-04-11 17:31:48.138738,2024-04-11 17:31:49.288035,0 days 00:00:01.149297,99.9617636343155,8.214743291056323,sigmoid,8,,25.0,30.0,,,,,,,,,,,,,COMPLETE
5824,0.4589089001573702,2024-04-11 17:31:49.290030,2024-04-11 17:31:51.519317,0 days 00:00:02.229287,96.4668591557192,8.578213406767363,sigmoid,27,,15.0,33.0,1.0,7.0,82.0,,,0.8487774169500071,6.644763692184654,8.216685572534537,4.0,33.0,68.0,120.0,COMPLETE
5825,0.03248773483307407,2024-04-11 17:31:51.521321,2024-04-11 17:31:53.430328,0 days 00:00:01.909007,98.2969990686778,7.9765521091524665,rbf,61,16.0,23.0,40.0,6.0,1.0,91.0,8.0,16.0,,,,,,,150.0,COMPLETE
5826,0.5350875353810672,2024-04-11 17:31:53.433326,2024-04-11 17:31:54.717217,0 days 00:00:01.283891,94.1685890533131,8.38893764849418,sigmoid,5,,,,,,,2.0,33.0,,,,,,,159.0,COMPLETE
5827,0.5369482300983651,2024-04-11 17:31:54.719252,2024-04-11 17:31:55.774589,0 days 00:00:01.055337,96.52459403764092,7.668179060486418,sigmoid,1,,,,,,,,,,,,,,,196.0,COMPLETE
5828,0.5368803152872847,2024-04-11 17:31:55.776614,2024-04-11 17:31:57.072549,0 days 00:00:01.295935,63.68414784890061,8.141413554926805,sigmoid,36,29.0,,,,,,4.0,11.0,,,,,,,,COMPLETE
5829,0.5952371952371952,2024-04-11 17:31:57.075075,2024-04-11 17:31:58.227845,0 days 00:00:01.152770,99.95683364156677,7.467373613277631,sigmoid,8,,25.0,32.0,,,,,,,,,,,,,COMPLETE
5830,0.4410710702101431,2024-04-11 17:31:58.230845,2024-04-11 17:32:00.154283,0 days 00:00:01.923438,98.34725311729834,8.901943913644358,sigmoid,30,,26.0,31.0,7.0,5.0,47.0,27.0,23.0,1.2086723610493406,5.15070346005368,6.549823783410002,14.0,49.0,98.0,,COMPLETE
5831,0.3588006938134963,2024-04-11 17:32:00.157277,2024-04-11 17:32:01.281906,0 days 00:00:01.124629,95.39770438964533,7.897088540870621,sigmoid,33,4.0,,,,,,,,,,,,,,188.0,COMPLETE
5832,0.33424434923917856,2024-04-11 17:32:01.284888,2024-04-11 17:32:02.916302,0 days 00:00:01.631414,98.1100562250587,8.454503521967736,sigmoid,53,42.0,,,8.0,1.0,26.0,12.0,29.0,,,,,,,155.0,COMPLETE
5833,0.3984102720880465,2024-04-11 17:32:02.919327,2024-04-11 17:32:04.468431,0 days 00:00:01.549104,98.25640919209654,8.180476883306754,sigmoid,45,33.0,29.0,29.0,,,,16.0,18.0,,,,,,,29.0,COMPLETE
5834,0.5285867061533399,2024-04-11 17:32:04.471008,2024-04-11 17:32:05.635453,0 days 00:00:01.164445,96.6359573158172,7.852457978198517,sigmoid,4,,,,,,,33.0,44.0,,,,,,,,COMPLETE
5835,0.4166937221451551,2024-04-11 17:32:05.638968,2024-04-11 17:32:07.602847,0 days 00:00:01.963879,93.91606379078969,8.040812680949545,sigmoid,51,25.0,,,3.0,6.0,41.0,,,9.525436743227733,8.845667581652044,3.279624449741982,12.0,37.0,99.0,17.0,COMPLETE
5836,0.44701971028259324,2024-04-11 17:32:07.605848,2024-04-11 17:32:08.813010,0 days 00:00:01.207162,99.96818191469903,7.623871236972474,sigmoid,8,,24.0,30.0,,,,,,,,,,,,,COMPLETE
5837,0.5963643249384587,2024-04-11 17:32:08.815006,2024-04-11 17:32:10.067923,0 days 00:00:01.252917,99.92221766896988,8.611154969758914,sigmoid,8,,25.0,32.0,,,,,,,,,,,,,COMPLETE
5838,0.46318707682465216,2024-04-11 17:32:10.069817,2024-04-11 17:32:11.728511,0 days 00:00:01.658694,96.53027224302306,8.32980120007378,sigmoid,19,,,,5.0,8.0,86.0,,,2.968088324854285,4.522603398817073,5.55569021297318,16.0,24.0,85.0,173.0,COMPLETE
5839,0.3830941199814803,2024-04-11 17:32:11.730513,2024-04-11 17:32:13.143859,0 days 00:00:01.413346,91.45342847923372,7.876950916707367,sigmoid,49,11.0,,,3.0,3.0,29.0,,,,,,,,,133.0,COMPLETE
5840,0.5986580986580987,2024-04-11 17:32:13.145850,2024-04-11 17:32:14.358918,0 days 00:00:01.213068,98.25260906075154,8.201881982957513,sigmoid,8,,27.0,31.0,,,,,,,,,,,,,COMPLETE
5841,0.322896566789238,2024-04-11 17:32:14.360919,2024-04-11 17:32:16.021060,0 days 00:00:01.660141,95.15335227943486,8.054552328716639,sigmoid,18,,,,4.0,4.0,15.0,,,9.813433933420043,6.359759910402536,4.556446662192146,19.0,27.0,53.0,,COMPLETE
5842,0.42752362008950767,2024-04-11 17:32:16.024016,2024-04-11 17:32:17.951963,0 days 00:00:01.927947,96.69047670519538,7.744055770655095,sigmoid,58,40.0,24.0,33.0,1.0,2.0,78.0,,,4.823314940422664,3.6177952466747563,1.2803147087366553,2.0,22.0,78.0,,COMPLETE
5843,0.4825204483489852,2024-04-11 17:32:17.953958,2024-04-11 17:32:19.847511,0 days 00:00:01.893553,96.78298544034492,8.409775098474922,rbf,8,,26.0,30.0,,,,,,,,,,,,,COMPLETE
5844,0.45317267819419443,2024-04-11 17:32:19.851009,2024-04-11 17:32:21.606504,0 days 00:00:01.755495,99.98541710055888,7.55180841986635,sigmoid,29,,22.0,31.0,8.0,5.0,44.0,23.0,48.0,,,,,,,56.0,COMPLETE
5845,0.39947952696247985,2024-04-11 17:32:21.609092,2024-04-11 17:32:23.290819,0 days 00:00:01.681727,48.00478440230259,6.908130665895069,sigmoid,50,22.0,,,6.0,6.0,70.0,,,1.885121203227453,0.805562699562417,7.399381936297059,7.0,39.0,73.0,,COMPLETE
5846,0.12003789673140693,2024-04-11 17:32:23.292817,2024-04-11 17:32:24.471969,0 days 00:00:01.179152,98.1526623923924,8.745240275145688,sigmoid,8,,23.0,28.0,,,,,,,,,,,,,COMPLETE
5847,0.5952371952371952,2024-04-11 17:32:24.474489,2024-04-11 17:32:25.679092,0 days 00:00:01.204603,99.95411596922571,8.019779839023506,sigmoid,8,,25.0,32.0,,,,,,,,,,,,,COMPLETE
5848,0.493154134994047,2024-04-11 17:32:25.681093,2024-04-11 17:32:27.386967,0 days 00:00:01.705874,94.59151459733879,8.264835637318146,sigmoid,39,18.0,,,,,,25.0,40.0,1.5780655787690279,2.7938864344628778,5.98986024738393,10.0,44.0,92.0,144.0,COMPLETE
5849,0.42508472560794347,2024-04-11 17:32:27.389493,2024-04-11 17:32:28.624326,0 days 00:00:01.234833,98.15430403640192,7.90970753970784,sigmoid,17,,,,2.0,7.0,66.0,,,,,,,,,69.0,COMPLETE
5850,0.49666963741263664,2024-04-11 17:32:28.626321,2024-04-11 17:32:30.476149,0 days 00:00:01.849828,99.93382496068847,8.496558013513566,sigmoid,22,,,,7.0,4.0,59.0,40.0,45.0,5.889377658958806,9.095760218944289,9.23029245484345,17.0,40.0,81.0,,COMPLETE
5851,0.4100535180746626,2024-04-11 17:32:30.478335,2024-04-11 17:32:32.015356,0 days 00:00:01.537021,95.08426834286244,7.414977255843853,sigmoid,25,,26.0,30.0,5.0,1.0,37.0,,,,,,,,,140.0,COMPLETE
5852,0.4949020008688319,2024-04-11 17:32:32.017356,2024-04-11 17:32:33.960344,0 days 00:00:01.942988,98.22135887261071,8.193658862176145,sigmoid,47,37.0,27.0,33.0,,,,21.0,2.0,3.9344102598769104,8.339439641755,7.785222260240845,13.0,30.0,51.0,179.0,COMPLETE
5853,0.535514439465729,2024-04-11 17:32:33.962880,2024-04-11 17:32:35.523113,0 days 00:00:01.560233,92.6291830271822,7.759035719322154,sigmoid,6,,,,,,,13.0,13.0,5.408727407975761,9.640288838961318,3.51925410922924,19.0,47.0,77.0,,COMPLETE
5854,0.5943780375673191,2024-04-11 17:32:35.525111,2024-04-11 17:32:36.779889,0 days 00:00:01.254778,99.9656867952246,8.076171434066502,sigmoid,8,,24.0,24.0,,,,,,,,,,,,,COMPLETE
5855,0.3916027179608533,2024-04-11 17:32:36.781878,2024-04-11 17:32:38.644975,0 days 00:00:01.863097,84.13114377729747,8.32262694265501,sigmoid,43,49.0,25.0,32.0,,,,,,6.7835186029788,9.866311932349792,8.925114393696367,9.0,48.0,52.0,99.0,COMPLETE
5856,0.5334611183247799,2024-04-11 17:32:38.648945,2024-04-11 17:32:40.164712,0 days 00:00:01.515767,96.70640799866561,7.913067384807429,sigmoid,21,,,,4.0,8.0,13.0,6.0,25.0,,,,,,,108.0,COMPLETE
5857,0.5218333719143923,2024-04-11 17:32:40.166715,2024-04-11 17:32:41.775197,0 days 00:00:01.608482,99.96670593245705,7.649336961045515,sigmoid,35,43.0,,,,,,,,8.487581856727392,4.734392828001698,7.145726822752513,20.0,21.0,66.0,125.0,COMPLETE
5858,0.4881673233031016,2024-04-11 17:32:41.778192,2024-04-11 17:32:43.232318,0 days 00:00:01.454126,99.96399723824977,8.519100096063289,sigmoid,24,,30.0,29.0,3.0,2.0,64.0,,,,,,,,,,COMPLETE
5859,0.6009432182607054,2024-04-11 17:32:43.235314,2024-04-11 17:32:44.333097,0 days 00:00:01.097783,95.34214243870028,8.096815363661044,sigmoid,8,,28.0,31.0,,,,,,,,,,,,,COMPLETE
5860,0.3284468955701832,2024-04-11 17:32:44.334606,2024-04-11 17:32:46.495265,0 days 00:00:02.160659,96.54387672332557,3.438110758768544,rbf,38,28.0,,,,,,47.0,19.0,6.215625489528654,9.274136027714963,4.0826533734716,5.0,42.0,58.0,,COMPLETE
5861,0.532871605879612,2024-04-11 17:32:46.496247,2024-04-11 17:32:48.023291,0 days 00:00:01.527044,98.24355938660193,7.317659676643824,sigmoid,3,,,,,,,,,4.4316655981138515,2.356037450197132,2.358206010278128,11.0,33.0,80.0,161.0,COMPLETE
5862,0.5906279643331437,2024-04-11 17:32:48.026289,2024-04-11 17:32:49.178533,0 days 00:00:01.152244,93.35217591798731,8.309568977176696,sigmoid,8,,26.0,34.0,,,,,,,,,,,,,COMPLETE
5863,0.3881164833644601,2024-04-11 17:32:49.181107,2024-04-11 17:32:51.070520,0 days 00:00:01.889413,99.9995586802203,7.773118231326843,sigmoid,15,,27.0,30.0,,,,31.0,7.0,5.197901045574052,7.287702037336639,2.728235242042572,4.0,25.0,97.0,183.0,COMPLETE
5864,0.6009432182607054,2024-04-11 17:32:51.072530,2024-04-11 17:32:52.253127,0 days 00:00:01.180597,99.99818901951778,8.008479972003531,sigmoid,8,,23.0,31.0,,,,,,,,,,,,,COMPLETE
5865,0.44852556513119857,2024-04-11 17:32:52.256124,2024-04-11 17:32:53.808686,0 days 00:00:01.552562,96.69525345183071,8.17554209468371,sigmoid,57,34.0,25.0,32.0,6.0,3.0,53.0,,,,,,,,,72.0,COMPLETE
5866,0.6009432182607054,2024-04-11 17:32:53.810676,2024-04-11 17:32:54.961349,0 days 00:00:01.150673,96.65888653585012,7.868010187816034,sigmoid,8,,24.0,31.0,,,,,,,,,,,,,COMPLETE
5867,0.12622036262203626,2024-04-11 17:32:54.964332,2024-04-11 17:32:56.214211,0 days 00:00:01.249879,98.139782213356,8.478939567023032,sigmoid,8,,26.0,29.0,,,,,,,,,,,,,COMPLETE
5868,0.3306865294076312,2024-04-11 17:32:56.217214,2024-04-11 17:32:57.964382,0 days 00:00:01.747168,99.93960230157353,8.656967976349598,sigmoid,42,31.0,22.0,33.0,,,,,,8.068848625244687,7.569210677387692,5.214146880576556,18.0,35.0,89.0,,COMPLETE
5869,0.4951273722003761,2024-04-11 17:32:57.967878,2024-04-11 17:32:59.698837,0 days 00:00:01.730959,94.3168691308253,7.639360665467087,sigmoid,14,,29.0,27.0,,,,44.0,11.0,7.269646437912539,1.8344659706323996,1.6866093591678752,8.0,26.0,79.0,,COMPLETE
5870,0.45855592884287055,2024-04-11 17:32:59.700833,2024-04-11 17:33:01.708582,0 days 00:00:02.007749,96.68152441705095,8.301851472526453,sigmoid,31,,24.0,30.0,1.0,5.0,94.0,37.0,42.0,8.647042965448648,4.134673771713743,2.021757648673578,10.0,50.0,95.0,45.0,COMPLETE
5871,0.45688028427888744,2024-04-11 17:33:01.711583,2024-04-11 17:33:02.956952,0 days 00:00:01.245369,98.18273707302134,8.010685986388369,sigmoid,16,,,,2.0,6.0,33.0,,,,,,,,,,COMPLETE
5872,0.5963643249384587,2024-04-11 17:33:02.958954,2024-04-11 17:33:04.156493,0 days 00:00:01.197539,94.99113459449781,8.148102061246504,sigmoid,8,,27.0,32.0,,,,,,,,,,,,,COMPLETE
5873,0.46192136648473825,2024-04-11 17:33:04.159467,2024-04-11 17:33:05.769953,0 days 00:00:01.610486,98.19243685467326,7.862206167322232,sigmoid,28,,10.0,31.0,7.0,2.0,74.0,10.0,17.0,,,,,,,,COMPLETE
5874,0.36837146195303966,2024-04-11 17:33:05.771991,2024-04-11 17:33:07.043246,0 days 00:00:01.271255,99.98637682659341,7.490383384782268,sigmoid,9,,25.0,29.0,,,,,,,,,,,,200.0,COMPLETE
5875,0.45345352376492626,2024-04-11 17:33:07.045244,2024-04-11 17:33:08.128439,0 days 00:00:01.083195,66.15732784643829,8.357227735287378,sigmoid,8,,26.0,30.0,,,,,,,,,,,,,COMPLETE
5876,0.4882175522915082,2024-04-11 17:33:08.130434,2024-04-11 17:33:09.889094,0 days 00:00:01.758660,90.93823072535896,8.021617450513899,sigmoid,46,9.0,28.0,36.0,,,,20.0,34.0,9.06412423570529,7.911785445732876,8.453574008156188,15.0,31.0,91.0,,COMPLETE
5877,0.5975287681569516,2024-04-11 17:33:09.892097,2024-04-11 17:33:11.072613,0 days 00:00:01.180516,96.4942135264191,8.759447895600802,sigmoid,8,,24.0,32.0,,,,,,,,,,,,,COMPLETE
5878,0.5524898252334212,2024-04-11 17:33:11.075118,2024-04-11 17:33:12.578933,0 days 00:00:01.503815,99.95878643947692,7.834303168910371,sigmoid,2,,,,,,,,,2.2979282866476147,0.5003476045218402,0.8139780624275383,6.0,45.0,76.0,,COMPLETE
5879,0.3461630408797514,2024-04-11 17:33:12.580941,2024-04-11 17:33:14.369659,0 days 00:00:01.788718,34.036953583849524,8.203324991024676,sigmoid,26,,23.0,28.0,8.0,8.0,19.0,,,1.0762408632226368,5.427311275685955,9.6291712154954,7.0,38.0,99.0,,COMPLETE
5880,0.45487434410383876,2024-04-11 17:33:14.372663,2024-04-11 17:33:16.297063,0 days 00:00:01.924400,99.95601686572833,9.029730950613676,rbf,8,,25.0,26.0,,,,,,,,,,,,,COMPLETE
5881,0.49677449623495745,2024-04-11 17:33:16.300064,2024-04-11 17:33:17.712667,0 days 00:00:01.412603,93.40687918614084,6.362170181760962,sigmoid,41,45.0,21.0,34.0,,,,,,,,,,,,22.0,COMPLETE
5882,0.5139242231510086,2024-04-11 17:33:17.714669,2024-04-11 17:33:19.331729,0 days 00:00:01.617060,96.79358545388511,7.65268412375354,sigmoid,10,,27.0,31.0,,,,,,6.5018239339408295,6.082203764904312,2.937165931580783,12.0,20.0,74.0,,COMPLETE
5883,0.5929369437606513,2024-04-11 17:33:19.333681,2024-04-11 17:33:20.540803,0 days 00:00:01.207122,98.15059225698863,8.476664552576544,sigmoid,8,,25.0,33.0,,,,,,,,,,,,,COMPLETE
5884,0.48997436695972973,2024-04-11 17:33:20.542819,2024-04-11 17:33:22.134234,0 days 00:00:01.591415,95.16880840776527,8.058537526816528,sigmoid,56,32.0,26.0,30.0,5.0,6.0,40.0,,,,,,,,,,COMPLETE
5885,0.4728194143308691,2024-04-11 17:33:22.136771,2024-04-11 17:33:24.232174,0 days 00:00:02.095403,98.08811667402871,8.280469065510804,sigmoid,63,46.0,23.0,32.0,1.0,7.0,50.0,42.0,28.0,7.482339840147867,1.1171716636739637,5.739868889380211,13.0,41.0,65.0,61.0,COMPLETE
5886,0.44322171411712635,2024-04-11 17:33:24.236175,2024-04-11 17:33:26.336883,0 days 00:00:02.100708,95.08213196209623,7.13668614658697,sigmoid,62,38.0,24.0,31.0,6.0,5.0,80.0,46.0,20.0,9.337170616110928,8.717810417006522,3.808064025671273,3.0,35.0,54.0,,COMPLETE
5887,0.12622036262203626,2024-04-11 17:33:26.338887,2024-04-11 17:33:27.523707,0 days 00:00:01.184820,98.11666878273499,7.813366471622285,sigmoid,8,,26.0,29.0,,,,,,,,,,,,,COMPLETE
5888,0.32592645946627286,2024-04-11 17:33:27.525706,2024-04-11 17:33:28.846980,0 days 00:00:01.321274,98.15485481244409,8.04835829993958,sigmoid,37,5.0,,,,,,18.0,39.0,,,,,,,33.0,COMPLETE
5889,0.3732951899407891,2024-04-11 17:33:28.849981,2024-04-11 17:33:30.438900,0 days 00:00:01.588919,96.58740375467107,7.513362991786117,sigmoid,11,,22.0,33.0,,,,,,1.3730319351586187,3.963799813364489,4.886041441111683,16.0,28.0,63.0,89.0,COMPLETE
5890,0.46925755534656743,2024-04-11 17:33:30.440903,2024-04-11 17:33:32.416811,0 days 00:00:01.975908,98.26940391565147,8.520272041318176,sigmoid,59,2.0,29.0,30.0,2.0,4.0,9.0,,,0.6977993995403695,3.1562316253708347,4.392215097424005,17.0,32.0,86.0,81.0,COMPLETE
5891,0.6009432182607054,2024-04-11 17:33:32.419344,2024-04-11 17:33:33.549448,0 days 00:00:01.130104,94.26289512517201,7.956496339192895,sigmoid,8,,27.0,31.0,,,,,,,,,,,,,COMPLETE
5892,0.5294770781286698,2024-04-11 17:33:33.551463,2024-04-11 17:33:34.874059,0 days 00:00:01.322596,96.5852325834558,8.286762458139238,sigmoid,48,13.0,,,7.0,7.0,98.0,,,,,,,,,,COMPLETE
5893,0.44036600200983755,2024-04-11 17:33:34.875569,2024-04-11 17:33:36.945874,0 days 00:00:02.070305,92.50109355533922,7.732134570368942,sigmoid,55,24.0,,,3.0,1.0,88.0,27.0,8.0,4.552396084265315,4.964985587585976,8.133101773374326,8.0,46.0,61.0,104.0,COMPLETE
5894,0.3625996840929229,2024-04-11 17:33:36.948418,2024-04-11 17:33:38.374725,0 days 00:00:01.426307,98.1606549920768,3.964906027911233,sigmoid,13,,25.0,32.0,,,,49.0,31.0,,,,,,,137.0,COMPLETE
5895,0.12003789673140693,2024-04-11 17:33:38.376723,2024-04-11 17:33:39.549963,0 days 00:00:01.173240,95.6422613278948,8.17813777574942,sigmoid,8,,7.0,28.0,,,,,,,,,,,,,COMPLETE
5896,0.4448341684562156,2024-04-11 17:33:39.551957,2024-04-11 17:33:40.808366,0 days 00:00:01.256409,98.32636389714516,8.66224045313235,sigmoid,8,,2.0,30.0,,,,,,,,,,,,,COMPLETE
