number,value,datetime_start,datetime_complete,duration,params_C,params_aws_w1,params_aws_w2,params_gamma,params_kernel,params_kma_pow1,params_kma_pow2,params_kma_window,params_mask_number,params_ppo_wfast,params_ppo_wsign,params_ppo_wslow,params_roc_window,params_rsi_window,params_so_smooth,params_so_window,params_srsi_smooth1,params_srsi_smooth2,params_srsi_window,params_tsi_window_fast,params_tsi_window_slow,params_ult_weight_1,params_ult_weight_2,params_ult_weight_3,params_ult_window_1,params_ult_window_2,params_ult_window_3,params_williams_lbp,state
0,0.6000526223469567,2024-04-12 03:11:40.099357,2024-04-12 03:11:40.458926,0 days 00:00:00.359569,75.07390930688732,,,9.561642995840787,rbf,,,,120,,,,23.0,22.0,24.0,42.0,1.0,6.0,19.0,,,,,,,,,,COMPLETE
1,0.5395584917821463,2024-04-12 03:11:40.459984,2024-04-12 03:11:40.657071,0 days 00:00:00.197087,67.01287172794873,59.0,44.0,6.988929852520999,sigmoid,16.0,13.0,37.0,836,,,,31.0,,,,,,,35.0,14.0,,,,,,,,COMPLETE
2,0.582080912462749,2024-04-12 03:11:40.659158,2024-04-12 03:11:41.018656,0 days 00:00:00.359498,23.303454378465812,,,2.978179017548448,rbf,26.0,8.0,14.0,425,18.0,42.0,16.0,,21.0,20.0,27.0,,,,,,,,,,,,194.0,COMPLETE
3,0.5640637521146825,2024-04-12 03:11:41.020659,2024-04-12 03:11:41.462388,0 days 00:00:00.441729,35.0236363802857,18.0,77.0,1.360938131209123,rbf,15.0,42.0,15.0,939,21.0,27.0,46.0,,32.0,10.0,27.0,,,,,,4.14752882962804,1.5810414316729684,1.604117647019412,20.0,41.0,92.0,193.0,COMPLETE
4,0.5890542856592654,2024-04-12 03:11:41.465392,2024-04-12 03:11:41.622863,0 days 00:00:00.157471,43.424600922840554,16.0,10.0,7.868053124449813,sigmoid,38.0,34.0,41.0,976,19.0,34.0,50.0,48.0,,,,5.0,8.0,77.0,,,,,,,,,,COMPLETE
5,0.5451700600442019,2024-04-12 03:11:41.624917,2024-04-12 03:11:41.805639,0 days 00:00:00.180722,66.37258497671775,,,8.232967370688543,sigmoid,,,,72,,,,32.0,,8.0,50.0,,,,,,,,,,,,,COMPLETE
6,0.33431339289079876,2024-04-12 03:11:41.808629,2024-04-12 03:11:41.978065,0 days 00:00:00.169436,35.693315268176036,64.0,97.0,8.979070781734066,sigmoid,,,,717,49.0,50.0,41.0,43.0,,11.0,34.0,,,,47.0,31.0,,,,,,,91.0,COMPLETE
7,0.5838709677419355,2024-04-12 03:11:41.980134,2024-04-12 03:11:42.340130,0 days 00:00:00.359996,32.48984717273608,,,8.816938963514897,rbf,29.0,3.0,4.0,360,,,,42.0,7.0,12.0,11.0,,,,,,,,,,,,,COMPLETE
8,0.5039514019742948,2024-04-12 03:11:42.342130,2024-04-12 03:11:42.723447,0 days 00:00:00.381317,8.481239084045173,,,5.092957957266595,rbf,39.0,8.0,16.0,382,,,,44.0,5.0,20.0,4.0,6.0,2.0,2.0,43.0,16.0,3.203140216317572,8.42658892245175,9.68697516509124,5.0,20.0,89.0,,COMPLETE
9,0.3543045061269232,2024-04-12 03:11:42.725447,2024-04-12 03:11:42.995615,0 days 00:00:00.270168,91.30200595428876,84.0,34.0,6.122887127656665,sigmoid,,,,737,20.0,4.0,28.0,49.0,6.0,,,,,,,,,,,,,,192.0,COMPLETE
10,0.5213942254426202,2024-04-12 03:11:42.996617,2024-04-12 03:11:43.605410,0 days 00:00:00.608793,98.51916575544801,93.0,2.0,2.997173420598955,rbf,2.0,50.0,50.0,823,,,,,49.0,,,1.0,6.0,17.0,2.0,48.0,9.620619852185099,9.701876232880839,7.111266208673075,16.0,47.0,52.0,13.0,COMPLETE
11,0.3193504248883767,2024-04-12 03:11:43.606416,2024-04-12 03:11:43.978775,0 days 00:00:00.372359,60.4977907982169,2.0,3.0,9.983940668471195,sigmoid,,,,676,2.0,29.0,4.0,,26.0,,,,,,14.0,2.0,,,,,,,,COMPLETE
12,0.5381764927774202,2024-04-12 03:11:43.981832,2024-04-12 03:11:44.265853,0 days 00:00:00.284021,77.77984750734655,30.0,22.0,7.344718823944713,sigmoid,50.0,30.0,37.0,892,,,,10.0,39.0,42.0,49.0,3.0,8.0,87.0,24.0,50.0,,,,,,,,COMPLETE
13,0.5936073851706606,2024-04-12 03:11:44.266854,2024-04-12 03:11:44.748991,0 days 00:00:00.482137,50.11921067167302,36.0,66.0,9.826077775627049,rbf,49.0,27.0,50.0,835,,,,16.0,,,,,,,,,9.33103467465516,0.603686963833816,0.7585832902438359,4.0,27.0,59.0,15.0,COMPLETE
14,0.5811279000163253,2024-04-12 03:11:44.751037,2024-04-12 03:11:45.303861,0 days 00:00:00.552824,53.387928793465356,,,9.776039198055418,rbf,50.0,20.0,50.0,275,,,,,,,,8.0,4.0,38.0,,,9.823547853054915,0.572327006992998,0.5891520699515347,2.0,26.0,58.0,18.0,COMPLETE
15,0.6130066654656818,2024-04-12 03:11:45.306031,2024-04-12 03:11:45.941672,0 days 00:00:00.635641,81.1518845225556,,,6.124064987407309,rbf,39.0,22.0,27.0,470,49.0,8.0,30.0,16.0,,,,1.0,5.0,45.0,3.0,35.0,6.636907909542531,4.423782811426156,3.8604099143055417,8.0,32.0,69.0,,COMPLETE
16,0.5276398186136904,2024-04-12 03:11:45.943676,2024-04-12 03:11:46.422425,0 days 00:00:00.478749,79.42959627833687,,,4.116493269633813,rbf,37.0,22.0,28.0,345,,,,19.0,,37.0,40.0,1.0,5.0,46.0,,,,,,,,,116.0,COMPLETE
17,0.5985779639530397,2024-04-12 03:11:46.425520,2024-04-12 03:11:47.013123,0 days 00:00:00.587603,82.83743981774622,72.0,99.0,6.009174601549318,rbf,,,,703,47.0,7.0,30.0,,14.0,29.0,39.0,3.0,6.0,28.0,7.0,34.0,6.93337174966251,4.870898907488885,4.468275674160633,10.0,32.0,72.0,118.0,COMPLETE
18,0.47747075594873295,2024-04-12 03:11:47.015634,2024-04-12 03:11:47.852399,0 days 00:00:00.836765,74.40194767771992,43.0,63.0,0.8289290442649282,rbf,29.0,38.0,25.0,815,,,,,18.0,32.0,15.0,,,,22.0,38.0,1.2094639333220218,4.80956097777434,4.162673920953465,11.0,36.0,75.0,68.0,COMPLETE
19,0.5949282424659368,2024-04-12 03:11:47.857622,2024-04-12 03:11:48.343123,0 days 00:00:00.485501,90.4777329241741,95.0,29.0,4.556078098501439,rbf,20.0,18.0,25.0,787,,,,,,,,2.0,3.0,62.0,,,6.704602887626734,6.797773987686586,6.692512494904515,8.0,41.0,68.0,157.0,COMPLETE
20,0.5205286667074589,2024-04-12 03:11:48.344237,2024-04-12 03:11:48.799194,0 days 00:00:00.454957,60.42600013457108,,,6.2262309848321635,rbf,,,,23,,,,,,,,3.0,6.0,59.0,13.0,20.0,6.525560759907454,3.4508217560421173,3.221766568652825,15.0,50.0,83.0,57.0,COMPLETE
21,0.5673086400283862,2024-04-12 03:11:48.800190,2024-04-12 03:11:49.337558,0 days 00:00:00.537368,86.00226310470624,74.0,99.0,5.939086326600645,rbf,,,,724,50.0,7.0,29.0,2.0,,,,1.0,6.0,26.0,2.0,35.0,,,,,,,,COMPLETE
22,0.5270330079899369,2024-04-12 03:11:49.341697,2024-04-12 03:11:50.010540,0 days 00:00:00.668843,98.41206877388808,75.0,82.0,3.233108767537722,rbf,,,,546,,,,,15.0,,,,,,,,6.860077901238438,4.25598481247361,5.299986020288233,9.0,32.0,71.0,,COMPLETE
23,0.6034951902809182,2024-04-12 03:11:50.012587,2024-04-12 03:11:50.560175,0 days 00:00:00.547588,82.49280387757582,,,6.855270343680157,rbf,,,,57,,,,,13.0,29.0,40.0,3.0,5.0,29.0,,,,,,,,,135.0,COMPLETE
24,0.578387686626782,2024-04-12 03:11:50.562225,2024-04-12 03:11:51.132999,0 days 00:00:00.570774,70.18564876591641,,,7.150323835451309,rbf,,,,119,,,,24.0,30.0,,,2.0,4.0,13.0,33.0,25.0,5.003090234893359,6.655583174091108,2.9194279228952764,14.0,20.0,99.0,154.0,COMPLETE
25,0.6091406849410615,2024-04-12 03:11:51.136114,2024-04-12 03:11:51.655584,0 days 00:00:00.519470,89.08467532328163,55.0,54.0,8.659091390705004,rbf,,,,599,,,,11.0,,,,2.0,5.0,35.0,14.0,44.0,0.5358942101462283,2.7399132486495077,8.361289881185579,6.0,39.0,63.0,151.0,COMPLETE
26,0.6041232550849177,2024-04-12 03:11:51.656585,2024-04-12 03:11:52.175816,0 days 00:00:00.519231,90.14213862152954,,,8.092733258615006,rbf,,,,176,35.0,17.0,17.0,,38.0,,,4.0,5.0,41.0,,,,,,,,,,COMPLETE
27,0.526427431170592,2024-04-12 03:11:52.177816,2024-04-12 03:11:52.627900,0 days 00:00:00.450084,94.20389792939997,52.0,53.0,8.405524589967646,rbf,,,,545,,,,,48.0,,,,,,,,,,,,,,159.0,COMPLETE
28,0.6000177273533062,2024-04-12 03:11:52.629998,2024-04-12 03:11:53.211379,0 days 00:00:00.581381,87.51906924879083,45.0,47.0,7.757630226735714,rbf,2.0,46.0,3.0,914,36.0,17.0,16.0,,,,,5.0,3.0,45.0,,,0.8130875644268758,2.7852150525867536,8.411017174138442,6.0,38.0,63.0,,COMPLETE
29,0.6139406854910319,2024-04-12 03:11:53.213590,2024-04-12 03:11:53.861646,0 days 00:00:00.648056,72.32363061432604,26.0,79.0,9.074712381254278,rbf,,,,630,,,,8.0,40.0,,,4.0,5.0,57.0,14.0,40.0,2.666378922701228,2.745601621058168,6.1845468689652385,7.0,44.0,83.0,,COMPLETE
30,0.6271918368768391,2024-04-12 03:11:53.862722,2024-04-12 03:11:54.379927,0 days 00:00:00.517205,72.70391833458795,,,9.167776658855338,rbf,,,,188,36.0,16.0,38.0,,42.0,49.0,19.0,2.0,7.0,60.0,15.0,42.0,,,,,,,,COMPLETE
31,0.6080312844542447,2024-04-12 03:11:54.383114,2024-04-12 03:11:55.000583,0 days 00:00:00.617469,73.39216015309339,,,9.080819571872565,rbf,43.0,33.0,32.0,279,,,,,,,,2.0,7.0,61.0,15.0,42.0,2.375832199385912,2.465707947602632,6.340274357893068,7.0,44.0,82.0,88.0,COMPLETE
32,0.5884374593620538,2024-04-12 03:11:55.001583,2024-04-12 03:11:55.591315,0 days 00:00:00.589732,62.48171682815352,,,9.278149250512092,rbf,,,,174,38.0,18.0,38.0,,42.0,49.0,18.0,,,,18.0,43.0,2.1226611614912776,3.513813644187227,8.034435461792677,2.0,42.0,81.0,,COMPLETE
33,0.614500054758515,2024-04-12 03:11:55.592476,2024-04-12 03:11:56.089790,0 days 00:00:00.497314,54.986802014514296,24.0,83.0,8.717147194488158,rbf,10.0,14.0,19.0,837,,,,8.0,,,,,,,8.0,42.0,,,,,,,138.0,COMPLETE
34,0.6082051809562996,2024-04-12 03:11:56.091792,2024-04-12 03:11:56.675843,0 days 00:00:00.584051,55.126511661731975,,,9.444954851019512,rbf,8.0,15.0,17.0,363,,,,3.0,44.0,50.0,21.0,,,,,,8.229200788067741,6.107844044197661,5.463339034114184,13.0,32.0,79.0,64.0,COMPLETE
35,0.5401833297804306,2024-04-12 03:11:56.679994,2024-04-12 03:11:57.294894,0 days 00:00:00.614900,67.52646809573906,,,6.760803611517527,rbf,,,,7,,,,,,,,,,,8.0,39.0,5.204416272326581,5.669811580412168,2.5180460375163003,12.0,26.0,88.0,41.0,COMPLETE
36,0.5755792134942425,2024-04-12 03:11:57.295885,2024-04-12 03:11:58.001556,0 days 00:00:00.705671,48.1553277034335,22.0,81.0,7.843738193022201,rbf,33.0,24.0,21.0,770,,,,,,,,,,,,,3.9431559308879467,7.504939995054423,3.7771209072474896,18.0,46.0,95.0,,COMPLETE
37,0.5234028244788165,2024-04-12 03:11:58.004716,2024-04-12 03:11:58.410019,0 days 00:00:00.405303,41.19943541281026,5.0,88.0,2.0987380339932034,sigmoid,,,,750,42.0,14.0,36.0,9.0,36.0,42.0,4.0,,,,8.0,30.0,8.071464175297864,1.8050635445587604,5.878491851410972,9.0,35.0,74.0,,COMPLETE
38,0.570039218793329,2024-04-12 03:11:58.411171,2024-04-12 03:11:59.063814,0 days 00:00:00.652643,63.82462762465645,31.0,71.0,8.67551170081441,rbf,,,,579,,,,15.0,,,,,,,,,5.910947259691183,4.12221662133325,4.936489974211769,4.0,35.0,50.0,174.0,COMPLETE
39,0.5922346719424733,2024-04-12 03:11:59.064855,2024-04-12 03:11:59.693580,0 days 00:00:00.628725,20.33346895925169,,,9.276238981644525,rbf,,,,153,29.0,11.0,22.0,,,40.0,10.0,7.0,7.0,72.0,,,,,,,,,133.0,COMPLETE
40,0.5571509283251184,2024-04-12 03:11:59.697711,2024-04-12 03:12:00.146385,0 days 00:00:00.448674,55.7685601250335,11.0,86.0,5.524190656223318,sigmoid,20.0,13.0,10.0,774,,,,,,,,,,,9.0,45.0,4.242644711391563,1.8610163645463218,1.8490742979045036,11.0,29.0,67.0,,COMPLETE
41,0.5929709611134804,2024-04-12 03:12:00.149690,2024-04-12 03:12:00.805745,0 days 00:00:00.656055,69.84301886809044,,,8.564973680283197,rbf,,,,167,30.0,23.0,34.0,,34.0,,,,,,19.0,41.0,1.8319034376731542,2.7063487503363417,9.99387046147248,7.0,38.0,63.0,136.0,COMPLETE
42,0.5646134009898931,2024-04-12 03:12:00.806743,2024-04-12 03:12:01.467382,0 days 00:00:00.660639,78.64078404174518,,,8.181824018627177,rbf,9.0,3.0,31.0,293,,,,,44.0,,,,,,12.0,46.0,,,,,,,172.0,COMPLETE
43,0.58244524787522,2024-04-12 03:12:01.471515,2024-04-12 03:12:01.997028,0 days 00:00:00.525513,72.36132474946612,26.0,56.0,7.5207043897442425,rbf,,,,556,,,,,27.0,46.0,33.0,,,,5.0,38.0,,,,,,,,COMPLETE
44,0.6219823864617511,2024-04-12 03:12:02.001026,2024-04-12 03:12:02.666590,0 days 00:00:00.665564,84.53705882295496,41.0,73.0,8.886793905167119,rbf,,,,698,43.0,3.0,44.0,,50.0,36.0,20.0,2.0,4.0,55.0,,,0.5048594199840991,3.3978726432383417,8.123022867608814,5.0,39.0,56.0,,COMPLETE
45,0.6011070110701108,2024-04-12 03:12:02.668590,2024-04-12 03:12:03.273755,0 days 00:00:00.605165,0.831512620964169,39.0,73.0,8.970299922830174,rbf,,,,630,,,,8.0,49.0,,,4.0,3.0,54.0,4.0,35.0,2.881414594916161,3.651187026663901,7.501515919688891,4.0,44.0,57.0,,COMPLETE
46,0.40999182029824455,2024-04-12 03:12:03.277757,2024-04-12 03:12:03.661595,0 days 00:00:00.383838,81.9303080789727,,,9.997275211633072,sigmoid,,,,188,42.0,2.0,43.0,,41.0,36.0,22.0,2.0,4.0,69.0,27.0,28.0,,,,,,,,COMPLETE
47,0.5810481531618642,2024-04-12 03:12:03.662586,2024-04-12 03:12:04.271732,0 days 00:00:00.609146,76.51200975024406,46.0,88.0,6.545138841051985,rbf,,,,586,,,,6.0,,45.0,13.0,,,,,,1.39833923080838,5.3036721453886075,9.071259894326534,8.0,48.0,86.0,,COMPLETE
48,0.602794522586887,2024-04-12 03:12:04.273767,2024-04-12 03:12:04.845931,0 days 00:00:00.572164,42.50542165670882,,,9.449060626576907,rbf,,,,102,,,,15.0,46.0,,,,,,11.0,34.0,3.63179029094913,4.263009207269329,7.411564342307448,3.0,30.0,56.0,,COMPLETE
49,0.6103704218741853,2024-04-12 03:12:04.848351,2024-04-12 03:12:05.570078,0 days 00:00:00.721727,59.00109314821614,34.0,61.0,7.392230807587045,rbf,44.0,9.0,9.0,954,43.0,10.0,48.0,,46.0,35.0,22.0,4.0,1.0,52.0,,,7.998087939446975,1.3020438545722763,6.608878020930955,6.0,44.0,77.0,,COMPLETE
50,0.37469033155733533,2024-04-12 03:12:05.571350,2024-04-12 03:12:06.055131,0 days 00:00:00.483781,65.7559408660802,,,5.209910089802236,sigmoid,21.0,26.0,21.0,470,43.0,2.0,33.0,20.0,,,,1.0,7.0,84.0,18.0,39.0,4.810952906334057,3.3489687804081334,6.109505332787383,9.0,23.0,93.0,,COMPLETE
51,0.6136785039467411,2024-04-12 03:12:06.057133,2024-04-12 03:12:06.763326,0 days 00:00:00.706193,47.100291584350465,35.0,63.0,7.32176068328438,rbf,44.0,10.0,9.0,954,44.0,10.0,49.0,,45.0,36.0,23.0,4.0,1.0,52.0,,,7.758406539881834,1.246782346381605,6.680099286992775,6.0,43.0,79.0,,COMPLETE
52,0.5939545088038404,2024-04-12 03:12:06.765326,2024-04-12 03:12:07.433343,0 days 00:00:00.668017,28.933032351495893,,,8.128602803920574,rbf,,,,178,46.0,11.0,42.0,,41.0,,,5.0,1.0,52.0,,,7.463127204817202,1.3041144130989255,5.7973540871979115,5.0,42.0,85.0,,COMPLETE
53,0.4965098336966372,2024-04-12 03:12:07.435350,2024-04-12 03:12:08.054624,0 days 00:00:00.619274,48.65444507628379,,,7.679886696777063,rbf,,,,98,,,,13.0,50.0,,,,,,,,5.912070954923742,2.150196734826918,4.818024305962627,7.0,39.0,79.0,,COMPLETE
54,0.05925036826886355,2024-04-12 03:12:08.056632,2024-04-12 03:12:08.683318,0 days 00:00:00.626686,35.38351622201474,25.0,70.0,0.09705533672906963,rbf,45.0,17.0,11.0,837,,,,5.0,,,,,,,6.0,48.0,,,,,,,93.0,COMPLETE
55,0.6125967318302807,2024-04-12 03:12:08.684317,2024-04-12 03:12:09.363738,0 days 00:00:00.679421,39.4987198023295,13.0,76.0,8.885814749168746,rbf,,,,558,,,,,37.0,39.0,29.0,,,,28.0,41.0,2.964618372958096,1.3279229487377815,9.144202649543601,8.0,46.0,70.0,,COMPLETE
56,0.5977801840822956,2024-04-12 03:12:09.368902,2024-04-12 03:12:10.131234,0 days 00:00:00.762332,93.75355608723915,40.0,42.0,6.460990651505786,rbf,,,,741,37.0,8.0,45.0,19.0,45.0,,,,,,10.0,24.0,,,,,,,107.0,COMPLETE
57,0.6002065741311202,2024-04-12 03:12:10.133434,2024-04-12 03:12:10.860770,0 days 00:00:00.727336,84.63798371643038,,,9.630442038815444,rbf,35.0,10.0,22.0,474,40.0,14.0,39.0,28.0,,32.0,18.0,3.0,2.0,66.0,,,7.321105355697631,3.001853223157565,7.057086185485612,5.0,37.0,54.0,,COMPLETE
58,0.6270389777692669,2024-04-12 03:12:10.862855,2024-04-12 03:12:11.647906,0 days 00:00:00.785051,51.933531866252615,61.0,92.0,7.1171995844894544,rbf,,,,760,32.0,21.0,47.0,6.0,30.0,2.0,31.0,4.0,2.0,96.0,,,,,,,,,,COMPLETE
59,0.5878327437220902,2024-04-12 03:12:11.651913,2024-04-12 03:12:12.303419,0 days 00:00:00.651506,52.99486659070132,,,7.221442040683918,rbf,,,,159,32.0,20.0,50.0,,,17.0,24.0,4.0,2.0,77.0,21.0,9.0,9.03796299168539,0.6925932220215003,7.769673981377005,3.0,49.0,89.0,36.0,COMPLETE
60,0.6165937505403863,2024-04-12 03:12:12.304415,2024-04-12 03:12:12.897369,0 days 00:00:00.592954,46.882222121801554,58.0,90.0,8.200549328028522,rbf,,,,681,33.0,23.0,45.0,,32.0,2.0,32.0,,,,,,,,,,,,79.0,COMPLETE
61,0.6205571731302656,2024-04-12 03:12:12.898369,2024-04-12 03:12:13.529463,0 days 00:00:00.631094,45.97040251161373,63.0,92.0,8.41145136066437,rbf,8.0,5.0,5.0,855,,,,6.0,,,,6.0,1.0,98.0,31.0,31.0,1.3972902672280936,2.234035284161691,8.924100901350887,20.0,40.0,91.0,78.0,COMPLETE
62,0.6204415483038911,2024-04-12 03:12:13.533603,2024-04-12 03:12:14.206365,0 days 00:00:00.672762,45.22680183461789,61.0,93.0,8.372265844584778,rbf,,,,619,,,,6.0,32.0,3.0,32.0,,,,,,1.4493379267638848,9.552207435126364,9.479259256485257,20.0,40.0,97.0,80.0,COMPLETE
63,0.629981553026348,2024-04-12 03:12:14.208417,2024-04-12 03:12:14.887762,0 days 00:00:00.679345,38.85426471784811,62.0,93.0,8.38520443739028,rbf,8.0,5.0,6.0,1016,27.0,23.0,44.0,5.0,31.0,2.0,32.0,6.0,2.0,100.0,,,,,,,,,,COMPLETE
64,0.6357990123708191,2024-04-12 03:12:14.889767,2024-04-12 03:12:15.744132,0 days 00:00:00.854365,31.04474635638652,62.0,93.0,8.348825718727438,rbf,14.0,5.0,4.0,975,26.0,23.0,44.0,2.0,,2.0,32.0,,,,39.0,21.0,1.4169737823366564,9.051025803229141,9.1110340129596,20.0,40.0,99.0,77.0,COMPLETE
65,0.592597388183937,2024-04-12 03:12:15.748211,2024-04-12 03:12:16.387862,0 days 00:00:00.639651,28.466191830700666,,,7.9761259098534385,rbf,13.0,5.0,6.0,438,25.0,30.0,40.0,,23.0,,,6.0,2.0,100.0,41.0,21.0,1.6155180323127634,9.77270200921415,9.239340752765392,20.0,40.0,100.0,,COMPLETE
66,0.60374895761575,2024-04-12 03:12:16.388861,2024-04-12 03:12:17.109554,0 days 00:00:00.720693,38.62579381273966,,,8.41383382858608,rbf,,,,219,26.0,22.0,44.0,2.0,,2.0,36.0,6.0,1.0,100.0,,,1.0205632637134974,8.673310303769412,8.768028773629856,20.0,34.0,97.0,54.0,COMPLETE
67,0.3256392589190017,2024-04-12 03:12:17.112684,2024-04-12 03:12:17.599796,0 days 00:00:00.487112,19.63731793980233,67.0,93.0,8.493659083079384,sigmoid,5.0,5.0,7.0,884,,,,3.0,29.0,,,7.0,2.0,93.0,37.0,13.0,,,,,,,,COMPLETE
68,0.6325119049774575,2024-04-12 03:12:17.601939,2024-04-12 03:12:18.241848,0 days 00:00:00.639909,31.737071472544933,,,9.638102745003446,rbf,,,,47,,,,,23.0,6.0,30.0,,,,50.0,18.0,0.512561801222837,8.597119805646296,9.662913127766062,18.0,41.0,92.0,73.0,COMPLETE
69,0.6243010190749935,2024-04-12 03:12:18.242860,2024-04-12 03:12:18.911367,0 days 00:00:00.668507,31.766794381342734,65.0,95.0,9.741248328220477,rbf,12.0,2.0,3.0,1016,15.0,34.0,46.0,11.0,22.0,6.0,29.0,7.0,3.0,92.0,,,,,,,,,,COMPLETE
70,0.6068425147260402,2024-04-12 03:12:18.912570,2024-04-12 03:12:19.549408,0 days 00:00:00.636838,30.85745545159139,82.0,94.0,9.234695274705999,rbf,17.0,11.0,13.0,786,,,,,,,,7.0,3.0,88.0,,,1.9908794360669928,8.29849013479593,9.879611736222685,17.0,46.0,91.0,,COMPLETE
71,0.6304497804102374,2024-04-12 03:12:19.552421,2024-04-12 03:12:20.302303,0 days 00:00:00.749882,21.7254265614446,65.0,100.0,9.673165347255953,rbf,12.0,2.0,2.0,975,9.0,34.0,47.0,5.0,,6.0,29.0,,,,50.0,16.0,0.5527169186341987,7.966439513902812,8.650990065221164,18.0,37.0,92.0,102.0,COMPLETE
72,0.6094061238519981,2024-04-12 03:12:20.303373,2024-04-12 03:12:21.029855,0 days 00:00:00.726482,22.63309560046278,67.0,100.0,9.661575414177655,rbf,,,,725,12.0,38.0,47.0,12.0,,,,8.0,3.0,79.0,49.0,15.0,,,,,,,95.0,COMPLETE
73,0.6313706418018078,2024-04-12 03:12:21.031854,2024-04-12 03:12:21.830133,0 days 00:00:00.798279,15.67515484226125,50.0,96.0,9.774648905856372,rbf,,,,683,10.0,34.0,42.0,,23.0,6.0,30.0,,,,,,0.523088175473339,9.007235825541333,8.552427410074815,17.0,34.0,93.0,105.0,COMPLETE
74,0.6168747461547971,2024-04-12 03:12:21.833139,2024-04-12 03:12:22.555384,0 days 00:00:00.722245,14.649825127052168,49.0,95.0,9.814226086141447,rbf,13.0,6.0,2.0,870,,,,5.0,23.0,,,,,,43.0,10.0,0.913579701646751,9.116622631072774,9.62005551143321,18.0,34.0,94.0,,COMPLETE
75,0.6293907171294664,2024-04-12 03:12:22.557376,2024-04-12 03:12:23.324492,0 days 00:00:00.767116,26.244261790326,57.0,100.0,9.509526722788506,rbf,16.0,2.0,2.0,911,11.0,34.0,47.0,,,6.0,29.0,,,,50.0,21.0,3.3758920701694777,8.09173505192263,8.643151883855197,16.0,37.0,98.0,103.0,COMPLETE
76,0.6283352060239146,2024-04-12 03:12:23.328561,2024-04-12 03:12:24.004360,0 days 00:00:00.675799,14.298173871368745,57.0,99.0,9.444605373856684,rbf,,,,683,8.0,26.0,42.0,,10.0,6.0,29.0,,,,,,3.3552214047421955,7.814702862515809,8.624677084911701,16.0,37.0,97.0,105.0,COMPLETE
77,0.6129032258064516,2024-04-12 03:12:24.006357,2024-04-12 03:12:24.668774,0 days 00:00:00.662417,13.465389481833634,,,9.317298361085445,rbf,,,,59,,,,,8.0,6.0,27.0,8.0,8.0,22.0,,,3.2992422105448123,7.778768867835985,8.688309486202916,16.0,37.0,97.0,108.0,COMPLETE
78,0.5670943306430823,2024-04-12 03:12:24.672912,2024-04-12 03:12:25.466212,0 days 00:00:00.793300,25.634702660080176,,,9.988890518142785,rbf,,,,164,7.0,26.0,41.0,,19.0,,,,,,50.0,19.0,,,,,,,,COMPLETE
79,0.2117054298438976,2024-04-12 03:12:25.468212,2024-04-12 03:12:26.224864,0 days 00:00:00.756652,13.063619338907523,,,9.528989956068093,rbf,16.0,7.0,7.0,506,9.0,33.0,37.0,36.0,2.0,6.0,29.0,5.0,8.0,4.0,,,0.8640298326711996,7.777490329645007,8.457011632300315,18.0,36.0,95.0,,COMPLETE
80,0.374540654322309,2024-04-12 03:12:26.226858,2024-04-12 03:12:26.675153,0 days 00:00:00.448295,17.277891895435545,,,9.021606305085777,sigmoid,,,,141,5.0,40.0,42.0,,,9.0,35.0,,,,46.0,17.0,,,,,,,103.0,COMPLETE
81,0.5886016645538223,2024-04-12 03:12:26.678307,2024-04-12 03:12:27.294223,0 days 00:00:00.615916,5.868209330905302,56.0,100.0,9.189973157102017,rbf,23.0,2.0,2.0,785,,,,,,,,5.0,2.0,82.0,,,,,,,,,121.0,COMPLETE
82,0.514413317092976,2024-04-12 03:12:27.296362,2024-04-12 03:12:28.043135,0 days 00:00:00.746773,25.16188892922144,,,8.763376794442348,rbf,5.0,8.0,6.0,320,,,,4.0,,,,,,,,,,,,,,,,COMPLETE
