number,value,datetime_start,datetime_complete,duration,params_C,params_gamma,params_kernel,params_mask_number,params_rsi_window,params_so_smooth,params_so_window,params_srsi_smooth1,params_srsi_smooth2,params_srsi_window,params_tsi_window_fast,params_tsi_window_slow,params_ult_weight_1,params_ult_weight_2,params_ult_weight_3,params_ult_window_1,params_ult_window_2,params_ult_window_3,params_williams_lbp,state
3741,0.3837691669483453,2024-04-11 16:52:15.593045,2024-04-11 16:52:16.988202,0 days 00:00:01.395157,99.95809985362096,8.11189459714685,sigmoid,58,21.0,26.0,34.0,8.0,1.0,28.0,,,8.445669193325081,7.3521386977317205,9.058172157388007,2.0,38.0,77.0,,COMPLETE
3742,0.36373085718245446,2024-04-11 16:52:16.988202,2024-04-11 16:52:18.220190,0 days 00:00:01.231988,95.31076791271192,7.5672814704945255,sigmoid,39,50.0,,,,,,33.0,11.0,3.736766764643612,9.993951502013644,4.749443964224518,18.0,22.0,89.0,88.0,COMPLETE
3743,0.44400949920405025,2024-04-11 16:52:18.228000,2024-04-11 16:52:19.398093,0 days 00:00:01.170093,98.15378397999704,8.422933110665367,sigmoid,29,,28.0,31.0,6.0,3.0,53.0,26.0,30.0,,,,,,,98.0,COMPLETE
3744,0.3990374165502251,2024-04-11 16:52:19.405618,2024-04-11 16:52:20.650122,0 days 00:00:01.244504,98.11462451914046,7.81933523546416,sigmoid,43,43.0,25.0,35.0,,,,,,7.51438400362783,5.958046237768758,8.504022706523111,20.0,45.0,62.0,22.0,COMPLETE
3745,0.12622036262203626,2024-04-11 16:52:20.650122,2024-04-11 16:52:21.514010,0 days 00:00:00.863888,96.6048848235379,8.063081144907299,sigmoid,8,,23.0,29.0,,,,,,,,,,,,,COMPLETE
3746,0.48217301334348167,2024-04-11 16:52:21.514010,2024-04-11 16:52:22.740550,0 days 00:00:01.226540,99.94701679592968,8.237986015985685,sigmoid,18,,,,5.0,6.0,44.0,,,9.32244780851528,5.431620327093746,8.292134189379206,13.0,23.0,55.0,,COMPLETE
3747,0.48398663020358546,2024-04-11 16:52:22.749316,2024-04-11 16:52:24.361298,0 days 00:00:01.611982,94.25282832869183,8.66422221970373,rbf,8,,25.0,30.0,,,,,,,,,,,,,COMPLETE
3748,0.5929369437606513,2024-04-11 16:52:24.361496,2024-04-11 16:52:25.262845,0 days 00:00:00.901349,98.1570731806771,7.93206130922493,sigmoid,8,,27.0,33.0,,,,,,,,,,,,,COMPLETE
3749,0.4512950859356088,2024-04-11 16:52:25.271779,2024-04-11 16:52:26.150619,0 days 00:00:00.878840,96.40939979990695,9.560044708256093,sigmoid,8,,26.0,28.0,,,,,,,,,,,,,COMPLETE
3750,0.5023384900035976,2024-04-11 16:52:26.150860,2024-04-11 16:52:27.374647,0 days 00:00:01.223787,98.09476888669678,7.602583568143703,sigmoid,50,18.0,,,2.0,7.0,93.0,,,4.824317723441277,7.5337481719494415,7.385105844584521,3.0,35.0,83.0,,COMPLETE
3751,0.32954628213531423,2024-04-11 16:52:27.374647,2024-04-11 16:52:28.583118,0 days 00:00:01.208471,92.00929819410723,8.413758508938812,sigmoid,38,27.0,,,,,,23.0,42.0,4.047198030393209,0.6513790631980418,3.8436060024589764,17.0,42.0,96.0,,COMPLETE
3752,0.48135015342652576,2024-04-11 16:52:28.583118,2024-04-11 16:52:29.700057,0 days 00:00:01.116939,96.64294726765759,8.185762245308956,sigmoid,24,,29.0,32.0,7.0,8.0,77.0,,,,,,,,,,COMPLETE
3753,0.41092262092451276,2024-04-11 16:52:29.700057,2024-04-11 16:52:30.843750,0 days 00:00:01.143693,94.14516091715188,7.9602997121040175,sigmoid,25,,24.0,27.0,4.0,5.0,19.0,,,,,,,,,194.0,COMPLETE
3754,0.40703750248032267,2024-04-11 16:52:30.853308,2024-04-11 16:52:32.226085,0 days 00:00:01.372777,97.93940458409611,7.051592980974901,sigmoid,47,47.0,22.0,31.0,,,,47.0,28.0,0.746412679579926,3.753928724357699,8.00224702070954,7.0,29.0,84.0,131.0,COMPLETE
3755,0.4673014519529123,2024-04-11 16:52:32.226085,2024-04-11 16:52:33.330752,0 days 00:00:01.104667,98.20220553259462,7.351491734701745,sigmoid,21,,,,3.0,4.0,65.0,20.0,12.0,,,,,,,26.0,COMPLETE
3756,0.5025567458756566,2024-04-11 16:52:33.330752,2024-04-11 16:52:34.632815,0 days 00:00:01.302063,99.9974097381041,7.7196727525524445,sigmoid,15,,26.0,30.0,,,,7.0,27.0,4.372188893964968,6.311491228544562,4.945168050407551,14.0,50.0,67.0,124.0,COMPLETE
3757,0.39824677819299403,2024-04-11 16:52:34.632815,2024-04-11 16:52:35.894494,0 days 00:00:01.261679,94.40020215481451,8.266575381524742,sigmoid,22,,,,1.0,1.0,100.0,11.0,31.0,1.412207486732529,4.636275352450351,5.825560546379307,16.0,47.0,100.0,,COMPLETE
3758,0.5952371952371952,2024-04-11 16:52:35.901070,2024-04-11 16:52:36.813326,0 days 00:00:00.912256,96.46869772651485,8.035483572600654,sigmoid,8,,25.0,32.0,,,,,,,,,,,,,COMPLETE
3759,0.5025429446260834,2024-04-11 16:52:36.813326,2024-04-11 16:52:37.941941,0 days 00:00:01.128615,99.94690092437395,8.550838250390346,sigmoid,28,,27.0,31.0,6.0,4.0,59.0,29.0,2.0,,,,,,,,COMPLETE
3760,0.43271137026239065,2024-04-11 16:52:37.941941,2024-04-11 16:52:39.418398,0 days 00:00:01.476457,95.6427200019917,7.857134628705668,sigmoid,31,,24.0,29.0,4.0,2.0,38.0,3.0,22.0,6.212388693520955,9.072682231428754,4.315119007225278,11.0,32.0,79.0,103.0,COMPLETE
3761,0.5106633491802551,2024-04-11 16:52:39.418398,2024-04-11 16:52:40.598040,0 days 00:00:01.179642,97.95426573866958,8.193426914754333,sigmoid,57,25.0,28.0,33.0,8.0,3.0,8.0,,,,,,,,,186.0,COMPLETE
3762,0.4448341684562156,2024-04-11 16:52:40.598040,2024-04-11 16:52:41.470413,0 days 00:00:00.872373,98.19784398259432,8.82771685012762,sigmoid,8,,23.0,30.0,,,,,,,,,,,,,COMPLETE
3763,0.37650729677901645,2024-04-11 16:52:41.477983,2024-04-11 16:52:42.703899,0 days 00:00:01.225916,99.96645959340437,8.447547249434662,sigmoid,42,11.0,26.0,32.0,,,,,,8.767707907045358,6.564064488841343,2.227957175997252,9.0,20.0,53.0,,COMPLETE
3764,0.3599072062451669,2024-04-11 16:52:42.703899,2024-04-11 16:52:43.633291,0 days 00:00:00.929392,96.16052843248181,7.585040496290152,sigmoid,9,,25.0,31.0,,,,,,,,,,,,137.0,COMPLETE
3765,0.5235330398349604,2024-04-11 16:52:43.633291,2024-04-11 16:52:44.780256,0 days 00:00:01.146965,99.96606406096262,8.038039293205314,sigmoid,35,19.0,,,,,,,,9.568740209211558,3.5092664434864203,2.7312600872796073,6.0,31.0,93.0,108.0,COMPLETE
3766,0.37302348719042033,2024-04-11 16:52:44.780256,2024-04-11 16:52:46.313131,0 days 00:00:01.532875,98.14106546403754,7.838817040570039,rbf,3,,,,,,,,,6.8707094530370165,1.8365493421833636,1.866484566931394,4.0,30.0,86.0,44.0,COMPLETE
3767,0.4439107886467567,2024-04-11 16:52:46.316183,2024-04-11 16:52:47.875679,0 days 00:00:01.559496,99.98380857769308,8.293290041319553,sigmoid,63,38.0,24.0,31.0,5.0,8.0,23.0,37.0,17.0,1.7917171118437203,3.895031402619786,7.747301348695698,10.0,24.0,64.0,79.0,COMPLETE
3768,0.44701971028259324,2024-04-11 16:52:47.875679,2024-04-11 16:52:48.780370,0 days 00:00:00.904691,99.99923032562953,8.137047930177518,sigmoid,8,,27.0,30.0,,,,,,,,,,,,,COMPLETE
3769,0.48712574075511733,2024-04-11 16:52:48.780370,2024-04-11 16:52:50.033773,0 days 00:00:01.253403,92.79552465340424,7.837609316375297,sigmoid,14,,26.0,33.0,,,,34.0,19.0,5.724808418109837,8.15555500396918,6.283025799088669,18.0,33.0,71.0,,COMPLETE
3770,0.49112200695006425,2024-04-11 16:52:50.033773,2024-04-11 16:52:50.944671,0 days 00:00:00.910898,95.44915879734799,7.438463766654967,sigmoid,16,,,,3.0,6.0,88.0,,,,,,,,,,COMPLETE
3771,0.12622036262203626,2024-04-11 16:52:50.954346,2024-04-11 16:52:51.835299,0 days 00:00:00.880953,96.50081944016915,9.043593123064946,sigmoid,8,,25.0,29.0,,,,,,,,,,,,,COMPLETE
3772,0.484546118276953,2024-04-11 16:52:51.835299,2024-04-11 16:52:53.328308,0 days 00:00:01.493009,90.97047333040497,8.418052361476212,sigmoid,62,34.0,22.0,34.0,7.0,1.0,46.0,9.0,25.0,2.8338197981327955,1.3348420994819836,3.194445073850443,19.0,25.0,92.0,,COMPLETE
3773,0.5952371952371952,2024-04-11 16:52:53.328308,2024-04-11 16:52:54.185877,0 days 00:00:00.857569,99.96169638763814,8.042512158026858,sigmoid,8,,24.0,32.0,,,,,,,,,,,,,COMPLETE
3774,0.5690778056797533,2024-04-11 16:52:54.185877,2024-04-11 16:52:55.196793,0 days 00:00:01.010916,94.15831907984719,7.655577292024058,sigmoid,2,,,,,,,,,6.524383925349753,8.442171293236427,8.671912562044287,2.0,34.0,99.0,,COMPLETE
3775,0.38820375335120644,2024-04-11 16:52:55.196793,2024-04-11 16:52:56.494965,0 days 00:00:01.298172,96.80476711525357,8.670916379217232,sigmoid,46,41.0,28.0,30.0,,,,32.0,29.0,1.0319344703474922,5.181469488222756,9.600143764274044,12.0,29.0,50.0,,COMPLETE
3776,0.42301627527172386,2024-04-11 16:52:56.494965,2024-04-11 16:52:57.798284,0 days 00:00:01.303319,98.06294506082537,8.228599254990396,sigmoid,26,,23.0,31.0,6.0,7.0,96.0,,,3.3459354136674473,7.204815730681727,6.740429927424641,15.0,36.0,60.0,,COMPLETE
3777,0.12622036262203626,2024-04-11 16:52:57.798284,2024-04-11 16:52:58.687532,0 days 00:00:00.889248,96.585242288067,7.946591910621205,sigmoid,8,,26.0,29.0,,,,,,,,,,,,,COMPLETE
3778,0.489789885392032,2024-04-11 16:52:58.687532,2024-04-11 16:52:59.709961,0 days 00:00:01.022429,69.4532827078522,7.721373873157345,sigmoid,20,,,,1.0,2.0,73.0,14.0,47.0,,,,,,,,COMPLETE
3779,0.49613755295290307,2024-04-11 16:52:59.709961,2024-04-11 16:53:00.952385,0 days 00:00:01.242424,98.13863147192713,8.374763359479033,sigmoid,10,,27.0,33.0,,,,,,5.977578023713533,4.099809815318551,0.7606257101690677,14.0,49.0,79.0,,COMPLETE
3780,0.5952371952371952,2024-04-11 16:53:00.952385,2024-04-11 16:53:01.811722,0 days 00:00:00.859337,95.10636947581204,8.021214980063768,sigmoid,8,,25.0,32.0,,,,,,,,,,,,,COMPLETE
3781,0.44701971028259324,2024-04-11 16:53:01.818783,2024-04-11 16:53:02.704757,0 days 00:00:00.885974,98.0205083888235,8.181119188772316,sigmoid,8,,24.0,30.0,,,,,,,,,,,,,COMPLETE
3782,0.4498482628714944,2024-04-11 16:53:02.704757,2024-04-11 16:53:03.971141,0 days 00:00:01.266384,99.97557826786587,8.535887290390624,sigmoid,11,,26.0,28.0,,,,,,7.315347106775631,4.402157096052005,3.5985507884473735,20.0,40.0,75.0,71.0,COMPLETE
3783,0.3915801783365005,2024-04-11 16:53:03.971141,2024-04-11 16:53:05.108852,0 days 00:00:01.137711,78.51550434182744,7.887960172664075,sigmoid,56,10.0,25.0,31.0,2.0,5.0,34.0,,,,,,,,,,COMPLETE
3784,0.18879451646550438,2024-04-11 16:53:05.108852,2024-04-11 16:53:06.434018,0 days 00:00:01.325166,92.96921091408745,7.441323505438429,rbf,41,31.0,27.0,32.0,,,,,,,,,,,,197.0,COMPLETE
3785,0.5409742241817874,2024-04-11 16:53:06.434018,2024-04-11 16:53:07.373304,0 days 00:00:00.939286,98.15871437243372,8.271873206673915,sigmoid,37,16.0,,,,,,50.0,7.0,,,,,,,143.0,COMPLETE
3786,0.44701971028259324,2024-04-11 16:53:07.373304,2024-04-11 16:53:08.314018,0 days 00:00:00.940714,95.2982956253598,7.784374255613864,sigmoid,8,,23.0,30.0,,,,,,,,,,,,,COMPLETE
3787,0.6009432182607054,2024-04-11 16:53:08.314018,2024-04-11 16:53:09.171637,0 days 00:00:00.857619,99.98747367800378,8.106257842051527,sigmoid,8,,29.0,31.0,,,,,,,,,,,,,COMPLETE
3788,0.3730697752998817,2024-04-11 16:53:09.179556,2024-04-11 16:53:10.595882,0 days 00:00:01.416326,96.87966831636427,7.985537376897536,sigmoid,59,14.0,22.0,32.0,8.0,3.0,4.0,,,0.5026198830479194,6.139861663349312,1.5842397145540028,8.0,43.0,82.0,169.0,COMPLETE
3789,0.5082670620478951,2024-04-11 16:53:10.595882,2024-04-11 16:53:11.558303,0 days 00:00:00.962421,99.96165263439732,7.598718046304426,sigmoid,48,23.0,,,4.0,6.0,83.0,,,,,,,,,,COMPLETE
3790,0.5929369437606513,2024-04-11 16:53:11.558303,2024-04-11 16:53:12.464066,0 days 00:00:00.905763,74.26462773154454,8.411085639853441,sigmoid,8,,26.0,33.0,,,,,,,,,,,,,COMPLETE
3791,0.418450722067393,2024-04-11 16:53:12.464066,2024-04-11 16:53:13.829673,0 days 00:00:01.365607,96.37820071231766,8.166200078555036,sigmoid,55,6.0,,,3.0,4.0,56.0,38.0,37.0,2.08544925486461,2.1069662154511763,9.171112282656857,13.0,44.0,90.0,157.0,COMPLETE
3792,0.5069140556625241,2024-04-11 16:53:13.837561,2024-04-11 16:53:14.711556,0 days 00:00:00.873995,93.92544108007031,8.734798972110582,sigmoid,8,,21.0,35.0,,,,,,,,,,,,,COMPLETE
3793,0.12622036262203626,2024-04-11 16:53:14.711556,2024-04-11 16:53:15.625084,0 days 00:00:00.913528,98.23372918079434,7.79216267944531,sigmoid,8,,24.0,29.0,,,,,,,,,,,,,COMPLETE
3794,0.5493967983914624,2024-04-11 16:53:15.633114,2024-04-11 16:53:16.614455,0 days 00:00:00.981341,98.26462902932649,7.967477102937748,sigmoid,12,,28.0,31.0,,,,46.0,24.0,,,,,,,,COMPLETE
3795,0.44406744271023646,2024-04-11 16:53:16.623309,2024-04-11 16:53:17.427797,0 days 00:00:00.804488,96.57398715158375,8.347697808726974,sigmoid,1,,,,,,,,,,,,,,,176.0,COMPLETE
3796,0.5014800255748418,2024-04-11 16:53:17.427797,2024-04-11 16:53:18.540672,0 days 00:00:01.112875,99.997930543213,8.132924930371004,sigmoid,44,13.0,25.0,34.0,,,,36.0,10.0,,,,,,,,COMPLETE
3797,0.44701971028259324,2024-04-11 16:53:18.540672,2024-04-11 16:53:19.436823,0 days 00:00:00.896151,95.14093147249451,7.6915294708742525,sigmoid,8,,24.0,30.0,,,,,,,,,,,,,COMPLETE
3798,0.5169787369089177,2024-04-11 16:53:19.445328,2024-04-11 16:53:20.845440,0 days 00:00:01.400112,23.324238022971226,7.245381777899494,sigmoid,23,,,,2.0,7.0,16.0,42.0,15.0,2.5022399916903817,0.9531203375727468,5.677662016987861,6.0,28.0,58.0,164.0,COMPLETE
3799,0.5593948214831186,2024-04-11 16:53:20.854208,2024-04-11 16:53:21.752634,0 days 00:00:00.898426,98.26631785951797,8.56927971904464,sigmoid,32,4.0,,,,,,,,,,,,,,,COMPLETE
3800,0.47275028272927994,2024-04-11 16:53:21.752634,2024-04-11 16:53:23.122649,0 days 00:00:01.370015,96.76427589940508,7.903327388155724,sigmoid,54,42.0,,,7.0,5.0,67.0,25.0,5.0,9.805932544425826,8.824272603141514,4.140187014145501,4.0,37.0,69.0,,COMPLETE
3801,0.33608284234958036,2024-04-11 16:53:23.128564,2024-04-11 16:53:24.043412,0 days 00:00:00.914848,98.16471226750413,8.264916494191347,sigmoid,36,36.0,,,,,,44.0,18.0,,,,,,,,COMPLETE
3802,0.37843317388411946,2024-04-11 16:53:24.052344,2024-04-11 16:53:25.409313,0 days 00:00:01.356969,99.97468308505943,8.048997340480994,sigmoid,61,39.0,27.0,32.0,5.0,8.0,12.0,31.0,20.0,,,,,,,39.0,COMPLETE
3803,0.5963245096172158,2024-04-11 16:53:25.417564,2024-04-11 16:53:26.375856,0 days 00:00:00.958292,94.26300306185247,8.408078334883802,sigmoid,8,,26.0,31.0,,,,,,,,,,,,,COMPLETE
3804,0.08038192516931275,2024-04-11 16:53:26.384148,2024-04-11 16:53:28.289493,0 days 00:00:01.905345,91.97415107154107,7.5058258145028285,rbf,27,,25.0,29.0,4.0,1.0,62.0,,,4.973040579114223,9.294932497032832,6.0921273356848005,3.0,39.0,63.0,182.0,COMPLETE
3805,0.38827522172061596,2024-04-11 16:53:28.289493,2024-04-11 16:53:29.372869,0 days 00:00:01.083376,96.71237328202689,7.790728310677761,sigmoid,52,44.0,,,8.0,6.0,2.0,28.0,49.0,,,,,,,,COMPLETE
3806,0.5929369437606513,2024-04-11 16:53:29.372869,2024-04-11 16:53:30.253660,0 days 00:00:00.880791,97.9961719439659,8.144636861848811,sigmoid,8,,23.0,33.0,,,,,,,,,,,,,COMPLETE
3807,0.37548528583706253,2024-04-11 16:53:30.261627,2024-04-11 16:53:31.372076,0 days 00:00:01.110449,53.430245272228944,7.966932210900481,sigmoid,34,2.0,,,,,,,,7.85361404526634,4.853681118501772,5.108131631813444,19.0,47.0,73.0,,COMPLETE
3808,0.4113013179821239,2024-04-11 16:53:31.372448,2024-04-11 16:53:32.573599,0 days 00:00:01.201151,99.99447868585933,8.506839606084952,sigmoid,60,22.0,25.0,27.0,1.0,2.0,31.0,15.0,44.0,,,,,,,,COMPLETE
3809,0.44701971028259324,2024-04-11 16:53:32.573599,2024-04-11 16:53:33.455492,0 days 00:00:00.881893,95.22123920078249,7.663210612685905,sigmoid,8,,27.0,30.0,,,,,,,,,,,,,COMPLETE
3810,0.32964133060769374,2024-04-11 16:53:33.455492,2024-04-11 16:53:34.552208,0 days 00:00:01.096716,99.96856886890208,8.287760423564807,sigmoid,13,,24.0,32.0,,,,18.0,43.0,,,,,,,10.0,COMPLETE
3811,0.5015718510583798,2024-04-11 16:53:34.552208,2024-04-11 16:53:35.781488,0 days 00:00:01.229280,96.60736265666212,7.900854435388583,sigmoid,7,,,,,,,40.0,39.0,4.545602112984336,2.8187274414450254,8.885508784804713,17.0,27.0,66.0,31.0,COMPLETE
3812,0.456546663609264,2024-04-11 16:53:35.781488,2024-04-11 16:53:36.720864,0 days 00:00:00.939376,98.03572295777457,2.6858952279656534,sigmoid,8,,26.0,28.0,,,,,,,,,,,,,COMPLETE
3813,0.49510120853434125,2024-04-11 16:53:36.720864,2024-04-11 16:53:38.214071,0 days 00:00:01.493207,93.6174551088689,8.113990680585964,sigmoid,30,,23.0,31.0,5.0,4.0,81.0,4.0,31.0,9.145001354505467,2.421130564311836,7.168615070902315,7.0,35.0,78.0,,COMPLETE
3814,0.5170095786263476,2024-04-11 16:53:38.214071,2024-04-11 16:53:39.129038,0 days 00:00:00.914967,98.21035404670637,8.262334623038972,sigmoid,5,,,,,,,35.0,23.0,,,,,,,90.0,COMPLETE
3815,0.4545177188453415,2024-04-11 16:53:39.137914,2024-04-11 16:53:40.049618,0 days 00:00:00.911704,14.37514099311528,8.572386122759779,sigmoid,8,,26.0,30.0,,,,,,,,,,,,,COMPLETE
3816,0.31177682082007113,2024-04-11 16:53:40.049618,2024-04-11 16:53:40.924148,0 days 00:00:00.874530,95.39617700790025,7.783282888834716,sigmoid,33,20.0,,,,,,,,,,,,,,62.0,COMPLETE
3817,0.3843013000587966,2024-04-11 16:53:40.924148,2024-04-11 16:53:41.879503,0 days 00:00:00.955355,98.1548108723122,7.493950506823375,sigmoid,17,,,,2.0,3.0,55.0,,,,,,,,,192.0,COMPLETE
3818,0.40711246200607903,2024-04-11 16:53:41.879503,2024-04-11 16:53:42.963371,0 days 00:00:01.083868,96.29257225466375,8.786178039064291,sigmoid,49,30.0,,,3.0,8.0,52.0,,,,,,,,,50.0,COMPLETE
3819,0.42335005354224203,2024-04-11 16:53:42.971239,2024-04-11 16:53:44.094329,0 days 00:00:01.123090,98.05135057249956,8.055142811831498,sigmoid,53,7.0,,,7.0,5.0,27.0,5.0,36.0,,,,,,,59.0,COMPLETE
3820,0.5260977118119975,2024-04-11 16:53:44.099044,2024-04-11 16:53:45.099024,0 days 00:00:00.999980,95.1806030300679,8.428952645899052,sigmoid,40,28.0,28.0,32.0,,,,,,,,,,,,,COMPLETE
3821,0.5650833173721509,2024-04-11 16:53:45.101722,2024-04-11 16:53:45.980127,0 days 00:00:00.878405,98.25126843771065,7.921423896720103,sigmoid,4,,,,,,,26.0,13.0,,,,,,,,COMPLETE
3822,0.473906575423981,2024-04-11 16:53:45.988559,2024-04-11 16:53:47.791085,0 days 00:00:01.802526,96.74719822081815,8.181428813054573,rbf,8,,20.0,31.0,,,,,,,,,,,,,COMPLETE
3823,0.48102887786821064,2024-04-11 16:53:47.791085,2024-04-11 16:53:48.909828,0 days 00:00:01.118743,93.13299364471828,7.664314553423754,sigmoid,45,15.0,25.0,29.0,,,,21.0,34.0,,,,,,,84.0,COMPLETE
3824,0.42034370645610775,2024-04-11 16:53:48.917898,2024-04-11 16:53:50.216558,0 days 00:00:01.298660,99.9951690261491,8.310987091133853,sigmoid,51,32.0,,,6.0,7.0,71.0,,,8.341189482422259,6.897188696283313,2.382769421949766,18.0,45.0,88.0,154.0,COMPLETE
3825,0.41887665749311986,2024-04-11 16:53:50.216558,2024-04-11 16:53:51.508344,0 days 00:00:01.291786,96.7780902602083,5.149096147742178,sigmoid,50,8.0,,,1.0,1.0,79.0,,,3.560772650344091,3.194149373115374,5.522646686993541,11.0,26.0,95.0,,COMPLETE
3826,0.35207421538921935,2024-04-11 16:53:51.508344,2024-04-11 16:53:52.775556,0 days 00:00:01.267212,98.15656631704545,7.2973131973518415,sigmoid,18,,,,6.0,4.0,90.0,,,4.176426156754173,5.895811485083172,1.1939869216230505,10.0,22.0,52.0,,COMPLETE
3827,0.5929369437606513,2024-04-11 16:53:52.775556,2024-04-11 16:53:53.732605,0 days 00:00:00.957049,95.02797904442147,8.004635381165805,sigmoid,8,,24.0,33.0,,,,,,,,,,,,,COMPLETE
3828,0.38431110206218555,2024-04-11 16:53:53.741725,2024-04-11 16:53:55.058569,0 days 00:00:01.316844,98.07607879058916,7.782546075440297,sigmoid,19,,,,8.0,2.0,48.0,,,5.265715982093447,1.6512493948499771,3.86890585459589,12.0,41.0,98.0,18.0,COMPLETE
3829,0.4607307631118417,2024-04-11 16:53:55.058569,2024-04-11 16:53:56.661588,0 days 00:00:01.603019,26.650997216730595,8.143168217057458,sigmoid,58,45.0,27.0,30.0,3.0,7.0,86.0,,,8.072663974462573,5.524711008701098,4.61982693379284,5.0,48.0,70.0,,COMPLETE
3830,0.5963245096172158,2024-04-11 16:53:56.661588,2024-04-11 16:53:57.646988,0 days 00:00:00.985400,91.03970979410592,8.568786301221522,sigmoid,8,,22.0,31.0,,,,,,,,,,,,,COMPLETE
3831,0.39491357856339276,2024-04-11 16:53:57.646988,2024-04-11 16:53:58.890381,0 days 00:00:01.243393,99.95477519602191,7.860262454700687,sigmoid,25,,25.0,32.0,2.0,8.0,98.0,,,,,,,,,129.0,COMPLETE
3832,0.42690993873014155,2024-04-11 16:53:58.890381,2024-04-11 16:54:00.152814,0 days 00:00:01.262433,98.23596289087848,5.758898369903823,sigmoid,29,,26.0,31.0,4.0,2.0,25.0,17.0,41.0,,,,,,,53.0,COMPLETE
3833,0.36962662945440933,2024-04-11 16:54:00.161523,2024-04-11 16:54:01.397947,0 days 00:00:01.236424,96.26656183103867,8.345753545196857,sigmoid,39,46.0,,,,,,2.0,46.0,7.67716822590201,6.485069834086688,9.785493962286344,16.0,49.0,97.0,74.0,COMPLETE
3834,0.5929369437606513,2024-04-11 16:54:01.405486,2024-04-11 16:54:02.269810,0 days 00:00:00.864324,94.1705621465341,8.089629465456646,sigmoid,8,,24.0,33.0,,,,,,,,,,,,,COMPLETE
3835,0.12622036262203626,2024-04-11 16:54:02.279156,2024-04-11 16:54:03.172983,0 days 00:00:00.893827,99.94547002617603,7.586404949610941,sigmoid,8,,23.0,29.0,,,,,,,,,,,,,COMPLETE
3836,0.4085259242775853,2024-04-11 16:54:03.172983,2024-04-11 16:54:04.448461,0 days 00:00:01.275478,96.16715201490406,7.931286498011955,sigmoid,43,24.0,28.0,34.0,,,,,,3.088720959968653,9.460337714145393,3.3429421021306744,9.0,32.0,72.0,139.0,COMPLETE
3837,0.2807540866245078,2024-04-11 16:54:04.451261,2024-04-11 16:54:05.593174,0 days 00:00:01.141913,96.66348842406406,8.305417469249024,sigmoid,6,,,,,,,12.0,21.0,3.9494369740498687,7.829579485115124,6.895673601099788,15.0,24.0,81.0,,COMPLETE
3838,0.5081716503081489,2024-04-11 16:54:05.593174,2024-04-11 16:54:06.692871,0 days 00:00:01.099697,98.1889650671655,8.706651335797586,sigmoid,24,,25.0,30.0,5.0,3.0,7.0,,,,,,,,,,COMPLETE
3839,0.47379880614541536,2024-04-11 16:54:06.692871,2024-04-11 16:54:08.077370,0 days 00:00:01.384499,99.99622598849757,8.09634382173979,sigmoid,47,12.0,26.0,31.0,,,,49.0,9.0,8.953966375150967,4.454267373527567,7.506968703530582,2.0,39.0,77.0,150.0,COMPLETE
3840,0.47265674517658396,2024-04-11 16:54:08.077370,2024-04-11 16:54:09.373212,0 days 00:00:01.295842,93.59024631360371,7.696992170679886,sigmoid,22,,,,7.0,6.0,43.0,23.0,32.0,4.710850273756848,9.606200675700173,9.333309874368663,8.0,46.0,56.0,,COMPLETE
3841,0.17647878168817902,2024-04-11 16:54:09.373212,2024-04-11 16:54:10.772999,0 days 00:00:01.399787,98.14962426562143,8.447373070224867,rbf,21,,,,6.0,5.0,17.0,8.0,26.0,,,,,,,117.0,COMPLETE
3842,0.5952371952371952,2024-04-11 16:54:10.780939,2024-04-11 16:54:11.667187,0 days 00:00:00.886248,98.15717985672772,7.892751738136824,sigmoid,8,,29.0,32.0,,,,,,,,,,,,,COMPLETE
