number,value,datetime_start,datetime_complete,duration,params_C,params_gamma,params_kernel,params_mask_number,params_rsi_window,params_so_smooth,params_so_window,params_srsi_smooth1,params_srsi_smooth2,params_srsi_window,params_tsi_window_fast,params_tsi_window_slow,params_ult_weight_1,params_ult_weight_2,params_ult_weight_3,params_ult_window_1,params_ult_window_2,params_ult_window_3,params_williams_lbp,state
3023,0.24772250973012275,2024-04-11 16:34:21.434716,2024-04-11 16:34:22.329312,0 days 00:00:00.894596,99.99000951540464,7.658633071161495,sigmoid,34,32.0,,,,,,,,4.476374063128806,6.245923592935657,2.2193351665790226,14.0,25.0,90.0,,COMPLETE
3024,0.12622036262203626,2024-04-11 16:34:22.331368,2024-04-11 16:34:23.177709,0 days 00:00:00.846341,96.79227237153303,8.053257985960414,sigmoid,8,,27.0,29.0,,,,,,,,,,,,,COMPLETE
3025,0.5974957313602731,2024-04-11 16:34:23.179709,2024-04-11 16:34:23.906869,0 days 00:00:00.727160,94.40653694851434,8.465527184899601,sigmoid,8,,22.0,31.0,,,,,,,,,,,,,COMPLETE
3026,0.46773446451644357,2024-04-11 16:34:23.908979,2024-04-11 16:34:25.080646,0 days 00:00:01.171667,96.79703144469664,8.256132632459959,sigmoid,30,,24.0,33.0,7.0,6.0,62.0,8.0,8.0,2.334013428480345,5.468241068719554,5.110755582437566,8.0,35.0,63.0,,COMPLETE
3027,0.4044975207765905,2024-04-11 16:34:25.082647,2024-04-11 16:34:25.918280,0 days 00:00:00.835633,98.05045661945883,7.236571581792812,sigmoid,33,19.0,,,,,,,,,,,,,,114.0,COMPLETE
3028,0.4338756566532361,2024-04-11 16:34:25.920332,2024-04-11 16:34:26.884291,0 days 00:00:00.963959,99.97957895159459,7.866425871075376,sigmoid,53,31.0,,,2.0,4.0,87.0,21.0,46.0,,,,,,,103.0,COMPLETE
3029,0.44701971028259324,2024-04-11 16:34:26.886285,2024-04-11 16:34:27.633193,0 days 00:00:00.746908,9.986032982986373,8.065833822776876,sigmoid,8,,21.0,30.0,,,,,,,,,,,,,COMPLETE
3030,0.5166309877310499,2024-04-11 16:34:27.635362,2024-04-11 16:34:28.814175,0 days 00:00:01.178813,93.93661527592164,7.5012313611121755,sigmoid,58,24.0,26.0,32.0,5.0,8.0,9.0,,,1.5253420753808444,3.0413888847537236,5.526228155347835,15.0,41.0,80.0,,COMPLETE
3031,0.4020668340737879,2024-04-11 16:34:28.816174,2024-04-11 16:34:29.746689,0 days 00:00:00.930515,98.05654573202234,7.787144391976526,sigmoid,45,11.0,25.0,31.0,,,,4.0,34.0,,,,,,,89.0,COMPLETE
3032,0.5413610849346498,2024-04-11 16:34:29.749837,2024-04-11 16:34:30.502891,0 days 00:00:00.753054,95.37445676897775,8.305150404034107,sigmoid,5,,,,,,,15.0,32.0,,,,,,,175.0,COMPLETE
3033,0.45347172512526845,2024-04-11 16:34:30.505100,2024-04-11 16:34:31.332703,0 days 00:00:00.827603,98.14340017077727,7.966699248503579,sigmoid,8,,28.0,28.0,,,,,,,,,,,,,COMPLETE
3034,0.48103603603603606,2024-04-11 16:34:31.336886,2024-04-11 16:34:32.471630,0 days 00:00:01.134744,95.72058307592454,8.61243168019611,sigmoid,18,,,,8.0,3.0,51.0,,,6.373890986436646,5.9131142119252935,6.8718118991239,10.0,46.0,100.0,,COMPLETE
3035,0.35671160884662306,2024-04-11 16:34:32.472770,2024-04-11 16:34:33.601938,0 days 00:00:01.129168,92.2396787025069,8.933406783143267,sigmoid,51,16.0,,,4.0,2.0,6.0,,,6.908869218419767,9.573744304057804,1.4602028543123966,13.0,44.0,55.0,15.0,COMPLETE
3036,0.1523088250762596,2024-04-11 16:34:33.603988,2024-04-11 16:34:34.804630,0 days 00:00:01.200642,25.985548499354802,8.173893910567125,rbf,17,,,,7.0,3.0,80.0,,,,,,,,,164.0,COMPLETE
3037,0.3257622115834563,2024-04-11 16:34:34.806631,2024-04-11 16:34:35.831846,0 days 00:00:01.025215,98.14804509774481,8.44176964058804,sigmoid,50,5.0,,,6.0,5.0,16.0,,,7.299842763803625,4.1502497142432295,3.8950250972386447,11.0,30.0,93.0,,COMPLETE
3038,0.4523933034661636,2024-04-11 16:34:35.833991,2024-04-11 16:34:36.590587,0 days 00:00:00.756596,96.58134732662978,6.688761918746613,sigmoid,8,,27.0,30.0,,,,,,,,,,,,,COMPLETE
3039,0.4387714299995002,2024-04-11 16:34:36.592587,2024-04-11 16:34:37.427709,0 days 00:00:00.835122,98.20853824721465,7.695131446852021,sigmoid,49,30.0,,,3.0,1.0,93.0,,,,,,,,,146.0,COMPLETE
3040,0.4561236489891919,2024-04-11 16:34:37.429709,2024-04-11 16:34:38.497134,0 days 00:00:01.067425,99.9373094052017,7.93963405954439,sigmoid,29,,23.0,32.0,1.0,6.0,84.0,25.0,11.0,,,,,,,26.0,COMPLETE
3041,0.12622036262203626,2024-04-11 16:34:38.499142,2024-04-11 16:34:39.224756,0 days 00:00:00.725614,99.99772402500406,8.160786530431437,sigmoid,8,,24.0,29.0,,,,,,,,,,,,,COMPLETE
3042,0.2550986569391477,2024-04-11 16:34:39.226765,2024-04-11 16:34:40.181280,0 days 00:00:00.954515,93.90285692536487,8.347606786725942,sigmoid,6,,,,,,,17.0,19.0,9.879027368504751,1.6904665185129932,9.34613425560356,12.0,50.0,76.0,,COMPLETE
3043,0.47049767817484345,2024-04-11 16:34:40.183275,2024-04-11 16:34:41.366022,0 days 00:00:01.182747,96.61742790948331,7.784029538976064,sigmoid,47,39.0,25.0,33.0,,,,39.0,9.0,6.075060715574431,2.5187684313030214,3.2659214783934747,6.0,32.0,74.0,35.0,COMPLETE
3044,0.6009432182607054,2024-04-11 16:34:41.367239,2024-04-11 16:34:42.097609,0 days 00:00:00.730370,98.27848536694627,7.551501506818133,sigmoid,8,,26.0,31.0,,,,,,,,,,,,,COMPLETE
3045,0.37112979290547465,2024-04-11 16:34:42.100609,2024-04-11 16:34:43.210044,0 days 00:00:01.109435,96.60976380972528,8.054777336796981,sigmoid,39,35.0,,,,,,40.0,2.0,9.352405052960826,7.267440521245994,0.8849875738113884,3.0,28.0,96.0,96.0,COMPLETE
3046,0.5064017450682853,2024-04-11 16:34:43.212044,2024-04-11 16:34:44.165324,0 days 00:00:00.953280,94.68808822304533,8.527070392370923,sigmoid,25,,23.0,30.0,8.0,7.0,41.0,,,,,,,,,141.0,COMPLETE
3047,0.4321587353861353,2024-04-11 16:34:44.167470,2024-04-11 16:34:45.202766,0 days 00:00:01.035296,98.36726794550644,8.240271674157688,sigmoid,19,,,,2.0,2.0,3.0,,,8.83623847765684,8.812429318043655,6.186235913630613,16.0,39.0,50.0,131.0,COMPLETE
3048,0.4984603059359588,2024-04-11 16:34:45.204936,2024-04-11 16:34:46.107209,0 days 00:00:00.902273,96.51074406097284,8.786818854497733,sigmoid,24,,25.0,31.0,4.0,4.0,44.0,,,,,,,,,,COMPLETE
3049,0.36273736776397925,2024-04-11 16:34:46.109385,2024-04-11 16:34:47.221104,0 days 00:00:01.111719,98.13274758755016,7.924790805845914,sigmoid,22,,,,6.0,8.0,59.0,46.0,44.0,3.5172108064729986,7.575470530339757,7.637208590840022,18.0,43.0,62.0,,COMPLETE
3050,0.4005797824257349,2024-04-11 16:34:47.223106,2024-04-11 16:34:48.333474,0 days 00:00:01.110368,94.01229057681724,7.403007840582824,sigmoid,43,27.0,27.0,32.0,,,,,,3.9582159477259946,9.3280291552536,9.042520998655249,19.0,48.0,98.0,59.0,COMPLETE
3051,0.5895095625828441,2024-04-11 16:34:48.335532,2024-04-11 16:34:49.130421,0 days 00:00:00.794889,99.94370123166408,8.13329309687102,sigmoid,8,,24.0,34.0,,,,,,,,,,,,,COMPLETE
3052,0.44701971028259324,2024-04-11 16:34:49.131420,2024-04-11 16:34:49.962022,0 days 00:00:00.830602,99.94402754664196,7.711630457301732,sigmoid,8,,26.0,30.0,,,,,,,,,,,,,COMPLETE
3053,0.3534905191392657,2024-04-11 16:34:49.964095,2024-04-11 16:34:50.903962,0 days 00:00:00.939867,96.85262559097568,8.363705172535376,sigmoid,35,37.0,,,,,,,,9.122163616335254,5.162656029730419,5.722380773844529,20.0,36.0,87.0,74.0,COMPLETE
3054,0.5147744620339195,2024-04-11 16:34:50.905962,2024-04-11 16:34:51.842580,0 days 00:00:00.936618,99.99226912688732,7.984104975359448,sigmoid,21,,,,2.0,5.0,28.0,49.0,6.0,,,,,,,108.0,COMPLETE
3055,0.18570162757076902,2024-04-11 16:34:51.844751,2024-04-11 16:34:53.148150,0 days 00:00:01.303399,14.145864441676466,7.833068352454883,rbf,38,8.0,,,,,,36.0,49.0,6.603495947201292,3.4639633287489127,2.514151006715023,11.0,23.0,79.0,,COMPLETE
3056,0.4536340852130326,2024-04-11 16:34:53.150249,2024-04-11 16:34:54.391276,0 days 00:00:01.241027,92.07906247166011,8.165787052314528,sigmoid,31,,28.0,28.0,5.0,1.0,91.0,10.0,14.0,5.728590966682149,8.096444057928764,2.7958099611322846,9.0,40.0,85.0,181.0,COMPLETE
3057,0.5963643249384587,2024-04-11 16:34:54.393424,2024-04-11 16:34:55.120404,0 days 00:00:00.726980,99.99189667676984,8.567325525023955,sigmoid,8,,25.0,32.0,,,,,,,,,,,,,COMPLETE
3058,0.12622036262203626,2024-04-11 16:34:55.122399,2024-04-11 16:34:55.902367,0 days 00:00:00.779968,95.56658177924606,7.604033875605338,sigmoid,8,,27.0,29.0,,,,,,,,,,,,,COMPLETE
3059,0.3963719562019938,2024-04-11 16:34:55.904358,2024-04-11 16:34:57.019947,0 days 00:00:01.115589,98.23853311766142,8.019500095436216,sigmoid,15,,23.0,31.0,,,,13.0,20.0,2.6843417987404607,4.807474346110184,1.2045766567276441,2.0,29.0,83.0,152.0,COMPLETE
3060,0.3967086444518742,2024-04-11 16:34:57.021948,2024-04-11 16:34:57.980728,0 days 00:00:00.958780,96.38023072477021,8.303622003175743,sigmoid,3,,,,,,,,,0.7564103533952773,2.214500603292359,4.792247449188874,7.0,22.0,70.0,124.0,COMPLETE
3061,0.51332727715862,2024-04-11 16:34:57.982843,2024-04-11 16:34:59.015618,0 days 00:00:01.032775,98.2856479990748,7.84536666932959,sigmoid,57,40.0,26.0,33.0,1.0,6.0,11.0,,,,,,,,,196.0,COMPLETE
3062,0.3361838795805441,2024-04-11 16:34:59.017733,2024-04-11 16:34:59.854983,0 days 00:00:00.837250,95.07771525453438,8.17281801731164,sigmoid,9,,24.0,30.0,,,,,,,,,,,,83.0,COMPLETE
3063,0.5998117115420825,2024-04-11 16:34:59.856982,2024-04-11 16:35:00.633167,0 days 00:00:00.776185,97.00150984595149,7.037578711686696,sigmoid,8,,25.0,32.0,,,,,,,,,,,,,COMPLETE
3064,0.46094646405283635,2024-04-11 16:35:00.635346,2024-04-11 16:35:01.935286,0 days 00:00:01.299940,99.98394853774558,9.726574924647394,sigmoid,63,12.0,26.0,31.0,3.0,3.0,100.0,19.0,16.0,1.3116376630116822,4.01003576836883,1.8546081157367569,10.0,45.0,64.0,160.0,COMPLETE
3065,0.3980979523558749,2024-04-11 16:35:01.937491,2024-04-11 16:35:02.949746,0 days 00:00:01.012255,98.09874072376735,8.483358373580753,sigmoid,28,,24.0,30.0,8.0,7.0,47.0,14.0,18.0,,,,,,,,COMPLETE
3066,0.47245438345506113,2024-04-11 16:35:02.950743,2024-04-11 16:35:04.007268,0 days 00:00:01.056525,99.95843649376471,7.995380885696406,sigmoid,14,,22.0,33.0,,,,29.0,22.0,7.885499577341672,6.090397131776916,8.327851740565224,12.0,31.0,77.0,,COMPLETE
3067,0.6009432182607054,2024-04-11 16:35:04.009317,2024-04-11 16:35:04.739843,0 days 00:00:00.730526,94.00183881397734,7.7063280577360525,sigmoid,8,,27.0,31.0,,,,,,,,,,,,,COMPLETE
3068,0.5124938061867346,2024-04-11 16:35:04.740964,2024-04-11 16:35:05.754509,0 days 00:00:01.013545,99.97941607326305,7.418531314882326,sigmoid,42,9.0,28.0,29.0,,,,,,8.596252419694629,6.792520353362799,4.164110403327334,15.0,24.0,99.0,,COMPLETE
3069,0.42020683209213977,2024-04-11 16:35:05.756557,2024-04-11 16:35:06.884171,0 days 00:00:01.127614,96.73096339709119,8.265325716773045,sigmoid,46,15.0,30.0,32.0,,,,9.0,7.0,4.62917644533118,1.0382446712192213,6.37157448577662,4.0,27.0,53.0,,COMPLETE
3070,0.5895095625828441,2024-04-11 16:35:06.886169,2024-04-11 16:35:07.625149,0 days 00:00:00.738980,96.6603155238717,7.890953403511595,sigmoid,8,,25.0,34.0,,,,,,,,,,,,,COMPLETE
3071,0.32081533178243044,2024-04-11 16:35:07.626254,2024-04-11 16:35:08.623030,0 days 00:00:00.996776,98.27016624871952,8.777159569007429,sigmoid,10,,29.0,30.0,,,,,,4.951881175622204,3.779607317793752,0.6235803257632693,8.0,26.0,92.0,,COMPLETE
3072,0.5468825036017289,2024-04-11 16:35:08.625183,2024-04-11 16:35:09.414672,0 days 00:00:00.789489,94.78755236776307,8.087718676201078,sigmoid,16,,,,7.0,2.0,74.0,,,,,,,,,,COMPLETE
3073,0.44684547394087165,2024-04-11 16:35:09.416748,2024-04-11 16:35:11.004398,0 days 00:00:01.587650,98.15022743883266,8.376974607965812,rbf,8,,23.0,29.0,,,,,,,,,,,,,COMPLETE
3074,0.6009432182607054,2024-04-11 16:35:11.006584,2024-04-11 16:35:11.795697,0 days 00:00:00.789113,95.31525963435384,7.596198420453814,sigmoid,8,,26.0,31.0,,,,,,,,,,,,,COMPLETE
3075,0.49977408504442994,2024-04-11 16:35:11.797698,2024-04-11 16:35:13.037488,0 days 00:00:01.239790,92.37800521928826,7.820220176669538,sigmoid,62,29.0,24.0,32.0,4.0,4.0,57.0,22.0,42.0,3.777295496021034,7.773661240524273,9.754609616369532,17.0,37.0,68.0,,COMPLETE
3076,0.38441431138702825,2024-04-11 16:35:13.039488,2024-04-11 16:35:13.956328,0 days 00:00:00.916840,98.22730974407777,8.574246469058183,sigmoid,41,26.0,25.0,33.0,,,,,,,,,,,,66.0,COMPLETE
3077,0.5151802656546489,2024-04-11 16:35:13.958331,2024-04-11 16:35:14.972270,0 days 00:00:01.013939,96.68025476722424,8.09579380739361,sigmoid,11,,27.0,31.0,,,,,,1.8423029119612973,7.097034466322842,3.068372448905635,14.0,42.0,90.0,187.0,COMPLETE
3078,0.12003789673140693,2024-04-11 16:35:14.974341,2024-04-11 16:35:15.793174,0 days 00:00:00.818833,98.22452478858436,8.27442250433376,sigmoid,8,,26.0,28.0,,,,,,,,,,,,,COMPLETE
3079,0.39688009021425885,2024-04-11 16:35:15.795174,2024-04-11 16:35:16.954385,0 days 00:00:01.159211,99.96668123755967,7.9716504546261415,sigmoid,26,,23.0,31.0,5.0,8.0,23.0,,,0.9711729963629123,6.466442158740673,7.438085695162076,13.0,50.0,67.0,,COMPLETE
3080,0.5588088835773329,2024-04-11 16:35:16.956385,2024-04-11 16:35:17.848377,0 days 00:00:00.891992,96.5942728113915,7.228293523788352,sigmoid,20,,,,2.0,5.0,33.0,16.0,31.0,,,,,,,,COMPLETE
3081,0.5931679318644695,2024-04-11 16:35:17.851371,2024-04-11 16:35:18.594080,0 days 00:00:00.742709,99.96376195774671,8.40439599359244,sigmoid,8,,20.0,27.0,,,,,,,,,,,,,COMPLETE
3082,0.44701971028259324,2024-04-11 16:35:18.596135,2024-04-11 16:35:19.340170,0 days 00:00:00.744035,93.87761410959115,7.782741548111702,sigmoid,8,,22.0,30.0,,,,,,,,,,,,,COMPLETE
3083,0.3077379304891068,2024-04-11 16:35:19.342176,2024-04-11 16:35:20.170995,0 days 00:00:00.828819,99.99294561255364,8.144144317830145,sigmoid,48,4.0,,,6.0,1.0,19.0,,,,,,,,,,COMPLETE
3084,0.33653949297386204,2024-04-11 16:35:20.172988,2024-04-11 16:35:20.985095,0 days 00:00:00.812107,95.51665831259159,7.521300882251064,sigmoid,37,42.0,,,,,,26.0,26.0,,,,,,,53.0,COMPLETE
3085,0.45719352931692375,2024-04-11 16:35:20.987095,2024-04-11 16:35:21.948102,0 days 00:00:00.961007,98.11322273163492,8.046963585881649,sigmoid,56,18.0,24.0,32.0,7.0,7.0,95.0,,,,,,,,,,COMPLETE
3086,0.3007839312163578,2024-04-11 16:35:21.950101,2024-04-11 16:35:22.872570,0 days 00:00:00.922469,97.02244454588003,7.741225523509123,sigmoid,2,,,,,,,,,5.37522570948151,7.363743591749193,3.563583795737227,5.0,34.0,97.0,,COMPLETE
3087,0.5069140556625241,2024-04-11 16:35:22.875579,2024-04-11 16:35:23.658333,0 days 00:00:00.782754,99.96263628317057,8.275677464276562,sigmoid,8,,25.0,35.0,,,,,,,,,,,,,COMPLETE
3088,0.4448341684562156,2024-04-11 16:35:23.659334,2024-04-11 16:35:24.406026,0 days 00:00:00.746692,99.98969703751496,8.667755595122918,sigmoid,8,,26.0,30.0,,,,,,,,,,,,,COMPLETE
3089,0.4133530360021494,2024-04-11 16:35:24.407188,2024-04-11 16:35:25.291701,0 days 00:00:00.884513,95.52060895377463,7.925271512895797,sigmoid,52,45.0,,,1.0,3.0,78.0,32.0,3.0,,,,,,,,COMPLETE
3090,0.5256838181108847,2024-04-11 16:35:25.293698,2024-04-11 16:35:26.183400,0 days 00:00:00.889702,98.00575826230998,8.469636341566721,sigmoid,13,,27.0,33.0,,,,24.0,33.0,,,,,,,119.0,COMPLETE
3091,0.6009432182607054,2024-04-11 16:35:26.185398,2024-04-11 16:35:26.935273,0 days 00:00:00.749875,92.25159594388069,8.168195851092026,sigmoid,8,,24.0,31.0,,,,,,,,,,,,,COMPLETE
3092,0.08220733507437265,2024-04-11 16:35:26.937272,2024-04-11 16:35:28.460789,0 days 00:00:01.523517,96.88230856792481,7.663814313610692,rbf,59,22.0,28.0,29.0,8.0,4.0,54.0,,,7.049347435012884,8.315949831781285,4.5920795026870245,6.0,32.0,65.0,171.0,COMPLETE
3093,0.5010317580149982,2024-04-11 16:35:28.462958,2024-04-11 16:35:29.636429,0 days 00:00:01.173471,98.1610021103794,7.9689598510026896,sigmoid,55,38.0,,,3.0,6.0,66.0,7.0,38.0,2.9643861717004825,1.4737432823053274,3.7891186905165997,18.0,33.0,82.0,43.0,COMPLETE
3094,0.2938879653612711,2024-04-11 16:35:29.638428,2024-04-11 16:35:30.496975,0 days 00:00:00.858547,93.74438661821455,8.332274505792407,sigmoid,12,,25.0,32.0,,,,44.0,10.0,,,,,,,,COMPLETE
3095,0.37997769467952497,2024-04-11 16:35:30.499087,2024-04-11 16:35:31.639634,0 days 00:00:01.140547,95.53321276501313,7.876379125939107,sigmoid,54,44.0,,,5.0,2.0,14.0,3.0,29.0,6.717519501160977,4.5426307040015095,6.965039179090026,9.0,46.0,59.0,,COMPLETE
3096,0.451800200775972,2024-04-11 16:35:31.641656,2024-04-11 16:35:32.639649,0 days 00:00:00.997993,97.98813933501933,8.219826040789174,sigmoid,60,14.0,26.0,31.0,7.0,4.0,70.0,33.0,23.0,,,,,,,,COMPLETE
3097,0.5906279643331437,2024-04-11 16:35:32.640645,2024-04-11 16:35:33.369879,0 days 00:00:00.729234,98.25467970326666,8.473633889899373,sigmoid,8,,25.0,34.0,,,,,,,,,,,,,COMPLETE
3098,0.48908390922786293,2024-04-11 16:35:33.371880,2024-04-11 16:35:34.520775,0 days 00:00:01.148895,95.30406673109067,8.071825054685533,sigmoid,23,,,,4.0,5.0,63.0,11.0,12.0,3.2670873426005125,8.544231225039413,8.811226402924449,3.0,38.0,84.0,128.0,COMPLETE
3099,0.5090272858032245,2024-04-11 16:35:34.522777,2024-04-11 16:35:35.533398,0 days 00:00:01.010621,98.1253739423908,7.457677774719968,sigmoid,7,,,,,,,37.0,50.0,9.562540074328755,5.6358488875912105,1.6841493474856186,16.0,40.0,62.0,92.0,COMPLETE
3100,0.5508679895080392,2024-04-11 16:35:35.535991,2024-04-11 16:35:36.417297,0 days 00:00:00.881306,96.68279800790295,7.718988745404624,sigmoid,44,47.0,27.0,30.0,,,,43.0,30.0,,,,,,,,COMPLETE
3101,0.37580331542695183,2024-04-11 16:35:36.418400,2024-04-11 16:35:37.186011,0 days 00:00:00.767611,99.96917213324589,8.037191065298813,sigmoid,36,28.0,,,,,,38.0,40.0,,,,,,,,COMPLETE
3102,0.42493458218189817,2024-04-11 16:35:37.188012,2024-04-11 16:35:37.907157,0 days 00:00:00.719145,96.66330163028769,8.300463896695845,sigmoid,1,,,,,,,,,,,,,,,21.0,COMPLETE
3103,0.5406827880512091,2024-04-11 16:35:37.909269,2024-04-11 16:35:38.782775,0 days 00:00:00.873506,93.76984113417879,7.886711032474031,sigmoid,40,33.0,23.0,32.0,,,,,,,,,,,,,COMPLETE
3104,0.5929369437606513,2024-04-11 16:35:38.784771,2024-04-11 16:35:39.521887,0 days 00:00:00.737116,98.32109563424842,8.615539068405724,sigmoid,8,,24.0,33.0,,,,,,,,,,,,,COMPLETE
3105,0.12118603538976568,2024-04-11 16:35:39.523878,2024-04-11 16:35:40.299008,0 days 00:00:00.775130,96.55496192964779,4.542839814262859,sigmoid,8,,21.0,29.0,,,,,,,,,,,,,COMPLETE
3106,0.44701971028259324,2024-04-11 16:35:40.300012,2024-04-11 16:35:41.061426,0 days 00:00:00.761414,94.84180366385426,8.09966248903633,sigmoid,8,,29.0,30.0,,,,,,,,,,,,,COMPLETE
3107,0.4307444926837112,2024-04-11 16:35:41.063424,2024-04-11 16:35:42.261927,0 days 00:00:01.198503,98.37956907090965,7.663662813109073,sigmoid,27,,26.0,32.0,6.0,3.0,2.0,,,4.311964071985808,2.3812286076056037,1.967359909868219,8.0,20.0,61.0,30.0,COMPLETE
3108,0.5940087769509635,2024-04-11 16:35:42.264099,2024-04-11 16:35:42.995491,0 days 00:00:00.731392,98.13154673415087,9.082000699374749,sigmoid,8,,25.0,31.0,,,,,,,,,,,,,COMPLETE
3109,0.5903136380931674,2024-04-11 16:35:42.997491,2024-04-11 16:35:43.717783,0 days 00:00:00.720292,91.86804198099982,8.361978725889815,sigmoid,32,13.0,,,,,,,,,,,,,,,COMPLETE
3110,0.3747296211606205,2024-04-11 16:35:43.719920,2024-04-11 16:35:44.626162,0 days 00:00:00.906242,98.19403202813159,7.848585239861188,sigmoid,34,2.0,,,,,,,,8.36094242510816,2.052306513194185,4.38740371823864,19.0,44.0,89.0,,COMPLETE
3111,0.12192657460424385,2024-04-11 16:35:44.628160,2024-04-11 16:35:46.059325,0 days 00:00:01.431165,95.407082999881,7.353423280825133,rbf,51,17.0,,,2.0,7.0,88.0,,,7.4446618451499535,9.767700407549526,7.797841978467924,2.0,47.0,73.0,156.0,COMPLETE
3112,0.4448341684562156,2024-04-11 16:35:46.061535,2024-04-11 16:35:46.816198,0 days 00:00:00.754663,96.61550056095258,8.813459551755635,sigmoid,8,,28.0,30.0,,,,,,,,,,,,,COMPLETE
3113,0.4860225365619755,2024-04-11 16:35:46.818197,2024-04-11 16:35:47.784350,0 days 00:00:00.966153,6.522998345826849,8.158722438474062,sigmoid,45,19.0,27.0,32.0,,,,31.0,5.0,,,,,,,38.0,COMPLETE
3114,0.5262838615207615,2024-04-11 16:35:47.786345,2024-04-11 16:35:48.517810,0 days 00:00:00.731465,63.91023698579903,7.93384271459286,sigmoid,4,,,,,,,41.0,25.0,,,,,,,,COMPLETE
3115,0.34055216372921704,2024-04-11 16:35:48.519848,2024-04-11 16:35:49.256205,0 days 00:00:00.736357,96.52350318127887,8.46706086377372,sigmoid,33,20.0,,,,,,,,,,,,,,79.0,COMPLETE
3116,0.6009432182607054,2024-04-11 16:35:49.258213,2024-04-11 16:35:50.027719,0 days 00:00:00.769506,99.93865349012901,7.549643052238316,sigmoid,8,,24.0,31.0,,,,,,,,,,,,,COMPLETE
3117,0.44266304347826085,2024-04-11 16:35:50.030896,2024-04-11 16:35:51.366375,0 days 00:00:01.335479,98.18574107944873,8.205756617575469,sigmoid,30,,22.0,29.0,1.0,6.0,51.0,30.0,27.0,5.989085333943073,0.7368440628082684,9.260147363541382,15.0,29.0,51.0,,COMPLETE
3118,0.48150337645801605,2024-04-11 16:35:51.368375,2024-04-11 16:35:52.152595,0 days 00:00:00.784220,93.27113681210972,8.01555449902127,sigmoid,5,,,,,,,27.0,44.0,,,,,,,100.0,COMPLETE
3119,0.510792159975307,2024-04-11 16:35:52.154610,2024-04-11 16:35:53.075990,0 days 00:00:00.921380,98.05602187368874,8.286038806618524,sigmoid,49,43.0,,,3.0,8.0,45.0,,,,,,,,,137.0,COMPLETE
3120,0.4594026406870914,2024-04-11 16:35:53.076989,2024-04-11 16:35:54.189844,0 days 00:00:01.112855,95.01593132484095,7.748883414517128,sigmoid,61,9.0,26.0,33.0,5.0,2.0,30.0,23.0,35.0,,,,,,,61.0,COMPLETE
3121,0.3939442435105464,2024-04-11 16:35:54.190855,2024-04-11 16:35:55.157033,0 days 00:00:00.966178,98.22334377266273,8.548869580838755,sigmoid,53,3.0,,,8.0,1.0,37.0,50.0,24.0,,,,,,,17.0,COMPLETE
3122,0.42759163766606556,2024-04-11 16:35:55.159033,2024-04-11 16:35:56.035923,0 days 00:00:00.876890,98.22453279422548,8.071359004401295,sigmoid,17,,,,3.0,5.0,26.0,,,,,,,,,10.0,COMPLETE
3123,0.47238663373258144,2024-04-11 16:35:56.037928,2024-04-11 16:35:57.176623,0 days 00:00:01.138695,96.43812143077776,7.818237879059805,sigmoid,19,,,,4.0,1.0,81.0,,,2.3871779388298258,2.930535112609232,2.880159506663802,12.0,49.0,69.0,144.0,COMPLETE
3124,0.5986580986580987,2024-04-11 16:35:57.178626,2024-04-11 16:35:57.910047,0 days 00:00:00.731421,99.96888283876113,8.263983289099562,sigmoid,8,,25.0,31.0,,,,,,,,,,,,,COMPLETE
3125,0.12622036262203626,2024-04-11 16:35:57.912043,2024-04-11 16:35:58.656335,0 days 00:00:00.744292,93.78303003420369,7.612292407960124,sigmoid,8,,23.0,29.0,,,,,,,,,,,,,COMPLETE
