number,value,datetime_start,datetime_complete,duration,params_C,params_gamma,params_kernel,params_mask_number,params_rsi_window,params_so_smooth,params_so_window,params_srsi_smooth1,params_srsi_smooth2,params_srsi_window,params_tsi_window_fast,params_tsi_window_slow,params_ult_weight_1,params_ult_weight_2,params_ult_weight_3,params_ult_window_1,params_ult_window_2,params_ult_window_3,params_williams_lbp,state
6822,0.4459799667898656,2024-04-11 18:01:56.331526,2024-04-11 18:01:58.360792,0 days 00:00:02.029266,96.68774495100834,8.502661689569221,sigmoid,22,,,,5.0,8.0,57.0,28.0,8.0,1.6876565216732007,4.631512538806683,4.725319947813546,9.0,49.0,91.0,,COMPLETE
6823,0.44701971028259324,2024-04-11 18:01:58.363359,2024-04-11 18:01:59.655740,0 days 00:00:01.292381,98.23737796941394,8.024886245265584,sigmoid,8,,26.0,30.0,,,,,,,,,,,,,COMPLETE
6824,0.5963643249384587,2024-04-11 18:01:59.658838,2024-04-11 18:02:01.221709,0 days 00:00:01.562871,88.51769283838681,8.195273010608895,sigmoid,8,,21.0,32.0,,,,,,,,,,,,,COMPLETE
6825,0.4344351947499544,2024-04-11 18:02:01.224255,2024-04-11 18:02:03.391253,0 days 00:00:02.166998,95.25136255206951,8.786988356898181,sigmoid,57,44.0,27.0,28.0,7.0,4.0,88.0,,,,,,,,,62.0,COMPLETE
6826,0.3407122957608613,2024-04-11 18:02:03.393820,2024-04-11 18:02:05.552607,0 days 00:00:02.158787,96.79949720500655,7.561403031160919,sigmoid,35,50.0,,,,,,,,9.406259346432767,4.875000303324726,4.129216264848137,19.0,34.0,96.0,34.0,COMPLETE
6827,0.5318546895065625,2024-04-11 18:02:05.555552,2024-04-11 18:02:07.879917,0 days 00:00:02.324365,64.58668225371474,7.868189873238527,sigmoid,38,4.0,,,,,,13.0,6.0,6.1710296030719345,9.405752265630763,7.509425331554624,16.0,41.0,81.0,,COMPLETE
6828,0.546851738330852,2024-04-11 18:02:07.883469,2024-04-11 18:02:09.621408,0 days 00:00:01.737939,98.31148870860176,8.48461757335933,sigmoid,3,,,,,,,,,2.6534677653482657,8.4171322913075,2.224876171826313,3.0,22.0,50.0,146.0,COMPLETE
6829,0.4973494796226048,2024-04-11 18:02:09.623936,2024-04-11 18:02:11.774839,0 days 00:00:02.150903,92.23070021430547,8.061554381791282,sigmoid,28,,25.0,31.0,4.0,3.0,38.0,37.0,12.0,,,,,,,,COMPLETE
6830,0.4246064271784291,2024-04-11 18:02:11.778123,2024-04-11 18:02:14.483939,0 days 00:00:02.705816,96.53458789834424,8.292529785698964,sigmoid,31,,24.0,33.0,2.0,5.0,32.0,43.0,38.0,7.6180451187021205,5.351087299761531,9.764683740769058,12.0,31.0,92.0,22.0,COMPLETE
6831,0.126809901914993,2024-04-11 18:02:14.487950,2024-04-11 18:02:16.151559,0 days 00:00:01.663609,37.72858516319727,7.278943605088921,sigmoid,8,,25.0,29.0,,,,,,,,,,,,,COMPLETE
6832,0.23232786284037774,2024-04-11 18:02:16.154536,2024-04-11 18:02:18.164860,0 days 00:00:02.010324,56.35911331470046,7.762525437117378,rbf,9,,27.0,30.0,,,,,,,,,,,,172.0,COMPLETE
6833,0.3365374495702509,2024-04-11 18:02:18.168041,2024-04-11 18:02:20.261327,0 days 00:00:02.093286,98.08033463747755,7.9827817774180865,sigmoid,42,10.0,26.0,31.0,,,,,,3.7329384730775583,6.825665007181243,2.6899288172749882,4.0,43.0,66.0,,COMPLETE
6834,0.41007722254132356,2024-04-11 18:02:20.267501,2024-04-11 18:02:21.786628,0 days 00:00:01.519127,95.07737144008937,8.368063100973519,sigmoid,16,,,,3.0,6.0,67.0,,,,,,,,,,COMPLETE
6835,0.5952371952371952,2024-04-11 18:02:21.788627,2024-04-11 18:02:23.313481,0 days 00:00:01.524854,96.50065822694356,7.646402850277225,sigmoid,8,,24.0,32.0,,,,,,,,,,,,,COMPLETE
6836,0.4881120265221802,2024-04-11 18:02:23.316545,2024-04-11 18:02:26.017649,0 days 00:00:02.701104,99.96193719990052,8.15166565682553,sigmoid,63,7.0,23.0,33.0,7.0,1.0,6.0,34.0,33.0,4.7186525665789905,5.789622454140021,8.624374798312646,17.0,39.0,61.0,105.0,COMPLETE
6837,0.12622036262203626,2024-04-11 18:02:26.019646,2024-04-11 18:02:27.531248,0 days 00:00:01.511602,94.05661805506722,7.880946778409849,sigmoid,8,,27.0,29.0,,,,,,,,,,,,,COMPLETE
6838,0.4670311422221087,2024-04-11 18:02:27.534248,2024-04-11 18:02:30.087878,0 days 00:00:02.553630,98.20597253867254,8.568079895160864,sigmoid,62,20.0,25.0,31.0,1.0,8.0,19.0,17.0,32.0,5.4796563931009015,3.4073498982329973,4.424496358562213,18.0,42.0,71.0,,COMPLETE
6839,0.4835741143874926,2024-04-11 18:02:30.090121,2024-04-11 18:02:32.455784,0 days 00:00:02.365663,98.20830814780409,8.15901130552328,sigmoid,46,29.0,22.0,32.0,,,,26.0,28.0,9.76037936855353,6.310465386224312,1.703554981714987,19.0,37.0,76.0,,COMPLETE
6840,0.5975937325125911,2024-04-11 18:02:32.461322,2024-04-11 18:02:34.173406,0 days 00:00:01.712084,98.12023520705989,7.413255877592063,sigmoid,8,,26.0,25.0,,,,,,,,,,,,,COMPLETE
6841,0.23946598243996306,2024-04-11 18:02:34.178623,2024-04-11 18:02:35.800605,0 days 00:00:01.621982,99.9990149578191,7.920132547721606,sigmoid,2,,,,,,,,,3.445381850933276,1.2836875072023353,8.06993581805921,14.0,27.0,79.0,,COMPLETE
6842,0.48714617169373553,2024-04-11 18:02:35.802605,2024-04-11 18:02:37.775401,0 days 00:00:01.972796,95.29406354374791,8.302732832604644,sigmoid,15,,24.0,30.0,,,,24.0,43.0,8.472012574426719,1.5638618918234135,6.379277732178377,7.0,30.0,89.0,101.0,COMPLETE
6843,0.5963245096172158,2024-04-11 18:02:37.777404,2024-04-11 18:02:38.997648,0 days 00:00:01.220244,91.19791620690877,9.018964228142877,sigmoid,8,,28.0,31.0,,,,,,,,,,,,,COMPLETE
6844,0.5356137736942306,2024-04-11 18:02:39.000650,2024-04-11 18:02:41.209085,0 days 00:00:02.208435,96.54247845258375,7.729315317549195,sigmoid,14,,26.0,30.0,,,,32.0,44.0,7.100193635252111,7.718719415787707,4.916123060003881,4.0,48.0,51.0,,COMPLETE
6845,0.3431575318855567,2024-04-11 18:02:41.212088,2024-04-11 18:02:42.957293,0 days 00:00:01.745205,98.03613856037373,8.045324121648227,sigmoid,41,33.0,25.0,33.0,,,,,,,,,,,,38.0,COMPLETE
6846,0.5963245096172158,2024-04-11 18:02:42.959292,2024-04-11 18:02:44.467515,0 days 00:00:01.508223,93.85639364557049,8.688033760548178,sigmoid,8,,23.0,31.0,,,,,,,,,,,,,COMPLETE
6847,0.380340882558954,2024-04-11 18:02:44.470005,2024-04-11 18:02:46.700514,0 days 00:00:02.230509,98.2990198693845,8.383019691089176,sigmoid,26,,25.0,29.0,5.0,7.0,13.0,,,6.718345743465637,5.516822578334531,0.5026332383056262,5.0,32.0,99.0,,COMPLETE
6848,0.38023783621562823,2024-04-11 18:02:46.703514,2024-04-11 18:02:48.298682,0 days 00:00:01.595168,96.39952193557693,8.083432566784825,sigmoid,37,46.0,,,,,,49.0,21.0,,,,,,,140.0,COMPLETE
6849,0.5784152494860774,2024-04-11 18:02:48.301459,2024-04-11 18:02:50.026874,0 days 00:00:01.725415,99.95103986785152,7.61137535529989,sigmoid,8,,27.0,43.0,,,,,,,,,,,,,COMPLETE
6850,0.31583339655564824,2024-04-11 18:02:50.031121,2024-04-11 18:02:51.894491,0 days 00:00:01.863370,98.13855589418543,7.900865043395083,sigmoid,10,,29.0,32.0,,,,,,8.966691054461329,2.859887504280965,3.930845594492749,13.0,28.0,94.0,,COMPLETE
6851,0.29856256382059543,2024-04-11 18:02:51.896509,2024-04-11 18:02:54.529111,0 days 00:00:02.632602,95.39511332317868,8.23561171375589,rbf,11,,24.0,36.0,,,,,,3.8775014040213125,0.8460981899668338,3.758082909644335,11.0,34.0,87.0,72.0,COMPLETE
6852,0.45345352376492626,2024-04-11 18:02:54.532095,2024-04-11 18:02:55.886150,0 days 00:00:01.354055,99.96373325166854,8.482895595400954,sigmoid,8,,19.0,30.0,,,,,,,,,,,,,COMPLETE
6853,0.5952371952371952,2024-04-11 18:02:55.889384,2024-04-11 18:02:57.372230,0 days 00:00:01.482846,19.52403981783826,7.807673032180064,sigmoid,8,,28.0,32.0,,,,,,,,,,,,,COMPLETE
6854,0.48696746803574076,2024-04-11 18:02:57.374310,2024-04-11 18:02:59.010013,0 days 00:00:01.635703,96.67997852791348,8.152996295020644,sigmoid,20,,,,6.0,3.0,95.0,19.0,24.0,,,,,,,,COMPLETE
6855,0.44046236380731146,2024-04-11 18:02:59.013183,2024-04-11 18:03:01.311490,0 days 00:00:02.298307,98.33518450336504,8.004559161376864,sigmoid,55,36.0,,,8.0,2.0,48.0,42.0,37.0,7.956849409947765,7.213169891553418,1.167861267941551,15.0,20.0,53.0,80.0,COMPLETE
6856,0.4286112271904165,2024-04-11 18:03:01.314548,2024-04-11 18:03:03.188682,0 days 00:00:01.874134,93.6957634260268,7.545772036315799,sigmoid,56,25.0,26.0,34.0,3.0,4.0,85.0,,,,,,,,,,COMPLETE
6857,0.4059173196433396,2024-04-11 18:03:03.190713,2024-04-11 18:03:04.734960,0 days 00:00:01.544247,96.60144379905992,8.339129893190783,sigmoid,48,40.0,,,4.0,5.0,4.0,,,,,,,,,,COMPLETE
6858,0.505280242371781,2024-04-11 18:03:04.738366,2024-04-11 18:03:06.429133,0 days 00:00:01.690767,98.27874987676125,3.6070516395900087,sigmoid,12,,22.0,28.0,,,,11.0,19.0,,,,,,,,COMPLETE
6859,0.34094952384274596,2024-04-11 18:03:06.431118,2024-04-11 18:03:07.964381,0 days 00:00:01.533263,95.46567265044006,7.0417803149307705,sigmoid,44,13.0,25.0,31.0,,,,23.0,30.0,,,,,,,,COMPLETE
6860,0.4510053891174596,2024-04-11 18:03:07.966577,2024-04-11 18:03:10.075094,0 days 00:00:02.108517,99.95674266094939,7.792335820878015,sigmoid,59,27.0,35.0,30.0,2.0,6.0,92.0,,,5.921390808013231,2.541771162965984,3.5505487174726786,2.0,46.0,95.0,29.0,COMPLETE
6861,0.4142300860773329,2024-04-11 18:03:10.078098,2024-04-11 18:03:11.916042,0 days 00:00:01.837944,98.11483190606546,8.547856552034483,sigmoid,52,23.0,,,1.0,1.0,79.0,44.0,46.0,,,,,,,,COMPLETE
6862,0.34191562303225354,2024-04-11 18:03:11.919061,2024-04-11 18:03:13.732117,0 days 00:00:01.813056,69.50117107902514,8.152605851186022,sigmoid,13,,27.0,29.0,,,,46.0,14.0,,,,,,,43.0,COMPLETE
6863,0.5929369437606513,2024-04-11 18:03:13.734111,2024-04-11 18:03:15.301702,0 days 00:00:01.567591,96.78613109107016,7.979223893629329,sigmoid,8,,23.0,33.0,,,,,,,,,,,,,COMPLETE
6864,0.5975614331269932,2024-04-11 18:03:15.304702,2024-04-11 18:03:16.737376,0 days 00:00:01.432674,99.97552095714728,6.433827714729277,sigmoid,8,,24.0,32.0,,,,,,,,,,,,,COMPLETE
6865,0.5986580986580987,2024-04-11 18:03:16.740368,2024-04-11 18:03:18.085369,0 days 00:00:01.345001,93.2163192551189,8.315724779436064,sigmoid,8,,26.0,31.0,,,,,,,,,,,,,COMPLETE
6866,0.4246957031822848,2024-04-11 18:03:18.088351,2024-04-11 18:03:20.230593,0 days 00:00:02.142242,95.19601796967368,7.726442446569761,sigmoid,23,,,,8.0,4.0,60.0,36.0,11.0,2.2741617998053396,7.940832517386179,5.786741373312614,9.0,33.0,75.0,159.0,COMPLETE
6867,0.4935212219192626,2024-04-11 18:03:20.233854,2024-04-11 18:03:22.379707,0 days 00:00:02.145853,98.21776408647312,7.375492714807968,sigmoid,60,16.0,30.0,30.0,4.0,7.0,41.0,16.0,15.0,,,,,,,,COMPLETE
6868,0.6009432182607054,2024-04-11 18:03:22.381705,2024-04-11 18:03:24.009799,0 days 00:00:01.628094,96.69194382266582,7.972591815590238,sigmoid,8,,25.0,31.0,,,,,,,,,,,,,COMPLETE
6869,0.4799242424242424,2024-04-11 18:03:24.012001,2024-04-11 18:03:26.129881,0 days 00:00:02.117880,98.27471324093541,8.849639070579986,sigmoid,54,9.0,,,7.0,5.0,51.0,15.0,49.0,2.4976683438550897,3.6218842808993785,7.845511592178267,8.0,24.0,69.0,,COMPLETE
6870,0.3182209254479483,2024-04-11 18:03:26.132906,2024-04-11 18:03:27.855013,0 days 00:00:01.722107,89.83591336349555,8.220827897294056,rbf,1,,,,,,,,,,,,,,,180.0,COMPLETE
6871,0.5187028657616893,2024-04-11 18:03:27.859236,2024-04-11 18:03:29.703667,0 days 00:00:01.844431,98.17252002885182,8.43993741057306,sigmoid,40,2.0,26.0,34.0,,,,,,,,,,,,,COMPLETE
6872,0.49170996744356527,2024-04-11 18:03:29.707915,2024-04-11 18:03:31.585437,0 days 00:00:01.877522,95.13443871610494,7.624439673386492,sigmoid,7,,,,,,,7.0,34.0,9.1042176729785,5.052473028703329,1.5237472647533847,6.0,44.0,62.0,94.0,COMPLETE
6873,0.5606351695745933,2024-04-11 18:03:31.588708,2024-04-11 18:03:33.590201,0 days 00:00:02.001493,99.92997693803237,7.846087288937702,sigmoid,36,5.0,,,,,,3.0,41.0,,,,,,,,COMPLETE
6874,0.4712579130079641,2024-04-11 18:03:33.593201,2024-04-11 18:03:35.789343,0 days 00:00:02.196142,96.67888312620407,8.695528874817171,sigmoid,61,11.0,24.0,27.0,3.0,6.0,71.0,30.0,16.0,,,,,,,121.0,COMPLETE
6875,0.5952371952371952,2024-04-11 18:03:35.794630,2024-04-11 18:03:37.461756,0 days 00:00:01.667126,99.9756251873934,8.101386069038096,sigmoid,8,,27.0,32.0,,,,,,,,,,,,,COMPLETE
6876,0.408881490949083,2024-04-11 18:03:37.465754,2024-04-11 18:03:39.785781,0 days 00:00:02.320027,91.63526693923842,8.25398815240471,sigmoid,30,,25.0,29.0,6.0,3.0,34.0,25.0,47.0,1.5193911208585482,9.580766386724395,6.027057222033795,3.0,38.0,55.0,,COMPLETE
6877,0.45385908351932985,2024-04-11 18:03:39.789364,2024-04-11 18:03:40.944161,0 days 00:00:01.154797,94.29478913301429,7.94346045316142,sigmoid,32,37.0,,,,,,,,,,,,,,,COMPLETE
6878,0.5974957313602731,2024-04-11 18:03:40.947189,2024-04-11 18:03:42.419789,0 days 00:00:01.472600,98.27970708007125,8.45395885734216,sigmoid,8,,32.0,31.0,,,,,,,,,,,,,COMPLETE
6879,0.5453290093105974,2024-04-11 18:03:42.423792,2024-04-11 18:03:43.880271,0 days 00:00:01.456479,98.2029330276341,8.098310358661747,sigmoid,33,22.0,,,,,,,,,,,,,,168.0,COMPLETE
6880,0.3135067724391173,2024-04-11 18:03:43.882271,2024-04-11 18:03:45.693717,0 days 00:00:01.811446,96.71170370029924,7.538576277438241,sigmoid,4,,,,,,,47.0,9.0,,,,,,,,COMPLETE
6881,0.5929369437606513,2024-04-11 18:03:45.697105,2024-04-11 18:03:47.243653,0 days 00:00:01.546548,32.56905930020031,7.779066227059112,sigmoid,8,,23.0,33.0,,,,,,,,,,,,,COMPLETE
6882,0.5277529476865449,2024-04-11 18:03:47.247265,2024-04-11 18:03:49.337704,0 days 00:00:02.090439,96.73284367247989,8.270615193035436,sigmoid,34,19.0,,,,,,,,0.6580160217431326,1.797202548553777,0.7771586026881758,12.0,36.0,58.0,,COMPLETE
6883,0.44701971028259324,2024-04-11 18:03:49.342710,2024-04-11 18:03:50.789031,0 days 00:00:01.446321,93.90516621641152,7.984203596690265,sigmoid,8,,21.0,30.0,,,,,,,,,,,,,COMPLETE
6884,0.5066937577604695,2024-04-11 18:03:50.791025,2024-04-11 18:03:52.556618,0 days 00:00:01.765593,98.14583137538887,8.601533585496778,sigmoid,17,,,,5.0,8.0,64.0,,,,,,,,,152.0,COMPLETE
6885,0.5204140310523289,2024-04-11 18:03:52.560622,2024-04-11 18:03:54.674004,0 days 00:00:02.113382,95.70053063839393,7.718662548307297,sigmoid,51,41.0,,,2.0,1.0,8.0,,,6.36522792206632,8.817604782766043,9.236339507549344,10.0,50.0,59.0,187.0,COMPLETE
6886,0.5199631932131876,2024-04-11 18:03:54.676161,2024-04-11 18:03:56.906879,0 days 00:00:02.230718,62.78436937264698,8.159877117907227,sigmoid,45,17.0,26.0,28.0,,,,50.0,25.0,,,,,,,135.0,COMPLETE
6887,0.5952371952371952,2024-04-11 18:03:56.908875,2024-04-11 18:03:58.941839,0 days 00:00:02.032964,98.08564998617912,7.895419519134595,sigmoid,8,,28.0,32.0,,,,,,,,,,,,,COMPLETE
6888,0.305152350014392,2024-04-11 18:03:58.944377,2024-04-11 18:04:01.584562,0 days 00:00:02.640185,99.95669058899932,8.398678575322673,rbf,5,,,,,,,40.0,4.0,,,,,,,129.0,COMPLETE
6889,0.3791856732556175,2024-04-11 18:04:01.589480,2024-04-11 18:04:04.476753,0 days 00:00:02.887273,96.60307889822286,8.075353017815317,sigmoid,18,,,,1.0,2.0,77.0,,,4.56743683632256,4.399894931235449,3.3435171858469013,20.0,31.0,98.0,,COMPLETE
6890,0.40108410322844573,2024-04-11 18:04:04.478752,2024-04-11 18:04:06.264279,0 days 00:00:01.785527,92.59122344445717,7.497299655565112,sigmoid,49,28.0,,,6.0,3.0,100.0,,,,,,,,,76.0,COMPLETE
6891,0.5015252427678072,2024-04-11 18:04:06.268375,2024-04-11 18:04:09.134459,0 days 00:00:02.866084,95.23700696678684,8.289893668578038,sigmoid,27,,25.0,31.0,7.0,4.0,56.0,,,7.457475841095215,2.086028117700234,5.1637558436199456,17.0,29.0,86.0,116.0,COMPLETE
6892,0.44701971028259324,2024-04-11 18:04:09.138458,2024-04-11 18:04:10.824529,0 days 00:00:01.686071,99.93777312004235,7.8707569285989765,sigmoid,8,,24.0,30.0,,,,,,,,,,,,,COMPLETE
6893,0.5929369437606513,2024-04-11 18:04:10.829496,2024-04-11 18:04:12.822927,0 days 00:00:01.993431,98.22347326416855,7.255154540854104,sigmoid,8,,27.0,33.0,,,,,,,,,,,,,COMPLETE
6894,0.38779692594317655,2024-04-11 18:04:12.827464,2024-04-11 18:04:15.428707,0 days 00:00:02.601243,98.29659603543348,8.576117382057431,sigmoid,19,,,,3.0,7.0,31.0,,,4.157888337016099,6.65091766258776,8.889226962937139,14.0,25.0,64.0,52.0,COMPLETE
6895,0.3954258405871309,2024-04-11 18:04:15.432709,2024-04-11 18:04:17.147081,0 days 00:00:01.714372,83.22407726067374,6.123728976900803,sigmoid,53,45.0,,,8.0,2.0,2.0,20.0,29.0,,,,,,,67.0,COMPLETE
6896,0.37564856451055,2024-04-11 18:04:17.150101,2024-04-11 18:04:19.236976,0 days 00:00:02.086875,99.92661973626441,8.087858692565323,sigmoid,25,,25.0,9.0,2.0,6.0,16.0,,,,,,,,,10.0,COMPLETE
6897,0.4188966355194261,2024-04-11 18:04:19.240977,2024-04-11 18:04:21.783117,0 days 00:00:02.542140,96.62262511474225,2.0249714902927396,sigmoid,58,7.0,24.0,31.0,5.0,7.0,26.0,,,9.552702052925458,6.0123895104392355,7.268797884595186,18.0,47.0,52.0,,COMPLETE
6898,0.5952371952371952,2024-04-11 18:04:21.787681,2024-04-11 18:04:23.274897,0 days 00:00:01.487216,94.01170104584902,7.690094325624305,sigmoid,8,,22.0,32.0,,,,,,,,,,,,,COMPLETE
6899,0.46013404206147446,2024-04-11 18:04:23.276482,2024-04-11 18:04:25.868724,0 days 00:00:02.592242,98.23826317252468,8.379284081941865,sigmoid,39,15.0,,,,,,10.0,35.0,6.9496985784841225,9.02312024184032,2.4973319587169933,2.0,26.0,85.0,57.0,COMPLETE
6900,0.12622036262203626,2024-04-11 18:04:25.871725,2024-04-11 18:04:27.587133,0 days 00:00:01.715408,95.38489799704864,7.947040974360995,sigmoid,8,,26.0,29.0,,,,,,,,,,,,,COMPLETE
6901,0.19776233556225692,2024-04-11 18:04:27.590130,2024-04-11 18:04:29.418956,0 days 00:00:01.828826,99.99797357914385,8.174657422344724,sigmoid,6,,,,,,,18.0,10.0,2.954987457029525,8.289757700030513,6.53668611293159,15.0,41.0,93.0,,COMPLETE
6902,0.44701971028259324,2024-04-11 18:04:29.423972,2024-04-11 18:04:31.005054,0 days 00:00:01.581082,96.77551856751742,7.843308246396307,sigmoid,8,,28.0,30.0,,,,,,,,,,,,,COMPLETE
6903,0.4833880531190278,2024-04-11 18:04:31.008093,2024-04-11 18:04:33.519553,0 days 00:00:02.511460,98.08504750067304,7.6171140759127205,sigmoid,29,,23.0,33.0,4.0,8.0,43.0,28.0,50.0,,,,,,,192.0,COMPLETE
6904,0.4565263084144889,2024-04-11 18:04:33.522550,2024-04-11 18:04:35.687175,0 days 00:00:02.164625,13.866752553762616,8.246846124311757,sigmoid,24,,26.0,21.0,4.0,5.0,53.0,,,,,,,,,,COMPLETE
6905,0.5150619150307908,2024-04-11 18:04:35.691183,2024-04-11 18:04:37.957580,0 days 00:00:02.266397,99.95808570040026,8.02432848018351,sigmoid,38,30.0,,,,,,35.0,37.0,1.0192487344022565,3.8924490980224973,7.6543635914745085,16.0,40.0,97.0,,COMPLETE
6906,0.3449848541574487,2024-04-11 18:04:37.962579,2024-04-11 18:04:40.647817,0 days 00:00:02.685238,95.08373837142834,8.520874555860686,sigmoid,50,34.0,,,6.0,1.0,46.0,,,8.64280341526294,7.389439330009754,3.062520353764082,8.0,49.0,67.0,,COMPLETE
6907,0.25401888236795106,2024-04-11 18:04:40.649817,2024-04-11 18:04:43.030294,0 days 00:00:02.380477,96.77422141860077,8.821324847410667,rbf,22,,,,7.0,4.0,82.0,5.0,26.0,4.898664601892425,6.3924446434331825,4.564524321743458,13.0,39.0,72.0,,COMPLETE
6908,0.39327100342375565,2024-04-11 18:04:43.032295,2024-04-11 18:04:45.009479,0 days 00:00:01.977184,98.24023727720237,7.750282461535637,sigmoid,43,32.0,29.0,31.0,,,,,,1.86015652830195,4.752693875617995,2.0773057778343307,11.0,21.0,89.0,145.0,COMPLETE
6909,0.3567255578236081,2024-04-11 18:04:45.012482,2024-04-11 18:04:47.320394,0 days 00:00:02.307912,93.46157576896049,7.442051981027679,sigmoid,47,47.0,24.0,32.0,,,,41.0,45.0,8.281900637367563,3.1294815587090024,6.727914169623059,5.0,35.0,81.0,175.0,COMPLETE
6910,0.44701971028259324,2024-04-11 18:04:47.322396,2024-04-11 18:04:48.770989,0 days 00:00:01.448593,96.58061299424794,8.108165102203298,sigmoid,8,,27.0,30.0,,,,,,,,,,,,,COMPLETE
6911,0.4378096403800199,2024-04-11 18:04:48.773990,2024-04-11 18:04:51.276173,0 days 00:00:02.502183,98.3612646511463,8.384377935014452,sigmoid,31,,25.0,32.0,5.0,3.0,94.0,37.0,27.0,5.612230527082122,7.025039574422578,6.957684069341763,16.0,23.0,74.0,40.0,COMPLETE
6912,0.5069140556625241,2024-04-11 18:04:51.280232,2024-04-11 18:04:52.901514,0 days 00:00:01.621282,99.95142035768406,7.9266470597276175,sigmoid,8,,23.0,35.0,,,,,,,,,,,,,COMPLETE
6913,0.5139557873924657,2024-04-11 18:04:52.905720,2024-04-11 18:04:54.895707,0 days 00:00:01.989987,91.47424816362704,8.266430742653354,sigmoid,35,49.0,,,,,,,,2.77602601704093,1.038114257516228,9.620369357989215,6.0,28.0,78.0,16.0,COMPLETE
6914,0.5422846457864093,2024-04-11 18:04:54.899635,2024-04-11 18:04:56.682475,0 days 00:00:01.782840,96.66497598643117,8.039346694515995,sigmoid,21,,,,1.0,6.0,22.0,12.0,40.0,,,,,,,90.0,COMPLETE
6915,0.5192082790882412,2024-04-11 18:04:56.684472,2024-04-11 18:04:58.523589,0 days 00:00:01.839117,98.23904428727327,8.654180899804341,sigmoid,3,,,,,,,,,3.1371193034203526,9.99619148038617,1.7415312305859127,7.0,27.0,56.0,107.0,COMPLETE
6916,0.12622036262203626,2024-04-11 18:04:58.527117,2024-04-11 18:05:00.004612,0 days 00:00:01.477495,99.97730063852464,7.78343813124713,sigmoid,8,,26.0,29.0,,,,,,,,,,,,,COMPLETE
6917,0.5368591571790367,2024-04-11 18:05:00.008689,2024-04-11 18:05:01.760758,0 days 00:00:01.752069,99.98011830782272,8.196520463850291,sigmoid,9,,25.0,31.0,,,,,,,,,,,,46.0,COMPLETE
6918,0.3702458135422806,2024-04-11 18:05:01.763755,2024-04-11 18:05:03.701132,0 days 00:00:01.937377,95.18682187138246,8.4467319653768,sigmoid,42,21.0,28.0,34.0,,,,,,8.074536772956003,8.594092657597253,8.38291529255898,19.0,30.0,82.0,,COMPLETE
6919,0.44701971028259324,2024-04-11 18:05:03.703126,2024-04-11 18:05:05.203971,0 days 00:00:01.500845,96.6267070711483,7.654552392594575,sigmoid,8,,27.0,30.0,,,,,,,,,,,,,COMPLETE
6920,0.3653613241824788,2024-04-11 18:05:05.208040,2024-04-11 18:05:07.437247,0 days 00:00:02.229207,93.64284299137987,7.953924665587958,sigmoid,14,,24.0,33.0,,,,39.0,3.0,8.890937799325457,7.546300967432785,8.71869863869289,20.0,43.0,68.0,,COMPLETE
6921,0.4563386130390935,2024-04-11 18:05:07.440421,2024-04-11 18:05:09.399413,0 days 00:00:01.958992,98.2840019434099,8.187185659442243,sigmoid,57,39.0,26.0,28.0,8.0,1.0,87.0,,,,,,,,,23.0,COMPLETE
6922,0.48274858763911443,2024-04-11 18:05:09.402419,2024-04-11 18:05:12.117857,0 days 00:00:02.715438,95.3214094588552,7.281990578008856,sigmoid,15,,25.0,31.0,,,,31.0,13.0,3.6237589090160016,5.882995523778516,4.216180061225746,7.0,46.0,76.0,84.0,COMPLETE
6923,0.5952371952371952,2024-04-11 18:05:12.121869,2024-04-11 18:05:13.654217,0 days 00:00:01.532348,99.99330357728606,7.835964057361723,sigmoid,8,,24.0,32.0,,,,,,,,,,,,,COMPLETE
