number,value,datetime_start,datetime_complete,duration,params_C,params_gamma,params_kernel,params_mask_number,params_rsi_window,params_so_smooth,params_so_window,params_srsi_smooth1,params_srsi_smooth2,params_srsi_window,params_tsi_window_fast,params_tsi_window_slow,params_ult_weight_1,params_ult_weight_2,params_ult_weight_3,params_ult_window_1,params_ult_window_2,params_ult_window_3,params_williams_lbp,state
1247,0.589341292515921,2024-04-11 16:12:22.133816,2024-04-11 16:12:22.528301,0 days 00:00:00.394485,91.89121669584934,0.8482885621510128,sigmoid,0,,,,,,,,,,,,,,,,COMPLETE
1248,0.45740439153142026,2024-04-11 16:12:22.529342,2024-04-11 16:12:23.365447,0 days 00:00:00.836105,7.740269983418017,1.0626278632965793,sigmoid,30,,22.0,17.0,5.0,6.0,83.0,15.0,31.0,4.741017757646405,6.062351378245553,4.585012247826997,18.0,31.0,95.0,,COMPLETE
1249,0.4405168916961233,2024-04-11 16:12:23.366449,2024-04-11 16:12:24.252445,0 days 00:00:00.885996,89.63239386553073,0.49375804513659705,sigmoid,27,,49.0,28.0,4.0,5.0,81.0,,,1.4304638649150467,6.302751917274947,3.8469160527769457,7.0,50.0,89.0,74.0,COMPLETE
1250,0.12072238469036992,2024-04-11 16:12:24.253606,2024-04-11 16:12:24.719538,0 days 00:00:00.465932,23.809445355303254,1.629254418195338,sigmoid,8,,13.0,35.0,,,,,,,,,,,,,COMPLETE
1251,0.08954977736243197,2024-04-11 16:12:24.720587,2024-04-11 16:12:25.114492,0 days 00:00:00.393905,97.03764236788119,0.2302099817451626,sigmoid,32,36.0,,,,,,,,,,,,,,,COMPLETE
1252,0.5876937898060764,2024-04-11 16:12:25.115487,2024-04-11 16:12:25.542621,0 days 00:00:00.427134,86.34747190887421,1.3673553755977537,sigmoid,0,,,,,,,,,,,,,,,,COMPLETE
1253,0.4960129382960084,2024-04-11 16:12:25.543771,2024-04-11 16:12:26.216322,0 days 00:00:00.672551,93.42273452692248,1.8972584843315823,sigmoid,7,,,,,,,28.0,28.0,2.0697212893300274,7.412130385693482,2.30403469522312,3.0,39.0,68.0,125.0,COMPLETE
1254,0.48831719419954706,2024-04-11 16:12:26.218323,2024-04-11 16:12:26.878467,0 days 00:00:00.660144,95.50921067230964,0.75597649097759,sigmoid,61,11.0,19.0,3.0,3.0,8.0,97.0,36.0,42.0,,,,,,,14.0,COMPLETE
1255,0.4402107823267126,2024-04-11 16:12:26.879467,2024-04-11 16:12:27.397904,0 days 00:00:00.518437,98.0010360532006,0.9984925859330283,sigmoid,5,,,,,,,24.0,39.0,,,,,,,131.0,COMPLETE
1256,0.18026178507066298,2024-04-11 16:12:27.398906,2024-04-11 16:12:27.854003,0 days 00:00:00.455097,91.09318449315646,1.221429635359291,sigmoid,4,,,,,,,10.0,48.0,,,,,,,,COMPLETE
1257,0.3665970101269892,2024-04-11 16:12:27.855021,2024-04-11 16:12:29.295698,0 days 00:00:01.440677,87.54169541161917,0.6731884059013806,rbf,34,23.0,,,,,,,,7.829139327673923,5.709486352302239,3.3104802310334414,4.0,48.0,61.0,,COMPLETE
1258,0.2779876302353576,2024-04-11 16:12:29.297698,2024-04-11 16:12:29.808752,0 days 00:00:00.511054,95.24909183465928,1.4689893399305491,sigmoid,33,32.0,,,,,,,,,,,,,,35.0,COMPLETE
1259,0.5880365043344815,2024-04-11 16:12:29.809752,2024-04-11 16:12:30.202022,0 days 00:00:00.392270,92.86133364623845,0.9743478601550846,sigmoid,0,,,,,,,,,,,,,,,,COMPLETE
1260,0.39257806696972397,2024-04-11 16:12:30.203182,2024-04-11 16:12:30.899453,0 days 00:00:00.696271,98.11084346184671,0.4321020660615933,sigmoid,53,19.0,,,2.0,7.0,68.0,44.0,13.0,,,,,,,27.0,COMPLETE
1261,0.5851460801678332,2024-04-11 16:12:30.900462,2024-04-11 16:12:31.302346,0 days 00:00:00.401884,89.49718991981756,1.185834882084706,sigmoid,0,,,,,,,,,,,,,,,,COMPLETE
1262,0.5596495748518424,2024-04-11 16:12:31.304414,2024-04-11 16:12:31.723908,0 days 00:00:00.419494,94.75449573468008,3.8736849643176106,sigmoid,0,,,,,,,,,,,,,,,,COMPLETE
1263,0.44165617856317263,2024-04-11 16:12:31.724910,2024-04-11 16:12:32.455967,0 days 00:00:00.731057,92.46144650030419,0.8340152763449544,sigmoid,51,14.0,,,6.0,4.0,90.0,,,8.744210277975032,4.797523845526743,1.571325539105723,9.0,41.0,65.0,92.0,COMPLETE
1264,0.48714617169373553,2024-04-11 16:12:32.457087,2024-04-11 16:12:33.047923,0 days 00:00:00.590836,53.256828442378605,1.2704219752806258,sigmoid,45,24.0,9.0,40.0,,,,3.0,11.0,,,,,,,102.0,COMPLETE
1265,0.3244495552474042,2024-04-11 16:12:33.048933,2024-04-11 16:12:33.611847,0 days 00:00:00.562914,96.63510002653886,1.0677295269258762,sigmoid,17,,,,1.0,6.0,29.0,,,,,,,,,57.0,COMPLETE
1266,0.5816943051806145,2024-04-11 16:12:33.612847,2024-04-11 16:12:34.018910,0 days 00:00:00.406063,98.33562030868475,1.5519197192522438,sigmoid,0,,,,,,,,,,,,,,,,COMPLETE
1267,0.5423739039498028,2024-04-11 16:12:34.019906,2024-04-11 16:12:34.707516,0 days 00:00:00.687610,90.9248656056336,0.625705526510256,sigmoid,50,43.0,,,8.0,4.0,23.0,,,5.026968292648725,3.6909802864338266,2.5323721272287956,13.0,36.0,76.0,,COMPLETE
1268,0.3995985950827898,2024-04-11 16:12:34.709516,2024-04-11 16:12:35.278864,0 days 00:00:00.569348,62.50134128435909,0.8880976400958275,sigmoid,49,25.0,,,7.0,2.0,72.0,,,,,,,,,169.0,COMPLETE
1269,0.1823957237995093,2024-04-11 16:12:35.280865,2024-04-11 16:12:35.907268,0 days 00:00:00.626403,93.89763988367491,1.2697729450363693,sigmoid,18,,,,5.0,6.0,18.0,,,4.224469405378062,2.6806343332781477,3.514375373776065,3.0,37.0,69.0,,COMPLETE
1270,0.58913736984438,2024-04-11 16:12:35.908380,2024-04-11 16:12:36.318415,0 days 00:00:00.410035,88.10888791041812,0.9418479218666984,sigmoid,0,,,,,,,,,,,,,,,,COMPLETE
1271,0.5138242801593549,2024-04-11 16:12:36.319415,2024-04-11 16:12:36.970966,0 days 00:00:00.651551,96.84956258748784,1.3941455816638684,sigmoid,19,,,,2.0,5.0,53.0,,,1.5854420296820055,9.744938882244503,7.103886480150127,8.0,21.0,79.0,87.0,COMPLETE
1272,0.5251847486058848,2024-04-11 16:12:36.972075,2024-04-11 16:12:37.593205,0 days 00:00:00.621130,95.52437847063064,2.041166814899656,sigmoid,29,,6.0,9.0,3.0,1.0,50.0,50.0,44.0,,,,,,,186.0,COMPLETE
1273,0.5663851724068762,2024-04-11 16:12:37.594207,2024-04-11 16:12:38.031911,0 days 00:00:00.437704,99.85505698630136,5.837573197114001,sigmoid,0,,,,,,,,,,,,,,,,COMPLETE
1274,0.4477227520783394,2024-04-11 16:12:38.032912,2024-04-11 16:12:38.734046,0 days 00:00:00.701134,91.56298126242395,1.7472951484660164,sigmoid,58,12.0,4.0,16.0,4.0,3.0,86.0,,,3.191684463913383,7.301136651965736,4.398609648508838,5.0,49.0,56.0,,COMPLETE
1275,0.44114062880818905,2024-04-11 16:12:38.736092,2024-04-11 16:12:40.070056,0 days 00:00:01.333964,93.67028575104493,0.7400738467704033,rbf,24,,24.0,30.0,2.0,7.0,39.0,,,,,,,,,,COMPLETE
1276,0.5874934491910808,2024-04-11 16:12:40.071057,2024-04-11 16:12:40.484083,0 days 00:00:00.413026,84.96345733515147,1.1283375999433325,sigmoid,0,,,,,,,,,,,,,,,,COMPLETE
1277,0.5664105764666585,2024-04-11 16:12:40.485127,2024-04-11 16:12:41.079952,0 days 00:00:00.594825,89.52294684253496,0.3644173573116979,sigmoid,6,,,,,,,46.0,50.0,5.513287808351306,9.272738825038982,7.699614513628966,4.0,30.0,98.0,,COMPLETE
1278,0.4004045128464431,2024-04-11 16:12:41.082129,2024-04-11 16:12:41.825319,0 days 00:00:00.743190,98.26231197507379,1.0179577687899104,sigmoid,47,2.0,17.0,42.0,,,,31.0,32.0,8.211975575125798,1.0032748302978796,4.783015100140168,20.0,35.0,71.0,79.0,COMPLETE
1279,0.3529985372988786,2024-04-11 16:12:41.826322,2024-04-11 16:12:42.493684,0 days 00:00:00.667362,95.66516564592655,0.5998167886214442,sigmoid,43,49.0,12.0,49.0,,,,,,2.218905378082847,8.706272265468964,1.9055967268900453,11.0,23.0,91.0,177.0,COMPLETE
1280,0.5128587805247334,2024-04-11 16:12:42.494684,2024-04-11 16:12:43.090455,0 days 00:00:00.595771,99.97292922392694,1.3579868882914303,sigmoid,25,,32.0,7.0,6.0,3.0,77.0,,,,,,,,,195.0,COMPLETE
1281,0.402377730523874,2024-04-11 16:12:43.091455,2024-04-11 16:12:43.757812,0 days 00:00:00.666357,92.8025912010763,0.8539198174013424,sigmoid,22,,,,3.0,8.0,66.0,18.0,29.0,9.445810028842557,8.375558094658222,0.9321083025199934,14.0,47.0,85.0,,COMPLETE
1282,0.38098996875513896,2024-04-11 16:12:43.759871,2024-04-11 16:12:44.486430,0 days 00:00:00.726559,96.78549280636277,1.1139731144842064,sigmoid,39,6.0,,,,,,13.0,27.0,3.591207190444571,7.821322479265751,4.106848266456738,6.0,44.0,62.0,21.0,COMPLETE
1283,0.5638855948385022,2024-04-11 16:12:44.487429,2024-04-11 16:12:44.884096,0 days 00:00:00.396667,90.21448149555542,5.035937110855407,sigmoid,0,,,,,,,,,,,,,,,,COMPLETE
1284,0.3094592083255901,2024-04-11 16:12:44.885093,2024-04-11 16:12:45.420561,0 days 00:00:00.535468,94.45375247040717,9.116379941574959,sigmoid,3,,,,,,,,,1.214384511606565,8.944461905815388,1.6535642327896025,15.0,33.0,64.0,46.0,COMPLETE
1285,0.18851712016664499,2024-04-11 16:12:45.421562,2024-04-11 16:12:45.959821,0 days 00:00:00.538259,86.98031419033838,1.5579488794889111,sigmoid,2,,,,,,,,,5.2453707932702365,6.463828052069684,5.274908468699614,2.0,39.0,81.0,,COMPLETE
1286,0.5823323040111231,2024-04-11 16:12:45.960892,2024-04-11 16:12:46.438544,0 days 00:00:00.477652,91.95335061666728,0.4991141363832373,sigmoid,0,,,,,,,,,,,,,,,,COMPLETE
1287,0.493579255292776,2024-04-11 16:12:46.439545,2024-04-11 16:12:47.265636,0 days 00:00:00.826091,77.91717881705917,0.8195171006171633,sigmoid,31,,20.0,38.0,1.0,5.0,31.0,33.0,37.0,6.104600340413811,7.177174988424044,3.002518130510917,9.0,42.0,100.0,111.0,COMPLETE
1288,0.3699695070870891,2024-04-11 16:12:47.267662,2024-04-11 16:12:47.995028,0 days 00:00:00.727366,97.95636249742674,1.1734029186306947,sigmoid,15,,42.0,13.0,,,,25.0,25.0,9.637046511946913,6.864139633810154,6.378273152978257,7.0,26.0,84.0,64.0,COMPLETE
1289,0.5849009941800075,2024-04-11 16:12:47.996028,2024-04-11 16:12:48.411143,0 days 00:00:00.415115,95.46779881455305,1.015845690916601,sigmoid,0,,,,,,,,,,,,,,,,COMPLETE
1290,0.40863738984778963,2024-04-11 16:12:48.412143,2024-04-11 16:12:48.970115,0 days 00:00:00.557972,88.62157028056728,0.23351798057466522,sigmoid,21,,,,5.0,4.0,35.0,48.0,22.0,,,,,,,96.0,COMPLETE
1291,0.5050064127084131,2024-04-11 16:12:48.971179,2024-04-11 16:12:49.606348,0 days 00:00:00.635169,93.97006359297146,1.3544158292404347,sigmoid,38,8.0,,,,,,8.0,16.0,2.6243620887256864,8.025934129009132,6.03163197167465,8.0,38.0,72.0,,COMPLETE
1292,0.5861983059292476,2024-04-11 16:12:49.607346,2024-04-11 16:12:50.140399,0 days 00:00:00.533053,90.91059540841744,0.7369465167668342,sigmoid,8,,39.0,27.0,,,,,,,,,,,,,COMPLETE
1293,0.4702578314445489,2024-04-11 16:12:50.141423,2024-04-11 16:12:50.719427,0 days 00:00:00.578004,97.41724163762979,0.9427571545042531,sigmoid,28,,11.0,22.0,8.0,2.0,93.0,22.0,20.0,,,,,,,,COMPLETE
1294,0.41500722407186386,2024-04-11 16:12:50.721427,2024-04-11 16:12:52.116422,0 days 00:00:01.394995,82.10429954650539,1.2395947117154917,rbf,57,15.0,2.0,46.0,4.0,6.0,58.0,,,,,,,,,53.0,COMPLETE
1295,0.36959948412982735,2024-04-11 16:12:52.117423,2024-04-11 16:12:52.762413,0 days 00:00:00.644990,72.67590544937474,1.7142484454842755,sigmoid,35,22.0,,,,,,,,1.8428467383018567,9.437431381557207,2.1915500427210293,4.0,24.0,93.0,163.0,COMPLETE
1296,0.5863711449328822,2024-04-11 16:12:52.763412,2024-04-11 16:12:53.165957,0 days 00:00:00.402545,92.73898890699724,0.6362603544681636,sigmoid,0,,,,,,,,,,,,,,,,COMPLETE
1297,0.5851186236370609,2024-04-11 16:12:53.166488,2024-04-11 16:12:53.612101,0 days 00:00:00.445613,95.99881953931319,1.4853470753585083,sigmoid,0,,,,,,,,,,,,,,,,COMPLETE
1298,0.4083505887443212,2024-04-11 16:12:53.614102,2024-04-11 16:12:54.455082,0 days 00:00:00.840980,98.53317828696345,1.0997699272500807,sigmoid,63,30.0,29.0,14.0,7.0,7.0,48.0,34.0,45.0,2.863643886138923,5.462068186706369,1.1444134671617041,2.0,40.0,78.0,140.0,COMPLETE
1299,0.3692089614161251,2024-04-11 16:12:54.456079,2024-04-11 16:12:55.169642,0 days 00:00:00.713563,89.74696913234305,0.8272064336679323,sigmoid,46,35.0,14.0,39.0,,,,21.0,36.0,6.817281147736404,7.629195962885966,5.798529553850613,3.0,29.0,67.0,,COMPLETE
1300,0.23684685497698763,2024-04-11 16:12:55.170642,2024-04-11 16:12:55.784116,0 days 00:00:00.613474,99.89861976248969,0.5187263968747393,sigmoid,10,,15.0,24.0,,,,,,6.572166551169364,4.619672897784821,2.7202064749701464,5.0,32.0,87.0,,COMPLETE
1301,0.0,2024-04-11 16:12:55.785266,2024-04-11 16:12:56.582165,0 days 00:00:00.796899,85.54840425529908,0.0010430872660414092,sigmoid,42,41.0,36.0,45.0,,,,,,4.391076197208903,5.967196009066574,3.186582290105223,10.0,34.0,75.0,,COMPLETE
1302,0.5881014021858113,2024-04-11 16:12:56.583330,2024-04-11 16:12:56.990539,0 days 00:00:00.407209,94.38653552991742,1.2717494314899844,sigmoid,0,,,,,,,,,,,,,,,,COMPLETE
1303,0.5255477205022814,2024-04-11 16:12:56.991540,2024-04-11 16:12:57.554435,0 days 00:00:00.562895,96.60117745388945,0.9678275838382783,sigmoid,9,,23.0,20.0,,,,,,,,,,,,118.0,COMPLETE
1304,0.3356117069623705,2024-04-11 16:12:57.555450,2024-04-11 16:12:58.344010,0 days 00:00:00.788560,92.45821607764591,1.1070645432103352,sigmoid,14,,33.0,18.0,,,,11.0,35.0,3.8964284876121154,9.156450910325486,8.254886456080964,6.0,43.0,60.0,,COMPLETE
1305,0.42594828920885586,2024-04-11 16:12:58.345990,2024-04-11 16:12:59.178651,0 days 00:00:00.832661,87.73097937947458,0.7324370876355508,sigmoid,62,5.0,18.0,12.0,3.0,3.0,80.0,42.0,31.0,7.2943782278318885,9.638174269768578,3.922223774424393,13.0,41.0,96.0,,COMPLETE
1306,0.5093353582276219,2024-04-11 16:12:59.180040,2024-04-11 16:12:59.864517,0 days 00:00:00.684477,94.7770880244577,1.3997029666884786,sigmoid,41,16.0,40.0,36.0,,,,,,,,,,,,146.0,COMPLETE
1307,0.32165003024803385,2024-04-11 16:12:59.865519,2024-04-11 16:13:00.447394,0 days 00:00:00.581875,98.06859275392524,0.9523293746241561,sigmoid,37,50.0,,,,,,16.0,9.0,,,,,,,30.0,COMPLETE
1308,0.11340260011486453,2024-04-11 16:13:00.448441,2024-04-11 16:13:00.895894,0 days 00:00:00.447453,3.7229063992538443,0.3894322834284392,sigmoid,0,,,,,,,,,,,,,,,,COMPLETE
1309,0.5815744280095285,2024-04-11 16:13:00.896982,2024-04-11 16:13:01.305135,0 days 00:00:00.408153,92.08752381770722,1.5905194906871911,sigmoid,0,,,,,,,,,,,,,,,,COMPLETE
1310,0.3027561300133055,2024-04-11 16:13:01.306136,2024-04-11 16:13:02.003837,0 days 00:00:00.697701,90.14061104744381,1.2246073430312818,sigmoid,26,,7.0,10.0,2.0,1.0,27.0,,,0.9365445446684777,4.377710505698753,8.014940181703926,12.0,36.0,63.0,,COMPLETE
1311,0.4755545924862537,2024-04-11 16:13:02.006106,2024-04-11 16:13:02.651819,0 days 00:00:00.645713,96.46968476087875,0.7158978177029762,sigmoid,20,,,,1.0,4.0,2.0,38.0,6.0,,,,,,,,COMPLETE
1312,0.47999728008341075,2024-04-11 16:13:02.652820,2024-04-11 16:13:03.183439,0 days 00:00:00.530619,93.79606293503066,1.0715999668559393,sigmoid,16,,,,6.0,5.0,64.0,,,,,,,,,,COMPLETE
1313,0.3864613719062941,2024-04-11 16:13:03.184440,2024-04-11 16:13:04.110532,0 days 00:00:00.926092,88.53393099155642,3.269485469685673,rbf,0,,,,,,,,,,,,,,,,COMPLETE
1314,0.35718417202544994,2024-04-11 16:13:04.111533,2024-04-11 16:13:04.780970,0 days 00:00:00.669437,98.24022178760751,0.9159442059755338,sigmoid,56,17.0,5.0,15.0,4.0,2.0,12.0,,,,,,,,,,COMPLETE
1315,0.5186796858416473,2024-04-11 16:13:04.783018,2024-04-11 16:13:05.416173,0 days 00:00:00.633155,95.7087882165882,1.378839205077627,sigmoid,52,26.0,,,5.0,8.0,15.0,14.0,12.0,,,,,,,,COMPLETE
1316,0.5852394231262724,2024-04-11 16:13:05.417254,2024-04-11 16:13:05.852499,0 days 00:00:00.435245,91.65489995853785,1.1753318675758824,sigmoid,0,,,,,,,,,,,,,,,,COMPLETE
1317,0.46604280295689254,2024-04-11 16:13:05.853720,2024-04-11 16:13:06.667165,0 days 00:00:00.813445,83.3971657630722,0.5609861671731964,sigmoid,59,42.0,9.0,43.0,3.0,6.0,62.0,,,6.316348899152538,5.2308770727906735,6.696261596898502,7.0,28.0,57.0,71.0,COMPLETE
1318,0.47391060407705254,2024-04-11 16:13:06.669267,2024-04-11 16:13:07.201040,0 days 00:00:00.531773,93.50399020116018,0.8066068113087785,sigmoid,48,9.0,,,7.0,5.0,74.0,,,,,,,,,,COMPLETE
1319,0.5858043514863523,2024-04-11 16:13:07.202177,2024-04-11 16:13:07.615968,0 days 00:00:00.413791,96.86954362040393,1.9055497074246035,sigmoid,0,,,,,,,,,,,,,,,,COMPLETE
1320,0.5362466438292751,2024-04-11 16:13:07.616968,2024-04-11 16:13:08.166346,0 days 00:00:00.549378,90.7514568920623,1.4785868005524785,sigmoid,12,,50.0,19.0,,,,19.0,47.0,,,,,,,,COMPLETE
1321,0.3997762606849866,2024-04-11 16:13:08.167345,2024-04-11 16:13:08.791548,0 days 00:00:00.624203,98.28512608717662,1.0573303413102462,sigmoid,18,,,,5.0,4.0,45.0,,,0.5310922193242584,5.780657429507625,0.5101409564165462,3.0,35.0,74.0,,COMPLETE
1322,0.5060389174681279,2024-04-11 16:13:08.792760,2024-04-11 16:13:09.362296,0 days 00:00:00.569536,94.44510693711443,0.8804204715851826,sigmoid,44,31.0,27.0,25.0,,,,27.0,2.0,,,,,,,,COMPLETE
1323,0.5880576932543524,2024-04-11 16:13:09.363322,2024-04-11 16:13:09.892817,0 days 00:00:00.529495,86.96132618712298,0.23840895423781105,sigmoid,2,,,,,,,,,8.063378510170585,8.541060413922768,9.682438006768697,15.0,45.0,77.0,,COMPLETE
1324,0.5025534235708266,2024-04-11 16:13:09.893817,2024-04-11 16:13:10.527891,0 days 00:00:00.634074,95.99320698042014,1.2901873279285019,sigmoid,60,47.0,8.0,33.0,2.0,3.0,56.0,6.0,21.0,,,,,,,,COMPLETE
1325,0.5082546598886468,2024-04-11 16:13:10.528892,2024-04-11 16:13:11.133887,0 days 00:00:00.604995,92.39341315453586,0.6519035743376972,sigmoid,13,,45.0,41.0,,,,2.0,38.0,,,,,,,40.0,COMPLETE
1326,0.5836206735876839,2024-04-11 16:13:11.134913,2024-04-11 16:13:11.551048,0 days 00:00:00.416135,98.5335158772878,1.703712173727682,sigmoid,0,,,,,,,,,,,,,,,,COMPLETE
1327,0.4353545551728234,2024-04-11 16:13:11.552046,2024-04-11 16:13:12.308827,0 days 00:00:00.756781,46.43730111337067,1.0006781636053885,sigmoid,55,28.0,,,4.0,7.0,60.0,47.0,33.0,4.594225930199488,6.66827647695665,2.4892586493895186,8.0,49.0,89.0,157.0,COMPLETE
1328,0.1440853367298201,2024-04-11 16:13:12.310868,2024-04-11 16:13:12.876945,0 days 00:00:00.566077,99.92096040111696,0.483502154781567,sigmoid,36,4.0,,,,,,29.0,43.0,,,,,,,,COMPLETE
1329,0.4772029122221415,2024-04-11 16:13:12.877947,2024-04-11 16:13:13.650835,0 days 00:00:00.772888,89.34709061239488,1.1698430532640254,sigmoid,54,11.0,,,8.0,1.0,37.0,32.0,26.0,3.0574482893059347,0.6623093026846076,1.3189795146053913,16.0,31.0,82.0,,COMPLETE
1330,0.39980711196839125,2024-04-11 16:13:13.652994,2024-04-11 16:13:14.438863,0 days 00:00:00.785869,94.11136861718316,0.7883698539787559,sigmoid,23,,,,1.0,2.0,43.0,40.0,23.0,5.8874189642460175,3.475566331072131,5.542435029372408,4.0,37.0,73.0,59.0,COMPLETE
1331,0.5636462904171639,2024-04-11 16:13:14.439887,2024-04-11 16:13:14.823944,0 days 00:00:00.384057,99.98090485547641,6.996035743766019,sigmoid,0,,,,,,,,,,,,,,,,COMPLETE
1332,0.3527377883950462,2024-04-11 16:13:14.825138,2024-04-11 16:13:15.933659,0 days 00:00:01.108521,13.407652922940805,1.414985450031275,rbf,27,,25.0,50.0,6.0,5.0,89.0,,,7.599251757904238,8.171534917458423,5.013644356057638,2.0,26.0,84.0,14.0,COMPLETE
1333,0.33589429536428755,2024-04-11 16:13:15.934813,2024-04-11 16:13:16.596866,0 days 00:00:00.662053,96.34622597408203,0.9273923764114497,sigmoid,7,,,,,,,23.0,8.0,3.392683404182033,1.497176648854155,7.425227126876265,5.0,50.0,70.0,25.0,COMPLETE
1334,0.10595497844712895,2024-04-11 16:13:16.597865,2024-04-11 16:13:17.037718,0 days 00:00:00.439853,90.82815076936896,1.2067446323129134,sigmoid,32,18.0,,,,,,,,,,,,,,,COMPLETE
1335,0.4538236523192645,2024-04-11 16:13:17.038778,2024-04-11 16:13:17.805115,0 days 00:00:00.766337,85.6725561784872,0.6804677845949756,sigmoid,30,,21.0,48.0,2.0,6.0,85.0,20.0,14.0,4.93759835939035,2.369310315515168,3.398798445720229,10.0,46.0,68.0,,COMPLETE
1336,0.5815744280095285,2024-04-11 16:13:17.807269,2024-04-11 16:13:18.250285,0 days 00:00:00.443016,92.48584260955464,1.586417469134891,sigmoid,0,,,,,,,,,,,,,,,,COMPLETE
1337,0.5103780185299044,2024-04-11 16:13:18.251286,2024-04-11 16:13:18.783451,0 days 00:00:00.532165,94.72593741662038,1.0547423290915454,sigmoid,5,,,,,,,37.0,17.0,,,,,,,50.0,COMPLETE
1338,0.27589306652075346,2024-04-11 16:13:18.785556,2024-04-11 16:13:19.435960,0 days 00:00:00.650404,88.98833929472177,1.3248172177305613,sigmoid,34,45.0,,,,,,,,5.663845770423124,8.816458615506694,4.713165071964951,9.0,47.0,58.0,,COMPLETE
1339,0.46964193046185776,2024-04-11 16:13:19.436960,2024-04-11 16:13:20.170268,0 days 00:00:00.733308,96.54992896652328,0.8562778454106772,sigmoid,11,,3.0,35.0,,,,,,2.5235618641367146,6.92096216706333,1.8032105850555395,6.0,33.0,55.0,34.0,COMPLETE
1340,0.5884883071139484,2024-04-11 16:13:20.171268,2024-04-11 16:13:20.582246,0 days 00:00:00.410978,98.09171661500837,1.133597787413821,sigmoid,0,,,,,,,,,,,,,,,,COMPLETE
1341,0.5807195494878266,2024-04-11 16:13:20.583244,2024-04-11 16:13:21.058052,0 days 00:00:00.474808,93.10901288610555,0.33328008105110507,sigmoid,4,,,,,,,45.0,41.0,,,,,,,,COMPLETE
1342,0.44723984949738865,2024-04-11 16:13:21.059199,2024-04-11 16:13:21.774858,0 days 00:00:00.715659,95.08230051328182,0.5583253163306455,sigmoid,61,33.0,38.0,29.0,3.0,4.0,95.0,26.0,42.0,,,,,,,67.0,COMPLETE
1343,0.2794798862251117,2024-04-11 16:13:21.775857,2024-04-11 16:13:22.278537,0 days 00:00:00.502680,91.27274325699715,2.35574706748106,sigmoid,40,37.0,12.0,38.0,,,,,,,,,,,,,COMPLETE
1344,0.5871571537475874,2024-04-11 16:13:22.279652,2024-04-11 16:13:22.687097,0 days 00:00:00.407445,88.52170405187263,0.9293491765366355,sigmoid,0,,,,,,,,,,,,,,,,COMPLETE
1345,0.5294755806970302,2024-04-11 16:13:22.688097,2024-04-11 16:13:23.178424,0 days 00:00:00.490327,99.94655592798772,1.4515345056666098,sigmoid,33,20.0,,,,,,,,,,,,,,108.0,COMPLETE
1346,0.08623153882801333,2024-04-11 16:13:23.179445,2024-04-11 16:13:23.683740,0 days 00:00:00.504295,55.01256480695612,0.7853659186173846,sigmoid,8,,31.0,22.0,,,,,,,,,,,,,COMPLETE
1347,0.4984279797914092,2024-04-11 16:13:23.684738,2024-04-11 16:13:24.420895,0 days 00:00:00.736157,96.85541951102535,1.2301032543446262,sigmoid,51,28.0,,,5.0,7.0,8.0,,,5.438975347390369,8.343918207485753,4.376071084882604,12.0,27.0,92.0,128.0,COMPLETE
1348,0.47415617128463466,2024-04-11 16:13:24.421895,2024-04-11 16:13:25.085045,0 days 00:00:00.663150,93.98241704531503,1.0476355091301919,sigmoid,53,46.0,,,4.0,8.0,52.0,4.0,34.0,,,,,,,17.0,COMPLETE
1349,0.3335341436620716,2024-04-11 16:13:25.086046,2024-04-11 16:13:25.708937,0 days 00:00:00.622891,91.09242366532392,0.6292521257304392,sigmoid,45,8.0,15.0,26.0,,,,41.0,19.0,,,,,,,121.0,COMPLETE
