number,value,datetime_start,datetime_complete,duration,params_C,params_gamma,params_kernel,params_mask_number,params_rsi_window,params_so_smooth,params_so_window,params_srsi_smooth1,params_srsi_smooth2,params_srsi_window,params_tsi_window_fast,params_tsi_window_slow,params_ult_weight_1,params_ult_weight_2,params_ult_weight_3,params_ult_window_1,params_ult_window_2,params_ult_window_3,params_williams_lbp,state
628,0.5876937898060764,2024-04-11 16:06:48.844693,2024-04-11 16:06:49.202458,0 days 00:00:00.357765,99.87114812845223,1.3677410378341541,sigmoid,0,,,,,,,,,,,,,,,,COMPLETE
629,0.350624192854068,2024-04-11 16:06:49.203459,2024-04-11 16:06:50.394251,0 days 00:00:01.190792,96.94886742983797,0.8674556671476024,rbf,53,43.0,,,3.0,5.0,72.0,33.0,34.0,,,,,,,55.0,COMPLETE
630,0.5863711449328822,2024-04-11 16:06:50.395252,2024-04-11 16:06:50.718450,0 days 00:00:00.323198,92.64754611049857,0.728245294018758,sigmoid,0,,,,,,,,,,,,,,,,COMPLETE
631,0.516717851118128,2024-04-11 16:06:50.719560,2024-04-11 16:06:51.135355,0 days 00:00:00.415795,95.20788182092535,1.5767545051345835,sigmoid,17,,,,2.0,1.0,43.0,,,,,,,,,116.0,COMPLETE
632,0.40697020798201233,2024-04-11 16:06:51.136467,2024-04-11 16:06:51.547987,0 days 00:00:00.411520,23.455308748174833,1.285124934498076,sigmoid,33,47.0,,,,,,,,,,,,,,83.0,COMPLETE
633,0.5880365043344815,2024-04-11 16:06:51.549095,2024-04-11 16:06:51.861900,0 days 00:00:00.312805,96.68658763465561,0.9887087692564189,sigmoid,0,,,,,,,,,,,,,,,,COMPLETE
634,0.47409525640409483,2024-04-11 16:06:51.862912,2024-04-11 16:06:52.398505,0 days 00:00:00.535593,99.92035352761808,1.1233764726402427,sigmoid,51,25.0,,,4.0,2.0,57.0,,,1.9094274764544195,5.643462015016038,9.535880649985074,5.0,21.0,99.0,173.0,COMPLETE
635,0.5852178809510835,2024-04-11 16:06:52.399529,2024-04-11 16:06:52.718832,0 days 00:00:00.319303,93.70364773478673,1.415096276618289,sigmoid,0,,,,,,,,,,,,,,,,COMPLETE
636,0.4443794937744783,2024-04-11 16:06:52.719827,2024-04-11 16:06:53.282815,0 days 00:00:00.562988,92.2244812293254,3.398780242715047,sigmoid,58,35.0,25.0,28.0,1.0,4.0,84.0,,,6.403795709617553,1.3063431990647976,7.399687619196785,8.0,38.0,57.0,,COMPLETE
637,0.42938478570298905,2024-04-11 16:06:53.284817,2024-04-11 16:06:53.799486,0 days 00:00:00.514669,97.77674037481322,0.6737978533967905,sigmoid,50,13.0,,,6.0,7.0,66.0,,,7.9378666865422876,4.173100477414171,4.495374714465542,12.0,40.0,89.0,,COMPLETE
638,0.25297977248903214,2024-04-11 16:06:53.800487,2024-04-11 16:06:54.354117,0 days 00:00:00.553630,94.76164905275259,0.8704438656829195,sigmoid,19,,,,7.0,6.0,49.0,,,9.575026946713981,7.69881019315491,1.187385721888457,3.0,36.0,80.0,135.0,COMPLETE
639,0.588258559317662,2024-04-11 16:06:54.355130,2024-04-11 16:06:54.691388,0 days 00:00:00.336258,90.44647778118332,1.2056673849358597,sigmoid,0,,,,,,,,,,,,,,,,COMPLETE
640,0.5839382417329186,2024-04-11 16:06:54.692451,2024-04-11 16:06:55.005578,0 days 00:00:00.313127,96.9205123159764,1.0035891945528137,sigmoid,0,,,,,,,,,,,,,,,,COMPLETE
641,0.25116689794373653,2024-04-11 16:06:55.006551,2024-04-11 16:06:55.456484,0 days 00:00:00.449933,93.54387058892692,1.6705820880212903,sigmoid,6,,,,,,,14.0,50.0,7.175031633432184,3.05629887020046,6.827769107897712,2.0,47.0,92.0,,COMPLETE
642,0.4030688508587291,2024-04-11 16:06:55.457485,2024-04-11 16:06:55.928866,0 days 00:00:00.471381,95.87041891926471,0.6784582883515067,sigmoid,29,,20.0,39.0,3.0,8.0,20.0,41.0,30.0,,,,,,,98.0,COMPLETE
643,0.4936970143752304,2024-04-11 16:06:55.929929,2024-04-11 16:06:56.455792,0 days 00:00:00.525863,98.00009318048305,1.372937168384862,sigmoid,47,48.0,15.0,9.0,,,,50.0,42.0,1.7018690455313399,9.615977581551869,5.45865204909228,19.0,29.0,54.0,168.0,COMPLETE
644,0.38246170100369786,2024-04-11 16:06:56.457792,2024-04-11 16:06:56.963881,0 days 00:00:00.506089,91.98927488101478,0.8901614240713959,sigmoid,43,26.0,12.0,15.0,,,,,,4.35169475704586,0.957754761288566,5.045363049488001,10.0,25.0,61.0,151.0,COMPLETE
645,0.5596495748518424,2024-04-11 16:06:56.964881,2024-04-11 16:06:57.286197,0 days 00:00:00.321316,94.3253113297852,3.807227401058433,sigmoid,0,,,,,,,,,,,,,,,,COMPLETE
646,0.3992519420734631,2024-04-11 16:06:57.287197,2024-04-11 16:06:57.790277,0 days 00:00:00.503080,11.250813072757786,1.1955941696300243,sigmoid,39,11.0,,,,,,22.0,49.0,2.689879158895295,5.185651350587538,5.791981350485743,7.0,22.0,93.0,67.0,COMPLETE
647,0.4801284437825764,2024-04-11 16:06:57.792278,2024-04-11 16:06:58.247930,0 days 00:00:00.455652,99.93167136509933,0.4440090238488211,sigmoid,24,,28.0,12.0,8.0,2.0,79.0,,,,,,,,,,COMPLETE
648,0.3913305451194442,2024-04-11 16:06:58.249078,2024-04-11 16:06:58.756518,0 days 00:00:00.507440,96.38183051229096,1.0249489756044425,sigmoid,49,40.0,,,2.0,5.0,14.0,,,,,,,,,188.0,COMPLETE
649,0.39922801213123793,2024-04-11 16:06:58.757710,2024-04-11 16:06:59.822347,0 days 00:00:01.064637,90.15680951927814,1.4676148489290206,rbf,2,,,,,,,,,2.255704238015005,1.5729246105215893,3.1732077239529612,11.0,41.0,77.0,,COMPLETE
650,0.5873898933704218,2024-04-11 16:06:59.823349,2024-04-11 16:07:00.155354,0 days 00:00:00.332005,93.23037905967288,0.7871394249764536,sigmoid,0,,,,,,,,,,,,,,,,COMPLETE
651,0.48186064522374694,2024-04-11 16:07:00.156371,2024-04-11 16:07:00.695829,0 days 00:00:00.539458,98.5291794961301,1.1905251606482423,sigmoid,21,,,,5.0,4.0,53.0,3.0,9.0,,,,,,,75.0,COMPLETE
652,0.5433735693289137,2024-04-11 16:07:00.696830,2024-04-11 16:07:01.194089,0 days 00:00:00.497259,95.60172607690915,0.5710246160251601,sigmoid,35,38.0,,,,,,,,9.802466031512836,2.3000659983266423,8.416236402492567,14.0,42.0,52.0,21.0,COMPLETE
653,0.46737740962315283,2024-04-11 16:07:01.195082,2024-04-11 16:07:01.684998,0 days 00:00:00.489916,91.16915214285478,1.0165239145517917,sigmoid,22,,,,4.0,3.0,94.0,29.0,23.0,8.265036996448423,2.0475624145412823,2.876636143720836,9.0,44.0,74.0,,COMPLETE
654,0.5240122615803815,2024-04-11 16:07:01.685998,2024-04-11 16:07:02.031876,0 days 00:00:00.345878,94.93315267855294,1.3622506463704467,sigmoid,1,,,,,,,,,,,,,,,144.0,COMPLETE
655,0.5240534521158129,2024-04-11 16:07:02.032879,2024-04-11 16:07:02.501673,0 days 00:00:00.468794,99.98368414866147,0.8070019950726566,sigmoid,25,,7.0,36.0,1.0,8.0,17.0,,,,,,,,,103.0,COMPLETE
656,0.5858043514863523,2024-04-11 16:07:02.502675,2024-04-11 16:07:02.841949,0 days 00:00:00.339274,97.89573744870974,1.7694215852326,sigmoid,0,,,,,,,,,,,,,,,,COMPLETE
657,0.5547269272418937,2024-04-11 16:07:02.842962,2024-04-11 16:07:03.382173,0 days 00:00:00.539211,92.76134731092341,1.1366667406628361,sigmoid,38,3.0,,,,,,16.0,44.0,5.260785562595949,8.917335109189223,7.096228334003421,13.0,43.0,82.0,,COMPLETE
658,0.4304283204972301,2024-04-11 16:07:03.383183,2024-04-11 16:07:04.016194,0 days 00:00:00.633011,96.58181522154017,0.9374400955747896,sigmoid,31,,25.0,46.0,2.0,1.0,33.0,27.0,14.0,1.0126101572031896,5.8407382386369004,2.1984424674162053,8.0,45.0,62.0,13.0,COMPLETE
659,0.5014517165717325,2024-04-11 16:07:04.018222,2024-04-11 16:07:04.548163,0 days 00:00:00.529941,89.44354930720405,1.5506927478580892,sigmoid,15,,2.0,4.0,,,,26.0,3.0,2.9275326903364407,6.430167963192174,6.57011272221254,18.0,49.0,79.0,128.0,COMPLETE
660,0.5880215883883815,2024-04-11 16:07:04.549161,2024-04-11 16:07:04.888740,0 days 00:00:00.339579,94.14645373876809,1.2872483964483026,sigmoid,0,,,,,,,,,,,,,,,,COMPLETE
661,0.35020557647790485,2024-04-11 16:07:04.889764,2024-04-11 16:07:05.395297,0 days 00:00:00.505533,91.40590344173218,0.7152826753340555,sigmoid,3,,,,,,,,,4.633666533810635,9.311265052575036,5.988862412887709,5.0,30.0,71.0,53.0,COMPLETE
662,0.5906816394155942,2024-04-11 16:07:05.396445,2024-04-11 16:07:05.715920,0 days 00:00:00.319475,97.7353577788134,1.0875562747435235,sigmoid,0,,,,,,,,,,,,,,,,COMPLETE
663,0.06815125598407831,2024-04-11 16:07:05.716931,2024-04-11 16:07:06.100683,0 days 00:00:00.383752,98.21405930630787,0.5619072039603261,sigmoid,8,,34.0,20.0,,,,,,,,,,,,,COMPLETE
664,0.5881110587623675,2024-04-11 16:07:06.101683,2024-04-11 16:07:06.409795,0 days 00:00:00.308112,98.25335385918828,0.9579665517270459,sigmoid,0,,,,,,,,,,,,,,,,COMPLETE
665,0.5867358687757959,2024-04-11 16:07:06.410796,2024-04-11 16:07:06.738386,0 days 00:00:00.327590,97.59867495578584,1.328948124963092,sigmoid,0,,,,,,,,,,,,,,,,COMPLETE
666,0.381894306530841,2024-04-11 16:07:06.739386,2024-04-11 16:07:07.252064,0 days 00:00:00.512678,95.94643689595574,0.3756064260269506,sigmoid,57,29.0,17.0,43.0,6.0,6.0,36.0,,,,,,,,,197.0,COMPLETE
667,0.4064576821533699,2024-04-11 16:07:07.253064,2024-04-11 16:07:08.301429,0 days 00:00:01.048365,96.74747473173892,6.030335355196729,rbf,0,,,,,,,,,,,,,,,,COMPLETE
668,0.4489795918367347,2024-04-11 16:07:08.302436,2024-04-11 16:07:08.959051,0 days 00:00:00.656615,99.79940389469644,0.8193033787471395,sigmoid,63,16.0,32.0,11.0,7.0,7.0,74.0,7.0,39.0,4.958770097791764,8.118292405632864,3.913081934036307,3.0,37.0,56.0,48.0,COMPLETE
669,0.5902915485340632,2024-04-11 16:07:08.960049,2024-04-11 16:07:09.562928,0 days 00:00:00.602879,99.94200946553352,0.014839164263199978,sigmoid,18,,,,3.0,5.0,63.0,,,5.521211491653901,8.345195170953037,2.5170589702163255,4.0,46.0,69.0,,COMPLETE
670,0.0,2024-04-11 16:07:09.564028,2024-04-11 16:07:10.014120,0 days 00:00:00.450092,98.40896315447776,0.09037246045063967,sigmoid,18,,,,3.0,5.0,86.0,,,5.837905931855326,6.706061284791788,2.6353518363204693,4.0,48.0,69.0,,COMPLETE
671,0.36193536868416354,2024-04-11 16:07:10.015309,2024-04-11 16:07:10.499890,0 days 00:00:00.484581,96.14198079528981,0.24142715937206483,sigmoid,14,,8.0,33.0,,,,37.0,27.0,5.64409840735914,8.330803712322636,2.367035639136073,2.0,46.0,63.0,,COMPLETE
672,0.4994634370688333,2024-04-11 16:07:10.500891,2024-04-11 16:07:10.988116,0 days 00:00:00.487225,99.91765948733833,2.3975303532063466,sigmoid,28,,46.0,26.0,4.0,4.0,58.0,32.0,37.0,,,,,,,,COMPLETE
673,0.504690564521846,2024-04-11 16:07:10.989542,2024-04-11 16:07:11.440839,0 days 00:00:00.451297,93.00633852700959,0.3234872789826232,sigmoid,18,,,,3.0,5.0,62.0,,,6.892121246765637,7.130039647508303,1.9071439205148648,7.0,33.0,59.0,,COMPLETE
674,0.4211628515749979,2024-04-11 16:07:11.441840,2024-04-11 16:07:11.935228,0 days 00:00:00.493388,95.47208255048601,0.4220916498551441,sigmoid,18,,,,2.0,6.0,46.0,,,6.491837383448301,9.440889160667085,1.5130507879312831,6.0,47.0,72.0,,COMPLETE
675,0.4830740453487841,2024-04-11 16:07:11.936302,2024-04-11 16:07:12.413424,0 days 00:00:00.477122,97.68160697266532,1.9830781644804456,sigmoid,18,,,,3.0,4.0,67.0,,,3.617234723572728,7.942291203798901,2.7406780329286646,3.0,50.0,75.0,,COMPLETE
676,0.4051327650702152,2024-04-11 16:07:12.414427,2024-04-11 16:07:13.013580,0 days 00:00:00.599153,94.86257022084632,0.5770663959959598,sigmoid,62,8.0,43.0,5.0,2.0,3.0,81.0,20.0,13.0,4.228626880137341,9.099091132506565,3.4338632782802927,4.0,46.0,76.0,,COMPLETE
677,0.3338010664314638,2024-04-11 16:07:13.014582,2024-04-11 16:07:13.518072,0 days 00:00:00.503490,88.78063200003797,0.30091142649623026,sigmoid,46,33.0,37.0,24.0,,,,48.0,33.0,5.5616190432349395,7.511645553211051,0.7233417295886571,2.0,45.0,65.0,,COMPLETE
678,0.0,2024-04-11 16:07:13.519074,2024-04-11 16:07:13.834871,0 days 00:00:00.315797,99.89617471015963,0.09123573148999975,sigmoid,16,,,,4.0,5.0,70.0,,,,,,,,,,COMPLETE
679,0.283190230871971,2024-04-11 16:07:13.836394,2024-04-11 16:07:14.353509,0 days 00:00:00.517115,92.0241801619063,0.6611485194900825,sigmoid,42,31.0,27.0,31.0,,,,,,6.137098904292002,8.387609433053278,3.6440184944008713,5.0,41.0,66.0,,COMPLETE
680,0.4970290935776342,2024-04-11 16:07:14.354607,2024-04-11 16:07:14.903486,0 days 00:00:00.548879,97.65805561501641,1.5655665821163032,sigmoid,11,,47.0,50.0,,,,,,3.9884416634945037,9.817038374040328,3.0531914453173394,6.0,38.0,72.0,64.0,COMPLETE
681,0.5400221634984229,2024-04-11 16:07:14.904485,2024-04-11 16:07:15.519021,0 days 00:00:00.614536,93.87441528909281,1.8615100223155472,sigmoid,18,,,,1.0,6.0,39.0,,,7.4066059405889035,8.741870635359284,4.3636125817944595,4.0,44.0,58.0,,COMPLETE
682,0.03369740598237557,2024-04-11 16:07:15.521021,2024-04-11 16:07:15.891597,0 days 00:00:00.370576,96.44185508166785,0.12623279576141988,sigmoid,9,,24.0,15.0,,,,,,,,,,,,181.0,COMPLETE
683,0.3858577829166065,2024-04-11 16:07:15.892601,2024-04-11 16:07:16.321589,0 days 00:00:00.428988,99.93327481538526,0.8967163033825549,sigmoid,41,19.0,44.0,3.0,,,,,,,,,,,,157.0,COMPLETE
684,0.5025655834203336,2024-04-11 16:07:16.322587,2024-04-11 16:07:16.808885,0 days 00:00:00.486298,91.22807240344116,2.2457547490273027,sigmoid,20,,,,4.0,7.0,65.0,13.0,46.0,,,,,,,,COMPLETE
685,0.3261761435527779,2024-04-11 16:07:16.809884,2024-04-11 16:07:17.302881,0 days 00:00:00.492997,87.91267289195142,1.099423924646515,sigmoid,56,49.0,49.0,7.0,2.0,4.0,47.0,,,,,,,,,,COMPLETE
686,0.39487666701854396,2024-04-11 16:07:17.304017,2024-04-11 16:07:18.109790,0 days 00:00:00.805773,45.89882659734803,7.526535888231843,rbf,48,34.0,,,5.0,5.0,55.0,,,,,,,,,,COMPLETE
687,0.5876937898060764,2024-04-11 16:07:18.110790,2024-04-11 16:07:18.431645,0 days 00:00:00.320855,96.02103774055283,1.3739280048310403,sigmoid,0,,,,,,,,,,,,,,,,COMPLETE
688,0.5863711449328822,2024-04-11 16:07:18.432644,2024-04-11 16:07:18.801536,0 days 00:00:00.368892,93.58528967154936,0.7132867648631763,sigmoid,0,,,,,,,,,,,,,,,,COMPLETE
689,0.27236248119043643,2024-04-11 16:07:18.802538,2024-04-11 16:07:19.248397,0 days 00:00:00.445859,89.62829333953304,0.9905375117769306,sigmoid,10,,39.0,19.0,,,,,,4.790902245868383,7.276602394036856,2.026504250965266,5.0,39.0,68.0,,COMPLETE
690,0.5083543580711191,2024-04-11 16:07:19.249399,2024-04-11 16:07:19.729156,0 days 00:00:00.479757,98.07259204221924,0.0786823749174077,sigmoid,52,14.0,,,3.0,6.0,89.0,44.0,18.0,,,,,,,,COMPLETE
691,0.31772562488074796,2024-04-11 16:07:19.730232,2024-04-11 16:07:20.251167,0 days 00:00:00.520935,95.38448256013936,1.218049489428703,sigmoid,44,44.0,22.0,21.0,,,,40.0,22.0,,,,,,,,COMPLETE
692,0.4502372098987049,2024-04-11 16:07:20.252167,2024-04-11 16:07:20.811439,0 days 00:00:00.559272,93.03411182561065,0.5184417364246584,sigmoid,26,,10.0,35.0,1.0,3.0,77.0,,,3.291126329879723,7.67856131144565,0.9762579755544252,3.0,34.0,87.0,,COMPLETE
693,0.4442808051055474,2024-04-11 16:07:20.812546,2024-04-11 16:07:21.239887,0 days 00:00:00.427341,97.57432527904705,1.5134870581557403,sigmoid,12,,4.0,38.0,,,,35.0,10.0,,,,,,,,COMPLETE
694,0.3839433378873948,2024-04-11 16:07:21.240927,2024-04-11 16:07:21.666301,0 days 00:00:00.425374,91.20221124360872,0.8609121967731025,sigmoid,37,20.0,,,,,,9.0,5.0,,,,,,,163.0,COMPLETE
695,0.5868360544555274,2024-04-11 16:07:21.667413,2024-04-11 16:07:21.997223,0 days 00:00:00.329810,94.95784241969467,1.0270150777294063,sigmoid,0,,,,,,,,,,,,,,,,COMPLETE
696,0.39724009380073355,2024-04-11 16:07:21.998233,2024-04-11 16:07:22.587629,0 days 00:00:00.589396,99.98676262931865,1.7580866924138072,sigmoid,55,4.0,,,5.0,5.0,42.0,11.0,41.0,3.447558177340347,6.919832752442854,0.5332320380659035,2.0,40.0,70.0,95.0,COMPLETE
697,0.4610012597907653,2024-04-11 16:07:22.589630,2024-04-11 16:07:23.155266,0 days 00:00:00.565636,96.55599117252116,1.2912195354510736,sigmoid,59,36.0,36.0,29.0,4.0,4.0,83.0,,,5.084958435195017,8.530317759005026,2.479795905439996,7.0,43.0,79.0,61.0,COMPLETE
698,0.5225357921404583,2024-04-11 16:07:23.157316,2024-04-11 16:07:23.603468,0 days 00:00:00.446152,61.89053108580367,0.7360426116963665,sigmoid,13,,41.0,10.0,,,,24.0,44.0,,,,,,,110.0,COMPLETE
699,0.1957492829265999,2024-04-11 16:07:23.604526,2024-04-11 16:07:23.991761,0 days 00:00:00.387235,92.51444362500641,1.0932727971799332,sigmoid,36,2.0,,,,,,4.0,48.0,,,,,,,,COMPLETE
700,0.0,2024-04-11 16:07:23.992770,2024-04-11 16:07:24.516529,0 days 00:00:00.523759,89.39014664395856,0.0043577003867358854,sigmoid,0,,,,,,,,,,,,,,,,COMPLETE
701,0.14923988662715795,2024-04-11 16:07:24.517528,2024-04-11 16:07:24.946947,0 days 00:00:00.429419,98.18142167311696,0.5146326277265962,sigmoid,2,,,,,,,,,6.696449349075044,8.17748942130552,4.157199801632067,6.0,42.0,64.0,,COMPLETE
702,0.3818565400843882,2024-04-11 16:07:24.948641,2024-04-11 16:07:25.563569,0 days 00:00:00.614928,94.40387211457133,1.4608635097747062,sigmoid,23,,,,3.0,6.0,75.0,23.0,25.0,8.85446504815093,6.469460683843748,1.6961835723880758,4.0,35.0,83.0,192.0,COMPLETE
703,0.37143322475570034,2024-04-11 16:07:25.565563,2024-04-11 16:07:26.176122,0 days 00:00:00.610559,96.38582087803884,0.7973444971436842,sigmoid,54,18.0,,,2.0,7.0,52.0,36.0,19.0,5.402770213134897,6.133205471897007,5.217417846230587,3.0,36.0,73.0,,COMPLETE
704,0.38274362639980936,2024-04-11 16:07:26.177122,2024-04-11 16:07:26.667625,0 days 00:00:00.490503,92.0624233324031,1.256739067473374,sigmoid,60,7.0,13.0,18.0,2.0,3.0,73.0,43.0,2.0,,,,,,,,COMPLETE
705,0.5750692895288312,2024-04-11 16:07:26.668626,2024-04-11 16:07:27.109708,0 days 00:00:00.441082,87.74432450409923,0.9664952893023265,sigmoid,32,10.0,,,,,,,,,,,,,,,COMPLETE
706,0.38042839922109234,2024-04-11 16:07:27.110707,2024-04-11 16:07:28.000421,0 days 00:00:00.889714,97.9670269096861,2.1190967844427977,rbf,0,,,,,,,,,,,,,,,,COMPLETE
707,0.5003112782329358,2024-04-11 16:07:28.001431,2024-04-11 16:07:28.588019,0 days 00:00:00.586588,94.27681006723846,1.6442184208669557,sigmoid,30,,45.0,23.0,1.0,6.0,68.0,18.0,11.0,3.8050491296590327,9.00787220141898,1.1520888247179384,2.0,46.0,85.0,,COMPLETE
708,0.5865019492683915,2024-04-11 16:07:28.590019,2024-04-11 16:07:28.935269,0 days 00:00:00.345250,96.1612142598322,1.1165437835402179,sigmoid,0,,,,,,,,,,,,,,,,COMPLETE
709,0.5346851010811463,2024-04-11 16:07:28.935358,2024-04-11 16:07:29.293265,0 days 00:00:00.357907,90.62842708066609,6.526982566868159,sigmoid,5,,,,,,,12.0,17.0,,,,,,,88.0,COMPLETE
710,0.32681111356769105,2024-04-11 16:07:29.294266,2024-04-11 16:07:29.777076,0 days 00:00:00.482810,93.2835060793741,8.834186532455718,sigmoid,7,,,,,,,16.0,15.0,7.715027377847887,5.413263761660398,4.58691381435932,8.0,49.0,81.0,119.0,COMPLETE
711,0.49163871699182765,2024-04-11 16:07:29.778218,2024-04-11 16:07:30.343258,0 days 00:00:00.565040,98.12988797014606,0.6535350820716122,sigmoid,27,,50.0,44.0,3.0,4.0,59.0,,,4.538639509937903,9.660786941581987,3.2985525265856426,9.0,32.0,67.0,26.0,COMPLETE
712,0.5493529466530119,2024-04-11 16:07:30.344257,2024-04-11 16:07:30.800000,0 days 00:00:00.455743,95.2213065747156,0.8762897113137371,sigmoid,34,42.0,,,,,,,,3.100073260157412,7.362975324925454,2.2408527778467984,6.0,37.0,60.0,,COMPLETE
713,0.5877770482494277,2024-04-11 16:07:30.801001,2024-04-11 16:07:31.135564,0 days 00:00:00.334563,99.92613267011819,1.3487686109637889,sigmoid,0,,,,,,,,,,,,,,,,COMPLETE
714,0.3725131488680539,2024-04-11 16:07:31.137541,2024-04-11 16:07:31.522094,0 days 00:00:00.384553,84.60868941328681,1.0945704508681797,sigmoid,33,6.0,,,,,,,,,,,,,,132.0,COMPLETE
715,0.10504933255948928,2024-04-11 16:07:31.523094,2024-04-11 16:07:31.906215,0 days 00:00:00.383121,89.94932001456277,0.4249796715408788,sigmoid,0,,,,,,,,,,,,,,,,COMPLETE
716,0.3518222839291912,2024-04-11 16:07:31.907215,2024-04-11 16:07:32.409204,0 days 00:00:00.501989,96.77040203069227,0.86106026292893,sigmoid,40,39.0,38.0,41.0,,,,,,,,,,,,,COMPLETE
717,0.5873516489526552,2024-04-11 16:07:32.410206,2024-04-11 16:07:32.744471,0 days 00:00:00.334265,92.7150128833901,1.4725219261073628,sigmoid,0,,,,,,,,,,,,,,,,COMPLETE
718,0.48757243752263674,2024-04-11 16:07:32.745471,2024-04-11 16:07:33.251118,0 days 00:00:00.505647,18.124731564755194,1.2246457066744076,sigmoid,19,,,,4.0,5.0,64.0,,,2.472839703142264,7.833281170598796,2.808630960215078,5.0,42.0,77.0,148.0,COMPLETE
719,0.4550493729932755,2024-04-11 16:07:33.252126,2024-04-11 16:07:33.773009,0 days 00:00:00.520883,94.67128228855253,0.626670964102308,sigmoid,61,22.0,15.0,27.0,5.0,2.0,50.0,2.0,31.0,,,,,,,177.0,COMPLETE
720,0.4929641398093509,2024-04-11 16:07:33.774010,2024-04-11 16:07:34.276022,0 days 00:00:00.502012,87.16617043697815,0.9934568110620342,sigmoid,45,24.0,7.0,46.0,,,,45.0,29.0,,,,,,,136.0,COMPLETE
721,0.3889174711739249,2024-04-11 16:07:34.277116,2024-04-11 16:07:34.955996,0 days 00:00:00.678880,97.9184255344776,1.2140379183587595,sigmoid,58,32.0,31.0,16.0,3.0,8.0,40.0,,,5.973229704514863,4.590716004430398,4.861179261181975,7.0,50.0,86.0,,COMPLETE
722,0.5663851724068762,2024-04-11 16:07:34.957182,2024-04-11 16:07:35.327219,0 days 00:00:00.370037,91.48822118727621,4.479243419196137,sigmoid,0,,,,,,,,,,,,,,,,COMPLETE
723,0.574918874371169,2024-04-11 16:07:35.329237,2024-04-11 16:07:35.702398,0 days 00:00:00.373161,96.13593885198605,0.8448431545681423,sigmoid,4,,,,,,,47.0,40.0,,,,,,,,COMPLETE
724,0.4476631794405277,2024-04-11 16:07:35.703395,2024-04-11 16:07:36.235080,0 days 00:00:00.531685,93.66649175782463,0.3431345414263387,sigmoid,51,12.0,,,4.0,4.0,71.0,,,7.175073575058783,6.665043016095222,4.026884025990767,10.0,39.0,80.0,38.0,COMPLETE
725,0.38381235115649365,2024-04-11 16:07:36.237166,2024-04-11 16:07:36.993258,0 days 00:00:00.756092,96.8632201680071,1.4032036567147692,rbf,0,,,,,,,,,,,,,,,,COMPLETE
726,0.49909180435496225,2024-04-11 16:07:36.994259,2024-04-11 16:07:37.523638,0 days 00:00:00.529379,89.51777278663978,1.6483201524792526,sigmoid,18,,,,5.0,7.0,80.0,,,2.7961351194092763,6.017008605761816,1.3047179069812678,3.0,31.0,70.0,,COMPLETE
727,0.3873363544813696,2024-04-11 16:07:37.524845,2024-04-11 16:07:38.037933,0 days 00:00:00.513088,98.42971901983913,1.0494314406869372,sigmoid,53,38.0,,,1.0,5.0,44.0,6.0,36.0,,,,,,,142.0,COMPLETE
728,0.521783605337797,2024-04-11 16:07:38.038933,2024-04-11 16:07:38.557301,0 days 00:00:00.518368,99.85622725008417,0.7192160034321271,sigmoid,43,27.0,21.0,6.0,,,,,,1.394996449406055,9.407127489483685,3.7849315109085717,4.0,48.0,76.0,185.0,COMPLETE
729,0.5258433787182378,2024-04-11 16:07:38.558303,2024-04-11 16:07:39.146611,0 days 00:00:00.588308,94.97976211425977,1.2383149336731742,sigmoid,50,37.0,,,2.0,3.0,24.0,,,4.125370957486735,6.318864913284591,3.016803763169708,8.0,33.0,74.0,,COMPLETE
