number,value,datetime_start,datetime_complete,duration,params_C,params_gamma,params_kernel,params_mask_number,params_rsi_window,params_so_smooth,params_so_window,params_srsi_smooth1,params_srsi_smooth2,params_srsi_window,params_tsi_window_fast,params_tsi_window_slow,params_ult_weight_1,params_ult_weight_2,params_ult_weight_3,params_ult_window_1,params_ult_window_2,params_ult_window_3,params_williams_lbp,state
3432,0.4874764341502828,2024-04-11 16:46:39.307592,2024-04-11 16:46:40.679138,0 days 00:00:01.371546,62.65870338903929,8.129494048068809,sigmoid,62,29.0,25.0,31.0,5.0,2.0,32.0,12.0,31.0,0.8653701304915371,9.748181293467747,7.896633684862945,19.0,38.0,86.0,,COMPLETE
3433,0.49391357995396623,2024-04-11 16:46:40.683704,2024-04-11 16:46:41.740502,0 days 00:00:01.056798,98.25743065069997,8.381575234124854,sigmoid,56,10.0,24.0,29.0,4.0,1.0,40.0,,,,,,,,,,COMPLETE
3434,0.5929369437606513,2024-04-11 16:46:41.740502,2024-04-11 16:46:42.562264,0 days 00:00:00.821762,93.87479128339248,7.477830190777222,sigmoid,8,,23.0,33.0,,,,,,,,,,,,,COMPLETE
3435,0.44701971028259324,2024-04-11 16:46:42.562264,2024-04-11 16:46:43.369428,0 days 00:00:00.807164,99.99288984619179,7.750657873457932,sigmoid,8,,25.0,30.0,,,,,,,,,,,,,COMPLETE
3436,0.45599861002519326,2024-04-11 16:46:43.369428,2024-04-11 16:46:44.664012,0 days 00:00:01.294584,96.78584795840837,8.634789675289229,sigmoid,59,15.0,27.0,31.0,1.0,8.0,100.0,,,8.67471352306022,8.748258216354852,6.165269802206354,20.0,41.0,93.0,112.0,COMPLETE
3437,0.14418002588867868,2024-04-11 16:46:44.664012,2024-04-11 16:46:45.653785,0 days 00:00:00.989773,98.27274409455464,8.012837063367645,sigmoid,20,,,,7.0,6.0,27.0,25.0,33.0,,,,,,,,COMPLETE
3438,0.5008190189481141,2024-04-11 16:46:45.653785,2024-04-11 16:46:46.515362,0 days 00:00:00.861577,95.43471492284975,8.831814094677236,sigmoid,48,28.0,,,3.0,5.0,71.0,,,,,,,,,,COMPLETE
3439,0.5963643249384587,2024-04-11 16:46:46.515362,2024-04-11 16:46:47.380746,0 days 00:00:00.865384,70.08961258115994,8.227218370785668,sigmoid,8,,26.0,32.0,,,,,,,,,,,,,COMPLETE
3440,0.6009432182607054,2024-04-11 16:46:47.380746,2024-04-11 16:46:48.218768,0 days 00:00:00.838022,96.77272829873158,7.906747072675879,sigmoid,8,,25.0,31.0,,,,,,,,,,,,,COMPLETE
3441,0.5035738520696674,2024-04-11 16:46:48.218768,2024-04-11 16:46:49.172689,0 days 00:00:00.953921,98.16482156214663,8.429852513872685,sigmoid,44,39.0,28.0,30.0,,,,21.0,4.0,,,,,,,,COMPLETE
3442,0.5929369437606513,2024-04-11 16:46:49.172689,2024-04-11 16:46:50.015265,0 days 00:00:00.842576,99.96525738990105,8.13158701170705,sigmoid,8,,24.0,33.0,,,,,,,,,,,,,COMPLETE
3443,0.36548428350272594,2024-04-11 16:46:50.023719,2024-04-11 16:46:51.365752,0 days 00:00:01.342033,94.0424065841017,7.80290650856487,sigmoid,55,32.0,,,2.0,7.0,15.0,18.0,42.0,3.9376020074473743,7.002959740712344,5.642116997399424,16.0,40.0,69.0,175.0,COMPLETE
3444,0.5124529971245301,2024-04-11 16:46:51.365752,2024-04-11 16:46:52.328485,0 days 00:00:00.962733,99.98892287153843,7.612451953883452,sigmoid,12,,26.0,29.0,,,,2.0,16.0,,,,,,,,COMPLETE
3445,0.37153393869811785,2024-04-11 16:46:52.328485,2024-04-11 16:46:53.294852,0 days 00:00:00.966367,99.94732145054296,8.300877054085287,sigmoid,13,,21.0,32.0,,,,13.0,38.0,,,,,,,85.0,COMPLETE
3446,0.44388761529029164,2024-04-11 16:46:53.300580,2024-04-11 16:46:54.546109,0 days 00:00:01.245529,91.95522335412772,8.026606901664538,sigmoid,23,,,,8.0,3.0,87.0,40.0,46.0,5.677537671865539,3.2304451559953327,9.62198249244192,5.0,25.0,91.0,135.0,COMPLETE
3447,0.4663265831916319,2024-04-11 16:46:54.548280,2024-04-11 16:46:55.679168,0 days 00:00:01.130888,43.53180541609808,8.610942495148855,sigmoid,60,50.0,20.0,36.0,6.0,4.0,82.0,42.0,44.0,,,,,,,,COMPLETE
3448,0.4041566472002749,2024-04-11 16:46:55.679168,2024-04-11 16:46:56.922271,0 days 00:00:01.243103,99.95515075433008,9.10585535307191,rbf,36,7.0,,,,,,36.0,6.0,,,,,,,,COMPLETE
3449,0.4502698896972542,2024-04-11 16:46:56.922271,2024-04-11 16:46:57.784615,0 days 00:00:00.862344,96.54716829022115,8.220261774201711,sigmoid,8,,27.0,30.0,,,,,,,,,,,,,COMPLETE
3450,0.5883953883953884,2024-04-11 16:46:57.786402,2024-04-11 16:46:58.633005,0 days 00:00:00.846603,99.95143049968658,7.304828917794466,sigmoid,8,,23.0,34.0,,,,,,,,,,,,,COMPLETE
3451,0.44156034251421045,2024-04-11 16:46:58.633005,2024-04-11 16:46:59.374277,0 days 00:00:00.741272,96.86742058695816,7.989660335362362,sigmoid,1,,,,,,,,,,,,,,,15.0,COMPLETE
3452,0.44209341895823046,2024-04-11 16:46:59.374277,2024-04-11 16:47:00.685308,0 days 00:00:01.311031,94.80854517795854,7.768702403380142,sigmoid,54,26.0,,,4.0,6.0,66.0,26.0,19.0,2.1407512481818167,5.843459914166914,2.142166169907738,14.0,27.0,74.0,,COMPLETE
3453,0.41433734939759037,2024-04-11 16:47:00.685308,2024-04-11 16:47:02.083738,0 days 00:00:01.398430,97.84338920551062,8.462685318230116,sigmoid,30,,24.0,31.0,1.0,2.0,36.0,30.0,8.0,2.3241557271031414,6.138561016754526,9.418939716266884,17.0,29.0,100.0,,COMPLETE
3454,0.5136469556791177,2024-04-11 16:47:02.083738,2024-04-11 16:47:03.214361,0 days 00:00:01.130623,98.0694720222741,8.14891111404659,sigmoid,7,,,,,,,6.0,12.0,8.319900629943017,2.762262495011801,8.914095902960623,7.0,49.0,77.0,51.0,COMPLETE
3455,0.557214219330855,2024-04-11 16:47:03.220170,2024-04-11 16:47:04.158599,0 days 00:00:00.938429,95.36400346276581,7.525814294664095,sigmoid,40,49.0,32.0,32.0,,,,,,,,,,,,,COMPLETE
3456,0.4513179767276182,2024-04-11 16:47:04.158599,2024-04-11 16:47:05.041690,0 days 00:00:00.883091,99.98369039872873,6.991865709172882,sigmoid,8,,25.0,28.0,,,,,,,,,,,,,COMPLETE
3457,0.5325378501522179,2024-04-11 16:47:05.041690,2024-04-11 16:47:05.873033,0 days 00:00:00.831343,98.18447262825896,7.914586048849961,sigmoid,4,,,,,,,38.0,41.0,,,,,,,,COMPLETE
3458,0.38574870274277245,2024-04-11 16:47:05.881089,2024-04-11 16:47:06.900091,0 days 00:00:01.019002,27.906957897267986,8.322295355653006,sigmoid,52,16.0,,,2.0,5.0,2.0,45.0,15.0,,,,,,,,COMPLETE
3459,0.47496268477057146,2024-04-11 16:47:06.909015,2024-04-11 16:47:08.099185,0 days 00:00:01.190170,96.69913576381535,8.077581660927274,sigmoid,61,35.0,22.0,30.0,5.0,8.0,20.0,4.0,13.0,,,,,,,116.0,COMPLETE
3460,0.576003346002073,2024-04-11 16:47:08.107258,2024-04-11 16:47:08.863574,0 days 00:00:00.756316,93.88232957143657,7.692036595009553,sigmoid,32,11.0,,,,,,,,,,,,,,,COMPLETE
3461,0.3115556745591554,2024-04-11 16:47:08.863574,2024-04-11 16:47:09.737560,0 days 00:00:00.873986,36.61881794202811,8.474611251983447,sigmoid,5,,,,,,,10.0,21.0,,,,,,,71.0,COMPLETE
3462,0.30647271607788806,2024-04-11 16:47:09.737560,2024-04-11 16:47:10.732628,0 days 00:00:00.995068,98.10482450644288,8.258491104659052,sigmoid,34,14.0,,,,,,,,6.176936186980751,7.259188742491435,6.57187876446906,6.0,30.0,58.0,,COMPLETE
3463,0.5952371952371952,2024-04-11 16:47:10.741229,2024-04-11 16:47:11.587577,0 days 00:00:00.846348,95.59836815931209,7.982509215721726,sigmoid,8,,26.0,32.0,,,,,,,,,,,,,COMPLETE
3464,0.5413951500908023,2024-04-11 16:47:11.587577,2024-04-11 16:47:12.464841,0 days 00:00:00.877264,19.621843153249763,7.806330436858638,sigmoid,33,30.0,,,,,,,,,,,,,,65.0,COMPLETE
3465,0.6009432182607054,2024-04-11 16:47:12.464841,2024-04-11 16:47:13.288219,0 days 00:00:00.823378,98.34285865207661,8.115776229567507,sigmoid,8,,27.0,31.0,,,,,,,,,,,,,COMPLETE
3466,0.07949928626331391,2024-04-11 16:47:13.296255,2024-04-11 16:47:14.679938,0 days 00:00:01.383683,96.66871092283861,7.651573241859972,rbf,53,13.0,,,3.0,1.0,91.0,32.0,29.0,,,,,,,130.0,COMPLETE
3467,0.43803971178703044,2024-04-11 16:47:14.688697,2024-04-11 16:47:16.058282,0 days 00:00:01.369585,98.38451410439689,8.560693520685511,sigmoid,27,,29.0,33.0,7.0,2.0,29.0,,,7.938407328863779,6.716692946997018,2.9240290589469753,15.0,34.0,94.0,25.0,COMPLETE
3468,0.49084470741164077,2024-04-11 16:47:16.058282,2024-04-11 16:47:17.274632,0 days 00:00:01.216350,92.58842462758993,8.337628072682895,sigmoid,51,9.0,,,8.0,3.0,6.0,,,4.506676804970573,8.994976142800697,4.65217808540441,9.0,47.0,79.0,123.0,COMPLETE
3469,0.4448341684562156,2024-04-11 16:47:17.274632,2024-04-11 16:47:18.116235,0 days 00:00:00.841603,99.93283900232352,8.88092049158458,sigmoid,8,,24.0,30.0,,,,,,,,,,,,,COMPLETE
3470,0.5942174967356836,2024-04-11 16:47:18.116235,2024-04-11 16:47:18.956256,0 days 00:00:00.840021,95.29987671140488,3.9629657340224558,sigmoid,8,,25.0,31.0,,,,,,,,,,,,,COMPLETE
3471,0.5280250541624659,2024-04-11 16:47:18.956256,2024-04-11 16:47:19.885730,0 days 00:00:00.929474,96.72245539264965,7.9048821518406625,sigmoid,17,,,,3.0,7.0,44.0,,,,,,,,,105.0,COMPLETE
3472,0.12622036262203626,2024-04-11 16:47:19.893719,2024-04-11 16:47:20.723828,0 days 00:00:00.830109,99.98968126775301,7.419792276794867,sigmoid,8,,26.0,29.0,,,,,,,,,,,,,COMPLETE
3473,0.4884181870283694,2024-04-11 16:47:20.724304,2024-04-11 16:47:21.903454,0 days 00:00:01.179150,98.11828279763235,8.130146266081795,sigmoid,19,,,,6.0,8.0,74.0,,,7.156460196058156,3.6456676845207614,1.4421331002539146,11.0,37.0,87.0,91.0,COMPLETE
3474,0.45944101752279054,2024-04-11 16:47:21.903454,2024-04-11 16:47:23.039738,0 days 00:00:01.136284,99.97780518580765,7.847671189876363,sigmoid,18,,,,1.0,6.0,56.0,,,1.3793241184831175,2.3531430593907743,4.412485991806939,19.0,22.0,51.0,,COMPLETE
3475,0.43309584621588926,2024-04-11 16:47:23.039738,2024-04-11 16:47:24.355640,0 days 00:00:01.315902,93.95674882706179,8.269731974581847,sigmoid,58,5.0,23.0,32.0,5.0,1.0,85.0,,,5.928474831776773,7.837637537506163,1.9798699278902254,8.0,21.0,63.0,,COMPLETE
3476,0.5895095625828441,2024-04-11 16:47:24.355640,2024-04-11 16:47:25.267067,0 days 00:00:00.911427,99.98562227763993,8.079320220302145,sigmoid,8,,28.0,34.0,,,,,,,,,,,,,COMPLETE
3477,0.5035927709094429,2024-04-11 16:47:25.267067,2024-04-11 16:47:26.337126,0 days 00:00:01.070059,96.58610216939543,7.59522913412818,sigmoid,25,,25.0,31.0,7.0,4.0,13.0,,,,,,,,,178.0,COMPLETE
3478,0.35995394599120784,2024-04-11 16:47:26.345147,2024-04-11 16:47:27.553294,0 days 00:00:01.208147,98.09746499887967,8.434814811775778,sigmoid,43,4.0,26.0,27.0,,,,,,1.8404279070318625,1.3617491233258638,3.964961158294764,10.0,44.0,92.0,97.0,COMPLETE
3479,0.40253793825222395,2024-04-11 16:47:27.560858,2024-04-11 16:47:28.704697,0 days 00:00:01.143839,96.49601907187785,7.950158637884715,sigmoid,50,41.0,,,2.0,5.0,79.0,,,3.323236831268991,4.883159179899668,0.8058506714568621,18.0,23.0,53.0,,COMPLETE
3480,0.38530157121135333,2024-04-11 16:47:28.704697,2024-04-11 16:47:29.765636,0 days 00:00:01.060939,95.1736318061686,8.705060332761713,sigmoid,45,34.0,27.0,30.0,,,,29.0,26.0,,,,,,,154.0,COMPLETE
3481,0.4492662702525776,2024-04-11 16:47:29.765636,2024-04-11 16:47:30.917372,0 days 00:00:01.151736,98.2105647887444,8.222743585457858,sigmoid,29,,24.0,33.0,4.0,3.0,49.0,43.0,2.0,,,,,,,48.0,COMPLETE
3482,0.36285302289593074,2024-04-11 16:47:30.917372,2024-04-11 16:47:31.901867,0 days 00:00:00.984495,91.3432496405028,7.744335872775733,sigmoid,49,43.0,,,3.0,7.0,59.0,,,,,,,,,197.0,COMPLETE
3483,0.12622036262203626,2024-04-11 16:47:31.901867,2024-04-11 16:47:32.740062,0 days 00:00:00.838195,96.93190082955955,8.04311790268203,sigmoid,8,,22.0,29.0,,,,,,,,,,,,,COMPLETE
3484,0.2891027432815557,2024-04-11 16:47:32.748559,2024-04-11 16:47:33.785174,0 days 00:00:01.036615,93.77666407978548,8.402215615507751,sigmoid,6,,,,,,,23.0,11.0,6.727454063724544,8.112965437843188,9.167329086443413,13.0,28.0,70.0,,COMPLETE
3485,0.4615473775717184,2024-04-11 16:47:33.785174,2024-04-11 16:47:35.467286,0 days 00:00:01.682112,97.90982700466358,7.172190049294563,rbf,8,,25.0,32.0,,,,,,,,,,,,,COMPLETE
3486,0.6009432182607054,2024-04-11 16:47:35.469466,2024-04-11 16:47:36.294931,0 days 00:00:00.825465,98.15811170413934,7.8812470263789445,sigmoid,8,,31.0,31.0,,,,,,,,,,,,,COMPLETE
3487,0.4975578627003412,2024-04-11 16:47:36.294931,2024-04-11 16:47:37.455886,0 days 00:00:01.160955,95.46269427415133,8.220008101277624,sigmoid,39,17.0,,,,,,15.0,34.0,9.496391514629432,0.6784656372969744,6.815237059477549,12.0,39.0,83.0,42.0,COMPLETE
3488,0.502357911283588,2024-04-11 16:47:37.465829,2024-04-11 16:47:38.766874,0 days 00:00:01.301045,99.94050705757226,7.528581783977403,sigmoid,47,32.0,26.0,29.0,,,,39.0,35.0,5.457877567879014,4.011880607699173,8.41954026404019,2.0,48.0,76.0,187.0,COMPLETE
3489,0.27312738399631137,2024-04-11 16:47:38.766874,2024-04-11 16:47:39.743181,0 days 00:00:00.976307,98.15202912065256,8.570522572901181,sigmoid,3,,,,,,,,,1.0897876972282763,8.627204674598918,3.34215684095175,17.0,45.0,85.0,140.0,COMPLETE
3490,0.6009432182607054,2024-04-11 16:47:39.743181,2024-04-11 16:47:40.564370,0 days 00:00:00.821189,99.98741943945059,8.034127954898086,sigmoid,8,,28.0,31.0,,,,,,,,,,,,,COMPLETE
3491,0.49653658871133677,2024-04-11 16:47:40.564370,2024-04-11 16:47:41.799689,0 days 00:00:01.235319,99.97136616170647,7.698102346493557,sigmoid,22,,,,6.0,6.0,10.0,47.0,39.0,1.6055285092843246,0.9567760076810305,5.160761592931874,7.0,50.0,55.0,,COMPLETE
3492,0.5351358299768618,2024-04-11 16:47:41.799689,2024-04-11 16:47:42.834611,0 days 00:00:01.034922,95.37408312957892,8.35167892464023,sigmoid,35,37.0,,,,,,,,7.6692067672322475,2.9522634118644793,0.5093605944069575,16.0,46.0,98.0,146.0,COMPLETE
3493,0.3858246735944577,2024-04-11 16:47:42.843535,2024-04-11 16:47:44.032920,0 days 00:00:01.189385,57.1873324707477,7.88688982172337,sigmoid,38,18.0,,,,,,7.0,47.0,8.904759702055394,9.205393255832956,5.922569201794503,14.0,35.0,67.0,,COMPLETE
3494,0.5963643249384587,2024-04-11 16:47:44.040738,2024-04-11 16:47:44.872295,0 days 00:00:00.831557,96.40511082221391,8.154047746124693,sigmoid,8,,24.0,32.0,,,,,,,,,,,,,COMPLETE
3495,0.4894615445796548,2024-04-11 16:47:44.872430,2024-04-11 16:47:45.900350,0 days 00:00:01.027920,99.98282368347957,7.349474616568408,sigmoid,24,,27.0,30.0,8.0,4.0,64.0,,,,,,,,,,COMPLETE
3496,0.4891423925001196,2024-04-11 16:47:45.900350,2024-04-11 16:47:47.162471,0 days 00:00:01.262121,93.36878569367741,7.747951195955132,sigmoid,15,,25.0,33.0,,,,14.0,10.0,9.985592293780165,4.4916898784275086,7.2555261606649255,4.0,26.0,50.0,171.0,COMPLETE
3497,0.49924669123612164,2024-04-11 16:47:47.162471,2024-04-11 16:47:48.198839,0 days 00:00:01.036368,99.99437519658602,8.041806066249604,sigmoid,21,,,,5.0,8.0,42.0,50.0,24.0,,,,,,,79.0,COMPLETE
3498,0.4448341684562156,2024-04-11 16:47:48.198839,2024-04-11 16:47:49.003905,0 days 00:00:00.805066,96.80320125462114,8.554202098415157,sigmoid,8,,24.0,30.0,,,,,,,,,,,,,COMPLETE
3499,0.43277634254933206,2024-04-11 16:47:49.011835,2024-04-11 16:47:50.123806,0 days 00:00:01.111971,96.82090979386606,8.254199825644527,sigmoid,57,21.0,23.0,35.0,4.0,2.0,24.0,,,,,,,,,58.0,COMPLETE
3500,0.48130912810023013,2024-04-11 16:47:50.123806,2024-04-11 16:47:51.215552,0 days 00:00:01.091746,98.12305792728021,7.930157719669844,sigmoid,28,,26.0,31.0,2.0,3.0,8.0,20.0,22.0,,,,,,,,COMPLETE
3501,0.5259574098972113,2024-04-11 16:47:51.215552,2024-04-11 16:47:52.098245,0 days 00:00:00.882693,94.91935669688482,8.414803619089877,sigmoid,9,,23.0,28.0,,,,,,,,,,,,165.0,COMPLETE
3502,0.5963643249384587,2024-04-11 16:47:52.098245,2024-04-11 16:47:52.929071,0 days 00:00:00.830826,98.03097041422181,8.157147330936265,sigmoid,8,,27.0,32.0,,,,,,,,,,,,,COMPLETE
3503,0.41691165328080004,2024-04-11 16:47:52.929071,2024-04-11 16:47:54.416648,0 days 00:00:01.487577,98.09447837193163,3.2866983454376966,sigmoid,31,,25.0,30.0,1.0,1.0,46.0,33.0,32.0,3.7272227372414446,2.5817349621736883,3.6207613083381913,3.0,32.0,60.0,159.0,COMPLETE
3504,0.05413003170046057,2024-04-11 16:47:54.423583,2024-04-11 16:47:56.200518,0 days 00:00:01.776935,95.2908470360191,7.609866271589537,rbf,63,8.0,28.0,31.0,7.0,5.0,61.0,16.0,17.0,2.7361740954032734,2.1995165561462646,1.0111113659416953,5.0,20.0,90.0,75.0,COMPLETE
3505,0.5150938026750728,2024-04-11 16:47:56.200518,2024-04-11 16:47:57.548729,0 days 00:00:01.348211,91.89839984429972,7.788442363896308,sigmoid,14,,25.0,33.0,,,,27.0,37.0,8.51350969606854,9.588737502944497,6.328573283413731,6.0,42.0,97.0,,COMPLETE
3506,0.12622036262203626,2024-04-11 16:47:57.556736,2024-04-11 16:47:58.403196,0 days 00:00:00.846460,98.19393148029943,8.017657164271606,sigmoid,8,,26.0,29.0,,,,,,,,,,,,,COMPLETE
3507,0.40982874637242084,2024-04-11 16:47:58.403196,2024-04-11 16:47:59.232196,0 days 00:00:00.829000,96.8999909469602,8.702331730317455,sigmoid,16,,,,6.0,7.0,69.0,,,,,,,,,,COMPLETE
3508,0.46119168953351625,2024-04-11 16:47:59.232196,2024-04-11 16:48:00.699003,0 days 00:00:01.466807,98.21649651060919,8.289871374494378,sigmoid,62,46.0,24.0,32.0,8.0,4.0,89.0,24.0,30.0,4.891476432331277,5.312232548039478,2.4779240046345667,11.0,38.0,89.0,,COMPLETE
3509,0.3944476028046239,2024-04-11 16:48:00.699003,2024-04-11 16:48:02.001170,0 days 00:00:01.302167,93.71267182071259,7.876927877472314,sigmoid,46,12.0,22.0,34.0,,,,36.0,27.0,5.120587354859542,9.413797635669688,4.974394203738432,9.0,48.0,95.0,,COMPLETE
3510,0.5986580986580987,2024-04-11 16:48:02.009528,2024-04-11 16:48:02.841409,0 days 00:00:00.831881,99.94262064316717,7.503033619610331,sigmoid,8,,27.0,31.0,,,,,,,,,,,,,COMPLETE
3511,0.34784083201446975,2024-04-11 16:48:02.841409,2024-04-11 16:48:03.867427,0 days 00:00:01.026018,95.65852728076216,8.132132129778462,sigmoid,41,38.0,25.0,30.0,,,,,,,,,,,,134.0,COMPLETE
3512,0.512464608797735,2024-04-11 16:48:03.867427,2024-04-11 16:48:05.093877,0 days 00:00:01.226450,98.13195811592617,8.431679200516607,sigmoid,42,27.0,21.0,29.0,,,,,,7.419132620917528,5.0926410472397,1.7470243414809086,10.0,43.0,71.0,,COMPLETE
3513,0.5952371952371952,2024-04-11 16:48:05.093877,2024-04-11 16:48:05.935159,0 days 00:00:00.841282,96.61404463845714,7.976430312462749,sigmoid,8,,29.0,32.0,,,,,,,,,,,,,COMPLETE
3514,0.477183395647589,2024-04-11 16:48:05.935159,2024-04-11 16:48:07.210618,0 days 00:00:01.275459,98.27415770195256,7.699967735788806,sigmoid,26,,26.0,31.0,5.0,1.0,38.0,,,6.918807921511684,3.463719862912936,4.1959746946930885,12.0,24.0,73.0,,COMPLETE
3515,0.374395366598778,2024-04-11 16:48:07.210618,2024-04-11 16:48:08.385509,0 days 00:00:01.174891,99.94648193071662,8.232614544468845,sigmoid,11,,24.0,33.0,,,,,,4.245890216740847,4.182579928892575,7.7343338690984185,18.0,39.0,59.0,68.0,COMPLETE
3516,0.45345352376492626,2024-04-11 16:48:08.385509,2024-04-11 16:48:09.209001,0 days 00:00:00.823492,95.25129852398865,8.597224677672765,sigmoid,8,,23.0,30.0,,,,,,,,,,,,,COMPLETE
3517,0.2232341919263792,2024-04-11 16:48:09.209001,2024-04-11 16:48:10.313540,0 days 00:00:01.104539,93.81692604703343,8.066096324519584,sigmoid,10,,26.0,32.0,,,,,,2.379311475357371,1.5052587660138697,8.776815517930496,20.0,29.0,99.0,,COMPLETE
3518,0.45347172512526845,2024-04-11 16:48:10.317754,2024-04-11 16:48:11.135540,0 days 00:00:00.817786,96.73717628952404,7.808397790888393,sigmoid,8,,28.0,28.0,,,,,,,,,,,,,COMPLETE
3519,0.44746600741656367,2024-04-11 16:48:11.143611,2024-04-11 16:48:12.189528,0 days 00:00:01.045917,98.08597012278375,6.898977921251894,sigmoid,56,20.0,24.0,31.0,4.0,6.0,94.0,,,,,,,,,,COMPLETE
3520,0.5005693834390759,2024-04-11 16:48:12.189876,2024-04-11 16:48:13.153063,0 days 00:00:00.963187,99.95208726249378,8.32110087478622,sigmoid,37,24.0,,,,,,44.0,3.0,,,,,,,37.0,COMPLETE
3521,0.12622036262203626,2024-04-11 16:48:13.153063,2024-04-11 16:48:14.015741,0 days 00:00:00.862678,98.11694067248933,9.786902860004929,sigmoid,8,,25.0,29.0,,,,,,,,,,,,,COMPLETE
3522,0.3720893457204982,2024-04-11 16:48:14.018805,2024-04-11 16:48:15.420626,0 days 00:00:01.401821,95.27121806733344,7.952234284244279,rbf,48,22.0,,,2.0,8.0,77.0,,,,,,,,,,COMPLETE
3523,0.3995346617348765,2024-04-11 16:48:15.421515,2024-04-11 16:48:16.433554,0 days 00:00:01.012039,76.551206471797,7.394981390009915,sigmoid,52,19.0,,,3.0,2.0,35.0,11.0,7.0,,,,,,,,COMPLETE
3524,0.5314519911098424,2024-04-11 16:48:16.433554,2024-04-11 16:48:17.437341,0 days 00:00:01.003787,96.73925039133759,8.19833619300734,sigmoid,2,,,,,,,,,8.198033339788232,5.545521748883493,5.445532828891261,19.0,31.0,82.0,,COMPLETE
3525,0.5929369437606513,2024-04-11 16:48:17.437341,2024-04-11 16:48:18.266587,0 days 00:00:00.829246,91.32843199983516,8.472330530642708,sigmoid,8,,26.0,33.0,,,,,,,,,,,,,COMPLETE
3526,0.5138533128415301,2024-04-11 16:48:18.266587,2024-04-11 16:48:19.247626,0 days 00:00:00.981039,98.22409024699768,7.675307534449877,sigmoid,20,,,,1.0,5.0,17.0,35.0,14.0,,,,,,,,COMPLETE
3527,0.4570346405744496,2024-04-11 16:48:19.247626,2024-04-11 16:48:20.615247,0 days 00:00:01.367621,99.95543300591449,8.135825446633465,sigmoid,55,33.0,,,7.0,4.0,54.0,48.0,49.0,2.0187497676895085,6.35279140826485,6.974001008517892,15.0,33.0,78.0,83.0,COMPLETE
3528,0.44701971028259324,2024-04-11 16:48:20.615247,2024-04-11 16:48:21.545171,0 days 00:00:00.929924,99.94370217383344,7.914927194326532,sigmoid,8,,27.0,30.0,,,,,,,,,,,,,COMPLETE
3529,0.34266574434776276,2024-04-11 16:48:21.545171,2024-04-11 16:48:22.532636,0 days 00:00:00.987465,93.59744793145035,8.400720841410813,sigmoid,44,44.0,23.0,32.0,,,,9.0,43.0,,,,,,,,COMPLETE
3530,0.5986044733320588,2024-04-11 16:48:22.540895,2024-04-11 16:48:23.405264,0 days 00:00:00.864369,96.68577686557916,8.921970770664137,sigmoid,8,,25.0,31.0,,,,,,,,,,,,,COMPLETE
3531,0.33211009174311923,2024-04-11 16:48:23.405264,2024-04-11 16:48:24.409744,0 days 00:00:01.004480,96.3703069785548,7.831955548439161,sigmoid,13,,22.0,30.0,,,,17.0,46.0,,,,,,,17.0,COMPLETE
3532,0.5952371952371952,2024-04-11 16:48:24.409744,2024-04-11 16:48:25.257316,0 days 00:00:00.847572,98.17911389382675,8.107027093058974,sigmoid,8,,27.0,32.0,,,,,,,,,,,,,COMPLETE
3533,0.5544996877926944,2024-04-11 16:48:25.257316,2024-04-11 16:48:26.197516,0 days 00:00:00.940200,95.14837973891142,7.566594030812048,sigmoid,36,49.0,,,,,,3.0,18.0,,,,,,,,COMPLETE
3534,0.43310501600215356,2024-04-11 16:48:26.205559,2024-04-11 16:48:27.519045,0 days 00:00:01.313486,98.27346647040929,8.251903230589056,sigmoid,59,47.0,30.0,31.0,3.0,7.0,98.0,,,6.448298935568416,8.247503558809562,3.1303738921174773,8.0,40.0,65.0,181.0,COMPLETE
