number,value,datetime_start,datetime_complete,duration,params_C,params_gamma,params_kernel,params_mask_number,params_rsi_window,params_so_smooth,params_so_window,params_srsi_smooth1,params_srsi_smooth2,params_srsi_window,params_tsi_window_fast,params_tsi_window_slow,params_ult_weight_1,params_ult_weight_2,params_ult_weight_3,params_ult_window_1,params_ult_window_2,params_ult_window_3,params_williams_lbp,state
2200,0.31903267881693514,2024-04-11 16:22:37.336118,2024-04-11 16:22:38.133808,0 days 00:00:00.797690,93.94044817734104,8.019581208773378,sigmoid,10,,27.0,32.0,,,,,,8.612301534405066,2.082631643872708,7.002227220160378,8.0,24.0,50.0,,COMPLETE
2201,0.3871066300030553,2024-04-11 16:22:38.134808,2024-04-11 16:22:38.938901,0 days 00:00:00.804093,97.9661505069999,8.23237676072936,sigmoid,11,,25.0,29.0,,,,,,3.624806346975351,8.797188302339642,4.953921159194924,11.0,28.0,91.0,140.0,COMPLETE
2202,0.4311506916059876,2024-04-11 16:22:38.940901,2024-04-11 16:22:39.790149,0 days 00:00:00.849248,96.28091519814586,7.692900832781144,sigmoid,26,,26.0,31.0,5.0,5.0,5.0,,,3.8452086123945914,2.4893311311835005,9.37820615482526,16.0,39.0,81.0,,COMPLETE
2203,0.5929369437606513,2024-04-11 16:22:39.792144,2024-04-11 16:22:40.448785,0 days 00:00:00.656641,98.26685722758576,8.457702359834773,sigmoid,8,,23.0,33.0,,,,,,,,,,,,,COMPLETE
2204,0.3110647945005119,2024-04-11 16:22:40.449847,2024-04-11 16:22:41.136728,0 days 00:00:00.686881,99.95988101945605,7.908682893430774,sigmoid,41,49.0,25.0,30.0,,,,,,,,,,,,39.0,COMPLETE
2205,0.5963643249384587,2024-04-11 16:22:41.137722,2024-04-11 16:22:41.711335,0 days 00:00:00.573613,95.32751959630063,8.188076431771725,sigmoid,8,,24.0,32.0,,,,,,,,,,,,,COMPLETE
2206,0.44701971028259324,2024-04-11 16:22:41.713334,2024-04-11 16:22:42.393823,0 days 00:00:00.680489,97.95077555696085,8.019966301677304,sigmoid,8,,21.0,30.0,,,,,,,,,,,,,COMPLETE
2207,0.5069140556625241,2024-04-11 16:22:42.394833,2024-04-11 16:22:42.977573,0 days 00:00:00.582740,99.92811116909509,8.642945646238838,sigmoid,8,,27.0,35.0,,,,,,,,,,,,,COMPLETE
2208,0.5174927431851415,2024-04-11 16:22:42.978569,2024-04-11 16:22:43.608404,0 days 00:00:00.629835,99.99058265586228,7.499882701886586,sigmoid,37,43.0,,,,,,38.0,37.0,,,,,,,121.0,COMPLETE
2209,0.42758091731860715,2024-04-11 16:22:43.610451,2024-04-11 16:22:44.320129,0 days 00:00:00.709678,96.54716838783419,7.73813420768379,sigmoid,56,6.0,26.0,31.0,6.0,6.0,76.0,,,,,,,,,,COMPLETE
2210,0.5032246302499943,2024-04-11 16:22:44.322257,2024-04-11 16:22:45.019164,0 days 00:00:00.696907,93.9375017983339,8.333847552718046,sigmoid,20,,,,1.0,1.0,46.0,27.0,15.0,,,,,,,,COMPLETE
2211,0.6009432182607054,2024-04-11 16:22:45.022239,2024-04-11 16:22:45.639812,0 days 00:00:00.617573,98.2363741153169,8.10855920553803,sigmoid,8,,22.0,31.0,,,,,,,,,,,,,COMPLETE
2212,0.4772456456151915,2024-04-11 16:22:45.640811,2024-04-11 16:22:46.348739,0 days 00:00:00.707928,99.99956625134723,7.810022296934659,sigmoid,52,27.0,,,7.0,4.0,24.0,24.0,47.0,,,,,,,,COMPLETE
2213,0.5010515021459228,2024-04-11 16:22:46.349796,2024-04-11 16:22:46.980998,0 days 00:00:00.631202,96.36122515095218,8.408034108051224,sigmoid,48,50.0,,,4.0,2.0,51.0,,,,,,,,,,COMPLETE
2214,0.5929369437606513,2024-04-11 16:22:46.982997,2024-04-11 16:22:47.563532,0 days 00:00:00.580535,99.96450049045602,7.302567451319218,sigmoid,8,,26.0,33.0,,,,,,,,,,,,,COMPLETE
2215,0.4578786955196586,2024-04-11 16:22:47.566681,2024-04-11 16:22:48.881008,0 days 00:00:01.314327,93.93960147920976,8.795897052425072,rbf,8,,25.0,29.0,,,,,,,,,,,,,COMPLETE
2216,0.4743960635956779,2024-04-11 16:22:48.883155,2024-04-11 16:22:49.687026,0 days 00:00:00.803871,96.60465176423287,7.93855263799241,sigmoid,60,13.0,24.0,32.0,8.0,7.0,37.0,48.0,19.0,,,,,,,,COMPLETE
2217,0.4250174525607666,2024-04-11 16:22:49.688022,2024-04-11 16:22:50.706149,0 days 00:00:01.018127,98.14551475434047,8.129577041694887,sigmoid,59,23.0,28.0,31.0,2.0,5.0,16.0,,,5.2075429828948545,7.507013268538055,3.498203038770601,6.0,26.0,86.0,172.0,COMPLETE
2218,0.4579529448588867,2024-04-11 16:22:50.707145,2024-04-11 16:22:51.618165,0 days 00:00:00.911020,95.5119414498211,6.9528792987484405,sigmoid,55,17.0,,,6.0,3.0,56.0,40.0,4.0,2.555801145204295,9.26177551189653,5.592286738242883,12.0,21.0,51.0,111.0,COMPLETE
2219,0.3327441136958213,2024-04-11 16:22:51.620273,2024-04-11 16:22:52.312102,0 days 00:00:00.691829,97.9234400525331,7.662333619605493,sigmoid,44,36.0,25.0,30.0,,,,29.0,31.0,,,,,,,,COMPLETE
2220,0.4351236793825521,2024-04-11 16:22:52.313214,2024-04-11 16:22:53.230214,0 days 00:00:00.917000,98.15960796314788,8.278327443346575,sigmoid,54,12.0,,,3.0,8.0,93.0,35.0,24.0,4.989644252866782,0.9707166539472354,6.415475649645746,15.0,33.0,95.0,,COMPLETE
2221,0.5952371952371952,2024-04-11 16:22:53.232286,2024-04-11 16:22:53.820642,0 days 00:00:00.588356,99.97962237804107,7.941351958436587,sigmoid,8,,29.0,32.0,,,,,,,,,,,,,COMPLETE
2222,0.5113220039726329,2024-04-11 16:22:53.822760,2024-04-11 16:22:54.538887,0 days 00:00:00.716127,99.99089347476233,8.524071545848134,sigmoid,12,,23.0,28.0,,,,18.0,2.0,,,,,,,,COMPLETE
2223,0.36232206405693956,2024-04-11 16:22:54.539888,2024-04-11 16:22:55.213935,0 days 00:00:00.674047,95.43929031215262,8.21524924607438,sigmoid,13,,27.0,30.0,,,,17.0,42.0,,,,,,,156.0,COMPLETE
2224,0.5368803152872847,2024-04-11 16:22:55.214926,2024-04-11 16:22:55.843389,0 days 00:00:00.628463,96.55503078343803,8.017460997016066,sigmoid,36,29.0,,,,,,11.0,13.0,,,,,,,,COMPLETE
2225,0.5883953883953884,2024-04-11 16:22:55.845390,2024-04-11 16:22:56.424564,0 days 00:00:00.579174,94.05994828120265,7.548985981871104,sigmoid,8,,26.0,34.0,,,,,,,,,,,,,COMPLETE
2226,0.546927600892314,2024-04-11 16:22:56.425613,2024-04-11 16:22:57.100002,0 days 00:00:00.674389,97.95890877455734,7.785425756808322,sigmoid,40,32.0,25.0,31.0,,,,,,,,,,,,,COMPLETE
2227,0.5929369437606513,2024-04-11 16:22:57.101071,2024-04-11 16:22:57.672699,0 days 00:00:00.571628,98.00794678767681,8.379416116898946,sigmoid,8,,24.0,33.0,,,,,,,,,,,,,COMPLETE
2228,0.5750784907221147,2024-04-11 16:22:57.673905,2024-04-11 16:22:58.288376,0 days 00:00:00.614471,52.98333025637572,8.032030512116393,sigmoid,32,18.0,,,,,,,,,,,,,,,COMPLETE
2229,0.3823124253834145,2024-04-11 16:22:58.289537,2024-04-11 16:22:59.216597,0 days 00:00:00.927060,96.581280463614,8.15460786672413,sigmoid,27,,23.0,29.0,1.0,4.0,7.0,,,2.8553223010663085,5.495638671664874,6.079988935359039,7.0,29.0,52.0,47.0,COMPLETE
2230,0.05382419412394432,2024-04-11 16:22:59.218595,2024-04-11 16:23:00.435036,0 days 00:00:01.216441,98.31033283940437,8.64295476198697,rbf,61,24.0,26.0,32.0,4.0,1.0,84.0,46.0,14.0,,,,,,,149.0,COMPLETE
2231,0.6009432182607054,2024-04-11 16:23:00.437036,2024-04-11 16:23:01.050857,0 days 00:00:00.613821,94.9329548599478,7.884024589405658,sigmoid,8,,28.0,31.0,,,,,,,,,,,,,COMPLETE
2232,0.4630133771415161,2024-04-11 16:23:01.052981,2024-04-11 16:23:01.617572,0 days 00:00:00.564591,98.26169609474474,8.29094484196509,sigmoid,4,,,,,,,7.0,36.0,,,,,,,,COMPLETE
2233,0.4465950213839237,2024-04-11 16:23:01.618574,2024-04-11 16:23:02.548268,0 days 00:00:00.929694,96.70214468781016,7.654506211247757,sigmoid,30,,24.0,32.0,5.0,6.0,79.0,10.0,44.0,3.3571959775721125,3.0134493890389673,4.171617608437753,10.0,36.0,84.0,,COMPLETE
2234,0.4502698896972542,2024-04-11 16:23:02.550272,2024-04-11 16:23:03.140612,0 days 00:00:00.590340,98.02794646842828,7.424207812570629,sigmoid,8,,27.0,30.0,,,,,,,,,,,,,COMPLETE
2235,0.48611266533873454,2024-04-11 16:23:03.141610,2024-04-11 16:23:03.955954,0 days 00:00:00.814344,93.75878381711598,7.877007917428605,sigmoid,7,,,,,,,41.0,39.0,6.427140863830964,3.3646741419575985,8.880232985989927,19.0,40.0,72.0,99.0,COMPLETE
2236,0.5300406831626737,2024-04-11 16:23:03.956954,2024-04-11 16:23:04.554786,0 days 00:00:00.597832,99.99081084234977,8.466020331936734,sigmoid,33,15.0,,,,,,,,,,,,,,93.0,COMPLETE
2237,0.12622036262203626,2024-04-11 16:23:04.556880,2024-04-11 16:23:05.195593,0 days 00:00:00.638713,96.24768434349124,8.138597427908804,sigmoid,8,,25.0,29.0,,,,,,,,,,,,,COMPLETE
2238,0.5043734035142039,2024-04-11 16:23:05.196590,2024-04-11 16:23:06.073430,0 days 00:00:00.876840,98.30450673185675,8.251115796198508,sigmoid,23,,,,7.0,2.0,68.0,5.0,19.0,7.550894176435749,6.846303375382548,1.5612279707757266,14.0,44.0,65.0,117.0,COMPLETE
2239,0.44701971028259324,2024-04-11 16:23:06.075427,2024-04-11 16:23:06.658497,0 days 00:00:00.583070,95.27266991603838,8.004577185701528,sigmoid,8,,22.0,30.0,,,,,,,,,,,,,COMPLETE
2240,0.5929369437606513,2024-04-11 16:23:06.660522,2024-04-11 16:23:07.253637,0 days 00:00:00.593115,98.18766564150033,7.702105071867623,sigmoid,8,,26.0,33.0,,,,,,,,,,,,,COMPLETE
2241,0.3885422955658416,2024-04-11 16:23:07.254636,2024-04-11 16:23:07.989864,0 days 00:00:00.735228,21.806025679167593,8.738243889797873,sigmoid,45,10.0,24.0,31.0,,,,43.0,21.0,,,,,,,162.0,COMPLETE
2242,0.44247299108903076,2024-04-11 16:23:07.991870,2024-04-11 16:23:08.906043,0 days 00:00:00.914173,96.50608827960232,8.41789986913512,sigmoid,51,20.0,,,3.0,5.0,31.0,,,8.186025041169438,7.272250454427367,2.7968049067003213,18.0,41.0,85.0,75.0,COMPLETE
2243,0.2448041116270682,2024-04-11 16:23:08.907097,2024-04-11 16:23:09.739247,0 days 00:00:00.832150,99.9206233686305,7.907205946890467,sigmoid,34,40.0,,,,,,,,4.363339075667838,7.785053436366942,3.665252883278349,13.0,37.0,99.0,,COMPLETE
2244,0.38645822024391124,2024-04-11 16:23:09.741240,2024-04-11 16:23:10.381340,0 days 00:00:00.640100,93.76963036223577,8.167919204358288,sigmoid,17,,,,2.0,7.0,98.0,,,,,,,,,65.0,COMPLETE
2245,0.5952371952371952,2024-04-11 16:23:10.382342,2024-04-11 16:23:11.121254,0 days 00:00:00.738912,98.30335988693112,7.75558997305734,sigmoid,8,,27.0,32.0,,,,,,,,,,,,,COMPLETE
2246,0.4847863330357358,2024-04-11 16:23:11.122255,2024-04-11 16:23:11.938682,0 days 00:00:00.816427,96.21830609628702,8.033692306236976,sigmoid,19,,,,8.0,8.0,44.0,,,0.7729972306119546,4.630299778938881,4.764001183479158,9.0,48.0,80.0,31.0,COMPLETE
2247,0.39892593282423794,2024-04-11 16:23:11.939680,2024-04-11 16:23:12.721853,0 days 00:00:00.782173,97.98764427811524,7.487180855259155,sigmoid,29,,25.0,31.0,6.0,6.0,49.0,31.0,29.0,,,,,,,177.0,COMPLETE
2248,0.44028989868592644,2024-04-11 16:23:12.723853,2024-04-11 16:23:13.469670,0 days 00:00:00.745817,95.38906613882327,8.298552025495178,sigmoid,53,11.0,,,5.0,4.0,74.0,25.0,32.0,,,,,,,126.0,COMPLETE
2249,0.22317025054251333,2024-04-11 16:23:13.471737,2024-04-11 16:23:14.694121,0 days 00:00:01.222384,98.23292622268904,6.328828829207844,rbf,58,26.0,26.0,27.0,1.0,3.0,71.0,,,8.028281089931859,1.1608814641018723,7.689208896262954,5.0,25.0,55.0,,COMPLETE
2250,0.4039917189622825,2024-04-11 16:23:14.696122,2024-04-11 16:23:15.398768,0 days 00:00:00.702646,99.97503528797324,8.55689061649432,sigmoid,49,8.0,,,4.0,1.0,22.0,,,,,,,,,188.0,COMPLETE
2251,0.3117666056626117,2024-04-11 16:23:15.400769,2024-04-11 16:23:16.028647,0 days 00:00:00.627878,96.73600134097796,7.890518759331099,sigmoid,5,,,,,,,22.0,18.0,,,,,,,53.0,COMPLETE
2252,0.3283506276757855,2024-04-11 16:23:16.031688,2024-04-11 16:23:16.845475,0 days 00:00:00.813787,99.945816201633,8.109884062189614,sigmoid,50,41.0,,,8.0,2.0,26.0,,,6.981246968037192,6.2867356462493,7.2657566220981185,17.0,47.0,89.0,,COMPLETE
2253,0.22468110606968578,2024-04-11 16:23:16.846529,2024-04-11 16:23:17.582851,0 days 00:00:00.736322,93.99427745782253,7.614806475007358,sigmoid,6,,,,,,,15.0,11.0,5.560280904905809,2.670231270091083,9.99407936444225,15.0,43.0,94.0,,COMPLETE
2254,0.5883953883953884,2024-04-11 16:23:17.584952,2024-04-11 16:23:18.186256,0 days 00:00:00.601304,98.08416623826197,7.2921465074999805,sigmoid,8,,30.0,34.0,,,,,,,,,,,,,COMPLETE
2255,0.5017804650718162,2024-04-11 16:23:18.187256,2024-04-11 16:23:18.909769,0 days 00:00:00.722513,96.50127111175557,8.348787499120446,sigmoid,25,,23.0,29.0,7.0,4.0,41.0,,,,,,,,,10.0,COMPLETE
2256,0.6009432182607054,2024-04-11 16:23:18.911982,2024-04-11 16:23:19.528074,0 days 00:00:00.616092,99.98637776514732,8.027856203335915,sigmoid,8,,25.0,31.0,,,,,,,,,,,,,COMPLETE
2257,0.5929369437606513,2024-04-11 16:23:19.530062,2024-04-11 16:23:20.131936,0 days 00:00:00.601874,98.19267899857162,7.81311001666411,sigmoid,8,,28.0,33.0,,,,,,,,,,,,,COMPLETE
2258,0.48096843244839205,2024-04-11 16:23:20.133936,2024-04-11 16:23:21.076833,0 days 00:00:00.942897,99.98289430027077,8.22977736706385,sigmoid,47,22.0,24.0,30.0,,,,12.0,16.0,2.1831705163931336,5.768388357313468,2.5477912205328925,6.0,33.0,79.0,16.0,COMPLETE
2259,0.36143484732963005,2024-04-11 16:23:21.077833,2024-04-11 16:23:21.828633,0 days 00:00:00.750800,93.72432797966798,8.501278316576906,sigmoid,35,46.0,,,,,,,,9.3676291817068,5.084062192526403,5.305330952590704,2.0,35.0,60.0,87.0,COMPLETE
2260,0.3999802104291038,2024-04-11 16:23:21.830777,2024-04-11 16:23:22.683525,0 days 00:00:00.852748,99.9849394288234,8.873658358810994,sigmoid,39,31.0,,,,,,38.0,7.0,5.908856818472798,7.105998022989278,1.7812599860498977,20.0,34.0,74.0,105.0,COMPLETE
2261,0.5952371952371952,2024-04-11 16:23:22.685524,2024-04-11 16:23:23.262057,0 days 00:00:00.576533,95.75105628481279,8.001070598389,sigmoid,8,,27.0,32.0,,,,,,,,,,,,,COMPLETE
2262,0.363358125452511,2024-04-11 16:23:23.263058,2024-04-11 16:23:24.090474,0 days 00:00:00.827416,96.69646490062023,8.19510089933459,sigmoid,43,38.0,21.0,30.0,,,,,,9.069490422498156,4.430857196563329,0.509937100339978,7.0,45.0,57.0,44.0,COMPLETE
2263,0.37691031659195984,2024-04-11 16:23:24.091508,2024-04-11 16:23:24.914940,0 days 00:00:00.823432,97.97871325365153,7.760307750961301,sigmoid,22,,,,6.0,5.0,90.0,32.0,28.0,3.060578445061835,3.7560971784877433,7.9094001269363,11.0,23.0,90.0,,COMPLETE
2264,0.40988677161005244,2024-04-11 16:23:24.916998,2024-04-11 16:23:25.676799,0 days 00:00:00.759801,99.96342849273871,7.597518227571926,sigmoid,24,,26.0,32.0,1.0,1.0,4.0,,,,,,,,,,COMPLETE
2265,0.45022721836881124,2024-04-11 16:23:25.678800,2024-04-11 16:23:26.271653,0 days 00:00:00.592853,95.19723590707389,8.402046864257015,sigmoid,8,,23.0,28.0,,,,,,,,,,,,,COMPLETE
2266,0.6009432182607054,2024-04-11 16:23:26.273639,2024-04-11 16:23:26.853258,0 days 00:00:00.579619,97.98864135284256,7.911821581789579,sigmoid,8,,25.0,31.0,,,,,,,,,,,,,COMPLETE
2267,0.5176174317604627,2024-04-11 16:23:26.854458,2024-04-11 16:23:27.602820,0 days 00:00:00.748362,96.73433078695632,8.068614246745422,sigmoid,21,,,,2.0,6.0,28.0,28.0,25.0,,,,,,,136.0,COMPLETE
2268,0.4467756865165073,2024-04-11 16:23:27.604819,2024-04-11 16:23:28.939031,0 days 00:00:01.334212,93.7098992772952,8.249343361118552,rbf,8,,24.0,33.0,,,,,,,,,,,,,COMPLETE
2269,0.4633687222347715,2024-04-11 16:23:28.941081,2024-04-11 16:23:29.818217,0 days 00:00:00.877136,79.70082680718531,7.130287105675616,sigmoid,15,,26.0,29.0,,,,13.0,41.0,1.5716864000822999,8.48286834815739,4.506053303978703,8.0,26.0,70.0,69.0,COMPLETE
2270,0.33709616115545415,2024-04-11 16:23:29.820212,2024-04-11 16:23:30.524412,0 days 00:00:00.704200,98.0953098726965,8.685865157225086,sigmoid,9,,29.0,31.0,,,,,,,,,,,,22.0,COMPLETE
2271,0.44660427887942705,2024-04-11 16:23:30.525413,2024-04-11 16:23:31.560246,0 days 00:00:01.034833,99.98213140312126,7.799835786656212,sigmoid,31,,27.0,30.0,5.0,8.0,83.0,21.0,6.0,4.785887529804402,0.5027409361557007,6.778089778901927,12.0,46.0,83.0,197.0,COMPLETE
2272,0.2925359976491332,2024-04-11 16:23:31.562246,2024-04-11 16:23:32.363398,0 days 00:00:00.801152,95.34473720226457,8.123587359675968,sigmoid,38,2.0,,,,,,36.0,4.0,8.85560569023617,8.976159459978795,9.049158712966701,16.0,42.0,76.0,,COMPLETE
2273,0.34778507546115145,2024-04-11 16:23:32.365399,2024-04-11 16:23:33.216936,0 days 00:00:00.851537,99.96791941665948,8.421278755800127,sigmoid,14,,25.0,32.0,,,,19.0,46.0,6.685319991960938,9.516296909539985,0.8714301595122631,14.0,22.0,67.0,,COMPLETE
2274,0.5228991418132382,2024-04-11 16:23:33.217936,2024-04-11 16:23:33.957972,0 days 00:00:00.740036,96.74302528847937,7.507054317505442,sigmoid,3,,,,,,,,,2.6664170461279615,4.9230189495776955,2.2595907092911505,10.0,48.0,54.0,142.0,COMPLETE
2275,0.4157819581548395,2024-04-11 16:23:33.959973,2024-04-11 16:23:35.119393,0 days 00:00:01.159420,96.76684859986855,7.949114909790713,sigmoid,63,44.0,24.0,29.0,4.0,7.0,11.0,9.0,38.0,7.220430062013355,1.8386459314218109,8.167468806260466,19.0,27.0,59.0,183.0,COMPLETE
2276,0.4966314706386732,2024-04-11 16:23:35.121664,2024-04-11 16:23:35.882830,0 days 00:00:00.761166,98.35938678028695,9.073481722900816,sigmoid,57,30.0,22.0,35.0,3.0,3.0,63.0,,,,,,,,,36.0,COMPLETE
2277,0.4466772430812621,2024-04-11 16:23:35.883833,2024-04-11 16:23:36.663271,0 days 00:00:00.779438,93.74148981857955,8.250070869295236,sigmoid,28,,28.0,31.0,7.0,5.0,60.0,34.0,49.0,,,,,,,,COMPLETE
2278,0.44701971028259324,2024-04-11 16:23:36.665273,2024-04-11 16:23:37.255816,0 days 00:00:00.590543,98.0306477008958,7.723159145394538,sigmoid,8,,26.0,30.0,,,,,,,,,,,,,COMPLETE
2279,0.5314519911098424,2024-04-11 16:23:37.257816,2024-04-11 16:23:38.000268,0 days 00:00:00.742452,99.97673127991563,8.637208771831014,sigmoid,2,,,,,,,,,3.7324868505996,6.011902581400997,6.261973384683537,13.0,24.0,71.0,,COMPLETE
2280,0.33144112799853503,2024-04-11 16:23:38.002268,2024-04-11 16:23:38.849954,0 days 00:00:00.847686,95.2785299045956,8.02619264380721,sigmoid,42,43.0,23.0,32.0,,,,,,1.2859059515591218,9.849657104972998,2.9603137213930966,4.0,32.0,63.0,,COMPLETE
2281,0.5906279643331437,2024-04-11 16:23:38.851954,2024-04-11 16:23:39.439473,0 days 00:00:00.587519,98.14695173051783,8.398748495520286,sigmoid,8,,25.0,34.0,,,,,,,,,,,,,COMPLETE
2282,0.5929369437606513,2024-04-11 16:23:39.441488,2024-04-11 16:23:40.070683,0 days 00:00:00.629195,96.4574083549348,7.865081125753303,sigmoid,8,,27.0,33.0,,,,,,,,,,,,,COMPLETE
2283,0.5986580986580987,2024-04-11 16:23:40.071684,2024-04-11 16:23:40.710937,0 days 00:00:00.639253,99.9547506606315,8.186739827507708,sigmoid,8,,24.0,31.0,,,,,,,,,,,,,COMPLETE
2284,0.4453174603174603,2024-04-11 16:23:40.713150,2024-04-11 16:23:41.721148,0 days 00:00:01.007998,96.64636465288471,7.652671203571789,sigmoid,62,6.0,26.0,32.0,8.0,2.0,52.0,6.0,34.0,6.121874388944592,8.081179128264885,8.58910116643506,5.0,39.0,62.0,,COMPLETE
2285,0.49112200695006425,2024-04-11 16:23:41.724298,2024-04-11 16:23:42.399029,0 days 00:00:00.674731,24.853385452653992,7.361556371127328,sigmoid,16,,,,2.0,3.0,88.0,,,,,,,,,,COMPLETE
2286,0.3212935092999923,2024-04-11 16:23:42.400132,2024-04-11 16:23:43.085184,0 days 00:00:00.685052,98.04112113805262,8.074938095669305,sigmoid,41,47.0,25.0,30.0,,,,,,,,,,,,166.0,COMPLETE
2287,0.3924151962909843,2024-04-11 16:23:43.087183,2024-04-11 16:23:44.013978,0 days 00:00:00.926795,93.83560940238918,8.478158858254517,sigmoid,46,25.0,23.0,28.0,,,,49.0,26.0,4.238990135451299,1.3200844367078814,3.275912402744618,18.0,44.0,91.0,,COMPLETE
2288,0.28414442700156983,2024-04-11 16:23:44.015251,2024-04-11 16:23:45.169792,0 days 00:00:01.154541,99.95788333864314,7.897974972503718,rbf,20,,,,6.0,4.0,39.0,44.0,43.0,,,,,,,,COMPLETE
2289,0.48225942537412847,2024-04-11 16:23:45.170792,2024-04-11 16:23:46.064503,0 days 00:00:00.893711,95.27875872297265,8.2731087195971,sigmoid,11,,28.0,31.0,,,,,,1.9358829307114251,2.2587314345641647,9.60173055584443,15.0,20.0,86.0,113.0,COMPLETE
2290,0.4458981104998804,2024-04-11 16:23:46.066506,2024-04-11 16:23:46.656216,0 days 00:00:00.589710,98.07913256697348,9.324046166946003,sigmoid,8,,27.0,30.0,,,,,,,,,,,,,COMPLETE
2291,0.12622036262203626,2024-04-11 16:23:46.658352,2024-04-11 16:23:47.292036,0 days 00:00:00.633684,98.1786548843482,8.071912070679838,sigmoid,8,,25.0,29.0,,,,,,,,,,,,,COMPLETE
2292,0.44507403645694127,2024-04-11 16:23:47.293039,2024-04-11 16:23:48.048729,0 days 00:00:00.755690,96.63452707357074,7.650280241276762,sigmoid,56,14.0,24.0,33.0,3.0,8.0,96.0,,,,,,,,,,COMPLETE
2293,0.5952371952371952,2024-04-11 16:23:48.049726,2024-04-11 16:23:48.670096,0 days 00:00:00.620370,98.20859850777309,7.9149704960696425,sigmoid,8,,26.0,32.0,,,,,,,,,,,,,COMPLETE
2294,0.5963245096172158,2024-04-11 16:23:48.672097,2024-04-11 16:23:49.271789,0 days 00:00:00.599692,95.25896001286597,8.59178869007069,sigmoid,8,,26.0,31.0,,,,,,,,,,,,,COMPLETE
2295,0.2995074270761179,2024-04-11 16:23:49.273789,2024-04-11 16:23:50.080441,0 days 00:00:00.806652,99.97378815056723,8.34504209610345,sigmoid,10,,22.0,30.0,,,,,,4.5319300863120064,1.6117908673494643,1.0978677127189789,17.0,28.0,57.0,,COMPLETE
2296,0.37173480521147556,2024-04-11 16:23:50.081442,2024-04-11 16:23:51.022542,0 days 00:00:00.941100,96.29627872531309,6.874201435560536,sigmoid,26,,24.0,31.0,7.0,5.0,34.0,,,3.2427755900597925,6.755301252801109,1.4372675481213117,3.0,50.0,96.0,,COMPLETE
2297,0.465167508031207,2024-04-11 16:23:51.024694,2024-04-11 16:23:51.975718,0 days 00:00:00.951024,98.41767669376065,8.206826351159044,sigmoid,55,28.0,,,5.0,6.0,2.0,24.0,31.0,0.6318783726542554,3.5386088436010006,5.5420532316464755,8.0,29.0,88.0,170.0,COMPLETE
2298,0.5396126252620647,2024-04-11 16:23:51.976718,2024-04-11 16:23:52.699245,0 days 00:00:00.722527,93.73860621863044,7.850420029266045,sigmoid,48,35.0,,,6.0,1.0,9.0,,,,,,,,,,COMPLETE
2299,0.3279249536999758,2024-04-11 16:23:52.701398,2024-04-11 16:23:53.339456,0 days 00:00:00.638058,98.26309449552369,7.540534524733164,sigmoid,37,37.0,,,,,,26.0,24.0,,,,,,,132.0,COMPLETE
2300,0.5929369437606513,2024-04-11 16:23:53.341620,2024-04-11 16:23:53.924770,0 days 00:00:00.583150,96.7133051040805,8.085385009487096,sigmoid,8,,28.0,33.0,,,,,,,,,,,,,COMPLETE
2301,0.32497799683154377,2024-04-11 16:23:53.926786,2024-04-11 16:23:54.722660,0 days 00:00:00.795874,99.96578003744958,7.759123088032672,sigmoid,52,20.0,,,1.0,3.0,32.0,39.0,20.0,,,,,,,,COMPLETE
2302,0.3481864922528068,2024-04-11 16:23:54.724655,2024-04-11 16:23:55.437984,0 days 00:00:00.713329,95.44389731576962,8.449009992999265,sigmoid,44,16.0,25.0,32.0,,,,14.0,22.0,,,,,,,,COMPLETE
2303,0.32954985666692493,2024-04-11 16:23:55.440054,2024-04-11 16:23:56.161888,0 days 00:00:00.721834,98.08298240127836,8.041374876576796,sigmoid,13,,23.0,29.0,,,,50.0,50.0,,,,,,,192.0,COMPLETE
