number,value,datetime_start,datetime_complete,duration,params_C,params_gamma,params_kernel,params_mask_number,params_rsi_window,params_so_smooth,params_so_window,params_srsi_smooth1,params_srsi_smooth2,params_srsi_window,params_tsi_window_fast,params_tsi_window_slow,params_ult_weight_1,params_ult_weight_2,params_ult_weight_3,params_ult_window_1,params_ult_window_2,params_ult_window_3,params_williams_lbp,state
2098,0.5285629023319266,2024-04-11 16:21:21.743259,2024-04-11 16:21:22.417271,0 days 00:00:00.674012,99.97944401528916,7.873334531028472,sigmoid,3,,,,,,,,,2.7187149077412505,3.647208040342691,4.366247513830615,13.0,50.0,64.0,171.0,COMPLETE
2099,0.23161647091083587,2024-04-11 16:21:22.419281,2024-04-11 16:21:23.569474,0 days 00:00:01.150193,98.18056869793365,8.515733130470466,rbf,57,13.0,28.0,33.0,5.0,8.0,50.0,,,,,,,,,93.0,COMPLETE
2100,0.44701971028259324,2024-04-11 16:21:23.571467,2024-04-11 16:21:24.247658,0 days 00:00:00.676191,95.99334640661097,8.118146684679864,sigmoid,8,,26.0,30.0,,,,,,,,,,,,,COMPLETE
2101,0.3580444611906556,2024-04-11 16:21:24.248659,2024-04-11 16:21:25.002356,0 days 00:00:00.753697,59.772788999589444,7.5856700748701185,sigmoid,28,,24.0,31.0,1.0,6.0,25.0,18.0,30.0,,,,,,,,COMPLETE
2102,0.5952371952371952,2024-04-11 16:21:25.003356,2024-04-11 16:21:25.576656,0 days 00:00:00.573300,98.01610029269123,7.958089474373051,sigmoid,8,,24.0,32.0,,,,,,,,,,,,,COMPLETE
2103,0.5304245187024299,2024-04-11 16:21:25.578656,2024-04-11 16:21:26.169687,0 days 00:00:00.591031,94.26074344029912,8.213403258559959,sigmoid,9,,27.0,30.0,,,,,,,,,,,,120.0,COMPLETE
2104,0.39344107362253083,2024-04-11 16:21:26.171765,2024-04-11 16:21:27.034138,0 days 00:00:00.862373,98.19493778830474,7.677199445486716,sigmoid,15,,25.0,29.0,,,,25.0,27.0,9.212507725465656,5.243628807277571,2.7989656259849705,15.0,42.0,81.0,21.0,COMPLETE
2105,0.4993881138330775,2024-04-11 16:21:27.036136,2024-04-11 16:21:27.840510,0 days 00:00:00.804374,99.93657376063294,8.40392175510979,sigmoid,38,29.0,,,,,,29.0,9.0,4.788736805113843,0.8312253638608302,5.2551940310814205,18.0,20.0,77.0,,COMPLETE
2106,0.34403638585296314,2024-04-11 16:21:27.841507,2024-04-11 16:21:28.592457,0 days 00:00:00.750950,96.44503146950532,9.246342436110991,sigmoid,42,31.0,26.0,32.0,,,,,,1.1170336647940875,7.5752807811129,1.111774994998787,17.0,27.0,95.0,,COMPLETE
2107,0.45347172512526845,2024-04-11 16:21:28.593515,2024-04-11 16:21:29.171883,0 days 00:00:00.578368,98.0722584712509,8.016734206102683,sigmoid,8,,28.0,28.0,,,,,,,,,,,,,COMPLETE
2108,0.5964036904537752,2024-04-11 16:21:29.173883,2024-04-11 16:21:29.761936,0 days 00:00:00.588053,96.5245483072167,7.0277441840210475,sigmoid,8,,24.0,31.0,,,,,,,,,,,,,COMPLETE
2109,0.4724452105392761,2024-04-11 16:21:29.765138,2024-04-11 16:21:30.412012,0 days 00:00:00.646874,99.9973901965712,8.844902928097996,sigmoid,16,,,,4.0,5.0,15.0,,,,,,,,,,COMPLETE
2110,0.3315355652793324,2024-04-11 16:21:30.414012,2024-04-11 16:21:31.232682,0 days 00:00:00.818670,94.51368339769375,8.187953253708212,sigmoid,14,,26.0,33.0,,,,31.0,34.0,4.358329815540797,9.99519114687662,0.869282054082138,10.0,32.0,90.0,,COMPLETE
2111,0.6009432182607054,2024-04-11 16:21:31.233899,2024-04-11 16:21:31.840878,0 days 00:00:00.606979,55.970400375056975,7.8662986706337295,sigmoid,8,,22.0,31.0,,,,,,,,,,,,,COMPLETE
2112,0.45345352376492626,2024-04-11 16:21:31.841948,2024-04-11 16:21:32.391725,0 days 00:00:00.549777,99.96635580586575,8.607160585217791,sigmoid,8,,25.0,30.0,,,,,,,,,,,,,COMPLETE
2113,0.4181005123345278,2024-04-11 16:21:32.392726,2024-04-11 16:21:33.216958,0 days 00:00:00.824232,99.99967634544237,7.447688325731544,sigmoid,46,8.0,23.0,34.0,,,,5.0,25.0,7.793836571483807,2.1512803595463734,6.60181528056957,7.0,38.0,56.0,,COMPLETE
2114,0.5438794646662689,2024-04-11 16:21:33.218959,2024-04-11 16:21:34.030425,0 days 00:00:00.811466,99.99713055013282,8.279425994310188,sigmoid,10,,27.0,32.0,,,,,,8.186833099474075,2.716081449509362,9.636327439940896,9.0,44.0,68.0,,COMPLETE
2115,0.45800815065391687,2024-04-11 16:21:34.031424,2024-04-11 16:21:35.007962,0 days 00:00:00.976538,96.61103598641535,7.7334894133193055,sigmoid,63,25.0,25.0,29.0,2.0,7.0,11.0,49.0,15.0,3.465423429272514,4.333133762004662,5.461598245017958,8.0,22.0,79.0,68.0,COMPLETE
2116,0.6009432182607054,2024-04-11 16:21:35.009962,2024-04-11 16:21:35.586321,0 days 00:00:00.576359,98.17826856494447,8.000855783761835,sigmoid,8,,29.0,31.0,,,,,,,,,,,,,COMPLETE
2117,0.4787568193089768,2024-04-11 16:21:35.588315,2024-04-11 16:21:36.242772,0 days 00:00:00.654457,94.73824866080075,8.42724091689108,sigmoid,41,19.0,24.0,33.0,,,,,,,,,,,,86.0,COMPLETE
2118,0.44701971028259324,2024-04-11 16:21:36.243775,2024-04-11 16:21:36.811715,0 days 00:00:00.567940,98.09749990445872,8.140528477181894,sigmoid,8,,26.0,30.0,,,,,,,,,,,,,COMPLETE
2119,0.11187802616668382,2024-04-11 16:21:36.813758,2024-04-11 16:21:37.921985,0 days 00:00:01.108227,96.41284942794837,7.873076950192296,rbf,11,,28.0,32.0,,,,,,9.386932602012372,4.96449701620551,4.849767994158988,20.0,30.0,54.0,163.0,COMPLETE
2120,0.5986580986580987,2024-04-11 16:21:37.923980,2024-04-11 16:21:38.483610,0 days 00:00:00.559630,98.03977943456628,8.218208085159898,sigmoid,8,,23.0,31.0,,,,,,,,,,,,,COMPLETE
2121,0.48162394288273574,2024-04-11 16:21:38.484681,2024-04-11 16:21:39.330414,0 days 00:00:00.845733,94.49567716833994,7.681033007673863,sigmoid,26,,25.0,30.0,6.0,1.0,69.0,,,3.9985624161776325,4.502400061985328,7.382611854128767,16.0,48.0,97.0,,COMPLETE
2122,0.4173959318826868,2024-04-11 16:21:39.332414,2024-04-11 16:21:40.293803,0 days 00:00:00.961389,96.56363231027947,8.048168807071557,sigmoid,62,40.0,27.0,28.0,7.0,3.0,19.0,47.0,13.0,5.597338976875898,2.9264549639871245,1.6460037263883858,6.0,31.0,69.0,,COMPLETE
2123,0.4720548731189526,2024-04-11 16:21:40.295802,2024-04-11 16:21:41.036409,0 days 00:00:00.740607,98.0513760420756,8.636916733637541,sigmoid,52,12.0,,,8.0,8.0,44.0,39.0,11.0,,,,,,,,COMPLETE
2124,0.24901255935738695,2024-04-11 16:21:41.038408,2024-04-11 16:21:41.668259,0 days 00:00:00.629851,96.77819931071011,8.405942444547188,sigmoid,20,,,,4.0,6.0,98.0,27.0,45.0,,,,,,,,COMPLETE
2125,0.5312055761911312,2024-04-11 16:21:41.669260,2024-04-11 16:21:42.270424,0 days 00:00:00.601164,94.46756144241502,7.907430130064528,sigmoid,37,44.0,,,,,,43.0,41.0,,,,,,,191.0,COMPLETE
2126,0.5929369437606513,2024-04-11 16:21:42.272422,2024-04-11 16:21:42.833510,0 days 00:00:00.561088,98.11471231636803,7.4730482313469375,sigmoid,8,,26.0,33.0,,,,,,,,,,,,,COMPLETE
2127,0.45962174315566734,2024-04-11 16:21:42.834514,2024-04-11 16:21:43.469550,0 days 00:00:00.635036,99.98284427544121,8.253136396317684,sigmoid,48,47.0,,,5.0,2.0,31.0,,,,,,,,,,COMPLETE
2128,0.126809901914993,2024-04-11 16:21:43.471550,2024-04-11 16:21:44.049957,0 days 00:00:00.578407,96.43276870522736,7.211086363630405,sigmoid,8,,22.0,29.0,,,,,,,,,,,,,COMPLETE
2129,0.4859060402684564,2024-04-11 16:21:44.052112,2024-04-11 16:21:44.978336,0 days 00:00:00.926224,98.1535312795236,7.753435215843209,sigmoid,59,37.0,24.0,31.0,3.0,4.0,2.0,,,5.077534892423173,5.616354083919444,6.239006401108983,19.0,39.0,66.0,31.0,COMPLETE
2130,0.49816513761467884,2024-04-11 16:21:44.979394,2024-04-11 16:21:45.698391,0 days 00:00:00.718997,99.95274068361127,8.134467948858566,sigmoid,44,15.0,25.0,32.0,,,,21.0,20.0,,,,,,,,COMPLETE
2131,0.6009432182607054,2024-04-11 16:21:45.699488,2024-04-11 16:21:46.251772,0 days 00:00:00.552284,98.11324398697431,7.98870127081774,sigmoid,8,,24.0,31.0,,,,,,,,,,,,,COMPLETE
2132,0.497534796457088,2024-04-11 16:21:46.252805,2024-04-11 16:21:46.931172,0 days 00:00:00.678367,94.500749151098,8.511472435288278,sigmoid,13,,27.0,30.0,,,,4.0,32.0,,,,,,,116.0,COMPLETE
2133,0.4739183486704967,2024-04-11 16:21:46.932327,2024-04-11 16:21:47.842106,0 days 00:00:00.909779,96.14773771604982,8.330044044117427,sigmoid,55,32.0,,,2.0,1.0,57.0,14.0,36.0,0.8364714023969366,9.777977139533096,8.078189269409842,8.0,26.0,92.0,13.0,COMPLETE
2134,0.366329346826127,2024-04-11 16:21:47.844103,2024-04-11 16:21:48.614089,0 days 00:00:00.769986,99.97873427567568,7.569898184675387,sigmoid,56,10.0,26.0,34.0,8.0,4.0,22.0,,,,,,,,,,COMPLETE
2135,0.4351071636428047,2024-04-11 16:21:48.616243,2024-04-11 16:21:49.487926,0 days 00:00:00.871683,65.24632561563047,7.8192999943486825,sigmoid,23,,,,1.0,5.0,65.0,34.0,38.0,2.19215242918467,4.796748212145759,1.4512184909726438,11.0,29.0,55.0,125.0,COMPLETE
2136,0.30509604076832614,2024-04-11 16:21:49.489926,2024-04-11 16:21:50.213474,0 days 00:00:00.723548,98.10902044144856,8.042034151390302,sigmoid,12,,29.0,32.0,,,,24.0,5.0,,,,,,,,COMPLETE
2137,0.12622036262203626,2024-04-11 16:21:50.214538,2024-04-11 16:21:50.776385,0 days 00:00:00.561847,96.0792647492159,8.751120082830495,sigmoid,8,,23.0,29.0,,,,,,,,,,,,,COMPLETE
2138,0.5259522856962373,2024-04-11 16:21:50.778611,2024-04-11 16:21:51.404039,0 days 00:00:00.625428,98.0783853415515,4.759608836132493,sigmoid,36,22.0,,,,,,8.0,9.0,,,,,,,,COMPLETE
2139,0.5929369437606513,2024-04-11 16:21:51.406199,2024-04-11 16:21:52.003124,0 days 00:00:00.596925,98.14662755160865,8.300898869446097,sigmoid,8,,25.0,33.0,,,,,,,,,,,,,COMPLETE
2140,0.31225249950990003,2024-04-11 16:21:52.005149,2024-04-11 16:21:53.165790,0 days 00:00:01.160641,94.1740584473832,7.994354267818424,rbf,60,24.0,27.0,31.0,7.0,7.0,27.0,50.0,12.0,,,,,,,,COMPLETE
2141,0.4689235981366615,2024-04-11 16:21:53.168021,2024-04-11 16:21:54.075377,0 days 00:00:00.907356,96.2763312895498,8.133527927592327,sigmoid,54,42.0,,,6.0,2.0,36.0,36.0,27.0,3.039289630310663,6.967135854547944,2.3220847572774024,18.0,28.0,67.0,,COMPLETE
2142,0.5221854452744107,2024-04-11 16:21:54.076378,2024-04-11 16:21:54.832896,0 days 00:00:00.756518,0.45586273553846723,7.708724964595962,sigmoid,7,,,,,,,11.0,23.0,6.283887451200198,9.394966062050107,4.275799053967525,14.0,46.0,60.0,182.0,COMPLETE
2143,0.5298289012574727,2024-04-11 16:21:54.834943,2024-04-11 16:21:55.623157,0 days 00:00:00.788214,99.94643786353768,7.877210425972436,sigmoid,40,28.0,25.0,30.0,,,,,,,,,,,,,COMPLETE
2144,0.5963643249384587,2024-04-11 16:21:55.625156,2024-04-11 16:21:56.238774,0 days 00:00:00.613618,98.25928773618178,8.532841807644434,sigmoid,8,,21.0,32.0,,,,,,,,,,,,,COMPLETE
2145,0.12003789673140693,2024-04-11 16:21:56.240776,2024-04-11 16:21:56.852004,0 days 00:00:00.611228,99.96359736282487,8.292216136029582,sigmoid,8,,26.0,28.0,,,,,,,,,,,,,COMPLETE
2146,0.39600625108525783,2024-04-11 16:21:56.854006,2024-04-11 16:21:57.759447,0 days 00:00:00.905441,96.1679213637578,8.101320249625568,sigmoid,27,,24.0,30.0,5.0,3.0,9.0,,,8.747092556883077,6.17989323595341,7.1646707004921595,10.0,23.0,85.0,152.0,COMPLETE
2147,0.4467217512608649,2024-04-11 16:21:57.760450,2024-04-11 16:21:58.702135,0 days 00:00:00.941685,94.197160472872,7.612713779760951,sigmoid,30,,23.0,31.0,4.0,6.0,78.0,13.0,49.0,9.81575002453285,7.8143394911755095,8.735829224523375,17.0,33.0,83.0,,COMPLETE
2148,0.14185606933751324,2024-04-11 16:21:58.704197,2024-04-11 16:21:59.244694,0 days 00:00:00.540497,97.96940821006892,7.919930165597876,sigmoid,32,35.0,,,,,,,,,,,,,,,COMPLETE
2149,0.5975614331269932,2024-04-11 16:21:59.246814,2024-04-11 16:21:59.842705,0 days 00:00:00.595891,96.07273874354213,5.658443030871804,sigmoid,8,,28.0,32.0,,,,,,,,,,,,,COMPLETE
2150,0.5069140556625241,2024-04-11 16:21:59.845709,2024-04-11 16:22:00.426151,0 days 00:00:00.580442,97.95274847283342,8.446067880976711,sigmoid,8,,25.0,35.0,,,,,,,,,,,,,COMPLETE
2151,0.27782617714167185,2024-04-11 16:22:00.428150,2024-04-11 16:22:01.112789,0 days 00:00:00.684639,62.62174774727066,8.238121853914073,sigmoid,34,41.0,,,,,,,,6.624040220404328,6.394751443008648,5.077864584276046,12.0,25.0,61.0,,COMPLETE
2152,0.47124030383552085,2024-04-11 16:22:01.113788,2024-04-11 16:22:01.702244,0 days 00:00:00.588456,98.17940661973347,7.475622035409421,sigmoid,5,,,,,,,37.0,39.0,,,,,,,135.0,COMPLETE
2153,0.4253278714553364,2024-04-11 16:22:01.703241,2024-04-11 16:22:02.259667,0 days 00:00:00.556426,94.26967516963467,7.756056187236199,sigmoid,4,,,,,,,7.0,30.0,,,,,,,,COMPLETE
2154,0.4227796006896168,2024-04-11 16:22:02.260669,2024-04-11 16:22:03.101732,0 days 00:00:00.841063,96.36109186823941,9.012123295716895,sigmoid,61,30.0,27.0,29.0,3.0,5.0,40.0,44.0,46.0,,,,,,,43.0,COMPLETE
2155,0.1610240695892848,2024-04-11 16:22:03.102789,2024-04-11 16:22:04.072055,0 days 00:00:00.969266,99.95850824599718,8.049504995202629,rbf,33,9.0,,,,,,,,,,,,,,178.0,COMPLETE
2156,0.5929369437606513,2024-04-11 16:22:04.074108,2024-04-11 16:22:04.644796,0 days 00:00:00.570688,99.99733526184396,7.30233141547637,sigmoid,8,,26.0,33.0,,,,,,,,,,,,,COMPLETE
2157,0.44701971028259324,2024-04-11 16:22:04.645823,2024-04-11 16:22:05.234196,0 days 00:00:00.588373,98.1565382512457,7.880577393309083,sigmoid,8,,24.0,30.0,,,,,,,,,,,,,COMPLETE
2158,0.37741650468280613,2024-04-11 16:22:05.236232,2024-04-11 16:22:05.934443,0 days 00:00:00.698211,96.25858925158467,8.651421682752286,sigmoid,45,48.0,24.0,31.0,,,,2.0,10.0,,,,,,,159.0,COMPLETE
2159,0.4662763466042155,2024-04-11 16:22:05.935441,2024-04-11 16:22:06.724983,0 days 00:00:00.789542,97.95077087938404,8.206567119074634,sigmoid,19,,,,7.0,8.0,48.0,,,8.980807496585225,9.046223579661051,3.834848498617216,11.0,36.0,100.0,35.0,COMPLETE
2160,0.5963643249384587,2024-04-11 16:22:06.727028,2024-04-11 16:22:07.285918,0 days 00:00:00.558890,99.99861554190069,8.465466727245344,sigmoid,8,,26.0,32.0,,,,,,,,,,,,,COMPLETE
2161,0.46138851402009295,2024-04-11 16:22:07.287918,2024-04-11 16:22:07.971146,0 days 00:00:00.683228,94.71441136583576,7.966533812224371,sigmoid,17,,,,1.0,7.0,96.0,,,,,,,,,51.0,COMPLETE
2162,0.49689105797883576,2024-04-11 16:22:07.973245,2024-04-11 16:22:08.628396,0 days 00:00:00.655151,99.98935971774625,7.728291068764903,sigmoid,49,7.0,,,2.0,2.0,61.0,,,,,,,,,96.0,COMPLETE
2163,0.4708772944067061,2024-04-11 16:22:08.629397,2024-04-11 16:22:09.350283,0 days 00:00:00.720886,96.46869214424143,8.158511453112157,sigmoid,53,16.0,,,6.0,1.0,85.0,26.0,3.0,,,,,,,187.0,COMPLETE
2164,0.44456503113040496,2024-04-11 16:22:09.351509,2024-04-11 16:22:10.261787,0 days 00:00:00.910278,98.18834032811736,8.36856033608343,sigmoid,58,34.0,22.0,31.0,5.0,4.0,91.0,,,1.5621896034337373,3.2734892238935993,1.9102808884648823,8.0,41.0,71.0,,COMPLETE
2165,0.3796539066596749,2024-04-11 16:22:10.263834,2024-04-11 16:22:11.135517,0 days 00:00:00.871683,94.14862744581713,8.031697839714033,sigmoid,50,14.0,,,7.0,3.0,54.0,,,6.8685676174986545,7.330526272787505,3.373635122274686,13.0,47.0,94.0,,COMPLETE
2166,0.44810298941635207,2024-04-11 16:22:11.137516,2024-04-11 16:22:12.020724,0 days 00:00:00.883208,96.674070163869,7.568062554049797,sigmoid,51,38.0,,,4.0,1.0,73.0,,,1.3401695946882883,2.4024229433129443,8.256665985615708,9.0,40.0,62.0,167.0,COMPLETE
2167,0.5929369437606513,2024-04-11 16:22:12.022296,2024-04-11 16:22:12.608702,0 days 00:00:00.586406,98.14597039827535,7.826126845683227,sigmoid,8,,23.0,33.0,,,,,,,,,,,,,COMPLETE
2168,0.4687419070803336,2024-04-11 16:22:12.610930,2024-04-11 16:22:13.368935,0 days 00:00:00.758005,99.96352852901975,8.29803774510041,sigmoid,29,,28.0,29.0,3.0,6.0,81.0,22.0,22.0,,,,,,,77.0,COMPLETE
2169,0.6009432182607054,2024-04-11 16:22:13.370981,2024-04-11 16:22:13.938437,0 days 00:00:00.567456,95.7608847805627,8.140653181740035,sigmoid,8,,25.0,31.0,,,,,,,,,,,,,COMPLETE
2170,0.4448341684562156,2024-04-11 16:22:13.940596,2024-04-11 16:22:14.503593,0 days 00:00:00.562997,98.25030023476046,8.714622984225912,sigmoid,8,,30.0,30.0,,,,,,,,,,,,,COMPLETE
2171,0.47699721406520595,2024-04-11 16:22:14.505593,2024-04-11 16:22:15.348407,0 days 00:00:00.842814,96.58079187651701,7.887162499418779,sigmoid,43,26.0,26.0,28.0,,,,,,7.408713202034474,1.656895515314786,9.153505788275357,15.0,45.0,82.0,61.0,COMPLETE
2172,0.4692075947593358,2024-04-11 16:22:15.350405,2024-04-11 16:22:16.117511,0 days 00:00:00.767106,94.24117062748842,8.436811794170515,sigmoid,25,,27.0,34.0,5.0,5.0,29.0,,,,,,,,,107.0,COMPLETE
2173,0.2439034992392958,2024-04-11 16:22:16.119495,2024-04-11 16:22:16.869509,0 days 00:00:00.750014,97.75229736390482,8.085448460907514,sigmoid,6,,,,,,,19.0,43.0,1.0202625268734833,3.8611529694389253,4.5619039367123895,20.0,37.0,58.0,,COMPLETE
2174,0.5952371952371952,2024-04-11 16:22:16.871640,2024-04-11 16:22:17.497196,0 days 00:00:00.625556,98.14199727579079,7.588248774377565,sigmoid,8,,25.0,32.0,,,,,,,,,,,,,COMPLETE
2175,0.10660741058042407,2024-04-11 16:22:17.498200,2024-04-11 16:22:18.648646,0 days 00:00:01.150446,96.06139038055981,8.29092024936879,rbf,39,2.0,,,,,,42.0,28.0,8.384371343255825,8.031013811364163,2.636205453839774,6.0,20.0,96.0,145.0,COMPLETE
2176,0.5031982460502227,2024-04-11 16:22:18.649747,2024-04-11 16:22:19.420439,0 days 00:00:00.770692,98.30441878134116,7.765646992269755,sigmoid,35,4.0,,,,,,,,6.1236281621599735,8.526062638084008,7.837407073659234,17.0,43.0,70.0,19.0,COMPLETE
2177,0.4580097208999349,2024-04-11 16:22:19.421435,2024-04-11 16:22:20.398520,0 days 00:00:00.977085,98.13065683059975,8.55152886596019,sigmoid,31,,24.0,30.0,8.0,8.0,13.0,3.0,16.0,9.63467243167859,1.8868714530041775,0.7066545026273579,19.0,42.0,88.0,194.0,COMPLETE
2178,0.4765488478296326,2024-04-11 16:22:20.400518,2024-04-11 16:22:21.084044,0 days 00:00:00.683526,94.95520190383286,7.972741752496181,sigmoid,24,,23.0,32.0,2.0,3.0,64.0,,,,,,,,,,COMPLETE
2179,0.5295494441193681,2024-04-11 16:22:21.085046,2024-04-11 16:22:21.917416,0 days 00:00:00.832370,96.50389309489316,8.178080632022409,sigmoid,3,,,,,,,,,5.788356630987391,4.06989575834479,5.953442203477578,14.0,35.0,73.0,57.0,COMPLETE
2180,0.3865776253647385,2024-04-11 16:22:21.919416,2024-04-11 16:22:22.914706,0 days 00:00:00.995290,98.05733005451772,7.921073413395816,sigmoid,22,,,,3.0,4.0,42.0,30.0,21.0,5.4039846425985125,5.898185829631746,7.508790215719683,10.0,32.0,53.0,,COMPLETE
2181,0.3950658112309015,2024-04-11 16:22:22.916928,2024-04-11 16:22:23.754665,0 days 00:00:00.837737,99.90178045055998,7.403516489300536,sigmoid,15,,26.0,31.0,,,,33.0,50.0,2.3725003537553864,5.322336195727902,3.1231759707556495,16.0,30.0,75.0,131.0,COMPLETE
2182,0.46240707150703836,2024-04-11 16:22:23.756695,2024-04-11 16:22:24.659353,0 days 00:00:00.902658,94.61986550589879,8.316427514308323,sigmoid,47,19.0,25.0,33.0,,,,9.0,48.0,1.746850017117262,3.537010468109986,3.9999248094693023,13.0,34.0,77.0,71.0,COMPLETE
2183,0.3523840950338228,2024-04-11 16:22:24.661558,2024-04-11 16:22:25.425667,0 days 00:00:00.764109,98.11017127658323,7.732529665314761,sigmoid,38,17.0,,,,,,16.0,33.0,2.002898732889328,8.2888927572144,1.2736755151047952,7.0,50.0,63.0,,COMPLETE
2184,0.6009432182607054,2024-04-11 16:22:25.427671,2024-04-11 16:22:25.988936,0 days 00:00:00.561265,99.9957682867801,8.100651665734109,sigmoid,8,,28.0,31.0,,,,,,,,,,,,,COMPLETE
2185,0.12622036262203626,2024-04-11 16:22:25.989944,2024-04-11 16:22:26.557418,0 days 00:00:00.567474,96.28318812624096,8.509238514404013,sigmoid,8,,27.0,29.0,,,,,,,,,,,,,COMPLETE
2186,0.5337179487179488,2024-04-11 16:22:26.558415,2024-04-11 16:22:27.176850,0 days 00:00:00.618435,96.43435624071091,8.881408946880455,sigmoid,9,,24.0,30.0,,,,,,,,,,,,102.0,COMPLETE
2187,0.430977408676462,2024-04-11 16:22:27.179031,2024-04-11 16:22:27.921387,0 days 00:00:00.742356,99.99143286094082,7.996158510296299,sigmoid,57,5.0,26.0,32.0,1.0,6.0,67.0,,,,,,,,,82.0,COMPLETE
2188,0.5931679318644695,2024-04-11 16:22:27.923446,2024-04-11 16:22:28.501142,0 days 00:00:00.577696,98.05027229798957,8.317933627528586,sigmoid,8,,25.0,27.0,,,,,,,,,,,,,COMPLETE
2189,0.5128439292822855,2024-04-11 16:22:28.503141,2024-04-11 16:22:29.432927,0 days 00:00:00.929786,99.9765202116321,7.672162678974786,sigmoid,14,,23.0,30.0,,,,32.0,26.0,4.120226172040514,1.4512427161286299,6.68495840141542,18.0,27.0,64.0,,COMPLETE
2190,0.38354523677906766,2024-04-11 16:22:29.434927,2024-04-11 16:22:30.176081,0 days 00:00:00.741154,94.2740611554245,8.148585147168212,sigmoid,21,,,,6.0,3.0,34.0,23.0,17.0,,,,,,,89.0,COMPLETE
2191,0.5929369437606513,2024-04-11 16:22:30.177079,2024-04-11 16:22:30.752694,0 days 00:00:00.575615,98.18990196023913,7.865253738462339,sigmoid,8,,29.0,33.0,,,,,,,,,,,,,COMPLETE
2192,0.49163271413116033,2024-04-11 16:22:30.753696,2024-04-11 16:22:31.498628,0 days 00:00:00.744932,96.1821039482053,7.50051865562458,sigmoid,28,,25.0,31.0,8.0,7.0,18.0,47.0,40.0,,,,,,,,COMPLETE
2193,0.4108567351968351,2024-04-11 16:22:31.499667,2024-04-11 16:22:32.126756,0 days 00:00:00.627089,99.94889917007004,7.177087910716624,sigmoid,16,,,,4.0,8.0,59.0,,,,,,,,,,COMPLETE
2194,0.10079634682853483,2024-04-11 16:22:32.127805,2024-04-11 16:22:33.442011,0 days 00:00:01.314206,98.19860991986421,8.104828493783188,rbf,63,21.0,27.0,29.0,2.0,2.0,70.0,45.0,6.0,9.988074459592909,0.7131111275743471,9.81427614027334,12.0,49.0,98.0,26.0,COMPLETE
2195,0.5906279643331437,2024-04-11 16:22:33.443011,2024-04-11 16:22:34.037958,0 days 00:00:00.594947,94.22237728709143,8.566174275853683,sigmoid,8,,22.0,34.0,,,,,,,,,,,,,COMPLETE
2196,0.5963643249384587,2024-04-11 16:22:34.037958,2024-04-11 16:22:34.607997,0 days 00:00:00.570039,96.61261555016327,8.346914050358347,sigmoid,8,,24.0,32.0,,,,,,,,,,,,,COMPLETE
2197,0.398562222725948,2024-04-11 16:22:34.609999,2024-04-11 16:22:35.522795,0 days 00:00:00.912796,99.94345881234538,6.593451766135257,sigmoid,46,33.0,26.0,30.0,,,,20.0,35.0,7.202375281933679,9.615849904689174,8.493087986215675,9.0,31.0,93.0,,COMPLETE
2198,0.5251183386776608,2024-04-11 16:22:35.524794,2024-04-11 16:22:36.385226,0 days 00:00:00.860432,98.13133454697372,4.4383280005935175,sigmoid,42,45.0,28.0,31.0,,,,,,4.609960909228323,4.222350106205118,5.770848204447392,5.0,38.0,78.0,,COMPLETE
2199,0.47532049471960247,2024-04-11 16:22:36.387224,2024-04-11 16:22:37.333898,0 days 00:00:00.946674,96.28875142729868,7.838931202439672,sigmoid,62,39.0,24.0,28.0,3.0,7.0,87.0,6.0,8.0,7.8013183278839175,6.589856199343174,2.124674401165441,20.0,22.0,87.0,,COMPLETE
