number,value,datetime_start,datetime_complete,duration,params_C,params_gamma,params_kernel,params_mask_number,params_rsi_window,params_so_smooth,params_so_window,params_srsi_smooth1,params_srsi_smooth2,params_srsi_window,params_tsi_window_fast,params_tsi_window_slow,params_ult_weight_1,params_ult_weight_2,params_ult_weight_3,params_ult_window_1,params_ult_window_2,params_ult_window_3,params_williams_lbp,state
8365,0.28381027048216384,2024-04-11 18:50:53.954333,2024-04-11 18:50:55.933934,0 days 00:00:01.979601,98.20510826470979,7.4293364210114055,rbf,44,28.0,25.0,31.0,,,,34.0,10.0,,,,,,,,COMPLETE
8366,0.5242232754081094,2024-04-11 18:50:55.937356,2024-04-11 18:50:57.776212,0 days 00:00:01.838856,93.14540016098032,4.580198317193849,sigmoid,13,,30.0,33.0,,,,16.0,43.0,,,,,,,150.0,COMPLETE
8367,0.44701971028259324,2024-04-11 18:50:57.779188,2024-04-11 18:50:59.307487,0 days 00:00:01.528299,98.1347207238567,7.987045322471706,sigmoid,8,,27.0,30.0,,,,,,,,,,,,,COMPLETE
8368,0.431489407812754,2024-04-11 18:50:59.310505,2024-04-11 18:51:01.756304,0 days 00:00:02.445799,96.79608271428714,8.532386834953446,sigmoid,23,,,,3.0,8.0,96.0,44.0,48.0,8.543083242894562,5.339557624550823,3.910320392160097,13.0,41.0,84.0,176.0,COMPLETE
8369,0.5147300599866695,2024-04-11 18:51:01.760309,2024-04-11 18:51:03.403982,0 days 00:00:01.643673,95.14801205321538,8.185450588850678,sigmoid,12,,22.0,32.0,,,,18.0,6.0,,,,,,,,COMPLETE
8370,0.6009432182607054,2024-04-11 18:51:03.408559,2024-04-11 18:51:05.080266,0 days 00:00:01.671707,70.90212368319541,7.7362409855581,sigmoid,8,,26.0,31.0,,,,,,,,,,,,,COMPLETE
8371,0.32702224564309107,2024-04-11 18:51:05.083263,2024-04-11 18:51:06.777498,0 days 00:00:01.694235,98.24325654030791,8.8551279383733,sigmoid,36,31.0,,,,,,41.0,11.0,,,,,,,,COMPLETE
8372,0.5034063943252278,2024-04-11 18:51:06.780474,2024-04-11 18:51:08.282202,0 days 00:00:01.501728,96.64526322342329,8.321156813406898,sigmoid,8,,25.0,36.0,,,,,,,,,,,,,COMPLETE
8373,0.37183291485962106,2024-04-11 18:51:08.285814,2024-04-11 18:51:10.691067,0 days 00:00:02.405253,94.23300421246101,8.019741646527377,sigmoid,54,8.0,,,2.0,3.0,4.0,6.0,23.0,4.834070385917372,0.6442481402664884,8.406281914024325,14.0,35.0,53.0,,COMPLETE
8374,0.5216373215652722,2024-04-11 18:51:10.694082,2024-04-11 18:51:12.881752,0 days 00:00:02.187670,98.22688789359225,7.847919398568526,sigmoid,7,,,,,,,29.0,17.0,9.18042870490864,7.976381100773903,9.632279164305459,2.0,32.0,82.0,165.0,COMPLETE
8375,0.41636902960227623,2024-04-11 18:51:12.884759,2024-04-11 18:51:14.431113,0 days 00:00:01.546354,98.17139182215651,8.446193533405697,sigmoid,1,,,,,,,,,,,,,,,113.0,COMPLETE
8376,0.12003789673140693,2024-04-11 18:51:14.434111,2024-04-11 18:51:15.914866,0 days 00:00:01.480755,95.37157221898758,7.567611603279332,sigmoid,8,,23.0,28.0,,,,,,,,,,,,,COMPLETE
8377,0.39946051986267783,2024-04-11 18:51:15.917430,2024-04-11 18:51:18.529734,0 days 00:00:02.612304,92.42445224631922,8.21389741331239,sigmoid,30,,28.0,29.0,4.0,5.0,32.0,48.0,22.0,1.0276419988867982,2.8269838260518636,4.475218915274403,18.0,50.0,61.0,,COMPLETE
8378,0.48557134570765664,2024-04-11 18:51:18.532733,2024-04-11 18:51:20.834368,0 days 00:00:02.301635,98.13504338865766,7.301818758561132,sigmoid,61,21.0,24.0,25.0,7.0,2.0,74.0,35.0,39.0,,,,,,,138.0,COMPLETE
8379,0.4894586609244329,2024-04-11 18:51:20.838962,2024-04-11 18:51:22.966981,0 days 00:00:02.128019,96.8129051344437,8.034016303789723,sigmoid,60,16.0,26.0,33.0,6.0,6.0,58.0,26.0,28.0,,,,,,,,COMPLETE
8380,0.5963245096172158,2024-04-11 18:51:22.969989,2024-04-11 18:51:24.414660,0 days 00:00:01.444671,99.96495961162448,8.701844937860658,sigmoid,8,,27.0,31.0,,,,,,,,,,,,,COMPLETE
8381,0.44701971028259324,2024-04-11 18:51:24.419273,2024-04-11 18:51:25.852145,0 days 00:00:01.432872,99.99013462202056,7.831785734025859,sigmoid,8,,25.0,30.0,,,,,,,,,,,,,COMPLETE
8382,0.5963643249384587,2024-04-11 18:51:25.855146,2024-04-11 18:51:27.402109,0 days 00:00:01.546963,83.27024172712011,8.331686974649424,sigmoid,8,,23.0,32.0,,,,,,,,,,,,,COMPLETE
8383,0.3396451722961446,2024-04-11 18:51:27.405110,2024-04-11 18:51:29.616921,0 days 00:00:02.211811,95.4906380606415,8.09683204367078,rbf,40,34.0,26.0,30.0,,,,,,,,,,,,,COMPLETE
8384,0.4519718806828977,2024-04-11 18:51:29.619922,2024-04-11 18:51:31.904709,0 days 00:00:02.284787,96.6775769548696,6.164831895441978,sigmoid,27,,38.0,31.0,1.0,4.0,42.0,,,0.5088689440771592,7.398720897626454,1.784404758046369,20.0,36.0,78.0,34.0,COMPLETE
8385,0.46455395255849136,2024-04-11 18:51:31.907280,2024-04-11 18:51:34.030360,0 days 00:00:02.123080,99.94851377975311,7.663702323577191,sigmoid,51,18.0,,,5.0,1.0,86.0,,,3.1118988338261966,1.1051717734713478,0.7273613536601333,17.0,34.0,88.0,80.0,COMPLETE
8386,0.4488311833050068,2024-04-11 18:51:34.034359,2024-04-11 18:51:35.279558,0 days 00:00:01.245199,98.18763829322211,5.857662492360273,sigmoid,32,37.0,,,,,,,,,,,,,,,COMPLETE
8387,0.16604779170853173,2024-04-11 18:51:35.283171,2024-04-11 18:51:36.702542,0 days 00:00:01.419371,94.00417374809321,8.502172408021334,sigmoid,4,,,,,,,11.0,26.0,,,,,,,,COMPLETE
8388,0.5929369437606513,2024-04-11 18:51:36.705543,2024-04-11 18:51:38.258607,0 days 00:00:01.553064,96.72447832009347,7.904248174070885,sigmoid,8,,29.0,33.0,,,,,,,,,,,,,COMPLETE
8389,0.5551483768173671,2024-04-11 18:51:38.262590,2024-04-11 18:51:39.811759,0 days 00:00:01.549169,96.5884434074998,8.245826509668133,sigmoid,33,41.0,,,,,,,,,,,,,,40.0,COMPLETE
8390,0.514354120516435,2024-04-11 18:51:39.814740,2024-04-11 18:51:41.366448,0 days 00:00:01.551708,89.36943525397041,8.049532774501875,sigmoid,5,,,,,,,7.0,13.0,,,,,,,21.0,COMPLETE
8391,0.38502205399318057,2024-04-11 18:51:41.370576,2024-04-11 18:51:43.384501,0 days 00:00:02.013925,98.20114151900994,7.769830585594953,sigmoid,45,49.0,25.0,29.0,,,,14.0,9.0,,,,,,,51.0,COMPLETE
8392,0.5404089979550102,2024-04-11 18:51:43.388732,2024-04-11 18:51:45.270903,0 days 00:00:01.882171,98.17809857025567,8.196703647195925,sigmoid,34,10.0,,,,,,,,2.100598597823135,6.657917837940299,5.436403102005676,12.0,29.0,100.0,,COMPLETE
8393,0.5883953883953884,2024-04-11 18:51:45.273902,2024-04-11 18:51:46.897796,0 days 00:00:01.623894,99.98420114769543,7.544282322950234,sigmoid,8,,17.0,34.0,,,,,,,,,,,,,COMPLETE
8394,0.4362873467444352,2024-04-11 18:51:46.900771,2024-04-11 18:51:48.507643,0 days 00:00:01.606872,94.97380672435175,8.655517342097372,sigmoid,17,,,,4.0,7.0,2.0,,,,,,,,,171.0,COMPLETE
8395,0.49229374433363554,2024-04-11 18:51:48.510644,2024-04-11 18:51:50.540514,0 days 00:00:02.029870,46.505536455084126,8.38625582350371,sigmoid,53,29.0,,,3.0,6.0,38.0,39.0,18.0,,,,,,,193.0,COMPLETE
8396,0.5952371952371952,2024-04-11 18:51:50.543513,2024-04-11 18:51:52.185217,0 days 00:00:01.641704,99.9962759988683,7.943887694060682,sigmoid,8,,24.0,32.0,,,,,,,,,,,,,COMPLETE
8397,0.4418150517741977,2024-04-11 18:51:52.188812,2024-04-11 18:51:54.305384,0 days 00:00:02.116572,99.98527735639715,8.135423171785273,sigmoid,19,,,,7.0,5.0,65.0,,,5.719928639385588,4.300586706610647,6.112373371098207,19.0,27.0,86.0,13.0,COMPLETE
8398,0.22271339379300914,2024-04-11 18:51:54.308978,2024-04-11 18:51:56.343580,0 days 00:00:02.034602,99.98838109092029,7.185446242853317,sigmoid,6,,,,,,,20.0,37.0,2.5562708071264106,3.3218658441740017,9.055462495900858,5.0,48.0,73.0,,COMPLETE
8399,0.38556072622402826,2024-04-11 18:51:56.347211,2024-04-11 18:51:58.492986,0 days 00:00:02.145775,93.08491041480626,7.772859992462685,sigmoid,18,,,,8.0,8.0,83.0,,,4.38311915943007,7.088483434011923,2.81644377327941,7.0,39.0,54.0,,COMPLETE
8400,0.4196954881966755,2024-04-11 18:51:58.495985,2024-04-11 18:52:01.118177,0 days 00:00:02.622192,96.55137807154682,8.375641609592924,sigmoid,58,14.0,28.0,31.0,2.0,1.0,77.0,,,7.834387647045009,5.60311983508714,3.555332203344191,4.0,47.0,63.0,,COMPLETE
8401,0.45047287207565956,2024-04-11 18:52:01.121149,2024-04-11 18:52:03.443128,0 days 00:00:02.321979,98.1707520569044,7.972387728807369,sigmoid,29,,26.0,28.0,3.0,7.0,48.0,38.0,40.0,,,,,,,75.0,COMPLETE
8402,0.17727717923604308,2024-04-11 18:52:03.446100,2024-04-11 18:52:05.863207,0 days 00:00:02.417107,99.999225423904,8.193772812195869,rbf,50,50.0,,,6.0,4.0,20.0,,,3.6670392852741847,4.966628089896271,7.529985626184446,16.0,31.0,89.0,,COMPLETE
8403,0.44701971028259324,2024-04-11 18:52:05.867722,2024-04-11 18:52:07.376394,0 days 00:00:01.508672,85.97078733631176,7.6158593117110405,sigmoid,8,,24.0,30.0,,,,,,,,,,,,,COMPLETE
8404,0.5512726002948708,2024-04-11 18:52:07.379580,2024-04-11 18:52:09.073690,0 days 00:00:01.694110,95.02081662193953,8.522239298061617,sigmoid,8,,27.0,49.0,,,,,,,,,,,,,COMPLETE
8405,0.3770704552440149,2024-04-11 18:52:09.077312,2024-04-11 18:52:11.202529,0 days 00:00:02.125217,96.72783617443282,7.938387974610139,sigmoid,39,4.0,,,,,,24.0,30.0,2.792546774160351,8.278599666381567,7.988266610309245,8.0,23.0,67.0,92.0,COMPLETE
8406,0.383881230116649,2024-04-11 18:52:11.205530,2024-04-11 18:52:13.117594,0 days 00:00:01.912064,98.10442750558626,8.102627200343472,sigmoid,25,,22.0,31.0,5.0,3.0,13.0,,,,,,,,,64.0,COMPLETE
8407,0.5963643249384587,2024-04-11 18:52:13.120593,2024-04-11 18:52:14.614481,0 days 00:00:01.493888,99.97208387549767,8.332194034018212,sigmoid,8,,25.0,32.0,,,,,,,,,,,,,COMPLETE
8408,0.49945332430884576,2024-04-11 18:52:14.617483,2024-04-11 18:52:16.663427,0 days 00:00:02.045944,99.98819081689827,9.065307787907761,sigmoid,24,,24.0,29.0,1.0,5.0,89.0,,,,,,,,,,COMPLETE
8409,0.4973804509733422,2024-04-11 18:52:16.666422,2024-04-11 18:52:18.422946,0 days 00:00:01.756524,94.12979631967194,7.430309536918825,sigmoid,49,36.0,,,4.0,2.0,56.0,,,,,,,,,27.0,COMPLETE
8410,0.3410545466359118,2024-04-11 18:52:18.425939,2024-04-11 18:52:20.679491,0 days 00:00:02.253552,99.97874948589187,7.77622239491765,sigmoid,22,,,,2.0,6.0,35.0,49.0,3.0,5.290712938968817,2.2372060938276133,4.990362396690899,9.0,42.0,91.0,,COMPLETE
8411,0.47446042284230383,2024-04-11 18:52:20.681484,2024-04-11 18:52:23.102515,0 days 00:00:02.421031,0.2050210934619301,8.042353787867649,sigmoid,47,42.0,26.0,33.0,,,,43.0,44.0,8.913252862608022,2.635147239171267,8.716732027480498,10.0,37.0,50.0,110.0,COMPLETE
8412,0.45719521557167975,2024-04-11 18:52:23.106518,2024-04-11 18:52:25.286315,0 days 00:00:02.179797,96.92367302247894,8.258856160844925,sigmoid,43,22.0,25.0,30.0,,,,,,1.3944430797992973,3.0338305835831076,5.898038754255099,2.0,42.0,98.0,87.0,COMPLETE
8413,0.4102733993583484,2024-04-11 18:52:25.290930,2024-04-11 18:52:27.317554,0 days 00:00:02.026624,91.95005925630878,7.836947165552337,sigmoid,35,40.0,,,,,,,,3.445256893274631,4.10402375925308,9.978723153238676,15.0,30.0,71.0,155.0,COMPLETE
8414,0.5963643249384587,2024-04-11 18:52:27.321726,2024-04-11 18:52:28.916212,0 days 00:00:01.594486,96.70342438517878,8.555182041146399,sigmoid,8,,27.0,32.0,,,,,,,,,,,,,COMPLETE
8415,0.3280649604872037,2024-04-11 18:52:28.918761,2024-04-11 18:52:30.995570,0 days 00:00:02.076809,95.15496069844652,7.658871351358632,sigmoid,38,27.0,,,,,,32.0,21.0,0.8081972521109204,3.720399695375912,5.23293691261911,3.0,44.0,58.0,,COMPLETE
8416,0.42409495854575413,2024-04-11 18:52:30.999109,2024-04-11 18:52:32.806748,0 days 00:00:01.807639,98.12559291626643,8.109199219487985,sigmoid,21,,,,8.0,8.0,26.0,36.0,27.0,,,,,,,133.0,COMPLETE
8417,0.6009432182607054,2024-04-11 18:52:32.809362,2024-04-11 18:52:34.356535,0 days 00:00:01.547173,99.97904391581098,7.919556407876406,sigmoid,8,,23.0,31.0,,,,,,,,,,,,,COMPLETE
8418,0.5622601668933872,2024-04-11 18:52:34.359135,2024-04-11 18:52:35.618974,0 days 00:00:01.259839,96.7862926001486,8.751945638813304,sigmoid,0,,,,,,,,,,,,,,,,COMPLETE
8419,0.5931679318644695,2024-04-11 18:52:35.621972,2024-04-11 18:52:37.113935,0 days 00:00:01.491963,99.9650412805637,8.323041344672129,sigmoid,8,,28.0,27.0,,,,,,,,,,,,,COMPLETE
8420,0.4690855238800444,2024-04-11 18:52:37.116963,2024-04-11 18:52:39.107990,0 days 00:00:01.991027,98.0658901923949,5.010758739337398,sigmoid,57,20.0,26.0,30.0,5.0,7.0,94.0,,,,,,,,,68.0,COMPLETE
8421,0.4693171996542783,2024-04-11 18:52:39.110972,2024-04-11 18:52:41.406597,0 days 00:00:02.295625,95.47605081472946,7.515695561546175,rbf,8,,25.0,34.0,,,,,,,,,,,,,COMPLETE
8422,0.3246394140946118,2024-04-11 18:52:41.410170,2024-04-11 18:52:43.266677,0 days 00:00:01.856507,98.27286015641711,8.224005425681051,sigmoid,3,,,,,,,,,8.447035163747746,4.564678662787105,6.820321537978348,11.0,40.0,83.0,96.0,COMPLETE
8423,0.6009432182607054,2024-04-11 18:52:43.270250,2024-04-11 18:52:44.710518,0 days 00:00:01.440268,93.67474451728883,7.946210214762675,sigmoid,8,,24.0,31.0,,,,,,,,,,,,,COMPLETE
8424,0.48782236728234796,2024-04-11 18:52:44.713518,2024-04-11 18:52:47.129953,0 days 00:00:02.416435,96.64952211181857,8.425223422731067,sigmoid,15,,29.0,32.0,,,,13.0,19.0,6.6472379336204135,8.736669483762945,1.0452948109139415,14.0,45.0,80.0,55.0,COMPLETE
8425,0.5929369437606513,2024-04-11 18:52:47.133957,2024-04-11 18:52:48.610442,0 days 00:00:01.476485,98.1630907702015,7.729568876468086,sigmoid,8,,26.0,33.0,,,,,,,,,,,,,COMPLETE
8426,0.32105811128677747,2024-04-11 18:52:48.613412,2024-04-11 18:52:50.097057,0 days 00:00:01.483645,95.25452793376157,8.068169603683145,sigmoid,9,,23.0,35.0,,,,,,,,,,,,180.0,COMPLETE
8427,0.45518138459314933,2024-04-11 18:52:50.100655,2024-04-11 18:52:52.755856,0 days 00:00:02.655201,98.15586316663665,8.207454075594297,sigmoid,31,,21.0,29.0,7.0,3.0,60.0,37.0,33.0,3.8204735774804375,1.7098819147015898,4.155472636038494,13.0,28.0,62.0,160.0,COMPLETE
8428,0.4946869919656952,2024-04-11 18:52:52.759422,2024-04-11 18:52:54.938527,0 days 00:00:02.179105,99.97701338100927,8.548448582078134,sigmoid,42,11.0,25.0,31.0,,,,,,5.022580121686257,6.034992649560981,6.434262354123924,9.0,46.0,77.0,,COMPLETE
8429,0.4000448444857298,2024-04-11 18:52:54.942478,2024-04-11 18:52:56.594954,0 days 00:00:01.652476,99.98206721758999,7.8483450282007485,sigmoid,16,,,,3.0,4.0,62.0,,,,,,,,,,COMPLETE
8430,0.44701971028259324,2024-04-11 18:52:56.599512,2024-04-11 18:52:58.057142,0 days 00:00:01.457630,96.53369423183192,8.014668000867093,sigmoid,8,,27.0,30.0,,,,,,,,,,,,,COMPLETE
8431,0.43302714357444544,2024-04-11 18:52:58.061688,2024-04-11 18:53:01.006714,0 days 00:00:02.945026,92.36993197900702,7.629072614624423,sigmoid,63,38.0,24.0,32.0,4.0,5.0,30.0,27.0,8.0,9.370153674884616,5.8286312544500944,2.553572904615669,6.0,33.0,81.0,140.0,COMPLETE
8432,0.47698823529411766,2024-04-11 18:53:01.010315,2024-04-11 18:53:03.126813,0 days 00:00:02.116498,35.986956650946226,8.379968460069321,sigmoid,28,,26.0,29.0,1.0,1.0,52.0,3.0,45.0,,,,,,,,COMPLETE
8433,0.3246394140946118,2024-04-11 18:53:03.129353,2024-04-11 18:53:05.152198,0 days 00:00:02.022845,96.72878416260863,7.337310236821605,sigmoid,10,,25.0,31.0,,,,,,8.210703698830516,6.523855657688465,7.770166500643532,10.0,43.0,96.0,,COMPLETE
8434,0.4063371925210865,2024-04-11 18:53:05.155225,2024-04-11 18:53:07.619297,0 days 00:00:02.464072,98.19656218439407,8.14258944467207,sigmoid,46,7.0,27.0,33.0,,,,23.0,25.0,7.6396114509549555,6.392663038082425,4.616622480934669,16.0,22.0,93.0,,COMPLETE
8435,0.4993831452861084,2024-04-11 18:53:07.622317,2024-04-11 18:53:09.624329,0 days 00:00:02.002012,94.42629642831454,7.840605839827704,sigmoid,41,25.0,24.0,28.0,,,,,,,,,,,,99.0,COMPLETE
8436,0.4448341684562156,2024-04-11 18:53:09.627331,2024-04-11 18:53:11.284541,0 days 00:00:01.657210,98.20988694261105,8.934027812489244,sigmoid,8,,22.0,30.0,,,,,,,,,,,,,COMPLETE
8437,0.42293520266019585,2024-04-11 18:53:11.287464,2024-04-11 18:53:13.893005,0 days 00:00:02.605541,90.26118554512243,8.274388874399365,sigmoid,62,2.0,26.0,32.0,6.0,6.0,7.0,17.0,38.0,6.032236370073131,7.590345955402952,9.442080102427603,19.0,24.0,99.0,,COMPLETE
8438,0.6009432182607054,2024-04-11 18:53:13.896990,2024-04-11 18:53:15.370699,0 days 00:00:01.473709,95.33990583729891,8.00878032720743,sigmoid,8,,23.0,31.0,,,,,,,,,,,,,COMPLETE
8439,0.37864943854791566,2024-04-11 18:53:15.373698,2024-04-11 18:53:17.363693,0 days 00:00:01.989995,19.919250107486064,8.624720930735192,rbf,2,,,,,,,,,5.561499137894791,8.426047525139907,2.178039206691598,4.0,38.0,64.0,,COMPLETE
8440,0.44701971028259324,2024-04-11 18:53:17.366692,2024-04-11 18:53:18.834604,0 days 00:00:01.467912,98.23802856442035,7.777330311642096,sigmoid,8,,29.0,30.0,,,,,,,,,,,,,COMPLETE
8441,0.424182923739549,2024-04-11 18:53:18.837608,2024-04-11 18:53:20.739917,0 days 00:00:01.902309,96.64840092132553,8.406922172412402,sigmoid,56,35.0,25.0,32.0,8.0,2.0,73.0,,,,,,,,,,COMPLETE
8442,0.16015336970948238,2024-04-11 18:53:20.742958,2024-04-11 18:53:22.441476,0 days 00:00:01.698518,93.94402275295114,7.5033396507121655,sigmoid,20,,,,2.0,7.0,22.0,40.0,34.0,,,,,,,,COMPLETE
8443,0.6009432182607054,2024-04-11 18:53:22.444474,2024-04-11 18:53:23.901110,0 days 00:00:01.456636,98.04609569155258,8.13597731929837,sigmoid,8,,27.0,31.0,,,,,,,,,,,,,COMPLETE
8444,0.48898411663328517,2024-04-11 18:53:23.904107,2024-04-11 18:53:26.068731,0 days 00:00:02.164624,98.30614891191608,7.947704398542716,sigmoid,11,,24.0,33.0,,,,,,3.2903869817812286,9.841286862312971,6.995258874981158,7.0,26.0,68.0,118.0,COMPLETE
8445,0.4705589512404238,2024-04-11 18:53:26.072251,2024-04-11 18:53:27.848445,0 days 00:00:01.776194,96.6197754064477,8.240707148881246,sigmoid,48,12.0,,,6.0,4.0,69.0,,,,,,,,,,COMPLETE
8446,0.44701971028259324,2024-04-11 18:53:27.851033,2024-04-11 18:53:29.382237,0 days 00:00:01.531204,95.44293051814012,7.645103245426347,sigmoid,8,,28.0,30.0,,,,,,,,,,,,,COMPLETE
8447,0.3941174437493519,2024-04-11 18:53:29.385260,2024-04-11 18:53:31.268783,0 days 00:00:01.883523,59.223514049832595,1.9430005091201767,sigmoid,52,33.0,,,4.0,3.0,98.0,50.0,15.0,,,,,,,,COMPLETE
8448,0.5241598355870059,2024-04-11 18:53:31.272388,2024-04-11 18:53:33.821219,0 days 00:00:02.548831,96.74597994269806,8.520428325789215,sigmoid,59,28.0,26.0,29.0,5.0,8.0,44.0,,,7.023189350578348,1.264700811121381,8.225941004773745,17.0,49.0,74.0,125.0,COMPLETE
8449,0.5168083160454169,2024-04-11 18:53:33.824263,2024-04-11 18:53:35.571407,0 days 00:00:01.747144,98.18882905464768,7.175078334545311,sigmoid,37,45.0,,,,,,12.0,16.0,,,,,,,32.0,COMPLETE
8450,0.3522564535673631,2024-04-11 18:53:35.574403,2024-04-11 18:53:37.561362,0 days 00:00:01.986959,92.4367286953267,8.061639760539766,sigmoid,13,,25.0,31.0,,,,15.0,5.0,,,,,,,197.0,COMPLETE
8451,0.46774010336797867,2024-04-11 18:53:37.566384,2024-04-11 18:53:40.109809,0 days 00:00:02.543425,9.562297219889821,7.839411298875772,sigmoid,26,,25.0,34.0,7.0,1.0,91.0,,,1.9327619773261926,9.237168644858103,1.5859948426322825,12.0,32.0,90.0,,COMPLETE
8452,0.4615993433780853,2024-04-11 18:53:40.112376,2024-04-11 18:53:42.528569,0 days 00:00:02.416193,98.31492052736063,8.373868538923059,sigmoid,55,5.0,,,3.0,5.0,81.0,45.0,24.0,2.9767538584449693,8.936531030021074,7.31105096772632,14.0,27.0,76.0,104.0,COMPLETE
8453,0.3325936969108623,2024-04-11 18:53:42.531112,2024-04-11 18:53:44.969132,0 days 00:00:02.438020,98.17323738522647,8.087951911801376,sigmoid,14,,27.0,32.0,,,,30.0,11.0,6.190944295977136,7.79539253279,5.57777553472493,5.0,48.0,79.0,,COMPLETE
8454,0.12622036262203626,2024-04-11 18:53:44.972366,2024-04-11 18:53:46.472274,0 days 00:00:01.499908,44.00131711973331,8.754889956463947,sigmoid,8,,23.0,29.0,,,,,,,,,,,,,COMPLETE
8455,0.5952371952371952,2024-04-11 18:53:46.475274,2024-04-11 18:53:48.044589,0 days 00:00:01.569315,95.55050368729013,7.876590113343761,sigmoid,8,,24.0,32.0,,,,,,,,,,,,,COMPLETE
8456,0.5931111524855706,2024-04-11 18:53:48.048612,2024-04-11 18:53:49.575960,0 days 00:00:01.527348,98.12879372261304,8.260966262037591,sigmoid,8,,26.0,26.0,,,,,,,,,,,,,COMPLETE
8457,0.4332702878420711,2024-04-11 18:53:49.578552,2024-04-11 18:53:52.077856,0 days 00:00:02.499304,93.95168747127487,7.662178636261491,sigmoid,54,16.0,,,1.0,6.0,66.0,25.0,31.0,9.674109121034961,4.722154347579244,9.207907271332296,15.0,50.0,85.0,,COMPLETE
8458,0.2555820315947401,2024-04-11 18:53:52.083476,2024-04-11 18:53:54.430328,0 days 00:00:02.346852,98.21823721365142,7.992698342194626,rbf,7,,,,,,,48.0,36.0,4.149774367787856,2.435106222381905,0.68343486503852,18.0,34.0,87.0,45.0,COMPLETE
8459,0.5147300599866695,2024-04-11 18:53:54.433315,2024-04-11 18:53:56.070733,0 days 00:00:01.637418,95.44843771397424,8.23418412007152,sigmoid,12,,46.0,31.0,,,,19.0,4.0,,,,,,,,COMPLETE
8460,0.4346980786825252,2024-04-11 18:53:56.073776,2024-04-11 18:53:58.339476,0 days 00:00:02.265700,96.97328213862043,7.46209157702043,sigmoid,23,,,,6.0,2.0,16.0,27.0,29.0,7.218603756560092,9.588617751841454,1.8854444166320268,8.0,21.0,92.0,143.0,COMPLETE
8461,0.4408266534250786,2024-04-11 18:53:58.343073,2024-04-11 18:53:59.894222,0 days 00:00:01.551149,99.99922677186757,8.474435056057533,sigmoid,8,,28.0,22.0,,,,,,,,,,,,,COMPLETE
8462,0.3374184416750094,2024-04-11 18:53:59.897221,2024-04-11 18:54:01.707392,0 days 00:00:01.810171,99.94201837931175,7.773315886472109,sigmoid,44,15.0,24.0,30.0,,,,9.0,42.0,,,,,,,,COMPLETE
8463,0.4230903570756872,2024-04-11 18:54:01.710402,2024-04-11 18:54:03.874541,0 days 00:00:02.164139,99.96308913479137,8.089288948745564,sigmoid,60,30.0,26.0,30.0,8.0,7.0,55.0,42.0,47.0,,,,,,,,COMPLETE
8464,0.5536169981720449,2024-04-11 18:54:03.877542,2024-04-11 18:54:05.400658,0 days 00:00:01.523116,39.10360733191532,8.637868430516253,sigmoid,32,3.0,,,,,,,,,,,,,,,COMPLETE
8465,0.4262338860430676,2024-04-11 18:54:05.404003,2024-04-11 18:54:06.918351,0 days 00:00:01.514348,95.28638818488048,7.916710431114293,sigmoid,8,,23.0,17.0,,,,,,,,,,,,,COMPLETE
8466,0.4645816477415395,2024-04-11 18:54:06.922904,2024-04-11 18:54:08.553105,0 days 00:00:01.630201,96.61191316113359,8.286116554693132,sigmoid,36,23.0,,,,,,33.0,50.0,,,,,,,,COMPLETE
8467,0.5098043431520104,2024-04-11 18:54:08.556116,2024-04-11 18:54:10.177270,0 days 00:00:01.621154,99.96878626129904,7.641597609185588,sigmoid,40,6.0,22.0,28.0,,,,,,,,,,,,,COMPLETE
8468,0.5370429543068426,2024-04-11 18:54:10.180865,2024-04-11 18:54:11.735526,0 days 00:00:01.554661,98.21810638785952,8.13036713162114,sigmoid,1,,,,,,,,,,,,,,,185.0,COMPLETE
