number,value,datetime_start,datetime_complete,duration,params_C,params_gamma,params_kernel,params_mask_number,params_rsi_window,params_so_smooth,params_so_window,params_srsi_smooth1,params_srsi_smooth2,params_srsi_window,params_tsi_window_fast,params_tsi_window_slow,params_ult_weight_1,params_ult_weight_2,params_ult_weight_3,params_ult_window_1,params_ult_window_2,params_ult_window_3,params_williams_lbp,state
8675,0.48149597058133164,2024-04-11 19:01:04.384397,2024-04-11 19:01:07.035522,0 days 00:00:02.651125,98.23258392195945,8.238932436774753,sigmoid,47,5.0,28.0,31.0,,,,7.0,44.0,0.728841811861753,4.362000828125307,1.8550285141259462,7.0,39.0,70.0,72.0,COMPLETE
8676,0.126809901914993,2024-04-11 19:01:07.038536,2024-04-11 19:01:08.600797,0 days 00:00:01.562261,95.49860183130698,7.358647709413775,sigmoid,8,,24.0,29.0,,,,,,,,,,,,,COMPLETE
8677,0.4686408084261331,2024-04-11 19:01:08.604406,2024-04-11 19:01:11.042761,0 days 00:00:02.438355,99.98119810498834,3.370273951930738,sigmoid,22,,,,4.0,4.0,50.0,14.0,7.0,1.9340942020686933,1.4055457665842672,4.970675916151932,13.0,46.0,89.0,,COMPLETE
8678,0.4641025641025641,2024-04-11 19:01:11.045332,2024-04-11 19:01:13.523958,0 days 00:00:02.478626,96.47942066750618,8.55208380064751,sigmoid,43,15.0,25.0,32.0,,,,,,2.5812989262220514,8.823120199138607,2.8983999544526053,6.0,31.0,74.0,101.0,COMPLETE
8679,0.5997714721005524,2024-04-11 19:01:13.527954,2024-04-11 19:01:15.107679,0 days 00:00:01.579725,99.98323010923585,8.764896682658646,sigmoid,8,,22.0,31.0,,,,,,,,,,,,,COMPLETE
8680,0.44701971028259324,2024-04-11 19:01:15.111656,2024-04-11 19:01:16.814098,0 days 00:00:01.702442,93.83732795368928,8.017004484831627,sigmoid,8,,30.0,30.0,,,,,,,,,,,,,COMPLETE
8681,0.28717301981205,2024-04-11 19:01:16.817110,2024-04-11 19:01:18.770364,0 days 00:00:01.953254,98.22202668597026,7.7014397670119505,sigmoid,3,,,,,,,,,3.481501434595528,2.8147248391105752,4.70996747360733,20.0,41.0,91.0,33.0,COMPLETE
8682,0.48265566596772724,2024-04-11 19:01:18.773899,2024-04-11 19:01:20.924996,0 days 00:00:02.151097,90.64461812123854,8.264919135554667,sigmoid,57,23.0,27.0,34.0,6.0,6.0,27.0,,,,,,,,,142.0,COMPLETE
8683,0.36682992737713227,2024-04-11 19:01:20.927986,2024-04-11 19:01:22.941492,0 days 00:00:02.013506,99.99194841684123,7.8939283915675995,sigmoid,35,25.0,,,,,,,,9.193540269826666,3.9679066153386238,6.575597471320046,18.0,43.0,63.0,64.0,COMPLETE
8684,0.4550733313379228,2024-04-11 19:01:22.946053,2024-04-11 19:01:25.097453,0 days 00:00:02.151400,96.77007252758213,8.106004073284526,rbf,8,,23.0,32.0,,,,,,,,,,,,,COMPLETE
8685,0.5622601668933872,2024-04-11 19:01:25.101454,2024-04-11 19:01:26.405722,0 days 00:00:01.304268,99.97735492076878,8.456011116495823,sigmoid,0,,,,,,,,,,,,,,,,COMPLETE
8686,0.44701971028259324,2024-04-11 19:01:26.408717,2024-04-11 19:01:28.326781,0 days 00:00:01.918064,95.13152065987823,7.602493373800445,sigmoid,8,,25.0,30.0,,,,,,,,,,,,,COMPLETE
8687,0.5012423003261038,2024-04-11 19:01:28.330800,2024-04-11 19:01:30.537651,0 days 00:00:02.206851,97.08601921162288,8.155779310846313,sigmoid,28,,26.0,33.0,2.0,3.0,59.0,12.0,24.0,,,,,,,,COMPLETE
8688,0.21900947135644847,2024-04-11 19:01:30.541648,2024-04-11 19:01:32.659720,0 days 00:00:02.118072,98.21101665541845,7.888030405303491,sigmoid,6,,,,,,,33.0,10.0,1.349227818658174,5.664218989687766,5.973736716211025,19.0,47.0,52.0,,COMPLETE
8689,0.4931420720489952,2024-04-11 19:01:32.663261,2024-04-11 19:01:34.821646,0 days 00:00:02.158385,94.14861430690698,8.357080427148215,sigmoid,38,35.0,,,,,,24.0,31.0,3.241914128876238,9.64860295051924,5.2290317737471,10.0,26.0,77.0,,COMPLETE
8690,0.33244498865559835,2024-04-11 19:01:34.824171,2024-04-11 19:01:36.578178,0 days 00:00:01.754007,98.0571543727145,8.030606722795664,sigmoid,9,,24.0,31.0,,,,,,,,,,,,52.0,COMPLETE
8691,0.49139036223322696,2024-04-11 19:01:36.582206,2024-04-11 19:01:39.139103,0 days 00:00:02.556897,96.59440987561786,7.824886162815223,sigmoid,15,,29.0,28.0,,,,43.0,15.0,9.656097103603711,7.96013096259387,3.6237159368394964,12.0,28.0,98.0,38.0,COMPLETE
8692,0.5963643249384587,2024-04-11 19:01:39.143796,2024-04-11 19:01:40.954965,0 days 00:00:01.811169,99.98759956166694,8.233189513701925,sigmoid,8,,26.0,32.0,,,,,,,,,,,,,COMPLETE
8693,0.35987997975562147,2024-04-11 19:01:40.957940,2024-04-11 19:01:43.398664,0 days 00:00:02.440724,98.17528945123537,7.466808959473157,sigmoid,46,4.0,25.0,29.0,,,,49.0,29.0,4.650634862699443,6.499396218987659,6.935414826627921,11.0,42.0,88.0,,COMPLETE
8694,0.26227882855399637,2024-04-11 19:01:43.401648,2024-04-11 19:01:45.098646,0 days 00:00:01.696998,91.99282368045844,8.596341314702663,sigmoid,2,,,,,,,,,7.679371041089922,1.1469955519659072,7.6413549041977475,16.0,32.0,68.0,,COMPLETE
8695,0.44556644059281586,2024-04-11 19:01:45.101637,2024-04-11 19:01:46.677461,0 days 00:00:01.575824,99.97851808623551,7.772316871985836,sigmoid,16,,,,7.0,1.0,20.0,,,,,,,,,,COMPLETE
8696,0.4772927043656607,2024-04-11 19:01:46.680451,2024-04-11 19:01:48.914364,0 days 00:00:02.233913,95.64524419332798,7.056983441217198,sigmoid,21,,,,1.0,7.0,38.0,41.0,41.0,,,,,,,25.0,COMPLETE
8697,0.5246262476572374,2024-04-11 19:01:48.917393,2024-04-11 19:01:51.650737,0 days 00:00:02.733344,98.17090354165293,8.046573243304572,sigmoid,14,,27.0,35.0,,,,47.0,13.0,6.253597901982573,4.579111988897236,3.300002317871713,3.0,37.0,57.0,,COMPLETE
8698,0.5963245096172158,2024-04-11 19:01:51.654251,2024-04-11 19:01:53.308540,0 days 00:00:01.654289,96.55580462956969,8.379303667219173,sigmoid,8,,23.0,31.0,,,,,,,,,,,,,COMPLETE
8699,0.43425350484174013,2024-04-11 19:01:53.311539,2024-04-11 19:01:56.306342,0 days 00:00:02.994803,93.86763731098699,7.671627429117812,sigmoid,31,,24.0,33.0,8.0,5.0,57.0,50.0,49.0,6.94051546018575,4.185044655012227,1.4755493285916401,9.0,22.0,100.0,159.0,COMPLETE
8700,0.4858941819601718,2024-04-11 19:01:56.309352,2024-04-11 19:01:59.082160,0 days 00:00:02.772808,96.56481222979586,8.923184472766012,sigmoid,62,40.0,27.0,30.0,5.0,4.0,72.0,8.0,33.0,5.428379050483223,3.3347654889841776,6.217400438207808,15.0,27.0,62.0,,COMPLETE
8701,0.20716018861877947,2024-04-11 19:01:59.085381,2024-04-11 19:02:01.876131,0 days 00:00:02.790750,98.10140350092294,8.15627857571608,rbf,42,38.0,25.0,31.0,,,,,,4.916286860745732,6.116443132640248,8.303837042216353,8.0,23.0,81.0,,COMPLETE
8702,0.5761093428196967,2024-04-11 19:02:01.880125,2024-04-11 19:02:03.596009,0 days 00:00:01.715884,98.11404952120814,7.982626176813597,sigmoid,8,,22.0,43.0,,,,,,,,,,,,,COMPLETE
8703,0.49426103945119104,2024-04-11 19:02:03.599570,2024-04-11 19:02:05.767892,0 days 00:00:02.168322,95.3046264831644,3.9980724213180174,sigmoid,10,,28.0,32.0,,,,,,1.6140194740158682,5.158137358707958,3.1120875428193,17.0,35.0,83.0,,COMPLETE
8704,0.12003789673140693,2024-04-11 19:02:05.770908,2024-04-11 19:02:07.319895,0 days 00:00:01.548987,95.3666152735715,8.28777037607919,sigmoid,8,,26.0,28.0,,,,,,,,,,,,,COMPLETE
8705,0.45156741512094595,2024-04-11 19:02:07.322915,2024-04-11 19:02:10.300004,0 days 00:00:02.977089,61.57995427993203,4.737555218555022,sigmoid,63,46.0,24.0,30.0,3.0,2.0,74.0,18.0,19.0,7.360221086262289,2.5064578621056226,0.6469028047652028,4.0,25.0,50.0,46.0,COMPLETE
8706,0.49616228070175444,2024-04-11 19:02:10.303581,2024-04-11 19:02:12.505366,0 days 00:00:02.201785,98.14253579677255,7.9100587245252845,sigmoid,11,,23.0,31.0,,,,,,1.0926406266795743,4.904352805481539,2.471190119076752,14.0,36.0,79.0,146.0,COMPLETE
8707,0.48587718256324985,2024-04-11 19:02:12.508413,2024-04-11 19:02:14.525000,0 days 00:00:02.016587,98.03353883875288,8.58706173347005,sigmoid,20,,,,2.0,3.0,85.0,30.0,7.0,,,,,,,,COMPLETE
8708,0.506372396642835,2024-04-11 19:02:14.528038,2024-04-11 19:02:16.524688,0 days 00:00:01.996650,92.8026970172835,7.629784649155667,sigmoid,41,33.0,26.0,33.0,,,,,,,,,,,,111.0,COMPLETE
8709,0.5952371952371952,2024-04-11 19:02:16.528222,2024-04-11 19:02:18.126713,0 days 00:00:01.598491,98.09152306707173,8.13779093968665,sigmoid,8,,25.0,32.0,,,,,,,,,,,,,COMPLETE
8710,0.3357689104262891,2024-04-11 19:02:18.131708,2024-04-11 19:02:20.020479,0 days 00:00:01.888771,95.50787768732746,8.41360981549035,sigmoid,37,7.0,,,,,,34.0,25.0,,,,,,,185.0,COMPLETE
8711,0.3631310639697418,2024-04-11 19:02:20.022477,2024-04-11 19:02:22.306179,0 days 00:00:02.283702,98.04332586297429,7.7845751837678545,sigmoid,26,,27.0,39.0,4.0,8.0,22.0,,,2.879272587303298,9.992413712486798,7.9858430706053545,2.0,24.0,60.0,,COMPLETE
8712,0.12622036262203626,2024-04-11 19:02:22.309159,2024-04-11 19:02:24.012279,0 days 00:00:01.703120,96.64836575995972,8.015640971602544,sigmoid,8,,25.0,29.0,,,,,,,,,,,,,COMPLETE
8713,0.30776623664658265,2024-04-11 19:02:24.014879,2024-04-11 19:02:25.595375,0 days 00:00:01.580496,49.9079026118424,7.437889445243181,sigmoid,8,,29.0,6.0,,,,,,,,,,,,,COMPLETE
8714,0.4639086223708037,2024-04-11 19:02:25.599407,2024-04-11 19:02:28.167670,0 days 00:00:02.568263,94.05393629346541,8.266769709869083,sigmoid,59,24.0,24.0,31.0,3.0,6.0,80.0,,,8.913127344248672,3.660903549517341,2.0166358978923182,19.0,29.0,76.0,116.0,COMPLETE
8715,0.2646512546927484,2024-04-11 19:02:28.171682,2024-04-11 19:02:29.862102,0 days 00:00:01.690420,98.12755424993829,7.263206039651232,sigmoid,48,14.0,,,7.0,1.0,33.0,,,,,,,,,,COMPLETE
8716,0.4626907640788364,2024-04-11 19:02:29.865656,2024-04-11 19:02:32.538994,0 days 00:00:02.673338,98.22587815841838,8.74793202346612,sigmoid,55,17.0,,,1.0,5.0,65.0,20.0,6.0,8.507362801089847,0.5012057947192083,7.190058102749761,6.0,34.0,92.0,80.0,COMPLETE
8717,0.47195731427605686,2024-04-11 19:02:32.541995,2024-04-11 19:02:34.451120,0 days 00:00:01.909125,96.6956051254144,7.956405314251604,sigmoid,52,36.0,,,6.0,8.0,55.0,40.0,35.0,,,,,,,,COMPLETE
8718,0.4132650219969928,2024-04-11 19:02:34.454123,2024-04-11 19:02:36.589951,0 days 00:00:02.135828,95.30763863057678,8.148728179672993,sigmoid,56,12.0,28.0,30.0,5.0,7.0,88.0,,,,,,,,,,COMPLETE
8719,0.5963643249384587,2024-04-11 19:02:36.592955,2024-04-11 19:02:38.190350,0 days 00:00:01.597395,98.21540963866758,8.488520268406868,sigmoid,8,,26.0,32.0,,,,,,,,,,,,,COMPLETE
8720,0.4645180543121456,2024-04-11 19:02:38.193339,2024-04-11 19:02:40.515324,0 days 00:00:02.321985,76.23998427945932,7.711149474101119,rbf,8,,23.0,29.0,,,,,,,,,,,,,COMPLETE
8721,0.35669340340201905,2024-04-11 19:02:40.517907,2024-04-11 19:02:42.656051,0 days 00:00:02.138144,99.99273558410263,7.8865992497785005,sigmoid,44,18.0,25.0,34.0,,,,31.0,37.0,,,,,,,,COMPLETE
8722,0.5350150016668519,2024-04-11 19:02:42.660085,2024-04-11 19:02:44.692502,0 days 00:00:02.032417,94.15467354456864,8.307062618054907,sigmoid,13,,21.0,31.0,,,,13.0,45.0,,,,,,,168.0,COMPLETE
8723,0.521479251773812,2024-04-11 19:02:44.695504,2024-04-11 19:02:46.698532,0 days 00:00:02.003028,99.96329417353827,8.134785015767777,sigmoid,12,,26.0,33.0,,,,36.0,8.0,,,,,,,,COMPLETE
8724,0.36272545090180364,2024-04-11 19:02:46.701519,2024-04-11 19:02:48.363927,0 days 00:00:01.662408,88.09222196141056,7.521525799828054,sigmoid,36,21.0,,,,,,28.0,50.0,,,,,,,,COMPLETE
8725,0.4095398257147226,2024-04-11 19:02:48.367490,2024-04-11 19:02:51.146290,0 days 00:00:02.778800,96.79279799816132,7.973296659138087,sigmoid,54,22.0,,,8.0,4.0,29.0,3.0,16.0,5.119990239977478,2.2403661063473597,5.83874402264278,5.0,50.0,64.0,,COMPLETE
8726,0.4448341684562156,2024-04-11 19:02:51.161939,2024-04-11 19:02:53.143948,0 days 00:00:01.982009,98.14596569804274,8.424506520876466,sigmoid,8,,24.0,30.0,,,,,,,,,,,,,COMPLETE
8727,0.5952371952371952,2024-04-11 19:02:53.155466,2024-04-11 19:02:54.977117,0 days 00:00:01.821651,55.072788699181864,7.736912723847509,sigmoid,8,,27.0,32.0,,,,,,,,,,,,,COMPLETE
8728,0.5061061587362283,2024-04-11 19:02:54.977117,2024-04-11 19:02:57.465125,0 days 00:00:02.488008,92.4043804199379,8.19920295222631,sigmoid,60,11.0,25.0,46.0,6.0,1.0,4.0,32.0,46.0,,,,,,,,COMPLETE
8729,0.4915447636869851,2024-04-11 19:02:57.469127,2024-04-11 19:02:58.802239,0 days 00:00:01.333112,95.44494491150002,7.872589504113108,sigmoid,1,,,,,,,,,,,,,,,107.0,COMPLETE
8730,0.5963245096172158,2024-04-11 19:02:58.805239,2024-04-11 19:03:00.519767,0 days 00:00:01.714528,99.98398839209342,8.643347938490614,sigmoid,8,,22.0,31.0,,,,,,,,,,,,,COMPLETE
8731,0.42733182069050096,2024-04-11 19:03:00.522763,2024-04-11 19:03:03.153713,0 days 00:00:02.630950,96.7150425861412,8.018642138154208,sigmoid,23,,,,4.0,3.0,92.0,16.0,3.0,5.965844029763556,6.879820157756027,3.826197834658272,11.0,39.0,58.0,10.0,COMPLETE
8732,0.503337041156841,2024-04-11 19:03:03.156713,2024-04-11 19:03:04.866402,0 days 00:00:01.709689,98.15960080298139,8.304650278392977,sigmoid,32,49.0,,,,,,,,,,,,,,,COMPLETE
8733,0.4504950495049505,2024-04-11 19:03:04.869404,2024-04-11 19:03:07.711147,0 days 00:00:02.841743,98.16724854651204,7.589188539293934,sigmoid,30,,27.0,30.0,1.0,7.0,48.0,42.0,28.0,7.9512460229108175,8.543131280380383,4.334080097563269,18.0,41.0,94.0,,COMPLETE
8734,0.12622036262203626,2024-04-11 19:03:07.714144,2024-04-11 19:03:09.488006,0 days 00:00:01.773862,91.00791462039311,8.115781787137903,sigmoid,8,,26.0,29.0,,,,,,,,,,,,,COMPLETE
8735,0.38924731182795697,2024-04-11 19:03:09.491006,2024-04-11 19:03:11.930197,0 days 00:00:02.439191,95.34987830216645,8.445028996100769,sigmoid,27,,24.0,32.0,2.0,2.0,8.0,,,4.072406355838162,7.259284486589403,2.7877966289135587,20.0,21.0,99.0,153.0,COMPLETE
8736,0.5246057805342738,2024-04-11 19:03:11.932193,2024-04-11 19:03:13.406573,0 days 00:00:01.474380,98.20267934170029,7.796527518900326,sigmoid,5,,,,,,,9.0,40.0,,,,,,,120.0,COMPLETE
8737,0.5224976466896768,2024-04-11 19:03:13.408573,2024-04-11 19:03:14.950446,0 days 00:00:01.541873,96.78481663072374,8.104163879365872,sigmoid,4,,,,,,,25.0,42.0,,,,,,,,COMPLETE
8738,0.12003789673140693,2024-04-11 19:03:14.953442,2024-04-11 19:03:16.785791,0 days 00:00:01.832349,99.95480614364493,8.305931470237912,sigmoid,8,,25.0,28.0,,,,,,,,,,,,,COMPLETE
8739,0.23011260443152926,2024-04-11 19:03:16.788788,2024-04-11 19:03:19.596994,0 days 00:00:02.808206,94.09086387611713,7.897563474010387,rbf,61,45.0,28.0,31.0,7.0,6.0,37.0,35.0,2.0,,,,,,,77.0,COMPLETE
8740,0.5929369437606513,2024-04-11 19:03:19.599995,2024-04-11 19:03:21.112291,0 days 00:00:01.512296,63.82106112572647,7.673911359075205,sigmoid,8,,23.0,33.0,,,,,,,,,,,,,COMPLETE
8741,0.4985515505532601,2024-04-11 19:03:21.114292,2024-04-11 19:03:23.190565,0 days 00:00:02.076273,96.62655947778612,8.617151996684212,sigmoid,7,,,,,,,22.0,34.0,2.1977403241615767,8.95619107104613,8.92957776317358,13.0,30.0,66.0,176.0,COMPLETE
8742,0.5506033982428402,2024-04-11 19:03:23.193560,2024-04-11 19:03:24.936191,0 days 00:00:01.742631,98.11138198951691,3.6551858495767657,sigmoid,34,2.0,,,,,,,,9.332129605488044,8.360631099267568,4.124106422026027,7.0,44.0,54.0,,COMPLETE
8743,0.4709581244071012,2024-04-11 19:03:24.939191,2024-04-11 19:03:27.316950,0 days 00:00:02.377759,95.30106977238616,8.05316184116302,sigmoid,51,28.0,,,3.0,5.0,77.0,,,6.743285907331362,7.751475206105265,1.1766533458543842,8.0,49.0,61.0,69.0,COMPLETE
8744,0.39297064283691513,2024-04-11 19:03:27.319951,2024-04-11 19:03:29.381965,0 days 00:00:02.062014,2.896463245901721,7.331674362457386,sigmoid,45,9.0,26.0,30.0,,,,15.0,12.0,,,,,,,93.0,COMPLETE
8745,0.5069140556625241,2024-04-11 19:03:29.384967,2024-04-11 19:03:30.859778,0 days 00:00:01.474811,93.58896004517213,8.22970290052492,sigmoid,8,,24.0,35.0,,,,,,,,,,,,,COMPLETE
8746,0.3722920744451449,2024-04-11 19:03:30.863776,2024-04-11 19:03:32.662424,0 days 00:00:01.798648,98.19015186836855,6.9125810806450945,sigmoid,17,,,,5.0,8.0,43.0,,,,,,,,,62.0,COMPLETE
8747,0.4390259470845434,2024-04-11 19:03:32.665424,2024-04-11 19:03:34.690227,0 days 00:00:02.024803,98.30931529465957,7.883240875055633,sigmoid,53,30.0,,,8.0,2.0,100.0,4.0,30.0,,,,,,,131.0,COMPLETE
8748,0.4273437008121891,2024-04-11 19:03:34.693227,2024-04-11 19:03:36.931955,0 days 00:00:02.238728,99.9985043241625,8.464925844643645,sigmoid,19,,,,4.0,6.0,2.0,,,5.281950732291132,9.826073489932893,1.0009862738229458,15.0,31.0,72.0,164.0,COMPLETE
8749,0.47695543111966965,2024-04-11 19:03:36.934951,2024-04-11 19:03:38.983522,0 days 00:00:02.048571,96.85951051664259,8.088263746999171,sigmoid,49,43.0,,,3.0,4.0,16.0,,,,,,,,,56.0,COMPLETE
8750,0.5952371952371952,2024-04-11 19:03:38.986512,2024-04-11 19:03:40.740951,0 days 00:00:01.754439,95.57867585477894,7.541678525735789,sigmoid,8,,27.0,32.0,,,,,,,,,,,,,COMPLETE
8751,0.6009432182607054,2024-04-11 19:03:40.744951,2024-04-11 19:03:42.210955,0 days 00:00:01.466004,96.92686495864797,7.762600466470964,sigmoid,8,,25.0,31.0,,,,,,,,,,,,,COMPLETE
8752,0.48445012908879886,2024-04-11 19:03:42.213955,2024-04-11 19:03:44.658432,0 days 00:00:02.444477,98.18917502731834,9.374404943065553,sigmoid,18,,,,6.0,3.0,61.0,,,5.755034925424891,1.843986863881006,9.674771842146269,10.0,47.0,90.0,,COMPLETE
8753,0.5338445656982745,2024-04-11 19:03:44.662433,2024-04-11 19:03:46.864743,0 days 00:00:02.202310,98.14561114302167,8.287695258198463,sigmoid,6,,,,,,,27.0,11.0,3.7782824026345105,9.237236919872919,6.413605501670186,18.0,48.0,51.0,,COMPLETE
8754,0.5929369437606513,2024-04-11 19:03:46.867735,2024-04-11 19:03:48.506610,0 days 00:00:01.638875,93.19679060523553,7.966096619164489,sigmoid,8,,26.0,33.0,,,,,,,,,,,,,COMPLETE
8755,0.4704434630600791,2024-04-11 19:03:48.509605,2024-04-11 19:03:51.172603,0 days 00:00:02.662998,96.72140335124288,8.190839845217058,sigmoid,50,6.0,,,2.0,1.0,71.0,,,6.477144682753964,5.448854107414638,6.748533564036522,12.0,20.0,87.0,,COMPLETE
8756,0.551717130664499,2024-04-11 19:03:51.176589,2024-04-11 19:03:53.389244,0 days 00:00:02.212655,99.95108376078218,8.861225235345298,sigmoid,40,32.0,29.0,30.0,,,,,,,,,,,,,COMPLETE
8757,0.2922722029988466,2024-04-11 19:03:53.394263,2024-04-11 19:03:55.403346,0 days 00:00:02.009083,99.97079333128795,2.745969986783347,sigmoid,33,37.0,,,,,,,,,,,,,,40.0,COMPLETE
8758,0.22862088323353288,2024-04-11 19:03:55.406348,2024-04-11 19:03:58.050637,0 days 00:00:02.644289,94.99660498706024,8.514181370750313,rbf,25,,24.0,31.0,1.0,5.0,31.0,,,,,,,,,157.0,COMPLETE
8759,0.45095155190010205,2024-04-11 19:03:58.053634,2024-04-11 19:04:01.206405,0 days 00:00:03.152771,98.13455288743398,7.82685165179751,sigmoid,58,16.0,23.0,29.0,7.0,7.0,82.0,,,8.631707343295448,2.0376552247200297,5.384740839991354,4.0,23.0,95.0,,COMPLETE
8760,0.42556547619047613,2024-04-11 19:04:01.209405,2024-04-11 19:04:04.152690,0 days 00:00:02.943285,96.44409751123324,8.016243864108679,sigmoid,29,,26.0,32.0,4.0,2.0,51.0,46.0,26.0,,,,,,,100.0,COMPLETE
8761,0.5906279643331437,2024-04-11 19:04:04.157690,2024-04-11 19:04:06.292821,0 days 00:00:02.135131,98.16925582158787,8.344235057575357,sigmoid,8,,27.0,34.0,,,,,,,,,,,,,COMPLETE
8762,0.3828132626167312,2024-04-11 19:04:06.295820,2024-04-11 19:04:09.697215,0 days 00:00:03.401395,91.63957496149789,7.611712000778121,sigmoid,47,41.0,21.0,28.0,,,,44.0,14.0,2.684649061244205,1.1899093135602525,1.77704501247843,7.0,26.0,65.0,197.0,COMPLETE
8763,0.4099776324357995,2024-04-11 19:04:09.700212,2024-04-11 19:04:12.183622,0 days 00:00:02.483410,95.4379701685157,8.162140350252068,sigmoid,24,,25.0,30.0,5.0,4.0,64.0,,,,,,,,,,COMPLETE
8764,0.5008190189481141,2024-04-11 19:04:12.186631,2024-04-11 19:04:15.140304,0 days 00:00:02.953673,99.9733487042722,8.711947861468301,sigmoid,43,47.0,24.0,32.0,,,,,,5.54569688813361,3.086495510881347,9.212424320937279,9.0,45.0,80.0,149.0,COMPLETE
8765,0.46393602296611475,2024-04-11 19:04:15.144295,2024-04-11 19:04:18.181144,0 days 00:00:03.036849,99.96985126799758,7.9418336652507895,sigmoid,22,,,,6.0,5.0,95.0,40.0,23.0,9.077454995805022,8.08215819783216,2.1916332836213215,3.0,28.0,59.0,,COMPLETE
8766,0.5986580986580987,2024-04-11 19:04:18.184145,2024-04-11 19:04:20.269278,0 days 00:00:02.085133,99.99432981161213,8.417758149344378,sigmoid,8,,28.0,31.0,,,,,,,,,,,,,COMPLETE
8767,0.12622036262203626,2024-04-11 19:04:20.272278,2024-04-11 19:04:22.345556,0 days 00:00:02.073278,96.68702013764079,7.713333805758215,sigmoid,8,,25.0,29.0,,,,,,,,,,,,,COMPLETE
8768,0.5096684779021933,2024-04-11 19:04:22.350553,2024-04-11 19:04:24.990990,0 days 00:00:02.640437,94.24794498896452,7.381369582304979,sigmoid,3,,,,,,,,,1.959266441847126,7.47733568114079,4.572504637157378,2.0,32.0,96.0,138.0,COMPLETE
8769,0.5636462904171639,2024-04-11 19:04:24.993990,2024-04-11 19:04:26.832929,0 days 00:00:01.838939,84.54350553189292,8.185219104241675,sigmoid,0,,,,,,,,,,,,,,,,COMPLETE
8770,0.39973754120923083,2024-04-11 19:04:26.836922,2024-04-11 19:04:29.699387,0 days 00:00:02.862465,98.05583968684725,7.98470868327152,sigmoid,39,34.0,,,,,,39.0,43.0,0.662241770230013,2.6648593975642547,0.5111791988513215,11.0,36.0,71.0,30.0,COMPLETE
8771,0.5929369437606513,2024-04-11 19:04:29.702387,2024-04-11 19:04:31.606257,0 days 00:00:01.903870,98.16383410471235,7.812961150751196,sigmoid,8,,22.0,33.0,,,,,,,,,,,,,COMPLETE
8772,0.3548633046509095,2024-04-11 19:04:31.611261,2024-04-11 19:04:34.149792,0 days 00:00:02.538531,95.31714847005043,8.312016295353818,sigmoid,35,19.0,,,,,,,,4.265210653119505,6.00933318763986,7.761282930171133,5.0,34.0,56.0,84.0,COMPLETE
8773,0.4863132132691335,2024-04-11 19:04:34.155798,2024-04-11 19:04:36.355784,0 days 00:00:02.199986,98.12863943495917,7.1456322980678735,sigmoid,8,,27.0,37.0,,,,,,,,,,,,,COMPLETE
8774,0.37953449360452923,2024-04-11 19:04:36.358779,2024-04-11 19:04:39.971256,0 days 00:00:03.612477,99.9723652193401,7.5204389769281805,sigmoid,31,,23.0,30.0,8.0,3.0,10.0,11.0,47.0,2.426717867541389,1.5848590245076455,5.033429757676913,17.0,43.0,82.0,183.0,COMPLETE
8775,0.3564315969383963,2024-04-11 19:04:39.974252,2024-04-11 19:04:41.980001,0 days 00:00:02.005749,93.19388954710425,8.549183688706371,sigmoid,9,,26.0,31.0,,,,,,,,,,,,190.0,COMPLETE
8776,0.25954021925158427,2024-04-11 19:04:41.984000,2024-04-11 19:04:45.058492,0 days 00:00:03.074492,96.42694734716112,8.09323481809642,rbf,21,,,,2.0,1.0,41.0,7.0,20.0,,,,,,,127.0,COMPLETE
