number,value,datetime_start,datetime_complete,duration,params_C,params_gamma,params_kernel,params_mask_number,params_rsi_window,params_so_smooth,params_so_window,params_srsi_smooth1,params_srsi_smooth2,params_srsi_window,params_tsi_window_fast,params_tsi_window_slow,params_ult_weight_1,params_ult_weight_2,params_ult_weight_3,params_ult_window_1,params_ult_window_2,params_ult_window_3,params_williams_lbp,state
6206,0.3478118994960299,2024-04-11 17:41:45.183145,2024-04-11 17:41:46.645857,0 days 00:00:01.462712,94.80364402608633,7.831395099863426,sigmoid,35,17.0,,,,,,,,3.3980701722178757,8.267649241392375,4.438296531054034,11.0,33.0,54.0,99.0,COMPLETE
6207,0.5929369437606513,2024-04-11 17:41:46.649379,2024-04-11 17:41:47.794106,0 days 00:00:01.144727,92.61004303490712,8.091831167896883,sigmoid,8,,23.0,33.0,,,,,,,,,,,,,COMPLETE
6208,0.493142461325329,2024-04-11 17:41:47.796699,2024-04-11 17:41:49.162786,0 days 00:00:01.366087,98.14394698751173,7.74099384638583,sigmoid,24,,25.0,31.0,3.0,1.0,17.0,,,,,,,,,,COMPLETE
6209,0.3537291688874676,2024-04-11 17:41:49.166327,2024-04-11 17:41:50.623553,0 days 00:00:01.457226,95.45749783085473,8.312305753450024,sigmoid,38,42.0,,,,,,34.0,49.0,3.7173717873584913,3.7658495060747237,6.9076918555055045,14.0,26.0,68.0,,COMPLETE
6210,0.45234008178926643,2024-04-11 17:41:50.626077,2024-04-11 17:41:51.955192,0 days 00:00:01.329115,99.94398846907445,8.018973633759458,sigmoid,21,,,,5.0,6.0,12.0,41.0,29.0,,,,,,,165.0,COMPLETE
6211,0.44372533156823807,2024-04-11 17:41:51.958536,2024-04-11 17:41:53.013541,0 days 00:00:01.055005,96.97160283125861,7.616815467845296,sigmoid,8,,23.0,15.0,,,,,,,,,,,,,COMPLETE
6212,0.5412537652246038,2024-04-11 17:41:53.016056,2024-04-11 17:41:54.453929,0 days 00:00:01.437873,99.97208100220894,8.222740520283114,sigmoid,3,,,,,,,,,2.272416874994307,7.505000709576457,6.755079987446328,4.0,49.0,63.0,184.0,COMPLETE
6213,0.5963643249384587,2024-04-11 17:41:54.456452,2024-04-11 17:41:55.744012,0 days 00:00:01.287560,90.77099548726805,8.460873683654263,sigmoid,8,,26.0,32.0,,,,,,,,,,,,,COMPLETE
6214,0.12622036262203626,2024-04-11 17:41:55.746550,2024-04-11 17:41:56.817229,0 days 00:00:01.070679,98.22555646413566,7.931841923728153,sigmoid,8,,24.0,29.0,,,,,,,,,,,,,COMPLETE
6215,0.032881191716119654,2024-04-11 17:41:56.820238,2024-04-11 17:41:58.965478,0 days 00:00:02.145240,96.81289314706311,8.163724935696433,rbf,31,,27.0,31.0,1.0,4.0,60.0,23.0,33.0,4.527396600994221,1.1025237726207529,6.173533536857832,8.0,37.0,81.0,190.0,COMPLETE
6216,0.31089205033419215,2024-04-11 17:41:58.967586,2024-04-11 17:42:00.573858,0 days 00:00:01.606272,94.84852712043522,8.600431060927372,sigmoid,42,50.0,25.0,34.0,,,,,,2.0270145131079653,6.345233448278123,1.8068200181784024,9.0,36.0,93.0,,COMPLETE
6217,0.39460347121945694,2024-04-11 17:42:00.576394,2024-04-11 17:42:02.096278,0 days 00:00:01.519884,99.97638126913975,7.825384796377671,sigmoid,57,3.0,26.0,30.0,6.0,2.0,54.0,,,,,,,,,110.0,COMPLETE
6218,0.5053793739433373,2024-04-11 17:42:02.099305,2024-04-11 17:42:03.588920,0 days 00:00:01.489615,98.13561343227457,7.463570628869303,sigmoid,28,,28.0,28.0,8.0,7.0,58.0,11.0,15.0,,,,,,,,COMPLETE
6219,0.5230387176882266,2024-04-11 17:42:03.591919,2024-04-11 17:42:05.394227,0 days 00:00:01.802308,96.64461833929187,8.050475616812468,sigmoid,15,,24.0,32.0,,,,39.0,50.0,7.298177785470445,3.6299540648190156,7.1787863411158455,2.0,23.0,67.0,160.0,COMPLETE
6220,0.12622036262203626,2024-04-11 17:42:05.397811,2024-04-11 17:42:06.625926,0 days 00:00:01.228115,93.79243213058136,8.921733476032667,sigmoid,8,,26.0,29.0,,,,,,,,,,,,,COMPLETE
6221,0.5170256177737474,2024-04-11 17:42:06.627901,2024-04-11 17:42:07.833222,0 days 00:00:01.205321,99.97801682684091,8.31485657244905,sigmoid,9,,27.0,33.0,,,,,,,,,,,,31.0,COMPLETE
6222,0.5550255536626917,2024-04-11 17:42:07.835886,2024-04-11 17:42:09.065600,0 days 00:00:01.229714,98.18671726623612,7.661241424744661,sigmoid,16,,,,7.0,8.0,76.0,,,,,,,,,,COMPLETE
6223,0.6009432182607054,2024-04-11 17:42:09.068200,2024-04-11 17:42:10.149205,0 days 00:00:01.081005,20.626872207317785,7.956813659436515,sigmoid,8,,23.0,31.0,,,,,,,,,,,,,COMPLETE
6224,0.5069140556625241,2024-04-11 17:42:10.151197,2024-04-11 17:42:11.289021,0 days 00:00:01.137824,95.4269617419281,8.156113535161818,sigmoid,8,,25.0,35.0,,,,,,,,,,,,,COMPLETE
6225,0.47835996411512255,2024-04-11 17:42:11.291997,2024-04-11 17:42:13.068344,0 days 00:00:01.776347,98.24257211734543,8.438288855773918,sigmoid,46,35.0,22.0,30.0,,,,49.0,8.0,4.1092005889327705,5.85993344660213,3.412523606271088,12.0,38.0,71.0,,COMPLETE
6226,0.49242647058823524,2024-04-11 17:42:13.071345,2024-04-11 17:42:14.979274,0 days 00:00:01.907929,96.86773775816422,8.724558082159616,sigmoid,14,,25.0,32.0,,,,14.0,18.0,9.171693890940217,5.493628704273367,1.5558850123962,17.0,35.0,100.0,,COMPLETE
6227,0.5484029274329486,2024-04-11 17:42:14.982268,2024-04-11 17:42:16.420872,0 days 00:00:01.438604,99.9528123470987,7.7392022135682,sigmoid,2,,,,,,,,,1.758543989241785,5.033183234518916,3.811418753646791,10.0,20.0,56.0,,COMPLETE
6228,0.4452294970429685,2024-04-11 17:42:16.423141,2024-04-11 17:42:18.531077,0 days 00:00:02.107936,99.9705040501874,7.947928218250935,sigmoid,62,44.0,24.0,30.0,2.0,3.0,92.0,45.0,39.0,0.5084169106180898,1.6209171246556173,9.374639347302992,5.0,31.0,84.0,,COMPLETE
6229,0.31934914722603414,2024-04-11 17:42:18.535081,2024-04-11 17:42:20.065136,0 days 00:00:01.530055,96.60592819567755,7.215174043866797,sigmoid,10,,26.0,24.0,,,,,,6.976842263497104,3.9928050987384216,9.627702062017566,13.0,45.0,60.0,,COMPLETE
6230,0.47805484347083044,2024-04-11 17:42:20.068742,2024-04-11 17:42:22.152854,0 days 00:00:02.084112,95.4024142180001,8.214522601269298,sigmoid,63,21.0,27.0,27.0,4.0,5.0,63.0,16.0,19.0,8.82404843117753,9.56158021968855,2.9072038991452094,15.0,41.0,87.0,130.0,COMPLETE
6231,0.5963245096172158,2024-04-11 17:42:22.154855,2024-04-11 17:42:23.248317,0 days 00:00:01.093462,98.18414523245721,8.350041067739683,sigmoid,8,,24.0,31.0,,,,,,,,,,,,,COMPLETE
6232,0.45490086567997773,2024-04-11 17:42:23.250313,2024-04-11 17:42:24.645135,0 days 00:00:01.394822,99.98037338699099,8.065323452047297,sigmoid,8,,25.0,10.0,,,,,,,,,,,,,COMPLETE
6233,0.5111236617228171,2024-04-11 17:42:24.648725,2024-04-11 17:42:26.804802,0 days 00:00:02.156077,92.44318346561676,7.789594457078698,sigmoid,11,,29.0,32.0,,,,,,9.543013554170479,2.2349111101219656,4.676799512952856,7.0,34.0,75.0,20.0,COMPLETE
6234,0.4685212734305266,2024-04-11 17:42:26.808367,2024-04-11 17:42:29.238735,0 days 00:00:02.430368,98.12729889394582,7.604559368871521,rbf,8,,28.0,29.0,,,,,,,,,,,,,COMPLETE
6235,0.33118591087561466,2024-04-11 17:42:29.242725,2024-04-11 17:42:30.704670,0 days 00:00:01.461945,95.37878919403532,8.552920210698344,sigmoid,41,33.0,26.0,33.0,,,,,,,,,,,,197.0,COMPLETE
6236,0.6009432182607054,2024-04-11 17:42:30.706669,2024-04-11 17:42:31.983598,0 days 00:00:01.276929,93.57496367323083,7.909929287522665,sigmoid,8,,25.0,31.0,,,,,,,,,,,,,COMPLETE
6237,0.48766421732353593,2024-04-11 17:42:31.986578,2024-04-11 17:42:33.568366,0 days 00:00:01.581788,96.71100418847665,8.237290356620553,sigmoid,37,37.0,,,,,,15.0,24.0,,,,,,,42.0,COMPLETE
6238,0.4502698896972542,2024-04-11 17:42:33.571334,2024-04-11 17:42:34.764975,0 days 00:00:01.193641,99.97317672709912,7.409406453219382,sigmoid,8,,23.0,30.0,,,,,,,,,,,,,COMPLETE
6239,0.5952371952371952,2024-04-11 17:42:34.767520,2024-04-11 17:42:35.901176,0 days 00:00:01.133656,99.98795687095053,8.079408173542888,sigmoid,8,,21.0,32.0,,,,,,,,,,,,,COMPLETE
6240,0.4786132262566412,2024-04-11 17:42:35.904174,2024-04-11 17:42:37.659543,0 days 00:00:01.755369,86.28434755611008,8.357011283000828,sigmoid,26,,27.0,31.0,3.0,1.0,34.0,,,6.688982587765761,0.6591850192741884,6.562803966689664,3.0,50.0,77.0,,COMPLETE
6241,0.19364916335002355,2024-04-11 17:42:37.662534,2024-04-11 17:42:38.917949,0 days 00:00:01.255415,96.68337136244526,7.885707999609235,sigmoid,48,25.0,,,1.0,5.0,26.0,,,,,,,,,,COMPLETE
6242,0.4442834328976163,2024-04-11 17:42:38.920963,2024-04-11 17:42:40.313637,0 days 00:00:01.392674,98.0379868912483,8.126142665279787,sigmoid,56,16.0,24.0,31.0,2.0,6.0,86.0,,,,,,,,,,COMPLETE
6243,0.5242232754081094,2024-04-11 17:42:40.315624,2024-04-11 17:42:41.688718,0 days 00:00:01.373094,99.98758640364619,2.141502406173738,sigmoid,13,,26.0,29.0,,,,48.0,7.0,,,,,,,146.0,COMPLETE
6244,0.5929369437606513,2024-04-11 17:42:41.691712,2024-04-11 17:42:42.771004,0 days 00:00:01.079292,94.08342835327055,7.650394932005678,sigmoid,8,,23.0,33.0,,,,,,,,,,,,,COMPLETE
6245,0.4352726429854552,2024-04-11 17:42:42.773992,2024-04-11 17:42:44.746713,0 days 00:00:01.972721,96.84043025250469,8.622709367567063,sigmoid,23,,,,4.0,4.0,82.0,3.0,46.0,2.5669869521361255,1.321382073210466,8.262624176473091,16.0,40.0,82.0,48.0,COMPLETE
6246,0.3443246670894103,2024-04-11 17:42:44.750240,2024-04-11 17:42:46.182323,0 days 00:00:01.432083,95.20543973961229,8.33878103705446,sigmoid,52,39.0,,,7.0,2.0,30.0,46.0,6.0,,,,,,,,COMPLETE
6247,0.44701971028259324,2024-04-11 17:42:46.185335,2024-04-11 17:42:47.268758,0 days 00:00:01.083423,97.96050453145654,7.8742094873177635,sigmoid,8,,25.0,30.0,,,,,,,,,,,,,COMPLETE
6248,0.30774171609929346,2024-04-11 17:42:47.271768,2024-04-11 17:42:48.555620,0 days 00:00:01.283852,98.00611386592678,8.073075148344412,sigmoid,12,,27.0,33.0,,,,42.0,12.0,,,,,,,,COMPLETE
6249,0.45171330828332673,2024-04-11 17:42:48.558205,2024-04-11 17:42:50.564438,0 days 00:00:02.006233,98.17188011343589,8.492079329498328,sigmoid,55,28.0,,,5.0,7.0,46.0,12.0,25.0,1.0273686316595407,5.994344956769415,9.826942746246246,6.0,28.0,95.0,93.0,COMPLETE
6250,0.5033594375723057,2024-04-11 17:42:50.569007,2024-04-11 17:42:52.109588,0 days 00:00:01.540581,99.99038515914775,7.514644517292351,sigmoid,44,48.0,24.0,32.0,,,,8.0,28.0,,,,,,,,COMPLETE
6251,0.3376618626088229,2024-04-11 17:42:52.111587,2024-04-11 17:42:53.685586,0 days 00:00:01.573999,95.3667697786554,8.203850090840609,sigmoid,7,,,,,,,20.0,4.0,8.242268496958637,2.9269177857589925,2.5200864522186577,8.0,25.0,50.0,119.0,COMPLETE
6252,0.5895095625828441,2024-04-11 17:42:53.688179,2024-04-11 17:42:55.045650,0 days 00:00:01.357471,92.50393809980493,7.762804048118687,sigmoid,8,,22.0,34.0,,,,,,,,,,,,,COMPLETE
6253,0.39612794612794605,2024-04-11 17:42:55.048200,2024-04-11 17:42:56.801609,0 days 00:00:01.753409,98.16775183390833,6.746829098355292,rbf,20,,,,8.0,3.0,52.0,6.0,3.0,,,,,,,,COMPLETE
6254,0.4633501151975425,2024-04-11 17:42:56.804603,2024-04-11 17:42:58.726481,0 days 00:00:01.921878,96.76077373615992,7.982217055563435,sigmoid,59,8.0,28.0,29.0,6.0,2.0,70.0,,,5.167402246691585,2.6341376615441336,5.373129812641447,18.0,46.0,74.0,134.0,COMPLETE
6255,0.46318707682465216,2024-04-11 17:42:58.730060,2024-04-11 17:43:00.602797,0 days 00:00:01.872737,95.2458993815266,8.257071812611809,sigmoid,54,22.0,,,3.0,8.0,96.0,37.0,43.0,3.1930173958188695,3.27647502625846,0.7826864509246514,20.0,21.0,76.0,,COMPLETE
6256,0.3789904326257127,2024-04-11 17:43:00.607386,2024-04-11 17:43:01.682636,0 days 00:00:01.075250,98.16631732797032,9.131968380663853,sigmoid,1,,,,,,,,,,,,,,,86.0,COMPLETE
6257,0.6009432182607054,2024-04-11 17:43:01.684634,2024-04-11 17:43:02.803591,0 days 00:00:01.118957,90.33884280206037,8.073770410215259,sigmoid,8,,34.0,31.0,,,,,,,,,,,,,COMPLETE
6258,0.3917385523915531,2024-04-11 17:43:02.806585,2024-04-11 17:43:04.567446,0 days 00:00:01.760861,96.66407899651983,7.766445227317283,sigmoid,60,4.0,26.0,31.0,2.0,6.0,43.0,31.0,17.0,,,,,,,,COMPLETE
6259,0.39326453014665946,2024-04-11 17:43:04.572011,2024-04-11 17:43:06.798405,0 days 00:00:02.226394,93.9439917160764,8.421586474498989,sigmoid,27,,32.0,30.0,5.0,4.0,66.0,,,2.815970360065798,6.534026958776373,5.883946243695646,19.0,43.0,73.0,13.0,COMPLETE
6260,0.5153167071286693,2024-04-11 17:43:06.801402,2024-04-11 17:43:07.972445,0 days 00:00:01.171043,98.26216330981919,7.980681621401609,sigmoid,40,14.0,25.0,32.0,,,,,,,,,,,,,COMPLETE
6261,0.4959422714913198,2024-04-11 17:43:07.974441,2024-04-11 17:43:09.128458,0 days 00:00:01.154017,98.24889749042917,7.593816773905259,sigmoid,32,41.0,,,,,,,,,,,,,,,COMPLETE
6262,0.5221410372491629,2024-04-11 17:43:09.131474,2024-04-11 17:43:10.395617,0 days 00:00:01.264143,96.64617601635712,8.799316381069852,sigmoid,36,11.0,,,,,,2.0,13.0,,,,,,,,COMPLETE
6263,0.12003789673140693,2024-04-11 17:43:10.398133,2024-04-11 17:43:11.734921,0 days 00:00:01.336788,98.06737859087347,8.239790388689226,sigmoid,8,,24.0,28.0,,,,,,,,,,,,,COMPLETE
6264,0.44701971028259324,2024-04-11 17:43:11.737498,2024-04-11 17:43:12.909309,0 days 00:00:01.171811,99.99326220607837,7.845891820179006,sigmoid,8,,26.0,30.0,,,,,,,,,,,,,COMPLETE
6265,0.5952371952371952,2024-04-11 17:43:12.913303,2024-04-11 17:43:14.160515,0 days 00:00:01.247212,94.804692566129,8.086540170625689,sigmoid,8,,27.0,32.0,,,,,,,,,,,,,COMPLETE
6266,0.28208919437340146,2024-04-11 17:43:14.162510,2024-04-11 17:43:15.595788,0 days 00:00:01.433278,99.98773316774854,7.297659507509415,sigmoid,34,40.0,,,,,,,,5.585825673537636,8.13403608965083,7.564004191704639,5.0,39.0,69.0,,COMPLETE
6267,0.40703750248032267,2024-04-11 17:43:15.598288,2024-04-11 17:43:16.748864,0 days 00:00:01.150576,99.96542258952954,8.481768603106424,sigmoid,33,30.0,,,,,,,,,,,,,,115.0,COMPLETE
6268,0.49033693732917305,2024-04-11 17:43:16.751868,2024-04-11 17:43:18.549788,0 days 00:00:01.797920,96.56680047918303,8.257525682322026,sigmoid,61,38.0,23.0,34.0,1.0,1.0,15.0,35.0,37.0,,,,,,,81.0,COMPLETE
6269,0.505552427075121,2024-04-11 17:43:18.551773,2024-04-11 17:43:20.258109,0 days 00:00:01.706336,92.57260891721972,7.72937800931326,sigmoid,51,32.0,,,4.0,8.0,38.0,,,4.720500350589649,0.9457601384300132,5.074581931613352,9.0,30.0,94.0,152.0,COMPLETE
6270,0.6009432182607054,2024-04-11 17:43:20.260642,2024-04-11 17:43:21.362126,0 days 00:00:01.101484,98.22681121981731,7.9054648582641285,sigmoid,8,,50.0,31.0,,,,,,,,,,,,,COMPLETE
6271,0.18290746354843365,2024-04-11 17:43:21.365145,2024-04-11 17:43:23.552420,0 days 00:00:02.187275,95.36327876786108,8.074192646168328,rbf,30,,25.0,29.0,8.0,5.0,28.0,26.0,35.0,3.569857113891074,8.535053381048591,2.1776291902523672,11.0,47.0,91.0,,COMPLETE
6272,0.3116748938124211,2024-04-11 17:43:23.555413,2024-04-11 17:43:25.336945,0 days 00:00:01.781532,98.12804411775541,6.1147265305369425,sigmoid,53,20.0,,,7.0,7.0,10.0,9.0,40.0,,,,,,,178.0,COMPLETE
6273,0.5450611251819795,2024-04-11 17:43:25.339541,2024-04-11 17:43:26.508028,0 days 00:00:01.168487,99.99243271259348,3.5545818097324355,sigmoid,4,,,,,,,38.0,48.0,,,,,,,,COMPLETE
6274,0.4062850729517397,2024-04-11 17:43:26.511546,2024-04-11 17:43:28.286920,0 days 00:00:01.775374,96.12897732680293,8.675886210133665,sigmoid,45,18.0,22.0,30.0,,,,47.0,5.0,,,,,,,52.0,COMPLETE
6275,0.5963245096172158,2024-04-11 17:43:28.289471,2024-04-11 17:43:29.458355,0 days 00:00:01.168884,99.97746090842728,8.378302102584849,sigmoid,8,,29.0,31.0,,,,,,,,,,,,,COMPLETE
6276,0.33514867661474784,2024-04-11 17:43:29.461287,2024-04-11 17:43:30.631598,0 days 00:00:01.170311,93.51199694510962,7.453012304389062,sigmoid,5,,,,,,,21.0,32.0,,,,,,,71.0,COMPLETE
6277,0.46031626126806663,2024-04-11 17:43:30.634599,2024-04-11 17:43:31.971372,0 days 00:00:01.336773,41.31381808982833,7.93518578233576,sigmoid,49,24.0,,,3.0,3.0,5.0,,,,,,,,,194.0,COMPLETE
6278,0.37407895525070395,2024-04-11 17:43:31.974364,2024-04-11 17:43:33.196584,0 days 00:00:01.222220,96.59141403553409,8.157042685784859,sigmoid,17,,,,1.0,4.0,23.0,,,,,,,,,60.0,COMPLETE
6279,0.44920266131587283,2024-04-11 17:43:33.200106,2024-04-11 17:43:34.728747,0 days 00:00:01.528641,97.0131810918683,7.77316365738509,sigmoid,18,,,,4.0,2.0,74.0,,,7.680870909166404,1.9423291582082687,3.523715695994637,17.0,32.0,56.0,,COMPLETE
6280,0.3231501686173378,2024-04-11 17:43:34.731761,2024-04-11 17:43:36.667144,0 days 00:00:01.935383,98.26290558298273,8.502046180656485,sigmoid,19,,,,6.0,6.0,19.0,,,1.3502107770730194,6.706492775678337,8.876518811780661,14.0,27.0,66.0,10.0,COMPLETE
6281,0.4737156958049802,2024-04-11 17:43:36.670784,2024-04-11 17:43:38.500583,0 days 00:00:01.829799,94.46465934077672,7.592881989850249,sigmoid,58,26.0,25.0,33.0,2.0,6.0,62.0,,,9.74026969902776,5.265621630039727,7.3132318145175965,3.0,44.0,89.0,,COMPLETE
6282,0.5963643249384587,2024-04-11 17:43:38.503574,2024-04-11 17:43:39.595115,0 days 00:00:01.091541,98.19884101139161,8.290628311082122,sigmoid,8,,26.0,32.0,,,,,,,,,,,,,COMPLETE
6283,0.41866753542922297,2024-04-11 17:43:39.597112,2024-04-11 17:43:41.140052,0 days 00:00:01.542940,32.66939626187295,8.035603244949503,sigmoid,50,35.0,,,5.0,3.0,80.0,,,4.996275933809455,7.291678082457781,4.057739815161437,15.0,26.0,97.0,,COMPLETE
6284,0.45024875621890553,2024-04-11 17:43:41.143039,2024-04-11 17:43:42.234465,0 days 00:00:01.091426,98.1817590774727,5.255157967581428,sigmoid,8,,24.0,28.0,,,,,,,,,,,,,COMPLETE
6285,0.5517628655088043,2024-04-11 17:43:42.236450,2024-04-11 17:43:43.676391,0 days 00:00:01.439941,95.46223396023278,8.188794443738209,sigmoid,6,,,,,,,40.0,41.0,6.132229793910056,5.712429993041436,2.8159474611289017,7.0,24.0,96.0,,COMPLETE
6286,0.3986243816493866,2024-04-11 17:43:43.679910,2024-04-11 17:43:45.137283,0 days 00:00:01.457373,2.3447063138133473,7.867728319394341,sigmoid,25,,27.0,30.0,8.0,1.0,83.0,,,,,,,,,102.0,COMPLETE
6287,0.5963643249384587,2024-04-11 17:43:45.140807,2024-04-11 17:43:46.275607,0 days 00:00:01.134800,99.95629573432385,8.377927748670944,sigmoid,8,,23.0,32.0,,,,,,,,,,,,,COMPLETE
6288,0.3739065879087182,2024-04-11 17:43:46.278648,2024-04-11 17:43:47.668815,0 days 00:00:01.390167,96.66857866907651,7.050240161626485,sigmoid,24,,26.0,31.0,6.0,5.0,50.0,,,,,,,,,,COMPLETE
6289,0.12622036262203626,2024-04-11 17:43:47.670984,2024-04-11 17:43:49.300665,0 days 00:00:01.629681,38.82607254456798,9.551461287870977,sigmoid,8,,30.0,29.0,,,,,,,,,,,,,COMPLETE
6290,0.44540141494924634,2024-04-11 17:43:49.304712,2024-04-11 17:43:52.062696,0 days 00:00:02.757984,98.10621827861766,8.030660998735737,rbf,8,,28.0,33.0,,,,,,,,,,,,,COMPLETE
6291,0.40423699071563024,2024-04-11 17:43:52.065680,2024-04-11 17:43:54.750534,0 days 00:00:02.684854,93.91330135718827,8.646011247858308,sigmoid,43,34.0,25.0,31.0,,,,,,0.7078549005236745,4.878988652747309,8.540360290619267,4.0,22.0,80.0,35.0,COMPLETE
6292,0.42060864582670143,2024-04-11 17:43:54.755559,2024-04-11 17:43:56.988232,0 days 00:00:02.232673,91.52550708432871,7.725085365600205,sigmoid,29,,24.0,30.0,3.0,7.0,91.0,44.0,21.0,,,,,,,141.0,COMPLETE
6293,0.4083595558985929,2024-04-11 17:43:56.991763,2024-04-11 17:43:59.481825,0 days 00:00:02.490062,99.9525512046589,8.201325286766625,sigmoid,39,9.0,,,,,,4.0,20.0,8.569639859808541,4.096685426439452,4.264407312986874,10.0,41.0,58.0,39.0,COMPLETE
6294,0.5086791205157878,2024-04-11 17:43:59.488373,2024-04-11 17:44:01.951663,0 days 00:00:02.463290,96.75816217858721,7.534537680980923,sigmoid,38,12.0,,,,,,22.0,26.0,4.38426731892842,6.1438843325356345,3.2134257606559444,6.0,34.0,79.0,,COMPLETE
6295,0.4874208496081904,2024-04-11 17:44:01.957694,2024-04-11 17:44:04.759438,0 days 00:00:02.801744,63.03474112086804,7.935542649785563,sigmoid,47,31.0,27.0,32.0,,,,18.0,22.0,7.45939198891835,6.986128673334474,6.352060049551719,12.0,29.0,65.0,125.0,COMPLETE
6296,0.5128833177244675,2024-04-11 17:44:04.763424,2024-04-11 17:44:06.795270,0 days 00:00:02.031846,80.8973664885765,8.482598604119017,sigmoid,35,7.0,,,,,,,,1.9541746177744166,4.576642370072953,6.13047509971075,11.0,42.0,84.0,17.0,COMPLETE
6297,0.49045448946914644,2024-04-11 17:44:06.798280,2024-04-11 17:44:09.646708,0 days 00:00:02.848428,99.99804860208349,8.136125134066251,sigmoid,31,,25.0,35.0,7.0,8.0,56.0,50.0,9.0,6.478692283381553,4.4022968420405455,5.579709087560892,2.0,48.0,92.0,170.0,COMPLETE
6298,0.6009432182607054,2024-04-11 17:44:09.650240,2024-04-11 17:44:11.207209,0 days 00:00:01.556969,96.55855397493256,7.813343218937702,sigmoid,8,,26.0,31.0,,,,,,,,,,,,,COMPLETE
6299,0.36608412603103374,2024-04-11 17:44:11.210341,2024-04-11 17:44:13.897528,0 days 00:00:02.687187,98.23060693671955,8.24363366240311,sigmoid,22,,,,5.0,2.0,36.0,24.0,2.0,9.258745451608386,3.52929804541754,4.841512009209697,14.0,23.0,72.0,,COMPLETE
6300,0.3793281496780464,2024-04-11 17:44:13.900532,2024-04-11 17:44:16.481639,0 days 00:00:02.581107,94.69953587379457,7.984212172064607,sigmoid,15,,23.0,30.0,,,,29.0,15.0,1.611221079661389,8.836840600484823,1.1053953501803155,20.0,33.0,54.0,76.0,COMPLETE
6301,0.2870282270853155,2024-04-11 17:44:16.484632,2024-04-11 17:44:18.393565,0 days 00:00:01.908933,96.48213248640637,7.617353906995614,sigmoid,3,,,,,,,,,3.922385465924358,7.694597527851032,8.158050739511138,13.0,38.0,67.0,29.0,COMPLETE
6302,0.49757584845304137,2024-04-11 17:44:18.396570,2024-04-11 17:44:20.405640,0 days 00:00:02.009070,98.22952779985074,8.882088973981624,sigmoid,21,,,,1.0,1.0,8.0,17.0,30.0,,,,,,,183.0,COMPLETE
6303,0.5883953883953884,2024-04-11 17:44:20.408635,2024-04-11 17:44:22.118067,0 days 00:00:01.709432,98.24603982732138,7.344383561267818,sigmoid,8,,28.0,34.0,,,,,,,,,,,,,COMPLETE
6304,0.3842657656310738,2024-04-11 17:44:22.121629,2024-04-11 17:44:24.219667,0 days 00:00:02.098038,95.07528043457019,8.345730718631097,sigmoid,28,,24.0,27.0,7.0,4.0,40.0,7.0,11.0,,,,,,,,COMPLETE
6305,0.4356757262041084,2024-04-11 17:44:24.222702,2024-04-11 17:44:25.796826,0 days 00:00:01.574124,98.21134223937005,8.036637004586746,sigmoid,8,,25.0,23.0,,,,,,,,,,,,,COMPLETE
6306,0.5929369437606513,2024-04-11 17:44:25.799943,2024-04-11 17:44:27.329680,0 days 00:00:01.529737,96.65450546864102,8.58166172029912,sigmoid,8,,26.0,33.0,,,,,,,,,,,,,COMPLETE
6307,0.4537160407398207,2024-04-11 17:44:27.332645,2024-04-11 17:44:29.005366,0 days 00:00:01.672721,91.69994403355656,7.816138328596421,sigmoid,16,,,,6.0,3.0,47.0,,,,,,,,,,COMPLETE
6308,0.5386245974481269,2024-04-11 17:44:29.008364,2024-04-11 17:44:30.862234,0 days 00:00:01.853870,98.32893771615372,8.31151657206989,sigmoid,9,,19.0,30.0,,,,,,,,,,,,96.0,COMPLETE
