number,value,datetime_start,datetime_complete,duration,params_C,params_gamma,params_kernel,params_mask_number,params_rsi_window,params_so_smooth,params_so_window,params_srsi_smooth1,params_srsi_smooth2,params_srsi_window,params_tsi_window_fast,params_tsi_window_slow,params_ult_weight_1,params_ult_weight_2,params_ult_weight_3,params_ult_window_1,params_ult_window_2,params_ult_window_3,params_williams_lbp,state
7542,0.1069625013430751,2024-04-11 18:24:04.357224,2024-04-11 18:24:06.850512,0 days 00:00:02.493288,95.27017759880093,7.9154037593390045,rbf,57,15.0,23.0,29.0,4.0,5.0,71.0,,,,,,,,,165.0,COMPLETE
7543,0.44701971028259324,2024-04-11 18:24:06.853528,2024-04-11 18:24:08.320819,0 days 00:00:01.467291,93.55854739312734,8.167706380564447,sigmoid,8,,25.0,30.0,,,,,,,,,,,,,COMPLETE
7544,0.5076373919291659,2024-04-11 18:24:08.324408,2024-04-11 18:24:10.563086,0 days 00:00:02.238678,98.1992419331558,8.49234699206645,sigmoid,14,,27.0,32.0,,,,16.0,5.0,8.997539469808252,9.658636032911673,8.248574123353398,15.0,41.0,83.0,,COMPLETE
7545,0.5964426137427449,2024-04-11 18:24:10.566089,2024-04-11 18:24:12.030454,0 days 00:00:01.464365,96.66158095808291,4.709281288488536,sigmoid,8,,24.0,31.0,,,,,,,,,,,,,COMPLETE
7546,0.4033558366651373,2024-04-11 18:24:12.033443,2024-04-11 18:24:14.937514,0 days 00:00:02.904071,81.30822784654414,7.786174124469176,sigmoid,63,12.0,25.0,33.0,8.0,2.0,10.0,10.0,35.0,5.128508251710276,4.292227386510783,0.9018407914392252,14.0,39.0,90.0,175.0,COMPLETE
7547,0.46246614543410497,2024-04-11 18:24:14.941050,2024-04-11 18:24:17.756703,0 days 00:00:02.815653,99.94379271470216,8.782719494411358,sigmoid,62,34.0,26.0,28.0,6.0,7.0,60.0,7.0,33.0,4.154552489565859,6.5292705456645646,4.915154821292353,17.0,23.0,50.0,,COMPLETE
7548,0.2680227573844595,2024-04-11 18:24:17.760262,2024-04-11 18:24:19.556544,0 days 00:00:01.796282,99.99869297284441,8.050864065520361,sigmoid,2,,,,,,,,,6.459123729555747,1.367065998924903,0.6676198437995886,9.0,29.0,88.0,,COMPLETE
7549,0.3290310852572259,2024-04-11 18:24:19.560093,2024-04-11 18:24:21.648432,0 days 00:00:02.088339,95.21136821463912,7.603154424631086,sigmoid,10,,30.0,30.0,,,,,,7.130452654700786,7.543072319147897,1.3589645825104566,5.0,34.0,65.0,,COMPLETE
7550,0.5929369437606513,2024-04-11 18:24:21.651965,2024-04-11 18:24:23.150884,0 days 00:00:01.498919,98.20301634920949,8.288415621127877,sigmoid,8,,21.0,33.0,,,,,,,,,,,,,COMPLETE
7551,0.4534949123076137,2024-04-11 18:24:23.154894,2024-04-11 18:24:25.591577,0 days 00:00:02.436683,99.98738092069156,7.941989342117289,sigmoid,26,,28.0,32.0,2.0,6.0,83.0,,,0.9711017464761316,0.7640531863954347,7.377466526961569,19.0,35.0,70.0,,COMPLETE
7552,0.38841201716738194,2024-04-11 18:24:25.593571,2024-04-11 18:24:27.796340,0 days 00:00:02.202769,96.32981273633166,8.166909355610091,sigmoid,46,49.0,23.0,31.0,,,,29.0,16.0,5.463905089420237,3.9168951685983058,6.162185038643222,20.0,25.0,75.0,,COMPLETE
7553,0.45572618038590024,2024-04-11 18:24:27.799850,2024-04-11 18:24:29.590284,0 days 00:00:01.790434,92.16725829460816,8.393171167602631,sigmoid,20,,,,5.0,4.0,94.0,47.0,17.0,,,,,,,,COMPLETE
7554,0.37126892063941147,2024-04-11 18:24:29.593296,2024-04-11 18:24:31.697296,0 days 00:00:02.104000,96.7228699481838,7.800725266579772,sigmoid,11,,24.0,29.0,,,,,,3.5375002695028126,2.6964181222278594,3.215750130917961,3.0,47.0,81.0,155.0,COMPLETE
7555,0.5256838181108847,2024-04-11 18:24:31.700822,2024-04-11 18:24:33.511590,0 days 00:00:01.810768,98.2096710422478,8.02833594222251,sigmoid,41,46.0,27.0,30.0,,,,,,,,,,,,112.0,COMPLETE
7556,0.5964036904537752,2024-04-11 18:24:33.513574,2024-04-11 18:24:35.031130,0 days 00:00:01.517556,99.9991981524497,7.327281078840796,sigmoid,8,,26.0,31.0,,,,,,,,,,,,,COMPLETE
7557,0.4136953739257634,2024-04-11 18:24:35.034133,2024-04-11 18:24:36.620613,0 days 00:00:01.586480,94.44997886990997,8.591161941945629,sigmoid,16,,,,6.0,3.0,87.0,,,,,,,,,,COMPLETE
7558,0.5952371952371952,2024-04-11 18:24:36.623601,2024-04-11 18:24:38.099651,0 days 00:00:01.476050,96.72291804209578,7.615394587525254,sigmoid,8,,25.0,32.0,,,,,,,,,,,,,COMPLETE
7559,0.5906279643331437,2024-04-11 18:24:38.102667,2024-04-11 18:24:39.744085,0 days 00:00:01.641418,99.94678265941631,8.232314227532935,sigmoid,8,,24.0,34.0,,,,,,,,,,,,,COMPLETE
7560,0.48706761417075967,2024-04-11 18:24:39.748101,2024-04-11 18:24:41.790291,0 days 00:00:02.042190,94.25534893539555,7.91410427601987,sigmoid,56,32.0,26.0,31.0,4.0,8.0,73.0,,,,,,,,,,COMPLETE
7561,0.4149608620181443,2024-04-11 18:24:41.793318,2024-04-11 18:24:43.654595,0 days 00:00:01.861277,97.97594366802612,8.119858292726184,sigmoid,52,17.0,,,7.0,1.0,98.0,15.0,13.0,,,,,,,,COMPLETE
7562,0.35817127260320714,2024-04-11 18:24:43.656593,2024-04-11 18:24:45.668632,0 days 00:00:02.012039,98.18246482968017,8.427733036190476,rbf,48,39.0,,,1.0,5.0,22.0,,,,,,,,,,COMPLETE
7563,0.4647818606681561,2024-04-11 18:24:45.672168,2024-04-11 18:24:48.379024,0 days 00:00:02.706856,96.3933822727436,7.6818561336457245,sigmoid,59,19.0,23.0,27.0,2.0,2.0,30.0,,,3.033003224769087,8.755059825232753,3.7560691629191827,13.0,21.0,73.0,20.0,COMPLETE
7564,0.44701971028259324,2024-04-11 18:24:48.382568,2024-04-11 18:24:50.042544,0 days 00:00:01.659976,98.3098224740184,7.948435099805799,sigmoid,8,,27.0,30.0,,,,,,,,,,,,,COMPLETE
7565,0.42916105614425387,2024-04-11 18:24:50.044538,2024-04-11 18:24:52.691307,0 days 00:00:02.646769,99.98298002848436,8.267224910613074,sigmoid,55,35.0,,,8.0,6.0,43.0,28.0,9.0,9.328836765207296,6.061997292311434,5.481039459717258,11.0,28.0,96.0,10.0,COMPLETE
7566,0.3479830005396654,2024-04-11 18:24:52.694303,2024-04-11 18:24:54.709119,0 days 00:00:02.014816,90.6543118157496,8.66371506447842,sigmoid,44,24.0,29.0,33.0,,,,21.0,28.0,,,,,,,,COMPLETE
7567,0.12622036262203626,2024-04-11 18:24:54.711646,2024-04-11 18:24:56.393209,0 days 00:00:01.681563,60.56262096471939,7.78465610419784,sigmoid,8,,25.0,29.0,,,,,,,,,,,,,COMPLETE
7568,0.5952371952371952,2024-04-11 18:24:56.396208,2024-04-11 18:24:58.038757,0 days 00:00:01.642549,99.97796868799271,8.091208305218442,sigmoid,8,,24.0,32.0,,,,,,,,,,,,,COMPLETE
7569,0.5366688092226669,2024-04-11 18:24:58.043308,2024-04-11 18:25:00.051244,0 days 00:00:02.007936,95.43143157513099,7.449357153427468,sigmoid,12,,25.0,31.0,,,,25.0,21.0,,,,,,,,COMPLETE
7570,0.32269933995903194,2024-04-11 18:25:00.055229,2024-04-11 18:25:01.717814,0 days 00:00:01.662585,74.63154644606752,8.391425354462264,sigmoid,37,10.0,,,,,,46.0,44.0,,,,,,,50.0,COMPLETE
7571,0.31501573782632847,2024-04-11 18:25:01.720320,2024-04-11 18:25:03.355608,0 days 00:00:01.635288,96.59809610353105,7.967432007876795,sigmoid,36,20.0,,,,,,41.0,20.0,,,,,,,,COMPLETE
7572,0.40933269628921803,2024-04-11 18:25:03.358617,2024-04-11 18:25:05.683854,0 days 00:00:02.325237,93.40990112253283,8.213921769886316,sigmoid,60,5.0,45.0,30.0,3.0,4.0,77.0,30.0,39.0,,,,,,,,COMPLETE
7573,0.3710987926190295,2024-04-11 18:25:05.686846,2024-04-11 18:25:07.588490,0 days 00:00:01.901644,96.62385023505102,7.15693463425107,sigmoid,13,,7.0,35.0,,,,12.0,45.0,,,,,,,118.0,COMPLETE
7574,0.5952371952371952,2024-04-11 18:25:07.590994,2024-04-11 18:25:09.264248,0 days 00:00:01.673254,98.10912383934344,7.767176130435551,sigmoid,8,,26.0,32.0,,,,,,,,,,,,,COMPLETE
7575,0.5682728281100186,2024-04-11 18:25:09.267321,2024-04-11 18:25:10.969944,0 days 00:00:01.702623,98.29575132295804,8.935801172938408,sigmoid,8,,22.0,16.0,,,,,,,,,,,,,COMPLETE
7576,0.5072265495708201,2024-04-11 18:25:10.973488,2024-04-11 18:25:13.074783,0 days 00:00:02.101295,53.678223660185466,8.062211605296016,sigmoid,7,,,,,,,40.0,11.0,4.485980602997389,8.394960276380434,9.68715363566909,9.0,38.0,89.0,107.0,COMPLETE
7577,0.4874799825302082,2024-04-11 18:25:13.077775,2024-04-11 18:25:15.603225,0 days 00:00:02.525450,99.9547964200661,8.395380685930764,sigmoid,61,22.0,28.0,28.0,5.0,8.0,51.0,37.0,8.0,,,,,,,172.0,COMPLETE
7578,0.13796388928588443,2024-04-11 18:25:15.605223,2024-04-11 18:25:16.962366,0 days 00:00:01.357143,95.12032442338544,7.550332308846638,sigmoid,32,37.0,,,,,,,,,,,,,,,COMPLETE
7579,0.42036425864808696,2024-04-11 18:25:16.965360,2024-04-11 18:25:19.274387,0 days 00:00:02.309027,99.98048763761307,7.881840731928697,sigmoid,54,26.0,,,6.0,7.0,35.0,22.0,14.0,7.7902404857835075,1.2287860676318578,4.3277765182370835,14.0,48.0,67.0,,COMPLETE
7580,0.481063122923588,2024-04-11 18:25:19.278390,2024-04-11 18:25:21.480190,0 days 00:00:02.201800,98.01601834592464,8.195072584100942,rbf,8,,26.0,30.0,,,,,,,,,,,,,COMPLETE
7581,0.41441523949079584,2024-04-11 18:25:21.482723,2024-04-11 18:25:23.986186,0 days 00:00:02.503463,96.71025448781492,8.57343591862845,sigmoid,23,,,,7.0,6.0,17.0,14.0,47.0,3.7401409740502443,3.318889414581146,1.7251585882938842,2.0,50.0,91.0,135.0,COMPLETE
7582,0.37058428065028726,2024-04-11 18:25:23.989182,2024-04-11 18:25:26.402533,0 days 00:00:02.413351,99.97386447329065,8.025508908030481,sigmoid,27,,27.0,31.0,4.0,3.0,8.0,,,4.826494749886008,6.683834406567543,7.065895657042211,4.0,46.0,68.0,58.0,COMPLETE
7583,0.42510715753625744,2024-04-11 18:25:26.405530,2024-04-11 18:25:29.038892,0 days 00:00:02.633362,93.88261392800791,9.166730085837044,sigmoid,30,,23.0,33.0,3.0,1.0,26.0,39.0,50.0,1.4834593000040308,2.3060712435860777,6.653749197271837,10.0,37.0,59.0,,COMPLETE
7584,0.5402985074626865,2024-04-11 18:25:29.041565,2024-04-11 18:25:30.864614,0 days 00:00:01.823049,99.97311114555177,7.757006629955145,sigmoid,40,30.0,24.0,29.0,,,,,,,,,,,,,COMPLETE
7585,0.5963643249384587,2024-04-11 18:25:30.868598,2024-04-11 18:25:32.477311,0 days 00:00:01.608713,96.64760813284119,8.259905697564754,sigmoid,8,,25.0,32.0,,,,,,,,,,,,,COMPLETE
7586,0.5974957313602731,2024-04-11 18:25:32.480310,2024-04-11 18:25:34.038465,0 days 00:00:01.558155,99.9861206535615,8.456677800081739,sigmoid,8,,26.0,31.0,,,,,,,,,,,,,COMPLETE
7587,0.5492828933693619,2024-04-11 18:25:34.041986,2024-04-11 18:25:35.548036,0 days 00:00:01.506050,99.95203049624911,7.933603240309848,sigmoid,33,2.0,,,,,,,,,,,,,,42.0,COMPLETE
7588,0.518200408997955,2024-04-11 18:25:35.550027,2024-04-11 18:25:37.249834,0 days 00:00:01.699807,95.17211873208144,8.146169876930388,sigmoid,5,,,,,,,27.0,26.0,,,,,,,103.0,COMPLETE
7589,0.4885290148448043,2024-04-11 18:25:37.252367,2024-04-11 18:25:38.724601,0 days 00:00:01.472234,92.61425985980034,7.595735353288554,sigmoid,1,,,,,,,,,,,,,,,37.0,COMPLETE
7590,0.31525611590531233,2024-04-11 18:25:38.727600,2024-04-11 18:25:40.638173,0 days 00:00:01.910573,96.6185092891468,8.327878982720446,sigmoid,34,7.0,,,,,,,,8.595786329811142,4.863265857829143,1.162222485872669,12.0,30.0,94.0,,COMPLETE
7591,0.45498061238133436,2024-04-11 18:25:40.641689,2024-04-11 18:25:42.928236,0 days 00:00:02.286547,57.39184388397344,7.835516022463566,sigmoid,51,31.0,,,7.0,2.0,85.0,,,5.998268294251099,5.183099703722198,8.912496765175844,16.0,27.0,63.0,79.0,COMPLETE
7592,0.37010331467929397,2024-04-11 18:25:42.930230,2024-04-11 18:25:45.010840,0 days 00:00:02.080610,98.13681516685992,8.061197175048244,sigmoid,45,12.0,28.0,30.0,,,,50.0,40.0,,,,,,,145.0,COMPLETE
7593,0.5952371952371952,2024-04-11 18:25:45.014394,2024-04-11 18:25:46.642183,0 days 00:00:01.627789,99.99770160288092,7.415122772957602,sigmoid,8,,24.0,32.0,,,,,,,,,,,,,COMPLETE
7594,0.5831142381040548,2024-04-11 18:25:46.645209,2024-04-11 18:25:48.199741,0 days 00:00:01.554532,96.70898483756493,8.780894864572993,sigmoid,8,,27.0,38.0,,,,,,,,,,,,,COMPLETE
7595,0.5657348087749952,2024-04-11 18:25:48.202245,2024-04-11 18:25:49.750892,0 days 00:00:01.548647,99.96632160932312,8.554431222680618,sigmoid,4,,,,,,,4.0,30.0,,,,,,,,COMPLETE
7596,0.43493169177601376,2024-04-11 18:25:49.754473,2024-04-11 18:25:52.359076,0 days 00:00:02.604603,99.99724056709948,8.266691954180276,sigmoid,58,42.0,25.0,45.0,1.0,5.0,66.0,,,6.750087396864233,8.030692240380873,5.210343606687665,18.0,31.0,62.0,,COMPLETE
7597,0.4291063875643202,2024-04-11 18:25:52.362067,2024-04-11 18:25:54.326399,0 days 00:00:01.964332,94.94026123156584,7.7419646461508265,sigmoid,17,,,,5.0,4.0,55.0,,,,,,,,,32.0,COMPLETE
7598,0.6009432182607054,2024-04-11 18:25:54.330402,2024-04-11 18:25:55.943876,0 days 00:00:01.613474,99.97007164408956,8.012645100366354,sigmoid,8,,23.0,31.0,,,,,,,,,,,,,COMPLETE
7599,0.5302429777701189,2024-04-11 18:25:55.946871,2024-04-11 18:25:58.038792,0 days 00:00:02.091921,98.15355706237841,8.168766884488878,sigmoid,18,,,,3.0,7.0,39.0,,,8.30480580189421,6.295778788415066,7.754730648861461,7.0,49.0,69.0,,COMPLETE
7600,0.46423783153599535,2024-04-11 18:25:58.042405,2024-04-11 18:26:00.417405,0 days 00:00:02.375000,96.71700420111945,7.887241632226046,rbf,8,,26.0,34.0,,,,,,,,,,,,,COMPLETE
7601,0.38727086925975596,2024-04-11 18:26:00.420392,2024-04-11 18:26:02.751193,0 days 00:00:02.330801,99.98653091232748,7.61043059875672,sigmoid,29,,25.0,50.0,8.0,5.0,46.0,43.0,37.0,,,,,,,184.0,COMPLETE
7602,0.4776505155480588,2024-04-11 18:26:02.754611,2024-04-11 18:26:04.700982,0 days 00:00:01.946371,99.99860765937909,8.405746066763786,sigmoid,53,14.0,,,2.0,3.0,6.0,33.0,23.0,,,,,,,139.0,COMPLETE
7603,0.2763575147790001,2024-04-11 18:26:04.705551,2024-04-11 18:26:06.880417,0 days 00:00:02.174866,93.68530601027726,8.047400432403839,sigmoid,6,,,,,,,11.0,22.0,7.605526299299154,6.9946528915171235,2.5166324047924724,8.0,33.0,82.0,,COMPLETE
7604,0.34429688040395656,2024-04-11 18:26:06.882915,2024-04-11 18:26:09.214037,0 days 00:00:02.331122,96.69064486072212,8.302394315626799,sigmoid,19,,,,4.0,6.0,11.0,,,6.2236675714777805,5.677614714454699,9.876838733727638,6.0,40.0,77.0,161.0,COMPLETE
7605,0.12622036262203626,2024-04-11 18:26:09.218953,2024-04-11 18:26:10.947323,0 days 00:00:01.728370,98.25458615945713,7.8227136010698946,sigmoid,8,,24.0,29.0,,,,,,,,,,,,,COMPLETE
7606,0.42826414282641423,2024-04-11 18:26:10.950310,2024-04-11 18:26:13.472605,0 days 00:00:02.522295,96.62023632953387,8.611782435171582,sigmoid,47,16.0,22.0,33.0,,,,48.0,32.0,2.451377524461897,9.790501841262516,8.64010066027943,5.0,20.0,72.0,85.0,COMPLETE
7607,0.38878745569756196,2024-04-11 18:26:13.476612,2024-04-11 18:26:15.440694,0 days 00:00:01.964082,99.99247620392018,8.112560434000791,sigmoid,49,27.0,,,1.0,8.0,90.0,,,,,,,,,178.0,COMPLETE
7608,0.47559184935212145,2024-04-11 18:26:15.443241,2024-04-11 18:26:17.791160,0 days 00:00:02.347919,95.15287299361592,7.660755491927025,sigmoid,50,29.0,,,6.0,2.0,62.0,,,9.611846420923403,8.631398106568488,8.007329262170316,17.0,45.0,84.0,,COMPLETE
7609,0.4069218834109116,2024-04-11 18:26:17.794754,2024-04-11 18:26:20.186838,0 days 00:00:02.392084,92.20508831391496,7.9381121368217284,sigmoid,43,38.0,27.0,30.0,,,,,,9.06787446507599,3.6253197886516118,4.091782236704141,20.0,23.0,58.0,91.0,COMPLETE
7610,0.4033558366651373,2024-04-11 18:26:20.189819,2024-04-11 18:26:22.166219,0 days 00:00:01.976400,98.21963206279891,7.309089721316651,sigmoid,25,,41.0,32.0,7.0,1.0,95.0,,,,,,,,,70.0,COMPLETE
7611,0.12003789673140693,2024-04-11 18:26:22.169221,2024-04-11 18:26:23.761922,0 days 00:00:01.592701,98.0179755784768,8.263823774003702,sigmoid,8,,29.0,28.0,,,,,,,,,,,,,COMPLETE
7612,0.5974957313602731,2024-04-11 18:26:23.765468,2024-04-11 18:26:25.492852,0 days 00:00:01.727384,95.16090436491031,8.461487447508285,sigmoid,8,,25.0,31.0,,,,,,,,,,,,,COMPLETE
7613,0.3669598770478401,2024-04-11 18:26:25.495818,2024-04-11 18:26:27.852851,0 days 00:00:02.357033,98.12341681778125,8.121387124318117,sigmoid,39,48.0,,,,,,18.0,46.0,2.808260348221893,4.659917060737519,2.199675173242921,9.0,43.0,99.0,63.0,COMPLETE
7614,0.4591505831894974,2024-04-11 18:26:27.855864,2024-04-11 18:26:30.231534,0 days 00:00:02.375670,89.45151735764135,7.887827191146982,sigmoid,22,,,,2.0,4.0,57.0,24.0,36.0,7.3292712752329265,1.9299034469382272,5.759331098389211,11.0,22.0,74.0,,COMPLETE
7615,0.5432423696726231,2024-04-11 18:26:30.234062,2024-04-11 18:26:32.172975,0 days 00:00:01.938913,96.64110550263364,7.530796699471659,sigmoid,35,43.0,,,,,,,,7.0153975482676625,9.383799757533648,9.34224144371873,8.0,42.0,57.0,194.0,COMPLETE
7616,0.3027318342315555,2024-04-11 18:26:32.175504,2024-04-11 18:26:34.381484,0 days 00:00:02.205980,98.13465123298361,8.700898463818314,sigmoid,38,50.0,,,,,,44.0,19.0,1.7167107039046936,4.433025467092004,4.636262070231443,15.0,26.0,53.0,,COMPLETE
7617,0.44684547394087165,2024-04-11 18:26:34.384009,2024-04-11 18:26:36.542128,0 days 00:00:02.158119,93.91652378873749,8.32181027287461,rbf,8,,26.0,29.0,,,,,,,,,,,,,COMPLETE
7618,0.4293543461664304,2024-04-11 18:26:36.544658,2024-04-11 18:26:38.312091,0 days 00:00:01.767433,96.65076092909612,7.709967346982961,sigmoid,24,,23.0,31.0,5.0,7.0,75.0,,,,,,,,,,COMPLETE
7619,0.3234581629005997,2024-04-11 18:26:38.315696,2024-04-11 18:26:40.216030,0 days 00:00:01.900334,98.13851758560516,8.112835391355985,sigmoid,3,,,,,,,,,3.356908215607544,7.794924187925212,1.5034111435761313,19.0,29.0,87.0,94.0,COMPLETE
7620,0.5636462904171639,2024-04-11 18:26:40.219033,2024-04-11 18:26:41.478851,0 days 00:00:01.259818,99.96344440696839,7.923166717766445,sigmoid,0,,,,,,,,,,,,,,,,COMPLETE
7621,0.4484162095204389,2024-04-11 18:26:41.481850,2024-04-11 18:26:43.445175,0 days 00:00:01.963325,94.7210750630296,8.514844654905593,sigmoid,21,,,,4.0,6.0,69.0,26.0,2.0,,,,,,,15.0,COMPLETE
7622,0.49280268952128414,2024-04-11 18:26:43.448456,2024-04-11 18:26:45.967978,0 days 00:00:02.519522,96.69448840986557,8.227618892046731,sigmoid,15,,24.0,30.0,,,,2.0,18.0,5.218289703953011,7.401943532939351,3.4381956001412135,13.0,32.0,51.0,115.0,COMPLETE
7623,0.5952371952371952,2024-04-11 18:26:45.971979,2024-04-11 18:26:47.560658,0 days 00:00:01.588679,98.2685328656169,7.795683432963869,sigmoid,8,,25.0,32.0,,,,,,,,,,,,,COMPLETE
7624,0.5929369437606513,2024-04-11 18:26:47.562654,2024-04-11 18:26:49.183918,0 days 00:00:01.621264,49.289110610848525,8.041944985685777,sigmoid,8,,21.0,33.0,,,,,,,,,,,,,COMPLETE
7625,0.4785804385794683,2024-04-11 18:26:49.187947,2024-04-11 18:26:51.326955,0 days 00:00:02.139008,95.2698160357172,7.5169907193800585,sigmoid,28,,27.0,32.0,8.0,8.0,23.0,38.0,38.0,,,,,,,,COMPLETE
7626,0.43395936433774945,2024-04-11 18:26:51.329951,2024-04-11 18:26:54.201975,0 days 00:00:02.872024,91.6013720115838,8.343421875675194,sigmoid,31,,28.0,30.0,3.0,5.0,100.0,19.0,49.0,2.0499981203756366,1.49860855805426,3.8781206166514446,12.0,39.0,95.0,149.0,COMPLETE
7627,0.42683516749304634,2024-04-11 18:26:54.204529,2024-04-11 18:26:56.224285,0 days 00:00:02.019756,96.59171728221553,7.959230354794273,sigmoid,57,8.0,26.0,31.0,6.0,3.0,28.0,,,,,,,,,157.0,COMPLETE
7628,0.34659186347297344,2024-04-11 18:26:56.227296,2024-04-11 18:26:58.431845,0 days 00:00:02.204549,93.19279913394314,8.159014865293802,sigmoid,42,20.0,23.0,36.0,,,,,,4.648984386188707,5.391214885672157,6.37932955567664,7.0,24.0,55.0,,COMPLETE
7629,0.5929369437606513,2024-04-11 18:26:58.435367,2024-04-11 18:27:00.059251,0 days 00:00:01.623884,98.01199391284555,7.7421325280791375,sigmoid,8,,24.0,33.0,,,,,,,,,,,,,COMPLETE
7630,0.12622036262203626,2024-04-11 18:27:00.062242,2024-04-11 18:27:01.630721,0 days 00:00:01.568479,98.07349751392381,8.482423718904995,sigmoid,8,,25.0,29.0,,,,,,,,,,,,,COMPLETE
7631,0.5637734351750817,2024-04-11 18:27:01.635248,2024-04-11 18:27:03.309803,0 days 00:00:01.674555,94.85354767544892,8.032853438294648,sigmoid,16,,,,7.0,2.0,32.0,,,,,,,,,,COMPLETE
7632,0.3234581629005997,2024-04-11 18:27:03.312804,2024-04-11 18:27:05.043981,0 days 00:00:01.731177,96.34318188902007,8.889597261629932,sigmoid,9,,9.0,30.0,,,,,,,,,,,,100.0,COMPLETE
7633,0.5964036904537752,2024-04-11 18:27:05.046993,2024-04-11 18:27:06.621462,0 days 00:00:01.574469,98.08618508662406,7.134864004260557,sigmoid,8,,27.0,31.0,,,,,,,,,,,,,COMPLETE
7634,0.3839957569529618,2024-04-11 18:27:06.624989,2024-04-11 18:27:09.009071,0 days 00:00:02.384082,98.27347635187803,8.290280472299013,sigmoid,46,45.0,26.0,32.0,,,,45.0,6.0,1.0978579586865065,9.100869431667592,6.848383356202555,4.0,44.0,52.0,,COMPLETE
7635,0.4876683937823834,2024-04-11 18:27:09.012070,2024-04-11 18:27:11.976940,0 days 00:00:02.964870,99.95484580054902,7.802820232644604,sigmoid,63,40.0,25.0,34.0,2.0,4.0,52.0,7.0,42.0,4.056495761916261,0.9894029272743481,5.984795129062336,3.0,49.0,66.0,22.0,COMPLETE
7636,0.24626897402100434,2024-04-11 18:27:11.979944,2024-04-11 18:27:14.015573,0 days 00:00:02.035629,95.47884644452617,8.17393125583732,rbf,41,10.0,50.0,29.0,,,,,,,,,,,,125.0,COMPLETE
7637,0.5571318640121544,2024-04-11 18:27:14.018578,2024-04-11 18:27:15.957557,0 days 00:00:01.938979,98.21696265328886,7.565081288666217,sigmoid,2,,,,,,,,,0.7203009660067563,3.200623032125963,2.9346084708533997,10.0,37.0,98.0,,COMPLETE
7638,0.6009432182607054,2024-04-11 18:27:15.961678,2024-04-11 18:27:17.438568,0 days 00:00:01.476890,98.24771526795975,7.904358823474921,sigmoid,8,,28.0,31.0,,,,,,,,,,,,,COMPLETE
7639,0.4448341684562156,2024-04-11 18:27:17.441568,2024-04-11 18:27:19.074273,0 days 00:00:01.632705,10.187100890370381,8.422119701110052,sigmoid,8,,31.0,30.0,,,,,,,,,,,,,COMPLETE
7640,0.35175094310863847,2024-04-11 18:27:19.076829,2024-04-11 18:27:21.045892,0 days 00:00:01.969063,96.63255441423351,6.02865446821562,sigmoid,10,,24.0,33.0,,,,,,8.028161028081767,4.168097645875266,9.075289055125635,2.0,34.0,80.0,,COMPLETE
7641,0.5909107772212947,2024-04-11 18:27:21.048888,2024-04-11 18:27:22.672867,0 days 00:00:01.623979,94.1428102863458,6.9887326679816875,sigmoid,8,,26.0,27.0,,,,,,,,,,,,,COMPLETE
7642,0.4712846966347335,2024-04-11 18:27:22.676399,2024-04-11 18:27:24.658669,0 days 00:00:01.982270,98.19676364682276,8.039451236154504,sigmoid,56,16.0,22.0,31.0,5.0,1.0,14.0,,,,,,,,,,COMPLETE
7643,0.37528509226622436,2024-04-11 18:27:24.661678,2024-04-11 18:27:26.890457,0 days 00:00:02.228779,71.00013700543616,8.659003667548914,sigmoid,11,,25.0,28.0,,,,,,4.2976328212971175,7.16167535875874,1.07082951004225,18.0,36.0,78.0,133.0,COMPLETE
7644,0.48782236728234796,2024-04-11 18:27:26.894460,2024-04-11 18:27:29.613450,0 days 00:00:02.718990,98.25263324928808,7.368303962664473,sigmoid,62,44.0,23.0,32.0,6.0,4.0,21.0,32.0,25.0,8.731937354817802,8.2112282093699,9.49386385114515,5.0,46.0,70.0,,COMPLETE
