number,value,datetime_start,datetime_complete,duration,params_C,params_gamma,params_kernel,params_mask_number,params_rsi_window,params_so_smooth,params_so_window,params_srsi_smooth1,params_srsi_smooth2,params_srsi_window,params_tsi_window_fast,params_tsi_window_slow,params_ult_weight_1,params_ult_weight_2,params_ult_weight_3,params_ult_window_1,params_ult_window_2,params_ult_window_3,params_williams_lbp,state
2510,0.32613681037871833,2024-04-11 16:26:43.130527,2024-04-11 16:26:44.036642,0 days 00:00:00.906115,95.34146555964075,8.047646062696318,sigmoid,50,23.0,,,3.0,4.0,28.0,,,7.834080595442927,2.6375806747663098,0.8522088709490001,15.0,34.0,75.0,,COMPLETE
2511,0.45963271499798714,2024-04-11 16:26:44.037642,2024-04-11 16:26:45.477759,0 days 00:00:01.440117,98.15842927694102,8.211562255914547,rbf,8,,28.0,35.0,,,,,,,,,,,,,COMPLETE
2512,0.5546475995914198,2024-04-11 16:26:45.478757,2024-04-11 16:26:46.122069,0 days 00:00:00.643312,96.59214346082327,8.469850465451861,sigmoid,4,,,,,,,6.0,41.0,,,,,,,,COMPLETE
2513,0.33077701269457954,2024-04-11 16:26:46.123071,2024-04-11 16:26:46.878433,0 days 00:00:00.755362,98.29788800632718,7.856054243389051,sigmoid,17,,,,2.0,5.0,41.0,,,,,,,,,73.0,COMPLETE
2514,0.4502698896972542,2024-04-11 16:26:46.879534,2024-04-11 16:26:47.531179,0 days 00:00:00.651645,94.87439681082132,7.338076451655752,sigmoid,8,,25.0,30.0,,,,,,,,,,,,,COMPLETE
2515,0.47440514176315074,2024-04-11 16:26:47.533404,2024-04-11 16:26:48.575462,0 days 00:00:01.042058,98.12741910573644,4.646940226956221,sigmoid,19,,,,8.0,6.0,71.0,,,2.7502124213580426,8.775398833053114,4.675695113249051,19.0,38.0,94.0,110.0,COMPLETE
2516,0.41540799553391433,2024-04-11 16:26:48.577463,2024-04-11 16:26:49.595819,0 days 00:00:01.018356,96.51242194919931,8.12031695724383,sigmoid,47,46.0,27.0,31.0,,,,40.0,20.0,9.042796974057651,5.692170612269058,9.52812237726236,13.0,44.0,84.0,33.0,COMPLETE
2517,0.47161397003557654,2024-04-11 16:26:49.597818,2024-04-11 16:26:50.562935,0 days 00:00:00.965117,98.36936843617463,7.589966527715117,sigmoid,25,,24.0,33.0,5.0,3.0,83.0,,,,,,,,,133.0,COMPLETE
2518,0.38785714285714284,2024-04-11 16:26:50.565091,2024-04-11 16:26:51.516009,0 days 00:00:00.950918,54.500552737934235,8.910938544544852,sigmoid,29,,26.0,29.0,4.0,8.0,52.0,11.0,42.0,,,,,,,78.0,COMPLETE
2519,0.5963643249384587,2024-04-11 16:26:51.518185,2024-04-11 16:26:52.178007,0 days 00:00:00.659822,96.62805805735802,8.403046965153528,sigmoid,8,,21.0,32.0,,,,,,,,,,,,,COMPLETE
2520,0.40910558605101716,2024-04-11 16:26:52.179188,2024-04-11 16:26:53.236066,0 days 00:00:01.056878,94.9804184113678,7.908688671835582,sigmoid,43,16.0,24.0,30.0,,,,,,8.137884220442217,2.1322008877749967,5.271485227300866,18.0,46.0,54.0,18.0,COMPLETE
2521,0.5986580986580987,2024-04-11 16:26:53.238066,2024-04-11 16:26:53.946571,0 days 00:00:00.708505,98.09379111945839,8.206061030426017,sigmoid,8,,25.0,31.0,,,,,,,,,,,,,COMPLETE
2522,0.5952371952371952,2024-04-11 16:26:53.947568,2024-04-11 16:26:54.594972,0 days 00:00:00.647404,28.00109854362764,8.020396716927984,sigmoid,8,,28.0,32.0,,,,,,,,,,,,,COMPLETE
2523,0.37345689805910126,2024-04-11 16:26:54.596971,2024-04-11 16:26:55.559064,0 days 00:00:00.962093,98.1872903221754,7.661219096102556,sigmoid,39,49.0,,,,,,21.0,16.0,5.15300319445932,4.532516062585891,6.354538332427422,6.0,26.0,50.0,160.0,COMPLETE
2524,0.5030351788195715,2024-04-11 16:26:55.560243,2024-04-11 16:26:56.401097,0 days 00:00:00.840854,99.95511997381266,8.2988395451424,sigmoid,21,,,,1.0,1.0,64.0,34.0,36.0,,,,,,,60.0,COMPLETE
2525,0.24313102942972278,2024-04-11 16:26:56.403106,2024-04-11 16:26:57.233152,0 days 00:00:00.830046,92.9744469959851,7.812727433965221,sigmoid,6,,,,,,,43.0,14.0,9.727921403730766,1.1465192253939067,2.1833531945631868,3.0,33.0,53.0,,COMPLETE
2526,0.378030871650948,2024-04-11 16:26:57.235385,2024-04-11 16:26:58.206526,0 days 00:00:00.971141,99.92971683055026,8.543530650659736,sigmoid,15,,22.0,30.0,,,,26.0,39.0,7.356495718074529,0.7601454874036806,5.830186458290722,11.0,48.0,59.0,84.0,COMPLETE
2527,0.5929369437606513,2024-04-11 16:26:58.208729,2024-04-11 16:26:58.857802,0 days 00:00:00.649073,96.47161218229492,8.04167687742148,sigmoid,8,,23.0,33.0,,,,,,,,,,,,,COMPLETE
2528,0.34642893119774354,2024-04-11 16:26:58.859803,2024-04-11 16:26:59.782295,0 days 00:00:00.922492,95.25858178385064,8.325779080452284,sigmoid,22,,,,6.0,6.0,33.0,7.0,34.0,3.667052547497363,8.521402703270219,3.3637138180431094,10.0,23.0,90.0,,COMPLETE
2529,0.6009432182607054,2024-04-11 16:26:59.783303,2024-04-11 16:27:00.446073,0 days 00:00:00.662770,61.44185117520832,7.738213210340822,sigmoid,8,,26.0,31.0,,,,,,,,,,,,,COMPLETE
2530,0.45098754178061373,2024-04-11 16:27:00.447562,2024-04-11 16:27:01.866939,0 days 00:00:01.419377,98.24467276046494,8.113484973009706,rbf,8,,25.0,29.0,,,,,,,,,,,,,COMPLETE
2531,0.49538432991603654,2024-04-11 16:27:01.869057,2024-04-11 16:27:02.678397,0 days 00:00:00.809340,93.0254253728297,7.439463580664848,sigmoid,35,33.0,,,,,,,,4.52743574205221,5.009796659364385,8.805610812286904,14.0,36.0,93.0,187.0,COMPLETE
2532,0.4297166466253507,2024-04-11 16:27:02.680397,2024-04-11 16:27:03.514821,0 days 00:00:00.834424,99.98859548195027,8.676513655563959,sigmoid,57,11.0,27.0,32.0,3.0,7.0,22.0,,,,,,,,,200.0,COMPLETE
2533,0.4970186725247136,2024-04-11 16:27:03.515819,2024-04-11 16:27:04.282081,0 days 00:00:00.766262,96.71269356008558,7.94711877818578,sigmoid,24,,24.0,31.0,2.0,2.0,60.0,,,,,,,,,,COMPLETE
2534,0.517369355247689,2024-04-11 16:27:04.284088,2024-04-11 16:27:05.194631,0 days 00:00:00.910543,98.24851497975239,8.200040316090577,sigmoid,38,2.0,,,,,,25.0,43.0,0.8831919377680206,7.060624908758984,6.789930138391328,16.0,43.0,99.0,,COMPLETE
2535,0.34610394044936144,2024-04-11 16:27:05.195632,2024-04-11 16:27:06.105432,0 days 00:00:00.909800,99.97493320154369,7.853000287080543,sigmoid,42,32.0,26.0,30.0,,,,,,7.627047231001428,6.717236766784577,9.191369233238547,9.0,40.0,57.0,,COMPLETE
2536,0.5558435335627477,2024-04-11 16:27:06.107711,2024-04-11 16:27:06.897231,0 days 00:00:00.789520,94.96840268852664,8.4693912404665,sigmoid,3,,,,,,,,,1.4366289325855397,5.807784496189439,6.9877445940339555,3.0,39.0,87.0,172.0,COMPLETE
2537,0.5293075478142076,2024-04-11 16:27:06.899454,2024-04-11 16:27:07.634318,0 days 00:00:00.734864,96.76452113215909,8.11417252673618,sigmoid,9,,29.0,34.0,,,,,,,,,,,,49.0,COMPLETE
2538,0.5460689072587944,2024-04-11 16:27:07.635320,2024-04-11 16:27:08.285634,0 days 00:00:00.650314,98.21303936017684,7.748485841828226,sigmoid,16,,,,8.0,5.0,55.0,,,,,,,,,,COMPLETE
2539,0.5963643249384587,2024-04-11 16:27:08.286635,2024-04-11 16:27:08.937034,0 days 00:00:00.650399,96.36114222317585,8.34221647719447,sigmoid,8,,25.0,32.0,,,,,,,,,,,,,COMPLETE
2540,0.43292125772641765,2024-04-11 16:27:08.939034,2024-04-11 16:27:09.788199,0 days 00:00:00.849165,93.67809467001362,7.927481911307627,sigmoid,28,,23.0,27.0,7.0,2.0,6.0,19.0,21.0,,,,,,,,COMPLETE
2541,0.4854549205694244,2024-04-11 16:27:09.790358,2024-04-11 16:27:10.924098,0 days 00:00:01.133740,98.26951089184152,7.562734528684872,sigmoid,31,,27.0,31.0,1.0,4.0,78.0,13.0,32.0,2.472275091493413,9.559371973977786,1.0461956057069282,12.0,30.0,71.0,103.0,COMPLETE
2542,0.5929369437606513,2024-04-11 16:27:10.926097,2024-04-11 16:27:11.567065,0 days 00:00:00.640968,99.94124393907059,8.117914071309864,sigmoid,8,,24.0,33.0,,,,,,,,,,,,,COMPLETE
2543,0.4671595644575884,2024-04-11 16:27:11.569246,2024-04-11 16:27:12.709172,0 days 00:00:01.139926,96.8049369308678,8.310397961841188,sigmoid,63,38.0,25.0,29.0,3.0,8.0,80.0,14.0,37.0,2.972438906673842,3.585523051469266,7.194241018596114,5.0,25.0,85.0,29.0,COMPLETE
2544,0.28257558449470715,2024-04-11 16:27:12.711173,2024-04-11 16:27:13.476576,0 days 00:00:00.765403,99.97558059428503,7.992475062805094,sigmoid,2,,,,,,,,,4.369430113917962,4.175087556928715,1.8618612006746558,12.0,35.0,95.0,,COMPLETE
2545,0.45853014909618683,2024-04-11 16:27:13.478740,2024-04-11 16:27:14.662171,0 days 00:00:01.183431,94.64544350247985,7.234075508930377,sigmoid,62,47.0,26.0,30.0,6.0,6.0,85.0,5.0,5.0,8.891311062833536,9.066109314614867,9.979312168085546,2.0,31.0,61.0,,COMPLETE
2546,0.4943372588323728,2024-04-11 16:27:14.664287,2024-04-11 16:27:15.413822,0 days 00:00:00.749535,96.65718097561256,3.0699643934577177,sigmoid,8,,26.0,32.0,,,,,,,,,,,,,COMPLETE
2547,0.5001337017559498,2024-04-11 16:27:15.415830,2024-04-11 16:27:16.314527,0 days 00:00:00.898697,98.32010946903466,7.69363785235274,sigmoid,11,,27.0,31.0,,,,,,2.16736654843517,3.309874730236423,6.144956387723141,4.0,24.0,89.0,149.0,COMPLETE
2548,0.5222113793542364,2024-04-11 16:27:16.315529,2024-04-11 16:27:17.043132,0 days 00:00:00.727603,99.9861450162947,8.537950524566554,sigmoid,41,44.0,24.0,30.0,,,,,,,,,,,,116.0,COMPLETE
2549,0.45768891502499265,2024-04-11 16:27:17.045342,2024-04-11 16:27:18.499395,0 days 00:00:01.454053,94.97615031189663,8.235446114314309,rbf,8,,20.0,28.0,,,,,,,,,,,,,COMPLETE
2550,0.5034063943252278,2024-04-11 16:27:18.501394,2024-04-11 16:27:19.157564,0 days 00:00:00.656170,99.95494985984267,7.872840287529989,sigmoid,8,,28.0,36.0,,,,,,,,,,,,,COMPLETE
2551,0.3439260909448303,2024-04-11 16:27:19.159673,2024-04-11 16:27:20.203956,0 days 00:00:01.044283,99.98691952398231,8.110172035365064,sigmoid,14,,22.0,33.0,,,,9.0,30.0,6.193596823947646,2.8577373105041026,2.5520799699678234,17.0,28.0,67.0,,COMPLETE
2552,0.408418075696492,2024-04-11 16:27:20.204957,2024-04-11 16:27:21.139949,0 days 00:00:00.934992,96.74736686448563,7.527686602948508,sigmoid,26,,25.0,31.0,5.0,1.0,67.0,,,6.782713606657337,5.329137585543998,4.201709393044296,15.0,22.0,58.0,,COMPLETE
2553,0.27400822917475354,2024-04-11 16:27:21.140948,2024-04-11 16:27:21.873447,0 days 00:00:00.732499,98.22054303717424,8.35357248607962,sigmoid,20,,,,2.0,5.0,48.0,30.0,28.0,,,,,,,,COMPLETE
2554,0.3914480798343992,2024-04-11 16:27:21.874449,2024-04-11 16:27:23.041823,0 days 00:00:01.167374,93.4584152946091,8.81478954467615,sigmoid,46,35.0,23.0,32.0,,,,44.0,10.0,4.881065322498321,6.489063917955466,5.107385697327006,19.0,48.0,51.0,,COMPLETE
2555,0.41016328304463895,2024-04-11 16:27:23.043824,2024-04-11 16:27:23.882764,0 days 00:00:00.838940,96.37887803466955,8.055565177953891,sigmoid,56,26.0,25.0,29.0,7.0,7.0,95.0,,,,,,,,,,COMPLETE
2556,0.27628315207021564,2024-04-11 16:27:23.883765,2024-04-11 16:27:24.835773,0 days 00:00:00.952008,99.96864330139044,7.807840134886224,sigmoid,10,,26.0,31.0,,,,,,5.418890099860363,7.602431149930649,4.458559741273841,20.0,29.0,63.0,,COMPLETE
2557,0.4448341684562156,2024-04-11 16:27:24.837787,2024-04-11 16:27:25.490758,0 days 00:00:00.652971,98.10565853611968,8.573477738798198,sigmoid,8,,27.0,30.0,,,,,,,,,,,,,COMPLETE
2558,0.5906279643331437,2024-04-11 16:27:25.491993,2024-04-11 16:27:26.126946,0 days 00:00:00.634953,95.23133872729166,8.223681747727678,sigmoid,8,,24.0,34.0,,,,,,,,,,,,,COMPLETE
2559,0.5125878992968056,2024-04-11 16:27:26.127957,2024-04-11 16:27:26.865192,0 days 00:00:00.737235,97.92470333629146,7.97180771684694,sigmoid,48,43.0,,,4.0,3.0,26.0,,,,,,,,,,COMPLETE
2560,0.47986087464124144,2024-04-11 16:27:26.866193,2024-04-11 16:27:27.649690,0 days 00:00:00.783497,96.6388323174213,7.669670769329748,sigmoid,52,8.0,,,8.0,4.0,87.0,23.0,24.0,,,,,,,,COMPLETE
2561,0.5196658319661516,2024-04-11 16:27:27.652227,2024-04-11 16:27:28.367186,0 days 00:00:00.714959,99.99625967017262,8.354092505521976,sigmoid,37,17.0,,,,,,32.0,38.0,,,,,,,70.0,COMPLETE
2562,0.5952371952371952,2024-04-11 16:27:28.368311,2024-04-11 16:27:29.013342,0 days 00:00:00.645031,98.1254139705527,7.9274059671962585,sigmoid,8,,26.0,32.0,,,,,,,,,,,,,COMPLETE
2563,0.4458981104998804,2024-04-11 16:27:29.014826,2024-04-11 16:27:29.658234,0 days 00:00:00.643408,93.61111829942364,9.387765857698643,sigmoid,8,,25.0,30.0,,,,,,,,,,,,,COMPLETE
2564,0.441750732183534,2024-04-11 16:27:29.659424,2024-04-11 16:27:30.566288,0 days 00:00:00.906864,45.21679223777296,9.102655134396691,sigmoid,60,18.0,29.0,33.0,5.0,3.0,73.0,48.0,48.0,,,,,,,,COMPLETE
2565,0.5127838913603371,2024-04-11 16:27:30.568292,2024-04-11 16:27:31.362573,0 days 00:00:00.794281,95.330336288323,7.374473886315803,sigmoid,13,,23.0,29.0,,,,29.0,12.0,,,,,,,37.0,COMPLETE
2566,0.6009432182607054,2024-04-11 16:27:31.364571,2024-04-11 16:27:32.002777,0 days 00:00:00.638206,96.67698175077443,8.119274756022117,sigmoid,8,,28.0,31.0,,,,,,,,,,,,,COMPLETE
2567,0.4257357581320636,2024-04-11 16:27:32.003985,2024-04-11 16:27:33.066008,0 days 00:00:01.062023,98.1171889200925,8.677314677248857,sigmoid,59,30.0,24.0,32.0,4.0,1.0,20.0,,,8.607262439288188,6.080100817283537,5.507654635642509,18.0,45.0,69.0,89.0,COMPLETE
2568,0.4780744106787844,2024-04-11 16:27:33.068003,2024-04-11 16:27:34.601084,0 days 00:00:01.533081,99.95514058190749,7.050201504873728,rbf,8,,27.0,28.0,,,,,,,,,,,,,COMPLETE
2569,0.5428957352561428,2024-04-11 16:27:34.602078,2024-04-11 16:27:35.261012,0 days 00:00:00.658934,98.16218471147437,8.412045501986524,sigmoid,36,29.0,,,,,,50.0,22.0,,,,,,,,COMPLETE
2570,0.5099845703168675,2024-04-11 16:27:35.263032,2024-04-11 16:27:36.389278,0 days 00:00:01.126246,95.03113283760136,7.806307592018212,sigmoid,55,41.0,,,2.0,8.0,4.0,37.0,23.0,4.150024848335772,1.9093396170256733,6.644408069647278,8.0,27.0,82.0,128.0,COMPLETE
2571,0.3887713964708215,2024-04-11 16:27:36.391459,2024-04-11 16:27:37.383349,0 days 00:00:00.991890,96.78265317377426,8.193663550350323,sigmoid,23,,,,1.0,6.0,30.0,27.0,50.0,6.445715387284805,2.4349675241090782,3.7603948821443156,7.0,21.0,87.0,95.0,COMPLETE
2572,0.5117813383600377,2024-04-11 16:27:37.384349,2024-04-11 16:27:38.280443,0 days 00:00:00.896094,93.08797633219939,7.990171640616885,sigmoid,7,,,,,,,33.0,46.0,3.452438547942559,8.320262832532288,1.2527331881702866,6.0,41.0,88.0,65.0,COMPLETE
2573,0.3657885239985565,2024-04-11 16:27:38.282595,2024-04-11 16:27:39.026163,0 days 00:00:00.743568,99.95383156422108,7.619528301762097,sigmoid,40,5.0,25.0,31.0,,,,,,,,,,,,,COMPLETE
2574,0.34394607579505937,2024-04-11 16:27:39.027173,2024-04-11 16:27:39.792236,0 days 00:00:00.765063,98.26593454922882,8.489861214798278,sigmoid,44,37.0,26.0,30.0,,,,10.0,19.0,,,,,,,,COMPLETE
2575,0.5929369437606513,2024-04-11 16:27:39.793414,2024-04-11 16:27:40.454026,0 days 00:00:00.660612,96.71052511998916,8.215524947005127,sigmoid,8,,30.0,33.0,,,,,,,,,,,,,COMPLETE
2576,0.5809184377973914,2024-04-11 16:27:40.455025,2024-04-11 16:27:41.096346,0 days 00:00:00.641321,99.9903799512308,7.830070761692628,sigmoid,32,20.0,,,,,,,,,,,,,,,COMPLETE
2577,0.5262939270582371,2024-04-11 16:27:41.097347,2024-04-11 16:27:41.894461,0 days 00:00:00.797114,98.2753549993425,8.078841158556155,sigmoid,12,,24.0,32.0,,,,16.0,33.0,,,,,,,,COMPLETE
2578,0.4213957278388918,2024-04-11 16:27:41.895606,2024-04-11 16:27:42.874877,0 days 00:00:00.979271,95.52636219981827,7.493972929788378,sigmoid,54,45.0,,,6.0,2.0,44.0,6.0,31.0,7.145253286718485,7.293336045131751,1.627810028677331,11.0,34.0,96.0,,COMPLETE
2579,0.12622036262203626,2024-04-11 16:27:42.876886,2024-04-11 16:27:43.530737,0 days 00:00:00.653851,98.16561090984537,8.334286172755773,sigmoid,8,,23.0,29.0,,,,,,,,,,,,,COMPLETE
2580,0.5721957722338603,2024-04-11 16:27:43.532876,2024-04-11 16:27:44.131949,0 days 00:00:00.599073,95.02651738820683,7.9210519334621114,sigmoid,1,,,,,,,,,,,,,,,44.0,COMPLETE
2581,0.6009432182607054,2024-04-11 16:27:44.133106,2024-04-11 16:27:44.787433,0 days 00:00:00.654327,99.96830479395723,7.69410467109696,sigmoid,8,,27.0,31.0,,,,,,,,,,,,,COMPLETE
2582,0.42084668386877255,2024-04-11 16:27:44.788435,2024-04-11 16:27:45.872374,0 days 00:00:01.083939,96.64062386885445,8.064784129312615,sigmoid,30,,22.0,30.0,3.0,5.0,13.0,20.0,26.0,3.8812581242988893,5.555108460960833,9.424353507625572,10.0,50.0,55.0,,COMPLETE
2583,0.45091345266654365,2024-04-11 16:27:45.874571,2024-04-11 16:27:46.810890,0 days 00:00:00.936319,98.01782577754679,8.670562365120533,sigmoid,61,3.0,26.0,31.0,7.0,7.0,50.0,2.0,35.0,,,,,,,164.0,COMPLETE
2584,0.5906279643331437,2024-04-11 16:27:46.811889,2024-04-11 16:27:47.484435,0 days 00:00:00.672546,93.1890064023944,8.276986879639578,sigmoid,8,,25.0,34.0,,,,,,,,,,,,,COMPLETE
2585,0.4089085207539536,2024-04-11 16:27:47.486442,2024-04-11 16:27:48.180888,0 days 00:00:00.694446,98.12844209310288,8.490037139620023,sigmoid,33,23.0,,,,,,,,,,,,,,136.0,COMPLETE
2586,0.1374708403406933,2024-04-11 16:27:48.182872,2024-04-11 16:27:49.431971,0 days 00:00:01.249099,96.44399323755063,7.853576004819814,rbf,51,13.0,,,8.0,2.0,18.0,,,0.5339945315720112,1.5285337009753572,3.0781221521294406,14.0,47.0,56.0,196.0,COMPLETE
2587,0.22581651294390231,2024-04-11 16:27:49.434189,2024-04-11 16:27:50.223095,0 days 00:00:00.788906,98.19032288921339,8.133778610052415,sigmoid,34,48.0,,,,,,,,9.520142432964352,4.342272239525278,3.512643051302506,13.0,32.0,73.0,,COMPLETE
2588,0.5186135522911456,2024-04-11 16:27:50.225105,2024-04-11 16:27:51.001437,0 days 00:00:00.776332,95.2376633388889,7.6739390666992415,sigmoid,5,,,,,,,41.0,16.0,,,,,,,51.0,COMPLETE
2589,0.5952371952371952,2024-04-11 16:27:51.003610,2024-04-11 16:27:51.657653,0 days 00:00:00.654043,98.29191638305787,7.963442261676798,sigmoid,8,,24.0,32.0,,,,,,,,,,,,,COMPLETE
2590,0.40696367198792277,2024-04-11 16:27:51.659654,2024-04-11 16:27:52.476237,0 days 00:00:00.816583,99.94166532191718,8.31574684405807,sigmoid,53,27.0,,,4.0,3.0,90.0,8.0,7.0,,,,,,,145.0,COMPLETE
2591,0.38766331120154207,2024-04-11 16:27:52.478246,2024-04-11 16:27:53.283548,0 days 00:00:00.805302,96.50846970004608,8.077742203209391,sigmoid,45,42.0,28.0,29.0,,,,4.0,3.0,,,,,,,184.0,COMPLETE
2592,0.47778266608007036,2024-04-11 16:27:53.285549,2024-04-11 16:27:54.017157,0 days 00:00:00.731608,99.99883272224784,7.402903008572869,sigmoid,17,,,,3.0,6.0,10.0,,,,,,,,,176.0,COMPLETE
2593,0.19134810554803788,2024-04-11 16:27:54.019165,2024-04-11 16:27:54.736219,0 days 00:00:00.717054,93.04704886412124,7.812398914117675,sigmoid,4,,,,,,,22.0,27.0,,,,,,,,COMPLETE
2594,0.5963245096172158,2024-04-11 16:27:54.737216,2024-04-11 16:27:55.378702,0 days 00:00:00.641486,94.8385120035918,8.395264827699101,sigmoid,8,,27.0,31.0,,,,,,,,,,,,,COMPLETE
2595,0.48214069499939466,2024-04-11 16:27:55.380943,2024-04-11 16:27:56.312382,0 days 00:00:00.931439,98.30653255272298,8.18168989576362,sigmoid,19,,,,5.0,4.0,76.0,,,5.972862281436377,9.352614216658637,7.638524318317051,16.0,46.0,81.0,169.0,COMPLETE
2596,0.45472576294494105,2024-04-11 16:27:56.314574,2024-04-11 16:27:57.077987,0 days 00:00:00.763413,96.28132860869749,7.584314904064862,sigmoid,49,36.0,,,6.0,8.0,82.0,,,,,,,,,55.0,COMPLETE
2597,0.4066934720908231,2024-04-11 16:27:57.080112,2024-04-11 16:27:58.117020,0 days 00:00:01.036908,98.05963688978673,7.9512111651070665,sigmoid,58,7.0,25.0,30.0,5.0,5.0,37.0,,,1.1546624450404677,6.80246838519109,8.586497674519125,19.0,25.0,75.0,,COMPLETE
2598,0.522668206757147,2024-04-11 16:27:58.119021,2024-04-11 16:27:59.013221,0 days 00:00:00.894200,99.96226972654796,8.51305603141448,sigmoid,18,,,,7.0,1.0,53.0,,,8.065245256640548,7.875014626563723,2.076372652058236,2.0,20.0,66.0,,COMPLETE
2599,0.5929369437606513,2024-04-11 16:27:59.015384,2024-04-11 16:27:59.660397,0 days 00:00:00.645013,99.9703787010867,8.210573730553481,sigmoid,8,,26.0,33.0,,,,,,,,,,,,,COMPLETE
2600,0.5952371952371952,2024-04-11 16:27:59.662411,2024-04-11 16:28:00.333035,0 days 00:00:00.670624,96.99038405480074,7.828821987984448,sigmoid,8,,24.0,32.0,,,,,,,,,,,,,COMPLETE
2601,0.4858253022827782,2024-04-11 16:28:00.335052,2024-04-11 16:28:01.226502,0 days 00:00:00.891450,94.79033258594183,8.021543917221226,sigmoid,50,11.0,,,2.0,4.0,65.0,,,0.7192979997245974,4.877276298851215,8.304884760434234,9.0,37.0,60.0,,COMPLETE
2602,0.4643384399428834,2024-04-11 16:28:01.228496,2024-04-11 16:28:02.151207,0 days 00:00:00.922711,98.0201515865521,8.844985142617535,sigmoid,39,34.0,,,,,,38.0,29.0,1.6221431126607375,3.150349375713959,5.931914528451526,17.0,33.0,77.0,105.0,COMPLETE
2603,0.5107247901671489,2024-04-11 16:28:02.152232,2024-04-11 16:28:03.087639,0 days 00:00:00.935407,99.97140141769428,8.355158437327665,sigmoid,43,21.0,25.0,28.0,,,,,,5.015827525318485,8.192977423873574,9.687644928320879,4.0,49.0,52.0,122.0,COMPLETE
2604,0.6009432182607054,2024-04-11 16:28:03.088664,2024-04-11 16:28:03.737054,0 days 00:00:00.648390,99.99775818058575,7.691391877491322,sigmoid,8,,27.0,31.0,,,,,,,,,,,,,COMPLETE
2605,0.13237214647651885,2024-04-11 16:28:03.738063,2024-04-11 16:28:05.091042,0 days 00:00:01.352979,96.48581630752724,7.245746624223094,rbf,47,9.0,23.0,30.0,,,,36.0,13.0,5.750088463712494,5.120964564894685,5.6650206838136015,18.0,23.0,65.0,80.0,COMPLETE
2606,0.4674817969501306,2024-04-11 16:28:05.092578,2024-04-11 16:28:05.960570,0 days 00:00:00.867992,93.23891067051295,8.165024251665297,sigmoid,25,,26.0,32.0,1.0,3.0,7.0,,,,,,,,,158.0,COMPLETE
2607,0.4448341684562156,2024-04-11 16:28:05.962717,2024-04-11 16:28:06.623253,0 days 00:00:00.660536,96.99182992774139,8.624067411434138,sigmoid,8,,28.0,30.0,,,,,,,,,,,,,COMPLETE
2608,0.5906279643331437,2024-04-11 16:28:06.625417,2024-04-11 16:28:07.350776,0 days 00:00:00.725359,99.99693101327584,7.92202878252435,sigmoid,8,,22.0,34.0,,,,,,,,,,,,,COMPLETE
2609,0.45889004386076104,2024-04-11 16:28:07.352777,2024-04-11 16:28:08.381323,0 days 00:00:01.028546,95.02373098941393,8.045222892748518,sigmoid,27,,25.0,33.0,6.0,7.0,32.0,,,9.800324211745872,3.7232046223645794,2.6047930727985147,5.0,42.0,72.0,86.0,COMPLETE
2610,0.3146312597085583,2024-04-11 16:28:08.383331,2024-04-11 16:28:09.274860,0 days 00:00:00.891529,98.12926636120295,8.384020402833519,sigmoid,29,,24.0,29.0,8.0,5.0,15.0,40.0,9.0,,,,,,,112.0,COMPLETE
2611,0.1941426106421676,2024-04-11 16:28:09.276882,2024-04-11 16:28:10.118718,0 days 00:00:00.841836,96.83207711812513,7.721953695826104,sigmoid,6,,,,,,,42.0,45.0,1.9739713355613215,5.909049012106817,4.927694355265904,6.0,28.0,70.0,,COMPLETE
2612,0.33491454716727226,2024-04-11 16:28:10.120716,2024-04-11 16:28:10.954119,0 days 00:00:00.833403,99.99848100414577,5.041438314496116,sigmoid,24,,26.0,31.0,4.0,8.0,35.0,,,,,,,,,,COMPLETE
