number,value,datetime_start,datetime_complete,duration,params_C,params_gamma,params_kernel,params_mask_number,params_rsi_window,params_so_smooth,params_so_window,params_srsi_smooth1,params_srsi_smooth2,params_srsi_window,params_tsi_window_fast,params_tsi_window_slow,params_ult_weight_1,params_ult_weight_2,params_ult_weight_3,params_ult_window_1,params_ult_window_2,params_ult_window_3,params_williams_lbp,state
9394,0.3762737279760079,2024-04-11 19:30:18.583432,2024-04-11 19:30:20.747412,0 days 00:00:02.163980,92.22264364928448,8.392217243585664,sigmoid,38,24.0,,,,,,13.0,36.0,5.144037681803262,6.605705798527044,5.5541599040497625,14.0,29.0,85.0,,COMPLETE
9395,0.6009432182607054,2024-04-11 19:30:20.747412,2024-04-11 19:30:22.407435,0 days 00:00:01.660023,98.23405241660781,8.052004191144642,sigmoid,8,,28.0,31.0,,,,,,,,,,,,,COMPLETE
9396,0.5906279643331437,2024-04-11 19:30:22.407435,2024-04-11 19:30:24.429794,0 days 00:00:02.022359,95.24355470916275,8.626336987796128,sigmoid,8,,30.0,34.0,,,,,,,,,,,,,COMPLETE
9397,0.3688584620283395,2024-04-11 19:30:24.429794,2024-04-11 19:30:27.047644,0 days 00:00:02.617850,99.99994421068425,7.648139010742596,sigmoid,57,31.0,26.0,30.0,8.0,3.0,13.0,,,,,,,,,65.0,COMPLETE
9398,0.40102109623350346,2024-04-11 19:30:27.063305,2024-04-11 19:30:30.025073,0 days 00:00:02.961768,98.2400391971666,7.881887819751311,sigmoid,15,,24.0,32.0,,,,40.0,38.0,3.1514049055715625,5.897446561386934,8.887358348886838,7.0,46.0,56.0,29.0,COMPLETE
9399,0.12003789673140693,2024-04-11 19:30:30.041109,2024-04-11 19:30:32.270543,0 days 00:00:02.229434,96.78577747193759,8.18813624535518,sigmoid,8,,26.0,28.0,,,,,,,,,,,,,COMPLETE
9400,0.33900313431694823,2024-04-11 19:30:32.274543,2024-04-11 19:30:34.681594,0 days 00:00:02.407051,98.13283028877694,8.037844530207513,sigmoid,42,49.0,27.0,31.0,,,,,,6.859663049973721,8.016276326755978,7.324605193793387,19.0,35.0,95.0,,COMPLETE
9401,0.3270665128796617,2024-04-11 19:30:34.681594,2024-04-11 19:30:37.235667,0 days 00:00:02.554073,99.98986188580491,8.391436008606963,sigmoid,9,,25.0,33.0,,,,,,,,,,,,23.0,COMPLETE
9402,0.4693093991523311,2024-04-11 19:30:37.235667,2024-04-11 19:30:39.602046,0 days 00:00:02.366379,95.3408988532106,7.725657973281195,sigmoid,16,,,,6.0,5.0,16.0,,,,,,,,,,COMPLETE
9403,0.39872653750980747,2024-04-11 19:30:39.602046,2024-04-11 19:30:43.380388,0 days 00:00:03.778342,90.68514972405326,8.16757095430701,sigmoid,31,,24.0,29.0,7.0,8.0,25.0,11.0,8.0,1.614604228631535,8.207311789080169,3.3335435798302884,3.0,31.0,80.0,134.0,COMPLETE
9404,0.413591740013541,2024-04-11 19:30:43.380388,2024-04-11 19:30:46.123232,0 days 00:00:02.742844,36.349392228604884,7.52803612968256,sigmoid,28,,23.0,30.0,4.0,7.0,9.0,6.0,44.0,,,,,,,,COMPLETE
9405,0.5067982820397219,2024-04-11 19:30:46.123232,2024-04-11 19:30:49.211234,0 days 00:00:03.088002,98.15020394442826,8.526174814496903,sigmoid,14,,29.0,31.0,,,,17.0,18.0,6.32302453277254,1.3078171575753412,9.572935907501153,9.0,42.0,79.0,,COMPLETE
9406,0.5952371952371952,2024-04-11 19:30:49.211234,2024-04-11 19:30:51.376744,0 days 00:00:02.165510,99.97126473353497,7.952833304183634,sigmoid,8,,26.0,32.0,,,,,,,,,,,,,COMPLETE
9407,0.4565639206120412,2024-04-11 19:30:51.381732,2024-04-11 19:30:54.854383,0 days 00:00:03.472651,93.51354192880474,8.277366796702974,sigmoid,63,11.0,32.0,30.0,2.0,4.0,61.0,22.0,21.0,7.198929739683938,0.6315804569635226,6.533160768992216,8.0,45.0,76.0,148.0,COMPLETE
9408,0.3830468727657505,2024-04-11 19:30:54.854383,2024-04-11 19:30:57.330345,0 days 00:00:02.475962,96.78093545954177,7.79807218044738,sigmoid,2,,,,,,,,,9.996206247469335,7.527769542746189,2.5546338676352316,12.0,23.0,52.0,,COMPLETE
9409,0.5034063943252278,2024-04-11 19:30:57.330345,2024-04-11 19:30:59.446124,0 days 00:00:02.115779,95.2883519671058,8.858661148094205,sigmoid,8,,27.0,36.0,,,,,,,,,,,,,COMPLETE
9410,0.43855833035050534,2024-04-11 19:30:59.446124,2024-04-11 19:31:03.207515,0 days 00:00:03.761391,98.05056572568373,8.058977095767144,sigmoid,62,5.0,25.0,32.0,1.0,1.0,55.0,43.0,15.0,5.53004102589179,3.821014836247995,8.54170664904847,17.0,36.0,93.0,,COMPLETE
9411,0.476743489973062,2024-04-11 19:31:03.223162,2024-04-11 19:31:06.399304,0 days 00:00:03.176142,96.5545659973301,8.372315852989882,rbf,8,,6.0,31.0,,,,,,,,,,,,,COMPLETE
9412,0.31501573782632847,2024-04-11 19:31:06.399304,2024-04-11 19:31:09.660348,0 days 00:00:03.261044,98.19985973228157,9.234169297762381,sigmoid,10,,23.0,34.0,,,,,,8.837185235976797,3.3143727904218543,4.640130999280679,20.0,25.0,61.0,,COMPLETE
9413,0.37343970289879996,2024-04-11 19:31:09.660348,2024-04-11 19:31:12.997664,0 days 00:00:03.337316,99.99695352811801,7.883676383719858,sigmoid,46,15.0,27.0,29.0,,,,50.0,50.0,2.6371501949886955,8.978095827400548,6.70615273756699,15.0,40.0,50.0,,COMPLETE
9414,0.43978674718690286,2024-04-11 19:31:13.000797,2024-04-11 19:31:14.783437,0 days 00:00:01.782640,96.7143723829164,8.554709216500536,sigmoid,8,,25.0,24.0,,,,,,,,,,,,,COMPLETE
9415,0.3626777912820682,2024-04-11 19:31:14.787530,2024-04-11 19:31:17.506792,0 days 00:00:02.719262,99.98350030906947,7.348107688464896,sigmoid,26,,24.0,33.0,3.0,6.0,42.0,,,4.286377870250164,2.9748390218708716,6.2011115435145925,4.0,33.0,72.0,,COMPLETE
9416,0.5132251082251081,2024-04-11 19:31:17.509897,2024-04-11 19:31:19.704351,0 days 00:00:02.194454,94.06557406842971,8.239795580969803,sigmoid,11,,22.0,27.0,,,,,,4.682612157878681,0.5061911393448888,6.882294354374272,6.0,34.0,100.0,89.0,COMPLETE
9417,0.49707365388078517,2024-04-11 19:31:19.707523,2024-04-11 19:31:21.942470,0 days 00:00:02.234947,96.62683959895504,7.562117368455055,sigmoid,41,42.0,26.0,31.0,,,,,,,,,,,,76.0,COMPLETE
9418,0.5378956337413496,2024-04-11 19:31:21.946557,2024-04-11 19:31:24.157078,0 days 00:00:02.210521,98.11791810333128,8.036187274922058,sigmoid,37,26.0,,,,,,23.0,26.0,,,,,,,126.0,COMPLETE
9419,0.44701971028259324,2024-04-11 19:31:24.163371,2024-04-11 19:31:25.970724,0 days 00:00:01.807353,99.97357247415641,7.778524540725316,sigmoid,8,,28.0,30.0,,,,,,,,,,,,,COMPLETE
9420,0.40664278341125754,2024-04-11 19:31:25.974848,2024-04-11 19:31:28.254472,0 days 00:00:02.279624,92.75421252426236,8.172981511299504,sigmoid,20,,,,5.0,5.0,67.0,29.0,46.0,,,,,,,,COMPLETE
9421,0.5952371952371952,2024-04-11 19:31:28.257471,2024-04-11 19:31:29.884713,0 days 00:00:01.627242,95.26007978372115,7.924330913701978,sigmoid,8,,24.0,32.0,,,,,,,,,,,,,COMPLETE
9422,0.47983158332466996,2024-04-11 19:31:29.887837,2024-04-11 19:31:31.612479,0 days 00:00:01.724642,98.11187530569197,8.418307873562858,sigmoid,48,2.0,,,8.0,6.0,75.0,,,,,,,,,,COMPLETE
9423,0.4696037035152872,2024-04-11 19:31:31.615529,2024-04-11 19:31:33.833038,0 days 00:00:02.217509,95.55647041819063,8.116717621580015,sigmoid,52,12.0,,,6.0,3.0,93.0,21.0,23.0,,,,,,,,COMPLETE
9424,0.5975614331269932,2024-04-11 19:31:33.833038,2024-04-11 19:31:35.758024,0 days 00:00:01.924986,96.71420901111924,5.931669712305884,sigmoid,8,,23.0,31.0,,,,,,,,,,,,,COMPLETE
9425,0.34477429557216793,2024-04-11 19:31:35.773672,2024-04-11 19:31:38.030384,0 days 00:00:02.256712,99.98445476225514,7.664260946186907,sigmoid,13,,25.0,29.0,,,,28.0,40.0,,,,,,,43.0,COMPLETE
9426,0.4041261052067518,2024-04-11 19:31:38.046000,2024-04-11 19:31:40.522948,0 days 00:00:02.476948,96.59241533498142,8.689430407144178,sigmoid,56,8.0,26.0,33.0,5.0,8.0,19.0,,,,,,,,,,COMPLETE
9427,0.5177451320924341,2024-04-11 19:31:40.538575,2024-04-11 19:31:42.946577,0 days 00:00:02.408002,98.07073431279082,8.265373898768711,sigmoid,44,4.0,27.0,28.0,,,,44.0,37.0,,,,,,,,COMPLETE
9428,0.4491845899314583,2024-04-11 19:31:42.951065,2024-04-11 19:31:44.724462,0 days 00:00:01.773397,98.16690088475515,6.9549812934717865,sigmoid,8,,25.0,30.0,,,,,,,,,,,,,COMPLETE
9429,0.4408489909533751,2024-04-11 19:31:44.724462,2024-04-11 19:31:47.623134,0 days 00:00:02.898672,94.09852559046693,7.971599927101902,sigmoid,55,7.0,,,7.0,2.0,88.0,34.0,41.0,1.4202248691748824,2.438226489622922,9.079211900769312,11.0,44.0,98.0,15.0,COMPLETE
9430,0.40144648023143686,2024-04-11 19:31:47.623134,2024-04-11 19:31:50.376784,0 days 00:00:02.753650,99.97005934590551,7.778678490248582,rbf,12,,29.0,32.0,,,,9.0,32.0,,,,,,,,COMPLETE
9431,0.5986314388899449,2024-04-11 19:31:50.381664,2024-04-11 19:31:52.216210,0 days 00:00:01.834546,83.51723762891767,8.498193959853815,sigmoid,8,,23.0,31.0,,,,,,,,,,,,,COMPLETE
9432,0.5079788467783086,2024-04-11 19:31:52.216210,2024-04-11 19:31:54.990359,0 days 00:00:02.774149,98.23062954364211,8.090821732912929,sigmoid,23,,,,2.0,2.0,36.0,42.0,30.0,2.8034090659983337,7.111876547921812,4.92708121861139,18.0,38.0,88.0,192.0,COMPLETE
9433,0.4636666382033986,2024-04-11 19:31:54.990359,2024-04-11 19:31:58.344603,0 days 00:00:03.354244,95.21915298565202,8.326954859962047,sigmoid,59,34.0,24.0,26.0,3.0,4.0,100.0,,,8.013946921356863,9.860234896684704,0.5063833640893538,7.0,28.0,62.0,33.0,COMPLETE
9434,0.5998117115420825,2024-04-11 19:31:58.360238,2024-04-11 19:31:59.958677,0 days 00:00:01.598439,98.00358714483389,7.1653365155947055,sigmoid,8,,26.0,32.0,,,,,,,,,,,,,COMPLETE
9435,0.31531906835826545,2024-04-11 19:31:59.958677,2024-04-11 19:32:02.304140,0 days 00:00:02.345463,92.58914276890894,7.535223821046121,sigmoid,36,18.0,,,,,,49.0,13.0,,,,,,,,COMPLETE
9436,0.48155963302752286,2024-04-11 19:32:02.304140,2024-04-11 19:32:04.379538,0 days 00:00:02.075398,98.22122752627766,7.904437347713232,sigmoid,1,,,,,,,,,,,,,,,103.0,COMPLETE
9437,0.44701971028259324,2024-04-11 19:32:04.379538,2024-04-11 19:32:06.636852,0 days 00:00:02.257314,95.30914513591694,8.1789380237174,sigmoid,8,,27.0,30.0,,,,,,,,,,,,,COMPLETE
9438,0.5046215874241352,2024-04-11 19:32:06.636852,2024-04-11 19:32:08.657861,0 days 00:00:02.021009,56.524119235000136,7.714507726643261,sigmoid,32,46.0,,,,,,,,,,,,,,,COMPLETE
9439,0.40758322682733855,2024-04-11 19:32:08.657861,2024-04-11 19:32:11.510781,0 days 00:00:02.852920,11.784052063909883,7.972961511013797,sigmoid,60,32.0,25.0,34.0,4.0,7.0,48.0,37.0,35.0,,,,,,,,COMPLETE
9440,0.12622036262203626,2024-04-11 19:32:11.510781,2024-04-11 19:32:13.612007,0 days 00:00:02.101226,96.78022617653644,8.377680523933083,sigmoid,8,,21.0,29.0,,,,,,,,,,,,,COMPLETE
9441,0.5008256348462533,2024-04-11 19:32:13.612007,2024-04-11 19:32:16.323946,0 days 00:00:02.711939,98.23856301380634,8.6545149084359,sigmoid,7,,,,,,,11.0,11.0,2.0461630267801327,4.806148101735116,1.3665826112574178,2.0,30.0,90.0,165.0,COMPLETE
9442,0.6009432182607054,2024-04-11 19:32:16.323946,2024-04-11 19:32:18.360258,0 days 00:00:02.036312,96.68547418650272,8.108731677205121,sigmoid,8,,26.0,31.0,,,,,,,,,,,,,COMPLETE
9443,0.44701971028259324,2024-04-11 19:32:18.360258,2024-04-11 19:32:20.444693,0 days 00:00:02.084435,94.18031580373516,7.466221950810047,sigmoid,8,,24.0,30.0,,,,,,,,,,,,,COMPLETE
9444,0.19302377249500113,2024-04-11 19:32:20.444693,2024-04-11 19:32:22.952370,0 days 00:00:02.507677,98.13571433308384,7.841916396326822,sigmoid,34,39.0,,,,,,,,8.663818864706368,4.226040136534098,1.9341273260733418,16.0,20.0,66.0,,COMPLETE
9445,0.42519068472492094,2024-04-11 19:32:22.952370,2024-04-11 19:32:26.150388,0 days 00:00:03.198018,99.97931787214463,8.275327714016464,sigmoid,54,43.0,,,1.0,1.0,50.0,16.0,20.0,6.139157761704038,7.686303525895573,9.800551420791773,17.0,48.0,70.0,,COMPLETE
9446,0.5952371952371952,2024-04-11 19:32:26.150388,2024-04-11 19:32:28.125167,0 days 00:00:01.974779,96.84193796619506,8.016801525053607,sigmoid,8,,25.0,32.0,,,,,,,,,,,,,COMPLETE
9447,0.4166322375022133,2024-04-11 19:32:28.125167,2024-04-11 19:32:30.358805,0 days 00:00:02.233638,90.51052815920761,7.668206336509521,sigmoid,45,16.0,28.0,33.0,,,,2.0,47.0,,,,,,,58.0,COMPLETE
9448,0.47708620379799915,2024-04-11 19:32:30.367828,2024-04-11 19:32:33.109912,0 days 00:00:02.742084,95.34858702448835,8.485917256233398,rbf,4,,,,,,,45.0,14.0,,,,,,,,COMPLETE
9449,0.3966100602584345,2024-04-11 19:32:33.109912,2024-04-11 19:32:35.240564,0 days 00:00:02.130652,98.22881403689831,8.205663957216316,sigmoid,53,10.0,,,3.0,5.0,45.0,30.0,25.0,,,,,,,178.0,COMPLETE
9450,0.3917385523915531,2024-04-11 19:32:35.240564,2024-04-11 19:32:37.906181,0 days 00:00:02.665617,98.2263780485722,7.885258269245545,sigmoid,30,,26.0,31.0,7.0,3.0,32.0,18.0,17.0,5.8300659634707115,1.5969754014470912,1.6581295909139913,5.0,24.0,84.0,,COMPLETE
9451,0.5085820082770638,2024-04-11 19:32:37.906181,2024-04-11 19:32:40.038178,0 days 00:00:02.131997,92.77074002335078,8.103180483605437,sigmoid,40,6.0,22.0,29.0,,,,,,,,,,,,,COMPLETE
9452,0.2747743948722273,2024-04-11 19:32:40.038178,2024-04-11 19:32:41.776840,0 days 00:00:01.738662,98.17274435160392,9.03876204269941,sigmoid,5,,,,,,,27.0,7.0,,,,,,,184.0,COMPLETE
9453,0.4784863667262519,2024-04-11 19:32:41.780837,2024-04-11 19:32:44.348851,0 days 00:00:02.568014,95.43017195643974,8.403266216157826,sigmoid,51,29.0,,,8.0,4.0,63.0,,,7.686799094672864,8.64573414048784,2.9486325279320966,9.0,32.0,59.0,107.0,COMPLETE
9454,0.47748936064309,2024-04-11 19:32:44.351956,2024-04-11 19:32:47.639333,0 days 00:00:03.287377,96.42384376293337,7.7388225719824915,sigmoid,27,,24.0,30.0,6.0,8.0,5.0,,,4.177599673338068,2.0436930977013414,8.424380395125503,14.0,22.0,97.0,20.0,COMPLETE
9455,0.5975287681569516,2024-04-11 19:32:47.639333,2024-04-11 19:32:49.521182,0 days 00:00:01.881849,98.11119474740279,7.383298285299176,sigmoid,8,,27.0,32.0,,,,,,,,,,,,,COMPLETE
9456,0.4515251162263296,2024-04-11 19:32:49.521182,2024-04-11 19:32:52.379483,0 days 00:00:02.858301,98.23438195767119,7.96660456256279,sigmoid,61,24.0,26.0,35.0,2.0,7.0,71.0,4.0,28.0,,,,,,,117.0,COMPLETE
9457,0.5326748639387221,2024-04-11 19:32:52.379483,2024-04-11 19:32:53.950029,0 days 00:00:01.570546,93.96221966075272,8.278574857310733,sigmoid,33,27.0,,,,,,,,,,,,,,10.0,COMPLETE
9458,0.4301841948900772,2024-04-11 19:32:53.953428,2024-04-11 19:32:56.753859,0 days 00:00:02.800431,98.27628624870523,8.530048598741445,sigmoid,58,22.0,25.0,28.0,5.0,6.0,39.0,,,8.224666719490592,5.046534878277998,5.90117572490152,19.0,35.0,78.0,,COMPLETE
9459,0.4547495589886139,2024-04-11 19:32:56.753859,2024-04-11 19:32:58.479591,0 days 00:00:01.725732,53.436293364624994,8.09319441211381,sigmoid,49,41.0,,,4.0,5.0,96.0,,,,,,,,,52.0,COMPLETE
9460,0.5986580986580987,2024-04-11 19:32:58.479591,2024-04-11 19:33:00.126112,0 days 00:00:01.646521,95.53723707220068,6.72050710335256,sigmoid,8,,23.0,31.0,,,,,,,,,,,,,COMPLETE
9461,0.11190108191653786,2024-04-11 19:33:00.126112,2024-04-11 19:33:01.943225,0 days 00:00:01.817113,99.98657899409007,1.8668452089001883,sigmoid,8,,28.0,33.0,,,,,,,,,,,,,COMPLETE
9462,0.3549499594265621,2024-04-11 19:33:01.943225,2024-04-11 19:33:04.418859,0 days 00:00:02.475634,96.62491172841958,7.596354617066107,sigmoid,18,,,,5.0,1.0,78.0,,,0.6886688902691258,9.542795744975743,5.457171522392764,13.0,39.0,51.0,,COMPLETE
9463,0.5721957722338603,2024-04-11 19:33:04.427136,2024-04-11 19:33:06.282642,0 days 00:00:01.855506,98.23945279627125,7.852074977982406,sigmoid,8,,24.0,44.0,,,,,,,,,,,,,COMPLETE
9464,0.4908416194871307,2024-04-11 19:33:06.285639,2024-04-11 19:33:08.954890,0 days 00:00:02.669251,88.22428634707039,8.753261906913957,sigmoid,39,48.0,,,,,,20.0,22.0,7.043236867939223,2.7148592889046568,3.9070216067092525,10.0,26.0,73.0,132.0,COMPLETE
9465,0.3987038692376453,2024-04-11 19:33:08.954890,2024-04-11 19:33:11.541818,0 days 00:00:02.586928,96.53958156278271,8.099903426631183,sigmoid,43,37.0,26.0,30.0,,,,,,3.9512835388819196,8.370194176158614,3.3782923396318907,4.0,50.0,65.0,69.0,COMPLETE
9466,0.42282021721982893,2024-04-11 19:33:11.541818,2024-04-11 19:33:14.375256,0 days 00:00:02.833438,59.595460940877054,8.266205066355049,sigmoid,47,9.0,25.0,31.0,,,,24.0,2.0,7.482263888423236,5.713217537597604,1.044640468823224,3.0,27.0,82.0,97.0,COMPLETE
9467,0.37779662122496904,2024-04-11 19:33:14.375256,2024-04-11 19:33:16.869642,0 days 00:00:02.494386,92.42770966296973,7.853555800844591,sigmoid,19,,,,1.0,4.0,23.0,,,6.6940475891944695,7.898229963279675,7.126278306285855,12.0,43.0,94.0,82.0,COMPLETE
9468,0.2813835989117761,2024-04-11 19:33:16.869642,2024-04-11 19:33:18.923494,0 days 00:00:02.053852,98.18273653869274,8.439476287386995,sigmoid,17,,,,6.0,3.0,59.0,,,,,,,,,139.0,COMPLETE
9469,0.28593996840442343,2024-04-11 19:33:18.923494,2024-04-11 19:33:21.305157,0 days 00:00:02.381663,95.16953609032804,7.995538501747307,sigmoid,6,,,,,,,32.0,3.0,5.330371348162369,6.240868278939873,4.250601216420758,8.0,49.0,58.0,,COMPLETE
9470,0.16863092188009504,2024-04-11 19:33:21.308924,2024-04-11 19:33:24.073176,0 days 00:00:02.764252,98.20996572044754,7.681790434272909,rbf,50,50.0,,,2.0,7.0,17.0,,,9.475203256175389,2.2476069574305964,2.467114381785414,15.0,47.0,54.0,,COMPLETE
9471,0.40590760556160693,2024-04-11 19:33:24.087645,2024-04-11 19:33:26.500725,0 days 00:00:02.413080,93.90593740864283,4.48463193037393,sigmoid,29,,27.0,32.0,8.0,2.0,85.0,40.0,33.0,,,,,,,181.0,COMPLETE
9472,0.12622036262203626,2024-04-11 19:33:26.516280,2024-04-11 19:33:28.223047,0 days 00:00:01.706767,99.95466401417322,8.25498229229966,sigmoid,8,,23.0,29.0,,,,,,,,,,,,,COMPLETE
9473,0.5986580986580987,2024-04-11 19:33:28.223047,2024-04-11 19:33:30.151733,0 days 00:00:01.928686,96.54170183160701,7.414615057748109,sigmoid,8,,28.0,31.0,,,,,,,,,,,,,COMPLETE
9474,0.5906279643331437,2024-04-11 19:33:30.151733,2024-04-11 19:33:32.027918,0 days 00:00:01.876185,98.2947514164694,8.049201431993795,sigmoid,8,,25.0,34.0,,,,,,,,,,,,,COMPLETE
9475,0.47989015931633633,2024-04-11 19:33:32.031918,2024-04-11 19:33:34.998716,0 days 00:00:02.966798,98.11341428258196,8.662113033848833,sigmoid,22,,,,7.0,1.0,34.0,13.0,43.0,4.485956690658864,6.815717136049959,2.794671665090472,6.0,21.0,77.0,,COMPLETE
9476,0.5952371952371952,2024-04-11 19:33:34.998716,2024-04-11 19:33:36.626381,0 days 00:00:01.627665,95.22433285332073,7.820494883784183,sigmoid,8,,29.0,32.0,,,,,,,,,,,,,COMPLETE
9477,0.5223832734735762,2024-04-11 19:33:36.626381,2024-04-11 19:33:38.973617,0 days 00:00:02.347236,96.72058638439343,8.186533781943464,sigmoid,35,33.0,,,,,,,,6.0214693191273945,1.1280676257315427,9.48377381385518,20.0,24.0,96.0,144.0,COMPLETE
9478,0.47964852739487207,2024-04-11 19:33:38.989651,2024-04-11 19:33:41.200164,0 days 00:00:02.210513,96.61584880287192,8.319632699518994,sigmoid,24,,24.0,30.0,3.0,8.0,65.0,,,,,,,,,,COMPLETE
9479,0.47803228513600243,2024-04-11 19:33:41.200164,2024-04-11 19:33:43.160386,0 days 00:00:01.960222,99.98884254002299,7.664943320760546,sigmoid,25,,31.0,33.0,4.0,6.0,81.0,,,,,,,,,159.0,COMPLETE
9480,0.5217092922175962,2024-04-11 19:33:43.160386,2024-04-11 19:33:45.557862,0 days 00:00:02.397476,98.21343720989276,7.94302911593146,sigmoid,15,,22.0,31.0,,,,47.0,24.0,1.0226655448941395,5.382501544589221,8.041312818700153,16.0,46.0,67.0,173.0,COMPLETE
9481,0.4680678447379763,2024-04-11 19:33:45.573473,2024-04-11 19:33:47.642858,0 days 00:00:02.069385,99.96515946876384,8.46116474864386,sigmoid,21,,,,1.0,5.0,26.0,35.0,49.0,,,,,,,40.0,COMPLETE
9482,0.5003030817350823,2024-04-11 19:33:47.642858,2024-04-11 19:33:50.572324,0 days 00:00:02.929466,99.98752372684342,8.09958314978154,sigmoid,31,,27.0,29.0,6.0,3.0,14.0,39.0,39.0,3.7457627623623218,3.1047664810187445,7.698604424283542,11.0,29.0,75.0,86.0,COMPLETE
9483,0.3620670494536025,2024-04-11 19:33:50.587952,2024-04-11 19:33:53.015522,0 days 00:00:02.427570,94.40735728815588,7.842301734556645,sigmoid,3,,,,,,,,,9.71635308887074,9.324712185542777,3.534734697347847,18.0,37.0,69.0,152.0,COMPLETE
9484,0.4491845899314583,2024-04-11 19:33:53.015522,2024-04-11 19:33:54.859875,0 days 00:00:01.844353,99.98482355669135,7.264038396009621,sigmoid,8,,25.0,30.0,,,,,,,,,,,,,COMPLETE
9485,0.5223897164931287,2024-04-11 19:33:54.875515,2024-04-11 19:33:57.944673,0 days 00:00:03.069158,99.98675693501266,7.529207439934366,sigmoid,38,14.0,,,,,,28.0,34.0,2.4141484705961647,3.6333091518045264,0.501938209072077,7.0,23.0,86.0,,COMPLETE
9486,0.4575168305928873,2024-04-11 19:33:57.948673,2024-04-11 19:34:00.635239,0 days 00:00:02.686566,96.54331036331932,8.259535814079387,sigmoid,57,35.0,26.0,32.0,5.0,7.0,69.0,,,,,,,,,113.0,COMPLETE
9487,0.4619872379216044,2024-04-11 19:34:00.635239,2024-04-11 19:34:03.502607,0 days 00:00:02.867368,91.28949251266532,8.881729435500263,rbf,8,,23.0,31.0,,,,,,,,,,,,,COMPLETE
9488,0.493149618558306,2024-04-11 19:34:03.502607,2024-04-11 19:34:06.184324,0 days 00:00:02.681717,93.78136162102861,8.561916986681174,sigmoid,28,,25.0,33.0,3.0,2.0,57.0,7.0,31.0,,,,,,,,COMPLETE
9489,0.5636462904171639,2024-04-11 19:34:06.184324,2024-04-11 19:34:07.688517,0 days 00:00:01.504193,27.313988091127356,8.029618523495198,sigmoid,0,,,,,,,,,,,,,,,,COMPLETE
9490,0.12003789673140693,2024-04-11 19:34:07.688517,2024-04-11 19:34:09.804109,0 days 00:00:02.115592,98.22586576980542,7.812544972152312,sigmoid,8,,24.0,28.0,,,,,,,,,,,,,COMPLETE
9491,0.5064634738570405,2024-04-11 19:34:09.819740,2024-04-11 19:34:12.516002,0 days 00:00:02.696262,96.43391250701113,8.361022799213591,sigmoid,42,44.0,27.0,30.0,,,,,,5.022647706195928,9.997250185750612,8.279988758387352,13.0,33.0,71.0,,COMPLETE
9492,0.44324665488513004,2024-04-11 19:34:12.516002,2024-04-11 19:34:14.554913,0 days 00:00:02.038911,98.1966127229226,8.04068280960208,sigmoid,16,,,,8.0,4.0,21.0,,,,,,,,,,COMPLETE
9493,0.5342968972077057,2024-04-11 19:34:14.554913,2024-04-11 19:34:16.624422,0 days 00:00:02.069509,99.98612704943014,4.9813720118147575,sigmoid,9,,24.0,32.0,,,,,,,,,,,,196.0,COMPLETE
9494,0.36440880395836883,2024-04-11 19:34:16.624422,2024-04-11 19:34:19.711105,0 days 00:00:03.086683,99.99389544831898,8.198199240827265,sigmoid,46,38.0,26.0,4.0,,,,48.0,10.0,3.432066651708477,6.444252629398564,7.393958681608616,14.0,40.0,60.0,,COMPLETE
9495,0.3204957945993802,2024-04-11 19:34:19.726720,2024-04-11 19:34:22.380632,0 days 00:00:02.653912,95.44167447805941,7.678059850531237,sigmoid,14,,19.0,31.0,,,,14.0,36.0,1.7125112649015377,9.06084601740878,3.225222682472267,12.0,31.0,56.0,,COMPLETE
9496,0.6009432182607054,2024-04-11 19:34:22.396293,2024-04-11 19:34:24.388480,0 days 00:00:01.992187,96.81137451955287,7.954656228443291,sigmoid,8,,21.0,31.0,,,,,,,,,,,,,COMPLETE
