number,value,datetime_start,datetime_complete,duration,params_C,params_gamma,params_kernel,params_mask_number,params_rsi_window,params_so_smooth,params_so_window,params_srsi_smooth1,params_srsi_smooth2,params_srsi_window,params_tsi_window_fast,params_tsi_window_slow,params_ult_weight_1,params_ult_weight_2,params_ult_weight_3,params_ult_window_1,params_ult_window_2,params_ult_window_3,params_williams_lbp,state
8160,0.5391458358491326,2024-04-11 18:44:17.429834,2024-04-11 18:44:19.114294,0 days 00:00:01.684460,98.20503112727759,8.278430627576375,sigmoid,2,,,,,,,,,1.9386315709084156,3.3850357254252383,8.095423510560899,20.0,23.0,59.0,,COMPLETE
8161,0.3612142006862264,2024-04-11 18:44:19.118312,2024-04-11 18:44:21.134304,0 days 00:00:02.015992,95.55428278984175,8.398295071170146,sigmoid,42,7.0,24.0,31.0,,,,,,3.7262463875937955,8.83275347991877,6.577001205093687,7.0,34.0,88.0,,COMPLETE
8162,0.20741023682200152,2024-04-11 18:44:21.137350,2024-04-11 18:44:22.698376,0 days 00:00:01.561026,96.72863558337865,7.742588159059281,sigmoid,16,,,,8.0,7.0,48.0,,,,,,,,,,COMPLETE
8163,0.36127744510978044,2024-04-11 18:44:22.701376,2024-04-11 18:44:24.639180,0 days 00:00:01.937804,98.20279854166925,8.011003886486574,sigmoid,25,,23.0,32.0,7.0,5.0,8.0,,,,,,,,,137.0,COMPLETE
8164,0.4512950859356088,2024-04-11 18:44:24.642181,2024-04-11 18:44:26.195071,0 days 00:00:01.552890,98.2027758471294,8.610045754047883,sigmoid,8,,20.0,28.0,,,,,,,,,,,,,COMPLETE
8165,0.3431149529875644,2024-04-11 18:44:26.198063,2024-04-11 18:44:27.805532,0 days 00:00:01.607469,99.94667834910007,8.206696204015527,sigmoid,9,,29.0,35.0,,,,,,,,,,,,157.0,COMPLETE
8166,0.39097767899070224,2024-04-11 18:44:27.808531,2024-04-11 18:44:29.875223,0 days 00:00:02.066692,94.86638056772763,7.917197321609261,sigmoid,28,,26.0,33.0,3.0,8.0,43.0,23.0,10.0,,,,,,,,COMPLETE
8167,0.3822928568955369,2024-04-11 18:44:29.879224,2024-04-11 18:44:31.745230,0 days 00:00:01.866006,96.44586874232954,7.46418143397199,sigmoid,41,3.0,25.0,30.0,,,,,,,,,,,,92.0,COMPLETE
8168,0.5931679318644695,2024-04-11 18:44:31.749228,2024-04-11 18:44:33.276725,0 days 00:00:01.527497,98.20438889014687,8.388504694559405,sigmoid,8,,27.0,27.0,,,,,,,,,,,,,COMPLETE
8169,0.3815613800857283,2024-04-11 18:44:33.279698,2024-04-11 18:44:35.401879,0 days 00:00:02.122181,93.40992647864948,7.689713493888976,sigmoid,11,,24.0,32.0,,,,,,7.689735599171698,4.458085272883307,8.868956055111399,15.0,48.0,77.0,88.0,COMPLETE
8170,0.45842539203535054,2024-04-11 18:44:35.405398,2024-04-11 18:44:38.187064,0 days 00:00:02.781666,96.65966497136391,8.083724191435525,sigmoid,63,20.0,30.0,31.0,5.0,2.0,86.0,13.0,40.0,4.585210901677869,9.199534908603745,3.619537270755751,14.0,32.0,96.0,147.0,COMPLETE
8171,0.4910835409318501,2024-04-11 18:44:38.190094,2024-04-11 18:44:40.403367,0 days 00:00:02.213273,95.06494786814874,7.834327097923136,sigmoid,46,25.0,26.0,30.0,,,,29.0,45.0,2.873238900752008,2.096868957268211,1.3205387485345543,16.0,38.0,57.0,,COMPLETE
8172,0.4909290959801438,2024-04-11 18:44:40.406706,2024-04-11 18:44:43.081353,0 days 00:00:02.674647,98.16727761111284,8.222384855302888,sigmoid,62,17.0,28.0,33.0,6.0,4.0,50.0,19.0,30.0,2.4260753367869157,1.777375896790284,3.285722145177181,17.0,22.0,63.0,,COMPLETE
8173,0.6009432182607054,2024-04-11 18:44:43.084365,2024-04-11 18:44:44.682636,0 days 00:00:01.598271,98.14124144392221,8.00765391525741,sigmoid,8,,25.0,31.0,,,,,,,,,,,,,COMPLETE
8174,0.5006275567125326,2024-04-11 18:44:44.686175,2024-04-11 18:44:46.656328,0 days 00:00:01.970153,99.98712449250984,8.82620103868527,sigmoid,10,,23.0,28.0,,,,,,2.627178681297367,8.184179394041728,2.565878089330074,18.0,20.0,76.0,,COMPLETE
8175,0.5258658528938404,2024-04-11 18:44:46.659326,2024-04-11 18:44:48.252568,0 days 00:00:01.593242,92.43796454212466,8.44506245282294,sigmoid,37,5.0,,,,,,38.0,35.0,,,,,,,65.0,COMPLETE
8176,0.433025864589702,2024-04-11 18:44:48.255094,2024-04-11 18:44:50.756373,0 days 00:00:02.501279,96.7881668069387,7.64708685457966,sigmoid,26,,24.0,29.0,2.0,6.0,54.0,,,1.6052116866505366,3.823285493192535,7.249589599134469,13.0,30.0,90.0,,COMPLETE
8177,0.5297852166384961,2024-04-11 18:44:50.759376,2024-04-11 18:44:52.568437,0 days 00:00:01.809061,95.47756372034199,8.275858727911864,sigmoid,20,,,,1.0,1.0,93.0,7.0,12.0,,,,,,,,COMPLETE
8178,0.4469800654567093,2024-04-11 18:44:52.572432,2024-04-11 18:44:54.730810,0 days 00:00:02.158378,94.12859454969855,7.871650547117736,rbf,8,,27.0,32.0,,,,,,,,,,,,,COMPLETE
8179,0.5906279643331437,2024-04-11 18:44:54.733809,2024-04-11 18:44:56.400147,0 days 00:00:01.666338,96.9370447403339,8.644938072425019,sigmoid,8,,25.0,34.0,,,,,,,,,,,,,COMPLETE
8180,0.6009432182607054,2024-04-11 18:44:56.403145,2024-04-11 18:44:57.915050,0 days 00:00:01.511905,99.99414452738665,8.077416509519677,sigmoid,8,,22.0,31.0,,,,,,,,,,,,,COMPLETE
8181,0.5766445907590122,2024-04-11 18:44:57.919202,2024-04-11 18:44:59.674773,0 days 00:00:01.755571,98.27044162486182,7.322398672875039,sigmoid,48,35.0,,,4.0,7.0,19.0,,,,,,,,,,COMPLETE
8182,0.3591269841269842,2024-04-11 18:44:59.678841,2024-04-11 18:45:01.486667,0 days 00:00:01.807826,96.42892422992134,8.207095623719445,sigmoid,44,10.0,21.0,33.0,,,,47.0,23.0,,,,,,,,COMPLETE
8183,0.4837969533541489,2024-04-11 18:45:01.490264,2024-04-11 18:45:03.562239,0 days 00:00:02.071975,99.98164717803637,8.479057776086535,sigmoid,56,47.0,26.0,42.0,6.0,5.0,75.0,,,,,,,,,,COMPLETE
8184,0.4170026494643474,2024-04-11 18:45:03.568816,2024-04-11 18:45:06.024213,0 days 00:00:02.455397,96.7047710460944,7.951915877883047,sigmoid,59,34.0,24.0,29.0,7.0,8.0,15.0,,,6.0202665732789,1.543983528500958,0.852906618974373,8.0,26.0,68.0,55.0,COMPLETE
8185,0.45964310226492794,2024-04-11 18:45:06.027809,2024-04-11 18:45:07.669289,0 days 00:00:01.641480,99.95022832227575,2.5392073655308534,sigmoid,8,,26.0,30.0,,,,,,,,,,,,,COMPLETE
8186,0.5952371952371952,2024-04-11 18:45:07.672296,2024-04-11 18:45:09.115280,0 days 00:00:01.442984,99.95131855878688,7.733302638060917,sigmoid,8,,27.0,32.0,,,,,,,,,,,,,COMPLETE
8187,0.43781610278641664,2024-04-11 18:45:09.118324,2024-04-11 18:45:11.112011,0 days 00:00:01.993687,98.18657466368376,7.566110832522594,sigmoid,60,22.0,49.0,31.0,8.0,4.0,100.0,36.0,41.0,,,,,,,,COMPLETE
8188,0.44701971028259324,2024-04-11 18:45:11.115012,2024-04-11 18:45:12.791447,0 days 00:00:01.676435,94.16997907089755,8.113800342583247,sigmoid,8,,25.0,30.0,,,,,,,,,,,,,COMPLETE
8189,0.3430737640183225,2024-04-11 18:45:12.795447,2024-04-11 18:45:14.615357,0 days 00:00:01.819910,91.29981835201141,8.33350378627755,sigmoid,12,,28.0,23.0,,,,44.0,33.0,,,,,,,,COMPLETE
8190,0.3270838039304269,2024-04-11 18:45:14.620304,2024-04-11 18:45:17.069695,0 days 00:00:02.449391,98.21400101088739,7.870486563825952,sigmoid,14,,23.0,33.0,,,,20.0,43.0,7.318356830063276,0.9563784980652343,7.586598712552642,5.0,33.0,95.0,,COMPLETE
8191,0.4442399140972542,2024-04-11 18:45:17.072692,2024-04-11 18:45:19.451287,0 days 00:00:02.378595,99.99642536080401,8.043561685242897,sigmoid,54,6.0,,,3.0,3.0,81.0,9.0,6.0,8.934904732873871,0.5044383714613829,5.871416423600213,12.0,36.0,60.0,,COMPLETE
8192,0.4567938623056733,2024-04-11 18:45:19.455287,2024-04-11 18:45:21.986638,0 days 00:00:02.531351,95.18061674823745,8.49209643057972,sigmoid,55,8.0,,,5.0,2.0,33.0,2.0,38.0,1.0207073290090722,6.167902846728296,9.248193356293346,6.0,34.0,65.0,77.0,COMPLETE
8193,0.3300675796474416,2024-04-11 18:45:21.989681,2024-04-11 18:45:24.055483,0 days 00:00:02.065802,96.80854162956679,8.22327700199097,sigmoid,7,,,,,,,21.0,28.0,9.34695948126154,7.686565910751175,5.1302084847487,10.0,25.0,55.0,14.0,COMPLETE
8194,0.45715488436949137,2024-04-11 18:45:24.058437,2024-04-11 18:45:26.517440,0 days 00:00:02.459003,98.20974126573486,7.473406372000697,sigmoid,23,,,,4.0,7.0,2.0,16.0,4.0,8.269456758508891,9.707229447816289,6.689056616909405,7.0,42.0,71.0,118.0,COMPLETE
8195,0.4758030193025061,2024-04-11 18:45:26.520441,2024-04-11 18:45:28.496550,0 days 00:00:01.976109,98.24454708730173,6.950120547635789,sigmoid,52,36.0,,,1.0,6.0,37.0,25.0,11.0,,,,,,,,COMPLETE
8196,0.5952371952371952,2024-04-11 18:45:28.499521,2024-04-11 18:45:29.994220,0 days 00:00:01.494699,95.33996837471715,7.754739753628363,sigmoid,8,,24.0,32.0,,,,,,,,,,,,,COMPLETE
8197,0.23181557214150067,2024-04-11 18:45:29.997825,2024-04-11 18:45:31.860303,0 days 00:00:01.862478,98.19412199126216,7.957994121578849,rbf,13,,26.0,29.0,,,,33.0,14.0,,,,,,,83.0,COMPLETE
8198,0.5986580986580987,2024-04-11 18:45:31.863302,2024-04-11 18:45:33.364104,0 days 00:00:01.500802,99.94347301266173,8.293220723294707,sigmoid,8,,29.0,31.0,,,,,,,,,,,,,COMPLETE
8199,0.5192784177352749,2024-04-11 18:45:33.366653,2024-04-11 18:45:34.991303,0 days 00:00:01.624650,96.78974357930575,8.64233679439791,sigmoid,40,15.0,25.0,30.0,,,,,,,,,,,,,COMPLETE
8200,0.4266200942806838,2024-04-11 18:45:34.994301,2024-04-11 18:45:37.428551,0 days 00:00:02.434250,99.96711576049753,8.101205563535279,sigmoid,27,,22.0,32.0,2.0,1.0,71.0,,,1.2085804128079678,3.9948429749904375,1.4885050083950713,9.0,21.0,58.0,164.0,COMPLETE
8201,0.4065849432000513,2024-04-11 18:45:37.432534,2024-04-11 18:45:39.031957,0 days 00:00:01.599423,93.52628042989069,7.8032060603867315,sigmoid,36,43.0,,,,,,42.0,48.0,,,,,,,,COMPLETE
8202,0.3728785847421602,2024-04-11 18:45:39.034954,2024-04-11 18:45:41.102227,0 days 00:00:02.067273,95.64311808458169,8.352389453105706,sigmoid,61,31.0,24.0,31.0,6.0,5.0,10.0,5.0,15.0,,,,,,,98.0,COMPLETE
8203,0.14786160499759732,2024-04-11 18:45:41.105209,2024-04-11 18:45:42.386107,0 days 00:00:01.280898,98.13008003710121,8.000149913753118,sigmoid,32,27.0,,,,,,,,,,,,,,,COMPLETE
8204,0.12622036262203626,2024-04-11 18:45:42.388684,2024-04-11 18:45:43.882133,0 days 00:00:01.493449,98.27568520209886,7.710600201945712,sigmoid,8,,27.0,29.0,,,,,,,,,,,,,COMPLETE
8205,0.4069822485207101,2024-04-11 18:45:43.886124,2024-04-11 18:45:46.463624,0 days 00:00:02.577500,96.54866076340606,8.157775860948185,sigmoid,30,,26.0,30.0,8.0,3.0,52.0,46.0,46.0,2.0685489921157116,4.671711936835441,5.368597351718829,19.0,43.0,84.0,,COMPLETE
8206,0.566487145615283,2024-04-11 18:45:46.467220,2024-04-11 18:45:48.321544,0 days 00:00:01.854324,92.17939685288755,7.515204002794291,sigmoid,34,28.0,,,,,,,,5.193181324838092,5.030367432660265,1.8742754874370933,2.0,50.0,66.0,,COMPLETE
8207,0.45345352376492626,2024-04-11 18:45:48.324137,2024-04-11 18:45:49.504287,0 days 00:00:01.180150,95.17995485552578,8.45751746636884,sigmoid,1,,,,,,,,,,,,,,,30.0,COMPLETE
8208,0.5952371952371952,2024-04-11 18:45:49.506845,2024-04-11 18:45:50.862611,0 days 00:00:01.355766,98.0597763498068,7.917726257464146,sigmoid,8,,25.0,32.0,,,,,,,,,,,,,COMPLETE
8209,0.5842605449660073,2024-04-11 18:45:50.865584,2024-04-11 18:45:52.381539,0 days 00:00:01.515955,98.1986438038324,8.817987917108788,sigmoid,8,,24.0,5.0,,,,,,,,,,,,,COMPLETE
8210,0.3474211779760424,2024-04-11 18:45:52.384540,2024-04-11 18:45:54.446265,0 days 00:00:02.061725,99.97117536166176,8.196448574149034,sigmoid,45,33.0,23.0,31.0,,,,45.0,25.0,,,,,,,178.0,COMPLETE
8211,0.2102468367558598,2024-04-11 18:45:54.449319,2024-04-11 18:45:55.809909,0 days 00:00:01.360590,96.60257600855364,7.983016971905308,sigmoid,4,,,,,,,28.0,34.0,,,,,,,,COMPLETE
8212,0.32072839692354094,2024-04-11 18:45:55.812890,2024-04-11 18:45:57.346463,0 days 00:00:01.533573,93.77114839769796,7.2956624518782816,sigmoid,33,19.0,,,,,,,,,,,,,,69.0,COMPLETE
8213,0.4171841987323132,2024-04-11 18:45:57.348514,2024-04-11 18:45:58.976949,0 days 00:00:01.628435,96.76500482567543,8.347643275366371,sigmoid,5,,,,,,,49.0,36.0,,,,,,,133.0,COMPLETE
8214,0.5929369437606513,2024-04-11 18:45:58.979971,2024-04-11 18:46:00.431870,0 days 00:00:01.451899,89.61224857291884,7.720777403041431,sigmoid,8,,28.0,33.0,,,,,,,,,,,,,COMPLETE
8215,0.4617620884010679,2024-04-11 18:46:00.434918,2024-04-11 18:46:02.718556,0 days 00:00:02.283638,99.99900796152428,8.586460777336292,rbf,8,,44.0,28.0,,,,,,,,,,,,,COMPLETE
8216,0.4739183486704967,2024-04-11 18:46:02.721553,2024-04-11 18:46:05.258229,0 days 00:00:02.536676,98.24799066277211,8.116261048751364,sigmoid,58,24.0,26.0,31.0,7.0,4.0,56.0,,,5.522348652899322,9.361768000532471,4.071956582848683,16.0,41.0,52.0,,COMPLETE
8217,0.4392442364361241,2024-04-11 18:46:05.260223,2024-04-11 18:46:07.109880,0 days 00:00:01.849657,94.75437393322032,7.842325234474617,sigmoid,53,41.0,,,3.0,8.0,84.0,15.0,20.0,,,,,,,46.0,COMPLETE
8218,0.45682189340327606,2024-04-11 18:46:07.112879,2024-04-11 18:46:08.817071,0 days 00:00:01.704192,99.93922215272318,7.555293911367386,sigmoid,49,44.0,,,5.0,2.0,88.0,,,,,,,,,169.0,COMPLETE
8219,0.45345352376492626,2024-04-11 18:46:08.820038,2024-04-11 18:46:10.304549,0 days 00:00:01.484511,96.85759883537536,8.246887422288879,sigmoid,8,,27.0,30.0,,,,,,,,,,,,,COMPLETE
8220,0.48765981241898176,2024-04-11 18:46:10.307180,2024-04-11 18:46:12.498371,0 days 00:00:02.191191,96.69205515774674,8.001872845724163,sigmoid,29,,25.0,32.0,2.0,6.0,41.0,11.0,2.0,,,,,,,62.0,COMPLETE
8221,0.5906279643331437,2024-04-11 18:46:12.500367,2024-04-11 18:46:14.039574,0 days 00:00:01.539207,99.96026529804897,8.404900969320375,sigmoid,8,,24.0,34.0,,,,,,,,,,,,,COMPLETE
8222,0.5476609442060085,2024-04-11 18:46:14.043104,2024-04-11 18:46:15.619991,0 days 00:00:01.576887,95.15895764003122,7.862372506974476,sigmoid,17,,,,4.0,1.0,45.0,,,,,,,,,102.0,COMPLETE
8223,0.48097223238011655,2024-04-11 18:46:15.623973,2024-04-11 18:46:17.801183,0 days 00:00:02.177210,98.10089031362878,8.120917853346782,sigmoid,51,11.0,,,1.0,6.0,31.0,,,4.780017207775454,7.166952952831707,6.3489632477928915,19.0,29.0,91.0,110.0,COMPLETE
8224,0.4866409006889598,2024-04-11 18:46:17.804185,2024-04-11 18:46:19.761278,0 days 00:00:01.957093,98.26567611219852,7.676114535770514,sigmoid,18,,,,6.0,5.0,68.0,,,9.999297741945211,1.261135740011782,3.80752028703931,13.0,27.0,98.0,,COMPLETE
8225,0.547420895646914,2024-04-11 18:46:19.765294,2024-04-11 18:46:21.961833,0 days 00:00:02.196539,99.96035669049964,8.605786498897768,sigmoid,50,50.0,,,8.0,7.0,17.0,,,7.060462125383141,5.45241943349509,7.449842548130016,3.0,47.0,80.0,,COMPLETE
8226,0.4836570119769051,2024-04-11 18:46:21.965834,2024-04-11 18:46:24.360374,0 days 00:00:02.394540,92.58009628598825,8.228026824410971,sigmoid,47,32.0,23.0,30.0,,,,4.0,42.0,6.873295485374209,6.607048479499316,4.875117761198941,20.0,35.0,53.0,191.0,COMPLETE
8227,0.46943143475852345,2024-04-11 18:46:24.363374,2024-04-11 18:46:26.260086,0 days 00:00:01.896712,99.9903574258963,7.962181737047208,sigmoid,25,,26.0,33.0,7.0,4.0,63.0,,,,,,,,,185.0,COMPLETE
8228,0.536369559277863,2024-04-11 18:46:26.264086,2024-04-11 18:46:28.346380,0 days 00:00:02.082294,95.12797640296274,8.4011706194999,sigmoid,6,,,,,,,39.0,23.0,8.683087635043123,6.993285773835478,7.14724292420537,14.0,45.0,93.0,,COMPLETE
8229,0.4741897923539686,2024-04-11 18:46:28.350801,2024-04-11 18:46:30.912416,0 days 00:00:02.561615,96.79144830756373,8.144110219938256,sigmoid,43,13.0,25.0,2.0,,,,,,3.815330425723614,4.210205112414689,7.934445032268346,18.0,24.0,75.0,35.0,COMPLETE
8230,0.12622036262203626,2024-04-11 18:46:30.914415,2024-04-11 18:46:32.550146,0 days 00:00:01.635731,98.27030535050953,7.818127051193271,sigmoid,8,,28.0,29.0,,,,,,,,,,,,,COMPLETE
8231,0.5941143180531975,2024-04-11 18:46:32.553148,2024-04-11 18:46:34.222188,0 days 00:00:01.669040,93.88212163831527,7.3601295719373185,sigmoid,8,,27.0,31.0,,,,,,,,,,,,,COMPLETE
8232,0.34993672665916764,2024-04-11 18:46:34.225189,2024-04-11 18:46:35.999602,0 days 00:00:01.774413,96.67387098213253,7.59760948222321,sigmoid,24,,22.0,32.0,5.0,5.0,25.0,,,,,,,,,,COMPLETE
8233,0.5179918360102937,2024-04-11 18:46:36.002597,2024-04-11 18:46:37.902665,0 days 00:00:01.900068,99.99586644992928,8.018248576993152,sigmoid,35,30.0,,,,,,,,6.3236309115735,7.441861253478356,1.0197273539231464,11.0,37.0,78.0,150.0,COMPLETE
8234,0.45345352376492626,2024-04-11 18:46:37.905652,2024-04-11 18:46:39.513926,0 days 00:00:01.608274,96.88941955128907,8.33146549628879,sigmoid,8,,26.0,30.0,,,,,,,,,,,,,COMPLETE
8235,0.3443853282125366,2024-04-11 18:46:39.518473,2024-04-11 18:46:41.543444,0 days 00:00:02.024971,99.97751974455622,8.535956051534392,sigmoid,38,18.0,,,,,,31.0,31.0,3.4588704470698506,5.245121559597595,2.3362947350013754,9.0,31.0,99.0,,COMPLETE
8236,0.38817401960784315,2024-04-11 18:46:41.546444,2024-04-11 18:46:43.851731,0 days 00:00:02.305287,98.22638767147598,6.5460048875351164,sigmoid,22,,,,2.0,8.0,78.0,37.0,9.0,5.7968776743358115,2.516184241807151,9.613780320986574,5.0,39.0,73.0,,COMPLETE
8237,0.6009432182607054,2024-04-11 18:46:43.855728,2024-04-11 18:46:45.365893,0 days 00:00:01.510165,99.99636559423915,7.83988102784443,sigmoid,8,,24.0,31.0,,,,,,,,,,,,,COMPLETE
8238,0.5494415875676777,2024-04-11 18:46:45.369468,2024-04-11 18:46:47.512316,0 days 00:00:02.142848,95.2418290287344,8.11984658239585,sigmoid,19,,,,3.0,3.0,12.0,,,8.472588181302902,5.959715656554666,4.434458374764893,4.0,50.0,67.0,74.0,COMPLETE
8239,0.4778700682290121,2024-04-11 18:46:47.515315,2024-04-11 18:46:49.831981,0 days 00:00:02.316666,99.96900963930575,8.944199593930604,rbf,8,,25.0,34.0,,,,,,,,,,,,,COMPLETE
8240,0.4814638517108137,2024-04-11 18:46:49.834978,2024-04-11 18:46:52.624210,0 days 00:00:02.789232,99.95272269303005,7.091189259878508,sigmoid,31,,27.0,32.0,4.0,2.0,91.0,18.0,37.0,3.145971091686196,2.8692275173860042,0.7079672279277229,10.0,23.0,97.0,22.0,COMPLETE
8241,0.521783605337797,2024-04-11 18:46:52.627212,2024-04-11 18:46:54.914343,0 days 00:00:02.287131,96.67318363038991,8.252218501034962,sigmoid,39,9.0,,,,,,35.0,39.0,6.66155880522115,8.375509376794128,8.529537938870263,17.0,44.0,51.0,174.0,COMPLETE
8242,0.5596495748518424,2024-04-11 18:46:54.917318,2024-04-11 18:46:56.175116,0 days 00:00:01.257798,98.19837389491384,3.7523823093662365,sigmoid,0,,,,,,,,,,,,,,,,COMPLETE
8243,0.38464758347554495,2024-04-11 18:46:56.178183,2024-04-11 18:46:58.028336,0 days 00:00:01.850153,93.1199444430818,8.73074138702783,sigmoid,21,,,,8.0,7.0,61.0,22.0,7.0,,,,,,,140.0,COMPLETE
8244,0.4869591211419177,2024-04-11 18:46:58.030343,2024-04-11 18:47:00.521232,0 days 00:00:02.490889,95.14646423736471,7.98096344357253,sigmoid,15,,23.0,29.0,,,,10.0,17.0,8.05851230670688,4.893090028885287,5.569000006511082,15.0,28.0,86.0,52.0,COMPLETE
8245,0.5366650194443847,2024-04-11 18:47:00.524226,2024-04-11 18:47:02.522299,0 days 00:00:01.998073,98.20960032414574,7.714179447883943,sigmoid,3,,,,,,,,,7.537180321589264,3.477119406845249,2.938834387651589,7.0,32.0,82.0,18.0,COMPLETE
8246,0.43483183299276523,2024-04-11 18:47:02.525291,2024-04-11 18:47:04.715264,0 days 00:00:02.189973,96.34484712800293,2.24298069069618,sigmoid,28,,26.0,33.0,7.0,1.0,96.0,26.0,22.0,,,,,,,,COMPLETE
8247,0.5152437036876073,2024-04-11 18:47:04.718796,2024-04-11 18:47:06.722254,0 days 00:00:02.003458,96.68256212292135,8.449967550756778,sigmoid,57,40.0,25.0,31.0,1.0,3.0,22.0,,,,,,,,,122.0,COMPLETE
8248,0.44701971028259324,2024-04-11 18:47:06.725272,2024-04-11 18:47:08.271013,0 days 00:00:01.545741,90.70215501534803,7.482635895755251,sigmoid,8,,28.0,30.0,,,,,,,,,,,,,COMPLETE
8249,0.413215803158095,2024-04-11 18:47:08.273009,2024-04-11 18:47:09.908551,0 days 00:00:01.635542,94.11003661224743,8.09076386141117,sigmoid,16,,,,5.0,4.0,66.0,,,,,,,,,,COMPLETE
8250,0.587727022564667,2024-04-11 18:47:09.911482,2024-04-11 18:47:11.485217,0 days 00:00:01.573735,98.07309516079063,2.9861462597073487,sigmoid,8,,24.0,28.0,,,,,,,,,,,,,COMPLETE
8251,0.46430321371955613,2024-04-11 18:47:11.487218,2024-04-11 18:47:14.357435,0 days 00:00:02.870217,98.21243871890624,7.9065788348721435,sigmoid,63,21.0,25.0,32.0,2.0,8.0,28.0,8.0,3.0,4.301605754042824,0.799576105361183,9.103416606968842,12.0,25.0,63.0,154.0,COMPLETE
8252,0.5064634738570405,2024-04-11 18:47:14.362032,2024-04-11 18:47:16.649936,0 days 00:00:02.287904,99.9659706849051,8.313067765103265,sigmoid,46,36.0,30.0,31.0,,,,48.0,30.0,9.669533467061612,8.9908208014973,3.479798903011906,8.0,46.0,69.0,,COMPLETE
8253,0.48818528290823804,2024-04-11 18:47:16.653928,2024-04-11 18:47:18.764137,0 days 00:00:02.110209,95.60038613855446,7.707400987396845,rbf,8,,26.0,30.0,,,,,,,,,,,,,COMPLETE
8254,0.49274436001230976,2024-04-11 18:47:18.769637,2024-04-11 18:47:21.090984,0 days 00:00:02.321347,56.55615283940582,8.106299295146863,sigmoid,14,,27.0,32.0,,,,6.0,44.0,4.036421519126888,5.695656406417354,6.032869956449959,11.0,33.0,72.0,,COMPLETE
8255,0.5273825474808056,2024-04-11 18:47:21.093979,2024-04-11 18:47:22.705771,0 days 00:00:01.611792,48.824974873517434,7.918891093734904,sigmoid,9,,24.0,29.0,,,,,,,,,,,,105.0,COMPLETE
8256,0.20872286973353651,2024-04-11 18:47:22.708772,2024-04-11 18:47:24.433353,0 days 00:00:01.724581,96.70980832526664,8.266754237520043,sigmoid,2,,,,,,,,,4.979546665105806,3.2266732947177794,6.933410935764709,20.0,21.0,90.0,,COMPLETE
8257,0.5069140556625241,2024-04-11 18:47:24.436348,2024-04-11 18:47:25.847615,0 days 00:00:01.411267,99.9520008148946,8.502072734587932,sigmoid,8,,22.0,35.0,,,,,,,,,,,,,COMPLETE
8258,0.526761487964989,2024-04-11 18:47:25.850206,2024-04-11 18:47:28.113012,0 days 00:00:02.262806,98.20385723701764,7.541832733970896,sigmoid,42,48.0,23.0,31.0,,,,,,0.8363046219172254,3.653897302502048,9.423274667155061,3.0,29.0,100.0,,COMPLETE
8259,0.5929369437606513,2024-04-11 18:47:28.116016,2024-04-11 18:47:29.694890,0 days 00:00:01.578874,99.97294600462916,7.835431088853225,sigmoid,8,,26.0,33.0,,,,,,,,,,,,,COMPLETE
8260,0.3511658822261344,2024-04-11 18:47:29.697888,2024-04-11 18:47:31.917541,0 days 00:00:02.219653,41.25685326715394,8.095145898885942,sigmoid,11,,25.0,30.0,,,,,,1.4051538473881524,8.066295622033914,1.224257450886105,6.0,40.0,56.0,195.0,COMPLETE
8261,0.2707341074591616,2024-04-11 18:47:31.920141,2024-04-11 18:47:33.976176,0 days 00:00:02.056035,93.71585153153781,8.358180816389577,sigmoid,10,,34.0,32.0,,,,,,2.232833712956477,8.66792014361534,4.6424457096956715,14.0,38.0,61.0,,COMPLETE
