number,value,datetime_start,datetime_complete,duration,params_C,params_gamma,params_kernel,params_mask_number,params_rsi_window,params_so_smooth,params_so_window,params_srsi_smooth1,params_srsi_smooth2,params_srsi_window,params_tsi_window_fast,params_tsi_window_slow,params_ult_weight_1,params_ult_weight_2,params_ult_weight_3,params_ult_window_1,params_ult_window_2,params_ult_window_3,params_williams_lbp,state
4254,0.49686698096317955,2024-04-11 17:02:22.579511,2024-04-11 17:02:23.527476,0 days 00:00:00.947965,98.04004130618104,5.882463339797596,sigmoid,17,,,,8.0,4.0,26.0,,,,,,,,,166.0,COMPLETE
4255,0.47866713681241185,2024-04-11 17:02:23.530466,2024-04-11 17:02:24.650832,0 days 00:00:01.120366,95.30948240190006,7.713468068765148,sigmoid,53,6.0,,,7.0,6.0,39.0,39.0,50.0,,,,,,,149.0,COMPLETE
4256,0.5943780375673191,2024-04-11 17:02:24.652858,2024-04-11 17:02:25.468778,0 days 00:00:00.815920,98.26216404804221,8.24575956986111,sigmoid,8,,25.0,24.0,,,,,,,,,,,,,COMPLETE
4257,0.6009432182607054,2024-04-11 17:02:25.471767,2024-04-11 17:02:26.224723,0 days 00:00:00.752956,96.38595861743816,7.935487693084256,sigmoid,8,,28.0,31.0,,,,,,,,,,,,,COMPLETE
4258,0.5408789062500001,2024-04-11 17:02:26.226685,2024-04-11 17:02:26.995202,0 days 00:00:00.768517,99.93452906780142,8.461613708822812,sigmoid,5,,,,,,,4.0,31.0,,,,,,,102.0,COMPLETE
4259,0.44701971028259324,2024-04-11 17:02:26.996783,2024-04-11 17:02:27.758315,0 days 00:00:00.761532,99.99809434245978,8.133899819059897,sigmoid,8,,22.0,30.0,,,,,,,,,,,,,COMPLETE
4260,0.5716527804689014,2024-04-11 17:02:27.760326,2024-04-11 17:02:28.505328,0 days 00:00:00.745002,96.63990275726475,7.809361996499073,sigmoid,4,,,,,,,2.0,40.0,,,,,,,,COMPLETE
4261,0.5021125858904869,2024-04-11 17:02:28.508322,2024-04-11 17:02:29.221252,0 days 00:00:00.712930,93.66191022846408,8.946380882234152,sigmoid,33,45.0,,,,,,,,,,,,,,89.0,COMPLETE
4262,0.5074427608303851,2024-04-11 17:02:29.223273,2024-04-11 17:02:30.428744,0 days 00:00:01.205471,98.17876448939032,8.303847660936993,sigmoid,51,22.0,,,5.0,8.0,9.0,,,4.332727895757056,2.1771630861923073,8.422789216943604,19.0,46.0,86.0,69.0,COMPLETE
4263,0.3898499024029077,2024-04-11 17:02:30.431310,2024-04-11 17:02:31.443307,0 days 00:00:01.011997,95.20914851054985,8.005944426319793,sigmoid,45,20.0,25.0,32.0,,,,49.0,4.0,,,,,,,183.0,COMPLETE
4264,0.6009432182607054,2024-04-11 17:02:31.446307,2024-04-11 17:02:32.291486,0 days 00:00:00.845179,99.99930002853141,7.572178486403401,sigmoid,8,,24.0,31.0,,,,,,,,,,,,,COMPLETE
4265,0.47532049471960247,2024-04-11 17:02:32.293485,2024-04-11 17:02:33.579465,0 days 00:00:01.285980,96.96688810294711,8.118616742705102,sigmoid,58,10.0,27.0,33.0,6.0,5.0,96.0,,,8.333461187541017,4.388868051152079,9.026314772524533,18.0,21.0,80.0,,COMPLETE
4266,0.4664381396931904,2024-04-11 17:02:33.581485,2024-04-11 17:02:34.748013,0 days 00:00:01.166528,99.96195057923558,2.283680038764651,sigmoid,24,,26.0,29.0,4.0,7.0,98.0,,,,,,,,,,COMPLETE
4267,0.38530157121135333,2024-04-11 17:02:34.749960,2024-04-11 17:02:35.907237,0 days 00:00:01.157277,98.1843592979926,8.59821475733949,sigmoid,50,38.0,,,8.0,3.0,77.0,,,5.340543247788542,3.9665696338871586,5.480944399161401,2.0,47.0,65.0,,COMPLETE
4268,0.5258869276476756,2024-04-11 17:02:35.910238,2024-04-11 17:02:37.270580,0 days 00:00:01.360342,92.62627339925709,7.891903827876623,sigmoid,39,4.0,,,,,,45.0,46.0,6.036324817587585,1.4772730898036328,2.3524630658049697,15.0,30.0,88.0,155.0,COMPLETE
4269,0.4754513325054924,2024-04-11 17:02:37.272584,2024-04-11 17:02:38.198561,0 days 00:00:00.925977,95.15004535328048,8.347655538705329,sigmoid,49,48.0,,,1.0,2.0,62.0,,,,,,,,,142.0,COMPLETE
4270,0.5141797871828206,2024-04-11 17:02:38.200544,2024-04-11 17:02:39.341667,0 days 00:00:01.141123,98.13937322596577,7.8161872551910605,sigmoid,19,,,,3.0,1.0,57.0,,,9.482077253070335,4.931606749688563,7.598918133583721,4.0,26.0,84.0,13.0,COMPLETE
4271,0.05382419412394432,2024-04-11 17:02:39.343660,2024-04-11 17:02:40.975743,0 days 00:00:01.632083,96.52388520707909,8.120680289830347,rbf,47,42.0,23.0,30.0,,,,26.0,19.0,5.528873825309351,9.541167740097503,1.9481522653082783,13.0,36.0,52.0,192.0,COMPLETE
4272,0.1941426106421676,2024-04-11 17:02:40.978756,2024-04-11 17:02:42.126528,0 days 00:00:01.147772,99.98545853843588,8.461990700968933,sigmoid,6,,,,,,,37.0,44.0,2.9503634264800502,9.217408325512768,1.4547917564804846,11.0,35.0,71.0,,COMPLETE
4273,0.5986580986580987,2024-04-11 17:02:42.128527,2024-04-11 17:02:42.866861,0 days 00:00:00.738334,96.76777037560957,7.457635865138073,sigmoid,8,,26.0,31.0,,,,,,,,,,,,,COMPLETE
4274,0.36475452555505367,2024-04-11 17:02:42.867877,2024-04-11 17:02:43.880898,0 days 00:00:01.013021,98.18716683952024,7.6908641306414225,sigmoid,35,14.0,,,,,,,,9.288123799511366,2.808800139384788,3.0635399532206966,5.0,22.0,99.0,10.0,COMPLETE
4275,0.40625296367717245,2024-04-11 17:02:43.882441,2024-04-11 17:02:45.169335,0 days 00:00:01.286894,93.87691481173222,8.194702874600704,sigmoid,43,18.0,25.0,32.0,,,,,,1.2056629445913876,7.799956438856522,2.618730239383421,14.0,24.0,77.0,180.0,COMPLETE
4276,0.374426271898636,2024-04-11 17:02:45.171332,2024-04-11 17:02:46.500030,0 days 00:00:01.328698,98.12129053942628,8.72829594292665,sigmoid,29,,29.0,34.0,5.0,4.0,6.0,24.0,39.0,,,,,,,113.0,COMPLETE
4277,0.38873097087991915,2024-04-11 17:02:46.502537,2024-04-11 17:02:47.619407,0 days 00:00:01.116870,95.47998716467622,8.021003722989446,sigmoid,18,,,,2.0,8.0,45.0,,,2.4019229005574685,7.054511572137118,0.8065561935408248,17.0,49.0,67.0,,COMPLETE
4278,0.49176200802612235,2024-04-11 17:02:47.622491,2024-04-11 17:02:48.836802,0 days 00:00:01.214311,99.99685727691659,8.312696527028349,sigmoid,22,,,,7.0,7.0,54.0,30.0,33.0,7.154082378724884,3.4011930856789307,5.79996843185402,10.0,43.0,55.0,,COMPLETE
4279,0.6009432182607054,2024-04-11 17:02:48.839344,2024-04-11 17:02:49.586909,0 days 00:00:00.747565,99.96152056021847,7.836059791032811,sigmoid,8,,24.0,31.0,,,,,,,,,,,,,COMPLETE
4280,0.4442834328976163,2024-04-11 17:02:49.588922,2024-04-11 17:02:50.683252,0 days 00:00:01.094330,96.81490730051777,8.014893317356798,sigmoid,25,,30.0,29.0,4.0,2.0,83.0,,,,,,,,,27.0,COMPLETE
4281,0.5396128356465161,2024-04-11 17:02:50.685264,2024-04-11 17:02:51.765646,0 days 00:00:01.080382,98.13724406980153,8.473113689336213,sigmoid,38,11.0,,,,,,43.0,42.0,8.13641622117684,3.680756358042359,8.227046015302179,8.0,29.0,64.0,,COMPLETE
4282,0.47489453647494595,2024-04-11 17:02:51.767644,2024-04-11 17:02:53.119420,0 days 00:00:01.351776,95.10029716418735,7.630608256562951,sigmoid,31,,25.0,30.0,6.0,3.0,73.0,23.0,17.0,8.753660445792065,8.547681203066022,7.755958426452248,6.0,31.0,92.0,20.0,COMPLETE
4283,0.3518332327904015,2024-04-11 17:02:53.121436,2024-04-11 17:02:54.405552,0 days 00:00:01.284116,90.94759975715755,8.217645978117535,sigmoid,21,,,,1.0,1.0,49.0,14.0,9.0,,,,,,,132.0,COMPLETE
4284,0.5952371952371952,2024-04-11 17:02:54.407506,2024-04-11 17:02:55.360714,0 days 00:00:00.953208,99.97398728314913,7.883935797547409,sigmoid,8,,28.0,32.0,,,,,,,,,,,,,COMPLETE
4285,0.6009432182607054,2024-04-11 17:02:55.363269,2024-04-11 17:02:56.705700,0 days 00:00:01.342431,96.70796686627097,8.087450827953976,sigmoid,8,,26.0,31.0,,,,,,,,,,,,,COMPLETE
4286,0.31910886725167287,2024-04-11 17:02:56.707700,2024-04-11 17:02:57.703581,0 days 00:00:00.995881,99.97571067310486,7.258982889998324,sigmoid,3,,,,,,,,,3.1658900666838328,4.6122543088938155,7.089343859580877,20.0,37.0,87.0,138.0,COMPLETE
4287,0.5130069868611855,2024-04-11 17:02:57.705567,2024-04-11 17:02:58.504880,0 days 00:00:00.799313,93.63860168764649,8.346399485833148,sigmoid,9,,23.0,28.0,,,,,,,,,,,,162.0,COMPLETE
4288,0.4994916485112563,2024-04-11 17:02:58.507885,2024-04-11 17:02:59.530285,0 days 00:00:01.022400,96.77471993664766,7.752366210218581,sigmoid,57,27.0,27.0,44.0,3.0,6.0,15.0,,,,,,,,,43.0,COMPLETE
4289,0.21883282957451755,2024-04-11 17:02:59.532285,2024-04-11 17:03:01.179179,0 days 00:00:01.646894,98.2291700660487,8.016788827227975,rbf,15,,24.0,33.0,,,,16.0,2.0,3.679102658530078,0.7704606192657062,8.665491765856942,9.0,48.0,58.0,65.0,COMPLETE
4290,0.44701971028259324,2024-04-11 17:03:01.182724,2024-04-11 17:03:02.050734,0 days 00:00:00.868010,95.26539819385799,7.471514921088859,sigmoid,8,,25.0,30.0,,,,,,,,,,,,,COMPLETE
4291,0.44979616909588427,2024-04-11 17:03:02.052722,2024-04-11 17:03:03.691242,0 days 00:00:01.638520,74.41300698491705,8.57258142839261,sigmoid,63,16.0,21.0,32.0,2.0,5.0,87.0,35.0,37.0,6.250832886980784,7.558925201890212,4.213054637666852,3.0,39.0,79.0,80.0,COMPLETE
4292,0.6009432182607054,2024-04-11 17:03:03.693184,2024-04-11 17:03:04.800777,0 days 00:00:01.107593,98.18931403679119,8.164517907306395,sigmoid,8,,27.0,31.0,,,,,,,,,,,,,COMPLETE
4293,0.5635851250418777,2024-04-11 17:03:04.801875,2024-04-11 17:03:05.727968,0 days 00:00:00.926093,98.26672757832243,7.878485503982183,sigmoid,16,,,,5.0,5.0,37.0,,,,,,,,,,COMPLETE
4294,0.5069140556625241,2024-04-11 17:03:05.729969,2024-04-11 17:03:06.663002,0 days 00:00:00.933033,96.41093500035538,8.29655422682312,sigmoid,8,,26.0,35.0,,,,,,,,,,,,,COMPLETE
4295,0.48629235661805026,2024-04-11 17:03:06.664000,2024-04-11 17:03:07.821465,0 days 00:00:01.157465,98.15118498909509,7.652190990847666,sigmoid,28,,25.0,30.0,8.0,4.0,79.0,11.0,10.0,,,,,,,,COMPLETE
4296,0.5929369437606513,2024-04-11 17:03:07.824453,2024-04-11 17:03:08.704168,0 days 00:00:00.879715,93.56361951961884,8.015946481960995,sigmoid,8,,23.0,33.0,,,,,,,,,,,,,COMPLETE
4297,0.5007851641366934,2024-04-11 17:03:08.706156,2024-04-11 17:03:10.062122,0 days 00:00:01.355966,99.9685495842154,8.81424568846167,sigmoid,62,7.0,24.0,29.0,3.0,7.0,64.0,34.0,30.0,9.785344806359493,1.7992230742423692,3.3224931490760827,7.0,23.0,62.0,,COMPLETE
4298,0.3470938949130085,2024-04-11 17:03:10.064120,2024-04-11 17:03:11.182667,0 days 00:00:01.118547,31.457897491586852,8.229427081741235,sigmoid,42,37.0,26.0,32.0,,,,,,6.653776872242387,2.556523182599161,1.6800206170591974,13.0,27.0,98.0,,COMPLETE
4299,0.5986314388899449,2024-04-11 17:03:11.184668,2024-04-11 17:03:11.938587,0 days 00:00:00.753919,96.84406933446415,8.508753922955888,sigmoid,8,,27.0,31.0,,,,,,,,,,,,,COMPLETE
4300,0.5046917052590743,2024-04-11 17:03:11.940169,2024-04-11 17:03:13.196095,0 days 00:00:01.255926,95.11434059303942,7.769320231640781,sigmoid,14,,22.0,30.0,,,,20.0,25.0,5.864243640466417,5.566455547253057,4.6275573904189375,16.0,34.0,73.0,,COMPLETE
4301,0.3858246735944577,2024-04-11 17:03:13.198100,2024-04-11 17:03:14.458047,0 days 00:00:01.259947,98.18253603425649,7.980759031591988,sigmoid,46,50.0,28.0,27.0,,,,28.0,48.0,2.675195543693066,6.564118326396757,9.229008533040567,19.0,42.0,70.0,,COMPLETE
4302,0.5080760204316415,2024-04-11 17:03:14.459655,2024-04-11 17:03:15.771525,0 days 00:00:01.311870,99.96335465780177,8.415253946658254,sigmoid,10,,25.0,22.0,,,,,,5.674284245903195,8.93995147550836,6.287562826915366,15.0,25.0,94.0,,COMPLETE
4303,0.3549921911887553,2024-04-11 17:03:15.775125,2024-04-11 17:03:16.718144,0 days 00:00:00.943019,96.66568221878876,8.158926000841399,sigmoid,41,25.0,24.0,29.0,,,,,,,,,,,,196.0,COMPLETE
4304,0.22769143367284825,2024-04-11 17:03:16.721139,2024-04-11 17:03:17.658585,0 days 00:00:00.937446,98.2532491075494,7.571566048965148,sigmoid,2,,,,,,,,,7.850220613427263,6.139962730676957,9.833845626199262,14.0,44.0,83.0,,COMPLETE
4305,0.5012044395416376,2024-04-11 17:03:17.660090,2024-04-11 17:03:19.356158,0 days 00:00:01.696068,92.7092541281833,7.893513331407424,sigmoid,11,,26.0,34.0,,,,,,0.7923566055427758,1.2224179329386997,6.696386753855086,4.0,32.0,56.0,110.0,COMPLETE
4306,0.5963643249384587,2024-04-11 17:03:19.358116,2024-04-11 17:03:20.393113,0 days 00:00:01.034997,95.18627250329558,8.308052560619538,sigmoid,8,,23.0,32.0,,,,,,,,,,,,,COMPLETE
4307,0.27476777388224244,2024-04-11 17:03:20.395126,2024-04-11 17:03:21.944133,0 days 00:00:01.549007,99.96953558205428,8.097694858520457,sigmoid,20,,,,7.0,6.0,29.0,6.0,12.0,,,,,,,,COMPLETE
4308,0.4699194270367055,2024-04-11 17:03:21.948712,2024-04-11 17:03:24.501741,0 days 00:00:02.553029,82.26208205513606,8.636878521501945,rbf,8,,25.0,31.0,,,,,,,,,,,,,COMPLETE
4309,0.37675168572266193,2024-04-11 17:03:24.505726,2024-04-11 17:03:25.965504,0 days 00:00:01.459778,96.67650851386483,7.774821558670148,sigmoid,56,26.0,27.0,33.0,6.0,3.0,13.0,,,,,,,,,,COMPLETE
4310,0.4502698896972542,2024-04-11 17:03:25.967500,2024-04-11 17:03:27.300604,0 days 00:00:01.333104,98.18207329923271,7.369977540591055,sigmoid,8,,24.0,30.0,,,,,,,,,,,,,COMPLETE
4311,0.4098072511693033,2024-04-11 17:03:27.302565,2024-04-11 17:03:29.160258,0 days 00:00:01.857693,98.22365686093728,7.955576656717292,sigmoid,26,,28.0,32.0,4.0,1.0,22.0,,,4.560499209202299,9.86445317480781,1.2407185287511773,18.0,50.0,51.0,,COMPLETE
4312,0.27926113230189004,2024-04-11 17:03:29.162269,2024-04-11 17:03:30.058569,0 days 00:00:00.896300,94.84105441982999,8.370588558281916,sigmoid,48,41.0,,,1.0,8.0,90.0,,,,,,,,,,COMPLETE
4313,0.3548901664949653,2024-04-11 17:03:30.060571,2024-04-11 17:03:31.003963,0 days 00:00:00.943392,98.11255307386675,8.164827447660722,sigmoid,37,24.0,,,,,,31.0,3.0,,,,,,,37.0,COMPLETE
4314,0.6009432182607054,2024-04-11 17:03:31.005960,2024-04-11 17:03:31.984596,0 days 00:00:00.978636,99.94287813894428,7.705572706694128,sigmoid,8,,26.0,31.0,,,,,,,,,,,,,COMPLETE
4315,0.4644725696347601,2024-04-11 17:03:31.987612,2024-04-11 17:03:33.957335,0 days 00:00:01.969723,99.97394237518223,7.948619351137271,sigmoid,55,31.0,,,5.0,4.0,59.0,25.0,6.0,7.57244875099231,0.5028059888426597,4.948347326286482,12.0,20.0,91.0,94.0,COMPLETE
4316,0.3508393373075376,2024-04-11 17:03:33.959352,2024-04-11 17:03:35.015370,0 days 00:00:01.056018,96.58903410960933,8.478251595554363,sigmoid,44,35.0,25.0,28.0,,,,46.0,34.0,,,,,,,,COMPLETE
4317,0.421261204591917,2024-04-11 17:03:35.017369,2024-04-11 17:03:36.020991,0 days 00:00:01.003622,91.40294344615835,8.175653637882743,sigmoid,52,21.0,,,2.0,3.0,76.0,10.0,24.0,,,,,,,,COMPLETE
4318,0.41918767912456945,2024-04-11 17:03:36.022990,2024-04-11 17:03:37.434114,0 days 00:00:01.411124,93.88049690449546,7.56583226525935,sigmoid,59,28.0,24.0,30.0,3.0,2.0,35.0,,,3.904216422135749,2.9989326778103558,3.690478802248703,2.0,28.0,85.0,75.0,COMPLETE
4319,0.5963643249384587,2024-04-11 17:03:37.436116,2024-04-11 17:03:38.205885,0 days 00:00:00.769769,96.65923671000456,8.28985180783615,sigmoid,8,,22.0,32.0,,,,,,,,,,,,,COMPLETE
4320,0.298903000039319,2024-04-11 17:03:38.207887,2024-04-11 17:03:39.128833,0 days 00:00:00.920946,98.19814877828061,7.8210425895118885,sigmoid,13,,27.0,39.0,,,,44.0,21.0,,,,,,,200.0,COMPLETE
4321,0.6009432182607054,2024-04-11 17:03:39.130834,2024-04-11 17:03:39.883953,0 days 00:00:00.753119,95.44564865359663,8.035485183359524,sigmoid,8,,29.0,31.0,,,,,,,,,,,,,COMPLETE
4322,0.12622036262203626,2024-04-11 17:03:39.885952,2024-04-11 17:03:40.692852,0 days 00:00:00.806900,99.98359515946576,8.123072859377796,sigmoid,8,,26.0,29.0,,,,,,,,,,,,,COMPLETE
4323,0.5113220039726329,2024-04-11 17:03:40.695895,2024-04-11 17:03:41.678388,0 days 00:00:00.982493,98.19498758187424,5.165836267041039,sigmoid,12,,23.0,34.0,,,,17.0,11.0,,,,,,,,COMPLETE
4324,0.4373086107599382,2024-04-11 17:03:41.681398,2024-04-11 17:03:42.435243,0 days 00:00:00.753845,96.77128270982611,8.755535016580746,sigmoid,1,,,,,,,,,,,,,,,170.0,COMPLETE
4325,0.4991606714628297,2024-04-11 17:03:42.436243,2024-04-11 17:03:43.742089,0 days 00:00:01.305846,53.19017934002514,8.397052076492496,sigmoid,54,34.0,,,7.0,6.0,51.0,39.0,32.0,4.983349111272476,7.99349600205808,4.37447868487304,11.0,46.0,89.0,,COMPLETE
4326,0.3282504903956475,2024-04-11 17:03:43.745077,2024-04-11 17:03:44.874228,0 days 00:00:01.129151,94.07252974965267,7.837477664443142,sigmoid,7,,,,,,,9.0,35.0,8.433060073921904,3.2456677964461975,3.897585050019207,10.0,41.0,96.0,126.0,COMPLETE
4327,0.5929369437606513,2024-04-11 17:03:44.877782,2024-04-11 17:03:45.729700,0 days 00:00:00.851918,98.1600772785311,7.561153798633942,sigmoid,8,,25.0,33.0,,,,,,,,,,,,,COMPLETE
4328,0.27233540726281974,2024-04-11 17:03:45.731737,2024-04-11 17:03:46.627267,0 days 00:00:00.895530,96.62311496319795,8.020768784385638,sigmoid,36,8.0,,,,,,22.0,15.0,,,,,,,,COMPLETE
4329,0.5903136380931674,2024-04-11 17:03:46.629266,2024-04-11 17:03:47.400591,0 days 00:00:00.771325,92.27331662196153,8.563183822032544,sigmoid,32,13.0,,,,,,,,,,,,,,,COMPLETE
4330,0.4825204483489852,2024-04-11 17:03:47.402573,2024-04-11 17:03:49.115053,0 days 00:00:01.712480,98.23498701646359,8.261148185714966,rbf,8,,26.0,30.0,,,,,,,,,,,,,COMPLETE
4331,0.43933236970573,2024-04-11 17:03:49.117051,2024-04-11 17:03:50.410232,0 days 00:00:01.293181,95.35716957492501,7.735683519893972,sigmoid,27,,24.0,31.0,4.0,7.0,19.0,,,3.417524008519033,4.728294424613212,5.329058415341586,9.0,26.0,54.0,55.0,COMPLETE
4332,0.44930826749008573,2024-04-11 17:03:50.413792,2024-04-11 17:03:52.246981,0 days 00:00:01.833189,98.35815096715872,7.940254568675446,sigmoid,30,,20.0,29.0,6.0,2.0,100.0,40.0,36.0,5.21883373014624,5.134696063506652,5.678322025022526,15.0,38.0,68.0,,COMPLETE
4333,0.5998117115420825,2024-04-11 17:03:52.251560,2024-04-11 17:03:53.295301,0 days 00:00:01.043741,98.2701929631809,7.319638505215493,sigmoid,8,,25.0,32.0,,,,,,,,,,,,,COMPLETE
4334,0.43619027661357923,2024-04-11 17:03:53.297299,2024-04-11 17:03:54.618321,0 days 00:00:01.321022,46.190559144747155,8.172658883606907,sigmoid,61,5.0,28.0,31.0,1.0,5.0,67.0,3.0,7.0,,,,,,,144.0,COMPLETE
4335,0.45345352376492626,2024-04-11 17:03:54.620346,2024-04-11 17:03:55.497362,0 days 00:00:00.877016,95.00131154184058,8.511227405583014,sigmoid,8,,23.0,30.0,,,,,,,,,,,,,COMPLETE
4336,0.49033693732917305,2024-04-11 17:03:55.499929,2024-04-11 17:03:56.659255,0 days 00:00:01.159326,96.40409326680697,8.056031388792132,sigmoid,60,19.0,27.0,33.0,8.0,8.0,40.0,8.0,28.0,,,,,,,,COMPLETE
4337,0.5342602393941861,2024-04-11 17:03:56.660795,2024-04-11 17:03:57.706740,0 days 00:00:01.045945,98.3228584272908,7.851321413762895,sigmoid,34,32.0,,,,,,,,9.038031674476212,7.3541651076279315,9.993943545391208,19.0,23.0,75.0,,COMPLETE
4338,0.37857166953412275,2024-04-11 17:03:57.708684,2024-04-11 17:03:58.483213,0 days 00:00:00.774529,99.94780162948445,9.029598232072383,sigmoid,5,,,,,,,34.0,20.0,,,,,,,85.0,COMPLETE
4339,0.3414486563445453,2024-04-11 17:03:58.485211,2024-04-11 17:03:59.505708,0 days 00:00:01.020497,96.40145410432103,8.288605637291655,sigmoid,53,23.0,,,5.0,1.0,32.0,21.0,47.0,,,,,,,151.0,COMPLETE
4340,0.5952371952371952,2024-04-11 17:03:59.507698,2024-04-11 17:04:00.316484,0 days 00:00:00.808786,98.25017757571243,7.6687586097809834,sigmoid,8,,26.0,32.0,,,,,,,,,,,,,COMPLETE
4341,0.5184288822771881,2024-04-11 17:04:00.318689,2024-04-11 17:04:01.736404,0 days 00:00:01.417715,93.67462147752732,7.059315595164687,sigmoid,23,,,,8.0,4.0,26.0,42.0,23.0,2.1748558675395584,9.993207185075015,7.351652764199814,16.0,33.0,100.0,118.0,COMPLETE
4342,0.44701971028259324,2024-04-11 17:04:01.738414,2024-04-11 17:04:02.510118,0 days 00:00:00.771704,96.46372324355521,8.095829134370529,sigmoid,8,,25.0,30.0,,,,,,,,,,,,,COMPLETE
4343,0.45347172512526845,2024-04-11 17:04:02.513670,2024-04-11 17:04:03.286357,0 days 00:00:00.772687,99.95517933579063,7.464106128063698,sigmoid,8,,24.0,28.0,,,,,,,,,,,,,COMPLETE
4344,0.5963245096172158,2024-04-11 17:04:03.288353,2024-04-11 17:04:04.095148,0 days 00:00:00.806795,98.24494098264843,8.665537310490501,sigmoid,8,,22.0,31.0,,,,,,,,,,,,,COMPLETE
4345,0.5387559227311384,2024-04-11 17:04:04.096678,2024-04-11 17:04:04.996905,0 days 00:00:00.900227,95.09343702289246,8.345126124956712,sigmoid,4,,,,,,,18.0,40.0,,,,,,,,COMPLETE
4346,0.2420972847652592,2024-04-11 17:04:04.998894,2024-04-11 17:04:06.466300,0 days 00:00:01.467406,96.33091516668394,7.918758859925382,rbf,45,46.0,27.0,29.0,,,,15.0,14.0,,,,,,,31.0,COMPLETE
4347,0.5103056451440654,2024-04-11 17:04:06.468284,2024-04-11 17:04:07.637443,0 days 00:00:01.169159,99.94541461806513,8.189464920693535,sigmoid,51,30.0,,,2.0,3.0,11.0,,,0.5017096607039768,6.357479519049097,6.542354957507431,6.0,42.0,82.0,106.0,COMPLETE
4348,0.30996272791377055,2024-04-11 17:04:07.639438,2024-04-11 17:04:08.869582,0 days 00:00:01.230144,22.50674829919788,7.7090233671465365,sigmoid,18,,,,6.0,7.0,17.0,,,1.356285681767738,6.751101098784523,2.1382910740472987,8.0,24.0,93.0,,COMPLETE
4349,0.5558622298242887,2024-04-11 17:04:08.873126,2024-04-11 17:04:09.781426,0 days 00:00:00.908300,98.23028747762133,8.366869932148816,sigmoid,40,49.0,26.0,32.0,,,,,,,,,,,,,COMPLETE
4350,0.1905873735292771,2024-04-11 17:04:09.782425,2024-04-11 17:04:10.958120,0 days 00:00:01.175695,38.15974487787591,7.94340223347795,sigmoid,6,,,,,,,36.0,44.0,1.7507876610969304,8.36414569740132,8.812737041462235,5.0,37.0,77.0,,COMPLETE
4351,0.4735088395660076,2024-04-11 17:04:10.962157,2024-04-11 17:04:12.281071,0 days 00:00:01.318914,92.60333923195184,8.477030627837143,sigmoid,19,,,,4.0,8.0,93.0,,,4.287495968498325,9.10560396788588,1.0349927216309407,17.0,39.0,59.0,48.0,COMPLETE
4352,0.4224108773591288,2024-04-11 17:04:12.284660,2024-04-11 17:04:13.520363,0 days 00:00:01.235703,98.18637139216013,8.125267633111577,sigmoid,29,,30.0,33.0,7.0,5.0,2.0,7.0,18.0,,,,,,,157.0,COMPLETE
4353,0.44369995097238113,2024-04-11 17:04:13.522348,2024-04-11 17:04:14.459930,0 days 00:00:00.937582,96.72324540475105,7.787598190518011,sigmoid,49,15.0,,,3.0,6.0,84.0,,,,,,,,,60.0,COMPLETE
4354,0.5986580986580987,2024-04-11 17:04:14.461949,2024-04-11 17:04:15.363788,0 days 00:00:00.901839,94.42285969981936,7.50544713179967,sigmoid,8,,24.0,31.0,,,,,,,,,,,,,COMPLETE
4355,0.45897240207784534,2024-04-11 17:04:15.365803,2024-04-11 17:04:16.664266,0 days 00:00:01.298463,99.95396229527063,8.003743726821732,sigmoid,25,,25.0,30.0,1.0,1.0,61.0,,,,,,,,,98.0,COMPLETE
4356,0.4565639206120412,2024-04-11 17:04:16.666260,2024-04-11 17:04:17.877545,0 days 00:00:01.211285,96.76919400882718,8.256243220902679,sigmoid,58,44.0,28.0,32.0,4.0,4.0,71.0,,,1.064893873900468,4.242147228376056,5.912217888735453,13.0,29.0,78.0,,COMPLETE
