number,value,datetime_start,datetime_complete,duration,params_C,params_gamma,params_kernel,params_mask_number,params_rsi_window,params_so_smooth,params_so_window,params_srsi_smooth1,params_srsi_smooth2,params_srsi_window,params_tsi_window_fast,params_tsi_window_slow,params_ult_weight_1,params_ult_weight_2,params_ult_weight_3,params_ult_window_1,params_ult_window_2,params_ult_window_3,params_williams_lbp,state
730,0.5880365043344815,2024-04-11 16:07:39.147632,2024-04-11 16:07:39.477792,0 days 00:00:00.330160,92.79142021740364,0.9787552298952614,sigmoid,0,,,,,,,,,,,,,,,,COMPLETE
731,0.48782236728234796,2024-04-11 16:07:39.478857,2024-04-11 16:07:39.923198,0 days 00:00:00.444341,91.23568255992315,0.6156286326800771,sigmoid,49,43.0,,,2.0,2.0,37.0,,,,,,,,,31.0,COMPLETE
732,0.45465730250679237,2024-04-11 16:07:39.924199,2024-04-11 16:07:40.465121,0 days 00:00:00.540922,95.16376882506385,0.8431200850497076,sigmoid,29,,18.0,14.0,6.0,6.0,97.0,34.0,26.0,,,,,,,71.0,COMPLETE
733,0.5748870694522868,2024-04-11 16:07:40.467309,2024-04-11 16:07:40.841931,0 days 00:00:00.374622,98.05172720807052,1.41272417813283,sigmoid,1,,,,,,,,,,,,,,,10.0,COMPLETE
734,0.4824502403906036,2024-04-11 16:07:40.842931,2024-04-11 16:07:41.500743,0 days 00:00:00.657812,93.63955730663967,1.0989856763297272,sigmoid,47,17.0,29.0,17.0,,,,15.0,20.0,8.611515613377444,7.1042967697268695,3.5154495939668653,11.0,47.0,78.0,18.0,COMPLETE
735,0.5115696592293022,2024-04-11 16:07:41.501744,2024-04-11 16:07:41.961164,0 days 00:00:00.459420,88.59955753437598,1.2154078222450886,sigmoid,25,,9.0,48.0,3.0,3.0,62.0,,,,,,,,,79.0,COMPLETE
736,0.4927478020261526,2024-04-11 16:07:41.962168,2024-04-11 16:07:42.384040,0 days 00:00:00.421872,96.63290758118352,1.5679198442840376,sigmoid,17,,,,1.0,7.0,93.0,,,,,,,,,106.0,COMPLETE
737,0.5880365043344815,2024-04-11 16:07:42.385041,2024-04-11 16:07:42.731529,0 days 00:00:00.346488,90.90925469327571,0.9669313679386944,sigmoid,0,,,,,,,,,,,,,,,,COMPLETE
738,0.5178826895565093,2024-04-11 16:07:42.732529,2024-04-11 16:07:43.236712,0 days 00:00:00.504183,86.57968444175481,0.5262101831982318,sigmoid,39,50.0,,,,,,10.0,32.0,5.222312245691046,5.720778084061622,1.5473571526525265,12.0,35.0,88.0,114.0,COMPLETE
739,0.5873898933704218,2024-04-11 16:07:43.237711,2024-04-11 16:07:43.587825,0 days 00:00:00.350114,98.4250920208675,0.7668403259618244,sigmoid,0,,,,,,,,,,,,,,,,COMPLETE
740,0.489691625541722,2024-04-11 16:07:43.588825,2024-04-11 16:07:44.055368,0 days 00:00:00.466543,94.5197538753392,1.3224562641213065,sigmoid,21,,,,4.0,5.0,55.0,25.0,24.0,,,,,,,86.0,COMPLETE
741,0.14308300395256915,2024-04-11 16:07:44.056369,2024-04-11 16:07:44.528600,0 days 00:00:00.472231,96.69733422054314,1.0617328489441473,sigmoid,2,,,,,,,,,6.241335596861543,8.201118091297435,4.325752048337487,3.0,40.0,63.0,,COMPLETE
742,0.21491879055171534,2024-04-11 16:07:44.529603,2024-04-11 16:07:45.110340,0 days 00:00:00.580737,99.82207808523442,0.8355397925739773,sigmoid,22,,,,6.0,8.0,32.0,39.0,8.0,4.369200376268947,7.909148337152363,4.758828142771298,2.0,38.0,91.0,,COMPLETE
743,0.507725370433209,2024-04-11 16:07:45.111339,2024-04-11 16:07:45.710482,0 days 00:00:00.599143,92.26682903503868,2.6231324475101783,sigmoid,35,5.0,,,,,,,,8.360714341404707,8.734457605839859,6.234189866802874,6.0,45.0,65.0,59.0,COMPLETE
744,0.5438435123865588,2024-04-11 16:07:45.711542,2024-04-11 16:07:46.219938,0 days 00:00:00.508396,95.07203508975576,1.8008379749463472,sigmoid,38,45.0,,,,,,30.0,45.0,8.011454333767734,9.851624156212134,1.8254514596935363,5.0,27.0,55.0,,COMPLETE
745,0.04904351595946459,2024-04-11 16:07:46.222045,2024-04-11 16:07:47.121294,0 days 00:00:00.899249,96.97271142020308,0.2321818362418967,rbf,0,,,,,,,,,,,,,,,,COMPLETE
746,0.230828090460806,2024-04-11 16:07:47.122296,2024-04-11 16:07:47.621561,0 days 00:00:00.499265,93.66034869188829,1.207883751492576,sigmoid,6,,,,,,,8.0,43.0,3.651168395825661,9.9986582257977,2.558907422849845,7.0,36.0,68.0,,COMPLETE
747,0.48630611891142306,2024-04-11 16:07:47.622561,2024-04-11 16:07:48.245341,0 days 00:00:00.622780,89.50243059175925,1.491570525791511,sigmoid,31,,23.0,8.0,5.0,4.0,86.0,37.0,6.0,2.140447419115592,5.038503962034442,5.0205596753936845,9.0,28.0,84.0,101.0,COMPLETE
748,0.47052984827716593,2024-04-11 16:07:48.247285,2024-04-11 16:07:48.682773,0 days 00:00:00.435488,98.37104009495795,1.0004774078389662,sigmoid,24,,48.0,13.0,4.0,7.0,88.0,,,,,,,,,,COMPLETE
749,0.5863711449328822,2024-04-11 16:07:48.684774,2024-04-11 16:07:49.051792,0 days 00:00:00.367018,92.97707688486223,0.6642710084596661,sigmoid,0,,,,,,,,,,,,,,,,COMPLETE
750,0.5089843191458939,2024-04-11 16:07:49.052821,2024-04-11 16:07:49.556179,0 days 00:00:00.503358,99.97484028172794,1.3171972472745022,sigmoid,57,26.0,26.0,42.0,3.0,6.0,48.0,,,,,,,,,92.0,COMPLETE
751,0.5902205516200023,2024-04-11 16:07:49.557179,2024-04-11 16:07:49.886045,0 days 00:00:00.328866,95.63370541116137,0.8901176355083477,sigmoid,0,,,,,,,,,,,,,,,,COMPLETE
752,0.3699945245482752,2024-04-11 16:07:49.887103,2024-04-11 16:07:50.328028,0 days 00:00:00.440925,91.97214009749003,0.4787414199905192,sigmoid,3,,,,,,,,,2.595457824136752,8.564092021697334,2.1274837191002307,4.0,34.0,62.0,154.0,COMPLETE
753,0.3565533403525456,2024-04-11 16:07:50.329138,2024-04-11 16:07:50.866460,0 days 00:00:00.537322,95.52529623883746,0.7009121614279252,sigmoid,15,,34.0,40.0,,,,41.0,16.0,6.397738632326646,7.602320885667684,0.7480102989924462,5.0,43.0,72.0,43.0,COMPLETE
754,0.11340260011486453,2024-04-11 16:07:50.868461,2024-04-11 16:07:51.224972,0 days 00:00:00.356511,91.01393818852884,0.3723220936911972,sigmoid,0,,,,,,,,,,,,,,,,COMPLETE
755,0.5920418141965941,2024-04-11 16:07:51.225973,2024-04-11 16:07:51.600053,0 days 00:00:00.374080,96.03198746190566,0.8655638455968085,sigmoid,8,,6.0,25.0,,,,,,,,,,,,,COMPLETE
756,0.5794615005746183,2024-04-11 16:07:51.600053,2024-04-11 16:07:51.983176,0 days 00:00:00.383123,96.44393496490856,0.6070763887280038,sigmoid,8,,6.0,30.0,,,,,,,,,,,,,COMPLETE
757,0.585135810698217,2024-04-11 16:07:51.984332,2024-04-11 16:07:52.375787,0 days 00:00:00.391455,98.14640209191005,0.799724887302617,sigmoid,8,,4.0,34.0,,,,,,,,,,,,,COMPLETE
758,0.5407190793764333,2024-04-11 16:07:52.376936,2024-04-11 16:07:52.831615,0 days 00:00:00.454679,95.44876533006023,0.25630843558297023,sigmoid,28,,16.0,20.0,2.0,4.0,100.0,31.0,38.0,,,,,,,,COMPLETE
759,0.5180309101316543,2024-04-11 16:07:52.832623,2024-04-11 16:07:53.256969,0 days 00:00:00.424346,97.80195092265623,0.4919251270763114,sigmoid,8,,11.0,28.0,,,,,,,,,,,,,COMPLETE
760,0.06442263690445925,2024-04-11 16:07:53.257970,2024-04-11 16:07:53.670703,0 days 00:00:00.412733,94.06614337951146,0.873515093452506,sigmoid,16,,,,1.0,6.0,26.0,,,,,,,,,,COMPLETE
761,0.2233444540925917,2024-04-11 16:07:53.671730,2024-04-11 16:07:54.209412,0 days 00:00:00.537682,99.97238637492586,0.7080057677353222,sigmoid,10,,3.0,22.0,,,,,,4.836675315249581,9.262149571337932,3.2112930818541736,10.0,41.0,97.0,,COMPLETE
762,0.32915324872134877,2024-04-11 16:07:54.210422,2024-04-11 16:07:54.615115,0 days 00:00:00.404693,85.1122521661109,0.9011509455272734,sigmoid,37,30.0,,,,,,21.0,21.0,,,,,,,159.0,COMPLETE
763,0.4328046491918397,2024-04-11 16:07:54.616152,2024-04-11 16:07:55.972847,0 days 00:00:01.356695,88.19038598223804,0.48091890869392395,rbf,62,21.0,5.0,33.0,6.0,3.0,57.0,28.0,28.0,1.585044285276595,6.785212493117016,1.4182808524657946,8.0,48.0,69.0,,COMPLETE
764,0.5148418293748349,2024-04-11 16:07:55.974182,2024-04-11 16:07:56.369920,0 days 00:00:00.395738,96.93592203224459,3.1099072602001603,sigmoid,9,,14.0,26.0,,,,,,,,,,,,122.0,COMPLETE
765,0.35399608844101177,2024-04-11 16:07:56.370922,2024-04-11 16:07:56.974070,0 days 00:00:00.603148,94.8743305910183,1.0045461933561297,sigmoid,46,9.0,2.0,25.0,,,,3.0,48.0,6.903713044950413,5.2561851373909265,1.0095341525056152,3.0,30.0,51.0,,COMPLETE
766,0.4714918687311325,2024-04-11 16:07:56.976069,2024-04-11 16:07:57.515994,0 days 00:00:00.539925,98.24062489034074,0.6520212023331282,sigmoid,18,,,,5.0,5.0,79.0,,,5.800575287401802,8.91861855326955,5.663853218697232,6.0,44.0,82.0,,COMPLETE
767,0.35286544544986387,2024-04-11 16:07:57.517144,2024-04-11 16:07:58.061663,0 days 00:00:00.544519,92.72051558738124,0.9170150090838214,sigmoid,42,28.0,19.0,29.0,,,,,,6.6199217969694795,4.75803886852416,3.7752019101233154,2.0,37.0,59.0,,COMPLETE
768,0.35066597474485384,2024-04-11 16:07:58.062741,2024-04-11 16:07:58.546391,0 days 00:00:00.483650,96.21846419551207,4.192913553555174,sigmoid,14,,12.0,31.0,,,,49.0,12.0,1.9498093416201892,4.421144642038406,5.390290712635969,4.0,29.0,53.0,,COMPLETE
769,0.5886376209075821,2024-04-11 16:07:58.547392,2024-04-11 16:07:58.899998,0 days 00:00:00.352606,91.45222566372345,1.090678682369394,sigmoid,0,,,,,,,,,,,,,,,,COMPLETE
770,0.3497253267664331,2024-04-11 16:07:58.900998,2024-04-11 16:07:59.359676,0 days 00:00:00.458678,89.73090735198517,0.7981554166171304,sigmoid,41,23.0,8.0,23.0,,,,,,,,,,,,170.0,COMPLETE
771,0.33448692964182514,2024-04-11 16:07:59.360675,2024-04-11 16:07:59.903006,0 days 00:00:00.542331,94.00907740637138,1.0910097234650282,sigmoid,26,,10.0,37.0,3.0,2.0,34.0,,,3.926802999441369,9.62415758189452,5.897211752169265,5.0,32.0,94.0,,COMPLETE
772,0.09841770431189167,2024-04-11 16:07:59.904116,2024-04-11 16:08:00.310604,0 days 00:00:00.406488,99.98391088596297,0.30462378131334766,sigmoid,8,,7.0,35.0,,,,,,,,,,,,,COMPLETE
773,0.24780285297884552,2024-04-11 16:08:00.311607,2024-04-11 16:08:00.775977,0 days 00:00:00.464370,96.83221782873777,0.6082918152236965,sigmoid,52,47.0,,,7.0,8.0,9.0,46.0,34.0,,,,,,,,COMPLETE
774,0.45103924789035504,2024-04-11 16:08:00.776984,2024-04-11 16:08:01.426512,0 days 00:00:00.649528,87.19169098282649,0.8628670612490124,sigmoid,63,41.0,17.0,24.0,4.0,4.0,91.0,42.0,3.0,1.126246323990875,5.547156382653584,4.580214165420597,2.0,49.0,78.0,51.0,COMPLETE
775,0.4557002586345014,2024-04-11 16:08:01.427645,2024-04-11 16:08:01.880161,0 days 00:00:00.452516,98.00013061476345,1.1184026345095786,sigmoid,8,,13.0,17.0,,,,,,,,,,,,,COMPLETE
776,0.490774144626485,2024-04-11 16:08:01.881163,2024-04-11 16:08:02.343941,0 days 00:00:00.462778,94.64551873548879,0.7614242113905243,sigmoid,20,,,,2.0,7.0,53.0,17.0,46.0,,,,,,,,COMPLETE
777,0.38393592097764834,2024-04-11 16:08:02.344952,2024-04-11 16:08:02.866793,0 days 00:00:00.521841,92.77035369561571,0.991801904014199,sigmoid,11,,15.0,19.0,,,,,,5.457618639894461,8.049616052394704,2.8383783923322734,14.0,39.0,57.0,37.0,COMPLETE
778,0.5207922039736212,2024-04-11 16:08:02.867791,2024-04-11 16:08:03.264452,0 days 00:00:00.396661,95.95309130595213,0.4684730298179359,sigmoid,48,13.0,,,6.0,3.0,96.0,,,,,,,,,,COMPLETE
779,0.36451633859546545,2024-04-11 16:08:03.265546,2024-04-11 16:08:03.770048,0 days 00:00:00.504502,29.412181179998175,1.3407936336619146,sigmoid,56,35.0,5.0,32.0,3.0,5.0,30.0,,,,,,,,,,COMPLETE
780,0.5881803882253297,2024-04-11 16:08:03.771177,2024-04-11 16:08:04.124121,0 days 00:00:00.352944,90.78540531913309,1.2260155132433306,sigmoid,0,,,,,,,,,,,,,,,,COMPLETE
781,0.589341292515921,2024-04-11 16:08:04.124121,2024-04-11 16:08:04.461965,0 days 00:00:00.337844,97.94695663005626,0.8478028592610438,sigmoid,0,,,,,,,,,,,,,,,,COMPLETE
782,0.13390403720143731,2024-04-11 16:08:04.464037,2024-04-11 16:08:04.908393,0 days 00:00:00.444356,57.06049437790701,1.0263730945152856,sigmoid,2,,,,,,,,,0.6945160042196079,7.031823466247283,2.64313945391587,7.0,24.0,75.0,,COMPLETE
783,0.03966471264997534,2024-04-11 16:08:04.909394,2024-04-11 16:08:05.808332,0 days 00:00:00.898938,95.41651349810536,0.04343632726954172,rbf,0,,,,,,,,,,,,,,,,COMPLETE
784,0.49286103284161675,2024-04-11 16:08:05.809333,2024-04-11 16:08:06.397018,0 days 00:00:00.587685,98.53763175094787,0.642210003926439,sigmoid,55,31.0,,,1.0,2.0,21.0,14.0,30.0,7.5075476575128866,8.350308054291094,2.338435463030915,9.0,38.0,66.0,200.0,COMPLETE
785,0.5163095549168191,2024-04-11 16:08:06.398017,2024-04-11 16:08:06.848319,0 days 00:00:00.450302,64.0448457678667,1.208490689619665,sigmoid,44,14.0,10.0,28.0,,,,26.0,50.0,,,,,,,,COMPLETE
786,0.5851186236370609,2024-04-11 16:08:06.849322,2024-04-11 16:08:07.195045,0 days 00:00:00.345723,99.97590131316453,1.519962782012671,sigmoid,0,,,,,,,,,,,,,,,,COMPLETE
787,0.3876855315554483,2024-04-11 16:08:07.196044,2024-04-11 16:08:07.755931,0 days 00:00:00.559887,68.15952825224221,0.9180773476104901,sigmoid,60,49.0,20.0,21.0,5.0,6.0,18.0,5.0,23.0,,,,,,,,COMPLETE
788,0.41568423308938357,2024-04-11 16:08:07.756931,2024-04-11 16:08:08.365981,0 days 00:00:00.609050,93.32084726908228,1.3307830007481423,sigmoid,59,16.0,12.0,11.0,4.0,1.0,60.0,,,3.301841477883138,5.863825161906046,3.9802424232253872,4.0,42.0,89.0,139.0,COMPLETE
789,0.46856885587258706,2024-04-11 16:08:08.368122,2024-04-11 16:08:08.992553,0 days 00:00:00.624431,89.56351989766026,0.7509483149774236,sigmoid,23,,,,1.0,5.0,66.0,38.0,9.0,5.09347004977977,6.222668060153767,3.463059969050435,6.0,41.0,73.0,23.0,COMPLETE
790,0.5478167792418706,2024-04-11 16:08:08.995122,2024-04-11 16:08:09.428413,0 days 00:00:00.433291,96.49184583905588,1.1228560123270908,sigmoid,12,,24.0,14.0,,,,32.0,26.0,,,,,,,,COMPLETE
791,0.38677879644309643,2024-04-11 16:08:09.429421,2024-04-11 16:08:09.957900,0 days 00:00:00.528479,82.91298971486876,0.5082916318758853,sigmoid,13,,6.0,36.0,,,,33.0,47.0,,,,,,,166.0,COMPLETE
792,0.5880365043344815,2024-04-11 16:08:09.958903,2024-04-11 16:08:10.295437,0 days 00:00:00.336534,93.73711855264365,0.9826798454878942,sigmoid,0,,,,,,,,,,,,,,,,COMPLETE
793,0.5862828235037213,2024-04-11 16:08:10.296949,2024-04-11 16:08:10.635943,0 days 00:00:00.338994,91.59412705917724,1.4404571376118571,sigmoid,0,,,,,,,,,,,,,,,,COMPLETE
794,0.5618480418696987,2024-04-11 16:08:10.636997,2024-04-11 16:08:11.101012,0 days 00:00:00.464015,96.4371564787921,0.7783656134504018,sigmoid,40,25.0,3.0,10.0,,,,,,,,,,,,,COMPLETE
795,0.4074863420784055,2024-04-11 16:08:11.102134,2024-04-11 16:08:11.647960,0 days 00:00:00.545826,88.36812454099993,0.276702032541475,sigmoid,54,33.0,,,2.0,7.0,82.0,12.0,7.0,3.0303657604406875,3.68880859542777,1.7903591435439337,12.0,37.0,80.0,,COMPLETE
796,0.04942654287274713,2024-04-11 16:08:11.648961,2024-04-11 16:08:12.023466,0 days 00:00:00.374505,94.31251997839699,1.701534057229713,sigmoid,32,39.0,,,,,,,,,,,,,,,COMPLETE
797,0.4340116737655782,2024-04-11 16:08:12.024526,2024-04-11 16:08:12.566929,0 days 00:00:00.542403,98.20817747741992,1.1757402941663422,sigmoid,61,11.0,22.0,18.0,5.0,4.0,76.0,22.0,37.0,,,,,,,127.0,COMPLETE
798,0.5860258345915115,2024-04-11 16:08:12.568089,2024-04-11 16:08:12.956215,0 days 00:00:00.388126,92.4841033599244,0.9515727248485539,sigmoid,8,,11.0,27.0,,,,,,,,,,,,,COMPLETE
799,0.5863711449328822,2024-04-11 16:08:12.957254,2024-04-11 16:08:13.282324,0 days 00:00:00.325070,95.3032010569319,0.6784483169618867,sigmoid,0,,,,,,,,,,,,,,,,COMPLETE
800,0.39322542149873013,2024-04-11 16:08:13.283362,2024-04-11 16:08:13.904262,0 days 00:00:00.620900,85.2723240637746,1.2990373768520271,sigmoid,27,,9.0,12.0,3.0,8.0,50.0,,,4.638357951812371,9.10881325692686,5.277989440808909,11.0,40.0,92.0,45.0,COMPLETE
801,0.4011905892783636,2024-04-11 16:08:13.905263,2024-04-11 16:08:15.248761,0 days 00:00:01.343498,72.51741883697336,1.0849498093887158,rbf,7,,,,,,,19.0,40.0,6.023429204305087,7.729249255114912,3.608004396206246,3.0,36.0,84.0,98.0,COMPLETE
802,0.5685119748723989,2024-04-11 16:08:15.249761,2024-04-11 16:08:15.660767,0 days 00:00:00.411006,98.0771735663191,0.5511030824124579,sigmoid,36,3.0,,,,,,50.0,41.0,,,,,,,,COMPLETE
803,0.5044459190444592,2024-04-11 16:08:15.661767,2024-04-11 16:08:16.199033,0 days 00:00:00.537266,90.21576848967662,2.0040801805050705,sigmoid,5,,,,,,,29.0,4.0,,,,,,,16.0,COMPLETE
804,0.23395808327947562,2024-04-11 16:08:16.200031,2024-04-11 16:08:16.678278,0 days 00:00:00.478247,96.2710806664593,0.8519714547118091,sigmoid,34,20.0,,,,,,,,4.2781979770638285,7.408358011691633,4.361344387105696,15.0,35.0,87.0,,COMPLETE
805,0.383881230116649,2024-04-11 16:08:16.679448,2024-04-11 16:08:17.283439,0 days 00:00:00.603991,93.74710674716856,1.5057450141796604,sigmoid,30,,27.0,39.0,6.0,2.0,28.0,24.0,35.0,7.872149506813599,4.87393339222224,6.738389096430598,8.0,50.0,64.0,,COMPLETE
806,0.5081252567672433,2024-04-11 16:08:17.284614,2024-04-11 16:08:17.702922,0 days 00:00:00.418308,92.10293834843212,6.262609775617148,sigmoid,45,10.0,14.0,16.0,,,,40.0,18.0,,,,,,,192.0,COMPLETE
807,0.588258559317662,2024-04-11 16:08:17.704444,2024-04-11 16:08:18.044115,0 days 00:00:00.339671,98.55740976632025,1.1944752855933676,sigmoid,0,,,,,,,,,,,,,,,,COMPLETE
808,0.3287790238508924,2024-04-11 16:08:18.045217,2024-04-11 16:08:18.402334,0 days 00:00:00.357117,6.2527083852977015,6.74393105730432,sigmoid,33,7.0,,,,,,,,,,,,,,76.0,COMPLETE
809,0.5782848014446703,2024-04-11 16:08:18.403329,2024-04-11 16:08:18.806637,0 days 00:00:00.403308,60.320218330645325,1.0063909628971395,sigmoid,4,,,,,,,10.0,14.0,,,,,,,,COMPLETE
810,0.5722848330843986,2024-04-11 16:08:18.807804,2024-04-11 16:08:19.137945,0 days 00:00:00.330141,87.61475113761827,2.8924301369022074,sigmoid,0,,,,,,,,,,,,,,,,COMPLETE
811,0.44962476793138617,2024-04-11 16:08:19.138947,2024-04-11 16:08:19.705818,0 days 00:00:00.566871,79.19257868549325,8.060496919572428,sigmoid,51,46.0,,,4.0,3.0,44.0,,,0.8948266862955336,6.568776479423046,0.5046255254683594,10.0,45.0,71.0,81.0,COMPLETE
812,0.4387742416708106,2024-04-11 16:08:19.707049,2024-04-11 16:08:20.191037,0 days 00:00:00.483988,95.15371010000237,0.7242572128565802,sigmoid,53,34.0,,,7.0,6.0,72.0,7.0,31.0,,,,,,,117.0,COMPLETE
813,0.5881803882253297,2024-04-11 16:08:20.193056,2024-04-11 16:08:20.576607,0 days 00:00:00.383551,96.76493001973097,1.2260430882666375,sigmoid,0,,,,,,,,,,,,,,,,COMPLETE
814,0.3470945799261886,2024-04-11 16:08:20.577607,2024-04-11 16:08:21.151724,0 days 00:00:00.574117,90.52560103336683,0.41923834967245116,sigmoid,19,,,,2.0,1.0,42.0,,,7.104578684084004,3.9914622703866804,3.1451147264388877,13.0,31.0,54.0,111.0,COMPLETE
815,0.5871571537475874,2024-04-11 16:08:21.152722,2024-04-11 16:08:21.542753,0 days 00:00:00.390031,98.57454296568233,0.9218596487733874,sigmoid,0,,,,,,,,,,,,,,,,COMPLETE
816,0.4479051113576244,2024-04-11 16:08:21.543762,2024-04-11 16:08:22.149184,0 days 00:00:00.605422,99.92386178367802,1.4399353336641323,sigmoid,58,29.0,19.0,22.0,3.0,8.0,70.0,,,2.231956807811275,7.1856573265380925,4.151908581037695,6.0,20.0,81.0,,COMPLETE
817,0.25478820970012367,2024-04-11 16:08:22.151184,2024-04-11 16:08:22.720450,0 days 00:00:00.569266,93.6586121703482,1.0663884628103761,sigmoid,50,40.0,,,4.0,7.0,12.0,,,9.203778473245068,8.698592669538561,2.068596292980508,7.0,33.0,83.0,,COMPLETE
818,0.45341648011939023,2024-04-11 16:08:22.721460,2024-04-11 16:08:23.267970,0 days 00:00:00.546510,96.62619539216652,1.7180105592758488,sigmoid,29,,4.0,30.0,5.0,5.0,39.0,20.0,13.0,,,,,,,33.0,COMPLETE
819,0.42402763177654307,2024-04-11 16:08:23.268970,2024-04-11 16:08:23.726200,0 days 00:00:00.457230,95.28314091020351,0.6100473542190569,sigmoid,49,18.0,,,1.0,4.0,85.0,,,,,,,,,56.0,COMPLETE
820,0.4032897539237852,2024-04-11 16:08:23.727200,2024-04-11 16:08:25.264731,0 days 00:00:01.537531,92.34908104684048,1.3103383990304875,rbf,18,,,,2.0,2.0,63.0,,,3.500306225874898,7.53768568124672,5.52763602492837,5.0,44.0,96.0,,COMPLETE
821,0.5360315893385983,2024-04-11 16:08:25.265803,2024-04-11 16:08:25.761059,0 days 00:00:00.495256,88.38188581791513,9.41856346479264,sigmoid,25,,18.0,26.0,8.0,6.0,46.0,,,,,,,,,179.0,COMPLETE
822,0.5873898933704218,2024-04-11 16:08:25.762061,2024-04-11 16:08:26.107263,0 days 00:00:00.345202,97.4552858795291,0.7986297522403429,sigmoid,0,,,,,,,,,,,,,,,,COMPLETE
823,0.5608797520973471,2024-04-11 16:08:26.108264,2024-04-11 16:08:26.589793,0 days 00:00:00.481529,94.58824662405021,0.9870441872786753,sigmoid,6,,,,,,,27.0,49.0,5.633938489604885,9.503975191905145,6.129429443607528,9.0,47.0,56.0,,COMPLETE
824,0.38558066770961624,2024-04-11 16:08:26.590804,2024-04-11 16:08:27.151867,0 days 00:00:00.561063,99.86842792294777,1.1504262291668401,sigmoid,39,44.0,,,,,,43.0,16.0,3.861241861317417,6.840573967828073,2.978094371310384,2.0,46.0,77.0,67.0,COMPLETE
825,0.5873898933704218,2024-04-11 16:08:27.152865,2024-04-11 16:08:27.490460,0 days 00:00:00.337595,90.89634165027829,0.8202639812959133,sigmoid,0,,,,,,,,,,,,,,,,COMPLETE
826,0.5020332369602519,2024-04-11 16:08:27.491461,2024-04-11 16:08:27.950909,0 days 00:00:00.459448,96.8260425011501,5.101967777833914,sigmoid,17,,,,3.0,3.0,23.0,,,,,,,,,73.0,COMPLETE
827,0.5816943051806145,2024-04-11 16:08:27.951909,2024-04-11 16:08:28.297323,0 days 00:00:00.345414,86.2012769103072,1.553433819124997,sigmoid,0,,,,,,,,,,,,,,,,COMPLETE
828,0.22271339379300914,2024-04-11 16:08:28.298323,2024-04-11 16:08:28.842548,0 days 00:00:00.544225,92.99489935788213,0.27437557032191395,sigmoid,22,,,,6.0,5.0,35.0,30.0,19.0,2.7815990359005616,7.95755035542706,0.9073429707874916,7.0,49.0,79.0,,COMPLETE
829,0.42059115131986613,2024-04-11 16:08:28.844542,2024-04-11 16:08:29.409936,0 days 00:00:00.565394,95.24707959045392,1.370694987417794,sigmoid,47,5.0,7.0,35.0,,,,17.0,33.0,2.387889413020708,2.8437766225884475,5.12173666390235,19.0,34.0,74.0,144.0,COMPLETE
830,0.337131587597239,2024-04-11 16:08:29.410945,2024-04-11 16:08:29.946780,0 days 00:00:00.535835,89.7094252828865,0.6182647323518928,sigmoid,38,8.0,,,,,,8.0,5.0,1.8220113236888766,3.5293848774588987,1.372915406370347,4.0,26.0,90.0,,COMPLETE
831,0.12975530491301854,2024-04-11 16:08:29.947986,2024-04-11 16:08:30.396431,0 days 00:00:00.448445,98.12333683934791,1.0084996961083847,sigmoid,2,,,,,,,,,9.496643065818066,9.785282315848468,2.4998173192273905,3.0,39.0,69.0,,COMPLETE
832,0.5894939590264401,2024-04-11 16:08:30.397456,2024-04-11 16:08:30.778422,0 days 00:00:00.380966,40.1762454735897,1.2626656218336514,sigmoid,1,,,,,,,,,,,,,,,27.0,COMPLETE
