number,value,datetime_start,datetime_complete,duration,params_C,params_gamma,params_kernel,params_mask_number,params_rsi_window,params_so_smooth,params_so_window,params_srsi_smooth1,params_srsi_smooth2,params_srsi_window,params_tsi_window_fast,params_tsi_window_slow,params_ult_weight_1,params_ult_weight_2,params_ult_weight_3,params_ult_window_1,params_ult_window_2,params_ult_window_3,params_williams_lbp,state
7748,0.3847160001308002,2024-04-11 18:30:57.165495,2024-04-11 18:30:59.562557,0 days 00:00:02.397062,95.31725402281573,8.746335643591184,sigmoid,23,,,,5.0,3.0,48.0,23.0,27.0,1.215991016045999,0.6725706509383054,8.083305994279744,13.0,28.0,88.0,98.0,COMPLETE
7749,0.3900980481437635,2024-04-11 18:30:59.566559,2024-04-11 18:31:01.729443,0 days 00:00:02.162884,96.33706043465394,8.02533512921712,sigmoid,60,12.0,23.0,29.0,4.0,5.0,40.0,47.0,36.0,,,,,,,,COMPLETE
7750,0.5929369437606513,2024-04-11 18:31:01.732029,2024-04-11 18:31:03.225421,0 days 00:00:01.493392,98.30552470226671,8.261169123332694,sigmoid,8,,27.0,33.0,,,,,,,,,,,,,COMPLETE
7751,0.461104107574325,2024-04-11 18:31:03.228422,2024-04-11 18:31:05.606811,0 days 00:00:02.378389,93.1034505404647,8.503772887331579,sigmoid,54,29.0,,,7.0,7.0,73.0,29.0,5.0,8.411954484753785,5.545719227474847,5.997345831048163,6.0,46.0,75.0,,COMPLETE
7752,0.3408079424854502,2024-04-11 18:31:05.609802,2024-04-11 18:31:07.758230,0 days 00:00:02.148428,98.20722044177226,7.7985436566144815,rbf,12,,25.0,32.0,,,,17.0,14.0,,,,,,,,COMPLETE
7753,0.4288456347659178,2024-04-11 18:31:07.761832,2024-04-11 18:31:09.266313,0 days 00:00:01.504481,98.22080798812979,7.501046947360263,sigmoid,36,40.0,,,,,,34.0,38.0,,,,,,,,COMPLETE
7754,0.3718343782098962,2024-04-11 18:31:09.269305,2024-04-11 18:31:11.232124,0 days 00:00:01.962819,94.85370853322773,8.048788014956978,sigmoid,7,,,,,,,36.0,49.0,4.547632269076269,8.733691833274003,3.323136569286122,17.0,39.0,64.0,179.0,COMPLETE
7755,0.4545177188453415,2024-04-11 18:31:11.235130,2024-04-11 18:31:12.675111,0 days 00:00:01.439981,31.00165458382956,8.322889450589187,sigmoid,8,,24.0,30.0,,,,,,,,,,,,,COMPLETE
7756,0.2563941134807587,2024-04-11 18:31:12.678114,2024-04-11 18:31:14.022304,0 days 00:00:01.344190,99.99448771347875,7.851597385348542,sigmoid,1,,,,,,,,,,,,,,,171.0,COMPLETE
7757,0.49510120853434125,2024-04-11 18:31:14.026297,2024-04-11 18:31:16.290072,0 days 00:00:02.263775,96.80711578033167,8.138011094768611,sigmoid,61,13.0,26.0,34.0,6.0,1.0,55.0,2.0,12.0,,,,,,,193.0,COMPLETE
7758,0.5964036904537752,2024-04-11 18:31:16.292589,2024-04-11 18:31:17.652440,0 days 00:00:01.359851,96.68992866301132,7.081181772572004,sigmoid,8,,22.0,31.0,,,,,,,,,,,,,COMPLETE
7759,0.523121387283237,2024-04-11 18:31:17.655442,2024-04-11 18:31:19.221116,0 days 00:00:01.565674,99.95808983041903,7.662303331591559,sigmoid,40,20.0,26.0,32.0,,,,,,,,,,,,,COMPLETE
7760,0.4353985139252686,2024-04-11 18:31:19.227642,2024-04-11 18:31:21.607548,0 days 00:00:02.379906,98.22791918944505,8.568992155712271,sigmoid,27,,28.0,28.0,3.0,6.0,82.0,,,7.123453664750358,6.156689780682629,7.692310253025415,11.0,25.0,60.0,92.0,COMPLETE
7761,0.6009432182607054,2024-04-11 18:31:21.610571,2024-04-11 18:31:22.931402,0 days 00:00:01.320831,92.26891306068447,8.016836283386311,sigmoid,8,,25.0,31.0,,,,,,,,,,,,,COMPLETE
7762,0.1937210132001427,2024-04-11 18:31:22.933991,2024-04-11 18:31:24.732862,0 days 00:00:01.798871,94.87985792255168,8.336196824103348,sigmoid,34,42.0,,,,,,,,3.9970507779894966,8.081941239184694,8.663830437385194,4.0,27.0,68.0,,COMPLETE
7763,0.4547738693467336,2024-04-11 18:31:24.736841,2024-04-11 18:31:27.132208,0 days 00:00:02.395367,96.5897649673661,7.919701926324328,sigmoid,30,,24.0,30.0,8.0,4.0,96.0,32.0,30.0,6.73940418879587,7.692097922156854,4.15556687003491,3.0,43.0,100.0,,COMPLETE
7764,0.5929369437606513,2024-04-11 18:31:27.134236,2024-04-11 18:31:28.569418,0 days 00:00:01.435182,98.23051670416943,8.237325899104913,sigmoid,8,,27.0,33.0,,,,,,,,,,,,,COMPLETE
7765,0.42456426128033886,2024-04-11 18:31:28.572002,2024-04-11 18:31:30.054843,0 days 00:00:01.482841,98.16555677059172,3.5599851024259554,sigmoid,33,36.0,,,,,,,,,,,,,,152.0,COMPLETE
7766,0.5748731441458371,2024-04-11 18:31:30.057842,2024-04-11 18:31:31.570591,0 days 00:00:01.512749,99.94326414045094,7.741146031489868,sigmoid,4,,,,,,,8.0,22.0,,,,,,,,COMPLETE
7767,0.1512559602811778,2024-04-11 18:31:31.574153,2024-04-11 18:31:33.770729,0 days 00:00:02.196576,95.09098188057489,8.827707304233071,rbf,45,35.0,25.0,31.0,,,,24.0,33.0,,,,,,,86.0,COMPLETE
7768,0.5314103857101234,2024-04-11 18:31:33.773328,2024-04-11 18:31:36.102117,0 days 00:00:02.328789,78.89605920936101,8.112021517625896,sigmoid,51,9.0,,,4.0,8.0,23.0,,,4.902225762134137,1.9765499198420553,4.406155593697281,16.0,42.0,66.0,128.0,COMPLETE
7769,0.12622036262203626,2024-04-11 18:31:36.105034,2024-04-11 18:31:37.708033,0 days 00:00:01.602999,83.19083350616273,8.423942094947899,sigmoid,8,,23.0,29.0,,,,,,,,,,,,,COMPLETE
7770,0.4977227807854258,2024-04-11 18:31:37.711018,2024-04-11 18:31:39.092162,0 days 00:00:01.381144,96.63079877661656,7.424242005153802,sigmoid,32,48.0,,,,,,,,,,,,,,,COMPLETE
7771,0.50250338134447,2024-04-11 18:31:39.096173,2024-04-11 18:31:40.707977,0 days 00:00:01.611804,98.25796811868415,7.93052055174526,sigmoid,17,,,,1.0,2.0,36.0,,,,,,,,,33.0,COMPLETE
7772,0.5963643249384587,2024-04-11 18:31:40.710981,2024-04-11 18:31:42.233937,0 days 00:00:01.522956,93.92152434203979,8.187588459187934,sigmoid,8,,26.0,32.0,,,,,,,,,,,,,COMPLETE
7773,0.2915255637234658,2024-04-11 18:31:42.236944,2024-04-11 18:31:43.804945,0 days 00:00:01.568001,98.23999409959514,8.618247433752874,sigmoid,5,,,,,,,38.0,25.0,,,,,,,187.0,COMPLETE
7774,0.4451973997941922,2024-04-11 18:31:43.808943,2024-04-11 18:31:45.758036,0 days 00:00:01.949093,87.67636233328795,4.963851785194343,sigmoid,53,33.0,,,5.0,1.0,15.0,30.0,42.0,,,,,,,17.0,COMPLETE
7775,0.44617410684135883,2024-04-11 18:31:45.761058,2024-04-11 18:31:47.804858,0 days 00:00:02.043800,96.59532624216628,7.646430835305496,sigmoid,19,,,,2.0,5.0,92.0,,,2.4021035798761297,2.4957882334974872,9.974315178335383,14.0,36.0,77.0,140.0,COMPLETE
7776,0.6009432182607054,2024-04-11 18:31:47.808857,2024-04-11 18:31:49.204741,0 days 00:00:01.395884,99.9961690697105,7.953437957933765,sigmoid,8,,23.0,31.0,,,,,,,,,,,,,COMPLETE
7777,0.48561971866302256,2024-04-11 18:31:49.206740,2024-04-11 18:31:51.360608,0 days 00:00:02.153868,99.97488940796995,8.436416899108723,sigmoid,18,,,,7.0,2.0,18.0,,,0.6955621428490044,6.4206533194345194,1.5344008973730823,9.0,33.0,99.0,,COMPLETE
7778,0.4872504299708368,2024-04-11 18:31:51.365156,2024-04-11 18:31:53.476981,0 days 00:00:02.111825,95.16579165904763,8.19541306970664,sigmoid,50,14.0,,,6.0,7.0,64.0,,,3.018307585978702,3.648679165040611,9.61638127647689,8.0,38.0,91.0,,COMPLETE
7779,0.5929369437606513,2024-04-11 18:31:53.480003,2024-04-11 18:31:55.056285,0 days 00:00:01.576282,99.97178123216825,7.805836323685476,sigmoid,8,,25.0,33.0,,,,,,,,,,,,,COMPLETE
7780,0.4210913802750537,2024-04-11 18:31:55.059298,2024-04-11 18:31:57.293494,0 days 00:00:02.234196,92.17790405838072,8.047781661564601,sigmoid,58,11.0,27.0,30.0,2.0,4.0,68.0,,,7.983134002699254,0.9416878798035775,2.4316822647496052,20.0,22.0,98.0,,COMPLETE
7781,0.5952371952371952,2024-04-11 18:31:57.297488,2024-04-11 18:31:58.756625,0 days 00:00:01.459137,96.74846187716767,7.498348433100797,sigmoid,8,,29.0,32.0,,,,,,,,,,,,,COMPLETE
7782,0.5005099843604796,2024-04-11 18:31:58.759621,2024-04-11 18:32:00.575939,0 days 00:00:01.816318,96.83241888269805,8.33229241085336,sigmoid,25,,24.0,29.0,8.0,3.0,61.0,,,,,,,,,61.0,COMPLETE
7783,0.3998256067432059,2024-04-11 18:32:00.579513,2024-04-11 18:32:02.244328,0 days 00:00:01.664815,99.97947350618081,7.8770749762452965,sigmoid,49,24.0,,,3.0,6.0,32.0,,,,,,,,,65.0,COMPLETE
7784,0.4885290148448043,2024-04-11 18:32:02.248346,2024-04-11 18:32:03.798407,0 days 00:00:01.550061,98.19133414433182,8.142910865393597,sigmoid,8,,22.0,37.0,,,,,,,,,,,,,COMPLETE
7785,0.4316050655753553,2024-04-11 18:32:03.800408,2024-04-11 18:32:05.864760,0 days 00:00:02.064352,94.55833963341934,7.656452165214033,sigmoid,29,,28.0,31.0,4.0,8.0,100.0,45.0,7.0,,,,,,,107.0,COMPLETE
7786,0.17249594968073953,2024-04-11 18:32:05.867763,2024-04-11 18:32:08.519738,0 days 00:00:02.651975,98.10701429705766,9.642667670311477,rbf,43,47.0,26.0,30.0,,,,,,8.763358669492211,8.928379676700853,5.317673096890897,18.0,29.0,58.0,29.0,COMPLETE
7787,0.4611406805741241,2024-04-11 18:32:08.522739,2024-04-11 18:32:11.088907,0 days 00:00:02.566168,96.6199152583736,8.457817198889918,sigmoid,47,17.0,24.0,32.0,,,,14.0,13.0,2.1120670236383323,4.93786939922788,5.641038808421079,12.0,47.0,81.0,51.0,COMPLETE
7788,0.5451689937824057,2024-04-11 18:32:11.091889,2024-04-11 18:32:13.038709,0 days 00:00:01.946820,95.31275843646733,7.266720081714361,sigmoid,6,,,,,,,15.0,11.0,4.152303703121174,6.590890069276917,4.78675188391917,15.0,30.0,92.0,,COMPLETE
7789,0.5906279643331437,2024-04-11 18:32:13.041704,2024-04-11 18:32:14.530912,0 days 00:00:01.489208,99.97206233849766,7.958296638256394,sigmoid,8,,25.0,34.0,,,,,,,,,,,,,COMPLETE
7790,0.12622036262203626,2024-04-11 18:32:14.534435,2024-04-11 18:32:15.985158,0 days 00:00:01.450723,99.99322753249103,8.281249411684326,sigmoid,8,,27.0,29.0,,,,,,,,,,,,,COMPLETE
7791,0.45665885745179313,2024-04-11 18:32:15.987182,2024-04-11 18:32:18.177615,0 days 00:00:02.190433,93.75715255488146,8.678056917996033,sigmoid,22,,,,6.0,7.0,37.0,9.0,29.0,5.733362364816638,7.163993914333267,7.411602650851787,7.0,32.0,53.0,,COMPLETE
7792,0.4952759564252156,2024-04-11 18:32:18.180614,2024-04-11 18:32:19.795417,0 days 00:00:01.614803,98.16234471022482,8.099531824843183,sigmoid,24,,26.0,31.0,5.0,5.0,57.0,,,,,,,,,,COMPLETE
7793,0.4062850729517397,2024-04-11 18:32:19.798423,2024-04-11 18:32:21.894941,0 days 00:00:02.096518,96.70664601286494,7.768746945415607,sigmoid,39,25.0,,,,,,6.0,19.0,3.8239064387490527,5.932938470796499,0.7911042774183645,17.0,50.0,56.0,43.0,COMPLETE
7794,0.5001806857555854,2024-04-11 18:32:21.896928,2024-04-11 18:32:24.048634,0 days 00:00:02.151706,96.83329555118897,7.9823680333552325,sigmoid,38,50.0,,,,,,3.0,47.0,1.7376894590642138,4.0548169603447,6.253716353112134,10.0,45.0,79.0,,COMPLETE
7795,0.5636462904171639,2024-04-11 18:32:24.050633,2024-04-11 18:32:25.360649,0 days 00:00:01.310016,94.13592856897901,8.297083008348272,sigmoid,0,,,,,,,,,,,,,,,,COMPLETE
7796,0.4448341684562156,2024-04-11 18:32:25.363294,2024-04-11 18:32:26.951324,0 days 00:00:01.588030,98.24371905003838,8.553393528339399,sigmoid,8,,25.0,30.0,,,,,,,,,,,,,COMPLETE
7797,0.3982115609808026,2024-04-11 18:32:26.953862,2024-04-11 18:32:28.892180,0 days 00:00:01.938318,99.97347902571943,7.601580409030099,sigmoid,35,32.0,,,,,,,,5.96822701905985,2.65282892644707,9.126036374279812,19.0,40.0,97.0,83.0,COMPLETE
7798,0.5014305826785957,2024-04-11 18:32:28.894803,2024-04-11 18:32:31.558443,0 days 00:00:02.663640,90.94585796657553,8.902173989167744,sigmoid,31,,24.0,33.0,1.0,1.0,29.0,42.0,41.0,2.796117132713212,3.4049656214507693,6.7561545782464565,5.0,37.0,59.0,133.0,COMPLETE
7799,0.5952371952371952,2024-04-11 18:32:31.561443,2024-04-11 18:32:33.062616,0 days 00:00:01.501173,98.10586600296375,8.075992229860805,sigmoid,8,,26.0,32.0,,,,,,,,,,,,,COMPLETE
7800,0.39030250754728596,2024-04-11 18:32:33.065207,2024-04-11 18:32:34.957959,0 days 00:00:01.892752,99.96071473730684,7.802768155152275,sigmoid,28,,23.0,31.0,8.0,3.0,45.0,21.0,43.0,,,,,,,,COMPLETE
7801,0.12003789673140693,2024-04-11 18:32:34.960941,2024-04-11 18:32:36.512344,0 days 00:00:01.551403,95.57289347392584,8.282380126179154,sigmoid,8,,27.0,28.0,,,,,,,,,,,,,COMPLETE
7802,0.43180691535506255,2024-04-11 18:32:36.514873,2024-04-11 18:32:38.498390,0 days 00:00:01.983517,98.24493933251212,7.930485436732287,sigmoid,57,28.0,24.0,30.0,3.0,6.0,79.0,,,,,,,,,123.0,COMPLETE
7803,0.4192130543492565,2024-04-11 18:32:38.501391,2024-04-11 18:32:40.220782,0 days 00:00:01.719391,98.27008161912802,8.438868748582356,sigmoid,21,,,,5.0,4.0,85.0,44.0,31.0,,,,,,,145.0,COMPLETE
7804,0.18957391097357773,2024-04-11 18:32:40.224315,2024-04-11 18:32:42.756847,0 days 00:00:02.532532,95.34258447395823,8.153390940759113,rbf,42,6.0,28.0,32.0,,,,,,3.650676209345182,5.31205839634476,7.878664782976322,13.0,46.0,65.0,,COMPLETE
7805,0.5941143180531975,2024-04-11 18:32:42.759842,2024-04-11 18:32:44.336000,0 days 00:00:01.576158,98.1124675683496,7.436039428066483,sigmoid,8,,5.0,31.0,,,,,,,,,,,,,COMPLETE
7806,0.552484942844266,2024-04-11 18:32:44.339000,2024-04-11 18:32:46.225080,0 days 00:00:01.886080,93.01796492490402,7.7247683806200955,sigmoid,3,,,,,,,,,7.482184616121013,5.772594461201888,2.096753182463965,14.0,21.0,50.0,164.0,COMPLETE
7807,0.4448085193528568,2024-04-11 18:32:46.228075,2024-04-11 18:32:48.998615,0 days 00:00:02.770540,96.91256242582398,8.118854156643504,sigmoid,63,30.0,19.0,33.0,7.0,8.0,50.0,11.0,3.0,6.557866559262459,1.1631611981222498,2.6719515232062165,6.0,23.0,72.0,100.0,COMPLETE
7808,0.12622036262203626,2024-04-11 18:32:49.000614,2024-04-11 18:32:50.518356,0 days 00:00:01.517742,99.98725823238745,7.909831005468221,sigmoid,8,,26.0,29.0,,,,,,,,,,,,,COMPLETE
7809,0.5963643249384587,2024-04-11 18:32:50.520883,2024-04-11 18:32:52.048026,0 days 00:00:01.527143,96.68673520884154,8.343724551068535,sigmoid,8,,25.0,32.0,,,,,,,,,,,,,COMPLETE
7810,0.5634478261784069,2024-04-11 18:32:52.051026,2024-04-11 18:32:53.805141,0 days 00:00:01.754115,95.36641157573531,8.613852286974518,sigmoid,2,,,,,,,,,5.081728431379171,9.361923262635795,1.1394175001276228,2.0,41.0,84.0,,COMPLETE
7811,0.4514519864600036,2024-04-11 18:32:53.809125,2024-04-11 18:32:55.397566,0 days 00:00:01.588441,98.17314208754972,8.005731903725902,sigmoid,16,,,,6.0,2.0,8.0,,,,,,,,,,COMPLETE
7812,0.3431761525227344,2024-04-11 18:32:55.400563,2024-04-11 18:32:57.722602,0 days 00:00:02.322039,98.11165660106631,7.656343856265554,sigmoid,46,44.0,22.0,30.0,,,,31.0,4.0,7.8278546125352,3.149507929851252,3.5041191336695965,3.0,20.0,93.0,,COMPLETE
7813,0.4839807477271622,2024-04-11 18:32:57.727173,2024-04-11 18:33:00.244255,0 days 00:00:02.517082,93.9059840252013,8.226325969690198,sigmoid,15,,24.0,26.0,,,,40.0,24.0,9.45704014779183,9.813022518283905,9.50533109826875,18.0,44.0,86.0,114.0,COMPLETE
7814,0.3577608711866934,2024-04-11 18:33:00.246775,2024-04-11 18:33:01.830608,0 days 00:00:01.583833,96.35246189999542,7.79063087929023,sigmoid,9,,27.0,31.0,,,,,,,,,,,,184.0,COMPLETE
7815,0.2934089820579892,2024-04-11 18:33:01.833198,2024-04-11 18:33:03.849725,0 days 00:00:02.016527,98.29451942569503,8.447458154647283,sigmoid,10,,25.0,34.0,,,,,,8.177374941179874,7.4014486415214025,6.515319113037393,10.0,39.0,78.0,,COMPLETE
7816,0.12622036262203626,2024-04-11 18:33:03.852716,2024-04-11 18:33:05.383188,0 days 00:00:01.530472,99.9929605927227,8.080593260786687,sigmoid,8,,23.0,29.0,,,,,,,,,,,,,COMPLETE
7817,0.4889008938218249,2024-04-11 18:33:05.386799,2024-04-11 18:33:08.270426,0 days 00:00:02.883627,96.51824039093364,7.877470820959662,sigmoid,62,27.0,25.0,31.0,3.0,6.0,11.0,4.0,17.0,0.5037503233548719,4.402057574620488,1.8373552697076851,11.0,34.0,74.0,,COMPLETE
7818,0.49158066268332423,2024-04-11 18:33:08.273425,2024-04-11 18:33:09.911949,0 days 00:00:01.638524,98.2880608496496,7.527292007721931,sigmoid,41,23.0,27.0,30.0,,,,,,,,,,,,72.0,COMPLETE
7819,0.4747512937451263,2024-04-11 18:33:09.914554,2024-04-11 18:33:12.252414,0 days 00:00:02.337860,89.21741854639454,7.267387109946382,sigmoid,26,,28.0,33.0,4.0,5.0,53.0,,,9.18746015660616,0.5126147043767224,5.852202004998487,8.0,26.0,88.0,,COMPLETE
7820,0.509572072072072,2024-04-11 18:33:12.254918,2024-04-11 18:33:14.063438,0 days 00:00:01.808520,91.8888202053586,8.27710086876156,sigmoid,20,,,,2.0,2.0,71.0,25.0,6.0,,,,,,,,COMPLETE
7821,0.34417784538791313,2024-04-11 18:33:14.066028,2024-04-11 18:33:16.306443,0 days 00:00:02.240415,95.41648546607827,8.019640623019944,sigmoid,14,,26.0,32.0,,,,20.0,2.0,3.216074947134821,2.1783964868869408,6.9565056542134585,12.0,35.0,67.0,,COMPLETE
7822,0.12003789673140693,2024-04-11 18:33:16.309454,2024-04-11 18:33:17.879148,0 days 00:00:01.569694,98.07903404956079,8.18106862993354,sigmoid,8,,47.0,28.0,,,,,,,,,,,,,COMPLETE
7823,0.21474450762999628,2024-04-11 18:33:17.882164,2024-04-11 18:33:20.408938,0 days 00:00:02.526774,98.17199310998289,8.4286215550071,rbf,11,,25.0,27.0,,,,,,9.993088132088708,8.42813473725699,4.574731710432129,16.0,49.0,70.0,39.0,COMPLETE
7824,0.44701971028259324,2024-04-11 18:33:20.411932,2024-04-11 18:33:22.004771,0 days 00:00:01.592839,93.79214800936111,7.787606269097579,sigmoid,8,,23.0,30.0,,,,,,,,,,,,,COMPLETE
7825,0.5069140556625241,2024-04-11 18:33:22.007717,2024-04-11 18:33:23.526661,0 days 00:00:01.518944,96.54467454070044,8.649628340903696,sigmoid,8,,24.0,35.0,,,,,,,,,,,,,COMPLETE
7826,0.6009432182607054,2024-04-11 18:33:23.529658,2024-04-11 18:33:24.959808,0 days 00:00:01.430150,98.13506257961842,8.012322875326927,sigmoid,8,,26.0,31.0,,,,,,,,,,,,,COMPLETE
7827,0.4007084348018596,2024-04-11 18:33:24.961802,2024-04-11 18:33:26.796280,0 days 00:00:01.834478,95.5257617189181,8.20305433443996,sigmoid,56,15.0,26.0,32.0,1.0,3.0,2.0,,,,,,,,,,COMPLETE
7828,0.43372856564902124,2024-04-11 18:33:26.799289,2024-04-11 18:33:29.330345,0 days 00:00:02.531056,98.29670880102434,7.6313892709119004,sigmoid,55,4.0,,,7.0,1.0,74.0,33.0,9.0,0.91842927818288,5.1135973267788115,9.011282077681255,20.0,25.0,81.0,196.0,COMPLETE
7829,0.5399506384805237,2024-04-11 18:33:29.333341,2024-04-11 18:33:31.148704,0 days 00:00:01.815363,99.9992989782799,7.891425354025057,sigmoid,13,,22.0,29.0,,,,28.0,39.0,,,,,,,158.0,COMPLETE
7830,0.4677127177793169,2024-04-11 18:33:31.150696,2024-04-11 18:33:32.962947,0 days 00:00:01.812251,96.64819164041184,8.404626081371882,sigmoid,48,18.0,,,8.0,7.0,59.0,,,,,,,,,,COMPLETE
7831,0.44882215181154433,2024-04-11 18:33:32.966470,2024-04-11 18:33:35.520400,0 days 00:00:02.553930,94.71715642171642,8.126272877019398,sigmoid,59,21.0,21.0,31.0,5.0,4.0,77.0,,,6.997925133408161,7.8716813448079455,3.8917039923033387,15.0,32.0,54.0,168.0,COMPLETE
7832,0.3229139565136592,2024-04-11 18:33:35.523398,2024-04-11 18:33:37.259519,0 days 00:00:01.736121,98.30924314568418,7.4664465270743055,sigmoid,12,,29.0,36.0,,,,46.0,16.0,,,,,,,,COMPLETE
7833,0.5929369437606513,2024-04-11 18:33:37.262706,2024-04-11 18:33:38.665415,0 days 00:00:01.402709,99.94677135400177,7.748914290098716,sigmoid,8,,3.0,33.0,,,,,,,,,,,,,COMPLETE
7834,0.436576448484233,2024-04-11 18:33:38.667344,2024-04-11 18:33:40.602721,0 days 00:00:01.935377,96.5378310055275,8.302925831077747,sigmoid,52,39.0,,,4.0,6.0,26.0,16.0,44.0,,,,,,,,COMPLETE
7835,0.44701971028259324,2024-04-11 18:33:40.606295,2024-04-11 18:33:42.066516,0 days 00:00:01.460221,99.95102890078078,7.963634995260828,sigmoid,8,,24.0,30.0,,,,,,,,,,,,,COMPLETE
7836,0.5031301097874328,2024-04-11 18:33:42.070539,2024-04-11 18:33:44.269504,0 days 00:00:02.198965,14.872514407998878,8.796576858227507,sigmoid,60,19.0,27.0,32.0,2.0,1.0,4.0,7.0,23.0,,,,,,,,COMPLETE
7837,0.37281762898057935,2024-04-11 18:33:44.274502,2024-04-11 18:33:45.980471,0 days 00:00:01.705969,99.99545533947939,8.517393451805527,sigmoid,37,16.0,,,,,,18.0,28.0,,,,,,,58.0,COMPLETE
7838,0.35721073020977995,2024-04-11 18:33:45.984472,2024-04-11 18:33:47.863555,0 days 00:00:01.879083,46.77174812928176,8.163723088043698,sigmoid,44,22.0,25.0,31.0,,,,48.0,48.0,,,,,,,,COMPLETE
7839,0.22236847878548555,2024-04-11 18:33:47.866055,2024-04-11 18:33:49.311670,0 days 00:00:01.445615,99.98656701380992,7.892963787132198,sigmoid,36,5.0,,,,,,27.0,10.0,,,,,,,,COMPLETE
7840,0.44701971028259324,2024-04-11 18:33:49.314662,2024-04-11 18:33:50.791020,0 days 00:00:01.476358,92.86851355329256,7.700094809080589,sigmoid,8,,28.0,30.0,,,,,,,,,,,,,COMPLETE
7841,0.1252861934934242,2024-04-11 18:33:50.794027,2024-04-11 18:33:53.315482,0 days 00:00:02.521455,96.55785541830947,8.310103003441778,rbf,54,10.0,,,7.0,8.0,43.0,43.0,49.0,2.235787776132886,1.5883334725038205,1.3837223840708774,4.0,31.0,75.0,,COMPLETE
7842,0.5951910283216119,2024-04-11 18:33:53.318909,2024-04-11 18:33:54.728722,0 days 00:00:01.409813,94.86463412191996,9.12263702224874,sigmoid,8,,23.0,33.0,,,,,,,,,,,,,COMPLETE
7843,0.35798544889453976,2024-04-11 18:33:54.731722,2024-04-11 18:33:57.064304,0 days 00:00:02.332582,98.15737405921693,8.105621998292413,sigmoid,23,,,,3.0,3.0,13.0,36.0,26.0,1.5090845139039453,3.862651751037114,8.29798387209761,19.0,33.0,51.0,190.0,COMPLETE
7844,0.3577684626657125,2024-04-11 18:33:57.067855,2024-04-11 18:33:58.372397,0 days 00:00:01.304542,98.13129507933327,7.072330179439369,sigmoid,1,,,,,,,,,,,,,,,80.0,COMPLETE
7845,0.4511878720048838,2024-04-11 18:33:58.376020,2024-04-11 18:34:00.582453,0 days 00:00:02.206433,96.50659204636258,8.563312839638332,sigmoid,61,26.0,25.0,28.0,1.0,7.0,89.0,29.0,21.0,,,,,,,109.0,COMPLETE
7846,0.6009432182607054,2024-04-11 18:34:00.585977,2024-04-11 18:34:02.064744,0 days 00:00:01.478767,94.41439878989306,7.900395137599973,sigmoid,8,,25.0,31.0,,,,,,,,,,,,,COMPLETE
7847,0.5952371952371952,2024-04-11 18:34:02.067335,2024-04-11 18:34:03.531712,0 days 00:00:01.464377,96.64877580672896,7.57854895300283,sigmoid,8,,30.0,32.0,,,,,,,,,,,,,COMPLETE
7848,0.517707423580786,2024-04-11 18:34:03.534716,2024-04-11 18:34:05.541657,0 days 00:00:02.006941,98.33379024350573,8.055445021225278,sigmoid,7,,,,,,,39.0,38.0,5.555608501036163,2.9090320747998737,5.191071305432976,9.0,30.0,63.0,104.0,COMPLETE
7849,0.5886452332280246,2024-04-11 18:34:05.544656,2024-04-11 18:34:06.988023,0 days 00:00:01.443367,98.14450035907231,2.7920085124034557,sigmoid,8,,26.0,29.0,,,,,,,,,,,,,COMPLETE
7850,0.5361859699650278,2024-04-11 18:34:06.990033,2024-04-11 18:34:08.647195,0 days 00:00:01.657162,99.94292499828913,8.35376214261683,sigmoid,40,34.0,24.0,34.0,,,,,,,,,,,,,COMPLETE
7851,0.44701971028259324,2024-04-11 18:34:08.650192,2024-04-11 18:34:10.104669,0 days 00:00:01.454477,92.06480917211817,7.790978836236259,sigmoid,8,,27.0,30.0,,,,,,,,,,,,,COMPLETE
