number,value,datetime_start,datetime_complete,duration,params_C,params_gamma,params_kernel,params_mask_number,params_rsi_window,params_so_smooth,params_so_window,params_srsi_smooth1,params_srsi_smooth2,params_srsi_window,params_tsi_window_fast,params_tsi_window_slow,params_ult_weight_1,params_ult_weight_2,params_ult_weight_3,params_ult_window_1,params_ult_window_2,params_ult_window_3,params_williams_lbp,state
2613,0.4950457042777284,2024-04-11 16:28:10.956119,2024-04-11 16:28:11.946427,0 days 00:00:00.990308,95.01104148690372,8.222260034148732,sigmoid,22,,,,1.0,3.0,23.0,17.0,49.0,3.1260447122254122,4.591303076690075,7.344446282237396,15.0,31.0,92.0,,COMPLETE
2614,0.3806762053471846,2024-04-11 16:28:11.948427,2024-04-11 16:28:12.770273,0 days 00:00:00.821846,98.06662886711574,7.550763464004574,sigmoid,21,,,,3.0,2.0,39.0,24.0,25.0,,,,,,,98.0,COMPLETE
2615,0.594268224819143,2024-04-11 16:28:12.771471,2024-04-11 16:28:13.420795,0 days 00:00:00.649324,64.1138829467211,7.974737833991511,sigmoid,8,,23.0,27.0,,,,,,,,,,,,,COMPLETE
2616,0.5016441187523487,2024-04-11 16:28:13.422940,2024-04-11 16:28:14.395710,0 days 00:00:00.972770,98.14971185435542,8.540809110924295,sigmoid,15,,25.0,32.0,,,,35.0,41.0,8.419863589847527,8.914743271276269,7.855369875840611,11.0,44.0,62.0,141.0,COMPLETE
2617,0.31840037527852705,2024-04-11 16:28:14.397870,2024-04-11 16:28:15.284805,0 days 00:00:00.886935,93.10795130562978,7.807833900923524,sigmoid,35,30.0,,,,,,,,4.687638165311102,0.8902338048774956,6.495777252400167,7.0,38.0,97.0,24.0,COMPLETE
2618,0.537929726197753,2024-04-11 16:28:15.286958,2024-04-11 16:28:16.171517,0 days 00:00:00.884559,96.42421966862061,8.260095214991853,sigmoid,3,,,,,,,,,5.553159660214019,0.5394692624806563,8.088622190272883,10.0,30.0,85.0,14.0,COMPLETE
2619,0.4903658690973541,2024-04-11 16:28:16.172543,2024-04-11 16:28:17.283223,0 days 00:00:01.110680,98.29232138256458,8.086271386023904,sigmoid,31,,26.0,31.0,7.0,1.0,62.0,46.0,18.0,2.597107629810664,4.023209175024379,3.3129019145677887,20.0,36.0,100.0,153.0,COMPLETE
2620,0.12622036262203626,2024-04-11 16:28:17.285395,2024-04-11 16:28:17.942767,0 days 00:00:00.657372,99.98984129470682,7.413546642209362,sigmoid,8,,24.0,29.0,,,,,,,,,,,,,COMPLETE
2621,0.4513290990355211,2024-04-11 16:28:17.944931,2024-04-11 16:28:18.597544,0 days 00:00:00.652613,15.7559893856249,8.397852210486233,sigmoid,8,,28.0,30.0,,,,,,,,,,,,,COMPLETE
2622,0.5484848484848486,2024-04-11 16:28:18.599655,2024-04-11 16:28:19.376419,0 days 00:00:00.776764,96.58159833996882,7.913207608817895,sigmoid,9,,27.0,32.0,,,,,,,,,,,,41.0,COMPLETE
2623,0.5200804544349403,2024-04-11 16:28:19.377626,2024-04-11 16:28:20.344691,0 days 00:00:00.967065,94.47294216187059,8.706009794546684,sigmoid,38,6.0,,,,,,12.0,20.0,7.540063673222089,9.776531832264052,4.728621522578991,8.0,26.0,78.0,,COMPLETE
2624,0.49929268637713964,2024-04-11 16:28:20.346691,2024-04-11 16:28:21.228502,0 days 00:00:00.881811,98.08586553331774,8.149186728634634,sigmoid,57,39.0,21.0,33.0,2.0,7.0,57.0,,,,,,,,,190.0,COMPLETE
2625,0.24170759024726454,2024-04-11 16:28:21.230528,2024-04-11 16:28:22.409876,0 days 00:00:01.179348,96.57558817578168,7.696384631360452,rbf,28,,25.0,31.0,8.0,6.0,91.0,31.0,5.0,,,,,,,,COMPLETE
2626,0.44701971028259324,2024-04-11 16:28:22.411397,2024-04-11 16:28:23.086405,0 days 00:00:00.675008,98.22467758100444,7.914738696635134,sigmoid,8,,29.0,30.0,,,,,,,,,,,,,COMPLETE
2627,0.33169308039501816,2024-04-11 16:28:23.088461,2024-04-11 16:28:24.046832,0 days 00:00:00.958371,94.76101949902404,8.241593684749054,sigmoid,14,,26.0,35.0,,,,25.0,17.0,1.013126633310911,6.361375855611153,9.005660629185684,12.0,49.0,53.0,,COMPLETE
2628,0.5963245096172158,2024-04-11 16:28:24.048832,2024-04-11 16:28:24.717017,0 days 00:00:00.668185,98.14866285541758,8.517049587119754,sigmoid,8,,31.0,31.0,,,,,,,,,,,,,COMPLETE
2629,0.5952371952371952,2024-04-11 16:28:24.718019,2024-04-11 16:28:25.564270,0 days 00:00:00.846251,96.33538104699669,7.538202503961654,sigmoid,8,,23.0,32.0,,,,,,,,,,,,,COMPLETE
2630,0.35023219814241485,2024-04-11 16:28:25.566270,2024-04-11 16:28:26.503488,0 days 00:00:00.937218,99.96266061535374,8.016483932113852,sigmoid,42,4.0,24.0,33.0,,,,,,6.881296636921785,1.3475299080237249,3.9100336126894533,3.0,40.0,68.0,,COMPLETE
2631,0.4225175076315316,2024-04-11 16:28:26.505667,2024-04-11 16:28:27.637912,0 days 00:00:01.132245,79.19540686354506,7.79827015763423,sigmoid,63,50.0,27.0,30.0,5.0,4.0,70.0,18.0,44.0,5.262268012428378,8.561244985780505,1.8309864369460893,16.0,43.0,91.0,181.0,COMPLETE
2632,0.48243275987400047,2024-04-11 16:28:27.640082,2024-04-11 16:28:28.385607,0 days 00:00:00.745525,93.13771251996187,8.318990798812694,sigmoid,16,,,,6.0,6.0,42.0,,,,,,,,,,COMPLETE
2633,0.12622036262203626,2024-04-11 16:28:28.387607,2024-04-11 16:28:29.041115,0 days 00:00:00.653508,98.24777287284188,8.154525972340412,sigmoid,8,,25.0,29.0,,,,,,,,,,,,,COMPLETE
2634,0.392879126575307,2024-04-11 16:28:29.042112,2024-04-11 16:28:30.013478,0 days 00:00:00.971366,95.35186939167465,8.020750359116656,sigmoid,46,19.0,24.0,28.0,,,,21.0,36.0,9.250418573477287,1.6719760582342857,0.8289993435408389,13.0,22.0,50.0,,COMPLETE
2635,0.6009432182607054,2024-04-11 16:28:30.015485,2024-04-11 16:28:30.682101,0 days 00:00:00.666616,98.20392795006688,7.728110621403911,sigmoid,8,,23.0,31.0,,,,,,,,,,,,,COMPLETE
2636,0.47802212169547376,2024-04-11 16:28:30.684275,2024-04-11 16:28:31.429649,0 days 00:00:00.745374,96.90428268668667,8.446917492676398,sigmoid,2,,,,,,,,,7.364332539377655,2.7151775416451835,2.3386781470416476,14.0,39.0,80.0,,COMPLETE
2637,0.345149317260871,2024-04-11 16:28:31.430818,2024-04-11 16:28:32.171508,0 days 00:00:00.740690,99.93855922819534,8.178105454883399,sigmoid,37,26.0,,,,,,14.0,39.0,,,,,,,32.0,COMPLETE
2638,0.42086905972969046,2024-04-11 16:28:32.173681,2024-04-11 16:28:33.331404,0 days 00:00:01.157723,98.20116248158413,7.129359898051197,sigmoid,62,32.0,26.0,32.0,4.0,2.0,25.0,49.0,2.0,2.267733374977131,7.446433258940461,6.180006935727041,4.0,41.0,64.0,,COMPLETE
2639,0.4353985139252686,2024-04-11 16:28:33.333547,2024-04-11 16:28:34.345451,0 days 00:00:01.011904,95.3329428372393,7.877987759939841,sigmoid,26,,27.0,26.0,3.0,8.0,97.0,,,7.8280862045877555,2.1844576212523115,6.884700634802929,15.0,34.0,74.0,,COMPLETE
2640,0.24901255935738695,2024-04-11 16:28:34.346447,2024-04-11 16:28:35.091021,0 days 00:00:00.744574,93.13883358366076,8.96326648052799,sigmoid,20,,,,1.0,5.0,99.0,44.0,28.0,,,,,,,,COMPLETE
2641,0.30535638970898354,2024-04-11 16:28:35.093017,2024-04-11 16:28:35.963432,0 days 00:00:00.870415,96.71048572793553,7.550105476936715,sigmoid,10,,25.0,30.0,,,,,,2.795984541537698,6.977196209285344,4.3832255227656525,11.0,21.0,98.0,,COMPLETE
2642,0.4981951087446981,2024-04-11 16:28:35.965432,2024-04-11 16:28:36.708681,0 days 00:00:00.743249,96.85729582709152,8.363653201023508,sigmoid,41,48.0,24.0,32.0,,,,,,,,,,,,76.0,COMPLETE
2643,0.45098754178061373,2024-04-11 16:28:36.710679,2024-04-11 16:28:38.131142,0 days 00:00:01.420463,99.9952546392172,8.036457294513998,rbf,8,,22.0,29.0,,,,,,,,,,,,,COMPLETE
2644,0.5963245096172158,2024-04-11 16:28:38.133317,2024-04-11 16:28:38.795569,0 days 00:00:00.662252,98.32204081099675,8.711199635859145,sigmoid,8,,28.0,31.0,,,,,,,,,,,,,COMPLETE
2645,0.49204067229526627,2024-04-11 16:28:38.797559,2024-04-11 16:28:39.617030,0 days 00:00:00.819471,94.89286670215157,7.758690519243578,sigmoid,56,14.0,26.0,32.0,7.0,7.0,68.0,,,,,,,,,,COMPLETE
2646,0.5052792723834395,2024-04-11 16:28:39.619028,2024-04-11 16:28:40.550473,0 days 00:00:00.931445,99.98425561097343,6.001472272789947,sigmoid,11,,25.0,33.0,,,,,,6.3117732522052865,7.970863017915663,9.807644790383254,20.0,45.0,94.0,130.0,COMPLETE
2647,0.45345352376492626,2024-04-11 16:28:40.552474,2024-04-11 16:28:41.279051,0 days 00:00:00.726577,98.212362071458,8.257880879717447,sigmoid,8,,27.0,30.0,,,,,,,,,,,,,COMPLETE
2648,0.5906279643331437,2024-04-11 16:28:41.281049,2024-04-11 16:28:41.947262,0 days 00:00:00.666213,96.65143631165661,7.9735757838123975,sigmoid,8,,23.0,34.0,,,,,,,,,,,,,COMPLETE
2649,0.3954592951458155,2024-04-11 16:28:41.949269,2024-04-11 16:28:42.742574,0 days 00:00:00.793305,98.19104637649451,8.496968531552364,sigmoid,52,22.0,,,2.0,1.0,46.0,47.0,4.0,,,,,,,,COMPLETE
2650,0.3854344122657581,2024-04-11 16:28:42.744575,2024-04-11 16:28:43.512052,0 days 00:00:00.767477,99.98752212343324,8.141418729209965,sigmoid,48,35.0,,,5.0,4.0,79.0,,,,,,,,,,COMPLETE
2651,0.45830036398164276,2024-04-11 16:28:43.514052,2024-04-11 16:28:44.600327,0 days 00:00:01.086275,94.94557725021801,7.819647562633012,sigmoid,59,28.0,25.0,31.0,4.0,3.0,94.0,,,3.669850516892393,3.0338330670041707,5.353219708632027,9.0,27.0,89.0,150.0,COMPLETE
2652,0.4502698896972542,2024-04-11 16:28:44.602327,2024-04-11 16:28:45.337887,0 days 00:00:00.735560,93.05318576958939,7.40898560755984,sigmoid,8,,26.0,30.0,,,,,,,,,,,,,COMPLETE
2653,0.403700562309553,2024-04-11 16:28:45.339889,2024-04-11 16:28:46.419532,0 days 00:00:01.079643,96.63614609005877,8.011283075243108,sigmoid,55,25.0,,,3.0,8.0,2.0,34.0,14.0,4.317543651006562,7.7562317882782885,2.7877909184073153,2.0,29.0,86.0,65.0,COMPLETE
2654,0.3572325689884092,2024-04-11 16:28:46.421532,2024-04-11 16:28:47.227026,0 days 00:00:00.805494,98.23500571437435,8.330213578147248,sigmoid,13,,30.0,33.0,,,,22.0,32.0,,,,,,,18.0,COMPLETE
2655,0.5112306657700068,2024-04-11 16:28:47.229083,2024-04-11 16:28:48.014558,0 days 00:00:00.785475,95.00854951989025,8.60472555309586,sigmoid,12,,24.0,31.0,,,,8.0,11.0,,,,,,,,COMPLETE
2656,0.12622036262203626,2024-04-11 16:28:48.016558,2024-04-11 16:28:48.671114,0 days 00:00:00.654556,98.31666024178719,7.6367904654586,sigmoid,8,,26.0,29.0,,,,,,,,,,,,,COMPLETE
2657,0.31395752226033996,2024-04-11 16:28:48.672876,2024-04-11 16:28:49.450120,0 days 00:00:00.777244,96.73021626137363,8.098390785681984,sigmoid,44,46.0,28.0,32.0,,,,43.0,42.0,,,,,,,,COMPLETE
2658,0.5453727254940325,2024-04-11 16:28:49.452117,2024-04-11 16:28:50.158482,0 days 00:00:00.706365,99.97685753644994,7.88974553757142,sigmoid,36,41.0,,,,,,15.0,21.0,,,,,,,,COMPLETE
2659,0.12003789673140693,2024-04-11 16:28:50.160469,2024-04-11 16:28:50.867723,0 days 00:00:00.707254,96.58233919262368,8.221710980927911,sigmoid,8,,22.0,28.0,,,,,,,,,,,,,COMPLETE
2660,0.45944101752279054,2024-04-11 16:28:50.868725,2024-04-11 16:28:51.875161,0 days 00:00:01.006436,99.9937251333341,8.402175534465679,sigmoid,54,17.0,,,6.0,2.0,59.0,3.0,8.0,6.602317544966214,9.670601075057768,1.513174088113976,18.0,24.0,67.0,,COMPLETE
2661,0.27398437180378843,2024-04-11 16:28:51.877160,2024-04-11 16:28:53.166034,0 days 00:00:01.288874,98.16913365151485,7.668194590612997,rbf,60,38.0,24.0,31.0,8.0,6.0,28.0,39.0,47.0,,,,,,,,COMPLETE
2662,0.33466872110939905,2024-04-11 16:28:53.167032,2024-04-11 16:28:53.775929,0 days 00:00:00.608897,95.01490787211473,6.9056543924472145,sigmoid,1,,,,,,,,,,,,,,,61.0,COMPLETE
2663,0.5240595492750805,2024-04-11 16:28:53.776934,2024-04-11 16:28:54.872159,0 days 00:00:01.095225,98.1402765431357,7.956633438083345,sigmoid,7,,,,,,,45.0,12.0,8.813629730987811,9.996018545779542,9.22445804665486,17.0,37.0,93.0,92.0,COMPLETE
2664,0.42357972885732725,2024-04-11 16:28:54.874153,2024-04-11 16:28:55.901661,0 days 00:00:01.027508,92.73246196551938,8.190458992980291,sigmoid,23,,,,2.0,5.0,72.0,29.0,40.0,4.03420504390668,9.365080445945605,7.098271147556191,19.0,35.0,83.0,100.0,COMPLETE
2665,0.5941143180531975,2024-04-11 16:28:55.902660,2024-04-11 16:28:56.559798,0 days 00:00:00.657138,99.9450208900908,7.386978744664091,sigmoid,8,,25.0,31.0,,,,,,,,,,,,,COMPLETE
2666,0.5716972175564156,2024-04-11 16:28:56.561973,2024-04-11 16:28:57.190195,0 days 00:00:00.628222,96.66551228112145,7.848852466147421,sigmoid,32,10.0,,,,,,,,,,,,,,,COMPLETE
2667,0.5220776404250705,2024-04-11 16:28:57.191372,2024-04-11 16:28:57.966528,0 days 00:00:00.775156,98.1400453529049,8.574944176691075,sigmoid,40,2.0,27.0,33.0,,,,,,,,,,,,,COMPLETE
2668,0.4659582625842142,2024-04-11 16:28:57.968525,2024-04-11 16:28:59.037358,0 days 00:00:01.068833,95.14130550308819,8.080873612237172,sigmoid,27,,25.0,30.0,7.0,2.0,88.0,,,3.2738404511628816,1.1357283331139616,8.792930140996612,8.0,43.0,55.0,28.0,COMPLETE
2669,0.12622036262203626,2024-04-11 16:28:59.039357,2024-04-11 16:28:59.744718,0 days 00:00:00.705361,98.23172612923278,7.577968558836109,sigmoid,8,,23.0,29.0,,,,,,,,,,,,,COMPLETE
2670,0.24798638213069835,2024-04-11 16:28:59.746718,2024-04-11 16:29:00.613259,0 days 00:00:00.866541,99.99555976047505,8.315263250768263,sigmoid,34,24.0,,,,,,,,1.2437156407870136,5.458358866398091,3.5877854327110517,5.0,25.0,59.0,,COMPLETE
2671,0.5975287681569516,2024-04-11 16:29:00.615409,2024-04-11 16:29:01.291880,0 days 00:00:00.676471,96.86441789090365,8.779540967202587,sigmoid,8,,27.0,32.0,,,,,,,,,,,,,COMPLETE
2672,0.5018118144896521,2024-04-11 16:29:01.293880,2024-04-11 16:29:02.368246,0 days 00:00:01.074366,23.287971437939305,7.769694952762954,sigmoid,30,,24.0,30.0,3.0,7.0,55.0,10.0,37.0,1.7938230767126164,3.336562322612472,8.528604346717119,7.0,48.0,70.0,,COMPLETE
2673,0.6009432182607054,2024-04-11 16:29:02.370244,2024-04-11 16:29:03.028768,0 days 00:00:00.658524,94.96531626798478,8.061644365801696,sigmoid,8,,29.0,31.0,,,,,,,,,,,,,COMPLETE
2674,0.4527744087325652,2024-04-11 16:29:03.029811,2024-04-11 16:29:03.990441,0 days 00:00:00.960630,98.20064285977392,8.40694604974334,sigmoid,61,40.0,26.0,32.0,1.0,4.0,74.0,33.0,26.0,,,,,,,118.0,COMPLETE
2675,0.4452262456381214,2024-04-11 16:29:03.992442,2024-04-11 16:29:04.957161,0 days 00:00:00.964719,93.03249821630524,8.1803567328545,sigmoid,51,12.0,,,6.0,3.0,48.0,,,5.884244788668162,2.5357622814940997,5.0879900221554175,14.0,20.0,73.0,72.0,COMPLETE
2676,0.1793623438173201,2024-04-11 16:29:04.958166,2024-04-11 16:29:05.609244,0 days 00:00:00.651078,96.6889420003287,7.917304783498589,sigmoid,4,,,,,,,27.0,15.0,,,,,,,,COMPLETE
2677,0.3101085094231868,2024-04-11 16:29:05.611295,2024-04-11 16:29:06.281849,0 days 00:00:00.670554,58.2492725523924,7.783178288989136,sigmoid,33,15.0,,,,,,,,,,,,,,173.0,COMPLETE
2678,0.4986680024590724,2024-04-11 16:29:06.283854,2024-04-11 16:29:07.098163,0 days 00:00:00.814309,98.08602331420823,8.475339956253455,sigmoid,45,37.0,25.0,29.0,,,,5.0,43.0,,,,,,,126.0,COMPLETE
2679,0.5906279643331437,2024-04-11 16:29:07.099165,2024-04-11 16:29:07.777783,0 days 00:00:00.678618,98.15064654951614,8.249747691867796,sigmoid,8,,26.0,34.0,,,,,,,,,,,,,COMPLETE
2680,0.5069140556625241,2024-04-11 16:29:07.778783,2024-04-11 16:29:08.527968,0 days 00:00:00.749185,95.05170029261583,7.228053214345766,sigmoid,8,,24.0,35.0,,,,,,,,,,,,,COMPLETE
2681,0.378942392111839,2024-04-11 16:29:08.529969,2024-04-11 16:29:09.469962,0 days 00:00:00.939993,99.94915358993052,6.462413638222625,sigmoid,19,,,,8.0,1.0,36.0,,,6.989615703311735,6.66811031944575,7.5323387123077925,10.0,32.0,95.0,162.0,COMPLETE
2682,0.4781747223056139,2024-04-11 16:29:09.471964,2024-04-11 16:29:11.088078,0 days 00:00:01.616114,96.68780015150959,8.014100965881775,rbf,8,,28.0,30.0,,,,,,,,,,,,,COMPLETE
2683,0.37395384669257975,2024-04-11 16:29:11.089079,2024-04-11 16:29:11.792675,0 days 00:00:00.703596,98.37594631509208,7.623640668336979,sigmoid,5,,,,,,,28.0,6.0,,,,,,,135.0,COMPLETE
2684,0.5071129161870426,2024-04-11 16:29:11.794901,2024-04-11 16:29:12.731354,0 days 00:00:00.936453,96.39511384075325,8.132092557967365,sigmoid,18,,,,5.0,5.0,10.0,,,9.047984382853569,4.71921067554062,6.3420869872898455,12.0,50.0,79.0,,COMPLETE
2685,0.3890048279084255,2024-04-11 16:29:12.733445,2024-04-11 16:29:13.771784,0 days 00:00:01.038339,93.07951117868755,7.93034350179164,sigmoid,58,16.0,22.0,31.0,4.0,8.0,21.0,,,4.5502325914877835,4.301920718950502,1.0514494388811517,2.0,42.0,65.0,,COMPLETE
2686,0.5929369437606513,2024-04-11 16:29:13.773793,2024-04-11 16:29:14.452180,0 days 00:00:00.678387,99.93991258193651,8.35772280395878,sigmoid,8,,25.0,33.0,,,,,,,,,,,,,COMPLETE
2687,0.592071705784513,2024-04-11 16:29:14.453459,2024-04-11 16:29:15.132484,0 days 00:00:00.679025,99.9905682597527,8.625566580147128,sigmoid,8,,23.0,27.0,,,,,,,,,,,,,COMPLETE
2688,0.46850355605012345,2024-04-11 16:29:15.134772,2024-04-11 16:29:16.043815,0 days 00:00:00.909043,95.11495140192835,7.77962216384697,sigmoid,53,8.0,,,2.0,4.0,40.0,16.0,22.0,,,,,,,111.0,COMPLETE
2689,0.4173993254734657,2024-04-11 16:29:16.045835,2024-04-11 16:29:16.898738,0 days 00:00:00.852903,96.9772246518187,7.459003381297243,sigmoid,17,,,,1.0,7.0,16.0,,,,,,,,,36.0,COMPLETE
2690,0.4980052276791856,2024-04-11 16:29:16.900736,2024-04-11 16:29:17.694534,0 days 00:00:00.793798,98.24126280350178,8.163333126150553,sigmoid,49,44.0,,,7.0,6.0,52.0,,,,,,,,,194.0,COMPLETE
2691,0.19634785753028386,2024-04-11 16:29:17.695529,2024-04-11 16:29:18.540356,0 days 00:00:00.844827,96.72789585722872,7.99489518110591,sigmoid,6,,,,,,,37.0,24.0,1.4720249957127436,6.177306214478607,4.619737950867272,13.0,30.0,76.0,,COMPLETE
2692,0.41421552130308936,2024-04-11 16:29:18.542554,2024-04-11 16:29:19.377400,0 days 00:00:00.834846,98.21715618435499,8.304167093195588,sigmoid,25,,27.0,32.0,5.0,1.0,86.0,,,,,,,,,107.0,COMPLETE
2693,0.4735089712760616,2024-04-11 16:29:19.379399,2024-04-11 16:29:20.318199,0 days 00:00:00.938800,94.24451645863238,8.944048186342265,sigmoid,50,34.0,,,6.0,2.0,44.0,,,7.731052107193228,3.774976046855653,4.12722643237253,16.0,47.0,71.0,,COMPLETE
2694,0.406272045148464,2024-04-11 16:29:20.320392,2024-04-11 16:29:21.361417,0 days 00:00:01.041025,98.17207455632375,7.713854736654556,sigmoid,43,31.0,26.0,31.0,,,,,,7.208808281916255,0.7156498641014242,0.6691292261068646,6.0,33.0,57.0,10.0,COMPLETE
2695,0.44701971028259324,2024-04-11 16:29:21.364441,2024-04-11 16:29:22.082558,0 days 00:00:00.718117,94.84196023533721,7.912450626574872,sigmoid,8,,25.0,30.0,,,,,,,,,,,,,COMPLETE
2696,0.3996215108027125,2024-04-11 16:29:22.083720,2024-04-11 16:29:23.292963,0 days 00:00:01.209243,50.15322638125181,8.573494929844761,sigmoid,39,21.0,,,,,,20.0,35.0,9.643247603365417,5.198144616856322,5.751750049012665,9.0,26.0,62.0,21.0,COMPLETE
2697,0.46067202772588195,2024-04-11 16:29:23.294980,2024-04-11 16:29:24.286038,0 days 00:00:00.991058,98.36608665318883,5.291195637504525,sigmoid,21,,,,8.0,5.0,12.0,11.0,31.0,,,,,,,179.0,COMPLETE
2698,0.3898793743372216,2024-04-11 16:29:24.287042,2024-04-11 16:29:25.520885,0 days 00:00:01.233843,96.54442306522668,8.16424045157806,sigmoid,47,47.0,24.0,32.0,,,,7.0,23.0,8.156749071801658,8.739785768455953,1.326367142628654,4.0,38.0,61.0,156.0,COMPLETE
2699,0.2522275241754993,2024-04-11 16:29:25.522889,2024-04-11 16:29:26.797123,0 days 00:00:01.274234,99.95440411560577,7.5355286573593805,rbf,35,19.0,,,,,,,,5.060878811823677,7.198484867234262,3.046323691281814,3.0,23.0,99.0,82.0,COMPLETE
2700,0.32972371217488106,2024-04-11 16:29:26.799124,2024-04-11 16:29:27.806634,0 days 00:00:01.007510,98.19614783487457,8.38289411493774,sigmoid,22,,,,4.0,8.0,33.0,13.0,9.0,2.4472837273613024,8.129161870443353,2.0226906999986567,10.0,44.0,84.0,,COMPLETE
2701,0.45347172512526845,2024-04-11 16:29:27.807805,2024-04-11 16:29:28.500180,0 days 00:00:00.692375,92.78940924633818,8.042832689641822,sigmoid,8,,21.0,28.0,,,,,,,,,,,,,COMPLETE
2702,0.44701971028259324,2024-04-11 16:29:28.502284,2024-04-11 16:29:29.203838,0 days 00:00:00.701554,95.92585318838236,7.7471914897198,sigmoid,8,,27.0,30.0,,,,,,,,,,,,,COMPLETE
2703,0.48982941815842596,2024-04-11 16:29:29.205839,2024-04-11 16:29:30.148127,0 days 00:00:00.942288,98.27746781330035,8.24108449146846,sigmoid,38,31.0,,,,,,50.0,30.0,3.568064540831676,1.9537862200012799,9.497357257227062,18.0,46.0,90.0,,COMPLETE
2704,0.5929369437606513,2024-04-11 16:29:30.150173,2024-04-11 16:29:30.838321,0 days 00:00:00.688148,99.9331785442775,7.916863598518943,sigmoid,8,,26.0,33.0,,,,,,,,,,,,,COMPLETE
2705,0.507848970805215,2024-04-11 16:29:30.840320,2024-04-11 16:29:31.837902,0 days 00:00:00.997582,96.62294674198407,8.46626873558584,sigmoid,29,,23.0,29.0,2.0,3.0,8.0,38.0,46.0,,,,,,,53.0,COMPLETE
2706,0.5337433650686662,2024-04-11 16:29:31.839902,2024-04-11 16:29:32.590497,0 days 00:00:00.750595,94.55498636989637,8.080681980171379,sigmoid,9,,29.0,32.0,,,,,,,,,,,,145.0,COMPLETE
2707,0.5027902477740023,2024-04-11 16:29:32.592498,2024-04-11 16:29:33.722521,0 days 00:00:01.130023,96.53122689811921,7.875211671373058,sigmoid,31,,25.0,31.0,3.0,6.0,63.0,34.0,34.0,0.8250645870585656,9.180440443096767,6.6503785179511095,19.0,31.0,75.0,40.0,COMPLETE
2708,0.6009432182607054,2024-04-11 16:29:33.724501,2024-04-11 16:29:34.396929,0 days 00:00:00.672428,99.94396660340246,7.605831805831201,sigmoid,8,,24.0,31.0,,,,,,,,,,,,,COMPLETE
2709,0.42610913371262016,2024-04-11 16:29:34.399114,2024-04-11 16:29:35.263645,0 days 00:00:00.864531,99.99308552306361,8.693116210500285,sigmoid,28,,26.0,30.0,5.0,4.0,50.0,19.0,25.0,,,,,,,,COMPLETE
2710,0.3195237379807692,2024-04-11 16:29:35.264655,2024-04-11 16:29:36.092003,0 days 00:00:00.827348,98.17273497849669,8.337474419519946,sigmoid,3,,,,,,,,,9.321943227175062,5.719933296851284,7.793108057013929,16.0,40.0,69.0,47.0,COMPLETE
2711,0.45239228755058314,2024-04-11 16:29:36.094004,2024-04-11 16:29:36.802642,0 days 00:00:00.708638,95.14894719005922,7.265776507791385,sigmoid,8,,28.0,28.0,,,,,,,,,,,,,COMPLETE
2712,0.368230697193787,2024-04-11 16:29:36.804643,2024-04-11 16:29:37.726131,0 days 00:00:00.921488,96.82889430637186,8.158187669936092,sigmoid,42,9.0,25.0,34.0,,,,,,9.991876663311547,2.362204797986918,5.521960177167971,8.0,29.0,53.0,,COMPLETE
2713,0.5929369437606513,2024-04-11 16:29:37.728132,2024-04-11 16:29:38.391762,0 days 00:00:00.663630,98.1814942694686,7.826748038326292,sigmoid,8,,23.0,33.0,,,,,,,,,,,,,COMPLETE
2714,0.4957838766851066,2024-04-11 16:29:38.392982,2024-04-11 16:29:39.314900,0 days 00:00:00.921918,93.51805988930437,8.046886242634287,sigmoid,24,,27.0,29.0,3.0,7.0,66.0,,,,,,,,,,COMPLETE
