number,value,datetime_start,datetime_complete,duration,params_C,params_gamma,params_kernel,params_mask_number,params_rsi_window,params_so_smooth,params_so_window,params_srsi_smooth1,params_srsi_smooth2,params_srsi_window,params_tsi_window_fast,params_tsi_window_slow,params_ult_weight_1,params_ult_weight_2,params_ult_weight_3,params_ult_window_1,params_ult_window_2,params_ult_window_3,params_williams_lbp,state
8262,0.505805829920501,2024-04-11 18:47:33.980735,2024-04-11 18:47:35.657220,0 days 00:00:01.676485,96.60555273861407,3.4401346903094154,sigmoid,41,2.0,27.0,31.0,,,,,,,,,,,,41.0,COMPLETE
8263,0.5931679318644695,2024-04-11 18:47:35.661821,2024-04-11 18:47:37.388017,0 days 00:00:01.726196,98.08872421016916,7.69320876966732,sigmoid,8,,29.0,27.0,,,,,,,,,,,,,COMPLETE
8264,0.5194983465402134,2024-04-11 18:47:37.390610,2024-04-11 18:47:39.090537,0 days 00:00:01.699927,95.46244737775649,8.664638104013585,sigmoid,37,37.0,,,,,,14.0,49.0,,,,,,,91.0,COMPLETE
8265,0.12622036262203626,2024-04-11 18:47:39.093513,2024-04-11 18:47:40.645586,0 days 00:00:01.552073,92.32128567386533,8.005053766028041,sigmoid,8,,25.0,29.0,,,,,,,,,,,,,COMPLETE
8266,0.5986580986580987,2024-04-11 18:47:40.648594,2024-04-11 18:47:42.166244,0 days 00:00:01.517650,99.9846015031144,8.22216230640334,sigmoid,8,,24.0,31.0,,,,,,,,,,,,,COMPLETE
8267,0.41571199291604405,2024-04-11 18:47:42.169789,2024-04-11 18:47:44.602853,0 days 00:00:02.433064,96.74886254501094,7.846428859701382,sigmoid,26,,26.0,34.0,4.0,5.0,58.0,,,9.026932659585817,6.261859405562356,5.805998779924164,2.0,30.0,70.0,,COMPLETE
8268,0.4503226159230096,2024-04-11 18:47:44.605848,2024-04-11 18:47:47.085118,0 days 00:00:02.479270,66.88447468854385,8.105896874006428,sigmoid,62,4.0,23.0,33.0,6.0,1.0,75.0,43.0,21.0,6.1980262077686135,1.4825513280432356,8.83729776429266,16.0,26.0,81.0,,COMPLETE
8269,0.468008293694353,2024-04-11 18:47:47.088123,2024-04-11 18:47:48.856892,0 days 00:00:01.768769,97.97483659423843,7.379243254105347,sigmoid,52,39.0,,,3.0,2.0,80.0,29.0,5.0,,,,,,,,COMPLETE
8270,0.45345352376492626,2024-04-11 18:47:48.860409,2024-04-11 18:47:50.262822,0 days 00:00:01.402413,99.98925980775938,9.250544255900522,sigmoid,8,,25.0,30.0,,,,,,,,,,,,,COMPLETE
8271,0.5146271574224216,2024-04-11 18:47:50.265821,2024-04-11 18:47:52.236006,0 days 00:00:01.970185,95.13306351014587,8.473973397784395,sigmoid,13,,28.0,32.0,,,,3.0,26.0,,,,,,,127.0,COMPLETE
8272,0.30257920713262215,2024-04-11 18:47:52.238994,2024-04-11 18:47:54.287307,0 days 00:00:02.048313,13.25221937018523,8.269230035842723,rbf,48,46.0,,,7.0,6.0,38.0,,,,,,,,,,COMPLETE
8273,0.42883822053740667,2024-04-11 18:47:54.289939,2024-04-11 18:47:56.351852,0 days 00:00:02.061913,98.18503841297054,7.97701412164767,sigmoid,56,15.0,6.0,30.0,1.0,3.0,72.0,,,,,,,,,,COMPLETE
8274,0.6009432182607054,2024-04-11 18:47:56.354843,2024-04-11 18:47:57.892068,0 days 00:00:01.537225,98.10172553374723,7.621675192450298,sigmoid,8,,21.0,31.0,,,,,,,,,,,,,COMPLETE
8275,0.5101746184518081,2024-04-11 18:47:57.895062,2024-04-11 18:48:00.229983,0 days 00:00:02.334921,95.04648833764358,8.18357920852478,sigmoid,55,42.0,,,6.0,7.0,20.0,41.0,32.0,4.628126088559836,2.6471037919199585,3.168656536496653,15.0,36.0,88.0,114.0,COMPLETE
8276,0.5308713337615072,2024-04-11 18:48:00.233946,2024-04-11 18:48:02.226075,0 days 00:00:01.992129,96.52644041050121,7.816076741646626,sigmoid,20,,,,4.0,6.0,5.0,24.0,8.0,,,,,,,,COMPLETE
8277,0.41586251263670626,2024-04-11 18:48:02.229070,2024-04-11 18:48:04.380718,0 days 00:00:02.151648,97.9710913558635,8.5184391852491,sigmoid,60,29.0,24.0,29.0,3.0,8.0,43.0,23.0,28.0,,,,,,,,COMPLETE
8278,0.5952371952371952,2024-04-11 18:48:04.383754,2024-04-11 18:48:05.972305,0 days 00:00:01.588551,93.69286619163205,7.991230716503566,sigmoid,8,,27.0,32.0,,,,,,,,,,,,,COMPLETE
8279,0.43089538420843804,2024-04-11 18:48:05.974333,2024-04-11 18:48:08.340642,0 days 00:00:02.366309,98.34988041399662,8.306253410022089,sigmoid,23,,,,8.0,2.0,34.0,34.0,13.0,7.750650398248212,2.1888696582586977,2.1310916737771297,12.0,43.0,54.0,67.0,COMPLETE
8280,0.4626001022320669,2024-04-11 18:48:08.344561,2024-04-11 18:48:11.071642,0 days 00:00:02.727081,98.16547868784511,8.763792454492705,sigmoid,59,16.0,26.0,33.0,5.0,4.0,94.0,,,2.6758024475742346,4.358499913809264,8.261278965176247,4.0,24.0,83.0,59.0,COMPLETE
8281,0.3595473732751588,2024-04-11 18:48:11.075643,2024-04-11 18:48:12.886288,0 days 00:00:01.810645,96.66267092870181,7.749837278819457,sigmoid,44,26.0,25.0,28.0,,,,27.0,10.0,,,,,,,,COMPLETE
8282,0.4627067669172933,2024-04-11 18:48:12.889289,2024-04-11 18:48:15.356336,0 days 00:00:02.467047,94.98325867070334,8.008008168827107,sigmoid,54,20.0,,,1.0,5.0,51.0,31.0,18.0,0.6450314879867642,7.269862407199902,7.807203479589159,13.0,48.0,92.0,,COMPLETE
8283,0.2565663303593763,2024-04-11 18:48:15.361845,2024-04-11 18:48:16.974535,0 days 00:00:01.612690,98.25607735354338,8.142770586031617,sigmoid,36,7.0,,,,,,32.0,27.0,,,,,,,,COMPLETE
8284,0.36440880395836883,2024-04-11 18:48:16.977537,2024-04-11 18:48:18.726051,0 days 00:00:01.748514,96.65214775901173,7.16827252908101,sigmoid,12,,24.0,31.0,,,,40.0,24.0,,,,,,,,COMPLETE
8285,0.44701971028259324,2024-04-11 18:48:18.728597,2024-04-11 18:48:20.199081,0 days 00:00:01.470484,91.50729079911376,7.51951781810381,sigmoid,8,,23.0,30.0,,,,,,,,,,,,,COMPLETE
8286,0.5963643249384587,2024-04-11 18:48:20.201638,2024-04-11 18:48:21.638811,0 days 00:00:01.437173,98.17663379741289,8.41850648407288,sigmoid,8,,27.0,32.0,,,,,,,,,,,,,COMPLETE
8287,0.5929369437606513,2024-04-11 18:48:21.642414,2024-04-11 18:48:23.073425,0 days 00:00:01.431011,93.96568192265907,7.867410285261627,sigmoid,8,,26.0,33.0,,,,,,,,,,,,,COMPLETE
8288,0.383881230116649,2024-04-11 18:48:23.076429,2024-04-11 18:48:24.393708,0 days 00:00:01.317279,96.49411150690989,8.220955815350555,sigmoid,1,,,,,,,,,,,,,,,144.0,COMPLETE
8289,0.42487016226049706,2024-04-11 18:48:24.396709,2024-04-11 18:48:26.947358,0 days 00:00:02.550649,98.21862206580491,7.680354410970761,sigmoid,30,,25.0,31.0,2.0,1.0,47.0,50.0,40.0,3.601347622109844,9.55626799025828,6.4540659114526715,17.0,37.0,85.0,,COMPLETE
8290,0.3976351242205925,2024-04-11 18:48:26.950900,2024-04-11 18:48:28.880115,0 days 00:00:01.929215,99.9697902499889,8.63204114140561,rbf,32,5.0,,,,,,,,,,,,,,,COMPLETE
8291,0.3062487983080177,2024-04-11 18:48:28.884713,2024-04-11 18:48:30.629685,0 days 00:00:01.744972,95.51643921628136,8.012541096572987,sigmoid,34,14.0,,,,,,,,1.8336750774097736,1.8943698943162217,2.718360375675222,10.0,22.0,65.0,,COMPLETE
8292,0.5122563564157575,2024-04-11 18:48:30.633815,2024-04-11 18:48:32.706167,0 days 00:00:02.072352,99.94066803007664,8.422259537062041,sigmoid,7,,,,,,,47.0,50.0,5.161502182079641,6.405805830613669,9.797694037794049,3.0,20.0,56.0,161.0,COMPLETE
8293,0.3993447883933944,2024-04-11 18:48:32.709167,2024-04-11 18:48:35.086162,0 days 00:00:02.376995,99.97686459962065,5.1606290309349365,sigmoid,27,,28.0,29.0,5.0,4.0,55.0,,,0.5096886092936881,1.0851223867012587,6.203475293732584,5.0,49.0,95.0,181.0,COMPLETE
8294,0.44701971028259324,2024-04-11 18:48:35.089157,2024-04-11 18:48:36.706712,0 days 00:00:01.617555,98.18745855732034,8.160265411330805,sigmoid,8,,22.0,30.0,,,,,,,,,,,,,COMPLETE
8295,0.503062203310623,2024-04-11 18:48:36.709704,2024-04-11 18:48:39.059779,0 days 00:00:02.350075,95.577444739143,7.864217870120971,sigmoid,61,12.0,26.0,32.0,2.0,7.0,69.0,17.0,16.0,,,,,,,87.0,COMPLETE
8296,0.5941143180531975,2024-04-11 18:48:39.063378,2024-04-11 18:48:40.866726,0 days 00:00:01.803348,98.20329121997989,7.387288772693342,sigmoid,8,,25.0,31.0,,,,,,,,,,,,,COMPLETE
8297,0.12003789673140693,2024-04-11 18:48:40.869714,2024-04-11 18:48:42.659817,0 days 00:00:01.790103,96.7459221179944,8.298107332032549,sigmoid,8,,24.0,28.0,,,,,,,,,,,,,COMPLETE
8298,0.21524645288280161,2024-04-11 18:48:42.663372,2024-04-11 18:48:44.409643,0 days 00:00:01.746271,93.46096320707562,8.007050807193657,sigmoid,4,,,,,,,25.0,33.0,,,,,,,,COMPLETE
8299,0.5125513658526198,2024-04-11 18:48:44.412179,2024-04-11 18:48:46.106197,0 days 00:00:01.694018,62.59618822187565,7.6499959046110995,sigmoid,5,,,,,,,12.0,45.0,,,,,,,49.0,COMPLETE
8300,0.3448538657927829,2024-04-11 18:48:46.109171,2024-04-11 18:48:47.536413,0 days 00:00:01.427242,96.6579919010421,7.820832320663702,sigmoid,33,22.0,,,,,,,,,,,,,,83.0,COMPLETE
8301,0.44701971028259324,2024-04-11 18:48:47.539416,2024-04-11 18:48:49.017312,0 days 00:00:01.477896,99.98820501283672,8.149281749429305,sigmoid,8,,23.0,30.0,,,,,,,,,,,,,COMPLETE
8302,0.42821165097939456,2024-04-11 18:48:49.020312,2024-04-11 18:48:50.735521,0 days 00:00:01.715209,98.18584594418681,8.484545991075622,sigmoid,17,,,,8.0,3.0,14.0,,,,,,,,,10.0,COMPLETE
8303,0.5042176516532153,2024-04-11 18:48:50.738522,2024-04-11 18:48:52.392526,0 days 00:00:01.654004,94.97091645728467,8.332584673394615,sigmoid,40,38.0,27.0,32.0,,,,,,,,,,,,,COMPLETE
8304,0.4371359568120472,2024-04-11 18:48:52.396498,2024-04-11 18:48:54.855512,0 days 00:00:02.459014,99.99505244284835,7.998881610896825,sigmoid,58,44.0,29.0,34.0,7.0,2.0,85.0,,,7.287147999255768,7.620847368481801,4.292724264195441,18.0,42.0,68.0,,COMPLETE
8305,0.496704680927638,2024-04-11 18:48:54.858484,2024-04-11 18:48:56.767166,0 days 00:00:01.908682,98.12163390308683,7.592406727179807,sigmoid,45,49.0,24.0,31.0,,,,21.0,19.0,,,,,,,135.0,COMPLETE
8306,0.4497024325417461,2024-04-11 18:48:56.770165,2024-04-11 18:48:59.010371,0 days 00:00:02.240206,92.24294766598027,9.026020488795593,sigmoid,51,33.0,,,6.0,6.0,89.0,,,3.2961324525173246,3.065826240701727,1.4793062572222802,9.0,34.0,77.0,30.0,COMPLETE
8307,0.44701971028259324,2024-04-11 18:48:59.012939,2024-04-11 18:49:00.384687,0 days 00:00:01.371748,96.81229316724603,7.85452197391445,sigmoid,8,,26.0,30.0,,,,,,,,,,,,,COMPLETE
8308,0.5129586362062997,2024-04-11 18:49:00.386676,2024-04-11 18:49:02.435854,0 days 00:00:02.049178,98.24001238621369,8.614815358360262,sigmoid,53,23.0,,,3.0,8.0,7.0,30.0,47.0,,,,,,,37.0,COMPLETE
8309,0.452366950896795,2024-04-11 18:49:02.438856,2024-04-11 18:49:04.582328,0 days 00:00:02.143472,75.5166050735057,6.77305065544581,rbf,8,,25.0,33.0,,,,,,,,,,,,,COMPLETE
8310,0.45211546880230724,2024-04-11 18:49:04.585349,2024-04-11 18:49:06.792162,0 days 00:00:02.206813,95.19404328411444,8.165225913479535,sigmoid,29,,27.0,12.0,4.0,1.0,98.0,9.0,34.0,,,,,,,25.0,COMPLETE
8311,0.2409017177556877,2024-04-11 18:49:06.795354,2024-04-11 18:49:09.000643,0 days 00:00:02.205289,99.97761061082988,8.316489386568232,sigmoid,6,,,,,,,38.0,7.0,5.616935692479722,2.3844380216695877,1.6715518080702063,8.0,47.0,80.0,,COMPLETE
8312,0.12622036262203626,2024-04-11 18:49:09.004213,2024-04-11 18:49:10.776198,0 days 00:00:01.771985,98.21344359109963,7.997771707090825,sigmoid,8,,23.0,29.0,,,,,,,,,,,,,COMPLETE
8313,0.41255315529852016,2024-04-11 18:49:10.780192,2024-04-11 18:49:12.613569,0 days 00:00:01.833377,96.64511730474527,7.7168180357051925,sigmoid,49,3.0,,,7.0,4.0,76.0,,,,,,,,,96.0,COMPLETE
8314,0.5952371952371952,2024-04-11 18:49:12.616592,2024-04-11 18:49:14.191381,0 days 00:00:01.574789,95.11437520476676,8.141160651654697,sigmoid,8,,22.0,32.0,,,,,,,,,,,,,COMPLETE
8315,0.38997159925570457,2024-04-11 18:49:14.193963,2024-04-11 18:49:16.249925,0 days 00:00:02.055962,93.3774806994978,7.452803136849925,sigmoid,25,,28.0,31.0,1.0,5.0,64.0,,,,,,,,,197.0,COMPLETE
8316,0.3934541669218052,2024-04-11 18:49:16.254520,2024-04-11 18:49:18.508566,0 days 00:00:02.254046,99.99710129093738,8.795430199817337,sigmoid,50,17.0,,,3.0,3.0,49.0,,,9.275967693198258,4.0623192571861795,5.015295062841049,14.0,27.0,59.0,,COMPLETE
8317,0.4487524397320251,2024-04-11 18:49:18.511568,2024-04-11 18:49:20.832433,0 days 00:00:02.320865,98.1744649839749,7.876022829588085,sigmoid,19,,,,5.0,2.0,82.0,,,1.734690037645068,5.545146677169303,8.114303793505693,19.0,39.0,74.0,78.0,COMPLETE
8318,0.5963245096172158,2024-04-11 18:49:20.835022,2024-04-11 18:49:22.307423,0 days 00:00:01.472401,96.74626264851004,8.406201033029824,sigmoid,8,,31.0,31.0,,,,,,,,,,,,,COMPLETE
8319,0.49228516135781164,2024-04-11 18:49:22.312422,2024-04-11 18:49:24.209675,0 days 00:00:01.897253,98.29688886861213,8.069457487178882,sigmoid,24,,26.0,30.0,8.0,7.0,60.0,,,,,,,,,,COMPLETE
8320,0.5195201255746159,2024-04-11 18:49:24.212669,2024-04-11 18:49:26.295684,0 days 00:00:02.083015,90.58579946861065,8.269505303793938,sigmoid,35,25.0,,,,,,,,2.9162697786300766,5.874775622459843,4.044414616155345,16.0,45.0,64.0,169.0,COMPLETE
8321,0.4214626573909044,2024-04-11 18:49:26.298670,2024-04-11 18:49:28.758523,0 days 00:00:02.459853,96.72395082487898,7.7531945833735865,sigmoid,47,47.0,24.0,35.0,,,,45.0,14.0,6.541273224025247,6.908587069792724,7.640626907612306,7.0,41.0,50.0,56.0,COMPLETE
8322,0.4513595967634965,2024-04-11 18:49:28.763067,2024-04-11 18:49:30.601055,0 days 00:00:01.837988,99.97084118946442,8.539798618604324,sigmoid,21,,,,6.0,6.0,24.0,42.0,42.0,,,,,,,158.0,COMPLETE
8323,0.5440167485438302,2024-04-11 18:49:30.604620,2024-04-11 18:49:32.839592,0 days 00:00:02.234972,99.94969635476144,9.556735875867245,sigmoid,18,,,,4.0,7.0,16.0,,,2.448680169330492,9.191740281438383,2.5211341749610763,4.0,28.0,79.0,,COMPLETE
8324,0.3747539203041205,2024-04-11 18:49:32.842587,2024-04-11 18:49:34.978035,0 days 00:00:02.135448,93.68235113563092,7.267737005391435,sigmoid,43,35.0,25.0,27.0,,,,,,1.1570974601668258,1.6373942935937444,1.9850074857160567,2.0,30.0,87.0,72.0,COMPLETE
8325,0.3738688524590164,2024-04-11 18:49:34.981035,2024-04-11 18:49:37.255696,0 days 00:00:02.274661,98.18866813068021,7.965550869372527,sigmoid,39,9.0,,,,,,13.0,38.0,9.541766340939192,8.186022668976424,6.783364386600698,17.0,44.0,62.0,101.0,COMPLETE
8326,0.5831142381040548,2024-04-11 18:49:37.258681,2024-04-11 18:49:38.829191,0 days 00:00:01.570510,95.4596817346042,8.166930514198711,sigmoid,8,,26.0,38.0,,,,,,,,,,,,,COMPLETE
8327,0.5636462904171639,2024-04-11 18:49:38.831200,2024-04-11 18:49:40.144512,0 days 00:00:01.313312,99.94754687242614,7.553701614814663,sigmoid,0,,,,,,,,,,,,,,,,COMPLETE
8328,0.2043081553946007,2024-04-11 18:49:40.147504,2024-04-11 18:49:42.660283,0 days 00:00:02.512779,99.99198180198346,7.903064356071659,rbf,22,,,,1.0,8.0,30.0,15.0,29.0,8.776783502711082,9.99394697300206,3.728203672891043,10.0,35.0,96.0,,COMPLETE
8329,0.36775270299687984,2024-04-11 18:49:42.663286,2024-04-11 18:49:44.802918,0 days 00:00:02.139632,99.99144264603177,8.36659880989464,sigmoid,38,6.0,,,,,,4.0,12.0,7.972031444971989,7.829424069960268,5.295877507260408,6.0,26.0,89.0,,COMPLETE
8330,0.5097679824757477,2024-04-11 18:49:44.806489,2024-04-11 18:49:46.719296,0 days 00:00:01.912807,88.04276387937418,8.150383318655301,sigmoid,3,,,,,,,,,5.868857442339894,4.785594038860495,8.604689813788953,11.0,31.0,76.0,120.0,COMPLETE
8331,0.4872397139162334,2024-04-11 18:49:46.722279,2024-04-11 18:49:48.144486,0 days 00:00:01.422207,96.49821575519663,7.7190616357433495,sigmoid,8,,24.0,37.0,,,,,,,,,,,,,COMPLETE
8332,0.5929369437606513,2024-04-11 18:49:48.147516,2024-04-11 18:49:49.551510,0 days 00:00:01.403994,96.7051320198237,8.588571249312444,sigmoid,8,,25.0,33.0,,,,,,,,,,,,,COMPLETE
8333,0.4272092145015106,2024-04-11 18:49:49.554102,2024-04-11 18:49:51.806881,0 days 00:00:02.252779,98.19441317183386,8.04267275696576,sigmoid,57,45.0,28.0,29.0,2.0,5.0,40.0,,,,,,,,,146.0,COMPLETE
8334,0.5330034656142952,2024-04-11 18:49:51.809863,2024-04-11 18:49:53.586342,0 days 00:00:01.776479,93.80332469390025,8.304665620700144,sigmoid,9,,27.0,32.0,,,,,,,,,,,,125.0,COMPLETE
8335,0.3410881929692318,2024-04-11 18:49:53.589894,2024-04-11 18:49:55.842444,0 days 00:00:02.252550,99.97594531790206,7.802507254324527,sigmoid,42,11.0,25.0,31.0,,,,,,5.39310966791688,5.130963496044757,3.4224205260199927,15.0,46.0,58.0,,COMPLETE
8336,0.4256444927834445,2024-04-11 18:49:55.847058,2024-04-11 18:49:58.697166,0 days 00:00:02.850108,95.28677383867512,7.980737635343869,sigmoid,31,,23.0,30.0,7.0,1.0,27.0,5.0,36.0,4.540760141972363,8.9206229016451,2.986367045687234,13.0,22.0,97.0,107.0,COMPLETE
8337,0.5952371952371952,2024-04-11 18:49:58.700169,2024-04-11 18:50:00.264703,0 days 00:00:01.564534,98.16149991589087,7.53911047157279,sigmoid,8,,26.0,32.0,,,,,,,,,,,,,COMPLETE
8338,0.5929369437606513,2024-04-11 18:50:00.267744,2024-04-11 18:50:01.765397,0 days 00:00:01.497653,99.95426421375686,8.231065702309031,sigmoid,8,,24.0,33.0,,,,,,,,,,,,,COMPLETE
8339,0.5445990354658359,2024-04-11 18:50:01.769397,2024-04-11 18:50:03.699899,0 days 00:00:01.930502,96.64964746708498,8.77233402059813,sigmoid,2,,,,,,,,,8.26222433756015,8.528789550787428,7.357708196700486,5.0,33.0,94.0,,COMPLETE
8340,0.4830433797426924,2024-04-11 18:50:03.704433,2024-04-11 18:50:06.591412,0 days 00:00:02.886979,96.77096741231499,8.526155651787143,sigmoid,63,13.0,29.0,28.0,6.0,4.0,45.0,19.0,25.0,7.106756624972945,6.143297986704081,9.32252900773674,9.0,45.0,60.0,130.0,COMPLETE
8341,0.4695256907589424,2024-04-11 18:50:06.595926,2024-04-11 18:50:08.757244,0 days 00:00:02.161318,92.03183797371493,7.8794951269886475,sigmoid,28,,26.0,29.0,8.0,3.0,53.0,36.0,4.0,,,,,,,,COMPLETE
8342,0.45928900495183667,2024-04-11 18:50:08.761238,2024-04-11 18:50:10.363989,0 days 00:00:01.602751,80.35968602973013,8.090963000885486,sigmoid,16,,,,2.0,6.0,11.0,,,,,,,,,,COMPLETE
8343,0.4018210482288215,2024-04-11 18:50:10.366578,2024-04-11 18:50:12.886011,0 days 00:00:02.519433,99.99095162844105,8.37935230875658,sigmoid,46,26.0,27.0,31.0,,,,20.0,41.0,6.838157783823576,1.938685561336754,8.936534526147422,12.0,24.0,93.0,,COMPLETE
8344,0.5952371952371952,2024-04-11 18:50:12.889017,2024-04-11 18:50:14.429328,0 days 00:00:01.540311,95.25147062913442,7.665443384103962,sigmoid,8,,21.0,32.0,,,,,,,,,,,,,COMPLETE
8345,0.44701971028259324,2024-04-11 18:50:14.432317,2024-04-11 18:50:15.937210,0 days 00:00:01.504893,98.19238383903951,8.156798876480785,sigmoid,8,,25.0,30.0,,,,,,,,,,,,,COMPLETE
8346,0.2939372067845543,2024-04-11 18:50:15.941205,2024-04-11 18:50:17.971839,0 days 00:00:02.030634,98.17692424904494,7.908775233423173,rbf,41,19.0,20.0,31.0,,,,,,,,,,,,16.0,COMPLETE
8347,0.49878207809462877,2024-04-11 18:50:17.975426,2024-04-11 18:50:20.517145,0 days 00:00:02.541719,95.04494674651887,7.378005570937613,sigmoid,15,,23.0,34.0,,,,28.0,20.0,6.395419993606241,4.564072973842718,2.306233306584009,8.0,25.0,70.0,45.0,COMPLETE
8348,0.5084983846045793,2024-04-11 18:50:20.520142,2024-04-11 18:50:22.942599,0 days 00:00:02.422457,96.8036619307316,8.310216181191194,sigmoid,11,,24.0,30.0,,,,,,6.05634690638464,3.854336161612742,7.107624862379659,19.0,20.0,66.0,189.0,COMPLETE
8349,0.5011189811503587,2024-04-11 18:50:22.946160,2024-04-11 18:50:25.330852,0 days 00:00:02.384692,98.28624122881197,7.748447092245583,sigmoid,14,,27.0,32.0,,,,33.0,46.0,3.9383191361937726,0.8499101125848654,0.9137102929641054,18.0,40.0,72.0,,COMPLETE
8350,0.31429415893892937,2024-04-11 18:50:25.336379,2024-04-11 18:50:27.380312,0 days 00:00:02.043933,94.0820677769706,8.04204422263447,sigmoid,10,,26.0,31.0,,,,,,9.808604305314038,9.740376682706001,5.676806176843528,20.0,49.0,52.0,,COMPLETE
8351,0.12622036262203626,2024-04-11 18:50:27.383305,2024-04-11 18:50:29.012980,0 days 00:00:01.629675,98.20289968978666,8.468315918916362,sigmoid,8,,25.0,29.0,,,,,,,,,,,,,COMPLETE
8352,0.4728801045038905,2024-04-11 18:50:29.016546,2024-04-11 18:50:31.764855,0 days 00:00:02.748309,96.59204642923602,8.195284116246787,sigmoid,62,24.0,25.0,34.0,5.0,2.0,92.0,8.0,15.0,1.5664794296609843,3.4910887281001584,4.744342526382606,11.0,23.0,75.0,,COMPLETE
8353,0.34915355705590845,2024-04-11 18:50:31.768905,2024-04-11 18:50:33.959100,0 days 00:00:02.190195,99.98455569187014,7.903907296835699,sigmoid,26,,22.0,33.0,3.0,5.0,9.0,,,7.423927616797853,1.3866960726535766,3.248527499203179,6.0,38.0,55.0,,COMPLETE
8354,0.44701971028259324,2024-04-11 18:50:33.962099,2024-04-11 18:50:35.575502,0 days 00:00:01.613403,99.97160927256796,7.574554768296009,sigmoid,8,,23.0,30.0,,,,,,,,,,,,,COMPLETE
8355,0.5172686367505775,2024-04-11 18:50:35.578521,2024-04-11 18:50:37.281883,0 days 00:00:01.703362,96.74253330086603,8.62246717308511,sigmoid,37,30.0,,,,,,2.0,2.0,,,,,,,116.0,COMPLETE
8356,0.5998117115420825,2024-04-11 18:50:37.284528,2024-04-11 18:50:38.766042,0 days 00:00:01.481514,93.85497148724593,7.017337569314001,sigmoid,8,,26.0,32.0,,,,,,,,,,,,,COMPLETE
8357,0.4705218756131058,2024-04-11 18:50:38.769042,2024-04-11 18:50:40.512284,0 days 00:00:01.743242,98.20102360390194,8.021937673355378,sigmoid,56,43.0,28.0,31.0,4.0,7.0,71.0,,,,,,,,,,COMPLETE
8358,0.12622036262203626,2024-04-11 18:50:40.514940,2024-04-11 18:50:42.020655,0 days 00:00:01.505715,95.71931786482534,8.317006243040783,sigmoid,8,,27.0,29.0,,,,,,,,,,,,,COMPLETE
8359,0.4059110992100683,2024-04-11 18:50:42.023640,2024-04-11 18:50:43.878440,0 days 00:00:01.854800,98.28153676697046,7.78979435598548,sigmoid,52,39.0,,,6.0,8.0,79.0,46.0,32.0,,,,,,,,COMPLETE
8360,0.4603767586042445,2024-04-11 18:50:43.881430,2024-04-11 18:50:46.573107,0 days 00:00:02.691677,99.96330789338622,8.104017595022752,sigmoid,59,48.0,24.0,32.0,5.0,1.0,36.0,,,4.170931097717334,6.7722454936788585,1.2090136674610408,7.0,21.0,69.0,61.0,COMPLETE
8361,0.45634784203167617,2024-04-11 18:50:46.576720,2024-04-11 18:50:48.371151,0 days 00:00:01.794431,96.54461321837357,8.395353606856027,sigmoid,20,,,,7.0,4.0,23.0,10.0,35.0,,,,,,,,COMPLETE
8362,0.44701971028259324,2024-04-11 18:50:48.374776,2024-04-11 18:50:49.929318,0 days 00:00:01.554542,91.42756027118664,7.909220293735208,sigmoid,8,,24.0,30.0,,,,,,,,,,,,,COMPLETE
8363,0.3738921836476311,2024-04-11 18:50:49.932321,2024-04-11 18:50:52.343163,0 days 00:00:02.410842,98.1953885818454,8.176820916743184,sigmoid,55,32.0,,,1.0,3.0,18.0,22.0,49.0,2.2367476348408735,9.412817412455215,6.5999258163632915,3.0,43.0,57.0,184.0,COMPLETE
8364,0.2604543670692888,2024-04-11 18:50:52.346749,2024-04-11 18:50:53.951333,0 days 00:00:01.604584,95.26246014345003,7.6841427248301875,sigmoid,48,46.0,,,8.0,2.0,100.0,,,,,,,,,,COMPLETE
