number,value,datetime_start,datetime_complete,duration,params_C,params_gamma,params_kernel,params_mask_number,params_rsi_window,params_so_smooth,params_so_window,params_srsi_smooth1,params_srsi_smooth2,params_srsi_window,params_tsi_window_fast,params_tsi_window_slow,params_ult_weight_1,params_ult_weight_2,params_ult_weight_3,params_ult_window_1,params_ult_window_2,params_ult_window_3,params_williams_lbp,state
4664,0.3628109892701332,2024-04-11 17:09:58.679338,2024-04-11 17:10:00.124349,0 days 00:00:01.445011,99.99541957919998,8.019950103787746,rbf,26,,26.0,28.0,4.0,2.0,43.0,,,5.9029132018354815,4.191347334947983,7.486918235839273,8.0,34.0,79.0,,COMPLETE
4665,0.41362720630243255,2024-04-11 17:10:00.126371,2024-04-11 17:10:01.095749,0 days 00:00:00.969378,98.16737804475936,8.467861423807141,sigmoid,20,,,,1.0,3.0,69.0,24.0,41.0,,,,,,,,COMPLETE
4666,0.3689097379488839,2024-04-11 17:10:01.098764,2024-04-11 17:10:02.146377,0 days 00:00:01.047613,95.3573327852058,8.332902015576737,sigmoid,56,3.0,22.0,31.0,6.0,5.0,12.0,,,,,,,,,,COMPLETE
4667,0.445601233908762,2024-04-11 17:10:02.148380,2024-04-11 17:10:03.428189,0 days 00:00:01.279809,96.75941546922098,7.86321584079612,sigmoid,55,39.0,,,3.0,1.0,83.0,3.0,13.0,9.235285764830802,9.818751467579187,8.050381625729823,9.0,39.0,75.0,42.0,COMPLETE
4668,0.42493458218189817,2024-04-11 17:10:03.430174,2024-04-11 17:10:04.225733,0 days 00:00:00.795559,92.15977171399882,8.127534811703267,sigmoid,8,,24.0,21.0,,,,,,,,,,,,,COMPLETE
4669,0.5031301097874328,2024-04-11 17:10:04.228746,2024-04-11 17:10:05.252267,0 days 00:00:01.023521,98.17276208303666,8.018563092514215,sigmoid,44,16.0,23.0,32.0,,,,5.0,39.0,,,,,,,,COMPLETE
4670,0.4167936950669736,2024-04-11 17:10:05.255266,2024-04-11 17:10:06.595181,0 days 00:00:01.339915,99.98703715344614,7.552901762000236,sigmoid,59,47.0,27.0,29.0,8.0,7.0,17.0,,,0.5108249571073298,2.478764705684826,1.6017292608113483,2.0,27.0,59.0,179.0,COMPLETE
4671,0.5268989484135939,2024-04-11 17:10:06.597182,2024-04-11 17:10:07.566810,0 days 00:00:00.969628,94.2282100273752,8.286550486869873,sigmoid,13,,25.0,33.0,,,,19.0,28.0,,,,,,,163.0,COMPLETE
4672,0.5343300638034472,2024-04-11 17:10:07.568900,2024-04-11 17:10:08.474897,0 days 00:00:00.905997,96.7632033620329,7.710077088731264,sigmoid,12,,24.0,26.0,,,,23.0,44.0,,,,,,,,COMPLETE
4673,0.5034063943252278,2024-04-11 17:10:08.476891,2024-04-11 17:10:09.285610,0 days 00:00:00.808719,99.97353140650011,8.533952893829085,sigmoid,8,,26.0,36.0,,,,,,,,,,,,,COMPLETE
4674,0.40637629097440503,2024-04-11 17:10:09.287609,2024-04-11 17:10:10.497230,0 days 00:00:01.209621,96.8676971055583,7.878700255866936,sigmoid,54,22.0,,,2.0,6.0,27.0,12.0,50.0,2.0738868724081616,7.776276298384429,2.3135149626839304,14.0,20.0,57.0,,COMPLETE
4675,0.4373086107599382,2024-04-11 17:10:10.499236,2024-04-11 17:10:11.208695,0 days 00:00:00.709459,98.1705504122048,8.163327822206725,sigmoid,1,,,,,,,,,,,,,,,170.0,COMPLETE
4676,0.46409089766471434,2024-04-11 17:10:11.210674,2024-04-11 17:10:12.291410,0 days 00:00:01.080736,95.15944406458487,7.4076889670928985,sigmoid,60,24.0,28.0,30.0,3.0,4.0,46.0,40.0,42.0,,,,,,,,COMPLETE
4677,0.5292625241883466,2024-04-11 17:10:12.293415,2024-04-11 17:10:13.176396,0 days 00:00:00.882981,99.98664375864905,7.148249245282393,sigmoid,36,9.0,,,,,,16.0,9.0,,,,,,,,COMPLETE
4678,0.5952371952371952,2024-04-11 17:10:13.178397,2024-04-11 17:10:13.967581,0 days 00:00:00.789184,98.21086314338523,7.972634034257437,sigmoid,8,,23.0,32.0,,,,,,,,,,,,,COMPLETE
4679,0.5484848484848486,2024-04-11 17:10:13.969578,2024-04-11 17:10:14.865524,0 days 00:00:00.895946,99.95660177582178,3.4173490083205555,sigmoid,40,13.0,27.0,40.0,,,,,,,,,,,,,COMPLETE
4680,0.5790947100527176,2024-04-11 17:10:14.867528,2024-04-11 17:10:15.587519,0 days 00:00:00.719991,93.29150801539761,8.319690277060628,sigmoid,32,30.0,,,,,,,,,,,,,,,COMPLETE
4681,0.4598397498534298,2024-04-11 17:10:15.589521,2024-04-11 17:10:16.775698,0 days 00:00:01.186177,96.64280269125676,7.646568587463897,sigmoid,23,,,,5.0,5.0,64.0,35.0,27.0,3.790503738427506,8.465556332150532,0.7695484361241673,20.0,40.0,91.0,52.0,COMPLETE
4682,0.6009432182607054,2024-04-11 17:10:16.778245,2024-04-11 17:10:17.554126,0 days 00:00:00.775881,95.32688681088165,8.111464164653212,sigmoid,8,,37.0,31.0,,,,,,,,,,,,,COMPLETE
4683,0.18474100535850982,2024-04-11 17:10:17.556124,2024-04-11 17:10:18.978437,0 days 00:00:01.422313,98.18262215130643,5.799415899896701,rbf,61,45.0,25.0,34.0,7.0,8.0,52.0,37.0,35.0,,,,,,,159.0,COMPLETE
4684,0.5100986378581494,2024-04-11 17:10:18.981018,2024-04-11 17:10:20.109816,0 days 00:00:01.128798,98.31329290198424,8.640729402111619,sigmoid,7,,,,,,,10.0,4.0,5.245359338559857,8.976236428136918,8.948845189604182,10.0,45.0,100.0,112.0,COMPLETE
4685,0.44701971028259324,2024-04-11 17:10:20.112419,2024-04-11 17:10:20.910198,0 days 00:00:00.797779,99.92995333577649,7.818164173936007,sigmoid,8,,26.0,30.0,,,,,,,,,,,,,COMPLETE
4686,0.45472576294494105,2024-04-11 17:10:20.912196,2024-04-11 17:10:22.193917,0 days 00:00:01.281721,95.4710407352159,8.325354534848206,sigmoid,27,,24.0,32.0,4.0,2.0,86.0,,,2.6510280922328304,8.093048629289003,6.254379391014364,4.0,38.0,87.0,134.0,COMPLETE
4687,0.5477342379676567,2024-04-11 17:10:22.195460,2024-04-11 17:10:23.164900,0 days 00:00:00.969440,96.71728542256942,7.982160015500694,sigmoid,34,7.0,,,,,,,,2.3188587956169253,2.2064679744431777,9.666682484907975,14.0,36.0,97.0,,COMPLETE
4688,0.46296392963407634,2024-04-11 17:10:23.166909,2024-04-11 17:10:24.460922,0 days 00:00:01.294013,98.18115326916558,8.466997419120625,sigmoid,30,,25.0,28.0,1.0,4.0,96.0,48.0,24.0,8.459165034693942,6.882097337697143,7.010136356123152,3.0,50.0,98.0,,COMPLETE
4689,0.6009432182607054,2024-04-11 17:10:24.462961,2024-04-11 17:10:25.282018,0 days 00:00:00.819057,93.19611080857412,8.121771444960789,sigmoid,8,,26.0,31.0,,,,,,,,,,,,,COMPLETE
4690,0.12622036262203626,2024-04-11 17:10:25.283560,2024-04-11 17:10:26.087689,0 days 00:00:00.804129,98.19504734711974,7.796753140123332,sigmoid,8,,29.0,29.0,,,,,,,,,,,,,COMPLETE
4691,0.5648622616066269,2024-04-11 17:10:26.089685,2024-04-11 17:10:26.856941,0 days 00:00:00.767256,96.33746787606256,8.205375093647026,sigmoid,4,,,,,,,14.0,17.0,,,,,,,,COMPLETE
4692,0.4030044249034694,2024-04-11 17:10:26.858453,2024-04-11 17:10:27.893390,0 days 00:00:01.034937,98.29737728397515,7.596476137154502,sigmoid,53,19.0,,,6.0,1.0,20.0,45.0,48.0,,,,,,,76.0,COMPLETE
4693,0.25693119815463783,2024-04-11 17:10:27.894895,2024-04-11 17:10:28.730245,0 days 00:00:00.835350,99.9707728938082,7.975313858685382,sigmoid,5,,,,,,,43.0,37.0,,,,,,,10.0,COMPLETE
4694,0.42751440071340774,2024-04-11 17:10:28.731246,2024-04-11 17:10:29.512293,0 days 00:00:00.781047,91.02406337027445,8.368030983230822,sigmoid,8,,23.0,19.0,,,,,,,,,,,,,COMPLETE
4695,0.5057588768486336,2024-04-11 17:10:29.513295,2024-04-11 17:10:30.700912,0 days 00:00:01.187617,99.9610309051124,8.724220298836284,sigmoid,51,28.0,,,2.0,3.0,4.0,,,9.013734797516875,2.934448964855928,5.059281125024498,15.0,35.0,95.0,105.0,COMPLETE
4696,0.44701971028259324,2024-04-11 17:10:30.702913,2024-04-11 17:10:31.510993,0 days 00:00:00.808080,94.95675891397062,7.885614476683653,sigmoid,8,,28.0,30.0,,,,,,,,,,,,,COMPLETE
4697,0.4075212218943013,2024-04-11 17:10:31.512582,2024-04-11 17:10:32.499927,0 days 00:00:00.987345,65.08716477891554,8.148575857925366,sigmoid,45,18.0,27.0,33.0,,,,25.0,29.0,,,,,,,48.0,COMPLETE
4698,0.4772029122221415,2024-04-11 17:10:32.501925,2024-04-11 17:10:33.495250,0 days 00:00:00.993325,99.97223814905188,4.592225229347076,sigmoid,49,25.0,,,7.0,6.0,30.0,,,,,,,,,85.0,COMPLETE
4699,0.3675639085768894,2024-04-11 17:10:33.499175,2024-04-11 17:10:34.357870,0 days 00:00:00.858695,96.7145729274632,8.486859540638443,sigmoid,17,,,,8.0,7.0,91.0,,,,,,,,,154.0,COMPLETE
4700,0.5941143180531975,2024-04-11 17:10:34.359871,2024-04-11 17:10:35.181685,0 days 00:00:00.821814,94.02463130450374,7.395384111765605,sigmoid,8,,24.0,31.0,,,,,,,,,,,,,COMPLETE
4701,0.45768891502499265,2024-04-11 17:10:35.183688,2024-04-11 17:10:36.302957,0 days 00:00:01.119269,26.32010665112886,7.695370719252379,rbf,8,,25.0,32.0,,,,,,,,,,,,,COMPLETE
4702,0.3285697732802904,2024-04-11 17:10:36.304956,2024-04-11 17:10:37.099747,0 days 00:00:00.794791,97.03943216338452,8.045744965039171,sigmoid,33,11.0,,,,,,,,,,,,,,20.0,COMPLETE
4703,0.4837969533541489,2024-04-11 17:10:37.101762,2024-04-11 17:10:38.165617,0 days 00:00:01.063855,99.98222448211666,8.273772746562802,sigmoid,18,,,,5.0,8.0,73.0,,,1.8330961277008493,5.677474859095058,7.245317016336485,16.0,46.0,70.0,,COMPLETE
4704,0.45172203427430535,2024-04-11 17:10:38.167659,2024-04-11 17:10:39.408769,0 days 00:00:01.241110,96.53295687105454,7.836372126469567,sigmoid,58,36.0,26.0,30.0,6.0,6.0,49.0,,,3.383409289642797,9.362241217502064,3.0380402002769884,12.0,42.0,65.0,,COMPLETE
4705,0.5414380097703747,2024-04-11 17:10:39.410764,2024-04-11 17:10:40.424763,0 days 00:00:01.013999,98.07177190870443,8.956575292341162,sigmoid,6,,,,,,,18.0,32.0,6.459804002916899,4.534530346388765,3.42290474842756,17.0,30.0,52.0,,COMPLETE
4706,0.43240364965604583,2024-04-11 17:10:40.426761,2024-04-11 17:10:41.623126,0 days 00:00:01.196365,95.35271022405271,8.05950745999055,sigmoid,29,,21.0,32.0,4.0,2.0,40.0,2.0,2.0,,,,,,,30.0,COMPLETE
4707,0.3782654127481714,2024-04-11 17:10:41.625123,2024-04-11 17:10:42.740113,0 days 00:00:01.114990,96.77002540467498,8.337492136407548,sigmoid,19,,,,1.0,3.0,35.0,,,9.462088352166681,6.136320783169692,5.925145037317712,5.0,24.0,90.0,55.0,COMPLETE
4708,0.4404353855412229,2024-04-11 17:10:42.742113,2024-04-11 17:10:43.723332,0 days 00:00:00.981219,97.97756697152809,7.60112918752873,sigmoid,25,,22.0,31.0,3.0,1.0,54.0,,,,,,,,,128.0,COMPLETE
4709,0.4239234719792313,2024-04-11 17:10:43.725368,2024-04-11 17:10:44.835150,0 days 00:00:01.109782,93.36788942565457,7.922712220553336,sigmoid,50,14.0,,,8.0,5.0,66.0,,,5.3615337371804035,7.2766234872401565,1.8865338743564566,13.0,22.0,68.0,,COMPLETE
4710,0.44140360384771715,2024-04-11 17:10:44.837150,2024-04-11 17:10:46.132931,0 days 00:00:01.295781,98.20408705325296,8.571379062039147,sigmoid,47,21.0,24.0,34.0,,,,5.0,7.0,1.3760975243931997,6.551134188098437,7.694589520008206,6.0,31.0,54.0,61.0,COMPLETE
4711,0.36663989103482003,2024-04-11 17:10:46.134930,2024-04-11 17:10:47.290115,0 days 00:00:01.155185,98.11387844363456,8.221813735037808,sigmoid,43,42.0,27.0,29.0,,,,,,7.293775494759078,1.4383016184498087,5.443888169330015,9.0,29.0,67.0,197.0,COMPLETE
4712,0.5929369437606513,2024-04-11 17:10:47.292110,2024-04-11 17:10:48.087776,0 days 00:00:00.795666,95.36252237001817,7.757145020547209,sigmoid,8,,25.0,33.0,,,,,,,,,,,,,COMPLETE
4713,0.4142300860773329,2024-04-11 17:10:48.090402,2024-04-11 17:10:49.040991,0 days 00:00:00.950589,99.9568911426383,8.118779478353941,sigmoid,24,,26.0,31.0,2.0,8.0,78.0,,,,,,,,,,COMPLETE
4714,0.38004002493356515,2024-04-11 17:10:49.042993,2024-04-11 17:10:50.153533,0 days 00:00:01.110540,91.69519881707416,8.3961506655928,sigmoid,39,38.0,,,,,,28.0,18.0,5.746781991988733,0.5209815675513934,9.817990608400342,11.0,43.0,93.0,68.0,COMPLETE
4715,0.5761093428196967,2024-04-11 17:10:50.155533,2024-04-11 17:10:50.951108,0 days 00:00:00.795575,98.30008634726968,7.935629189084508,sigmoid,8,,24.0,43.0,,,,,,,,,,,,,COMPLETE
4716,0.4448906086490959,2024-04-11 17:10:50.953089,2024-04-11 17:10:51.751691,0 days 00:00:00.798602,96.5030172982026,7.3582779917034955,sigmoid,8,,28.0,15.0,,,,,,,,,,,,,COMPLETE
4717,0.44701971028259324,2024-04-11 17:10:51.753684,2024-04-11 17:10:52.553298,0 days 00:00:00.799614,99.97757723250382,8.111627254568779,sigmoid,8,,23.0,30.0,,,,,,,,,,,,,COMPLETE
4718,0.5120103562353167,2024-04-11 17:10:52.555300,2024-04-11 17:10:53.966834,0 days 00:00:01.411534,94.27436538963616,7.69440198550454,sigmoid,31,,25.0,32.0,4.0,4.0,25.0,30.0,45.0,4.678681092836065,3.665819856181079,8.387523763646103,2.0,41.0,72.0,182.0,COMPLETE
4719,0.4879511443661972,2024-04-11 17:10:53.968837,2024-04-11 17:10:55.169514,0 days 00:00:01.200677,47.051654551639174,8.50815798915383,sigmoid,22,,,,7.0,7.0,2.0,9.0,6.0,3.5560768573800674,3.938842269709328,9.304883478757791,18.0,23.0,100.0,,COMPLETE
4720,0.10693377732423867,2024-04-11 17:10:55.171038,2024-04-11 17:10:56.619040,0 days 00:00:01.448002,99.93784934211088,8.275562282524145,rbf,15,,27.0,27.0,,,,4.0,21.0,9.796052294454192,9.642532194851878,4.861981945388374,12.0,37.0,53.0,121.0,COMPLETE
4721,0.6009432182607054,2024-04-11 17:10:56.621033,2024-04-11 17:10:57.424669,0 days 00:00:00.803636,96.59338106797321,7.919355675582711,sigmoid,8,,26.0,31.0,,,,,,,,,,,,,COMPLETE
4722,0.5253144147049339,2024-04-11 17:10:57.427198,2024-04-11 17:10:58.439718,0 days 00:00:01.012520,97.94162069696091,8.727495127092544,sigmoid,35,34.0,,,,,,,,4.071118996972047,5.349773194058289,4.484540519327435,4.0,48.0,63.0,167.0,COMPLETE
4723,0.44701971028259324,2024-04-11 17:10:58.440736,2024-04-11 17:10:59.235808,0 days 00:00:00.795072,95.02314003891749,7.531065249812715,sigmoid,8,,24.0,30.0,,,,,,,,,,,,,COMPLETE
4724,0.4689348389304394,2024-04-11 17:10:59.237824,2024-04-11 17:11:00.224942,0 days 00:00:00.987118,99.99309419012907,8.134170431095681,sigmoid,21,,,,5.0,1.0,22.0,6.0,15.0,,,,,,,186.0,COMPLETE
4725,0.4230975771551316,2024-04-11 17:11:00.226486,2024-04-11 17:11:01.300205,0 days 00:00:01.073719,98.22378725169402,7.830831545066291,sigmoid,57,5.0,25.0,32.0,3.0,4.0,9.0,,,,,,,,,138.0,COMPLETE
4726,0.12622036262203626,2024-04-11 17:11:01.302216,2024-04-11 17:11:02.093831,0 days 00:00:00.791615,69.7596027641105,8.405844333009565,sigmoid,8,,22.0,29.0,,,,,,,,,,,,,COMPLETE
4727,0.5929369437606513,2024-04-11 17:11:02.095831,2024-04-11 17:11:02.904612,0 days 00:00:00.808781,99.94733999622052,7.981097952440595,sigmoid,8,,26.0,33.0,,,,,,,,,,,,,COMPLETE
4728,0.32652234739709884,2024-04-11 17:11:02.906606,2024-04-11 17:11:03.809306,0 days 00:00:00.902700,36.987817636822186,8.241653982170641,sigmoid,2,,,,,,,,,7.7678029111163935,1.895480047710378,1.4419347887621492,18.0,28.0,94.0,,COMPLETE
4729,0.30902275173514454,2024-04-11 17:11:03.811305,2024-04-11 17:11:04.873920,0 days 00:00:01.062615,95.4618336480454,7.732756449471703,sigmoid,38,50.0,,,,,,11.0,38.0,3.217214467208534,9.113979352460547,6.42475022421111,7.0,39.0,82.0,,COMPLETE
4730,0.48158092059115204,2024-04-11 17:11:04.875921,2024-04-11 17:11:06.008554,0 days 00:00:01.132633,96.7654403327385,8.008910868183428,sigmoid,14,,23.0,24.0,,,,46.0,12.0,4.918699185734936,4.752206872177408,2.6686997035519426,20.0,49.0,78.0,,COMPLETE
4731,0.3436572920374985,2024-04-11 17:11:06.009555,2024-04-11 17:11:06.947085,0 days 00:00:00.937530,93.72558210066185,7.147923826841598,sigmoid,3,,,,,,,,,8.75636099066186,3.5463513445457044,4.24800645745014,19.0,36.0,75.0,94.0,COMPLETE
4732,0.3883163929237154,2024-04-11 17:11:06.949081,2024-04-11 17:11:07.984912,0 days 00:00:01.035831,98.14462143025133,8.209384854807679,sigmoid,28,,27.0,31.0,1.0,3.0,100.0,41.0,43.0,,,,,,,,COMPLETE
4733,0.5073185923388353,2024-04-11 17:11:07.986913,2024-04-11 17:11:09.178355,0 days 00:00:01.191442,98.0965487371577,7.49327460593943,sigmoid,46,32.0,25.0,9.0,,,,16.0,20.0,6.8434952107964655,7.085928226426672,8.67255525268649,7.0,38.0,73.0,,COMPLETE
4734,0.4512950859356088,2024-04-11 17:11:09.180880,2024-04-11 17:11:09.983422,0 days 00:00:00.802542,96.56437778352544,8.628269239310018,sigmoid,8,,29.0,28.0,,,,,,,,,,,,,COMPLETE
4735,0.4975188518608611,2024-04-11 17:11:09.985464,2024-04-11 17:11:10.882074,0 days 00:00:00.896610,99.96234144075605,7.8591904069879295,sigmoid,9,,24.0,30.0,,,,,,,,,,,,38.0,COMPLETE
4736,0.506798173700275,2024-04-11 17:11:10.884072,2024-04-11 17:11:11.920168,0 days 00:00:01.036096,99.95838295164745,8.432314744175294,sigmoid,10,,26.0,32.0,,,,,,2.8546722723599673,8.750050866194858,1.19670119336147,8.0,21.0,85.0,,COMPLETE
4737,0.5216843053366359,2024-04-11 17:11:11.922157,2024-04-11 17:11:12.824439,0 days 00:00:00.902282,91.7719347701743,8.064633458770768,sigmoid,41,43.0,28.0,30.0,,,,,,,,,,,,27.0,COMPLETE
4738,0.4193750391383305,2024-04-11 17:11:12.825443,2024-04-11 17:11:13.638898,0 days 00:00:00.813455,99.98508593571053,7.728649903935784,sigmoid,16,,,,6.0,5.0,56.0,,,,,,,,,,COMPLETE
4739,0.275599543205177,2024-04-11 17:11:13.641438,2024-04-11 17:11:14.950981,0 days 00:00:01.309543,96.70644329981636,8.263979189590634,rbf,42,9.0,24.0,33.0,,,,,,6.1846724737892504,3.1560835054545513,6.7983405055036705,5.0,33.0,71.0,,COMPLETE
4740,0.12622036262203626,2024-04-11 17:11:14.952568,2024-04-11 17:11:15.724468,0 days 00:00:00.771900,94.83090209966619,8.057453448962532,sigmoid,8,,25.0,29.0,,,,,,,,,,,,,COMPLETE
4741,0.3941294312342131,2024-04-11 17:11:15.726480,2024-04-11 17:11:16.932982,0 days 00:00:01.206502,98.3182158038485,8.405239688478053,sigmoid,26,,44.0,31.0,8.0,2.0,43.0,,,8.225678933645135,0.6985827872294381,6.0996236453976636,10.0,26.0,56.0,,COMPLETE
4742,0.5069140556625241,2024-04-11 17:11:16.934979,2024-04-11 17:11:17.723375,0 days 00:00:00.788396,98.21188573760934,7.889086294605865,sigmoid,8,,27.0,35.0,,,,,,,,,,,,,COMPLETE
4743,0.5371493231991119,2024-04-11 17:11:17.724373,2024-04-11 17:11:18.868571,0 days 00:00:01.144198,51.689045139552945,7.53809318919425,sigmoid,11,,26.0,31.0,,,,,,1.7593859966171705,2.6989932084877957,3.644490338390285,3.0,44.0,92.0,116.0,COMPLETE
4744,0.4386479591836734,2024-04-11 17:11:18.870578,2024-04-11 17:11:20.335436,0 days 00:00:01.464858,99.95693489988,8.197686383210506,sigmoid,63,23.0,23.0,32.0,5.0,7.0,32.0,21.0,47.0,0.7449887405142439,1.2107549505172832,2.069486546741086,15.0,27.0,66.0,101.0,COMPLETE
4745,0.39269571506056766,2024-04-11 17:11:20.337376,2024-04-11 17:11:21.691388,0 days 00:00:01.354012,96.52630452001691,8.558116606767689,sigmoid,62,31.0,25.0,30.0,2.0,6.0,15.0,19.0,10.0,7.97651133669002,3.314968953145165,3.970362460573933,17.0,31.0,58.0,,COMPLETE
4746,0.3512950808102195,2024-04-11 17:11:21.693404,2024-04-11 17:11:22.592089,0 days 00:00:00.898685,94.19723945613289,7.995810109432581,sigmoid,20,,,,7.0,8.0,59.0,49.0,49.0,,,,,,,,COMPLETE
4747,0.5360013537524326,2024-04-11 17:11:22.594086,2024-04-11 17:11:23.458309,0 days 00:00:00.864223,98.22953959686578,8.795513574756374,sigmoid,37,26.0,,,,,,27.0,30.0,,,,,,,148.0,COMPLETE
4748,0.5952371952371952,2024-04-11 17:11:23.460307,2024-04-11 17:11:24.256569,0 days 00:00:00.796262,99.98167191281222,7.797783917614771,sigmoid,8,,24.0,32.0,,,,,,,,,,,,,COMPLETE
4749,0.5975614331269932,2024-04-11 17:11:24.258485,2024-04-11 17:11:25.060745,0 days 00:00:00.802260,96.61471286722471,5.303681069185757,sigmoid,8,,26.0,31.0,,,,,,,,,,,,,COMPLETE
4750,0.4711823814234393,2024-04-11 17:11:25.061725,2024-04-11 17:11:26.065106,0 days 00:00:01.003381,95.29241722326357,8.281490835197557,sigmoid,56,46.0,29.0,34.0,4.0,3.0,94.0,,,,,,,,,,COMPLETE
4751,0.12622036262203626,2024-04-11 17:11:26.066698,2024-04-11 17:11:26.873561,0 days 00:00:00.806863,93.06226756929297,7.655333286925943,sigmoid,8,,27.0,29.0,,,,,,,,,,,,,COMPLETE
4752,0.5929369437606513,2024-04-11 17:11:26.875561,2024-04-11 17:11:27.715211,0 days 00:00:00.839650,98.23397646207293,7.338154384544319,sigmoid,8,,22.0,33.0,,,,,,,,,,,,,COMPLETE
4753,0.47980252438045673,2024-04-11 17:11:27.717219,2024-04-11 17:11:29.018031,0 days 00:00:01.300812,96.72052998081314,3.9323240160228723,sigmoid,55,3.0,,,1.0,2.0,61.0,29.0,36.0,4.289140588180505,6.418193056179566,7.878526894162887,6.0,46.0,83.0,16.0,COMPLETE
4754,0.4538538253312438,2024-04-11 17:11:29.020028,2024-04-11 17:11:30.385275,0 days 00:00:01.365247,89.63386768575222,8.117200400056882,sigmoid,59,20.0,25.0,30.0,3.0,6.0,76.0,,,5.4446337351535306,7.9414059777926616,5.112638220450935,14.0,42.0,55.0,110.0,COMPLETE
4755,0.5952371952371952,2024-04-11 17:11:30.387276,2024-04-11 17:11:31.195084,0 days 00:00:00.807808,98.30117283877634,7.990220577485847,sigmoid,8,,23.0,32.0,,,,,,,,,,,,,COMPLETE
4756,0.5407567317515083,2024-04-11 17:11:31.196646,2024-04-11 17:11:32.201737,0 days 00:00:01.005091,99.98028480318249,8.44425013427029,sigmoid,44,39.0,26.0,28.0,,,,47.0,44.0,,,,,,,,COMPLETE
4757,0.39283130549161455,2024-04-11 17:11:32.202717,2024-04-11 17:11:33.420269,0 days 00:00:01.217552,95.09639014719632,7.822047564705005,rbf,12,,24.0,31.0,,,,7.0,26.0,,,,,,,,COMPLETE
4758,0.5929369437606513,2024-04-11 17:11:33.422308,2024-04-11 17:11:34.205524,0 days 00:00:00.783216,99.99498953220755,8.16859501321826,sigmoid,8,,28.0,33.0,,,,,,,,,,,,,COMPLETE
4759,0.4946604505890728,2024-04-11 17:11:34.207536,2024-04-11 17:11:35.195023,0 days 00:00:00.987487,96.97196384042225,7.693270992832108,sigmoid,13,,25.0,30.0,,,,34.0,39.0,,,,,,,74.0,COMPLETE
4760,0.37293956043956045,2024-04-11 17:11:35.196045,2024-04-11 17:11:35.909004,0 days 00:00:00.712959,98.12373312217304,8.34661042170184,sigmoid,1,,,,,,,,,,,,,,,142.0,COMPLETE
4761,0.47378551081684506,2024-04-11 17:11:35.910958,2024-04-11 17:11:36.882465,0 days 00:00:00.971507,95.3595962640251,7.979177654084969,sigmoid,52,41.0,,,5.0,5.0,7.0,39.0,16.0,,,,,,,,COMPLETE
4762,0.5963245096172158,2024-04-11 17:11:36.884110,2024-04-11 17:11:37.686668,0 days 00:00:00.802558,98.26069756597518,8.59489363784436,sigmoid,8,,27.0,31.0,,,,,,,,,,,,,COMPLETE
4763,0.4592966627364536,2024-04-11 17:11:37.688620,2024-04-11 17:11:39.046730,0 days 00:00:01.358110,96.83964955410181,8.177548227316636,sigmoid,23,,,,6.0,4.0,70.0,32.0,22.0,1.1266286921426572,5.066621685479694,9.54393320937944,16.0,25.0,61.0,174.0,COMPLETE
4764,0.46583068667177746,2024-04-11 17:11:39.049264,2024-04-11 17:11:40.030489,0 days 00:00:00.981225,92.5668840855086,7.539035403692746,sigmoid,48,40.0,,,2.0,1.0,38.0,,,,,,,,,,COMPLETE
4765,0.4282249955639676,2024-04-11 17:11:40.032489,2024-04-11 17:11:41.303270,0 days 00:00:01.270781,98.12887135542474,7.9078888500509485,sigmoid,61,15.0,25.0,29.0,4.0,5.0,84.0,44.0,41.0,,,,,,,88.0,COMPLETE
4766,0.5243519930298408,2024-04-11 17:11:41.305200,2024-04-11 17:11:42.198055,0 days 00:00:00.892855,95.36877140146254,8.305061985870017,sigmoid,40,17.0,23.0,32.0,,,,,,,,,,,,,COMPLETE
