number,value,datetime_start,datetime_complete,duration,params_C,params_gamma,params_kernel,params_mask_number,params_rsi_window,params_so_smooth,params_so_window,params_srsi_smooth1,params_srsi_smooth2,params_srsi_window,params_tsi_window_fast,params_tsi_window_slow,params_ult_weight_1,params_ult_weight_2,params_ult_weight_3,params_ult_window_1,params_ult_window_2,params_ult_window_3,params_williams_lbp,state
3228,0.393465682043413,2024-04-11 16:43:09.146175,2024-04-11 16:43:10.191688,0 days 00:00:01.045513,98.17929570993456,8.943883380689163,sigmoid,43,6.0,27.0,34.0,,,,,,1.3197410356519579,6.41807096715771,4.671059953297805,3.0,28.0,57.0,92.0,COMPLETE
3229,0.4124768551488392,2024-04-11 16:43:10.199970,2024-04-11 16:43:11.129328,0 days 00:00:00.929358,95.29460835996358,7.82843868001234,sigmoid,25,,25.0,36.0,3.0,6.0,34.0,,,,,,,,,47.0,COMPLETE
3230,0.4461302514104179,2024-04-11 16:43:11.129328,2024-04-11 16:43:12.366449,0 days 00:00:01.237121,92.44212188083758,8.174931047860346,sigmoid,31,,22.0,32.0,8.0,8.0,94.0,11.0,17.0,4.960979707225542,7.942515777883015,6.030526452830089,5.0,50.0,60.0,32.0,COMPLETE
3231,0.44701971028259324,2024-04-11 16:43:12.374985,2024-04-11 16:43:13.118174,0 days 00:00:00.743189,99.9746033453172,7.878651761493597,sigmoid,8,,24.0,30.0,,,,,,,,,,,,,COMPLETE
3232,0.37314371571333727,2024-04-11 16:43:13.118174,2024-04-11 16:43:14.215402,0 days 00:00:01.097228,96.94006082201835,8.459257778132168,sigmoid,39,8.0,,,,,,49.0,3.0,3.3734331650059923,5.776130677845185,7.508124666778771,10.0,24.0,85.0,105.0,COMPLETE
3233,0.4982513143347097,2024-04-11 16:43:14.215402,2024-04-11 16:43:15.185858,0 days 00:00:00.970456,98.30634931555579,7.624350226614683,sigmoid,35,41.0,,,,,,,,4.69062173151562,9.05011376773963,4.456862146211213,4.0,30.0,90.0,110.0,COMPLETE
3234,0.5371038820116483,2024-04-11 16:43:15.185858,2024-04-11 16:43:16.318530,0 days 00:00:01.132672,98.1774565374097,7.289470568515358,sigmoid,15,,26.0,28.0,,,,9.0,31.0,0.9547935670093128,1.3802760361413,6.770138347749535,8.0,41.0,83.0,137.0,COMPLETE
3235,0.4098158692105351,2024-04-11 16:43:16.318530,2024-04-11 16:43:17.275387,0 days 00:00:00.956857,95.18154810793698,8.107567370530738,sigmoid,57,47.0,27.0,31.0,5.0,5.0,100.0,,,,,,,,,151.0,COMPLETE
3236,0.5952371952371952,2024-04-11 16:43:17.275387,2024-04-11 16:43:18.034299,0 days 00:00:00.758912,99.99442972417692,8.00323924059698,sigmoid,8,,25.0,32.0,,,,,,,,,,,,,COMPLETE
3237,0.5964426137427449,2024-04-11 16:43:18.034299,2024-04-11 16:43:18.786626,0 days 00:00:00.752327,96.57722268610999,4.769255912246742,sigmoid,8,,28.0,31.0,,,,,,,,,,,,,COMPLETE
3238,0.3445390223754624,2024-04-11 16:43:18.792156,2024-04-11 16:43:19.816376,0 days 00:00:01.024220,98.26580936000266,8.365354743162078,sigmoid,42,25.0,24.0,27.0,,,,,,1.883641731002685,8.27374565641849,2.7235192919537705,16.0,23.0,82.0,,COMPLETE
3239,0.5940618478467085,2024-04-11 16:43:19.824520,2024-04-11 16:43:20.559324,0 days 00:00:00.734804,96.73790755570164,8.727110577837955,sigmoid,8,,26.0,33.0,,,,,,,,,,,,,COMPLETE
3240,0.5069672992087388,2024-04-11 16:43:20.559324,2024-04-11 16:43:21.651933,0 days 00:00:01.092609,93.64471614783304,7.782818371907529,sigmoid,14,,23.0,29.0,,,,44.0,22.0,2.9962110030305706,1.7639625802964805,3.8575931574260185,13.0,45.0,78.0,,COMPLETE
3241,0.39887221700100467,2024-04-11 16:43:21.651933,2024-04-11 16:43:22.635094,0 days 00:00:00.983161,97.99696030799313,8.212824825109479,sigmoid,28,,25.0,30.0,1.0,7.0,70.0,34.0,43.0,,,,,,,,COMPLETE
3242,0.44282183212267956,2024-04-11 16:43:22.643595,2024-04-11 16:43:23.440671,0 days 00:00:00.797076,95.15272370116088,8.01929905357574,sigmoid,16,,,,4.0,4.0,25.0,,,,,,,,,,COMPLETE
3243,0.3843664677924967,2024-04-11 16:43:23.448872,2024-04-11 16:43:24.740281,0 days 00:00:01.291409,99.98315676218523,7.686066970218601,rbf,9,,27.0,32.0,,,,,,,,,,,,51.0,COMPLETE
3244,0.5963245096172158,2024-04-11 16:43:24.740281,2024-04-11 16:43:25.489750,0 days 00:00:00.749469,99.99399200778304,8.411036634890879,sigmoid,8,,24.0,31.0,,,,,,,,,,,,,COMPLETE
3245,0.2350363186300369,2024-04-11 16:43:25.489947,2024-04-11 16:43:26.382966,0 days 00:00:00.893019,96.5673247924735,7.910800810499736,sigmoid,2,,,,,,,,,4.408390178704639,4.473930387161403,6.520915269232744,14.0,44.0,73.0,,COMPLETE
3246,0.433597843988621,2024-04-11 16:43:26.391614,2024-04-11 16:43:27.626618,0 days 00:00:01.235004,91.84491912403034,8.194439611242284,sigmoid,62,2.0,26.0,30.0,2.0,1.0,85.0,41.0,29.0,6.6777182231690775,2.8630903470740714,8.117025453808095,6.0,34.0,65.0,,COMPLETE
3247,0.48304483020346206,2024-04-11 16:43:27.635136,2024-04-11 16:43:28.980855,0 days 00:00:01.345719,99.97972823878679,8.585502369991287,sigmoid,63,43.0,25.0,32.0,7.0,5.0,6.0,37.0,49.0,9.748346913730582,3.9038073765842185,7.175084561981011,9.0,49.0,75.0,19.0,COMPLETE
3248,0.2898002256104218,2024-04-11 16:43:28.980855,2024-04-11 16:43:30.114339,0 days 00:00:01.133484,98.1225582250674,7.417478951474634,sigmoid,46,28.0,30.0,29.0,,,,8.0,4.0,0.5028403915618664,6.027830001008157,9.349047909251302,8.0,22.0,97.0,,COMPLETE
3249,0.3020442219440968,2024-04-11 16:43:30.114339,2024-04-11 16:43:31.096909,0 days 00:00:00.982570,94.93230670704042,8.04910389024574,sigmoid,10,,21.0,34.0,,,,,,8.669988954320155,6.693468635928294,5.381801845574725,18.0,38.0,50.0,,COMPLETE
3250,0.6009432182607054,2024-04-11 16:43:31.096909,2024-04-11 16:43:31.839912,0 days 00:00:00.743003,99.95705748601588,7.759968466104363,sigmoid,8,,28.0,31.0,,,,,,,,,,,,,COMPLETE
3251,0.4200359535871874,2024-04-11 16:43:31.839912,2024-04-11 16:43:32.976653,0 days 00:00:01.136741,96.88498151463907,8.367726714024952,sigmoid,26,,23.0,35.0,6.0,3.0,80.0,,,7.199102853059589,1.1034403294579676,1.978641408992302,2.0,33.0,72.0,,COMPLETE
3252,0.3602246072926292,2024-04-11 16:43:32.985351,2024-04-11 16:43:33.806519,0 days 00:00:00.821168,98.14583595782177,8.172638893430001,sigmoid,41,14.0,26.0,30.0,,,,,,,,,,,,131.0,COMPLETE
3253,0.5952371952371952,2024-04-11 16:43:33.806519,2024-04-11 16:43:34.564763,0 days 00:00:00.758244,98.11694594650854,7.918325145488702,sigmoid,8,,24.0,32.0,,,,,,,,,,,,,COMPLETE
3254,0.5929369437606513,2024-04-11 16:43:34.564763,2024-04-11 16:43:35.330317,0 days 00:00:00.765554,93.97741841659719,7.5162553257078075,sigmoid,8,,25.0,33.0,,,,,,,,,,,,,COMPLETE
3255,0.5986580986580987,2024-04-11 16:43:35.330317,2024-04-11 16:43:36.105048,0 days 00:00:00.774731,96.6341389542289,8.19657610443175,sigmoid,8,,20.0,31.0,,,,,,,,,,,,,COMPLETE
3256,0.4995110715139399,2024-04-11 16:43:36.105048,2024-04-11 16:43:37.013842,0 days 00:00:00.908794,98.25225263542167,8.567232171519702,sigmoid,20,,,,8.0,6.0,53.0,23.0,38.0,,,,,,,,COMPLETE
3257,0.5356301976455341,2024-04-11 16:43:37.022603,2024-04-11 16:43:37.871363,0 days 00:00:00.848760,56.07585033138507,7.74380861812535,sigmoid,37,48.0,,,,,,30.0,35.0,,,,,,,158.0,COMPLETE
3258,0.12622036262203626,2024-04-11 16:43:37.871363,2024-04-11 16:43:38.647260,0 days 00:00:00.775897,95.64546830657355,7.997704581816626,sigmoid,8,,22.0,29.0,,,,,,,,,,,,,COMPLETE
3259,0.5098120700004617,2024-04-11 16:43:38.647260,2024-04-11 16:43:39.661165,0 days 00:00:01.013905,96.82142697597105,7.1264739310568554,sigmoid,11,,29.0,33.0,,,,,,7.995421624995123,4.805067171387429,1.0740701190058788,11.0,32.0,59.0,192.0,COMPLETE
3260,0.28531334102268363,2024-04-11 16:43:39.669997,2024-04-11 16:43:41.030904,0 days 00:00:01.360907,99.94276599906937,7.903473422954448,rbf,56,19.0,27.0,28.0,3.0,2.0,22.0,,,,,,,,,,COMPLETE
3261,0.45345352376492626,2024-04-11 16:43:41.030904,2024-04-11 16:43:41.831107,0 days 00:00:00.800203,98.00812399724592,8.369053448814249,sigmoid,8,,26.0,30.0,,,,,,,,,,,,,COMPLETE
3262,0.4865938667237646,2024-04-11 16:43:41.831107,2024-04-11 16:43:43.078318,0 days 00:00:01.247211,94.07240387028146,7.63112796902659,sigmoid,55,27.0,,,2.0,8.0,50.0,7.0,24.0,2.253478676145485,3.0766681587750773,3.996755442565054,10.0,46.0,94.0,180.0,COMPLETE
3263,0.6009158557527189,2024-04-11 16:43:43.080410,2024-04-11 16:43:43.873824,0 days 00:00:00.793414,99.96039784604831,8.808623343185356,sigmoid,8,,24.0,31.0,,,,,,,,,,,,,COMPLETE
3264,0.49741767353707644,2024-04-11 16:43:43.873987,2024-04-11 16:43:44.803729,0 days 00:00:00.929742,95.4762689659516,8.125164194018058,sigmoid,44,13.0,25.0,32.0,,,,36.0,5.0,,,,,,,,COMPLETE
3265,0.2925040401110512,2024-04-11 16:43:44.803729,2024-04-11 16:43:45.639528,0 days 00:00:00.835799,98.11637219529999,8.324723398721774,sigmoid,48,34.0,,,4.0,5.0,90.0,,,,,,,,,,COMPLETE
3266,0.4494904804041903,2024-04-11 16:43:45.639528,2024-04-11 16:43:46.890227,0 days 00:00:01.250699,99.96622372149899,7.855288722780008,sigmoid,59,22.0,27.0,31.0,6.0,4.0,98.0,,,1.6215642097100393,5.5528907294779835,1.7425248783397436,3.0,39.0,88.0,84.0,COMPLETE
3267,0.3548633046509095,2024-04-11 16:43:46.898558,2024-04-11 16:43:47.779632,0 days 00:00:00.881074,0.9380607629599922,6.822748395485058,sigmoid,12,,23.0,30.0,,,,38.0,45.0,,,,,,,,COMPLETE
3268,0.5929369437606513,2024-04-11 16:43:47.779632,2024-04-11 16:43:48.553850,0 days 00:00:00.774218,91.72433904640036,8.110555708949963,sigmoid,8,,26.0,33.0,,,,,,,,,,,,,COMPLETE
3269,0.3880765909293945,2024-04-11 16:43:48.553850,2024-04-11 16:43:49.493720,0 days 00:00:00.939870,99.96318752789928,8.564948276229174,sigmoid,13,,24.0,26.0,,,,50.0,15.0,,,,,,,100.0,COMPLETE
3270,0.49115097375309175,2024-04-11 16:43:49.494160,2024-04-11 16:43:50.541514,0 days 00:00:01.047354,96.71764352093665,8.32913399447148,sigmoid,60,24.0,28.0,32.0,5.0,7.0,43.0,17.0,9.0,,,,,,,,COMPLETE
3271,0.44701971028259324,2024-04-11 16:43:50.542993,2024-04-11 16:43:51.341245,0 days 00:00:00.798252,98.1192222093193,8.015530810877946,sigmoid,8,,25.0,30.0,,,,,,,,,,,,,COMPLETE
3272,0.12622036262203626,2024-04-11 16:43:51.341245,2024-04-11 16:43:52.100269,0 days 00:00:00.759024,3.9680082237657928,7.652075682253388,sigmoid,8,,27.0,29.0,,,,,,,,,,,,,COMPLETE
3273,0.4585064342891883,2024-04-11 16:43:52.100269,2024-04-11 16:43:53.047569,0 days 00:00:00.947300,95.38050469284765,7.81661255466137,sigmoid,52,17.0,,,7.0,6.0,72.0,4.0,14.0,,,,,,,,COMPLETE
3274,0.5407289384584745,2024-04-11 16:43:53.047569,2024-04-11 16:43:53.880228,0 days 00:00:00.832659,96.64876797299883,8.263512026895132,sigmoid,36,32.0,,,,,,18.0,20.0,,,,,,,,COMPLETE
3275,0.5151426694884332,2024-04-11 16:43:53.881045,2024-04-11 16:43:55.027128,0 days 00:00:01.146083,99.98935515085476,7.393284898689968,sigmoid,61,9.0,23.0,31.0,1.0,1.0,2.0,3.0,6.0,,,,,,,117.0,COMPLETE
3276,0.5952371952371952,2024-04-11 16:43:55.027128,2024-04-11 16:43:55.801812,0 days 00:00:00.774684,94.15102885829216,8.090302965039278,sigmoid,8,,26.0,32.0,,,,,,,,,,,,,COMPLETE
3277,0.5428480025592833,2024-04-11 16:43:55.802731,2024-04-11 16:43:56.592766,0 days 00:00:00.790035,96.80781712147784,2.774317198905313,sigmoid,1,,,,,,,,,,,,,,,163.0,COMPLETE
3278,0.47426169550739666,2024-04-11 16:43:56.600715,2024-04-11 16:43:57.815646,0 days 00:00:01.214931,98.18721450910108,8.481773286845943,sigmoid,23,,,,3.0,3.0,58.0,31.0,18.0,6.154401287903239,3.458702813135443,8.52143480060184,15.0,43.0,62.0,95.0,COMPLETE
3279,0.5342340469756807,2024-04-11 16:43:57.815646,2024-04-11 16:43:58.698653,0 days 00:00:00.883007,99.98787122866713,7.915796166919294,sigmoid,40,31.0,25.0,34.0,,,,,,,,,,,,,COMPLETE
3280,0.5007851641366934,2024-04-11 16:43:58.698653,2024-04-11 16:43:59.942026,0 days 00:00:01.243373,93.37571564580881,7.5877891208131425,sigmoid,30,,24.0,30.0,8.0,2.0,65.0,22.0,50.0,3.579827550587704,9.848930350767166,9.779710263488846,19.0,50.0,86.0,,COMPLETE
3281,0.473906575423981,2024-04-11 16:43:59.942026,2024-04-11 16:44:01.680575,0 days 00:00:01.738549,98.17111471072356,8.170170727564916,rbf,8,,26.0,31.0,,,,,,,,,,,,,COMPLETE
3282,0.49698176482917633,2024-04-11 16:44:01.680575,2024-04-11 16:44:02.397326,0 days 00:00:00.716751,96.65077597557435,7.967658021593781,sigmoid,32,42.0,,,,,,,,,,,,,,,COMPLETE
3283,0.12622036262203626,2024-04-11 16:44:02.397326,2024-04-11 16:44:03.187857,0 days 00:00:00.790531,95.18737053786174,9.278047329068087,sigmoid,8,,28.0,29.0,,,,,,,,,,,,,COMPLETE
3284,0.528671448820927,2024-04-11 16:44:03.195904,2024-04-11 16:44:04.293311,0 days 00:00:01.097407,96.9214904651418,8.697664102219331,sigmoid,7,,,,,,,48.0,42.0,3.8859148256502642,6.217404922417735,3.5076232395971574,12.0,42.0,66.0,55.0,COMPLETE
3285,0.5963643249384587,2024-04-11 16:44:04.293311,2024-04-11 16:44:05.117588,0 days 00:00:00.824277,98.17761413598663,8.32629565236691,sigmoid,8,,22.0,32.0,,,,,,,,,,,,,COMPLETE
3286,0.49053843386497187,2024-04-11 16:44:05.117588,2024-04-11 16:44:06.379423,0 days 00:00:01.261835,98.32467041240912,7.797109625876493,sigmoid,27,,25.0,31.0,5.0,4.0,39.0,,,5.544539259499089,8.805402822920422,7.009551228457551,13.0,40.0,81.0,170.0,COMPLETE
3287,0.48915377747749916,2024-04-11 16:44:06.379423,2024-04-11 16:44:07.585385,0 days 00:00:01.205962,92.01132194179063,8.080775453908451,sigmoid,54,23.0,,,4.0,8.0,18.0,28.0,32.0,2.467682731245019,2.07464818254028,1.465595825535714,14.0,34.0,77.0,,COMPLETE
3288,0.29741609497596844,2024-04-11 16:44:07.585385,2024-04-11 16:44:08.557925,0 days 00:00:00.972540,98.19475452339292,8.244952196664109,sigmoid,34,18.0,,,,,,,,9.48246174065067,0.6899980588869967,7.699624926733493,17.0,30.0,70.0,,COMPLETE
3289,0.5262838615207615,2024-04-11 16:44:08.557925,2024-04-11 16:44:09.336464,0 days 00:00:00.778539,95.35285587114656,8.51379551655924,sigmoid,4,,,,,,,42.0,25.0,,,,,,,,COMPLETE
3290,0.5929369437606513,2024-04-11 16:44:09.336464,2024-04-11 16:44:10.117421,0 days 00:00:00.780957,98.14583047175647,7.699638782027048,sigmoid,8,,27.0,33.0,,,,,,,,,,,,,COMPLETE
3291,0.34332822645363675,2024-04-11 16:44:10.125444,2024-04-11 16:44:11.162101,0 days 00:00:01.036657,93.75171681840877,7.998769121799774,sigmoid,53,15.0,,,7.0,1.0,12.0,2.0,28.0,,,,,,,177.0,COMPLETE
3292,0.49078324572461524,2024-04-11 16:44:11.162101,2024-04-11 16:44:12.185532,0 days 00:00:01.023431,99.97918960684373,7.283932131573431,sigmoid,45,4.0,25.0,28.0,,,,40.0,39.0,,,,,,,77.0,COMPLETE
3293,0.5185345950169286,2024-04-11 16:44:12.185532,2024-04-11 16:44:12.973755,0 days 00:00:00.788223,96.60045580353093,8.379294783637304,sigmoid,33,49.0,,,,,,,,,,,,,,145.0,COMPLETE
3294,0.4862440334844451,2024-04-11 16:44:12.973755,2024-04-11 16:44:13.926374,0 days 00:00:00.952619,99.99657904226657,7.839202797013561,sigmoid,17,,,,6.0,7.0,15.0,,,,,,,,,37.0,COMPLETE
3295,0.4194541850891904,2024-04-11 16:44:13.926374,2024-04-11 16:44:14.841254,0 days 00:00:00.914880,99.96175732069464,7.511447884128788,sigmoid,49,7.0,,,1.0,3.0,76.0,,,,,,,,,28.0,COMPLETE
3296,0.48435190376675663,2024-04-11 16:44:14.841254,2024-04-11 16:44:16.116092,0 days 00:00:01.274838,95.0771290361419,8.16530425964216,sigmoid,58,36.0,23.0,30.0,2.0,5.0,56.0,,,6.350944519183661,4.669633942372791,8.318256676507573,6.0,36.0,55.0,,COMPLETE
3297,0.41693060754391015,2024-04-11 16:44:16.116092,2024-04-11 16:44:17.283177,0 days 00:00:01.167085,98.10693347573319,7.984253265756277,sigmoid,51,35.0,,,3.0,4.0,62.0,,,5.07753077933196,7.702341743547167,5.1657505433340445,4.0,31.0,64.0,140.0,COMPLETE
3298,0.6009432182607054,2024-04-11 16:44:17.283177,2024-04-11 16:44:18.040149,0 days 00:00:00.756972,96.73527435950986,7.744371201904575,sigmoid,8,,24.0,31.0,,,,,,,,,,,,,COMPLETE
3299,0.2341317632365404,2024-04-11 16:44:18.048751,2024-04-11 16:44:19.381226,0 days 00:00:01.332475,98.14131065862888,9.032987869790059,rbf,5,,,,,,,25.0,34.0,,,,,,,125.0,COMPLETE
3300,0.4923917370725881,2024-04-11 16:44:19.381226,2024-04-11 16:44:20.460320,0 days 00:00:01.079094,95.41370972775995,5.332194793174702,sigmoid,18,,,,8.0,6.0,87.0,,,7.768567469355528,3.2724828298152966,5.54692850919759,7.0,25.0,68.0,,COMPLETE
3301,0.3821336676123243,2024-04-11 16:44:20.468731,2024-04-11 16:44:21.562611,0 days 00:00:01.093880,96.7908165149551,8.656881139871933,sigmoid,19,,,,7.0,2.0,32.0,,,8.902539959326866,4.251000899316896,6.397137216890545,5.0,28.0,91.0,187.0,COMPLETE
3302,0.5963643249384587,2024-04-11 16:44:21.571080,2024-04-11 16:44:22.325508,0 days 00:00:00.754428,93.69126281828561,8.282553783474148,sigmoid,8,,26.0,32.0,,,,,,,,,,,,,COMPLETE
3303,0.41750496572051005,2024-04-11 16:44:22.325508,2024-04-11 16:44:23.414170,0 days 00:00:01.088662,99.94664010966463,8.073877254318594,sigmoid,50,11.0,,,4.0,8.0,92.0,,,4.231846690824089,5.173808276664306,4.87784131761822,9.0,21.0,96.0,,COMPLETE
3304,0.12622036262203626,2024-04-11 16:44:23.414170,2024-04-11 16:44:24.193440,0 days 00:00:00.779270,98.38234972374795,8.454209739817976,sigmoid,8,,29.0,29.0,,,,,,,,,,,,,COMPLETE
3305,0.5929369437606513,2024-04-11 16:44:24.193440,2024-04-11 16:44:25.001968,0 days 00:00:00.808528,99.9990408497724,7.876208259640654,sigmoid,8,,25.0,33.0,,,,,,,,,,,,,COMPLETE
3306,0.40177580466148727,2024-04-11 16:44:25.001968,2024-04-11 16:44:25.943594,0 days 00:00:00.941626,96.64700433197281,7.583902093397801,sigmoid,25,,27.0,30.0,2.0,7.0,83.0,,,,,,,,,196.0,COMPLETE
3307,0.4384979627794296,2024-04-11 16:44:25.943594,2024-04-11 16:44:27.005870,0 days 00:00:01.062276,92.17489842489027,8.213299719615048,sigmoid,29,,23.0,32.0,5.0,1.0,28.0,13.0,16.0,,,,,,,69.0,COMPLETE
3308,0.5122641509433962,2024-04-11 16:44:27.005870,2024-04-11 16:44:28.232017,0 days 00:00:01.226147,98.08877981526896,8.015552641265655,sigmoid,47,45.0,26.0,34.0,,,,12.0,22.0,6.922308524210995,2.505859877605514,7.283750747357748,18.0,26.0,100.0,60.0,COMPLETE
3309,0.34195611103037354,2024-04-11 16:44:28.232017,2024-04-11 16:44:29.222800,0 days 00:00:00.990783,95.51174395011309,7.768063698094515,sigmoid,6,,,,,,,15.0,12.0,9.275667243056198,6.881325290976672,2.57688860368985,20.0,48.0,76.0,,COMPLETE
3310,0.5962842367362575,2024-04-11 16:44:29.222800,2024-04-11 16:44:30.018001,0 days 00:00:00.795201,98.28899257014389,9.50332269951035,sigmoid,8,,21.0,31.0,,,,,,,,,,,,,COMPLETE
3311,0.49431042330450614,2024-04-11 16:44:30.020099,2024-04-11 16:44:31.152985,0 days 00:00:01.132886,95.46112317041396,8.427464935041396,sigmoid,43,39.0,24.0,31.0,,,,,,5.847213172053424,9.649222228910922,9.982883882838872,11.0,45.0,80.0,10.0,COMPLETE
3312,0.3551734459706654,2024-04-11 16:44:31.152985,2024-04-11 16:44:32.144954,0 days 00:00:00.991969,96.73817897234846,8.165333818279905,sigmoid,35,21.0,,,,,,,,0.7309950579598219,7.474793821342562,3.200177861553562,16.0,23.0,54.0,41.0,COMPLETE
3313,0.4607534038627712,2024-04-11 16:44:32.144954,2024-04-11 16:44:33.260193,0 days 00:00:01.115239,99.9545505551123,7.938441613889018,sigmoid,39,50.0,,,,,,21.0,36.0,1.178364495786007,8.102583775214459,8.949239974568133,12.0,37.0,87.0,108.0,COMPLETE
3314,0.12003789673140693,2024-04-11 16:44:33.260193,2024-04-11 16:44:34.052729,0 days 00:00:00.792536,98.25281797739638,8.84523149985941,sigmoid,8,,27.0,28.0,,,,,,,,,,,,,COMPLETE
3315,0.4745874937097756,2024-04-11 16:44:34.052729,2024-04-11 16:44:35.193429,0 days 00:00:01.140700,93.32245525514075,9.973600157103572,sigmoid,22,,,,6.0,4.0,68.0,47.0,8.0,8.28690641390217,3.7879196712970513,6.193689731028146,19.0,44.0,61.0,,COMPLETE
3316,0.44771119043146096,2024-04-11 16:44:35.201442,2024-04-11 16:44:36.165740,0 days 00:00:00.964298,98.1672442694855,6.220592780238514,sigmoid,21,,,,1.0,5.0,7.0,46.0,40.0,,,,,,,114.0,COMPLETE
3317,0.44235869169569964,2024-04-11 16:44:36.174381,2024-04-11 16:44:37.094765,0 days 00:00:00.920384,95.26259755007732,8.200908564523761,sigmoid,24,,24.0,30.0,2.0,3.0,48.0,,,,,,,,,,COMPLETE
3318,0.3130134025075659,2024-04-11 16:44:37.094765,2024-04-11 16:44:38.553011,0 days 00:00:01.458246,98.20154202446216,7.561872436160458,rbf,38,41.0,,,,,,32.0,48.0,4.854967828797487,9.159291746737178,5.706453097420827,8.0,20.0,84.0,,COMPLETE
3319,0.5611127185549539,2024-04-11 16:44:38.553011,2024-04-11 16:44:39.604736,0 days 00:00:01.051725,96.67424615126728,8.538948600918191,sigmoid,3,,,,,,,,,5.345238323992477,2.267021255584288,0.9373357128707411,2.0,32.0,58.0,17.0,COMPLETE
3320,0.5069140556625241,2024-04-11 16:44:39.613297,2024-04-11 16:44:40.455759,0 days 00:00:00.842462,98.06345024733605,7.81122765400973,sigmoid,8,,26.0,35.0,,,,,,,,,,,,,COMPLETE
3321,0.5963643249384587,2024-04-11 16:44:40.455759,2024-04-11 16:44:41.248763,0 days 00:00:00.793004,54.26935702030161,8.32314917440002,sigmoid,8,,25.0,32.0,,,,,,,,,,,,,COMPLETE
3322,0.4958414570942028,2024-04-11 16:44:41.248763,2024-04-11 16:44:42.582359,0 days 00:00:01.333596,99.96457344460065,7.330713674552095,sigmoid,31,,28.0,33.0,3.0,2.0,41.0,34.0,46.0,3.1078209051202257,1.5305683240365138,9.506578957664889,20.0,47.0,51.0,121.0,COMPLETE
3323,0.43603588635986046,2024-04-11 16:44:42.590382,2024-04-11 16:44:43.675512,0 days 00:00:01.085130,99.94911630032347,8.052167820452372,sigmoid,28,,25.0,31.0,5.0,6.0,95.0,19.0,30.0,,,,,,,,COMPLETE
3324,0.3478118994960299,2024-04-11 16:44:43.675512,2024-04-11 16:44:44.756159,0 days 00:00:01.080647,94.15173484620566,7.927770049777599,sigmoid,42,30.0,22.0,29.0,,,,,,3.443127365948552,7.232158898780806,4.38476244616031,10.0,25.0,92.0,,COMPLETE
3325,0.39599755477622983,2024-04-11 16:44:44.756159,2024-04-11 16:44:45.985864,0 days 00:00:01.229705,74.1836101383625,7.696698598497489,sigmoid,15,,27.0,30.0,,,,10.0,41.0,7.464775890273563,0.9013365615418989,2.8507852200076034,18.0,27.0,99.0,91.0,COMPLETE
3326,0.5963643249384587,2024-04-11 16:44:45.985864,2024-04-11 16:44:46.855971,0 days 00:00:00.870107,96.41098357165308,8.31538042588573,sigmoid,8,,26.0,32.0,,,,,,,,,,,,,COMPLETE
3327,0.6009432182607054,2024-04-11 16:44:46.855971,2024-04-11 16:44:47.652532,0 days 00:00:00.796561,99.97348345110379,8.110848288734532,sigmoid,8,,23.0,31.0,,,,,,,,,,,,,COMPLETE
3328,0.40275041949368934,2024-04-11 16:44:47.652532,2024-04-11 16:44:48.489781,0 days 00:00:00.837249,98.20042882392873,8.577822580047751,sigmoid,9,,28.0,27.0,,,,,,,,,,,,181.0,COMPLETE
3329,0.5929369437606513,2024-04-11 16:44:48.497763,2024-04-11 16:44:49.291276,0 days 00:00:00.793513,96.61942937548717,7.838028937115011,sigmoid,8,,25.0,33.0,,,,,,,,,,,,,COMPLETE
