number,value,datetime_start,datetime_complete,duration,params_C,params_gamma,params_kernel,params_mask_number,params_rsi_window,params_so_smooth,params_so_window,params_srsi_smooth1,params_srsi_smooth2,params_srsi_window,params_tsi_window_fast,params_tsi_window_slow,params_ult_weight_1,params_ult_weight_2,params_ult_weight_3,params_ult_window_1,params_ult_window_2,params_ult_window_3,params_williams_lbp,state
8982,0.30210150974888095,2024-04-11 19:13:57.514074,2024-04-11 19:13:59.725157,0 days 00:00:02.211083,99.97946368796698,7.4266647031743815,sigmoid,48,24.0,,,5.0,5.0,45.0,,,,,,,,,,COMPLETE
8983,0.48502802635460707,2024-04-11 19:13:59.729148,2024-04-11 19:14:03.152492,0 days 00:00:03.423344,93.79058696520134,8.444831700578934,sigmoid,59,40.0,24.0,32.0,8.0,4.0,60.0,,,6.603386322698636,1.96812451462617,1.666672706889274,9.0,21.0,50.0,142.0,COMPLETE
8984,0.3331889550622631,2024-04-11 19:14:03.157786,2024-04-11 19:14:05.520491,0 days 00:00:02.362705,95.32325799942717,7.87444328249952,sigmoid,44,42.0,27.0,29.0,,,,20.0,41.0,,,,,,,,COMPLETE
8985,0.4458506752739319,2024-04-11 19:14:05.523493,2024-04-11 19:14:08.720622,0 days 00:00:03.197129,98.18786064292186,7.62585117994159,sigmoid,55,35.0,,,4.0,8.0,64.0,49.0,33.0,5.019784571331006,2.8315508462081183,2.859734936020296,19.0,24.0,51.0,53.0,COMPLETE
8986,0.5929369437606513,2024-04-11 19:14:08.724627,2024-04-11 19:14:10.669482,0 days 00:00:01.944855,98.21867610332151,8.251966953538938,sigmoid,8,,24.0,33.0,,,,,,,,,,,,,COMPLETE
8987,0.6009432182607054,2024-04-11 19:14:10.673478,2024-04-11 19:14:12.731370,0 days 00:00:02.057892,96.21815827394384,8.016935395151714,sigmoid,8,,26.0,31.0,,,,,,,,,,,,,COMPLETE
8988,0.4776997578692494,2024-04-11 19:14:12.734361,2024-04-11 19:14:15.706909,0 days 00:00:02.972548,98.21911555893938,8.557320848059863,sigmoid,60,7.0,29.0,30.0,6.0,3.0,52.0,38.0,49.0,,,,,,,,COMPLETE
8989,0.5963643249384587,2024-04-11 19:14:15.710896,2024-04-11 19:14:17.712486,0 days 00:00:02.001590,92.53481709180237,4.369846862864935,sigmoid,8,,25.0,32.0,,,,,,,,,,,,,COMPLETE
8990,0.32829107265933904,2024-04-11 19:14:17.715480,2024-04-11 19:14:20.246057,0 days 00:00:02.530577,96.65768123850897,8.19512085328878,sigmoid,13,,23.0,31.0,,,,15.0,39.0,,,,,,,10.0,COMPLETE
8991,0.3455491502582915,2024-04-11 19:14:20.249056,2024-04-11 19:14:23.489599,0 days 00:00:03.240543,99.93540713182814,7.82282811700141,sigmoid,23,,,,1.0,6.0,25.0,50.0,8.0,5.966865496444809,3.2449932165433837,0.5032137171268731,4.0,33.0,74.0,188.0,COMPLETE
8992,0.5906279643331437,2024-04-11 19:14:23.492606,2024-04-11 19:14:25.558036,0 days 00:00:02.065430,95.1391575443719,8.350300670505126,sigmoid,8,,26.0,34.0,,,,,,,,,,,,,COMPLETE
8993,0.5750784907221147,2024-04-11 19:14:25.561034,2024-04-11 19:14:27.424292,0 days 00:00:01.863258,98.18278068613704,8.03209827246059,sigmoid,32,18.0,,,,,,,,,,,,,,,COMPLETE
8994,0.5415388668310032,2024-04-11 19:14:27.428286,2024-04-11 19:14:29.707561,0 days 00:00:02.279275,96.65470881671601,7.680766868763547,sigmoid,12,,27.0,29.0,,,,43.0,44.0,,,,,,,,COMPLETE
8995,0.4461302514104179,2024-04-11 19:14:29.711563,2024-04-11 19:14:31.427710,0 days 00:00:01.716147,94.08154668739112,8.857484379420322,sigmoid,1,,,,,,,,,,,,,,,171.0,COMPLETE
8996,0.5998117115420825,2024-04-11 19:14:31.430710,2024-04-11 19:14:33.594741,0 days 00:00:02.164031,98.09155605959674,7.32884407012514,sigmoid,8,,20.0,32.0,,,,,,,,,,,,,COMPLETE
8997,0.31535438908659547,2024-04-11 19:14:33.597741,2024-04-11 19:14:36.426689,0 days 00:00:02.828948,98.31955969787079,8.129219353913607,sigmoid,7,,,,,,,16.0,24.0,1.5316938578659736,9.796072469006582,6.609381408886968,18.0,28.0,100.0,157.0,COMPLETE
8998,0.5511962121686169,2024-04-11 19:14:36.429698,2024-04-11 19:14:38.882948,0 days 00:00:02.453250,99.95051148770244,7.961610238381475,sigmoid,34,2.0,,,,,,,,9.85917877298589,3.7638251255526654,5.905873045602553,12.0,39.0,85.0,,COMPLETE
8999,0.45693274428559666,2024-04-11 19:14:38.886948,2024-04-11 19:14:42.115499,0 days 00:00:03.228551,78.36889184702636,8.39025349392143,sigmoid,54,23.0,,,3.0,2.0,42.0,33.0,20.0,2.352843781922426,5.96088547314028,3.3363994624618223,13.0,31.0,66.0,,COMPLETE
9000,0.35468699896675815,2024-04-11 19:14:42.118497,2024-04-11 19:14:44.887550,0 days 00:00:02.769053,96.41278091468217,7.828627096971481,rbf,36,21.0,,,,,,29.0,28.0,,,,,,,,COMPLETE
9001,0.4448341684562156,2024-04-11 19:14:44.890550,2024-04-11 19:14:46.978947,0 days 00:00:02.088397,52.480016873603816,8.664819641313859,sigmoid,8,,25.0,30.0,,,,,,,,,,,,,COMPLETE
9002,0.47377474198534175,2024-04-11 19:14:46.982944,2024-04-11 19:14:50.516898,0 days 00:00:03.533954,96.73592852901466,7.602076674599257,sigmoid,30,,24.0,7.0,5.0,4.0,89.0,26.0,12.0,0.512015244724223,1.2747659985892996,9.075849533278314,16.0,50.0,83.0,,COMPLETE
9003,0.5267096237788401,2024-04-11 19:14:50.521897,2024-04-11 19:14:52.712823,0 days 00:00:02.190926,93.95237588505691,8.176167368913953,sigmoid,40,27.0,22.0,33.0,,,,,,,,,,,,,COMPLETE
9004,0.4469389492805041,2024-04-11 19:14:52.716811,2024-04-11 19:14:55.737215,0 days 00:00:03.020404,98.22876583839192,8.437203982954317,sigmoid,61,28.0,28.0,28.0,2.0,1.0,98.0,31.0,15.0,,,,,,,30.0,COMPLETE
9005,0.5465823301367068,2024-04-11 19:14:55.740215,2024-04-11 19:14:57.833570,0 days 00:00:02.093355,95.27670280594933,7.923665046484566,sigmoid,5,,,,,,,21.0,18.0,,,,,,,14.0,COMPLETE
9006,0.3609740736853154,2024-04-11 19:14:57.836570,2024-04-11 19:14:59.764439,0 days 00:00:01.927869,98.19502261622237,8.216969608004769,sigmoid,4,,,,,,,47.0,46.0,,,,,,,,COMPLETE
9007,0.6009432182607054,2024-04-11 19:14:59.767438,2024-04-11 19:15:01.710798,0 days 00:00:01.943360,91.70275530183729,7.731831592992685,sigmoid,8,,25.0,31.0,,,,,,,,,,,,,COMPLETE
9008,0.3511884138313353,2024-04-11 19:15:01.716798,2024-04-11 19:15:04.668039,0 days 00:00:02.951241,98.31085030752998,8.126561045334569,sigmoid,51,43.0,,,8.0,8.0,23.0,,,4.514889281492751,4.892895066480602,6.126944103023153,2.0,47.0,96.0,37.0,COMPLETE
9009,0.44701971028259324,2024-04-11 19:15:04.671040,2024-04-11 19:15:06.760270,0 days 00:00:02.089230,96.78856505435078,7.482623925623939,sigmoid,8,,26.0,30.0,,,,,,,,,,,,,COMPLETE
9010,0.47496173190465774,2024-04-11 19:15:06.764263,2024-04-11 19:15:10.069497,0 days 00:00:03.305234,95.41219754791483,7.970799104556605,sigmoid,27,,24.0,32.0,6.0,7.0,33.0,,,6.177078178689005,2.4154173710536373,4.376855720426291,6.0,26.0,62.0,136.0,COMPLETE
9011,0.4190461490970829,2024-04-11 19:15:10.073506,2024-04-11 19:15:12.833109,0 days 00:00:02.759603,98.21885981995617,8.262595386562468,sigmoid,53,9.0,,,4.0,3.0,80.0,25.0,50.0,,,,,,,24.0,COMPLETE
9012,0.5470114170584285,2024-04-11 19:15:12.836120,2024-04-11 19:15:15.090076,0 days 00:00:02.253956,98.15710415365147,8.45956588551864,sigmoid,33,5.0,,,,,,,,,,,,,,48.0,COMPLETE
9013,0.49042093163282063,2024-04-11 19:15:15.094617,2024-04-11 19:15:17.179388,0 days 00:00:02.084771,94.04215790791491,7.7868019537118265,sigmoid,17,,,,7.0,6.0,29.0,,,,,,,,,113.0,COMPLETE
9014,0.5069140556625241,2024-04-11 19:15:17.183385,2024-04-11 19:15:19.125604,0 days 00:00:01.942219,60.49088091709029,7.988225827310655,sigmoid,8,,27.0,35.0,,,,,,,,,,,,,COMPLETE
9015,0.35609375530002374,2024-04-11 19:15:19.128601,2024-04-11 19:15:22.293634,0 days 00:00:03.165033,98.24060398513633,8.711113903234152,sigmoid,58,30.0,23.0,31.0,3.0,1.0,15.0,,,2.9035164149905457,5.809898996404842,7.1051685638680455,8.0,49.0,98.0,,COMPLETE
9016,0.5931679318644695,2024-04-11 19:15:22.297726,2024-04-11 19:15:24.354818,0 days 00:00:02.057092,95.45818472654152,8.303529990514185,sigmoid,8,,25.0,27.0,,,,,,,,,,,,,COMPLETE
9017,0.41604746886192334,2024-04-11 19:15:24.357808,2024-04-11 19:15:27.358102,0 days 00:00:03.000294,96.8553566415438,8.063419620781888,sigmoid,19,,,,1.0,5.0,86.0,,,5.712421886463748,8.4371224787476,8.08378183295121,10.0,40.0,91.0,149.0,COMPLETE
9018,0.12622036262203626,2024-04-11 19:15:27.361099,2024-04-11 19:15:29.315394,0 days 00:00:01.954295,96.8801777024971,7.618829922147257,sigmoid,8,,26.0,29.0,,,,,,,,,,,,,COMPLETE
9019,0.27261382218779584,2024-04-11 19:15:29.318399,2024-04-11 19:15:31.897342,0 days 00:00:02.578943,92.23420118669502,7.853188861641336,rbf,49,13.0,,,8.0,4.0,57.0,,,,,,,,,94.0,COMPLETE
9020,0.5048684108577184,2024-04-11 19:15:31.899331,2024-04-11 19:15:34.515440,0 days 00:00:02.616109,98.37483373601961,8.5668013546617,sigmoid,29,,28.0,9.0,5.0,2.0,9.0,28.0,35.0,,,,,,,107.0,COMPLETE
9021,0.5929369437606513,2024-04-11 19:15:34.520431,2024-04-11 19:15:36.494759,0 days 00:00:01.974328,95.29625041074495,8.172421700679212,sigmoid,8,,30.0,33.0,,,,,,,,,,,,,COMPLETE
9022,0.23855548721553466,2024-04-11 19:15:36.499747,2024-04-11 19:15:39.004474,0 days 00:00:02.504727,99.98902065695832,8.36213503907749,sigmoid,50,32.0,,,6.0,7.0,12.0,,,9.27143758053142,3.1060758435195472,2.194619379403306,5.0,44.0,87.0,,COMPLETE
9023,0.4047548990760901,2024-04-11 19:15:39.008482,2024-04-11 19:15:41.602346,0 days 00:00:02.593864,99.99701839075102,8.023695193544134,sigmoid,45,16.0,24.0,31.0,,,,3.0,6.0,,,,,,,59.0,COMPLETE
9024,0.533486801058497,2024-04-11 19:15:41.607847,2024-04-11 19:15:44.125423,0 days 00:00:02.517576,98.29955348049751,7.2798000328869685,sigmoid,6,,,,,,,40.0,19.0,2.5897349533227603,6.690764404833059,7.823340168343164,15.0,38.0,92.0,,COMPLETE
9025,0.4734200480701259,2024-04-11 19:15:44.129410,2024-04-11 19:15:47.017279,0 days 00:00:02.887869,96.75474999113924,3.8890543609220893,sigmoid,18,,,,2.0,8.0,67.0,,,9.985148254608816,4.189045598020459,0.8809069001423415,7.0,45.0,70.0,,COMPLETE
9026,0.44701971028259324,2024-04-11 19:15:47.021280,2024-04-11 19:15:49.089158,0 days 00:00:02.067878,93.75791160976404,7.775690677686744,sigmoid,8,,25.0,30.0,,,,,,,,,,,,,COMPLETE
9027,0.4882583877261013,2024-04-11 19:15:49.092155,2024-04-11 19:15:52.525748,0 days 00:00:03.433593,95.46699868257421,8.205039697685896,sigmoid,47,37.0,22.0,32.0,,,,13.0,30.0,3.9528624549573546,9.332278187472177,8.489316984069484,20.0,34.0,90.0,123.0,COMPLETE
9028,0.6009432182607054,2024-04-11 19:15:52.529731,2024-04-11 19:15:54.424895,0 days 00:00:01.895164,98.2247069932594,7.598212052718687,sigmoid,8,,27.0,31.0,,,,,,,,,,,,,COMPLETE
9029,0.4338399520618838,2024-04-11 19:15:54.427888,2024-04-11 19:15:56.521774,0 days 00:00:02.093886,98.22937568583058,7.918598591223966,sigmoid,24,,26.0,33.0,4.0,1.0,84.0,,,,,,,,,,COMPLETE
9030,0.4939288486092681,2024-04-11 19:15:56.525769,2024-04-11 19:15:59.355328,0 days 00:00:02.829559,98.29944306108756,8.489770741131393,sigmoid,39,49.0,,,,,,45.0,23.0,3.222774967845664,6.406137985734166,1.1070505635168377,11.0,30.0,73.0,68.0,COMPLETE
9031,0.44701971028259324,2024-04-11 19:15:59.358322,2024-04-11 19:16:01.540809,0 days 00:00:02.182487,96.56084571077831,8.085163146715264,sigmoid,8,,23.0,30.0,,,,,,,,,,,,,COMPLETE
9032,0.4145901297980149,2024-04-11 19:16:01.544800,2024-04-11 19:16:03.918952,0 days 00:00:02.374152,96.53581726075481,8.368140716790592,sigmoid,21,,,,1.0,3.0,77.0,5.0,3.0,,,,,,,181.0,COMPLETE
9033,0.38166134185303513,2024-04-11 19:16:03.921948,2024-04-11 19:16:06.954512,0 days 00:00:03.032564,93.35052359260709,7.785182506755863,sigmoid,43,15.0,24.0,29.0,,,,,,8.750606381831398,1.0288323525384575,3.554295913104646,14.0,20.0,54.0,102.0,COMPLETE
9034,0.40789266809915625,2024-04-11 19:16:06.960498,2024-04-11 19:16:10.150617,0 days 00:00:03.190119,99.9551289917157,7.469075158805231,sigmoid,22,,,,3.0,5.0,4.0,18.0,22.0,6.797473782642579,7.063227235561019,7.263561350236021,3.0,35.0,94.0,,COMPLETE
9035,0.49113603473227213,2024-04-11 19:16:10.153623,2024-04-11 19:16:12.994746,0 days 00:00:02.841123,98.19416814470891,8.089938242051682,sigmoid,38,34.0,,,,,,22.0,32.0,7.565817652174076,2.6527049607276942,2.4513934542362192,18.0,36.0,76.0,,COMPLETE
9036,0.48709830615798644,2024-04-11 19:16:12.998738,2024-04-11 19:16:15.882158,0 days 00:00:02.883420,99.9987991541584,6.952562782083648,sigmoid,25,,27.0,34.0,7.0,2.0,54.0,,,,,,,,,81.0,COMPLETE
9037,0.2987159360785735,2024-04-11 19:16:15.885147,2024-04-11 19:16:18.896769,0 days 00:00:03.011622,96.23210443681532,8.27864873373744,rbf,35,11.0,,,,,,,,2.19393705751737,4.591179779371285,6.794412419561065,9.0,32.0,80.0,75.0,COMPLETE
9038,0.5636462904171639,2024-04-11 19:16:18.899763,2024-04-11 19:16:20.719281,0 days 00:00:01.819518,99.97483810290119,7.903697592538666,sigmoid,0,,,,,,,,,,,,,,,,COMPLETE
9039,0.5952371952371952,2024-04-11 19:16:20.722285,2024-04-11 19:16:22.613353,0 days 00:00:01.891068,87.62944660557639,7.659248560231394,sigmoid,8,,25.0,32.0,,,,,,,,,,,,,COMPLETE
9040,0.48987324642518837,2024-04-11 19:16:22.616352,2024-04-11 19:16:25.286118,0 days 00:00:02.669766,99.94797901528445,4.852079961378243,sigmoid,57,25.0,26.0,30.0,5.0,6.0,35.0,,,,,,,,,117.0,COMPLETE
9041,0.5986314388899449,2024-04-11 19:16:25.290114,2024-04-11 19:16:27.375354,0 days 00:00:02.085240,99.95546477821242,8.532071344589472,sigmoid,8,,24.0,31.0,,,,,,,,,,,,,COMPLETE
9042,0.4599081800594808,2024-04-11 19:16:27.379348,2024-04-11 19:16:30.966884,0 days 00:00:03.587536,90.27940231346199,8.806376780000203,sigmoid,31,,28.0,28.0,8.0,7.0,91.0,11.0,26.0,9.705290922470782,6.1906828316682265,4.794603731245314,17.0,46.0,82.0,200.0,COMPLETE
9043,0.4214776060725194,2024-04-11 19:16:30.971893,2024-04-11 19:16:34.315308,0 days 00:00:03.343415,94.97293749121607,8.065422968621714,sigmoid,15,,25.0,31.0,,,,2.0,11.0,3.71260475565318,3.4995056704602963,1.4736157465935973,6.0,23.0,56.0,19.0,COMPLETE
9044,0.5963643249384587,2024-04-11 19:16:34.318331,2024-04-11 19:16:36.333797,0 days 00:00:02.015466,96.6669120615962,8.260817100326207,sigmoid,8,,23.0,32.0,,,,,,,,,,,,,COMPLETE
9045,0.44701971028259324,2024-04-11 19:16:36.336796,2024-04-11 19:16:38.672399,0 days 00:00:02.335603,98.32124565892568,7.8802033309147195,sigmoid,8,,26.0,30.0,,,,,,,,,,,,,COMPLETE
9046,0.5929369437606513,2024-04-11 19:16:38.677392,2024-04-11 19:16:40.644486,0 days 00:00:01.967094,94.96590979357833,8.134176900058975,sigmoid,8,,24.0,33.0,,,,,,,,,,,,,COMPLETE
9047,0.5404855671441555,2024-04-11 19:16:40.649474,2024-04-11 19:16:42.699927,0 days 00:00:02.050453,74.48235066828158,8.401255286910759,sigmoid,3,,,,,,,,,8.11574056827684,2.159697039641917,1.9018494346925041,10.0,42.0,51.0,194.0,COMPLETE
9048,0.297006323541183,2024-04-11 19:16:42.703927,2024-04-11 19:16:45.308601,0 days 00:00:02.604674,96.64444752588491,7.732793461862026,sigmoid,10,,27.0,32.0,,,,,,1.1230063272867419,7.391012102151894,8.653732076783827,4.0,49.0,58.0,,COMPLETE
9049,0.23952690128613374,2024-04-11 19:16:45.312601,2024-04-11 19:16:47.276333,0 days 00:00:01.963732,99.93357050159642,7.484008102181765,sigmoid,16,,,,6.0,4.0,46.0,,,,,,,,,,COMPLETE
9050,0.5381565906838454,2024-04-11 19:16:47.280333,2024-04-11 19:16:49.306306,0 days 00:00:02.025973,92.56411436133897,7.964183606496809,sigmoid,9,,22.0,29.0,,,,,,,,,,,,174.0,COMPLETE
9051,0.4888300382820284,2024-04-11 19:16:49.310306,2024-04-11 19:16:51.931560,0 days 00:00:02.621254,96.70533373190187,8.567835696887263,sigmoid,28,,25.0,31.0,4.0,6.0,59.0,35.0,14.0,,,,,,,,COMPLETE
9052,0.44701971028259324,2024-04-11 19:16:51.934554,2024-04-11 19:16:54.053861,0 days 00:00:02.119307,98.20490299592312,8.19909569673905,sigmoid,8,,29.0,30.0,,,,,,,,,,,,,COMPLETE
9053,0.49412363501758283,2024-04-11 19:16:54.057862,2024-04-11 19:16:57.184974,0 days 00:00:03.127112,94.11454748601231,7.845450189173588,sigmoid,14,,26.0,32.0,,,,32.0,37.0,8.518304823854773,7.865277465976656,8.254189512959528,12.0,41.0,75.0,,COMPLETE
9054,0.47952264054638705,2024-04-11 19:16:57.188978,2024-04-11 19:17:00.986836,0 days 00:00:03.797858,98.25034845836278,8.324091992550018,sigmoid,62,47.0,23.0,34.0,2.0,8.0,40.0,20.0,42.0,4.162460325085034,4.2962852742898345,8.894925103466532,13.0,31.0,65.0,,COMPLETE
9055,0.5469851777234134,2024-04-11 19:17:00.992829,2024-04-11 19:17:03.553664,0 days 00:00:02.560835,96.66615971292023,8.012534217297873,sigmoid,2,,,,,,,,,4.79985067991045,0.6961464963605222,4.50189200475648,7.0,27.0,78.0,,COMPLETE
9056,0.4828789211374964,2024-04-11 19:17:03.556657,2024-04-11 19:17:06.675542,0 days 00:00:03.118885,99.96343142922368,7.626710926949914,rbf,8,,27.0,31.0,,,,,,,,,,,,,COMPLETE
9057,0.46185615825748405,2024-04-11 19:17:06.680542,2024-04-11 19:17:10.283673,0 days 00:00:03.603131,98.21050717560183,8.123584394237222,sigmoid,63,41.0,25.0,29.0,3.0,3.0,95.0,24.0,47.0,3.4717678984237983,1.6358714003142891,1.3621439612708994,2.0,43.0,84.0,185.0,COMPLETE
9058,0.5162512505055235,2024-04-11 19:17:10.288679,2024-04-11 19:17:12.717236,0 days 00:00:02.428557,94.90542602177736,7.244143091881531,sigmoid,41,3.0,24.0,36.0,,,,,,,,,,,,98.0,COMPLETE
9059,0.48609658712805404,2024-04-11 19:17:12.721246,2024-04-11 19:17:15.066315,0 days 00:00:02.345069,98.35872081240011,8.39211914540169,sigmoid,20,,,,7.0,2.0,72.0,39.0,4.0,,,,,,,,COMPLETE
9060,0.5963245096172158,2024-04-11 19:17:15.070309,2024-04-11 19:17:17.090962,0 days 00:00:02.020653,99.99315116003423,8.705525045497408,sigmoid,8,,21.0,31.0,,,,,,,,,,,,,COMPLETE
9061,0.3969550568940309,2024-04-11 19:17:17.093957,2024-04-11 19:17:20.416684,0 days 00:00:03.322727,96.65467115536708,7.856722188171038,sigmoid,26,,26.0,33.0,1.0,5.0,48.0,,,1.899579639097313,1.380992327953336,5.299094682033912,15.0,39.0,60.0,,COMPLETE
9062,0.44701971028259324,2024-04-11 19:17:20.421684,2024-04-11 19:17:22.502148,0 days 00:00:02.080464,98.29341310635421,8.054026941258185,sigmoid,8,,25.0,30.0,,,,,,,,,,,,,COMPLETE
9063,0.5142629844300487,2024-04-11 19:17:22.505144,2024-04-11 19:17:25.351698,0 days 00:00:02.846554,94.00707000535729,8.263519251819174,sigmoid,11,,27.0,27.0,,,,,,5.240564312535547,5.506527891402766,3.181232887137389,4.0,25.0,72.0,160.0,COMPLETE
9064,0.3723185424625331,2024-04-11 19:17:25.354690,2024-04-11 19:17:28.265654,0 days 00:00:02.910964,96.64249446983318,7.740562344891578,sigmoid,42,29.0,24.0,32.0,,,,,,0.8628264341072889,0.5003923751153438,9.280440068719527,19.0,24.0,68.0,,COMPLETE
9065,0.30337455303933253,2024-04-11 19:17:28.270653,2024-04-11 19:17:30.416095,0 days 00:00:02.145442,98.27648931027277,8.574684392134536,sigmoid,37,50.0,,,,,,4.0,8.0,,,,,,,40.0,COMPLETE
9066,0.12622036262203626,2024-04-11 19:17:30.420094,2024-04-11 19:17:32.151064,0 days 00:00:01.730970,99.96485696137458,8.013738669027635,sigmoid,8,,28.0,29.0,,,,,,,,,,,,,COMPLETE
9067,0.5954954785584027,2024-04-11 19:17:32.156082,2024-04-11 19:17:33.773791,0 days 00:00:01.617709,94.99901214995572,7.441364391072084,sigmoid,8,,26.0,23.0,,,,,,,,,,,,,COMPLETE
9068,0.4627813801465549,2024-04-11 19:17:33.776784,2024-04-11 19:17:35.994254,0 days 00:00:02.217470,98.26899612878617,8.2364727269317,sigmoid,52,44.0,,,5.0,1.0,56.0,17.0,28.0,,,,,,,,COMPLETE
9069,0.4448341684562156,2024-04-11 19:17:35.997249,2024-04-11 19:17:37.872065,0 days 00:00:01.874816,99.95317558175289,9.030418584641168,sigmoid,8,,23.0,30.0,,,,,,,,,,,,,COMPLETE
9070,0.38597815032315225,2024-04-11 19:17:37.875055,2024-04-11 19:17:40.820452,0 days 00:00:02.945397,99.96053357834298,7.832444494439349,sigmoid,46,19.0,25.0,31.0,,,,37.0,17.0,7.915053532121103,8.287715391002846,3.7698157216324484,5.0,22.0,98.0,,COMPLETE
9071,0.5929369437606513,2024-04-11 19:17:40.823446,2024-04-11 19:17:42.779081,0 days 00:00:01.955635,96.51417234436036,8.459088491781113,sigmoid,8,,26.0,33.0,,,,,,,,,,,,,COMPLETE
9072,0.33728722451173626,2024-04-11 19:17:42.783073,2024-04-11 19:17:45.041613,0 days 00:00:02.258540,99.94147651179965,7.593095054439987,sigmoid,44,39.0,29.0,28.0,,,,27.0,34.0,,,,,,,,COMPLETE
9073,0.428740623766285,2024-04-11 19:17:45.045619,2024-04-11 19:17:48.606823,0 days 00:00:03.561204,99.93852878114423,8.002205260851687,sigmoid,55,26.0,,,8.0,4.0,27.0,48.0,21.0,5.512730933249555,5.078027359477037,4.945489063801214,8.0,29.0,89.0,64.0,COMPLETE
9074,0.5120347014309625,2024-04-11 19:17:48.610822,2024-04-11 19:17:50.609523,0 days 00:00:01.998701,92.54174278409536,8.217936509669164,sigmoid,48,6.0,,,7.0,8.0,65.0,,,,,,,,,,COMPLETE
9075,0.3388393348750138,2024-04-11 19:17:50.612521,2024-04-11 19:17:53.525724,0 days 00:00:02.913203,96.6916343165887,7.7452724296043955,rbf,56,14.0,23.0,32.0,2.0,7.0,44.0,,,,,,,,,,COMPLETE
9076,0.3851776461880089,2024-04-11 19:17:53.529717,2024-04-11 19:17:56.520944,0 days 00:00:02.991227,95.21646766881491,8.015315197979401,sigmoid,60,22.0,33.0,31.0,4.0,3.0,18.0,44.0,31.0,,,,,,,,COMPLETE
9077,0.5160339197816659,2024-04-11 19:17:56.525934,2024-04-11 19:17:59.011397,0 days 00:00:02.485463,99.99200175289731,8.385695211213427,sigmoid,13,,24.0,30.0,,,,33.0,9.0,,,,,,,134.0,COMPLETE
9078,0.5963643249384587,2024-04-11 19:17:59.015398,2024-04-11 19:18:01.019275,0 days 00:00:02.003877,98.1744313392041,8.188054284344009,sigmoid,8,,27.0,32.0,,,,,,,,,,,,,COMPLETE
9079,0.4363053712211446,2024-04-11 19:18:01.023275,2024-04-11 19:18:04.109058,0 days 00:00:03.085783,96.55316011526365,7.88559729846553,sigmoid,23,,,,6.0,6.0,38.0,41.0,2.0,7.285459640321961,8.87275538555732,5.606919469002433,16.0,33.0,95.0,87.0,COMPLETE
9080,0.44993917596657323,2024-04-11 19:18:04.112054,2024-04-11 19:18:07.363404,0 days 00:00:03.251350,93.76850000414063,8.63438245294344,sigmoid,54,35.0,,,1.0,5.0,82.0,30.0,44.0,3.017472501033576,5.242846476094306,2.7522225118861714,14.0,38.0,63.0,,COMPLETE
9081,0.4550493729932755,2024-04-11 19:18:07.366386,2024-04-11 19:18:10.598911,0 days 00:00:03.232525,99.93952709720286,7.6669522797729455,sigmoid,59,8.0,25.0,31.0,3.0,1.0,32.0,,,6.419838373354462,3.8750328394076643,6.186404477579323,20.0,50.0,93.0,166.0,COMPLETE
9082,0.5604697359196074,2024-04-11 19:18:10.602910,2024-04-11 19:18:12.986075,0 days 00:00:02.383165,96.7300126490976,8.144054823853942,sigmoid,40,48.0,26.0,34.0,,,,,,,,,,,,,COMPLETE
9083,0.5715229842855045,2024-04-11 19:18:12.990075,2024-04-11 19:18:14.918332,0 days 00:00:01.928257,99.98816371153984,8.355707461506338,sigmoid,32,10.0,,,,,,,,,,,,,,,COMPLETE
9084,0.2996806875073915,2024-04-11 19:18:14.921332,2024-04-11 19:18:17.334527,0 days 00:00:02.413195,90.67714592888484,7.998307373670506,sigmoid,12,,28.0,33.0,,,,7.0,48.0,,,,,,,,COMPLETE
