number,value,datetime_start,datetime_complete,duration,params_C,params_gamma,params_kernel,params_mask_number,params_rsi_window,params_so_smooth,params_so_window,params_srsi_smooth1,params_srsi_smooth2,params_srsi_window,params_tsi_window_fast,params_tsi_window_slow,params_ult_weight_1,params_ult_weight_2,params_ult_weight_3,params_ult_window_1,params_ult_window_2,params_ult_window_3,params_williams_lbp,state
9188,0.5279166666666666,2024-04-11 19:22:18.511085,2024-04-11 19:22:21.332176,0 days 00:00:02.821091,98.11295399837022,8.409147631551845,sigmoid,53,34.0,,,1.0,7.0,28.0,37.0,26.0,,,,,,,103.0,COMPLETE
9189,0.3098968995421893,2024-04-11 19:22:21.335174,2024-04-11 19:22:23.650525,0 days 00:00:02.315351,92.51332192560446,7.773155937106173,rbf,34,37.0,,,,,,,,3.35841001489022,2.5153628755712187,3.699136888138984,17.0,36.0,54.0,,COMPLETE
9190,0.5510837786067144,2024-04-11 19:22:23.653529,2024-04-11 19:22:25.304782,0 days 00:00:01.651253,98.06675461728406,7.056204807450479,sigmoid,5,,,,,,,8.0,18.0,,,,,,,158.0,COMPLETE
9191,0.497137004794935,2024-04-11 19:22:25.307782,2024-04-11 19:22:27.509057,0 days 00:00:02.201275,95.29700474086803,8.122611795262277,sigmoid,45,50.0,16.0,32.0,,,,32.0,5.0,,,,,,,90.0,COMPLETE
9192,0.5214344068452509,2024-04-11 19:22:27.512209,2024-04-11 19:22:29.473902,0 days 00:00:01.961693,96.81919663299551,7.349090475669028,sigmoid,17,,,,6.0,2.0,18.0,,,,,,,,,183.0,COMPLETE
9193,0.6009432182607054,2024-04-11 19:22:29.476959,2024-04-11 19:22:31.409964,0 days 00:00:01.933005,99.98074986062079,7.957500875680151,sigmoid,8,,24.0,31.0,,,,,,,,,,,,,COMPLETE
9194,0.12622036262203626,2024-04-11 19:22:31.412974,2024-04-11 19:22:33.401501,0 days 00:00:01.988527,98.20821241134632,7.60631464412682,sigmoid,8,,22.0,29.0,,,,,,,,,,,,,COMPLETE
9195,0.4640490868237598,2024-04-11 19:22:33.404499,2024-04-11 19:22:36.026348,0 days 00:00:02.621849,95.13191186438722,8.306665907699445,sigmoid,58,6.0,25.0,31.0,3.0,4.0,94.0,,,7.109290194479051,3.888719951405235,3.347980409225233,8.0,22.0,77.0,,COMPLETE
9196,0.5587612853121057,2024-04-11 19:22:36.029386,2024-04-11 19:22:38.135022,0 days 00:00:02.105636,96.88357651845115,8.745617991155976,sigmoid,6,,,,,,,44.0,22.0,4.237063481469708,1.0440643104502154,6.419320835813881,5.0,38.0,62.0,,COMPLETE
9197,0.41061957754682854,2024-04-11 19:22:38.140168,2024-04-11 19:22:40.767745,0 days 00:00:02.627577,98.06008072547823,8.517852882653749,sigmoid,29,,27.0,34.0,5.0,8.0,41.0,34.0,43.0,,,,,,,109.0,COMPLETE
9198,0.47499478126025113,2024-04-11 19:22:40.773859,2024-04-11 19:22:43.502280,0 days 00:00:02.728421,93.99303437110298,8.131515655081186,sigmoid,51,39.0,,,4.0,6.0,98.0,,,0.7690816190325789,6.552736013044682,7.050119591412882,20.0,50.0,67.0,82.0,COMPLETE
9199,0.5929369437606513,2024-04-11 19:22:43.505278,2024-04-11 19:22:45.199161,0 days 00:00:01.693883,98.1536053298988,7.772276848117841,sigmoid,8,,24.0,33.0,,,,,,,,,,,,,COMPLETE
9200,0.3720575558649957,2024-04-11 19:22:45.204174,2024-04-11 19:22:47.481837,0 days 00:00:02.277663,91.26390809286728,7.944926342457178,sigmoid,39,33.0,,,,,,40.0,9.0,5.1155441168271185,5.757003697670853,6.041243983490454,3.0,45.0,95.0,52.0,COMPLETE
9201,0.40804057862107834,2024-04-11 19:22:47.484995,2024-04-11 19:22:49.215936,0 days 00:00:01.730941,96.6920471974554,8.3352123027661,sigmoid,49,20.0,,,2.0,1.0,67.0,,,,,,,,,35.0,COMPLETE
9202,0.46160385378294133,2024-04-11 19:22:49.219084,2024-04-11 19:22:51.316385,0 days 00:00:02.097301,98.06276076293724,8.118398683945367,sigmoid,18,,,,7.0,5.0,55.0,,,7.863935587618905,6.917763868532436,4.440955163827691,10.0,20.0,74.0,,COMPLETE
9203,0.4224463333813572,2024-04-11 19:22:51.319391,2024-04-11 19:22:53.480158,0 days 00:00:02.160767,95.40121849918124,7.740579754727391,sigmoid,25,,26.0,30.0,6.0,6.0,32.0,,,,,,,,,17.0,COMPLETE
9204,0.5952371952371952,2024-04-11 19:22:53.484245,2024-04-11 19:22:55.492700,0 days 00:00:02.008455,98.2337748119029,7.519352615578509,sigmoid,8,,23.0,32.0,,,,,,,,,,,,,COMPLETE
9205,0.2753813890373782,2024-04-11 19:22:55.495882,2024-04-11 19:22:58.205421,0 days 00:00:02.709539,98.15349553523143,7.941846836436985,rbf,50,29.0,,,1.0,7.0,63.0,,,1.7824684720919963,3.187534822429877,1.4009481001431143,9.0,26.0,60.0,,COMPLETE
9206,0.45345352376492626,2024-04-11 19:22:58.208578,2024-04-11 19:22:59.901887,0 days 00:00:01.693309,93.7342221248473,8.47684991763925,sigmoid,8,,30.0,30.0,,,,,,,,,,,,,COMPLETE
9207,0.3733579415915753,2024-04-11 19:22:59.904956,2024-04-11 19:23:02.087099,0 days 00:00:02.182143,39.4254283690937,8.210988413179516,sigmoid,35,14.0,,,,,,,,5.857396757744915,4.622762407463508,5.251859630901596,13.0,35.0,85.0,180.0,COMPLETE
9208,0.4081998496501474,2024-04-11 19:23:02.090272,2024-04-11 19:23:05.138088,0 days 00:00:03.047816,99.99624530871394,7.951582193808636,sigmoid,47,40.0,25.0,35.0,,,,15.0,25.0,4.875521494338057,2.8059734879993727,3.997607863506757,18.0,31.0,57.0,10.0,COMPLETE
9209,0.12622036262203626,2024-04-11 19:23:05.142260,2024-04-11 19:23:07.197712,0 days 00:00:02.055452,96.76030410699015,8.274849427589958,sigmoid,8,,27.0,29.0,,,,,,,,,,,,,COMPLETE
9210,0.40988677161005244,2024-04-11 19:23:07.201860,2024-04-11 19:23:09.414139,0 days 00:00:02.212279,95.35572057809058,8.682210030552039,sigmoid,24,,26.0,32.0,3.0,3.0,4.0,,,,,,,,,,COMPLETE
9211,0.6009432182607054,2024-04-11 19:23:09.418138,2024-04-11 19:23:11.218035,0 days 00:00:01.799897,98.27783357742243,7.7376591004749855,sigmoid,8,,24.0,31.0,,,,,,,,,,,,,COMPLETE
9212,0.5831142381040548,2024-04-11 19:23:11.222039,2024-04-11 19:23:13.157126,0 days 00:00:01.935087,99.96488561530636,8.070928867015649,sigmoid,8,,25.0,38.0,,,,,,,,,,,,,COMPLETE
9213,0.4644201163188505,2024-04-11 19:23:13.161264,2024-04-11 19:23:15.545816,0 days 00:00:02.384552,92.48422677421333,8.431928147686088,sigmoid,57,25.0,28.0,33.0,8.0,2.0,79.0,,,,,,,,,23.0,COMPLETE
9214,0.3548633046509095,2024-04-11 19:23:15.545816,2024-04-11 19:23:17.968796,0 days 00:00:02.422980,58.15644834714267,7.877125669070095,sigmoid,38,38.0,,,,,,17.0,7.0,8.8552365778081,8.153443644321266,2.715331918766795,11.0,47.0,83.0,,COMPLETE
9215,0.38405941250580194,2024-04-11 19:23:17.971798,2024-04-11 19:23:20.923086,0 days 00:00:02.951288,14.27932927028617,7.349547769491599,sigmoid,43,44.0,23.0,28.0,,,,,,5.521494982469766,2.211357284476749,7.891775572829416,12.0,43.0,89.0,28.0,COMPLETE
9216,0.5468760337869132,2024-04-11 19:23:20.926082,2024-04-11 19:23:23.979453,0 days 00:00:03.053371,95.41823026344684,8.204959939753106,sigmoid,22,,,,4.0,8.0,21.0,13.0,38.0,9.817964331687467,9.410834490752977,4.257300562033356,4.0,23.0,78.0,,COMPLETE
9217,0.44701971028259324,2024-04-11 19:23:23.979453,2024-04-11 19:23:26.163780,0 days 00:00:02.184327,96.66804160292916,7.5866723395500735,sigmoid,8,,29.0,30.0,,,,,,,,,,,,,COMPLETE
9218,0.5091598084344632,2024-04-11 19:23:26.163780,2024-04-11 19:23:29.398621,0 days 00:00:03.234841,98.0716544886319,8.026206104919172,sigmoid,15,,26.0,31.0,,,,6.0,13.0,1.5857755530058735,4.173306064425029,8.72975529528378,6.0,37.0,75.0,173.0,COMPLETE
9219,0.4367459496725267,2024-04-11 19:23:29.401614,2024-04-11 19:23:31.977706,0 days 00:00:02.576092,98.09954617119665,8.317391455013555,sigmoid,21,,,,5.0,4.0,86.0,28.0,27.0,,,,,,,113.0,COMPLETE
9220,0.46495783771709387,2024-04-11 19:23:31.977706,2024-04-11 19:23:35.470687,0 days 00:00:03.492981,93.84915162313887,7.762953538365521,sigmoid,31,,27.0,32.0,1.0,6.0,92.0,23.0,31.0,1.9764794359619886,0.8095841510493624,5.728953223324675,19.0,39.0,80.0,143.0,COMPLETE
9221,0.32633064200047035,2024-04-11 19:23:35.474237,2024-04-11 19:23:38.224669,0 days 00:00:02.750432,96.67898582112248,8.530927206455821,sigmoid,3,,,,,,,,,7.334658084446314,7.235593289853411,1.8048207323941319,17.0,49.0,86.0,186.0,COMPLETE
9222,0.5636462904171639,2024-04-11 19:23:38.224669,2024-04-11 19:23:40.142020,0 days 00:00:01.917351,98.19488694366137,8.113478160930821,sigmoid,0,,,,,,,,,,,,,,,,COMPLETE
9223,0.3163068409363963,2024-04-11 19:23:40.158465,2024-04-11 19:23:42.822077,0 days 00:00:02.663612,95.29671170916633,8.789869477013198,sigmoid,42,36.0,25.0,31.0,,,,,,2.9435952292031176,5.512819053498894,0.993258918802205,2.0,42.0,56.0,,COMPLETE
9224,0.1888695652173913,2024-04-11 19:23:42.839282,2024-04-11 19:23:44.939684,0 days 00:00:02.100402,96.8616598696788,7.890266476377798,sigmoid,16,,,,2.0,5.0,51.0,,,,,,,,,,COMPLETE
9225,0.12622036262203626,2024-04-11 19:23:44.939684,2024-04-11 19:23:47.437762,0 days 00:00:02.498078,97.98112675944944,8.36711180582525,sigmoid,8,,24.0,29.0,,,,,,,,,,,,,COMPLETE
9226,0.41622484829128076,2024-04-11 19:23:47.437762,2024-04-11 19:23:49.914368,0 days 00:00:02.476606,98.13122148634758,8.105345783147078,rbf,9,,21.0,30.0,,,,,,,,,,,,41.0,COMPLETE
9227,0.5929369437606513,2024-04-11 19:23:49.917367,2024-04-11 19:23:51.612404,0 days 00:00:01.695037,99.97533161461931,7.6889327309680535,sigmoid,8,,25.0,33.0,,,,,,,,,,,,,COMPLETE
9228,0.5952371952371952,2024-04-11 19:23:51.612404,2024-04-11 19:23:53.260009,0 days 00:00:01.647605,95.2335943342457,7.898397777157085,sigmoid,8,,48.0,32.0,,,,,,,,,,,,,COMPLETE
9229,0.5986580986580987,2024-04-11 19:23:53.260009,2024-04-11 19:23:54.859719,0 days 00:00:01.599710,89.90560472914453,7.4964055327096775,sigmoid,8,,26.0,31.0,,,,,,,,,,,,,COMPLETE
9230,0.29102942826160116,2024-04-11 19:23:54.863490,2024-04-11 19:23:57.543227,0 days 00:00:02.679737,98.26756714798528,8.237504912274858,sigmoid,14,,23.0,30.0,,,,48.0,37.0,1.3001140975042813,5.026499878068831,2.104887156402659,15.0,41.0,72.0,,COMPLETE
9231,0.4065849432000513,2024-04-11 19:23:57.546227,2024-04-11 19:24:00.348073,0 days 00:00:02.801846,99.99130351632921,8.029165553024912,sigmoid,46,23.0,27.0,32.0,,,,19.0,3.0,9.999021244353578,8.697961750026192,7.21349659576415,16.0,24.0,94.0,,COMPLETE
9232,0.537496675826611,2024-04-11 19:24:00.349155,2024-04-11 19:24:02.947007,0 days 00:00:02.597852,92.87207299357011,8.525430743231665,sigmoid,10,,24.0,34.0,,,,,,3.865133763524913,7.987201475240108,2.3229984891653306,5.0,27.0,68.0,,COMPLETE
9233,0.39494615330470895,2024-04-11 19:24:02.947007,2024-04-11 19:24:05.119133,0 days 00:00:02.172126,63.16271241588581,8.263454776780748,sigmoid,41,9.0,26.0,29.0,,,,,,,,,,,,163.0,COMPLETE
9234,0.44891820580474934,2024-04-11 19:24:05.119133,2024-04-11 19:24:08.885877,0 days 00:00:03.766744,99.99286306536526,7.831650549793388,sigmoid,63,3.0,28.0,33.0,8.0,1.0,7.0,33.0,24.0,9.431651354668274,4.351620146412468,0.6530443704166586,14.0,46.0,100.0,86.0,COMPLETE
9235,0.533197371402674,2024-04-11 19:24:08.888882,2024-04-11 19:24:11.030184,0 days 00:00:02.141302,95.49056635722604,7.637093159605877,sigmoid,2,,,,,,,,,8.545355214597464,9.5537289704545,5.532714272452943,20.0,29.0,70.0,,COMPLETE
9236,0.3449848541574487,2024-04-11 19:24:11.035183,2024-04-11 19:24:13.848746,0 days 00:00:02.813563,96.73380701721024,8.087966491768345,sigmoid,26,,25.0,31.0,6.0,3.0,13.0,,,9.14165851553199,9.1601647795564,9.643057179068258,7.0,33.0,98.0,,COMPLETE
9237,0.5963643249384587,2024-04-11 19:24:13.848746,2024-04-11 19:24:15.468948,0 days 00:00:01.620202,98.10252227555692,8.38000688121379,sigmoid,8,,24.0,32.0,,,,,,,,,,,,,COMPLETE
9238,0.5402155068360875,2024-04-11 19:24:15.471938,2024-04-11 19:24:17.511520,0 days 00:00:02.039582,99.9810701127357,7.271633742328263,sigmoid,20,,,,7.0,7.0,17.0,25.0,32.0,,,,,,,,COMPLETE
9239,0.12622036262203626,2024-04-11 19:24:17.514536,2024-04-11 19:24:19.277929,0 days 00:00:01.763393,93.82562228741568,8.609133486262468,sigmoid,8,,23.0,29.0,,,,,,,,,,,,,COMPLETE
9240,0.3564871803889846,2024-04-11 19:24:19.277929,2024-04-11 19:24:21.821345,0 days 00:00:02.543416,96.74666567002569,7.9448727576287,sigmoid,11,,27.0,30.0,,,,,,2.5095839437248433,6.166218566465118,8.371417946308547,9.0,36.0,54.0,196.0,COMPLETE
9241,0.47009464825312786,2024-04-11 19:24:21.834368,2024-04-11 19:24:24.848426,0 days 00:00:03.014058,98.17447411407244,8.142888700610637,sigmoid,62,21.0,22.0,31.0,3.0,4.0,34.0,5.0,19.0,6.800586052496483,1.5114989131393912,5.131558120676469,6.0,25.0,84.0,,COMPLETE
9242,0.4676765629749722,2024-04-11 19:24:24.851424,2024-04-11 19:24:27.220874,0 days 00:00:02.369450,46.91512715339748,6.859855874335956,sigmoid,56,17.0,26.0,28.0,4.0,8.0,75.0,,,,,,,,,,COMPLETE
9243,0.34922822491730987,2024-04-11 19:24:27.223863,2024-04-11 19:24:29.345766,0 days 00:00:02.121903,95.62238080000144,9.020317290775331,sigmoid,37,34.0,,,,,,41.0,10.0,,,,,,,69.0,COMPLETE
9244,0.3858515627562231,2024-04-11 19:24:29.356791,2024-04-11 19:24:31.806706,0 days 00:00:02.449915,98.02178218783301,7.810854249489106,rbf,48,12.0,,,5.0,2.0,11.0,,,,,,,,,,COMPLETE
9245,0.430028394274787,2024-04-11 19:24:31.809753,2024-04-11 19:24:34.275776,0 days 00:00:02.466023,98.21974736309673,8.293272990770365,sigmoid,28,,25.0,32.0,1.0,7.0,83.0,31.0,15.0,,,,,,,,COMPLETE
9246,0.44701971028259324,2024-04-11 19:24:34.275776,2024-04-11 19:24:35.966045,0 days 00:00:01.690269,95.32544218725994,7.522212148659724,sigmoid,8,,28.0,30.0,,,,,,,,,,,,,COMPLETE
9247,0.37905148527611326,2024-04-11 19:24:35.969539,2024-04-11 19:24:38.377407,0 days 00:00:02.407868,96.51973378831971,7.999909958340028,sigmoid,52,31.0,,,3.0,5.0,60.0,10.0,35.0,,,,,,,,COMPLETE
9248,0.4926736199440345,2024-04-11 19:24:38.377407,2024-04-11 19:24:40.529162,0 days 00:00:02.151755,92.8380226175437,2.6074004595068923,sigmoid,8,,24.0,31.0,,,,,,,,,,,,,COMPLETE
9249,0.42448896867218716,2024-04-11 19:24:40.529162,2024-04-11 19:24:44.043243,0 days 00:00:03.514081,98.2729100786639,8.171964788651044,sigmoid,59,4.0,8.0,33.0,2.0,1.0,57.0,,,7.574431168266725,8.294995971970083,7.517547932462333,12.0,28.0,52.0,118.0,COMPLETE
9250,0.5091006299542062,2024-04-11 19:24:44.043243,2024-04-11 19:24:47.497891,0 days 00:00:03.454648,98.21688931883564,8.458420323536082,sigmoid,55,48.0,,,7.0,6.0,40.0,50.0,16.0,0.8944186412647293,2.998184783921623,1.6048583808654806,13.0,50.0,79.0,125.0,COMPLETE
9251,0.44701971028259324,2024-04-11 19:24:47.497891,2024-04-11 19:24:49.636776,0 days 00:00:02.138885,76.85954213323491,7.765313355473864,sigmoid,8,,25.0,30.0,,,,,,,,,,,,,COMPLETE
9252,0.5127819216042141,2024-04-11 19:24:49.636776,2024-04-11 19:24:51.621359,0 days 00:00:01.984583,95.36604900089024,8.02825953085059,sigmoid,13,,27.0,31.0,,,,30.0,36.0,,,,,,,98.0,COMPLETE
9253,0.37456886640607034,2024-04-11 19:24:51.624357,2024-04-11 19:24:54.103871,0 days 00:00:02.479514,96.8046468455951,8.824724178618993,sigmoid,12,,26.0,32.0,,,,46.0,39.0,,,,,,,,COMPLETE
9254,0.34703179828528014,2024-04-11 19:24:54.119499,2024-04-11 19:24:56.666360,0 days 00:00:02.546861,98.2106953857713,7.651399656146003,sigmoid,44,24.0,23.0,33.0,,,,38.0,44.0,,,,,,,,COMPLETE
9255,0.45345352376492626,2024-04-11 19:24:56.669356,2024-04-11 19:24:58.650109,0 days 00:00:01.980753,93.50484401636186,8.306799984398591,sigmoid,8,,29.0,30.0,,,,,,,,,,,,,COMPLETE
9256,0.5045025728987993,2024-04-11 19:24:58.650109,2024-04-11 19:25:01.943065,0 days 00:00:03.292956,98.25980479513132,7.91147468124601,sigmoid,23,,,,6.0,4.0,24.0,36.0,6.0,8.06088201712349,6.789027108595706,2.994484510458404,15.0,38.0,51.0,148.0,COMPLETE
9257,0.4283835904628331,2024-04-11 19:25:01.943065,2024-04-11 19:25:04.505105,0 days 00:00:02.562040,96.66300701460305,8.578373181732019,sigmoid,60,22.0,25.0,27.0,8.0,2.0,38.0,20.0,12.0,,,,,,,,COMPLETE
9258,0.6009432182607054,2024-04-11 19:25:04.505105,2024-04-11 19:25:06.651502,0 days 00:00:02.146397,95.37663285850363,8.163200923639259,sigmoid,8,,24.0,31.0,,,,,,,,,,,,,COMPLETE
9259,0.5694204506191922,2024-04-11 19:25:06.651502,2024-04-11 19:25:08.673009,0 days 00:00:02.021507,99.99777465419602,7.45695929766741,sigmoid,8,,22.0,11.0,,,,,,,,,,,,,COMPLETE
9260,0.5955035642478522,2024-04-11 19:25:08.688644,2024-04-11 19:25:10.556251,0 days 00:00:01.867607,98.30794520186052,7.928773275876744,sigmoid,8,,26.0,41.0,,,,,,,,,,,,,COMPLETE
9261,0.45975797705348476,2024-04-11 19:25:10.556251,2024-04-11 19:25:12.608156,0 days 00:00:02.051905,91.52723008910198,8.419287738028311,sigmoid,1,,,,,,,,,,,,,,,132.0,COMPLETE
9262,0.21483679525222552,2024-04-11 19:25:12.608156,2024-04-11 19:25:15.586588,0 days 00:00:02.978432,99.99863747553901,7.713387676393342,rbf,7,,,,,,,12.0,8.0,4.602065638713009,1.881489922105346,6.208512498157366,8.0,32.0,61.0,56.0,COMPLETE
9263,0.23573000404185565,2024-04-11 19:25:15.586588,2024-04-11 19:25:17.734598,0 days 00:00:02.148010,96.77026886762731,8.136393110443969,sigmoid,36,27.0,,,,,,7.0,48.0,,,,,,,,COMPLETE
9264,0.5150136879998276,2024-04-11 19:25:17.734598,2024-04-11 19:25:20.045532,0 days 00:00:02.310934,93.8347809899712,7.969599587758627,sigmoid,40,11.0,27.0,21.0,,,,,,,,,,,,,COMPLETE
9265,0.37779662122496904,2024-04-11 19:25:20.061185,2024-04-11 19:25:23.415736,0 days 00:00:03.354551,99.99574221058771,8.260946080564889,sigmoid,54,43.0,,,5.0,3.0,29.0,43.0,29.0,6.390616182417999,8.92744719452753,7.729664614556858,10.0,40.0,88.0,,COMPLETE
9266,0.12622036262203626,2024-04-11 19:25:23.431369,2024-04-11 19:25:25.784708,0 days 00:00:02.353339,98.18002894777126,7.770123283525927,sigmoid,8,,24.0,29.0,,,,,,,,,,,,,COMPLETE
9267,0.5069140556625241,2024-04-11 19:25:25.788696,2024-04-11 19:25:28.039991,0 days 00:00:02.251295,25.13516084726585,8.361957685169049,sigmoid,8,,26.0,35.0,,,,,,,,,,,,,COMPLETE
9268,0.46857538319577585,2024-04-11 19:25:28.043552,2024-04-11 19:25:30.907803,0 days 00:00:02.864251,96.54435194441504,8.114622295448015,sigmoid,61,45.0,25.0,32.0,4.0,8.0,89.0,21.0,33.0,,,,,,,169.0,COMPLETE
9269,0.4654516994633274,2024-04-11 19:25:30.907803,2024-04-11 19:25:34.434408,0 days 00:00:03.526605,95.15689324092946,4.164817945480764,sigmoid,30,,23.0,37.0,1.0,5.0,73.0,14.0,50.0,4.135269835953505,7.407475484591181,9.01550459561954,5.0,44.0,69.0,,COMPLETE
9270,0.5047791576287751,2024-04-11 19:25:34.434408,2024-04-11 19:25:36.518827,0 days 00:00:02.084419,96.7902273667558,8.69344413211511,sigmoid,32,2.0,,,,,,,,,,,,,,,COMPLETE
9271,0.4769661979254007,2024-04-11 19:25:36.518827,2024-04-11 19:25:39.433839,0 days 00:00:02.915012,98.230827875072,7.890136161830959,sigmoid,45,42.0,21.0,31.0,,,,27.0,20.0,,,,,,,72.0,COMPLETE
9272,0.5185325012769548,2024-04-11 19:25:39.449457,2024-04-11 19:25:41.734955,0 days 00:00:02.285498,98.29495341475852,7.234274443400544,sigmoid,33,15.0,,,,,,,,,,,,,,47.0,COMPLETE
9273,0.42777622290636563,2024-04-11 19:25:41.739200,2024-04-11 19:25:44.986767,0 days 00:00:03.247567,99.99450977683244,7.577043066931613,sigmoid,51,19.0,,,3.0,7.0,64.0,,,2.236321271326938,2.619136524721534,4.660114871064804,4.0,22.0,76.0,139.0,COMPLETE
9274,0.5929369437606513,2024-04-11 19:25:44.986767,2024-04-11 19:25:47.259273,0 days 00:00:02.272506,95.10813741291763,8.49981232613663,sigmoid,8,,25.0,33.0,,,,,,,,,,,,,COMPLETE
9275,0.46682905860438456,2024-04-11 19:25:47.259273,2024-04-11 19:25:50.407732,0 days 00:00:03.148459,99.97475394600293,8.074369241162639,sigmoid,27,,28.0,28.0,6.0,4.0,46.0,,,4.351703876282372,0.6794174155090102,1.2374386247824436,18.0,34.0,91.0,154.0,COMPLETE
9276,0.2513307104836843,2024-04-11 19:25:50.407732,2024-04-11 19:25:52.837284,0 days 00:00:02.429552,98.20162597183098,8.271419694087259,sigmoid,34,7.0,,,,,,,,0.6691132836546023,3.441914698989661,3.5117267090763744,17.0,30.0,66.0,,COMPLETE
9277,0.46903921617019173,2024-04-11 19:25:52.837284,2024-04-11 19:25:55.313877,0 days 00:00:02.476593,93.33964242781066,7.759939775954098,sigmoid,53,28.0,,,7.0,3.0,53.0,16.0,42.0,,,,,,,105.0,COMPLETE
9278,0.44701971028259324,2024-04-11 19:25:55.313877,2024-04-11 19:25:57.399335,0 days 00:00:02.085458,96.6677219544098,8.023352713598475,sigmoid,8,,27.0,30.0,,,,,,,,,,,,,COMPLETE
9279,0.5226001911307213,2024-04-11 19:25:57.399335,2024-04-11 19:25:59.577780,0 days 00:00:02.178445,98.20586884615027,8.250826406185741,sigmoid,5,,,,,,,18.0,21.0,,,,,,,93.0,COMPLETE
9280,0.4673745901877158,2024-04-11 19:25:59.577780,2024-04-11 19:26:02.241873,0 days 00:00:02.664093,87.08479900327187,7.87556120267178,rbf,4,,,,,,,35.0,18.0,,,,,,,,COMPLETE
9281,0.5906279643331437,2024-04-11 19:26:02.257502,2024-04-11 19:26:04.515978,0 days 00:00:02.258476,95.26770028517475,8.465095545789286,sigmoid,8,,24.0,34.0,,,,,,,,,,,,,COMPLETE
9282,0.37962902274365873,2024-04-11 19:26:04.529517,2024-04-11 19:26:06.897029,0 days 00:00:02.367512,96.93691548120019,7.446028985572489,sigmoid,17,,,,2.0,1.0,69.0,,,,,,,,,191.0,COMPLETE
9283,0.6009432182607054,2024-04-11 19:26:06.897029,2024-04-11 19:26:08.606541,0 days 00:00:01.709512,98.26073033273202,8.114471405757584,sigmoid,8,,26.0,31.0,,,,,,,,,,,,,COMPLETE
9284,0.47865869783678,2024-04-11 19:26:08.606541,2024-04-11 19:26:11.444565,0 days 00:00:02.838024,50.21095689310763,7.72457078694595,sigmoid,58,46.0,23.0,29.0,8.0,2.0,81.0,,,8.348805389640395,5.239944083513794,6.929147915532868,3.0,48.0,90.0,,COMPLETE
9285,0.46131864171150533,2024-04-11 19:26:11.447555,2024-04-11 19:26:13.605973,0 days 00:00:02.158418,94.43872350901165,8.672567501950086,sigmoid,29,,25.0,32.0,5.0,6.0,44.0,9.0,41.0,,,,,,,65.0,COMPLETE
9286,0.36044938754039224,2024-04-11 19:26:13.605973,2024-04-11 19:26:16.067134,0 days 00:00:02.461161,31.36228480844933,7.964906406948817,sigmoid,18,,,,3.0,5.0,91.0,,,6.0622248057174515,3.997780230812153,8.103001134966515,11.0,43.0,97.0,,COMPLETE
9287,0.47948218123656716,2024-04-11 19:26:16.067134,2024-04-11 19:26:18.820140,0 days 00:00:02.753006,99.97630883286628,8.33296026139617,sigmoid,50,37.0,,,4.0,8.0,96.0,,,3.2321785543708836,4.7549666852348595,9.446748363554681,2.0,47.0,81.0,,COMPLETE
9288,0.40246355839480463,2024-04-11 19:26:18.835770,2024-04-11 19:26:21.745714,0 days 00:00:02.909944,98.15566811143977,8.154272751511723,sigmoid,19,,,,2.0,3.0,100.0,,,5.285197758510147,5.989878268585084,6.556114075206924,10.0,27.0,63.0,178.0,COMPLETE
9289,0.2098599387811891,2024-04-11 19:26:21.745714,2024-04-11 19:26:24.035765,0 days 00:00:02.290051,90.51210747121006,7.607119507673618,sigmoid,6,,,,,,,44.0,45.0,7.229993362509718,7.843802384481302,8.5985029875241,19.0,45.0,59.0,,COMPLETE
9290,0.40804754747916383,2024-04-11 19:26:24.049291,2024-04-11 19:26:26.300864,0 days 00:00:02.251573,96.61663020090374,7.949693632989785,sigmoid,49,35.0,,,7.0,7.0,78.0,,,,,,,,,101.0,COMPLETE
