number,value,datetime_start,datetime_complete,duration,params_C,params_gamma,params_kernel,params_mask_number,params_rsi_window,params_so_smooth,params_so_window,params_srsi_smooth1,params_srsi_smooth2,params_srsi_window,params_tsi_window_fast,params_tsi_window_slow,params_ult_weight_1,params_ult_weight_2,params_ult_weight_3,params_ult_window_1,params_ult_window_2,params_ult_window_3,params_williams_lbp,state
6924,0.25176942273861636,2024-04-11 18:05:13.657754,2024-04-11 18:05:15.422526,0 days 00:00:01.764772,99.96586155865627,8.349862067420899,sigmoid,2,,,,,,,,,7.2755880425762705,2.74592995521007,5.600398810948227,9.0,22.0,84.0,,COMPLETE
6925,0.3916104239997416,2024-04-11 18:05:15.425527,2024-04-11 18:05:17.595180,0 days 00:00:02.169653,99.99743167104371,8.022762870386288,sigmoid,46,43.0,22.0,29.0,,,,21.0,6.0,5.81507621880613,6.12940234925361,9.398772281895267,12.0,38.0,54.0,,COMPLETE
6926,0.4011635960659371,2024-04-11 18:05:17.598736,2024-04-11 18:05:19.682757,0 days 00:00:02.084021,96.45512891689293,7.535874231373637,rbf,16,,,,3.0,5.0,74.0,,,,,,,,,,COMPLETE
6927,0.45345352376492626,2024-04-11 18:05:19.685770,2024-04-11 18:05:21.298048,0 days 00:00:01.612278,98.23558249976442,8.602813167787685,sigmoid,8,,26.0,30.0,,,,,,,,,,,,,COMPLETE
6928,0.5943780375673191,2024-04-11 18:05:21.301051,2024-04-11 18:05:22.734494,0 days 00:00:01.433443,99.99080287605459,8.100040366724794,sigmoid,8,,27.0,24.0,,,,,,,,,,,,,COMPLETE
6929,0.4774223211692962,2024-04-11 18:05:22.737035,2024-04-11 18:05:25.182015,0 days 00:00:02.444980,96.85255408931826,7.764954663925677,sigmoid,26,,23.0,31.0,2.0,2.0,38.0,,,5.322084285829798,3.486749591482835,9.831390394001458,14.0,33.0,60.0,,COMPLETE
6930,0.5931111524855706,2024-04-11 18:05:25.186015,2024-04-11 18:05:26.641564,0 days 00:00:01.455549,92.59365493844899,8.420266541844335,sigmoid,8,,25.0,26.0,,,,,,,,,,,,,COMPLETE
6931,0.5963643249384587,2024-04-11 18:05:26.645569,2024-04-11 18:05:27.952221,0 days 00:00:01.306652,95.08229598224477,8.273556837773029,sigmoid,8,,17.0,32.0,,,,,,,,,,,,,COMPLETE
6932,0.39102256361017756,2024-04-11 18:05:27.954221,2024-04-11 18:05:29.266196,0 days 00:00:01.311975,98.17839676155717,7.93036481500978,sigmoid,41,6.0,26.0,29.0,,,,,,,,,,,,97.0,COMPLETE
6933,0.45716049729183617,2024-04-11 18:05:29.269351,2024-04-11 18:05:31.883112,0 days 00:00:02.613761,96.82375186721522,8.094430759608965,sigmoid,62,18.0,24.0,30.0,6.0,8.0,98.0,2.0,42.0,1.3106163855868074,9.779257684918996,2.794959657980698,10.0,48.0,70.0,,COMPLETE
6934,0.5141264988399575,2024-04-11 18:05:31.888677,2024-04-11 18:05:34.818355,0 days 00:00:02.929678,94.58031979088778,7.575900595176331,sigmoid,11,,29.0,32.0,,,,,,4.348684675955679,5.624050634335727,2.307726432921917,4.0,37.0,73.0,124.0,COMPLETE
6935,0.4180514727938089,2024-04-11 18:05:34.822345,2024-04-11 18:05:36.613613,0 days 00:00:01.791268,98.25573261225394,7.867124112277243,sigmoid,20,,,,1.0,6.0,66.0,48.0,19.0,,,,,,,,COMPLETE
6936,0.44476768817963563,2024-04-11 18:05:36.615609,2024-04-11 18:05:39.830522,0 days 00:00:03.214913,96.68668300213166,8.321671120877285,sigmoid,63,24.0,22.0,31.0,7.0,3.0,12.0,8.0,20.0,3.959893266683939,0.6747116221747547,1.3193390354211312,6.0,45.0,63.0,31.0,COMPLETE
6937,0.5316591854042985,2024-04-11 18:05:39.833506,2024-04-11 18:05:42.296436,0 days 00:00:02.462930,98.02664533923054,8.169361202323152,sigmoid,10,,27.0,33.0,,,,,,9.337567201241342,9.276814373052547,9.089355551861019,3.0,24.0,80.0,,COMPLETE
6938,0.38951752863589034,2024-04-11 18:05:42.299969,2024-04-11 18:05:44.815974,0 days 00:00:02.516005,45.368415432692274,8.538808190578756,sigmoid,56,12.0,25.0,8.0,5.0,2.0,20.0,,,,,,,,,,COMPLETE
6939,0.5906279643331437,2024-04-11 18:05:44.819592,2024-04-11 18:05:46.502659,0 days 00:00:01.683067,94.92841040926757,8.945966531922293,sigmoid,8,,24.0,34.0,,,,,,,,,,,,,COMPLETE
6940,0.6009432182607054,2024-04-11 18:05:46.505657,2024-04-11 18:05:48.029869,0 days 00:00:01.524212,97.98403477189322,7.724385138158236,sigmoid,8,,26.0,31.0,,,,,,,,,,,,,COMPLETE
6941,0.39747812843126823,2024-04-11 18:05:48.032851,2024-04-11 18:05:50.457606,0 days 00:00:02.424755,99.94350687281722,7.377189976633295,sigmoid,28,,25.0,30.0,3.0,7.0,90.0,46.0,48.0,,,,,,,,COMPLETE
6942,0.5952371952371952,2024-04-11 18:05:50.459620,2024-04-11 18:05:52.168526,0 days 00:00:01.708906,40.61905802695941,7.960990680996324,sigmoid,8,,28.0,32.0,,,,,,,,,,,,,COMPLETE
6943,0.35590734877520414,2024-04-11 18:05:52.172499,2024-04-11 18:05:53.985495,0 days 00:00:01.812996,92.79709193609261,8.142995745172712,sigmoid,37,14.0,,,,,,45.0,17.0,,,,,,,61.0,COMPLETE
6944,0.4619872379216044,2024-04-11 18:05:53.989116,2024-04-11 18:05:56.374981,0 days 00:00:02.385865,98.187060300564,8.709071843440636,rbf,8,,23.0,29.0,,,,,,,,,,,,,COMPLETE
6945,0.347263403913908,2024-04-11 18:05:56.378481,2024-04-11 18:05:58.431513,0 days 00:00:02.053032,95.43167808712417,8.409784396556745,sigmoid,44,31.0,27.0,31.0,,,,14.0,39.0,,,,,,,,COMPLETE
6946,0.4627960432862419,2024-04-11 18:05:58.434588,2024-04-11 18:06:00.266762,0 days 00:00:01.832174,98.30346256368766,7.9378842736781445,sigmoid,52,38.0,,,8.0,4.0,62.0,6.0,18.0,,,,,,,,COMPLETE
6947,0.48880810179174244,2024-04-11 18:06:00.268766,2024-04-11 18:06:01.613668,0 days 00:00:01.344902,96.65781499937667,7.7018689846158646,sigmoid,8,,24.0,38.0,,,,,,,,,,,,,COMPLETE
6948,0.5695272343502648,2024-04-11 18:06:01.616844,2024-04-11 18:06:03.316072,0 days 00:00:01.699228,99.95686278816139,8.222439213691622,sigmoid,48,36.0,,,4.0,5.0,28.0,,,,,,,,,,COMPLETE
6949,0.4613908460789369,2024-04-11 18:06:03.319072,2024-04-11 18:06:06.142753,0 days 00:00:02.823681,99.9988981673525,8.01867463614228,sigmoid,59,11.0,26.0,33.0,6.0,8.0,58.0,,,9.83841844444899,2.2196893899392784,8.054691615862096,18.0,42.0,88.0,163.0,COMPLETE
6950,0.45507415684681024,2024-04-11 18:06:06.146762,2024-04-11 18:06:08.659294,0 days 00:00:02.512532,59.690280755427175,7.806875218642047,sigmoid,23,,,,7.0,3.0,72.0,29.0,24.0,6.276462466832401,4.098557117021755,6.1367690243001585,11.0,28.0,79.0,109.0,COMPLETE
6951,0.44701971028259324,2024-04-11 18:06:08.663500,2024-04-11 18:06:10.697008,0 days 00:00:02.033508,95.3353971232093,7.535714740301257,sigmoid,8,,25.0,30.0,,,,,,,,,,,,,COMPLETE
6952,0.3149423620677155,2024-04-11 18:06:10.700115,2024-04-11 18:06:12.791156,0 days 00:00:02.091041,96.77624139184151,8.330705377595947,sigmoid,12,,23.0,31.0,,,,26.0,32.0,,,,,,,,COMPLETE
6953,0.48125139775861636,2024-04-11 18:06:12.796173,2024-04-11 18:06:16.036046,0 days 00:00:03.239873,91.15562950644373,7.161948639662176,sigmoid,54,26.0,,,2.0,6.0,40.0,4.0,21.0,9.998582973961778,6.560942424684518,0.9120039140833729,15.0,34.0,50.0,,COMPLETE
6954,0.3484119345524543,2024-04-11 18:06:16.039621,2024-04-11 18:06:17.828305,0 days 00:00:01.788684,98.02388144831106,8.090194852522783,sigmoid,13,,30.0,28.0,,,,22.0,7.0,,,,,,,182.0,COMPLETE
6955,0.5220776404250705,2024-04-11 18:06:17.832210,2024-04-11 18:06:19.587192,0 days 00:00:01.754982,93.86005370042167,8.535866675396806,sigmoid,40,4.0,27.0,32.0,,,,,,,,,,,,,COMPLETE
6956,0.35899189549635807,2024-04-11 18:06:19.591830,2024-04-11 18:06:21.924454,0 days 00:00:02.332624,98.27131466677952,7.87570174392631,sigmoid,7,,,,,,,34.0,23.0,2.1876213556113973,1.359877254996174,3.8797259484309095,2.0,44.0,77.0,71.0,COMPLETE
6957,0.4694423750793256,2024-04-11 18:06:21.929583,2024-04-11 18:06:24.003625,0 days 00:00:02.074042,96.65687271881362,8.271251365006917,sigmoid,36,24.0,,,,,,44.0,30.0,,,,,,,,COMPLETE
6958,0.44701971028259324,2024-04-11 18:06:24.005641,2024-04-11 18:06:26.168563,0 days 00:00:02.162922,99.9844002068751,8.065946375096766,sigmoid,8,,21.0,30.0,,,,,,,,,,,,,COMPLETE
6959,0.3958172914035791,2024-04-11 18:06:26.172631,2024-04-11 18:06:29.208445,0 days 00:00:03.035814,96.61327549360787,7.622220712055,sigmoid,60,44.0,26.0,33.0,5.0,4.0,24.0,24.0,27.0,,,,,,,,COMPLETE
6960,0.35482872472141974,2024-04-11 18:06:29.213402,2024-04-11 18:06:32.459841,0 days 00:00:03.246439,98.23161999041227,8.456596358053638,sigmoid,61,41.0,25.0,31.0,1.0,1.0,14.0,49.0,9.0,,,,,,,156.0,COMPLETE
6961,0.484883275928052,2024-04-11 18:06:32.464841,2024-04-11 18:06:35.881755,0 days 00:00:03.416914,94.20706337678945,6.630646814831875,sigmoid,55,9.0,,,4.0,7.0,48.0,11.0,38.0,1.620375713320798,6.9671101741938735,1.88875289457184,19.0,47.0,66.0,170.0,COMPLETE
6962,0.4209914231719727,2024-04-11 18:06:35.883780,2024-04-11 18:06:38.708992,0 days 00:00:02.825212,99.96840489514544,8.190799753406703,sigmoid,30,,28.0,29.0,3.0,5.0,76.0,13.0,2.0,6.099524181859051,1.9449165324273086,5.388075504797139,12.0,41.0,86.0,,COMPLETE
6963,0.5952371952371952,2024-04-11 18:06:38.711003,2024-04-11 18:06:40.029281,0 days 00:00:01.318278,96.78717630275966,7.820011629439784,sigmoid,8,,23.0,32.0,,,,,,,,,,,,,COMPLETE
6964,0.4990738791833298,2024-04-11 18:06:40.031296,2024-04-11 18:06:41.304311,0 days 00:00:01.273015,99.9596097368761,7.4330268223745435,sigmoid,32,42.0,,,,,,,,,,,,,,,COMPLETE
6965,0.3993821712268314,2024-04-11 18:06:41.306308,2024-04-11 18:06:43.370941,0 days 00:00:02.064633,89.10711359491756,7.996910062826323,rbf,4,,,,,,,36.0,34.0,,,,,,,,COMPLETE
6966,0.45345352376492626,2024-04-11 18:06:43.372935,2024-04-11 18:06:45.069352,0 days 00:00:01.696417,99.97724069315908,8.281060374533903,sigmoid,8,,24.0,30.0,,,,,,,,,,,,,COMPLETE
6967,0.4751843980497562,2024-04-11 18:06:45.071364,2024-04-11 18:06:47.331032,0 days 00:00:02.259668,99.99540417178122,8.77518679464586,sigmoid,27,,27.0,34.0,8.0,8.0,85.0,,,6.610163036191559,5.246655162924929,4.720995411723612,13.0,50.0,100.0,149.0,COMPLETE
6968,0.2833957076300313,2024-04-11 18:06:47.335038,2024-04-11 18:06:49.299499,0 days 00:00:01.964461,95.19070450817637,5.560069414601651,sigmoid,34,8.0,,,,,,,,3.361387998765423,1.7110832475408784,7.1231040019730445,9.0,29.0,57.0,,COMPLETE
6969,0.3952091962880903,2024-04-11 18:06:49.302537,2024-04-11 18:06:50.849758,0 days 00:00:01.547221,96.6350441622482,7.69778337350218,sigmoid,5,,,,,,,42.0,44.0,,,,,,,77.0,COMPLETE
6970,0.5952371952371952,2024-04-11 18:06:50.851790,2024-04-11 18:06:52.282821,0 days 00:00:01.431031,98.04673645291498,7.98467107723162,sigmoid,8,,25.0,32.0,,,,,,,,,,,,,COMPLETE
6971,0.39758374519494777,2024-04-11 18:06:52.285421,2024-04-11 18:06:54.789431,0 days 00:00:02.504010,98.13257405991838,8.493316886204745,sigmoid,51,50.0,,,1.0,2.0,35.0,,,7.863408778774807,7.8864509656207495,4.9508268344952695,5.0,25.0,61.0,138.0,COMPLETE
6972,0.5526397155445621,2024-04-11 18:06:54.792401,2024-04-11 18:06:56.582223,0 days 00:00:01.789822,93.41278613903017,8.156018083049947,sigmoid,1,,,,,,,,,,,,,,,50.0,COMPLETE
6973,0.6009432182607054,2024-04-11 18:06:56.585213,2024-04-11 18:06:58.192182,0 days 00:00:01.606969,99.94634652238005,7.850520501407444,sigmoid,8,,26.0,31.0,,,,,,,,,,,,,COMPLETE
6974,0.4727985130858492,2024-04-11 18:06:58.197182,2024-04-11 18:07:00.515297,0 days 00:00:02.318115,95.76089912760222,8.34877755256735,sigmoid,19,,,,2.0,3.0,7.0,,,4.774159988671077,8.09507246971191,7.346002616076186,16.0,36.0,91.0,190.0,COMPLETE
6975,0.12622036262203626,2024-04-11 18:07:00.517323,2024-04-11 18:07:02.143387,0 days 00:00:01.626064,98.06373088721539,8.054350834775946,sigmoid,8,,24.0,29.0,,,,,,,,,,,,,COMPLETE
6976,0.32505660966658856,2024-04-11 18:07:02.146411,2024-04-11 18:07:03.864947,0 days 00:00:01.718536,98.22160568018259,7.708272742604475,sigmoid,33,28.0,,,,,,,,,,,,,,185.0,COMPLETE
6977,0.3698991363965983,2024-04-11 18:07:03.869473,2024-04-11 18:07:05.820163,0 days 00:00:01.950690,95.21129985380169,8.605459287122665,sigmoid,53,2.0,,,6.0,4.0,51.0,9.0,15.0,,,,,,,112.0,COMPLETE
6978,0.5986580986580987,2024-04-11 18:07:05.823221,2024-04-11 18:07:07.461095,0 days 00:00:01.637874,96.84794608280491,8.213460931487049,sigmoid,8,,28.0,31.0,,,,,,,,,,,,,COMPLETE
6979,0.48843673260112797,2024-04-11 18:07:07.464089,2024-04-11 18:07:08.988530,0 days 00:00:01.524441,91.88873354539756,7.873891895692653,sigmoid,17,,,,7.0,7.0,69.0,,,,,,,,,26.0,COMPLETE
6980,0.4511322055470117,2024-04-11 18:07:08.992082,2024-04-11 18:07:11.207758,0 days 00:00:02.215676,99.97819978462202,7.527773764630922,sigmoid,58,34.0,25.0,27.0,4.0,5.0,96.0,,,5.171646268092502,2.6102882808732115,5.855831144062767,8.0,32.0,65.0,,COMPLETE
6981,0.49106356648182964,2024-04-11 18:07:11.210293,2024-04-11 18:07:13.257259,0 days 00:00:02.046966,99.97853431046055,8.057215014444543,sigmoid,18,,,,5.0,2.0,55.0,,,0.6554822079634404,4.514135678235849,2.9490191256457994,4.0,43.0,51.0,,COMPLETE
6982,0.08501144836493864,2024-04-11 18:07:13.259841,2024-04-11 18:07:15.567881,0 days 00:00:02.308040,98.230151753157,8.363790789455493,rbf,29,,26.0,33.0,2.0,1.0,79.0,32.0,5.0,,,,,,,195.0,COMPLETE
6983,0.4008859357696567,2024-04-11 18:07:15.570384,2024-04-11 18:07:17.313345,0 days 00:00:01.742961,93.91389079710964,9.176609195836347,sigmoid,45,48.0,23.0,30.0,,,,15.0,11.0,,,,,,,65.0,COMPLETE
6984,0.4590289062884719,2024-04-11 18:07:17.316361,2024-04-11 18:07:18.932260,0 days 00:00:01.615899,96.21808070401119,7.850638726842522,sigmoid,49,46.0,,,3.0,6.0,83.0,,,,,,,,,100.0,COMPLETE
6985,0.35355196874678724,2024-04-11 18:07:18.935261,2024-04-11 18:07:21.304088,0 days 00:00:02.368827,96.7442014949151,8.18220227369415,sigmoid,50,7.0,,,7.0,7.0,18.0,,,1.9047014555180208,3.739531289195345,6.328812450456825,20.0,26.0,90.0,,COMPLETE
6986,0.5952371952371952,2024-04-11 18:07:21.307088,2024-04-11 18:07:22.488269,0 days 00:00:01.181181,98.20988816837028,7.967106995350268,sigmoid,8,,27.0,32.0,,,,,,,,,,,,,COMPLETE
6987,0.553065025847094,2024-04-11 18:07:22.491802,2024-04-11 18:07:24.052660,0 days 00:00:01.560858,95.0742684805792,8.667814174139721,sigmoid,6,,,,,,,27.0,12.0,9.662098796121944,9.475447585814361,8.564526038684614,17.0,49.0,97.0,,COMPLETE
6988,0.48295286095463974,2024-04-11 18:07:24.054658,2024-04-11 18:07:26.264502,0 days 00:00:02.209844,98.26009583034718,6.990094136700798,sigmoid,47,15.0,22.0,30.0,,,,10.0,29.0,1.0885278180358107,8.7047216237483,7.625605728585084,3.0,20.0,58.0,142.0,COMPLETE
6989,0.3286542356309798,2024-04-11 18:07:26.267506,2024-04-11 18:07:28.164232,0 days 00:00:01.896726,99.99463434657899,8.371255911132353,sigmoid,43,3.0,24.0,28.0,,,,,,7.659185053406015,7.269851174982697,1.5534192097576787,18.0,45.0,71.0,132.0,COMPLETE
6990,0.4363944522689837,2024-04-11 18:07:28.166229,2024-04-11 18:07:29.594860,0 days 00:00:01.428631,96.57419385585305,5.210757820330901,sigmoid,8,,25.0,12.0,,,,,,,,,,,,,COMPLETE
6991,0.40649244589628425,2024-04-11 18:07:29.597862,2024-04-11 18:07:31.382122,0 days 00:00:01.784260,98.24380646047494,5.818388517466897,sigmoid,25,,26.0,31.0,8.0,8.0,30.0,,,,,,,,,35.0,COMPLETE
6992,0.5929369437606513,2024-04-11 18:07:31.385119,2024-04-11 18:07:32.930441,0 days 00:00:01.545322,92.4487434194287,7.557847785719076,sigmoid,8,,24.0,33.0,,,,,,,,,,,,,COMPLETE
6993,0.4062565757171916,2024-04-11 18:07:32.933661,2024-04-11 18:07:34.548917,0 days 00:00:01.615256,95.09763375249413,7.308154197401473,sigmoid,24,,28.0,29.0,3.0,4.0,91.0,,,,,,,,,,COMPLETE
6994,0.5952371952371952,2024-04-11 18:07:34.552492,2024-04-11 18:07:35.973045,0 days 00:00:01.420553,98.06689346896637,7.7181149640941,sigmoid,8,,25.0,32.0,,,,,,,,,,,,,COMPLETE
6995,0.5184864432749318,2024-04-11 18:07:35.976701,2024-04-11 18:07:37.749110,0 days 00:00:01.772409,96.69818318728728,8.205090793630342,sigmoid,35,19.0,,,,,,,,5.509021776850614,5.026093971411877,2.538039539318792,10.0,37.0,73.0,200.0,COMPLETE
6996,0.5069140556625241,2024-04-11 18:07:37.752644,2024-04-11 18:07:39.371729,0 days 00:00:01.619085,53.73912004410706,8.048657946377814,sigmoid,8,,12.0,35.0,,,,,,,,,,,,,COMPLETE
6997,0.3521767832945346,2024-04-11 18:07:39.374723,2024-04-11 18:07:41.318976,0 days 00:00:01.944253,93.99310798342779,8.469489378523452,sigmoid,22,,,,5.0,1.0,10.0,39.0,43.0,4.480179737328378,6.7858514475081995,3.6537502407686544,15.0,35.0,92.0,,COMPLETE
6998,0.49427667660378216,2024-04-11 18:07:41.322538,2024-04-11 18:07:42.779757,0 days 00:00:01.457219,98.22319981689577,7.890744478798149,sigmoid,21,,,,6.0,3.0,43.0,33.0,22.0,,,,,,,13.0,COMPLETE
6999,0.31868534957083117,2024-04-11 18:07:42.782857,2024-04-11 18:07:44.474469,0 days 00:00:01.691612,96.75645466707074,8.179895818536426,sigmoid,38,10.0,,,,,,17.0,36.0,8.435276106168775,2.9939181039642264,4.363008650451797,14.0,30.0,94.0,,COMPLETE
7000,0.05547382616157901,2024-04-11 18:07:44.478483,2024-04-11 18:07:46.915433,0 days 00:00:02.436950,99.95485473522314,7.729608391270356,rbf,31,,29.0,31.0,1.0,6.0,88.0,23.0,41.0,4.176807957685565,4.26638824036878,4.088175405685938,6.0,31.0,75.0,120.0,COMPLETE
7001,0.49190803809710365,2024-04-11 18:07:46.919435,2024-04-11 18:07:49.509258,0 days 00:00:02.589823,99.95591530897147,8.019814524129535,sigmoid,15,,26.0,30.0,,,,19.0,31.0,5.048943847235834,7.685866229073824,5.290291727723639,2.0,27.0,84.0,18.0,COMPLETE
7002,0.48648348475088293,2024-04-11 18:07:49.513856,2024-04-11 18:07:51.505464,0 days 00:00:01.991608,49.752054122912156,8.354401862267395,sigmoid,57,29.0,27.0,32.0,4.0,5.0,33.0,,,,,,,,,127.0,COMPLETE
7003,0.5963245096172158,2024-04-11 18:07:51.508459,2024-04-11 18:07:52.675890,0 days 00:00:01.167431,95.15751292527162,8.580045163604797,sigmoid,8,,25.0,31.0,,,,,,,,,,,,,COMPLETE
7004,0.4741816223098206,2024-04-11 18:07:52.678882,2024-04-11 18:07:54.471135,0 days 00:00:01.792253,98.25594242507016,7.439339735010164,sigmoid,39,5.0,,,,,,2.0,49.0,2.550238893036588,9.140061485828708,7.866581950372047,13.0,33.0,68.0,87.0,COMPLETE
7005,0.5906279643331437,2024-04-11 18:07:54.476121,2024-04-11 18:07:55.784701,0 days 00:00:01.308580,98.11287221912846,7.94511019434686,sigmoid,8,,24.0,34.0,,,,,,,,,,,,,COMPLETE
7006,0.5004434242787834,2024-04-11 18:07:55.787963,2024-04-11 18:07:57.671715,0 days 00:00:01.883752,99.99788353702388,8.153009662579665,sigmoid,28,,23.0,30.0,7.0,3.0,59.0,30.0,3.0,,,,,,,,COMPLETE
7007,0.37518316000142954,2024-04-11 18:07:57.675753,2024-04-11 18:07:59.215394,0 days 00:00:01.539641,95.36089171276681,7.725032017947082,sigmoid,3,,,,,,,,,0.7904401307139333,0.915148892822371,0.6891077484078059,8.0,21.0,63.0,93.0,COMPLETE
7008,0.5963643249384587,2024-04-11 18:07:59.218386,2024-04-11 18:08:00.485744,0 days 00:00:01.267358,24.930657712453016,8.311326297130647,sigmoid,8,,26.0,32.0,,,,,,,,,,,,,COMPLETE
7009,0.3470938949130085,2024-04-11 18:08:00.488743,2024-04-11 18:08:02.716424,0 days 00:00:02.227681,96.89172980287809,8.934081287174838,sigmoid,14,,31.0,29.0,,,,38.0,17.0,8.701025833802179,8.45796208015288,3.36061476961663,16.0,23.0,99.0,,COMPLETE
7010,0.5929369437606513,2024-04-11 18:08:02.721973,2024-04-11 18:08:04.010900,0 days 00:00:01.288927,93.04186122133738,8.071627446896487,sigmoid,8,,27.0,33.0,,,,,,,,,,,,,COMPLETE
7011,0.33413706061861886,2024-04-11 18:08:04.014088,2024-04-11 18:08:05.375992,0 days 00:00:01.361904,98.16470720551395,7.866684774360464,sigmoid,9,,24.0,31.0,,,,,,,,,,,,80.0,COMPLETE
7012,0.363358125452511,2024-04-11 18:08:05.378986,2024-04-11 18:08:07.289011,0 days 00:00:01.910025,96.62323019585281,8.48174538559065,sigmoid,42,13.0,22.0,30.0,,,,,,6.969573009635092,8.910184694583569,6.717514946532902,11.0,39.0,59.0,,COMPLETE
7013,0.45273374840270797,2024-04-11 18:08:07.291527,2024-04-11 18:08:09.750458,0 days 00:00:02.458931,90.38951279669921,7.650543776678874,sigmoid,63,17.0,25.0,32.0,8.0,1.0,4.0,47.0,14.0,6.766644594798838,3.266975590904024,1.05762432820055,17.0,46.0,96.0,57.0,COMPLETE
7014,0.41007722254132356,2024-04-11 18:08:09.752997,2024-04-11 18:08:11.829610,0 days 00:00:02.076613,98.23845541874003,8.273788078236011,sigmoid,16,,,,2.0,2.0,67.0,,,,,,,,,,COMPLETE
7015,0.25591076898908177,2024-04-11 18:08:11.834173,2024-04-11 18:08:13.796180,0 days 00:00:01.962007,95.30554801567737,8.020605712720087,sigmoid,2,,,,,,,,,2.8301067948523912,0.5051796617453537,5.716104374307278,12.0,29.0,87.0,,COMPLETE
7016,0.3854930477378526,2024-04-11 18:08:13.803322,2024-04-11 18:08:16.595140,0 days 00:00:02.791818,8.755556215837075,8.730810667713799,sigmoid,46,20.0,26.0,31.0,,,,22.0,25.0,9.19398384792688,4.874256781457699,8.254495537831797,7.0,42.0,53.0,,COMPLETE
7017,0.12622036262203626,2024-04-11 18:08:16.599139,2024-04-11 18:08:18.074376,0 days 00:00:01.475237,98.1879540343828,7.8670919812011375,sigmoid,8,,23.0,29.0,,,,,,,,,,,,,COMPLETE
7018,0.472944519140516,2024-04-11 18:08:18.077368,2024-04-11 18:08:20.770196,0 days 00:00:02.692828,99.97693623883362,8.195299807467308,sigmoid,62,33.0,25.0,28.0,4.0,4.0,64.0,20.0,33.0,3.7875702269699962,1.5048906769026682,3.5129467671232986,5.0,48.0,67.0,,COMPLETE
7019,0.37183291485962106,2024-04-11 18:08:20.773802,2024-04-11 18:08:23.598112,0 days 00:00:02.824310,80.39569905392563,8.46154375537691,rbf,10,,28.0,33.0,,,,,,7.406812227770697,5.7698929542319455,7.449103445402605,10.0,25.0,55.0,,COMPLETE
7020,0.44701971028259324,2024-04-11 18:08:23.603718,2024-04-11 18:08:25.294184,0 days 00:00:01.690466,93.9615210246748,7.525364999502527,sigmoid,8,,26.0,30.0,,,,,,,,,,,,,COMPLETE
7021,0.5264570981094082,2024-04-11 18:08:25.296191,2024-04-11 18:08:27.564094,0 days 00:00:02.267903,96.76961428167964,8.092149542284918,sigmoid,11,,24.0,31.0,,,,,,8.101905005829163,6.287995006534405,8.966366148784081,3.0,36.0,78.0,160.0,COMPLETE
7022,0.4963115748604708,2024-04-11 18:08:27.566080,2024-04-11 18:08:29.460220,0 days 00:00:01.894140,96.88995719088234,7.729398872723341,sigmoid,41,22.0,4.0,32.0,,,,,,,,,,,,42.0,COMPLETE
7023,0.423523487945027,2024-04-11 18:08:29.463791,2024-04-11 18:08:31.732865,0 days 00:00:02.269074,99.99675926885322,8.308195924048066,sigmoid,26,,27.0,30.0,6.0,8.0,45.0,,,3.5501558979693524,1.1203069139986876,9.504963010963404,19.0,22.0,69.0,,COMPLETE
7024,0.5964036904537752,2024-04-11 18:08:31.735893,2024-04-11 18:08:33.248864,0 days 00:00:01.512971,99.98670631614638,7.2014196958288625,sigmoid,8,,21.0,31.0,,,,,,,,,,,,,COMPLETE
7025,0.4716839997104457,2024-04-11 18:08:33.250857,2024-04-11 18:08:35.283590,0 days 00:00:02.032733,98.28556921844061,7.89117449747253,sigmoid,56,39.0,25.0,32.0,1.0,7.0,36.0,,,,,,,,,,COMPLETE
