number,value,datetime_start,datetime_complete,duration,params_C,params_gamma,params_kernel,params_mask_number,params_rsi_window,params_so_smooth,params_so_window,params_srsi_smooth1,params_srsi_smooth2,params_srsi_window,params_tsi_window_fast,params_tsi_window_slow,params_ult_weight_1,params_ult_weight_2,params_ult_weight_3,params_ult_window_1,params_ult_window_2,params_ult_window_3,params_williams_lbp,state
9497,0.5929369437606513,2024-04-11 19:34:24.388480,2024-04-11 19:34:26.439713,0 days 00:00:02.051233,99.9641896778661,8.535502661413616,sigmoid,8,,25.0,33.0,,,,,,,,,,,,,COMPLETE
9498,0.46449120721791515,2024-04-11 19:34:26.439713,2024-04-11 19:34:29.856176,0 days 00:00:03.416463,93.97449588677199,8.193470357950904,sigmoid,62,20.0,29.0,29.0,2.0,6.0,54.0,19.0,4.0,3.003520177662313,1.7369447051091251,0.818382176597714,9.0,28.0,64.0,,COMPLETE
9499,0.5931679318644695,2024-04-11 19:34:29.856176,2024-04-11 19:34:31.882863,0 days 00:00:02.026687,95.26643491027579,7.833388787823782,sigmoid,8,,27.0,27.0,,,,,,,,,,,,,COMPLETE
9500,0.44701971028259324,2024-04-11 19:34:31.887851,2024-04-11 19:34:33.870170,0 days 00:00:01.982319,99.99524273845127,7.507902215002112,sigmoid,8,,26.0,30.0,,,,,,,,,,,,,COMPLETE
9501,0.4885910066215999,2024-04-11 19:34:33.870170,2024-04-11 19:34:36.623854,0 days 00:00:02.753684,96.72509562136162,8.128278178458286,sigmoid,10,,25.0,35.0,,,,,,7.901168909949622,6.946146665556096,8.723028162821665,19.0,25.0,80.0,,COMPLETE
9502,0.3323359401564093,2024-04-11 19:34:36.639473,2024-04-11 19:34:39.345918,0 days 00:00:02.706445,98.29916286532527,8.35750800420863,sigmoid,56,21.0,28.0,32.0,7.0,5.0,11.0,,,,,,,,,,COMPLETE
9503,0.522668206757147,2024-04-11 19:34:39.361550,2024-04-11 19:34:41.703107,0 days 00:00:02.341557,98.20369791022493,7.973700495043177,sigmoid,41,18.0,24.0,42.0,,,,,,,,,,,,123.0,COMPLETE
9504,0.04254068981726306,2024-04-11 19:34:41.703107,2024-04-11 19:34:46.111622,0 days 00:00:04.408515,99.98545869734858,7.711924042459326,rbf,63,3.0,23.0,32.0,4.0,1.0,29.0,21.0,9.0,8.884920572973172,4.013997165610817,6.402213878705345,4.0,42.0,74.0,129.0,COMPLETE
9505,0.4448341684562156,2024-04-11 19:34:46.111622,2024-04-11 19:34:48.048647,0 days 00:00:01.937025,92.29757091537104,8.73059487430264,sigmoid,8,,26.0,30.0,,,,,,,,,,,,,COMPLETE
9506,0.1953209306340916,2024-04-11 19:34:48.053648,2024-04-11 19:34:50.077973,0 days 00:00:02.024325,96.27353343411801,8.40584178967395,sigmoid,2,,,,,,,,,8.375001313842274,7.29003223109456,4.725087457736041,10.0,22.0,55.0,,COMPLETE
9507,0.38831540327094083,2024-04-11 19:34:50.077973,2024-04-11 19:34:52.567119,0 days 00:00:02.489146,96.41721956310691,8.175052777441284,sigmoid,26,,22.0,31.0,1.0,3.0,40.0,,,5.574361138730381,4.702166672135484,2.01524909896667,17.0,32.0,89.0,,COMPLETE
9508,0.4810885825845604,2024-04-11 19:34:52.567119,2024-04-11 19:34:54.687777,0 days 00:00:02.120658,74.33988783528838,9.751738409714829,sigmoid,20,,,,6.0,8.0,94.0,8.0,27.0,,,,,,,,COMPLETE
9509,0.12622036262203626,2024-04-11 19:34:54.687777,2024-04-11 19:34:56.230201,0 days 00:00:01.542424,98.24865607584995,7.968587279372826,sigmoid,8,,25.0,29.0,,,,,,,,,,,,,COMPLETE
9510,0.4596708655018285,2024-04-11 19:34:56.230201,2024-04-11 19:34:58.395811,0 days 00:00:02.165610,99.96767569266235,7.732062578217861,sigmoid,52,25.0,,,8.0,6.0,73.0,25.0,38.0,,,,,,,,COMPLETE
9511,0.45855592884287055,2024-04-11 19:34:58.395811,2024-04-11 19:35:01.759966,0 days 00:00:03.364155,98.17319029032943,8.303275080592044,sigmoid,55,12.0,,,3.0,4.0,83.0,36.0,15.0,2.1145493138398934,8.143307465431022,5.174488904722466,5.0,41.0,94.0,28.0,COMPLETE
9512,0.3567719191842614,2024-04-11 19:35:01.775584,2024-04-11 19:35:03.763025,0 days 00:00:01.987441,99.9686056167394,7.564795093284041,sigmoid,37,16.0,,,,,,41.0,40.0,,,,,,,93.0,COMPLETE
9513,0.5906279643331437,2024-04-11 19:35:03.763025,2024-04-11 19:35:05.425216,0 days 00:00:01.662191,65.12694788718747,8.51298868532987,sigmoid,8,,27.0,34.0,,,,,,,,,,,,,COMPLETE
9514,0.4864060041157245,2024-04-11 19:35:05.425216,2024-04-11 19:35:07.995912,0 days 00:00:02.570696,94.19003091319722,7.959508608642362,sigmoid,11,,24.0,33.0,,,,,,6.362991309465681,9.634874455193156,9.998370056058446,2.0,30.0,63.0,47.0,COMPLETE
9515,0.5118519370042534,2024-04-11 19:35:07.995912,2024-04-11 19:35:10.095804,0 days 00:00:02.099892,16.13573238564156,8.14931010299488,sigmoid,13,,26.0,31.0,,,,38.0,6.0,,,,,,,168.0,COMPLETE
9516,0.35434364621569653,2024-04-11 19:35:10.095804,2024-04-11 19:35:12.093960,0 days 00:00:01.998156,96.90221850207813,7.819690552607003,sigmoid,44,27.0,36.0,30.0,,,,43.0,20.0,,,,,,,,COMPLETE
9517,0.5998117115420825,2024-04-11 19:35:12.109586,2024-04-11 19:35:13.536389,0 days 00:00:01.426803,95.21037027965981,7.108084246349333,sigmoid,8,,30.0,32.0,,,,,,,,,,,,,COMPLETE
9518,0.41839788993272675,2024-04-11 19:35:13.536389,2024-04-11 19:35:16.191636,0 days 00:00:02.655247,98.17050710970024,7.39991289416791,sigmoid,60,44.0,23.0,30.0,5.0,2.0,37.0,10.0,12.0,,,,,,,,COMPLETE
9519,0.5106776280585689,2024-04-11 19:35:16.191636,2024-04-11 19:35:19.290220,0 days 00:00:03.098584,99.98656629326997,8.341687720523327,sigmoid,59,30.0,28.0,31.0,2.0,8.0,52.0,,,9.174926523771223,5.861792552974639,4.376040430192679,14.0,45.0,83.0,187.0,COMPLETE
9520,0.4512950859356088,2024-04-11 19:35:19.292326,2024-04-11 19:35:21.001401,0 days 00:00:01.709075,96.59377399425401,8.618147098773093,sigmoid,8,,26.0,28.0,,,,,,,,,,,,,COMPLETE
9521,0.543404889917978,2024-04-11 19:35:21.001401,2024-04-11 19:35:22.726039,0 days 00:00:01.724638,92.27443431013184,8.0926543833187,sigmoid,12,,24.0,33.0,,,,46.0,44.0,,,,,,,,COMPLETE
9522,0.12622036262203626,2024-04-11 19:35:22.726039,2024-04-11 19:35:24.309113,0 days 00:00:01.583074,96.76853080389542,7.844858927783723,sigmoid,8,,25.0,29.0,,,,,,,,,,,,,COMPLETE
9523,0.18026990687714756,2024-04-11 19:35:24.309113,2024-04-11 19:35:27.397213,0 days 00:00:03.088100,94.04986186623256,8.21063340206247,rbf,23,,,,4.0,7.0,9.0,15.0,29.0,1.8736074314307642,5.206050745058105,2.199113431053625,11.0,34.0,92.0,36.0,COMPLETE
9524,0.2836029474040823,2024-04-11 19:35:27.397213,2024-04-11 19:35:29.350416,0 days 00:00:01.953203,98.0189137823264,7.585696284332727,sigmoid,48,47.0,,,7.0,1.0,91.0,,,,,,,,,,COMPLETE
9525,0.34109657232257146,2024-04-11 19:35:29.353415,2024-04-11 19:35:31.158348,0 days 00:00:01.804933,98.28639177530646,7.975317885306828,sigmoid,1,,,,,,,,,,,,,,,75.0,COMPLETE
9526,0.5963643249384587,2024-04-11 19:35:31.158348,2024-04-11 19:35:33.057741,0 days 00:00:01.899393,98.22183901925197,8.41597654396492,sigmoid,8,,27.0,32.0,,,,,,,,,,,,,COMPLETE
9527,0.28998476026728154,2024-04-11 19:35:33.060736,2024-04-11 19:35:34.889503,0 days 00:00:01.828767,95.41407281890406,8.123168225822882,sigmoid,36,23.0,,,,,,31.0,5.0,,,,,,,,COMPLETE
9528,0.44701971028259324,2024-04-11 19:35:34.889503,2024-04-11 19:35:36.901812,0 days 00:00:02.012309,98.19725183002197,7.695763247557762,sigmoid,8,,25.0,30.0,,,,,,,,,,,,,COMPLETE
9529,0.5371240788687511,2024-04-11 19:35:36.904797,2024-04-11 19:35:38.711761,0 days 00:00:01.806964,96.74204636959713,7.976521097943618,sigmoid,40,42.0,22.0,31.0,,,,,,,,,,,,,COMPLETE
9530,0.27776431629109116,2024-04-11 19:35:38.723782,2024-04-11 19:35:41.142356,0 days 00:00:02.418574,94.08005528197793,9.449596320551752,sigmoid,7,,,,,,,12.0,19.0,1.253439068726519,1.4097968340741511,7.8785831798111285,3.0,48.0,87.0,16.0,COMPLETE
9531,0.4114497652020459,2024-04-11 19:35:41.157984,2024-04-11 19:35:44.228129,0 days 00:00:03.070145,98.280248845266,8.35149325434129,sigmoid,27,,26.0,32.0,1.0,2.0,2.0,,,2.590456075923253,4.440815560273811,9.270178743832833,8.0,43.0,90.0,62.0,COMPLETE
9532,0.4223368093564556,2024-04-11 19:35:44.228129,2024-04-11 19:35:47.350908,0 days 00:00:03.122779,90.4241157388022,8.732027122201556,sigmoid,30,,24.0,31.0,6.0,3.0,87.0,5.0,48.0,7.238133873850856,8.70469121410836,1.499976770445226,6.0,38.0,53.0,,COMPLETE
9533,0.12622036262203626,2024-04-11 19:35:47.366538,2024-04-11 19:35:49.206295,0 days 00:00:01.839757,95.36995374513303,7.817418075131844,sigmoid,8,,27.0,29.0,,,,,,,,,,,,,COMPLETE
9534,0.25499487704918034,2024-04-11 19:35:49.206295,2024-04-11 19:35:51.451964,0 days 00:00:02.245669,96.4163778530857,8.166410828801299,sigmoid,34,36.0,,,,,,,,4.66502572364373,5.600889596754953,6.916538001529415,20.0,21.0,76.0,,COMPLETE
9535,0.503337041156841,2024-04-11 19:35:51.451964,2024-04-11 19:35:52.988130,0 days 00:00:01.536166,98.16052763875327,7.9684643577786085,sigmoid,32,49.0,,,,,,,,,,,,,,,COMPLETE
9536,0.5929369437606513,2024-04-11 19:35:52.988130,2024-04-11 19:35:54.508225,0 days 00:00:01.520095,96.62499098927938,8.550493986398823,sigmoid,8,,25.0,33.0,,,,,,,,,,,,,COMPLETE
9537,0.45204519842841046,2024-04-11 19:35:54.508225,2024-04-11 19:35:57.015108,0 days 00:00:02.506883,98.27873057454097,7.261442102254815,sigmoid,61,40.0,23.0,30.0,2.0,5.0,98.0,33.0,42.0,,,,,,,24.0,COMPLETE
9538,0.5963643249384587,2024-04-11 19:35:57.015108,2024-04-11 19:35:58.536082,0 days 00:00:01.520974,98.24944007655562,8.237446177245237,sigmoid,8,,28.0,32.0,,,,,,,,,,,,,COMPLETE
9539,0.4262731304480807,2024-04-11 19:35:58.536082,2024-04-11 19:36:01.530739,0 days 00:00:02.994657,92.89746377755527,7.752496546219047,sigmoid,54,28.0,,,8.0,4.0,77.0,3.0,17.0,8.591845384990133,3.79765403828378,5.788991889139786,10.0,49.0,85.0,,COMPLETE
9540,0.4493622121393716,2024-04-11 19:36:01.530739,2024-04-11 19:36:03.207558,0 days 00:00:01.676819,98.20093470336077,7.504935417866478,sigmoid,4,,,,,,,50.0,23.0,,,,,,,,COMPLETE
9541,0.5483099489795918,2024-04-11 19:36:03.223185,2024-04-11 19:36:04.821188,0 days 00:00:01.598003,95.09670001010694,8.071705357388893,sigmoid,33,15.0,,,,,,,,,,,,,,148.0,COMPLETE
9542,0.1661058427653717,2024-04-11 19:36:04.821188,2024-04-11 19:36:07.685909,0 days 00:00:02.864721,99.97253771067574,8.391241328147343,rbf,53,19.0,,,4.0,6.0,5.0,22.0,8.0,,,,,,,162.0,COMPLETE
9543,0.42154441887872496,2024-04-11 19:36:07.685909,2024-04-11 19:36:10.188909,0 days 00:00:02.503000,95.47889214283757,7.881853210494372,sigmoid,51,31.0,,,3.0,7.0,67.0,,,3.169705381433815,3.4661446304876407,1.8282620335149096,15.0,36.0,71.0,66.0,COMPLETE
9544,0.12003789673140693,2024-04-11 19:36:10.193909,2024-04-11 19:36:11.879092,0 days 00:00:01.685183,96.3994862301418,8.244246432455691,sigmoid,8,,24.0,28.0,,,,,,,,,,,,,COMPLETE
9545,0.38621889567329787,2024-04-11 19:36:11.886953,2024-04-11 19:36:14.058986,0 days 00:00:02.172033,98.20518667146078,8.877655953618671,sigmoid,49,46.0,,,5.0,8.0,49.0,,,,,,,,,79.0,COMPLETE
9546,0.4301841948900772,2024-04-11 19:36:14.058986,2024-04-11 19:36:17.017122,0 days 00:00:02.958136,99.94521685414264,7.680100358346296,sigmoid,58,37.0,26.0,31.0,6.0,5.0,42.0,,,7.703325996016532,0.889343379644524,1.1776502432262825,17.0,50.0,68.0,,COMPLETE
9547,0.3413271659847003,2024-04-11 19:36:17.017122,2024-04-11 19:36:18.789333,0 days 00:00:01.772211,93.87110488145478,8.000394867356839,sigmoid,5,,,,,,,16.0,45.0,,,,,,,56.0,COMPLETE
9548,0.3938285036099297,2024-04-11 19:36:18.789333,2024-04-11 19:36:21.538040,0 days 00:00:02.748707,98.03718639689323,8.499561115933677,sigmoid,19,,,,7.0,6.0,46.0,,,5.241257924818351,1.9108580185538573,8.943766432473673,13.0,26.0,61.0,200.0,COMPLETE
9549,0.39626772310258546,2024-04-11 19:36:21.553679,2024-04-11 19:36:23.828391,0 days 00:00:02.274712,99.9935631414679,8.170216079890412,sigmoid,18,,,,3.0,4.0,79.0,,,6.480171592325613,4.940483473142278,6.140882886702775,2.0,29.0,97.0,,COMPLETE
9550,0.5895095625828441,2024-04-11 19:36:23.844018,2024-04-11 19:36:25.560629,0 days 00:00:01.716611,96.70228622131151,7.872277811201398,sigmoid,8,,25.0,34.0,,,,,,,,,,,,,COMPLETE
9551,0.5963245096172158,2024-04-11 19:36:25.576249,2024-04-11 19:36:27.499295,0 days 00:00:01.923046,96.65894574389769,8.376957296999723,sigmoid,8,,23.0,31.0,,,,,,,,,,,,,COMPLETE
9552,0.5929369437606513,2024-04-11 19:36:27.499295,2024-04-11 19:36:29.310233,0 days 00:00:01.810938,98.15347125034951,7.58642713522618,sigmoid,8,,27.0,33.0,,,,,,,,,,,,,COMPLETE
9553,0.48468339527689924,2024-04-11 19:36:29.310233,2024-04-11 19:36:31.677505,0 days 00:00:02.367272,99.97115715030486,8.094723862076698,sigmoid,45,32.0,26.0,30.0,,,,26.0,14.0,,,,,,,110.0,COMPLETE
9554,0.5456132000634619,2024-04-11 19:36:31.677505,2024-04-11 19:36:33.840672,0 days 00:00:02.163167,93.82869061558442,8.672475404868397,sigmoid,6,,,,,,,42.0,35.0,5.696901512645256,2.476428426252158,3.6466934381067366,7.0,44.0,58.0,,COMPLETE
9555,0.48679706601466993,2024-04-11 19:36:33.856301,2024-04-11 19:36:36.615507,0 days 00:00:02.759206,98.1698257064238,7.897460736752768,sigmoid,43,4.0,24.0,32.0,,,,,,2.3245609176932165,6.105694462239177,6.592456473064718,19.0,37.0,100.0,88.0,COMPLETE
9556,0.5094598232860954,2024-04-11 19:36:36.615507,2024-04-11 19:36:38.840895,0 days 00:00:02.225388,95.24073707070819,8.240583667323776,sigmoid,29,,25.0,30.0,1.0,2.0,63.0,6.0,26.0,,,,,,,137.0,COMPLETE
9557,0.32788712767810485,2024-04-11 19:36:38.856530,2024-04-11 19:36:41.082360,0 days 00:00:02.225830,91.96458420967981,7.3519105188158616,sigmoid,50,29.0,,,4.0,3.0,27.0,,,4.10712300409815,6.663741795979431,3.0707735120935795,16.0,47.0,66.0,,COMPLETE
9558,0.42613301942319015,2024-04-11 19:36:41.082360,2024-04-11 19:36:43.853686,0 days 00:00:02.771326,96.77463780375624,8.038377126404388,sigmoid,47,11.0,29.0,31.0,,,,27.0,49.0,6.792461065212618,2.753852087335393,3.995288392345089,12.0,33.0,52.0,100.0,COMPLETE
9559,0.12622036262203626,2024-04-11 19:36:43.855493,2024-04-11 19:36:45.643784,0 days 00:00:01.788291,98.30296829606975,7.818980369771613,sigmoid,8,,23.0,29.0,,,,,,,,,,,,,COMPLETE
9560,0.42346938775510207,2024-04-11 19:36:45.643784,2024-04-11 19:36:47.947243,0 days 00:00:02.303459,99.94871064306983,8.471698823462908,sigmoid,24,,26.0,32.0,8.0,1.0,71.0,,,,,,,,,,COMPLETE
9561,0.19223713430530076,2024-04-11 19:36:47.962890,2024-04-11 19:36:50.180770,0 days 00:00:02.217880,96.79200923455082,8.253711815894908,rbf,17,,,,5.0,5.0,20.0,,,,,,,,,193.0,COMPLETE
9562,0.12622036262203626,2024-04-11 19:36:50.183770,2024-04-11 19:36:51.725049,0 days 00:00:01.541279,95.20275619267973,7.575205709834107,sigmoid,8,,28.0,29.0,,,,,,,,,,,,,COMPLETE
9563,0.4918732853667374,2024-04-11 19:36:51.725049,2024-04-11 19:36:54.106812,0 days 00:00:02.381763,88.97014156227058,7.9754680846857795,sigmoid,25,,24.0,39.0,2.0,7.0,60.0,,,,,,,,,46.0,COMPLETE
9564,0.47195731427605686,2024-04-11 19:36:54.122439,2024-04-11 19:36:56.332939,0 days 00:00:02.210500,98.3633705858207,7.695299873414442,sigmoid,21,,,,3.0,2.0,31.0,9.0,16.0,,,,,,,121.0,COMPLETE
9565,0.49386691575919967,2024-04-11 19:36:56.332939,2024-04-11 19:36:58.824719,0 days 00:00:02.491780,98.20793269417285,8.132457660980318,sigmoid,22,,,,7.0,3.0,7.0,29.0,32.0,0.6899666540038449,3.2692944347630952,5.538535369717065,18.0,35.0,98.0,,COMPLETE
9566,0.5272172251479704,2024-04-11 19:36:58.824719,2024-04-11 19:37:00.814958,0 days 00:00:01.990239,29.584594034200805,8.358618776592225,sigmoid,35,34.0,,,,,,,,4.926957536411393,7.461847496740468,4.930508835798604,4.0,41.0,95.0,176.0,COMPLETE
9567,0.3458353973533366,2024-04-11 19:37:00.830589,2024-04-11 19:37:03.214168,0 days 00:00:02.383579,93.72604540154985,8.60526270339403,sigmoid,38,13.0,,,,,,35.0,21.0,2.826342462720361,8.85010648553829,2.690861149836374,8.0,30.0,88.0,,COMPLETE
9568,0.5952371952371952,2024-04-11 19:37:03.214168,2024-04-11 19:37:04.892296,0 days 00:00:01.678128,96.41123299771283,8.043749046940661,sigmoid,8,,27.0,32.0,,,,,,,,,,,,,COMPLETE
9569,0.5929369437606513,2024-04-11 19:37:04.892296,2024-04-11 19:37:06.630529,0 days 00:00:01.738233,98.24020245383689,7.801552645386106,sigmoid,8,,25.0,33.0,,,,,,,,,,,,,COMPLETE
9570,0.5636462904171639,2024-04-11 19:37:06.630529,2024-04-11 19:37:08.120486,0 days 00:00:01.489957,98.16745006906072,8.311036657977567,sigmoid,0,,,,,,,,,,,,,,,,COMPLETE
9571,0.4502230100640439,2024-04-11 19:37:08.120486,2024-04-11 19:37:11.254325,0 days 00:00:03.133839,95.37814126256681,8.114556408656856,sigmoid,31,,22.0,31.0,6.0,1.0,74.0,37.0,29.0,3.79970632014486,4.167429116112883,7.510482432448938,16.0,39.0,79.0,132.0,COMPLETE
9572,0.3894249576215934,2024-04-11 19:37:11.254325,2024-04-11 19:37:14.093131,0 days 00:00:02.838806,96.68989464426367,7.760739775016233,sigmoid,15,,26.0,36.0,,,,44.0,11.0,1.4930501011575457,7.793409314325111,7.158180163159367,9.0,20.0,81.0,157.0,COMPLETE
9573,0.40708135201130957,2024-04-11 19:37:14.108802,2024-04-11 19:37:16.631048,0 days 00:00:02.522246,98.24092092731712,8.523700346929287,sigmoid,39,2.0,,,,,,30.0,19.0,5.964842398245565,7.048656145347442,9.761488167086824,5.0,27.0,75.0,71.0,COMPLETE
9574,0.4292189469892537,2024-04-11 19:37:16.631048,2024-04-11 19:37:19.280135,0 days 00:00:02.649087,95.11928787834266,7.95584711472766,sigmoid,57,26.0,27.0,30.0,1.0,8.0,57.0,,,,,,,,,171.0,COMPLETE
9575,0.5941143180531975,2024-04-11 19:37:19.295753,2024-04-11 19:37:21.143904,0 days 00:00:01.848151,92.43002990803086,7.435166674410007,sigmoid,8,,25.0,31.0,,,,,,,,,,,,,COMPLETE
9576,0.5140877073392411,2024-04-11 19:37:21.143904,2024-04-11 19:37:22.853992,0 days 00:00:01.710088,98.15179423072665,8.248711412611852,sigmoid,9,,24.0,30.0,,,,,,,,,,,,33.0,COMPLETE
9577,0.5227677748417624,2024-04-11 19:37:22.853992,2024-04-11 19:37:24.922976,0 days 00:00:02.068984,98.17194197832413,7.88732269968285,sigmoid,3,,,,,,,,,9.804969349996293,8.312937044600837,5.976007350251107,15.0,42.0,93.0,126.0,COMPLETE
9578,0.12003789673140693,2024-04-11 19:37:24.922976,2024-04-11 19:37:26.599388,0 days 00:00:01.676412,96.33519867978067,7.598180717121799,sigmoid,8,,22.0,28.0,,,,,,,,,,,,,COMPLETE
9579,0.4537153088630259,2024-04-11 19:37:26.615428,2024-04-11 19:37:29.233458,0 days 00:00:02.618030,99.99797524311181,8.071114209485785,rbf,8,,41.0,32.0,,,,,,,,,,,,,COMPLETE
9580,0.4773926149208741,2024-04-11 19:37:29.233458,2024-04-11 19:37:31.663134,0 days 00:00:02.429676,94.0074522662926,3.810100261174169,sigmoid,28,,26.0,34.0,2.0,7.0,14.0,18.0,6.0,,,,,,,,COMPLETE
9581,0.3673013832989482,2024-04-11 19:37:31.663134,2024-04-11 19:37:33.840912,0 days 00:00:02.177778,96.78725946540129,8.398595611917337,sigmoid,42,6.0,28.0,31.0,,,,,,3.520495695447538,9.146746999399399,4.523588072375068,7.0,24.0,51.0,,COMPLETE
9582,0.12622036262203626,2024-04-11 19:37:33.840912,2024-04-11 19:37:35.631996,0 days 00:00:01.791084,98.26404692138948,8.845766952265194,sigmoid,8,,23.0,29.0,,,,,,,,,,,,,COMPLETE
9583,0.5032160780340692,2024-04-11 19:37:35.631996,2024-04-11 19:37:38.119890,0 days 00:00:02.487894,94.96280331136467,8.171744135551943,sigmoid,14,,25.0,33.0,,,,24.0,31.0,7.490041113986543,2.924771255791302,2.2444356561263143,14.0,23.0,72.0,,COMPLETE
9584,0.4595123499233088,2024-04-11 19:37:38.119890,2024-04-11 19:37:41.082193,0 days 00:00:02.962303,99.93153216870428,7.775048900118047,sigmoid,62,17.0,24.0,30.0,4.0,4.0,82.0,3.0,27.0,9.031290088625676,2.1350963943912444,5.303067309262601,18.0,31.0,57.0,,COMPLETE
9585,0.5254507355830095,2024-04-11 19:37:41.082193,2024-04-11 19:37:42.901211,0 days 00:00:01.819018,98.19289192570233,8.583661335943507,sigmoid,41,43.0,20.0,32.0,,,,,,,,,,,,188.0,COMPLETE
9586,0.3874909426256505,2024-04-11 19:37:42.916837,2024-04-11 19:37:45.690869,0 days 00:00:02.774032,99.96093694833633,8.024508321056153,sigmoid,46,9.0,21.0,34.0,,,,49.0,47.0,0.833095168269165,9.802761034950244,3.809929791803631,10.0,25.0,62.0,,COMPLETE
9587,0.4490335596085167,2024-04-11 19:37:45.690869,2024-04-11 19:37:48.778000,0 days 00:00:03.087131,99.94550511023418,9.11770535526078,sigmoid,63,28.0,27.0,31.0,5.0,5.0,34.0,11.0,3.0,9.310211159147578,4.602140714771972,9.644106101683317,3.0,38.0,91.0,50.0,COMPLETE
9588,0.5931111524855706,2024-04-11 19:37:48.778000,2024-04-11 19:37:50.408753,0 days 00:00:01.630753,85.7192127777508,8.315467299275225,sigmoid,8,,26.0,26.0,,,,,,,,,,,,,COMPLETE
9589,0.36121930022210064,2024-04-11 19:37:50.408753,2024-04-11 19:37:52.837559,0 days 00:00:02.428806,96.66316457510742,6.916758048495402,sigmoid,11,,25.0,31.0,,,,,,8.13424242228062,1.6270719576555281,0.9023611790990396,20.0,28.0,50.0,21.0,COMPLETE
9590,0.47529799449064186,2024-04-11 19:37:52.837559,2024-04-11 19:37:54.849621,0 days 00:00:02.012062,67.5105479677978,7.922646023903837,sigmoid,10,,23.0,30.0,,,,,,7.082725118207797,1.2531359459723364,9.126583751419702,11.0,46.0,86.0,,COMPLETE
9591,0.5998117115420825,2024-04-11 19:37:54.852618,2024-04-11 19:37:56.477399,0 days 00:00:01.624781,91.60228505437777,7.2358665806973335,sigmoid,8,,50.0,32.0,,,,,,,,,,,,,COMPLETE
9592,0.5578195237814813,2024-04-11 19:37:56.477399,2024-04-11 19:37:58.527951,0 days 00:00:02.050552,95.633565220791,8.187092569930488,sigmoid,20,,,,8.0,6.0,44.0,47.0,40.0,,,,,,,,COMPLETE
9593,0.4208793863622637,2024-04-11 19:37:58.527951,2024-04-11 19:38:00.205425,0 days 00:00:01.677474,99.98238584361054,7.6139514418853596,sigmoid,16,,,,7.0,8.0,89.0,,,,,,,,,,COMPLETE
9594,0.12622036262203626,2024-04-11 19:38:00.221043,2024-04-11 19:38:01.850927,0 days 00:00:01.629884,96.66173109758566,8.426323132293339,sigmoid,8,,25.0,29.0,,,,,,,,,,,,,COMPLETE
9595,0.36691943839627594,2024-04-11 19:38:01.850927,2024-04-11 19:38:03.919046,0 days 00:00:02.068119,99.97498487397725,7.808063976418032,sigmoid,37,24.0,,,,,,38.0,36.0,,,,,,,118.0,COMPLETE
9596,0.5929369437606513,2024-04-11 19:38:03.919046,2024-04-11 19:38:05.863450,0 days 00:00:01.944404,93.75404444945104,8.062563182677623,sigmoid,8,,29.0,33.0,,,,,,,,,,,,,COMPLETE
9597,0.4846398431710057,2024-04-11 19:38:05.863450,2024-04-11 19:38:08.418878,0 days 00:00:02.555428,98.18383038127172,7.429661025531841,sigmoid,56,45.0,27.0,30.0,1.0,3.0,24.0,,,,,,,,,,COMPLETE
9598,0.2847485012117862,2024-04-11 19:38:08.418878,2024-04-11 19:38:10.660136,0 days 00:00:02.241258,99.95871300399625,8.255701582664724,rbf,52,7.0,,,5.0,4.0,55.0,23.0,43.0,,,,,,,,COMPLETE
9599,0.5963245096172158,2024-04-11 19:38:10.660136,2024-04-11 19:38:12.290577,0 days 00:00:01.630441,96.77613638486883,8.63832097460579,sigmoid,8,,24.0,31.0,,,,,,,,,,,,,COMPLETE
