number,value,datetime_start,datetime_complete,duration,params_C,params_gamma,params_kernel,params_mask_number,params_rsi_window,params_so_smooth,params_so_window,params_srsi_smooth1,params_srsi_smooth2,params_srsi_window,params_tsi_window_fast,params_tsi_window_slow,params_ult_weight_1,params_ult_weight_2,params_ult_weight_3,params_ult_window_1,params_ult_window_2,params_ult_window_3,params_williams_lbp,state
0,0.18971881693478557,2024-04-11 16:02:32.353295,2024-04-11 16:02:32.922156,0 days 00:00:00.568861,82.08880832303043,7.384494584448869,rbf,15,,45.0,30.0,,,,8.0,42.0,6.36426737435607,7.946544455736712,3.689006108025188,17.0,41.0,75.0,79.0,COMPLETE
1,0.43072448439978844,2024-04-11 16:02:32.923192,2024-04-11 16:02:33.642955,0 days 00:00:00.719763,47.542216195722546,1.238401554567616,rbf,21,,,,6.0,1.0,58.0,39.0,36.0,,,,,,,67.0,COMPLETE
2,0.546753674263695,2024-04-11 16:02:33.644041,2024-04-11 16:02:33.857602,0 days 00:00:00.213561,29.97924662415354,0.2663083580086719,sigmoid,14,,39.0,25.0,,,,36.0,35.0,2.396328348911873,9.907882867368853,8.767583825926753,15.0,39.0,55.0,,COMPLETE
3,0.49506220651595106,2024-04-11 16:02:33.858595,2024-04-11 16:02:34.060271,0 days 00:00:00.201676,29.610933021084094,9.225365921841242,sigmoid,22,,,,1.0,8.0,97.0,17.0,18.0,8.931814980844065,6.065950844637754,9.424623539345756,2.0,26.0,51.0,,COMPLETE
4,0.25595807511541824,2024-04-11 16:02:34.061272,2024-04-11 16:02:34.592654,0 days 00:00:00.531382,14.359663792602957,7.2761484915924735,rbf,14,,11.0,11.0,,,,45.0,40.0,2.309741546573612,7.092400886232894,5.919989924551576,2.0,39.0,83.0,,COMPLETE
5,0.40816038899263596,2024-04-11 16:02:34.594654,2024-04-11 16:02:35.275187,0 days 00:00:00.680533,56.177297993613465,5.704407893869801,rbf,18,,,,5.0,6.0,13.0,,,3.057974689546472,4.765234304909889,4.0782312642950584,8.0,44.0,91.0,,COMPLETE
6,0.5867954807022094,2024-04-11 16:02:35.277159,2024-04-11 16:02:35.629618,0 days 00:00:00.352459,97.80515173903052,0.45726147892020996,sigmoid,16,,,,2.0,6.0,7.0,,,,,,,,,,COMPLETE
7,0.4099862123301162,2024-04-11 16:02:35.630619,2024-04-11 16:02:36.379180,0 days 00:00:00.748561,43.31405487041807,2.891991353377384,rbf,42,24.0,7.0,32.0,,,,,,6.300922637239266,8.591037156934982,7.695611948886833,19.0,49.0,94.0,,COMPLETE
8,0.4171174343052845,2024-04-11 16:02:36.380179,2024-04-11 16:02:36.978524,0 days 00:00:00.598345,19.78727244165214,3.76530645801936,rbf,42,26.0,50.0,31.0,,,,,,2.9487344739857178,3.212660659800496,6.684383979602798,19.0,39.0,83.0,,COMPLETE
9,0.40960919140047,2024-04-11 16:02:36.979523,2024-04-11 16:02:37.226861,0 days 00:00:00.247338,96.02136719112974,0.49995549189519456,sigmoid,28,,23.0,31.0,7.0,1.0,29.0,22.0,6.0,,,,,,,,COMPLETE
10,0.5310022201078337,2024-04-11 16:02:37.226861,2024-04-11 16:02:37.558032,0 days 00:00:00.331171,71.1880124574153,2.3672209352798363,sigmoid,8,,27.0,50.0,,,,,,,,,,,,,COMPLETE
11,0.2210812033476589,2024-04-11 16:02:37.559069,2024-04-11 16:02:37.956737,0 days 00:00:00.397668,0.1523527817102277,0.2376312811811347,sigmoid,14,,36.0,11.0,,,,35.0,26.0,0.747781200630899,0.5030673709162201,0.5246201846181204,13.0,28.0,51.0,,COMPLETE
12,0.5409353032790336,2024-04-11 16:02:37.957739,2024-04-11 16:02:38.214517,0 days 00:00:00.256778,65.5739232013353,1.9797458821525105,sigmoid,9,,38.0,45.0,,,,,,,,,,,,189.0,COMPLETE
13,0.4731105055336189,2024-04-11 16:02:38.215634,2024-04-11 16:02:38.511987,0 days 00:00:00.296353,99.03096388157628,4.356154101359015,sigmoid,16,,,,1.0,5.0,2.0,,,,,,,,,,COMPLETE
14,0.576813843664344,2024-04-11 16:02:38.512980,2024-04-11 16:02:38.884458,0 days 00:00:00.371478,33.037320034483464,0.05493780736532744,sigmoid,30,,23.0,3.0,3.0,8.0,49.0,31.0,50.0,4.5913129776712855,9.740865350673735,9.743154903689124,12.0,20.0,64.0,,COMPLETE
15,0.47969408617077663,2024-04-11 16:02:38.885456,2024-04-11 16:02:39.345483,0 days 00:00:00.460027,81.2567921169655,1.6330113619466267,sigmoid,30,,18.0,2.0,3.0,8.0,55.0,27.0,18.0,8.308670890431097,9.906956349159682,1.4355643870650905,9.0,20.0,66.0,,COMPLETE
16,0.4315583542214342,2024-04-11 16:02:39.346492,2024-04-11 16:02:39.708911,0 days 00:00:00.362419,39.047187752502964,3.511640407437068,sigmoid,30,,2.0,2.0,3.0,6.0,81.0,5.0,50.0,4.777415949831278,3.809915842860536,9.857321632651665,6.0,30.0,66.0,,COMPLETE
17,0.5664599940950694,2024-04-11 16:02:39.709910,2024-04-11 16:02:40.004930,0 days 00:00:00.295020,58.671234769688944,5.154480964866187,sigmoid,16,,,,3.0,7.0,34.0,,,,,,,,,,COMPLETE
18,0.4475995565788351,2024-04-11 16:02:40.004930,2024-04-11 16:02:40.450315,0 days 00:00:00.445385,87.09091082361219,1.1075255322255622,sigmoid,63,48.0,29.0,13.0,2.0,3.0,31.0,49.0,50.0,4.786099127732752,2.596897644408384,7.675153014706448,11.0,20.0,64.0,17.0,COMPLETE
19,0.5024864812668984,2024-04-11 16:02:40.451315,2024-04-11 16:02:40.800813,0 days 00:00:00.349498,0.31665407844789684,2.785619907626387,sigmoid,46,3.0,17.0,20.0,,,,25.0,5.0,7.184532441760396,6.055177054023049,4.172442302909623,13.0,33.0,75.0,,COMPLETE
20,0.4969872626039204,2024-04-11 16:02:40.801859,2024-04-11 16:02:41.084264,0 days 00:00:00.282405,33.081244999599846,6.366689919310532,sigmoid,11,,31.0,40.0,,,,,,9.98865095798358,1.5567872216850271,2.556100777636807,5.0,25.0,100.0,178.0,COMPLETE
21,0.5658152464238371,2024-04-11 16:02:41.085266,2024-04-11 16:02:41.378379,0 days 00:00:00.293113,56.27318275172845,5.2746751357457615,sigmoid,16,,,,3.0,7.0,36.0,,,,,,,,,,COMPLETE
22,0.27107872900222624,2024-04-11 16:02:41.378379,2024-04-11 16:02:41.691336,0 days 00:00:00.312957,68.19149780068348,4.518014054385415,sigmoid,10,,19.0,18.0,,,,,,4.345665686729054,8.080530117739242,5.501754769564635,16.0,35.0,63.0,,COMPLETE
23,0.4793810840322468,2024-04-11 16:02:41.691336,2024-04-11 16:02:42.016601,0 days 00:00:00.325265,20.045495895178263,9.656020477143466,sigmoid,26,,10.0,7.0,4.0,7.0,43.0,,,0.7051185252109589,4.680691186907525,8.280625691428451,10.0,23.0,57.0,,COMPLETE
24,0.46239253254728574,2024-04-11 16:02:42.017616,2024-04-11 16:02:42.268440,0 days 00:00:00.250824,58.159881608112094,6.154238983357506,sigmoid,16,,,,2.0,7.0,17.0,,,,,,,,,,COMPLETE
25,0.4913112965828661,2024-04-11 16:02:42.269439,2024-04-11 16:02:42.711460,0 days 00:00:00.442021,88.38714209914477,7.619718797676745,sigmoid,62,46.0,23.0,39.0,4.0,5.0,64.0,13.0,24.0,3.797616226210007,6.7954031128823456,6.001795364921719,13.0,31.0,71.0,,COMPLETE
26,0.4901748380527331,2024-04-11 16:02:42.712581,2024-04-11 16:02:43.182573,0 days 00:00:00.469992,76.84399859427302,0.8389557167609181,sigmoid,37,3.0,,,,,,30.0,32.0,,,,,,,138.0,COMPLETE
27,0.36332006289518587,2024-04-11 16:02:43.183772,2024-04-11 16:02:43.490572,0 days 00:00:00.306800,11.092799964938457,8.54283289127776,sigmoid,41,16.0,33.0,20.0,,,,,,,,,,,,10.0,COMPLETE
28,0.0,2024-04-11 16:02:43.491620,2024-04-11 16:02:43.963536,0 days 00:00:00.471916,36.36757440748454,0.010832604669902324,sigmoid,20,,,,2.0,8.0,15.0,42.0,44.0,,,,,,,,COMPLETE
29,0.36765020312165914,2024-04-11 16:02:43.965070,2024-04-11 16:02:44.850874,0 days 00:00:00.885804,49.11683558668817,3.7319203866273876,rbf,52,38.0,,,3.0,6.0,45.0,18.0,13.0,,,,,,,,COMPLETE
30,0.3718134366054891,2024-04-11 16:02:44.850874,2024-04-11 16:02:45.146476,0 days 00:00:00.295602,61.547236313680784,4.779352861203181,sigmoid,60,37.0,14.0,25.0,5.0,4.0,2.0,31.0,32.0,,,,,,,,COMPLETE
31,0.5637734351750817,2024-04-11 16:02:45.147617,2024-04-11 16:02:45.456757,0 days 00:00:00.309140,54.90210155608605,5.517421463912066,sigmoid,16,,,,3.0,7.0,32.0,,,,,,,,,,COMPLETE
32,0.38054602232322293,2024-04-11 16:02:45.457794,2024-04-11 16:02:45.795973,0 days 00:00:00.338179,73.68379340291125,6.813320865295363,sigmoid,56,14.0,43.0,16.0,2.0,7.0,40.0,,,,,,,,,,COMPLETE
33,0.4732674253554798,2024-04-11 16:02:45.796985,2024-04-11 16:02:46.175199,0 days 00:00:00.378214,44.624136811554024,5.268243205950204,sigmoid,59,37.0,2.0,5.0,4.0,8.0,69.0,,,6.0522949100102945,8.525002694896898,6.846275458504589,7.0,46.0,81.0,135.0,COMPLETE
34,0.4441298603246509,2024-04-11 16:02:46.176192,2024-04-11 16:02:46.654073,0 days 00:00:00.477881,28.628993852092094,1.4631540112201438,sigmoid,55,15.0,,,3.0,6.0,21.0,10.0,25.0,7.394733761224108,9.180075247186892,4.80284888456094,14.0,23.0,58.0,57.0,COMPLETE
35,0.29939742428419513,2024-04-11 16:02:46.655074,2024-04-11 16:02:47.373916,0 days 00:00:00.718842,52.25987524201473,7.870872917917463,rbf,44,32.0,23.0,37.0,,,,2.0,11.0,,,,,,,,COMPLETE
36,0.39524133628268393,2024-04-11 16:02:47.374929,2024-04-11 16:02:47.695680,0 days 00:00:00.320751,63.25437649154862,6.0786010076975465,sigmoid,48,9.0,,,2.0,7.0,49.0,,,,,,,,,,COMPLETE
37,0.2876762572336783,2024-04-11 16:02:47.696680,2024-04-11 16:02:48.474913,0 days 00:00:00.778233,42.07025682355284,3.124850215540904,rbf,23,,,,1.0,7.0,37.0,49.0,46.0,1.727121727810018,7.095056978538109,2.8789881113175353,4.0,35.0,70.0,117.0,COMPLETE
38,0.5456458676980831,2024-04-11 16:02:48.476914,2024-04-11 16:02:48.871916,0 days 00:00:00.395002,24.01746050441087,2.0970431891029326,sigmoid,12,,7.0,7.0,,,,34.0,38.0,,,,,,,,COMPLETE
39,0.28079199836701363,2024-04-11 16:02:48.872915,2024-04-11 16:02:49.512559,0 days 00:00:00.639644,10.669437993208568,4.073525489169935,rbf,13,,49.0,23.0,,,,21.0,29.0,,,,,,,168.0,COMPLETE
40,0.37145283419432445,2024-04-11 16:02:49.513560,2024-04-11 16:02:49.827329,0 days 00:00:00.313769,90.72831033689462,5.115595098448213,sigmoid,7,,,,,,,41.0,20.0,5.697492176067536,5.329859641596007,8.879758431189732,17.0,50.0,87.0,89.0,COMPLETE
41,0.19234070380512525,2024-04-11 16:02:49.828332,2024-04-11 16:02:50.073368,0 days 00:00:00.245036,55.253980606055634,5.53080988155166,sigmoid,16,,,,3.0,7.0,29.0,,,,,,,,,,COMPLETE
42,0.5664599940950694,2024-04-11 16:02:50.074371,2024-04-11 16:02:50.379259,0 days 00:00:00.304888,48.08904544400011,5.721330151898759,sigmoid,16,,,,3.0,8.0,34.0,,,,,,,,,,COMPLETE
43,0.3211885524428,2024-04-11 16:02:50.379259,2024-04-11 16:02:50.602054,0 days 00:00:00.222795,47.48233419819529,6.95040770314789,sigmoid,36,21.0,,,,,,13.0,46.0,,,,,,,,COMPLETE
44,0.38628855430492615,2024-04-11 16:02:50.603191,2024-04-11 16:02:50.937148,0 days 00:00:00.333957,35.416672995167225,5.878597602783981,sigmoid,27,,34.0,15.0,4.0,8.0,24.0,,,3.7204397241118192,2.4968463366618963,9.961014501224145,11.0,28.0,60.0,42.0,COMPLETE
45,0.4190305943031298,2024-04-11 16:02:50.938196,2024-04-11 16:02:51.323821,0 days 00:00:00.385625,59.735751369391714,0.7112290084055595,sigmoid,54,43.0,,,2.0,8.0,38.0,27.0,11.0,9.996272636621221,5.874309982908773,7.1217167235899215,20.0,43.0,71.0,,COMPLETE
46,0.408590688195642,2024-04-11 16:02:51.324822,2024-04-11 16:02:51.644535,0 days 00:00:00.319713,80.7901803789569,4.960879060426996,sigmoid,61,31.0,42.0,50.0,3.0,6.0,49.0,46.0,32.0,,,,,,,153.0,COMPLETE
47,0.5517424480805537,2024-04-11 16:02:51.645536,2024-04-11 16:02:51.981575,0 days 00:00:00.336039,41.281484342350936,6.604795929569036,sigmoid,40,50.0,47.0,35.0,,,,,,,,,,,,,COMPLETE
48,0.35026024289336716,2024-04-11 16:02:51.982575,2024-04-11 16:02:52.696541,0 days 00:00:00.713966,28.196925220347886,4.080069209848425,rbf,32,8.0,,,,,,,,,,,,,,,COMPLETE
49,0.5623743476230125,2024-04-11 16:02:52.697567,2024-04-11 16:02:53.017104,0 days 00:00:00.319537,52.542100049207974,4.612022585661799,sigmoid,2,,,,,,,,,7.865939043934059,4.0864399759869645,4.898299126930681,9.0,22.0,79.0,,COMPLETE
50,0.5615081732490157,2024-04-11 16:02:53.018106,2024-04-11 16:02:53.275481,0 days 00:00:00.257375,67.99266471907109,0.34474395728396545,sigmoid,4,,,,,,,31.0,21.0,,,,,,,,COMPLETE
51,0.5369548133595284,2024-04-11 16:02:53.275481,2024-04-11 16:02:53.515390,0 days 00:00:00.239909,45.481026816176445,5.694524873079542,sigmoid,5,,,,,,,38.0,2.0,,,,,,,103.0,COMPLETE
52,0.44207955338450805,2024-04-11 16:02:53.516388,2024-04-11 16:02:53.804047,0 days 00:00:00.287659,53.60477830289774,5.439864514633535,sigmoid,16,,,,3.0,7.0,35.0,,,,,,,,,,COMPLETE
53,0.48342191167345616,2024-04-11 16:02:53.805048,2024-04-11 16:02:54.087180,0 days 00:00:00.282132,65.09010215211815,4.296277863990486,sigmoid,16,,,,3.0,8.0,26.0,,,,,,,,,,COMPLETE
54,0.5309850107066382,2024-04-11 16:02:54.088296,2024-04-11 16:02:54.366652,0 days 00:00:00.278356,56.517806348215196,7.076004643227539,sigmoid,34,30.0,,,,,,,,6.913444033544778,9.315009061846506,2.289317590066111,12.0,35.0,100.0,,COMPLETE
55,0.39848191108336345,2024-04-11 16:02:54.367653,2024-04-11 16:02:54.647753,0 days 00:00:00.280100,49.84463864799046,6.4344719992357575,sigmoid,53,20.0,,,4.0,7.0,33.0,16.0,42.0,,,,,,,198.0,COMPLETE
56,0.48624119654396275,2024-04-11 16:02:54.648754,2024-04-11 16:02:55.018410,0 days 00:00:00.369656,38.987251881474606,3.324140708208801,sigmoid,51,42.0,,,8.0,7.0,61.0,,,5.2767138977660215,7.637134946288567,8.44047733974986,15.0,32.0,76.0,29.0,COMPLETE
57,0.5372565541278078,2024-04-11 16:02:55.019408,2024-04-11 16:02:55.304598,0 days 00:00:00.285190,71.7399000331374,2.6437095660832663,sigmoid,33,10.0,,,,,,,,,,,,,,106.0,COMPLETE
58,0.43683807035974903,2024-04-11 16:02:55.305632,2024-04-11 16:02:55.592950,0 days 00:00:00.287318,99.33349823816862,5.012973557568716,sigmoid,17,,,,2.0,8.0,55.0,,,,,,,,,51.0,COMPLETE
59,0.585513790372854,2024-04-11 16:02:55.593950,2024-04-11 16:02:55.853484,0 days 00:00:00.259534,94.80105604683848,1.1066509160290343,sigmoid,0,,,,,,,,,,,,,,,,COMPLETE
60,0.5032551200325512,2024-04-11 16:02:55.854502,2024-04-11 16:02:56.222358,0 days 00:00:00.367856,95.62038961123159,1.1481546552027622,sigmoid,45,20.0,25.0,28.0,,,,7.0,37.0,,,,,,,131.0,COMPLETE
61,0.5863711449328822,2024-04-11 16:02:56.223372,2024-04-11 16:02:56.451085,0 days 00:00:00.227713,93.48491787579778,0.6286751891965339,sigmoid,0,,,,,,,,,,,,,,,,COMPLETE
62,0.5854322450482764,2024-04-11 16:02:56.451085,2024-04-11 16:02:56.683327,0 days 00:00:00.232242,93.89480974423222,0.7523452357375572,sigmoid,0,,,,,,,,,,,,,,,,COMPLETE
63,0.5863711449328822,2024-04-11 16:02:56.683327,2024-04-11 16:02:56.922810,0 days 00:00:00.239483,92.19899828855034,0.6984786993369576,sigmoid,0,,,,,,,,,,,,,,,,COMPLETE
64,0.5863711449328822,2024-04-11 16:02:56.923861,2024-04-11 16:02:57.157933,0 days 00:00:00.234072,94.03886317967404,0.6816572987466492,sigmoid,0,,,,,,,,,,,,,,,,COMPLETE
65,0.5863711449328822,2024-04-11 16:02:57.157933,2024-04-11 16:02:57.407804,0 days 00:00:00.249871,93.84798376919049,0.6999717579526017,sigmoid,0,,,,,,,,,,,,,,,,COMPLETE
66,0.5836206735876839,2024-04-11 16:02:57.407804,2024-04-11 16:02:57.679719,0 days 00:00:00.271915,93.96465985519039,1.7428207924674224,sigmoid,0,,,,,,,,,,,,,,,,COMPLETE
67,0.5873898933704218,2024-04-11 16:02:57.680719,2024-04-11 16:02:57.917313,0 days 00:00:00.236594,84.44989549908132,0.7946756603106854,sigmoid,0,,,,,,,,,,,,,,,,COMPLETE
68,0.37216860677212876,2024-04-11 16:02:57.918297,2024-04-11 16:02:58.655380,0 days 00:00:00.737083,85.21585229916026,1.29727775771632,rbf,0,,,,,,,,,,,,,,,,COMPLETE
69,0.10504933255948928,2024-04-11 16:02:58.655380,2024-04-11 16:02:58.925669,0 days 00:00:00.270289,90.85219214129185,0.507842996210326,sigmoid,0,,,,,,,,,,,,,,,,COMPLETE
70,0.5868360544555274,2024-04-11 16:02:58.926670,2024-04-11 16:02:59.161881,0 days 00:00:00.235211,83.6600988737735,1.028016354897624,sigmoid,0,,,,,,,,,,,,,,,,COMPLETE
71,0.5880365043344815,2024-04-11 16:02:59.161881,2024-04-11 16:02:59.405486,0 days 00:00:00.243605,84.98349014162419,0.9818046150978497,sigmoid,0,,,,,,,,,,,,,,,,COMPLETE
72,0.3766733964901382,2024-04-11 16:02:59.406487,2024-04-11 16:02:59.750342,0 days 00:00:00.343855,84.08787436072173,1.7123703114120499,sigmoid,19,,,,6.0,2.0,9.0,,,1.581000512072317,1.3713891364900466,3.45705401435594,4.0,47.0,94.0,154.0,COMPLETE
73,0.13026268441885572,2024-04-11 16:02:59.751342,2024-04-11 16:02:59.943209,0 days 00:00:00.191867,79.1412722267294,0.2440061458124102,sigmoid,0,,,,,,,,,,,,,,,,COMPLETE
74,0.4520663317166671,2024-04-11 16:02:59.944209,2024-04-11 16:03:00.384811,0 days 00:00:00.440602,90.43200445823108,0.9309308360656892,sigmoid,58,27.0,41.0,46.0,6.0,4.0,90.0,,,9.095504350260015,0.7370882009909296,0.7177006228731662,18.0,42.0,88.0,,COMPLETE
75,0.4095022624434389,2024-04-11 16:03:00.385812,2024-04-11 16:03:00.785442,0 days 00:00:00.399630,98.09168263884956,0.5224215922383451,sigmoid,50,34.0,,,7.0,1.0,81.0,,,9.044447104868787,1.7910789817891732,1.219848567947258,3.0,38.0,95.0,,COMPLETE
76,0.26569380882479926,2024-04-11 16:03:00.786493,2024-04-11 16:03:01.095581,0 days 00:00:00.309088,87.03890248869408,2.157379072753988,sigmoid,6,,,,,,,2.0,14.0,1.5582574190724343,3.2685842543283954,3.4286275919643456,7.0,37.0,87.0,,COMPLETE
77,0.3861104527139132,2024-04-11 16:03:01.096579,2024-04-11 16:03:01.415322,0 days 00:00:00.318743,83.6609983765905,1.48410984516243,sigmoid,49,23.0,,,1.0,3.0,98.0,,,,,,,,,81.0,COMPLETE
78,0.4936321300846477,2024-04-11 16:03:01.416321,2024-04-11 16:03:01.762582,0 days 00:00:00.346261,76.09220971223736,0.05913678224893515,sigmoid,47,41.0,15.0,34.0,,,,10.0,6.0,8.396789075110274,2.3427143834822535,1.4266510062100966,16.0,41.0,54.0,30.0,COMPLETE
79,0.45353734605747187,2024-04-11 16:03:01.762582,2024-04-11 16:03:02.576930,0 days 00:00:00.814348,88.78160424966725,0.9480267850510177,rbf,1,,,,,,,,,,,,,,,164.0,COMPLETE
80,0.41302334810503344,2024-04-11 16:03:02.577932,2024-04-11 16:03:02.939300,0 days 00:00:00.361368,92.48234502636191,0.5427070394733859,sigmoid,25,,45.0,43.0,5.0,5.0,8.0,,,,,,,,,115.0,COMPLETE
81,0.5860647931709175,2024-04-11 16:03:02.940315,2024-04-11 16:03:03.180149,0 days 00:00:00.239834,96.36765173462386,1.2401855072368781,sigmoid,0,,,,,,,,,,,,,,,,COMPLETE
82,0.3902833462484417,2024-04-11 16:03:03.180149,2024-04-11 16:03:03.580048,0 days 00:00:00.399899,96.72063782636577,1.3589065817549721,sigmoid,43,27.0,6.0,28.0,,,,,,6.633641693634762,5.221474155870888,2.0304759950728717,2.0,45.0,79.0,94.0,COMPLETE
83,0.4233479393652297,2024-04-11 16:03:03.581058,2024-04-11 16:03:03.945946,0 days 00:00:00.364888,87.97335157622464,1.8554970327965055,sigmoid,29,,10.0,22.0,8.0,2.0,79.0,22.0,29.0,,,,,,,71.0,COMPLETE
84,0.3412178985558796,2024-04-11 16:03:03.946946,2024-04-11 16:03:04.299438,0 days 00:00:00.352492,92.00966669244218,0.7035170386300035,sigmoid,39,46.0,,,,,,43.0,2.0,2.6689969702840797,7.599759137720941,5.939658690494561,20.0,26.0,97.0,177.0,COMPLETE
85,0.5247406051094256,2024-04-11 16:03:04.300561,2024-04-11 16:03:04.581089,0 days 00:00:00.280528,99.15671702461235,0.2884491305571739,sigmoid,24,,39.0,9.0,7.0,4.0,74.0,,,,,,,,,,COMPLETE
86,0.4871372111631065,2024-04-11 16:03:04.582087,2024-04-11 16:03:04.942730,0 days 00:00:00.360643,80.2190142478414,2.3568622548074867,sigmoid,21,,,,1.0,3.0,8.0,46.0,9.0,,,,,,,73.0,COMPLETE
87,0.3265645452294195,2024-04-11 16:03:04.942730,2024-04-11 16:03:05.311470,0 days 00:00:00.368740,83.2921749199446,1.0445392474525423,sigmoid,3,,,,,,,,,5.4910970081294606,6.800419511415342,9.109435066189565,6.0,47.0,50.0,41.0,COMPLETE
88,0.2511490764027404,2024-04-11 16:03:05.311470,2024-04-11 16:03:05.719593,0 days 00:00:00.408123,96.99571759481081,1.4784480581882917,sigmoid,38,2.0,,,,,,37.0,16.0,3.7715903616900066,4.530815935591893,4.083728092610466,8.0,41.0,89.0,,COMPLETE
89,0.3357471551385867,2024-04-11 16:03:05.720582,2024-04-11 16:03:06.074552,0 days 00:00:00.353970,86.74110417624964,0.8138225696297307,sigmoid,15,,20.0,46.0,,,,24.0,35.0,2.0522875123119806,3.3000157141536235,8.040497794608532,18.0,29.0,85.0,196.0,COMPLETE
90,0.12959648135835936,2024-04-11 16:03:06.074552,2024-04-11 16:03:06.272808,0 days 00:00:00.198256,89.35828468008029,0.08234149045047351,sigmoid,0,,,,,,,,,,,,,,,,COMPLETE
91,0.588258559317662,2024-04-11 16:03:06.272808,2024-04-11 16:03:06.521681,0 days 00:00:00.248873,96.38481505641043,1.196664715022201,sigmoid,0,,,,,,,,,,,,,,,,COMPLETE
92,0.40342689977014695,2024-04-11 16:03:06.522683,2024-04-11 16:03:06.884254,0 days 00:00:00.361571,91.85794377226911,0.39278215999457133,sigmoid,22,,,,5.0,2.0,92.0,19.0,40.0,3.308218016878259,1.1147180471915723,6.43291975908794,15.0,48.0,54.0,,COMPLETE
93,0.5901522152284971,2024-04-11 16:03:06.885312,2024-04-11 16:03:07.130040,0 days 00:00:00.244728,99.76995689827987,1.2821540262614821,sigmoid,0,,,,,,,,,,,,,,,,COMPLETE
94,0.45088795435673534,2024-04-11 16:03:07.131039,2024-04-11 16:03:07.484671,0 days 00:00:00.353632,99.60463642114739,0.6707754244372943,sigmoid,18,,,,1.0,5.0,2.0,,,1.1643880950737575,5.355856633056115,7.355080880698606,2.0,37.0,91.0,,COMPLETE
95,0.33010372734526383,2024-04-11 16:03:07.485738,2024-04-11 16:03:07.919780,0 days 00:00:00.434042,93.24255424723724,1.571213359382233,sigmoid,35,6.0,,,,,,,,9.520455866984504,1.9741197718309422,3.0325354118316055,10.0,33.0,67.0,123.0,COMPLETE
96,0.46697124428916953,2024-04-11 16:03:07.920781,2024-04-11 16:03:09.266633,0 days 00:00:01.345852,85.28536962679716,0.9394522368675013,rbf,28,,27.0,42.0,7.0,1.0,19.0,14.0,28.0,,,,,,,,COMPLETE
97,0.45896499072963254,2024-04-11 16:03:09.267634,2024-04-11 16:03:09.717416,0 days 00:00:00.449782,77.45704521249894,1.1520223443570705,sigmoid,31,,37.0,33.0,6.0,6.0,57.0,5.0,18.0,7.78223735482587,3.900347017500906,4.414934684591364,18.0,50.0,69.0,146.0,COMPLETE
98,0.4564802854155134,2024-04-11 16:03:09.718420,2024-04-11 16:03:10.090524,0 days 00:00:00.372104,95.50269856378208,1.905112017484756,sigmoid,57,13.0,12.0,28.0,1.0,5.0,67.0,,,,,,,,,181.0,COMPLETE
99,0.10504933255948928,2024-04-11 16:03:10.090524,2024-04-11 16:03:10.478487,0 days 00:00:00.387963,81.83760080711532,0.5166497643294006,sigmoid,0,,,,,,,,,,,,,,,,COMPLETE
100,0.23810567857925893,2024-04-11 16:03:10.479501,2024-04-11 16:03:10.789915,0 days 00:00:00.310414,89.60381348306113,0.17332941228884247,sigmoid,42,24.0,6.0,12.0,,,,,,8.389606798944543,6.41555330047337,5.534416827531838,5.0,25.0,61.0,,COMPLETE
