number,value,datetime_start,datetime_complete,duration,params_C,params_gamma,params_kernel,params_mask_number,params_rsi_window,params_so_smooth,params_so_window,params_srsi_smooth1,params_srsi_smooth2,params_srsi_window,params_tsi_window_fast,params_tsi_window_slow,params_ult_weight_1,params_ult_weight_2,params_ult_weight_3,params_ult_window_1,params_ult_window_2,params_ult_window_3,params_williams_lbp,state
1040,0.570347623635196,2024-04-11 16:10:22.887857,2024-04-11 16:10:23.478061,0 days 00:00:00.590204,88.20252416158353,1.2501652405377806,sigmoid,18,,,,3.0,5.0,38.0,,,7.01582009689219,5.815492482699966,2.436161877876604,2.0,47.0,67.0,,COMPLETE
1041,0.3739926992217095,2024-04-11 16:10:23.479066,2024-04-11 16:10:23.899403,0 days 00:00:00.420337,94.50661772991816,0.8433727424316873,sigmoid,1,,,,,,,,,,,,,,,120.0,COMPLETE
1042,0.5289171063972922,2024-04-11 16:10:23.900403,2024-04-11 16:10:24.481196,0 days 00:00:00.580793,97.95661381401474,1.1246988573407448,sigmoid,10,,35.0,39.0,,,,,,6.404124255876205,8.057348992398408,4.642489358245257,15.0,46.0,55.0,,COMPLETE
1043,0.31099656357388317,2024-04-11 16:10:24.483197,2024-04-11 16:10:25.004290,0 days 00:00:00.521093,92.67503118901581,0.4690566075650474,sigmoid,41,3.0,25.0,15.0,,,,,,,,,,,,89.0,COMPLETE
1044,0.34944451971277607,2024-04-11 16:10:25.005343,2024-04-11 16:10:25.660004,0 days 00:00:00.654661,89.9013807768096,1.5024552795025885,sigmoid,11,,44.0,19.0,,,,,,6.044809564818895,4.676797170468906,1.0050702466981436,7.0,39.0,74.0,15.0,COMPLETE
1045,0.3853287147290178,2024-04-11 16:10:25.661134,2024-04-11 16:10:26.216983,0 days 00:00:00.555849,95.91876386366845,0.9608542166342032,sigmoid,48,25.0,,,8.0,4.0,92.0,,,,,,,,,,COMPLETE
1046,0.5448098134212968,2024-04-11 16:10:26.218085,2024-04-11 16:10:26.683858,0 days 00:00:00.465773,86.17636605089734,0.6955188884049733,sigmoid,37,33.0,,,,,,41.0,23.0,,,,,,,24.0,COMPLETE
1047,0.41739235974148137,2024-04-11 16:10:26.684973,2024-04-11 16:10:27.237062,0 days 00:00:00.552089,98.44602360685286,1.6990130869475553,sigmoid,20,,,,4.0,5.0,70.0,20.0,47.0,,,,,,,,COMPLETE
1048,0.5870813314138034,2024-04-11 16:10:27.238063,2024-04-11 16:10:27.627532,0 days 00:00:00.389469,91.8709127368652,1.2590948742319998,sigmoid,0,,,,,,,,,,,,,,,,COMPLETE
1049,0.3844771241830065,2024-04-11 16:10:27.627532,2024-04-11 16:10:28.886039,0 days 00:00:01.258507,95.64564586421366,1.0637428756828367,rbf,59,9.0,7.0,36.0,2.0,8.0,40.0,,,5.390773088233533,5.243448807679502,5.17090512952616,5.0,29.0,100.0,79.0,COMPLETE
1050,0.35958312978342283,2024-04-11 16:10:28.888263,2024-04-11 16:10:29.516394,0 days 00:00:00.628131,99.89591405816826,0.7700257042585977,sigmoid,52,32.0,,,1.0,6.0,33.0,3.0,21.0,,,,,,,,COMPLETE
1051,0.4531393302431648,2024-04-11 16:10:29.518557,2024-04-11 16:10:30.189448,0 days 00:00:00.670891,93.01500826907058,1.4085152633381575,sigmoid,55,28.0,,,6.0,2.0,22.0,14.0,26.0,1.0603264277300308,9.427031229996961,6.76317604397004,6.0,24.0,76.0,86.0,COMPLETE
1052,0.5823323040111231,2024-04-11 16:10:30.190441,2024-04-11 16:10:30.600507,0 days 00:00:00.410066,96.9705211756725,0.3954402503047382,sigmoid,0,,,,,,,,,,,,,,,,COMPLETE
1053,0.3139043884783592,2024-04-11 16:10:30.601554,2024-04-11 16:10:31.108493,0 days 00:00:00.506939,90.61867484021222,0.8968969471762862,sigmoid,13,,37.0,11.0,,,,32.0,8.0,,,,,,,70.0,COMPLETE
1054,0.47766167297542245,2024-04-11 16:10:31.109493,2024-04-11 16:10:31.739047,0 days 00:00:00.629554,94.7498612294436,1.146996952702308,sigmoid,54,38.0,,,4.0,1.0,96.0,26.0,7.0,3.119955631826513,7.26561628077099,1.5920260491138656,12.0,41.0,79.0,,COMPLETE
1055,0.3370043180287604,2024-04-11 16:10:31.740046,2024-04-11 16:10:32.241638,0 days 00:00:00.501592,88.2103255078299,0.5911021909067116,sigmoid,44,23.0,30.0,25.0,,,,47.0,34.0,,,,,,,,COMPLETE
1056,0.4825058313895368,2024-04-11 16:10:32.242639,2024-04-11 16:10:32.927842,0 days 00:00:00.685203,93.72104679837325,1.2230876433219258,sigmoid,56,47.0,4.0,14.0,2.0,7.0,88.0,,,,,,,,,,COMPLETE
1057,0.04232680502776966,2024-04-11 16:10:32.928882,2024-04-11 16:10:33.509484,0 days 00:00:00.580602,97.68892227009748,0.15670592275998096,sigmoid,2,,,,,,,,,3.918463202665002,6.601183343174181,3.758296084658401,3.0,27.0,61.0,,COMPLETE
1058,0.5871571537475874,2024-04-11 16:10:33.510620,2024-04-11 16:10:33.786511,0 days 00:00:00.275891,99.93088083120665,0.920121968457155,sigmoid,0,,,,,,,,,,,,,,,,COMPLETE
1059,0.44740589483865767,2024-04-11 16:10:33.787612,2024-04-11 16:10:34.237512,0 days 00:00:00.449900,96.12650668378832,1.5337935845323514,sigmoid,60,29.0,11.0,31.0,3.0,5.0,55.0,49.0,41.0,,,,,,,,COMPLETE
1060,0.33590480695753433,2024-04-11 16:10:34.238513,2024-04-11 16:10:34.716646,0 days 00:00:00.478133,91.29263425158761,4.501724198547777,sigmoid,7,,,,,,,16.0,9.0,6.856527695430829,7.022945692670269,6.027370161860433,10.0,34.0,85.0,94.0,COMPLETE
1061,0.4157819581548395,2024-04-11 16:10:34.717649,2024-04-11 16:10:35.347077,0 days 00:00:00.629428,89.50869950552496,0.7879605770796312,sigmoid,23,,,,6.0,4.0,86.0,43.0,37.0,7.474472558082681,6.01420900411776,8.107675258730204,2.0,45.0,75.0,41.0,COMPLETE
1062,0.5896947521427498,2024-04-11 16:10:35.349078,2024-04-11 16:10:35.704021,0 days 00:00:00.354943,94.09793883197749,1.063254600161834,sigmoid,0,,,,,,,,,,,,,,,,COMPLETE
1063,0.09651789047085797,2024-04-11 16:10:35.705021,2024-04-11 16:10:36.076800,0 days 00:00:00.371779,91.6652791987067,0.5537261841888128,sigmoid,0,,,,,,,,,,,,,,,,COMPLETE
1064,0.5841555865593114,2024-04-11 16:10:36.077800,2024-04-11 16:10:36.502852,0 days 00:00:00.425052,93.05062770199692,1.0052659792323615,sigmoid,32,14.0,,,,,,,,,,,,,,,COMPLETE
1065,0.37037906742703786,2024-04-11 16:10:36.504059,2024-04-11 16:10:36.990771,0 days 00:00:00.486712,89.49054167974846,0.7389010028621728,sigmoid,40,34.0,31.0,38.0,,,,,,,,,,,,,COMPLETE
1066,0.5221410372491629,2024-04-11 16:10:36.991771,2024-04-11 16:10:37.434843,0 days 00:00:00.443072,86.50713301018736,1.3317541158376014,sigmoid,36,17.0,,,,,,5.0,16.0,,,,,,,,COMPLETE
1067,0.4212325815256428,2024-04-11 16:10:37.435847,2024-04-11 16:10:38.042965,0 days 00:00:00.607118,93.5381086468633,1.0502062035890491,sigmoid,61,18.0,14.0,44.0,7.0,3.0,17.0,30.0,31.0,,,,,,,64.0,COMPLETE
1068,0.4105143787618854,2024-04-11 16:10:38.044965,2024-04-11 16:10:39.160784,0 days 00:00:01.115819,91.09710604520328,0.8802992685116061,rbf,8,,9.0,18.0,,,,,,,,,,,,,COMPLETE
1069,0.13026268441885572,2024-04-11 16:10:39.161785,2024-04-11 16:10:39.513127,0 days 00:00:00.351342,88.76613683204305,0.31210513777870674,sigmoid,0,,,,,,,,,,,,,,,,COMPLETE
1070,0.44285379629870636,2024-04-11 16:10:39.514194,2024-04-11 16:10:40.301420,0 days 00:00:00.787226,93.63883668884316,1.2422878076292456,sigmoid,27,,13.0,4.0,5.0,6.0,65.0,,,4.963425517250384,9.153989709455255,3.214938597020189,11.0,32.0,95.0,31.0,COMPLETE
1071,0.5858043514863523,2024-04-11 16:10:40.302418,2024-04-11 16:10:40.714173,0 days 00:00:00.411755,95.09000731568433,1.7743836606469316,sigmoid,0,,,,,,,,,,,,,,,,COMPLETE
1072,0.5587070471753058,2024-04-11 16:10:40.715229,2024-04-11 16:10:41.212236,0 days 00:00:00.497007,91.54500836594858,1.08359827720573,sigmoid,12,,23.0,8.0,,,,11.0,14.0,,,,,,,,COMPLETE
1073,0.5391204469795783,2024-04-11 16:10:41.213423,2024-04-11 16:10:41.609071,0 days 00:00:00.395648,94.31863871178179,0.5452525640414032,sigmoid,1,,,,,,,,,,,,,,,57.0,COMPLETE
1074,0.5820915626946844,2024-04-11 16:10:41.610070,2024-04-11 16:10:42.043489,0 days 00:00:00.433419,89.73059183208397,0.7667182264895276,sigmoid,4,,,,,,,19.0,3.0,,,,,,,,COMPLETE
1075,0.3859797583183833,2024-04-11 16:10:42.044489,2024-04-11 16:10:42.617045,0 days 00:00:00.572556,86.96034554853834,1.4563718135067933,sigmoid,5,,,,,,,35.0,33.0,,,,,,,74.0,COMPLETE
1076,0.3661721432074546,2024-04-11 16:10:42.618044,2024-04-11 16:10:43.350152,0 days 00:00:00.732108,92.61952482560754,0.9633139598756394,sigmoid,30,,5.0,47.0,8.0,3.0,14.0,7.0,22.0,2.9191728392486733,9.708975610249494,2.060847673602246,7.0,35.0,69.0,,COMPLETE
1077,0.39369871139966384,2024-04-11 16:10:43.351323,2024-04-11 16:10:43.986969,0 days 00:00:00.635646,83.94885769209986,1.2065048565955034,sigmoid,53,2.0,,,1.0,4.0,43.0,38.0,19.0,,,,,,,19.0,COMPLETE
1078,0.5863711449328822,2024-04-11 16:10:43.988970,2024-04-11 16:10:44.374372,0 days 00:00:00.385402,79.01818735877256,0.6458699857452979,sigmoid,0,,,,,,,,,,,,,,,,COMPLETE
1079,0.40366474789789336,2024-04-11 16:10:44.375372,2024-04-11 16:10:45.081165,0 days 00:00:00.705793,43.65871414246475,0.8848333599977014,sigmoid,51,39.0,,,4.0,7.0,48.0,,,3.591547454474995,4.863095526201293,0.7772140549328794,8.0,49.0,98.0,44.0,COMPLETE
1080,0.5898705322956922,2024-04-11 16:10:45.082318,2024-04-11 16:10:45.469033,0 days 00:00:00.386715,95.49240367752475,1.361018556436854,sigmoid,0,,,,,,,,,,,,,,,,COMPLETE
1081,0.5833977343411305,2024-04-11 16:10:45.470034,2024-04-11 16:10:45.924973,0 days 00:00:00.454939,95.43427292238032,1.868510351842149,sigmoid,0,,,,,,,,,,,,,,,,COMPLETE
1082,0.5851186236370609,2024-04-11 16:10:45.926170,2024-04-11 16:10:46.309642,0 days 00:00:00.383472,95.96546446697721,1.4933940731587274,sigmoid,0,,,,,,,,,,,,,,,,COMPLETE
1083,0.5794344378415175,2024-04-11 16:10:46.310643,2024-04-11 16:10:46.690051,0 days 00:00:00.379408,93.79547215277707,1.5712972533154401,sigmoid,0,,,,,,,,,,,,,,,,COMPLETE
1084,0.5700732324696153,2024-04-11 16:10:46.691174,2024-04-11 16:10:47.070163,0 days 00:00:00.378989,96.22527294810833,2.4642620921430267,sigmoid,0,,,,,,,,,,,,,,,,COMPLETE
1085,0.5874934491910808,2024-04-11 16:10:47.071211,2024-04-11 16:10:47.474132,0 days 00:00:00.402921,93.05745388922395,1.1267035893370605,sigmoid,0,,,,,,,,,,,,,,,,COMPLETE
1086,0.5021859761224146,2024-04-11 16:10:47.475134,2024-04-11 16:10:47.897600,0 days 00:00:00.422466,91.78458527089762,0.4542177563022522,sigmoid,33,20.0,,,,,,,,,,,,,,149.0,COMPLETE
1087,0.5329315285050883,2024-04-11 16:10:47.898601,2024-04-11 16:10:48.435558,0 days 00:00:00.536957,63.616897985962495,1.3472871649671054,sigmoid,34,40.0,,,,,,,,4.732138590519611,8.703708654540872,4.4505846652101555,4.0,50.0,64.0,,COMPLETE
1088,0.5802471436825526,2024-04-11 16:10:48.436565,2024-04-11 16:10:48.834329,0 days 00:00:00.397764,11.938341600743037,1.7139115138468992,sigmoid,0,,,,,,,,,,,,,,,,COMPLETE
1089,0.5083659408982885,2024-04-11 16:10:48.835330,2024-04-11 16:10:50.132583,0 days 00:00:01.297253,94.76955031537587,0.7522196231240885,rbf,45,30.0,48.0,24.0,,,,33.0,30.0,,,,,,,137.0,COMPLETE
1090,0.5880365043344815,2024-04-11 16:10:50.133584,2024-04-11 16:10:50.540316,0 days 00:00:00.406732,97.3625334289432,0.9896553969332648,sigmoid,0,,,,,,,,,,,,,,,,COMPLETE
1091,0.42984122676075454,2024-04-11 16:10:50.541316,2024-04-11 16:10:51.160052,0 days 00:00:00.618736,90.94290223895571,1.1091892782739714,sigmoid,19,,,,3.0,2.0,78.0,,,4.282406544324878,6.8190853204993385,6.880672695221079,5.0,33.0,71.0,123.0,COMPLETE
1092,0.48703417073461125,2024-04-11 16:10:51.162042,2024-04-11 16:10:51.633918,0 days 00:00:00.471876,94.45514852166231,1.3134917972832592,sigmoid,17,,,,2.0,1.0,74.0,,,,,,,,,153.0,COMPLETE
1093,0.589341292515921,2024-04-11 16:10:51.634912,2024-04-11 16:10:52.006807,0 days 00:00:00.371895,96.64588043410019,0.85215784914351,sigmoid,0,,,,,,,,,,,,,,,,COMPLETE
1094,0.4628348927761957,2024-04-11 16:10:52.007822,2024-04-11 16:10:52.720440,0 days 00:00:00.712618,98.17839361552537,0.5909165009049466,sigmoid,58,8.0,50.0,34.0,5.0,8.0,82.0,,,8.605899605473883,4.260416513538734,5.7655041648802765,9.0,42.0,59.0,,COMPLETE
1095,0.46903921617019173,2024-04-11 16:10:52.721497,2024-04-11 16:10:53.438247,0 days 00:00:00.716750,15.286498117541463,0.38203142828229764,sigmoid,50,37.0,,,3.0,5.0,62.0,,,0.605493178692099,6.377961187509862,4.313730492349057,19.0,21.0,82.0,,COMPLETE
1096,0.5781127423512272,2024-04-11 16:10:53.440247,2024-04-11 16:10:54.005422,0 days 00:00:00.565175,92.68851763071488,0.1822482678365478,sigmoid,18,,,,6.0,6.0,57.0,,,3.388046569172727,8.301712503324184,4.9484002222932695,6.0,43.0,78.0,,COMPLETE
1097,0.5596495748518424,2024-04-11 16:10:54.006417,2024-04-11 16:10:54.409992,0 days 00:00:00.403575,95.13181590924293,4.068554656180446,sigmoid,0,,,,,,,,,,,,,,,,COMPLETE
1098,0.39742413318476766,2024-04-11 16:10:54.410994,2024-04-11 16:10:54.997757,0 days 00:00:00.586763,89.74797860896663,0.9968617663594949,sigmoid,29,,6.0,49.0,7.0,4.0,25.0,24.0,48.0,,,,,,,173.0,COMPLETE
1099,0.4109200295135933,2024-04-11 16:10:54.999758,2024-04-11 16:10:55.541857,0 days 00:00:00.542099,97.07562688768442,1.4311848898200132,sigmoid,49,6.0,,,1.0,7.0,19.0,,,,,,,,,132.0,COMPLETE
1100,0.5852394231262724,2024-04-11 16:10:55.542878,2024-04-11 16:10:55.976620,0 days 00:00:00.433742,92.62713556981883,1.1729079644116163,sigmoid,0,,,,,,,,,,,,,,,,COMPLETE
1101,0.36098389717831286,2024-04-11 16:10:55.977617,2024-04-11 16:10:56.613110,0 days 00:00:00.635493,88.03373749950637,0.7397156826492894,sigmoid,39,11.0,,,,,,27.0,11.0,9.52593707762492,5.512864559419913,5.543865769801229,2.0,37.0,73.0,142.0,COMPLETE
1102,0.5161522051460664,2024-04-11 16:10:56.614147,2024-04-11 16:10:57.159848,0 days 00:00:00.545701,94.80194071292595,1.641860408011321,sigmoid,25,,28.0,3.0,4.0,7.0,51.0,,,,,,,,,116.0,COMPLETE
1103,0.24087299826997294,2024-04-11 16:10:57.161845,2024-04-11 16:10:57.730263,0 days 00:00:00.568418,98.67473326259008,0.9488743402471864,sigmoid,6,,,,,,,12.0,5.0,5.2900225889271,9.97663747411585,3.6529444411813814,3.0,46.0,70.0,,COMPLETE
1104,0.5663851724068762,2024-04-11 16:10:57.732265,2024-04-11 16:10:58.079442,0 days 00:00:00.347177,90.84000216023709,6.051234882049396,sigmoid,0,,,,,,,,,,,,,,,,COMPLETE
1105,0.5867358687757959,2024-04-11 16:10:58.080489,2024-04-11 16:10:58.530679,0 days 00:00:00.450190,96.33362758945623,1.3345732600395381,sigmoid,0,,,,,,,,,,,,,,,,COMPLETE
1106,0.34307274157785567,2024-04-11 16:10:58.531923,2024-04-11 16:10:59.784561,0 days 00:00:01.252638,93.6562379496764,1.1119386018151958,rbf,2,,,,,,,,,8.261600781840036,7.880445307745349,3.0314539606467346,7.0,39.0,88.0,,COMPLETE
1107,0.48214765756738925,2024-04-11 16:10:59.785561,2024-04-11 16:11:00.470669,0 days 00:00:00.685108,98.25402358476508,0.6813829166499547,sigmoid,47,22.0,40.0,21.0,,,,21.0,50.0,5.587141279237781,7.44254572926468,2.8227731543465304,5.0,48.0,89.0,109.0,COMPLETE
1108,0.4266200942806838,2024-04-11 16:11:00.471757,2024-04-11 16:11:01.187208,0 days 00:00:00.715451,91.11642551467422,0.873897881282702,sigmoid,31,,2.0,26.0,2.0,3.0,53.0,39.0,18.0,2.5086377172574954,8.8466243007021,1.307031534446526,16.0,31.0,65.0,162.0,COMPLETE
1109,0.33697638338217545,2024-04-11 16:11:01.188220,2024-04-11 16:11:01.644508,0 days 00:00:00.456288,96.20001908031622,7.35149550135627,sigmoid,24,,16.0,32.0,5.0,2.0,32.0,,,,,,,,,,COMPLETE
1110,0.3818565400843882,2024-04-11 16:11:01.645705,2024-04-11 16:11:02.227842,0 days 00:00:00.582137,85.51855128661956,2.0801064730667047,sigmoid,43,44.0,45.0,36.0,,,,,,1.6881457897667045,5.707816032141816,1.7849093183434805,4.0,40.0,94.0,184.0,COMPLETE
1111,0.5873516489526552,2024-04-11 16:11:02.228921,2024-04-11 16:11:02.618741,0 days 00:00:00.389820,94.04037544765754,1.453144279330745,sigmoid,0,,,,,,,,,,,,,,,,COMPLETE
1112,0.41232540015586605,2024-04-11 16:11:02.619738,2024-04-11 16:11:03.260783,0 days 00:00:00.641045,89.15913293485225,1.1371224091278,sigmoid,22,,,,4.0,8.0,45.0,29.0,24.0,0.8243186185962879,8.482274990964637,4.068363536595842,10.0,36.0,81.0,,COMPLETE
1113,0.10504933255948928,2024-04-11 16:11:03.262782,2024-04-11 16:11:03.669237,0 days 00:00:00.406455,92.54087366858488,0.48454261152273026,sigmoid,0,,,,,,,,,,,,,,,,COMPLETE
1114,0.3513919413919414,2024-04-11 16:11:03.670241,2024-04-11 16:11:04.286944,0 days 00:00:00.616703,98.29206401097503,0.9260837266323556,sigmoid,35,10.0,,,,,,,,7.278845281999815,3.442448412879692,4.703643300376499,13.0,44.0,68.0,103.0,COMPLETE
1115,0.5881014021858113,2024-04-11 16:11:04.287940,2024-04-11 16:11:04.666527,0 days 00:00:00.378587,95.62678462988629,1.2688753220061062,sigmoid,0,,,,,,,,,,,,,,,,COMPLETE
1116,0.3820125272331155,2024-04-11 16:11:04.668540,2024-04-11 16:11:05.188650,0 days 00:00:00.520110,97.97479926368645,0.7469307824780207,sigmoid,21,,,,3.0,5.0,67.0,23.0,42.0,,,,,,,155.0,COMPLETE
1117,0.2739147749900438,2024-04-11 16:11:05.189652,2024-04-11 16:11:05.653225,0 days 00:00:00.463573,92.12018609063081,1.0339606701082535,sigmoid,8,,12.0,42.0,,,,,,,,,,,,,COMPLETE
1118,0.5638855948385022,2024-04-11 16:11:05.654224,2024-04-11 16:11:06.028916,0 days 00:00:00.374692,99.91738770687856,4.711199992288265,sigmoid,0,,,,,,,,,,,,,,,,COMPLETE
1119,0.526000123662895,2024-04-11 16:11:06.029917,2024-04-11 16:11:06.481966,0 days 00:00:00.452049,87.27898400849816,1.557043233793526,sigmoid,9,,34.0,16.0,,,,,,,,,,,,127.0,COMPLETE
1120,0.5205248918901646,2024-04-11 16:11:06.483022,2024-04-11 16:11:07.056644,0 days 00:00:00.573622,94.75717259516426,0.6086636018833834,sigmoid,38,27.0,,,,,,4.0,38.0,5.92158960047858,7.672347656014174,5.355950280040814,4.0,23.0,72.0,,COMPLETE
1121,0.5393963731665047,2024-04-11 16:11:07.057835,2024-04-11 16:11:07.635450,0 days 00:00:00.577615,89.79962111821521,1.860371948146111,sigmoid,3,,,,,,,,,2.0810705500518263,5.0686343363965465,8.348327343393837,12.0,41.0,57.0,167.0,COMPLETE
1122,0.47192845655246357,2024-04-11 16:11:07.636449,2024-04-11 16:11:08.299769,0 days 00:00:00.663320,96.51802090432365,1.2405290865430902,sigmoid,15,,20.0,29.0,,,,15.0,40.0,6.198122203355212,3.8177351068866736,6.2015106267138265,11.0,38.0,55.0,119.0,COMPLETE
1123,0.5092564132876227,2024-04-11 16:11:08.300930,2024-04-11 16:11:09.006784,0 days 00:00:00.705854,93.59577071225591,0.00982756669177297,sigmoid,57,48.0,19.0,27.0,8.0,6.0,28.0,,,,,,,,,158.0,COMPLETE
1124,0.42738423796381475,2024-04-11 16:11:09.007784,2024-04-11 16:11:09.564824,0 days 00:00:00.557040,96.62515241075047,0.8576268779823615,sigmoid,28,,8.0,33.0,1.0,5.0,5.0,40.0,4.0,,,,,,,,COMPLETE
1125,0.43964457016357156,2024-04-11 16:11:09.565825,2024-04-11 16:11:10.608121,0 days 00:00:01.042296,27.033504494763655,1.0759244057272634,rbf,42,43.0,42.0,10.0,,,,,,4.042319480350137,9.268304868924202,7.565696561213212,6.0,30.0,74.0,,COMPLETE
1126,0.5832088276060698,2024-04-11 16:11:10.609116,2024-04-11 16:11:10.996392,0 days 00:00:00.387276,91.42478208810005,1.394584706111217,sigmoid,0,,,,,,,,,,,,,,,,COMPLETE
1127,0.44826042847765113,2024-04-11 16:11:10.997393,2024-04-11 16:11:11.698019,0 days 00:00:00.700626,98.28392576771397,0.39484333884566375,sigmoid,62,49.0,15.0,23.0,6.0,1.0,91.0,50.0,28.0,8.014896827208489,2.9212206759402015,1.4751162909215394,17.0,47.0,92.0,,COMPLETE
1128,0.5065260707009649,2024-04-11 16:11:11.699016,2024-04-11 16:11:12.299008,0 days 00:00:00.599992,94.40166614026477,0.7344792310311328,sigmoid,14,,33.0,30.0,,,,9.0,45.0,1.305389449790716,8.070532241642756,7.224227538724444,20.0,42.0,52.0,,COMPLETE
1129,0.4869803242636221,2024-04-11 16:11:12.300062,2024-04-11 16:11:13.021394,0 days 00:00:00.721332,87.80196459802293,0.9849396868763012,sigmoid,46,19.0,3.0,20.0,,,,18.0,36.0,6.65783108416822,1.1986146045502446,2.5875731098920443,8.0,27.0,86.0,,COMPLETE
1130,0.5881803882253297,2024-04-11 16:11:13.022391,2024-04-11 16:11:13.405946,0 days 00:00:00.383555,90.57232179633066,1.2266068207067742,sigmoid,0,,,,,,,,,,,,,,,,COMPLETE
1131,0.46257950222170596,2024-04-11 16:11:13.407130,2024-04-11 16:11:14.141874,0 days 00:00:00.734744,95.81767964772354,1.6678985069817893,sigmoid,63,32.0,24.0,13.0,7.0,4.0,98.0,45.0,49.0,4.482642466752183,6.617782142268388,2.244754758379966,2.0,44.0,76.0,100.0,COMPLETE
1132,0.5863711449328822,2024-04-11 16:11:14.142875,2024-04-11 16:11:14.536303,0 days 00:00:00.393428,93.21614024888758,0.5932163853905796,sigmoid,0,,,,,,,,,,,,,,,,COMPLETE
1133,0.33501715960359385,2024-04-11 16:11:14.537303,2024-04-11 16:11:15.059487,0 days 00:00:00.522184,97.68740595466402,0.8945683275668156,sigmoid,41,45.0,26.0,22.0,,,,,,,,,,,,196.0,COMPLETE
1134,0.38499531328862924,2024-04-11 16:11:15.061508,2024-04-11 16:11:15.561563,0 days 00:00:00.500055,92.35352629812779,1.4397368558740484,sigmoid,37,46.0,,,,,,48.0,13.0,,,,,,,134.0,COMPLETE
1135,0.17280736015275788,2024-04-11 16:11:15.563597,2024-04-11 16:11:16.180585,0 days 00:00:00.616988,95.0011317086772,1.141299157798945,sigmoid,18,,,,2.0,6.0,37.0,,,3.1781777039436596,6.2466900881831595,3.387865125534628,3.0,34.0,79.0,,COMPLETE
1136,0.568555053455307,2024-04-11 16:11:16.181674,2024-04-11 16:11:16.656105,0 days 00:00:00.474431,98.24309439546523,0.8044241649238473,sigmoid,16,,,,5.0,3.0,60.0,,,,,,,,,,COMPLETE
1137,0.13026268441885572,2024-04-11 16:11:16.657106,2024-04-11 16:11:17.003473,0 days 00:00:00.346367,99.97693471537488,0.2666522927659708,sigmoid,0,,,,,,,,,,,,,,,,COMPLETE
1138,0.34363463769644553,2024-04-11 16:11:17.004482,2024-04-11 16:11:17.582556,0 days 00:00:00.578074,90.31401282517182,1.0528651719528586,sigmoid,10,,36.0,50.0,,,,,,1.5067032673853902,4.575606234699979,6.456957899294421,9.0,26.0,80.0,,COMPLETE
1139,0.5099609548318397,2024-04-11 16:11:17.584580,2024-04-11 16:11:18.185212,0 days 00:00:00.600632,88.51309220741162,1.3323629369167422,sigmoid,11,,7.0,35.0,,,,,,2.7733187013713656,7.118811192789609,1.9332530039193765,5.0,36.0,84.0,148.0,COMPLETE
1140,0.39678027059427984,2024-04-11 16:11:18.186316,2024-04-11 16:11:18.763433,0 days 00:00:00.577117,18.529973607831757,0.9283809201229597,sigmoid,52,15.0,,,4.0,8.0,76.0,32.0,29.0,,,,,,,,COMPLETE
1141,0.5863711449328822,2024-04-11 16:11:18.764522,2024-04-11 16:11:19.146244,0 days 00:00:00.381722,85.16942440926559,0.5941625770620084,sigmoid,0,,,,,,,,,,,,,,,,COMPLETE
1142,0.49820848064921813,2024-04-11 16:11:19.147244,2024-04-11 16:11:19.809850,0 days 00:00:00.662606,96.61263158543129,1.184422888152716,sigmoid,26,,38.0,39.0,3.0,5.0,41.0,,,5.06017899917512,9.522973285643262,9.460919922463475,14.0,29.0,77.0,,COMPLETE
1143,0.47632728940824265,2024-04-11 16:11:19.810998,2024-04-11 16:11:20.305260,0 days 00:00:00.494262,93.82215632129099,0.6862966935245967,sigmoid,48,25.0,,,1.0,2.0,64.0,,,,,,,,,,COMPLETE
