number,value,datetime_start,datetime_complete,duration,params_C,params_gamma,params_kernel,params_mask_number,params_rsi_window,params_so_smooth,params_so_window,params_srsi_smooth1,params_srsi_smooth2,params_srsi_window,params_tsi_window_fast,params_tsi_window_slow,params_ult_weight_1,params_ult_weight_2,params_ult_weight_3,params_ult_window_1,params_ult_window_2,params_ult_window_3,params_williams_lbp,state
5177,0.5041336929130378,2024-04-11 17:18:59.183245,2024-04-11 17:19:00.173080,0 days 00:00:00.989835,98.16179028067764,8.043038067155647,sigmoid,41,29.0,23.0,29.0,,,,,,,,,,,,113.0,COMPLETE
5178,0.5342980409966352,2024-04-11 17:19:00.175054,2024-04-11 17:19:01.207208,0 days 00:00:01.032154,95.70364073398751,8.438950027653028,sigmoid,2,,,,,,,,,9.783955478726643,8.421271876569586,9.431952056727093,19.0,26.0,80.0,,COMPLETE
5179,0.30535638970898354,2024-04-11 17:19:01.209199,2024-04-11 17:19:02.398103,0 days 00:00:01.188904,89.76314958720684,7.768673596805999,sigmoid,10,,28.0,34.0,,,,,,2.6707890747909975,1.3835245288914533,1.0423405065050897,13.0,31.0,99.0,,COMPLETE
5180,0.5963643249384587,2024-04-11 17:19:02.399685,2024-04-11 17:19:03.286631,0 days 00:00:00.886946,98.2920482435254,8.206339091474847,sigmoid,8,,25.0,32.0,,,,,,,,,,,,,COMPLETE
5181,0.5045406041072323,2024-04-11 17:19:03.289645,2024-04-11 17:19:04.272234,0 days 00:00:00.982589,96.70331661990386,7.958543342746652,sigmoid,37,12.0,,,,,,12.0,13.0,,,,,,,108.0,COMPLETE
5182,0.527754636734336,2024-04-11 17:19:04.273778,2024-04-11 17:19:05.509043,0 days 00:00:01.235265,93.86290154732887,8.673150770056193,sigmoid,11,,25.0,31.0,,,,,,1.6512340067744051,3.76822842230479,1.4473984087329117,5.0,45.0,90.0,174.0,COMPLETE
5183,0.4729587188953349,2024-04-11 17:19:05.511023,2024-04-11 17:19:06.527401,0 days 00:00:01.016378,99.93911785549534,7.352697202718235,sigmoid,20,,,,8.0,4.0,86.0,49.0,47.0,,,,,,,,COMPLETE
5184,0.44701971028259324,2024-04-11 17:19:06.529404,2024-04-11 17:19:07.422026,0 days 00:00:00.892622,98.1548697242252,8.110198928804783,sigmoid,8,,27.0,30.0,,,,,,,,,,,,,COMPLETE
5185,0.5250995378243734,2024-04-11 17:19:07.424003,2024-04-11 17:19:08.370336,0 days 00:00:00.946333,95.18012041722719,7.649426522687579,sigmoid,9,,24.0,8.0,,,,,,,,,,,,100.0,COMPLETE
5186,0.5929369437606513,2024-04-11 17:19:08.371846,2024-04-11 17:19:09.221101,0 days 00:00:00.849255,98.08286565119826,8.422910431611102,sigmoid,8,,26.0,33.0,,,,,,,,,,,,,COMPLETE
5187,0.4774289085818737,2024-04-11 17:19:09.223079,2024-04-11 17:19:10.526591,0 days 00:00:01.303512,96.69232791061613,7.831032133974468,sigmoid,26,,23.0,31.0,3.0,3.0,54.0,,,9.450231115307837,6.991776017359344,2.1122289278782733,6.0,49.0,89.0,,COMPLETE
5188,0.28879433784723646,2024-04-11 17:19:10.529620,2024-04-11 17:19:11.867888,0 days 00:00:01.338268,92.65446368031796,8.25111842090974,rbf,52,46.0,,,2.0,8.0,38.0,47.0,33.0,,,,,,,,COMPLETE
5189,0.45347172512526845,2024-04-11 17:19:11.869887,2024-04-11 17:19:12.751606,0 days 00:00:00.881719,96.72162562322741,8.003254387662835,sigmoid,8,,26.0,28.0,,,,,,,,,,,,,COMPLETE
5190,0.494172965593953,2024-04-11 17:19:12.753603,2024-04-11 17:19:14.187425,0 days 00:00:01.433822,99.98843208469624,8.124221120429343,sigmoid,59,20.0,24.0,29.0,5.0,7.0,68.0,,,8.057494291966115,8.012811036634215,6.620412213179588,12.0,37.0,61.0,123.0,COMPLETE
5191,0.4662300807683912,2024-04-11 17:19:14.189396,2024-04-11 17:19:15.138275,0 days 00:00:00.948879,98.13721561344211,8.51461996336896,sigmoid,48,44.0,,,4.0,5.0,21.0,,,,,,,,,,COMPLETE
5192,0.48301692455347733,2024-04-11 17:19:15.139297,2024-04-11 17:19:16.243475,0 days 00:00:01.104178,99.9710852537798,7.528271705474404,sigmoid,56,19.0,29.0,32.0,1.0,1.0,63.0,,,,,,,,,,COMPLETE
5193,0.4489041858581768,2024-04-11 17:19:16.245992,2024-04-11 17:19:17.630741,0 days 00:00:01.384749,95.31990198225242,8.767275987274244,sigmoid,55,40.0,,,6.0,2.0,93.0,6.0,49.0,5.686174024714384,2.419366709328939,0.6434801302385589,17.0,24.0,55.0,141.0,COMPLETE
5194,0.44701971028259324,2024-04-11 17:19:17.632741,2024-04-11 17:19:18.495453,0 days 00:00:00.862712,98.16910462979608,7.890959476194087,sigmoid,8,,28.0,30.0,,,,,,,,,,,,,COMPLETE
5195,0.3151723871067601,2024-04-11 17:19:18.498482,2024-04-11 17:19:19.525943,0 days 00:00:01.027461,94.01092233654161,8.2837042646255,sigmoid,44,49.0,25.0,32.0,,,,44.0,39.0,,,,,,,,COMPLETE
5196,0.32337067778315404,2024-04-11 17:19:19.527865,2024-04-11 17:19:20.508715,0 days 00:00:00.980850,96.84385192429501,7.732141797916375,sigmoid,12,,22.0,31.0,,,,16.0,38.0,,,,,,,,COMPLETE
5197,0.519666953775481,2024-04-11 17:19:20.510716,2024-04-11 17:19:21.526359,0 days 00:00:01.015643,98.11202076542183,8.033489173008231,sigmoid,13,,27.0,11.0,,,,42.0,42.0,,,,,,,90.0,COMPLETE
5198,0.449215640365254,2024-04-11 17:19:21.528492,2024-04-11 17:19:22.393698,0 days 00:00:00.865206,95.2456908402669,4.590939423387799,sigmoid,8,,25.0,30.0,,,,,,,,,,,,,COMPLETE
5199,0.4692628427861228,2024-04-11 17:19:22.395697,2024-04-11 17:19:23.582669,0 days 00:00:01.186972,98.06751933178074,8.328580214671952,sigmoid,60,30.0,26.0,34.0,8.0,4.0,89.0,3.0,35.0,,,,,,,,COMPLETE
5200,0.5952371952371952,2024-04-11 17:19:23.584674,2024-04-11 17:19:24.422537,0 days 00:00:00.837863,81.01841363529259,7.906274021088194,sigmoid,8,,24.0,32.0,,,,,,,,,,,,,COMPLETE
5201,0.12622036262203626,2024-04-11 17:19:24.424503,2024-04-11 17:19:25.279694,0 days 00:00:00.855191,99.9362543653926,7.575263525594419,sigmoid,8,,23.0,29.0,,,,,,,,,,,,,COMPLETE
5202,0.4140380447869011,2024-04-11 17:19:25.281695,2024-04-11 17:19:26.646537,0 days 00:00:01.364842,98.11599014895292,8.116403994130067,sigmoid,54,14.0,,,3.0,3.0,35.0,19.0,17.0,3.4259345472235303,9.52680375251356,7.0167033215871655,3.0,21.0,54.0,,COMPLETE
5203,0.5284502599948854,2024-04-11 17:19:26.649119,2024-04-11 17:19:27.825997,0 days 00:00:01.176878,95.36295711278534,8.554857413343754,sigmoid,7,,,,,,,37.0,25.0,2.2798415004734673,7.445058982394003,7.656799727874432,15.0,42.0,74.0,14.0,COMPLETE
5204,0.39719492414845914,2024-04-11 17:19:27.827966,2024-04-11 17:19:28.698150,0 days 00:00:00.870184,93.10846468339959,8.246049607620023,sigmoid,36,33.0,,,,,,50.0,37.0,,,,,,,,COMPLETE
5205,0.559587003441638,2024-04-11 17:19:28.699794,2024-04-11 17:19:29.585008,0 days 00:00:00.885214,99.97186880529543,7.769983958439702,sigmoid,8,,14.0,47.0,,,,,,,,,,,,,COMPLETE
5206,0.4207291832510746,2024-04-11 17:19:29.587003,2024-04-11 17:19:31.007966,0 days 00:00:01.420963,98.17200193290445,7.995649718819571,rbf,1,,,,,,,,,,,,,,,63.0,COMPLETE
5207,0.3975615967403069,2024-04-11 17:19:31.009966,2024-04-11 17:19:32.377861,0 days 00:00:01.367895,99.9675274894097,8.423604906217708,sigmoid,27,,27.0,31.0,5.0,6.0,4.0,,,0.5112687503714559,3.1641239937370145,4.216815057097173,14.0,35.0,66.0,164.0,COMPLETE
5208,0.28097106636195074,2024-04-11 17:19:32.379886,2024-04-11 17:19:33.335419,0 days 00:00:00.955533,96.70939538839573,7.255036427060774,sigmoid,40,37.0,26.0,30.0,,,,,,,,,,,,,COMPLETE
5209,0.4113882409235002,2024-04-11 17:19:33.337394,2024-04-11 17:19:34.690464,0 days 00:00:01.353070,96.58911592882514,8.134789011125676,sigmoid,23,,,,7.0,7.0,18.0,24.0,41.0,7.380165293799433,2.755091405000584,6.057084210789813,11.0,30.0,100.0,132.0,COMPLETE
5210,0.5929369437606513,2024-04-11 17:19:34.693464,2024-04-11 17:19:35.556880,0 days 00:00:00.863416,99.97416667992243,7.8443734256876185,sigmoid,8,,25.0,33.0,,,,,,,,,,,,,COMPLETE
5211,0.12003789673140693,2024-04-11 17:19:35.559839,2024-04-11 17:19:36.444666,0 days 00:00:00.884827,99.97939669022769,8.313809836017333,sigmoid,8,,24.0,28.0,,,,,,,,,,,,,COMPLETE
5212,0.30890886335191714,2024-04-11 17:19:36.446665,2024-04-11 17:19:37.276836,0 days 00:00:00.830171,91.48723982507138,7.466757588151904,sigmoid,33,9.0,,,,,,,,,,,,,,56.0,COMPLETE
5213,0.5256185854085448,2024-04-11 17:19:37.278836,2024-04-11 17:19:38.161693,0 days 00:00:00.882857,95.65619208278518,7.665530359480569,sigmoid,5,,,,,,,21.0,4.0,,,,,,,148.0,COMPLETE
5214,0.12295002426006793,2024-04-11 17:19:38.163694,2024-04-11 17:19:38.966121,0 days 00:00:00.802427,98.15601883661925,7.996199968156676,sigmoid,32,25.0,,,,,,,,,,,,,,,COMPLETE
5215,0.6009158557527189,2024-04-11 17:19:38.968123,2024-04-11 17:19:39.832836,0 days 00:00:00.864713,96.76418059986219,8.804993304498426,sigmoid,8,,22.0,31.0,,,,,,,,,,,,,COMPLETE
5216,0.5963643249384587,2024-04-11 17:19:39.835430,2024-04-11 17:19:40.701935,0 days 00:00:00.866505,94.04719950845188,8.523857165554597,sigmoid,8,,27.0,32.0,,,,,,,,,,,,,COMPLETE
5217,0.5286643215009061,2024-04-11 17:19:40.703933,2024-04-11 17:19:41.772641,0 days 00:00:01.068708,98.15074503405987,8.132628333221115,sigmoid,34,23.0,,,,,,,,8.977026437968272,4.474223623605672,3.1606908354007723,10.0,29.0,60.0,,COMPLETE
5218,0.4385740147611753,2024-04-11 17:19:41.775229,2024-04-11 17:19:43.019150,0 days 00:00:01.243921,94.93578240189905,7.867947504767314,sigmoid,61,34.0,25.0,29.0,4.0,2.0,28.0,20.0,43.0,,,,,,,36.0,COMPLETE
5219,0.43817607942879905,2024-04-11 17:19:43.020190,2024-04-11 17:19:44.294861,0 days 00:00:01.274671,98.16248570772585,8.286044965394815,sigmoid,51,21.0,,,2.0,8.0,72.0,,,1.019868656007402,3.9117870957853325,8.177574540374906,16.0,32.0,59.0,200.0,COMPLETE
5220,0.3740936504709629,2024-04-11 17:19:44.296857,2024-04-11 17:19:45.385081,0 days 00:00:01.088224,96.7345461465943,7.6559629825845805,sigmoid,45,18.0,28.0,31.0,,,,40.0,12.0,,,,,,,184.0,COMPLETE
5221,0.5929369437606513,2024-04-11 17:19:45.387082,2024-04-11 17:19:46.269131,0 days 00:00:00.882049,96.80245687183589,8.071248567641597,sigmoid,8,,26.0,33.0,,,,,,,,,,,,,COMPLETE
5222,0.48392193082662904,2024-04-11 17:19:46.271130,2024-04-11 17:19:47.712598,0 days 00:00:01.441468,99.99882881553776,8.419966396087283,sigmoid,30,,24.0,30.0,3.0,5.0,41.0,28.0,46.0,3.954155795420733,0.701030284963478,9.677620558368858,4.0,47.0,78.0,,COMPLETE
5223,0.48135015342652576,2024-04-11 17:19:47.714586,2024-04-11 17:19:48.672467,0 days 00:00:00.957881,99.96728467187704,7.868868420557463,sigmoid,17,,,,4.0,1.0,44.0,,,,,,,,,159.0,COMPLETE
5224,0.40786331685332805,2024-04-11 17:19:48.674000,2024-04-11 17:19:49.664086,0 days 00:00:00.990086,93.6238729311907,8.179909040124263,sigmoid,49,16.0,,,2.0,3.0,98.0,,,,,,,,,77.0,COMPLETE
5225,0.41198380088090103,2024-04-11 17:19:49.666095,2024-04-11 17:19:51.106374,0 days 00:00:01.440279,98.21763228943695,7.959199920502236,rbf,4,,,,,,,38.0,9.0,,,,,,,,COMPLETE
5226,0.3541843323984084,2024-04-11 17:19:51.108380,2024-04-11 17:19:52.321397,0 days 00:00:01.213017,99.99884230789372,8.280558759887091,sigmoid,50,28.0,,,6.0,7.0,8.0,,,2.920199613825098,3.431592810173002,5.66775266895839,5.0,38.0,95.0,,COMPLETE
5227,0.4708012444535115,2024-04-11 17:19:52.323393,2024-04-11 17:19:53.527478,0 days 00:00:01.204085,95.3616121038014,7.477496961064147,sigmoid,19,,,,8.0,6.0,83.0,,,4.878913447444789,1.173452442347843,1.7365835807864243,9.0,43.0,64.0,43.0,COMPLETE
5228,0.4054538394910547,2024-04-11 17:19:53.528480,2024-04-11 17:19:54.716854,0 days 00:00:01.188374,99.99733278324379,7.729629554742469,sigmoid,53,2.0,,,1.0,4.0,50.0,14.0,32.0,,,,,,,66.0,COMPLETE
5229,0.587727022564667,2024-04-11 17:19:54.718891,2024-04-11 17:19:55.637984,0 days 00:00:00.919093,96.76458805018441,3.5278685498698588,sigmoid,8,,21.0,27.0,,,,,,,,,,,,,COMPLETE
5230,0.5963643249384587,2024-04-11 17:19:55.639984,2024-04-11 17:19:56.512336,0 days 00:00:00.872352,99.99875861061514,8.54773767173735,sigmoid,8,,23.0,32.0,,,,,,,,,,,,,COMPLETE
5231,0.47967790433962737,2024-04-11 17:19:56.514875,2024-04-11 17:19:57.732486,0 days 00:00:01.217611,98.17699565906909,8.10167902131487,sigmoid,29,,25.0,31.0,1.0,8.0,15.0,8.0,18.0,,,,,,,71.0,COMPLETE
5232,0.4686026915467846,2024-04-11 17:19:57.735086,2024-04-11 17:19:58.958053,0 days 00:00:01.222967,91.70284180467607,7.932988862904063,sigmoid,18,,,,5.0,5.0,11.0,,,5.3535663993382645,1.8153413713535258,9.009741582818704,19.0,28.0,83.0,,COMPLETE
5233,0.46708447440488726,2024-04-11 17:19:58.960044,2024-04-11 17:20:00.352219,0 days 00:00:01.392175,95.21524135884265,8.671867130468161,sigmoid,58,11.0,26.0,30.0,7.0,1.0,78.0,,,6.34698768926324,5.6256856447572785,0.8477076559964143,18.0,33.0,52.0,,COMPLETE
5234,0.5091598084344632,2024-04-11 17:20:00.354221,2024-04-11 17:20:01.643065,0 days 00:00:01.288844,96.76741207107035,8.383792009474222,sigmoid,43,7.0,27.0,33.0,,,,,,7.612086141826116,9.221219945668038,2.9745065435048628,12.0,46.0,50.0,192.0,COMPLETE
5235,0.22682719419952557,2024-04-11 17:20:01.644111,2024-04-11 17:20:02.756397,0 days 00:00:01.112286,98.24168538932344,6.8927216633402875,sigmoid,6,,,,,,,35.0,21.0,7.1264022306442305,4.807501137397028,7.399503198962513,8.0,23.0,73.0,,COMPLETE
5236,0.48060248607749606,2024-04-11 17:20:02.758373,2024-04-11 17:20:03.993844,0 days 00:00:01.235471,93.6331894523812,7.734502915589174,sigmoid,39,22.0,,,,,,17.0,50.0,4.5615379079829745,6.430993600965979,5.470670759640508,7.0,50.0,63.0,137.0,COMPLETE
5237,0.4821780595663062,2024-04-11 17:20:03.995858,2024-04-11 17:20:05.080735,0 days 00:00:01.084877,99.98536602055057,8.12380308961488,sigmoid,25,,24.0,31.0,2.0,2.0,58.0,,,,,,,,,85.0,COMPLETE
5238,0.126809901914993,2024-04-11 17:20:05.082733,2024-04-11 17:20:05.967181,0 days 00:00:00.884448,96.46218673325383,7.354349717222313,sigmoid,8,,25.0,29.0,,,,,,,,,,,,,COMPLETE
5239,0.5963643249384587,2024-04-11 17:20:05.969183,2024-04-11 17:20:06.860845,0 days 00:00:00.891662,99.97074098841732,8.276081124240173,sigmoid,8,,28.0,32.0,,,,,,,,,,,,,COMPLETE
5240,0.5069140556625241,2024-04-11 17:20:06.862846,2024-04-11 17:20:07.710610,0 days 00:00:00.847764,98.19110540067547,7.927685275901592,sigmoid,8,,23.0,35.0,,,,,,,,,,,,,COMPLETE
5241,0.47633900287538383,2024-04-11 17:20:07.712571,2024-04-11 17:20:09.182247,0 days 00:00:01.469676,95.36900023947898,7.62578699706137,sigmoid,31,,26.0,30.0,4.0,4.0,25.0,31.0,5.0,1.827242215184234,7.282876202035149,3.428051873430825,2.0,27.0,97.0,117.0,COMPLETE
5242,0.49939347810574886,2024-04-11 17:20:09.184763,2024-04-11 17:20:10.613719,0 days 00:00:01.428956,98.22538115813055,4.3410294556768925,sigmoid,47,47.0,29.0,32.0,,,,33.0,28.0,1.5221645033176352,5.332571313261843,4.776791089557827,20.0,41.0,77.0,46.0,COMPLETE
5243,0.1839804838381785,2024-04-11 17:20:10.616255,2024-04-11 17:20:11.932080,0 days 00:00:01.315825,89.47557822132478,8.144788176626138,rbf,21,,,,6.0,6.0,67.0,44.0,6.0,,,,,,,142.0,COMPLETE
5244,0.4871437496996204,2024-04-11 17:20:11.934084,2024-04-11 17:20:13.241819,0 days 00:00:01.307735,96.80467214799805,9.448452689902087,sigmoid,22,,,,3.0,3.0,87.0,45.0,15.0,2.0591332286696953,6.027044000030163,2.6285165455425497,3.0,20.0,79.0,,COMPLETE
5245,0.5297879047147296,2024-04-11 17:20:13.243817,2024-04-11 17:20:14.372417,0 days 00:00:01.128600,98.12984853017059,8.456015643382244,sigmoid,35,3.0,,,,,,,,0.7716366108160324,5.09169809645941,1.1998925157194194,11.0,31.0,71.0,172.0,COMPLETE
5246,0.6009432182607054,2024-04-11 17:20:14.374405,2024-04-11 17:20:15.258329,0 days 00:00:00.883924,93.75762880083624,7.811606584577611,sigmoid,8,,25.0,31.0,,,,,,,,,,,,,COMPLETE
5247,0.5906279643331437,2024-04-11 17:20:15.261104,2024-04-11 17:20:16.142060,0 days 00:00:00.880956,96.69318224635111,8.014059736691047,sigmoid,8,,27.0,34.0,,,,,,,,,,,,,COMPLETE
5248,0.4634299516908212,2024-04-11 17:20:16.144097,2024-04-11 17:20:17.192811,0 days 00:00:01.048714,98.26009417352401,8.258339013235833,sigmoid,24,,24.0,30.0,5.0,2.0,52.0,,,,,,,,,,COMPLETE
5249,0.12622036262203626,2024-04-11 17:20:17.194803,2024-04-11 17:20:18.050513,0 days 00:00:00.855710,95.27913485248516,8.627097579396834,sigmoid,8,,22.0,29.0,,,,,,,,,,,,,COMPLETE
5250,0.4270780442639108,2024-04-11 17:20:18.054083,2024-04-11 17:20:19.394269,0 days 00:00:01.340186,98.1452035606763,7.964687562224841,sigmoid,15,,26.0,32.0,,,,36.0,2.0,5.113362271579093,9.846212929319362,5.1837165605883735,17.0,36.0,62.0,98.0,COMPLETE
5251,0.6009432182607054,2024-04-11 17:20:19.396266,2024-04-11 17:20:20.288647,0 days 00:00:00.892381,98.21360388993952,7.638285214657306,sigmoid,8,,25.0,31.0,,,,,,,,,,,,,COMPLETE
5252,0.3545791646260407,2024-04-11 17:20:20.290643,2024-04-11 17:20:21.458111,0 days 00:00:01.167468,99.97753251113605,8.410061780591061,sigmoid,38,45.0,,,,,,22.0,8.0,8.812635215935371,6.748288409640052,9.817949302532973,16.0,45.0,57.0,,COMPLETE
5253,0.4416908435237656,2024-04-11 17:20:21.460106,2024-04-11 17:20:22.616397,0 days 00:00:01.156291,95.09428509294112,8.195071150684136,sigmoid,28,,27.0,28.0,8.0,8.0,46.0,11.0,34.0,,,,,,,,COMPLETE
5254,0.48709830615798644,2024-04-11 17:20:22.618421,2024-04-11 17:20:23.701494,0 days 00:00:01.083073,96.85717372936692,7.866924913476924,sigmoid,3,,,,,,,,,6.681851231334538,8.218312389733335,4.613803382859661,13.0,48.0,93.0,123.0,COMPLETE
5255,0.48040382993501013,2024-04-11 17:20:23.703496,2024-04-11 17:20:24.865379,0 days 00:00:01.161883,98.1851656575786,7.499024234272441,sigmoid,57,17.0,24.0,33.0,7.0,5.0,56.0,,,,,,,,,187.0,COMPLETE
5256,0.48102887786821064,2024-04-11 17:20:24.867389,2024-04-11 17:20:26.187335,0 days 00:00:01.319946,93.97026263210095,8.09900162874738,sigmoid,14,,23.0,31.0,,,,48.0,11.0,2.4543929850894664,4.2760478798257955,3.6549928953691557,6.0,26.0,85.0,,COMPLETE
5257,0.45345352376492626,2024-04-11 17:20:26.189858,2024-04-11 17:20:27.065298,0 days 00:00:00.875440,91.95993251476756,8.353321768158516,sigmoid,8,,26.0,30.0,,,,,,,,,,,,,COMPLETE
5258,0.49549744254736694,2024-04-11 17:20:27.067297,2024-04-11 17:20:28.415258,0 days 00:00:01.347961,96.59441838844401,7.792839555604455,sigmoid,46,26.0,25.0,32.0,,,,10.0,20.0,4.190480420012648,8.78088158814193,3.84005889635327,12.0,40.0,84.0,,COMPLETE
5259,0.5205279536430947,2024-04-11 17:20:28.417279,2024-04-11 17:20:29.342124,0 days 00:00:00.924845,99.96962775971946,8.03925582046421,sigmoid,9,,28.0,29.0,,,,,,,,,,,,151.0,COMPLETE
5260,0.43941960252935863,2024-04-11 17:20:29.344122,2024-04-11 17:20:30.824262,0 days 00:00:01.480140,45.21681140723165,8.65642427188267,sigmoid,62,41.0,26.0,33.0,3.0,7.0,33.0,4.0,36.0,3.774214383104024,4.565720471033655,6.80892623875376,9.0,39.0,67.0,,COMPLETE
5261,0.4639268342411092,2024-04-11 17:20:30.826260,2024-04-11 17:20:31.734249,0 days 00:00:00.907989,95.54445037929987,8.177174054599892,sigmoid,16,,,,6.0,3.0,100.0,,,,,,,,,,COMPLETE
5262,0.4336291038154392,2024-04-11 17:20:31.736767,2024-04-11 17:20:33.305532,0 days 00:00:01.568765,98.1773770422147,2.4903404676928766,rbf,8,,24.0,30.0,,,,,,,,,,,,,COMPLETE
5263,0.2410314353738751,2024-04-11 17:20:33.307533,2024-04-11 17:20:34.337575,0 days 00:00:01.030042,23.988180300146738,8.82924435146619,sigmoid,2,,,,,,,,,1.2046478334252564,3.657333747264014,8.579589814501507,7.0,25.0,91.0,,COMPLETE
5264,0.5895095625828441,2024-04-11 17:20:34.339615,2024-04-11 17:20:35.213056,0 days 00:00:00.873441,98.22559284489297,7.771989749825512,sigmoid,8,,30.0,34.0,,,,,,,,,,,,,COMPLETE
5265,0.4913112965828661,2024-04-11 17:20:35.215057,2024-04-11 17:20:36.787356,0 days 00:00:01.572299,96.64688526714986,7.212488319765487,sigmoid,63,48.0,25.0,31.0,7.0,1.0,61.0,15.0,45.0,8.518615809418113,2.9056782778672745,5.808435713033841,15.0,44.0,96.0,82.0,COMPLETE
5266,0.5549171365478207,2024-04-11 17:20:36.789352,2024-04-11 17:20:38.008661,0 days 00:00:01.219309,93.50126574327595,8.450558275876917,sigmoid,10,,27.0,32.0,,,,,,8.196803178379025,7.711260754594594,7.28406184582718,4.0,34.0,70.0,,COMPLETE
5267,0.35600272335274985,2024-04-11 17:20:38.010664,2024-04-11 17:20:39.206087,0 days 00:00:01.195423,98.11598905364147,7.963187284353257,sigmoid,11,,22.0,31.0,,,,,,3.2581488540550305,2.1632628156892846,0.6788639198304374,2.0,42.0,87.0,111.0,COMPLETE
5268,0.3729974074320281,2024-04-11 17:20:39.208091,2024-04-11 17:20:40.169648,0 days 00:00:00.961557,95.45536645748294,7.539709805849452,sigmoid,41,35.0,23.0,30.0,,,,,,,,,,,,60.0,COMPLETE
5269,0.40213653102839575,2024-04-11 17:20:40.171645,2024-04-11 17:20:41.583295,0 days 00:00:01.411650,98.21548920689084,8.237988660118221,sigmoid,26,,25.0,32.0,1.0,4.0,2.0,,,6.160737487527076,6.293995140963856,8.101678096407042,14.0,35.0,53.0,,COMPLETE
5270,0.3480516653363326,2024-04-11 17:20:41.585295,2024-04-11 17:20:42.819117,0 days 00:00:01.233822,96.35947865113324,7.997639979052395,sigmoid,42,31.0,24.0,29.0,,,,,,4.442319950839471,1.6233137170854945,2.8529168131671687,19.0,37.0,89.0,,COMPLETE
5271,0.45024875621890553,2024-04-11 17:20:42.821708,2024-04-11 17:20:43.687473,0 days 00:00:00.865765,99.93369029331507,5.868112215249287,sigmoid,8,,26.0,28.0,,,,,,,,,,,,,COMPLETE
5272,0.5929369437606513,2024-04-11 17:20:43.689471,2024-04-11 17:20:44.554365,0 days 00:00:00.864894,96.63006760714647,7.784907185044301,sigmoid,8,,29.0,33.0,,,,,,,,,,,,,COMPLETE
5273,0.537113238901638,2024-04-11 17:20:44.556937,2024-04-11 17:20:45.455367,0 days 00:00:00.898430,99.99772922244418,9.047200074217006,sigmoid,8,,28.0,49.0,,,,,,,,,,,,,COMPLETE
5274,0.3259181453276813,2024-04-11 17:20:45.458368,2024-04-11 17:20:46.768831,0 days 00:00:01.310463,93.76306776447262,8.33823691328707,sigmoid,52,6.0,,,5.0,6.0,70.0,46.0,48.0,,,,,,,,COMPLETE
5275,0.44117324861696877,2024-04-11 17:20:46.770839,2024-04-11 17:20:47.911093,0 days 00:00:01.140254,98.32654976674897,8.104291201160182,sigmoid,56,24.0,24.0,31.0,4.0,8.0,95.0,,,,,,,,,,COMPLETE
5276,0.45345352376492626,2024-04-11 17:20:47.913089,2024-04-11 17:20:48.798057,0 days 00:00:00.884968,98.20269021074773,8.539132464324458,sigmoid,8,,27.0,30.0,,,,,,,,,,,,,COMPLETE
5277,0.4439811124057153,2024-04-11 17:20:48.800049,2024-04-11 17:20:50.200656,0 days 00:00:01.400607,94.97898303180905,7.9009814618364596,sigmoid,55,27.0,,,2.0,7.0,92.0,6.0,23.0,3.5217297088721473,8.579646124793136,6.392035319840321,10.0,49.0,82.0,93.0,COMPLETE
5278,0.5952371952371952,2024-04-11 17:20:50.202656,2024-04-11 17:20:51.065033,0 days 00:00:00.862377,99.95548275994844,7.611770666448899,sigmoid,8,,25.0,32.0,,,,,,,,,,,,,COMPLETE
5279,0.29293806497453917,2024-04-11 17:20:51.067032,2024-04-11 17:20:52.052587,0 days 00:00:00.985555,96.62071134435263,8.20906068864765,sigmoid,37,39.0,,,,,,26.0,26.0,,,,,,,180.0,COMPLETE
