number,value,datetime_start,datetime_complete,duration,params_C,params_gamma,params_kernel,params_mask_number,params_rsi_window,params_so_smooth,params_so_window,params_srsi_smooth1,params_srsi_smooth2,params_srsi_window,params_tsi_window_fast,params_tsi_window_slow,params_ult_weight_1,params_ult_weight_2,params_ult_weight_3,params_ult_window_1,params_ult_window_2,params_ult_window_3,params_williams_lbp,state
6411,0.3423167848699763,2024-04-11 17:48:04.226625,2024-04-11 17:48:06.310809,0 days 00:00:02.084184,98.2201864566138,7.595646476089327,sigmoid,56,19.0,24.0,31.0,5.0,6.0,10.0,,,,,,,,,,COMPLETE
6412,0.45345352376492626,2024-04-11 17:48:06.313785,2024-04-11 17:48:07.916035,0 days 00:00:01.602250,98.1062332853662,8.374654882024128,sigmoid,8,,23.0,30.0,,,,,,,,,,,,,COMPLETE
6413,0.5003981067810854,2024-04-11 17:48:07.918898,2024-04-11 17:48:09.679348,0 days 00:00:01.760450,95.30466730667935,8.03481177596764,sigmoid,37,14.0,,,,,,26.0,12.0,,,,,,,162.0,COMPLETE
6414,0.3243146389535925,2024-04-11 17:48:09.682348,2024-04-11 17:48:11.568688,0 days 00:00:01.886340,45.10919325123273,8.587520348056321,sigmoid,52,28.0,,,3.0,5.0,31.0,17.0,47.0,,,,,,,,COMPLETE
6415,0.3336200540673384,2024-04-11 17:48:11.572672,2024-04-11 17:48:13.413985,0 days 00:00:01.841313,98.00512382796056,7.766152631274384,sigmoid,48,4.0,,,8.0,2.0,84.0,,,,,,,,,,COMPLETE
6416,0.5929369437606513,2024-04-11 17:48:13.416652,2024-04-11 17:48:14.997682,0 days 00:00:01.581030,90.75762060709725,8.2113190598357,sigmoid,8,,27.0,33.0,,,,,,,,,,,,,COMPLETE
6417,0.5005892114186768,2024-04-11 17:48:15.000678,2024-04-11 17:48:17.373687,0 days 00:00:02.373009,98.23624480073607,8.812416600768257,sigmoid,11,,26.0,29.0,,,,,,3.1218191768476786,7.217413491062863,5.0678861459266455,19.0,36.0,98.0,39.0,COMPLETE
6418,0.5952371952371952,2024-04-11 17:48:17.377253,2024-04-11 17:48:19.006421,0 days 00:00:01.629168,96.51490875229814,7.958635486483942,sigmoid,8,,25.0,32.0,,,,,,,,,,,,,COMPLETE
6419,0.5047154840172297,2024-04-11 17:48:19.009455,2024-04-11 17:48:20.975246,0 days 00:00:01.965791,93.07344355686116,8.340197282879522,sigmoid,44,44.0,27.0,31.0,,,,13.0,23.0,,,,,,,,COMPLETE
6420,0.35822583495317195,2024-04-11 17:48:20.978791,2024-04-11 17:48:23.227677,0 days 00:00:02.248886,99.95175656733518,3.283120427490637,sigmoid,13,,4.0,32.0,,,,3.0,30.0,,,,,,,154.0,COMPLETE
6421,0.4523783929051331,2024-04-11 17:48:23.230687,2024-04-11 17:48:25.911690,0 days 00:00:02.681003,95.43728068961288,8.140526018467561,rbf,8,,25.0,26.0,,,,,,,,,,,,,COMPLETE
6422,0.44701971028259324,2024-04-11 17:48:25.916699,2024-04-11 17:48:27.938712,0 days 00:00:02.022013,96.87564232818411,7.464871311830109,sigmoid,8,,20.0,30.0,,,,,,,,,,,,,COMPLETE
6423,0.6009432182607054,2024-04-11 17:48:27.942680,2024-04-11 17:48:29.654228,0 days 00:00:01.711548,98.15204447960096,7.823272183240469,sigmoid,8,,23.0,31.0,,,,,,,,,,,,,COMPLETE
6424,0.43284578165841725,2024-04-11 17:48:29.656832,2024-04-11 17:48:32.104060,0 days 00:00:02.447228,10.529708095291674,8.03393058703251,sigmoid,54,48.0,,,6.0,3.0,48.0,27.0,26.0,5.762915851468189,2.5341856208588975,2.4542626037897755,20.0,40.0,68.0,,COMPLETE
6425,0.1533745389293191,2024-04-11 17:48:32.108211,2024-04-11 17:48:34.117090,0 days 00:00:02.008879,98.0461335500853,8.460615794956865,sigmoid,20,,,,1.0,8.0,39.0,46.0,43.0,,,,,,,,COMPLETE
6426,0.45045019853475754,2024-04-11 17:48:34.122317,2024-04-11 17:48:36.801135,0 days 00:00:02.678818,95.25121352521622,7.670786487616918,sigmoid,23,,,,2.0,1.0,45.0,8.0,5.0,0.502297902322951,9.134692902940976,4.078339446796491,11.0,33.0,58.0,24.0,COMPLETE
6427,0.41092262092451276,2024-04-11 17:48:36.804154,2024-04-11 17:48:39.514815,0 days 00:00:02.710661,98.160752934341,8.273806106705281,sigmoid,59,23.0,26.0,31.0,7.0,6.0,19.0,,,6.810584516351723,2.831574696340677,4.659763069768588,16.0,31.0,60.0,192.0,COMPLETE
6428,0.47292381781853576,2024-04-11 17:48:39.519380,2024-04-11 17:48:41.988032,0 days 00:00:02.468652,96.7152050839313,7.908881771807946,sigmoid,55,20.0,,,5.0,5.0,57.0,11.0,3.0,9.999036048930328,1.524847175395466,8.990662522325204,12.0,20.0,86.0,47.0,COMPLETE
6429,0.5929369437606513,2024-04-11 17:48:41.991032,2024-04-11 17:48:43.600467,0 days 00:00:01.609435,99.96741293051643,8.117238587270693,sigmoid,8,,22.0,33.0,,,,,,,,,,,,,COMPLETE
6430,0.3325207560501678,2024-04-11 17:48:43.603466,2024-04-11 17:48:45.307758,0 days 00:00:01.704292,93.72202505923542,8.669712319865027,sigmoid,12,,24.0,29.0,,,,44.0,20.0,,,,,,,,COMPLETE
6431,0.33527040278938,2024-04-11 17:48:45.310791,2024-04-11 17:48:47.575766,0 days 00:00:02.264975,98.12926156018241,7.799258784141747,sigmoid,7,,,,,,,35.0,18.0,8.778911101275346,4.138053259546578,1.2648484304445313,14.0,49.0,95.0,196.0,COMPLETE
6432,0.4669210512172838,2024-04-11 17:48:47.579284,2024-04-11 17:48:49.858596,0 days 00:00:02.279312,95.61453533215713,8.245840652638796,sigmoid,60,26.0,28.0,34.0,8.0,4.0,93.0,12.0,8.0,,,,,,,,COMPLETE
6433,0.5687712201112476,2024-04-11 17:48:49.861596,2024-04-11 17:48:51.359723,0 days 00:00:01.498127,98.22807826307877,7.59287582925868,sigmoid,32,8.0,,,,,,,,,,,,,,,COMPLETE
6434,0.5952828415711333,2024-04-11 17:48:51.362716,2024-04-11 17:48:52.973266,0 days 00:00:01.610550,96.74337811014996,9.995345206124957,sigmoid,8,,26.0,30.0,,,,,,,,,,,,,COMPLETE
6435,0.48776305152012545,2024-04-11 17:48:52.977248,2024-04-11 17:48:54.434706,0 days 00:00:01.457458,92.38542686240169,7.336026276863834,sigmoid,1,,,,,,,,,,,,,,,130.0,COMPLETE
6436,0.3727583803307776,2024-04-11 17:48:54.438890,2024-04-11 17:48:57.216035,0 days 00:00:02.777145,98.17588689701293,7.998951568588708,sigmoid,30,,24.0,32.0,4.0,2.0,13.0,24.0,49.0,5.51866750084798,5.610657680947547,8.27359577633429,17.0,37.0,94.0,,COMPLETE
6437,0.2813893548255124,2024-04-11 17:48:57.220572,2024-04-11 17:48:59.146607,0 days 00:00:01.926035,95.16855395769169,8.451010741030291,sigmoid,34,49.0,,,,,,,,8.389328204661098,7.821185726869323,6.1055669641560515,4.0,27.0,80.0,,COMPLETE
6438,0.12622036262203626,2024-04-11 17:48:59.151032,2024-04-11 17:49:00.726373,0 days 00:00:01.575341,98.02732458218132,9.148720959733886,sigmoid,8,,25.0,29.0,,,,,,,,,,,,,COMPLETE
6439,0.5864669774809641,2024-04-11 17:49:00.729983,2024-04-11 17:49:02.410297,0 days 00:00:01.680314,98.2866063295841,8.106242541912454,sigmoid,8,,27.0,5.0,,,,,,,,,,,,,COMPLETE
6440,0.3934381686648779,2024-04-11 17:49:02.413299,2024-04-11 17:49:04.654592,0 days 00:00:02.241293,99.97062177515565,7.8505113618732025,rbf,33,36.0,,,,,,,,,,,,,,85.0,COMPLETE
6441,0.30507565600459685,2024-04-11 17:49:04.658115,2024-04-11 17:49:06.354890,0 days 00:00:01.696775,99.9893750425499,8.322816193606743,sigmoid,36,17.0,,,,,,22.0,41.0,,,,,,,,COMPLETE
6442,0.48373336074420514,2024-04-11 17:49:06.358413,2024-04-11 17:49:08.916221,0 days 00:00:02.557808,95.52234796968963,8.563670289744158,sigmoid,27,,24.0,31.0,2.0,3.0,63.0,,,2.0843380518017223,8.460289627875984,4.459966047117312,5.0,38.0,66.0,173.0,COMPLETE
6443,0.40081716673944234,2024-04-11 17:49:08.920799,2024-04-11 17:49:11.090864,0 days 00:00:02.170065,96.63646213063952,7.650985151787039,sigmoid,45,13.0,26.0,30.0,,,,7.0,9.0,,,,,,,96.0,COMPLETE
6444,0.5700088630749212,2024-04-11 17:49:11.093854,2024-04-11 17:49:13.036278,0 days 00:00:01.942424,93.77134133960946,7.998247629237432,sigmoid,40,46.0,25.0,4.0,,,,,,,,,,,,,COMPLETE
6445,0.5307809795336523,2024-04-11 17:49:13.039382,2024-04-11 17:49:14.778255,0 days 00:00:01.738873,96.63045208641779,2.8869641159197084,sigmoid,4,,,,,,,29.0,33.0,,,,,,,,COMPLETE
6446,0.4600135547272111,2024-04-11 17:49:14.782058,2024-04-11 17:49:16.940061,0 days 00:00:02.158003,90.11669154404667,8.190931258030536,sigmoid,53,12.0,,,6.0,7.0,97.0,19.0,7.0,,,,,,,126.0,COMPLETE
6447,0.5952371952371952,2024-04-11 17:49:16.943058,2024-04-11 17:49:18.685305,0 days 00:00:01.742247,98.29027113458899,7.8510338562583195,sigmoid,8,,27.0,32.0,,,,,,,,,,,,,COMPLETE
6448,0.4704065120384446,2024-04-11 17:49:18.689460,2024-04-11 17:49:20.877267,0 days 00:00:02.187807,98.33290178337744,8.408385331298783,sigmoid,17,,,,3.0,1.0,4.0,,,,,,,,,59.0,COMPLETE
6449,0.4606770170526851,2024-04-11 17:49:20.881736,2024-04-11 17:49:23.496912,0 days 00:00:02.615176,94.12282860319898,8.116607429373031,sigmoid,51,3.0,,,7.0,8.0,61.0,,,7.5910774445117415,0.7833810568610495,1.9063535631458581,10.0,42.0,53.0,14.0,COMPLETE
6450,0.45347172512526845,2024-04-11 17:49:23.502494,2024-04-11 17:49:25.636989,0 days 00:00:02.134495,99.99005679892879,7.6829014778504945,sigmoid,8,,29.0,28.0,,,,,,,,,,,,,COMPLETE
6451,0.4367786015409217,2024-04-11 17:49:25.641573,2024-04-11 17:49:28.120564,0 days 00:00:02.478991,96.43912708154654,8.901007277582504,sigmoid,18,,,,1.0,6.0,76.0,,,3.799666072547018,9.993797390701666,8.70983565581369,6.0,36.0,91.0,,COMPLETE
6452,0.2721251523770825,2024-04-11 17:49:28.123560,2024-04-11 17:49:29.922306,0 days 00:00:01.798746,99.93883404057677,7.995795567549887,sigmoid,5,,,,,,,33.0,11.0,,,,,,,18.0,COMPLETE
6453,0.38271288524380087,2024-04-11 17:49:29.926310,2024-04-11 17:49:32.513619,0 days 00:00:02.587309,96.76085961365168,7.121319720975731,sigmoid,61,2.0,23.0,33.0,5.0,4.0,55.0,38.0,38.0,,,,,,,181.0,COMPLETE
6454,0.4502698896972542,2024-04-11 17:49:32.516613,2024-04-11 17:49:34.484831,0 days 00:00:01.968218,95.25116307047453,7.388123402963945,sigmoid,8,,26.0,30.0,,,,,,,,,,,,,COMPLETE
6455,0.4584483675692104,2024-04-11 17:49:34.488812,2024-04-11 17:49:36.000485,0 days 00:00:01.511673,92.20552010083259,8.254552807192745,sigmoid,49,41.0,,,8.0,8.0,50.0,,,,,,,,,79.0,COMPLETE
6456,0.44596972896867293,2024-04-11 17:49:36.002457,2024-04-11 17:49:38.737516,0 days 00:00:02.735059,99.98565080184476,8.608093983879169,sigmoid,19,,,,6.0,2.0,90.0,,,1.074436130383659,8.179388242523913,7.3189063529324425,8.0,25.0,56.0,70.0,COMPLETE
6457,0.5718532089510385,2024-04-11 17:49:38.741027,2024-04-11 17:49:40.850530,0 days 00:00:02.109503,98.2940266019992,7.839962096165904,sigmoid,8,,24.0,13.0,,,,,,,,,,,,,COMPLETE
6458,0.4831965270327586,2024-04-11 17:49:40.855534,2024-04-11 17:49:43.540178,0 days 00:00:02.684644,96.25453294070512,8.359357191374084,sigmoid,58,27.0,22.0,32.0,4.0,5.0,41.0,,,2.6757687034436493,5.417228704048367,0.676024064502804,3.0,28.0,97.0,,COMPLETE
6459,0.23220526432205263,2024-04-11 17:49:43.544176,2024-04-11 17:49:46.260948,0 days 00:00:02.716772,96.68077545590012,8.011744508285798,rbf,50,33.0,,,2.0,3.0,34.0,,,2.3474979112092886,3.5053972590548335,5.6768829875192575,13.0,26.0,63.0,,COMPLETE
6460,0.2537059847937816,2024-04-11 17:49:46.263954,2024-04-11 17:49:48.069532,0 days 00:00:01.805578,99.99083197705069,7.578303639219733,sigmoid,6,,,,,,,36.0,15.0,7.8742969447284406,7.094990769520367,7.688443854137324,18.0,41.0,83.0,,COMPLETE
6461,0.3520559631462208,2024-04-11 17:49:48.072563,2024-04-11 17:49:49.996453,0 days 00:00:01.923890,97.94069125244496,8.199932135564033,sigmoid,29,,25.0,31.0,1.0,7.0,8.0,47.0,14.0,,,,,,,45.0,COMPLETE
6462,0.6009432182607054,2024-04-11 17:49:49.999984,2024-04-11 17:49:51.930096,0 days 00:00:01.930112,99.9811365927717,7.783508551873832,sigmoid,8,,25.0,31.0,,,,,,,,,,,,,COMPLETE
6463,0.4202545433698331,2024-04-11 17:49:51.933095,2024-04-11 17:49:54.532708,0 days 00:00:02.599613,94.11632695681556,8.005355404727839,sigmoid,47,5.0,27.0,29.0,,,,32.0,24.0,5.918995978638821,6.4432879144626,9.747482735571019,16.0,46.0,59.0,52.0,COMPLETE
6464,0.37308977183879455,2024-04-11 17:49:54.535707,2024-04-11 17:49:57.159817,0 days 00:00:02.624110,97.99872777913644,8.472236925109382,sigmoid,39,15.0,,,,,,50.0,27.0,9.640752867386192,4.8934825649586555,7.077836658827428,2.0,24.0,73.0,132.0,COMPLETE
6465,0.4894537587885343,2024-04-11 17:49:57.162870,2024-04-11 17:49:58.926327,0 days 00:00:01.763457,98.13179039584804,8.220529052127482,sigmoid,25,,26.0,34.0,3.0,6.0,71.0,,,,,,,,,120.0,COMPLETE
6466,0.44701971028259324,2024-04-11 17:49:58.929330,2024-04-11 17:50:00.449881,0 days 00:00:01.520551,95.23500464208006,7.895527682820945,sigmoid,8,,28.0,30.0,,,,,,,,,,,,,COMPLETE
6467,0.3743352373448887,2024-04-11 17:50:00.453935,2024-04-11 17:50:02.875404,0 days 00:00:02.421469,98.28716874282946,8.115416632669346,sigmoid,43,35.0,23.0,33.0,,,,,,9.390845050477093,4.588757293147363,6.626956843679762,9.0,32.0,88.0,90.0,COMPLETE
6468,0.48451428112535794,2024-04-11 17:50:02.878412,2024-04-11 17:50:04.376118,0 days 00:00:01.497706,98.21172801934054,8.730829955913062,sigmoid,24,,21.0,32.0,7.0,1.0,68.0,,,,,,,,,,COMPLETE
6469,0.5218319468286456,2024-04-11 17:50:04.379740,2024-04-11 17:50:06.367100,0 days 00:00:01.987360,95.349228464574,7.51364426630173,sigmoid,35,7.0,,,,,,,,4.242869468101781,9.635212495489048,5.345753370110757,7.0,21.0,64.0,113.0,COMPLETE
6470,0.5963245096172158,2024-04-11 17:50:06.371706,2024-04-11 17:50:08.209714,0 days 00:00:01.838008,96.64716051972329,8.374365166408355,sigmoid,8,,24.0,31.0,,,,,,,,,,,,,COMPLETE
6471,0.44701971028259324,2024-04-11 17:50:08.212701,2024-04-11 17:50:09.582035,0 days 00:00:01.369334,98.18245349837117,7.679768236330098,sigmoid,8,,25.0,30.0,,,,,,,,,,,,,COMPLETE
6472,0.32579592755090564,2024-04-11 17:50:09.585007,2024-04-11 17:50:11.415668,0 days 00:00:01.830661,16.709786062807737,8.011126985117809,sigmoid,38,6.0,,,,,,18.0,34.0,1.8694585981022138,3.952737551317564,2.658154425813905,19.0,23.0,54.0,,COMPLETE
6473,0.5975614331269932,2024-04-11 17:50:11.419655,2024-04-11 17:50:12.714524,0 days 00:00:01.294869,58.24793840548504,6.5060241327229384,sigmoid,8,,27.0,32.0,,,,,,,,,,,,,COMPLETE
6474,0.4373976317697285,2024-04-11 17:50:12.717526,2024-04-11 17:50:15.286495,0 days 00:00:02.568969,92.02133874204853,8.193863591838966,sigmoid,22,,,,5.0,4.0,17.0,20.0,31.0,1.370523336379093,6.864376523862719,0.5191235774090872,15.0,31.0,84.0,,COMPLETE
6475,0.4874799825302082,2024-04-11 17:50:15.290015,2024-04-11 17:50:18.060064,0 days 00:00:02.770049,93.98694855286159,8.556612396484569,sigmoid,15,,26.0,28.0,,,,5.0,36.0,3.9943459015796803,8.968770027796683,1.3980610873226968,17.0,22.0,62.0,164.0,COMPLETE
6476,0.42816168426032714,2024-04-11 17:50:18.063026,2024-04-11 17:50:20.750361,0 days 00:00:02.687335,96.81434219659329,7.790307763270911,sigmoid,31,,24.0,31.0,4.0,2.0,22.0,16.0,50.0,8.591462759630842,7.5559151203763975,8.086957029901614,14.0,34.0,51.0,106.0,COMPLETE
6477,0.48902097558579355,2024-04-11 17:50:20.754235,2024-04-11 17:50:22.748429,0 days 00:00:01.994194,98.07633460031904,8.357395804373489,sigmoid,21,,,,2.0,5.0,52.0,30.0,19.0,,,,,,,176.0,COMPLETE
6478,0.1971677559912854,2024-04-11 17:50:22.752799,2024-04-11 17:50:25.325149,0 days 00:00:02.572350,99.99582593577522,7.983761202693337,rbf,28,,25.0,29.0,3.0,8.0,95.0,15.0,28.0,,,,,,,,COMPLETE
6479,0.5929369437606513,2024-04-11 17:50:25.328150,2024-04-11 17:50:26.965328,0 days 00:00:01.637178,96.60606806358206,7.379340014333572,sigmoid,8,,29.0,33.0,,,,,,,,,,,,,COMPLETE
6480,0.5986580986580987,2024-04-11 17:50:26.969327,2024-04-11 17:50:28.650507,0 days 00:00:01.681180,99.97931853611252,8.17665411700918,sigmoid,8,,24.0,31.0,,,,,,,,,,,,,COMPLETE
6481,0.5393185645809042,2024-04-11 17:50:28.653450,2024-04-11 17:50:30.731838,0 days 00:00:02.078388,95.21327474867937,7.735794348511548,sigmoid,3,,,,,,,,,5.214974763991005,1.9572188597148634,0.9536627472078134,10.0,47.0,76.0,186.0,COMPLETE
6482,0.4262338860430676,2024-04-11 17:50:30.736830,2024-04-11 17:50:32.507725,0 days 00:00:01.770895,98.11712780392945,7.954488042852456,sigmoid,8,,28.0,17.0,,,,,,,,,,,,,COMPLETE
6483,0.36908403223154085,2024-04-11 17:50:32.511270,2024-04-11 17:50:35.137894,0 days 00:00:02.626624,99.96092618906948,8.472139563889462,sigmoid,14,,26.0,30.0,,,,42.0,10.0,7.109108020961321,9.33280112065659,9.449224849490015,20.0,43.0,61.0,,COMPLETE
6484,0.5189905104339713,2024-04-11 17:50:35.141524,2024-04-11 17:50:37.655426,0 days 00:00:02.513902,93.29555881142355,8.206783718016224,sigmoid,42,29.0,23.0,32.0,,,,,,6.166010838481743,3.185519346649811,3.9501864745612174,11.0,50.0,78.0,,COMPLETE
6485,0.5555245535714285,2024-04-11 17:50:37.658426,2024-04-11 17:50:39.489658,0 days 00:00:01.831232,99.98057872223909,7.8777784094422465,sigmoid,16,,,,6.0,7.0,79.0,,,,,,,,,,COMPLETE
6486,0.4259392966974194,2024-04-11 17:50:39.493231,2024-04-11 17:50:42.297642,0 days 00:00:02.804411,95.55525386257362,7.6207816643251425,sigmoid,63,45.0,27.0,34.0,8.0,4.0,85.0,37.0,25.0,4.4184466190513,4.436677037364267,8.537813958791054,12.0,44.0,90.0,141.0,COMPLETE
6487,0.30431127657019336,2024-04-11 17:50:42.301175,2024-04-11 17:50:44.045260,0 days 00:00:01.744085,98.21618890256356,8.085888533675348,sigmoid,9,,30.0,30.0,,,,,,,,,,,,99.0,COMPLETE
6488,0.49146800189323175,2024-04-11 17:50:44.049272,2024-04-11 17:50:46.544771,0 days 00:00:02.495499,96.73210460096917,8.38091206124927,sigmoid,46,21.0,22.0,31.0,,,,23.0,39.0,9.257504487629978,2.220733893382522,3.514951067106784,16.0,45.0,85.0,,COMPLETE
6489,0.43210223283246735,2024-04-11 17:50:46.547774,2024-04-11 17:50:48.993894,0 days 00:00:02.446120,96.7187835073882,8.591454971835214,sigmoid,57,39.0,25.0,29.0,1.0,3.0,29.0,,,,,,,,,66.0,COMPLETE
6490,0.5952371952371952,2024-04-11 17:50:48.998894,2024-04-11 17:50:50.651606,0 days 00:00:01.652712,99.9911934278084,7.775782611523256,sigmoid,8,,25.0,32.0,,,,,,,,,,,,,COMPLETE
6491,0.5929369437606513,2024-04-11 17:50:50.654639,2024-04-11 17:50:52.315409,0 days 00:00:01.660770,98.14313755683956,8.23210793060591,sigmoid,8,,26.0,33.0,,,,,,,,,,,,,COMPLETE
6492,0.594268224819143,2024-04-11 17:50:52.318410,2024-04-11 17:50:53.853206,0 days 00:00:01.534796,54.80559716807084,7.989799205427838,sigmoid,8,,23.0,27.0,,,,,,,,,,,,,COMPLETE
6493,0.2785346995458469,2024-04-11 17:50:53.857213,2024-04-11 17:50:55.938970,0 days 00:00:02.081757,93.9750990371821,7.517288261136129,sigmoid,2,,,,,,,,,4.829491310221305,9.80087098525065,4.977870541908237,5.0,29.0,82.0,,COMPLETE
6494,0.36118569044336407,2024-04-11 17:50:55.942566,2024-04-11 17:50:58.064489,0 days 00:00:02.121923,98.22072453279864,6.9938017911577255,sigmoid,10,,24.0,31.0,,,,,,6.5095553783203615,1.0352041248513464,4.2386221303411205,4.0,44.0,94.0,,COMPLETE
6495,0.5015190919475975,2024-04-11 17:50:58.067488,2024-04-11 17:51:00.764280,0 days 00:00:02.696792,88.92339119267828,8.069109487341755,sigmoid,26,,27.0,30.0,7.0,1.0,26.0,,,7.522855963893864,1.29580083700845,2.8280407529045277,7.0,48.0,70.0,,COMPLETE
6496,0.22137162529443738,2024-04-11 17:51:00.768281,2024-04-11 17:51:03.209881,0 days 00:00:02.441600,95.38306456256747,7.250400229018121,rbf,41,25.0,26.0,32.0,,,,,,,,,,,,157.0,COMPLETE
6497,0.48426260127716503,2024-04-11 17:51:03.213486,2024-04-11 17:51:05.881220,0 days 00:00:02.667734,98.25022090902607,8.826542156416082,sigmoid,62,23.0,25.0,29.0,4.0,6.0,65.0,41.0,22.0,3.384396899950934,6.076116528765067,3.2270656398678184,2.0,39.0,52.0,,COMPLETE
6498,0.5069140556625241,2024-04-11 17:51:05.884831,2024-04-11 17:51:07.590016,0 days 00:00:01.705185,96.43672651474105,4.9090157875780775,sigmoid,8,,28.0,35.0,,,,,,,,,,,,,COMPLETE
6499,0.5089589327753073,2024-04-11 17:51:07.592601,2024-04-11 17:51:09.853146,0 days 00:00:02.260545,92.13217477064607,8.297519591759107,sigmoid,20,,,,5.0,3.0,73.0,10.0,17.0,,,,,,,,COMPLETE
6500,0.4731725888324874,2024-04-11 17:51:09.858150,2024-04-11 17:51:12.262176,0 days 00:00:02.404026,98.09936155007486,7.86171685838483,sigmoid,11,,24.0,33.0,,,,,,8.163986995844935,1.6929780902372435,1.6573230523238132,3.0,35.0,100.0,30.0,COMPLETE
6501,0.44701971028259324,2024-04-11 17:51:12.265231,2024-04-11 17:51:13.923344,0 days 00:00:01.658113,35.57337416823171,8.112890377588283,sigmoid,8,,23.0,30.0,,,,,,,,,,,,,COMPLETE
6502,0.5286079727137072,2024-04-11 17:51:13.926337,2024-04-11 17:51:15.869018,0 days 00:00:01.942681,95.1249263565695,8.408716197612204,sigmoid,48,10.0,,,6.0,7.0,15.0,,,,,,,,,,COMPLETE
6503,0.6009432182607054,2024-04-11 17:51:15.872609,2024-04-11 17:51:17.482061,0 days 00:00:01.609452,96.66571601404569,7.777005818252194,sigmoid,8,,26.0,31.0,,,,,,,,,,,,,COMPLETE
6504,0.5963643249384587,2024-04-11 17:51:17.485110,2024-04-11 17:51:19.125486,0 days 00:00:01.640376,98.21877564651555,8.587260480302836,sigmoid,8,,25.0,32.0,,,,,,,,,,,,,COMPLETE
6505,0.46359476799124677,2024-04-11 17:51:19.128487,2024-04-11 17:51:21.027625,0 days 00:00:01.899138,99.93307191659873,7.943784952222193,sigmoid,52,31.0,,,8.0,2.0,87.0,2.0,46.0,,,,,,,,COMPLETE
6506,0.35681737388100704,2024-04-11 17:51:21.030620,2024-04-11 17:51:23.053112,0 days 00:00:02.022492,94.22269397397653,7.56468121219987,sigmoid,56,24.0,27.0,31.0,2.0,8.0,37.0,,,,,,,,,,COMPLETE
6507,0.5538470420692044,2024-04-11 17:51:23.056102,2024-04-11 17:51:25.099616,0 days 00:00:02.043514,98.28360640612206,8.167050173579064,sigmoid,44,47.0,24.0,30.0,,,,45.0,45.0,,,,,,,,COMPLETE
6508,0.5025931705525977,2024-04-11 17:51:25.103139,2024-04-11 17:51:27.090540,0 days 00:00:01.987401,96.5754994770533,8.337036122803434,sigmoid,13,,26.0,34.0,,,,4.0,35.0,,,,,,,148.0,COMPLETE
6509,0.45999304459484763,2024-04-11 17:51:27.095111,2024-04-11 17:51:29.845401,0 days 00:00:02.750290,98.23955363900562,7.725601345556782,sigmoid,55,16.0,,,3.0,4.0,46.0,48.0,18.0,0.8767879307519548,6.628952862568151,2.296985383956322,10.0,37.0,72.0,55.0,COMPLETE
6510,0.30681594197185313,2024-04-11 17:51:29.848401,2024-04-11 17:51:31.790694,0 days 00:00:01.942293,99.97031505800797,7.9626304310537295,sigmoid,12,,22.0,28.0,,,,13.0,38.0,,,,,,,,COMPLETE
6511,0.6009432182607054,2024-04-11 17:51:31.794246,2024-04-11 17:51:33.352080,0 days 00:00:01.557834,95.33633526034573,8.153804731863309,sigmoid,8,,28.0,31.0,,,,,,,,,,,,,COMPLETE
6512,0.47651502103683296,2024-04-11 17:51:33.356069,2024-04-11 17:51:36.037882,0 days 00:00:02.681813,60.85330097283678,8.330414049339518,sigmoid,59,34.0,25.0,29.0,1.0,5.0,43.0,,,5.424284072947238,4.254453044031113,7.5418987198329805,6.0,27.0,75.0,35.0,COMPLETE
6513,0.4968576175684461,2024-04-11 17:51:36.040878,2024-04-11 17:51:38.242482,0 days 00:00:02.201604,98.16927937726605,7.8964253449484945,sigmoid,60,18.0,24.0,32.0,5.0,6.0,11.0,40.0,6.0,,,,,,,,COMPLETE
