number,value,datetime_start,datetime_complete,duration,params_C,params_gamma,params_kernel,params_mask_number,params_rsi_window,params_so_smooth,params_so_window,params_srsi_smooth1,params_srsi_smooth2,params_srsi_window,params_tsi_window_fast,params_tsi_window_slow,params_ult_weight_1,params_ult_weight_2,params_ult_weight_3,params_ult_window_1,params_ult_window_2,params_ult_window_3,params_williams_lbp,state
8469,0.437277284532222,2024-04-11 18:54:11.739525,2024-04-11 18:54:14.050847,0 days 00:00:02.311322,93.71009498961261,8.414738533135749,sigmoid,61,18.0,25.0,33.0,2.0,4.0,39.0,46.0,7.0,,,,,,,174.0,COMPLETE
8470,0.6009432182607054,2024-04-11 18:54:14.053410,2024-04-11 18:54:15.737795,0 days 00:00:01.684385,98.18292327204755,7.943046855409718,sigmoid,8,,27.0,31.0,,,,,,,,,,,,,COMPLETE
8471,0.5952371952371952,2024-04-11 18:54:15.741866,2024-04-11 18:54:17.313442,0 days 00:00:01.571576,96.7705808945353,7.800913352352782,sigmoid,8,,24.0,32.0,,,,,,,,,,,,,COMPLETE
8472,0.19783300860143516,2024-04-11 18:54:17.316439,2024-04-11 18:54:19.234046,0 days 00:00:01.917607,99.97149116414724,8.191385398357069,sigmoid,34,43.0,,,,,,,,4.718151611735932,6.96723602681928,6.222115396228201,11.0,36.0,86.0,,COMPLETE
8473,0.4315583542214342,2024-04-11 18:54:19.237024,2024-04-11 18:54:21.780161,0 days 00:00:02.543137,96.7035710568181,8.011161830339965,sigmoid,27,,25.0,30.0,7.0,2.0,34.0,,,9.092554918929828,2.123215296951998,4.256950978078382,20.0,29.0,95.0,167.0,COMPLETE
8474,0.4089715899651105,2024-04-11 18:54:21.783790,2024-04-11 18:54:24.118853,0 days 00:00:02.335063,92.5678839575295,7.283239201243529,sigmoid,51,24.0,,,5.0,8.0,46.0,,,8.699145249187858,5.245231419599989,3.6424044297162155,2.0,35.0,65.0,151.0,COMPLETE
8475,0.5963643249384587,2024-04-11 18:54:24.122455,2024-04-11 18:54:25.762059,0 days 00:00:01.639604,99.97834545761586,8.450389328962544,sigmoid,8,,27.0,32.0,,,,,,,,,,,,,COMPLETE
8476,0.3194079302769474,2024-04-11 18:54:25.765042,2024-04-11 18:54:28.476753,0 days 00:00:02.711711,95.22182348690292,7.556172461312409,sigmoid,30,,26.0,29.0,3.0,3.0,9.0,28.0,20.0,1.2190080637906613,0.9706996515506994,3.074202909734783,13.0,39.0,52.0,,COMPLETE
8477,0.18532739466543796,2024-04-11 18:54:28.479752,2024-04-11 18:54:30.537056,0 days 00:00:02.057304,99.99178000548488,8.247045946872312,rbf,45,9.0,28.0,31.0,,,,2.0,14.0,,,,,,,200.0,COMPLETE
8478,0.30283615588655377,2024-04-11 18:54:30.540055,2024-04-11 18:54:32.123881,0 days 00:00:01.583826,99.97535396900004,7.769673960427829,sigmoid,5,,,,,,,24.0,43.0,,,,,,,17.0,COMPLETE
8479,0.5929369437606513,2024-04-11 18:54:32.126880,2024-04-11 18:54:33.656992,0 days 00:00:01.530112,52.01426451389681,8.643688989835645,sigmoid,8,,23.0,33.0,,,,,,,,,,,,,COMPLETE
8480,0.6009432182607054,2024-04-11 18:54:33.659992,2024-04-11 18:54:35.128211,0 days 00:00:01.468219,96.7124830779112,8.032422116829379,sigmoid,8,,25.0,31.0,,,,,,,,,,,,,COMPLETE
8481,0.25520187994018373,2024-04-11 18:54:35.132424,2024-04-11 18:54:37.226260,0 days 00:00:02.093836,98.1689472709592,8.331836898714563,sigmoid,18,,,,4.0,1.0,28.0,,,4.454884895287458,3.188760377259916,3.28053345770185,4.0,20.0,60.0,,COMPLETE
8482,0.36711131913565803,2024-04-11 18:54:37.229260,2024-04-11 18:54:38.695982,0 days 00:00:01.466722,99.9766606183263,7.899246400795641,sigmoid,33,17.0,,,,,,,,,,,,,,131.0,COMPLETE
8483,0.5906279643331437,2024-04-11 18:54:38.698980,2024-04-11 18:54:40.157457,0 days 00:00:01.458477,90.96711544923625,8.854502907901443,sigmoid,8,,26.0,34.0,,,,,,,,,,,,,COMPLETE
8484,0.47180746064685936,2024-04-11 18:54:40.160440,2024-04-11 18:54:41.739628,0 days 00:00:01.579188,93.97963590164028,8.159917941847931,sigmoid,17,,,,1.0,6.0,87.0,,,,,,,,,81.0,COMPLETE
8485,0.16591008293321693,2024-04-11 18:54:41.743224,2024-04-11 18:54:43.226850,0 days 00:00:01.483626,96.79452550744874,7.4794808817327585,sigmoid,4,,,,,,,31.0,12.0,,,,,,,,COMPLETE
8486,0.5418147801683816,2024-04-11 18:54:43.229880,2024-04-11 18:54:45.168399,0 days 00:00:01.938519,99.9677583558108,7.720317276347959,sigmoid,6,,,,,,,47.0,17.0,6.801907366355951,0.6430942068014911,2.3974391876388936,3.0,41.0,56.0,,COMPLETE
8487,0.42510715753625744,2024-04-11 18:54:45.171941,2024-04-11 18:54:47.272477,0 days 00:00:02.100536,99.99738806029653,8.505210013034684,sigmoid,53,47.0,,,8.0,5.0,5.0,4.0,2.0,,,,,,,90.0,COMPLETE
8488,0.45467964986792353,2024-04-11 18:54:47.277485,2024-04-11 18:54:49.554241,0 days 00:00:02.276756,95.14563642275952,6.943050590433213,sigmoid,19,,,,5.0,3.0,84.0,,,2.326085669583567,3.857163379512511,5.154995400723513,6.0,25.0,66.0,189.0,COMPLETE
8489,0.49496687804993045,2024-04-11 18:54:49.557213,2024-04-11 18:54:51.916800,0 days 00:00:02.359587,98.07547608531937,8.082604238441766,sigmoid,29,,24.0,29.0,3.0,4.0,50.0,22.0,41.0,,,,,,,122.0,COMPLETE
8490,0.5952371952371952,2024-04-11 18:54:51.919798,2024-04-11 18:54:53.486908,0 days 00:00:01.567110,24.90058285532113,7.920094660487395,sigmoid,8,,20.0,32.0,,,,,,,,,,,,,COMPLETE
8491,0.46394313347250477,2024-04-11 18:54:53.489898,2024-04-11 18:54:55.728659,0 days 00:00:02.238761,96.59945259666524,8.297985884320834,sigmoid,50,31.0,,,2.0,7.0,42.0,,,7.990282538703208,5.468900604948493,0.504218523311943,17.0,31.0,75.0,,COMPLETE
8492,0.44701971028259324,2024-04-11 18:54:55.732277,2024-04-11 18:54:57.230872,0 days 00:00:01.498595,98.0659938568448,7.6823754326560225,sigmoid,8,,30.0,30.0,,,,,,,,,,,,,COMPLETE
8493,0.4156840778602437,2024-04-11 18:54:57.234459,2024-04-11 18:54:59.113327,0 days 00:00:01.878868,65.66151583599652,8.112531793074263,sigmoid,25,,25.0,33.0,6.0,8.0,32.0,,,,,,,,,57.0,COMPLETE
8494,0.46131864171150533,2024-04-11 18:54:59.116328,2024-04-11 18:55:01.655353,0 days 00:00:02.539025,95.34720754997146,7.867880295156755,sigmoid,47,21.0,22.0,28.0,,,,39.0,9.0,1.7659446829652663,7.2155573212419775,9.783848502455943,15.0,37.0,70.0,73.0,COMPLETE
8495,0.4817279148326339,2024-04-11 18:55:01.658354,2024-04-11 18:55:04.372571,0 days 00:00:02.714217,98.26343775251215,8.427402700292278,sigmoid,58,37.0,27.0,31.0,7.0,5.0,71.0,,,6.508181008801247,2.7214816100468275,3.835558605943072,9.0,38.0,59.0,,COMPLETE
8496,0.481063122923588,2024-04-11 18:55:04.375589,2024-04-11 18:55:06.518554,0 days 00:00:02.142965,98.17713246759924,8.188356740398648,rbf,8,,26.0,30.0,,,,,,,,,,,,,COMPLETE
8497,0.4138555647939185,2024-04-11 18:55:06.522096,2024-04-11 18:55:08.487637,0 days 00:00:01.965541,93.15030573931507,7.384391638905448,sigmoid,49,8.0,,,4.0,1.0,78.0,,,,,,,,,38.0,COMPLETE
8498,0.5275348979904895,2024-04-11 18:55:08.490636,2024-04-11 18:55:10.511175,0 days 00:00:02.020539,99.98010540805417,7.978439694644654,sigmoid,35,34.0,,,,,,,,5.10571194925624,1.9891289445623337,4.86600032239532,8.0,26.0,94.0,178.0,COMPLETE
8499,0.4603545020714248,2024-04-11 18:55:10.513746,2024-04-11 18:55:12.772657,0 days 00:00:02.258911,96.89600713455926,6.451529573617792,sigmoid,22,,,,1.0,2.0,58.0,7.0,46.0,1.501827204103304,2.939925847166085,2.7041302150723916,12.0,47.0,98.0,,COMPLETE
8500,0.39557755351288804,2024-04-11 18:55:12.775575,2024-04-11 18:55:15.092761,0 days 00:00:02.317186,95.30532554658195,7.6615623210944355,sigmoid,43,26.0,23.0,32.0,,,,,,7.484315676939357,3.4788772142480484,1.3685716649987216,18.0,28.0,67.0,163.0,COMPLETE
8501,0.5963245096172158,2024-04-11 18:55:15.096314,2024-04-11 18:55:16.633818,0 days 00:00:01.537504,98.14584560461992,8.636155793722558,sigmoid,8,,24.0,31.0,,,,,,,,,,,,,COMPLETE
8502,0.4797736173464514,2024-04-11 18:55:16.636825,2024-04-11 18:55:18.983786,0 days 00:00:02.346961,98.25638070949174,8.311889024058097,sigmoid,39,13.0,,,,,,10.0,23.0,5.838817432847161,8.549045885521119,7.9359554706291,19.0,23.0,71.0,146.0,COMPLETE
8503,0.49245846210740424,2024-04-11 18:55:18.986757,2024-04-11 18:55:21.010760,0 days 00:00:02.024003,96.67522151287508,8.045008747732881,sigmoid,24,,29.0,30.0,6.0,6.0,68.0,,,,,,,,,,COMPLETE
8504,0.47322595762523745,2024-04-11 18:55:21.014286,2024-04-11 18:55:23.978839,0 days 00:00:02.964553,93.80310324443595,7.831625404929499,sigmoid,31,,25.0,32.0,8.0,4.0,13.0,18.0,32.0,3.5879153222686577,5.0860031044866165,8.966546875528971,16.0,49.0,83.0,48.0,COMPLETE
8505,0.5622601668933872,2024-04-11 18:55:23.982830,2024-04-11 18:55:25.371024,0 days 00:00:01.388194,96.6605824433408,8.44970178699967,sigmoid,0,,,,,,,,,,,,,,,,COMPLETE
8506,0.5069140556625241,2024-04-11 18:55:25.375586,2024-04-11 18:55:26.989784,0 days 00:00:01.614198,98.07781151864675,8.174915825601703,sigmoid,8,,28.0,35.0,,,,,,,,,,,,,COMPLETE
8507,0.12622036262203626,2024-04-11 18:55:26.992785,2024-04-11 18:55:28.701225,0 days 00:00:01.708440,95.52538303488772,7.949747995623539,sigmoid,8,,21.0,29.0,,,,,,,,,,,,,COMPLETE
8508,0.3006871554783659,2024-04-11 18:55:28.704798,2024-04-11 18:55:30.868723,0 days 00:00:02.163925,96.6641710790365,7.5420966520460535,sigmoid,38,49.0,,,,,,34.0,26.0,9.547212140137667,6.133899953341933,5.801517167159539,5.0,33.0,51.0,,COMPLETE
8509,0.4037521091314668,2024-04-11 18:55:30.871713,2024-04-11 18:55:33.011334,0 days 00:00:02.139621,91.53939085008199,8.310323679598818,sigmoid,28,,26.0,31.0,2.0,7.0,19.0,16.0,39.0,,,,,,,,COMPLETE
8510,0.4593788429838562,2024-04-11 18:55:33.013886,2024-04-11 18:55:35.001990,0 days 00:00:01.988104,98.22348880404878,7.740546940552607,sigmoid,21,,,,7.0,3.0,64.0,30.0,6.0,,,,,,,85.0,COMPLETE
8511,0.4210735360871538,2024-04-11 18:55:35.006586,2024-04-11 18:55:36.992042,0 days 00:00:01.985456,99.95347364638954,8.098206189709856,sigmoid,57,41.0,27.0,33.0,5.0,8.0,25.0,,,,,,,,,22.0,COMPLETE
8512,0.35574706126922934,2024-04-11 18:55:36.994639,2024-04-11 18:55:39.092346,0 days 00:00:02.097707,15.322207503581872,8.686506836544028,sigmoid,3,,,,,,,,,2.0527957994653234,5.74555385865733,7.4310080594397245,10.0,43.0,73.0,136.0,COMPLETE
8513,0.4870852254979697,2024-04-11 18:55:39.096907,2024-04-11 18:55:41.679724,0 days 00:00:02.582817,94.98309255391209,7.8827888134646384,sigmoid,15,,24.0,30.0,,,,21.0,35.0,2.7036734363439985,4.356646466157789,8.410731940138561,7.0,44.0,54.0,127.0,COMPLETE
8514,0.476743489973062,2024-04-11 18:55:41.681725,2024-04-11 18:55:43.879663,0 days 00:00:02.197938,98.07662512889914,8.45815333424423,rbf,8,,25.0,31.0,,,,,,,,,,,,,COMPLETE
8515,0.594268224819143,2024-04-11 18:55:43.881662,2024-04-11 18:55:45.435222,0 days 00:00:01.553560,93.86095065825296,8.238841245904426,sigmoid,8,,26.0,27.0,,,,,,,,,,,,,COMPLETE
8516,0.3854839254927149,2024-04-11 18:55:45.438219,2024-04-11 18:55:48.114756,0 days 00:00:02.676537,98.21923036148331,8.05061677212256,sigmoid,46,39.0,24.0,32.0,,,,35.0,29.0,3.985385885006084,8.096831971429829,6.067491929794797,14.0,35.0,91.0,,COMPLETE
8517,0.34385804931798314,2024-04-11 18:55:48.118763,2024-04-11 18:55:49.909675,0 days 00:00:01.790912,98.21788518782174,5.595904998741007,sigmoid,9,,27.0,29.0,,,,,,,,,,,,109.0,COMPLETE
8518,0.5147575460650526,2024-04-11 18:55:49.912657,2024-04-11 18:55:52.179004,0 days 00:00:02.266347,95.14022862337201,7.707242703385349,sigmoid,42,50.0,23.0,33.0,,,,,,9.828382004530331,9.285467387681841,6.668347784509377,20.0,22.0,77.0,,COMPLETE
8519,0.4502698896972542,2024-04-11 18:55:52.182004,2024-04-11 18:55:53.835554,0 days 00:00:01.653550,96.71386560724514,7.385497771623242,sigmoid,8,,28.0,30.0,,,,,,,,,,,,,COMPLETE
8520,0.4656946826758147,2024-04-11 18:55:53.839553,2024-04-11 18:55:55.304061,0 days 00:00:01.464508,98.15214534041213,7.948953582752287,sigmoid,16,,,,3.0,5.0,96.0,,,,,,,,,,COMPLETE
8521,0.5986580986580987,2024-04-11 18:55:55.307976,2024-04-11 18:55:56.971927,0 days 00:00:01.663951,98.26286075891991,8.2488363386783,sigmoid,8,,25.0,31.0,,,,,,,,,,,,,COMPLETE
8522,0.4594515984029192,2024-04-11 18:55:56.974484,2024-04-11 18:55:59.930099,0 days 00:00:02.955615,95.19837976162283,8.503215767716473,sigmoid,63,11.0,22.0,34.0,4.0,6.0,54.0,26.0,18.0,0.9209215040292422,1.621418499437433,2.8784580408544214,8.0,46.0,81.0,42.0,COMPLETE
8523,0.5952371952371952,2024-04-11 18:55:59.934099,2024-04-11 18:56:01.407602,0 days 00:00:01.473503,96.66197339964214,8.088356944071226,sigmoid,8,,26.0,32.0,,,,,,,,,,,,,COMPLETE
8524,0.5562782864961584,2024-04-11 18:56:01.410603,2024-04-11 18:56:03.147242,0 days 00:00:01.736639,98.34826375592012,7.781946471771656,sigmoid,2,,,,,,,,,8.38045291145053,9.079824743985412,7.125697658049868,4.0,32.0,61.0,,COMPLETE
8525,0.27249565720903296,2024-04-11 18:56:03.149226,2024-04-11 18:56:05.326718,0 days 00:00:02.177492,98.1583442279356,7.597591479861094,sigmoid,10,,25.0,28.0,,,,,,2.5212615876757973,6.712497764556887,4.4374351999012775,11.0,40.0,63.0,,COMPLETE
8526,0.5986044733320588,2024-04-11 18:56:05.329699,2024-04-11 18:56:06.916004,0 days 00:00:01.586305,99.95050385032125,8.846527246976379,sigmoid,8,,24.0,31.0,,,,,,,,,,,,,COMPLETE
8527,0.5975287681569516,2024-04-11 18:56:06.918970,2024-04-11 18:56:08.475510,0 days 00:00:01.556540,78.15769660056279,9.80283373300471,sigmoid,8,,23.0,30.0,,,,,,,,,,,,,COMPLETE
8528,0.5313474273490659,2024-04-11 18:56:08.478508,2024-04-11 18:56:10.673264,0 days 00:00:02.194756,92.36675143894746,8.341508511769984,sigmoid,11,,28.0,33.0,,,,,,5.3270013885782745,7.377118296656163,2.00668019375918,3.0,50.0,78.0,70.0,COMPLETE
8529,0.2963597593481075,2024-04-11 18:56:10.678833,2024-04-11 18:56:13.084570,0 days 00:00:02.405737,96.62913279701012,8.130683729531867,sigmoid,14,,26.0,29.0,,,,8.0,10.0,0.5033338784681005,4.035819269255482,4.019049259010551,16.0,42.0,89.0,,COMPLETE
8530,0.4220264050387596,2024-04-11 18:56:13.088529,2024-04-11 18:56:16.062574,0 days 00:00:02.974045,95.29550025210953,5.316878736086224,sigmoid,62,19.0,30.0,32.0,1.0,1.0,11.0,5.0,49.0,4.611602502881777,8.768724167805681,8.735844790709002,15.0,24.0,69.0,,COMPLETE
8531,0.5964036904537752,2024-04-11 18:56:16.066165,2024-04-11 18:56:17.680201,0 days 00:00:01.614036,93.82554389240295,7.188768818341073,sigmoid,8,,27.0,31.0,,,,,,,,,,,,,COMPLETE
8532,0.5376158177062552,2024-04-11 18:56:17.683201,2024-04-11 18:56:19.429889,0 days 00:00:01.746688,89.4871289965166,7.944065341764488,sigmoid,37,44.0,,,,,,14.0,33.0,,,,,,,193.0,COMPLETE
8533,0.48398663020358546,2024-04-11 18:56:19.434465,2024-04-11 18:56:21.555755,0 days 00:00:02.121290,98.14024128995813,8.586965684954242,rbf,8,,25.0,30.0,,,,,,,,,,,,,COMPLETE
8534,0.4555172145396051,2024-04-11 18:56:21.559750,2024-04-11 18:56:23.641128,0 days 00:00:02.081378,96.53313297697694,7.808111863773081,sigmoid,56,27.0,24.0,34.0,6.0,2.0,37.0,,,,,,,,,,COMPLETE
8535,0.48300266852303053,2024-04-11 18:56:23.643109,2024-04-11 18:56:25.591976,0 days 00:00:01.948867,98.30855538866115,8.26745244004214,sigmoid,52,10.0,,,2.0,4.0,76.0,49.0,21.0,,,,,,,,COMPLETE
8536,0.3844425290894539,2024-04-11 18:56:25.596563,2024-04-11 18:56:28.076139,0 days 00:00:02.479576,96.62504969635103,8.000705388356794,sigmoid,26,,26.0,32.0,8.0,8.0,29.0,,,6.302183710486993,6.309209710746353,7.685089888405393,9.0,20.0,58.0,,COMPLETE
8537,0.3491410685689329,2024-04-11 18:56:28.079138,2024-04-11 18:56:29.989844,0 days 00:00:01.910706,98.26309084226942,7.583914929994597,sigmoid,41,33.0,25.0,31.0,,,,,,,,,,,,155.0,COMPLETE
8538,0.4307728922472779,2024-04-11 18:56:29.992838,2024-04-11 18:56:32.698076,0 days 00:00:02.705238,93.57536787633202,8.402222337546872,sigmoid,59,36.0,14.0,30.0,5.0,3.0,48.0,,,6.929025063928103,3.6373651268031044,0.8651250022411299,17.0,36.0,57.0,172.0,COMPLETE
8539,0.5963643249384587,2024-04-11 18:56:32.700074,2024-04-11 18:56:34.311031,0 days 00:00:01.610957,98.19665359595629,8.147206279819349,sigmoid,8,,27.0,32.0,,,,,,,,,,,,,COMPLETE
8540,0.6009432182607054,2024-04-11 18:56:34.314016,2024-04-11 18:56:35.915096,0 days 00:00:01.601080,95.44457782863279,7.859107272188748,sigmoid,8,,23.0,31.0,,,,,,,,,,,,,COMPLETE
8541,0.25258845772935984,2024-04-11 18:56:35.918053,2024-04-11 18:56:37.708703,0 days 00:00:01.790650,98.14578695926055,8.244148915982668,sigmoid,20,,,,3.0,7.0,92.0,29.0,37.0,,,,,,,,COMPLETE
8542,0.4077706918064606,2024-04-11 18:56:37.712718,2024-04-11 18:56:40.373568,0 days 00:00:02.660850,96.5689590163628,8.032570476253635,sigmoid,55,29.0,,,7.0,6.0,2.0,37.0,44.0,3.1288215774975017,2.419239949089199,9.617533043090756,7.0,27.0,84.0,64.0,COMPLETE
8543,0.5024373730534869,2024-04-11 18:56:40.377144,2024-04-11 18:56:42.311802,0 days 00:00:01.934658,98.17655090096962,7.4864895728141585,sigmoid,44,31.0,26.0,29.0,,,,32.0,8.0,,,,,,,,COMPLETE
8544,0.37302348719042033,2024-04-11 18:56:42.315438,2024-04-11 18:56:44.098160,0 days 00:00:01.782722,94.88205000311586,8.489997008202515,sigmoid,13,,24.0,28.0,,,,43.0,22.0,,,,,,,78.0,COMPLETE
8545,0.44152324163165746,2024-04-11 18:56:44.103159,2024-04-11 18:56:46.503929,0 days 00:00:02.400770,98.16976314446823,7.756084204983577,sigmoid,23,,,,4.0,5.0,80.0,40.0,3.0,7.779643213985765,4.843833663754415,9.209630086380187,10.0,28.0,97.0,26.0,COMPLETE
8546,0.422568093385214,2024-04-11 18:56:46.507510,2024-04-11 18:56:48.693353,0 days 00:00:02.185843,92.06907248985034,8.131767566488044,sigmoid,60,20.0,25.0,33.0,1.0,4.0,15.0,11.0,13.0,,,,,,,,COMPLETE
8547,0.3404687558782589,2024-04-11 18:56:48.697888,2024-04-11 18:56:50.472250,0 days 00:00:01.774362,99.96687817315335,4.260574116962418,sigmoid,12,,22.0,30.0,,,,50.0,48.0,,,,,,,,COMPLETE
8548,0.5952371952371952,2024-04-11 18:56:50.476859,2024-04-11 18:56:52.049543,0 days 00:00:01.572684,99.93744073072277,8.653944362234533,sigmoid,8,,29.0,32.0,,,,,,,,,,,,,COMPLETE
8549,0.47330091155697845,2024-04-11 18:56:52.052543,2024-04-11 18:56:53.699391,0 days 00:00:01.646848,96.52143208381324,9.265074400050093,sigmoid,48,14.0,,,2.0,1.0,63.0,,,,,,,,,,COMPLETE
8550,0.41381654153922204,2024-04-11 18:56:53.703391,2024-04-11 18:56:56.075885,0 days 00:00:02.372494,99.95123296932921,7.897818989930447,sigmoid,54,40.0,,,8.0,2.0,21.0,6.0,38.0,4.920214483106847,1.7859464228036455,5.374660661775709,12.0,25.0,55.0,,COMPLETE
8551,0.4485644814364538,2024-04-11 18:56:56.080935,2024-04-11 18:56:57.456334,0 days 00:00:01.375399,95.28059124622813,8.328395809330603,sigmoid,1,,,,,,,,,,,,,,,10.0,COMPLETE
8552,0.33482746353610815,2024-04-11 18:56:57.459448,2024-04-11 18:56:59.437647,0 days 00:00:01.978199,99.97699348229524,7.621178321626538,rbf,40,32.0,27.0,31.0,,,,,,,,,,,,,COMPLETE
8553,0.37495172220076545,2024-04-11 18:56:59.440627,2024-04-11 18:57:01.543469,0 days 00:00:02.102842,96.50477816985111,8.026685260981901,sigmoid,7,,,,,,,19.0,25.0,4.262129038769442,0.7779073212687866,6.346294632039516,13.0,30.0,72.0,94.0,COMPLETE
8554,0.12622036262203626,2024-04-11 18:57:01.547067,2024-04-11 18:57:03.041849,0 days 00:00:01.494782,94.05865228989143,8.232050205399828,sigmoid,8,,24.0,29.0,,,,,,,,,,,,,COMPLETE
8555,0.42167199307069675,2024-04-11 18:57:03.044850,2024-04-11 18:57:05.289697,0 days 00:00:02.244847,98.21086141072682,7.898160262280322,sigmoid,61,4.0,26.0,30.0,6.0,3.0,40.0,12.0,30.0,,,,,,,100.0,COMPLETE
8556,0.5906279643331437,2024-04-11 18:57:05.292721,2024-04-11 18:57:06.849811,0 days 00:00:01.557090,99.9501873744936,8.417662215074737,sigmoid,8,,23.0,34.0,,,,,,,,,,,,,COMPLETE
8557,0.5900242633031432,2024-04-11 18:57:06.852825,2024-04-11 18:57:08.221987,0 days 00:00:01.369162,96.64382203640102,7.34872666281782,sigmoid,32,22.0,,,,,,,,,,,,,,,COMPLETE
8558,0.49733969475182976,2024-04-11 18:57:08.224974,2024-04-11 18:57:10.799459,0 days 00:00:02.574485,99.94380675783955,7.704900331952629,sigmoid,30,,25.0,13.0,5.0,7.0,100.0,33.0,27.0,8.082324400186488,7.6096858940763905,1.1601963030820386,3.0,31.0,80.0,,COMPLETE
8559,0.2674108425329339,2024-04-11 18:57:10.802071,2024-04-11 18:57:12.660104,0 days 00:00:01.858033,98.06941011433533,8.11599153754755,sigmoid,34,46.0,,,,,,,,9.067913568400531,1.3130938279834283,2.275495603451731,6.0,48.0,53.0,,COMPLETE
8560,0.5683976715686275,2024-04-11 18:57:12.663096,2024-04-11 18:57:14.461305,0 days 00:00:01.798209,94.07091276157942,8.722539537351084,sigmoid,36,2.0,,,,,,44.0,24.0,,,,,,,,COMPLETE
8561,0.5952371952371952,2024-04-11 18:57:14.464305,2024-04-11 18:57:16.100735,0 days 00:00:01.636430,99.97649121501175,7.891141986854917,sigmoid,8,,27.0,32.0,,,,,,,,,,,,,COMPLETE
8562,0.5929369437606513,2024-04-11 18:57:16.102756,2024-04-11 18:57:17.746986,0 days 00:00:01.644230,96.69537883748572,8.314124223164647,sigmoid,8,,28.0,33.0,,,,,,,,,,,,,COMPLETE
8563,0.45477386934673364,2024-04-11 18:57:17.751000,2024-04-11 18:57:20.368443,0 days 00:00:02.617443,7.224877128132839,8.107762837838553,sigmoid,27,,24.0,31.0,3.0,6.0,50.0,,,5.615647685852556,5.975939265617277,1.707887471803971,13.0,41.0,90.0,104.0,COMPLETE
8564,0.40239254710988775,2024-04-11 18:57:20.371452,2024-04-11 18:57:21.904232,0 days 00:00:01.532780,98.26490945581902,8.970011750877422,sigmoid,33,24.0,,,,,,,,,,,,,,114.0,COMPLETE
8565,0.4558602066780911,2024-04-11 18:57:21.907834,2024-04-11 18:57:24.247854,0 days 00:00:02.340020,95.29171907083231,8.508321627652835,sigmoid,51,48.0,,,4.0,2.0,89.0,,,7.232601340966404,0.5056200028757427,8.514870674643374,20.0,34.0,68.0,15.0,COMPLETE
8566,0.3138048110958607,2024-04-11 18:57:24.250857,2024-04-11 18:57:26.084675,0 days 00:00:01.833818,99.97417719680901,7.75850026446851,sigmoid,5,,,,,,,17.0,19.0,,,,,,,60.0,COMPLETE
8567,0.5034063943252278,2024-04-11 18:57:26.090252,2024-04-11 18:57:27.791816,0 days 00:00:01.701564,96.67759805975336,7.98741004569508,sigmoid,8,,19.0,36.0,,,,,,,,,,,,,COMPLETE
8568,0.4988651102464331,2024-04-11 18:57:27.794824,2024-04-11 18:57:29.751220,0 days 00:00:01.956396,92.26611989353736,7.521376583162106,sigmoid,45,38.0,26.0,30.0,,,,9.0,36.0,,,,,,,149.0,COMPLETE
8569,0.5986580986580987,2024-04-11 18:57:29.754191,2024-04-11 18:57:31.303133,0 days 00:00:01.548942,99.97439128382499,8.24254806128585,sigmoid,8,,25.0,31.0,,,,,,,,,,,,,COMPLETE
8570,0.1265393923097607,2024-04-11 18:57:31.307702,2024-04-11 18:57:33.574695,0 days 00:00:02.266993,98.20788166317354,7.839964271997219,rbf,53,17.0,,,7.0,5.0,67.0,41.0,15.0,,,,,,,158.0,COMPLETE
8571,0.12622036262203626,2024-04-11 18:57:33.578306,2024-04-11 18:57:35.239081,0 days 00:00:01.660775,99.94740205368494,8.071069065573916,sigmoid,8,,22.0,29.0,,,,,,,,,,,,,COMPLETE
