number,value,datetime_start,datetime_complete,duration,params_C,params_gamma,params_kernel,params_mask_number,params_rsi_window,params_so_smooth,params_so_window,params_srsi_smooth1,params_srsi_smooth2,params_srsi_window,params_tsi_window_fast,params_tsi_window_slow,params_ult_weight_1,params_ult_weight_2,params_ult_weight_3,params_ult_window_1,params_ult_window_2,params_ult_window_3,params_williams_lbp,state
937,0.42885976715614577,2024-04-11 16:09:26.141218,2024-04-11 16:09:26.749197,0 days 00:00:00.607979,88.99935967627694,1.2206173241822829,sigmoid,15,,22.0,17.0,,,,40.0,17.0,2.6908844063245327,9.336840266113443,6.307265713299916,18.0,36.0,57.0,17.0,COMPLETE
938,0.5070892613525629,2024-04-11 16:09:26.750346,2024-04-11 16:09:27.260167,0 days 00:00:00.509821,96.00180393692321,0.24854928761961292,sigmoid,28,,39.0,22.0,8.0,8.0,25.0,8.0,9.0,,,,,,,,COMPLETE
939,0.5852178809510835,2024-04-11 16:09:27.261168,2024-04-11 16:09:27.617047,0 days 00:00:00.355879,93.66451867822155,1.4247906457625492,sigmoid,0,,,,,,,,,,,,,,,,COMPLETE
940,0.26163420999799236,2024-04-11 16:09:27.618100,2024-04-11 16:09:28.197386,0 days 00:00:00.579286,90.92783921100948,1.0321580302058746,sigmoid,14,,19.0,11.0,,,,22.0,37.0,1.1636665540391973,8.104608202913198,4.259765833260726,7.0,35.0,64.0,,COMPLETE
941,0.5873898933704218,2024-04-11 16:09:28.198386,2024-04-11 16:09:28.568609,0 days 00:00:00.370223,86.8943659853215,0.7856714592325452,sigmoid,0,,,,,,,,,,,,,,,,COMPLETE
942,0.4873672555236801,2024-04-11 16:09:28.569627,2024-04-11 16:09:29.276459,0 days 00:00:00.706832,96.45785442789645,1.6902160910894461,sigmoid,63,16.0,21.0,26.0,3.0,2.0,67.0,35.0,13.0,0.9086998731378504,4.802461693561874,3.058033592537794,3.0,46.0,76.0,57.0,COMPLETE
943,0.4431929480901077,2024-04-11 16:09:29.277479,2024-04-11 16:09:29.803206,0 days 00:00:00.525727,93.7515749289887,0.498587423648713,sigmoid,57,11.0,10.0,39.0,2.0,6.0,87.0,,,,,,,,,79.0,COMPLETE
944,0.5170877305191345,2024-04-11 16:09:29.804206,2024-04-11 16:09:30.299124,0 days 00:00:00.494918,40.982075464678,1.1558207450024551,sigmoid,37,29.0,,,,,,33.0,30.0,,,,,,,41.0,COMPLETE
945,0.5882580084629866,2024-04-11 16:09:30.300125,2024-04-11 16:09:30.659967,0 days 00:00:00.359842,98.27504598624391,0.8978020181083042,sigmoid,0,,,,,,,,,,,,,,,,COMPLETE
946,0.385418228713673,2024-04-11 16:09:30.660967,2024-04-11 16:09:31.391825,0 days 00:00:00.730858,95.35185007314027,1.4489296761075452,sigmoid,62,40.0,26.0,20.0,4.0,5.0,19.0,29.0,50.0,4.917662623307118,9.63355364607825,2.6402278457311166,2.0,30.0,54.0,,COMPLETE
947,0.53022320355027,2024-04-11 16:09:31.392931,2024-04-11 16:09:32.009810,0 days 00:00:00.616879,99.95607316643834,1.097612597570539,sigmoid,46,46.0,7.0,3.0,,,,44.0,5.0,3.7338012777589453,1.997491481833534,2.3099494869863224,11.0,48.0,84.0,,COMPLETE
948,0.514182072461868,2024-04-11 16:09:32.010810,2024-04-11 16:09:32.632819,0 days 00:00:00.622009,89.7154416092311,0.6988686025429199,sigmoid,10,,17.0,42.0,,,,,,3.206828474174475,9.952958090885888,0.6786569112933107,10.0,42.0,94.0,,COMPLETE
949,0.5870813314138034,2024-04-11 16:09:32.633820,2024-04-11 16:09:32.988755,0 days 00:00:00.354935,92.4026087127192,1.248216530634048,sigmoid,0,,,,,,,,,,,,,,,,COMPLETE
950,0.19690178843392367,2024-04-11 16:09:32.989756,2024-04-11 16:09:33.545263,0 days 00:00:00.555507,97.00981066588922,0.943325235760546,sigmoid,18,,,,1.0,3.0,33.0,,,6.68729894425566,7.743751555068493,7.462547980048471,6.0,34.0,91.0,,COMPLETE
951,0.43555253902634666,2024-04-11 16:09:33.546288,2024-04-11 16:09:34.158202,0 days 00:00:00.611914,38.05407907796403,0.7763743675104398,sigmoid,26,,28.0,14.0,6.0,4.0,81.0,,,1.4683689675530853,8.281698491496575,5.15999189146093,9.0,22.0,71.0,,COMPLETE
952,0.5823323040111231,2024-04-11 16:09:34.159197,2024-04-11 16:09:34.674696,0 days 00:00:00.515499,35.55526892230213,0.5040710321918069,sigmoid,0,,,,,,,,,,,,,,,,COMPLETE
953,0.387727602529109,2024-04-11 16:09:34.675838,2024-04-11 16:09:35.318764,0 days 00:00:00.642926,94.35631292258903,1.451507124433187,sigmoid,11,,14.0,25.0,,,,,,9.744143841093441,5.669210515412049,8.572706352517063,14.0,43.0,85.0,86.0,COMPLETE
954,0.36378371369294604,2024-04-11 16:09:35.319891,2024-04-11 16:09:35.893766,0 days 00:00:00.573875,98.41558867242378,1.082342796206551,sigmoid,41,10.0,12.0,37.0,,,,,,,,,,,,50.0,COMPLETE
955,0.4071227741330834,2024-04-11 16:09:35.894791,2024-04-11 16:09:36.676319,0 days 00:00:00.781528,8.865803501191806,1.2146623400180785,rbf,20,,,,2.0,7.0,13.0,7.0,3.0,,,,,,,,COMPLETE
956,0.08623153882801333,2024-04-11 16:09:36.677319,2024-04-11 16:09:37.069237,0 days 00:00:00.391918,91.92975775745799,0.9224523077294065,sigmoid,1,,,,,,,,,,,,,,,23.0,COMPLETE
957,0.5246376811594203,2024-04-11 16:09:37.069237,2024-04-11 16:09:37.561847,0 days 00:00:00.492610,96.47260334748903,5.74081252619259,sigmoid,52,2.0,,,7.0,3.0,16.0,20.0,19.0,,,,,,,,COMPLETE
958,0.5814532152340631,2024-04-11 16:09:37.562848,2024-04-11 16:09:37.921123,0 days 00:00:00.358275,65.94167970014013,1.6568940202528684,sigmoid,0,,,,,,,,,,,,,,,,COMPLETE
959,0.4108906512574073,2024-04-11 16:09:37.922149,2024-04-11 16:09:38.715210,0 days 00:00:00.793061,93.94066014384373,3.3222152486552505,sigmoid,59,27.0,30.0,16.0,5.0,7.0,39.0,,,2.99706176128698,9.08642594241065,0.9345853008994869,8.0,40.0,96.0,106.0,COMPLETE
960,0.13026268441885572,2024-04-11 16:09:38.716209,2024-04-11 16:09:39.056934,0 days 00:00:00.340725,87.55890795992136,0.3088709332773818,sigmoid,0,,,,,,,,,,,,,,,,COMPLETE
961,0.5863711449328822,2024-04-11 16:09:39.057934,2024-04-11 16:09:39.493010,0 days 00:00:00.435076,83.3378788821257,0.6458432091230981,sigmoid,0,,,,,,,,,,,,,,,,COMPLETE
962,0.3615497682131685,2024-04-11 16:09:39.494011,2024-04-11 16:09:39.998431,0 days 00:00:00.504420,20.925686589897744,1.3406523232565997,sigmoid,56,48.0,4.0,9.0,3.0,5.0,90.0,,,,,,,,,,COMPLETE
963,0.5857799611637595,2024-04-11 16:09:39.999445,2024-04-11 16:09:40.354367,0 days 00:00:00.354922,89.96547648110655,1.0361644069156197,sigmoid,0,,,,,,,,,,,,,,,,COMPLETE
964,0.5226863189021854,2024-04-11 16:09:40.355368,2024-04-11 16:09:40.866780,0 days 00:00:00.511412,95.73479327645275,0.8268641956782017,sigmoid,13,,43.0,50.0,,,,17.0,42.0,,,,,,,37.0,COMPLETE
965,0.4762792836522494,2024-04-11 16:09:40.868803,2024-04-11 16:09:41.527741,0 days 00:00:00.658938,31.456431221095144,2.07944969949604,sigmoid,55,34.0,,,8.0,2.0,36.0,12.0,48.0,5.974498785010114,4.4374760807975,1.4300492718522924,2.0,20.0,78.0,61.0,COMPLETE
966,0.3227427459880045,2024-04-11 16:09:41.528740,2024-04-11 16:09:42.019822,0 days 00:00:00.491082,97.96274518132843,1.228077663836426,sigmoid,48,7.0,,,1.0,1.0,78.0,,,,,,,,,,COMPLETE
967,0.5346622598636646,2024-04-11 16:09:42.020823,2024-04-11 16:09:42.458329,0 days 00:00:00.437506,91.912173632262,0.6219374826208683,sigmoid,12,,36.0,34.0,,,,3.0,28.0,,,,,,,,COMPLETE
968,0.502470053335665,2024-04-11 16:09:42.459328,2024-04-11 16:09:43.001527,0 days 00:00:00.542199,1.8273972498512023,1.4522839531574148,sigmoid,44,39.0,25.0,48.0,,,,43.0,7.0,,,,,,,,COMPLETE
969,0.2686484881896442,2024-04-11 16:09:43.002528,2024-04-11 16:09:43.647773,0 days 00:00:00.645245,94.47104587449608,0.9985569245381772,sigmoid,54,49.0,,,3.0,6.0,30.0,25.0,39.0,8.124637896064907,6.034877065157323,3.8636805260159104,5.0,25.0,90.0,,COMPLETE
970,0.47480504614504093,2024-04-11 16:09:43.648770,2024-04-11 16:09:44.273963,0 days 00:00:00.625193,97.69983028547409,0.8050335701500391,sigmoid,60,5.0,3.0,19.0,4.0,5.0,98.0,50.0,44.0,,,,,,,,COMPLETE
971,0.5770173401883281,2024-04-11 16:09:44.275170,2024-04-11 16:09:44.752602,0 days 00:00:00.477432,44.33932031437984,1.1445707130523233,sigmoid,2,,,,,,,,,4.046162866838519,7.443026704736899,9.617010914902561,4.0,45.0,56.0,,COMPLETE
972,0.4484188843113239,2024-04-11 16:09:44.753743,2024-04-11 16:09:45.875274,0 days 00:00:01.121531,93.19430399262532,1.8235370040690244,rbf,7,,,,,,,23.0,40.0,6.283439281053561,3.223569488428396,3.2788764344208383,3.0,29.0,75.0,32.0,COMPLETE
973,0.08130263896687255,2024-04-11 16:09:45.876285,2024-04-11 16:09:46.260577,0 days 00:00:00.384292,95.88904238367222,0.4643357018540506,sigmoid,32,42.0,,,,,,,,,,,,,,,COMPLETE
974,0.5273914570891282,2024-04-11 16:09:46.261577,2024-04-11 16:09:46.703531,0 days 00:00:00.441954,99.91933979581454,1.3364546177495609,sigmoid,40,22.0,46.0,24.0,,,,,,,,,,,,,COMPLETE
975,0.5871571537475874,2024-04-11 16:09:46.704531,2024-04-11 16:09:47.062785,0 days 00:00:00.358254,90.60939364667253,0.9291338069797502,sigmoid,0,,,,,,,,,,,,,,,,COMPLETE
976,0.4791947649732754,2024-04-11 16:09:47.063785,2024-04-11 16:09:47.677788,0 days 00:00:00.614003,89.09119520961069,1.5835183130089578,sigmoid,23,,,,2.0,4.0,56.0,27.0,11.0,0.742699552167267,2.221847582028131,1.3143931281253487,10.0,27.0,73.0,15.0,COMPLETE
977,0.46737089201877946,2024-04-11 16:09:47.679767,2024-04-11 16:09:48.274541,0 days 00:00:00.594774,96.51852732410808,1.1068259378748642,sigmoid,61,8.0,20.0,13.0,6.0,8.0,52.0,11.0,14.0,,,,,,,26.0,COMPLETE
978,0.5298284643756219,2024-04-11 16:09:48.275672,2024-04-11 16:09:48.729086,0 days 00:00:00.453414,53.913557763313534,0.7008211159803227,sigmoid,36,44.0,,,,,,31.0,49.0,,,,,,,,COMPLETE
979,0.08623153882801333,2024-04-11 16:09:48.730085,2024-04-11 16:09:49.200538,0 days 00:00:00.470453,98.13043361308297,1.297208045478254,sigmoid,8,,38.0,21.0,,,,,,,,,,,,,COMPLETE
980,0.47214545830212556,2024-04-11 16:09:49.202535,2024-04-11 16:09:49.933205,0 days 00:00:00.730670,99.96983504870352,0.855835064655986,sigmoid,27,,40.0,35.0,4.0,7.0,62.0,,,7.895411748735635,8.83105088729757,6.120483753667808,13.0,39.0,82.0,67.0,COMPLETE
981,0.4321650891105995,2024-04-11 16:09:49.935349,2024-04-11 16:09:50.576594,0 days 00:00:00.641245,76.50969048697475,0.3530425175528731,sigmoid,30,,15.0,45.0,5.0,6.0,45.0,15.0,4.0,2.0863659082449946,8.610318026140726,5.624847737661608,7.0,50.0,99.0,,COMPLETE
982,0.5647883613964704,2024-04-11 16:09:50.577620,2024-04-11 16:09:50.943938,0 days 00:00:00.366318,92.62740781522676,8.914357946131851,sigmoid,0,,,,,,,,,,,,,,,,COMPLETE
983,0.5658094087413459,2024-04-11 16:09:50.944962,2024-04-11 16:09:51.454906,0 days 00:00:00.509944,86.22858605662393,1.0340456318369693,sigmoid,34,19.0,,,,,,,,9.329341397372719,7.048605402184803,4.420776391995064,2.0,44.0,86.0,,COMPLETE
984,0.5851186236370609,2024-04-11 16:09:51.456092,2024-04-11 16:09:51.844307,0 days 00:00:00.388215,94.52409982181338,1.4962633815630841,sigmoid,0,,,,,,,,,,,,,,,,COMPLETE
985,0.42572158661943205,2024-04-11 16:09:51.845308,2024-04-11 16:09:52.427890,0 days 00:00:00.582582,95.52559845290993,1.1863244465467102,sigmoid,53,15.0,,,7.0,4.0,60.0,39.0,18.0,,,,,,,91.0,COMPLETE
986,0.2550457955157694,2024-04-11 16:09:52.428891,2024-04-11 16:09:52.819355,0 days 00:00:00.390464,90.93935907049807,0.6437716465396908,sigmoid,1,,,,,,,,,,,,,,,45.0,COMPLETE
987,0.10418628990057563,2024-04-11 16:09:52.820425,2024-04-11 16:09:53.226389,0 days 00:00:00.405964,97.98803419975066,0.8720351932830347,sigmoid,4,,,,,,,4.0,22.0,,,,,,,,COMPLETE
988,0.2597973119916489,2024-04-11 16:09:53.228518,2024-04-11 16:09:53.655967,0 days 00:00:00.427449,93.75861057942447,1.3105504361466234,sigmoid,33,24.0,,,,,,,,,,,,,,19.0,COMPLETE
989,0.5896947521427498,2024-04-11 16:09:53.656967,2024-04-11 16:09:54.024436,0 days 00:00:00.367469,88.68013210015157,1.058958658467553,sigmoid,0,,,,,,,,,,,,,,,,COMPLETE
990,0.10504933255948928,2024-04-11 16:09:54.025437,2024-04-11 16:09:54.446847,0 days 00:00:00.421410,86.77699344580101,0.4964178273170422,sigmoid,0,,,,,,,,,,,,,,,,COMPLETE
991,0.5610057636385798,2024-04-11 16:09:54.447849,2024-04-11 16:09:54.896984,0 days 00:00:00.449135,84.6419696936172,0.7181418915671767,sigmoid,5,,,,,,,30.0,16.0,,,,,,,10.0,COMPLETE
992,0.3723370872703184,2024-04-11 16:09:54.897985,2024-04-11 16:09:55.388925,0 days 00:00:00.490940,87.45528520062689,9.995044462017347,sigmoid,45,36.0,33.0,23.0,,,,9.0,24.0,,,,,,,98.0,COMPLETE
993,0.44513091203550964,2024-04-11 16:09:55.389950,2024-04-11 16:09:56.665165,0 days 00:00:01.275215,85.61145579630484,0.9897395541311882,rbf,51,6.0,,,3.0,2.0,4.0,,,1.6750847193722214,5.041638781797162,5.8492686317903475,6.0,33.0,68.0,71.0,COMPLETE
994,0.589341292515921,2024-04-11 16:09:56.666166,2024-04-11 16:09:57.026717,0 days 00:00:00.360551,81.3202925946808,0.8488072514024405,sigmoid,0,,,,,,,,,,,,,,,,COMPLETE
995,0.44863056140785723,2024-04-11 16:09:57.028300,2024-04-11 16:09:57.570364,0 days 00:00:00.542064,88.87717210279578,1.0798289199574183,sigmoid,17,,,,2.0,6.0,71.0,,,,,,,,,109.0,COMPLETE
996,0.13026268441885572,2024-04-11 16:09:57.571521,2024-04-11 16:09:57.914686,0 days 00:00:00.343165,84.46228900932398,0.2652011446450858,sigmoid,0,,,,,,,,,,,,,,,,COMPLETE
997,0.438081949941627,2024-04-11 16:09:57.915692,2024-04-11 16:09:58.521389,0 days 00:00:00.605697,87.84775512880928,0.5942813388785935,sigmoid,19,,,,1.0,8.0,65.0,,,2.4621640899589443,0.5413801245999794,4.77447710228269,16.0,32.0,88.0,55.0,COMPLETE
998,0.0,2024-04-11 16:09:58.522415,2024-04-11 16:09:59.185394,0 days 00:00:00.662979,88.45005607498685,0.005566146035404618,sigmoid,49,26.0,,,4.0,1.0,42.0,,,,,,,,,131.0,COMPLETE
999,0.4594587933753943,2024-04-11 16:09:59.186467,2024-04-11 16:09:59.764222,0 days 00:00:00.577755,89.28275182318498,1.2096799073513829,sigmoid,18,,,,6.0,3.0,73.0,,,7.6481239496533036,7.257583351172574,3.5804426437543007,20.0,38.0,60.0,,COMPLETE
1000,0.4880673370126761,2024-04-11 16:09:59.765221,2024-04-11 16:10:00.430843,0 days 00:00:00.665622,90.9176248585506,0.8869207445349747,sigmoid,58,21.0,16.0,40.0,8.0,5.0,47.0,,,9.104580793195696,2.702666374905966,5.454692273008948,9.0,42.0,65.0,,COMPLETE
1001,0.5862828235037213,2024-04-11 16:10:00.432864,2024-04-11 16:10:00.799976,0 days 00:00:00.367112,90.37200131349891,1.457527580430946,sigmoid,0,,,,,,,,,,,,,,,,COMPLETE
1002,0.4885848927117171,2024-04-11 16:10:00.801957,2024-04-11 16:10:01.460942,0 days 00:00:00.658985,86.97387645809391,1.0317730599936854,sigmoid,50,4.0,,,7.0,4.0,84.0,,,5.495218579576244,7.904981346941312,2.4290760723900697,15.0,45.0,70.0,,COMPLETE
1003,0.4660903381769451,2024-04-11 16:10:01.461950,2024-04-11 16:10:02.034963,0 days 00:00:00.573013,91.7883140998355,0.753045206528713,sigmoid,29,,22.0,33.0,5.0,7.0,68.0,34.0,36.0,,,,,,,38.0,COMPLETE
1004,0.37782048308538485,2024-04-11 16:10:02.035986,2024-04-11 16:10:02.610832,0 days 00:00:00.574846,89.1949710067827,1.2569651818664183,sigmoid,43,37.0,18.0,32.0,,,,,,7.219402783590786,1.3512288464404887,7.158948929390558,12.0,43.0,92.0,83.0,COMPLETE
1005,0.47953948794527806,2024-04-11 16:10:02.612833,2024-04-11 16:10:03.360474,0 days 00:00:00.747641,92.52705761423539,1.5865027438176007,sigmoid,47,31.0,13.0,29.0,,,,24.0,27.0,2.819668177286843,6.72539982529492,2.847524058075155,4.0,47.0,80.0,125.0,COMPLETE
1006,0.10504933255948928,2024-04-11 16:10:03.361484,2024-04-11 16:10:03.825765,0 days 00:00:00.464281,90.20814030257895,0.49722338742980177,sigmoid,0,,,,,,,,,,,,,,,,COMPLETE
1007,0.4813706687124408,2024-04-11 16:10:03.826766,2024-04-11 16:10:04.578746,0 days 00:00:00.751980,85.06523597191412,1.02941381539683,sigmoid,39,41.0,,,,,,10.0,20.0,4.375442743988742,9.55111579139814,4.885542965819081,5.0,41.0,63.0,63.0,COMPLETE
1008,0.25810510422346183,2024-04-11 16:10:04.579747,2024-04-11 16:10:05.100165,0 days 00:00:00.520418,88.55446469194132,0.8551694437643365,sigmoid,6,,,,,,,46.0,25.0,8.379723826297688,6.421370452499052,2.1415413367307456,8.0,48.0,53.0,,COMPLETE
1009,0.18632233809246745,2024-04-11 16:10:05.101167,2024-04-11 16:10:05.596909,0 days 00:00:00.495742,50.52658232616015,1.7815245435119187,sigmoid,2,,,,,,,,,6.566593855985321,9.287158742166273,1.8794735101636433,7.0,35.0,72.0,,COMPLETE
1010,0.4478646013757609,2024-04-11 16:10:05.598081,2024-04-11 16:10:06.079157,0 days 00:00:00.481076,82.1827630090164,2.783596807268449,sigmoid,24,,5.0,27.0,1.0,6.0,94.0,,,,,,,,,,COMPLETE
1011,0.38038945259908713,2024-04-11 16:10:06.080156,2024-04-11 16:10:06.951101,0 days 00:00:00.870945,92.28527428293786,1.34602668968799,rbf,0,,,,,,,,,,,,,,,,COMPLETE
1012,0.45593259598123803,2024-04-11 16:10:06.952101,2024-04-11 16:10:07.595417,0 days 00:00:00.643316,98.3723162193503,0.6813546301715221,sigmoid,22,,,,3.0,2.0,58.0,42.0,6.0,3.4100801919774835,4.023169605883122,1.663677792066208,5.0,49.0,87.0,,COMPLETE
1013,0.4974007832001282,2024-04-11 16:10:07.596414,2024-04-11 16:10:08.185623,0 days 00:00:00.589209,86.55541436046866,1.1516547492072071,sigmoid,38,16.0,,,,,,37.0,2.0,5.140539576400012,5.421390623849239,6.518413037259526,11.0,44.0,51.0,,COMPLETE
1014,0.5880365043344815,2024-04-11 16:10:08.186776,2024-04-11 16:10:08.613318,0 days 00:00:00.426542,70.7934393066516,0.9712927061002214,sigmoid,0,,,,,,,,,,,,,,,,COMPLETE
1015,0.3533298295667843,2024-04-11 16:10:08.614550,2024-04-11 16:10:09.191636,0 days 00:00:00.577086,93.99626601470939,1.3836191422155386,sigmoid,35,12.0,,,,,,,,4.593343629223032,7.540324679919929,7.761132269616023,18.0,31.0,62.0,114.0,COMPLETE
1016,0.4555407344021343,2024-04-11 16:10:09.193828,2024-04-11 16:10:09.717443,0 days 00:00:00.523615,74.16206483882155,0.7635417796026169,sigmoid,21,,,,2.0,3.0,100.0,13.0,15.0,,,,,,,29.0,COMPLETE
1017,0.3162702037250308,2024-04-11 16:10:09.718444,2024-04-11 16:10:10.239375,0 days 00:00:00.520931,38.70172519821466,1.127050738847632,sigmoid,3,,,,,,,,,1.3483605821595166,2.417970891430496,3.0831900269226997,3.0,36.0,97.0,42.0,COMPLETE
1018,0.5498880716341542,2024-04-11 16:10:10.240376,2024-04-11 16:10:10.614836,0 days 00:00:00.374460,96.70596542933052,0.22773897675298427,sigmoid,1,,,,,,,,,,,,,,,59.0,COMPLETE
1019,0.46825870646766177,2024-04-11 16:10:10.615819,2024-04-11 16:10:11.323105,0 days 00:00:00.707286,99.89454411339372,0.6068318018237924,sigmoid,31,,11.0,46.0,5.0,5.0,24.0,18.0,29.0,3.7546025800310194,8.24740666328503,4.164581874670024,13.0,30.0,81.0,101.0,COMPLETE
1020,0.49069370087709313,2024-04-11 16:10:11.324105,2024-04-11 16:10:11.927469,0 days 00:00:00.603364,91.46535302702533,0.9695368462859257,sigmoid,25,,32.0,7.0,4.0,4.0,76.0,,,,,,,,,75.0,COMPLETE
1021,0.46472219369415624,2024-04-11 16:10:11.928468,2024-04-11 16:10:12.599375,0 days 00:00:00.670907,95.02559476646793,1.5790118992685114,sigmoid,57,35.0,2.0,2.0,1.0,7.0,8.0,,,,,,,,,48.0,COMPLETE
1022,0.5892718722546639,2024-04-11 16:10:12.601432,2024-04-11 16:10:13.053001,0 days 00:00:00.451569,96.82717608133568,1.2161500391289226,sigmoid,0,,,,,,,,,,,,,,,,COMPLETE
1023,0.3543752171029779,2024-04-11 16:10:13.055007,2024-04-11 16:10:13.549617,0 days 00:00:00.494610,93.02209043413465,7.706087303527857,sigmoid,28,,24.0,17.0,6.0,8.0,28.0,6.0,35.0,,,,,,,,COMPLETE
1024,0.5873898933704218,2024-04-11 16:10:13.550708,2024-04-11 16:10:13.917680,0 days 00:00:00.366972,90.12684443043513,0.8385266048403593,sigmoid,0,,,,,,,,,,,,,,,,COMPLETE
1025,0.4724306688417619,2024-04-11 16:10:13.918682,2024-04-11 16:10:14.444394,0 days 00:00:00.525712,34.04627695008509,0.38202152341247053,sigmoid,9,,29.0,28.0,,,,,,,,,,,,21.0,COMPLETE
1026,0.5842605449660073,2024-04-11 16:10:14.445390,2024-04-11 16:10:14.972535,0 days 00:00:00.527145,99.95635030552798,1.3976906961300766,sigmoid,0,,,,,,,,,,,,,,,,COMPLETE
1027,0.34543161912551545,2024-04-11 16:10:14.973552,2024-04-11 16:10:15.706382,0 days 00:00:00.732830,25.66429757305969,1.088351671364168,sigmoid,15,,8.0,5.0,,,,22.0,43.0,4.809176349059253,6.176742611504158,9.821779906133191,8.0,28.0,84.0,34.0,COMPLETE
1028,0.09530830393344215,2024-04-11 16:10:15.708547,2024-04-11 16:10:16.347316,0 days 00:00:00.638769,95.64754418606003,0.7357910234276326,sigmoid,8,,10.0,12.0,,,,,,,,,,,,,COMPLETE
1029,0.3258762689140011,2024-04-11 16:10:16.349314,2024-04-11 16:10:16.991258,0 days 00:00:00.641944,87.87257805228647,1.2755822815872244,sigmoid,42,50.0,27.0,9.0,,,,,,5.779654902774979,1.5365545442746775,3.4346941780025864,6.0,38.0,66.0,,COMPLETE
1030,0.412789636927568,2024-04-11 16:10:16.992259,2024-04-11 16:10:17.656912,0 days 00:00:00.664653,36.35747468906415,0.9677330714286058,sigmoid,46,13.0,47.0,43.0,,,,2.0,32.0,8.84535821363757,3.613561007183031,3.981195336529219,9.0,37.0,58.0,,COMPLETE
1031,0.4665781884076466,2024-04-11 16:10:17.659065,2024-04-11 16:10:18.487422,0 days 00:00:00.828357,98.22552415632744,0.5501898899785209,sigmoid,63,45.0,21.0,22.0,2.0,1.0,50.0,28.0,12.0,2.2606312762135783,8.478471977069631,1.186650580834805,14.0,34.0,77.0,52.0,COMPLETE
1032,0.41486369161312736,2024-04-11 16:10:18.488419,2024-04-11 16:10:19.343276,0 days 00:00:00.854857,41.065682344947135,1.640848445628294,rbf,16,,,,3.0,6.0,80.0,,,,,,,,,,COMPLETE
1033,0.5865019492683915,2024-04-11 16:10:19.344278,2024-04-11 16:10:19.732235,0 days 00:00:00.387957,93.65325194544315,1.1218761395536063,sigmoid,0,,,,,,,,,,,,,,,,COMPLETE
1034,0.3548633046509095,2024-04-11 16:10:19.733236,2024-04-11 16:10:20.388170,0 days 00:00:00.654934,90.69238747802046,1.956746027239177,sigmoid,14,,19.0,41.0,,,,36.0,45.0,2.630169734349867,9.885478418485667,2.701219507635135,3.0,26.0,83.0,,COMPLETE
1035,0.589341292515921,2024-04-11 16:10:20.389305,2024-04-11 16:10:20.757183,0 days 00:00:00.367878,96.70891822449396,0.8435051833714053,sigmoid,0,,,,,,,,,,,,,,,,COMPLETE
1036,0.43116910616447424,2024-04-11 16:10:20.758184,2024-04-11 16:10:21.384964,0 days 00:00:00.626780,94.82391915820796,1.3889547562815063,sigmoid,26,,17.0,6.0,5.0,2.0,11.0,,,4.18326803454573,8.98260073924277,8.966685115925445,4.0,40.0,93.0,,COMPLETE
1037,0.5839382417329186,2024-04-11 16:10:21.386013,2024-04-11 16:10:21.748915,0 days 00:00:00.362902,92.31635878001612,1.006466591202404,sigmoid,0,,,,,,,,,,,,,,,,COMPLETE
1038,0.4362545892772063,2024-04-11 16:10:21.750022,2024-04-11 16:10:22.459034,0 days 00:00:00.709012,83.67957679595759,0.637472584813586,sigmoid,62,43.0,49.0,30.0,7.0,3.0,35.0,45.0,38.0,1.9253846926217615,7.725502454526458,0.5561389051066943,17.0,22.0,90.0,,COMPLETE
1039,0.5711768919520648,2024-04-11 16:10:22.460035,2024-04-11 16:10:22.886858,0 days 00:00:00.426823,97.77473589206937,2.2541558460252378,sigmoid,0,,,,,,,,,,,,,,,,COMPLETE
