number,value,datetime_start,datetime_complete,duration,params_C,params_gamma,params_kernel,params_mask_number,params_rsi_window,params_so_smooth,params_so_window,params_srsi_smooth1,params_srsi_smooth2,params_srsi_window,params_tsi_window_fast,params_tsi_window_slow,params_ult_weight_1,params_ult_weight_2,params_ult_weight_3,params_ult_window_1,params_ult_window_2,params_ult_window_3,params_williams_lbp,state
3843,0.12622036262203626,2024-04-11 16:54:11.667187,2024-04-11 16:54:12.538711,0 days 00:00:00.871524,95.53834693452167,7.4005818602568665,sigmoid,8,,27.0,29.0,,,,,,,,,,,,,COMPLETE
3844,0.5195503774995779,2024-04-11 16:54:12.547463,2024-04-11 16:54:14.019323,0 days 00:00:01.471860,96.67578082347758,8.24646807917716,sigmoid,31,,24.0,30.0,2.0,4.0,69.0,41.0,14.0,1.0976888896270331,4.9745009221814716,7.853454537519047,9.0,50.0,86.0,94.0,COMPLETE
3845,0.4787799339872188,2024-04-11 16:54:14.026884,2024-04-11 16:54:15.397660,0 days 00:00:01.370776,98.22359089047437,8.142062463990786,sigmoid,15,,25.0,32.0,,,,46.0,50.0,5.572013951947653,3.57935972141932,5.2683761570381975,20.0,23.0,61.0,110.0,COMPLETE
3846,0.5909107772212947,2024-04-11 16:54:15.405708,2024-04-11 16:54:16.288878,0 days 00:00:00.883170,98.09065892982215,7.149697795914662,sigmoid,8,,23.0,27.0,,,,,,,,,,,,,COMPLETE
3847,0.4053692446409354,2024-04-11 16:54:16.288878,2024-04-11 16:54:17.478452,0 days 00:00:01.189574,99.94227598223459,7.784768294528331,sigmoid,38,33.0,,,,,,39.0,19.0,1.339157309809631,0.7728712212593063,2.0779284585244606,11.0,20.0,92.0,,COMPLETE
3848,0.5211781514452137,2024-04-11 16:54:17.478452,2024-04-11 16:54:18.615749,0 days 00:00:01.137297,92.5871798946973,8.46573714255877,sigmoid,35,26.0,,,,,,,,0.8279303968540574,1.1100861710533518,8.173035149857077,7.0,30.0,80.0,168.0,COMPLETE
3849,0.5964811022156022,2024-04-11 16:54:18.615749,2024-04-11 16:54:19.495790,0 days 00:00:00.880041,95.05910994697823,8.017020791890793,sigmoid,8,,30.0,25.0,,,,,,,,,,,,,COMPLETE
3850,0.42766266812068343,2024-04-11 16:54:19.495790,2024-04-11 16:54:20.663902,0 days 00:00:01.168112,96.56765068255247,8.956606545414747,sigmoid,57,37.0,27.0,30.0,3.0,3.0,95.0,,,,,,,,,34.0,COMPLETE
3851,0.5311247004009587,2024-04-11 16:54:20.663902,2024-04-11 16:54:21.632751,0 days 00:00:00.968849,98.1214400904932,7.557687687741495,sigmoid,9,,26.0,33.0,,,,,,,,,,,,86.0,COMPLETE
3852,0.4704325432781726,2024-04-11 16:54:21.632751,2024-04-11 16:54:22.802178,0 days 00:00:01.169427,33.7422970688956,8.283278246822874,sigmoid,28,,25.0,31.0,1.0,1.0,60.0,10.0,16.0,,,,,,,,COMPLETE
3853,0.45347172512526845,2024-04-11 16:54:22.802178,2024-04-11 16:54:23.717506,0 days 00:00:00.915328,98.18645000160437,7.922191439755789,sigmoid,8,,24.0,28.0,,,,,,,,,,,,,COMPLETE
3854,0.40510295434198745,2024-04-11 16:54:23.717506,2024-04-11 16:54:24.597721,0 days 00:00:00.880215,94.67148904916989,8.119456278749823,sigmoid,16,,,,4.0,5.0,75.0,,,,,,,,,,COMPLETE
3855,0.485935960591133,2024-04-11 16:54:24.597721,2024-04-11 16:54:26.145506,0 days 00:00:01.547785,96.86578878399851,7.664455465310834,sigmoid,63,48.0,21.0,32.0,5.0,6.0,39.0,13.0,3.0,1.9133388393881061,8.649966070387762,0.9779494776703581,19.0,21.0,55.0,101.0,COMPLETE
3856,0.4999063758075087,2024-04-11 16:54:26.145506,2024-04-11 16:54:27.375144,0 days 00:00:01.229638,98.10437194168343,8.51317350817372,sigmoid,42,20.0,22.0,31.0,,,,,,7.149030301171152,0.5336593974543931,3.0325554169053026,6.0,33.0,74.0,,COMPLETE
3857,0.44701971028259324,2024-04-11 16:54:27.375144,2024-04-11 16:54:28.305102,0 days 00:00:00.929958,93.03454463228474,7.935874710777774,sigmoid,8,,26.0,30.0,,,,,,,,,,,,,COMPLETE
3858,0.5186022964734268,2024-04-11 16:54:28.305102,2024-04-11 16:54:29.332431,0 days 00:00:01.027329,38.523922231836906,3.748692596601495,sigmoid,41,35.0,27.0,34.0,,,,,,,,,,,,122.0,COMPLETE
3859,0.18382420829101656,2024-04-11 16:54:29.333712,2024-04-11 16:54:30.946236,0 days 00:00:01.612524,95.4141854386398,8.256965827539844,rbf,14,,28.0,32.0,,,,29.0,22.0,1.6552315115691423,1.9125611272382508,6.334166295769739,17.0,35.0,94.0,,COMPLETE
3860,0.25373493010774223,2024-04-11 16:54:30.946236,2024-04-11 16:54:32.042879,0 days 00:00:01.096643,98.35365396132224,7.750223704921833,sigmoid,3,,,,,,,,,2.1849445199955944,7.585427083277548,2.5547924281279775,14.0,38.0,51.0,43.0,COMPLETE
3861,0.12622036262203626,2024-04-11 16:54:32.050920,2024-04-11 16:54:32.928771,0 days 00:00:00.877851,29.9164302078038,8.021782468338584,sigmoid,8,,24.0,29.0,,,,,,,,,,,,,COMPLETE
3862,0.5400835488362841,2024-04-11 16:54:32.928771,2024-04-11 16:54:34.148087,0 days 00:00:01.219316,99.99235378375074,8.691403122541288,sigmoid,10,,25.0,31.0,,,,,,9.442104240882482,1.4498569040056126,4.33111668507408,13.0,40.0,85.0,,COMPLETE
3863,0.26155047842218315,2024-04-11 16:54:34.155156,2024-04-11 16:54:35.221875,0 days 00:00:01.066719,96.08181232603664,8.32169383835293,sigmoid,2,,,,,,,,,8.632050904625245,8.081257528420387,6.543081651277394,10.0,41.0,65.0,,COMPLETE
3864,0.5189905104339713,2024-04-11 16:54:35.221875,2024-04-11 16:54:36.575112,0 days 00:00:01.353237,99.96177322793197,4.345337833523464,sigmoid,46,5.0,23.0,33.0,,,,33.0,38.0,6.791509135230342,2.579905079020574,8.495262998864018,4.0,36.0,59.0,,COMPLETE
3865,0.4347437508727831,2024-04-11 16:54:36.575112,2024-04-11 16:54:38.127397,0 days 00:00:01.552285,91.3131340496356,8.107787398666098,sigmoid,62,29.0,26.0,30.0,7.0,8.0,22.0,19.0,24.0,6.261431286685593,8.959833612950366,2.8338338789266424,8.0,33.0,62.0,,COMPLETE
3866,0.5952371952371952,2024-04-11 16:54:38.127397,2024-04-11 16:54:39.043988,0 days 00:00:00.916591,98.2750839456053,7.745738466747422,sigmoid,8,,24.0,32.0,,,,,,,,,,,,,COMPLETE
3867,0.3819513406156902,2024-04-11 16:54:39.052836,2024-04-11 16:54:40.391370,0 days 00:00:01.338534,99.99495759135311,7.392711585203173,sigmoid,26,,26.0,31.0,2.0,7.0,35.0,,,3.221274048113959,5.409830142885926,1.8063822062670907,3.0,28.0,57.0,,COMPLETE
3868,0.45022721836881124,2024-04-11 16:54:40.391370,2024-04-11 16:54:41.321105,0 days 00:00:00.929735,96.31779215355851,8.417434052620973,sigmoid,8,,28.0,28.0,,,,,,,,,,,,,COMPLETE
3869,0.5515665174745262,2024-04-11 16:54:41.321105,2024-04-11 16:54:42.446429,0 days 00:00:01.125324,99.99823623996588,7.894016994551557,sigmoid,20,,,,8.0,2.0,20.0,22.0,45.0,,,,,,,,COMPLETE
3870,0.5274129197113014,2024-04-11 16:54:42.454835,2024-04-11 16:54:43.514672,0 days 00:00:01.059837,93.59838847879196,8.179724093459484,sigmoid,37,27.0,,,,,,48.0,6.0,,,,,,,174.0,COMPLETE
3871,0.5906279643331437,2024-04-11 16:54:43.522606,2024-04-11 16:54:44.436738,0 days 00:00:00.914132,96.68070503166814,8.001621939698236,sigmoid,8,,49.0,34.0,,,,,,,,,,,,,COMPLETE
3872,0.4470712773465067,2024-04-11 16:54:44.436738,2024-04-11 16:54:45.388161,0 days 00:00:00.951423,99.94432855390615,4.698885037503861,sigmoid,8,,25.0,30.0,,,,,,,,,,,,,COMPLETE
3873,0.45501885437241874,2024-04-11 16:54:45.388161,2024-04-11 16:54:46.856947,0 days 00:00:01.468786,98.12755989958941,7.534763017967804,sigmoid,59,3.0,27.0,32.0,1.0,4.0,92.0,,,4.391937035814643,5.708783361748334,0.6711268383251738,5.0,43.0,83.0,24.0,COMPLETE
3874,0.41314648945391513,2024-04-11 16:54:46.856947,2024-04-11 16:54:48.068849,0 days 00:00:01.211902,99.9724244177733,8.252434162055488,sigmoid,56,40.0,23.0,33.0,3.0,1.0,13.0,,,,,,,,,,COMPLETE
3875,0.4584483675692104,2024-04-11 16:54:48.068849,2024-04-11 16:54:49.223833,0 days 00:00:01.154984,6.270785167623735,8.517855745080757,sigmoid,52,10.0,,,6.0,3.0,50.0,30.0,27.0,,,,,,,,COMPLETE
3876,0.3480645276165379,2024-04-11 16:54:49.223833,2024-04-11 16:54:50.431874,0 days 00:00:01.208041,95.07619112120008,7.88133696979737,sigmoid,11,,25.0,29.0,,,,,,6.06910631815707,9.801968173401086,1.3981369111224322,13.0,47.0,91.0,14.0,COMPLETE
3877,0.6009432182607054,2024-04-11 16:54:50.431874,2024-04-11 16:54:51.320360,0 days 00:00:00.888486,96.33392018610313,8.071165141094284,sigmoid,8,,24.0,31.0,,,,,,,,,,,,,COMPLETE
3878,0.3670858069987831,2024-04-11 16:54:51.320360,2024-04-11 16:54:52.758954,0 days 00:00:01.438594,97.91958054896723,7.761536260974764,rbf,48,16.0,,,7.0,6.0,63.0,,,,,,,,,,COMPLETE
3879,0.4224628886191765,2024-04-11 16:54:52.758954,2024-04-11 16:54:54.175278,0 days 00:00:01.416324,94.10328359024261,8.364856612255812,sigmoid,55,50.0,,,5.0,7.0,84.0,3.0,10.0,3.6672612993990534,7.157954353563682,4.841583154621054,15.0,42.0,54.0,179.0,COMPLETE
3880,0.6009432182607054,2024-04-11 16:54:54.184883,2024-04-11 16:54:55.105949,0 days 00:00:00.921066,82.33046619646139,7.617184716080999,sigmoid,8,,26.0,31.0,,,,,,,,,,,,,COMPLETE
3881,0.33673779330245274,2024-04-11 16:54:55.108123,2024-04-11 16:54:56.300164,0 days 00:00:01.192041,98.198184837817,8.614750248953515,sigmoid,13,,25.0,30.0,,,,17.0,4.0,,,,,,,133.0,COMPLETE
3882,0.5963643249384587,2024-04-11 16:54:56.300164,2024-04-11 16:54:57.190356,0 days 00:00:00.890192,96.5682422789701,8.196845148971363,sigmoid,8,,29.0,32.0,,,,,,,,,,,,,COMPLETE
3883,0.12622036262203626,2024-04-11 16:54:57.193888,2024-04-11 16:54:58.091831,0 days 00:00:00.897943,98.12753362810057,7.985200025782187,sigmoid,8,,22.0,29.0,,,,,,,,,,,,,COMPLETE
3884,0.4237817250959947,2024-04-11 16:54:58.091831,2024-04-11 16:54:59.484642,0 days 00:00:01.392811,95.3174068544085,8.791943384167254,sigmoid,23,,,,4.0,5.0,58.0,27.0,12.0,2.434304446441766,3.9777124610564565,4.022053770759447,7.0,22.0,70.0,200.0,COMPLETE
3885,0.38051440396807146,2024-04-11 16:54:59.493764,2024-04-11 16:55:00.886189,0 days 00:00:01.392425,98.35545271004973,7.8360992262432125,sigmoid,54,11.0,,,8.0,8.0,32.0,38.0,48.0,2.936672672903225,4.643641474208139,3.4326608170790145,2.0,26.0,75.0,,COMPLETE
3886,0.4972303535239811,2024-04-11 16:55:00.886189,2024-04-11 16:55:02.022040,0 days 00:00:01.135851,96.87261471716674,8.368959768338984,sigmoid,44,38.0,27.0,33.0,,,,6.0,37.0,,,,,,,,COMPLETE
3887,0.32128237638109036,2024-04-11 16:55:02.022040,2024-04-11 16:55:03.062756,0 days 00:00:01.040716,99.94916879801949,6.986169636807511,sigmoid,12,,24.0,31.0,,,,20.0,42.0,,,,,,,,COMPLETE
3888,0.44701971028259324,2024-04-11 16:55:03.071505,2024-04-11 16:55:04.005427,0 days 00:00:00.933922,92.63170285171307,8.16954746376442,sigmoid,8,,26.0,30.0,,,,,,,,,,,,,COMPLETE
3889,0.2970575592981908,2024-04-11 16:55:04.005427,2024-04-11 16:55:04.975490,0 days 00:00:00.970063,98.27017006864747,7.5073591248714004,sigmoid,40,17.0,28.0,35.0,,,,,,,,,,,,,COMPLETE
3890,0.5952371952371952,2024-04-11 16:55:04.983911,2024-04-11 16:55:05.909465,0 days 00:00:00.925554,95.2474177848721,8.05746125958925,sigmoid,8,,23.0,32.0,,,,,,,,,,,,,COMPLETE
3891,0.35228436795738577,2024-04-11 16:55:05.909465,2024-04-11 16:55:06.848151,0 days 00:00:00.938686,98.26315038818147,7.801819748271657,sigmoid,36,44.0,,,,,,32.0,28.0,,,,,,,,COMPLETE
3892,0.40207926070730404,2024-04-11 16:55:06.848151,2024-04-11 16:55:08.091232,0 days 00:00:01.243081,96.81154278385857,8.496019416457436,sigmoid,60,8.0,25.0,31.0,6.0,4.0,45.0,24.0,40.0,,,,,,,,COMPLETE
3893,0.5857819385273628,2024-04-11 16:55:08.091232,2024-04-11 16:55:08.902248,0 days 00:00:00.811016,94.11020572419137,8.25506646935342,sigmoid,32,24.0,,,,,,,,,,,,,,,COMPLETE
3894,0.29481009846746126,2024-04-11 16:55:08.911247,2024-04-11 16:55:09.729872,0 days 00:00:00.818625,98.27532072302296,7.968197240496714,sigmoid,1,,,,,,,,,,,,,,,188.0,COMPLETE
3895,0.38051036579449526,2024-04-11 16:55:09.737435,2024-04-11 16:55:11.097499,0 days 00:00:01.360064,99.98087187520571,7.293764282311264,sigmoid,61,19.0,26.0,28.0,4.0,2.0,10.0,14.0,2.0,,,,,,,105.0,COMPLETE
3896,0.5086733210582421,2024-04-11 16:55:11.097499,2024-04-11 16:55:12.547523,0 days 00:00:01.450024,99.95003823264155,7.6912947207743105,sigmoid,27,,19.0,30.0,3.0,6.0,15.0,,,7.470712153089955,6.7105906906080754,5.929041172892338,12.0,37.0,76.0,144.0,COMPLETE
3897,0.5952371952371952,2024-04-11 16:55:12.547523,2024-04-11 16:55:13.478064,0 days 00:00:00.930541,96.53440450619264,8.081346716060459,sigmoid,8,,24.0,32.0,,,,,,,,,,,,,COMPLETE
3898,0.23036363636363635,2024-04-11 16:55:13.478064,2024-04-11 16:55:15.040526,0 days 00:00:01.562462,95.12775712403423,8.381111594361537,rbf,7,,,,,,,45.0,32.0,5.0165784305842696,2.9107298365578638,7.223622785585166,16.0,34.0,100.0,80.0,COMPLETE
3899,0.2086798978835543,2024-04-11 16:55:15.040526,2024-04-11 16:55:15.930867,0 days 00:00:00.890341,96.73743164951517,7.907911097532441,sigmoid,4,,,,,,,31.0,29.0,,,,,,,,COMPLETE
3900,0.3639044332004156,2024-04-11 16:55:15.930867,2024-04-11 16:55:16.872476,0 days 00:00:00.941609,91.59989424827027,8.241341097072427,sigmoid,5,,,,,,,43.0,35.0,,,,,,,65.0,COMPLETE
3901,0.12622036262203626,2024-04-11 16:55:16.872476,2024-04-11 16:55:17.755455,0 days 00:00:00.882979,98.25084021198714,8.651443186498337,sigmoid,8,,27.0,29.0,,,,,,,,,,,,,COMPLETE
3902,0.4044975207765905,2024-04-11 16:55:17.755455,2024-04-11 16:55:18.669163,0 days 00:00:00.913708,99.98885744642463,7.524223789422874,sigmoid,33,22.0,,,,,,,,,,,,,,115.0,COMPLETE
3903,0.42086905972969046,2024-04-11 16:55:18.669163,2024-04-11 16:55:20.118922,0 days 00:00:01.449759,96.52396106687135,8.07888042279064,sigmoid,30,,25.0,33.0,5.0,5.0,28.0,11.0,8.0,9.6658738561706,3.3751027415820367,2.2460560383615045,6.0,25.0,64.0,,COMPLETE
3904,0.461104107574325,2024-04-11 16:55:20.127583,2024-04-11 16:55:21.541610,0 days 00:00:01.414027,99.93481204316686,7.778592067726604,sigmoid,51,34.0,,,1.0,1.0,73.0,,,6.4382221028779485,2.288442525171077,8.307356509836923,20.0,46.0,96.0,69.0,COMPLETE
3905,0.5852815461810073,2024-04-11 16:55:21.541610,2024-04-11 16:55:22.455102,0 days 00:00:00.913492,99.95403265350392,8.440805916575453,sigmoid,8,,29.0,40.0,,,,,,,,,,,,,COMPLETE
3906,0.5986580986580987,2024-04-11 16:55:22.463168,2024-04-11 16:55:23.380423,0 days 00:00:00.917255,94.22344458454346,8.198241740957693,sigmoid,8,,24.0,31.0,,,,,,,,,,,,,COMPLETE
3907,0.5120347014309625,2024-04-11 16:55:23.382544,2024-04-11 16:55:24.620285,0 days 00:00:01.237741,99.97736137441557,7.95145919985373,sigmoid,18,,,,8.0,8.0,65.0,,,5.464894088213828,8.25869588521601,0.5011834139142257,3.0,21.0,67.0,,COMPLETE
3908,0.558916665027634,2024-04-11 16:55:24.628347,2024-04-11 16:55:25.781748,0 days 00:00:01.153401,96.69532024309476,7.767024066257556,sigmoid,34,4.0,,,,,,,,6.968760203122935,5.067717843253202,9.603576279788875,9.0,31.0,72.0,,COMPLETE
3909,0.3753804984111055,2024-04-11 16:55:25.789289,2024-04-11 16:55:26.915901,0 days 00:00:01.126612,99.98773998969658,8.252670772143325,sigmoid,45,14.0,23.0,30.0,,,,36.0,30.0,,,,,,,159.0,COMPLETE
3910,0.6009432182607054,2024-04-11 16:55:26.915901,2024-04-11 16:55:27.805939,0 days 00:00:00.890038,98.1170780479106,7.626767293609745,sigmoid,8,,27.0,31.0,,,,,,,,,,,,,COMPLETE
3911,0.5124949055106287,2024-04-11 16:55:27.805939,2024-04-11 16:55:29.084013,0 days 00:00:01.278074,95.16748288413307,8.024675782685252,sigmoid,53,47.0,,,2.0,7.0,30.0,16.0,20.0,,,,,,,126.0,COMPLETE
3912,0.5105422748748325,2024-04-11 16:55:29.084013,2024-04-11 16:55:30.081471,0 days 00:00:00.997458,96.83059654683152,8.536649715911674,sigmoid,17,,,,7.0,3.0,41.0,,,,,,,,,28.0,COMPLETE
3913,0.48097223238011655,2024-04-11 16:55:30.090273,2024-04-11 16:55:31.172385,0 days 00:00:01.082112,98.11114043634588,7.899793206142906,sigmoid,49,18.0,,,6.0,3.0,54.0,,,,,,,,,97.0,COMPLETE
3914,0.4495633362711321,2024-04-11 16:55:31.172988,2024-04-11 16:55:32.412737,0 days 00:00:01.239749,94.11922063443565,8.127949346379422,sigmoid,19,,,,2.0,2.0,37.0,,,2.7372430702809636,9.176525922116202,7.082361192123272,18.0,29.0,50.0,47.0,COMPLETE
3915,0.4246957031822848,2024-04-11 16:55:32.412737,2024-04-11 16:55:33.803610,0 days 00:00:01.390873,98.13967863346772,8.36166007817828,sigmoid,58,49.0,26.0,34.0,5.0,6.0,77.0,,,1.2218805345840202,7.351941867830529,4.588796587266794,5.0,45.0,89.0,,COMPLETE
3916,0.4603040046769951,2024-04-11 16:55:33.803610,2024-04-11 16:55:35.481087,0 days 00:00:01.677477,96.6974849973198,7.445792468736633,rbf,8,,25.0,32.0,,,,,,,,,,,,,COMPLETE
3917,0.46130053941703375,2024-04-11 16:55:35.497852,2024-04-11 16:55:36.645341,0 days 00:00:01.147489,99.96693184379056,8.786987017384936,sigmoid,25,,26.0,30.0,3.0,4.0,94.0,,,,,,,,,91.0,COMPLETE
3918,0.6009432182607054,2024-04-11 16:55:36.645341,2024-04-11 16:55:37.608518,0 days 00:00:00.963177,93.02363578055328,7.891236401802677,sigmoid,8,,25.0,31.0,,,,,,,,,,,,,COMPLETE
3919,0.46445141390840045,2024-04-11 16:55:37.608518,2024-04-11 16:55:38.942699,0 days 00:00:01.334181,99.96717519428353,8.175017010743778,sigmoid,43,41.0,22.0,29.0,,,,,,5.8435489701629155,6.197179366142475,8.895256516701057,14.0,27.0,98.0,54.0,COMPLETE
3920,0.5347179938208962,2024-04-11 16:55:38.942699,2024-04-11 16:55:40.259150,0 days 00:00:01.316451,96.83522842923678,7.659478488102616,sigmoid,50,46.0,,,1.0,4.0,6.0,,,8.292318411877465,3.7764272638605076,7.573427360124225,11.0,23.0,84.0,,COMPLETE
3921,0.5929369437606513,2024-04-11 16:55:40.259150,2024-04-11 16:55:41.202124,0 days 00:00:00.942974,90.73905474088413,8.403265042640447,sigmoid,8,,28.0,33.0,,,,,,,,,,,,,COMPLETE
3922,0.4943372588323728,2024-04-11 16:55:41.202124,2024-04-11 16:55:42.197351,0 days 00:00:00.995227,95.19115863249816,2.9360442202134904,sigmoid,8,,24.0,32.0,,,,,,,,,,,,,COMPLETE
3923,0.6009432182607054,2024-04-11 16:55:42.204888,2024-04-11 16:55:43.201287,0 days 00:00:00.996399,98.26063320771249,8.04210092013321,sigmoid,8,,27.0,31.0,,,,,,,,,,,,,COMPLETE
3924,0.4512140399860397,2024-04-11 16:55:43.201287,2024-04-11 16:55:44.428802,0 days 00:00:01.227515,98.22504825143344,8.277571425326048,sigmoid,21,,,,4.0,5.0,88.0,8.0,33.0,,,,,,,148.0,COMPLETE
3925,0.4014747317307115,2024-04-11 16:55:44.428802,2024-04-11 16:55:45.855165,0 days 00:00:01.426363,95.33038901553796,8.565718629142525,sigmoid,47,36.0,23.0,28.0,,,,35.0,17.0,6.606320058497525,8.48258340422346,8.009278376502309,8.0,42.0,87.0,38.0,COMPLETE
3926,0.5085109899190217,2024-04-11 16:55:45.863607,2024-04-11 16:55:47.367244,0 days 00:00:01.503637,96.75596516862109,7.821782889765015,sigmoid,31,,25.0,30.0,6.0,1.0,67.0,47.0,42.0,3.409109260009652,4.1868743785935605,5.583662065250863,19.0,44.0,59.0,136.0,COMPLETE
3927,0.47744425176464844,2024-04-11 16:55:47.375317,2024-04-11 16:55:48.653022,0 days 00:00:01.277705,66.88150818708593,8.063195620872513,sigmoid,35,32.0,,,,,,,,3.8544165153183307,5.204199250563377,6.249602062288919,17.0,32.0,78.0,32.0,COMPLETE
3928,0.2574014221073045,2024-04-11 16:55:48.653532,2024-04-11 16:55:49.784373,0 days 00:00:01.130841,98.19431720475602,8.957610850846562,sigmoid,6,,,,,,,5.0,18.0,0.720382067625132,7.795692968763191,3.692118696745529,12.0,39.0,61.0,,COMPLETE
3929,0.3745957832104514,2024-04-11 16:55:49.784373,2024-04-11 16:55:51.061504,0 days 00:00:01.277131,99.95538473303019,7.623930338758233,sigmoid,39,25.0,,,,,,50.0,25.0,9.050462283860684,3.1131783250938576,8.731291940037242,10.0,24.0,53.0,77.0,COMPLETE
3930,0.413039934800326,2024-04-11 16:55:51.061504,2024-04-11 16:55:52.287091,0 days 00:00:01.225587,98.1739361622497,7.296861813003929,sigmoid,24,,26.0,33.0,7.0,7.0,4.0,,,,,,,,,,COMPLETE
3931,0.5109190371991248,2024-04-11 16:55:52.287091,2024-04-11 16:55:53.640933,0 days 00:00:01.353842,94.40233947228758,6.484766635972814,sigmoid,22,,,,8.0,1.0,51.0,25.0,49.0,2.322507635941313,1.229898115981034,6.7366965650397574,7.0,48.0,68.0,,COMPLETE
3932,0.5204627524408185,2024-04-11 16:55:53.640933,2024-04-11 16:55:54.837910,0 days 00:00:01.196977,96.4448869589045,7.928038289473651,sigmoid,38,31.0,,,,,,44.0,46.0,8.546264848862458,6.910437284466212,5.016349274661547,16.0,49.0,57.0,,COMPLETE
3933,0.5069681650498701,2024-04-11 16:55:54.837910,2024-04-11 16:55:56.207410,0 days 00:00:01.369500,99.95856652086701,8.234827860742442,sigmoid,15,,24.0,32.0,,,,42.0,14.0,7.650955082466513,0.9786046674356665,2.6125841102733487,2.0,27.0,93.0,184.0,COMPLETE
3934,0.3137041515517936,2024-04-11 16:55:56.207410,2024-04-11 16:55:57.834578,0 days 00:00:01.627168,92.84689384030034,6.014810700261442,rbf,29,,26.0,29.0,5.0,2.0,18.0,21.0,22.0,,,,,,,18.0,COMPLETE
3935,0.5241987385763933,2024-04-11 16:55:57.834578,2024-04-11 16:55:58.921260,0 days 00:00:01.086682,98.36976670907738,8.496511759702514,sigmoid,3,,,,,,,,,5.18125032856847,5.848339434443774,1.6734502804530185,15.0,50.0,82.0,165.0,COMPLETE
3936,0.44701971028259324,2024-04-11 16:55:58.921260,2024-04-11 16:55:59.876266,0 days 00:00:00.955006,96.73052369074614,8.067683350425337,sigmoid,8,,30.0,30.0,,,,,,,,,,,,,COMPLETE
3937,0.6009432182607054,2024-04-11 16:55:59.876266,2024-04-11 16:56:00.827827,0 days 00:00:00.951561,95.22468898649568,7.787619519068478,sigmoid,8,,28.0,31.0,,,,,,,,,,,,,COMPLETE
3938,0.5034063943252278,2024-04-11 16:56:00.835877,2024-04-11 16:56:01.773089,0 days 00:00:00.937212,99.98345752019351,8.312571727893479,sigmoid,8,,27.0,36.0,,,,,,,,,,,,,COMPLETE
3939,0.4562496378281277,2024-04-11 16:56:01.773089,2024-04-11 16:56:03.415216,0 days 00:00:01.642127,98.10434113532587,7.939770649809036,sigmoid,63,28.0,23.0,32.0,2.0,6.0,86.0,41.0,39.0,1.518425334360881,2.0512704226422755,1.2606156006943467,4.0,20.0,90.0,110.0,COMPLETE
3940,0.44701971028259324,2024-04-11 16:56:03.415216,2024-04-11 16:56:04.330595,0 days 00:00:00.915379,96.72662981427656,7.551484916869845,sigmoid,8,,25.0,30.0,,,,,,,,,,,,,COMPLETE
3941,0.37678599589970035,2024-04-11 16:56:04.338286,2024-04-11 16:56:05.782868,0 days 00:00:01.444582,98.16524175046949,8.103220836380652,sigmoid,46,2.0,24.0,34.0,,,,28.0,11.0,7.94341544487493,1.6590542359353444,5.265134266591025,13.0,36.0,66.0,,COMPLETE
3942,0.533807520492692,2024-04-11 16:56:05.791311,2024-04-11 16:56:06.848570,0 days 00:00:01.057259,95.2417289241029,8.596399121882875,sigmoid,9,,25.0,31.0,,,,,,,,,,,,176.0,COMPLETE
3943,0.36073741903338313,2024-04-11 16:56:06.848570,2024-04-11 16:56:08.184713,0 days 00:00:01.336143,98.12898107785169,7.7294031819645745,sigmoid,14,,22.0,32.0,,,,9.0,43.0,2.601189920997052,6.408572077759331,6.079185783308539,12.0,40.0,64.0,,COMPLETE
3944,0.12622036262203626,2024-04-11 16:56:08.184713,2024-04-11 16:56:09.089045,0 days 00:00:00.904332,99.9644597046599,8.356063780243284,sigmoid,8,,27.0,29.0,,,,,,,,,,,,,COMPLETE
