number,value,datetime_start,datetime_complete,duration,params_C,params_gamma,params_kernel,params_mask_number,params_rsi_window,params_so_smooth,params_so_window,params_srsi_smooth1,params_srsi_smooth2,params_srsi_window,params_tsi_window_fast,params_tsi_window_slow,params_ult_weight_1,params_ult_weight_2,params_ult_weight_3,params_ult_window_1,params_ult_window_2,params_ult_window_3,params_williams_lbp,state
523,0.3795223541118772,2024-04-11 16:06:01.241532,2024-04-11 16:06:01.742276,0 days 00:00:00.500744,93.0820042784032,0.7617855950343715,sigmoid,7,,,,,,,19.0,16.0,2.3997382040637367,8.995216715377465,6.669688025454906,3.0,37.0,76.0,134.0,COMPLETE
524,0.43151047798445963,2024-04-11 16:06:01.743275,2024-04-11 16:06:02.149392,0 days 00:00:00.406117,32.88220184552122,0.10437058181065284,sigmoid,61,26.0,24.0,32.0,6.0,8.0,53.0,50.0,41.0,,,,,,,150.0,COMPLETE
525,0.5833908896563065,2024-04-11 16:06:02.150589,2024-04-11 16:06:02.474128,0 days 00:00:00.323539,54.03475176788899,1.0782619325172913,sigmoid,32,33.0,,,,,,,,,,,,,,,COMPLETE
526,0.5912286039101403,2024-04-11 16:06:02.475128,2024-04-11 16:06:02.771381,0 days 00:00:00.296253,94.39361276249036,0.8751140087680125,sigmoid,0,,,,,,,,,,,,,,,,COMPLETE
527,0.2736205593348451,2024-04-11 16:06:02.771381,2024-04-11 16:06:03.129537,0 days 00:00:00.358156,96.96369269021008,0.7077068056982212,sigmoid,40,36.0,44.0,34.0,,,,,,,,,,,,,COMPLETE
528,0.38275099225714104,2024-04-11 16:06:03.130536,2024-04-11 16:06:03.670657,0 days 00:00:00.540121,94.64146099319852,0.917888760498101,sigmoid,27,,9.0,7.0,2.0,7.0,67.0,,,3.952241829841557,6.628950689509859,9.342063630269712,7.0,46.0,90.0,67.0,COMPLETE
529,0.10504933255948928,2024-04-11 16:06:03.672672,2024-04-11 16:06:03.988418,0 days 00:00:00.315746,97.16316776826993,0.4402905730000779,sigmoid,0,,,,,,,,,,,,,,,,COMPLETE
530,0.4091580930299957,2024-04-11 16:06:03.989635,2024-04-11 16:06:04.463523,0 days 00:00:00.473888,95.30437858808071,9.14444859591113,sigmoid,30,,40.0,25.0,8.0,1.0,29.0,4.0,31.0,0.5053694260010215,7.839378182217073,7.262570226806131,7.0,21.0,65.0,,COMPLETE
531,0.17072928560790343,2024-04-11 16:06:04.464510,2024-04-11 16:06:04.936646,0 days 00:00:00.472136,98.42283689341488,1.1500920408569009,sigmoid,34,2.0,,,,,,,,8.19443045208193,8.520332837932134,1.5133878435811332,14.0,28.0,83.0,,COMPLETE
532,0.27183007938210685,2024-04-11 16:06:04.937648,2024-04-11 16:06:05.349465,0 days 00:00:00.411817,93.43086124453023,0.8374934234611481,sigmoid,36,12.0,,,,,,33.0,34.0,,,,,,,,COMPLETE
533,0.5636462904171639,2024-04-11 16:06:05.350463,2024-04-11 16:06:05.658503,0 days 00:00:00.308040,95.08010572974504,7.201148967722366,sigmoid,0,,,,,,,,,,,,,,,,COMPLETE
534,0.38839919448020865,2024-04-11 16:06:05.659553,2024-04-11 16:06:06.949208,0 days 00:00:01.289655,92.28982644047653,1.0736137895961102,rbf,4,,,,,,,12.0,10.0,,,,,,,,COMPLETE
535,0.5863711449328822,2024-04-11 16:06:06.950314,2024-04-11 16:06:07.237365,0 days 00:00:00.287051,97.81590980375513,0.614760314220728,sigmoid,0,,,,,,,,,,,,,,,,COMPLETE
536,0.43103910914335547,2024-04-11 16:06:07.238360,2024-04-11 16:06:07.657016,0 days 00:00:00.418656,95.67607080619663,1.2268978427884472,sigmoid,53,6.0,,,1.0,8.0,88.0,48.0,40.0,,,,,,,163.0,COMPLETE
537,0.4582017805842365,2024-04-11 16:06:07.658086,2024-04-11 16:06:08.152917,0 days 00:00:00.494831,99.98933274144248,0.8921305441996407,sigmoid,51,13.0,,,5.0,3.0,70.0,,,5.942389851258916,7.224508722867268,5.719822082794902,16.0,41.0,69.0,19.0,COMPLETE
538,0.3425459739332262,2024-04-11 16:06:08.155029,2024-04-11 16:06:08.510949,0 days 00:00:00.355920,89.71289818291298,1.0714688593271813,sigmoid,33,44.0,,,,,,,,,,,,,,63.0,COMPLETE
539,0.5135302672674821,2024-04-11 16:06:08.511952,2024-04-11 16:06:08.909834,0 days 00:00:00.397882,93.87066161324053,0.24568833794981937,sigmoid,45,39.0,26.0,16.0,,,,37.0,42.0,,,,,,,74.0,COMPLETE
540,0.44835565985463316,2024-04-11 16:06:08.911837,2024-04-11 16:06:09.248268,0 days 00:00:00.336431,96.78633299265772,0.5762914029590614,sigmoid,5,,,,,,,43.0,27.0,,,,,,,99.0,COMPLETE
541,0.58260777795367,2024-04-11 16:06:09.249268,2024-04-11 16:06:09.552634,0 days 00:00:00.303366,91.11083142572542,1.291826925609018,sigmoid,0,,,,,,,,,,,,,,,,COMPLETE
542,0.5873898933704218,2024-04-11 16:06:09.553646,2024-04-11 16:06:09.871549,0 days 00:00:00.317903,65.36781757473041,0.78834313509992,sigmoid,0,,,,,,,,,,,,,,,,COMPLETE
543,0.44387533370584215,2024-04-11 16:06:09.872549,2024-04-11 16:06:10.275759,0 days 00:00:00.403210,92.68311550961775,1.0261949163485566,sigmoid,17,,,,3.0,5.0,82.0,,,,,,,,,114.0,COMPLETE
544,0.4675311256909645,2024-04-11 16:06:10.276759,2024-04-11 16:06:10.808505,0 days 00:00:00.531746,98.04709451009309,1.479134597420662,sigmoid,19,,,,2.0,2.0,4.0,,,5.671599465198886,9.55303413298782,4.258920493421599,15.0,34.0,79.0,190.0,COMPLETE
545,0.5863711449328822,2024-04-11 16:06:10.809564,2024-04-11 16:06:11.101884,0 days 00:00:00.292320,94.92136234629672,0.7066678252816375,sigmoid,0,,,,,,,,,,,,,,,,COMPLETE
546,0.37436540269508,2024-04-11 16:06:11.102885,2024-04-11 16:06:11.542356,0 days 00:00:00.439471,96.35958989596395,1.198732823425314,sigmoid,25,,2.0,27.0,8.0,4.0,10.0,,,,,,,,,38.0,COMPLETE
547,0.5852585969961036,2024-04-11 16:06:11.543434,2024-04-11 16:06:11.829282,0 days 00:00:00.285848,91.92094357779375,0.9128624050678217,sigmoid,0,,,,,,,,,,,,,,,,COMPLETE
548,0.4282916745995049,2024-04-11 16:06:11.830353,2024-04-11 16:06:12.252732,0 days 00:00:00.422379,89.003587403048,1.2658706730912694,sigmoid,49,29.0,,,4.0,6.0,19.0,,,,,,,,,52.0,COMPLETE
549,0.43610613228337197,2024-04-11 16:06:12.252801,2024-04-11 16:06:12.739984,0 days 00:00:00.487183,94.21168163711808,0.425903953165829,sigmoid,58,34.0,32.0,50.0,7.0,7.0,100.0,,,1.01696839931645,2.845992806374734,2.6887042668724206,5.0,35.0,58.0,,COMPLETE
550,0.3961107984743325,2024-04-11 16:06:12.740984,2024-04-11 16:06:13.264243,0 days 00:00:00.523259,98.03524386831835,1.0051299983331705,sigmoid,43,40.0,35.0,21.0,,,,,,5.24766618296761,6.809953567980081,3.6788523635623935,4.0,32.0,51.0,58.0,COMPLETE
551,0.45042701204682994,2024-04-11 16:06:13.265242,2024-04-11 16:06:14.543546,0 days 00:00:01.278304,90.26366520616074,0.7787000698005997,rbf,6,,,,,,,30.0,26.0,4.425779224182388,9.179521699232806,8.386525901643786,6.0,38.0,87.0,,COMPLETE
552,0.40614145636738075,2024-04-11 16:06:14.544547,2024-04-11 16:06:15.013541,0 days 00:00:00.468994,95.58977893899217,1.6356819370786972,sigmoid,29,,47.0,29.0,6.0,2.0,16.0,44.0,19.0,,,,,,,178.0,COMPLETE
553,0.3378928789627316,2024-04-11 16:06:15.015694,2024-04-11 16:06:15.498611,0 days 00:00:00.482917,92.7972702082046,1.122559590613529,sigmoid,50,20.0,,,3.0,5.0,48.0,,,3.3292727383220755,4.6735781048343785,8.8755732435962,8.0,40.0,77.0,,COMPLETE
554,0.5863711449328822,2024-04-11 16:06:15.499611,2024-04-11 16:06:15.790160,0 days 00:00:00.290549,88.09391828697802,0.5699351036362239,sigmoid,0,,,,,,,,,,,,,,,,COMPLETE
555,0.5423456861721664,2024-04-11 16:06:15.791337,2024-04-11 16:06:16.149562,0 days 00:00:00.358225,97.62727583755245,1.356204375361378,sigmoid,1,,,,,,,,,,,,,,,47.0,COMPLETE
556,0.5698793073290187,2024-04-11 16:06:16.150562,2024-04-11 16:06:16.468670,0 days 00:00:00.318108,99.81301982997853,3.0935294930685004,sigmoid,0,,,,,,,,,,,,,,,,COMPLETE
557,0.49733082116501803,2024-04-11 16:06:16.469704,2024-04-11 16:06:16.811735,0 days 00:00:00.342031,93.66928561557006,5.621419750287051,sigmoid,24,,16.0,23.0,7.0,3.0,96.0,,,,,,,,,,COMPLETE
558,0.4880783423218848,2024-04-11 16:06:16.813724,2024-04-11 16:06:17.321272,0 days 00:00:00.507548,95.64376992519522,0.8947787767063545,sigmoid,22,,,,4.0,4.0,74.0,24.0,46.0,6.341728002010605,5.054271327926385,0.6344482376538547,2.0,31.0,68.0,,COMPLETE
559,0.3837584976778623,2024-04-11 16:06:17.323436,2024-04-11 16:06:17.820700,0 days 00:00:00.497264,90.10763588315015,1.0756222789201575,sigmoid,47,18.0,18.0,14.0,,,,15.0,30.0,2.7021811737159083,2.578682411866689,5.218351887673887,13.0,22.0,92.0,174.0,COMPLETE
560,0.4951087208493672,2024-04-11 16:06:17.822803,2024-04-11 16:06:18.359861,0 days 00:00:00.537058,91.62138240620816,0.7881612451921532,sigmoid,39,11.0,,,,,,36.0,12.0,3.6818703362713916,5.335473996353476,7.9553965999322775,10.0,49.0,100.0,111.0,COMPLETE
561,0.5498837296526892,2024-04-11 16:06:18.360914,2024-04-11 16:06:18.755239,0 days 00:00:00.394325,98.12395477178782,1.4741450714476663,sigmoid,2,,,,,,,,,1.719579392600358,8.216046217227838,6.143586215088035,11.0,36.0,74.0,,COMPLETE
562,0.5090588004447641,2024-04-11 16:06:18.755361,2024-04-11 16:06:19.227062,0 days 00:00:00.471701,94.29571229447866,1.2412012515688302,sigmoid,38,4.0,,,,,,8.0,14.0,8.975831573280997,3.736167135573572,7.552130123316374,18.0,26.0,55.0,,COMPLETE
563,0.5202138675796191,2024-04-11 16:06:19.228295,2024-04-11 16:06:19.720235,0 days 00:00:00.491940,96.28367182314862,0.5998908827734429,sigmoid,35,27.0,,,,,,,,2.945108223336959,8.844485550059105,3.9607015891682935,17.0,24.0,64.0,130.0,COMPLETE
564,0.4254661666050394,2024-04-11 16:06:19.721236,2024-04-11 16:06:20.155967,0 days 00:00:00.434731,88.35627992055437,0.9568664095894903,sigmoid,21,,,,1.0,1.0,45.0,20.0,50.0,,,,,,,29.0,COMPLETE
565,0.13026268441885572,2024-04-11 16:06:20.156978,2024-04-11 16:06:20.428597,0 days 00:00:00.271619,92.07250808201609,0.26862220124871916,sigmoid,0,,,,,,,,,,,,,,,,COMPLETE
566,0.440654178839434,2024-04-11 16:06:20.429588,2024-04-11 16:06:20.977400,0 days 00:00:00.547812,39.57465892085064,0.7232084975647993,sigmoid,31,,27.0,45.0,5.0,8.0,86.0,18.0,43.0,6.9669973877125475,7.581843199405435,2.1158971986746966,14.0,29.0,94.0,166.0,COMPLETE
567,0.5865019492683915,2024-04-11 16:06:20.978393,2024-04-11 16:06:21.276722,0 days 00:00:00.298329,96.90120450242179,1.1223552306515607,sigmoid,0,,,,,,,,,,,,,,,,COMPLETE
568,0.5873516489526552,2024-04-11 16:06:21.277721,2024-04-11 16:06:21.579254,0 days 00:00:00.301533,93.50726128551742,1.4693132983126735,sigmoid,0,,,,,,,,,,,,,,,,COMPLETE
569,0.3790575916230366,2024-04-11 16:06:21.580256,2024-04-11 16:06:22.021738,0 days 00:00:00.441482,99.94093266071374,0.9074692963946485,sigmoid,3,,,,,,,,,6.136562952470771,9.79841208123821,9.783630751864337,3.0,42.0,61.0,160.0,COMPLETE
570,0.37435367114788004,2024-04-11 16:06:22.022740,2024-04-11 16:06:23.174045,0 days 00:00:01.151305,94.70459166224867,1.3032418943799724,rbf,57,15.0,22.0,17.0,6.0,7.0,41.0,,,,,,,,,86.0,COMPLETE
571,0.5858043514863523,2024-04-11 16:06:23.175042,2024-04-11 16:06:23.524576,0 days 00:00:00.349534,91.10768440517786,1.78224578096747,sigmoid,0,,,,,,,,,,,,,,,,COMPLETE
572,0.5896947521427498,2024-04-11 16:06:23.524576,2024-04-11 16:06:23.884103,0 days 00:00:00.359527,98.30827270291081,1.054606265081196,sigmoid,0,,,,,,,,,,,,,,,,COMPLETE
573,0.5074688605965896,2024-04-11 16:06:23.884103,2024-04-11 16:06:24.403491,0 days 00:00:00.519388,98.46275356902294,1.1988434580377783,sigmoid,15,,8.0,3.0,,,,23.0,24.0,5.386648347444529,7.104776194202471,2.431774816450869,8.0,39.0,70.0,184.0,COMPLETE
574,0.3937591352527278,2024-04-11 16:06:24.404683,2024-04-11 16:06:24.809412,0 days 00:00:00.404729,98.09880989582395,1.4726645754350884,sigmoid,9,,10.0,41.0,,,,,,,,,,,,125.0,COMPLETE
575,0.5756205734717733,2024-04-11 16:06:24.810629,2024-04-11 16:06:25.205861,0 days 00:00:00.395232,99.94363224708016,1.1052388365996462,sigmoid,8,,50.0,10.0,,,,,,,,,,,,,COMPLETE
576,0.3089674531522646,2024-04-11 16:06:25.206893,2024-04-11 16:06:25.721186,0 days 00:00:00.514293,96.63811822221342,1.0288408645698204,sigmoid,42,42.0,13.0,38.0,,,,,,5.012979455856087,1.7700738604408341,7.735754798712122,6.0,44.0,96.0,,COMPLETE
577,0.5815744280095285,2024-04-11 16:06:25.722187,2024-04-11 16:06:26.033313,0 days 00:00:00.311126,27.477987904630144,1.6102319332016626,sigmoid,0,,,,,,,,,,,,,,,,COMPLETE
578,0.3434984621425299,2024-04-11 16:06:26.034309,2024-04-11 16:06:26.442186,0 days 00:00:00.407877,50.68045830661487,9.790605352440728,sigmoid,18,,,,2.0,6.0,38.0,,,7.342628655046642,5.504954395585081,7.015620497668595,12.0,20.0,88.0,,COMPLETE
579,0.26661756582581475,2024-04-11 16:06:26.444235,2024-04-11 16:06:26.884243,0 days 00:00:00.440008,77.3727826113046,1.2300887433997472,sigmoid,28,,38.0,20.0,8.0,1.0,12.0,47.0,22.0,,,,,,,,COMPLETE
580,0.4617224244678872,2024-04-11 16:06:26.885239,2024-04-11 16:06:27.490114,0 days 00:00:00.604875,98.18054246484581,0.8917753730439992,sigmoid,63,21.0,5.0,36.0,7.0,3.0,64.0,46.0,2.0,1.2174760734238343,4.418741957902887,2.998746443088489,9.0,27.0,75.0,195.0,COMPLETE
581,0.1278700105969622,2024-04-11 16:06:27.491141,2024-04-11 16:06:27.879550,0 days 00:00:00.388409,96.21691336471322,1.369239122163047,sigmoid,16,,,,4.0,5.0,25.0,,,,,,,,,,COMPLETE
582,0.10504933255948928,2024-04-11 16:06:27.880550,2024-04-11 16:06:28.220638,0 days 00:00:00.340088,0.9802508019079283,0.4971157490817578,sigmoid,0,,,,,,,,,,,,,,,,COMPLETE
583,0.5863711449328822,2024-04-11 16:06:28.221637,2024-04-11 16:06:28.523743,0 days 00:00:00.302106,96.25190262505436,0.710600011048225,sigmoid,0,,,,,,,,,,,,,,,,COMPLETE
584,0.33468692215655704,2024-04-11 16:06:28.524743,2024-04-11 16:06:29.052209,0 days 00:00:00.527466,99.96242107825715,1.0276382619590072,sigmoid,46,48.0,36.0,13.0,,,,5.0,28.0,5.752118798791403,6.223381622526983,9.988774217208924,5.0,28.0,98.0,,COMPLETE
585,0.585791427013526,2024-04-11 16:06:29.053207,2024-04-11 16:06:29.354677,0 days 00:00:00.301470,97.95383437475634,1.2956220509028775,sigmoid,0,,,,,,,,,,,,,,,,COMPLETE
586,0.586206338153612,2024-04-11 16:06:29.354677,2024-04-11 16:06:29.656231,0 days 00:00:00.301554,94.42607291616969,0.9169318440357422,sigmoid,0,,,,,,,,,,,,,,,,COMPLETE
587,0.5239836024004734,2024-04-11 16:06:29.657241,2024-04-11 16:06:30.067603,0 days 00:00:00.410362,96.06018390981404,4.744692725202635,sigmoid,37,7.0,,,,,,38.0,38.0,,,,,,,15.0,COMPLETE
588,0.38618950635243915,2024-04-11 16:06:30.068603,2024-04-11 16:06:30.620920,0 days 00:00:00.552317,98.40537477429987,0.6991171138216634,sigmoid,62,50.0,30.0,8.0,3.0,2.0,90.0,2.0,36.0,8.57494565556254,6.492490294287938,1.925282683932712,3.0,32.0,84.0,,COMPLETE
589,0.5894865401251845,2024-04-11 16:06:30.622086,2024-04-11 16:06:30.928766,0 days 00:00:00.306680,94.45199380234321,1.1413063802607748,sigmoid,0,,,,,,,,,,,,,,,,COMPLETE
590,0.4081435428276906,2024-04-11 16:06:30.929941,2024-04-11 16:06:32.476679,0 days 00:00:01.546738,94.79284342924842,1.5512122801045103,rbf,10,,14.0,24.0,,,,,,2.050638848893702,6.02154211152435,4.678407515731598,11.0,50.0,81.0,,COMPLETE
591,0.5344863952752583,2024-04-11 16:06:32.477648,2024-04-11 16:06:33.022085,0 days 00:00:00.544437,97.14825968850504,2.030021647582533,sigmoid,56,32.0,33.0,6.0,1.0,4.0,22.0,,,,,,,,,,COMPLETE
592,0.5860647931709175,2024-04-11 16:06:33.023050,2024-04-11 16:06:33.339119,0 days 00:00:00.316069,95.43948126080198,1.2471289521989264,sigmoid,0,,,,,,,,,,,,,,,,COMPLETE
593,0.35819759476328206,2024-04-11 16:06:33.340178,2024-04-11 16:06:33.725862,0 days 00:00:00.385684,98.3206740035008,1.4384780739526348,sigmoid,41,46.0,11.0,26.0,,,,,,,,,,,,147.0,COMPLETE
594,0.42259031392964186,2024-04-11 16:06:33.726864,2024-04-11 16:06:34.229787,0 days 00:00:00.502923,93.90589167879273,1.7690346474126906,sigmoid,52,17.0,,,5.0,6.0,77.0,17.0,25.0,,,,,,,,COMPLETE
595,0.49382197854088516,2024-04-11 16:06:34.230786,2024-04-11 16:06:34.694686,0 days 00:00:00.463900,96.66502298887059,1.1407292911961429,sigmoid,48,5.0,,,6.0,8.0,55.0,,,,,,,,,,COMPLETE
596,0.5906816394155942,2024-04-11 16:06:34.696688,2024-04-11 16:06:35.025844,0 days 00:00:00.329156,94.3297495479123,1.0748120490175783,sigmoid,0,,,,,,,,,,,,,,,,COMPLETE
597,0.5842605449660073,2024-04-11 16:06:35.026870,2024-04-11 16:06:35.345255,0 days 00:00:00.318385,92.89441068101233,1.3952833985337987,sigmoid,0,,,,,,,,,,,,,,,,COMPLETE
598,0.319530260582569,2024-04-11 16:06:35.346255,2024-04-11 16:06:35.765241,0 days 00:00:00.418986,87.78734240123406,1.1711959036853108,sigmoid,20,,,,3.0,3.0,69.0,11.0,7.0,,,,,,,,COMPLETE
599,0.3457809177089717,2024-04-11 16:06:35.766340,2024-04-11 16:06:36.230241,0 days 00:00:00.463901,99.94166265007946,1.6220055709378434,sigmoid,14,,23.0,47.0,,,,39.0,45.0,1.4423051912535363,3.2175450973562056,9.036639257385342,7.0,25.0,73.0,,COMPLETE
600,0.5214516663903167,2024-04-11 16:06:36.231241,2024-04-11 16:06:36.626659,0 days 00:00:00.395418,90.84386487921351,1.2775031490489188,sigmoid,12,,17.0,40.0,,,,34.0,16.0,,,,,,,,COMPLETE
601,0.3647695465571935,2024-04-11 16:06:36.627660,2024-04-11 16:06:37.111494,0 days 00:00:00.483834,93.82031879731605,1.0491101039364918,sigmoid,11,,45.0,18.0,,,,,,4.72388827777408,7.907969578766339,8.140530385314296,4.0,48.0,71.0,154.0,COMPLETE
602,0.45705728631412046,2024-04-11 16:06:37.112542,2024-04-11 16:06:37.675557,0 days 00:00:00.563015,95.86900968295528,1.034807870028102,sigmoid,59,37.0,31.0,44.0,8.0,7.0,51.0,,,4.096312255876749,8.483997363704084,5.574301205958708,16.0,30.0,86.0,139.0,COMPLETE
603,0.360797342192691,2024-04-11 16:06:37.676558,2024-04-11 16:06:38.171007,0 days 00:00:00.494449,92.51245932837753,1.4539923918006616,sigmoid,26,,21.0,30.0,2.0,2.0,34.0,,,0.7468966369525489,0.6234156277307568,1.3261787373994487,10.0,33.0,66.0,,COMPLETE
604,0.5892718722546639,2024-04-11 16:06:38.172008,2024-04-11 16:06:38.484324,0 days 00:00:00.312316,90.47910811336716,1.217347710153259,sigmoid,0,,,,,,,,,,,,,,,,COMPLETE
605,0.5191839023443398,2024-04-11 16:06:38.485374,2024-04-11 16:06:38.912005,0 days 00:00:00.426631,94.43746110752971,0.9833081234741464,sigmoid,44,41.0,6.0,34.0,,,,35.0,18.0,,,,,,,,COMPLETE
606,0.16639670796305212,2024-04-11 16:06:38.913007,2024-04-11 16:06:39.336848,0 days 00:00:00.423841,98.2836154295109,1.3502302978960583,sigmoid,2,,,,,,,,,4.503609288121422,9.989554518138409,1.6690322559913038,2.0,34.0,82.0,,COMPLETE
607,0.37601633296321496,2024-04-11 16:06:39.337844,2024-04-11 16:06:39.802174,0 days 00:00:00.464330,88.99909506495939,0.8848154005376309,sigmoid,13,,49.0,48.0,,,,29.0,32.0,,,,,,,106.0,COMPLETE
608,0.48301692455347733,2024-04-11 16:06:39.803173,2024-04-11 16:06:40.365829,0 days 00:00:00.562656,96.6991437714174,1.5903587185693762,sigmoid,23,,,,1.0,4.0,6.0,9.0,21.0,3.83949553708951,8.696561987823241,3.5257680782613674,20.0,43.0,60.0,121.0,COMPLETE
609,0.38290417479258254,2024-04-11 16:06:40.366955,2024-04-11 16:06:41.165366,0 days 00:00:00.798411,92.54481159270019,1.1326646685717694,rbf,0,,,,,,,,,,,,,,,,COMPLETE
610,0.32114975159687725,2024-04-11 16:06:41.166367,2024-04-11 16:06:41.529577,0 days 00:00:00.363210,94.85844034472962,0.9715168037733227,sigmoid,36,24.0,,,,,,49.0,47.0,,,,,,,,COMPLETE
611,0.4141075629168949,2024-04-11 16:06:41.530573,2024-04-11 16:06:42.063484,0 days 00:00:00.532911,98.08206296054563,1.2214440168878076,sigmoid,55,19.0,,,7.0,5.0,2.0,6.0,29.0,7.614236030077031,3.9061137260176118,4.880249332560585,6.0,39.0,78.0,33.0,COMPLETE
612,0.4295490921132513,2024-04-11 16:06:42.064486,2024-04-11 16:06:42.565061,0 days 00:00:00.500575,91.17969044308113,0.7470628321254417,sigmoid,60,30.0,19.0,49.0,4.0,1.0,60.0,13.0,11.0,,,,,,,,COMPLETE
613,0.5873516489526552,2024-04-11 16:06:42.566062,2024-04-11 16:06:42.875067,0 days 00:00:00.309005,94.26864954799142,1.4506087628145927,sigmoid,0,,,,,,,,,,,,,,,,COMPLETE
614,0.5302253562386223,2024-04-11 16:06:42.876075,2024-04-11 16:06:43.274914,0 days 00:00:00.398839,99.9210361806597,1.0757478722530067,sigmoid,40,15.0,40.0,22.0,,,,,,,,,,,,,COMPLETE
615,0.4494904804041903,2024-04-11 16:06:43.276071,2024-04-11 16:06:43.782247,0 days 00:00:00.506176,86.67581829495352,1.7129281863361,sigmoid,54,22.0,,,5.0,3.0,98.0,21.0,13.0,3.455025477062145,6.899894132877728,4.156585787635571,17.0,37.0,50.0,,COMPLETE
616,0.3612277200467965,2024-04-11 16:06:43.783249,2024-04-11 16:06:44.257172,0 days 00:00:00.473923,96.46729782660913,0.8491955337096059,sigmoid,7,,,,,,,42.0,4.0,2.4225179970510986,4.90699945983253,0.8823383638100868,13.0,31.0,95.0,70.0,COMPLETE
617,0.5888219294970936,2024-04-11 16:06:44.258171,2024-04-11 16:06:44.575603,0 days 00:00:00.317432,75.10621706580748,1.3605745672145797,sigmoid,0,,,,,,,,,,,,,,,,COMPLETE
618,0.4417969431045505,2024-04-11 16:06:44.576601,2024-04-11 16:06:45.074372,0 days 00:00:00.497771,93.04317010777824,0.5245965743805854,sigmoid,61,28.0,3.0,37.0,6.0,8.0,92.0,45.0,39.0,,,,,,,25.0,COMPLETE
619,0.5906816394155942,2024-04-11 16:06:45.075368,2024-04-11 16:06:45.382845,0 days 00:00:00.307477,96.82290502752309,1.0822823957213188,sigmoid,0,,,,,,,,,,,,,,,,COMPLETE
620,0.3773131073410089,2024-04-11 16:06:45.383847,2024-04-11 16:06:45.859220,0 days 00:00:00.475373,98.0103173351749,8.379275932476439,sigmoid,27,,29.0,2.0,8.0,6.0,28.0,,,3.166059871096916,3.423384598572447,3.7849818056769458,4.0,26.0,90.0,79.0,COMPLETE
621,0.5417956030176163,2024-04-11 16:06:45.860217,2024-04-11 16:06:46.323059,0 days 00:00:00.462842,96.2912829821714,1.2628701349038622,sigmoid,34,9.0,,,,,,,,6.7423839240737315,7.388172927256246,6.396832252319156,9.0,35.0,85.0,,COMPLETE
622,0.5152121449640065,2024-04-11 16:06:46.324203,2024-04-11 16:06:46.708736,0 days 00:00:00.384533,70.48313774307093,1.087264806149763,sigmoid,5,,,,,,,28.0,6.0,,,,,,,91.0,COMPLETE
623,0.5847104737362986,2024-04-11 16:06:46.709738,2024-04-11 16:06:47.067785,0 days 00:00:00.358047,98.10173340870999,1.8770760496896852,sigmoid,0,,,,,,,,,,,,,,,,COMPLETE
624,0.5563948075673208,2024-04-11 16:06:47.069072,2024-04-11 16:06:47.464480,0 days 00:00:00.395408,94.8800869121036,1.5469694788955155,sigmoid,32,45.0,,,,,,,,,,,,,,,COMPLETE
625,0.07822798487304161,2024-04-11 16:06:47.465556,2024-04-11 16:06:47.810574,0 days 00:00:00.345018,96.2720318156557,1.2108339559157077,sigmoid,4,,,,,,,25.0,8.0,,,,,,,,COMPLETE
626,0.4130282654334134,2024-04-11 16:06:47.812283,2024-04-11 16:06:48.266384,0 days 00:00:00.454101,98.34071824518553,0.9835228411225736,sigmoid,45,23.0,35.0,32.0,,,,31.0,20.0,,,,,,,43.0,COMPLETE
627,0.40252426062846575,2024-04-11 16:06:48.267378,2024-04-11 16:06:48.843697,0 days 00:00:00.576319,94.68884803126042,1.1006227097484065,sigmoid,30,,42.0,42.0,5.0,7.0,30.0,19.0,35.0,9.287374154410895,9.2271763629401,3.3274566400198458,15.0,23.0,67.0,,COMPLETE
