number,value,datetime_start,datetime_complete,duration,params_C,params_gamma,params_kernel,params_mask_number,params_rsi_window,params_so_smooth,params_so_window,params_srsi_smooth1,params_srsi_smooth2,params_srsi_window,params_tsi_window_fast,params_tsi_window_slow,params_ult_weight_1,params_ult_weight_2,params_ult_weight_3,params_ult_window_1,params_ult_window_2,params_ult_window_3,params_williams_lbp,state
8058,0.4778541036550981,2024-04-11 18:40:48.142651,2024-04-11 18:40:50.819801,0 days 00:00:02.677150,96.81590540652,8.073662184706869,sigmoid,47,23.0,26.0,32.0,,,,31.0,46.0,2.685133719431144,5.275849528814882,0.8611588588646697,9.0,31.0,95.0,186.0,COMPLETE
8059,0.3775626609302174,2024-04-11 18:40:50.822793,2024-04-11 18:40:53.022145,0 days 00:00:02.199352,94.84262350819539,7.850078857013311,sigmoid,39,17.0,,,,,,34.0,2.0,1.9432991397548136,1.0305942395120429,1.3502604105455185,20.0,50.0,75.0,98.0,COMPLETE
8060,0.47805484347083044,2024-04-11 18:40:53.026141,2024-04-11 18:40:55.528878,0 days 00:00:02.502737,99.9667194803417,7.621132600257379,sigmoid,22,,,,7.0,4.0,63.0,45.0,48.0,6.199351226759183,8.258150739228139,8.203496889134165,18.0,34.0,59.0,,COMPLETE
8061,0.42911064666063575,2024-04-11 18:40:55.531891,2024-04-11 18:40:57.606529,0 days 00:00:02.074638,98.29146882753037,8.37358796862214,sigmoid,21,,,,3.0,7.0,68.0,43.0,5.0,,,,,,,77.0,COMPLETE
8062,0.6009432182607054,2024-04-11 18:40:57.609063,2024-04-11 18:40:59.261688,0 days 00:00:01.652625,98.26006079146997,8.131773435517614,sigmoid,8,,23.0,31.0,,,,,,,,,,,,,COMPLETE
8063,0.4477175624016191,2024-04-11 18:40:59.266675,2024-04-11 18:41:02.070629,0 days 00:00:02.803954,99.95176249578388,7.940226422074781,sigmoid,31,,24.0,30.0,2.0,8.0,79.0,48.0,27.0,3.276487424938643,7.6624421303432655,4.333165213194369,10.0,29.0,84.0,144.0,COMPLETE
8064,0.5928174679180234,2024-04-11 18:41:02.073624,2024-04-11 18:41:03.766024,0 days 00:00:01.692400,95.59504114568415,9.789277692600761,sigmoid,8,,26.0,33.0,,,,,,,,,,,,,COMPLETE
8065,0.5067497178574529,2024-04-11 18:41:03.768536,2024-04-11 18:41:05.905440,0 days 00:00:02.136904,96.67488262997529,8.60406812435169,sigmoid,35,44.0,,,,,,,,3.6976377577077866,1.5147323517897733,8.448828127645738,19.0,39.0,91.0,150.0,COMPLETE
8066,0.334395942763992,2024-04-11 18:41:05.908986,2024-04-11 18:41:07.793062,0 days 00:00:01.884076,98.02356850681602,7.269476119255467,sigmoid,9,,28.0,31.0,,,,,,,,,,,,64.0,COMPLETE
8067,0.37726754600227974,2024-04-11 18:41:07.796061,2024-04-11 18:41:10.566304,0 days 00:00:02.770243,99.9659553471688,3.186011602160735,rbf,57,24.0,25.0,29.0,4.0,6.0,31.0,,,,,,,,,10.0,COMPLETE
8068,0.5611209045042855,2024-04-11 18:41:10.569429,2024-04-11 18:41:11.942124,0 days 00:00:01.372695,17.805775900350035,8.237682227142916,sigmoid,0,,,,,,,,,,,,,,,,COMPLETE
8069,0.33898593659549836,2024-04-11 18:41:11.946124,2024-04-11 18:41:14.306864,0 days 00:00:02.360740,98.16518225365066,7.747247184303814,sigmoid,42,28.0,24.0,32.0,,,,,,5.444294990839646,2.532463862668363,4.044664735783275,6.0,44.0,55.0,,COMPLETE
8070,0.42002404451030284,2024-04-11 18:41:14.309385,2024-04-11 18:41:16.586321,0 days 00:00:02.276936,93.33792442145821,7.9782096228159265,sigmoid,28,,23.0,31.0,8.0,5.0,14.0,42.0,12.0,,,,,,,,COMPLETE
8071,0.44701971028259324,2024-04-11 18:41:16.588826,2024-04-11 18:41:18.197122,0 days 00:00:01.608296,95.40924860670019,7.540051971996477,sigmoid,8,,26.0,30.0,,,,,,,,,,,,,COMPLETE
8072,0.404246448884786,2024-04-11 18:41:18.199677,2024-04-11 18:41:20.645317,0 days 00:00:02.445640,64.2649803424516,8.448930609695925,sigmoid,15,,27.0,36.0,,,,11.0,9.0,8.420985320956152,2.9290925972776543,1.6456206400330555,4.0,22.0,93.0,57.0,COMPLETE
8073,0.509968720899692,2024-04-11 18:41:20.648823,2024-04-11 18:41:23.044613,0 days 00:00:02.395790,98.18255097372128,8.150854893096252,sigmoid,14,,25.0,32.0,,,,4.0,4.0,2.927759641581199,6.251772028689505,1.9528025564882845,5.0,27.0,98.0,,COMPLETE
8074,0.4387681810019752,2024-04-11 18:41:23.047608,2024-04-11 18:41:24.672335,0 days 00:00:01.624727,96.89725146502941,7.8012641993734775,sigmoid,16,,,,1.0,2.0,92.0,,,,,,,,,,COMPLETE
8075,0.45345352376492626,2024-04-11 18:41:24.675329,2024-04-11 18:41:26.347766,0 days 00:00:01.672437,99.95746178331085,8.307950620802377,sigmoid,8,,25.0,30.0,,,,,,,,,,,,,COMPLETE
8076,0.5410714667008307,2024-04-11 18:41:26.351847,2024-04-11 18:41:28.286481,0 days 00:00:01.934634,98.14579396013667,7.9748569863427425,sigmoid,3,,,,,,,,,4.158688139057054,1.8160915294145963,6.497287959837262,11.0,40.0,76.0,178.0,COMPLETE
8077,0.5963245096172158,2024-04-11 18:41:28.288993,2024-04-11 18:41:29.791005,0 days 00:00:01.502012,96.68990675881045,8.737579008905438,sigmoid,8,,27.0,31.0,,,,,,,,,,,,,COMPLETE
8078,0.3952091962880903,2024-04-11 18:41:29.793001,2024-04-11 18:41:32.299523,0 days 00:00:02.506522,93.95826053659404,8.154934336386333,sigmoid,46,31.0,22.0,34.0,,,,46.0,34.0,0.7992354572058602,5.642322580688768,3.3691853335777777,16.0,37.0,57.0,,COMPLETE
8079,0.3349525792273884,2024-04-11 18:41:32.303547,2024-04-11 18:41:34.182684,0 days 00:00:01.879137,98.25476240197338,7.677207374550983,sigmoid,41,50.0,24.0,29.0,,,,,,,,,,,,134.0,COMPLETE
8080,0.5955035642478522,2024-04-11 18:41:34.186680,2024-04-11 18:41:35.927194,0 days 00:00:01.740514,95.25959223035508,8.504238227828077,sigmoid,8,,31.0,41.0,,,,,,,,,,,,,COMPLETE
8081,0.4641754330873501,2024-04-11 18:41:35.931731,2024-04-11 18:41:38.677375,0 days 00:00:02.745644,91.94860630118573,7.880602389196003,sigmoid,62,15.0,29.0,33.0,5.0,3.0,81.0,8.0,41.0,7.2396117501079695,3.276740755295788,7.609214026926483,17.0,24.0,72.0,,COMPLETE
8082,0.4950883619151821,2024-04-11 18:41:38.680900,2024-04-11 18:41:41.077555,0 days 00:00:02.396655,98.16680529311066,8.297343078130218,sigmoid,11,,26.0,35.0,,,,,,8.828437886555644,3.953522167128077,4.653062501494491,15.0,46.0,79.0,73.0,COMPLETE
8083,0.47518554046549205,2024-04-11 18:41:41.080072,2024-04-11 18:41:44.091741,0 days 00:00:03.011669,32.08958962025969,7.387735248981386,sigmoid,63,43.0,24.0,32.0,6.0,1.0,22.0,49.0,8.0,4.826920689815138,7.301312763072944,9.230823214674995,7.0,21.0,100.0,191.0,COMPLETE
8084,0.3713727405959941,2024-04-11 18:41:44.095736,2024-04-11 18:41:46.905744,0 days 00:00:02.810008,95.45843359779185,7.025828844967493,rbf,2,,,,,,,,,0.9387226559688893,4.6448339213870735,7.922563771248075,2.0,43.0,65.0,,COMPLETE
8085,0.6009432182607054,2024-04-11 18:41:46.909313,2024-04-11 18:41:48.716201,0 days 00:00:01.806888,99.97934299401204,8.082418734246085,sigmoid,8,,23.0,31.0,,,,,,,,,,,,,COMPLETE
8086,0.594268224819143,2024-04-11 18:41:48.719696,2024-04-11 18:41:50.433264,0 days 00:00:01.713568,96.73349581433443,7.837791353623062,sigmoid,8,,25.0,27.0,,,,,,,,,,,,,COMPLETE
8087,0.3977172154911954,2024-04-11 18:41:50.437270,2024-04-11 18:41:52.459312,0 days 00:00:02.022042,52.852139376964054,8.039699341203518,sigmoid,56,6.0,26.0,29.0,3.0,4.0,28.0,,,,,,,,,,COMPLETE
8088,0.5300656249331994,2024-04-11 18:41:52.462336,2024-04-11 18:41:54.668311,0 days 00:00:02.205975,96.66631389620319,8.35218077765783,sigmoid,10,,28.0,30.0,,,,,,2.3074278483231185,5.4453831519915274,2.951542307658948,3.0,26.0,97.0,,COMPLETE
8089,0.5280733790903176,2024-04-11 18:41:54.672753,2024-04-11 18:41:56.604716,0 days 00:00:01.931963,98.07221500010598,7.575057685809848,sigmoid,20,,,,2.0,7.0,36.0,30.0,17.0,,,,,,,,COMPLETE
8090,0.34224558484286954,2024-04-11 18:41:56.607714,2024-04-11 18:41:58.451824,0 days 00:00:01.844110,94.02625167671097,8.188069645014785,sigmoid,37,48.0,,,,,,28.0,14.0,,,,,,,85.0,COMPLETE
8091,0.5963643249384587,2024-04-11 18:41:58.454821,2024-04-11 18:42:00.073007,0 days 00:00:01.618186,99.98880333397513,8.574614480703591,sigmoid,8,,26.0,32.0,,,,,,,,,,,,,COMPLETE
8092,0.3870702418160881,2024-04-11 18:42:00.076005,2024-04-11 18:42:02.046398,0 days 00:00:01.970393,98.03896793110404,7.854361483207392,sigmoid,52,13.0,,,8.0,5.0,77.0,21.0,29.0,,,,,,,,COMPLETE
8093,0.37909480642733245,2024-04-11 18:42:02.050912,2024-04-11 18:42:04.605146,0 days 00:00:02.554234,99.96286474650043,8.021388398386891,sigmoid,26,,24.0,10.0,7.0,6.0,70.0,,,5.942900676224614,2.1869090935155295,2.3817979731697885,12.0,38.0,71.0,,COMPLETE
8094,0.5986044733320588,2024-04-11 18:42:04.608143,2024-04-11 18:42:06.339076,0 days 00:00:01.730933,96.67346142243952,8.925851642935692,sigmoid,8,,21.0,31.0,,,,,,,,,,,,,COMPLETE
8095,0.5917506177532789,2024-04-11 18:42:06.341598,2024-04-11 18:42:08.072313,0 days 00:00:01.730715,94.9837613134254,4.804172035118114,sigmoid,8,,27.0,33.0,,,,,,,,,,,,,COMPLETE
8096,0.5107625672660454,2024-04-11 18:42:08.076313,2024-04-11 18:42:09.820166,0 days 00:00:01.743853,98.04725912692648,7.700003331543544,sigmoid,48,25.0,,,4.0,1.0,87.0,,,,,,,,,,COMPLETE
8097,0.3467307622799725,2024-04-11 18:42:09.823093,2024-04-11 18:42:11.722980,0 days 00:00:01.899887,84.50440232849168,8.324803291990461,sigmoid,44,34.0,25.0,26.0,,,,16.0,39.0,,,,,,,,COMPLETE
8098,0.53299118692552,2024-04-11 18:42:11.725980,2024-04-11 18:42:13.682394,0 days 00:00:01.956414,98.20083746043959,8.136597244348852,sigmoid,13,,23.0,39.0,,,,44.0,43.0,,,,,,,44.0,COMPLETE
8099,0.40561420062511055,2024-04-11 18:42:13.685395,2024-04-11 18:42:16.288381,0 days 00:00:02.602986,99.94314330165095,8.487879840103137,sigmoid,55,10.0,,,1.0,2.0,41.0,26.0,35.0,1.698179209784557,6.858194207430939,4.940659658897272,20.0,49.0,53.0,166.0,COMPLETE
8100,0.518183851487363,2024-04-11 18:42:16.290882,2024-04-11 18:42:18.093083,0 days 00:00:01.802201,95.4967582250348,7.924390494807177,sigmoid,12,,27.0,30.0,,,,7.0,7.0,,,,,,,,COMPLETE
8101,0.45347172512526845,2024-04-11 18:42:18.096081,2024-04-11 18:42:19.836871,0 days 00:00:01.740790,92.80565418036203,7.481264454345663,sigmoid,8,,24.0,28.0,,,,,,,,,,,,,COMPLETE
8102,0.42933897287874023,2024-04-11 18:42:19.840469,2024-04-11 18:42:22.184976,0 days 00:00:02.344507,96.59252487527641,8.231187237062134,sigmoid,60,20.0,25.0,32.0,6.0,8.0,18.0,6.0,21.0,,,,,,,,COMPLETE
8103,0.49381185049232373,2024-04-11 18:42:22.186969,2024-04-11 18:42:24.958556,0 days 00:00:02.771587,98.24632123644763,7.723810413697462,sigmoid,59,32.0,26.0,31.0,2.0,6.0,53.0,,,4.424092027791218,6.030520633475478,6.781954228771045,8.0,20.0,73.0,104.0,COMPLETE
8104,0.4781747223056139,2024-04-11 18:42:24.964070,2024-04-11 18:42:27.329622,0 days 00:00:02.365552,98.19348237622519,8.006981042066313,rbf,8,,24.0,30.0,,,,,,,,,,,,,COMPLETE
8105,0.5986580986580987,2024-04-11 18:42:27.334174,2024-04-11 18:42:29.056928,0 days 00:00:01.722754,60.6137417235475,8.426008461928538,sigmoid,8,,28.0,31.0,,,,,,,,,,,,,COMPLETE
8106,0.42510882159521507,2024-04-11 18:42:29.058928,2024-04-11 18:42:31.497267,0 days 00:00:02.438339,91.05351041506516,8.1453307894185,sigmoid,23,,,,8.0,7.0,57.0,34.0,31.0,6.996221424836983,8.663691432829296,7.327409554654187,13.0,32.0,54.0,196.0,COMPLETE
8107,0.12622036262203626,2024-04-11 18:42:31.500835,2024-04-11 18:42:33.116586,0 days 00:00:01.615751,99.99568681333223,7.876379259551273,sigmoid,8,,26.0,29.0,,,,,,,,,,,,,COMPLETE
8108,0.40549389949679454,2024-04-11 18:42:33.119585,2024-04-11 18:42:35.702993,0 days 00:00:02.583408,95.3771421127303,8.662437352464204,sigmoid,54,4.0,,,4.0,3.0,83.0,41.0,27.0,9.48182940649967,9.043743725303571,5.959006654474165,4.0,30.0,89.0,,COMPLETE
8109,0.4412948330053168,2024-04-11 18:42:35.705993,2024-04-11 18:42:37.358939,0 days 00:00:01.652946,96.72926630131387,8.285490051577876,sigmoid,36,41.0,,,,,,37.0,49.0,,,,,,,,COMPLETE
8110,0.5895095625828441,2024-04-11 18:42:37.361393,2024-04-11 18:42:38.844915,0 days 00:00:01.483522,93.72938398387382,7.602983156545408,sigmoid,1,,,,,,,,,,,,,,,34.0,COMPLETE
8111,0.5792947936935136,2024-04-11 18:42:38.847908,2024-04-11 18:42:40.360734,0 days 00:00:01.512826,98.10403033930804,8.018870444601777,sigmoid,32,16.0,,,,,,,,,,,,,,,COMPLETE
8112,0.5929369437606513,2024-04-11 18:42:40.365277,2024-04-11 18:42:41.959110,0 days 00:00:01.593833,98.35200566125725,7.767162704547474,sigmoid,8,,22.0,33.0,,,,,,,,,,,,,COMPLETE
8113,0.46985613430699436,2024-04-11 18:42:41.961611,2024-04-11 18:42:44.814901,0 days 00:00:02.853290,96.58694073465271,7.187120270958178,sigmoid,30,,25.0,18.0,5.0,4.0,65.0,15.0,16.0,6.52069116799495,7.112914526373449,5.273122186848188,11.0,48.0,69.0,,COMPLETE
8114,0.5963643249384587,2024-04-11 18:42:44.818898,2024-04-11 18:42:46.466208,0 days 00:00:01.647310,99.98013902061909,8.378190088349308,sigmoid,8,,23.0,32.0,,,,,,,,,,,,,COMPLETE
8115,0.4019797582410609,2024-04-11 18:42:46.469166,2024-04-11 18:42:48.903850,0 days 00:00:02.434684,95.08740924693804,8.099314436998487,sigmoid,61,29.0,27.0,31.0,3.0,8.0,46.0,39.0,37.0,,,,,,,130.0,COMPLETE
8116,0.5332042757343657,2024-04-11 18:42:48.906852,2024-04-11 18:42:50.539427,0 days 00:00:01.632575,98.18031989493252,7.857792223010352,sigmoid,33,30.0,,,,,,,,,,,,,,70.0,COMPLETE
8117,0.4787963958006117,2024-04-11 18:42:50.544956,2024-04-11 18:42:52.358016,0 days 00:00:01.813060,98.17519374660674,8.236968495783556,sigmoid,40,37.0,25.0,34.0,,,,,,,,,,,,,COMPLETE
8118,0.502407078110769,2024-04-11 18:42:52.361521,2024-04-11 18:42:54.672340,0 days 00:00:02.310819,99.98832197536588,7.399930592429176,sigmoid,7,,,,,,,10.0,22.0,5.695033675355108,4.8435389602011805,1.1274451978040725,6.0,47.0,78.0,161.0,COMPLETE
8119,0.44081587468519084,2024-04-11 18:42:54.675348,2024-04-11 18:42:57.471260,0 days 00:00:02.795912,96.45895292801161,8.511122876870035,sigmoid,27,,29.0,30.0,7.0,5.0,90.0,,,3.400861244735777,5.136838380313007,9.488951380773138,13.0,42.0,50.0,50.0,COMPLETE
8120,0.324348540282237,2024-04-11 18:42:57.473268,2024-04-11 18:42:59.185500,0 days 00:00:01.712232,93.31478664235432,8.012787569405086,sigmoid,5,,,,,,,22.0,3.0,,,,,,,60.0,COMPLETE
8121,0.5952371952371952,2024-04-11 18:42:59.188500,2024-04-11 18:43:00.851947,0 days 00:00:01.663447,99.94169702491492,7.660738886865078,sigmoid,8,,39.0,32.0,,,,,,,,,,,,,COMPLETE
8122,0.44230403046651856,2024-04-11 18:43:00.855953,2024-04-11 18:43:03.271315,0 days 00:00:02.415362,99.98968335253885,8.766511299923668,rbf,8,,26.0,33.0,,,,,,,,,,,,,COMPLETE
8123,0.42201318539958194,2024-04-11 18:43:03.274269,2024-04-11 18:43:05.732163,0 days 00:00:02.457894,99.97358383216377,8.239004652070106,sigmoid,19,,,,6.0,3.0,95.0,,,8.12209544903986,1.2679205993755551,5.579579869154339,16.0,37.0,62.0,28.0,COMPLETE
8124,0.48158092059115204,2024-04-11 18:43:05.735175,2024-04-11 18:43:08.013180,0 days 00:00:02.278005,96.87306097087954,4.068984884259324,sigmoid,45,18.0,24.0,30.0,,,,27.0,32.0,,,,,,,81.0,COMPLETE
8125,0.3845399575093969,2024-04-11 18:43:08.016306,2024-04-11 18:43:10.681764,0 days 00:00:02.665458,95.32621006573893,7.909436920473804,sigmoid,51,46.0,,,1.0,2.0,39.0,,,6.733908977087604,0.7089880791324106,4.494663916527474,18.0,33.0,67.0,153.0,COMPLETE
8126,0.5149252170275075,2024-04-11 18:43:10.684313,2024-04-11 18:43:12.318450,0 days 00:00:01.634137,96.80296204921792,8.147472341540322,sigmoid,4,,,,,,,18.0,44.0,,,,,,,,COMPLETE
8127,0.12622036262203626,2024-04-11 18:43:12.322965,2024-04-11 18:43:13.966797,0 days 00:00:01.643832,98.23057520561714,8.413201543861463,sigmoid,8,,27.0,29.0,,,,,,,,,,,,,COMPLETE
8128,0.2663891341827509,2024-04-11 18:43:13.969798,2024-04-11 18:43:15.976249,0 days 00:00:02.006451,93.93983724900728,7.761710205690322,sigmoid,34,39.0,,,,,,,,8.626677486278467,8.008617946031977,9.991174270174362,14.0,45.0,99.0,,COMPLETE
8129,0.5952371952371952,2024-04-11 18:43:15.979250,2024-04-11 18:43:17.657567,0 days 00:00:01.678317,96.71875426164719,8.00799681003382,sigmoid,8,,23.0,32.0,,,,,,,,,,,,,COMPLETE
8130,0.48898411663328517,2024-04-11 18:43:17.660561,2024-04-11 18:43:19.505704,0 days 00:00:01.845143,99.99318047680508,7.578666998749307,sigmoid,17,,,,3.0,1.0,12.0,,,,,,,,,114.0,COMPLETE
8131,0.5986580986580987,2024-04-11 18:43:19.509704,2024-04-11 18:43:21.067983,0 days 00:00:01.558279,98.14885545423017,8.287414669996224,sigmoid,8,,28.0,31.0,,,,,,,,,,,,,COMPLETE
8132,0.4512950859356088,2024-04-11 18:43:21.070985,2024-04-11 18:43:22.676391,0 days 00:00:01.605406,99.96463012780279,8.608033037151129,sigmoid,8,,25.0,28.0,,,,,,,,,,,,,COMPLETE
8133,0.3888586298717018,2024-04-11 18:43:22.679383,2024-04-11 18:43:24.796868,0 days 00:00:02.117485,94.9645670296505,8.047614866562471,sigmoid,53,49.0,,,2.0,6.0,23.0,3.0,29.0,,,,,,,19.0,COMPLETE
8134,0.4804275568521485,2024-04-11 18:43:24.800869,2024-04-11 18:43:26.795507,0 days 00:00:01.994638,88.41988714964197,7.843042222658686,sigmoid,49,14.0,,,5.0,4.0,62.0,,,,,,,,,108.0,COMPLETE
8135,0.3245438244910875,2024-04-11 18:43:26.799022,2024-04-11 18:43:29.137220,0 days 00:00:02.338198,77.58891120122674,8.4071511082066,sigmoid,50,12.0,,,8.0,7.0,6.0,,,3.9893362136232042,7.476428288487094,7.023324246785876,9.0,25.0,82.0,,COMPLETE
8136,0.4951280718015961,2024-04-11 18:43:29.141217,2024-04-11 18:43:31.769553,0 days 00:00:02.628336,92.32275597032734,8.191963930998167,sigmoid,18,,,,7.0,8.0,98.0,,,7.495797916929178,4.263010729802834,3.8798861357978267,4.0,36.0,61.0,,COMPLETE
8137,0.4502698896972542,2024-04-11 18:43:31.775099,2024-04-11 18:43:34.118064,0 days 00:00:02.342965,99.981078975123,7.418167111494524,sigmoid,8,,26.0,30.0,,,,,,,,,,,,,COMPLETE
8138,0.47088252951771065,2024-04-11 18:43:34.121070,2024-04-11 18:43:36.850827,0 days 00:00:02.729757,96.74707969721725,7.958838918373717,sigmoid,58,2.0,24.0,31.0,3.0,5.0,73.0,,,9.162805135726694,9.508929430234158,3.0984887311693874,5.0,27.0,85.0,,COMPLETE
8139,0.36437804619622804,2024-04-11 18:43:36.854401,2024-04-11 18:43:38.973931,0 days 00:00:02.119530,96.88859171859998,7.707245536946017,sigmoid,39,45.0,,,,,,24.0,26.0,7.853641449694944,3.6449170341671997,4.234370091123414,19.0,29.0,64.0,182.0,COMPLETE
8140,0.38786140507038536,2024-04-11 18:43:38.976957,2024-04-11 18:43:41.063504,0 days 00:00:02.086547,99.98322905541927,8.137216870793278,sigmoid,43,23.0,27.0,32.0,,,,,,5.343294462770042,6.47327933376992,1.7463834240796898,8.0,35.0,70.0,200.0,COMPLETE
8141,0.4523620847302652,2024-04-11 18:43:41.066531,2024-04-11 18:43:43.066196,0 days 00:00:01.999665,98.17199113922491,8.52989847517296,rbf,8,,25.0,29.0,,,,,,,,,,,,,COMPLETE
8142,0.49737054057895475,2024-04-11 18:43:43.069172,2024-04-11 18:43:45.019055,0 days 00:00:01.949883,95.36973631038718,7.876851824042227,sigmoid,29,,26.0,33.0,4.0,4.0,35.0,12.0,24.0,,,,,,,173.0,COMPLETE
8143,0.16558411856188823,2024-04-11 18:43:45.022570,2024-04-11 18:43:46.881905,0 days 00:00:01.859335,94.0746712026653,8.304675960581005,sigmoid,6,,,,,,,17.0,47.0,6.333718184220591,2.7122267259022874,8.660122901558271,15.0,39.0,94.0,,COMPLETE
8144,0.4193750391383305,2024-04-11 18:43:46.885219,2024-04-11 18:43:49.068102,0 days 00:00:02.182883,98.12061970271797,5.537515046233899,sigmoid,22,,,,6.0,2.0,67.0,40.0,19.0,3.1477717055372274,7.8446776131635225,2.7685090894025075,12.0,49.0,83.0,,COMPLETE
8145,0.3703730770636167,2024-04-11 18:43:49.071099,2024-04-11 18:43:50.982970,0 days 00:00:01.911871,98.18178341074956,7.582534856902718,sigmoid,24,,22.0,30.0,1.0,3.0,29.0,,,,,,,,,,COMPLETE
8146,0.42226686540081654,2024-04-11 18:43:50.985563,2024-04-11 18:43:53.359086,0 days 00:00:02.373523,96.40777980968846,8.067965827280485,sigmoid,47,40.0,24.0,31.0,,,,32.0,18.0,1.4007505965572635,5.765014834688755,6.246030703434927,11.0,44.0,87.0,95.0,COMPLETE
8147,0.12622036262203626,2024-04-11 18:43:53.363626,2024-04-11 18:43:54.913014,0 days 00:00:01.549388,98.20602289112304,8.737485010766727,sigmoid,8,,25.0,29.0,,,,,,,,,,,,,COMPLETE
8148,0.5259003881263687,2024-04-11 18:43:54.916933,2024-04-11 18:43:57.032954,0 days 00:00:02.116021,95.15188670949698,9.023163487207942,sigmoid,35,42.0,,,,,,,,0.6350779386217269,9.822670818848046,9.761636668526705,17.0,41.0,81.0,123.0,COMPLETE
8149,0.5895095625828441,2024-04-11 18:43:57.037502,2024-04-11 18:43:58.670214,0 days 00:00:01.632712,98.13217883582706,7.827678170768274,sigmoid,8,,36.0,34.0,,,,,,,,,,,,,COMPLETE
8150,0.3131372621194832,2024-04-11 18:43:58.673213,2024-04-11 18:44:00.659683,0 days 00:00:01.986470,90.53501185908418,8.347376135663536,sigmoid,38,38.0,,,,,,30.0,20.0,4.999774776183637,8.522200547446364,2.0930670581164845,3.0,28.0,51.0,,COMPLETE
8151,0.41174965166206956,2024-04-11 18:44:00.663317,2024-04-11 18:44:02.763888,0 days 00:00:02.100571,96.64674895804389,8.10183682574671,sigmoid,57,27.0,23.0,21.0,4.0,1.0,26.0,,,,,,,,,41.0,COMPLETE
8152,0.4399683181296771,2024-04-11 18:44:02.766942,2024-04-11 18:44:05.333107,0 days 00:00:02.566165,92.48333644028448,7.901872094497875,sigmoid,31,,28.0,14.0,2.0,6.0,4.0,35.0,50.0,4.264287556630748,3.0635794647286727,4.77344044263274,2.0,46.0,74.0,188.0,COMPLETE
8153,0.48494404400606983,2024-04-11 18:44:05.335697,2024-04-11 18:44:07.548834,0 days 00:00:02.213137,98.18497597785921,8.512514777262398,sigmoid,15,,26.0,32.0,,,,14.0,13.0,9.983040253536354,6.74665236699596,0.5015847658270225,10.0,31.0,92.0,142.0,COMPLETE
8154,0.4390744541892144,2024-04-11 18:44:07.550837,2024-04-11 18:44:09.087459,0 days 00:00:01.536622,98.21625023174492,8.201734648507367,sigmoid,8,,11.0,8.0,,,,,,,,,,,,,COMPLETE
8155,0.4749636203153701,2024-04-11 18:44:09.089461,2024-04-11 18:44:10.899812,0 days 00:00:01.810351,95.3117728013652,7.728003790166035,sigmoid,21,,,,5.0,3.0,59.0,50.0,16.0,,,,,,,128.0,COMPLETE
8156,0.5101995400934649,2024-04-11 18:44:10.901808,2024-04-11 18:44:12.833750,0 days 00:00:01.931942,96.74681803205345,7.550192639258664,sigmoid,3,,,,,,,,,9.685537684485281,2.3959382694207862,8.355391865308608,6.0,40.0,79.0,24.0,COMPLETE
8157,0.5636462904171639,2024-04-11 18:44:12.836356,2024-04-11 18:44:13.978994,0 days 00:00:01.142638,26.563045462893726,7.233482751329693,sigmoid,0,,,,,,,,,,,,,,,,COMPLETE
8158,0.6009432182607054,2024-04-11 18:44:13.980994,2024-04-11 18:44:15.333514,0 days 00:00:01.352520,93.83381169147594,8.109842137587124,sigmoid,8,,27.0,31.0,,,,,,,,,,,,,COMPLETE
8159,0.48216102963184676,2024-04-11 18:44:15.336563,2024-04-11 18:44:17.426816,0 days 00:00:02.090253,98.28703044745625,7.9448219361566546,rbf,8,,25.0,30.0,,,,,,,,,,,,,COMPLETE
