number,value,datetime_start,datetime_complete,duration,params_C,params_gamma,params_kernel,params_mask_number,params_rsi_window,params_so_smooth,params_so_window,params_srsi_smooth1,params_srsi_smooth2,params_srsi_window,params_tsi_window_fast,params_tsi_window_slow,params_ult_weight_1,params_ult_weight_2,params_ult_weight_3,params_ult_window_1,params_ult_window_2,params_ult_window_3,params_williams_lbp,state
6617,0.4856579759699862,2024-04-11 17:55:16.614932,2024-04-11 17:55:18.961093,0 days 00:00:02.346161,96.64671938783002,7.765401808041192,sigmoid,45,40.0,26.0,31.0,,,,24.0,19.0,,,,,,,190.0,COMPLETE
6618,0.41214200955710206,2024-04-11 17:55:18.965098,2024-04-11 17:55:21.686702,0 days 00:00:02.721604,99.9774653239958,8.351313039914146,sigmoid,30,,28.0,30.0,8.0,2.0,24.0,43.0,50.0,6.21435557992918,1.2589079184071426,6.985156020435692,3.0,42.0,67.0,,COMPLETE
6619,0.18277443514116207,2024-04-11 17:55:21.689995,2024-04-11 17:55:23.637556,0 days 00:00:01.947561,93.9407221608869,6.9374413982352765,sigmoid,4,,,,,,,28.0,29.0,,,,,,,,COMPLETE
6620,0.31818022008930147,2024-04-11 17:55:23.641172,2024-04-11 17:55:25.228881,0 days 00:00:01.587709,98.33372097571157,8.093496039944052,sigmoid,33,2.0,,,,,,,,,,,,,,79.0,COMPLETE
6621,0.5276651824045047,2024-04-11 17:55:25.231844,2024-04-11 17:55:27.177195,0 days 00:00:01.945351,98.18950815896908,8.692115597309684,sigmoid,5,,,,,,,4.0,39.0,,,,,,,99.0,COMPLETE
6622,0.5952371952371952,2024-04-11 17:55:27.181776,2024-04-11 17:55:28.776700,0 days 00:00:01.594924,96.47043476438016,7.960525180930311,sigmoid,8,,25.0,32.0,,,,,,,,,,,,,COMPLETE
6623,0.12622036262203626,2024-04-11 17:55:28.779254,2024-04-11 17:55:30.533750,0 days 00:00:01.754496,27.14399126990784,8.242606506794838,sigmoid,8,,15.0,29.0,,,,,,,,,,,,,COMPLETE
6624,0.4901974882561596,2024-04-11 17:55:30.536744,2024-04-11 17:55:33.345967,0 days 00:00:02.809223,99.96429025449166,7.571126149768164,sigmoid,27,,30.0,31.0,5.0,4.0,21.0,,,3.5461796718853416,7.495902162907211,5.704984121193752,6.0,32.0,75.0,14.0,COMPLETE
6625,0.4923675277084598,2024-04-11 17:55:33.349463,2024-04-11 17:55:34.895280,0 days 00:00:01.545817,96.87259300213157,8.466852809950957,sigmoid,1,,,,,,,,,,,,,,,92.0,COMPLETE
6626,0.5124798536394128,2024-04-11 17:55:34.899862,2024-04-11 17:55:37.275314,0 days 00:00:02.375452,99.96101662507229,7.848437392498256,sigmoid,17,,,,7.0,2.0,47.0,,,,,,,,,171.0,COMPLETE
6627,0.5929369437606513,2024-04-11 17:55:37.279812,2024-04-11 17:55:39.194474,0 days 00:00:01.914662,99.94470180484349,8.168094738768342,sigmoid,8,,23.0,33.0,,,,,,,,,,,,,COMPLETE
6628,0.559587003441638,2024-04-11 17:55:39.199019,2024-04-11 17:55:41.135147,0 days 00:00:01.936128,99.97932466761691,7.985291212067997,sigmoid,8,,27.0,47.0,,,,,,,,,,,,,COMPLETE
6629,0.5690940144398726,2024-04-11 17:55:41.138136,2024-04-11 17:55:43.425497,0 days 00:00:02.287361,88.76696289146281,7.354151511093296,sigmoid,6,,,,,,,45.0,31.0,6.56257463329441,2.5127807966809548,9.05395984422678,2.0,49.0,73.0,,COMPLETE
6630,0.4312508657708824,2024-04-11 17:55:43.429295,2024-04-11 17:55:45.562904,0 days 00:00:02.133609,93.55737857652936,7.794890293643839,sigmoid,53,18.0,,,2.0,7.0,77.0,11.0,37.0,,,,,,,44.0,COMPLETE
6631,0.27092519923945146,2024-04-11 17:55:45.565886,2024-04-11 17:55:48.457949,0 days 00:00:02.892063,99.98376725890733,6.271279975720487,rbf,58,37.0,26.0,28.0,4.0,5.0,55.0,,,9.403586250383647,9.795319633708718,1.8265373601901014,18.0,24.0,93.0,,COMPLETE
6632,0.45345352376492626,2024-04-11 17:55:48.462544,2024-04-11 17:55:50.300148,0 days 00:00:01.837604,96.69862343738242,8.342636263241609,sigmoid,8,,25.0,30.0,,,,,,,,,,,,,COMPLETE
6633,0.44167107661551125,2024-04-11 17:55:50.303174,2024-04-11 17:55:53.179874,0 days 00:00:02.876700,99.98864253555858,7.673774052982187,sigmoid,29,,24.0,31.0,1.0,1.0,81.0,21.0,11.0,,,,,,,134.0,COMPLETE
6634,0.36602001645187815,2024-04-11 17:55:53.182844,2024-04-11 17:55:55.455191,0 days 00:00:02.272347,94.92676045920886,8.831143630840891,sigmoid,39,23.0,,,,,,30.0,6.0,5.403342492498422,5.672979264856917,1.3528110117825136,14.0,23.0,83.0,146.0,COMPLETE
6635,0.3964082347787998,2024-04-11 17:55:55.458192,2024-04-11 17:55:57.451648,0 days 00:00:01.993456,99.989946117419,8.150424272599464,sigmoid,49,32.0,,,3.0,8.0,45.0,,,,,,,,,57.0,COMPLETE
6636,0.4475195405965864,2024-04-11 17:55:57.455642,2024-04-11 17:55:59.788656,0 days 00:00:02.333014,96.78939688842941,8.444776253719814,sigmoid,19,,,,6.0,4.0,86.0,,,7.694225854709931,9.015565295176302,5.218915844415809,16.0,47.0,63.0,155.0,COMPLETE
6637,0.40613313388182504,2024-04-11 17:55:59.792234,2024-04-11 17:56:02.326715,0 days 00:00:02.534481,96.7830689756193,7.985239261168478,sigmoid,43,16.0,22.0,33.0,,,,,,4.254725106965247,2.026293831592141,3.6496159411485665,12.0,21.0,90.0,181.0,COMPLETE
6638,0.3871066300030553,2024-04-11 17:56:02.331438,2024-04-11 17:56:04.834841,0 days 00:00:02.503403,98.10670628624683,8.227028888282032,sigmoid,50,7.0,,,5.0,7.0,69.0,,,3.089744984931545,3.3744991063022423,3.200941908665235,6.0,29.0,100.0,,COMPLETE
6639,0.5041187716855099,2024-04-11 17:56:04.837814,2024-04-11 17:56:07.276221,0 days 00:00:02.438407,94.24538020796862,7.819458464146293,sigmoid,18,,,,2.0,3.0,4.0,,,8.129107702908883,6.901742740692984,2.2113063078963595,19.0,26.0,51.0,,COMPLETE
6640,0.46953750370589975,2024-04-11 17:56:07.279844,2024-04-11 17:56:09.536755,0 days 00:00:02.256911,99.95838240003722,8.583351386654442,sigmoid,25,,27.0,29.0,4.0,8.0,43.0,,,,,,,,,141.0,COMPLETE
6641,0.5952371952371952,2024-04-11 17:56:09.541359,2024-04-11 17:56:11.321640,0 days 00:00:01.780281,91.85399052850457,8.052832713351384,sigmoid,8,,25.0,32.0,,,,,,,,,,,,,COMPLETE
6642,0.35556428641587273,2024-04-11 17:56:11.325625,2024-04-11 17:56:13.798204,0 days 00:00:02.472579,98.24396024499555,7.565456513185648,sigmoid,22,,,,8.0,6.0,33.0,5.0,40.0,8.80552997622955,8.70308396843063,9.396492664717536,15.0,33.0,85.0,,COMPLETE
6643,0.44820643369590374,2024-04-11 17:56:13.801782,2024-04-11 17:56:15.600775,0 days 00:00:01.798993,95.33262611081655,3.078308684830227,sigmoid,8,,26.0,30.0,,,,,,,,,,,,,COMPLETE
6644,0.5210888493586744,2024-04-11 17:56:15.603811,2024-04-11 17:56:18.048550,0 days 00:00:02.444739,97.00744924730999,8.297713525772533,sigmoid,24,,28.0,18.0,7.0,3.0,39.0,,,,,,,,,,COMPLETE
6645,0.2592672975084643,2024-04-11 17:56:18.052135,2024-04-11 17:56:20.643061,0 days 00:00:02.590926,66.91974580859826,7.964023046557392,rbf,21,,,,2.0,5.0,15.0,35.0,35.0,,,,,,,116.0,COMPLETE
6646,0.5952371952371952,2024-04-11 17:56:20.647055,2024-04-11 17:56:22.386897,0 days 00:00:01.739842,98.27669345412075,7.735468523829922,sigmoid,8,,24.0,32.0,,,,,,,,,,,,,COMPLETE
6647,0.5115325006837451,2024-04-11 17:56:22.390587,2024-04-11 17:56:24.445319,0 days 00:00:02.054732,98.16344779796468,8.148056661214424,sigmoid,35,24.0,,,,,,,,1.2753455567431855,8.338394389092896,7.98021733677399,3.0,41.0,81.0,150.0,COMPLETE
6648,0.5974957313602731,2024-04-11 17:56:24.448317,2024-04-11 17:56:26.048825,0 days 00:00:01.600508,95.33826956693292,8.45607887135959,sigmoid,8,,23.0,31.0,,,,,,,,,,,,,COMPLETE
6649,0.46688415143008877,2024-04-11 17:56:26.051358,2024-04-11 17:56:28.780568,0 days 00:00:02.729210,91.0379721370066,7.871112394493488,sigmoid,47,47.0,26.0,31.0,,,,39.0,48.0,9.71375974927252,7.986817704037899,2.8348980537761546,16.0,45.0,78.0,87.0,COMPLETE
6650,0.3995081036766097,2024-04-11 17:56:28.783602,2024-04-11 17:56:31.872433,0 days 00:00:03.088831,42.77833148801302,8.136343414246376,sigmoid,57,39.0,25.0,29.0,1.0,2.0,75.0,,,,,,,,,162.0,COMPLETE
6651,0.5883953883953884,2024-04-11 17:56:31.875430,2024-04-11 17:56:33.555321,0 days 00:00:01.679891,96.77236535221881,7.321154978297717,sigmoid,8,,24.0,34.0,,,,,,,,,,,,,COMPLETE
6652,0.328319854886252,2024-04-11 17:56:33.559713,2024-04-11 17:56:35.893277,0 days 00:00:02.333564,99.99136221005048,8.33342593669635,sigmoid,38,30.0,,,,,,49.0,18.0,7.2537480792054545,1.6693538856176158,7.479973892038378,17.0,36.0,87.0,,COMPLETE
6653,0.4891528029157266,2024-04-11 17:56:35.897276,2024-04-11 17:56:38.279119,0 days 00:00:02.381843,93.89199100733461,7.555259840001538,sigmoid,15,,29.0,33.0,,,,9.0,2.0,2.147954778590636,5.395167243081334,4.531510768084737,11.0,28.0,60.0,195.0,COMPLETE
6654,0.5041318509311051,2024-04-11 17:56:38.283687,2024-04-11 17:56:39.937117,0 days 00:00:01.653430,98.2193729284526,8.698582592825588,sigmoid,9,,27.0,30.0,,,,,,,,,,,,74.0,COMPLETE
6655,0.5120950629509124,2024-04-11 17:56:39.940117,2024-04-11 17:56:42.745515,0 days 00:00:02.805398,96.62858145295023,7.9904583155730755,sigmoid,31,,26.0,28.0,6.0,4.0,52.0,37.0,25.0,9.187339051762406,3.80547697554331,7.72843716379587,8.0,34.0,76.0,186.0,COMPLETE
6656,0.5130218618590712,2024-04-11 17:56:42.749510,2024-04-11 17:56:45.142618,0 days 00:00:02.393108,98.16478454485315,7.752976847179806,sigmoid,42,34.0,23.0,32.0,,,,,,8.34760092196359,4.816992679147922,6.001080583683244,9.0,39.0,72.0,,COMPLETE
6657,0.45345352376492626,2024-04-11 17:56:45.145607,2024-04-11 17:56:46.722065,0 days 00:00:01.576458,96.81520666754501,8.28034796950491,sigmoid,8,,25.0,30.0,,,,,,,,,,,,,COMPLETE
6658,0.40498735326545177,2024-04-11 17:56:46.726077,2024-04-11 17:56:48.339430,0 days 00:00:01.613353,99.95682831276554,8.084060514521417,sigmoid,16,,,,3.0,7.0,58.0,,,,,,,,,,COMPLETE
6659,0.3521633029943279,2024-04-11 17:56:48.342958,2024-04-11 17:56:50.878459,0 days 00:00:02.535501,94.80888265129916,8.524130764993478,sigmoid,14,,24.0,32.0,,,,16.0,32.0,2.5606532066802616,3.517623789851046,4.974296360051492,20.0,37.0,67.0,,COMPLETE
6660,0.5069140556625241,2024-04-11 17:56:50.881995,2024-04-11 17:56:52.721057,0 days 00:00:01.839062,98.14913730377145,7.8772174773472114,sigmoid,8,,22.0,35.0,,,,,,,,,,,,,COMPLETE
6661,0.334395942763992,2024-04-11 17:56:52.725644,2024-04-11 17:56:54.642272,0 days 00:00:01.916628,95.62798474267652,8.217795964183816,sigmoid,3,,,,,,,,,4.52415674680314,2.9885001161117386,8.62335484845312,5.0,43.0,55.0,63.0,COMPLETE
6662,0.46804398715226736,2024-04-11 17:56:54.645792,2024-04-11 17:56:57.416874,0 days 00:00:02.771082,99.94865235015077,7.709174416408216,sigmoid,63,43.0,27.0,31.0,7.0,1.0,66.0,31.0,4.0,0.6366224225250603,5.842308712815932,8.34709980738955,12.0,31.0,57.0,107.0,COMPLETE
6663,0.6009432182607054,2024-04-11 17:56:57.419890,2024-04-11 17:56:58.964274,0 days 00:00:01.544384,51.353057710796975,8.014514173939887,sigmoid,8,,28.0,31.0,,,,,,,,,,,,,COMPLETE
6664,0.5025799116708207,2024-04-11 17:56:58.967275,2024-04-11 17:57:00.779548,0 days 00:00:01.812273,93.17669618565948,8.417264981112709,sigmoid,41,21.0,26.0,29.0,,,,,,,,,,,,119.0,COMPLETE
6665,0.27703250202574947,2024-04-11 17:57:00.782902,2024-04-11 17:57:03.312901,0 days 00:00:02.529999,96.46514696468277,7.47875597406054,rbf,28,,42.0,33.0,5.0,5.0,97.0,2.0,20.0,,,,,,,,COMPLETE
6666,0.49518694903232335,2024-04-11 17:57:03.315900,2024-04-11 17:57:06.530315,0 days 00:00:03.214415,98.4017462064751,8.951379084664154,sigmoid,62,38.0,24.0,30.0,8.0,6.0,72.0,8.0,13.0,5.139641991255132,4.096262185879896,6.804635078161882,7.0,42.0,74.0,,COMPLETE
6667,0.36146403608442645,2024-04-11 17:57:06.533853,2024-04-11 17:57:08.905933,0 days 00:00:02.372080,98.21728991362973,7.903040266354823,sigmoid,46,41.0,25.0,32.0,,,,14.0,46.0,6.0786830021439116,9.437931175984446,6.329698358587471,4.0,30.0,80.0,,COMPLETE
6668,0.5964426137427449,2024-04-11 17:57:08.909928,2024-04-11 17:57:10.575867,0 days 00:00:01.665939,95.53611769459333,4.393950170877227,sigmoid,8,,26.0,31.0,,,,,,,,,,,,,COMPLETE
6669,0.3234581629005997,2024-04-11 17:57:10.578867,2024-04-11 17:57:12.613560,0 days 00:00:02.034693,99.9436320161447,8.16294453353556,sigmoid,10,,23.0,30.0,,,,,,3.8530561330651403,7.685536971051115,7.23187380122332,13.0,22.0,99.0,,COMPLETE
6670,0.5222063199981825,2024-04-11 17:57:12.616556,2024-04-11 17:57:14.754792,0 days 00:00:02.138236,98.15495388319212,8.621379259275516,sigmoid,11,,27.0,33.0,,,,,,0.8730886992638327,6.609586466442863,9.751105281702921,18.0,48.0,50.0,127.0,COMPLETE
6671,0.5493750395211096,2024-04-11 17:57:14.757781,2024-04-11 17:57:16.702427,0 days 00:00:01.944646,99.98775909546684,7.6589352015170915,sigmoid,2,,,,,,,,,7.832166921125356,5.191150809044921,4.249947742214482,10.0,35.0,70.0,,COMPLETE
6672,0.5986580986580987,2024-04-11 17:57:16.705451,2024-04-11 17:57:18.630648,0 days 00:00:01.925197,96.73467985403944,8.29520616577978,sigmoid,8,,25.0,31.0,,,,,,,,,,,,,COMPLETE
6673,0.34491719215577576,2024-04-11 17:57:18.634190,2024-04-11 17:57:21.222298,0 days 00:00:02.588108,93.15204605435922,8.05113406227104,sigmoid,26,,28.0,29.0,4.0,8.0,25.0,,,1.5701353006348255,1.0846898350576346,4.76672261951083,5.0,40.0,96.0,,COMPLETE
6674,0.5952371952371952,2024-04-11 17:57:21.226273,2024-04-11 17:57:23.165930,0 days 00:00:01.939657,95.10885917304117,7.837211069660889,sigmoid,8,,24.0,32.0,,,,,,,,,,,,,COMPLETE
6675,0.4453466199175739,2024-04-11 17:57:23.169910,2024-04-11 17:57:25.237750,0 days 00:00:02.067840,99.99857676461095,8.388764686921602,sigmoid,56,19.0,25.0,27.0,6.0,3.0,91.0,,,,,,,,,,COMPLETE
6676,0.44701971028259324,2024-04-11 17:57:25.240742,2024-04-11 17:57:27.002178,0 days 00:00:01.761436,98.15431031831429,8.063762018585178,sigmoid,8,,22.0,30.0,,,,,,,,,,,,,COMPLETE
6677,0.5287897617023132,2024-04-11 17:57:27.006150,2024-04-11 17:57:28.804032,0 days 00:00:01.797882,99.96910908133263,8.220171430242736,sigmoid,20,,,,1.0,2.0,10.0,40.0,16.0,,,,,,,,COMPLETE
6678,0.5895095625828441,2024-04-11 17:57:28.807026,2024-04-11 17:57:30.641217,0 days 00:00:01.834191,96.6815580720706,7.875945097457534,sigmoid,8,,27.0,34.0,,,,,,,,,,,,,COMPLETE
6679,0.3228798744157836,2024-04-11 17:57:30.643791,2024-04-11 17:57:32.866444,0 days 00:00:02.222653,98.15615019625781,7.621503380174003,sigmoid,37,12.0,,,,,,18.0,27.0,,,,,,,24.0,COMPLETE
6680,0.5126187928755742,2024-04-11 17:57:32.870048,2024-04-11 17:57:35.137806,0 days 00:00:02.267758,95.07445522226928,7.1666307622005565,sigmoid,52,50.0,,,4.0,4.0,12.0,13.0,42.0,,,,,,,,COMPLETE
6681,0.45022721836881124,2024-04-11 17:57:35.142431,2024-04-11 17:57:36.925038,0 days 00:00:01.782607,92.17621572924314,8.473270060759809,sigmoid,8,,26.0,28.0,,,,,,,,,,,,,COMPLETE
6682,0.3907775593722811,2024-04-11 17:57:36.929021,2024-04-11 17:57:39.794052,0 days 00:00:02.865031,96.60642172879405,8.082333012765057,sigmoid,55,9.0,,,8.0,1.0,30.0,22.0,23.0,9.85690591070741,8.18540166008857,3.014966358497851,2.0,33.0,77.0,178.0,COMPLETE
6683,0.334395942763992,2024-04-11 17:57:39.798072,2024-04-11 17:57:41.853888,0 days 00:00:02.055816,99.96331992423929,7.409398878217126,sigmoid,44,48.0,23.0,31.0,,,,42.0,22.0,,,,,,,,COMPLETE
6684,0.3271044927169552,2024-04-11 17:57:41.859862,2024-04-11 17:57:43.906379,0 days 00:00:02.046517,96.88950645859207,7.91993987284301,sigmoid,13,,25.0,32.0,,,,17.0,38.0,,,,,,,10.0,COMPLETE
6685,0.05344593397507824,2024-04-11 17:57:43.910391,2024-04-11 17:57:47.215587,0 days 00:00:03.305196,98.14301336034299,8.270712970811482,rbf,59,26.0,37.0,30.0,3.0,7.0,7.0,,,2.887171512595484,8.469120172392142,3.814174243744797,20.0,26.0,79.0,197.0,COMPLETE
6686,0.5096922069417159,2024-04-11 17:57:47.219587,2024-04-11 17:57:49.189078,0 days 00:00:01.969491,94.41531441505154,8.692485574566183,sigmoid,12,,26.0,29.0,,,,6.0,21.0,,,,,,,,COMPLETE
6687,0.6009432182607054,2024-04-11 17:57:49.192082,2024-04-11 17:57:50.930437,0 days 00:00:01.738355,98.12459558973067,7.756387002974241,sigmoid,8,,30.0,31.0,,,,,,,,,,,,,COMPLETE
6688,0.5952371952371952,2024-04-11 17:57:50.935011,2024-04-11 17:57:52.671208,0 days 00:00:01.736197,99.99789192501146,8.077245120585532,sigmoid,8,,24.0,32.0,,,,,,,,,,,,,COMPLETE
6689,0.3958756444305577,2024-04-11 17:57:52.674819,2024-04-11 17:57:55.247616,0 days 00:00:02.572797,96.64587306876113,8.416335611353505,sigmoid,54,44.0,,,2.0,5.0,17.0,7.0,5.0,9.998279405362872,9.99182445270045,3.4197345397254324,14.0,50.0,65.0,,COMPLETE
6690,0.515211549847429,2024-04-11 17:57:55.251618,2024-04-11 17:57:57.081062,0 days 00:00:01.829444,93.96033786161814,7.6385915217539555,sigmoid,48,36.0,,,5.0,8.0,84.0,,,,,,,,,,COMPLETE
6691,0.5426050659330234,2024-04-11 17:57:57.083614,2024-04-11 17:57:58.976771,0 days 00:00:01.893157,96.63242074534813,8.210629511924997,sigmoid,36,6.0,,,,,,29.0,34.0,,,,,,,,COMPLETE
6692,0.45936706893872686,2024-04-11 17:57:58.979771,2024-04-11 17:58:01.473026,0 days 00:00:02.493255,98.25955729058758,7.894236176996396,sigmoid,23,,,,6.0,6.0,88.0,26.0,7.0,5.565520251405289,4.655813099197571,2.54144756402436,17.0,38.0,92.0,167.0,COMPLETE
6693,0.5918162918162918,2024-04-11 17:58:01.476604,2024-04-11 17:58:03.202151,0 days 00:00:01.725547,95.27880666712616,5.652510570176373,sigmoid,8,,28.0,33.0,,,,,,,,,,,,,COMPLETE
6694,0.4312419817948561,2024-04-11 17:58:03.205731,2024-04-11 17:58:05.528527,0 days 00:00:02.322796,98.04091759893967,8.005905121898877,sigmoid,60,4.0,21.0,31.0,7.0,1.0,56.0,47.0,31.0,,,,,,,,COMPLETE
6695,0.4874107984381311,2024-04-11 17:58:05.532525,2024-04-11 17:58:07.177718,0 days 00:00:01.645193,99.9545052684454,8.559042756133099,sigmoid,1,,,,,,,,,,,,,,,96.0,COMPLETE
6696,0.48425438596491227,2024-04-11 17:58:07.181744,2024-04-11 17:58:09.571990,0 days 00:00:02.390246,99.97226988386832,8.268860309726318,sigmoid,7,,,,,,,27.0,49.0,2.3151268585252827,6.098532020880139,8.796545024491861,13.0,44.0,85.0,102.0,COMPLETE
6697,0.44701971028259324,2024-04-11 17:58:09.575519,2024-04-11 17:58:11.337747,0 days 00:00:01.762228,90.62256893995406,7.733451157855967,sigmoid,8,,24.0,30.0,,,,,,,,,,,,,COMPLETE
6698,0.5271844660194175,2024-04-11 17:58:11.340745,2024-04-11 17:58:13.196580,0 days 00:00:01.855835,96.68053000851323,8.11358290229821,sigmoid,40,27.0,26.0,32.0,,,,,,,,,,,,,COMPLETE
6699,0.13463505346350532,2024-04-11 17:58:13.200579,2024-04-11 17:58:14.712510,0 days 00:00:01.511931,98.06999947969818,8.397421719885065,sigmoid,32,31.0,,,,,,,,,,,,,,,COMPLETE
6700,0.4520395893071871,2024-04-11 17:58:14.716063,2024-04-11 17:58:17.583820,0 days 00:00:02.867757,99.97310304364717,7.444647719816194,sigmoid,27,,27.0,34.0,1.0,4.0,100.0,,,8.646784121079502,1.5455372362459046,9.249237153813265,15.0,27.0,63.0,158.0,COMPLETE
6701,0.2009266856508519,2024-04-11 17:58:17.586753,2024-04-11 17:58:20.522903,0 days 00:00:02.936150,93.1090033587722,7.905306023751801,rbf,30,,25.0,29.0,5.0,6.0,61.0,34.0,9.0,6.88565383171324,2.3428180178607656,1.1270516055303057,19.0,41.0,68.0,,COMPLETE
6702,0.5021152645814551,2024-04-11 17:58:20.525476,2024-04-11 17:58:22.841869,0 days 00:00:02.316393,95.04424944389078,8.142622453507913,sigmoid,61,10.0,23.0,31.0,7.0,3.0,47.0,38.0,44.0,,,,,,,137.0,COMPLETE
6703,0.5929369437606513,2024-04-11 17:58:22.844911,2024-04-11 17:58:24.474125,0 days 00:00:01.629214,98.14300045708798,7.769753480706198,sigmoid,8,,25.0,33.0,,,,,,,,,,,,,COMPLETE
6704,0.45345352376492626,2024-04-11 17:58:24.476660,2024-04-11 17:58:26.081733,0 days 00:00:01.605073,95.33133228459883,8.310536588717957,sigmoid,8,,29.0,30.0,,,,,,,,,,,,,COMPLETE
6705,0.5597434673418982,2024-04-11 17:58:26.085309,2024-04-11 17:58:28.194497,0 days 00:00:02.109188,98.18095792292107,2.351160582725902,sigmoid,34,14.0,,,,,,,,3.4512338015659116,7.1141579381652065,1.7544453630057864,3.0,46.0,97.0,,COMPLETE
6706,0.5963643249384587,2024-04-11 17:58:28.198517,2024-04-11 17:58:29.760913,0 days 00:00:01.562396,87.42519546734961,8.603420824700201,sigmoid,8,,26.0,32.0,,,,,,,,,,,,,COMPLETE
6707,0.4012191742865059,2024-04-11 17:58:29.764465,2024-04-11 17:58:32.112694,0 days 00:00:02.348229,96.71312731719837,7.971495674908637,sigmoid,51,13.0,,,4.0,2.0,20.0,,,4.1617642033108195,2.8126722097204073,5.516376429797191,6.0,25.0,91.0,47.0,COMPLETE
6708,0.38405401060922684,2024-04-11 17:58:32.116265,2024-04-11 17:58:34.052084,0 days 00:00:01.935819,98.26611176480372,7.5733179195658415,sigmoid,5,,,,,,,44.0,17.0,,,,,,,39.0,COMPLETE
6709,0.3482917619721889,2024-04-11 17:58:34.055600,2024-04-11 17:58:35.808821,0 days 00:00:01.753221,98.17870595045588,8.151783787661882,sigmoid,33,29.0,,,,,,,,,,,,,,82.0,COMPLETE
6710,0.4734436520829318,2024-04-11 17:58:35.812785,2024-04-11 17:58:38.358928,0 days 00:00:02.546143,95.43130261785815,8.899621688714003,sigmoid,53,33.0,,,3.0,7.0,63.0,3.0,11.0,,,,,,,69.0,COMPLETE
6711,0.5986580986580987,2024-04-11 17:58:38.361929,2024-04-11 17:58:39.992586,0 days 00:00:01.630657,92.59218375487195,8.41621341932651,sigmoid,8,,24.0,31.0,,,,,,,,,,,,,COMPLETE
6712,0.12622036262203626,2024-04-11 17:58:39.996138,2024-04-11 17:58:41.538565,0 days 00:00:01.542427,98.14751061150871,7.898626449693426,sigmoid,8,,27.0,29.0,,,,,,,,,,,,,COMPLETE
6713,0.49312907774299164,2024-04-11 17:58:41.541565,2024-04-11 17:58:43.696389,0 days 00:00:02.154824,96.4497702383679,7.7290879359367475,sigmoid,17,,,,8.0,2.0,36.0,,,,,,,,,31.0,COMPLETE
6714,0.49115097375309175,2024-04-11 17:58:43.701144,2024-04-11 17:58:45.818923,0 days 00:00:02.117779,47.4549293529631,7.2982293481124705,sigmoid,45,8.0,26.0,33.0,,,,45.0,26.0,,,,,,,17.0,COMPLETE
6715,0.41871066507909505,2024-04-11 17:58:45.826703,2024-04-11 17:58:47.938299,0 days 00:00:02.111596,99.97774576634055,8.01613630265902,sigmoid,49,23.0,,,2.0,5.0,80.0,,,,,,,,,114.0,COMPLETE
6716,0.12003789673140693,2024-04-11 17:58:47.941295,2024-04-11 17:58:49.725052,0 days 00:00:01.783757,99.98030553338509,8.252012677518596,sigmoid,8,,22.0,28.0,,,,,,,,,,,,,COMPLETE
6717,0.5170075443722473,2024-04-11 17:58:49.728057,2024-04-11 17:58:52.456801,0 days 00:00:02.728744,94.15618091376275,8.543924618418444,sigmoid,18,,,,3.0,1.0,49.0,,,7.489546101725871,3.282300657257831,0.8672998816329169,7.0,31.0,89.0,,COMPLETE
6718,0.45450441554044524,2024-04-11 17:58:52.461325,2024-04-11 17:58:53.765785,0 days 00:00:01.304460,76.950939566617,8.064229616148031,sigmoid,4,,,,,,,33.0,41.0,,,,,,,,COMPLETE
6719,0.49249172164181015,2024-04-11 17:58:53.769410,2024-04-11 17:58:55.914957,0 days 00:00:02.145547,96.67787252998342,7.544143961735182,sigmoid,58,25.0,24.0,31.0,4.0,8.0,68.0,,,5.808729403244854,7.73515082525348,6.138116259528102,4.0,32.0,70.0,,COMPLETE
