number,value,datetime_start,datetime_complete,duration,params_C,params_gamma,params_kernel,params_mask_number,params_rsi_window,params_so_smooth,params_so_window,params_srsi_smooth1,params_srsi_smooth2,params_srsi_window,params_tsi_window_fast,params_tsi_window_slow,params_ult_weight_1,params_ult_weight_2,params_ult_weight_3,params_ult_window_1,params_ult_window_2,params_ult_window_3,params_williams_lbp,state
2715,0.40744031751673476,2024-04-11 16:29:39.316901,2024-04-11 16:29:40.368232,0 days 00:00:01.051331,98.2432673827677,8.444267461335318,sigmoid,15,,26.0,32.0,,,,26.0,10.0,4.769997826337736,6.466102059624661,2.535992915091171,15.0,39.0,80.0,89.0,COMPLETE
2716,0.33264571299977497,2024-04-11 16:29:40.370398,2024-04-11 16:29:41.431016,0 days 00:00:01.060618,99.9615825587671,7.663316512052082,sigmoid,14,,20.0,31.0,,,,48.0,38.0,8.472144974729202,2.8576692278550735,1.7208879146038285,12.0,45.0,88.0,,COMPLETE
2717,0.558920211176412,2024-04-11 16:29:41.432013,2024-04-11 16:29:42.150941,0 days 00:00:00.718928,99.94864806581919,8.240866743952424,sigmoid,16,,,,1.0,2.0,77.0,,,,,,,,,,COMPLETE
2718,0.2732943934517424,2024-04-11 16:29:42.152941,2024-04-11 16:29:43.061574,0 days 00:00:00.908633,95.71117269817859,7.980358559777674,sigmoid,10,,24.0,30.0,,,,,,2.1071731539682332,7.577023002304875,5.972354044480721,17.0,34.0,51.0,,COMPLETE
2719,0.10157696840451204,2024-04-11 16:29:43.063600,2024-04-11 16:29:44.520283,0 days 00:00:01.456683,96.4972118005362,7.425504442107093,rbf,62,18.0,25.0,32.0,6.0,3.0,61.0,32.0,48.0,6.050936454847088,8.436724677127273,8.05805578266143,5.0,20.0,82.0,,COMPLETE
2720,0.44180681848662856,2024-04-11 16:29:44.522283,2024-04-11 16:29:45.694595,0 days 00:00:01.172312,98.11357104010332,8.21987700484774,sigmoid,63,5.0,26.0,31.0,7.0,6.0,26.0,30.0,17.0,8.005646013736765,3.5671988674999957,7.267329406880701,11.0,36.0,91.0,58.0,COMPLETE
2721,0.4078173981191223,2024-04-11 16:29:45.696765,2024-04-11 16:29:46.763425,0 days 00:00:01.066660,92.64809972349802,7.810947479447209,sigmoid,46,43.0,24.0,30.0,,,,24.0,33.0,5.543728157857741,1.002691930437221,2.2325658318557497,13.0,28.0,68.0,,COMPLETE
2722,0.41814987147366023,2024-04-11 16:29:46.765599,2024-04-11 16:29:47.625279,0 days 00:00:00.859680,98.19040523858172,8.506636673761438,sigmoid,57,28.0,28.0,29.0,4.0,1.0,100.0,,,,,,,,,200.0,COMPLETE
2723,0.6009432182607054,2024-04-11 16:29:47.627443,2024-04-11 16:29:48.293735,0 days 00:00:00.666292,94.84995648422232,8.036690742934926,sigmoid,8,,22.0,31.0,,,,,,,,,,,,,COMPLETE
2724,0.5146454844969987,2024-04-11 16:29:48.294744,2024-04-11 16:29:49.047048,0 days 00:00:00.752304,99.96003998693584,8.791572169461872,sigmoid,41,27.0,23.0,33.0,,,,,,,,,,,,188.0,COMPLETE
2725,0.5963643249384587,2024-04-11 16:29:49.048088,2024-04-11 16:29:49.759210,0 days 00:00:00.711122,96.79864384541985,8.310759903509796,sigmoid,8,,27.0,32.0,,,,,,,,,,,,,COMPLETE
2726,0.5952371952371952,2024-04-11 16:29:49.760364,2024-04-11 16:29:50.543545,0 days 00:00:00.783181,99.9411139691425,7.640908438131785,sigmoid,8,,25.0,32.0,,,,,,,,,,,,,COMPLETE
2727,0.48136011777556154,2024-04-11 16:29:50.545541,2024-04-11 16:29:51.323794,0 days 00:00:00.778253,96.29398395197764,8.071575325215957,sigmoid,20,,,,8.0,5.0,82.0,42.0,50.0,,,,,,,,COMPLETE
2728,0.44701971028259324,2024-04-11 16:29:51.325999,2024-04-11 16:29:52.001069,0 days 00:00:00.675070,98.1810076758947,7.852089915890463,sigmoid,8,,26.0,30.0,,,,,,,,,,,,,COMPLETE
2729,0.4596089040770801,2024-04-11 16:29:52.003089,2024-04-11 16:29:52.942034,0 days 00:00:00.938945,98.18467147905581,8.47979650941501,sigmoid,11,,24.0,31.0,,,,,,6.5257363411143565,5.991711924898872,8.31688460387087,20.0,24.0,86.0,116.0,COMPLETE
2730,0.5906279643331437,2024-04-11 16:29:52.944089,2024-04-11 16:29:53.616456,0 days 00:00:00.672367,95.13077242473683,8.21401608598379,sigmoid,8,,27.0,34.0,,,,,,,,,,,,,COMPLETE
2731,0.48322836801752456,2024-04-11 16:29:53.617469,2024-04-11 16:29:54.461806,0 days 00:00:00.844337,96.69737296540617,9.183779305056975,sigmoid,52,49.0,,,5.0,8.0,30.0,41.0,27.0,,,,,,,,COMPLETE
2732,0.40032438808611026,2024-04-11 16:29:54.463981,2024-04-11 16:29:55.319099,0 days 00:00:00.855118,99.96495925126837,7.931911612686777,sigmoid,56,13.0,25.0,29.0,7.0,4.0,4.0,,,,,,,,,,COMPLETE
2733,0.3567719191842614,2024-04-11 16:29:55.320098,2024-04-11 16:29:56.131092,0 days 00:00:00.810994,93.40850366480441,7.4593305563850025,sigmoid,37,3.0,,,,,,4.0,19.0,,,,,,,94.0,COMPLETE
2734,0.5475055141266674,2024-04-11 16:29:56.132093,2024-04-11 16:29:56.939483,0 days 00:00:00.807390,8.182030762233786,8.114203840129958,sigmoid,2,,,,,,,,,2.906025428199216,4.541240056462887,3.3377231635719387,7.0,21.0,66.0,,COMPLETE
2735,0.5929369437606513,2024-04-11 16:29:56.941470,2024-04-11 16:29:57.639105,0 days 00:00:00.697635,97.9884304903628,8.627904123191776,sigmoid,8,,26.0,33.0,,,,,,,,,,,,,COMPLETE
2736,0.6009432182607054,2024-04-11 16:29:57.641278,2024-04-11 16:29:58.311344,0 days 00:00:00.670066,95.18118006923527,7.680742256248916,sigmoid,8,,29.0,31.0,,,,,,,,,,,,,COMPLETE
2737,0.3087898879454073,2024-04-11 16:29:58.312535,2024-04-11 16:29:59.104991,0 days 00:00:00.792456,98.32256552365521,8.3331098102814,sigmoid,12,,24.0,30.0,,,,9.0,28.0,,,,,,,,COMPLETE
2738,0.20477043461864802,2024-04-11 16:29:59.106529,2024-04-11 16:30:00.560211,0 days 00:00:01.453682,96.51638165876749,7.87690164792659,rbf,26,,23.0,36.0,2.0,7.0,84.0,,,3.9591414626071844,4.979769004705091,4.873417108000396,6.0,48.0,58.0,,COMPLETE
2739,0.5975287681569516,2024-04-11 16:30:00.562236,2024-04-11 16:30:01.233880,0 days 00:00:00.671644,99.99705321191037,9.6435874435821,sigmoid,8,,25.0,32.0,,,,,,,,,,,,,COMPLETE
2740,0.3963777337160782,2024-04-11 16:30:01.235024,2024-04-11 16:30:02.184830,0 days 00:00:00.949806,98.07811082557667,8.096952928676167,sigmoid,60,23.0,22.0,27.0,3.0,3.0,18.0,18.0,4.0,,,,,,,,COMPLETE
2741,0.49119156923494417,2024-04-11 16:30:02.185831,2024-04-11 16:30:02.959775,0 days 00:00:00.773944,29.403846777291733,8.33281933021002,sigmoid,48,36.0,,,6.0,1.0,54.0,,,,,,,,,,COMPLETE
2742,0.500348353747612,2024-04-11 16:30:02.960776,2024-04-11 16:30:03.762713,0 days 00:00:00.801937,94.09438658841268,7.766950048727983,sigmoid,13,,27.0,29.0,,,,35.0,2.0,,,,,,,168.0,COMPLETE
2743,0.4365653642064641,2024-04-11 16:30:03.763715,2024-04-11 16:30:04.862520,0 days 00:00:01.098805,96.3899525315063,7.984928117711801,sigmoid,59,6.0,28.0,28.0,1.0,5.0,93.0,,,3.3130311085980804,3.9792609683977163,3.736510985107704,14.0,22.0,78.0,70.0,COMPLETE
2744,0.44915402932698334,2024-04-11 16:30:04.864762,2024-04-11 16:30:05.898039,0 days 00:00:01.033277,99.9912841776177,8.496317215472022,sigmoid,23,,,,8.0,2.0,80.0,39.0,14.0,8.724888465105536,1.455092214627682,9.038386647001875,15.0,27.0,72.0,120.0,COMPLETE
2745,0.43777596535140767,2024-04-11 16:30:05.900252,2024-04-11 16:30:06.969397,0 days 00:00:01.069145,98.20186027288824,7.543518186968982,sigmoid,54,20.0,,,4.0,8.0,68.0,2.0,40.0,5.35829977883938,3.194989334016839,4.5036423205234986,19.0,41.0,56.0,,COMPLETE
2746,0.5986580986580987,2024-04-11 16:30:06.970398,2024-04-11 16:30:07.662773,0 days 00:00:00.692375,99.99310127116051,8.213437100013563,sigmoid,8,,26.0,31.0,,,,,,,,,,,,,COMPLETE
2747,0.4982513143347097,2024-04-11 16:30:07.663928,2024-04-11 16:30:08.759408,0 days 00:00:01.095480,96.42778956794304,7.994456795523498,sigmoid,55,33.0,,,2.0,7.0,23.0,22.0,6.0,9.459864763263552,6.92749907986541,6.092063672412964,8.0,37.0,60.0,130.0,COMPLETE
2748,0.5295791583166333,2024-04-11 16:30:08.761474,2024-04-11 16:30:09.374582,0 days 00:00:00.613108,93.17499684065048,7.811975996400526,sigmoid,1,,,,,,,,,,,,,,,101.0,COMPLETE
2749,0.3884536967485782,2024-04-11 16:30:09.376733,2024-04-11 16:30:10.357490,0 days 00:00:00.980757,2.441347511207816,8.23659586284361,sigmoid,7,,,,,,,45.0,13.0,4.245834220462006,9.491784262026155,8.742289835064698,4.0,49.0,81.0,137.0,COMPLETE
2750,0.3353404353867532,2024-04-11 16:30:10.359489,2024-04-11 16:30:11.200681,0 days 00:00:00.841192,96.7175379768956,8.667817486327626,sigmoid,44,39.0,25.0,30.0,,,,28.0,29.0,,,,,,,,COMPLETE
2751,0.5929369437606513,2024-04-11 16:30:11.201682,2024-04-11 16:30:11.929282,0 days 00:00:00.727600,98.3162452907591,8.112699872906447,sigmoid,8,,23.0,33.0,,,,,,,,,,,,,COMPLETE
2752,0.5963643249384587,2024-04-11 16:30:11.930281,2024-04-11 16:30:12.595259,0 days 00:00:00.664978,95.0542268998712,8.474906533431627,sigmoid,8,,24.0,32.0,,,,,,,,,,,,,COMPLETE
2753,0.4641754330873501,2024-04-11 16:30:12.597281,2024-04-11 16:30:13.601096,0 days 00:00:01.003815,98.01449369457657,7.305497986768629,sigmoid,61,30.0,27.0,31.0,7.0,6.0,96.0,12.0,20.0,,,,,,,160.0,COMPLETE
2754,0.5516436105998536,2024-04-11 16:30:13.604090,2024-04-11 16:30:14.434157,0 days 00:00:00.830067,99.96181241897037,7.650637718363113,sigmoid,40,45.0,26.0,30.0,,,,,,,,,,,,,COMPLETE
2755,0.3856112749918059,2024-04-11 16:30:14.436169,2024-04-11 16:30:15.970755,0 days 00:00:01.534586,99.94084749535337,7.913097112918583,rbf,32,42.0,,,,,,,,,,,,,,,COMPLETE
2756,0.5963643249384587,2024-04-11 16:30:15.972764,2024-04-11 16:30:16.653179,0 days 00:00:00.680415,96.61993701262789,8.298276903969562,sigmoid,8,,25.0,32.0,,,,,,,,,,,,,COMPLETE
2757,0.4227128355234477,2024-04-11 16:30:16.654181,2024-04-11 16:30:17.720595,0 days 00:00:01.066414,99.97499645615144,7.065610274599499,sigmoid,27,,24.0,30.0,1.0,4.0,71.0,,,6.73952216234855,1.6651206803104794,3.9430866872514994,5.0,33.0,97.0,174.0,COMPLETE
2758,0.5232123451423603,2024-04-11 16:30:17.722595,2024-04-11 16:30:18.485019,0 days 00:00:00.762424,94.74346719220789,8.067116163857278,sigmoid,5,,,,,,,17.0,7.0,,,,,,,25.0,COMPLETE
2759,0.5520029907130489,2024-04-11 16:30:18.486016,2024-04-11 16:30:19.179062,0 days 00:00:00.693046,98.17503227026437,7.826364783291343,sigmoid,36,24.0,,,,,,31.0,45.0,,,,,,,,COMPLETE
2760,0.4043610962524779,2024-04-11 16:30:19.181062,2024-04-11 16:30:20.438552,0 days 00:00:01.257490,96.6309058239711,8.333500324392109,sigmoid,30,,21.0,34.0,6.0,2.0,38.0,47.0,44.0,8.329949222704837,8.809633544860954,0.9334969125667234,3.0,47.0,76.0,,COMPLETE
2761,0.5986044733320588,2024-04-11 16:30:20.440718,2024-04-11 16:30:21.267836,0 days 00:00:00.827118,99.99773256150307,8.892840721173263,sigmoid,8,,26.0,31.0,,,,,,,,,,,,,COMPLETE
2762,0.5439961009686656,2024-04-11 16:30:21.269883,2024-04-11 16:30:22.153593,0 days 00:00:00.883710,98.04296333327278,6.7476271810360595,sigmoid,4,,,,,,,49.0,36.0,,,,,,,,COMPLETE
2763,0.36793687982359424,2024-04-11 16:30:22.155589,2024-04-11 16:30:22.882060,0 days 00:00:00.726471,92.80823956166736,8.107889492683164,sigmoid,33,50.0,,,,,,,,,,,,,,76.0,COMPLETE
2764,0.5952371952371952,2024-04-11 16:30:22.884061,2024-04-11 16:30:23.625588,0 days 00:00:00.741527,99.97120080355647,7.547134735360947,sigmoid,8,,28.0,32.0,,,,,,,,,,,,,COMPLETE
2765,0.3816284218294269,2024-04-11 16:30:23.627714,2024-04-11 16:30:24.597911,0 days 00:00:00.970197,95.23780454468148,7.813044090694879,sigmoid,45,7.0,25.0,29.0,,,,25.0,42.0,,,,,,,140.0,COMPLETE
2766,0.2921078527848849,2024-04-11 16:30:24.599909,2024-04-11 16:30:25.434872,0 days 00:00:00.834963,99.99047786760737,8.460076860083257,sigmoid,34,15.0,,,,,,,,5.719377395002818,7.316277026423685,1.167861639162152,11.0,26.0,64.0,,COMPLETE
2767,0.5929369437606513,2024-04-11 16:30:25.438050,2024-04-11 16:30:26.147802,0 days 00:00:00.709752,96.70184964149567,7.991819895963255,sigmoid,8,,30.0,33.0,,,,,,,,,,,,,COMPLETE
2768,0.37866108786610875,2024-04-11 16:30:26.150057,2024-04-11 16:30:27.129934,0 days 00:00:00.979877,96.79305330856765,8.165704795338106,sigmoid,51,10.0,,,5.0,1.0,14.0,,,6.2322092551681,2.1349207047237133,6.921765582718299,9.0,38.0,92.0,184.0,COMPLETE
2769,0.5975614331269932,2024-04-11 16:30:27.132086,2024-04-11 16:30:27.842452,0 days 00:00:00.710366,98.1288911266897,5.633392362067582,sigmoid,8,,23.0,31.0,,,,,,,,,,,,,COMPLETE
2770,0.3547501959945834,2024-04-11 16:30:27.843454,2024-04-11 16:30:28.897284,0 days 00:00:01.053830,94.81593793269471,7.695089336836267,sigmoid,58,47.0,27.0,30.0,3.0,3.0,6.0,,,1.8515719956168968,6.298822229579494,4.31392962761057,10.0,35.0,96.0,,COMPLETE
2771,0.42140063326504,2024-04-11 16:30:28.899476,2024-04-11 16:30:29.651908,0 days 00:00:00.752432,98.10774038624874,8.601914011580549,sigmoid,17,,,,8.0,5.0,75.0,,,,,,,,,191.0,COMPLETE
2772,0.46794208893485,2024-04-11 16:30:29.653080,2024-04-11 16:30:30.600613,0 days 00:00:00.947533,93.05777576143677,8.255787692630664,sigmoid,53,25.0,,,4.0,6.0,89.0,40.0,32.0,,,,,,,15.0,COMPLETE
2773,0.4941672871680317,2024-04-11 16:30:30.601612,2024-04-11 16:30:31.423950,0 days 00:00:00.822338,43.6059741531282,7.953990894545933,sigmoid,49,4.0,,,3.0,8.0,58.0,,,,,,,,,125.0,COMPLETE
2774,0.4909214194228885,2024-04-11 16:30:31.424975,2024-04-11 16:30:32.473350,0 days 00:00:01.048375,77.74685723333693,3.8055419870091662,sigmoid,19,,,,6.0,4.0,64.0,,,7.504726891387923,9.006749461568365,9.351243988509063,7.0,46.0,50.0,86.0,COMPLETE
2775,0.23855548721553466,2024-04-11 16:30:32.475438,2024-04-11 16:30:33.759174,0 days 00:00:01.283736,98.24043260325035,7.464097039415815,rbf,50,32.0,,,4.0,3.0,48.0,,,3.7362987106934984,1.8158944905682168,2.9076278090591203,17.0,40.0,84.0,,COMPLETE
2776,0.47633900287538383,2024-04-11 16:30:33.761181,2024-04-11 16:30:34.714935,0 days 00:00:00.953754,95.37838056276372,8.327072366990398,sigmoid,18,,,,2.0,7.0,56.0,,,3.0761434558593264,1.2276557995301358,7.58669285558207,18.0,50.0,54.0,,COMPLETE
2777,0.5929369437606513,2024-04-11 16:30:34.717121,2024-04-11 16:30:35.416733,0 days 00:00:00.699612,99.97471365101639,7.953824865602067,sigmoid,8,,25.0,33.0,,,,,,,,,,,,,COMPLETE
2778,0.4848935853549635,2024-04-11 16:30:35.417735,2024-04-11 16:30:36.293692,0 days 00:00:00.875957,97.02459118562152,7.7632139247892304,sigmoid,25,,24.0,29.0,5.0,1.0,20.0,,,,,,,,,165.0,COMPLETE
2779,0.5483562018685743,2024-04-11 16:30:36.295758,2024-04-11 16:30:37.193731,0 days 00:00:00.897973,98.35450822796737,8.149025288467854,sigmoid,6,,,,,,,15.0,15.0,1.0425584009260902,0.5185512135096788,5.317054003072805,6.0,32.0,87.0,,COMPLETE
2780,0.5963245096172158,2024-04-11 16:30:37.195730,2024-04-11 16:30:37.902201,0 days 00:00:00.706471,96.75927352121333,8.411101957974848,sigmoid,8,,28.0,31.0,,,,,,,,,,,,,COMPLETE
2781,0.40252038547071906,2024-04-11 16:30:37.904206,2024-04-11 16:30:38.875095,0 days 00:00:00.970889,94.62890405092625,8.018457876862843,sigmoid,29,,26.0,32.0,7.0,6.0,41.0,23.0,47.0,,,,,,,147.0,COMPLETE
2782,0.446099985996359,2024-04-11 16:30:38.877196,2024-04-11 16:30:39.974601,0 days 00:00:01.097405,99.98654783121282,7.663686948358213,sigmoid,47,35.0,22.0,31.0,,,,6.0,49.0,4.406884998151,2.9364985098661105,5.211930484125498,12.0,44.0,63.0,65.0,COMPLETE
2783,0.4502052644288819,2024-04-11 16:30:39.976601,2024-04-11 16:30:40.703465,0 days 00:00:00.726864,98.18598167662148,8.656675531333585,sigmoid,8,,24.0,28.0,,,,,,,,,,,,,COMPLETE
2784,0.3801619296046614,2024-04-11 16:30:40.705464,2024-04-11 16:30:41.744927,0 days 00:00:01.039463,96.48469924757094,8.190155318318126,sigmoid,39,12.0,,,,,,36.0,8.0,9.786686751741984,2.615781994211296,3.2030631743905644,16.0,23.0,52.0,108.0,COMPLETE
2785,0.5069140556625241,2024-04-11 16:30:41.746024,2024-04-11 16:30:42.444396,0 days 00:00:00.698372,92.98222947925156,7.2936613333758356,sigmoid,8,,26.0,35.0,,,,,,,,,,,,,COMPLETE
2786,0.44701971028259324,2024-04-11 16:30:42.446465,2024-04-11 16:30:43.128692,0 days 00:00:00.682227,98.12292891703245,7.915320761767203,sigmoid,8,,27.0,30.0,,,,,,,,,,,,,COMPLETE
2787,0.3973713482817165,2024-04-11 16:30:43.130751,2024-04-11 16:30:43.967561,0 days 00:00:00.836810,95.32325077623688,8.368573349303183,sigmoid,24,,25.0,34.0,1.0,5.0,45.0,,,,,,,,,,COMPLETE
2788,0.5952371952371952,2024-04-11 16:30:43.968661,2024-04-11 16:30:44.646400,0 days 00:00:00.677739,80.61457176964215,8.125894708681303,sigmoid,8,,24.0,32.0,,,,,,,,,,,,,COMPLETE
2789,0.5394039735099337,2024-04-11 16:30:44.647400,2024-04-11 16:30:45.613180,0 days 00:00:00.965780,98.21425720167109,7.6700291534044664,sigmoid,38,22.0,,,,,,10.0,18.0,5.212650848122668,5.5795976901051,9.859836689931752,2.0,42.0,100.0,,COMPLETE
2790,0.3729612684664547,2024-04-11 16:30:45.614204,2024-04-11 16:30:46.695974,0 days 00:00:01.081770,98.18483079231596,7.846594898328234,sigmoid,22,,,,5.0,2.0,98.0,13.0,12.0,2.6843825273495763,4.121909053134592,2.713277623496532,3.0,25.0,95.0,,COMPLETE
2791,0.49115097375309175,2024-04-11 16:30:46.697975,2024-04-11 16:30:47.735859,0 days 00:00:01.037884,96.07229508982664,8.812850929755216,sigmoid,43,40.0,26.0,31.0,,,,,,1.3643020732548985,8.39614481911389,6.41682081938394,13.0,29.0,77.0,44.0,COMPLETE
2792,0.355991856733722,2024-04-11 16:30:47.737845,2024-04-11 16:30:48.642094,0 days 00:00:00.904249,98.25107300209508,8.45805916957935,sigmoid,35,29.0,,,,,,,,9.030208131437472,5.265628240171815,1.9111458432338675,20.0,41.0,98.0,35.0,COMPLETE
2793,0.36656025812652315,2024-04-11 16:30:48.644088,2024-04-11 16:30:49.658312,0 days 00:00:01.014224,94.30982699617567,8.04673605957312,sigmoid,15,,29.0,29.0,,,,5.0,34.0,4.850384599352848,3.379465737108424,8.496326068665498,14.0,43.0,74.0,196.0,COMPLETE
2794,0.4239278366830195,2024-04-11 16:30:49.660500,2024-04-11 16:30:50.557719,0 days 00:00:00.897219,96.23089493508978,7.487696020111922,sigmoid,57,38.0,23.0,33.0,8.0,4.0,33.0,,,,,,,,,153.0,COMPLETE
2795,0.4487524397320251,2024-04-11 16:30:50.558896,2024-04-11 16:30:51.725344,0 days 00:00:01.166448,73.16003742261496,8.213902169452368,sigmoid,31,,25.0,30.0,2.0,8.0,92.0,20.0,4.0,7.108106006761764,7.715896715925548,1.5307230512229024,5.0,36.0,68.0,29.0,COMPLETE
2796,0.4402362751911049,2024-04-11 16:30:51.726461,2024-04-11 16:30:53.265691,0 days 00:00:01.539230,99.99826825646771,4.427026821193383,rbf,3,,,,,,,,,0.617326691948274,5.848811455580819,9.641070714952296,9.0,39.0,93.0,177.0,COMPLETE
2797,0.5952371952371952,2024-04-11 16:30:53.266759,2024-04-11 16:30:53.952329,0 days 00:00:00.685570,98.27787040596424,7.849992622803577,sigmoid,8,,27.0,32.0,,,,,,,,,,,,,COMPLETE
2798,0.32012734347364696,2024-04-11 16:30:53.954484,2024-04-11 16:30:54.745852,0 days 00:00:00.791368,96.6938282786886,8.524792994844535,sigmoid,9,,23.0,30.0,,,,,,,,,,,,81.0,COMPLETE
2799,0.4832926457125418,2024-04-11 16:30:54.746871,2024-04-11 16:30:55.596370,0 days 00:00:00.849499,99.94122804760842,8.255119065023129,sigmoid,21,,,,6.0,1.0,35.0,37.0,39.0,,,,,,,51.0,COMPLETE
2800,0.5952371952371952,2024-04-11 16:30:55.598396,2024-04-11 16:30:56.301007,0 days 00:00:00.702611,99.98390903232072,8.015349597835671,sigmoid,8,,25.0,32.0,,,,,,,,,,,,,COMPLETE
2801,0.6009432182607054,2024-04-11 16:30:56.303007,2024-04-11 16:30:56.978537,0 days 00:00:00.675530,92.88722176937003,7.746677936338668,sigmoid,8,,24.0,31.0,,,,,,,,,,,,,COMPLETE
2802,0.4104069767441861,2024-04-11 16:30:56.980534,2024-04-11 16:30:57.928629,0 days 00:00:00.948095,99.96266046008778,8.117002563974918,sigmoid,28,,28.0,29.0,4.0,7.0,51.0,27.0,16.0,,,,,,,,COMPLETE
2803,0.41291078364880696,2024-04-11 16:30:57.930808,2024-04-11 16:30:59.115979,0 days 00:00:01.185171,99.99603745927713,7.571732596283049,sigmoid,63,44.0,26.0,28.0,7.0,3.0,31.0,43.0,19.0,2.399540056854567,4.766581104560289,5.677311051814082,4.0,31.0,79.0,132.0,COMPLETE
2804,0.36485367697347115,2024-04-11 16:30:59.117979,2024-04-11 16:31:00.107739,0 days 00:00:00.989760,96.81520946099485,8.354958140277507,sigmoid,14,,22.0,31.0,,,,3.0,10.0,1.6477741536190607,9.78766433623247,3.5305366334194,11.0,24.0,90.0,,COMPLETE
2805,0.49274436001230976,2024-04-11 16:31:00.110777,2024-04-11 16:31:01.115768,0 days 00:00:01.004991,94.88745940092126,7.92121386346119,sigmoid,42,26.0,27.0,32.0,,,,,,3.4938234642140715,0.846270029443378,0.6324452297245537,12.0,30.0,72.0,,COMPLETE
2806,0.5051004854255094,2024-04-11 16:31:01.117769,2024-04-11 16:31:02.255544,0 days 00:00:01.137775,98.09483108431466,8.623006368011795,sigmoid,46,42.0,25.0,30.0,,,,11.0,41.0,2.019194304619616,4.302163156121635,7.9327571994019905,2.0,37.0,85.0,,COMPLETE
2807,0.5929369437606513,2024-04-11 16:31:02.257672,2024-04-11 16:31:02.954230,0 days 00:00:00.696558,96.62018706971183,8.230405088926267,sigmoid,8,,26.0,33.0,,,,,,,,,,,,,COMPLETE
2808,0.6009432182607054,2024-04-11 16:31:02.955323,2024-04-11 16:31:03.672877,0 days 00:00:00.717554,98.13722609529862,7.943709729355445,sigmoid,8,,24.0,31.0,,,,,,,,,,,,,COMPLETE
2809,0.544033663961527,2024-04-11 16:31:03.674874,2024-04-11 16:31:04.468142,0 days 00:00:00.793268,67.92522452776535,7.761977560836271,sigmoid,2,,,,,,,,,2.2613156186763037,3.656539622837884,7.4224455218443754,17.0,28.0,61.0,,COMPLETE
2810,0.3398497901480009,2024-04-11 16:31:04.469647,2024-04-11 16:31:05.254234,0 days 00:00:00.784587,94.42164550530407,8.382021335046506,sigmoid,41,2.0,27.0,30.0,,,,,,,,,,,,96.0,COMPLETE
2811,0.35311990277289157,2024-04-11 16:31:05.255266,2024-04-11 16:31:06.849753,0 days 00:00:01.594487,98.18619185188022,8.121718211222468,rbf,16,,,,3.0,6.0,28.0,,,,,,,,,,COMPLETE
2812,0.3415580716371146,2024-04-11 16:31:06.850805,2024-04-11 16:31:07.750313,0 days 00:00:00.899508,99.99936970082803,7.54613271329292,sigmoid,10,,23.0,33.0,,,,,,8.555782167124077,7.871811725240663,8.175609443871997,7.0,21.0,59.0,,COMPLETE
2813,0.6009432182607054,2024-04-11 16:31:07.752475,2024-04-11 16:31:08.435956,0 days 00:00:00.683481,96.6772227069458,7.9549586190146915,sigmoid,8,,25.0,31.0,,,,,,,,,,,,,COMPLETE
2814,0.47512735211560453,2024-04-11 16:31:08.437956,2024-04-11 16:31:09.570755,0 days 00:00:01.132799,94.85953644460439,8.498472799974863,sigmoid,62,17.0,26.0,29.0,1.0,5.0,78.0,32.0,11.0,9.214416275296653,3.887017102033242,2.331156913753243,19.0,45.0,82.0,,COMPLETE
2815,0.5963643249384587,2024-04-11 16:31:09.572987,2024-04-11 16:31:10.258580,0 days 00:00:00.685593,98.12649449379093,8.221196895411989,sigmoid,8,,24.0,32.0,,,,,,,,,,,,,COMPLETE
2816,0.5405751343971328,2024-04-11 16:31:10.259583,2024-04-11 16:31:11.092566,0 days 00:00:00.832983,96.47283224779615,7.767611809280054,sigmoid,37,46.0,,,,,,26.0,23.0,,,,,,,142.0,COMPLETE
