number,value,datetime_start,datetime_complete,duration,params_C,params_gamma,params_kernel,params_mask_number,params_rsi_window,params_so_smooth,params_so_window,params_srsi_smooth1,params_srsi_smooth2,params_srsi_window,params_tsi_window_fast,params_tsi_window_slow,params_ult_weight_1,params_ult_weight_2,params_ult_weight_3,params_ult_window_1,params_ult_window_2,params_ult_window_3,params_williams_lbp,state
315,0.5234549346449879,2024-04-11 16:04:28.854768,2024-04-11 16:04:29.203631,0 days 00:00:00.348863,94.25179061165768,1.1518659135979759,sigmoid,41,44.0,38.0,49.0,,,,,,,,,,,,187.0,COMPLETE
316,0.5902834396431826,2024-04-11 16:04:29.203631,2024-04-11 16:04:29.473616,0 days 00:00:00.269985,86.52899609810767,0.8739059959978435,sigmoid,0,,,,,,,,,,,,,,,,COMPLETE
317,0.12450253033950767,2024-04-11 16:04:29.473616,2024-04-11 16:04:30.270839,0 days 00:00:00.797223,85.84184926209237,0.4092586235662578,rbf,0,,,,,,,,,,,,,,,,COMPLETE
318,0.3032298281840496,2024-04-11 16:04:30.270925,2024-04-11 16:04:30.688115,0 days 00:00:00.417190,84.61994485434303,0.6922962922257649,sigmoid,37,30.0,,,,,,44.0,8.0,,,,,,,15.0,COMPLETE
319,0.4571824329829708,2024-04-11 16:04:30.689116,2024-04-11 16:04:31.156794,0 days 00:00:00.467678,58.95900626651944,0.8942235335026394,sigmoid,26,,24.0,43.0,3.0,3.0,61.0,,,8.104203772783613,2.6930845853460847,7.207763414531197,13.0,27.0,90.0,,COMPLETE
320,0.5873130612179333,2024-04-11 16:04:31.157862,2024-04-11 16:04:31.425716,0 days 00:00:00.267854,88.52210318361034,0.5586976986801169,sigmoid,0,,,,,,,,,,,,,,,,COMPLETE
321,0.4041275684156534,2024-04-11 16:04:31.426717,2024-04-11 16:04:31.945941,0 days 00:00:00.519224,90.78729601092624,0.8299498633745463,sigmoid,62,11.0,30.0,8.0,1.0,7.0,31.0,14.0,45.0,2.8563635135409053,4.618823149726533,5.801592123729314,19.0,31.0,82.0,,COMPLETE
322,0.41612971534017007,2024-04-11 16:04:31.946941,2024-04-11 16:04:32.323340,0 days 00:00:00.376399,38.491883435616586,1.0103715741589174,sigmoid,20,,,,7.0,1.0,68.0,29.0,23.0,,,,,,,,COMPLETE
323,0.3434052420771555,2024-04-11 16:04:32.324340,2024-04-11 16:04:32.793403,0 days 00:00:00.469063,25.87790968947577,4.872895682321607,sigmoid,11,,44.0,23.0,,,,,,3.1274141772707105,6.982176620872394,3.337440284521883,2.0,41.0,96.0,41.0,COMPLETE
324,0.5377368089046253,2024-04-11 16:04:32.794400,2024-04-11 16:04:33.169062,0 days 00:00:00.374662,88.45536802852604,0.20924894788379456,sigmoid,52,21.0,,,5.0,4.0,36.0,25.0,14.0,,,,,,,,COMPLETE
325,0.47570213862406596,2024-04-11 16:04:33.170063,2024-04-11 16:04:33.670104,0 days 00:00:00.500041,87.23229502406355,1.3136333795901964,sigmoid,48,25.0,,,2.0,5.0,3.0,,,,,,,,,,COMPLETE
326,0.5854322450482764,2024-04-11 16:04:33.671119,2024-04-11 16:04:33.973789,0 days 00:00:00.302670,91.91386716021883,0.7492777654270605,sigmoid,0,,,,,,,,,,,,,,,,COMPLETE
327,0.38958243650452,2024-04-11 16:04:33.973789,2024-04-11 16:04:34.434494,0 days 00:00:00.460705,82.76007316634076,1.0736545462478442,sigmoid,56,32.0,2.0,12.0,4.0,8.0,72.0,,,,,,,,,,COMPLETE
328,0.5794344378415175,2024-04-11 16:04:34.435500,2024-04-11 16:04:34.742875,0 days 00:00:00.307375,93.11862931315922,1.5717745832058763,sigmoid,0,,,,,,,,,,,,,,,,COMPLETE
329,0.5862891399287705,2024-04-11 16:04:34.743872,2024-04-11 16:04:35.074839,0 days 00:00:00.330967,95.50439236473663,0.8996813644360699,sigmoid,0,,,,,,,,,,,,,,,,COMPLETE
330,0.5860647931709175,2024-04-11 16:04:35.075849,2024-04-11 16:04:35.425849,0 days 00:00:00.350000,90.74274174847426,1.2376697416533373,sigmoid,0,,,,,,,,,,,,,,,,COMPLETE
331,0.5823323040111231,2024-04-11 16:04:35.426852,2024-04-11 16:04:35.815717,0 days 00:00:00.388865,86.9515221681266,0.5021845331024295,sigmoid,0,,,,,,,,,,,,,,,,COMPLETE
332,0.5360991492490285,2024-04-11 16:04:35.816715,2024-04-11 16:04:36.254196,0 days 00:00:00.437481,93.72333553529909,0.6914377152421876,sigmoid,44,34.0,46.0,25.0,,,,12.0,49.0,,,,,,,,COMPLETE
333,0.44862995042762976,2024-04-11 16:04:36.255199,2024-04-11 16:04:36.697090,0 days 00:00:00.441891,79.84312567037927,1.0407558160030101,sigmoid,54,19.0,,,6.0,6.0,93.0,42.0,10.0,1.2764454697925718,3.382046017984351,4.253331951790844,15.0,45.0,92.0,,COMPLETE
334,0.5509140284688429,2024-04-11 16:04:36.698087,2024-04-11 16:04:37.046880,0 days 00:00:00.348793,97.50384489398846,1.382856013344543,sigmoid,12,,20.0,17.0,,,,36.0,17.0,,,,,,,,COMPLETE
335,0.46831766818037807,2024-04-11 16:04:37.047880,2024-04-11 16:04:37.545132,0 days 00:00:00.497252,89.33520761233633,0.8712503927825759,sigmoid,55,28.0,,,7.0,2.0,75.0,18.0,12.0,3.57339825639855,5.230853194486513,1.093461724576617,12.0,42.0,80.0,93.0,COMPLETE
336,0.42679092746463065,2024-04-11 16:04:37.546313,2024-04-11 16:04:38.011793,0 days 00:00:00.465480,95.20258071787539,1.1091108288046108,sigmoid,61,43.0,32.0,15.0,8.0,3.0,39.0,34.0,25.0,,,,,,,73.0,COMPLETE
337,0.1932414241284872,2024-04-11 16:04:38.012794,2024-04-11 16:04:39.044611,0 days 00:00:01.031817,99.90665165425195,1.7441092806718528,sigmoid,2,,,,,,,,,5.265945855619887,2.2149247780567665,1.375015173846081,18.0,23.0,84.0,,COMPLETE
338,0.5505803110684604,2024-04-11 16:04:39.046833,2024-04-11 16:04:39.502150,0 days 00:00:00.455317,92.66149601187551,0.7017737040596828,sigmoid,36,40.0,,,,,,40.0,5.0,,,,,,,,COMPLETE
339,0.3863731802911534,2024-04-11 16:04:39.502150,2024-04-11 16:04:41.166311,0 days 00:00:01.664161,96.59138908509479,0.3792721587924035,rbf,7,,,,,,,4.0,29.0,7.0020595995929655,8.060466555160577,1.7469781136453642,8.0,32.0,86.0,150.0,COMPLETE
340,0.44418507212545644,2024-04-11 16:04:41.167492,2024-04-11 16:04:41.675000,0 days 00:00:00.507508,52.04422366203741,1.4591908592293712,sigmoid,59,5.0,37.0,36.0,3.0,1.0,84.0,,,1.7835106588261764,6.738086765588831,9.32219663870537,4.0,40.0,77.0,171.0,COMPLETE
341,0.5017057569296375,2024-04-11 16:04:41.675113,2024-04-11 16:04:42.131975,0 days 00:00:00.456862,86.51162411815552,1.2201388964417024,sigmoid,60,17.0,41.0,30.0,2.0,7.0,12.0,21.0,20.0,,,,,,,,COMPLETE
342,0.35274206783369805,2024-04-11 16:04:42.132951,2024-04-11 16:04:42.482987,0 days 00:00:00.350036,91.8025006812878,4.5852591666349705,sigmoid,13,,7.0,33.0,,,,46.0,3.0,,,,,,,22.0,COMPLETE
343,0.5881110587623675,2024-04-11 16:04:42.482987,2024-04-11 16:04:42.776737,0 days 00:00:00.293750,94.58639029157096,0.9589559779784077,sigmoid,0,,,,,,,,,,,,,,,,COMPLETE
344,0.21806218432880772,2024-04-11 16:04:42.777737,2024-04-11 16:04:43.595479,0 days 00:00:00.817742,83.6293136138487,0.6071503682759227,sigmoid,34,14.0,,,,,,,,4.650211779164782,4.280803869600593,6.377933904113226,5.0,29.0,99.0,,COMPLETE
345,0.08945634266886326,2024-04-11 16:04:43.596577,2024-04-11 16:04:44.002451,0 days 00:00:00.405874,45.483459123538196,0.8604769564550261,sigmoid,32,38.0,,,,,,,,,,,,,,,COMPLETE
346,0.290905527244218,2024-04-11 16:04:44.003449,2024-04-11 16:04:44.460168,0 days 00:00:00.456719,75.48326371111843,1.3219043673434705,sigmoid,40,9.0,5.0,39.0,,,,,,,,,,,,,COMPLETE
347,0.5865019492683915,2024-04-11 16:04:44.461168,2024-04-11 16:04:44.738868,0 days 00:00:00.277700,89.8563566360889,1.1236028452530464,sigmoid,0,,,,,,,,,,,,,,,,COMPLETE
348,0.5421400537079116,2024-04-11 16:04:44.739889,2024-04-11 16:04:45.329080,0 days 00:00:00.589191,97.91282242289255,0.968184070834281,sigmoid,5,,,,,,,7.0,27.0,,,,,,,30.0,COMPLETE
349,0.4728561995808573,2024-04-11 16:04:45.330083,2024-04-11 16:04:45.854202,0 days 00:00:00.524119,95.83196801112224,1.5229395570628772,sigmoid,23,,,,4.0,4.0,98.0,23.0,41.0,2.551962892780703,9.15858762697645,8.011846305277333,6.0,38.0,62.0,97.0,COMPLETE
350,0.5661614836639558,2024-04-11 16:04:45.855202,2024-04-11 16:04:46.109974,0 days 00:00:00.254772,93.15491488728597,6.636905976472859,sigmoid,0,,,,,,,,,,,,,,,,COMPLETE
351,0.47322595762523745,2024-04-11 16:04:46.110978,2024-04-11 16:04:46.639188,0 days 00:00:00.528210,90.77583839589006,0.8142165648144886,sigmoid,27,,22.0,3.0,5.0,8.0,28.0,,,7.692478718193334,3.787774618193774,1.9941453212623372,11.0,47.0,72.0,57.0,COMPLETE
352,0.40930204131524267,2024-04-11 16:04:46.640190,2024-04-11 16:04:47.104558,0 days 00:00:00.464368,97.94039601100357,0.5599426691289779,sigmoid,30,,10.0,10.0,1.0,5.0,9.0,16.0,38.0,6.211129591108809,9.655526844576722,0.7759471846592447,17.0,34.0,67.0,,COMPLETE
353,0.44420205876337854,2024-04-11 16:04:47.105552,2024-04-11 16:04:47.648816,0 days 00:00:00.543264,94.62426996462972,1.2015405835215587,sigmoid,33,22.0,,,,,,,,,,,,,,118.0,COMPLETE
354,0.5080672767520938,2024-04-11 16:04:47.649853,2024-04-11 16:04:48.152300,0 days 00:00:00.502447,88.4860547291829,8.335449214550852,sigmoid,53,41.0,,,6.0,2.0,46.0,32.0,32.0,,,,,,,125.0,COMPLETE
355,0.06188739457488033,2024-04-11 16:04:48.154533,2024-04-11 16:04:48.468437,0 days 00:00:00.313904,96.57593293926172,0.33311497350958197,sigmoid,4,,,,,,,11.0,37.0,,,,,,,,COMPLETE
356,0.4810075392125711,2024-04-11 16:04:48.469434,2024-04-11 16:04:49.949191,0 days 00:00:01.479757,92.16858540347646,1.077127755285075,rbf,45,36.0,15.0,41.0,,,,13.0,35.0,,,,,,,108.0,COMPLETE
357,0.5863711449328822,2024-04-11 16:04:49.950193,2024-04-11 16:04:50.226802,0 days 00:00:00.276609,93.87637715788215,0.6928502328414716,sigmoid,0,,,,,,,,,,,,,,,,COMPLETE
358,0.5888219294970936,2024-04-11 16:04:50.227821,2024-04-11 16:04:50.697973,0 days 00:00:00.470152,86.18034033855871,1.3581816464482206,sigmoid,0,,,,,,,,,,,,,,,,COMPLETE
359,0.3412051000822594,2024-04-11 16:04:50.699999,2024-04-11 16:04:51.699848,0 days 00:00:00.999849,87.03597750193673,5.87180393206697,sigmoid,51,29.0,,,7.0,3.0,15.0,,,8.48402701667624,6.3029251062979945,3.136630363887866,3.0,39.0,65.0,155.0,COMPLETE
360,0.5836206735876839,2024-04-11 16:04:51.701835,2024-04-11 16:04:52.164080,0 days 00:00:00.462245,82.04176197592281,1.7513759479999433,sigmoid,0,,,,,,,,,,,,,,,,COMPLETE
361,0.5867358687757959,2024-04-11 16:04:52.165076,2024-04-11 16:04:52.488023,0 days 00:00:00.322947,86.47064988060916,1.330735352555616,sigmoid,0,,,,,,,,,,,,,,,,COMPLETE
362,0.4315472455766094,2024-04-11 16:04:52.489080,2024-04-11 16:04:52.984332,0 days 00:00:00.495252,89.45568176884156,0.9447995842926521,sigmoid,17,,,,8.0,6.0,79.0,,,,,,,,,102.0,COMPLETE
363,0.31299716400359684,2024-04-11 16:04:52.985333,2024-04-11 16:04:53.598157,0 days 00:00:00.612824,84.70209182714544,0.7727619724961043,sigmoid,19,,,,3.0,7.0,41.0,,,0.817897896608911,4.945458056893127,8.463954800427606,13.0,35.0,50.0,161.0,COMPLETE
364,0.5851186236370609,2024-04-11 16:04:53.600688,2024-04-11 16:04:53.968783,0 days 00:00:00.368095,85.5484268999666,1.5042623052830846,sigmoid,0,,,,,,,,,,,,,,,,COMPLETE
365,0.4880634138403961,2024-04-11 16:04:53.969791,2024-04-11 16:04:54.496859,0 days 00:00:00.527068,90.07075033761024,1.129656236276788,sigmoid,58,45.0,26.0,21.0,4.0,5.0,63.0,,,6.67596002732671,5.854873143716235,5.568772274936618,10.0,21.0,55.0,,COMPLETE
366,0.3771309508776361,2024-04-11 16:04:54.498834,2024-04-11 16:04:54.894683,0 days 00:00:00.395849,87.86581685798029,0.5268794341105956,sigmoid,25,,35.0,27.0,2.0,8.0,51.0,,,,,,,,,142.0,COMPLETE
367,0.2499539679617013,2024-04-11 16:04:54.894683,2024-04-11 16:04:55.347271,0 days 00:00:00.452588,99.91247665700405,0.9428592279843137,sigmoid,6,,,,,,,28.0,44.0,3.9616434728485688,3.01071674332309,7.65236337566767,16.0,33.0,75.0,,COMPLETE
368,0.5856983714391809,2024-04-11 16:04:55.348273,2024-04-11 16:04:55.640812,0 days 00:00:00.292539,91.68521020480797,1.3146398523271967,sigmoid,0,,,,,,,,,,,,,,,,COMPLETE
369,0.43421295441963464,2024-04-11 16:04:55.640812,2024-04-11 16:04:56.073555,0 days 00:00:00.432743,82.40526147038469,0.7504473121830074,sigmoid,29,,13.0,13.0,5.0,6.0,91.0,39.0,22.0,,,,,,,84.0,COMPLETE
370,0.3787977195641192,2024-04-11 16:04:56.074595,2024-04-11 16:04:56.470235,0 days 00:00:00.395640,96.93297599986185,1.1035684516504356,sigmoid,49,24.0,,,6.0,4.0,88.0,,,,,,,,,184.0,COMPLETE
371,0.3636728953184649,2024-04-11 16:04:56.470235,2024-04-11 16:04:56.916459,0 days 00:00:00.446224,88.80707020028287,1.5118787516396477,sigmoid,50,11.0,,,1.0,1.0,24.0,,,4.30341396567701,5.426863048302863,6.594406179562415,20.0,36.0,88.0,,COMPLETE
372,0.4790820784293571,2024-04-11 16:04:56.917454,2024-04-11 16:04:57.398005,0 days 00:00:00.480551,85.21877694213075,0.9667639450883218,sigmoid,47,49.0,11.0,44.0,,,,3.0,33.0,5.392709304320273,7.822823163063719,9.13189333996955,9.0,43.0,57.0,191.0,COMPLETE
373,0.0,2024-04-11 16:04:57.399128,2024-04-11 16:04:57.654526,0 days 00:00:00.255398,93.75033456183449,0.1972269476964552,sigmoid,1,,,,,,,,,,,,,,,200.0,COMPLETE
374,0.585791427013526,2024-04-11 16:04:57.654526,2024-04-11 16:04:57.938990,0 days 00:00:00.284464,98.48625057110837,1.2965511672477918,sigmoid,0,,,,,,,,,,,,,,,,COMPLETE
375,0.37325417903452585,2024-04-11 16:04:57.938990,2024-04-11 16:04:58.372974,0 days 00:00:00.433984,91.39567453142519,0.5434387615772591,sigmoid,43,3.0,49.0,47.0,,,,,,3.6455517587089563,8.405493445435333,5.2604985376353435,15.0,24.0,59.0,64.0,COMPLETE
376,0.23937001562938323,2024-04-11 16:04:58.374078,2024-04-11 16:04:59.163123,0 days 00:00:00.789045,95.8929312640889,0.8140073596359865,rbf,0,,,,,,,,,,,,,,,,COMPLETE
377,0.1888153120464441,2024-04-11 16:04:59.163123,2024-04-11 16:04:59.548851,0 days 00:00:00.385728,93.6451581949986,1.0976636967023106,sigmoid,24,,45.0,50.0,8.0,2.0,20.0,,,,,,,,,,COMPLETE
378,0.49757368584610234,2024-04-11 16:04:59.549848,2024-04-11 16:05:00.123281,0 days 00:00:00.573433,87.453115301438,1.6901157842380161,sigmoid,39,16.0,,,,,,6.0,50.0,5.057968393821205,0.9826477705194767,4.489101234115027,14.0,48.0,71.0,178.0,COMPLETE
379,0.5189334627175088,2024-04-11 16:05:00.124281,2024-04-11 16:05:00.611722,0 days 00:00:00.487441,90.38140859653461,0.7486502157181797,sigmoid,22,,,,7.0,3.0,43.0,50.0,31.0,9.675531053155153,1.8528187924159862,0.9624870786002111,18.0,31.0,53.0,,COMPLETE
380,0.36256692282478054,2024-04-11 16:05:00.612783,2024-04-11 16:05:01.061641,0 days 00:00:00.448858,95.89173741687408,1.2627445855251316,sigmoid,35,7.0,,,,,,,,4.209832799028921,6.602487662696195,1.6486352313184525,5.0,28.0,95.0,138.0,COMPLETE
381,0.5439762753020321,2024-04-11 16:05:01.062778,2024-04-11 16:05:01.501214,0 days 00:00:00.438436,97.76009027472699,0.9750999204833934,sigmoid,38,31.0,,,,,,43.0,43.0,9.983234483331284,9.799605692343786,6.892676375226214,8.0,46.0,81.0,,COMPLETE
382,0.10504933255948928,2024-04-11 16:05:01.503245,2024-04-11 16:05:01.813880,0 days 00:00:00.310635,92.37561362160574,0.4566886233631315,sigmoid,0,,,,,,,,,,,,,,,,COMPLETE
383,0.5865019492683915,2024-04-11 16:05:01.814881,2024-04-11 16:05:02.104419,0 days 00:00:00.289538,94.97820616027958,1.1134498009332208,sigmoid,0,,,,,,,,,,,,,,,,COMPLETE
384,0.4652339816630452,2024-04-11 16:05:02.105494,2024-04-11 16:05:02.508915,0 days 00:00:00.403421,83.97349919054365,1.3749821153385215,sigmoid,21,,,,3.0,4.0,59.0,30.0,21.0,,,,,,,40.0,COMPLETE
385,0.5863711449328822,2024-04-11 16:05:02.509929,2024-04-11 16:05:02.805305,0 days 00:00:00.295376,98.6829592365518,0.6631064771428875,sigmoid,0,,,,,,,,,,,,,,,,COMPLETE
386,0.3986658695446964,2024-04-11 16:05:02.806305,2024-04-11 16:05:03.280895,0 days 00:00:00.474590,90.2144426461448,0.8768268905401639,sigmoid,15,,34.0,31.0,,,,19.0,14.0,5.835868211533918,8.665168836456488,9.68164008945886,7.0,44.0,92.0,48.0,COMPLETE
387,0.422520502503302,2024-04-11 16:05:03.281896,2024-04-11 16:05:03.864297,0 days 00:00:00.582401,88.13040094222879,1.0179280435897715,sigmoid,31,,39.0,19.0,6.0,1.0,33.0,9.0,8.0,9.407327901231913,9.257831666196584,2.89246117225741,2.0,25.0,100.0,135.0,COMPLETE
388,0.5806280131248509,2024-04-11 16:05:03.865259,2024-04-11 16:05:04.174870,0 days 00:00:00.309611,93.3341226613088,1.5472475291195211,sigmoid,0,,,,,,,,,,,,,,,,COMPLETE
389,0.31716054670768273,2024-04-11 16:05:04.174870,2024-04-11 16:05:04.626249,0 days 00:00:00.451379,96.58300099268537,1.2116773446157652,sigmoid,42,26.0,24.0,8.0,,,,,,7.979387169283449,8.961040432054277,5.930447727923609,4.0,49.0,90.0,,COMPLETE
390,0.2604977988486285,2024-04-11 16:05:04.627467,2024-04-11 16:05:05.111045,0 days 00:00:00.483578,5.363553969278463,0.7627229988802897,sigmoid,3,,,,,,,,,7.561972972682236,1.4972216638132765,4.914622614872262,11.0,42.0,69.0,30.0,COMPLETE
391,0.12158321707228854,2024-04-11 16:05:05.112560,2024-04-11 16:05:05.488061,0 days 00:00:00.375501,99.91436673005528,0.3555485008435833,sigmoid,0,,,,,,,,,,,,,,,,COMPLETE
392,0.3976717494671258,2024-04-11 16:05:05.489226,2024-04-11 16:05:06.013345,0 days 00:00:00.524119,86.30329961303956,0.9187855232714811,sigmoid,57,13.0,18.0,6.0,1.0,5.0,29.0,,,,,,,,,168.0,COMPLETE
393,0.24177292046144505,2024-04-11 16:05:06.014354,2024-04-11 16:05:06.481394,0 days 00:00:00.467040,94.96848351286873,1.4321069211794955,sigmoid,18,,,,4.0,7.0,17.0,,,2.134098730915704,5.70961732425952,1.3214287511227019,7.0,37.0,61.0,,COMPLETE
394,0.5816943051806145,2024-04-11 16:05:06.482395,2024-04-11 16:05:06.850551,0 days 00:00:00.368156,92.01288770165583,5.385564429023352,sigmoid,8,,32.0,4.0,,,,,,,,,,,,,COMPLETE
395,0.3877335794087598,2024-04-11 16:05:06.850551,2024-04-11 16:05:07.304321,0 days 00:00:00.453770,89.45804424885364,0.6379525379884861,sigmoid,9,,3.0,34.0,,,,,,,,,,,,72.0,COMPLETE
396,0.1448413832523578,2024-04-11 16:05:07.304321,2024-04-11 16:05:07.948162,0 days 00:00:00.643841,97.3175462515771,0.0486735950357714,rbf,16,,,,5.0,8.0,76.0,,,,,,,,,,COMPLETE
397,0.5852394231262724,2024-04-11 16:05:07.949230,2024-04-11 16:05:08.239163,0 days 00:00:00.289933,93.75886714221778,1.174744671510684,sigmoid,0,,,,,,,,,,,,,,,,COMPLETE
398,0.4952580825120208,2024-04-11 16:05:08.240172,2024-04-11 16:05:08.643396,0 days 00:00:00.403224,92.35781151608234,0.975244664957331,sigmoid,10,,9.0,14.0,,,,,,5.580904571091355,1.2913563091336795,8.734425371188216,12.0,23.0,78.0,,COMPLETE
399,0.44450155629800964,2024-04-11 16:05:08.644396,2024-04-11 16:05:09.176622,0 days 00:00:00.532226,96.22662182674424,1.2526689595499987,sigmoid,63,33.0,20.0,28.0,2.0,2.0,54.0,33.0,27.0,6.443950691884481,0.7474693246543058,7.243510228071734,17.0,40.0,64.0,18.0,COMPLETE
400,0.26139404493904767,2024-04-11 16:05:09.177630,2024-04-11 16:05:09.603446,0 days 00:00:00.425816,88.20976606504244,0.7893043725191418,sigmoid,14,,30.0,23.0,,,,48.0,10.0,8.74165896267499,4.111221617416784,6.223432899237604,3.0,20.0,85.0,,COMPLETE
401,0.5847104737362986,2024-04-11 16:05:09.604467,2024-04-11 16:05:09.887408,0 days 00:00:00.282941,90.98423691976653,1.893712677037608,sigmoid,0,,,,,,,,,,,,,,,,COMPLETE
402,0.5863711449328822,2024-04-11 16:05:09.888407,2024-04-11 16:05:10.169427,0 days 00:00:00.281020,98.716567754875,0.5751169575586441,sigmoid,0,,,,,,,,,,,,,,,,COMPLETE
403,0.3553464441661307,2024-04-11 16:05:10.170418,2024-04-11 16:05:10.617209,0 days 00:00:00.446791,85.81963336218163,1.0088478852524119,sigmoid,46,47.0,43.0,45.0,,,,37.0,47.0,8.341816108765604,7.519085850090054,2.260957020993848,18.0,30.0,73.0,,COMPLETE
404,0.5842605449660073,2024-04-11 16:05:10.618218,2024-04-11 16:05:10.902889,0 days 00:00:00.284671,95.19505625124357,1.398450596856501,sigmoid,0,,,,,,,,,,,,,,,,COMPLETE
405,0.5138658611369779,2024-04-11 16:05:10.903955,2024-04-11 16:05:11.230007,0 days 00:00:00.326052,93.50144405047169,6.3186667611702925,sigmoid,37,2.0,,,,,,35.0,12.0,,,,,,,36.0,COMPLETE
406,0.4987702117968572,2024-04-11 16:05:11.231014,2024-04-11 16:05:11.662506,0 days 00:00:00.431492,99.99976844721247,1.1435625050114937,sigmoid,28,,22.0,22.0,8.0,3.0,7.0,26.0,18.0,,,,,,,,COMPLETE
407,0.4570000515277992,2024-04-11 16:05:11.663501,2024-04-11 16:05:12.165912,0 days 00:00:00.502411,83.72424184826019,0.8273453968610487,sigmoid,62,19.0,17.0,29.0,3.0,6.0,97.0,44.0,4.0,7.332789303274707,2.757429201842385,4.606543448475071,9.0,47.0,97.0,,COMPLETE
408,0.5825349282830726,2024-04-11 16:05:12.166926,2024-04-11 16:05:12.502949,0 days 00:00:00.336023,89.82231532194989,1.6853014941485518,sigmoid,0,,,,,,,,,,,,,,,,COMPLETE
409,0.486889099868891,2024-04-11 16:05:12.502949,2024-04-11 16:05:12.945420,0 days 00:00:00.442471,79.89271956810327,2.8541477907099573,sigmoid,11,,41.0,17.0,,,,,,6.810626089748876,3.147510759784133,0.5148266897124207,19.0,36.0,94.0,114.0,COMPLETE
410,0.4414102486903113,2024-04-11 16:05:12.946418,2024-04-11 16:05:13.377766,0 days 00:00:00.431348,97.14955123700108,0.44068924227067285,sigmoid,26,,28.0,36.0,7.0,4.0,84.0,,,9.124414939989517,3.4585004529568657,8.202975541740043,14.0,32.0,74.0,,COMPLETE
411,0.4952938123658323,2024-04-11 16:05:13.378767,2024-04-11 16:05:13.793581,0 days 00:00:00.414814,95.0779171536752,1.0276997858982118,sigmoid,41,5.0,37.0,11.0,,,,,,,,,,,,13.0,COMPLETE
412,0.5863711449328822,2024-04-11 16:05:13.794659,2024-04-11 16:05:14.077833,0 days 00:00:00.283174,92.18080127143757,0.640033551175659,sigmoid,0,,,,,,,,,,,,,,,,COMPLETE
413,0.5881014021858113,2024-04-11 16:05:14.077833,2024-04-11 16:05:14.361968,0 days 00:00:00.284135,87.53750976237785,1.2635800794869396,sigmoid,0,,,,,,,,,,,,,,,,COMPLETE
414,0.29438509592281814,2024-04-11 16:05:14.361968,2024-04-11 16:05:15.031732,0 days 00:00:00.669764,96.97504748290118,0.8595004317643599,rbf,0,,,,,,,,,,,,,,,,COMPLETE
415,0.4237857957615417,2024-04-11 16:05:15.032760,2024-04-11 16:05:15.547341,0 days 00:00:00.514581,91.42630764731499,1.5037653454095332,sigmoid,59,27.0,13.0,5.0,5.0,1.0,5.0,,,3.4113038051119084,6.0256930670533535,7.507437185808654,6.0,22.0,80.0,163.0,COMPLETE
416,0.41116236807157336,2024-04-11 16:05:15.548342,2024-04-11 16:05:15.975083,0 days 00:00:00.426741,94.77285724880905,1.1038360968079262,sigmoid,52,8.0,,,2.0,6.0,87.0,24.0,45.0,,,,,,,,COMPLETE
417,0.46811605916107657,2024-04-11 16:05:15.976231,2024-04-11 16:05:16.359846,0 days 00:00:00.383615,98.1935294388547,0.8751403098183285,sigmoid,48,36.0,,,1.0,5.0,2.0,,,,,,,,,,COMPLETE
418,0.35046646717127267,2024-04-11 16:05:16.360848,2024-04-11 16:05:16.766115,0 days 00:00:00.405267,89.24032056719798,1.3133087009573376,sigmoid,44,10.0,50.0,32.0,,,,29.0,34.0,,,,,,,,COMPLETE
419,0.2212134439109559,2024-04-11 16:05:16.766115,2024-04-11 16:05:17.178512,0 days 00:00:00.412397,93.36466381825711,0.6938877297732076,sigmoid,56,39.0,47.0,24.0,6.0,7.0,13.0,,,,,,,,,,COMPLETE
