number,value,datetime_start,datetime_complete,duration,params_C,params_gamma,params_kernel,params_mask_number,params_rsi_window,params_so_smooth,params_so_window,params_srsi_smooth1,params_srsi_smooth2,params_srsi_window,params_tsi_window_fast,params_tsi_window_slow,params_ult_weight_1,params_ult_weight_2,params_ult_weight_3,params_ult_window_1,params_ult_window_2,params_ult_window_3,params_williams_lbp,state
8572,0.507056601370997,2024-04-11 18:57:35.242082,2024-04-11 18:57:36.989586,0 days 00:00:01.747504,96.6877081692527,8.4147881028531,sigmoid,17,,,,6.0,8.0,61.0,,,,,,,,,120.0,COMPLETE
8573,0.1731982079944326,2024-04-11 18:57:36.993572,2024-04-11 18:57:38.610208,0 days 00:00:01.616636,95.01899649315015,7.645950127382599,sigmoid,4,,,,,,,3.0,34.0,,,,,,,,COMPLETE
8574,0.4363157304630564,2024-04-11 18:57:38.613209,2024-04-11 18:57:40.716733,0 days 00:00:02.103524,98.12394316618504,8.183913686649278,sigmoid,19,,,,2.0,4.0,73.0,,,1.0752986380552159,9.49547953576953,4.829884119811403,18.0,38.0,50.0,31.0,COMPLETE
8575,0.47437659033078877,2024-04-11 18:57:40.719704,2024-04-11 18:57:43.243384,0 days 00:00:02.523680,99.97646803390168,7.89687079484835,sigmoid,58,8.0,25.0,33.0,5.0,1.0,18.0,,,9.356962869706688,7.9462312188590225,3.482754700713575,5.0,29.0,100.0,,COMPLETE
8576,0.47803228513600243,2024-04-11 18:57:43.247059,2024-04-11 18:57:45.548726,0 days 00:00:02.301667,99.99333895613906,7.0514680509737255,sigmoid,50,7.0,,,1.0,3.0,82.0,,,1.59727202064539,5.382083205857829,6.762167594125664,2.0,37.0,76.0,,COMPLETE
8577,0.4707226731814958,2024-04-11 18:57:45.551736,2024-04-11 18:57:47.528282,0 days 00:00:01.976546,99.96489730479801,8.611814250663286,sigmoid,49,42.0,,,8.0,6.0,8.0,,,,,,,,,53.0,COMPLETE
8578,0.5963643249384587,2024-04-11 18:57:47.531279,2024-04-11 18:57:49.067180,0 days 00:00:01.535901,96.34145050045183,8.318810470754384,sigmoid,8,,26.0,32.0,,,,,,,,,,,,,COMPLETE
8579,0.4132813243268957,2024-04-11 18:57:49.069751,2024-04-11 18:57:51.390920,0 days 00:00:02.321169,90.51256210555124,8.079476065672157,sigmoid,29,,24.0,31.0,3.0,7.0,85.0,23.0,31.0,,,,,,,200.0,COMPLETE
8580,0.44701971028259324,2024-04-11 18:57:51.393931,2024-04-11 18:57:52.957942,0 days 00:00:01.564011,94.27449054442762,7.793433115424061,sigmoid,8,,9.0,30.0,,,,,,,,,,,,,COMPLETE
8581,0.29356905360473606,2024-04-11 18:57:52.960991,2024-04-11 18:57:55.103081,0 days 00:00:02.142090,96.72545318042714,7.477591290609981,sigmoid,6,,,,,,,13.0,16.0,8.777110361034607,4.4897033622913645,8.110872484296314,19.0,45.0,88.0,,COMPLETE
8582,0.4077870152947896,2024-04-11 18:57:55.107054,2024-04-11 18:57:57.144886,0 days 00:00:02.037832,33.796259487961194,7.998349691363605,sigmoid,25,,27.0,32.0,7.0,8.0,52.0,,,,,,,,,182.0,COMPLETE
8583,0.48785785314282726,2024-04-11 18:57:57.149440,2024-04-11 18:57:59.472577,0 days 00:00:02.323137,98.30109363843117,8.423448871068581,sigmoid,18,,,,4.0,5.0,94.0,,,3.850522660727375,6.913267262785518,1.3260885624492387,14.0,44.0,94.0,,COMPLETE
8584,0.12003789673140693,2024-04-11 18:57:59.476578,2024-04-11 18:58:01.166057,0 days 00:00:01.689479,87.09139804820475,8.277474390910381,sigmoid,8,,23.0,28.0,,,,,,,,,,,,,COMPLETE
8585,0.3816464979831316,2024-04-11 18:58:01.168651,2024-04-11 18:58:03.515520,0 days 00:00:02.346869,93.44356383078104,7.704982950295735,sigmoid,43,5.0,31.0,31.0,,,,,,3.3657731211788007,1.5322357058158063,5.736872517402225,9.0,39.0,74.0,36.0,COMPLETE
8586,0.44701971028259324,2024-04-11 18:58:03.518053,2024-04-11 18:58:05.227297,0 days 00:00:01.709244,98.1608111259507,8.14907851456535,sigmoid,8,,25.0,30.0,,,,,,,,,,,,,COMPLETE
8587,0.5929369437606513,2024-04-11 18:58:05.229858,2024-04-11 18:58:06.776268,0 days 00:00:01.546410,99.97618640756002,7.952466041461016,sigmoid,8,,28.0,33.0,,,,,,,,,,,,,COMPLETE
8588,0.45906188458554636,2024-04-11 18:58:06.779857,2024-04-11 18:58:09.515535,0 days 00:00:02.735678,96.52568791388072,8.781439432560147,sigmoid,31,,26.0,24.0,6.0,4.0,45.0,20.0,5.0,6.422029470104899,4.187508231030016,9.991680836756442,10.0,23.0,85.0,166.0,COMPLETE
8589,0.20162188655705568,2024-04-11 18:58:09.519093,2024-04-11 18:58:12.336191,0 days 00:00:02.817098,95.41850553355066,8.499562314779876,rbf,22,,,,1.0,2.0,24.0,25.0,45.0,5.987451914979878,3.2898768423398375,4.5971413700917445,6.0,47.0,79.0,,COMPLETE
8590,0.3679269689913885,2024-04-11 18:58:12.339785,2024-04-11 18:58:14.572415,0 days 00:00:02.232630,98.03774960856013,8.22184585777902,sigmoid,39,6.0,,,,,,36.0,22.0,7.571899644989869,6.549914528896544,3.738087655933027,12.0,49.0,92.0,139.0,COMPLETE
8591,0.33636993040119517,2024-04-11 18:58:14.574417,2024-04-11 18:58:16.799288,0 days 00:00:02.224871,98.16630130160686,7.329264063779406,sigmoid,35,35.0,,,,,,,,2.8574398326964174,8.32414860168971,5.11349412841063,18.0,40.0,65.0,85.0,COMPLETE
8592,0.3433060158179151,2024-04-11 18:58:16.803284,2024-04-11 18:58:19.025243,0 days 00:00:02.221959,95.50604198273591,7.820152434511686,sigmoid,38,19.0,,,,,,2.0,28.0,6.741881186214028,9.723002127822935,6.97217568955535,16.0,21.0,82.0,,COMPLETE
8593,0.4410486759438671,2024-04-11 18:58:19.030829,2024-04-11 18:58:21.656288,0 days 00:00:02.625459,99.97865288735535,8.03167521866739,sigmoid,47,44.0,21.0,29.0,,,,38.0,41.0,2.3729833309193693,5.577570759668961,3.083682094840542,11.0,26.0,96.0,67.0,COMPLETE
8594,0.47922521308962535,2024-04-11 18:58:21.659880,2024-04-11 18:58:23.634042,0 days 00:00:01.974162,96.76919119463162,6.750762801247396,sigmoid,24,,23.0,32.0,5.0,1.0,70.0,,,,,,,,,,COMPLETE
8595,0.6009432182607054,2024-04-11 18:58:23.637042,2024-04-11 18:58:25.197175,0 days 00:00:01.560133,93.58054935204694,7.605789573737052,sigmoid,8,,24.0,31.0,,,,,,,,,,,,,COMPLETE
8596,0.5929369437606513,2024-04-11 18:58:25.199784,2024-04-11 18:58:26.845659,0 days 00:00:01.645875,98.20359590763762,8.369025441765867,sigmoid,8,,27.0,33.0,,,,,,,,,,,,,COMPLETE
8597,0.5636462904171639,2024-04-11 18:58:26.849236,2024-04-11 18:58:28.088833,0 days 00:00:01.239597,96.70961891048164,7.904266108062924,sigmoid,0,,,,,,,,,,,,,,,,COMPLETE
8598,0.432508007524531,2024-04-11 18:58:28.090864,2024-04-11 18:58:30.338046,0 days 00:00:02.247182,98.19552019304574,8.17825728852421,sigmoid,21,,,,2.0,7.0,4.0,28.0,50.0,,,,,,,111.0,COMPLETE
8599,0.4512950859356088,2024-04-11 18:58:30.340627,2024-04-11 18:58:32.138100,0 days 00:00:01.797473,94.9217014033247,8.617408681274506,sigmoid,8,,26.0,28.0,,,,,,,,,,,,,COMPLETE
8600,0.5212902654083035,2024-04-11 18:58:32.143424,2024-04-11 18:58:34.288187,0 days 00:00:02.144763,91.69388399036481,8.011839086590818,sigmoid,3,,,,,,,,,8.5412928219707,1.029463080461964,5.479874901087972,2.0,43.0,60.0,132.0,COMPLETE
8601,0.4263281863386549,2024-04-11 18:58:34.291159,2024-04-11 18:58:35.964663,0 days 00:00:01.673504,98.13386814126375,7.70764786653876,sigmoid,9,,25.0,30.0,,,,,,,,,,,,21.0,COMPLETE
8602,0.35357956806424773,2024-04-11 18:58:35.967652,2024-04-11 18:58:38.431676,0 days 00:00:02.464024,96.61370433163171,8.253070110699557,sigmoid,14,,24.0,32.0,,,,15.0,40.0,1.2724539389158451,2.9364950216823438,2.4862190601526706,4.0,30.0,71.0,,COMPLETE
8603,0.5069140556625241,2024-04-11 18:58:38.439208,2024-04-11 18:58:40.068614,0 days 00:00:01.629406,98.21075746685565,8.480525431429506,sigmoid,8,,29.0,35.0,,,,,,,,,,,,,COMPLETE
8604,0.5658152464238371,2024-04-11 18:58:40.072555,2024-04-11 18:58:41.693327,0 days 00:00:01.620772,94.83289534017412,8.063225460472786,sigmoid,16,,,,3.0,3.0,36.0,,,,,,,,,,COMPLETE
8605,0.48859680104949804,2024-04-11 18:58:41.697358,2024-04-11 18:58:43.859039,0 days 00:00:02.161681,96.69468669888415,7.826628944355507,sigmoid,57,26.0,28.0,31.0,8.0,5.0,56.0,,,,,,,,,49.0,COMPLETE
8606,0.4702387076859759,2024-04-11 18:58:43.862080,2024-04-11 18:58:46.635908,0 days 00:00:02.773828,99.9715991034617,7.518405473607209,sigmoid,63,15.0,25.0,30.0,7.0,6.0,75.0,48.0,26.0,4.793385735971127,2.0636041094555653,6.46598897134954,15.0,34.0,64.0,144.0,COMPLETE
8607,0.49424448577010904,2024-04-11 18:58:46.639443,2024-04-11 18:58:48.818810,0 days 00:00:02.179367,98.15111285231794,8.305676733694256,sigmoid,42,12.0,26.0,27.0,,,,,,0.8590827117468178,7.242200953911434,4.215543142615289,17.0,32.0,99.0,,COMPLETE
8608,0.1125097125097125,2024-04-11 18:58:48.821403,2024-04-11 18:58:51.416296,0 days 00:00:02.594893,92.69641289719914,7.9605051566110525,rbf,46,3.0,24.0,32.0,,,,46.0,14.0,5.434573286324131,5.009932733318139,9.519539106890878,5.0,33.0,62.0,,COMPLETE
8609,0.3967154791779169,2024-04-11 18:58:51.419865,2024-04-11 18:58:54.220446,0 days 00:00:02.800581,98.15807603275762,8.096700290187156,sigmoid,15,,27.0,31.0,,,,47.0,46.0,1.779805130279414,2.603739463235343,6.071260079325357,8.0,36.0,51.0,43.0,COMPLETE
8610,0.12622036262203626,2024-04-11 18:58:54.223440,2024-04-11 18:58:55.794427,0 days 00:00:01.570987,95.06906413937209,7.806625454287929,sigmoid,8,,23.0,29.0,,,,,,,,,,,,,COMPLETE
8611,0.5906279643331437,2024-04-11 18:58:55.797399,2024-04-11 18:58:57.353623,0 days 00:00:01.556224,68.95380235134367,8.533067411752985,sigmoid,8,,25.0,34.0,,,,,,,,,,,,,COMPLETE
8612,0.45120108777760987,2024-04-11 18:58:57.356617,2024-04-11 18:58:59.549960,0 days 00:00:02.193343,96.64107172489258,8.225182295458994,sigmoid,28,,26.0,31.0,4.0,1.0,97.0,42.0,35.0,,,,,,,,COMPLETE
8613,0.46488149730444517,2024-04-11 18:58:59.552979,2024-04-11 18:59:01.841004,0 days 00:00:02.288025,98.05117307116791,7.180871881074489,sigmoid,11,,24.0,29.0,,,,,,2.1741268020288587,9.979803655670661,2.1779712018413635,20.0,46.0,73.0,75.0,COMPLETE
8614,0.4454676179414855,2024-04-11 18:59:01.845002,2024-04-11 18:59:04.806968,0 days 00:00:02.961966,99.96232339116678,7.644690656906868,sigmoid,62,23.0,27.0,30.0,1.0,8.0,42.0,21.0,11.0,4.326071616564359,4.714070515172835,8.848385658045135,11.0,21.0,87.0,,COMPLETE
8615,0.5952371952371952,2024-04-11 18:59:04.810544,2024-04-11 18:59:06.539295,0 days 00:00:01.728751,93.91061413113485,7.988655180977267,sigmoid,8,,22.0,32.0,,,,,,,,,,,,,COMPLETE
8616,0.5929369437606513,2024-04-11 18:59:06.543836,2024-04-11 18:59:08.056293,0 days 00:00:01.512457,98.23291738341678,8.377892672562774,sigmoid,8,,25.0,33.0,,,,,,,,,,,,,COMPLETE
8617,0.3680933608660285,2024-04-11 18:59:08.059861,2024-04-11 18:59:10.676818,0 days 00:00:02.616957,99.98332867598269,7.39421403377864,sigmoid,26,,23.0,31.0,5.0,4.0,32.0,,,8.308498132497416,8.537905968732673,1.5609825716185686,13.0,42.0,95.0,,COMPLETE
8618,0.4950372755745733,2024-04-11 18:59:10.682405,2024-04-11 18:59:12.652158,0 days 00:00:01.969753,96.60387393597266,8.172677163354937,sigmoid,41,21.0,28.0,30.0,,,,,,,,,,,,116.0,COMPLETE
8619,0.5288642150519681,2024-04-11 18:59:12.656141,2024-04-11 18:59:14.455664,0 days 00:00:01.799523,95.24188345191415,7.795876616880982,sigmoid,20,,,,6.0,2.0,87.0,5.0,5.0,,,,,,,,COMPLETE
8620,0.5963643249384587,2024-04-11 18:59:14.458667,2024-04-11 18:59:16.088169,0 days 00:00:01.629502,99.96670101836759,8.615058918858809,sigmoid,8,,26.0,32.0,,,,,,,,,,,,,COMPLETE
8621,0.34424229375246707,2024-04-11 18:59:16.091712,2024-04-11 18:59:18.157429,0 days 00:00:02.065717,99.97710957144332,7.968340205811771,sigmoid,10,,25.0,29.0,,,,,,5.151341629281008,3.129452884493662,9.37090149216809,7.0,40.0,56.0,,COMPLETE
8622,0.25876125342915646,2024-04-11 18:59:18.159958,2024-04-11 18:59:19.944009,0 days 00:00:01.784051,96.71369050474702,8.377573410094726,sigmoid,2,,,,,,,,,9.485261404458402,9.072956799931934,3.3720383758206607,14.0,24.0,97.0,,COMPLETE
8623,0.424481466816922,2024-04-11 18:59:19.948011,2024-04-11 18:59:21.918238,0 days 00:00:01.970227,82.21080327411838,7.616030041695342,sigmoid,56,25.0,26.0,34.0,4.0,5.0,90.0,,,,,,,,,,COMPLETE
8624,0.6009432182607054,2024-04-11 18:59:21.920814,2024-04-11 18:59:23.539626,0 days 00:00:01.618812,96.68599146663955,8.147733926793894,sigmoid,8,,27.0,31.0,,,,,,,,,,,,,COMPLETE
8625,0.5929369437606513,2024-04-11 18:59:23.541604,2024-04-11 18:59:24.983428,0 days 00:00:01.441824,94.183853151131,7.842903892477406,sigmoid,8,,23.0,33.0,,,,,,,,,,,,,COMPLETE
8626,0.09248325195866924,2024-04-11 18:59:24.986443,2024-04-11 18:59:28.013111,0 days 00:00:03.026668,97.99156393302152,8.188973349677111,rbf,59,45.0,24.0,30.0,3.0,7.0,26.0,,,3.0286499988512974,2.295554802508937,7.238299182856119,6.0,25.0,53.0,187.0,COMPLETE
8627,0.5391238178062834,2024-04-11 18:59:28.016123,2024-04-11 18:59:29.725469,0 days 00:00:01.709346,73.59788796422414,8.744777579240479,sigmoid,37,48.0,,,,,,31.0,20.0,,,,,,,152.0,COMPLETE
8628,0.4557447041436313,2024-04-11 18:59:29.728469,2024-04-11 18:59:32.499669,0 days 00:00:02.771200,99.96225723447793,7.984718313797978,sigmoid,55,10.0,,,8.0,2.0,59.0,45.0,43.0,7.859003832036201,7.748818954447046,7.467444998084475,19.0,30.0,67.0,82.0,COMPLETE
8629,0.5963643249384587,2024-04-11 18:59:32.502246,2024-04-11 18:59:34.111052,0 days 00:00:01.608806,98.21084823452932,8.39911481641809,sigmoid,8,,42.0,32.0,,,,,,,,,,,,,COMPLETE
8630,0.42825169459010104,2024-04-11 18:59:34.114085,2024-04-11 18:59:36.128408,0 days 00:00:02.014323,92.8200056556942,7.6420258995679955,sigmoid,52,30.0,,,2.0,8.0,78.0,38.0,2.0,,,,,,,,COMPLETE
8631,0.33966077228437386,2024-04-11 18:59:36.132004,2024-04-11 18:59:38.153567,0 days 00:00:02.021563,98.21578162609394,8.122561353648694,sigmoid,44,28.0,25.0,26.0,,,,16.0,18.0,,,,,,,,COMPLETE
8632,0.5054832777058783,2024-04-11 18:59:38.156567,2024-04-11 18:59:40.702364,0 days 00:00:02.545797,22.84518085629759,7.868772530471613,sigmoid,54,13.0,,,4.0,6.0,6.0,27.0,12.0,3.6147558644328672,7.507219660804138,7.832570935653921,15.0,22.0,85.0,,COMPLETE
8633,0.5986580986580987,2024-04-11 18:59:40.705353,2024-04-11 18:59:42.213243,0 days 00:00:01.507890,99.97597677292437,8.290931488305667,sigmoid,8,,29.0,31.0,,,,,,,,,,,,,COMPLETE
8634,0.38636437142210295,2024-04-11 18:59:42.216233,2024-04-11 18:59:44.700549,0 days 00:00:02.484316,95.46843545499961,8.880582384244343,sigmoid,23,,,,7.0,3.0,34.0,11.0,32.0,8.870016601929143,3.8317565249236196,8.229895156921462,3.0,48.0,55.0,106.0,COMPLETE
8635,0.4308384025390109,2024-04-11 18:59:44.704530,2024-04-11 18:59:46.216092,0 days 00:00:01.511562,99.99486100498096,7.457904670696298,sigmoid,8,,26.0,19.0,,,,,,,,,,,,,COMPLETE
8636,0.5374247020122185,2024-04-11 18:59:46.219090,2024-04-11 18:59:48.338255,0 days 00:00:02.119165,11.27215895811996,8.481306165504067,sigmoid,13,,24.0,30.0,,,,44.0,47.0,,,,,,,162.0,COMPLETE
8637,0.48448867536032947,2024-04-11 18:59:48.341822,2024-04-11 18:59:50.193001,0 days 00:00:01.851179,96.29259861539857,8.034301360801592,sigmoid,48,18.0,,,5.0,4.0,14.0,,,,,,,,,,COMPLETE
8638,0.12622036262203626,2024-04-11 18:59:50.196011,2024-04-11 18:59:51.758426,0 days 00:00:01.562415,96.8348206090899,7.7505046722107656,sigmoid,8,,27.0,29.0,,,,,,,,,,,,,COMPLETE
8639,0.5963643249384587,2024-04-11 18:59:51.760996,2024-04-11 18:59:53.385264,0 days 00:00:01.624268,99.96792071159686,8.22198803681904,sigmoid,8,,21.0,32.0,,,,,,,,,,,,,COMPLETE
8640,0.3327441136958213,2024-04-11 18:59:53.388289,2024-04-11 18:59:55.519654,0 days 00:00:02.131365,94.76874524672569,7.94126763585992,sigmoid,7,,,,,,,4.0,42.0,5.74850417777877,1.830878961132579,2.657301382446469,9.0,27.0,59.0,28.0,COMPLETE
8641,0.4923675277084598,2024-04-11 18:59:55.522240,2024-04-11 18:59:57.065213,0 days 00:00:01.542973,27.875987183989764,8.560359689341464,sigmoid,1,,,,,,,,,,,,,,,91.0,COMPLETE
8642,0.1763235916984329,2024-04-11 18:59:57.069214,2024-04-11 18:59:58.511634,0 days 00:00:01.442420,98.2050401957975,8.086328991923594,sigmoid,32,39.0,,,,,,,,,,,,,,,COMPLETE
8643,0.46787656847433895,2024-04-11 18:59:58.515655,2024-04-11 19:00:00.886960,0 days 00:00:02.371305,98.07349476309162,7.808029100517138,sigmoid,60,9.0,25.0,28.0,1.0,7.0,66.0,29.0,17.0,,,,,,,,COMPLETE
8644,0.33850026973565905,2024-04-11 19:00:00.891508,2024-04-11 19:00:02.597267,0 days 00:00:01.705759,99.9876242255909,8.363011589766913,sigmoid,36,37.0,,,,,,22.0,39.0,,,,,,,,COMPLETE
8645,0.42869886188864964,2024-04-11 19:00:02.599282,2024-04-11 19:00:05.075530,0 days 00:00:02.476248,96.8785965167711,7.614162657059761,rbf,4,,,,,,,23.0,21.0,,,,,,,,COMPLETE
8646,0.5473238584820079,2024-04-11 19:00:05.078528,2024-04-11 19:00:06.981924,0 days 00:00:01.903396,90.361484640257,8.22990112473343,sigmoid,12,,26.0,31.0,,,,17.0,48.0,,,,,,,,COMPLETE
8647,0.37068461088355764,2024-04-11 19:00:06.983941,2024-04-11 19:00:09.555769,0 days 00:00:02.571828,95.00768933116235,7.98726294737793,sigmoid,61,34.0,28.0,33.0,7.0,3.0,17.0,37.0,38.0,,,,,,,96.0,COMPLETE
8648,0.45345352376492626,2024-04-11 19:00:09.558768,2024-04-11 19:00:11.117145,0 days 00:00:01.558377,93.09937587368461,9.102320175511085,sigmoid,8,,23.0,30.0,,,,,,,,,,,,,COMPLETE
8649,0.5204094968416467,2024-04-11 19:00:11.120147,2024-04-11 19:00:12.881282,0 days 00:00:01.761135,98.1316193705194,7.237447932089157,sigmoid,40,16.0,25.0,32.0,,,,,,,,,,,,,COMPLETE
8650,0.5404113164213383,2024-04-11 19:00:12.884873,2024-04-11 19:00:14.668130,0 days 00:00:01.783257,96.63006148586834,7.727690337127766,sigmoid,33,47.0,,,,,,,,,,,,,,170.0,COMPLETE
8651,0.25810510422346183,2024-04-11 19:00:14.672661,2024-04-11 19:00:16.785029,0 days 00:00:02.112368,99.99781177954293,8.097954232198342,sigmoid,34,42.0,,,,,,,,4.047413585858958,6.296161278940136,8.598216023234675,5.0,20.0,82.0,,COMPLETE
8652,0.12622036262203626,2024-04-11 19:00:16.788046,2024-04-11 19:00:18.491972,0 days 00:00:01.703926,99.99478497365972,8.366924848780148,sigmoid,8,,22.0,29.0,,,,,,,,,,,,,COMPLETE
8653,0.5963245096172158,2024-04-11 19:00:18.495014,2024-04-11 19:00:20.210288,0 days 00:00:01.715274,95.52802081998084,8.706503404489448,sigmoid,8,,24.0,31.0,,,,,,,,,,,,,COMPLETE
8654,0.5531023596551585,2024-04-11 19:00:20.214852,2024-04-11 19:00:21.912488,0 days 00:00:01.697636,98.25893521634248,7.942700884371485,sigmoid,5,,,,,,,35.0,27.0,,,,,,,174.0,COMPLETE
8655,0.49937809538886,2024-04-11 19:00:21.916504,2024-04-11 19:00:24.155440,0 days 00:00:02.238936,99.97738896683305,7.423831200886763,sigmoid,45,43.0,27.0,33.0,,,,26.0,9.0,,,,,,,128.0,COMPLETE
8656,0.5204688631823869,2024-04-11 19:00:24.160433,2024-04-11 19:00:26.669070,0 days 00:00:02.508637,99.99651979666919,8.196551543399423,sigmoid,27,,26.0,31.0,6.0,1.0,10.0,,,7.420580034698016,7.05110719595277,9.81327770348966,12.0,50.0,93.0,136.0,COMPLETE
8657,0.4648491519205261,2024-04-11 19:00:26.672620,2024-04-11 19:00:28.504293,0 days 00:00:01.831673,99.99144469694075,8.511778330107752,sigmoid,17,,,,8.0,6.0,47.0,,,,,,,,,179.0,COMPLETE
8658,0.4423664426320963,2024-04-11 19:00:28.507289,2024-04-11 19:00:30.822331,0 days 00:00:02.315042,99.97289609965281,7.771750790797124,sigmoid,51,32.0,,,2.0,5.0,30.0,,,6.113889732100931,3.547497838974317,0.7784227633021583,17.0,35.0,86.0,58.0,COMPLETE
8659,0.49308286350499836,2024-04-11 19:00:30.826354,2024-04-11 19:00:32.800065,0 days 00:00:01.973711,96.58278217543666,7.950529073532996,sigmoid,53,27.0,,,3.0,4.0,40.0,6.0,30.0,,,,,,,191.0,COMPLETE
8660,0.46475159907379815,2024-04-11 19:00:32.803660,2024-04-11 19:00:35.205444,0 days 00:00:02.401784,92.48012319488726,8.23917165203513,sigmoid,19,,,,4.0,8.0,53.0,,,7.11821491384251,5.294609443076301,5.627285452876323,8.0,37.0,75.0,18.0,COMPLETE
8661,0.44701971028259324,2024-04-11 19:00:35.209441,2024-04-11 19:00:36.854882,0 days 00:00:01.645441,96.64638919899112,7.553603985134021,sigmoid,8,,32.0,30.0,,,,,,,,,,,,,COMPLETE
8662,0.34384269288451924,2024-04-11 19:00:36.857876,2024-04-11 19:00:39.150645,0 days 00:00:02.292769,94.33884195398193,8.095513285889812,sigmoid,50,50.0,,,5.0,2.0,23.0,,,4.464182146815283,8.219851358326684,9.998275807313718,10.0,29.0,66.0,,COMPLETE
8663,0.48671960222227856,2024-04-11 19:00:39.155235,2024-04-11 19:00:41.948171,0 days 00:00:02.792936,98.10399094170786,8.362444013185875,sigmoid,30,,24.0,34.0,2.0,1.0,62.0,19.0,23.0,9.852933243161182,0.8345572425192049,3.9709805084051135,2.0,33.0,78.0,,COMPLETE
8664,0.32227769437558923,2024-04-11 19:00:41.951174,2024-04-11 19:00:44.444326,0 days 00:00:02.493152,96.80252211494692,7.846276417639928,rbf,18,,,,6.0,3.0,44.0,,,6.6062964609186805,9.372871222105319,4.416467489796954,4.0,38.0,69.0,,COMPLETE
8665,0.5963643249384587,2024-04-11 19:00:44.447309,2024-04-11 19:00:46.298187,0 days 00:00:01.850878,99.98044002564497,8.586452089338989,sigmoid,8,,28.0,32.0,,,,,,,,,,,,,COMPLETE
8666,0.6009432182607054,2024-04-11 19:00:46.302192,2024-04-11 19:00:47.836300,0 days 00:00:01.534108,95.0649891346302,8.095825983389574,sigmoid,8,,24.0,31.0,,,,,,,,,,,,,COMPLETE
8667,0.12622036262203626,2024-04-11 19:00:47.839303,2024-04-11 19:00:49.384644,0 days 00:00:01.545341,98.156238591473,7.7413168251749696,sigmoid,8,,25.0,29.0,,,,,,,,,,,,,COMPLETE
8668,0.4468750897137772,2024-04-11 19:00:49.387633,2024-04-11 19:00:51.853034,0 days 00:00:02.465401,99.9697606868399,8.300316769309273,sigmoid,58,29.0,27.0,32.0,8.0,6.0,98.0,,,3.8049828185416925,6.737233536882199,1.0210942204657725,16.0,45.0,84.0,,COMPLETE
8669,0.42708301412680416,2024-04-11 19:00:51.856078,2024-04-11 19:00:54.456686,0 days 00:00:02.600608,96.85152956348992,6.0784629297771104,sigmoid,29,,26.0,27.0,1.0,5.0,83.0,39.0,4.0,,,,,,,195.0,COMPLETE
8670,0.45233845055337385,2024-04-11 19:00:54.460677,2024-04-11 19:00:56.371369,0 days 00:00:01.910692,95.34076238572786,7.943309123395834,sigmoid,24,,23.0,30.0,7.0,8.0,94.0,,,,,,,,,,COMPLETE
8671,0.4124594794107263,2024-04-11 19:00:56.374968,2024-04-11 19:00:58.119125,0 days 00:00:01.744157,96.90795731262835,8.092237284802403,sigmoid,49,41.0,,,3.0,7.0,69.0,,,,,,,,,88.0,COMPLETE
8672,0.5929369437606513,2024-04-11 19:00:58.122698,2024-04-11 19:00:59.847815,0 days 00:00:01.725117,98.16049738583206,7.58125032043192,sigmoid,8,,25.0,33.0,,,,,,,,,,,,,COMPLETE
8673,0.5110316719415288,2024-04-11 19:00:59.850807,2024-04-11 19:01:01.902496,0 days 00:00:02.051689,93.0447524146838,8.41053393374444,sigmoid,25,,26.0,30.0,5.0,2.0,12.0,,,,,,,,,124.0,COMPLETE
8674,0.49311538178337383,2024-04-11 19:01:01.905412,2024-04-11 19:01:04.381820,0 days 00:00:02.476408,98.21152062636004,7.860359104651133,sigmoid,39,20.0,,,,,,10.0,36.0,8.145423711419317,5.880610690822124,9.089535421035357,14.0,44.0,72.0,14.0,COMPLETE
