number,value,datetime_start,datetime_complete,duration,params_C,params_gamma,params_kernel,params_mask_number,params_rsi_window,params_so_smooth,params_so_window,params_srsi_smooth1,params_srsi_smooth2,params_srsi_window,params_tsi_window_fast,params_tsi_window_slow,params_ult_weight_1,params_ult_weight_2,params_ult_weight_3,params_ult_window_1,params_ult_window_2,params_ult_window_3,params_williams_lbp,state
6309,0.5952371952371952,2024-04-11 17:44:30.864229,2024-04-11 17:44:32.414216,0 days 00:00:01.549987,75.98602367784065,8.095796350515606,sigmoid,8,,27.0,32.0,,,,,,,,,,,,,COMPLETE
6310,0.34577422436056177,2024-04-11 17:44:32.418217,2024-04-11 17:44:34.733109,0 days 00:00:02.314892,95.3659921063069,7.676588869156973,rbf,10,,21.0,29.0,,,,,,7.994528975968845,9.873146620642384,7.027546797717161,18.0,45.0,52.0,,COMPLETE
6311,0.33769823446083685,2024-04-11 17:44:34.735098,2024-04-11 17:44:36.751572,0 days 00:00:02.016474,99.97461376902706,7.891817633596777,sigmoid,46,46.0,24.0,31.0,,,,36.0,36.0,7.166738979329118,9.331518334564779,1.4414327323696345,5.0,27.0,62.0,,COMPLETE
6312,0.40795061083164563,2024-04-11 17:44:36.754565,2024-04-11 17:44:38.448597,0 days 00:00:01.694032,98.25180200648242,8.233394204398229,sigmoid,57,43.0,25.0,32.0,4.0,5.0,89.0,,,,,,,,,155.0,COMPLETE
6313,0.4858194774346793,2024-04-11 17:44:38.452155,2024-04-11 17:44:40.744663,0 days 00:00:02.292508,96.57403758446964,8.453684867651155,sigmoid,14,,26.0,31.0,,,,27.0,38.0,2.9961013934143774,8.364926980985151,9.994458794760815,10.0,40.0,100.0,,COMPLETE
6314,0.12622036262203626,2024-04-11 17:44:40.747669,2024-04-11 17:44:41.950306,0 days 00:00:01.202637,93.6297910356746,8.02117354351182,sigmoid,8,,28.0,29.0,,,,,,,,,,,,,COMPLETE
6315,0.4675744039610355,2024-04-11 17:44:41.952905,2024-04-11 17:44:44.262501,0 days 00:00:02.309596,99.96979891150862,7.451818853485374,sigmoid,63,15.0,11.0,33.0,2.0,7.0,32.0,25.0,23.0,4.239572304800663,2.4517146133193717,1.967139388797083,16.0,36.0,71.0,89.0,COMPLETE
6316,0.2548065320569543,2024-04-11 17:44:44.266504,2024-04-11 17:44:46.062416,0 days 00:00:01.795912,98.10132497802371,7.722590471759358,sigmoid,2,,,,,,,,,8.366003064147234,1.4471165234240337,4.547065609061336,19.0,39.0,88.0,,COMPLETE
6317,0.4851144336127388,2024-04-11 17:44:46.065410,2024-04-11 17:44:48.554702,0 days 00:00:02.489292,95.30851817012373,8.719098367938528,sigmoid,26,,27.0,30.0,8.0,2.0,68.0,,,5.40361255801458,5.128295342694286,9.08342417932053,9.0,49.0,86.0,,COMPLETE
6318,0.438381535831315,2024-04-11 17:44:48.560502,2024-04-11 17:44:51.318846,0 days 00:00:02.758344,96.58068842066068,8.145365593119667,sigmoid,62,49.0,23.0,28.0,2.0,8.0,77.0,13.0,46.0,6.8822818640203165,9.689245793134155,2.3650414755518163,12.0,37.0,98.0,,COMPLETE
6319,0.5172243097900682,2024-04-11 17:44:51.324414,2024-04-11 17:44:53.799078,0 days 00:00:02.474664,98.11372639846749,7.884338953115019,sigmoid,42,5.0,24.0,32.0,,,,,,2.441008291914558,1.7060244041315769,7.745684420696774,17.0,43.0,82.0,,COMPLETE
6320,0.5153914187717065,2024-04-11 17:44:53.802648,2024-04-11 17:44:56.081944,0 days 00:00:02.279296,93.48159469843728,8.390191456145693,sigmoid,41,33.0,22.0,31.0,,,,,,,,,,,,136.0,COMPLETE
6321,0.12622036262203626,2024-04-11 17:44:56.087972,2024-04-11 17:44:57.905983,0 days 00:00:01.818011,99.95717551954758,8.1333124715889,sigmoid,8,,31.0,29.0,,,,,,,,,,,,,COMPLETE
6322,0.5952371952371952,2024-04-11 17:44:57.908989,2024-04-11 17:44:59.431720,0 days 00:00:01.522731,99.96507514706347,7.940090251264619,sigmoid,8,,26.0,32.0,,,,,,,,,,,,,COMPLETE
6323,0.5261297810493737,2024-04-11 17:44:59.434737,2024-04-11 17:45:01.214778,0 days 00:00:01.780041,99.98985713832397,8.490222803786816,sigmoid,37,29.0,,,,,,34.0,44.0,,,,,,,107.0,COMPLETE
6324,0.5362781019586557,2024-04-11 17:45:01.218781,2024-04-11 17:45:03.509586,0 days 00:00:02.290805,95.6486437939469,5.814572376795344,sigmoid,11,,25.0,31.0,,,,,,5.728944061212944,5.496240582143923,2.666212984978591,3.0,46.0,63.0,165.0,COMPLETE
6325,0.4669345636751501,2024-04-11 17:45:03.517145,2024-04-11 17:45:05.597566,0 days 00:00:02.080421,98.16068514464119,7.616653133063977,sigmoid,20,,,,3.0,6.0,95.0,19.0,34.0,,,,,,,,COMPLETE
6326,0.45345352376492626,2024-04-11 17:45:05.599568,2024-04-11 17:45:07.233711,0 days 00:00:01.634143,99.9577727018526,8.292251589147334,sigmoid,8,,25.0,30.0,,,,,,,,,,,,,COMPLETE
6327,0.6009432182607054,2024-04-11 17:45:07.236724,2024-04-11 17:45:09.037541,0 days 00:00:01.800817,96.64228364419256,7.838394958651634,sigmoid,8,,29.0,31.0,,,,,,,,,,,,,COMPLETE
6328,0.44540141494924634,2024-04-11 17:45:09.041682,2024-04-11 17:45:11.489274,0 days 00:00:02.447592,98.18755541322831,8.046781222957184,rbf,8,,23.0,33.0,,,,,,,,,,,,,COMPLETE
6329,0.5906279643331437,2024-04-11 17:45:11.492845,2024-04-11 17:45:13.028766,0 days 00:00:01.535921,95.20144417353329,8.258771857336232,sigmoid,8,,27.0,34.0,,,,,,,,,,,,,COMPLETE
6330,0.3069215353784492,2024-04-11 17:45:13.032335,2024-04-11 17:45:14.835439,0 days 00:00:01.803104,92.56406302102437,7.215939766677377,sigmoid,48,3.0,,,5.0,4.0,25.0,,,,,,,,,,COMPLETE
6331,0.5087105771293713,2024-04-11 17:45:14.838431,2024-04-11 17:45:16.856434,0 days 00:00:02.018003,99.95460131780247,4.526196031057619,sigmoid,52,20.0,,,4.0,1.0,12.0,11.0,14.0,,,,,,,,COMPLETE
6332,0.44129598526304387,2024-04-11 17:45:16.860434,2024-04-11 17:45:19.453271,0 days 00:00:02.592837,96.98323698717459,8.568951568907702,sigmoid,55,17.0,,,1.0,5.0,93.0,40.0,27.0,9.462666736385593,0.8176184483132758,9.372350044156255,15.0,30.0,60.0,174.0,COMPLETE
6333,0.3978922186661494,2024-04-11 17:45:19.456248,2024-04-11 17:45:21.359895,0 days 00:00:01.903647,89.73167281804189,7.732328854247425,sigmoid,56,36.0,24.0,30.0,8.0,6.0,100.0,,,,,,,,,,COMPLETE
6334,0.47808462785710554,2024-04-11 17:45:21.363451,2024-04-11 17:45:24.157718,0 days 00:00:02.794267,96.56484143141206,8.014685166496172,sigmoid,59,10.0,26.0,32.0,7.0,7.0,58.0,,,9.052883171784128,3.862786428249837,3.8279559765283295,18.0,29.0,75.0,65.0,COMPLETE
6335,0.49720832588886904,2024-04-11 17:45:24.160730,2024-04-11 17:45:26.220144,0 days 00:00:02.059414,99.988299442726,7.5032696432972426,sigmoid,13,,28.0,29.0,,,,23.0,8.0,,,,,,,147.0,COMPLETE
6336,0.3554644432194047,2024-04-11 17:45:26.223730,2024-04-11 17:45:28.369605,0 days 00:00:02.145875,98.16051025496202,8.317541621740858,sigmoid,12,,25.0,31.0,,,,30.0,47.0,,,,,,,,COMPLETE
6337,0.5929369437606513,2024-04-11 17:45:28.373191,2024-04-11 17:45:29.979272,0 days 00:00:01.606081,95.33288522734163,7.907891032832943,sigmoid,8,,26.0,33.0,,,,,,,,,,,,,COMPLETE
6338,0.44701971028259324,2024-04-11 17:45:29.982825,2024-04-11 17:45:31.569576,0 days 00:00:01.586751,98.27375176312813,8.193396907107307,sigmoid,8,,24.0,30.0,,,,,,,,,,,,,COMPLETE
6339,0.5536246566268581,2024-04-11 17:45:31.571560,2024-04-11 17:45:33.599966,0 days 00:00:02.028406,93.4430061432794,8.700731870606814,sigmoid,40,45.0,22.0,32.0,,,,,,,,,,,,,COMPLETE
6340,0.5285443130383998,2024-04-11 17:45:33.602502,2024-04-11 17:45:35.561897,0 days 00:00:01.959395,96.65413518538695,8.097330025237078,sigmoid,44,39.0,25.0,36.0,,,,28.0,50.0,,,,,,,,COMPLETE
6341,0.30832309947312125,2024-04-11 17:45:35.565994,2024-04-11 17:45:37.770944,0 days 00:00:02.204950,99.9821295906824,8.415412704319307,sigmoid,7,,,,,,,31.0,42.0,1.210672938015052,1.2329225810667603,8.701781988283999,8.0,50.0,78.0,22.0,COMPLETE
6342,0.4387941361017626,2024-04-11 17:45:37.774221,2024-04-11 17:45:40.217483,0 days 00:00:02.443262,98.0809003679854,7.689444700505538,sigmoid,60,18.0,24.0,30.0,3.0,3.0,49.0,32.0,25.0,,,,,,,,COMPLETE
6343,0.45347172512526845,2024-04-11 17:45:40.222084,2024-04-11 17:45:41.937415,0 days 00:00:01.715331,94.47421307540031,7.905228601532,sigmoid,8,,27.0,28.0,,,,,,,,,,,,,COMPLETE
6344,0.4535485261626341,2024-04-11 17:45:41.940411,2024-04-11 17:45:44.597352,0 days 00:00:02.656941,96.56682444231775,8.111026145989717,sigmoid,54,27.0,,,5.0,2.0,86.0,15.0,19.0,9.837835229923368,7.887824686847601,2.987608074941864,4.0,20.0,53.0,,COMPLETE
6345,0.3765727684026287,2024-04-11 17:45:44.601849,2024-04-11 17:45:47.375867,0 days 00:00:02.774018,99.9714763156244,8.398050527632934,sigmoid,23,,,,6.0,4.0,17.0,2.0,4.0,8.721004343789808,3.006730975291182,0.8756519607135687,8.0,35.0,92.0,56.0,COMPLETE
6346,0.053132155228086654,2024-04-11 17:45:47.379385,2024-04-11 17:45:50.016995,0 days 00:00:02.637610,98.14844128725821,7.772827302866606,rbf,61,24.0,23.0,31.0,4.0,7.0,64.0,5.0,16.0,,,,,,,200.0,COMPLETE
6347,0.5952371952371952,2024-04-11 17:45:50.019996,2024-04-11 17:45:51.903404,0 days 00:00:01.883408,96.89366412553679,7.442952550677091,sigmoid,8,,26.0,32.0,,,,,,,,,,,,,COMPLETE
6348,0.5503020853634769,2024-04-11 17:45:51.906415,2024-04-11 17:45:53.653155,0 days 00:00:01.746740,94.09914169846706,8.186494302412035,sigmoid,36,43.0,,,,,,10.0,31.0,,,,,,,,COMPLETE
6349,0.2730632873199065,2024-04-11 17:45:53.656171,2024-04-11 17:45:55.034577,0 days 00:00:01.378406,48.99271784097101,2.6314522906760818,sigmoid,1,,,,,,,,,,,,,,,190.0,COMPLETE
6350,0.4758757905208555,2024-04-11 17:45:55.038563,2024-04-11 17:45:57.564346,0 days 00:00:02.525783,98.27297348467812,7.93604563125076,sigmoid,27,,27.0,20.0,6.0,1.0,21.0,,,3.7483923699890287,6.375636130656253,3.562828201142954,6.0,31.0,90.0,129.0,COMPLETE
6351,0.55163344118568,2024-04-11 17:45:57.568353,2024-04-11 17:45:59.642526,0 days 00:00:02.074173,95.35811780428419,8.543074396702332,sigmoid,34,2.0,,,,,,,,0.9311981630775064,2.106316768609936,6.828480346263208,13.0,32.0,61.0,,COMPLETE
6352,0.48889045471627207,2024-04-11 17:45:59.645561,2024-04-11 17:46:02.526464,0 days 00:00:02.880903,98.19828046092148,8.987692690222305,sigmoid,30,,24.0,25.0,7.0,8.0,72.0,33.0,40.0,5.97835542136728,8.62443397879952,5.267066336226575,20.0,42.0,51.0,,COMPLETE
6353,0.4959422714913198,2024-04-11 17:46:02.530470,2024-04-11 17:46:03.947446,0 days 00:00:01.416976,96.8483992521308,7.656800115986571,sigmoid,32,41.0,,,,,,,,,,,,,,,COMPLETE
6354,0.5929369437606513,2024-04-11 17:46:03.950454,2024-04-11 17:46:05.679169,0 days 00:00:01.728715,99.98883160735282,8.249690459306482,sigmoid,8,,25.0,33.0,,,,,,,,,,,,,COMPLETE
6355,0.10641842234198921,2024-04-11 17:46:05.683699,2024-04-11 17:46:07.311703,0 days 00:00:01.628004,91.83036721265326,3.914507521110993,sigmoid,8,,26.0,29.0,,,,,,,,,,,,,COMPLETE
6356,0.6009432182607054,2024-04-11 17:46:07.318815,2024-04-11 17:46:08.956422,0 days 00:00:01.637607,98.20070532174694,7.97366579720407,sigmoid,8,,28.0,31.0,,,,,,,,,,,,,COMPLETE
6357,0.21177277495360283,2024-04-11 17:46:08.959440,2024-04-11 17:46:10.745810,0 days 00:00:01.786370,95.38485924643237,8.0892902206574,sigmoid,4,,,,,,,45.0,13.0,,,,,,,,COMPLETE
6358,0.4632010606481053,2024-04-11 17:46:10.748808,2024-04-11 17:46:13.501454,0 days 00:00:02.752646,98.14176885780623,7.809290419806563,sigmoid,51,22.0,,,1.0,6.0,98.0,,,2.2122273211402415,9.113033960931325,7.509698179970851,16.0,33.0,55.0,113.0,COMPLETE
6359,0.45345352376492626,2024-04-11 17:46:13.505691,2024-04-11 17:46:15.137097,0 days 00:00:01.631406,96.71398717178785,8.449270941510099,sigmoid,8,,25.0,30.0,,,,,,,,,,,,,COMPLETE
6360,0.5215158158471656,2024-04-11 17:46:15.140094,2024-04-11 17:46:16.930859,0 days 00:00:01.790765,94.40741033424479,4.212962197836243,sigmoid,5,,,,,,,41.0,29.0,,,,,,,159.0,COMPLETE
6361,0.5097532260670837,2024-04-11 17:46:16.936417,2024-04-11 17:46:19.280703,0 days 00:00:02.344286,99.95446966159552,8.314577569319146,sigmoid,19,,,,2.0,5.0,44.0,,,4.837064445036367,2.7298835556532093,1.7829500688943116,7.0,28.0,73.0,122.0,COMPLETE
6362,0.4911292005844292,2024-04-11 17:46:19.284258,2024-04-11 17:46:21.183660,0 days 00:00:01.899402,96.24417069217948,7.297753818690229,sigmoid,17,,,,8.0,3.0,54.0,,,,,,,,,50.0,COMPLETE
6363,0.5290450494644755,2024-04-11 17:46:21.186675,2024-04-11 17:46:22.707039,0 days 00:00:01.520364,98.08135832935149,8.05545979245444,sigmoid,33,37.0,,,,,,,,,,,,,,69.0,COMPLETE
6364,0.5952371952371952,2024-04-11 17:46:22.710037,2024-04-11 17:46:24.200418,0 days 00:00:01.490381,99.98140591442186,7.809011389890947,sigmoid,8,,22.0,32.0,,,,,,,,,,,,,COMPLETE
6365,0.4906035417419588,2024-04-11 17:46:24.202992,2024-04-11 17:46:26.938584,0 days 00:00:02.735592,98.16598890564545,7.5628056357128886,sigmoid,58,13.0,23.0,31.0,3.0,4.0,60.0,,,7.805553589053883,6.939466763411895,4.888587899720031,10.0,22.0,59.0,,COMPLETE
6366,0.23429931518289626,2024-04-11 17:46:26.941578,2024-04-11 17:46:29.334280,0 days 00:00:02.392702,93.6426655173387,8.599160776514015,rbf,45,30.0,29.0,33.0,,,,25.0,24.0,,,,,,,27.0,COMPLETE
6367,0.346871532797633,2024-04-11 17:46:29.337295,2024-04-11 17:46:31.943303,0 days 00:00:02.606008,13.14551293833533,8.203570996494369,sigmoid,50,6.0,,,5.0,2.0,29.0,,,8.130010138852812,3.3845462493910397,5.7579049412648615,11.0,47.0,85.0,,COMPLETE
6368,0.47349233295299586,2024-04-11 17:46:31.949886,2024-04-11 17:46:34.230979,0 days 00:00:02.281093,96.64428776501089,6.886061710822732,sigmoid,53,50.0,,,4.0,8.0,2.0,43.0,48.0,,,,,,,43.0,COMPLETE
6369,0.5599147210668228,2024-04-11 17:46:34.235554,2024-04-11 17:46:36.473966,0 days 00:00:02.238412,98.08564191277438,8.82161788171581,sigmoid,18,,,,1.0,5.0,34.0,,,4.535567988516002,7.376102877758532,5.921719521133081,2.0,28.0,70.0,,COMPLETE
6370,0.49977698009812876,2024-04-11 17:46:36.477016,2024-04-11 17:46:38.310093,0 days 00:00:01.833077,95.44455385370928,7.965862675941397,sigmoid,49,47.0,,,6.0,7.0,15.0,,,,,,,,,100.0,COMPLETE
6371,0.5721957722338603,2024-04-11 17:46:38.313600,2024-04-11 17:46:40.041940,0 days 00:00:01.728340,91.5051149711344,8.316863440661521,sigmoid,8,,26.0,44.0,,,,,,,,,,,,,COMPLETE
6372,0.1634272679750986,2024-04-11 17:46:40.044471,2024-04-11 17:46:42.185810,0 days 00:00:02.141339,99.95597137982536,7.627259697858301,sigmoid,6,,,,,,,49.0,33.0,3.2356155507290247,8.057403871638876,4.341102276579176,15.0,26.0,79.0,,COMPLETE
6373,0.48951100065784664,2024-04-11 17:46:42.188808,2024-04-11 17:46:44.202328,0 days 00:00:02.013520,98.15827598064165,8.102938348191083,sigmoid,25,,24.0,29.0,3.0,1.0,6.0,,,,,,,,,81.0,COMPLETE
6374,0.44701971028259324,2024-04-11 17:46:44.206021,2024-04-11 17:46:45.900089,0 days 00:00:01.694068,96.68012450486304,7.8295364746804665,sigmoid,8,,27.0,30.0,,,,,,,,,,,,,COMPLETE
6375,0.5974957313602731,2024-04-11 17:46:45.903885,2024-04-11 17:46:47.470241,0 days 00:00:01.566356,99.94937375750303,8.452762566547982,sigmoid,8,,25.0,31.0,,,,,,,,,,,,,COMPLETE
6376,0.5906279643331437,2024-04-11 17:46:47.472239,2024-04-11 17:46:49.119451,0 days 00:00:01.647212,94.302948898714,8.002266454549193,sigmoid,8,,26.0,34.0,,,,,,,,,,,,,COMPLETE
6377,0.5093363222283166,2024-04-11 17:46:49.122441,2024-04-11 17:46:51.448869,0 days 00:00:02.326428,87.5070019522422,8.235524706724728,sigmoid,43,40.0,24.0,32.0,,,,,,6.640315528170503,3.1173937686623963,7.891370699536271,14.0,43.0,93.0,179.0,COMPLETE
6378,0.4901187648456057,2024-04-11 17:46:51.456464,2024-04-11 17:46:54.019266,0 days 00:00:02.562802,98.24048944559864,7.753515644177462,sigmoid,29,,23.0,30.0,7.0,6.0,52.0,20.0,45.0,,,,,,,63.0,COMPLETE
6379,0.5986580986580987,2024-04-11 17:46:54.022277,2024-04-11 17:46:55.636540,0 days 00:00:01.614263,99.98950841813742,7.472550329673217,sigmoid,8,,27.0,31.0,,,,,,,,,,,,,COMPLETE
6380,0.36682992737713227,2024-04-11 17:46:55.639544,2024-04-11 17:46:57.653249,0 days 00:00:02.013705,96.34632135951493,8.134295679493338,sigmoid,35,25.0,,,,,,,,5.273803979575268,4.256748663041346,1.1441014387585886,19.0,23.0,64.0,33.0,COMPLETE
6381,0.529930912461033,2024-04-11 17:46:57.656767,2024-04-11 17:46:59.575583,0 days 00:00:01.918816,96.77379440874063,8.68744328536964,sigmoid,3,,,,,,,,,6.388539252090016,4.734023592866763,8.463705766324615,9.0,25.0,57.0,144.0,COMPLETE
6382,0.5307345680343244,2024-04-11 17:46:59.579575,2024-04-11 17:47:01.701526,0 days 00:00:02.121951,93.59486364018454,8.37840604919058,sigmoid,21,,,,2.0,4.0,42.0,37.0,35.0,,,,,,,93.0,COMPLETE
6383,0.5052038981928281,2024-04-11 17:47:01.705068,2024-04-11 17:47:03.962371,0 days 00:00:02.257303,95.1834891580844,7.915828664781067,sigmoid,39,32.0,,,,,,14.0,39.0,2.8881465271847895,2.310284498002017,6.293114845348066,5.0,49.0,99.0,150.0,COMPLETE
6384,0.07446808510638296,2024-04-11 17:47:03.964883,2024-04-11 17:47:07.104574,0 days 00:00:03.139691,97.02778382216891,8.14675771766978,rbf,47,34.0,25.0,28.0,,,,9.0,10.0,7.053741764097927,7.581827848222797,9.643324985940039,17.0,35.0,87.0,187.0,COMPLETE
6385,0.33705772811918056,2024-04-11 17:47:07.107594,2024-04-11 17:47:09.371288,0 days 00:00:02.263694,98.16640595855232,7.642852270365221,sigmoid,38,31.0,,,,,,48.0,28.0,2.6573993811354204,0.5026569644949701,3.0855958123426466,3.0,38.0,76.0,,COMPLETE
6386,0.32713818033010506,2024-04-11 17:47:09.375878,2024-04-11 17:47:11.708664,0 days 00:00:02.332786,98.19443986694532,7.931954410437685,sigmoid,22,,,,5.0,2.0,27.0,6.0,44.0,3.539665580212916,1.8131746416386925,7.227916851398375,8.0,44.0,69.0,,COMPLETE
6387,0.46440633590784136,2024-04-11 17:47:11.711661,2024-04-11 17:47:14.879162,0 days 00:00:03.167501,99.97386224885642,8.519745750033874,sigmoid,31,,26.0,32.0,8.0,3.0,74.0,39.0,32.0,1.7491535867819334,6.671348495174591,2.171578160634126,12.0,21.0,83.0,168.0,COMPLETE
6388,0.49518598411111686,2024-04-11 17:47:14.883178,2024-04-11 17:47:16.917577,0 days 00:00:02.034399,65.66796388655604,8.252589271202684,sigmoid,24,,28.0,29.0,3.0,5.0,88.0,,,,,,,,,,COMPLETE
6389,0.5929369437606513,2024-04-11 17:47:16.920564,2024-04-11 17:47:18.588125,0 days 00:00:01.667561,52.713838749291675,8.00295305658334,sigmoid,8,,21.0,33.0,,,,,,,,,,,,,COMPLETE
6390,0.3934782608695653,2024-04-11 17:47:18.591144,2024-04-11 17:47:21.190415,0 days 00:00:02.599271,95.11930278515271,7.787088695533445,sigmoid,15,,30.0,27.0,,,,28.0,42.0,6.27322649168291,5.946498295354045,0.6875706048181698,7.0,39.0,81.0,104.0,COMPLETE
6391,0.4491845899314583,2024-04-11 17:47:21.193414,2024-04-11 17:47:22.979514,0 days 00:00:01.786100,99.97860197617048,7.181001101556326,sigmoid,8,,24.0,30.0,,,,,,,,,,,,,COMPLETE
6392,0.3300410271995137,2024-04-11 17:47:22.982489,2024-04-11 17:47:24.709912,0 days 00:00:01.727423,99.97437722112961,8.344555318568887,sigmoid,9,,23.0,32.0,,,,,,,,,,,,75.0,COMPLETE
6393,0.6009432182607054,2024-04-11 17:47:24.712898,2024-04-11 17:47:26.388908,0 days 00:00:01.676010,98.33883515704761,8.1417112290248,sigmoid,8,,25.0,31.0,,,,,,,,,,,,,COMPLETE
6394,0.5586636642466125,2024-04-11 17:47:26.391901,2024-04-11 17:47:28.193871,0 days 00:00:01.801970,96.67006703892945,7.513969925908238,sigmoid,16,,,,4.0,8.0,81.0,,,,,,,,,,COMPLETE
6395,0.4343391925130482,2024-04-11 17:47:28.196444,2024-04-11 17:47:30.295882,0 days 00:00:02.099438,98.28493950114866,7.876977499348478,sigmoid,57,38.0,26.0,38.0,6.0,3.0,66.0,,,,,,,,,110.0,COMPLETE
6396,0.5906279643331437,2024-04-11 17:47:30.299874,2024-04-11 17:47:32.072602,0 days 00:00:01.772728,92.28209804474457,8.515712944000256,sigmoid,8,,27.0,34.0,,,,,,,,,,,,,COMPLETE
6397,0.44701971028259324,2024-04-11 17:47:32.076163,2024-04-11 17:47:33.650970,0 days 00:00:01.574807,95.38267145854333,8.144569400251221,sigmoid,8,,24.0,30.0,,,,,,,,,,,,,COMPLETE
6398,0.4663247697056607,2024-04-11 17:47:33.653954,2024-04-11 17:47:35.881210,0 days 00:00:02.227256,98.18826415870555,7.722083122552579,sigmoid,28,,25.0,32.0,1.0,7.0,37.0,34.0,21.0,,,,,,,,COMPLETE
6399,0.42866564739035284,2024-04-11 17:47:35.883713,2024-04-11 17:47:39.149758,0 days 00:00:03.266045,96.75994189072907,7.989301061802972,sigmoid,63,42.0,28.0,31.0,2.0,1.0,70.0,16.0,2.0,4.111592869150533,1.097875606636027,3.3253833573235427,4.0,45.0,96.0,138.0,COMPLETE
6400,0.4993224276449521,2024-04-11 17:47:39.152755,2024-04-11 17:47:41.766971,0 days 00:00:02.614216,99.9703353279635,8.322938322357619,sigmoid,46,16.0,27.0,33.0,,,,21.0,6.0,8.974500361887824,9.499729595495946,9.209864504814446,18.0,24.0,74.0,,COMPLETE
6401,0.3518817401511261,2024-04-11 17:47:41.772990,2024-04-11 17:47:44.194073,0 days 00:00:02.421083,93.77792982767117,8.693812847883397,sigmoid,42,21.0,22.0,29.0,,,,,,0.7328702684741817,5.053746025217156,5.469495064941746,6.0,41.0,89.0,,COMPLETE
6402,0.43572948158100994,2024-04-11 17:47:44.197622,2024-04-11 17:47:47.841206,0 days 00:00:03.643584,98.27725431794123,7.379689507718444,rbf,2,,,,,,,,,1.5224523482551935,6.213379656451532,1.5641910471672578,9.0,50.0,67.0,,COMPLETE
6403,0.5274193195013475,2024-04-11 17:47:47.844189,2024-04-11 17:47:49.927244,0 days 00:00:02.083055,68.93239049457637,8.023129472907682,sigmoid,10,,26.0,31.0,,,,,,5.006854888633272,5.790023715288362,6.478953051261506,13.0,46.0,77.0,,COMPLETE
6404,0.4616829240946295,2024-04-11 17:47:49.930219,2024-04-11 17:47:52.496033,0 days 00:00:02.565814,99.97387494666357,7.651853486110264,sigmoid,62,11.0,24.0,35.0,7.0,4.0,78.0,4.0,17.0,7.3411715971241165,5.25783519205783,6.711649995639219,2.0,30.0,50.0,,COMPLETE
6405,0.5029740716073767,2024-04-11 17:47:52.499067,2024-04-11 17:47:54.869788,0 days 00:00:02.370721,95.37385716089699,8.286641666393502,sigmoid,14,,25.0,22.0,,,,42.0,37.0,4.702317633934559,3.7163903366055013,7.989801002936513,15.0,34.0,71.0,,COMPLETE
6406,0.44701971028259324,2024-04-11 17:47:54.872786,2024-04-11 17:47:56.437717,0 days 00:00:01.564931,96.70786678027468,7.847763220893939,sigmoid,8,,23.0,30.0,,,,,,,,,,,,,COMPLETE
6407,0.5076471361584646,2024-04-11 17:47:56.440715,2024-04-11 17:47:58.241856,0 days 00:00:01.801141,84.34223760861687,8.457380692559877,sigmoid,41,9.0,26.0,32.0,,,,,,,,,,,,117.0,COMPLETE
6408,0.5598407083067525,2024-04-11 17:47:58.245855,2024-04-11 17:48:00.046119,0 days 00:00:01.800264,96.71185437270643,8.198857295319055,sigmoid,8,,25.0,46.0,,,,,,,,,,,,,COMPLETE
6409,0.5095146942911835,2024-04-11 17:48:00.048657,2024-04-11 17:48:02.542529,0 days 00:00:02.493872,93.87158469728959,8.079128528836739,sigmoid,26,,28.0,6.0,4.0,7.0,24.0,,,3.413662833143662,8.735206181659859,3.7225621819073247,11.0,48.0,65.0,,COMPLETE
6410,0.12003789673140693,2024-04-11 17:48:02.546125,2024-04-11 17:48:04.224117,0 days 00:00:01.677992,99.95354687538364,7.864411967259733,sigmoid,8,,29.0,28.0,,,,,,,,,,,,,COMPLETE
