number,value,datetime_start,datetime_complete,duration,params_C,params_gamma,params_kernel,params_mask_number,params_rsi_window,params_so_smooth,params_so_window,params_srsi_smooth1,params_srsi_smooth2,params_srsi_window,params_tsi_window_fast,params_tsi_window_slow,params_ult_weight_1,params_ult_weight_2,params_ult_weight_3,params_ult_window_1,params_ult_window_2,params_ult_window_3,params_williams_lbp,state
8879,0.38044884232311466,2024-04-11 19:08:54.087670,2024-04-11 19:08:57.423950,0 days 00:00:03.336280,95.13761163856216,7.928757955407914,sigmoid,14,,24.0,33.0,,,,21.0,21.0,9.297142044141705,2.6911865914897652,6.094786641198976,17.0,22.0,67.0,,COMPLETE
8880,0.4813495825914021,2024-04-11 19:08:57.427946,2024-04-11 19:09:00.415746,0 days 00:00:02.987800,99.93202755751601,8.049964047330334,sigmoid,41,15.0,22.0,32.0,,,,,,,,,,,,86.0,COMPLETE
8881,0.6009432182607054,2024-04-11 19:09:00.418746,2024-04-11 19:09:02.846271,0 days 00:00:02.427525,48.23343855789511,7.745447458467227,sigmoid,8,,29.0,31.0,,,,,,,,,,,,,COMPLETE
8882,0.38054602232322293,2024-04-11 19:09:02.849262,2024-04-11 19:09:06.870031,0 days 00:00:04.020769,96.62327665525241,8.391206477663241,sigmoid,62,37.0,25.0,34.0,4.0,3.0,16.0,47.0,14.0,6.013109765156595,1.999868999608125,5.452649889945088,2.0,27.0,83.0,,COMPLETE
8883,0.5119357393370291,2024-04-11 19:09:06.874038,2024-04-11 19:09:09.790505,0 days 00:00:02.916467,90.82642652291824,8.150906661874007,sigmoid,11,,28.0,29.0,,,,,,1.4662254984981375,5.203098269231295,0.987768824241769,8.0,40.0,75.0,151.0,COMPLETE
8884,0.44701971028259324,2024-04-11 19:09:09.793503,2024-04-11 19:09:11.813856,0 days 00:00:02.020353,96.8289970333819,7.875581819865212,sigmoid,8,,15.0,30.0,,,,,,,,,,,,,COMPLETE
8885,0.5952371952371952,2024-04-11 19:09:11.816858,2024-04-11 19:09:13.901049,0 days 00:00:02.084191,99.97703426160538,7.486561817515332,sigmoid,8,,26.0,32.0,,,,,,,,,,,,,COMPLETE
8886,0.5963245096172158,2024-04-11 19:09:13.904047,2024-04-11 19:09:16.060890,0 days 00:00:02.156843,98.18492211732868,8.680238728193988,sigmoid,8,,25.0,31.0,,,,,,,,,,,,,COMPLETE
8887,0.4674849763457358,2024-04-11 19:09:16.065886,2024-04-11 19:09:18.544517,0 days 00:00:02.478631,93.8866218922936,8.2615664410232,sigmoid,20,,,,6.0,5.0,32.0,16.0,27.0,,,,,,,,COMPLETE
8888,0.5232123451423603,2024-04-11 19:09:18.547518,2024-04-11 19:09:21.103259,0 days 00:00:02.555741,98.26414899795752,8.082910049220299,sigmoid,52,18.0,,,3.0,6.0,6.0,11.0,17.0,,,,,,,,COMPLETE
8889,0.2836029474040823,2024-04-11 19:09:21.106258,2024-04-11 19:09:23.463374,0 days 00:00:02.357116,95.18299679927881,5.353943904002447,sigmoid,48,47.0,,,8.0,2.0,91.0,,,,,,,,,,COMPLETE
8890,0.4523620847302652,2024-04-11 19:09:23.467377,2024-04-11 19:09:26.499007,0 days 00:00:03.031630,99.94889218155495,8.470752058989525,rbf,8,,24.0,29.0,,,,,,,,,,,,,COMPLETE
8891,0.4681866666666667,2024-04-11 19:09:26.503005,2024-04-11 19:09:30.519340,0 days 00:00:04.016335,98.29032076944313,7.699451118576916,sigmoid,59,16.0,27.0,33.0,5.0,7.0,51.0,,,4.380371963416847,3.801676641283172,3.002026548752179,9.0,29.0,94.0,29.0,COMPLETE
8892,0.44701971028259324,2024-04-11 19:09:30.523338,2024-04-11 19:09:32.721489,0 days 00:00:02.198151,96.63618019163344,7.892624668241667,sigmoid,8,,26.0,30.0,,,,,,,,,,,,,COMPLETE
8893,0.3163068409363963,2024-04-11 19:09:32.725488,2024-04-11 19:09:35.292533,0 days 00:00:02.567045,99.9778934322139,8.100563493221962,sigmoid,37,5.0,,,,,,3.0,50.0,,,,,,,39.0,COMPLETE
8894,0.5963643249384587,2024-04-11 19:09:35.296533,2024-04-11 19:09:37.683135,0 days 00:00:02.386602,98.2658489301821,8.355785822324806,sigmoid,8,,23.0,32.0,,,,,,,,,,,,,COMPLETE
8895,0.5032160780340692,2024-04-11 19:09:37.686361,2024-04-11 19:09:41.206926,0 days 00:00:03.520565,92.3593051764833,7.914861425700569,sigmoid,26,,27.0,28.0,1.0,1.0,41.0,,,6.745283601882253,3.399613857621585,4.966483559176421,6.0,48.0,79.0,,COMPLETE
8896,0.40563744831286885,2024-04-11 19:09:41.210924,2024-04-11 19:09:44.619984,0 days 00:00:03.409060,95.19876131204663,7.601912561807857,sigmoid,23,,,,7.0,8.0,29.0,42.0,11.0,2.465367962273935,5.354809525702441,7.152749042700872,13.0,45.0,99.0,51.0,COMPLETE
8897,0.422337138172416,2024-04-11 19:09:44.623986,2024-04-11 19:09:48.128259,0 days 00:00:03.504273,96.81864945265754,8.189004669914398,sigmoid,55,13.0,,,2.0,4.0,43.0,2.0,6.0,4.805413342434714,6.130831658545343,1.7653720354709765,19.0,50.0,60.0,182.0,COMPLETE
8898,0.5089488953358626,2024-04-11 19:09:48.132252,2024-04-11 19:09:50.709785,0 days 00:00:02.577533,99.99943375354931,8.594183978452003,sigmoid,12,,25.0,31.0,,,,18.0,2.0,,,,,,,,COMPLETE
8899,0.348008863977058,2024-04-11 19:09:50.712783,2024-04-11 19:09:54.480104,0 days 00:00:03.767321,98.31290721124293,7.835287721649379,sigmoid,54,6.0,,,4.0,5.0,4.0,5.0,20.0,5.679560612218979,9.265418021071007,2.5358397003150075,18.0,21.0,58.0,,COMPLETE
8900,0.5141289975023262,2024-04-11 19:09:54.486122,2024-04-11 19:09:57.674387,0 days 00:00:03.188265,95.53435212971286,8.054300301494036,sigmoid,60,49.0,23.0,32.0,3.0,3.0,58.0,35.0,30.0,,,,,,,,COMPLETE
8901,0.5205248918901646,2024-04-11 19:09:57.678387,2024-04-11 19:10:00.743112,0 days 00:00:03.064725,98.32093615375908,8.341263891583056,sigmoid,44,8.0,24.0,30.0,,,,37.0,45.0,,,,,,,,COMPLETE
8902,0.6009432182607054,2024-04-11 19:10:00.748111,2024-04-11 19:10:03.070945,0 days 00:00:02.322834,92.88246367283404,7.717292913024359,sigmoid,8,,26.0,31.0,,,,,,,,,,,,,COMPLETE
8903,0.3901740613236382,2024-04-11 19:10:03.073948,2024-04-11 19:10:06.235482,0 days 00:00:03.161534,98.2053119171032,7.336659817645642,sigmoid,56,26.0,28.0,33.0,8.0,2.0,47.0,,,,,,,,,,COMPLETE
8904,0.4670254973226425,2024-04-11 19:10:06.238478,2024-04-11 19:10:08.621589,0 days 00:00:02.383111,95.36376101460557,8.206285916661425,sigmoid,36,32.0,,,,,,48.0,32.0,,,,,,,,COMPLETE
8905,0.3369071550889733,2024-04-11 19:10:08.625588,2024-04-11 19:10:11.546703,0 days 00:00:02.921115,96.86203786183559,8.84281181075243,sigmoid,7,,,,,,,24.0,26.0,1.066874841914764,7.173255181570977,9.24658843308486,15.0,47.0,95.0,34.0,COMPLETE
8906,0.38224715393499414,2024-04-11 19:10:11.551703,2024-04-11 19:10:14.419492,0 days 00:00:02.867789,98.27330378653511,7.99821274549482,sigmoid,13,,21.0,29.0,,,,27.0,23.0,,,,,,,65.0,COMPLETE
8907,0.42974070602936587,2024-04-11 19:10:14.424496,2024-04-11 19:10:17.807789,0 days 00:00:03.383293,99.93798577297369,9.991776969947923,rbf,8,,25.0,32.0,,,,,,,,,,,,,COMPLETE
8908,0.5428892062844316,2024-04-11 19:10:17.810788,2024-04-11 19:10:20.348231,0 days 00:00:02.537443,94.25163803085331,8.524760244925425,sigmoid,40,31.0,26.0,30.0,,,,,,,,,,,,,COMPLETE
8909,0.6009432182607054,2024-04-11 19:10:20.351230,2024-04-11 19:10:22.843749,0 days 00:00:02.492519,96.61187182390188,7.8418734895955255,sigmoid,8,,23.0,31.0,,,,,,,,,,,,,COMPLETE
8910,0.41585295807007466,2024-04-11 19:10:22.849748,2024-04-11 19:10:27.114716,0 days 00:00:04.264968,98.26498869768348,8.288162170958662,sigmoid,27,,22.0,34.0,2.0,8.0,36.0,,,2.1209336638232363,0.6799543944994912,3.866873118164545,16.0,46.0,82.0,134.0,COMPLETE
8911,0.12622036262203626,2024-04-11 19:10:27.118716,2024-04-11 19:10:29.435357,0 days 00:00:02.316641,99.99461826987026,8.059096218673462,sigmoid,8,,24.0,29.0,,,,,,,,,,,,,COMPLETE
8912,0.45323392994337425,2024-04-11 19:10:29.440352,2024-04-11 19:10:31.913039,0 days 00:00:02.472687,96.60194226677753,5.0578216466900585,sigmoid,4,,,,,,,26.0,48.0,,,,,,,,COMPLETE
8913,0.5437947769817425,2024-04-11 19:10:31.916035,2024-04-11 19:10:34.039764,0 days 00:00:02.123729,99.93796756626048,7.520020617501981,sigmoid,1,,,,,,,,,,,,,,,70.0,COMPLETE
8914,0.3704714470901276,2024-04-11 19:10:34.043768,2024-04-11 19:10:37.104136,0 days 00:00:03.060368,99.98395635865378,8.409124899067715,sigmoid,61,44.0,31.0,31.0,6.0,6.0,14.0,46.0,9.0,,,,,,,175.0,COMPLETE
8915,0.2921149707961881,2024-04-11 19:10:37.108118,2024-04-11 19:10:39.909895,0 days 00:00:02.801777,99.99907843619152,7.700365477768495,sigmoid,34,19.0,,,,,,,,3.070736951441025,8.485277079252981,2.2653341971601804,7.0,38.0,69.0,,COMPLETE
8916,0.3717027227985695,2024-04-11 19:10:39.913895,2024-04-11 19:10:42.566872,0 days 00:00:02.652977,94.19500845076314,8.000258529831871,sigmoid,5,,,,,,,34.0,18.0,,,,,,,83.0,COMPLETE
8917,0.4513290990355211,2024-04-11 19:10:42.570873,2024-04-11 19:10:45.193875,0 days 00:00:02.623002,96.7845514864726,5.985420413380524,sigmoid,8,,27.0,30.0,,,,,,,,,,,,,COMPLETE
8918,0.5751561592097617,2024-04-11 19:10:45.198881,2024-04-11 19:10:47.480653,0 days 00:00:02.281772,98.19504044521689,8.192820367197717,sigmoid,32,9.0,,,,,,,,,,,,,,,COMPLETE
8919,0.5407567317515083,2024-04-11 19:10:47.483649,2024-04-11 19:10:49.621783,0 days 00:00:02.138134,99.95442615604826,7.852696218609939,sigmoid,33,27.0,,,,,,,,,,,,,,98.0,COMPLETE
8920,0.4512950859356088,2024-04-11 19:10:49.626797,2024-04-11 19:10:52.460344,0 days 00:00:02.833547,95.5412217971019,8.580576535019242,sigmoid,8,,25.0,28.0,,,,,,,,,,,,,COMPLETE
8921,0.5060347766791681,2024-04-11 19:10:52.465345,2024-04-11 19:10:55.372395,0 days 00:00:02.907050,92.15225872913828,8.192663334120473,sigmoid,17,,,,7.0,7.0,66.0,,,,,,,,,160.0,COMPLETE
8922,0.48559137795457696,2024-04-11 19:10:55.375383,2024-04-11 19:10:58.660645,0 days 00:00:03.285262,17.456692077699657,7.216530714126842,sigmoid,53,39.0,,,1.0,4.0,55.0,30.0,43.0,,,,,,,118.0,COMPLETE
8923,0.4646569910784638,2024-04-11 19:10:58.664647,2024-04-11 19:11:02.946669,0 days 00:00:04.282022,96.64968076843714,8.040264815668715,sigmoid,30,,26.0,32.0,4.0,2.0,19.0,32.0,40.0,1.7222389428951503,2.978189846433847,4.295473420386165,20.0,24.0,71.0,,COMPLETE
8924,0.4889421863165867,2024-04-11 19:11:02.951671,2024-04-11 19:11:05.448653,0 days 00:00:02.496982,98.14161522914273,3.0759162482577596,sigmoid,8,,24.0,31.0,,,,,,,,,,,,,COMPLETE
8925,0.3758849627135711,2024-04-11 19:11:05.453644,2024-04-11 19:11:09.087345,0 days 00:00:03.633701,98.16414679754668,7.638176501578619,sigmoid,51,10.0,,,6.0,1.0,27.0,,,2.7824080603996473,8.042407934867589,0.6705756577804047,4.0,20.0,84.0,91.0,COMPLETE
8926,0.11495104525006618,2024-04-11 19:11:09.092348,2024-04-11 19:11:12.958240,0 days 00:00:03.865892,93.91063602858678,8.31161016867996,rbf,45,41.0,27.0,33.0,,,,29.0,4.0,,,,,,,169.0,COMPLETE
8927,0.44701971028259324,2024-04-11 19:11:12.962233,2024-04-11 19:11:15.603827,0 days 00:00:02.641594,99.94683405503336,7.866155342329917,sigmoid,8,,29.0,30.0,,,,,,,,,,,,,COMPLETE
8928,0.39325402478985605,2024-04-11 19:11:15.608826,2024-04-11 19:11:18.590744,0 days 00:00:02.981918,96.75382902207025,8.46692027492337,sigmoid,49,3.0,,,5.0,5.0,79.0,,,,,,,,,139.0,COMPLETE
8929,0.5952371952371952,2024-04-11 19:11:18.593748,2024-04-11 19:11:20.941690,0 days 00:00:02.347942,94.87677950779164,8.059319873595392,sigmoid,8,,25.0,32.0,,,,,,,,,,,,,COMPLETE
8930,0.5931679318644695,2024-04-11 19:11:20.945693,2024-04-11 19:11:23.526435,0 days 00:00:02.580742,96.68600553461772,7.465672671856273,sigmoid,8,,26.0,27.0,,,,,,,,,,,,,COMPLETE
8931,0.4343160004218964,2024-04-11 19:11:23.531439,2024-04-11 19:11:27.118050,0 days 00:00:03.586611,98.27166171318598,8.686710019897761,sigmoid,18,,,,3.0,3.0,39.0,,,8.025242148591413,2.3190085229757273,8.415849614874878,10.0,49.0,52.0,,COMPLETE
8932,0.46773446451644357,2024-04-11 19:11:27.122045,2024-04-11 19:11:30.802574,0 days 00:00:03.680529,99.98577310598859,7.770262299182092,sigmoid,50,25.0,,,7.0,4.0,62.0,,,3.5770437241506787,1.2271179857889924,6.474755067342141,12.0,41.0,66.0,,COMPLETE
8933,0.22085244246223754,2024-04-11 19:11:30.805578,2024-04-11 19:11:34.034686,0 days 00:00:03.229108,96.66148598874314,8.204420138469382,sigmoid,6,,,,,,,39.0,7.0,5.1006400395171605,5.026187157564698,1.246270841757502,3.0,39.0,55.0,,COMPLETE
8934,0.4795246385587768,2024-04-11 19:11:34.038683,2024-04-11 19:11:38.163162,0 days 00:00:04.124479,99.9787451150719,7.957896891610081,sigmoid,58,4.0,28.0,30.0,8.0,6.0,100.0,,,7.6201901349860695,1.5339635787151802,2.0226719142842913,5.0,33.0,86.0,,COMPLETE
8935,0.39669702114523847,2024-04-11 19:11:38.166153,2024-04-11 19:11:41.678291,0 days 00:00:03.512138,90.1787306236765,8.386092596443396,sigmoid,19,,,,5.0,8.0,76.0,,,4.242177255822295,8.647982507950049,3.6209880810546053,18.0,46.0,77.0,57.0,COMPLETE
8936,0.450855298274153,2024-04-11 19:11:41.683293,2024-04-11 19:11:45.945142,0 days 00:00:04.261849,95.22577904128897,8.145821034275233,sigmoid,47,50.0,24.0,34.0,,,,44.0,22.0,8.810646739492586,6.629855916941205,7.3919162429444345,11.0,23.0,61.0,74.0,COMPLETE
8937,0.5975287681569516,2024-04-11 19:11:45.948143,2024-04-11 19:11:48.821031,0 days 00:00:02.872888,93.46371214206088,6.8256841725942055,sigmoid,8,,22.0,31.0,,,,,,,,,,,,,COMPLETE
8938,0.12622036262203626,2024-04-11 19:11:48.826019,2024-04-11 19:11:51.568085,0 days 00:00:02.742066,98.20679197199048,7.6856816431920105,sigmoid,8,,25.0,29.0,,,,,,,,,,,,,COMPLETE
8939,0.5005099843604796,2024-04-11 19:11:51.572085,2024-04-11 19:11:55.397393,0 days 00:00:03.825308,99.97939088461507,7.906405651817909,sigmoid,43,48.0,26.0,33.0,,,,,,8.499271121762208,5.647765988838447,7.981611594183548,8.0,34.0,93.0,125.0,COMPLETE
8940,0.44227244960293216,2024-04-11 19:11:55.401393,2024-04-11 19:11:59.359286,0 days 00:00:03.957893,95.75758783874025,8.33997722464917,sigmoid,22,,,,4.0,1.0,87.0,13.0,38.0,4.610476405065145,8.285561768928925,5.744527101495492,9.0,44.0,88.0,,COMPLETE
8941,0.4339686614516481,2024-04-11 19:11:59.365282,2024-04-11 19:12:01.648384,0 days 00:00:02.283102,98.25516045978578,8.10709439719891,sigmoid,8,,28.0,20.0,,,,,,,,,,,,,COMPLETE
8942,0.44646102715895525,2024-04-11 19:12:01.653383,2024-04-11 19:12:05.229118,0 days 00:00:03.575735,96.66452533575149,7.5398495448200435,sigmoid,29,,23.0,32.0,2.0,7.0,93.0,9.0,36.0,,,,,,,102.0,COMPLETE
8943,0.4934334364655229,2024-04-11 19:12:05.234125,2024-04-11 19:12:08.480683,0 days 00:00:03.246558,44.9237031598,8.499052361181535,sigmoid,35,36.0,,,,,,,,8.24084957589496,6.338276994775046,9.831151606879757,13.0,36.0,91.0,110.0,COMPLETE
8944,0.2673559822747415,2024-04-11 19:12:08.485685,2024-04-11 19:12:12.243412,0 days 00:00:03.757727,99.97076826757518,7.950327805506092,rbf,21,,,,1.0,2.0,2.0,6.0,31.0,,,,,,,62.0,COMPLETE
8945,0.4919424668077737,2024-04-11 19:12:12.248423,2024-04-11 19:12:16.645083,0 days 00:00:04.396660,98.17621236294099,8.234433786608003,sigmoid,31,,24.0,31.0,6.0,3.0,71.0,8.0,47.0,6.971776466600874,7.31519936676386,3.153489436789203,14.0,32.0,79.0,79.0,COMPLETE
8946,0.12622036262203626,2024-04-11 19:12:16.650069,2024-04-11 19:12:19.255139,0 days 00:00:02.605070,98.19166586530314,7.848472419161297,sigmoid,8,,27.0,29.0,,,,,,,,,,,,,COMPLETE
8947,0.4902674137610537,2024-04-11 19:12:19.259142,2024-04-11 19:12:22.343663,0 days 00:00:03.084521,95.31998468253599,8.848458245914873,sigmoid,24,,25.0,30.0,5.0,6.0,69.0,,,,,,,,,,COMPLETE
8948,0.5636462904171639,2024-04-11 19:12:22.346664,2024-04-11 19:12:24.152129,0 days 00:00:01.805465,93.57871462412103,8.060869012374363,sigmoid,0,,,,,,,,,,,,,,,,COMPLETE
8949,0.4769661979254007,2024-04-11 19:12:24.156128,2024-04-11 19:12:27.911884,0 days 00:00:03.755756,96.779978128385,7.721246061424844,sigmoid,39,33.0,,,,,,19.0,29.0,0.9208455646042379,4.020615467560034,6.9041684052399495,10.0,26.0,73.0,17.0,COMPLETE
8950,0.5986580986580987,2024-04-11 19:12:27.918890,2024-04-11 19:12:30.380458,0 days 00:00:02.461568,98.12007465097824,8.322073620741499,sigmoid,8,,25.0,31.0,,,,,,,,,,,,,COMPLETE
8951,0.3175097554863423,2024-04-11 19:12:30.384454,2024-04-11 19:12:33.580016,0 days 00:00:03.195562,98.19227394035771,2.1614292385741187,sigmoid,25,,26.0,32.0,8.0,5.0,11.0,,,,,,,,,196.0,COMPLETE
8952,0.3362576117246362,2024-04-11 19:12:33.583015,2024-04-11 19:12:37.018714,0 days 00:00:03.435699,99.97942227303878,8.668217430195535,sigmoid,38,17.0,,,,,,23.0,5.0,7.397654914799924,7.69607436900688,5.3166696605716535,3.0,30.0,56.0,,COMPLETE
8953,0.5929369437606513,2024-04-11 19:12:37.023716,2024-04-11 19:12:39.398845,0 days 00:00:02.375129,95.25874966963349,7.3616240068177765,sigmoid,8,,23.0,33.0,,,,,,,,,,,,,COMPLETE
8954,0.4997105579552032,2024-04-11 19:12:39.401839,2024-04-11 19:12:42.706341,0 days 00:00:03.304502,92.0830914158663,8.097880955054292,sigmoid,57,45.0,43.0,35.0,3.0,4.0,31.0,,,,,,,,,191.0,COMPLETE
8955,0.40447529944580185,2024-04-11 19:12:42.710343,2024-04-11 19:12:46.440056,0 days 00:00:03.729713,96.70165555141854,8.4582646758312,sigmoid,28,,24.0,28.0,4.0,8.0,49.0,12.0,24.0,,,,,,,,COMPLETE
8956,0.44701971028259324,2024-04-11 19:12:46.443058,2024-04-11 19:12:49.161783,0 days 00:00:02.718725,96.72428039307232,7.8292076625711,sigmoid,8,,27.0,30.0,,,,,,,,,,,,,COMPLETE
8957,0.5053361552663574,2024-04-11 19:12:49.166785,2024-04-11 19:12:51.922908,0 days 00:00:02.756123,98.12419704513076,8.250547602517962,sigmoid,16,,,,1.0,5.0,83.0,,,,,,,,,,COMPLETE
8958,0.42672915779008663,2024-04-11 19:12:51.928908,2024-04-11 19:12:55.319517,0 days 00:00:03.390609,88.80910972525312,7.984563229549197,sigmoid,15,,26.0,31.0,,,,7.0,13.0,3.3281517703673744,8.888974989762986,6.303015504011434,6.0,29.0,63.0,43.0,COMPLETE
8959,0.3640052217478742,2024-04-11 19:12:55.323581,2024-04-11 19:12:58.480140,0 days 00:00:03.156559,37.52631078111215,7.578482008284807,sigmoid,42,22.0,25.0,32.0,,,,,,1.8161228073249167,0.8508193959718175,9.391540929440126,2.0,28.0,70.0,,COMPLETE
8960,0.44701971028259324,2024-04-11 19:12:58.484142,2024-04-11 19:13:00.685653,0 days 00:00:02.201511,98.15821797087558,7.752748384128729,sigmoid,8,,29.0,30.0,,,,,,,,,,,,,COMPLETE
8961,0.5457903985941369,2024-04-11 19:13:00.690638,2024-04-11 19:13:03.294967,0 days 00:00:02.604329,94.44861721644696,8.214815741091893,sigmoid,3,,,,,,,,,3.8516213781632604,1.761138672831164,4.672491901493623,17.0,25.0,89.0,146.0,COMPLETE
8962,0.3527486670343813,2024-04-11 19:13:03.298967,2024-04-11 19:13:05.675074,0 days 00:00:02.376107,98.19540199074957,8.041651982738273,sigmoid,9,,24.0,32.0,,,,,,,,,,,,153.0,COMPLETE
8963,0.22144542515074714,2024-04-11 19:13:05.679062,2024-04-11 19:13:09.682146,0 days 00:00:04.003084,95.62496243664388,8.477382392022367,rbf,14,,23.0,31.0,,,,4.0,34.0,9.492477120388342,4.436894284084527,8.76714428643006,19.0,48.0,57.0,,COMPLETE
8964,0.5929369437606513,2024-04-11 19:13:09.686149,2024-04-11 19:13:11.905201,0 days 00:00:02.219052,99.98250987956338,7.939429082704315,sigmoid,8,,27.0,33.0,,,,,,,,,,,,,COMPLETE
8965,0.46784828823126023,2024-04-11 19:13:11.909201,2024-04-11 19:13:15.896787,0 days 00:00:03.987586,99.9996952540509,8.266745230167256,sigmoid,63,38.0,26.0,29.0,2.0,7.0,96.0,42.0,16.0,6.3188244645007305,4.76331370429784,2.618880817635214,20.0,35.0,81.0,178.0,COMPLETE
8966,0.4215183977643223,2024-04-11 19:13:15.901787,2024-04-11 19:13:19.550809,0 days 00:00:03.649022,99.95702076104905,7.721322228466161,sigmoid,62,20.0,25.0,30.0,7.0,1.0,7.0,17.0,43.0,7.809018525522655,9.601679119639174,5.135938017275404,14.0,42.0,64.0,,COMPLETE
8967,0.5861796271888533,2024-04-11 19:13:19.554798,2024-04-11 19:13:21.833616,0 days 00:00:02.278818,96.68243835449285,7.141020159004228,sigmoid,8,,28.0,34.0,,,,,,,,,,,,,COMPLETE
8968,0.5606051581392579,2024-04-11 19:13:21.837140,2024-04-11 19:13:24.046214,0 days 00:00:02.209074,99.96124297242399,8.565071765075,sigmoid,2,,,,,,,,,0.6792247692285738,5.420052315415795,4.05102279169358,16.0,43.0,53.0,,COMPLETE
8969,0.47952264054638705,2024-04-11 19:13:24.049205,2024-04-11 19:13:27.228034,0 days 00:00:03.178829,93.2976980044962,8.04927347014193,sigmoid,26,,22.0,32.0,6.0,6.0,37.0,,,9.06487422490428,9.084651078471312,5.5508236709011936,15.0,22.0,68.0,,COMPLETE
8970,0.29210037924634874,2024-04-11 19:13:27.231029,2024-04-11 19:13:30.016034,0 days 00:00:02.785005,96.78037606714734,7.489802303792345,sigmoid,10,,25.0,31.0,,,,,,1.2932489875851454,3.5853022681211146,9.64773101728018,11.0,37.0,59.0,,COMPLETE
8971,0.48974708736778544,2024-04-11 19:13:30.018026,2024-04-11 19:13:33.048775,0 days 00:00:03.030749,95.2884648995389,8.343257086944957,sigmoid,11,,26.0,29.0,,,,,,5.382456398554603,6.899114131794885,7.622687579653944,5.0,27.0,78.0,128.0,COMPLETE
8972,0.369758664866175,2024-04-11 19:13:33.053765,2024-04-11 19:13:36.301369,0 days 00:00:03.247604,98.29151696285925,9.039241255452922,sigmoid,46,46.0,24.0,33.0,,,,41.0,37.0,7.123632437002918,7.939032527171794,9.99768187971171,7.0,41.0,97.0,,COMPLETE
8973,0.6009432182607054,2024-04-11 19:13:36.304384,2024-04-11 19:13:38.148751,0 days 00:00:01.844367,98.2209711658779,7.817293625439705,sigmoid,8,,27.0,31.0,,,,,,,,,,,,,COMPLETE
8974,0.3798321184007068,2024-04-11 19:13:38.151752,2024-04-11 19:13:40.466501,0 days 00:00:02.314749,91.256890257492,8.157205940522159,sigmoid,41,29.0,25.0,28.0,,,,,,,,,,,,89.0,COMPLETE
8975,0.5721920102365315,2024-04-11 19:13:40.470501,2024-04-11 19:13:43.055582,0 days 00:00:02.585081,96.72617261820851,7.962446082518554,sigmoid,20,,,,3.0,2.0,17.0,36.0,45.0,,,,,,,,COMPLETE
8976,0.4452146690518784,2024-04-11 19:13:43.060582,2024-04-11 19:13:45.580321,0 days 00:00:02.519739,70.62123263987938,8.683887845020609,sigmoid,56,31.0,23.0,30.0,7.0,3.0,74.0,,,,,,,,,,COMPLETE
8977,0.4997105579552032,2024-04-11 19:13:45.584313,2024-04-11 19:13:47.902750,0 days 00:00:02.318437,94.68048295444564,7.6600424401325204,sigmoid,37,12.0,,,,,,10.0,10.0,,,,,,,165.0,COMPLETE
8978,0.5963643249384587,2024-04-11 19:13:47.906751,2024-04-11 19:13:50.058227,0 days 00:00:02.151476,98.06379707511587,8.37193390588581,sigmoid,8,,21.0,32.0,,,,,,,,,,,,,COMPLETE
8979,0.5986580986580987,2024-04-11 19:13:50.062228,2024-04-11 19:13:52.007147,0 days 00:00:01.944919,99.99309385507927,8.184680387828681,sigmoid,8,,28.0,31.0,,,,,,,,,,,,,COMPLETE
8980,0.3056399864910503,2024-04-11 19:13:52.011137,2024-04-11 19:13:54.671795,0 days 00:00:02.660658,96.4360526333918,7.894801662102272,sigmoid,52,14.0,,,2.0,7.0,21.0,14.0,25.0,,,,,,,,COMPLETE
8981,0.47961457392351703,2024-04-11 19:13:54.676784,2024-04-11 19:13:57.511079,0 days 00:00:02.834295,98.13659978445678,8.091981056144798,rbf,8,,26.0,30.0,,,,,,,,,,,,,COMPLETE
