number,value,datetime_start,datetime_complete,duration,params_C,params_gamma,params_kernel,params_mask_number,params_rsi_window,params_so_smooth,params_so_window,params_srsi_smooth1,params_srsi_smooth2,params_srsi_window,params_tsi_window_fast,params_tsi_window_slow,params_ult_weight_1,params_ult_weight_2,params_ult_weight_3,params_ult_window_1,params_ult_window_2,params_ult_window_3,params_williams_lbp,state
4973,0.44929255040405996,2024-04-11 17:15:18.072675,2024-04-11 17:15:19.354851,0 days 00:00:01.282176,91.99437033207539,7.693104194484739,sigmoid,51,45.0,,,8.0,2.0,69.0,,,5.578886157299598,6.421925479862543,9.19411620215935,20.0,26.0,61.0,78.0,COMPLETE
4974,0.48930319272896755,2024-04-11 17:15:19.358388,2024-04-11 17:15:20.339605,0 days 00:00:00.981217,99.99626578759133,8.225633665334348,sigmoid,24,,27.0,31.0,4.0,8.0,21.0,,,,,,,,,,COMPLETE
4975,0.40264896129230987,2024-04-11 17:15:20.342228,2024-04-11 17:15:21.721370,0 days 00:00:01.379142,98.15591136573072,8.627962783035082,sigmoid,47,3.0,23.0,27.0,,,,45.0,38.0,1.8284929566094807,5.467501367768429,4.1589369183980125,12.0,20.0,92.0,107.0,COMPLETE
4976,0.5952371952371952,2024-04-11 17:15:21.723946,2024-04-11 17:15:22.557210,0 days 00:00:00.833264,95.06505219272398,7.925605070695503,sigmoid,8,,26.0,32.0,,,,,,,,,,,,,COMPLETE
4977,0.35297559073032797,2024-04-11 17:15:22.559220,2024-04-11 17:15:23.910077,0 days 00:00:01.350857,96.8151846089803,8.380514036393192,sigmoid,58,37.0,25.0,29.0,2.0,3.0,16.0,,,3.216620703511191,9.841560292798706,1.94683907094799,14.0,41.0,50.0,,COMPLETE
4978,0.5151191746709355,2024-04-11 17:15:23.913097,2024-04-11 17:15:25.016357,0 days 00:00:01.103260,97.84282579218353,9.034487066166667,sigmoid,35,34.0,,,,,,,,8.821868060118861,7.94081237100829,8.22244508298024,7.0,43.0,75.0,147.0,COMPLETE
4979,0.3652940551641115,2024-04-11 17:15:25.018884,2024-04-11 17:15:26.308516,0 days 00:00:01.289632,93.63530906431342,8.086608915679758,sigmoid,43,50.0,34.0,31.0,,,,,,3.8227729856058854,4.615590450364907,9.680935509159017,5.0,24.0,83.0,22.0,COMPLETE
4980,0.3055076505338862,2024-04-11 17:15:26.310522,2024-04-11 17:15:27.182853,0 days 00:00:00.872331,98.28411154847038,7.817415626580508,sigmoid,8,,28.0,6.0,,,,,,,,,,,,,COMPLETE
4981,0.5006050129645635,2024-04-11 17:15:27.184855,2024-04-11 17:15:28.594391,0 days 00:00:01.409536,98.09015757610956,7.340513680092507,rbf,8,,24.0,30.0,,,,,,,,,,,,,COMPLETE
4982,0.3781811954101729,2024-04-11 17:15:28.596391,2024-04-11 17:15:29.868094,0 days 00:00:01.271703,99.98136867563942,8.236538289103795,sigmoid,15,,26.0,34.0,,,,25.0,50.0,7.8669703308233885,4.891729084515865,6.829243561485906,17.0,23.0,67.0,158.0,COMPLETE
4983,0.5952371952371952,2024-04-11 17:15:29.870097,2024-04-11 17:15:30.714536,0 days 00:00:00.844439,95.68463455891845,7.649783149777457,sigmoid,8,,19.0,32.0,,,,,,,,,,,,,COMPLETE
4984,0.12622036262203626,2024-04-11 17:15:30.716497,2024-04-11 17:15:31.599407,0 days 00:00:00.882910,96.70903764455556,8.023783832855905,sigmoid,8,,27.0,29.0,,,,,,,,,,,,,COMPLETE
4985,0.5135895692141735,2024-04-11 17:15:31.601399,2024-04-11 17:15:32.728320,0 days 00:00:01.126921,98.20840347108386,8.447437566435484,sigmoid,38,14.0,,,,,,22.0,2.0,7.662870970456183,8.814868242437681,0.8099538344767865,10.0,37.0,70.0,,COMPLETE
4986,0.3716230819105252,2024-04-11 17:15:32.730318,2024-04-11 17:15:33.753677,0 days 00:00:01.023359,94.39531786048036,7.853319022047683,sigmoid,3,,,,,,,,,8.551870633545917,5.882077488412023,2.7416503632366154,4.0,29.0,95.0,84.0,COMPLETE
4987,0.3679428342624819,2024-04-11 17:15:33.755687,2024-04-11 17:15:34.862035,0 days 00:00:01.106348,28.113523180095246,8.159409471975986,sigmoid,28,,24.0,33.0,1.0,5.0,28.0,2.0,35.0,,,,,,,,COMPLETE
4988,0.4485644814364538,2024-04-11 17:15:34.864031,2024-04-11 17:15:35.726425,0 days 00:00:00.862394,98.13688856158916,8.770886077324082,sigmoid,8,,22.0,10.0,,,,,,,,,,,,,COMPLETE
4989,0.3944323378656272,2024-04-11 17:15:35.728423,2024-04-11 17:15:36.768340,0 days 00:00:01.039917,96.57471606615721,8.012520617379733,sigmoid,21,,,,6.0,7.0,46.0,37.0,8.0,,,,,,,47.0,COMPLETE
4990,0.5986314388899449,2024-04-11 17:15:36.769882,2024-04-11 17:15:37.604998,0 days 00:00:00.835116,95.06449657081859,8.561017835290947,sigmoid,8,,25.0,31.0,,,,,,,,,,,,,COMPLETE
4991,0.3300410271995137,2024-04-11 17:15:37.606995,2024-04-11 17:15:38.496242,0 days 00:00:00.889247,98.16647907857318,8.307139923141497,sigmoid,9,,29.0,32.0,,,,,,,,,,,,75.0,COMPLETE
4992,0.4253619101334838,2024-04-11 17:15:38.498290,2024-04-11 17:15:39.758340,0 days 00:00:01.260050,96.57820375791567,7.712407285424857,sigmoid,22,,,,7.0,1.0,91.0,6.0,31.0,2.5892968854913807,6.781961367188123,8.968284788455964,18.0,36.0,63.0,,COMPLETE
4993,0.4454340374417719,2024-04-11 17:15:39.760337,2024-04-11 17:15:41.258519,0 days 00:00:01.498182,99.98356769482508,7.495843669959888,sigmoid,31,,23.0,30.0,3.0,2.0,55.0,17.0,5.0,4.095266604488511,2.5857329152316226,3.6201853127870045,8.0,44.0,69.0,178.0,COMPLETE
4994,0.49099440357780005,2024-04-11 17:15:41.261069,2024-04-11 17:15:42.422512,0 days 00:00:01.161443,91.63563645148048,7.969991519686463,sigmoid,57,5.0,26.0,31.0,4.0,4.0,42.0,,,,,,,,,130.0,COMPLETE
4995,0.3972757496530131,2024-04-11 17:15:42.424509,2024-04-11 17:15:43.731610,0 days 00:00:01.307101,99.99841859859194,7.1054376987622,sigmoid,46,19.0,27.0,33.0,,,,5.0,22.0,4.4343132193205035,1.581781298945895,5.59097643867607,11.0,33.0,98.0,,COMPLETE
4996,0.4134588671091218,2024-04-11 17:15:43.733608,2024-04-11 17:15:45.292509,0 days 00:00:01.558901,98.23672778810122,8.165843381053138,sigmoid,63,48.0,24.0,29.0,5.0,6.0,24.0,26.0,21.0,2.3610021225873816,8.27707893619853,5.1605271431861635,14.0,39.0,94.0,154.0,COMPLETE
4997,0.4270195997096339,2024-04-11 17:15:45.295457,2024-04-11 17:15:46.245229,0 days 00:00:00.949772,94.20171198048085,7.803435612449209,sigmoid,16,,,,8.0,5.0,5.0,,,,,,,,,,COMPLETE
4998,0.5088167646307181,2024-04-11 17:15:46.246202,2024-04-11 17:15:47.433783,0 days 00:00:01.187581,96.53645584280704,8.396378384430738,sigmoid,42,27.0,25.0,30.0,,,,,,9.823932690421575,7.285507255053725,7.978902844381198,3.0,38.0,72.0,,COMPLETE
4999,0.5952371952371952,2024-04-11 17:15:47.436370,2024-04-11 17:15:48.294637,0 days 00:00:00.858267,95.40175448252563,8.069865963671324,sigmoid,8,,28.0,32.0,,,,,,,,,,,,,COMPLETE
5000,0.24272902522839662,2024-04-11 17:15:48.296638,2024-04-11 17:15:49.440878,0 days 00:00:01.144240,98.29968811472884,8.236918690327897,rbf,41,24.0,23.0,31.0,,,,,,,,,,,,97.0,COMPLETE
5001,0.12622036262203626,2024-04-11 17:15:49.442874,2024-04-11 17:15:50.271057,0 days 00:00:00.828183,96.80141476499062,7.631833878426318,sigmoid,8,,25.0,29.0,,,,,,,,,,,,,COMPLETE
5002,0.2953119901381386,2024-04-11 17:15:50.273070,2024-04-11 17:15:51.239047,0 days 00:00:00.965977,98.1442474806359,7.868001159824331,sigmoid,2,,,,,,,,,5.015148462183372,8.60505402855351,1.473299392574253,19.0,21.0,97.0,,COMPLETE
5003,0.35282651072124754,2024-04-11 17:15:51.241046,2024-04-11 17:15:52.445807,0 days 00:00:01.204761,99.96846568520222,8.551870477850336,sigmoid,14,,26.0,32.0,,,,11.0,27.0,9.067699104408323,2.8382204613832553,1.031182839710719,15.0,27.0,55.0,,COMPLETE
5004,0.5069140556625241,2024-04-11 17:15:52.446803,2024-04-11 17:15:53.269858,0 days 00:00:00.823055,92.40662694119379,8.332500002732075,sigmoid,8,,27.0,35.0,,,,,,,,,,,,,COMPLETE
5005,0.4569874280954736,2024-04-11 17:15:53.271852,2024-04-11 17:15:54.722563,0 days 00:00:01.450711,99.98940652086678,7.9889188742238995,sigmoid,62,43.0,25.0,13.0,3.0,8.0,62.0,15.0,18.0,6.759652822371512,7.5536339963223975,5.83742983620295,5.0,30.0,78.0,,COMPLETE
5006,0.27774580887712436,2024-04-11 17:15:54.724560,2024-04-11 17:15:55.826621,0 days 00:00:01.102061,95.08940529041396,8.150822777722226,sigmoid,10,,24.0,30.0,,,,,,5.814695299790889,9.38601839724878,4.2668623649000565,2.0,25.0,52.0,,COMPLETE
5007,0.5094976148523787,2024-04-11 17:15:55.828121,2024-04-11 17:15:57.028595,0 days 00:00:01.200474,96.76924624328433,7.76403108788446,sigmoid,11,,22.0,31.0,,,,,,0.7259671436140058,3.0862817863687084,7.340334631386203,12.0,46.0,71.0,114.0,COMPLETE
5008,0.4773435626947975,2024-04-11 17:15:57.031598,2024-04-11 17:15:58.080354,0 days 00:00:01.048756,99.98585925653175,7.354601657765762,sigmoid,56,41.0,26.0,31.0,6.0,1.0,19.0,,,,,,,,,,COMPLETE
5009,0.45022721836881124,2024-04-11 17:15:58.081349,2024-04-11 17:15:58.982387,0 days 00:00:00.901038,98.27020988288406,8.470344369765398,sigmoid,8,,27.0,28.0,,,,,,,,,,,,,COMPLETE
5010,0.5929369437606513,2024-04-11 17:15:58.984387,2024-04-11 17:15:59.867104,0 days 00:00:00.882717,98.1529983977849,7.968644076476855,sigmoid,8,,21.0,33.0,,,,,,,,,,,,,COMPLETE
5011,0.44701971028259324,2024-04-11 17:15:59.869105,2024-04-11 17:16:00.849196,0 days 00:00:00.980091,93.46902649469135,7.585090001216651,sigmoid,8,,23.0,30.0,,,,,,,,,,,,,COMPLETE
5012,0.498190529588664,2024-04-11 17:16:00.851203,2024-04-11 17:16:02.446137,0 days 00:00:01.594934,96.86079133595278,5.684958699984532,sigmoid,26,,29.0,32.0,2.0,3.0,57.0,,,9.53286905144095,0.927982334559621,6.188776969167987,13.0,40.0,73.0,,COMPLETE
5013,0.5046894803548796,2024-04-11 17:16:02.449138,2024-04-11 17:16:03.680580,0 days 00:00:01.231442,98.18366018006301,8.26660567792578,sigmoid,20,,,,1.0,6.0,76.0,34.0,14.0,,,,,,,,COMPLETE
5014,0.5963245096172158,2024-04-11 17:16:03.682618,2024-04-11 17:16:04.533711,0 days 00:00:00.851093,95.17557289042101,8.727546009644806,sigmoid,8,,24.0,31.0,,,,,,,,,,,,,COMPLETE
5015,0.558698698292143,2024-04-11 17:16:04.536044,2024-04-11 17:16:05.499197,0 days 00:00:00.963153,98.23456517133519,8.089782221611236,sigmoid,48,42.0,,,7.0,4.0,37.0,,,,,,,,,,COMPLETE
5016,0.4770975282240016,2024-04-11 17:16:05.501235,2024-04-11 17:16:06.535257,0 days 00:00:01.034022,21.268116492888893,7.801114660571703,sigmoid,52,17.0,,,5.0,7.0,95.0,30.0,33.0,,,,,,,,COMPLETE
5017,0.5254507355830095,2024-04-11 17:16:06.538234,2024-04-11 17:16:07.464773,0 days 00:00:00.926539,90.06723294138644,8.310101144145614,sigmoid,37,15.0,,,,,,47.0,10.0,,,,,,,162.0,COMPLETE
5018,0.3329677716064669,2024-04-11 17:16:07.466763,2024-04-11 17:16:08.491929,0 days 00:00:01.025166,96.83789450352515,7.875502247920427,sigmoid,44,35.0,26.0,33.0,,,,20.0,37.0,,,,,,,,COMPLETE
5019,0.12622036262203626,2024-04-11 17:16:08.493926,2024-04-11 17:16:09.311740,0 days 00:00:00.817814,94.25887982411056,8.110490648084513,sigmoid,8,,25.0,29.0,,,,,,,,,,,,,COMPLETE
5020,0.0625,2024-04-11 17:16:09.313717,2024-04-11 17:16:10.909416,0 days 00:00:01.595699,98.17468988323172,8.551776612594686,rbf,59,31.0,28.0,30.0,4.0,5.0,48.0,,,4.805866618646306,5.713147139516026,6.962922656290231,6.0,49.0,89.0,142.0,COMPLETE
5021,0.5245064315049931,2024-04-11 17:16:10.912412,2024-04-11 17:16:11.937543,0 days 00:00:01.025131,72.64745521248264,7.54952638258656,sigmoid,12,,26.0,34.0,,,,8.0,49.0,,,,,,,,COMPLETE
5022,0.4400399222028867,2024-04-11 17:16:11.940609,2024-04-11 17:16:13.295586,0 days 00:00:01.354977,99.96454176895885,8.034311657009635,sigmoid,55,46.0,,,2.0,8.0,71.0,41.0,39.0,7.188403179722972,5.082706143845253,7.635433705912308,16.0,42.0,57.0,121.0,COMPLETE
5023,0.5432316723308469,2024-04-11 17:16:13.296585,2024-04-11 17:16:14.263899,0 days 00:00:00.967314,95.81431103912233,8.351380590989693,sigmoid,13,,24.0,32.0,,,,32.0,32.0,,,,,,,173.0,COMPLETE
5024,0.6009432182607054,2024-04-11 17:16:14.265874,2024-04-11 17:16:15.111800,0 days 00:00:00.845926,98.33791735566996,7.740581439757074,sigmoid,8,,25.0,31.0,,,,,,,,,,,,,COMPLETE
5025,0.56275119435808,2024-04-11 17:16:15.113808,2024-04-11 17:16:16.038384,0 days 00:00:00.924576,96.5004271516377,7.923120650688641,sigmoid,36,39.0,,,,,,24.0,26.0,,,,,,,,COMPLETE
5026,0.4427253705832081,2024-04-11 17:16:16.040370,2024-04-11 17:16:17.202369,0 days 00:00:01.161999,93.86579530668693,8.220304912285796,sigmoid,60,26.0,27.0,30.0,8.0,1.0,98.0,3.0,44.0,,,,,,,,COMPLETE
5027,0.5952371952371952,2024-04-11 17:16:17.204387,2024-04-11 17:16:18.061015,0 days 00:00:00.856628,99.98303457436513,8.123851360301849,sigmoid,8,,24.0,32.0,,,,,,,,,,,,,COMPLETE
5028,0.4180379929557134,2024-04-11 17:16:18.063011,2024-04-11 17:16:19.362522,0 days 00:00:01.299511,98.26787725036367,8.52155557040659,sigmoid,23,,,,6.0,2.0,66.0,7.0,29.0,7.456468453534844,2.253123634369775,3.2696603021564825,10.0,48.0,65.0,67.0,COMPLETE
5029,0.5431551871963418,2024-04-11 17:16:19.364499,2024-04-11 17:16:20.143509,0 days 00:00:00.779010,96.58253199503028,8.901975571393097,sigmoid,1,,,,,,,,,,,,,,,59.0,COMPLETE
5030,0.5035427081069334,2024-04-11 17:16:20.145492,2024-04-11 17:16:21.083111,0 days 00:00:00.937619,95.244468018402,7.883655659062171,sigmoid,40,7.0,23.0,28.0,,,,,,,,,,,,,COMPLETE
5031,0.31525562651548783,2024-04-11 17:16:21.086070,2024-04-11 17:16:22.446197,0 days 00:00:01.360127,98.24774889919756,2.2539279242559114,sigmoid,54,4.0,,,7.0,3.0,33.0,40.0,13.0,6.050598144712136,6.036502236803033,2.3908031503994,7.0,37.0,91.0,,COMPLETE
5032,0.33308075340982896,2024-04-11 17:16:22.448194,2024-04-11 17:16:23.623182,0 days 00:00:01.174988,92.59503335978296,7.665090830586775,sigmoid,7,,,,,,,46.0,24.0,9.982319334343135,9.056295738159381,8.775732221172289,9.0,43.0,99.0,183.0,COMPLETE
5033,0.5708330312477344,2024-04-11 17:16:23.625192,2024-04-11 17:16:24.377919,0 days 00:00:00.752727,99.99103458248376,8.317958054087251,sigmoid,32,8.0,,,,,,,,,,,,,,,COMPLETE
5034,0.5986580986580987,2024-04-11 17:16:24.379915,2024-04-11 17:16:25.242136,0 days 00:00:00.862221,98.20153010833103,7.454244404675888,sigmoid,8,,28.0,31.0,,,,,,,,,,,,,COMPLETE
5035,0.5929369437606513,2024-04-11 17:16:25.244135,2024-04-11 17:16:26.116285,0 days 00:00:00.872150,96.64408691417393,8.032948637597093,sigmoid,8,,26.0,33.0,,,,,,,,,,,,,COMPLETE
5036,0.4896034247541986,2024-04-11 17:16:26.118291,2024-04-11 17:16:27.355049,0 days 00:00:01.236758,99.95555130645288,8.178064616460974,sigmoid,61,21.0,25.0,30.0,3.0,7.0,11.0,9.0,16.0,,,,,,,190.0,COMPLETE
5037,0.43246331645240876,2024-04-11 17:16:27.357049,2024-04-11 17:16:28.217597,0 days 00:00:00.860548,95.2859729805165,7.855127007602467,sigmoid,4,,,,,,,23.0,41.0,,,,,,,,COMPLETE
5038,0.23433035714285713,2024-04-11 17:16:28.219591,2024-04-11 17:16:29.820522,0 days 00:00:01.600931,98.21711367040258,6.015635405552455,rbf,30,,39.0,36.0,1.0,6.0,51.0,12.0,7.0,3.403000417119386,7.03147659524834,1.7319690426514187,20.0,31.0,81.0,,COMPLETE
5039,0.12622036262203626,2024-04-11 17:16:29.822520,2024-04-11 17:16:30.685047,0 days 00:00:00.862527,96.73584036229731,8.36488511007573,sigmoid,8,,27.0,29.0,,,,,,,,,,,,,COMPLETE
5040,0.6009432182607054,2024-04-11 17:16:30.687044,2024-04-11 17:16:31.539932,0 days 00:00:00.852888,99.98800728660217,7.6620741446989085,sigmoid,8,,23.0,31.0,,,,,,,,,,,,,COMPLETE
5041,0.51928322829461,2024-04-11 17:16:31.542956,2024-04-11 17:16:32.611418,0 days 00:00:01.068462,94.02456096043517,8.604520787454254,sigmoid,45,12.0,25.0,32.0,,,,29.0,47.0,,,,,,,34.0,COMPLETE
5042,0.30747451868629666,2024-04-11 17:16:32.612415,2024-04-11 17:16:33.675503,0 days 00:00:01.063088,96.71614718748069,8.021092741989635,sigmoid,34,16.0,,,,,,,,9.345252219554338,0.7572788399507475,9.360665197667696,17.0,35.0,68.0,,COMPLETE
5043,0.5288642150519681,2024-04-11 17:16:33.678493,2024-04-11 17:16:34.492523,0 days 00:00:00.814030,95.46501011312223,8.173785103537126,sigmoid,33,33.0,,,,,,,,,,,,,,166.0,COMPLETE
5044,0.45564152843287936,2024-04-11 17:16:34.494102,2024-04-11 17:16:35.644112,0 days 00:00:01.150010,98.18368042243365,7.250350890764093,sigmoid,53,23.0,,,4.0,2.0,60.0,19.0,19.0,,,,,,,53.0,COMPLETE
5045,0.44701971028259324,2024-04-11 17:16:35.646113,2024-04-11 17:16:36.514478,0 days 00:00:00.868365,98.17888244137403,7.855728858758884,sigmoid,8,,42.0,30.0,,,,,,,,,,,,,COMPLETE
5046,0.46909710223626405,2024-04-11 17:16:36.515849,2024-04-11 17:16:37.759159,0 days 00:00:01.243310,98.07782279519165,8.324280237123535,sigmoid,19,,,,5.0,4.0,81.0,,,1.4662536793564964,1.2108362439492533,6.639275412580175,19.0,27.0,58.0,104.0,COMPLETE
5047,0.5952371952371952,2024-04-11 17:16:37.761159,2024-04-11 17:16:38.624131,0 days 00:00:00.862972,92.12952170448641,8.008218461853112,sigmoid,8,,26.0,32.0,,,,,,,,,,,,,COMPLETE
5048,0.4868473003652156,2024-04-11 17:16:38.626134,2024-04-11 17:16:39.997596,0 days 00:00:01.371462,7.042772832400502,8.450025651263951,sigmoid,58,37.0,30.0,35.0,8.0,3.0,29.0,,,8.245935191942,4.140705041173865,6.437949388285867,6.0,34.0,76.0,,COMPLETE
5049,0.3765643504144929,2024-04-11 17:16:40.000162,2024-04-11 17:16:41.036949,0 days 00:00:01.036787,95.21396095396236,8.719570057491529,sigmoid,49,29.0,,,6.0,4.0,44.0,,,,,,,,,14.0,COMPLETE
5050,0.48725535372153367,2024-04-11 17:16:41.038958,2024-04-11 17:16:42.414327,0 days 00:00:01.375369,96.7436132002747,7.650818398823667,sigmoid,27,,24.0,31.0,2.0,5.0,14.0,,,5.261928191910402,1.901380463925158,4.571145613854822,14.0,22.0,100.0,196.0,COMPLETE
5051,0.50406126711534,2024-04-11 17:16:42.416947,2024-04-11 17:16:43.357229,0 days 00:00:00.940282,98.24751129845104,8.086049231371371,sigmoid,17,,,,7.0,6.0,4.0,,,,,,,,,90.0,COMPLETE
5052,0.5895095625828441,2024-04-11 17:16:43.360231,2024-04-11 17:16:44.211288,0 days 00:00:00.851057,98.23276920201022,7.794380353851159,sigmoid,8,,26.0,34.0,,,,,,,,,,,,,COMPLETE
5053,0.5521619202455108,2024-04-11 17:16:44.213260,2024-04-11 17:16:45.099105,0 days 00:00:00.885845,99.95675891120449,7.4525382592671425,sigmoid,5,,,,,,,44.0,30.0,,,,,,,29.0,COMPLETE
5054,0.533733103762196,2024-04-11 17:16:45.101033,2024-04-11 17:16:45.965007,0 days 00:00:00.863974,93.63947698746688,8.216765257919443,sigmoid,8,,22.0,45.0,,,,,,,,,,,,,COMPLETE
5055,0.12622036262203626,2024-04-11 17:16:45.967005,2024-04-11 17:16:46.804329,0 days 00:00:00.837324,98.2421020545693,7.9297735709933725,sigmoid,8,,27.0,29.0,,,,,,,,,,,,,COMPLETE
5056,0.1618281266435258,2024-04-11 17:16:46.806844,2024-04-11 17:16:48.222686,0 days 00:00:01.415842,96.54373766469647,8.543317983365714,rbf,50,44.0,,,3.0,8.0,84.0,,,1.0382750100172444,3.8788483877315554,0.5016831102384645,8.0,29.0,61.0,,COMPLETE
5057,0.3970044494579182,2024-04-11 17:16:48.224672,2024-04-11 17:16:49.372344,0 days 00:00:01.147672,89.25842153561797,8.22136075767105,sigmoid,29,,25.0,33.0,5.0,1.0,88.0,27.0,34.0,,,,,,,150.0,COMPLETE
5058,0.431307854458803,2024-04-11 17:16:49.374346,2024-04-11 17:16:50.419577,0 days 00:00:01.045231,95.56017824870604,7.75753230228902,sigmoid,25,,24.0,39.0,4.0,7.0,100.0,,,,,,,,,45.0,COMPLETE
5059,0.3723165532201361,2024-04-11 17:16:50.422043,2024-04-11 17:16:51.740897,0 days 00:00:01.318854,98.2182078805339,6.779342012742818,sigmoid,51,20.0,,,1.0,2.0,8.0,,,2.7478294799665144,3.2732485102415034,2.944383704304668,11.0,20.0,82.0,133.0,COMPLETE
5060,0.48951100065784664,2024-04-11 17:16:51.742912,2024-04-11 17:16:52.953763,0 days 00:00:01.210851,99.96900582334155,8.387138148699307,sigmoid,39,25.0,,,,,,14.0,3.0,6.377189495812345,8.169352285469477,4.935149665994141,16.0,47.0,66.0,71.0,COMPLETE
5061,0.378030871650948,2024-04-11 17:16:52.955735,2024-04-11 17:16:54.255640,0 days 00:00:01.299905,99.94930336517474,8.002490919453257,sigmoid,43,40.0,28.0,30.0,,,,,,3.6665702307184924,9.99884956669682,2.191906786059569,5.0,32.0,54.0,81.0,COMPLETE
5062,0.5952371952371952,2024-04-11 17:16:54.257630,2024-04-11 17:16:55.105528,0 days 00:00:00.847898,96.48017539407094,7.55881365008784,sigmoid,8,,26.0,32.0,,,,,,,,,,,,,COMPLETE
5063,0.3277894814650553,2024-04-11 17:16:55.107489,2024-04-11 17:16:56.186481,0 days 00:00:01.078992,93.96999471902241,8.151042908863433,sigmoid,21,,,,8.0,5.0,40.0,49.0,12.0,,,,,,,139.0,COMPLETE
5064,0.5460507618652034,2024-04-11 17:16:56.188484,2024-04-11 17:16:57.384295,0 days 00:00:01.195811,96.6924621352129,7.903623845824277,sigmoid,18,,,,7.0,6.0,26.0,,,4.01324544620409,5.234437910476487,3.832485681883192,9.0,45.0,80.0,,COMPLETE
5065,0.5963245096172158,2024-04-11 17:16:57.386294,2024-04-11 17:16:58.230552,0 days 00:00:00.844258,98.04170804423734,8.394746801061768,sigmoid,8,,23.0,31.0,,,,,,,,,,,,,COMPLETE
5066,0.4837582236842105,2024-04-11 17:16:58.232592,2024-04-11 17:16:59.225403,0 days 00:00:00.992811,94.8757800914649,7.762372029398527,sigmoid,24,,25.0,29.0,5.0,8.0,74.0,,,,,,,,,,COMPLETE
5067,0.39191845164729,2024-04-11 17:16:59.227385,2024-04-11 17:17:00.298223,0 days 00:00:01.070838,99.940386993404,8.119270555678197,sigmoid,3,,,,,,,,,2.9958841172711304,6.280591811915992,5.39502826297108,2.0,50.0,56.0,110.0,COMPLETE
5068,0.43467255143765815,2024-04-11 17:17:00.300222,2024-04-11 17:17:01.552099,0 days 00:00:01.251877,99.94962455227419,7.303314044083552,sigmoid,22,,,,2.0,1.0,92.0,42.0,45.0,2.036408670492145,3.711401366303903,7.070766838875446,4.0,41.0,59.0,,COMPLETE
5069,0.23533112443903867,2024-04-11 17:17:01.555124,2024-04-11 17:17:02.689854,0 days 00:00:01.134730,96.76919699580995,8.670251475980347,sigmoid,6,,,,,,,39.0,23.0,5.556223896497769,2.4968421773527907,8.37198494440393,3.0,39.0,86.0,,COMPLETE
5070,0.2370328796595108,2024-04-11 17:17:02.691859,2024-04-11 17:17:03.875350,0 days 00:00:01.183491,98.3337355271287,7.973187109834029,sigmoid,38,2.0,,,,,,50.0,42.0,6.81464268761205,3.4150184621150372,9.542777069597594,13.0,36.0,83.0,,COMPLETE
5071,0.5931679318644695,2024-04-11 17:17:03.877349,2024-04-11 17:17:04.726836,0 days 00:00:00.849487,92.93603317919703,8.272803096860766,sigmoid,8,,27.0,27.0,,,,,,,,,,,,,COMPLETE
5072,0.41994199696174556,2024-04-11 17:17:04.728835,2024-04-11 17:17:06.238752,0 days 00:00:01.509917,98.1636067035923,7.66533559467513,sigmoid,31,,24.0,31.0,3.0,4.0,17.0,5.0,46.0,1.6811946062521663,6.562820736654719,4.0600079170300285,15.0,38.0,51.0,63.0,COMPLETE
5073,0.45022721836881124,2024-04-11 17:17:06.241334,2024-04-11 17:17:07.129822,0 days 00:00:00.888488,95.20608548209596,8.408861555231182,sigmoid,8,,25.0,28.0,,,,,,,,,,,,,COMPLETE
5074,0.44505591007552253,2024-04-11 17:17:07.131802,2024-04-11 17:17:08.532125,0 days 00:00:01.400323,98.2148794559262,8.029079356758087,sigmoid,47,32.0,23.0,30.0,,,,33.0,9.0,9.253594166198436,7.386186377584409,3.506798330614935,18.0,33.0,93.0,95.0,COMPLETE
