number,value,datetime_start,datetime_complete,duration,params_C,params_gamma,params_kernel,params_mask_number,params_rsi_window,params_so_smooth,params_so_window,params_srsi_smooth1,params_srsi_smooth2,params_srsi_window,params_tsi_window_fast,params_tsi_window_slow,params_ult_weight_1,params_ult_weight_2,params_ult_weight_3,params_ult_window_1,params_ult_window_2,params_ult_window_3,params_williams_lbp,state
2408,0.21452759905181173,2024-04-11 16:25:17.587642,2024-04-11 16:25:18.377533,0 days 00:00:00.789891,96.52043355964435,8.296568980176803,sigmoid,34,32.0,,,,,,,,3.9087149854401293,4.7115942477948884,3.408158718165658,4.0,27.0,68.0,,COMPLETE
2409,0.3166934475986431,2024-04-11 16:25:18.378636,2024-04-11 16:25:19.249099,0 days 00:00:00.870463,98.36930503606918,7.86124734977319,sigmoid,7,,,,,,,28.0,36.0,8.845908919187595,8.411112787921455,7.6638398051859875,6.0,20.0,59.0,55.0,COMPLETE
2410,0.5885628854419735,2024-04-11 16:25:19.251096,2024-04-11 16:25:19.991237,0 days 00:00:00.740141,98.26298201488795,5.816068111495124,sigmoid,8,,29.0,34.0,,,,,,,,,,,,,COMPLETE
2411,0.45471244496069596,2024-04-11 16:25:19.992451,2024-04-11 16:25:20.958906,0 days 00:00:00.966455,99.93017537626444,8.148266201247955,sigmoid,27,,25.0,33.0,5.0,5.0,54.0,,,7.64532794735835,3.1959356046811114,4.634791744256591,15.0,39.0,94.0,34.0,COMPLETE
2412,0.5560675883256528,2024-04-11 16:25:20.959931,2024-04-11 16:25:21.570242,0 days 00:00:00.610311,94.10114956978236,7.431770965600698,sigmoid,4,,,,,,,12.0,35.0,,,,,,,,COMPLETE
2413,0.4942931167285204,2024-04-11 16:25:21.572243,2024-04-11 16:25:22.335589,0 days 00:00:00.763346,96.62593521600239,7.795262758966485,sigmoid,45,37.0,27.0,29.0,,,,19.0,12.0,,,,,,,83.0,COMPLETE
2414,0.4394792581495066,2024-04-11 16:25:22.337589,2024-04-11 16:25:23.118337,0 days 00:00:00.780748,98.34282658137336,9.097741300761529,sigmoid,53,35.0,,,2.0,8.0,95.0,4.0,38.0,,,,,,,164.0,COMPLETE
2415,0.6009432182607054,2024-04-11 16:25:23.119338,2024-04-11 16:25:23.825496,0 days 00:00:00.706158,95.23906716250467,7.981137999814237,sigmoid,8,,28.0,31.0,,,,,,,,,,,,,COMPLETE
2416,0.4929027593685987,2024-04-11 16:25:23.827520,2024-04-11 16:25:24.793821,0 days 00:00:00.966301,99.98770059159853,8.34315065308331,sigmoid,51,44.0,,,6.0,1.0,60.0,,,6.153545071926444,9.022254984028057,2.415281570010872,3.0,44.0,55.0,170.0,COMPLETE
2417,0.4456934853594561,2024-04-11 16:25:24.794822,2024-04-11 16:25:25.519886,0 days 00:00:00.725064,99.94358152870197,8.534841020672234,sigmoid,17,,,,8.0,2.0,4.0,,,,,,,,,88.0,COMPLETE
2418,0.48962069979417816,2024-04-11 16:25:25.521886,2024-04-11 16:25:26.980725,0 days 00:00:01.458839,99.952247761909,7.654272931569494,rbf,8,,26.0,30.0,,,,,,,,,,,,,COMPLETE
2419,0.4511322055470117,2024-04-11 16:25:26.981725,2024-04-11 16:25:28.201482,0 days 00:00:01.219757,99.99440430317647,8.14789402367012,sigmoid,30,,24.0,32.0,1.0,4.0,88.0,29.0,5.0,4.22101588980864,1.2738376513412017,7.275261913450473,5.0,22.0,83.0,,COMPLETE
2420,0.5063760572543917,2024-04-11 16:25:28.203482,2024-04-11 16:25:28.902293,0 days 00:00:00.698811,96.72063772446108,7.282100574349194,sigmoid,5,,,,,,,10.0,23.0,,,,,,,30.0,COMPLETE
2421,0.40108410322844573,2024-04-11 16:25:28.904293,2024-04-11 16:25:29.599937,0 days 00:00:00.695644,51.352173212806804,7.99585682077689,sigmoid,49,38.0,,,4.0,6.0,98.0,,,,,,,,,45.0,COMPLETE
2422,0.3343554882329035,2024-04-11 16:25:29.601964,2024-04-11 16:25:30.487238,0 days 00:00:00.885274,99.9959411861495,8.285476806199794,sigmoid,50,2.0,,,2.0,8.0,20.0,,,3.520058616790498,5.673422074593732,3.7870434322652247,11.0,42.0,51.0,,COMPLETE
2423,0.40158478605388276,2024-04-11 16:25:30.489264,2024-04-11 16:25:31.601162,0 days 00:00:01.111898,96.70820104996187,7.818066652720793,sigmoid,58,7.0,26.0,30.0,3.0,3.0,32.0,,,3.224916769178223,8.195057474574979,5.9232908084969615,8.0,35.0,61.0,,COMPLETE
2424,0.5963245096172158,2024-04-11 16:25:31.601162,2024-04-11 16:25:32.279144,0 days 00:00:00.677982,94.2183873023796,8.6564359392627,sigmoid,8,,24.0,31.0,,,,,,,,,,,,,COMPLETE
2425,0.5952371952371952,2024-04-11 16:25:32.281150,2024-04-11 16:25:32.896997,0 days 00:00:00.615847,97.9022737251742,8.118641102784764,sigmoid,8,,21.0,32.0,,,,,,,,,,,,,COMPLETE
2426,0.5075601220387653,2024-04-11 16:25:32.898056,2024-04-11 16:25:33.781518,0 days 00:00:00.883462,98.13887411433645,7.640215917027131,sigmoid,19,,,,7.0,3.0,37.0,,,9.10908072918642,6.302249703679068,5.665956852459457,10.0,46.0,66.0,141.0,COMPLETE
2427,0.40614759937313005,2024-04-11 16:25:33.783575,2024-04-11 16:25:34.589403,0 days 00:00:00.805828,99.97449015926831,8.407415819982514,sigmoid,18,,,,6.0,7.0,73.0,,,7.939245736737617,2.854200896883812,9.277512345527757,12.0,29.0,97.0,,COMPLETE
2428,0.4847733359785736,2024-04-11 16:25:34.590405,2024-04-11 16:25:35.548648,0 days 00:00:00.958243,93.4784992609052,7.942724694877506,sigmoid,43,14.0,25.0,33.0,,,,,,1.2492557108839062,4.986843077433978,7.076786501019405,14.0,23.0,67.0,75.0,COMPLETE
2429,0.4771818181818181,2024-04-11 16:25:35.549647,2024-04-11 16:25:36.450817,0 days 00:00:00.901170,95.42593457703325,8.210682017237023,sigmoid,39,47.0,,,,,,32.0,43.0,8.415764120112874,4.187056985924064,6.729135441177495,2.0,25.0,54.0,101.0,COMPLETE
2430,0.45347172512526845,2024-04-11 16:25:36.451817,2024-04-11 16:25:37.150987,0 days 00:00:00.699170,99.97816049499883,7.870032031292665,sigmoid,8,,23.0,28.0,,,,,,,,,,,,,COMPLETE
2431,0.3967784979031643,2024-04-11 16:25:37.152989,2024-04-11 16:25:37.993640,0 days 00:00:00.840651,96.58282241277479,8.50539529510246,sigmoid,29,,27.0,29.0,5.0,5.0,47.0,50.0,25.0,,,,,,,148.0,COMPLETE
2432,0.6009432182607054,2024-04-11 16:25:37.994641,2024-04-11 16:25:38.607035,0 days 00:00:00.612394,19.964626828926622,8.032276274441925,sigmoid,8,,26.0,31.0,,,,,,,,,,,,,COMPLETE
2433,0.5011967897873938,2024-04-11 16:25:38.608042,2024-04-11 16:25:39.402905,0 days 00:00:00.794863,98.20949924977968,8.23056868355454,sigmoid,25,,24.0,30.0,5.0,1.0,27.0,,,,,,,,,175.0,COMPLETE
2434,0.5577402787967718,2024-04-11 16:25:39.403906,2024-04-11 16:25:40.236135,0 days 00:00:00.832229,95.30159554606739,7.54234083336755,sigmoid,6,,,,,,,15.0,10.0,7.22204518288328,7.6659687011788975,1.601303465361004,4.0,32.0,63.0,,COMPLETE
2435,0.5975287681569516,2024-04-11 16:25:40.238316,2024-04-11 16:25:40.856949,0 days 00:00:00.618633,98.13391477665441,8.917038201189527,sigmoid,8,,28.0,32.0,,,,,,,,,,,,,COMPLETE
2436,0.47423967873059414,2024-04-11 16:25:40.858952,2024-04-11 16:25:41.851834,0 days 00:00:00.992882,96.92280281336413,7.773237585178681,sigmoid,47,20.0,25.0,29.0,,,,44.0,49.0,2.669751962801547,9.513631004776911,4.999561662069098,16.0,33.0,82.0,115.0,COMPLETE
2437,0.3485863955011171,2024-04-11 16:25:41.853833,2024-04-11 16:25:42.787594,0 days 00:00:00.933761,93.27925831341298,8.352225692646472,sigmoid,38,18.0,,,,,,38.0,22.0,2.111841171255404,0.671635846699127,6.169021030168427,19.0,45.0,88.0,,COMPLETE
2438,0.4978462815921947,2024-04-11 16:25:42.789619,2024-04-11 16:25:43.514700,0 days 00:00:00.725081,98.09276888327936,8.01941883988391,sigmoid,24,,26.0,31.0,1.0,6.0,56.0,,,,,,,,,,COMPLETE
2439,0.4467756865165073,2024-04-11 16:25:43.516906,2024-04-11 16:25:44.914218,0 days 00:00:01.397312,99.99724997852313,8.143157109982585,rbf,8,,22.0,33.0,,,,,,,,,,,,,COMPLETE
2440,0.3950464983867906,2024-04-11 16:25:44.915219,2024-04-11 16:25:45.696657,0 days 00:00:00.781438,96.62619952950813,7.696149769283944,sigmoid,21,,,,2.0,2.0,18.0,41.0,45.0,,,,,,,190.0,COMPLETE
2441,0.5085743594317954,2024-04-11 16:25:45.698656,2024-04-11 16:25:46.485703,0 days 00:00:00.787047,98.14689538874498,7.356695562309093,sigmoid,3,,,,,,,,,1.735424849641349,8.678019820960868,1.9604494947609337,13.0,37.0,70.0,80.0,COMPLETE
2442,0.41605652988251324,2024-04-11 16:25:46.487701,2024-04-11 16:25:47.457500,0 days 00:00:00.969799,96.03047999032518,7.931700798828161,sigmoid,22,,,,4.0,4.0,66.0,35.0,2.0,5.635038056052919,5.2289315251797595,1.2059190178352965,20.0,27.0,60.0,,COMPLETE
2443,0.46943143475852345,2024-04-11 16:25:47.458668,2024-04-11 16:25:48.297732,0 days 00:00:00.839064,94.98885177183134,8.572074511767365,sigmoid,57,5.0,25.0,30.0,8.0,5.0,93.0,,,,,,,,,156.0,COMPLETE
2444,0.4886062404241348,2024-04-11 16:25:48.299727,2024-04-11 16:25:49.339198,0 days 00:00:01.039471,97.25230651876169,8.256564568016925,sigmoid,31,,23.0,35.0,7.0,8.0,50.0,33.0,18.0,4.641277383181775,9.803493191018354,7.952213248822128,17.0,47.0,92.0,108.0,COMPLETE
2445,0.3353404353867532,2024-04-11 16:25:49.340224,2024-04-11 16:25:50.140808,0 days 00:00:00.800584,98.31505368899221,8.027127900086574,sigmoid,35,24.0,,,,,,,,1.5288619267136085,2.0187910296458664,6.555564086393592,9.0,38.0,52.0,21.0,COMPLETE
2446,0.5963245096172158,2024-04-11 16:25:50.143577,2024-04-11 16:25:50.780515,0 days 00:00:00.636938,98.20160364023813,8.39611938549465,sigmoid,8,,27.0,31.0,,,,,,,,,,,,,COMPLETE
2447,0.45233335087073184,2024-04-11 16:25:50.782630,2024-04-11 16:25:51.663195,0 days 00:00:00.880565,99.98015997051989,8.767173565117849,sigmoid,28,,24.0,32.0,3.0,7.0,81.0,17.0,46.0,,,,,,,,COMPLETE
2448,0.539873838650517,2024-04-11 16:25:51.664186,2024-04-11 16:25:52.345587,0 days 00:00:00.681401,93.19748280786263,7.829823233013091,sigmoid,9,,25.0,30.0,,,,,,,,,,,,129.0,COMPLETE
2449,0.5952371952371952,2024-04-11 16:25:52.347709,2024-04-11 16:25:52.970733,0 days 00:00:00.623024,95.20086742884087,7.610750062541689,sigmoid,8,,28.0,32.0,,,,,,,,,,,,,COMPLETE
2450,0.4312991273132388,2024-04-11 16:25:52.971734,2024-04-11 16:25:54.046679,0 days 00:00:01.074945,99.99657625879759,8.145932873132962,sigmoid,63,26.0,26.0,33.0,2.0,2.0,30.0,37.0,31.0,6.808508533270764,7.8655708771087,3.5851758975154953,15.0,47.0,78.0,183.0,COMPLETE
2451,0.3456597222222223,2024-04-11 16:25:54.048703,2024-04-11 16:25:54.927023,0 days 00:00:00.878320,99.97498463995902,8.389616403291656,sigmoid,42,17.0,23.0,29.0,,,,,,3.769333219449883,6.018699793376032,0.6998619897786824,18.0,43.0,100.0,,COMPLETE
2452,0.4935212219192626,2024-04-11 16:25:54.928024,2024-04-11 16:25:55.891143,0 days 00:00:00.963119,96.43688937052165,7.840761578973687,sigmoid,15,,25.0,27.0,,,,23.0,48.0,1.105935429372587,6.902114470851811,2.7095180480314323,12.0,29.0,72.0,41.0,COMPLETE
2453,0.6009432182607054,2024-04-11 16:25:55.893324,2024-04-11 16:25:56.513606,0 days 00:00:00.620282,99.99297456708477,8.091562909279125,sigmoid,8,,30.0,31.0,,,,,,,,,,,,,COMPLETE
2454,0.3367619181352243,2024-04-11 16:25:56.515606,2024-04-11 16:25:57.404076,0 days 00:00:00.888470,98.06931020107503,6.5548129104354915,sigmoid,14,,27.0,34.0,,,,2.0,27.0,0.7065807885044153,5.394913896910919,9.791779791107068,5.0,50.0,58.0,,COMPLETE
2455,0.40254082378747263,2024-04-11 16:25:57.406243,2024-04-11 16:25:58.856457,0 days 00:00:01.450214,93.56972117551605,8.315789549090871,rbf,16,,,,6.0,3.0,35.0,,,,,,,,,,COMPLETE
2456,0.5963245096172158,2024-04-11 16:25:58.858457,2024-04-11 16:25:59.486417,0 days 00:00:00.627960,96.44626516306732,8.583147151611135,sigmoid,8,,24.0,31.0,,,,,,,,,,,,,COMPLETE
2457,0.4502698896972542,2024-04-11 16:25:59.488417,2024-04-11 16:26:00.146544,0 days 00:00:00.658127,99.98493721759871,7.443613182562375,sigmoid,8,,26.0,30.0,,,,,,,,,,,,,COMPLETE
2458,0.5952371952371952,2024-04-11 16:26:00.148525,2024-04-11 16:26:00.780901,0 days 00:00:00.632376,95.04242015596753,7.919511582966065,sigmoid,8,,22.0,32.0,,,,,,,,,,,,,COMPLETE
2459,0.4514060313016924,2024-04-11 16:26:00.782086,2024-04-11 16:26:01.690152,0 days 00:00:00.908066,98.08766143400015,7.701671943858636,sigmoid,26,,26.0,28.0,1.0,4.0,85.0,,,5.387014865998013,0.9743273856175767,4.312805895188457,10.0,39.0,96.0,,COMPLETE
2460,0.4712007809957697,2024-04-11 16:26:01.693270,2024-04-11 16:26:02.774566,0 days 00:00:01.081296,97.09484731608464,8.199529464637516,sigmoid,62,10.0,24.0,30.0,5.0,1.0,75.0,27.0,15.0,6.367657707723394,9.98321923917658,2.8946780420540303,8.0,20.0,86.0,,COMPLETE
2461,0.5327473319584327,2024-04-11 16:26:02.776788,2024-04-11 16:26:03.576175,0 days 00:00:00.799387,98.01212497434021,7.078490651274997,sigmoid,2,,,,,,,,,2.3515142821382504,6.561017548394972,8.585929344601496,11.0,24.0,73.0,,COMPLETE
2462,0.4028059990324141,2024-04-11 16:26:03.578284,2024-04-11 16:26:04.278694,0 days 00:00:00.700410,95.04719729726186,8.018434300454931,sigmoid,41,6.0,28.0,33.0,,,,,,,,,,,,63.0,COMPLETE
2463,0.5664574057860322,2024-04-11 16:26:04.279695,2024-04-11 16:26:05.042369,0 days 00:00:00.762674,98.21044020194871,7.820950718984107,sigmoid,20,,,,8.0,7.0,14.0,48.0,50.0,,,,,,,,COMPLETE
2464,0.5174553737448866,2024-04-11 16:26:05.044367,2024-04-11 16:26:06.022829,0 days 00:00:00.978462,99.97017661250496,6.819431073596975,sigmoid,46,43.0,25.0,31.0,,,,31.0,19.0,3.083610750705796,4.413863945166569,5.438946881318458,3.0,40.0,76.0,,COMPLETE
2465,0.12622036262203626,2024-04-11 16:26:06.024833,2024-04-11 16:26:06.666463,0 days 00:00:00.641630,66.39236914365887,8.467647246421887,sigmoid,8,,23.0,29.0,,,,,,,,,,,,,COMPLETE
2466,0.3336465825712943,2024-04-11 16:26:06.668624,2024-04-11 16:26:07.539737,0 days 00:00:00.871113,96.7093070928193,8.213529320013228,sigmoid,10,,27.0,32.0,,,,,,9.981244735525983,2.3823243158475242,4.067659330081343,6.0,22.0,56.0,,COMPLETE
2467,0.449215640365254,2024-04-11 16:26:07.541878,2024-04-11 16:26:08.176979,0 days 00:00:00.635101,99.98703324161244,6.179264586859012,sigmoid,8,,25.0,30.0,,,,,,,,,,,,,COMPLETE
2468,0.6009432182607054,2024-04-11 16:26:08.177959,2024-04-11 16:26:08.889003,0 days 00:00:00.711044,93.47726102592081,7.9988931168422965,sigmoid,8,,26.0,31.0,,,,,,,,,,,,,COMPLETE
2469,0.33280980655046927,2024-04-11 16:26:08.890044,2024-04-11 16:26:09.667818,0 days 00:00:00.777774,96.53797083855973,7.596850444055736,sigmoid,37,45.0,,,,,,24.0,37.0,,,,,,,24.0,COMPLETE
2470,0.5906279643331437,2024-04-11 16:26:09.669822,2024-04-11 16:26:10.315380,0 days 00:00:00.645558,97.76854751774788,8.347669171894863,sigmoid,8,,29.0,34.0,,,,,,,,,,,,,COMPLETE
2471,0.4914027149321267,2024-04-11 16:26:10.316375,2024-04-11 16:26:11.098703,0 days 00:00:00.782328,98.29224036168586,8.74591307385431,sigmoid,52,13.0,,,3.0,6.0,9.0,8.0,33.0,,,,,,,,COMPLETE
2472,0.4189687204946243,2024-04-11 16:26:11.100703,2024-04-11 16:26:12.216827,0 days 00:00:01.116124,94.91947333152015,8.108563649880459,sigmoid,59,27.0,24.0,32.0,4.0,5.0,100.0,,,9.507359619186904,7.167759055074024,4.886050085869955,7.0,21.0,74.0,97.0,COMPLETE
2473,0.30671626369084526,2024-04-11 16:26:12.218825,2024-04-11 16:26:12.916492,0 days 00:00:00.697667,98.02786603805365,7.775466462300944,sigmoid,48,4.0,,,7.0,8.0,77.0,,,,,,,,,,COMPLETE
2474,0.23181557214150067,2024-04-11 16:26:12.918495,2024-04-11 16:26:14.077049,0 days 00:00:01.158554,95.52499511466394,7.912233854587706,rbf,11,,25.0,31.0,,,,,,8.665886454544575,3.8185404645726755,2.968730569190033,13.0,35.0,80.0,14.0,COMPLETE
2475,0.45345352376492626,2024-04-11 16:26:14.080051,2024-04-11 16:26:14.705185,0 days 00:00:00.625134,99.97448951431127,8.248884397491478,sigmoid,8,,27.0,30.0,,,,,,,,,,,,,COMPLETE
2476,0.5951910283216119,2024-04-11 16:26:14.706180,2024-04-11 16:26:15.407530,0 days 00:00:00.701350,96.69373269183701,4.003453196260548,sigmoid,8,,21.0,33.0,,,,,,,,,,,,,COMPLETE
2477,0.5318351300964579,2024-04-11 16:26:15.409530,2024-04-11 16:26:16.201589,0 days 00:00:00.792059,98.2426814035952,7.5414139418687665,sigmoid,12,,24.0,29.0,,,,20.0,29.0,,,,,,,,COMPLETE
2478,0.48560032289465555,2024-04-11 16:26:16.203768,2024-04-11 16:26:16.978497,0 days 00:00:00.774729,95.18008597506196,8.567075887394607,sigmoid,56,29.0,26.0,32.0,5.0,2.0,62.0,,,,,,,,,,COMPLETE
2479,0.3789432596430219,2024-04-11 16:26:16.980701,2024-04-11 16:26:17.730288,0 days 00:00:00.749587,98.23229382178303,8.099471428256434,sigmoid,13,,27.0,31.0,,,,45.0,9.0,,,,,,,92.0,COMPLETE
2480,0.45941541092230415,2024-04-11 16:26:17.731315,2024-04-11 16:26:18.675783,0 days 00:00:00.944468,93.0787863051073,7.236163109975733,sigmoid,23,,,,6.0,1.0,2.0,16.0,6.0,8.29653914526607,1.714802830780438,8.991588153081382,17.0,30.0,91.0,144.0,COMPLETE
2481,0.4415336479821817,2024-04-11 16:26:18.677838,2024-04-11 16:26:19.528998,0 days 00:00:00.851160,96.51890799789331,7.765322772988854,sigmoid,60,40.0,31.0,28.0,1.0,4.0,89.0,14.0,11.0,,,,,,,,COMPLETE
2482,0.45345352376492626,2024-04-11 16:26:19.530996,2024-04-11 16:26:20.207979,0 days 00:00:00.676983,70.63297691751222,8.365280018015373,sigmoid,8,,23.0,30.0,,,,,,,,,,,,,COMPLETE
2483,0.5929369437606513,2024-04-11 16:26:20.209172,2024-04-11 16:26:20.872296,0 days 00:00:00.663124,98.13503286246656,8.033840158017165,sigmoid,8,,25.0,33.0,,,,,,,,,,,,,COMPLETE
2484,0.4980596909616877,2024-04-11 16:26:20.874580,2024-04-11 16:26:21.510094,0 days 00:00:00.635514,98.05346793044906,7.893177018161941,sigmoid,1,,,,,,,,,,,,,,,124.0,COMPLETE
2485,0.41441523949079584,2024-04-11 16:26:21.512109,2024-04-11 16:26:22.575554,0 days 00:00:01.063445,95.14173770709645,8.267651860854256,sigmoid,55,34.0,,,7.0,6.0,39.0,28.0,13.0,4.89615208744557,3.039274284552682,3.1598050764178542,14.0,49.0,98.0,138.0,COMPLETE
2486,0.5963643249384587,2024-04-11 16:26:22.577685,2024-04-11 16:26:23.248127,0 days 00:00:00.670442,96.40465935683996,8.569536771896065,sigmoid,8,,28.0,32.0,,,,,,,,,,,,,COMPLETE
2487,0.5193687230989957,2024-04-11 16:26:23.249354,2024-04-11 16:26:24.242358,0 days 00:00:00.993004,99.93676782793418,9.984913338541713,sigmoid,7,,,,,,,30.0,26.0,7.024267603010224,7.4463631581099285,8.38053713110013,16.0,26.0,69.0,167.0,COMPLETE
2488,0.44701971028259324,2024-04-11 16:26:24.244355,2024-04-11 16:26:25.023255,0 days 00:00:00.778900,99.97487896103561,7.6978382968057115,sigmoid,8,,26.0,30.0,,,,,,,,,,,,,COMPLETE
2489,0.34993672665916764,2024-04-11 16:26:25.025256,2024-04-11 16:26:25.921950,0 days 00:00:00.896694,99.99833626226561,8.099754767084764,sigmoid,44,50.0,22.0,31.0,,,,18.0,17.0,,,,,,,,COMPLETE
2490,0.12622036262203626,2024-04-11 16:26:25.923978,2024-04-11 16:26:26.630713,0 days 00:00:00.706735,98.13224254622146,7.403057489471985,sigmoid,8,,24.0,29.0,,,,,,,,,,,,,COMPLETE
2491,0.45422751421630136,2024-04-11 16:26:26.632770,2024-04-11 16:26:27.602885,0 days 00:00:00.970115,75.06100034238389,8.409838434974974,sigmoid,54,21.0,,,2.0,5.0,69.0,39.0,24.0,4.0625598651080255,9.205270334272612,7.45996816634881,2.0,42.0,79.0,,COMPLETE
2492,0.5368075415739857,2024-04-11 16:26:27.605111,2024-04-11 16:26:28.436625,0 days 00:00:00.831514,93.63606881936184,7.88225103336392,sigmoid,34,9.0,,,,,,,,6.045895683128984,8.05525548982737,0.5070531093383686,5.0,36.0,62.0,,COMPLETE
2493,0.5464367998728847,2024-04-11 16:26:28.437623,2024-04-11 16:26:29.136096,0 days 00:00:00.698473,96.66487923143129,8.119824870618785,sigmoid,36,39.0,,,,,,42.0,8.0,,,,,,,,COMPLETE
2494,0.5952371952371952,2024-04-11 16:26:29.138269,2024-04-11 16:26:29.769743,0 days 00:00:00.631474,99.97512934581327,7.605248914454898,sigmoid,8,,25.0,32.0,,,,,,,,,,,,,COMPLETE
2495,0.37923693014768,2024-04-11 16:26:29.770745,2024-04-11 16:26:31.191657,0 days 00:00:01.420912,98.20318629171898,8.232902780386373,rbf,32,36.0,,,,,,,,,,,,,,,COMPLETE
2496,0.47361910652267,2024-04-11 16:26:31.192734,2024-04-11 16:26:32.087710,0 days 00:00:00.894976,95.12169294562408,7.951542051833057,sigmoid,61,31.0,24.0,31.0,4.0,3.0,24.0,12.0,7.0,,,,,,,119.0,COMPLETE
2497,0.5940618478467085,2024-04-11 16:26:32.089799,2024-04-11 16:26:32.817231,0 days 00:00:00.727432,96.79533126678182,8.773207709485414,sigmoid,8,,23.0,33.0,,,,,,,,,,,,,COMPLETE
2498,0.4871372111631065,2024-04-11 16:26:32.819229,2024-04-11 16:26:33.618764,0 days 00:00:00.799535,98.22536320859125,8.39424680257101,sigmoid,45,22.0,26.0,34.0,,,,47.0,40.0,,,,,,,68.0,COMPLETE
2499,0.44701971028259324,2024-04-11 16:26:33.620761,2024-04-11 16:26:34.264716,0 days 00:00:00.643955,12.231823076534383,8.008252890018849,sigmoid,8,,27.0,30.0,,,,,,,,,,,,,COMPLETE
2500,0.4770975282240016,2024-04-11 16:26:34.266714,2024-04-11 16:26:35.200817,0 days 00:00:00.934103,93.41078654718139,7.738335569976732,sigmoid,51,12.0,,,3.0,7.0,97.0,,,3.344951124096954,3.456165057596412,7.770622409046908,9.0,41.0,65.0,10.0,COMPLETE
2501,0.5355583604047259,2024-04-11 16:26:35.201994,2024-04-11 16:26:35.922819,0 days 00:00:00.720825,99.98741869696319,3.532873886535768,sigmoid,33,28.0,,,,,,,,,,,,,,47.0,COMPLETE
2502,0.26228716338606445,2024-04-11 16:26:35.924843,2024-04-11 16:26:36.784414,0 days 00:00:00.859571,96.60744687455777,8.225230875094615,sigmoid,18,,,,8.0,2.0,43.0,,,9.275340506474297,4.777207018602316,8.11951588668315,4.0,28.0,77.0,,COMPLETE
2503,0.5026660742057321,2024-04-11 16:26:36.785634,2024-04-11 16:26:37.530832,0 days 00:00:00.745198,99.97262874495392,8.481644343589194,sigmoid,40,14.0,29.0,29.0,,,,,,,,,,,,,COMPLETE
2504,0.36909411398748826,2024-04-11 16:26:37.532842,2024-04-11 16:26:38.633418,0 days 00:00:01.100576,95.48432418658561,8.001002352057075,sigmoid,27,,25.0,31.0,5.0,1.0,11.0,,,1.837456107626311,1.4023240630884217,2.3557061654314286,20.0,31.0,83.0,179.0,COMPLETE
2505,0.3684155114932444,2024-04-11 16:26:38.634476,2024-04-11 16:26:39.329854,0 days 00:00:00.695378,98.3129060250618,7.514622314908511,sigmoid,5,,,,,,,36.0,3.0,,,,,,,153.0,COMPLETE
2506,0.4952306842712987,2024-04-11 16:26:39.331856,2024-04-11 16:26:40.429846,0 days 00:00:01.097990,98.18755535960514,7.876635641618781,sigmoid,30,,23.0,32.0,1.0,4.0,58.0,46.0,44.0,5.781537529906837,3.9670024427064754,3.9056860048480657,8.0,32.0,81.0,,COMPLETE
2507,0.383881230116649,2024-04-11 16:26:40.433904,2024-04-11 16:26:41.597510,0 days 00:00:01.163606,96.54422707255766,8.248294526899594,sigmoid,58,25.0,26.0,28.0,6.0,3.0,16.0,,,6.582443584753805,6.232580816425086,1.4510466771533155,7.0,37.0,64.0,,COMPLETE
2508,0.44120064624018596,2024-04-11 16:26:41.599611,2024-04-11 16:26:42.412397,0 days 00:00:00.812786,93.50142537348646,7.7280993472810975,sigmoid,53,19.0,,,7.0,8.0,46.0,3.0,47.0,,,,,,,57.0,COMPLETE
2509,0.4632732892258657,2024-04-11 16:26:42.413392,2024-04-11 16:26:43.129526,0 days 00:00:00.716134,98.17460575581507,8.638260101021121,sigmoid,49,15.0,,,4.0,7.0,92.0,,,,,,,,,193.0,COMPLETE
