number,value,datetime_start,datetime_complete,duration,params_C,params_gamma,params_kernel,params_mask_number,params_rsi_window,params_so_smooth,params_so_window,params_srsi_smooth1,params_srsi_smooth2,params_srsi_window,params_tsi_window_fast,params_tsi_window_slow,params_ult_weight_1,params_ult_weight_2,params_ult_weight_3,params_ult_window_1,params_ult_window_2,params_ult_window_3,params_williams_lbp,state
7233,0.45024875621890553,2024-04-11 18:14:34.846863,2024-04-11 18:14:36.176027,0 days 00:00:01.329164,5.119734173013008,8.160014721222936,sigmoid,8,,25.0,30.0,,,,,,,,,,,,,COMPLETE
7234,0.44854374338698005,2024-04-11 18:14:36.179018,2024-04-11 18:14:38.610650,0 days 00:00:02.431632,16.48221463021781,8.020874429375057,sigmoid,54,17.0,,,4.0,8.0,81.0,20.0,12.0,5.9180622080250345,5.6146659475947125,1.2241585418683023,12.0,29.0,100.0,,COMPLETE
7235,0.5314519911098424,2024-04-11 18:14:38.615189,2024-04-11 18:14:40.073512,0 days 00:00:01.458323,98.09337868216957,8.466907462732761,sigmoid,4,,,,,,,42.0,38.0,,,,,,,,COMPLETE
7236,0.5038731541999516,2024-04-11 18:14:40.076512,2024-04-11 18:14:42.308698,0 days 00:00:02.232186,98.2253753552778,7.760556595818014,sigmoid,45,43.0,26.0,32.0,,,,13.0,15.0,,,,,,,16.0,COMPLETE
7237,0.5211907369104108,2024-04-11 18:14:42.312708,2024-04-11 18:14:43.561109,0 days 00:00:01.248401,39.34398605403205,8.211964594591509,sigmoid,33,4.0,,,,,,,,,,,,,,177.0,COMPLETE
7238,0.5929369437606513,2024-04-11 18:14:43.564671,2024-04-11 18:14:44.972593,0 days 00:00:01.407922,99.99443656413808,7.900609214813918,sigmoid,8,,20.0,33.0,,,,,,,,,,,,,COMPLETE
7239,0.5081533818403013,2024-04-11 18:14:44.974542,2024-04-11 18:14:46.926448,0 days 00:00:01.951906,95.53042589678967,8.313222625292306,sigmoid,19,,,,2.0,1.0,43.0,,,6.389325120002594,5.9101285421779854,5.266391779509832,2.0,37.0,82.0,70.0,COMPLETE
7240,0.5467496683335034,2024-04-11 18:14:46.929443,2024-04-11 18:14:48.265214,0 days 00:00:01.335771,93.63431617513844,8.080532665238206,sigmoid,5,,,,,,,46.0,25.0,,,,,,,168.0,COMPLETE
7241,0.3580291314511779,2024-04-11 18:14:48.268212,2024-04-11 18:14:50.906219,0 days 00:00:02.638007,98.21985110460999,7.57016433550624,sigmoid,51,50.0,,,5.0,4.0,7.0,,,3.3117865777070516,5.280952597378213,9.662070399744469,6.0,47.0,66.0,46.0,COMPLETE
7242,0.4928851750006674,2024-04-11 18:14:50.909216,2024-04-11 18:14:52.426517,0 days 00:00:01.517301,96.56806083431142,8.617341363216926,sigmoid,17,,,,3.0,5.0,69.0,,,,,,,,,29.0,COMPLETE
7243,0.45781391147244804,2024-04-11 18:14:52.429512,2024-04-11 18:14:54.449917,0 days 00:00:02.020405,98.2970851897537,7.870964603159716,rbf,8,,28.0,29.0,,,,,,,,,,,,,COMPLETE
7244,0.45067257765766866,2024-04-11 18:14:54.453456,2024-04-11 18:14:56.113693,0 days 00:00:01.660237,95.09461226482195,8.200667406601802,sigmoid,53,33.0,,,7.0,6.0,21.0,29.0,41.0,,,,,,,200.0,COMPLETE
7245,0.4397989107666527,2024-04-11 18:14:56.115724,2024-04-11 18:14:58.227926,0 days 00:00:02.112202,98.17901139542391,7.687348101670657,sigmoid,58,22.0,23.0,30.0,6.0,7.0,34.0,,,7.941212267844545,7.860803040192295,0.864096577578902,19.0,32.0,57.0,,COMPLETE
7246,0.6009432182607054,2024-04-11 18:14:58.230932,2024-04-11 18:14:59.626662,0 days 00:00:01.395730,99.98240166654294,8.000995714834218,sigmoid,8,,27.0,31.0,,,,,,,,,,,,,COMPLETE
7247,0.5941143180531975,2024-04-11 18:14:59.629674,2024-04-11 18:15:01.074260,0 days 00:00:01.444586,96.34456506083623,4.248975644842951,sigmoid,8,,24.0,32.0,,,,,,,,,,,,,COMPLETE
7248,0.5351071692535108,2024-04-11 18:15:01.078291,2024-04-11 18:15:02.897593,0 days 00:00:01.819302,99.96882812355128,8.402780870766641,sigmoid,49,3.0,,,5.0,8.0,4.0,,,,,,,,,77.0,COMPLETE
7249,0.36976506639427986,2024-04-11 18:15:02.900591,2024-04-11 18:15:04.711518,0 days 00:00:01.810927,99.95876667090573,7.4183886060413515,sigmoid,18,,,,8.0,4.0,100.0,,,4.316401787395102,1.9669101172511034,2.3041787842787866,14.0,20.0,50.0,,COMPLETE
7250,0.5975614331269932,2024-04-11 18:15:04.715081,2024-04-11 18:15:06.060212,0 days 00:00:01.345131,73.15928378281265,5.99712918909829,sigmoid,8,,22.0,31.0,,,,,,,,,,,,,COMPLETE
7251,0.5054442202093209,2024-04-11 18:15:06.063211,2024-04-11 18:15:07.975390,0 days 00:00:01.912179,99.95044969527251,8.74913562588554,sigmoid,43,10.0,25.0,29.0,,,,,,6.8220280848024695,6.712407430182211,3.887436422124889,15.0,50.0,90.0,173.0,COMPLETE
7252,0.4561221464571598,2024-04-11 18:15:07.978996,2024-04-11 18:15:09.965423,0 days 00:00:01.986427,95.26661089881955,8.128180423018495,sigmoid,25,,27.0,33.0,1.0,2.0,75.0,,,,,,,,,114.0,COMPLETE
7253,0.26148054108479624,2024-04-11 18:15:09.969423,2024-04-11 18:15:11.967693,0 days 00:00:01.998270,93.3424538477929,7.845421565438816,sigmoid,6,,,,,,,40.0,27.0,7.138584285390499,3.542570940847968,9.839309054701978,16.0,24.0,79.0,,COMPLETE
7254,0.4565263084144889,2024-04-11 18:15:11.970693,2024-04-11 18:15:13.513610,0 days 00:00:01.542917,96.51566856602977,8.348140170562656,sigmoid,24,,26.0,19.0,2.0,1.0,54.0,,,,,,,,,,COMPLETE
7255,0.44701971028259324,2024-04-11 18:15:13.516684,2024-04-11 18:15:14.947168,0 days 00:00:01.430484,98.16730890060234,8.069669477446686,sigmoid,8,,24.0,30.0,,,,,,,,,,,,,COMPLETE
7256,0.3955058378448894,2024-04-11 18:15:14.949167,2024-04-11 18:15:17.211929,0 days 00:00:02.262762,96.71601541570946,8.493213428475498,sigmoid,39,29.0,,,,,,19.0,44.0,5.315274144959014,4.874601979545991,5.947973570307287,4.0,43.0,89.0,89.0,COMPLETE
7257,0.5003427762666136,2024-04-11 18:15:17.215491,2024-04-11 18:15:18.814298,0 days 00:00:01.598807,98.01615493924446,7.6936697443825,sigmoid,35,24.0,,,,,,,,2.3043179923713906,9.859271622638886,4.261548494802039,18.0,25.0,63.0,106.0,COMPLETE
7258,0.6009432182607054,2024-04-11 18:15:18.818308,2024-04-11 18:15:20.280657,0 days 00:00:01.462349,90.67313002619001,7.97739525462994,sigmoid,8,,25.0,31.0,,,,,,,,,,,,,COMPLETE
7259,0.4450145647932869,2024-04-11 18:15:20.283655,2024-04-11 18:15:22.237896,0 days 00:00:01.954241,94.41938154543647,8.268140015612921,sigmoid,50,11.0,,,4.0,5.0,65.0,,,1.766411430808216,9.039032880461777,6.207192908729734,13.0,36.0,91.0,,COMPLETE
7260,0.47699721406520595,2024-04-11 18:15:22.240888,2024-04-11 18:15:24.280223,0 days 00:00:02.039335,99.98454056025824,7.873180119216422,sigmoid,47,44.0,26.0,35.0,,,,34.0,7.0,8.776172102781288,0.5015886701744972,7.748559042336383,20.0,33.0,84.0,59.0,COMPLETE
7261,0.463346520828485,2024-04-11 18:15:24.283745,2024-04-11 18:15:26.545296,0 days 00:00:02.261551,51.67771603326733,8.13974475695476,sigmoid,31,,25.0,32.0,3.0,3.0,78.0,11.0,10.0,3.527842853387627,3.3406728741686824,9.120049497848452,11.0,21.0,75.0,125.0,COMPLETE
7262,0.15297802525604054,2024-04-11 18:15:26.548290,2024-04-11 18:15:28.607543,0 days 00:00:02.059253,98.2838658078808,7.540256385944019,rbf,29,,23.0,30.0,6.0,7.0,87.0,48.0,2.0,,,,,,,39.0,COMPLETE
7263,0.5963643249384587,2024-04-11 18:15:28.610544,2024-04-11 18:15:29.836758,0 days 00:00:01.226214,95.26283744591169,8.540355342766931,sigmoid,8,,28.0,32.0,,,,,,,,,,,,,COMPLETE
7264,0.4685419851092155,2024-04-11 18:15:29.839745,2024-04-11 18:15:31.833839,0 days 00:00:01.994094,96.70902304693118,7.760454500551214,sigmoid,22,,,,8.0,6.0,49.0,6.0,5.0,8.448872289852988,8.768630577035687,3.4258896477414273,7.0,23.0,96.0,,COMPLETE
7265,0.5064818660778698,2024-04-11 18:15:31.837401,2024-04-11 18:15:33.589898,0 days 00:00:01.752497,98.32356525923998,8.219745675979066,sigmoid,38,23.0,,,,,,49.0,19.0,7.581698900281587,4.4509750107833,8.369722689008482,6.0,30.0,86.0,,COMPLETE
7266,0.47203443473857454,2024-04-11 18:15:33.592888,2024-04-11 18:15:35.372591,0 days 00:00:01.779703,98.26605506672703,7.974158684550791,sigmoid,57,35.0,24.0,31.0,7.0,4.0,85.0,,,,,,,,,161.0,COMPLETE
7267,0.12003789673140693,2024-04-11 18:15:35.379165,2024-04-11 18:15:36.894230,0 days 00:00:01.515065,30.44149911132334,8.362651752950413,sigmoid,8,,27.0,28.0,,,,,,,,,,,,,COMPLETE
7268,0.5636462904171639,2024-04-11 18:15:36.896745,2024-04-11 18:15:37.919589,0 days 00:00:01.022844,92.09519384886096,7.290879371901928,sigmoid,0,,,,,,,,,,,,,,,,COMPLETE
7269,0.41128081226450364,2024-04-11 18:15:37.922585,2024-04-11 18:15:39.930386,0 days 00:00:02.007801,96.34892412100471,8.079306695523373,sigmoid,21,,,,5.0,2.0,18.0,23.0,31.0,,,,,,,24.0,COMPLETE
7270,0.5694204506191922,2024-04-11 18:15:39.933383,2024-04-11 18:15:41.294686,0 days 00:00:01.361303,93.6783629238583,7.71809754008014,sigmoid,8,,25.0,11.0,,,,,,,,,,,,,COMPLETE
7271,0.5502857837772103,2024-04-11 18:15:41.298562,2024-04-11 18:15:43.244228,0 days 00:00:01.945666,98.25593634855441,7.919255688369743,sigmoid,16,,,,2.0,8.0,60.0,,,,,,,,,,COMPLETE
7272,0.5130298671630426,2024-04-11 18:15:43.246759,2024-04-11 18:15:44.878796,0 days 00:00:01.632037,96.62125503506716,8.29728377557265,sigmoid,3,,,,,,,,,4.562343631592093,8.215611235348494,6.434045064580614,12.0,45.0,54.0,145.0,COMPLETE
7273,0.39973754120923083,2024-04-11 18:15:44.882810,2024-04-11 18:15:47.328019,0 days 00:00:02.445209,98.33653075014932,8.721754924677283,sigmoid,15,,26.0,29.0,,,,36.0,46.0,2.50565666297621,7.378907839239583,1.4352326077640165,17.0,38.0,69.0,86.0,COMPLETE
7274,0.3419754382281936,2024-04-11 18:15:47.333009,2024-04-11 18:15:49.285496,0 days 00:00:01.952487,95.31585473049415,8.117777473567829,sigmoid,14,,24.0,34.0,,,,28.0,17.0,3.002417574611342,4.084495562091489,3.5955124425568767,5.0,32.0,92.0,,COMPLETE
7275,0.44701971028259324,2024-04-11 18:15:49.288500,2024-04-11 18:15:50.579210,0 days 00:00:01.290710,96.44951381602945,7.516712070936508,sigmoid,8,,22.0,30.0,,,,,,,,,,,,,COMPLETE
7276,0.3257035917368459,2024-04-11 18:15:50.582214,2024-04-11 18:15:52.459670,0 days 00:00:01.877456,99.97454487106131,8.526473033234632,sigmoid,42,31.0,14.0,33.0,,,,,,6.2353831076445285,6.464635193722188,1.006838198086653,3.0,27.0,58.0,,COMPLETE
7277,0.5952371952371952,2024-04-11 18:15:52.462660,2024-04-11 18:15:54.004787,0 days 00:00:01.542127,98.25110178833458,7.858444064457422,sigmoid,8,,27.0,32.0,,,,,,,,,,,,,COMPLETE
7278,0.40839609749896716,2024-04-11 18:15:54.007343,2024-04-11 18:15:56.049580,0 days 00:00:02.042237,99.9588386042753,8.299327438966445,sigmoid,46,41.0,29.0,31.0,,,,21.0,11.0,4.825527055808084,9.989742554895965,8.747451441147033,9.0,22.0,56.0,,COMPLETE
7279,0.4110522331566995,2024-04-11 18:15:56.052581,2024-04-11 18:15:57.973903,0 days 00:00:01.921322,94.36150549677888,8.065664692830929,sigmoid,28,,23.0,31.0,6.0,5.0,13.0,10.0,43.0,,,,,,,,COMPLETE
7280,0.5952828415711333,2024-04-11 18:15:57.976414,2024-04-11 18:15:59.322724,0 days 00:00:01.346310,96.40479758326043,9.842303031003356,sigmoid,8,,26.0,30.0,,,,,,,,,,,,,COMPLETE
7281,0.4648221726911522,2024-04-11 18:15:59.326049,2024-04-11 18:16:01.845478,0 days 00:00:02.519429,98.21169496427751,7.778113729173895,sigmoid,63,46.0,25.0,33.0,4.0,7.0,72.0,44.0,32.0,2.0390066249614334,1.242826143127056,6.882741664833346,10.0,29.0,83.0,121.0,COMPLETE
7282,0.15570286408258274,2024-04-11 18:16:01.848502,2024-04-11 18:16:04.593585,0 days 00:00:02.745083,98.35443619122519,6.826759032632342,rbf,62,39.0,24.0,28.0,1.0,1.0,45.0,15.0,24.0,3.8405233659122735,9.349908223128372,5.674721833403331,8.0,49.0,73.0,,COMPLETE
7283,0.335489214023741,2024-04-11 18:16:04.597158,2024-04-11 18:16:05.951309,0 days 00:00:01.354151,99.95820956760478,8.510670009330026,sigmoid,9,,26.0,32.0,,,,,,,,,,,,139.0,COMPLETE
7284,0.33335839127983463,2024-04-11 18:16:05.953316,2024-04-11 18:16:07.886910,0 days 00:00:01.933594,92.58018627909752,8.177765211232298,sigmoid,10,,28.0,36.0,,,,,,8.114068218293731,7.183117227224823,7.607213887374289,19.0,42.0,60.0,,COMPLETE
7285,0.12622036262203626,2024-04-11 18:16:07.889891,2024-04-11 18:16:09.141210,0 days 00:00:01.251319,99.96784669468406,7.629198442312966,sigmoid,8,,25.0,29.0,,,,,,,,,,,,,COMPLETE
7286,0.24759575526446692,2024-04-11 18:16:09.144207,2024-04-11 18:16:10.615722,0 days 00:00:01.471515,95.57222603874922,7.954010222787247,sigmoid,2,,,,,,,,,1.562285468378577,6.977792284330799,2.210421479550857,16.0,35.0,67.0,,COMPLETE
7287,0.5564131074628819,2024-04-11 18:16:10.618746,2024-04-11 18:16:12.289082,0 days 00:00:01.670336,96.81953006460236,8.384879823531673,sigmoid,20,,,,3.0,6.0,25.0,39.0,13.0,,,,,,,,COMPLETE
7288,0.3802913925533014,2024-04-11 18:16:12.292079,2024-04-11 18:16:14.220216,0 days 00:00:01.928137,99.95958935059855,7.958502702366374,sigmoid,11,,2.0,31.0,,,,,,5.704013191417326,7.7135351708282816,9.45132434406675,14.0,26.0,95.0,195.0,COMPLETE
7289,0.44701971028259324,2024-04-11 18:16:14.223746,2024-04-11 18:16:15.607996,0 days 00:00:01.384250,47.78816602910404,8.18434498574928,sigmoid,8,,23.0,30.0,,,,,,,,,,,,,COMPLETE
7290,0.5975287681569516,2024-04-11 18:16:15.612004,2024-04-11 18:16:17.120733,0 days 00:00:01.508729,95.22503005789075,7.360287933764254,sigmoid,8,,27.0,32.0,,,,,,,,,,,,,COMPLETE
7291,0.25990608142197386,2024-04-11 18:16:17.123296,2024-04-11 18:16:19.305826,0 days 00:00:02.182530,98.21305542272094,7.7231469578159455,sigmoid,26,,26.0,33.0,7.0,3.0,10.0,,,6.556472990754996,2.2952104866832497,2.7284893627922555,2.0,37.0,53.0,,COMPLETE
7292,0.5963245096172158,2024-04-11 18:16:19.309862,2024-04-11 18:16:20.660001,0 days 00:00:01.350139,96.65523633014038,8.705648537629632,sigmoid,8,,24.0,31.0,,,,,,,,,,,,,COMPLETE
7293,0.3302133735226461,2024-04-11 18:16:20.663000,2024-04-11 18:16:22.127327,0 days 00:00:01.464327,99.973238783265,8.3274628223447,sigmoid,48,14.0,,,8.0,2.0,91.0,,,,,,,,,,COMPLETE
7294,0.44701971028259324,2024-04-11 18:16:22.130326,2024-04-11 18:16:23.476511,0 days 00:00:01.346185,83.00292601700707,8.027672608653459,sigmoid,8,,25.0,30.0,,,,,,,,,,,,,COMPLETE
7295,0.12622036262203626,2024-04-11 18:16:23.480532,2024-04-11 18:16:24.920644,0 days 00:00:01.440112,93.72941758205825,7.845956280184156,sigmoid,8,,24.0,29.0,,,,,,,,,,,,,COMPLETE
7296,0.4500070631445119,2024-04-11 18:16:24.923660,2024-04-11 18:16:27.112804,0 days 00:00:02.189144,98.11138116278642,7.586393904699885,sigmoid,59,9.0,27.0,31.0,4.0,4.0,80.0,,,9.829190698733143,5.5031314434122125,3.0884537172849496,8.0,44.0,88.0,152.0,COMPLETE
7297,0.4971198016673553,2024-04-11 18:16:27.116319,2024-04-11 18:16:29.216189,0 days 00:00:02.099870,96.6832481200264,9.045902990042425,sigmoid,55,28.0,,,6.0,8.0,30.0,25.0,29.0,5.181033755879182,1.5340491199370416,8.122867581320726,7.0,41.0,79.0,49.0,COMPLETE
7298,0.5007439438322406,2024-04-11 18:16:29.219200,2024-04-11 18:16:30.727883,0 days 00:00:01.508683,96.74989621680858,8.163451748263196,sigmoid,13,,26.0,32.0,,,,8.0,23.0,,,,,,,167.0,COMPLETE
7299,0.48398663020358546,2024-04-11 18:16:30.734408,2024-04-11 18:16:32.702045,0 days 00:00:01.967637,99.9265272407272,8.506383824603395,rbf,8,,22.0,30.0,,,,,,,,,,,,,COMPLETE
7300,0.5265758485338259,2024-04-11 18:16:32.704048,2024-04-11 18:16:34.469287,0 days 00:00:01.765239,98.26992163029757,7.975625458977403,sigmoid,41,16.0,25.0,34.0,,,,,,,,,,,,32.0,COMPLETE
7301,0.49830753260820504,2024-04-11 18:16:34.471269,2024-04-11 18:16:36.053333,0 days 00:00:01.582064,79.01913329587003,4.876887170860099,sigmoid,52,2.0,,,5.0,3.0,97.0,31.0,35.0,,,,,,,,COMPLETE
7302,0.5118459140503229,2024-04-11 18:16:36.056861,2024-04-11 18:16:37.551557,0 days 00:00:01.494696,99.98336362470785,8.290795605295626,sigmoid,12,,33.0,32.0,,,,16.0,3.0,,,,,,,,COMPLETE
7303,0.4324718086191322,2024-04-11 18:16:37.554552,2024-04-11 18:16:39.354018,0 days 00:00:01.799466,94.48397120100418,7.8368541636125215,sigmoid,60,25.0,28.0,31.0,7.0,1.0,63.0,50.0,16.0,,,,,,,,COMPLETE
7304,0.4264942528735632,2024-04-11 18:16:39.358560,2024-04-11 18:16:41.136556,0 days 00:00:01.777996,99.97876761584226,7.448658757388518,sigmoid,56,18.0,24.0,28.0,1.0,6.0,52.0,,,,,,,,,,COMPLETE
7305,0.4935212219192626,2024-04-11 18:16:41.139587,2024-04-11 18:16:43.389124,0 days 00:00:02.249537,95.31287313028447,8.097092376744248,sigmoid,23,,,,2.0,5.0,37.0,40.0,14.0,7.777004438388858,5.998044313157537,4.6270363091981155,11.0,46.0,78.0,43.0,COMPLETE
7306,0.4448341684562156,2024-04-11 18:16:43.393133,2024-04-11 18:16:44.827330,0 days 00:00:01.434197,99.95345763948286,8.404750185601333,sigmoid,8,,30.0,30.0,,,,,,,,,,,,,COMPLETE
7307,0.3398880385487528,2024-04-11 18:16:44.831334,2024-04-11 18:16:46.544031,0 days 00:00:01.712697,96.68130744176939,7.685131522672446,sigmoid,44,30.0,23.0,29.0,,,,47.0,21.0,,,,,,,,COMPLETE
7308,0.594268224819143,2024-04-11 18:16:46.546580,2024-04-11 18:16:48.094658,0 days 00:00:01.548078,98.27570162933397,8.160543298343935,sigmoid,8,,21.0,27.0,,,,,,,,,,,,,COMPLETE
7309,0.5034431708575403,2024-04-11 18:16:48.098244,2024-04-11 18:16:50.143755,0 days 00:00:02.045511,99.98166888119864,7.930707691611334,sigmoid,7,,,,,,,3.0,38.0,2.7742313884803993,5.762273878436937,6.072808154260727,15.0,39.0,98.0,73.0,COMPLETE
7310,0.35210582628149023,2024-04-11 18:16:50.146892,2024-04-11 18:16:52.606373,0 days 00:00:02.459481,92.6411426545691,8.8747069796891,sigmoid,54,6.0,,,5.0,7.0,41.0,41.0,9.0,9.004457544454059,8.641453416413306,0.5006732790650741,4.0,30.0,64.0,,COMPLETE
7311,0.3317939859696125,2024-04-11 18:16:52.609301,2024-04-11 18:16:54.142722,0 days 00:00:01.533421,96.77160597010858,7.164456896827636,sigmoid,37,42.0,,,,,,13.0,33.0,,,,,,,54.0,COMPLETE
7312,0.4860924611548052,2024-04-11 18:16:54.147304,2024-04-11 18:16:55.577171,0 days 00:00:01.429867,98.28613938761926,8.61803821858658,sigmoid,40,37.0,26.0,33.0,,,,,,,,,,,,,COMPLETE
7313,0.25894134477825465,2024-04-11 18:16:55.580213,2024-04-11 18:16:57.002891,0 days 00:00:01.422678,90.65727065416598,8.289568209750271,sigmoid,36,26.0,,,,,,43.0,8.0,,,,,,,,COMPLETE
7314,0.6009432182607054,2024-04-11 18:16:57.004845,2024-04-11 18:16:58.479827,0 days 00:00:01.474982,64.6185920340889,8.026694232968389,sigmoid,8,,25.0,31.0,,,,,,,,,,,,,COMPLETE
7315,0.4511175430133462,2024-04-11 18:16:58.482827,2024-04-11 18:17:01.227806,0 days 00:00:02.744979,93.8697982502035,7.748460563500727,sigmoid,30,,26.0,32.0,8.0,2.0,93.0,38.0,40.0,0.8125154877074321,0.9679912799275794,5.428181938656815,3.0,34.0,70.0,,COMPLETE
7316,0.44701971028259324,2024-04-11 18:17:01.232836,2024-04-11 18:17:02.800573,0 days 00:00:01.567737,96.82757180640634,8.180085889148161,sigmoid,8,,27.0,30.0,,,,,,,,,,,,,COMPLETE
7317,0.4838224647769672,2024-04-11 18:17:02.803579,2024-04-11 18:17:05.074843,0 days 00:00:02.271264,37.17045922821809,8.456821882296788,sigmoid,27,,23.0,31.0,3.0,4.0,89.0,,,9.583093855475072,9.68848388217905,4.449932518567909,13.0,28.0,82.0,21.0,COMPLETE
7318,0.46225411206713074,2024-04-11 18:17:05.077387,2024-04-11 18:17:07.554888,0 days 00:00:02.477501,95.29616159864503,7.550056510369675,rbf,8,,27.0,35.0,,,,,,,,,,,,,COMPLETE
7319,0.4403363868448716,2024-04-11 18:17:07.558439,2024-04-11 18:17:09.704705,0 days 00:00:02.146266,98.28810120025194,7.883753507354702,sigmoid,51,40.0,,,4.0,8.0,76.0,,,1.3142907174840124,2.8036127913178817,1.8107484598598962,16.0,48.0,99.0,95.0,COMPLETE
7320,0.3614731069965812,2024-04-11 18:17:09.710291,2024-04-11 18:17:10.919598,0 days 00:00:01.209307,98.25845430660699,8.066344608987748,sigmoid,1,,,,,,,,,,,,,,,81.0,COMPLETE
7321,0.42992874109263657,2024-04-11 18:17:10.922592,2024-04-11 18:17:12.904309,0 days 00:00:01.981717,96.68268552939473,8.321937553964785,sigmoid,61,7.0,25.0,33.0,6.0,3.0,27.0,34.0,50.0,,,,,,,133.0,COMPLETE
7322,0.12622036262203626,2024-04-11 18:17:12.907875,2024-04-11 18:17:14.236927,0 days 00:00:01.329052,55.56913641268813,7.714211040003975,sigmoid,8,,24.0,29.0,,,,,,,,,,,,,COMPLETE
7323,0.5764653293848131,2024-04-11 18:17:14.240521,2024-04-11 18:17:15.579922,0 days 00:00:01.339401,98.11194592070183,8.55673248204933,sigmoid,32,19.0,,,,,,,,,,,,,,,COMPLETE
7324,0.5716032931125755,2024-04-11 18:17:15.582919,2024-04-11 18:17:16.964036,0 days 00:00:01.381117,95.08585893586663,7.878513937493167,sigmoid,5,,,,,,,45.0,47.0,,,,,,,13.0,COMPLETE
7325,0.5176599999999999,2024-04-11 18:17:16.967038,2024-04-11 18:17:18.325289,0 days 00:00:01.358251,89.07471877665539,8.147622144540195,sigmoid,33,5.0,,,,,,,,,,,,,,101.0,COMPLETE
7326,0.35386119257087006,2024-04-11 18:17:18.329646,2024-04-11 18:17:19.739525,0 days 00:00:01.409879,98.16243278414734,9.22392089725016,sigmoid,4,,,,,,,22.0,34.0,,,,,,,,COMPLETE
7327,0.504541740760321,2024-04-11 18:17:19.743545,2024-04-11 18:17:21.672217,0 days 00:00:01.928672,99.97399848063912,7.9959172961310205,sigmoid,45,34.0,25.0,32.0,,,,27.0,37.0,,,,,,,188.0,COMPLETE
7328,0.1857589678428306,2024-04-11 18:17:21.676228,2024-04-11 18:17:23.339218,0 days 00:00:01.662990,96.60675889325128,8.328159516862597,sigmoid,34,49.0,,,,,,,,1.135950371900222,4.278566717442064,6.625961936784914,9.0,24.0,94.0,,COMPLETE
7329,0.5986580986580987,2024-04-11 18:17:23.342200,2024-04-11 18:17:24.623796,0 days 00:00:01.281596,93.78306077568394,7.5171290750755855,sigmoid,8,,31.0,31.0,,,,,,,,,,,,,COMPLETE
7330,0.48534847203768566,2024-04-11 18:17:24.627312,2024-04-11 18:17:26.495345,0 days 00:00:01.868033,99.94332116671411,8.177452600733035,sigmoid,53,45.0,,,2.0,5.0,47.0,9.0,27.0,,,,,,,158.0,COMPLETE
7331,0.44701971028259324,2024-04-11 18:17:26.497899,2024-04-11 18:17:27.858807,0 days 00:00:01.360908,99.93964963334523,7.827768052710782,sigmoid,8,,28.0,30.0,,,,,,,,,,,,,COMPLETE
7332,0.37883337883337875,2024-04-11 18:17:27.861321,2024-04-11 18:17:30.073971,0 days 00:00:02.212650,96.79046187114776,8.774162973038884,sigmoid,58,21.0,26.0,32.0,1.0,7.0,16.0,,,6.955169501516898,3.758523832384083,8.59467365327148,20.0,25.0,51.0,,COMPLETE
7333,0.4354830273549872,2024-04-11 18:17:30.075963,2024-04-11 18:17:32.044386,0 days 00:00:01.968423,98.20016911654031,2.9568954399400997,sigmoid,50,47.0,,,3.0,1.0,56.0,,,3.1493983009831963,9.089525059834614,7.085142960385618,10.0,31.0,76.0,,COMPLETE
7334,0.1274049741905209,2024-04-11 18:17:32.047917,2024-04-11 18:17:33.336347,0 days 00:00:01.288430,99.99698532759105,6.46970771642849,sigmoid,8,,22.0,29.0,,,,,,,,,,,,,COMPLETE
7335,0.45203322655953093,2024-04-11 18:17:33.340893,2024-04-11 18:17:35.216538,0 days 00:00:01.875645,95.2143934928845,3.737076453414155,sigmoid,19,,,,5.0,6.0,58.0,,,8.577793863558263,6.197694539432419,5.255957897168211,17.0,21.0,68.0,62.0,COMPLETE
