number,value,datetime_start,datetime_complete,duration,params_C,params_gamma,params_kernel,params_mask_number,params_rsi_window,params_so_smooth,params_so_window,params_srsi_smooth1,params_srsi_smooth2,params_srsi_window,params_tsi_window_fast,params_tsi_window_slow,params_ult_weight_1,params_ult_weight_2,params_ult_weight_3,params_ult_window_1,params_ult_window_2,params_ult_window_3,params_williams_lbp,state
2920,0.6009432182607054,2024-04-11 16:32:45.755911,2024-04-11 16:32:46.513038,0 days 00:00:00.757127,96.62568098375415,8.017299976589625,sigmoid,8,,24.0,31.0,,,,,,,,,,,,,COMPLETE
2921,0.3386880384126536,2024-04-11 16:32:46.515180,2024-04-11 16:32:47.346809,0 days 00:00:00.831629,98.23676104069088,8.32859303532494,sigmoid,12,,25.0,32.0,,,,37.0,39.0,,,,,,,,COMPLETE
2922,0.49352712443095603,2024-04-11 16:32:47.347863,2024-04-11 16:32:48.486165,0 days 00:00:01.138302,93.9425617603671,8.766207103530315,sigmoid,59,39.0,22.0,30.0,2.0,5.0,34.0,,,1.9219487770235326,6.6951005530497385,4.705082752248472,17.0,50.0,97.0,144.0,COMPLETE
2923,0.1621787314312662,2024-04-11 16:32:48.488271,2024-04-11 16:32:49.806987,0 days 00:00:01.318716,98.11962726409878,8.108457845472412,rbf,60,31.0,26.0,31.0,3.0,1.0,31.0,3.0,10.0,,,,,,,,COMPLETE
2924,0.5239375898172859,2024-04-11 16:32:49.808987,2024-04-11 16:32:50.617638,0 days 00:00:00.808651,96.6077159490967,7.6385466578804975,sigmoid,40,24.0,23.0,27.0,,,,,,,,,,,,,COMPLETE
2925,0.5090277449543886,2024-04-11 16:32:50.619637,2024-04-11 16:32:51.710727,0 days 00:00:01.091090,95.34948477839828,7.877234644150751,sigmoid,23,,,,5.0,3.0,43.0,35.0,38.0,4.009684686515923,8.546712503000789,7.944999400641377,18.0,48.0,61.0,188.0,COMPLETE
2926,0.5001265555789918,2024-04-11 16:32:51.712779,2024-04-11 16:32:52.350249,0 days 00:00:00.637470,52.92595713836481,8.366986084176444,sigmoid,32,43.0,,,,,,,,,,,,,,,COMPLETE
2927,0.5425169369739272,2024-04-11 16:32:52.352250,2024-04-11 16:32:53.111921,0 days 00:00:00.759671,98.14716522763838,8.143878754974423,sigmoid,36,33.0,,,,,,14.0,6.0,,,,,,,,COMPLETE
2928,0.3660977254178347,2024-04-11 16:32:53.113906,2024-04-11 16:32:54.123796,0 days 00:00:01.009890,92.5165346310956,7.684520222918547,sigmoid,7,,,,,,,19.0,30.0,3.821444943817667,3.2915971095404633,9.65764732413534,19.0,22.0,93.0,28.0,COMPLETE
2929,0.5963643249384587,2024-04-11 16:32:54.124889,2024-04-11 16:32:54.824894,0 days 00:00:00.700005,98.13845183137896,8.567367213878276,sigmoid,8,,31.0,32.0,,,,,,,,,,,,,COMPLETE
2930,0.12622036262203626,2024-04-11 16:32:54.825898,2024-04-11 16:32:55.544028,0 days 00:00:00.718130,95.35085808805168,7.929051524441182,sigmoid,8,,27.0,29.0,,,,,,,,,,,,,COMPLETE
2931,0.43486385477843026,2024-04-11 16:32:55.546075,2024-04-11 16:32:56.699094,0 days 00:00:01.153019,98.29956863348076,8.269923390053679,sigmoid,27,,25.0,33.0,3.0,4.0,74.0,,,1.4066216084245768,4.184448151076538,1.3743413141861702,2.0,25.0,50.0,173.0,COMPLETE
2932,0.4315583542214342,2024-04-11 16:32:56.701088,2024-04-11 16:32:57.837541,0 days 00:00:01.136453,75.25852274054856,8.040033393835305,sigmoid,30,,29.0,34.0,4.0,7.0,91.0,23.0,47.0,6.829238466586331,3.9262144624959854,6.328275195545023,7.0,20.0,86.0,,COMPLETE
2933,0.5457929542902299,2024-04-11 16:32:57.839708,2024-04-11 16:32:58.721356,0 days 00:00:00.881648,96.87655587343126,9.40490236364,sigmoid,34,11.0,,,,,,,,6.527288981100538,7.226800922126741,5.013702650694625,5.0,38.0,59.0,,COMPLETE
2934,0.5964036904537752,2024-04-11 16:32:58.723356,2024-04-11 16:32:59.433418,0 days 00:00:00.710062,98.25299340489585,7.317219480502658,sigmoid,8,,24.0,31.0,,,,,,,,,,,,,COMPLETE
2935,0.32290675547097997,2024-04-11 16:32:59.435458,2024-04-11 16:33:00.333833,0 days 00:00:00.898375,94.29721676890671,4.042172912402593,sigmoid,33,5.0,,,,,,,,,,,,,,75.0,COMPLETE
2936,0.4363944522689837,2024-04-11 16:33:00.335993,2024-04-11 16:33:01.017685,0 days 00:00:00.681692,96.58000469479067,7.801161143595204,sigmoid,1,,,,,,,,,,,,,,,18.0,COMPLETE
2937,0.45006781534133716,2024-04-11 16:33:01.018688,2024-04-11 16:33:02.049240,0 days 00:00:01.030552,98.38942573424397,8.419260515092807,sigmoid,61,47.0,26.0,30.0,7.0,5.0,84.0,12.0,23.0,,,,,,,110.0,COMPLETE
2938,0.568543090483352,2024-04-11 16:33:02.050237,2024-04-11 16:33:02.797516,0 days 00:00:00.747279,98.28837065763632,8.98861175417324,sigmoid,4,,,,,,,27.0,19.0,,,,,,,,COMPLETE
2939,0.5408476471186097,2024-04-11 16:33:02.799517,2024-04-11 16:33:03.554752,0 days 00:00:00.755235,99.9248698508554,4.938660476505319,sigmoid,5,,,,,,,44.0,13.0,,,,,,,160.0,COMPLETE
2940,0.5963643249384587,2024-04-11 16:33:03.557867,2024-04-11 16:33:04.266065,0 days 00:00:00.708198,95.1641734313187,8.161699780039392,sigmoid,8,,27.0,32.0,,,,,,,,,,,,,COMPLETE
2941,0.39068207478249317,2024-04-11 16:33:04.268170,2024-04-11 16:33:05.312578,0 days 00:00:01.044408,96.54022570753021,7.522062766253845,sigmoid,51,8.0,,,8.0,1.0,23.0,,,4.913618452642193,2.92095597930506,4.09109871105793,14.0,49.0,98.0,166.0,COMPLETE
2942,0.48216102963184676,2024-04-11 16:33:05.314614,2024-04-11 16:33:06.876897,0 days 00:00:01.562283,99.95381174055954,7.938792590128173,rbf,8,,24.0,30.0,,,,,,,,,,,,,COMPLETE
2943,0.45324737599232773,2024-04-11 16:33:06.879098,2024-04-11 16:33:07.789513,0 days 00:00:00.910415,99.99034373168824,8.279331013621121,sigmoid,53,20.0,,,6.0,6.0,60.0,15.0,16.0,,,,,,,88.0,COMPLETE
2944,0.34220383119894404,2024-04-11 16:33:07.791514,2024-04-11 16:33:08.671783,0 days 00:00:00.880269,92.77939208776864,8.653815289879894,sigmoid,45,35.0,25.0,31.0,,,,43.0,26.0,,,,,,,178.0,COMPLETE
2945,0.4472781363211055,2024-04-11 16:33:08.674798,2024-04-11 16:33:09.514431,0 days 00:00:00.839633,96.80529878954997,7.671276938991511,sigmoid,17,,,,1.0,8.0,50.0,,,,,,,,,38.0,COMPLETE
2946,0.12622036262203626,2024-04-11 16:33:09.515431,2024-04-11 16:33:10.235043,0 days 00:00:00.719612,95.0596429823364,8.002754883523275,sigmoid,8,,28.0,29.0,,,,,,,,,,,,,COMPLETE
2947,0.5929369437606513,2024-04-11 16:33:10.236222,2024-04-11 16:33:10.964753,0 days 00:00:00.728531,98.19077277367049,8.452183189609666,sigmoid,8,,26.0,33.0,,,,,,,,,,,,,COMPLETE
2948,0.46718116821103167,2024-04-11 16:33:10.966180,2024-04-11 16:33:11.993243,0 days 00:00:01.027063,99.99839909434557,8.162606836376247,sigmoid,50,26.0,,,2.0,4.0,4.0,,,4.337399635110472,5.370597215215605,7.1179452808685415,13.0,42.0,83.0,,COMPLETE
2949,0.22313382077877908,2024-04-11 16:33:11.995242,2024-04-11 16:33:12.982223,0 days 00:00:00.986981,99.9705905752051,7.861131530821259,sigmoid,6,,,,,,,9.0,33.0,2.9649856383996034,1.591525191379048,7.4839556765484065,9.0,40.0,76.0,,COMPLETE
2950,0.5952371952371952,2024-04-11 16:33:12.984222,2024-04-11 16:33:13.689016,0 days 00:00:00.704794,96.5636555546666,8.114984380983856,sigmoid,8,,22.0,32.0,,,,,,,,,,,,,COMPLETE
2951,0.4145961250914644,2024-04-11 16:33:13.690017,2024-04-11 16:33:14.688230,0 days 00:00:00.998213,98.18253457360538,7.705061558952655,sigmoid,29,,24.0,31.0,5.0,2.0,94.0,26.0,35.0,,,,,,,197.0,COMPLETE
2952,0.4502230100640439,2024-04-11 16:33:14.690378,2024-04-11 16:33:15.807585,0 days 00:00:01.117207,94.93846550337669,8.326224752088114,sigmoid,58,41.0,23.0,30.0,4.0,6.0,78.0,,,0.9680703614399278,7.47909216762112,6.038875887506858,16.0,29.0,79.0,,COMPLETE
2953,0.40261286381152295,2024-04-11 16:33:15.809584,2024-04-11 16:33:16.985821,0 days 00:00:01.176237,99.99106736958507,7.941904483021039,sigmoid,47,16.0,25.0,28.0,,,,16.0,21.0,3.6060311901485194,8.390358846956792,6.689746241596644,6.0,43.0,87.0,106.0,COMPLETE
2954,0.5006275567125326,2024-04-11 16:33:16.987855,2024-04-11 16:33:17.960583,0 days 00:00:00.972728,96.43059062500417,8.579001124866418,sigmoid,18,,,,6.0,7.0,39.0,,,6.2613103683359945,5.619764880149727,2.0587286958621807,15.0,26.0,69.0,,COMPLETE
2955,0.5963643249384587,2024-04-11 16:33:17.962677,2024-04-11 16:33:18.672045,0 days 00:00:00.709368,98.23101298035584,8.148670853243111,sigmoid,8,,27.0,32.0,,,,,,,,,,,,,COMPLETE
2956,0.4507527002070625,2024-04-11 16:33:18.674095,2024-04-11 16:33:19.541988,0 days 00:00:00.867893,92.471039480254,7.553352541316133,sigmoid,49,37.0,,,7.0,8.0,58.0,,,,,,,,,68.0,COMPLETE
2957,0.49731163694071384,2024-04-11 16:33:19.544142,2024-04-11 16:33:20.506620,0 days 00:00:00.962478,96.74169417986374,6.1278116858096805,sigmoid,25,,26.0,31.0,8.0,5.0,27.0,,,,,,,,,126.0,COMPLETE
2958,0.3980080196611046,2024-04-11 16:33:20.507618,2024-04-11 16:33:21.645817,0 days 00:00:01.138199,99.99236580756178,2.9071471065842642,sigmoid,43,49.0,23.0,30.0,,,,,,5.8275771459093235,9.164510411143068,1.8474838220361867,11.0,30.0,67.0,22.0,COMPLETE
2959,0.5929369437606513,2024-04-11 16:33:21.647814,2024-04-11 16:33:22.362118,0 days 00:00:00.714304,94.82486014288082,6.887038286694101,sigmoid,8,,28.0,33.0,,,,,,,,,,,,,COMPLETE
2960,0.5074105563087388,2024-04-11 16:33:22.363315,2024-04-11 16:33:23.377285,0 days 00:00:01.013970,98.14216612760825,7.8204865842668,sigmoid,19,,,,3.0,3.0,53.0,,,2.72480384116104,2.5285394081888595,8.872042995515459,20.0,45.0,71.0,93.0,COMPLETE
2961,0.18550784052475144,2024-04-11 16:33:23.379464,2024-04-11 16:33:24.717061,0 days 00:00:01.337597,98.11830268952475,8.397493552678299,rbf,22,,,,6.0,1.0,89.0,47.0,5.0,8.936932286674107,0.9310967628895401,9.169034467552102,3.0,39.0,91.0,,COMPLETE
2962,0.12622036262203626,2024-04-11 16:33:24.719062,2024-04-11 16:33:25.476001,0 days 00:00:00.756939,99.95775050605944,8.055403870801673,sigmoid,8,,24.0,29.0,,,,,,,,,,,,,COMPLETE
2963,0.5883953883953884,2024-04-11 16:33:25.478104,2024-04-11 16:33:26.220829,0 days 00:00:00.742725,93.79033892801797,7.372919741752287,sigmoid,8,,30.0,34.0,,,,,,,,,,,,,COMPLETE
2964,0.4979699770286875,2024-04-11 16:33:26.223844,2024-04-11 16:33:27.065010,0 days 00:00:00.841166,96.51535715706018,8.224293042802328,sigmoid,24,,26.0,31.0,5.0,4.0,67.0,,,,,,,,,,COMPLETE
2965,0.3519425644093782,2024-04-11 16:33:27.066128,2024-04-11 16:33:27.933346,0 days 00:00:00.867218,98.21412312791645,7.829967682126319,sigmoid,3,,,,,,,,,0.5035221130789518,2.154119401838449,3.063192201956501,8.0,31.0,81.0,63.0,COMPLETE
2966,0.3182209254479483,2024-04-11 16:33:27.935347,2024-04-11 16:33:28.871590,0 days 00:00:00.936243,96.64472856977017,5.745714161036544,sigmoid,21,,,,4.0,6.0,46.0,29.0,34.0,,,,,,,200.0,COMPLETE
2967,0.49305366385181143,2024-04-11 16:33:28.872591,2024-04-11 16:33:30.061990,0 days 00:00:01.189399,99.975232397608,8.737245834250137,sigmoid,31,,25.0,32.0,2.0,2.0,14.0,11.0,8.0,9.172321966370326,8.194394306676923,2.7782341693373582,4.0,24.0,85.0,100.0,COMPLETE
2968,0.34543141259584154,2024-04-11 16:33:30.064195,2024-04-11 16:33:31.014805,0 days 00:00:00.950610,93.84358117877167,7.989244661348186,sigmoid,35,2.0,,,,,,,,5.440043583308688,8.691454381878325,0.7431917638801737,12.0,33.0,52.0,51.0,COMPLETE
2969,0.45022721836881124,2024-04-11 16:33:31.015804,2024-04-11 16:33:31.751287,0 days 00:00:00.735483,98.23218312745536,8.486337836042217,sigmoid,8,,27.0,28.0,,,,,,,,,,,,,COMPLETE
2970,0.4283113888720345,2024-04-11 16:33:31.752482,2024-04-11 16:33:32.906765,0 days 00:00:01.154283,96.77821127604128,7.658583356243085,sigmoid,15,,21.0,31.0,,,,32.0,3.0,8.545859653505818,3.770353653093043,7.832446317242237,18.0,23.0,94.0,83.0,COMPLETE
2971,0.4491845899314583,2024-04-11 16:33:32.908934,2024-04-11 16:33:33.653618,0 days 00:00:00.744684,99.9621995678892,7.156049620573017,sigmoid,8,,24.0,30.0,,,,,,,,,,,,,COMPLETE
2972,0.5963643249384587,2024-04-11 16:33:33.654766,2024-04-11 16:33:34.370171,0 days 00:00:00.715405,99.98726294105926,8.277718855353465,sigmoid,8,,25.0,32.0,,,,,,,,,,,,,COMPLETE
2973,0.49282384973925886,2024-04-11 16:33:34.372170,2024-04-11 16:33:35.381958,0 days 00:00:01.009788,99.9830926476784,8.057109138285401,sigmoid,39,14.0,,,,,,7.0,24.0,7.129491860711784,6.422263358790832,1.6316476040036783,6.0,36.0,57.0,117.0,COMPLETE
2974,0.3485361765859573,2024-04-11 16:33:35.383957,2024-04-11 16:33:36.375469,0 days 00:00:00.991512,95.17377403216516,7.87692211901573,sigmoid,38,25.0,,,,,,50.0,31.0,4.700225549745827,0.5081505297847366,5.883437137293665,19.0,44.0,56.0,,COMPLETE
2975,0.387912558936991,2024-04-11 16:33:36.377656,2024-04-11 16:33:37.624224,0 days 00:00:01.246568,96.9829732533898,8.260870007515651,sigmoid,63,29.0,26.0,29.0,1.0,7.0,8.0,20.0,17.0,7.464835061089266,4.6368994713158225,3.684092619632785,5.0,46.0,95.0,42.0,COMPLETE
2976,0.6009432182607054,2024-04-11 16:33:37.626378,2024-04-11 16:33:38.339850,0 days 00:00:00.713472,92.16216534040517,7.66986682483393,sigmoid,8,,27.0,31.0,,,,,,,,,,,,,COMPLETE
2977,0.4001690672042137,2024-04-11 16:33:38.340851,2024-04-11 16:33:39.297556,0 days 00:00:00.956705,99.97994429599763,8.490249665839384,sigmoid,57,44.0,25.0,33.0,2.0,3.0,35.0,,,,,,,,,138.0,COMPLETE
2978,0.49467711288685284,2024-04-11 16:33:39.298565,2024-04-11 16:33:40.263208,0 days 00:00:00.964643,95.37210899639828,8.068347568995618,sigmoid,28,,29.0,30.0,8.0,5.0,55.0,22.0,29.0,,,,,,,,COMPLETE
2979,0.44282183212267956,2024-04-11 16:33:40.265208,2024-04-11 16:33:41.031025,0 days 00:00:00.765817,97.91413061083287,7.474221411037331,sigmoid,16,,,,3.0,8.0,25.0,,,,,,,,,,COMPLETE
2980,0.05043749651674747,2024-04-11 16:33:41.033175,2024-04-11 16:33:42.653244,0 days 00:00:01.620069,98.03674271589989,7.865115306313578,rbf,62,27.0,23.0,32.0,4.0,2.0,42.0,24.0,11.0,7.966544620538655,1.9120938562253142,9.549314969370648,7.0,37.0,78.0,,COMPLETE
2981,0.48997436695972973,2024-04-11 16:33:42.655425,2024-04-11 16:33:43.761490,0 days 00:00:01.106065,95.58628934671661,8.301380993489017,sigmoid,46,46.0,28.0,35.0,,,,35.0,43.0,5.099157445555248,3.534322293217598,3.4039374011952117,10.0,34.0,54.0,,COMPLETE
2982,0.5036607896357458,2024-04-11 16:33:43.763589,2024-04-11 16:33:44.693448,0 days 00:00:00.929859,96.8925901946604,8.108374068625062,sigmoid,10,,22.0,30.0,,,,,,2.5056433744125948,7.019070438080918,2.3961796238856863,14.0,27.0,73.0,,COMPLETE
2983,0.5952371952371952,2024-04-11 16:33:44.695441,2024-04-11 16:33:45.511804,0 days 00:00:00.816363,98.18167222367858,7.759328033052139,sigmoid,8,,26.0,32.0,,,,,,,,,,,,,COMPLETE
2984,0.30094346918258447,2024-04-11 16:33:45.512804,2024-04-11 16:33:46.609551,0 days 00:00:01.096747,98.02115798212165,8.857441716957407,sigmoid,42,48.0,24.0,33.0,,,,,,1.749070977633763,7.905705911640696,4.538006262251728,16.0,28.0,88.0,,COMPLETE
2985,0.5974957313602731,2024-04-11 16:33:46.610552,2024-04-11 16:33:47.381694,0 days 00:00:00.771142,94.2884129347762,8.45616423861182,sigmoid,8,,25.0,31.0,,,,,,,,,,,,,COMPLETE
2986,0.12622036262203626,2024-04-11 16:33:47.383705,2024-04-11 16:33:48.111139,0 days 00:00:00.727434,65.8055221540654,7.998012232881531,sigmoid,8,,26.0,29.0,,,,,,,,,,,,,COMPLETE
2987,0.5182773351806951,2024-04-11 16:33:48.113139,2024-04-11 16:33:49.231535,0 days 00:00:01.118396,96.65995667159679,8.248871907698282,sigmoid,14,,23.0,30.0,,,,42.0,15.0,3.347379489750225,2.753781231820921,4.914355158070823,17.0,20.0,65.0,,COMPLETE
2988,0.36272545090180364,2024-04-11 16:33:49.233719,2024-04-11 16:33:50.244327,0 days 00:00:01.010608,98.0997946557096,8.642673935054242,sigmoid,11,,24.0,31.0,,,,,,4.194842767547598,1.227441942391284,5.352225045196603,2.0,35.0,58.0,78.0,COMPLETE
2989,0.3763391598533973,2024-04-11 16:33:50.245326,2024-04-11 16:33:51.130989,0 days 00:00:00.885663,99.97525338219288,5.451501443524187,sigmoid,41,13.0,27.0,32.0,,,,,,,,,,,,156.0,COMPLETE
2990,0.5502940942691361,2024-04-11 16:33:51.131990,2024-04-11 16:33:51.959789,0 days 00:00:00.827799,93.71451121074473,7.558813368451587,sigmoid,2,,,,,,,,,5.575419186845016,5.820729536180488,9.868794445050467,13.0,41.0,75.0,,COMPLETE
2991,0.594268224819143,2024-04-11 16:33:51.961790,2024-04-11 16:33:52.695173,0 days 00:00:00.733383,95.65890186205903,7.971182934418506,sigmoid,8,,25.0,27.0,,,,,,,,,,,,,COMPLETE
2992,0.36621740691185584,2024-04-11 16:33:52.696197,2024-04-11 16:33:53.767766,0 days 00:00:01.071569,98.30033832455248,8.167875143435229,sigmoid,26,,28.0,34.0,7.0,4.0,18.0,,,3.1456093450398175,9.837280583091431,8.446925679074871,4.0,42.0,72.0,,COMPLETE
2993,0.12622036262203626,2024-04-11 16:33:53.769997,2024-04-11 16:33:54.514503,0 days 00:00:00.744506,96.69963960799288,7.809965338760779,sigmoid,8,,26.0,29.0,,,,,,,,,,,,,COMPLETE
2994,0.417813352519711,2024-04-11 16:33:54.516503,2024-04-11 16:33:55.352147,0 days 00:00:00.835644,99.9620058489602,8.37976136398597,sigmoid,20,,,,6.0,1.0,69.0,38.0,27.0,,,,,,,,COMPLETE
2995,0.468820252174763,2024-04-11 16:33:55.354273,2024-04-11 16:33:56.338909,0 days 00:00:00.984636,98.18474023498877,8.103334043669808,sigmoid,56,21.0,24.0,31.0,5.0,3.0,38.0,,,,,,,,,,COMPLETE
2996,0.44701971028259324,2024-04-11 16:33:56.341478,2024-04-11 16:33:57.112880,0 days 00:00:00.771402,99.99107131032494,7.742303321560248,sigmoid,8,,27.0,30.0,,,,,,,,,,,,,COMPLETE
2997,0.5034134007585335,2024-04-11 16:33:57.114886,2024-04-11 16:33:57.941537,0 days 00:00:00.826651,95.36707795176517,8.275573812315988,sigmoid,37,18.0,,,,,,30.0,37.0,,,,,,,56.0,COMPLETE
2998,0.44540141494924634,2024-04-11 16:33:57.943536,2024-04-11 16:33:59.416350,0 days 00:00:01.472814,96.75019395294612,7.951388156354624,rbf,8,,25.0,33.0,,,,,,,,,,,,,COMPLETE
2999,0.5373089117308508,2024-04-11 16:33:59.418359,2024-04-11 16:34:00.198454,0 days 00:00:00.780095,93.65376166605695,7.322348242191579,sigmoid,9,,23.0,31.0,,,,,,,,,,,,122.0,COMPLETE
3000,0.4575959549528845,2024-04-11 16:34:00.200487,2024-04-11 16:34:01.008599,0 days 00:00:00.808112,98.17808862276303,8.54494158036013,sigmoid,48,22.0,,,3.0,8.0,21.0,,,,,,,,,,COMPLETE
3001,0.12003789673140693,2024-04-11 16:34:01.010660,2024-04-11 16:34:01.741062,0 days 00:00:00.730402,92.32583890651561,7.5856365237972945,sigmoid,8,,26.0,28.0,,,,,,,,,,,,,COMPLETE
3002,0.44867166028991756,2024-04-11 16:34:01.742061,2024-04-11 16:34:02.964104,0 days 00:00:01.222043,96.71443156537454,7.951292362072138,sigmoid,59,6.0,25.0,32.0,1.0,7.0,82.0,,,0.7212771444503732,4.978452356187839,6.50500240938511,3.0,49.0,60.0,31.0,COMPLETE
3003,0.44701971028259324,2024-04-11 16:34:02.966305,2024-04-11 16:34:03.688899,0 days 00:00:00.722594,98.25748913593374,8.187756671095277,sigmoid,8,,22.0,30.0,,,,,,,,,,,,,COMPLETE
3004,0.4166107221636137,2024-04-11 16:34:03.691098,2024-04-11 16:34:04.434134,0 days 00:00:00.743036,95.22506016021123,8.412089426395962,sigmoid,36,45.0,,,,,,41.0,50.0,,,,,,,,COMPLETE
3005,0.4695803398335044,2024-04-11 16:34:04.436358,2024-04-11 16:34:05.679272,0 days 00:00:01.242914,99.97639247196864,7.801657629863951,sigmoid,55,34.0,,,8.0,6.0,72.0,2.0,39.0,9.606569268095623,9.036122992243795,8.677874474020957,9.0,33.0,68.0,134.0,COMPLETE
3006,0.5296497116791462,2024-04-11 16:34:05.681378,2024-04-11 16:34:06.663443,0 days 00:00:00.982065,98.11563058180997,8.094000178812152,sigmoid,13,,24.0,32.0,,,,47.0,45.0,,,,,,,149.0,COMPLETE
3007,0.48560032289465555,2024-04-11 16:34:06.666643,2024-04-11 16:34:07.659973,0 days 00:00:00.993330,98.20303135669779,8.703834091101566,sigmoid,60,23.0,27.0,36.0,7.0,5.0,65.0,45.0,41.0,,,,,,,,COMPLETE
3008,0.45345352376492626,2024-04-11 16:34:07.661959,2024-04-11 16:34:08.395472,0 days 00:00:00.733513,95.37967848253265,9.204925256635367,sigmoid,8,,25.0,30.0,,,,,,,,,,,,,COMPLETE
3009,0.477209100051643,2024-04-11 16:34:08.397468,2024-04-11 16:34:09.188638,0 days 00:00:00.791170,96.6834213151473,8.362227592677119,sigmoid,40,36.0,26.0,31.0,,,,,,,,,,,,,COMPLETE
3010,0.32388905457798983,2024-04-11 16:34:09.189636,2024-04-11 16:34:10.064118,0 days 00:00:00.874482,98.19733129665183,7.936823982061477,sigmoid,44,7.0,28.0,33.0,,,,34.0,36.0,,,,,,,,COMPLETE
3011,0.4302652558341789,2024-04-11 16:34:10.066292,2024-04-11 16:34:11.205535,0 days 00:00:01.139243,93.81091309958875,7.631167741675183,sigmoid,54,10.0,,,6.0,2.0,76.0,28.0,4.0,1.1872556147538287,0.8020491773814644,1.087689089207025,7.0,21.0,70.0,,COMPLETE
3012,0.5456970024930909,2024-04-11 16:34:11.207536,2024-04-11 16:34:11.891977,0 days 00:00:00.684441,96.38041290220896,8.21080951620111,sigmoid,1,,,,,,,,,,,,,,,71.0,COMPLETE
3013,0.5050977807075369,2024-04-11 16:34:11.892976,2024-04-11 16:34:12.701553,0 days 00:00:00.808577,98.1275652415813,8.07202829665113,sigmoid,12,,24.0,31.0,,,,5.0,28.0,,,,,,,,COMPLETE
3014,0.33413706061861886,2024-04-11 16:34:12.702552,2024-04-11 16:34:13.616330,0 days 00:00:00.913778,98.11395865718802,7.442876925820691,sigmoid,52,42.0,,,4.0,4.0,31.0,31.0,48.0,,,,,,,,COMPLETE
3015,0.43982990003865907,2024-04-11 16:34:13.618335,2024-04-11 16:34:14.775559,0 days 00:00:01.157224,42.03700935377719,7.864011897835535,sigmoid,23,,,,5.0,1.0,97.0,48.0,21.0,7.672109633664535,3.2275427024183174,4.282912610153346,5.0,38.0,82.0,47.0,COMPLETE
3016,0.5886452332280246,2024-04-11 16:34:14.777560,2024-04-11 16:34:15.584769,0 days 00:00:00.807209,92.15274455873897,2.5538588677066976,sigmoid,8,,29.0,29.0,,,,,,,,,,,,,COMPLETE
3017,0.10823593367762979,2024-04-11 16:34:15.585967,2024-04-11 16:34:17.020477,0 days 00:00:01.434510,95.33790692077916,8.410997303950438,rbf,61,50.0,23.0,32.0,1.0,5.0,36.0,18.0,25.0,,,,,,,170.0,COMPLETE
3018,0.5260932752014796,2024-04-11 16:34:17.021474,2024-04-11 16:34:18.079135,0 days 00:00:01.057661,98.17959101879357,7.747131788402152,sigmoid,7,,,,,,,6.0,47.0,8.248219615825858,4.339382421370422,7.20911104229652,17.0,22.0,66.0,191.0,COMPLETE
3019,0.5536169981720449,2024-04-11 16:34:18.081135,2024-04-11 16:34:18.859372,0 days 00:00:00.778237,99.93207832458619,8.145183976031985,sigmoid,32,3.0,,,,,,,,,,,,,,,COMPLETE
3020,0.5906279643331437,2024-04-11 16:34:18.861737,2024-04-11 16:34:19.592963,0 days 00:00:00.731226,99.93880747914834,8.62958590057953,sigmoid,8,,26.0,34.0,,,,,,,,,,,,,COMPLETE
3021,0.5771900206340274,2024-04-11 16:34:19.594107,2024-04-11 16:34:20.309769,0 days 00:00:00.715662,96.1483948923478,7.952151292624224,sigmoid,4,,,,,,,12.0,13.0,,,,,,,,COMPLETE
3022,0.4063787906747862,2024-04-11 16:34:20.311938,2024-04-11 16:34:21.432550,0 days 00:00:01.120612,99.94639340884446,8.267495328974698,sigmoid,27,,25.0,26.0,3.0,7.0,48.0,,,2.063482904250295,6.6359882651722515,8.094217210974639,20.0,47.0,52.0,184.0,COMPLETE
