number,value,datetime_start,datetime_complete,duration,params_C,params_gamma,params_kernel,params_mask_number,params_rsi_window,params_so_smooth,params_so_window,params_srsi_smooth1,params_srsi_smooth2,params_srsi_window,params_tsi_window_fast,params_tsi_window_slow,params_ult_weight_1,params_ult_weight_2,params_ult_weight_3,params_ult_window_1,params_ult_window_2,params_ult_window_3,params_williams_lbp,state
1685,0.5929369437606513,2024-04-11 16:16:39.257254,2024-04-11 16:16:39.774251,0 days 00:00:00.516997,98.21939590174762,8.47544011878978,sigmoid,8,,23.0,33.0,,,,,,,,,,,,,COMPLETE
1686,0.6009432182607054,2024-04-11 16:16:39.775252,2024-04-11 16:16:40.401304,0 days 00:00:00.626052,96.31798812267242,8.080665052812957,sigmoid,8,,25.0,31.0,,,,,,,,,,,,,COMPLETE
1687,0.5963643249384587,2024-04-11 16:16:40.402501,2024-04-11 16:16:40.909595,0 days 00:00:00.507094,99.92952428409217,8.247836619388062,sigmoid,8,,29.0,32.0,,,,,,,,,,,,,COMPLETE
1688,0.47961457392351703,2024-04-11 16:16:40.911596,2024-04-11 16:16:42.181436,0 days 00:00:01.269840,99.99661005469999,7.9912341320056886,rbf,8,,24.0,30.0,,,,,,,,,,,,,COMPLETE
1689,0.5986580986580987,2024-04-11 16:16:42.183436,2024-04-11 16:16:42.662074,0 days 00:00:00.478638,96.52091591062357,7.51668056486852,sigmoid,8,,27.0,31.0,,,,,,,,,,,,,COMPLETE
1690,0.12622036262203626,2024-04-11 16:16:42.663077,2024-04-11 16:16:43.134153,0 days 00:00:00.471076,96.61271521118191,7.888245543613572,sigmoid,8,,26.0,29.0,,,,,,,,,,,,,COMPLETE
1691,0.5929369437606513,2024-04-11 16:16:43.136154,2024-04-11 16:16:43.608102,0 days 00:00:00.471948,98.19848232981423,8.488340603565426,sigmoid,8,,22.0,33.0,,,,,,,,,,,,,COMPLETE
1692,0.5906279643331437,2024-04-11 16:16:43.609209,2024-04-11 16:16:44.101891,0 days 00:00:00.492682,98.1520481308946,8.273565467949666,sigmoid,8,,24.0,34.0,,,,,,,,,,,,,COMPLETE
1693,0.6009432182607054,2024-04-11 16:16:44.102950,2024-04-11 16:16:44.578954,0 days 00:00:00.476004,99.93286328869853,7.789867922391973,sigmoid,8,,25.0,31.0,,,,,,,,,,,,,COMPLETE
1694,0.5952371952371952,2024-04-11 16:16:44.580101,2024-04-11 16:16:45.148978,0 days 00:00:00.568877,96.41425802113369,8.097862460083315,sigmoid,8,,27.0,32.0,,,,,,,,,,,,,COMPLETE
1695,0.12622036262203626,2024-04-11 16:16:45.151265,2024-04-11 16:16:45.636941,0 days 00:00:00.485676,98.13371372365103,7.637545999386887,sigmoid,8,,23.0,29.0,,,,,,,,,,,,,COMPLETE
1696,0.45345352376492626,2024-04-11 16:16:45.638108,2024-04-11 16:16:46.131108,0 days 00:00:00.493000,96.42290979446483,8.403257236719389,sigmoid,8,,26.0,30.0,,,,,,,,,,,,,COMPLETE
1697,0.5952371952371952,2024-04-11 16:16:46.132107,2024-04-11 16:16:46.711013,0 days 00:00:00.578906,99.95966373597177,8.124986527677745,sigmoid,8,,28.0,32.0,,,,,,,,,,,,,COMPLETE
1698,0.44701971028259324,2024-04-11 16:16:46.712193,2024-04-11 16:16:47.313101,0 days 00:00:00.600908,98.18069660940962,7.892765172009689,sigmoid,8,,25.0,30.0,,,,,,,,,,,,,COMPLETE
1699,0.5963245096172158,2024-04-11 16:16:47.314103,2024-04-11 16:16:47.794948,0 days 00:00:00.480845,99.96614777525372,8.685455298211311,sigmoid,8,,26.0,31.0,,,,,,,,,,,,,COMPLETE
1700,0.12003789673140693,2024-04-11 16:16:47.795947,2024-04-11 16:16:48.298010,0 days 00:00:00.502063,96.4934965475884,8.28993301755375,sigmoid,8,,24.0,28.0,,,,,,,,,,,,,COMPLETE
1701,0.5929369437606513,2024-04-11 16:16:48.299010,2024-04-11 16:16:48.783766,0 days 00:00:00.484756,98.18875513203442,7.383593864003232,sigmoid,8,,25.0,33.0,,,,,,,,,,,,,COMPLETE
1702,0.5952371952371952,2024-04-11 16:16:48.785791,2024-04-11 16:16:49.259915,0 days 00:00:00.474124,99.95762311259368,7.989939408554001,sigmoid,8,,22.0,32.0,,,,,,,,,,,,,COMPLETE
1703,0.12622036262203626,2024-04-11 16:16:49.260915,2024-04-11 16:16:49.784957,0 days 00:00:00.524042,96.54440268144306,7.703557959950697,sigmoid,8,,23.0,29.0,,,,,,,,,,,,,COMPLETE
1704,0.3870360322982159,2024-04-11 16:16:49.787235,2024-04-11 16:16:50.598120,0 days 00:00:00.810885,98.02537986877456,8.16146533262885,sigmoid,59,7.0,27.0,31.0,7.0,1.0,6.0,,,9.236345712656714,1.1121405477049633,9.157957863049727,20.0,22.0,50.0,197.0,COMPLETE
1705,0.4014682911590127,2024-04-11 16:16:50.601113,2024-04-11 16:16:51.850518,0 days 00:00:01.249405,99.96503449333491,8.460692647752294,rbf,48,15.0,,,8.0,1.0,3.0,,,,,,,,,,COMPLETE
1706,0.5895095625828441,2024-04-11 16:16:51.851519,2024-04-11 16:16:52.336878,0 days 00:00:00.485359,96.60014566560811,7.873980687735741,sigmoid,8,,29.0,34.0,,,,,,,,,,,,,COMPLETE
1707,0.5098591549295776,2024-04-11 16:16:52.337869,2024-04-11 16:16:52.967382,0 days 00:00:00.629513,98.06779223836813,8.263126628007807,sigmoid,44,11.0,24.0,29.0,,,,5.0,22.0,,,,,,,,COMPLETE
1708,0.5163874560642717,2024-04-11 16:16:52.969541,2024-04-11 16:16:53.710828,0 days 00:00:00.741287,98.07822679838758,8.050322478618284,sigmoid,23,,,,8.0,2.0,16.0,35.0,17.0,9.550822940594557,1.417400465038499,9.83408799442043,18.0,22.0,54.0,187.0,COMPLETE
1709,0.4187707474097173,2024-04-11 16:16:53.711828,2024-04-11 16:16:54.487746,0 days 00:00:00.775918,99.98111214037753,8.5650928133839,sigmoid,55,12.0,,,8.0,1.0,2.0,46.0,40.0,9.735371412605037,0.8087020207392186,9.569893540195139,19.0,20.0,51.0,194.0,COMPLETE
1710,0.3706328954415147,2024-04-11 16:16:54.489744,2024-04-11 16:16:55.310398,0 days 00:00:00.820654,96.32013585288617,7.6446246918095655,sigmoid,60,25.0,26.0,31.0,8.0,1.0,17.0,43.0,31.0,,,,,,,,COMPLETE
1711,0.330643933627645,2024-04-11 16:16:55.311395,2024-04-11 16:16:55.851716,0 days 00:00:00.540321,99.99374952296645,7.157139136585186,sigmoid,37,40.0,,,,,,7.0,18.0,,,,,,,155.0,COMPLETE
1712,0.3338867367644346,2024-04-11 16:16:55.853909,2024-04-11 16:16:56.390275,0 days 00:00:00.536366,96.77744615288921,7.928052863392302,sigmoid,12,,25.0,30.0,,,,49.0,13.0,,,,,,,,COMPLETE
1713,0.516477150826003,2024-04-11 16:16:56.391275,2024-04-11 16:16:57.118051,0 days 00:00:00.726776,98.2400254771349,8.301266554026814,sigmoid,52,34.0,,,8.0,1.0,11.0,13.0,27.0,,,,,,,,COMPLETE
1714,0.538901203981397,2024-04-11 16:16:57.120075,2024-04-11 16:16:57.684414,0 days 00:00:00.564339,96.26288349991911,8.098702228239002,sigmoid,13,,27.0,32.0,,,,24.0,49.0,,,,,,,172.0,COMPLETE
1715,0.44701971028259324,2024-04-11 16:16:57.685537,2024-04-11 16:16:58.217888,0 days 00:00:00.532351,99.96575748167749,7.767975528620471,sigmoid,8,,28.0,30.0,,,,,,,,,,,,,COMPLETE
1716,0.326462251996908,2024-04-11 16:16:58.219892,2024-04-11 16:16:58.739278,0 days 00:00:00.519386,96.39615859073584,7.526134371780956,sigmoid,36,47.0,,,,,,40.0,15.0,,,,,,,,COMPLETE
1717,0.3702272727272728,2024-04-11 16:16:58.740276,2024-04-11 16:16:59.535516,0 days 00:00:00.795240,98.36946530743955,8.75107840585075,sigmoid,54,27.0,,,8.0,1.0,22.0,17.0,7.0,8.91888533706597,1.3007194312723867,8.643680980071501,19.0,20.0,100.0,,COMPLETE
1718,0.5253583852170253,2024-04-11 16:16:59.537520,2024-04-11 16:17:00.370821,0 days 00:00:00.833301,98.01122630100512,8.383391620138227,sigmoid,7,,,,,,,30.0,10.0,9.952787086506163,1.6480774888917078,8.456776807873318,20.0,21.0,52.0,178.0,COMPLETE
1719,0.5952371952371952,2024-04-11 16:17:00.371848,2024-04-11 16:17:00.859113,0 days 00:00:00.487265,96.51894190887187,7.950929616193074,sigmoid,8,,26.0,32.0,,,,,,,,,,,,,COMPLETE
1720,0.48426326798657393,2024-04-11 16:17:00.860141,2024-04-11 16:17:01.597278,0 days 00:00:00.737137,98.20326053479205,8.2005702163432,sigmoid,27,,24.0,31.0,8.0,1.0,19.0,,,9.464360628615735,2.1214569431257817,8.16412787872935,16.0,23.0,96.0,187.0,COMPLETE
1721,0.5929369437606513,2024-04-11 16:17:01.598279,2024-04-11 16:17:02.107004,0 days 00:00:00.508725,96.33598841614248,7.842922172395368,sigmoid,8,,25.0,33.0,,,,,,,,,,,,,COMPLETE
1722,0.5890914410049186,2024-04-11 16:17:02.109004,2024-04-11 16:17:02.563745,0 days 00:00:00.454741,98.19707435141295,8.103157119586296,sigmoid,32,23.0,,,,,,,,,,,,,,,COMPLETE
1723,0.39460189762643166,2024-04-11 16:17:02.564965,2024-04-11 16:17:03.345584,0 days 00:00:00.780619,99.98642537042623,8.50068164721803,sigmoid,30,,23.0,30.0,7.0,8.0,14.0,9.0,28.0,9.109551205473291,0.864034789802667,8.88605945143139,18.0,25.0,53.0,,COMPLETE
1724,0.4877716603882933,2024-04-11 16:17:03.347752,2024-04-11 16:17:04.790584,0 days 00:00:01.442832,99.99675911166537,7.28087989476134,rbf,8,,25.0,31.0,,,,,,,,,,,,,COMPLETE
1725,0.5929369437606513,2024-04-11 16:17:04.792584,2024-04-11 16:17:05.288956,0 days 00:00:00.496372,96.33679130562524,7.670084436581074,sigmoid,8,,27.0,33.0,,,,,,,,,,,,,COMPLETE
1726,0.45582566685511644,2024-04-11 16:17:05.290142,2024-04-11 16:17:05.991060,0 days 00:00:00.700918,98.13479934449681,8.315854514954468,sigmoid,61,46.0,24.0,28.0,7.0,2.0,8.0,4.0,4.0,,,,,,,191.0,COMPLETE
1727,0.12622036262203626,2024-04-11 16:17:05.992180,2024-04-11 16:17:06.544185,0 days 00:00:00.552005,98.2017756580995,7.944018400222119,sigmoid,8,,28.0,29.0,,,,,,,,,,,,,COMPLETE
1728,0.42569783994553445,2024-04-11 16:17:06.545185,2024-04-11 16:17:07.067147,0 days 00:00:00.521962,99.96521343295835,8.062536368166121,sigmoid,33,2.0,,,,,,,,,,,,,,162.0,COMPLETE
1729,0.3288834501427671,2024-04-11 16:17:07.068149,2024-04-11 16:17:07.655204,0 days 00:00:00.587055,96.54808381136603,8.562767903405605,sigmoid,34,21.0,,,,,,,,8.63317636573144,1.9354170321806858,9.353751492010545,20.0,23.0,55.0,,COMPLETE
1730,0.26740245068219337,2024-04-11 16:17:07.656203,2024-04-11 16:17:08.170339,0 days 00:00:00.514136,96.01170720761098,7.510792373013944,sigmoid,5,,,,,,,10.0,41.0,,,,,,,182.0,COMPLETE
1731,0.3343353857298081,2024-04-11 16:17:08.171341,2024-04-11 16:17:08.712547,0 days 00:00:00.541206,97.92533968753811,7.782857354708831,sigmoid,40,10.0,26.0,31.0,,,,,,,,,,,,,COMPLETE
1732,0.529468718455802,2024-04-11 16:17:08.714573,2024-04-11 16:17:09.220155,0 days 00:00:00.505582,98.05124492565452,8.198788671397246,sigmoid,4,,,,,,,50.0,29.0,,,,,,,,COMPLETE
1733,0.5030357448264067,2024-04-11 16:17:09.221157,2024-04-11 16:17:09.955164,0 days 00:00:00.734007,98.14664014612964,8.895308263055766,sigmoid,51,39.0,,,8.0,1.0,10.0,,,9.697586866708134,2.9537637644670083,8.957337091726217,17.0,20.0,97.0,142.0,COMPLETE
1734,0.38352457947581164,2024-04-11 16:17:09.956217,2024-04-11 16:17:10.586906,0 days 00:00:00.630689,96.34992751400397,8.3363499689581,sigmoid,53,42.0,,,6.0,8.0,32.0,18.0,5.0,,,,,,,148.0,COMPLETE
1735,0.5952371952371952,2024-04-11 16:17:10.588906,2024-04-11 16:17:11.079445,0 days 00:00:00.490539,96.19326262176152,8.052153553727738,sigmoid,8,,22.0,32.0,,,,,,,,,,,,,COMPLETE
1736,0.48681391916980055,2024-04-11 16:17:11.081444,2024-04-11 16:17:11.697741,0 days 00:00:00.616297,99.92568634192803,7.8857072650693745,sigmoid,45,31.0,26.0,30.0,,,,21.0,24.0,,,,,,,165.0,COMPLETE
1737,0.3744789606596282,2024-04-11 16:17:11.699935,2024-04-11 16:17:12.489126,0 days 00:00:00.789191,98.0724445361595,8.189803628049996,sigmoid,50,37.0,,,7.0,2.0,25.0,,,8.288820516112656,1.0144282383019787,8.079040084415567,18.0,21.0,56.0,,COMPLETE
1738,0.46149388653879586,2024-04-11 16:17:12.491126,2024-04-11 16:17:13.166840,0 days 00:00:00.675714,95.91307456811049,7.749094535633435,sigmoid,19,,,,8.0,1.0,5.0,,,9.29688629442704,3.4335599718450416,9.848961763773008,17.0,21.0,95.0,182.0,COMPLETE
1739,0.4011635960659371,2024-04-11 16:17:13.167840,2024-04-11 16:17:13.736301,0 days 00:00:00.568461,99.95238343575168,8.536430251677691,sigmoid,49,22.0,,,8.0,8.0,27.0,,,,,,,,,156.0,COMPLETE
1740,0.5952371952371952,2024-04-11 16:17:13.738301,2024-04-11 16:17:14.237112,0 days 00:00:00.498811,98.1208117408059,7.942677295635916,sigmoid,8,,24.0,32.0,,,,,,,,,,,,,COMPLETE
1741,0.5929369437606513,2024-04-11 16:17:14.239111,2024-04-11 16:17:14.753807,0 days 00:00:00.514696,96.29335871995086,8.366656531771788,sigmoid,8,,25.0,33.0,,,,,,,,,,,,,COMPLETE
1742,0.30707383639448255,2024-04-11 16:17:14.754805,2024-04-11 16:17:15.472394,0 days 00:00:00.717589,98.21687817041038,7.546907741849437,sigmoid,29,,23.0,30.0,7.0,2.0,12.0,12.0,32.0,,,,,,,174.0,COMPLETE
1743,0.39394214201505395,2024-04-11 16:17:15.473429,2024-04-11 16:17:16.225404,0 days 00:00:00.751975,98.05988846385061,8.13095685688814,sigmoid,58,8.0,27.0,31.0,6.0,8.0,23.0,,,8.779339269179152,2.4687325735805876,7.64458832023228,17.0,24.0,99.0,,COMPLETE
1744,0.45768891502499265,2024-04-11 16:17:16.226575,2024-04-11 16:17:17.521524,0 days 00:00:01.294949,96.2600795594996,7.731232665260983,rbf,8,,29.0,32.0,,,,,,,,,,,,,COMPLETE
1745,0.4061062198239137,2024-04-11 16:17:17.522722,2024-04-11 16:17:18.105175,0 days 00:00:00.582453,96.10405437972723,8.723167166061463,sigmoid,24,,25.0,34.0,7.0,2.0,13.0,,,,,,,,,,COMPLETE
1746,0.5156583860315541,2024-04-11 16:17:18.107224,2024-04-11 16:17:18.650117,0 days 00:00:00.542893,98.23233774899784,8.014162969490458,sigmoid,17,,,,7.0,1.0,18.0,,,,,,,,,199.0,COMPLETE
1747,0.5172034196041692,2024-04-11 16:17:18.652319,2024-04-11 16:17:19.361566,0 days 00:00:00.709247,97.90287664519953,8.313584580822852,sigmoid,39,19.0,,,,,,31.0,44.0,9.824750942292871,0.6242374257913017,9.255137285036216,15.0,24.0,58.0,169.0,COMPLETE
1748,0.36688334381771165,2024-04-11 16:17:19.362624,2024-04-11 16:17:20.057989,0 days 00:00:00.695365,96.05040884072334,7.388015572848647,sigmoid,43,44.0,27.0,29.0,,,,,,8.125028608453709,1.1944685045373626,9.686333055621684,19.0,27.0,55.0,194.0,COMPLETE
1749,0.44701971028259324,2024-04-11 16:17:20.059990,2024-04-11 16:17:20.561462,0 days 00:00:00.501472,99.97349709988123,8.174852570333325,sigmoid,8,,24.0,30.0,,,,,,,,,,,,,COMPLETE
1750,0.49213697824808933,2024-04-11 16:17:20.562585,2024-04-11 16:17:21.329110,0 days 00:00:00.766525,99.95013014943012,7.860938111407932,sigmoid,22,,,,6.0,2.0,7.0,36.0,39.0,9.985678526834988,2.7679566932037485,8.754627168379944,15.0,22.0,50.0,,COMPLETE
1751,0.5321572951120911,2024-04-11 16:17:21.330107,2024-04-11 16:17:22.076493,0 days 00:00:00.746386,96.1172816513527,8.440846866350348,sigmoid,35,32.0,,,,,,,,8.458348262521083,2.1126195892716693,8.351062483292864,16.0,26.0,54.0,138.0,COMPLETE
1752,0.3547220814326744,2024-04-11 16:17:22.077649,2024-04-11 16:17:22.779848,0 days 00:00:00.702199,99.96348274700692,8.045454849019164,sigmoid,25,,26.0,31.0,8.0,3.0,15.0,,,,,,,,,152.0,COMPLETE
1753,0.5472494470485583,2024-04-11 16:17:22.780846,2024-04-11 16:17:23.464783,0 days 00:00:00.683937,98.00227035578325,7.646684440801009,sigmoid,6,,,,,,,15.0,36.0,7.936922207585182,3.0685856532878892,9.953542140184643,16.0,23.0,98.0,,COMPLETE
1754,0.12003789673140693,2024-04-11 16:17:23.466783,2024-04-11 16:17:23.980805,0 days 00:00:00.514022,98.15962712220764,8.225059715005989,sigmoid,8,,23.0,28.0,,,,,,,,,,,,,COMPLETE
1755,0.5952371952371952,2024-04-11 16:17:23.981806,2024-04-11 16:17:24.471417,0 days 00:00:00.489611,96.01911055917978,7.889703200777452,sigmoid,8,,26.0,32.0,,,,,,,,,,,,,COMPLETE
1756,0.532187597059737,2024-04-11 16:17:24.472417,2024-04-11 16:17:25.105723,0 days 00:00:00.633306,98.33315092476344,8.557777496833008,sigmoid,3,,,,,,,,,8.86737823106236,1.757858603513733,7.56222589499901,20.0,25.0,52.0,159.0,COMPLETE
1757,0.44701971028259324,2024-04-11 16:17:25.106724,2024-04-11 16:17:25.631985,0 days 00:00:00.525261,98.19328612951911,8.069845199662929,sigmoid,8,,25.0,30.0,,,,,,,,,,,,,COMPLETE
1758,0.4208888743326892,2024-04-11 16:17:25.632985,2024-04-11 16:17:26.394629,0 days 00:00:00.761644,96.16871718347767,8.354203958971858,sigmoid,47,6.0,22.0,34.0,,,,2.0,50.0,9.103331895525884,3.657075939314535,7.835523186257142,14.0,22.0,58.0,200.0,COMPLETE
1759,0.3755906014557528,2024-04-11 16:17:26.395793,2024-04-11 16:17:27.039503,0 days 00:00:00.643710,98.29151289730783,7.735738536797255,sigmoid,28,,24.0,31.0,6.0,3.0,38.0,34.0,20.0,,,,,,,,COMPLETE
1760,0.32413566259776333,2024-04-11 16:17:27.041041,2024-04-11 16:17:27.718420,0 days 00:00:00.677379,99.9481036405543,7.911734532504263,sigmoid,38,24.0,,,,,,3.0,48.0,9.575302156514628,2.2111322567908416,8.677666929405612,15.0,21.0,94.0,,COMPLETE
1761,0.5929369437606513,2024-04-11 16:17:27.720420,2024-04-11 16:17:28.213847,0 days 00:00:00.493427,98.26248302615065,8.180740969100444,sigmoid,8,,28.0,33.0,,,,,,,,,,,,,COMPLETE
1762,0.4685212734305266,2024-04-11 16:17:28.214848,2024-04-11 16:17:29.514394,0 days 00:00:01.299546,99.98220497557362,7.499504512189726,rbf,8,,25.0,29.0,,,,,,,,,,,,,COMPLETE
1763,0.5086377666190629,2024-04-11 16:17:29.516523,2024-04-11 16:17:30.172647,0 days 00:00:00.656124,96.39459187208422,8.663302666063371,sigmoid,57,28.0,26.0,32.0,8.0,8.0,21.0,,,,,,,,,188.0,COMPLETE
1764,0.5099845703168675,2024-04-11 16:17:30.173647,2024-04-11 16:17:31.082024,0 days 00:00:00.908377,95.91029378409914,8.376699122089477,sigmoid,15,,27.0,31.0,,,,48.0,46.0,7.069365363237738,1.5297425202056232,9.58740684137434,18.0,27.0,96.0,125.0,COMPLETE
1765,0.36570422994199314,2024-04-11 16:17:31.084017,2024-04-11 16:17:31.782918,0 days 00:00:00.698901,99.99852701442401,8.014459407019205,sigmoid,14,,24.0,30.0,,,,22.0,11.0,7.323964424900787,1.3611457801720026,7.301365343436942,14.0,28.0,59.0,,COMPLETE
1766,0.5952371952371952,2024-04-11 16:17:31.784087,2024-04-11 16:17:32.273996,0 days 00:00:00.489909,95.97940235581066,7.763075078365493,sigmoid,8,,23.0,32.0,,,,,,,,,,,,,COMPLETE
1767,0.40046779189582143,2024-04-11 16:17:32.276176,2024-04-11 16:17:33.127311,0 days 00:00:00.851135,98.1538908380855,8.176433211782665,sigmoid,63,16.0,25.0,29.0,7.0,1.0,4.0,44.0,38.0,7.727374235220744,0.5023276587003593,9.12784680196945,19.0,20.0,57.0,133.0,COMPLETE
1768,0.47056933368387227,2024-04-11 16:17:33.129305,2024-04-11 16:17:33.638165,0 days 00:00:00.508860,98.16977764456331,7.257867457245833,sigmoid,16,,,,7.0,8.0,98.0,,,,,,,,,,COMPLETE
1769,0.3341826372733651,2024-04-11 16:17:33.640334,2024-04-11 16:17:34.340273,0 days 00:00:00.699939,99.95428254547576,7.9090869478533214,sigmoid,42,41.0,28.0,31.0,,,,,,8.633286106194777,3.582731560562236,7.056535465100627,18.0,21.0,98.0,,COMPLETE
1770,0.46341994879337584,2024-04-11 16:17:34.341258,2024-04-11 16:17:35.171024,0 days 00:00:00.829766,95.99705156674953,7.575565740187276,sigmoid,31,,26.0,33.0,6.0,7.0,89.0,25.0,23.0,8.36849834707003,2.5598061593137915,8.048498619110514,16.0,28.0,61.0,185.0,COMPLETE
1771,0.5243273016585407,2024-04-11 16:17:35.172175,2024-04-11 16:17:35.763459,0 days 00:00:00.591284,99.93301102997988,8.442921930662024,sigmoid,9,,25.0,30.0,,,,,,,,,,,,121.0,COMPLETE
1772,0.40337298599608495,2024-04-11 16:17:35.764459,2024-04-11 16:17:36.504628,0 days 00:00:00.740169,97.94890603735469,8.219604478914228,sigmoid,46,9.0,27.0,31.0,,,,29.0,34.0,1.117056563127644,4.080756737136788,7.427889054239635,20.0,26.0,53.0,,COMPLETE
1773,0.5998117115420825,2024-04-11 16:17:36.506608,2024-04-11 16:17:37.004722,0 days 00:00:00.498114,96.00486868245713,7.042662427036041,sigmoid,8,,23.0,32.0,,,,,,,,,,,,,COMPLETE
1774,0.3386210390926453,2024-04-11 16:17:37.006722,2024-04-11 16:17:37.654288,0 days 00:00:00.647566,99.92824772360001,8.055986642964653,sigmoid,41,49.0,24.0,34.0,,,,,,,,,,,,139.0,COMPLETE
1775,0.4502052644288819,2024-04-11 16:17:37.656405,2024-04-11 16:17:38.166107,0 days 00:00:00.509702,98.03716437583846,8.909561191253488,sigmoid,8,,26.0,28.0,,,,,,,,,,,,,COMPLETE
1776,0.49078324572461524,2024-04-11 16:17:38.167109,2024-04-11 16:17:39.007372,0 days 00:00:00.840263,96.37055629493987,7.815187155874343,sigmoid,26,,25.0,30.0,8.0,2.0,40.0,,,9.38881159859392,3.2282349034563675,9.99714110816358,13.0,24.0,56.0,,COMPLETE
1777,0.5986580986580987,2024-04-11 16:17:39.008369,2024-04-11 16:17:39.502788,0 days 00:00:00.494419,99.99657514814874,8.291227398822578,sigmoid,8,,29.0,31.0,,,,,,,,,,,,,COMPLETE
1778,0.39468223543066155,2024-04-11 16:17:39.504009,2024-04-11 16:17:40.103799,0 days 00:00:00.599790,97.86921080767631,8.044078879738562,sigmoid,21,,,,5.0,3.0,100.0,11.0,21.0,,,,,,,144.0,COMPLETE
1779,0.5257427937915743,2024-04-11 16:17:40.105799,2024-04-11 16:17:40.769090,0 days 00:00:00.663291,99.97044607589747,8.50320529415696,sigmoid,10,,24.0,33.0,,,,,,7.971139694756278,2.7317592510870856,6.549029800632052,15.0,24.0,100.0,,COMPLETE
1780,0.4685212734305266,2024-04-11 16:17:40.770090,2024-04-11 16:17:42.070803,0 days 00:00:01.300713,96.07996051773391,7.732188939116706,rbf,8,,26.0,29.0,,,,,,,,,,,,,COMPLETE
1781,0.4184049755077329,2024-04-11 16:17:42.072860,2024-04-11 16:17:42.708985,0 days 00:00:00.636125,97.90488939197394,7.975503467728937,sigmoid,20,,,,6.0,1.0,2.0,45.0,6.0,,,,,,,,COMPLETE
1782,0.3503186838856075,2024-04-11 16:17:42.709985,2024-04-11 16:17:43.325918,0 days 00:00:00.615933,98.0691483595961,8.225356762441377,sigmoid,56,45.0,27.0,32.0,8.0,3.0,29.0,,,,,,,,,,COMPLETE
1783,0.5241425169995066,2024-04-11 16:17:43.326919,2024-04-11 16:17:43.877499,0 days 00:00:00.550580,99.9586642575723,7.51335214113963,sigmoid,37,13.0,,,,,,28.0,19.0,,,,,,,130.0,COMPLETE
1784,0.45345352376492626,2024-04-11 16:17:43.879525,2024-04-11 16:17:44.375875,0 days 00:00:00.496350,95.62616036016351,8.604475755325494,sigmoid,8,,25.0,30.0,,,,,,,,,,,,,COMPLETE
1785,0.6009432182607054,2024-04-11 16:17:44.377932,2024-04-11 16:17:44.880475,0 days 00:00:00.502543,95.96753096590572,7.854364078354141,sigmoid,8,,21.0,31.0,,,,,,,,,,,,,COMPLETE
1786,0.4447422795554811,2024-04-11 16:17:44.882486,2024-04-11 16:17:45.738208,0 days 00:00:00.855722,98.37682167377416,8.386351088231486,sigmoid,62,38.0,23.0,32.0,7.0,7.0,95.0,41.0,16.0,9.705082768049284,3.8450132102623273,9.404122368926526,14.0,25.0,52.0,,COMPLETE
1787,0.6009432182607054,2024-04-11 16:17:45.739209,2024-04-11 16:17:46.241202,0 days 00:00:00.501993,98.1517695993941,8.104418928548766,sigmoid,8,,22.0,31.0,,,,,,,,,,,,,COMPLETE
1788,0.3432166867781417,2024-04-11 16:17:46.242276,2024-04-11 16:17:46.858864,0 days 00:00:00.616588,95.8365338358438,7.914844444145046,sigmoid,52,30.0,,,5.0,2.0,34.0,8.0,2.0,,,,,,,,COMPLETE
1789,0.4928439623745443,2024-04-11 16:17:46.860323,2024-04-11 16:17:47.564232,0 days 00:00:00.703909,99.98291093581108,7.72393166160156,sigmoid,11,,28.0,29.0,,,,,,7.418408020893889,2.911213772613238,8.554956070189892,17.0,29.0,91.0,114.0,COMPLETE
