number,value,datetime_start,datetime_complete,duration,params_C,params_gamma,params_kernel,params_mask_number,params_rsi_window,params_so_smooth,params_so_window,params_srsi_smooth1,params_srsi_smooth2,params_srsi_window,params_tsi_window_fast,params_tsi_window_slow,params_ult_weight_1,params_ult_weight_2,params_ult_weight_3,params_ult_window_1,params_ult_window_2,params_ult_window_3,params_williams_lbp,state
4870,0.4531522646233214,2024-04-11 17:13:28.326757,2024-04-11 17:13:29.626478,0 days 00:00:01.299721,98.1132889090387,7.201860667834482,sigmoid,58,26.0,26.0,33.0,3.0,4.0,32.0,,,3.208061080941825,4.719690911360775,1.7818323194189327,6.0,50.0,84.0,,COMPLETE
4871,0.46026700572155116,2024-04-11 17:13:29.627477,2024-04-11 17:13:30.940151,0 days 00:00:01.312674,96.81650460569692,8.285196346104271,sigmoid,27,,27.0,31.0,7.0,1.0,100.0,,,5.493342224258426,8.477970183456673,1.3370732063545137,11.0,22.0,55.0,181.0,COMPLETE
4872,0.5016083535408522,2024-04-11 17:13:30.942191,2024-04-11 17:13:32.140866,0 days 00:00:01.198675,93.12420861948488,8.787359822865549,sigmoid,19,,,,4.0,2.0,82.0,,,7.615516565903139,1.9744001595662564,4.69643591705907,7.0,35.0,58.0,55.0,COMPLETE
4873,0.5952371952371952,2024-04-11 17:13:32.141877,2024-04-11 17:13:32.979713,0 days 00:00:00.837836,96.6936735633177,7.567382071422363,sigmoid,8,,25.0,32.0,,,,,,,,,,,,,COMPLETE
4874,0.43199379456427695,2024-04-11 17:13:32.981715,2024-04-11 17:13:33.847374,0 days 00:00:00.865659,98.16405103309405,8.091884662268512,sigmoid,5,,,,,,,49.0,15.0,,,,,,,109.0,COMPLETE
4875,0.5085377009191097,2024-04-11 17:13:33.849373,2024-04-11 17:13:34.959466,0 days 00:00:01.110093,95.07984253539061,8.43925260325779,sigmoid,18,,,,5.0,7.0,94.0,,,5.09350372586659,0.9058149213158755,4.3452158890860515,10.0,37.0,92.0,,COMPLETE
4876,0.46335684522998993,2024-04-11 17:13:34.961463,2024-04-11 17:13:35.879292,0 days 00:00:00.917829,98.17169365567696,7.800817517277493,sigmoid,17,,,,1.0,6.0,47.0,,,,,,,,,130.0,COMPLETE
4877,0.47614871974745704,2024-04-11 17:13:35.881291,2024-04-11 17:13:36.943782,0 days 00:00:01.062491,95.24760508873848,8.19106723309269,sigmoid,53,39.0,,,8.0,5.0,64.0,31.0,36.0,,,,,,,176.0,COMPLETE
4878,0.5425425621534783,2024-04-11 17:13:36.945731,2024-04-11 17:13:37.757648,0 days 00:00:00.811917,98.29197249620965,7.955915250201576,sigmoid,33,4.0,,,,,,,,,,,,,,72.0,COMPLETE
4879,0.5001337017559498,2024-04-11 17:13:37.759654,2024-04-11 17:13:38.767956,0 days 00:00:01.008302,96.6093328228488,9.10423685282661,sigmoid,49,44.0,,,6.0,2.0,42.0,,,,,,,,,155.0,COMPLETE
4880,0.468877538551773,2024-04-11 17:13:38.769960,2024-04-11 17:13:39.940442,0 days 00:00:01.170482,98.18888350889549,8.65132723332012,sigmoid,50,17.0,,,4.0,4.0,61.0,,,0.5014422756848766,8.713886314097122,6.666994779235983,13.0,45.0,78.0,,COMPLETE
4881,0.5069140556625241,2024-04-11 17:13:39.943489,2024-04-11 17:13:40.762391,0 days 00:00:00.818902,93.80070195993457,6.663928053461484,sigmoid,8,,28.0,35.0,,,,,,,,,,,,,COMPLETE
4882,0.24621662982485976,2024-04-11 17:13:40.764909,2024-04-11 17:13:41.826081,0 days 00:00:01.061172,98.09599760252146,7.672635091663641,sigmoid,6,,,,,,,17.0,10.0,0.6853767798926169,7.8455326869045505,6.897020500119533,19.0,47.0,75.0,,COMPLETE
4883,0.45345352376492626,2024-04-11 17:13:41.828062,2024-04-11 17:13:42.639345,0 days 00:00:00.811283,98.24799866424186,8.3582515878321,sigmoid,8,,24.0,30.0,,,,,,,,,,,,,COMPLETE
4884,0.4880634138403961,2024-04-11 17:13:42.641348,2024-04-11 17:13:43.828414,0 days 00:00:01.187066,95.56305762269378,8.050496881942152,sigmoid,39,16.0,,,,,,33.0,44.0,2.4553494642271048,8.320466942266876,0.641866684773893,2.0,29.0,82.0,123.0,COMPLETE
4885,0.44011864044463445,2024-04-11 17:13:43.830413,2024-04-11 17:13:44.868707,0 days 00:00:01.038294,90.94989122895745,7.82575427592558,sigmoid,25,,23.0,31.0,6.0,8.0,39.0,,,,,,,,,64.0,COMPLETE
4886,0.4662121212121212,2024-04-11 17:13:44.870709,2024-04-11 17:13:46.245741,0 days 00:00:01.375032,98.24357926192337,8.131273273628853,sigmoid,47,50.0,25.0,28.0,,,,27.0,34.0,6.0006879985420785,3.03441037832621,8.567170880050643,12.0,23.0,56.0,101.0,COMPLETE
4887,0.40973065188149993,2024-04-11 17:13:46.247746,2024-04-11 17:13:47.438616,0 days 00:00:01.190870,96.73488155608942,8.30506841374473,sigmoid,43,46.0,26.0,32.0,,,,,,9.033360831291214,1.499171826580453,8.012666365285916,5.0,43.0,93.0,18.0,COMPLETE
4888,0.4161181620634271,2024-04-11 17:13:47.441614,2024-04-11 17:13:48.847938,0 days 00:00:01.406324,94.98233822874752,7.447059287420302,rbf,8,,21.0,4.0,,,,,,,,,,,,,COMPLETE
4889,0.5929369437606513,2024-04-11 17:13:48.849960,2024-04-11 17:13:49.667213,0 days 00:00:00.817253,62.40944102467749,7.932696721073463,sigmoid,8,,27.0,33.0,,,,,,,,,,,,,COMPLETE
4890,0.46228264795418195,2024-04-11 17:13:49.669210,2024-04-11 17:13:50.707252,0 days 00:00:01.038042,99.9217581870627,8.520463321378937,sigmoid,21,,,,3.0,3.0,28.0,41.0,25.0,,,,,,,88.0,COMPLETE
4891,0.42045491208259395,2024-04-11 17:13:50.708878,2024-04-11 17:13:52.024472,0 days 00:00:01.315594,99.99542806596835,7.66509890412117,sigmoid,22,,,,5.0,1.0,77.0,3.0,16.0,5.787740962939896,7.44253194308067,1.5302990824431273,8.0,27.0,89.0,,COMPLETE
4892,0.4946234170184403,2024-04-11 17:13:52.026470,2024-04-11 17:13:53.045309,0 days 00:00:01.018839,92.75870857908757,8.186285407470624,sigmoid,24,,25.0,29.0,3.0,5.0,14.0,,,,,,,,,,COMPLETE
4893,0.4108349057893729,2024-04-11 17:13:53.046895,2024-04-11 17:13:54.165105,0 days 00:00:01.118210,96.6316900438453,7.961659240037918,sigmoid,29,,24.0,31.0,7.0,3.0,22.0,22.0,30.0,,,,,,,45.0,COMPLETE
4894,0.5145671720733428,2024-04-11 17:13:54.167104,2024-04-11 17:13:55.250497,0 days 00:00:01.083393,98.18476217661994,8.357974780552105,sigmoid,35,9.0,,,,,,,,3.6376739033942442,7.014856697683518,3.551298517707522,4.0,38.0,87.0,150.0,COMPLETE
4895,0.3159634526816223,2024-04-11 17:13:55.252512,2024-04-11 17:13:56.382051,0 days 00:00:01.129539,98.34111227177775,8.103204503065395,sigmoid,38,35.0,,,,,,44.0,26.0,2.833650349694031,2.3015835845900106,2.899679315647042,16.0,26.0,69.0,,COMPLETE
4896,0.44701971028259324,2024-04-11 17:13:56.384043,2024-04-11 17:13:57.215933,0 days 00:00:00.831890,99.98823401511977,7.845200194697157,sigmoid,8,,23.0,30.0,,,,,,,,,,,,,COMPLETE
4897,0.537125899734815,2024-04-11 17:13:57.217937,2024-04-11 17:13:58.200472,0 days 00:00:00.982535,95.71194604334498,8.565462245517809,sigmoid,3,,,,,,,,,4.77888249071651,9.66406530986262,9.365029682970093,9.0,41.0,72.0,163.0,COMPLETE
4898,0.6009432182607054,2024-04-11 17:13:58.202469,2024-04-11 17:13:59.217018,0 days 00:00:01.014549,99.95953495067101,7.6266521784493335,sigmoid,8,,26.0,31.0,,,,,,,,,,,,,COMPLETE
4899,0.5929369437606513,2024-04-11 17:13:59.219014,2024-04-11 17:14:00.083220,0 days 00:00:00.864206,99.99675160676529,8.209327329521582,sigmoid,8,,27.0,33.0,,,,,,,,,,,,,COMPLETE
4900,0.5162066314510328,2024-04-11 17:14:00.084224,2024-04-11 17:14:01.511793,0 days 00:00:01.427569,96.7610120204982,7.991760742139275,sigmoid,31,,28.0,29.0,1.0,7.0,2.0,19.0,27.0,6.730441742653312,6.091726258742245,5.5247189128770415,18.0,24.0,65.0,184.0,COMPLETE
4901,0.420197330237957,2024-04-11 17:14:01.513817,2024-04-11 17:14:02.594875,0 days 00:00:01.081058,99.98309217986056,8.906237011674113,sigmoid,57,42.0,24.0,38.0,2.0,8.0,89.0,,,,,,,,,137.0,COMPLETE
4902,0.3409561843047131,2024-04-11 17:14:02.597842,2024-04-11 17:14:03.515069,0 days 00:00:00.917227,93.9852129055566,7.250317970690091,sigmoid,9,,25.0,32.0,,,,,,,,,,,,82.0,COMPLETE
4903,0.4157515496680406,2024-04-11 17:14:03.517069,2024-04-11 17:14:04.686524,0 days 00:00:01.169455,96.80524511311776,9.988364833743642,sigmoid,28,,22.0,30.0,8.0,6.0,50.0,39.0,19.0,,,,,,,,COMPLETE
4904,0.30664106618477527,2024-04-11 17:14:04.688175,2024-04-11 17:14:05.866372,0 days 00:00:01.178197,99.9896046175555,8.388521979120927,sigmoid,42,8.0,25.0,32.0,,,,,,1.1012219716032687,5.63030766540186,3.961245567965788,17.0,32.0,96.0,,COMPLETE
4905,0.5895095625828441,2024-04-11 17:14:05.868696,2024-04-11 17:14:06.694778,0 days 00:00:00.826082,98.13104657106935,7.790361576400076,sigmoid,8,,29.0,34.0,,,,,,,,,,,,,COMPLETE
4906,0.40982874637242084,2024-04-11 17:14:06.695805,2024-04-11 17:14:07.525624,0 days 00:00:00.829819,93.89283732420394,8.18425887442584,sigmoid,16,,,,5.0,4.0,68.0,,,,,,,,,,COMPLETE
4907,0.47110322389825504,2024-04-11 17:14:07.527625,2024-04-11 17:14:08.930654,0 days 00:00:01.403029,96.61351633731137,7.982643572833172,rbf,8,,26.0,31.0,,,,,,,,,,,,,COMPLETE
4908,0.5952371952371952,2024-04-11 17:14:08.932630,2024-04-11 17:14:09.802765,0 days 00:00:00.870135,96.80575797249539,7.531012207708536,sigmoid,8,,24.0,32.0,,,,,,,,,,,,,COMPLETE
4909,0.3397031223340727,2024-04-11 17:14:09.804769,2024-04-11 17:14:11.046163,0 days 00:00:01.241394,91.97826109148757,8.341806445815195,sigmoid,14,,26.0,30.0,,,,24.0,43.0,9.318017971287697,2.7851023369581798,9.817337572767467,11.0,44.0,54.0,,COMPLETE
4910,0.5252241752491495,2024-04-11 17:14:11.048362,2024-04-11 17:14:12.428758,0 days 00:00:01.380396,98.28831713755083,8.688274349049399,sigmoid,15,,23.0,36.0,,,,31.0,39.0,6.149288299832773,4.99904650711226,5.799085009288383,5.0,33.0,80.0,10.0,COMPLETE
4911,0.45729664414785515,2024-04-11 17:14:12.430298,2024-04-11 17:14:13.908143,0 days 00:00:01.477845,99.9773764110907,7.8136755904452135,sigmoid,62,33.0,27.0,29.0,4.0,2.0,86.0,26.0,49.0,2.0260762131598553,9.017699508843027,8.769738721374733,6.0,28.0,60.0,,COMPLETE
4912,0.5164721141374837,2024-04-11 17:14:13.910129,2024-04-11 17:14:14.887466,0 days 00:00:00.977337,95.27506787443546,8.10991852041764,sigmoid,2,,,,,,,,,3.9471679814593745,4.044038936260655,7.461212113158281,15.0,39.0,62.0,,COMPLETE
4913,0.5931111524855706,2024-04-11 17:14:14.889483,2024-04-11 17:14:15.769296,0 days 00:00:00.879813,98.20903251688792,7.973511533118365,sigmoid,8,,25.0,26.0,,,,,,,,,,,,,COMPLETE
4914,0.28717301981205,2024-04-11 17:14:15.771803,2024-04-11 17:14:16.888681,0 days 00:00:01.116878,95.3194765986009,7.700019284717843,sigmoid,10,,28.0,28.0,,,,,,8.688297010615605,4.462804761606291,9.997183431178684,20.0,40.0,99.0,,COMPLETE
4915,0.5199954033555505,2024-04-11 17:14:16.890659,2024-04-11 17:14:17.849632,0 days 00:00:00.958973,98.2383257140108,8.463659453199142,sigmoid,41,38.0,24.0,31.0,,,,,,,,,,,,36.0,COMPLETE
4916,0.3385873142342467,2024-04-11 17:14:17.851629,2024-04-11 17:14:19.014184,0 days 00:00:01.162555,96.74074774831571,8.218867224104937,sigmoid,11,,26.0,31.0,,,,,,8.375373343118977,5.2681130426994685,7.178432521074322,14.0,50.0,51.0,24.0,COMPLETE
4917,0.5929369437606513,2024-04-11 17:14:19.016184,2024-04-11 17:14:19.851993,0 days 00:00:00.835809,98.12600359791908,7.456092547184753,sigmoid,8,,27.0,33.0,,,,,,,,,,,,,COMPLETE
4918,0.39472755844905555,2024-04-11 17:14:19.853999,2024-04-11 17:14:21.174254,0 days 00:00:01.320255,99.96671090219847,7.928678414558208,sigmoid,46,21.0,23.0,30.0,,,,32.0,3.0,6.336987741358975,0.6860515749511906,6.052884124981574,7.0,36.0,90.0,,COMPLETE
4919,0.5963643249384587,2024-04-11 17:14:21.176778,2024-04-11 17:14:22.002455,0 days 00:00:00.825677,93.4855275050171,8.267131215625511,sigmoid,8,,25.0,32.0,,,,,,,,,,,,,COMPLETE
4920,0.4858253022827782,2024-04-11 17:14:22.003455,2024-04-11 17:14:23.502986,0 days 00:00:01.499531,99.97711610658538,6.979249559619212,sigmoid,63,29.0,24.0,29.0,1.0,7.0,54.0,7.0,28.0,9.663398787664974,1.0924015881138605,2.238718982334388,3.0,45.0,76.0,96.0,COMPLETE
4921,0.42227406679764246,2024-04-11 17:14:23.505009,2024-04-11 17:14:24.768206,0 days 00:00:01.263197,95.49802626809802,8.498614168812336,sigmoid,26,,26.0,34.0,6.0,5.0,72.0,,,5.389609813463293,3.794761438125705,5.281073187636462,12.0,42.0,88.0,,COMPLETE
4922,0.6009432182607054,2024-04-11 17:14:24.770191,2024-04-11 17:14:25.602300,0 days 00:00:00.832109,96.74445541140086,8.081013811815026,sigmoid,8,,22.0,31.0,,,,,,,,,,,,,COMPLETE
4923,0.3914480798343992,2024-04-11 17:14:25.604300,2024-04-11 17:14:26.647374,0 days 00:00:01.043074,98.34271099824029,7.788288890968867,sigmoid,56,27.0,25.0,32.0,2.0,1.0,26.0,,,,,,,,,,COMPLETE
4924,0.5215699472056874,2024-04-11 17:14:26.650367,2024-04-11 17:14:27.564352,0 days 00:00:00.913985,99.9496805866386,8.107907187209548,sigmoid,48,2.0,,,8.0,3.0,44.0,,,,,,,,,,COMPLETE
4925,0.28037176366452754,2024-04-11 17:14:27.565968,2024-04-11 17:14:28.789646,0 days 00:00:01.223678,82.26293752124668,7.655525971252984,rbf,52,18.0,,,7.0,2.0,80.0,10.0,22.0,,,,,,,,COMPLETE
4926,0.5336966962271316,2024-04-11 17:14:28.791649,2024-04-11 17:14:29.805324,0 days 00:00:01.013675,95.03802966550306,8.268703269743325,sigmoid,20,,,,3.0,8.0,18.0,14.0,42.0,,,,,,,,COMPLETE
4927,0.508404476489583,2024-04-11 17:14:29.807326,2024-04-11 17:14:30.741526,0 days 00:00:00.934200,96.74899182487694,8.6724594418134,sigmoid,37,15.0,,,,,,9.0,33.0,,,,,,,172.0,COMPLETE
4928,0.6009432182607054,2024-04-11 17:14:30.743540,2024-04-11 17:14:31.579880,0 days 00:00:00.836340,99.9891545313176,7.953753068677226,sigmoid,8,,28.0,31.0,,,,,,,,,,,,,COMPLETE
4929,0.45345352376492626,2024-04-11 17:14:31.581897,2024-04-11 17:14:32.398934,0 days 00:00:00.817037,98.20023267575867,8.383846614670524,sigmoid,8,,27.0,30.0,,,,,,,,,,,,,COMPLETE
4930,0.33443485058451483,2024-04-11 17:14:32.401556,2024-04-11 17:14:33.338219,0 days 00:00:00.936663,99.95293049470074,7.870015596982013,sigmoid,12,,24.0,33.0,,,,47.0,31.0,,,,,,,,COMPLETE
4931,0.34956090806398715,2024-04-11 17:14:33.340222,2024-04-11 17:14:34.340577,0 days 00:00:01.000355,93.63995995284688,7.405329972912296,sigmoid,44,22.0,26.0,28.0,,,,36.0,46.0,,,,,,,,COMPLETE
4932,0.44701971028259324,2024-04-11 17:14:34.343168,2024-04-11 17:14:35.195509,0 days 00:00:00.852341,96.53834536507,8.123409110692602,sigmoid,8,,25.0,30.0,,,,,,,,,,,,,COMPLETE
4933,0.46963965274746594,2024-04-11 17:14:35.197439,2024-04-11 17:14:36.538231,0 days 00:00:01.340792,98.27753971831342,7.683053167317809,sigmoid,55,13.0,,,5.0,6.0,36.0,30.0,12.0,1.6496716789895758,3.257750477573194,1.1877990865765522,9.0,48.0,77.0,112.0,COMPLETE
4934,0.46913649809832375,2024-04-11 17:14:36.540221,2024-04-11 17:14:37.915629,0 days 00:00:01.375408,96.72108558287512,8.506814619191397,sigmoid,59,20.0,23.0,32.0,1.0,4.0,59.0,,,3.4776171288279203,6.303533706865336,6.24900997650069,10.0,46.0,66.0,168.0,COMPLETE
4935,0.6009432182607054,2024-04-11 17:14:37.916606,2024-04-11 17:14:38.755483,0 days 00:00:00.838877,94.82416622010767,8.024229445244053,sigmoid,8,,27.0,31.0,,,,,,,,,,,,,COMPLETE
4936,0.4840038544928932,2024-04-11 17:14:38.757485,2024-04-11 17:14:39.910812,0 days 00:00:01.153327,99.97875360541535,8.296315794168375,sigmoid,60,11.0,21.0,29.0,4.0,1.0,12.0,12.0,9.0,,,,,,,,COMPLETE
4937,0.47932186610568006,2024-04-11 17:14:39.912812,2024-04-11 17:14:40.951474,0 days 00:00:01.038662,91.73165313402245,7.834369381135955,sigmoid,13,,24.0,32.0,,,,50.0,13.0,,,,,,,67.0,COMPLETE
4938,0.32608940434635736,2024-04-11 17:14:40.953479,2024-04-11 17:14:42.291126,0 days 00:00:01.337647,98.13852507443835,6.161957452742573,sigmoid,54,40.0,,,7.0,3.0,7.0,42.0,41.0,8.15047810270475,7.152799718752821,2.5417656461057243,13.0,25.0,81.0,,COMPLETE
4939,0.4366962591646951,2024-04-11 17:14:42.292125,2024-04-11 17:14:43.141497,0 days 00:00:00.849372,99.9893553582676,8.249741555294765,sigmoid,8,,29.0,23.0,,,,,,,,,,,,,COMPLETE
4940,0.4525,2024-04-11 17:14:43.142493,2024-04-11 17:14:44.472762,0 days 00:00:01.330269,95.40756046533028,7.554494176715537,sigmoid,23,,,,2.0,5.0,52.0,4.0,48.0,7.346137566969803,8.066127740995382,4.960385292105152,6.0,49.0,74.0,61.0,COMPLETE
4941,0.5372310756972112,2024-04-11 17:14:44.475759,2024-04-11 17:14:45.234157,0 days 00:00:00.758398,98.09432061966967,8.044486872552177,sigmoid,1,,,,,,,,,,,,,,,103.0,COMPLETE
4942,0.5128757310604343,2024-04-11 17:14:45.236153,2024-04-11 17:14:46.340868,0 days 00:00:01.104715,96.86999265951286,8.527011764668519,sigmoid,7,,,,,,,40.0,24.0,2.1659119583494832,9.19578954880857,6.466693651713658,8.0,21.0,64.0,188.0,COMPLETE
4943,0.5417584701725213,2024-04-11 17:14:46.342846,2024-04-11 17:14:47.213862,0 days 00:00:00.871016,93.70329242932462,7.843083105436651,sigmoid,36,25.0,,,,,,28.0,4.0,,,,,,,,COMPLETE
4944,0.3666888077050814,2024-04-11 17:14:47.215902,2024-04-11 17:14:48.394984,0 days 00:00:01.179082,99.95904173119665,8.832022267610428,rbf,40,7.0,30.0,30.0,,,,,,,,,,,,,COMPLETE
4945,0.5929369437606513,2024-04-11 17:14:48.396983,2024-04-11 17:14:49.235539,0 days 00:00:00.838556,98.28552913780779,8.094102296644776,sigmoid,8,,25.0,33.0,,,,,,,,,,,,,COMPLETE
4946,0.4499117977227775,2024-04-11 17:14:49.237577,2024-04-11 17:14:50.609521,0 days 00:00:01.371944,43.01527615259579,3.2083801327021,sigmoid,27,,26.0,31.0,6.0,7.0,93.0,,,4.2719284623892735,7.719872087378645,3.319096717567165,15.0,35.0,85.0,126.0,COMPLETE
4947,0.5767075627174509,2024-04-11 17:14:50.611534,2024-04-11 17:14:51.385947,0 days 00:00:00.774413,96.6070787558829,8.334987201082209,sigmoid,32,28.0,,,,,,,,,,,,,,,COMPLETE
4948,0.44701971028259324,2024-04-11 17:14:51.387944,2024-04-11 17:14:52.223773,0 days 00:00:00.835829,98.22409661095207,7.70156333578438,sigmoid,8,,23.0,30.0,,,,,,,,,,,,,COMPLETE
4949,0.4511175430133462,2024-04-11 17:14:52.225778,2024-04-11 17:14:53.452540,0 days 00:00:01.226762,94.7816852115806,7.233205571745749,sigmoid,61,23.0,25.0,33.0,5.0,2.0,83.0,38.0,36.0,,,,,,,91.0,COMPLETE
4950,0.5605125128224979,2024-04-11 17:14:53.454541,2024-04-11 17:14:54.249578,0 days 00:00:00.795037,99.99785083973666,7.963437279412184,sigmoid,4,,,,,,,23.0,29.0,,,,,,,,COMPLETE
4951,0.5986580986580987,2024-04-11 17:14:54.252579,2024-04-11 17:14:55.085926,0 days 00:00:00.833347,90.24738632175998,8.208149675042126,sigmoid,8,,26.0,31.0,,,,,,,,,,,,,COMPLETE
4952,0.4262338860430676,2024-04-11 17:14:55.088471,2024-04-11 17:14:55.939204,0 days 00:00:00.850733,96.69166368280142,8.435047430050293,sigmoid,8,,32.0,17.0,,,,,,,,,,,,,COMPLETE
4953,0.5088018433179723,2024-04-11 17:14:55.941777,2024-04-11 17:14:56.968182,0 days 00:00:01.026405,96.7575013680262,7.915636280004392,sigmoid,34,30.0,,,,,,,,0.882075133269443,1.7353698633625405,0.5146259338662311,18.0,28.0,100.0,,COMPLETE
4954,0.43502485388102907,2024-04-11 17:14:56.970180,2024-04-11 17:14:58.364918,0 days 00:00:01.394738,98.05646062546303,7.55384496642452,sigmoid,30,,27.0,29.0,8.0,6.0,97.0,16.0,6.0,4.613421772018421,6.635090510430957,7.729531779672266,3.0,31.0,79.0,,COMPLETE
4955,0.5963643249384587,2024-04-11 17:14:58.366917,2024-04-11 17:14:59.195462,0 days 00:00:00.828545,98.20021547156949,8.16626883672412,sigmoid,8,,24.0,32.0,,,,,,,,,,,,,COMPLETE
4956,0.322896566789238,2024-04-11 17:14:59.197462,2024-04-11 17:15:00.009472,0 days 00:00:00.812010,92.88399150054698,7.738702751187296,sigmoid,33,32.0,,,,,,,,,,,,,,51.0,COMPLETE
4957,0.5963245096172158,2024-04-11 17:15:00.011476,2024-04-11 17:15:00.926645,0 days 00:00:00.915169,95.44223972654306,8.57911960320527,sigmoid,8,,22.0,31.0,,,,,,,,,,,,,COMPLETE
4958,0.3378103649391768,2024-04-11 17:15:00.928227,2024-04-11 17:15:01.928656,0 days 00:00:01.000429,34.983468386734074,8.066115002226459,sigmoid,17,,,,4.0,7.0,34.0,,,,,,,,,30.0,COMPLETE
4959,0.45345352376492626,2024-04-11 17:15:01.930654,2024-04-11 17:15:02.823352,0 days 00:00:00.892698,98.13725929304348,8.299337663283175,sigmoid,8,,28.0,30.0,,,,,,,,,,,,,COMPLETE
4960,0.3686233288440693,2024-04-11 17:15:02.825356,2024-04-11 17:15:03.775248,0 days 00:00:00.949892,67.42554407540511,7.903721316543244,sigmoid,5,,,,,,,35.0,47.0,,,,,,,56.0,COMPLETE
4961,0.5011767963450091,2024-04-11 17:15:03.777249,2024-04-11 17:15:04.962902,0 days 00:00:01.185653,99.95182592456625,9.563649796853312,sigmoid,45,47.0,25.0,34.0,,,,43.0,17.0,,,,,,,118.0,COMPLETE
4962,0.44824394636782067,2024-04-11 17:15:04.964902,2024-04-11 17:15:06.201878,0 days 00:00:01.236976,99.97301223117321,8.183439489779976,sigmoid,53,12.0,,,3.0,8.0,74.0,13.0,11.0,,,,,,,144.0,COMPLETE
4963,0.2543665930536037,2024-04-11 17:15:06.203868,2024-04-11 17:15:07.722495,0 days 00:00:01.518627,95.14973113499313,7.434768617855547,rbf,19,,,,3.0,1.0,31.0,,,6.4858622792300675,3.525501219846111,3.7760595382304083,19.0,30.0,59.0,16.0,COMPLETE
4964,0.5039941571187292,2024-04-11 17:15:07.724490,2024-04-11 17:15:08.822121,0 days 00:00:01.097631,96.57967793711806,7.766322448683416,sigmoid,49,10.0,,,1.0,3.0,39.0,,,,,,,,,193.0,COMPLETE
4965,0.3943355119825707,2024-04-11 17:15:08.824156,2024-04-11 17:15:10.193219,0 days 00:00:01.369063,98.22908114218089,8.694025568566444,sigmoid,50,36.0,,,6.0,4.0,78.0,,,6.985089498291488,9.52328884335754,8.458787912876854,2.0,32.0,57.0,,COMPLETE
4966,0.5963643249384587,2024-04-11 17:15:10.196237,2024-04-11 17:15:11.122954,0 days 00:00:00.926717,93.58393929929638,8.402903484418331,sigmoid,8,,26.0,32.0,,,,,,,,,,,,,COMPLETE
4967,0.519146385838738,2024-04-11 17:15:11.124947,2024-04-11 17:15:12.422701,0 days 00:00:01.297754,99.95918247732006,8.006919266988575,sigmoid,18,,,,5.0,5.0,65.0,,,5.214246459467679,4.333514276394022,4.73718097163856,4.0,34.0,86.0,,COMPLETE
4968,0.4860993683791715,2024-04-11 17:15:12.424697,2024-04-11 17:15:13.720709,0 days 00:00:01.296012,96.55128526211033,8.192209501742424,sigmoid,29,,46.0,28.0,7.0,4.0,87.0,21.0,20.0,,,,,,,39.0,COMPLETE
4969,0.4935807712727448,2024-04-11 17:15:13.722719,2024-04-11 17:15:14.853530,0 days 00:00:01.130811,98.27139962580051,7.887534204762105,sigmoid,25,,24.0,30.0,2.0,6.0,9.0,,,,,,,,,134.0,COMPLETE
4970,0.345905599826921,2024-04-11 17:15:14.856131,2024-04-11 17:15:16.114475,0 days 00:00:01.258344,99.96950593824216,7.5582183739437605,sigmoid,39,6.0,,,,,,48.0,45.0,1.3038533432143202,2.1042285544231185,3.078886739585406,16.0,22.0,53.0,200.0,COMPLETE
4971,0.5929369437606513,2024-04-11 17:15:16.116116,2024-04-11 17:15:16.963355,0 days 00:00:00.847239,95.45075802591569,8.05020449065424,sigmoid,8,,25.0,33.0,,,,,,,,,,,,,COMPLETE
4972,0.5421667370283256,2024-04-11 17:15:16.965353,2024-04-11 17:15:18.070680,0 days 00:00:01.105327,96.79386425581964,8.403213188165207,sigmoid,6,,,,,,,18.0,15.0,2.996148994872084,1.3399318930294788,4.541072842084055,11.0,47.0,84.0,,COMPLETE
