number,value,datetime_start,datetime_complete,duration,params_C,params_gamma,params_kernel,params_mask_number,params_rsi_window,params_so_smooth,params_so_window,params_srsi_smooth1,params_srsi_smooth2,params_srsi_window,params_tsi_window_fast,params_tsi_window_slow,params_ult_weight_1,params_ult_weight_2,params_ult_weight_3,params_ult_window_1,params_ult_window_2,params_ult_window_3,params_williams_lbp,state
3126,0.41563809633159193,2024-04-11 16:35:58.658689,2024-04-11 16:35:59.805162,0 days 00:00:01.146473,98.22305657354632,7.9550269025980445,sigmoid,58,34.0,24.0,28.0,2.0,3.0,60.0,,,7.641779669141119,3.355210535121342,6.56162566141178,20.0,39.0,57.0,,COMPLETE
3127,0.5022561108027894,2024-04-11 16:35:59.808183,2024-04-11 16:36:00.765399,0 days 00:00:00.957216,95.35402860863853,7.1964175460819035,sigmoid,25,,26.0,32.0,6.0,8.0,40.0,,,,,,,,,50.0,COMPLETE
3128,0.3877300182609917,2024-04-11 16:36:00.767495,2024-04-11 16:36:01.761144,0 days 00:00:00.993649,49.28973177281692,8.461056919349272,sigmoid,18,,,,7.0,4.0,72.0,,,2.1696842665369003,4.901086042612526,7.320963350468317,11.0,41.0,81.0,,COMPLETE
3129,0.45781391147244804,2024-04-11 16:36:01.763199,2024-04-11 16:36:03.007221,0 days 00:00:01.244022,21.590430188105167,8.125080575036247,rbf,8,,27.0,30.0,,,,,,,,,,,,,COMPLETE
3130,0.5534728565188038,2024-04-11 16:36:03.009310,2024-04-11 16:36:03.982750,0 days 00:00:00.973440,98.17191769644838,7.8757696672623005,sigmoid,6,,,,,,,19.0,43.0,9.98803552992166,5.3539349334966415,5.804303267028616,4.0,45.0,95.0,,COMPLETE
3131,0.4778816038102141,2024-04-11 16:36:03.984363,2024-04-11 16:36:05.011764,0 days 00:00:01.027401,95.79313401179768,8.301166657587528,sigmoid,29,,25.0,31.0,1.0,6.0,76.0,5.0,17.0,,,,,,,178.0,COMPLETE
3132,0.4841785175362386,2024-04-11 16:36:05.013771,2024-04-11 16:36:06.090652,0 days 00:00:01.076881,99.91190088755319,8.064619804416239,sigmoid,43,49.0,24.0,33.0,,,,,,9.690592881938294,8.878014168996172,6.062194534021933,6.0,25.0,72.0,113.0,COMPLETE
3133,0.44701971028259324,2024-04-11 16:36:06.092675,2024-04-11 16:36:06.884439,0 days 00:00:00.791764,96.83372419955855,7.629044032828681,sigmoid,8,,26.0,30.0,,,,,,,,,,,,,COMPLETE
3134,0.4605235547161892,2024-04-11 16:36:06.886465,2024-04-11 16:36:07.993944,0 days 00:00:01.107479,98.10478262983065,8.66472082352391,sigmoid,22,,,,5.0,7.0,5.0,35.0,28.0,6.347252622190106,9.124643059838474,5.375127661374291,17.0,31.0,75.0,,COMPLETE
3135,0.473342708410431,2024-04-11 16:36:07.995034,2024-04-11 16:36:08.878085,0 days 00:00:00.883051,99.9436111682053,7.7828913434572105,sigmoid,24,,30.0,32.0,4.0,5.0,98.0,,,,,,,,,,COMPLETE
3136,0.5906279643331437,2024-04-11 16:36:08.880084,2024-04-11 16:36:09.624361,0 days 00:00:00.744277,94.06533302046292,8.403448143382228,sigmoid,8,,28.0,34.0,,,,,,,,,,,,,COMPLETE
3137,0.41280137432616554,2024-04-11 16:36:09.625361,2024-04-11 16:36:10.824241,0 days 00:00:01.198880,96.66878918127016,8.179549668428514,sigmoid,47,7.0,23.0,31.0,,,,12.0,21.0,8.061011565561929,3.707558804288837,8.551413131692392,5.0,34.0,87.0,70.0,COMPLETE
3138,0.3317939859696125,2024-04-11 16:36:10.826371,2024-04-11 16:36:11.898610,0 days 00:00:01.072239,92.04466679908762,7.404547490002448,sigmoid,35,39.0,,,,,,,,5.5215896143165075,1.29070064415678,5.177017636052681,7.0,36.0,55.0,34.0,COMPLETE
3139,0.5271134919116554,2024-04-11 16:36:11.900618,2024-04-11 16:36:12.911036,0 days 00:00:01.010418,98.13986100433013,7.947812245811207,sigmoid,38,46.0,,,,,,25.0,37.0,4.817079693736329,1.8457844017689302,2.5866141192350653,13.0,21.0,78.0,,COMPLETE
3140,0.12622036262203626,2024-04-11 16:36:12.913304,2024-04-11 16:36:13.683725,0 days 00:00:00.770421,96.24454603911585,8.145229791805177,sigmoid,8,,25.0,29.0,,,,,,,,,,,,,COMPLETE
3141,0.5215913978494625,2024-04-11 16:36:13.685714,2024-04-11 16:36:14.629609,0 days 00:00:00.943895,98.35592151318893,7.790939295464438,sigmoid,3,,,,,,,,,4.085119822790445,4.374272161281582,8.231883535243494,10.0,43.0,71.0,104.0,COMPLETE
3142,0.45345352376492626,2024-04-11 16:36:14.631722,2024-04-11 16:36:15.493249,0 days 00:00:00.861527,94.48696862343401,8.359285891600987,sigmoid,8,,26.0,30.0,,,,,,,,,,,,,COMPLETE
3143,0.48696746803574076,2024-04-11 16:36:15.495249,2024-04-11 16:36:16.650784,0 days 00:00:01.155535,99.9064231530645,8.692207099556803,sigmoid,15,,22.0,33.0,,,,4.0,46.0,1.691755209747011,9.99927932026898,6.734555402512237,14.0,23.0,60.0,194.0,COMPLETE
3144,0.5952371952371952,2024-04-11 16:36:16.651811,2024-04-11 16:36:17.436309,0 days 00:00:00.784498,77.15652064019687,8.002055325626783,sigmoid,8,,27.0,32.0,,,,,,,,,,,,,COMPLETE
3145,0.4354919163170095,2024-04-11 16:36:17.437308,2024-04-11 16:36:18.522481,0 days 00:00:01.085173,96.62574747040354,7.540339688880495,sigmoid,50,41.0,,,2.0,6.0,21.0,,,1.0990715895628869,6.219220170426208,8.023705103402335,18.0,28.0,93.0,,COMPLETE
3146,0.5986580986580987,2024-04-11 16:36:18.524477,2024-04-11 16:36:19.274525,0 days 00:00:00.750048,98.40289212601512,8.214899031373799,sigmoid,8,,24.0,31.0,,,,,,,,,,,,,COMPLETE
3147,0.36649735740270434,2024-04-11 16:36:19.275687,2024-04-11 16:36:20.341545,0 days 00:00:01.065858,98.20030860104093,4.241730580571527,sigmoid,39,32.0,,,,,,17.0,15.0,3.6086035499386933,7.56778999557029,3.9990941480138398,9.0,26.0,92.0,133.0,COMPLETE
3148,0.344929377475525,2024-04-11 16:36:20.343545,2024-04-11 16:36:21.144751,0 days 00:00:00.801206,94.92658037538546,8.515016102001608,sigmoid,9,,25.0,30.0,,,,,,,,,,,,88.0,COMPLETE
3149,0.4667922341350333,2024-04-11 16:36:21.146825,2024-04-11 16:36:22.700049,0 days 00:00:01.553224,96.65086152183775,7.927571271838013,rbf,8,,29.0,28.0,,,,,,,,,,,,,COMPLETE
3150,0.3423103109161056,2024-04-11 16:36:22.702204,2024-04-11 16:36:23.648262,0 days 00:00:00.946058,68.62518315182137,7.720632392387725,sigmoid,21,,,,8.0,2.0,10.0,21.0,8.0,,,,,,,111.0,COMPLETE
3151,0.6009432182607054,2024-04-11 16:36:23.650409,2024-04-11 16:36:24.418538,0 days 00:00:00.768129,98.07388699217479,8.115815444739022,sigmoid,8,,27.0,31.0,,,,,,,,,,,,,COMPLETE
3152,0.3563586611939801,2024-04-11 16:36:24.420534,2024-04-11 16:36:25.445511,0 days 00:00:01.024977,93.54759893082257,5.931705745204774,sigmoid,42,24.0,25.0,32.0,,,,,,5.156017462870131,8.0685087438506,7.627442972772004,11.0,37.0,56.0,,COMPLETE
3153,0.5632968577452063,2024-04-11 16:36:25.447683,2024-04-11 16:36:26.364379,0 days 00:00:00.916696,99.96218308394519,8.386986339807784,sigmoid,2,,,,,,,,,2.856532114321255,6.921530480690032,3.392651172084129,2.0,48.0,64.0,,COMPLETE
3154,0.4547738693467336,2024-04-11 16:36:26.366601,2024-04-11 16:36:27.658881,0 days 00:00:01.292280,99.9009607006046,7.941974705609047,sigmoid,31,,23.0,34.0,5.0,3.0,92.0,20.0,40.0,8.937743300226844,5.923989133096114,2.244825114637364,16.0,22.0,58.0,189.0,COMPLETE
3155,0.46075318199711324,2024-04-11 16:36:27.660878,2024-04-11 16:36:28.675307,0 days 00:00:01.014429,96.14822291733633,6.976611430343178,sigmoid,57,6.0,24.0,30.0,6.0,8.0,33.0,,,,,,,,,26.0,COMPLETE
3156,0.4142887661366619,2024-04-11 16:36:28.676317,2024-04-11 16:36:29.782795,0 days 00:00:01.106478,98.2592420204391,8.2466541773288,sigmoid,46,36.0,26.0,32.0,,,,8.0,48.0,4.5154713157990525,9.608153132250903,1.3851767956419296,19.0,30.0,51.0,,COMPLETE
3157,0.3592542709293259,2024-04-11 16:36:29.784956,2024-04-11 16:36:30.652945,0 days 00:00:00.867989,91.99038855382896,7.644981344159824,sigmoid,41,21.0,28.0,29.0,,,,,,,,,,,,166.0,COMPLETE
3158,0.2940643064948804,2024-04-11 16:36:30.655218,2024-04-11 16:36:31.713492,0 days 00:00:01.058274,99.9125208963608,8.079250950647115,sigmoid,10,,26.0,35.0,,,,,,1.4751960060313012,6.57792241914014,9.639959153635152,20.0,27.0,53.0,,COMPLETE
3159,0.4106118848068561,2024-04-11 16:36:31.715481,2024-04-11 16:36:32.628989,0 days 00:00:00.913508,96.74893931534552,7.818659162524606,sigmoid,16,,,,4.0,7.0,57.0,,,,,,,,,,COMPLETE
3160,0.5986314388899449,2024-04-11 16:36:32.630612,2024-04-11 16:36:33.147104,0 days 00:00:00.516492,94.80019949723665,8.534929981955933,sigmoid,8,,24.0,31.0,,,,,,,,,,,,,COMPLETE
3161,0.4219114219114219,2024-04-11 16:36:33.148702,2024-04-11 16:36:34.004644,0 days 00:00:00.855942,99.98892074785266,8.826046452600508,sigmoid,62,25.0,25.0,33.0,7.0,2.0,17.0,45.0,14.0,2.5673446213883424,5.052381606906361,0.5219465297638299,12.0,39.0,88.0,,COMPLETE
3162,0.3349415108056309,2024-04-11 16:36:34.006644,2024-04-11 16:42:04.673833,0 days 00:05:30.667189,98.18447542775074,7.426315450628588,sigmoid,26,,27.0,37.0,3.0,4.0,49.0,,,5.8674738280728445,3.9983537986870052,5.5391024346548186,5.0,42.0,80.0,,COMPLETE
3163,0.36765020312165914,2024-04-11 16:42:04.677827,2024-04-11 16:42:07.295159,0 days 00:00:02.617332,81.12571219654052,8.279422646494433,sigmoid,14,,23.0,30.0,,,,43.0,19.0,8.733794675874815,2.619136576405368,8.933199270289688,8.0,24.0,96.0,,COMPLETE
3164,0.5032160780340692,2024-04-11 16:42:07.296149,2024-04-11 16:42:08.712027,0 days 00:00:01.415878,96.62599139695031,3.661341704878633,sigmoid,11,,25.0,32.0,,,,,,3.187352074964787,4.648826836723118,7.107811340265645,4.0,35.0,77.0,56.0,COMPLETE
3165,0.6009432182607054,2024-04-11 16:42:08.715025,2024-04-11 16:42:09.784802,0 days 00:00:01.069777,72.26140311394268,7.893666107778345,sigmoid,8,,26.0,31.0,,,,,,,,,,,,,COMPLETE
3166,0.5298990905693286,2024-04-11 16:42:09.787804,2024-04-11 16:42:10.824489,0 days 00:00:01.036685,98.23540386088347,8.118504201069664,sigmoid,37,28.0,,,,,,48.0,42.0,,,,,,,45.0,COMPLETE
3167,0.02260522043212189,2024-04-11 16:42:10.828004,2024-04-11 16:42:12.835918,0 days 00:00:02.007914,99.97489297528296,8.372153741005471,rbf,63,30.0,25.0,27.0,6.0,5.0,86.0,40.0,6.0,7.323098906419583,9.326302751240103,0.8997585028472894,3.0,33.0,66.0,66.0,COMPLETE
3168,0.4805707196029777,2024-04-11 16:42:12.835918,2024-04-11 16:42:13.779414,0 days 00:00:00.943496,99.9837180057275,7.671876737938425,sigmoid,20,,,,1.0,1.0,52.0,6.0,36.0,,,,,,,,COMPLETE
3169,0.12622036262203626,2024-04-11 16:42:13.779414,2024-04-11 16:42:14.569169,0 days 00:00:00.789755,95.63135837531246,8.011062258162088,sigmoid,8,,22.0,29.0,,,,,,,,,,,,,COMPLETE
3170,0.3972939326431661,2024-04-11 16:42:14.577186,2024-04-11 16:42:15.642115,0 days 00:00:01.064929,96.79587437941514,8.238864093751118,sigmoid,28,,28.0,31.0,8.0,7.0,24.0,36.0,32.0,,,,,,,,COMPLETE
3171,0.40928754014550695,2024-04-11 16:42:15.642115,2024-04-11 16:42:16.835071,0 days 00:00:01.192956,93.69563150614141,7.809456399543087,sigmoid,56,40.0,24.0,33.0,1.0,8.0,83.0,,,,,,,,,,COMPLETE
3172,0.4448341684562156,2024-04-11 16:42:16.835071,2024-04-11 16:42:17.645635,0 days 00:00:00.810564,98.21279269033131,8.566282572236428,sigmoid,8,,27.0,30.0,,,,,,,,,,,,,COMPLETE
3173,0.45347172512526845,2024-04-11 16:42:17.645635,2024-04-11 16:42:18.487772,0 days 00:00:00.842137,45.570991310849486,8.010959046624405,sigmoid,8,,26.0,28.0,,,,,,,,,,,,,COMPLETE
3174,0.4803584097537904,2024-04-11 16:42:18.488029,2024-04-11 16:42:19.455083,0 days 00:00:00.967054,95.12172141565539,7.190157177527535,sigmoid,52,23.0,,,2.0,6.0,69.0,28.0,4.0,,,,,,,,COMPLETE
3175,0.5169837852089467,2024-04-11 16:42:19.455083,2024-04-11 16:42:20.322302,0 days 00:00:00.867219,99.93092746055827,8.379083767844982,sigmoid,48,15.0,,,3.0,3.0,89.0,,,,,,,,,,COMPLETE
3176,0.5952371952371952,2024-04-11 16:42:20.322302,2024-04-11 16:42:21.091362,0 days 00:00:00.769060,96.93970381769573,7.552844748847876,sigmoid,8,,24.0,32.0,,,,,,,,,,,,,COMPLETE
3177,0.42140063326504,2024-04-11 16:42:21.099074,2024-04-11 16:42:22.345186,0 days 00:00:01.246112,97.98847719600771,8.141680233786676,sigmoid,55,11.0,,,7.0,2.0,42.0,13.0,2.0,9.99920477896191,1.5955325378805463,4.8438721728229694,7.0,48.0,99.0,161.0,COMPLETE
3178,0.34290294374817837,2024-04-11 16:42:22.345186,2024-04-11 16:42:23.331407,0 days 00:00:00.986221,95.09561219180826,7.857167783701672,sigmoid,44,48.0,23.0,31.0,,,,29.0,18.0,,,,,,,,COMPLETE
3179,0.12622036262203626,2024-04-11 16:42:23.331407,2024-04-11 16:42:24.065486,0 days 00:00:00.734079,34.545938735424635,8.164695768466009,sigmoid,8,,25.0,29.0,,,,,,,,,,,,,COMPLETE
3180,0.35316397582064424,2024-04-11 16:42:24.065486,2024-04-11 16:42:24.972969,0 days 00:00:00.907483,96.76036154878473,8.723292259951325,sigmoid,13,,29.0,33.0,,,,33.0,30.0,,,,,,,117.0,COMPLETE
3181,0.5181678044483595,2024-04-11 16:42:24.972969,2024-04-11 16:42:25.871361,0 days 00:00:00.898392,30.37813203171814,7.981113798814664,sigmoid,12,,27.0,30.0,,,,2.0,13.0,,,,,,,,COMPLETE
3182,0.5952371952371952,2024-04-11 16:42:25.871361,2024-04-11 16:42:26.664732,0 days 00:00:00.793371,98.06662924366722,7.732806010051943,sigmoid,8,,21.0,32.0,,,,,,,,,,,,,COMPLETE
3183,0.5653270113644916,2024-04-11 16:42:26.664732,2024-04-11 16:42:27.524985,0 days 00:00:00.860253,91.96025417780626,8.48543450183548,sigmoid,36,50.0,,,,,,15.0,34.0,,,,,,,,COMPLETE
3184,0.4791383330095201,2024-04-11 16:42:27.524985,2024-04-11 16:42:28.712220,0 days 00:00:01.187235,98.15924688151733,8.922378008545222,sigmoid,59,17.0,26.0,31.0,5.0,4.0,8.0,,,7.047855691097405,7.798877410753474,9.964385423229668,17.0,31.0,67.0,148.0,COMPLETE
3185,0.4492461145905822,2024-04-11 16:42:28.720494,2024-04-11 16:42:29.648947,0 days 00:00:00.928453,98.2650731019703,3.133131670010962,sigmoid,8,,24.0,30.0,,,,,,,,,,,,,COMPLETE
3186,0.17536210822070436,2024-04-11 16:42:29.656990,2024-04-11 16:42:31.148953,0 days 00:00:01.491963,93.74650424125389,8.293577830894888,rbf,54,35.0,,,2.0,1.0,12.0,32.0,20.0,7.802570618742303,3.129989741492193,6.263355766848262,15.0,21.0,86.0,,COMPLETE
3187,0.5238324928743696,2024-04-11 16:42:31.156959,2024-04-11 16:42:31.978308,0 days 00:00:00.821349,96.60079636212274,7.99853389230811,sigmoid,40,5.0,23.0,32.0,,,,,,,,,,,,,COMPLETE
3188,0.46655619558641737,2024-04-11 16:42:31.978308,2024-04-11 16:42:33.096217,0 days 00:00:01.117909,98.33787314226257,7.488144744933375,sigmoid,60,33.0,26.0,31.0,4.0,3.0,61.0,22.0,23.0,,,,,,,,COMPLETE
3189,0.301883931617452,2024-04-11 16:42:33.096217,2024-04-11 16:42:34.128338,0 days 00:00:01.032121,99.93612573455205,7.778103696072745,sigmoid,7,,,,,,,39.0,10.0,9.350722144562827,0.8758900632188702,2.3789636758322494,10.0,43.0,91.0,13.0,COMPLETE
3190,0.5838604458380638,2024-04-11 16:42:34.128338,2024-04-11 16:42:34.816607,0 days 00:00:00.688269,99.98986962413343,8.141966813072566,sigmoid,32,12.0,,,,,,,,,,,,,,,COMPLETE
3191,0.5906279643331437,2024-04-11 16:42:34.816607,2024-04-11 16:42:35.594395,0 days 00:00:00.777788,99.94308783855948,8.397092673806986,sigmoid,8,,25.0,34.0,,,,,,,,,,,,,COMPLETE
3192,0.3358549814444761,2024-04-11 16:42:35.594395,2024-04-11 16:42:36.282325,0 days 00:00:00.687930,99.96931160714821,7.9525310210792,sigmoid,1,,,,,,,,,,,,,,,76.0,COMPLETE
3193,0.126809901914993,2024-04-11 16:42:36.282325,2024-04-11 16:42:37.015915,0 days 00:00:00.733590,95.55321411030485,7.3123077330533555,sigmoid,8,,28.0,29.0,,,,,,,,,,,,,COMPLETE
3194,0.5929369437606513,2024-04-11 16:42:37.015915,2024-04-11 16:42:37.758536,0 days 00:00:00.742621,96.33131313047076,7.654911373375093,sigmoid,8,,31.0,33.0,,,,,,,,,,,,,COMPLETE
3195,0.4692041177496948,2024-04-11 16:42:37.759130,2024-04-11 16:42:38.860510,0 days 00:00:01.101380,94.51801784488936,8.242384953663345,sigmoid,61,26.0,24.0,30.0,6.0,5.0,64.0,47.0,45.0,,,,,,,86.0,COMPLETE
3196,0.5452045226350024,2024-04-11 16:42:38.860510,2024-04-11 16:42:39.634987,0 days 00:00:00.774477,98.3443693482887,8.072594629102728,sigmoid,5,,,,,,,42.0,39.0,,,,,,,174.0,COMPLETE
3197,0.4641754330873501,2024-04-11 16:42:39.634987,2024-04-11 16:42:40.764653,0 days 00:00:01.129666,96.39702316764354,8.538830867796198,sigmoid,23,,,,3.0,4.0,96.0,18.0,9.0,2.0026525522839735,8.657589478873073,1.5548326499347844,18.0,32.0,84.0,154.0,COMPLETE
3198,0.5975614331269932,2024-04-11 16:42:40.764653,2024-04-11 16:42:41.514754,0 days 00:00:00.750101,98.14156845043598,5.130587215887754,sigmoid,8,,27.0,31.0,,,,,,,,,,,,,COMPLETE
3199,0.47540066635861766,2024-04-11 16:42:41.521325,2024-04-11 16:42:42.650513,0 days 00:00:01.129188,60.161032181984815,7.820742974045805,sigmoid,27,,22.0,28.0,5.0,8.0,38.0,,,6.504033042466278,2.7297853152533866,1.2059017990665604,9.0,38.0,63.0,127.0,COMPLETE
3200,0.5975614331269932,2024-04-11 16:42:42.650513,2024-04-11 16:42:43.406236,0 days 00:00:00.755723,93.51297262683012,6.440661033656243,sigmoid,8,,26.0,32.0,,,,,,,,,,,,,COMPLETE
3201,0.5323106271361578,2024-04-11 16:42:43.406236,2024-04-11 16:42:44.325863,0 days 00:00:00.919627,96.95234027909575,8.269198761832717,sigmoid,34,38.0,,,,,,,,8.20378669556696,0.5122229771364335,3.1892762715517264,13.0,49.0,74.0,,COMPLETE
3202,0.4087601416343714,2024-04-11 16:42:44.325863,2024-04-11 16:42:45.504342,0 days 00:00:01.178479,98.10348609753952,7.936283583597869,sigmoid,30,,25.0,30.0,8.0,6.0,27.0,10.0,16.0,6.122507099942627,5.2677910976935225,3.6684834394727193,16.0,35.0,54.0,,COMPLETE
3203,0.4867083382474348,2024-04-11 16:42:45.512856,2024-04-11 16:42:46.435687,0 days 00:00:00.922831,95.05041962275521,8.130287353641778,sigmoid,45,16.0,23.0,32.0,,,,5.0,41.0,,,,,,,168.0,COMPLETE
3204,0.5468832380257128,2024-04-11 16:42:46.443710,2024-04-11 16:42:47.160450,0 days 00:00:00.716740,91.95244614263399,7.51823907608315,sigmoid,33,31.0,,,,,,,,,,,,,,184.0,COMPLETE
3205,0.2811529168104936,2024-04-11 16:42:47.160450,2024-04-11 16:42:48.418504,0 days 00:00:01.258054,96.67413737982768,8.418907292298742,rbf,17,,,,1.0,7.0,78.0,,,,,,,,,97.0,COMPLETE
3206,0.211122682774422,2024-04-11 16:42:48.418504,2024-04-11 16:42:49.160508,0 days 00:00:00.742004,98.26191990338616,7.736346202496752,sigmoid,4,,,,,,,35.0,26.0,,,,,,,,COMPLETE
3207,0.6009432182607054,2024-04-11 16:42:49.160508,2024-04-11 16:42:49.895049,0 days 00:00:00.734541,96.6517786716252,8.027214754056645,sigmoid,8,,27.0,31.0,,,,,,,,,,,,,COMPLETE
3208,0.4577169893408745,2024-04-11 16:42:49.895049,2024-04-11 16:42:50.880489,0 days 00:00:00.985440,98.30440669006292,8.660635903612166,sigmoid,53,46.0,,,4.0,1.0,74.0,14.0,11.0,,,,,,,40.0,COMPLETE
3209,0.4051381418501319,2024-04-11 16:42:50.880489,2024-04-11 16:42:51.729381,0 days 00:00:00.848892,99.91490666615013,8.197352830630377,sigmoid,49,10.0,,,7.0,5.0,55.0,,,,,,,,,200.0,COMPLETE
3210,0.5290493749437899,2024-04-11 16:42:51.737793,2024-04-11 16:42:52.795873,0 days 00:00:01.058080,95.13567030647378,7.870045620915694,sigmoid,19,,,,8.0,3.0,15.0,,,0.765930434540703,8.451192389691332,2.143386249676855,14.0,37.0,100.0,142.0,COMPLETE
3211,0.45752618914517657,2024-04-11 16:42:52.804401,2024-04-11 16:42:53.947963,0 days 00:00:01.143562,96.97066676894728,8.348518164454276,sigmoid,58,44.0,25.0,29.0,6.0,2.0,36.0,,,5.264345938783213,7.082054535299463,5.056200713764776,6.0,46.0,71.0,,COMPLETE
3212,0.5929369437606513,2024-04-11 16:42:53.947963,2024-04-11 16:42:54.693081,0 days 00:00:00.745118,98.23080454339761,7.6438320164196245,sigmoid,8,,26.0,33.0,,,,,,,,,,,,,COMPLETE
3213,0.5521836865767502,2024-04-11 16:42:54.693081,2024-04-11 16:42:55.686767,0 days 00:00:00.993686,99.94101765467364,8.042247087687695,sigmoid,6,,,,,,,27.0,47.0,6.8355824206561175,5.510655448823433,5.838316518135311,7.0,20.0,76.0,,COMPLETE
3214,0.5963245096172158,2024-04-11 16:42:55.686970,2024-04-11 16:42:56.435767,0 days 00:00:00.748797,99.9900393519009,8.520312294500005,sigmoid,8,,28.0,31.0,,,,,,,,,,,,,COMPLETE
3215,0.44701971028259324,2024-04-11 16:42:56.435767,2024-04-11 16:42:57.175700,0 days 00:00:00.739933,93.52294148598794,7.855215742001704,sigmoid,8,,24.0,30.0,,,,,,,,,,,,,COMPLETE
3216,0.4200893119454727,2024-04-11 16:42:57.184441,2024-04-11 16:42:58.251650,0 days 00:00:01.067209,95.28263007877193,8.238615297975684,sigmoid,51,29.0,,,3.0,7.0,67.0,,,8.48086297905137,1.9789340540815559,9.492469674974187,19.0,26.0,95.0,63.0,COMPLETE
3217,0.5110646894081998,2024-04-11 16:42:58.253195,2024-04-11 16:42:59.253118,0 days 00:00:00.999923,98.27804703028096,7.43863678469038,sigmoid,18,,,,5.0,6.0,45.0,,,3.7649997618170206,1.1686319436438106,4.2153760677295375,20.0,36.0,89.0,,COMPLETE
3218,0.5929369437606513,2024-04-11 16:42:59.253379,2024-04-11 16:42:59.985411,0 days 00:00:00.732032,96.62634272157307,8.041642778815948,sigmoid,8,,25.0,33.0,,,,,,,,,,,,,COMPLETE
3219,0.5963643249384587,2024-04-11 16:42:59.985411,2024-04-11 16:43:00.752510,0 days 00:00:00.767099,99.92946214337154,8.314810248236354,sigmoid,8,,23.0,32.0,,,,,,,,,,,,,COMPLETE
3220,0.38688392552894896,2024-04-11 16:43:00.752510,2024-04-11 16:43:01.871413,0 days 00:00:01.118903,98.30889403491977,7.697835099919851,sigmoid,22,,,,2.0,8.0,47.0,24.0,7.0,9.118992749433053,3.566007669547331,8.667784203273008,17.0,47.0,79.0,,COMPLETE
3221,0.43903867064432484,2024-04-11 16:43:01.871413,2024-04-11 16:43:02.901023,0 days 00:00:01.029610,99.96658241327502,8.63588068980514,sigmoid,29,,26.0,29.0,4.0,2.0,29.0,16.0,37.0,,,,,,,22.0,COMPLETE
3222,0.28866472628683065,2024-04-11 16:43:02.901023,2024-04-11 16:43:03.942834,0 days 00:00:01.041811,99.98462644628302,7.89426051562027,sigmoid,50,37.0,,,6.0,4.0,20.0,,,5.718672405646723,2.3059000841061668,0.7056664879287124,15.0,29.0,98.0,,COMPLETE
3223,0.47980252438045673,2024-04-11 16:43:03.951628,2024-04-11 16:43:05.140896,0 days 00:00:01.189268,99.9704522948267,8.155134428412671,sigmoid,47,20.0,29.0,31.0,,,,26.0,33.0,4.124098952538108,7.386542811201625,2.9773755057517977,2.0,40.0,94.0,122.0,COMPLETE
3224,0.5028971740679173,2024-04-11 16:43:05.148931,2024-04-11 16:43:06.050443,0 days 00:00:00.901512,95.10072997681775,8.462476466192967,sigmoid,24,,24.0,30.0,1.0,3.0,4.0,,,,,,,,,,COMPLETE
3225,0.2379074658254469,2024-04-11 16:43:06.050443,2024-04-11 16:43:07.347332,0 days 00:00:01.296889,93.7345088528619,8.01639024556833,rbf,38,4.0,,,,,,46.0,12.0,2.7608713431245633,4.150942778886053,9.108872020717813,11.0,25.0,69.0,,COMPLETE
3226,0.4659784259712175,2024-04-11 16:43:07.347332,2024-04-11 16:43:08.257682,0 days 00:00:00.910350,96.6575408016583,7.540088200154516,sigmoid,21,,,,7.0,1.0,31.0,20.0,27.0,,,,,,,72.0,COMPLETE
3227,0.3548633046509095,2024-04-11 16:43:08.257682,2024-04-11 16:43:09.146175,0 days 00:00:00.888493,96.71681729948335,8.277346902432798,sigmoid,3,,,,,,,,,7.540598092373948,9.459710728981761,7.89441102315284,12.0,27.0,52.0,81.0,COMPLETE
