number,value,datetime_start,datetime_complete,duration,params_C,params_gamma,params_kernel,params_mask_number,params_rsi_window,params_so_smooth,params_so_window,params_srsi_smooth1,params_srsi_smooth2,params_srsi_window,params_tsi_window_fast,params_tsi_window_slow,params_ult_weight_1,params_ult_weight_2,params_ult_weight_3,params_ult_window_1,params_ult_window_2,params_ult_window_3,params_williams_lbp,state
5383,0.5963643249384587,2024-04-11 17:22:49.050387,2024-04-11 17:22:49.940907,0 days 00:00:00.890520,99.9510383060185,8.330314546051058,sigmoid,8,,26.0,32.0,,,,,,,,,,,,,COMPLETE
5384,0.5929369437606513,2024-04-11 17:22:49.942904,2024-04-11 17:22:50.848261,0 days 00:00:00.905357,95.18974642370034,8.021921115013402,sigmoid,8,,27.0,33.0,,,,,,,,,,,,,COMPLETE
5385,0.4711823814234393,2024-04-11 17:22:50.849258,2024-04-11 17:22:51.638552,0 days 00:00:00.789294,96.68052495699948,8.502663121153535,sigmoid,1,,,,,,,,,,,,,,,167.0,COMPLETE
5386,0.5903136380931674,2024-04-11 17:22:51.640556,2024-04-11 17:22:52.469202,0 days 00:00:00.828646,98.18521354380391,7.34029219384254,sigmoid,32,13.0,,,,,,,,,,,,,,,COMPLETE
5387,0.4203937119388189,2024-04-11 17:22:52.471380,2024-04-11 17:22:53.797530,0 days 00:00:01.326150,91.51592628929649,6.9890496756228515,sigmoid,61,30.0,24.0,28.0,7.0,7.0,20.0,45.0,17.0,,,,,,,46.0,COMPLETE
5388,0.5986580986580987,2024-04-11 17:22:53.798511,2024-04-11 17:22:54.699805,0 days 00:00:00.901294,94.12400295419258,8.205103579352576,sigmoid,8,,25.0,31.0,,,,,,,,,,,,,COMPLETE
5389,0.12622036262203626,2024-04-11 17:22:54.702784,2024-04-11 17:22:55.624524,0 days 00:00:00.921740,96.65410981257399,7.760266061347142,sigmoid,8,,21.0,29.0,,,,,,,,,,,,,COMPLETE
5390,0.5292514897104756,2024-04-11 17:22:55.626539,2024-04-11 17:22:56.534852,0 days 00:00:00.908313,95.26959726584472,8.81568580301038,sigmoid,33,15.0,,,,,,,,,,,,,,72.0,COMPLETE
5391,0.43783726308514315,2024-04-11 17:22:56.537874,2024-04-11 17:22:58.009860,0 days 00:00:01.471986,98.21551929763504,7.94417964541504,sigmoid,30,,31.0,30.0,2.0,5.0,62.0,38.0,12.0,7.745619278406366,5.130129924712233,8.376359203979435,12.0,41.0,60.0,,COMPLETE
5392,0.5034063943252278,2024-04-11 17:22:58.011861,2024-04-11 17:22:58.912196,0 days 00:00:00.900335,99.98575445122296,8.228953016460276,sigmoid,8,,28.0,36.0,,,,,,,,,,,,,COMPLETE
5393,0.3034310621018515,2024-04-11 17:22:58.914216,2024-04-11 17:23:00.328929,0 days 00:00:01.414713,98.17333325138028,8.451755753142189,rbf,34,42.0,,,,,,,,1.5929282060041396,0.9860191629710942,0.9345284459888301,10.0,38.0,84.0,,COMPLETE
5394,0.4945467792982536,2024-04-11 17:23:00.330934,2024-04-11 17:23:01.382563,0 days 00:00:01.051629,96.64079023012431,7.556420405739694,sigmoid,49,26.0,,,5.0,2.0,42.0,,,,,,,,,125.0,COMPLETE
5395,0.4610146584884084,2024-04-11 17:23:01.384573,2024-04-11 17:23:02.841463,0 days 00:00:01.456890,98.21291769768077,8.049051165445153,sigmoid,27,,27.0,31.0,8.0,4.0,57.0,,,2.392046896692377,5.626067697117064,2.9328747177760985,17.0,47.0,57.0,146.0,COMPLETE
5396,0.41902134272032476,2024-04-11 17:23:02.843044,2024-04-11 17:23:04.036113,0 days 00:00:01.193069,93.97668081737291,2.9031327864222463,sigmoid,53,41.0,,,6.0,8.0,71.0,3.0,41.0,,,,,,,196.0,COMPLETE
5397,0.44808354437583586,2024-04-11 17:23:04.038113,2024-04-11 17:23:04.911239,0 days 00:00:00.873126,98.24344841585157,7.762449490611807,sigmoid,4,,,,,,,29.0,45.0,,,,,,,,COMPLETE
5398,0.3763398458505109,2024-04-11 17:23:04.914219,2024-04-11 17:23:06.112977,0 days 00:00:01.198758,66.97104880938492,8.25487897233649,sigmoid,45,6.0,29.0,32.0,,,,41.0,36.0,,,,,,,160.0,COMPLETE
5399,0.5007439438322406,2024-04-11 17:23:06.115521,2024-04-11 17:23:07.420075,0 days 00:00:01.304554,29.287563393560376,7.951464990151963,sigmoid,19,,,,2.0,6.0,84.0,,,7.178238137585477,8.91426728831003,2.0656820744173263,2.0,27.0,99.0,139.0,COMPLETE
5400,0.4791558425492961,2024-04-11 17:23:07.422086,2024-04-11 17:23:08.428124,0 days 00:00:01.006038,96.59569990851864,8.563052884924602,sigmoid,17,,,,3.0,3.0,9.0,,,,,,,,,129.0,COMPLETE
5401,0.2986293256620695,2024-04-11 17:23:08.429636,2024-04-11 17:23:09.358597,0 days 00:00:00.928961,98.2555512541477,8.075555826716556,sigmoid,5,,,,,,,11.0,24.0,,,,,,,112.0,COMPLETE
5402,0.3786847364476643,2024-04-11 17:23:09.360597,2024-04-11 17:23:10.806970,0 days 00:00:01.446373,94.67460425920842,7.760594225442001,sigmoid,58,48.0,26.0,33.0,4.0,1.0,4.0,,,3.907071554167378,8.144898958955181,6.495171442806458,9.0,21.0,73.0,,COMPLETE
5403,0.45345352376492626,2024-04-11 17:23:10.811010,2024-04-11 17:23:11.702619,0 days 00:00:00.891609,99.96498858733295,8.290832647656089,sigmoid,8,,25.0,30.0,,,,,,,,,,,,,COMPLETE
5404,0.6009432182607054,2024-04-11 17:23:11.704618,2024-04-11 17:23:12.595594,0 days 00:00:00.890976,96.66514710048808,8.11517715808834,sigmoid,8,,23.0,31.0,,,,,,,,,,,,,COMPLETE
5405,0.12622036262203626,2024-04-11 17:23:12.597596,2024-04-11 17:23:13.502335,0 days 00:00:00.904739,92.14502487046761,7.500582431212774,sigmoid,8,,24.0,29.0,,,,,,,,,,,,,COMPLETE
5406,0.4032834945763706,2024-04-11 17:23:13.504339,2024-04-11 17:23:14.641715,0 days 00:00:01.137376,99.95038233203267,7.871071967602909,sigmoid,25,,26.0,32.0,1.0,5.0,17.0,,,,,,,,,16.0,COMPLETE
5407,0.46971916030730493,2024-04-11 17:23:14.643690,2024-04-11 17:23:15.874587,0 days 00:00:01.230897,96.55648309238693,8.377432585669796,sigmoid,18,,,,7.0,4.0,65.0,,,2.061728469574453,9.810480096372476,7.446827276143194,5.0,34.0,62.0,,COMPLETE
5408,0.4569466311960476,2024-04-11 17:23:15.877117,2024-04-11 17:23:17.150090,0 days 00:00:01.272973,98.02569255243131,8.693611870139849,sigmoid,50,33.0,,,3.0,7.0,60.0,,,9.314398760422883,8.531915752611997,3.8272705878388242,8.0,43.0,95.0,,COMPLETE
5409,0.48426326798657393,2024-04-11 17:23:17.152088,2024-04-11 17:23:18.546255,0 days 00:00:01.394167,99.98292147754431,7.988800148303748,sigmoid,51,4.0,,,6.0,3.0,77.0,,,4.965406398373709,1.380498512377308,5.263306469628123,11.0,34.0,67.0,176.0,COMPLETE
5410,0.4935147669648091,2024-04-11 17:23:18.549831,2024-04-11 17:23:19.910493,0 days 00:00:01.360662,95.33065215355364,7.679500884122728,sigmoid,39,20.0,,,,,,17.0,15.0,9.53941026810078,5.361843194775815,5.465588108797764,3.0,32.0,85.0,53.0,COMPLETE
5411,0.3793160801011244,2024-04-11 17:23:19.912503,2024-04-11 17:23:21.264831,0 days 00:00:01.352328,98.18614827382508,7.297345514791348,sigmoid,43,35.0,25.0,35.0,,,,,,0.6753190333355139,2.1926826785293594,4.256608056197978,15.0,25.0,89.0,33.0,COMPLETE
5412,0.4523684975297878,2024-04-11 17:23:21.266831,2024-04-11 17:23:22.727000,0 days 00:00:01.460169,96.61213750373965,8.166972157498147,rbf,8,,24.0,27.0,,,,,,,,,,,,,COMPLETE
5413,0.4448341684562156,2024-04-11 17:23:22.729001,2024-04-11 17:23:23.614538,0 days 00:00:00.885537,47.08986569415959,8.432793042026661,sigmoid,8,,27.0,30.0,,,,,,,,,,,,,COMPLETE
5414,0.39793046842938384,2024-04-11 17:23:23.615529,2024-04-11 17:23:24.942757,0 days 00:00:01.327228,93.77431825359042,7.849451949936887,sigmoid,22,,,,8.0,6.0,96.0,32.0,34.0,2.5540652137975908,9.136457710780093,8.640458303520129,14.0,30.0,51.0,,COMPLETE
5415,0.3034714018976489,2024-04-11 17:23:24.944756,2024-04-11 17:23:26.146401,0 days 00:00:01.201645,96.81811941125984,8.24473455082614,sigmoid,6,,,,,,,36.0,5.0,6.664425754220504,6.677634440115316,3.1774809006429643,20.0,23.0,82.0,,COMPLETE
5416,0.4257782665811261,2024-04-11 17:23:26.148969,2024-04-11 17:23:27.390807,0 days 00:00:01.241838,97.98553697085086,8.032151208351747,sigmoid,29,,25.0,29.0,5.0,8.0,54.0,16.0,26.0,,,,,,,200.0,COMPLETE
5417,0.6009432182607054,2024-04-11 17:23:27.392807,2024-04-11 17:23:28.279882,0 days 00:00:00.887075,98.25582687694026,7.729484325148583,sigmoid,8,,26.0,31.0,,,,,,,,,,,,,COMPLETE
5418,0.4788714981579013,2024-04-11 17:23:28.281415,2024-04-11 17:23:29.628723,0 days 00:00:01.347308,95.25389845225972,8.4959483239513,sigmoid,15,,22.0,33.0,,,,48.0,2.0,1.2641005621611603,9.994651924670958,0.6745742608249241,10.0,37.0,78.0,86.0,COMPLETE
5419,0.4634789442993687,2024-04-11 17:23:29.629718,2024-04-11 17:23:31.058308,0 days 00:00:01.428590,95.24291277586201,8.165401649734319,sigmoid,47,29.0,23.0,32.0,,,,24.0,48.0,3.552568735579288,9.381240236792554,0.5056183664549021,13.0,20.0,64.0,78.0,COMPLETE
5420,0.31113839677249605,2024-04-11 17:23:31.060305,2024-04-11 17:23:32.134072,0 days 00:00:01.073767,90.79282141131588,7.474569775241937,sigmoid,24,,24.0,34.0,4.0,2.0,34.0,,,,,,,,,,COMPLETE
5421,0.5185137677441424,2024-04-11 17:23:32.136071,2024-04-11 17:23:33.326706,0 days 00:00:01.190635,98.29946931380897,7.955115422461405,sigmoid,35,50.0,,,,,,,,7.409666928339796,3.2321580499947675,1.441056649815339,6.0,50.0,70.0,149.0,COMPLETE
5422,0.31457308730540257,2024-04-11 17:23:33.329217,2024-04-11 17:23:34.552887,0 days 00:00:01.223670,98.08556347982154,8.313611345632332,sigmoid,38,39.0,,,,,,40.0,31.0,8.190763376672397,3.8428295419366014,5.047875179130358,17.0,22.0,53.0,,COMPLETE
5423,0.41016328304463895,2024-04-11 17:23:34.554887,2024-04-11 17:23:35.663959,0 days 00:00:01.109072,98.18138013111641,7.870592853879961,sigmoid,21,,,,2.0,2.0,92.0,9.0,39.0,,,,,,,40.0,COMPLETE
5424,0.5963245096172158,2024-04-11 17:23:35.666507,2024-04-11 17:23:36.613188,0 days 00:00:00.946681,93.38958430445592,8.665273673454914,sigmoid,8,,28.0,31.0,,,,,,,,,,,,,COMPLETE
5425,0.4626461507313863,2024-04-11 17:23:36.615748,2024-04-11 17:23:37.848100,0 days 00:00:01.232352,96.61039860734107,7.60069184734291,sigmoid,57,8.0,26.0,30.0,1.0,5.0,87.0,,,,,,,,,133.0,COMPLETE
5426,0.30559575494452484,2024-04-11 17:23:37.850689,2024-04-11 17:23:38.941199,0 days 00:00:01.090510,98.16386694944113,8.102429059367728,sigmoid,3,,,,,,,,,6.162778277499588,7.285071272219729,9.839117826267916,18.0,48.0,94.0,155.0,COMPLETE
5427,0.5963643249384587,2024-04-11 17:23:38.943200,2024-04-11 17:23:39.833144,0 days 00:00:00.889944,95.40951563805153,8.393350525303768,sigmoid,8,,27.0,32.0,,,,,,,,,,,,,COMPLETE
5428,0.12622036262203626,2024-04-11 17:23:39.835163,2024-04-11 17:23:40.748098,0 days 00:00:00.912935,98.20364899352225,7.86388982718591,sigmoid,8,,25.0,29.0,,,,,,,,,,,,,COMPLETE
5429,0.4639268342411092,2024-04-11 17:23:40.750095,2024-04-11 17:23:41.667732,0 days 00:00:00.917637,96.551184142344,8.155207077409267,sigmoid,16,,,,6.0,7.0,100.0,,,,,,,,,,COMPLETE
5430,0.47897677153778306,2024-04-11 17:23:41.670286,2024-04-11 17:23:43.180602,0 days 00:00:01.510316,99.96831894835951,7.698333363231025,rbf,8,,29.0,31.0,,,,,,,,,,,,,COMPLETE
5431,0.4616587131808458,2024-04-11 17:23:43.183230,2024-04-11 17:23:44.750268,0 days 00:00:01.567038,99.94601885363664,4.74605693904908,sigmoid,31,,23.0,28.0,8.0,1.0,49.0,30.0,41.0,8.823944058742939,4.861985788963751,3.3804716542867643,5.0,35.0,92.0,67.0,COMPLETE
5432,0.38121786532862545,2024-04-11 17:23:44.752268,2024-04-11 17:23:45.975210,0 days 00:00:01.222942,99.92037220752822,8.031182641125525,sigmoid,28,,24.0,32.0,7.0,4.0,30.0,13.0,29.0,,,,,,,,COMPLETE
5433,0.33699235871378147,2024-04-11 17:23:45.977799,2024-04-11 17:23:47.303189,0 days 00:00:01.325390,99.96787364976024,8.38643988370514,sigmoid,42,44.0,27.0,31.0,,,,,,0.9854200624640441,6.381689433062929,6.920778397266285,2.0,26.0,91.0,,COMPLETE
5434,0.5940087769509635,2024-04-11 17:23:47.305191,2024-04-11 17:23:48.215929,0 days 00:00:00.910738,93.04220925811057,8.852299604334693,sigmoid,8,,21.0,33.0,,,,,,,,,,,,,COMPLETE
5435,0.2767684858193468,2024-04-11 17:23:48.217930,2024-04-11 17:23:49.246419,0 days 00:00:01.028489,96.44616187113269,8.197759796630363,sigmoid,2,,,,,,,,,4.417282449639994,4.51586984020568,9.160723472603431,4.0,39.0,52.0,,COMPLETE
5436,0.48375629249052887,2024-04-11 17:23:49.249002,2024-04-11 17:23:50.847429,0 days 00:00:01.598427,95.4222878819884,7.130373311720472,sigmoid,63,3.0,25.0,30.0,5.0,3.0,47.0,19.0,27.0,3.1836581663725156,2.6507797839111578,4.687178719015853,12.0,44.0,55.0,117.0,COMPLETE
5437,0.45345352376492626,2024-04-11 17:23:50.850435,2024-04-11 17:23:51.743453,0 days 00:00:00.893018,98.05165267914549,8.596988559744899,sigmoid,8,,26.0,30.0,,,,,,,,,,,,,COMPLETE
5438,0.5952371952371952,2024-04-11 17:23:51.746457,2024-04-11 17:23:52.640212,0 days 00:00:00.893755,96.73867617679716,7.906773158009854,sigmoid,8,,24.0,32.0,,,,,,,,,,,,,COMPLETE
5439,0.5314468085106383,2024-04-11 17:23:52.641756,2024-04-11 17:23:53.622635,0 days 00:00:00.980879,94.3704703732362,7.397765150214328,sigmoid,9,,26.0,31.0,,,,,,,,,,,,102.0,COMPLETE
5440,0.5005530973451326,2024-04-11 17:23:53.624635,2024-04-11 17:23:55.184375,0 days 00:00:01.559740,89.07937494869127,7.72619073616275,sigmoid,62,40.0,25.0,30.0,3.0,6.0,73.0,42.0,18.0,4.74562700374394,3.62737158950314,1.6326307727064417,16.0,31.0,79.0,,COMPLETE
5441,0.38963500835368203,2024-04-11 17:23:55.186371,2024-04-11 17:23:56.573037,0 days 00:00:01.386666,73.96599146264415,8.035258542203529,sigmoid,46,38.0,28.0,33.0,,,,27.0,16.0,4.054359552121527,7.898586962917525,2.771477443420359,7.0,42.0,68.0,,COMPLETE
5442,0.5341146217566343,2024-04-11 17:23:56.574943,2024-04-11 17:23:57.770164,0 days 00:00:01.195221,98.30803640371852,8.281201071508887,sigmoid,10,,27.0,29.0,,,,,,0.500473856698326,0.7110707395072895,2.2228422882370644,19.0,28.0,72.0,,COMPLETE
5443,0.5221115228437659,2024-04-11 17:23:57.772752,2024-04-11 17:23:58.906498,0 days 00:00:01.133746,76.43609817541714,8.496535944691816,sigmoid,20,,,,4.0,8.0,27.0,15.0,19.0,,,,,,,,COMPLETE
5444,0.5495077416836536,2024-04-11 17:23:58.908508,2024-04-11 17:23:59.994635,0 days 00:00:01.086127,99.99478382554096,7.907580458213644,sigmoid,37,17.0,,,,,,46.0,42.0,,,,,,,186.0,COMPLETE
5445,0.36349156885149403,2024-04-11 17:23:59.997217,2024-04-11 17:24:01.316044,0 days 00:00:01.318827,99.98930639628928,8.202870189919052,sigmoid,14,,24.0,31.0,,,,33.0,23.0,7.965341779946319,6.042375584817119,8.175566344097824,13.0,40.0,98.0,,COMPLETE
5446,0.3618773297187394,2024-04-11 17:24:01.318549,2024-04-11 17:24:02.351715,0 days 00:00:01.033166,96.60395190526836,7.590289795211729,sigmoid,41,28.0,22.0,32.0,,,,,,,,,,,,28.0,COMPLETE
5447,0.5906279643331437,2024-04-11 17:24:02.353364,2024-04-11 17:24:03.247486,0 days 00:00:00.894122,98.17236269096922,8.012384302939344,sigmoid,8,,26.0,34.0,,,,,,,,,,,,,COMPLETE
5448,0.45022721836881124,2024-04-11 17:24:03.250442,2024-04-11 17:24:04.237271,0 days 00:00:00.986829,93.65644970592128,8.367269248734992,sigmoid,8,,25.0,28.0,,,,,,,,,,,,,COMPLETE
5449,0.5929369437606513,2024-04-11 17:24:04.239273,2024-04-11 17:24:05.260611,0 days 00:00:01.021338,95.30898868068488,7.781518084920852,sigmoid,8,,23.0,33.0,,,,,,,,,,,,,COMPLETE
5450,0.4281764806475517,2024-04-11 17:24:05.263612,2024-04-11 17:24:06.774337,0 days 00:00:01.510725,98.39607883218633,8.117382254678462,sigmoid,26,,24.0,30.0,1.0,7.0,7.0,,,6.485239556031832,6.205275380489201,8.840537182205523,12.0,29.0,58.0,,COMPLETE
5451,0.3236666148343959,2024-04-11 17:24:06.776345,2024-04-11 17:24:08.168717,0 days 00:00:01.392372,96.5893425758121,8.273166211726942,rbf,52,22.0,,,7.0,5.0,23.0,37.0,33.0,,,,,,,,COMPLETE
5452,0.5174927431851415,2024-04-11 17:24:08.170695,2024-04-11 17:24:09.457527,0 days 00:00:01.286832,92.35650044427925,7.593141822394561,sigmoid,11,,27.0,31.0,,,,,,6.889529099684811,1.9800652195979156,3.633135765100538,6.0,49.0,66.0,108.0,COMPLETE
5453,0.5952371952371952,2024-04-11 17:24:09.459529,2024-04-11 17:24:10.372551,0 days 00:00:00.913022,50.48476402126768,7.894166201270292,sigmoid,8,,25.0,32.0,,,,,,,,,,,,,COMPLETE
5454,0.4328815845955725,2024-04-11 17:24:10.374548,2024-04-11 17:24:11.958012,0 days 00:00:01.583464,26.084176159929797,8.615354527640454,sigmoid,59,46.0,26.0,30.0,2.0,2.0,81.0,,,1.4980954230776735,1.6197726357674824,5.879782661515748,10.0,41.0,81.0,120.0,COMPLETE
5455,0.6009432182607054,2024-04-11 17:24:11.960967,2024-04-11 17:24:12.908794,0 days 00:00:00.947827,98.25104946084299,8.07213152235499,sigmoid,8,,23.0,31.0,,,,,,,,,,,,,COMPLETE
5456,0.40547331456422364,2024-04-11 17:24:12.910834,2024-04-11 17:24:14.392559,0 days 00:00:01.481725,98.31857094735584,8.374548801110203,sigmoid,55,18.0,,,8.0,1.0,2.0,23.0,43.0,5.342077544788592,4.241761496856539,9.471807276511221,15.0,36.0,77.0,95.0,COMPLETE
5457,0.4868045049588166,2024-04-11 17:24:14.394558,2024-04-11 17:24:15.590370,0 days 00:00:01.195812,95.08286996985035,7.763558082812526,sigmoid,56,24.0,28.0,29.0,5.0,5.0,40.0,,,,,,,,,,COMPLETE
5458,0.20292354792807554,2024-04-11 17:24:15.592336,2024-04-11 17:24:16.648379,0 days 00:00:01.056043,96.8024848557023,8.14540072611924,sigmoid,48,16.0,,,3.0,3.0,19.0,,,,,,,,,,COMPLETE
5459,0.3276683784682454,2024-04-11 17:24:16.650355,2024-04-11 17:24:17.686300,0 days 00:00:01.035945,96.8571327350835,8.949550755166602,sigmoid,12,,25.0,32.0,,,,44.0,13.0,,,,,,,,COMPLETE
5460,0.4969114619080302,2024-04-11 17:24:17.688313,2024-04-11 17:24:18.826717,0 days 00:00:01.138404,99.93308998565402,7.948762390702926,sigmoid,44,26.0,27.0,33.0,,,,35.0,7.0,,,,,,,,COMPLETE
5461,0.5379542249701703,2024-04-11 17:24:18.828701,2024-04-11 17:24:19.934126,0 days 00:00:01.105425,98.26319252124648,7.40409805051063,sigmoid,13,,24.0,30.0,,,,20.0,49.0,,,,,,,170.0,COMPLETE
5462,0.5986314388899449,2024-04-11 17:24:19.936125,2024-04-11 17:24:20.867372,0 days 00:00:00.931247,99.95962481447111,8.539172619211467,sigmoid,8,,26.0,31.0,,,,,,,,,,,,,COMPLETE
5463,0.47744425176464844,2024-04-11 17:24:20.869984,2024-04-11 17:24:22.137706,0 days 00:00:01.267722,54.45958845360316,8.260466271502159,sigmoid,60,34.0,25.0,34.0,6.0,4.0,36.0,8.0,37.0,,,,,,,,COMPLETE
5464,0.4151125595992516,2024-04-11 17:24:22.139707,2024-04-11 17:24:23.556774,0 days 00:00:01.417067,94.71476505445483,7.693118710399503,sigmoid,23,,,,4.0,6.0,67.0,49.0,30.0,2.816941944153966,1.152315887879678,2.480402669672008,8.0,21.0,90.0,59.0,COMPLETE
5465,0.12622036262203626,2024-04-11 17:24:23.559770,2024-04-11 17:24:24.490343,0 days 00:00:00.930573,96.37693110126051,8.014121083098793,sigmoid,8,,23.0,29.0,,,,,,,,,,,,,COMPLETE
5466,0.5711081543432807,2024-04-11 17:24:24.492374,2024-04-11 17:24:25.438500,0 days 00:00:00.946126,99.92981630947304,7.85053811885823,sigmoid,36,43.0,,,,,,25.0,17.0,,,,,,,,COMPLETE
5467,0.38738220731512535,2024-04-11 17:24:25.440500,2024-04-11 17:24:26.904356,0 days 00:00:01.463856,96.61385355055978,8.341319979589208,sigmoid,54,5.0,,,2.0,1.0,15.0,3.0,12.0,1.9227019181703082,5.696630489105117,7.761615814627557,9.0,33.0,61.0,,COMPLETE
5468,0.2668154824579876,2024-04-11 17:24:26.906361,2024-04-11 17:24:28.376375,0 days 00:00:01.470014,99.94696993448073,8.172358401544178,rbf,7,,,,,,,38.0,40.0,9.986613196613462,7.547959663608021,6.314803912646987,4.0,45.0,65.0,75.0,COMPLETE
5469,0.5931679318644695,2024-04-11 17:24:28.379525,2024-04-11 17:24:29.319309,0 days 00:00:00.939784,91.30440664640389,7.525122623118928,sigmoid,8,,27.0,27.0,,,,,,,,,,,,,COMPLETE
5470,0.47473647745830644,2024-04-11 17:24:29.321309,2024-04-11 17:24:30.786819,0 days 00:00:01.465510,98.18954832867657,8.489796244821834,sigmoid,27,,29.0,16.0,1.0,8.0,52.0,,,8.655016034875098,2.419822345346181,1.2369133799118268,16.0,43.0,59.0,192.0,COMPLETE
5471,0.38568913869244315,2024-04-11 17:24:30.789407,2024-04-11 17:24:32.294070,0 days 00:00:01.504663,94.60275607642133,8.006066652118047,sigmoid,30,,25.0,32.0,6.0,4.0,43.0,47.0,45.0,5.6092511228007975,8.728587832997846,6.6440276552899125,14.0,38.0,74.0,,COMPLETE
5472,0.37106107198359956,2024-04-11 17:24:32.296068,2024-04-11 17:24:33.085099,0 days 00:00:00.789031,99.99814150610435,8.783654741271583,sigmoid,1,,,,,,,,,,,,,,,82.0,COMPLETE
5473,0.5141818982602951,2024-04-11 17:24:33.087140,2024-04-11 17:24:34.061334,0 days 00:00:00.974194,98.23958981520835,7.811997337659186,sigmoid,40,12.0,24.0,31.0,,,,,,,,,,,,,COMPLETE
5474,0.44701971028259324,2024-04-11 17:24:34.063329,2024-04-11 17:24:34.986910,0 days 00:00:00.923581,99.94706120737544,8.18767956952489,sigmoid,8,,28.0,30.0,,,,,,,,,,,,,COMPLETE
5475,0.5952371952371952,2024-04-11 17:24:34.988888,2024-04-11 17:24:35.914642,0 days 00:00:00.925754,96.58975869305614,8.03485457806889,sigmoid,8,,26.0,32.0,,,,,,,,,,,,,COMPLETE
5476,0.4283490066637604,2024-04-11 17:24:35.916620,2024-04-11 17:24:37.257808,0 days 00:00:01.341188,93.4486015831766,7.257287603139767,sigmoid,61,10.0,23.0,29.0,7.0,6.0,25.0,7.0,35.0,,,,,,,165.0,COMPLETE
5477,0.5776845855523185,2024-04-11 17:24:37.260368,2024-04-11 17:24:38.102963,0 days 00:00:00.842595,98.24110019686262,7.6480465861075,sigmoid,32,19.0,,,,,,,,,,,,,,,COMPLETE
5478,0.25235791027638804,2024-04-11 17:24:38.105568,2024-04-11 17:24:39.204478,0 days 00:00:01.098910,95.16084011042209,8.388266133254843,sigmoid,34,25.0,,,,,,,,5.061822248585795,8.308325874441692,3.9799362211067812,20.0,46.0,57.0,,COMPLETE
5479,0.5929369437606513,2024-04-11 17:24:39.206478,2024-04-11 17:24:40.141335,0 days 00:00:00.934857,99.98714100317241,7.84434391036218,sigmoid,8,,26.0,33.0,,,,,,,,,,,,,COMPLETE
5480,0.2958259994971084,2024-04-11 17:24:40.143344,2024-04-11 17:24:41.025703,0 days 00:00:00.882359,99.98728962453315,8.142954140859002,sigmoid,33,14.0,,,,,,,,,,,,,,90.0,COMPLETE
5481,0.5403091184037393,2024-04-11 17:24:41.027702,2024-04-11 17:24:41.968074,0 days 00:00:00.940372,96.7110978215394,8.599467128072348,sigmoid,5,,,,,,,5.0,25.0,,,,,,,105.0,COMPLETE
5482,0.49789575153410304,2024-04-11 17:24:41.970070,2024-04-11 17:24:43.137439,0 days 00:00:01.167369,96.77832190743024,8.278474631941686,sigmoid,45,31.0,24.0,31.0,,,,39.0,4.0,,,,,,,180.0,COMPLETE
5483,0.4688505717051728,2024-04-11 17:24:43.139445,2024-04-11 17:24:44.398745,0 days 00:00:01.259300,98.05800270274038,7.956362592588921,sigmoid,53,2.0,,,3.0,7.0,64.0,12.0,38.0,,,,,,,37.0,COMPLETE
5484,0.5069140556625241,2024-04-11 17:24:44.401288,2024-04-11 17:24:45.313526,0 days 00:00:00.912238,93.96846749688731,7.57575424607305,sigmoid,8,,27.0,35.0,,,,,,,,,,,,,COMPLETE
5485,0.45345352376492626,2024-04-11 17:24:45.315522,2024-04-11 17:24:46.238344,0 days 00:00:00.922822,98.29177166912584,9.207915238928658,sigmoid,8,,25.0,30.0,,,,,,,,,,,,,COMPLETE
5486,0.476743489973062,2024-04-11 17:24:46.240879,2024-04-11 17:24:47.784168,0 days 00:00:01.543289,99.96970921219189,8.414575595170437,rbf,8,,22.0,31.0,,,,,,,,,,,,,COMPLETE
