number,value,datetime_start,datetime_complete,duration,params_C,params_gamma,params_kernel,params_mask_number,params_rsi_window,params_so_smooth,params_so_window,params_srsi_smooth1,params_srsi_smooth2,params_srsi_window,params_tsi_window_fast,params_tsi_window_slow,params_ult_weight_1,params_ult_weight_2,params_ult_weight_3,params_ult_window_1,params_ult_window_2,params_ult_window_3,params_williams_lbp,state
1996,0.4872504299708368,2024-04-11 16:20:09.590229,2024-04-11 16:20:10.275282,0 days 00:00:00.685053,98.28429677623257,7.482371876765592,sigmoid,53,3.0,,,1.0,1.0,61.0,21.0,18.0,,,,,,,63.0,COMPLETE
1997,0.12622036262203626,2024-04-11 16:20:10.277418,2024-04-11 16:20:10.824143,0 days 00:00:00.546725,94.58597513598197,8.022960197083417,sigmoid,8,,22.0,29.0,,,,,,,,,,,,,COMPLETE
1998,0.4167146310579026,2024-04-11 16:20:10.826143,2024-04-11 16:20:11.541528,0 days 00:00:00.715385,98.25982824587703,7.768589997391519,sigmoid,25,,25.0,30.0,6.0,3.0,21.0,,,,,,,,,50.0,COMPLETE
1999,0.4092923689209154,2024-04-11 16:20:11.543639,2024-04-11 16:20:12.335935,0 days 00:00:00.792296,99.87933492136067,8.220246030154915,sigmoid,43,31.0,26.0,32.0,,,,,,1.9040775489839534,3.2422481271283075,8.339437446667427,11.0,35.0,56.0,42.0,COMPLETE
2000,0.5906279643331437,2024-04-11 16:20:12.337937,2024-04-11 16:20:12.974035,0 days 00:00:00.636098,99.89525385672403,7.956975504303203,sigmoid,8,,23.0,34.0,,,,,,,,,,,,,COMPLETE
2001,0.5312270706547543,2024-04-11 16:20:12.976204,2024-04-11 16:20:13.813875,0 days 00:00:00.837671,96.32173206351457,7.643235748576768,sigmoid,29,,25.0,31.0,3.0,6.0,7.0,36.0,10.0,,,,,,,114.0,COMPLETE
2002,0.3436626782259798,2024-04-11 16:20:13.814874,2024-04-11 16:20:14.561258,0 days 00:00:00.746384,96.31674725758775,8.406745363517048,sigmoid,39,33.0,,,,,,24.0,5.0,7.453983256988151,5.607407196366101,1.407458937741569,15.0,50.0,99.0,181.0,COMPLETE
2003,0.19584328930165454,2024-04-11 16:20:14.562322,2024-04-11 16:20:15.292629,0 days 00:00:00.730307,99.99053569540892,8.104309732461983,sigmoid,6,,,,,,,28.0,15.0,5.520970378958646,0.8284359828732164,8.824844648261912,9.0,34.0,90.0,,COMPLETE
2004,0.4941363593201026,2024-04-11 16:20:15.294630,2024-04-11 16:20:15.929122,0 days 00:00:00.634492,98.35836058340446,8.607941010108318,sigmoid,24,,28.0,29.0,2.0,5.0,38.0,,,,,,,,,,COMPLETE
2005,0.16073760643577287,2024-04-11 16:20:15.931178,2024-04-11 16:20:17.088026,0 days 00:00:01.156848,78.02392862482107,7.876663255456263,rbf,47,21.0,24.0,31.0,,,,7.0,29.0,0.9360070799130558,4.4758508965439985,5.798160564255785,14.0,32.0,71.0,80.0,COMPLETE
2006,0.5929369437606513,2024-04-11 16:20:17.090027,2024-04-11 16:20:17.630254,0 days 00:00:00.540227,99.97503318418609,8.259233978664925,sigmoid,8,,27.0,33.0,,,,,,,,,,,,,COMPLETE
2007,0.44701971028259324,2024-04-11 16:20:17.631325,2024-04-11 16:20:18.251378,0 days 00:00:00.620053,94.95272759608262,8.040298804952489,sigmoid,8,,26.0,30.0,,,,,,,,,,,,,COMPLETE
2008,0.5964036904537752,2024-04-11 16:20:18.252379,2024-04-11 16:20:18.794751,0 days 00:00:00.542372,96.92623164272723,7.288494409589865,sigmoid,8,,24.0,31.0,,,,,,,,,,,,,COMPLETE
2009,0.4675311256909645,2024-04-11 16:20:18.796774,2024-04-11 16:20:19.612026,0 days 00:00:00.815252,98.23118764360397,7.755764629294914,sigmoid,22,,,,8.0,2.0,95.0,49.0,11.0,8.755940749684653,2.4766715836941504,4.477333101607721,20.0,21.0,58.0,,COMPLETE
2010,0.421605106331488,2024-04-11 16:20:19.614175,2024-04-11 16:20:20.334046,0 days 00:00:00.719871,94.71198760210956,8.354792960170839,sigmoid,57,16.0,26.0,28.0,7.0,8.0,70.0,,,,,,,,,121.0,COMPLETE
2011,0.49757584845304137,2024-04-11 16:20:20.336048,2024-04-11 16:20:21.007625,0 days 00:00:00.671577,99.97831486277886,7.5209846784089756,sigmoid,21,,,,1.0,7.0,10.0,10.0,32.0,,,,,,,190.0,COMPLETE
2012,0.4773666725838764,2024-04-11 16:20:21.009144,2024-04-11 16:20:21.883303,0 days 00:00:00.874159,96.80351700263213,8.121702402960803,sigmoid,31,,25.0,32.0,5.0,4.0,90.0,38.0,16.0,1.6064782810184726,6.2164372148341975,6.531682375060152,8.0,27.0,66.0,33.0,COMPLETE
2013,0.4044150504960229,2024-04-11 16:20:21.884360,2024-04-11 16:20:22.706332,0 days 00:00:00.821972,99.97367908077962,7.917756777076719,sigmoid,15,,22.0,30.0,,,,17.0,38.0,8.302648589898393,4.07067032244196,5.063963470828302,19.0,24.0,55.0,24.0,COMPLETE
2014,0.3604318054779206,2024-04-11 16:20:22.708331,2024-04-11 16:20:23.398543,0 days 00:00:00.690212,99.98099520593802,8.76764393246745,sigmoid,35,47.0,,,,,,,,5.095428366516691,5.076479627747963,8.224903390584103,16.0,43.0,69.0,54.0,COMPLETE
2015,0.5929369437606513,2024-04-11 16:20:23.400766,2024-04-11 16:20:23.937899,0 days 00:00:00.537133,94.51605174484133,8.204830512824756,sigmoid,8,,28.0,33.0,,,,,,,,,,,,,COMPLETE
2016,0.5963643249384587,2024-04-11 16:20:23.938955,2024-04-11 16:20:24.527500,0 days 00:00:00.588545,99.97113382360158,8.48908594177799,sigmoid,8,,23.0,32.0,,,,,,,,,,,,,COMPLETE
2017,0.5237446808510638,2024-04-11 16:20:24.528659,2024-04-11 16:20:25.192706,0 days 00:00:00.664047,98.16761229505845,7.897520117352188,sigmoid,3,,,,,,,,,9.785971604243658,1.557259986410929,1.2371091215444983,11.0,45.0,96.0,101.0,COMPLETE
2018,0.4003834242737059,2024-04-11 16:20:25.194707,2024-04-11 16:20:25.976367,0 days 00:00:00.781660,96.75985496708546,7.6220774303784715,sigmoid,28,,24.0,35.0,4.0,1.0,24.0,13.0,49.0,,,,,,,,COMPLETE
2019,0.3729437595000844,2024-04-11 16:20:25.978421,2024-04-11 16:20:26.716446,0 days 00:00:00.738025,96.44236521474075,7.029504000067539,sigmoid,42,7.0,27.0,30.0,,,,,,4.811592419205721,1.8597525919265787,8.02075663523056,17.0,22.0,60.0,,COMPLETE
2020,0.35858678504604313,2024-04-11 16:20:26.718445,2024-04-11 16:20:27.296517,0 days 00:00:00.578072,99.97700216651491,8.054227808018073,sigmoid,9,,25.0,31.0,,,,,,,,,,,,136.0,COMPLETE
2021,0.12622036262203626,2024-04-11 16:20:27.297519,2024-04-11 16:20:27.831146,0 days 00:00:00.533627,98.21369303701698,8.27969913486865,sigmoid,8,,30.0,29.0,,,,,,,,,,,,,COMPLETE
2022,0.5952371952371952,2024-04-11 16:20:27.833155,2024-04-11 16:20:28.391919,0 days 00:00:00.558764,99.97400687806241,7.777033127535538,sigmoid,8,,26.0,32.0,,,,,,,,,,,,,COMPLETE
2023,0.459074119674957,2024-04-11 16:20:28.392986,2024-04-11 16:20:28.991164,0 days 00:00:00.598178,94.63724539597676,8.037492931908671,sigmoid,16,,,,2.0,3.0,17.0,,,,,,,,,,COMPLETE
2024,0.35282651072124754,2024-04-11 16:20:28.993177,2024-04-11 16:20:29.779038,0 days 00:00:00.785861,99.99098313249908,8.417649923244026,sigmoid,14,,25.0,31.0,,,,33.0,12.0,6.004456390917381,3.7826818855026496,9.790819068244163,18.0,41.0,53.0,,COMPLETE
2025,0.022054343852808578,2024-04-11 16:20:29.780037,2024-04-11 16:20:31.015384,0 days 00:00:01.235347,96.85886666913396,7.391605901330217,rbf,63,14.0,24.0,29.0,8.0,5.0,64.0,14.0,44.0,6.866144575749371,2.7999634196981793,7.229797509286629,12.0,49.0,100.0,167.0,COMPLETE
2026,0.47679938534149213,2024-04-11 16:20:31.017383,2024-04-11 16:20:31.713540,0 days 00:00:00.696157,96.65836054974042,8.169430881650333,sigmoid,10,,27.0,33.0,,,,,,4.131206559330232,6.531730638663932,6.119755000006771,14.0,20.0,82.0,,COMPLETE
2027,0.5107358582073102,2024-04-11 16:20:31.714543,2024-04-11 16:20:32.438602,0 days 00:00:00.724059,98.16530911690928,8.621980982395401,sigmoid,38,43.0,,,,,,46.0,22.0,3.3062607118996556,5.916336233629989,7.558721153025708,20.0,31.0,88.0,,COMPLETE
2028,0.44701971028259324,2024-04-11 16:20:32.440668,2024-04-11 16:20:32.996911,0 days 00:00:00.556243,95.03710540378893,7.854568362446183,sigmoid,8,,26.0,30.0,,,,,,,,,,,,,COMPLETE
2029,0.35572863590042214,2024-04-11 16:20:32.999094,2024-04-11 16:20:33.612855,0 days 00:00:00.613761,98.15057497689992,7.699411213226663,sigmoid,41,35.0,23.0,31.0,,,,,,,,,,,,157.0,COMPLETE
2030,0.5931679318644695,2024-04-11 16:20:33.614928,2024-04-11 16:20:34.270817,0 days 00:00:00.655889,96.57308053918172,8.329452522363502,sigmoid,8,,25.0,27.0,,,,,,,,,,,,,COMPLETE
2031,0.36864681376330816,2024-04-11 16:20:34.272031,2024-04-11 16:20:35.095606,0 days 00:00:00.823575,98.16223423760266,7.988687800484805,sigmoid,26,,29.0,32.0,7.0,6.0,30.0,,,7.26306411875247,4.2978904835098275,5.426356402380874,13.0,33.0,63.0,,COMPLETE
2032,0.449215640365254,2024-04-11 16:20:35.097782,2024-04-11 16:20:35.652369,0 days 00:00:00.554587,94.74786945191964,6.1154137516311495,sigmoid,8,,27.0,30.0,,,,,,,,,,,,,COMPLETE
2033,0.5986580986580987,2024-04-11 16:20:35.654591,2024-04-11 16:20:36.193991,0 days 00:00:00.539400,98.271403846693,8.178817553946653,sigmoid,8,,21.0,31.0,,,,,,,,,,,,,COMPLETE
2034,0.4951273722003761,2024-04-11 16:20:36.196059,2024-04-11 16:20:37.107960,0 days 00:00:00.911901,96.66173890176242,7.902646254575546,sigmoid,46,46.0,28.0,34.0,,,,9.0,21.0,6.655177150425814,2.5993969647800306,1.7641961697283075,10.0,44.0,78.0,,COMPLETE
2035,0.4618347254651806,2024-04-11 16:20:37.109960,2024-04-11 16:20:38.037127,0 days 00:00:00.927167,98.12472671150368,8.511786442171138,sigmoid,62,17.0,24.0,32.0,6.0,8.0,36.0,44.0,26.0,2.8953856170308767,2.0706323745959723,8.666078861413318,9.0,47.0,70.0,,COMPLETE
2036,0.3983650369438767,2024-04-11 16:20:38.039176,2024-04-11 16:20:38.780038,0 days 00:00:00.740862,94.9428497147666,7.583997527677307,sigmoid,11,,25.0,29.0,,,,,,4.501443107578988,0.6998990617358691,1.0229154393956197,12.0,28.0,52.0,66.0,COMPLETE
2037,0.4151125595992516,2024-04-11 16:20:38.781108,2024-04-11 16:20:39.413564,0 days 00:00:00.632456,98.30388134836298,8.132198626002307,sigmoid,20,,,,4.0,7.0,67.0,22.0,50.0,,,,,,,,COMPLETE
2038,0.12003789673140693,2024-04-11 16:20:39.415560,2024-04-11 16:20:39.998854,0 days 00:00:00.583294,96.35693928525083,8.33228816796409,sigmoid,8,,26.0,28.0,,,,,,,,,,,,,COMPLETE
2039,0.4680320366132723,2024-04-11 16:20:40.001018,2024-04-11 16:20:40.678957,0 days 00:00:00.677939,94.59264145332466,7.830285087090566,sigmoid,56,5.0,23.0,30.0,5.0,1.0,51.0,,,,,,,,,,COMPLETE
2040,0.5929369437606513,2024-04-11 16:20:40.680959,2024-04-11 16:20:41.223166,0 days 00:00:00.542207,98.16244672827867,7.999878609836212,sigmoid,8,,26.0,33.0,,,,,,,,,,,,,COMPLETE
2041,0.5137504730667339,2024-04-11 16:20:41.224167,2024-04-11 16:20:41.902348,0 days 00:00:00.678181,98.26297321197495,8.261361687934823,sigmoid,37,37.0,,,,,,8.0,43.0,,,,,,,89.0,COMPLETE
2042,0.5975614331269932,2024-04-11 16:20:41.904349,2024-04-11 16:20:42.457598,0 days 00:00:00.553249,96.73819045033525,6.737331398339683,sigmoid,8,,24.0,32.0,,,,,,,,,,,,,COMPLETE
2043,0.4453763725360497,2024-04-11 16:20:42.458782,2024-04-11 16:20:43.315794,0 days 00:00:00.857012,99.89666568580324,7.652492532872567,sigmoid,59,25.0,25.0,31.0,3.0,2.0,77.0,,,2.088866160315132,6.367532156525673,3.484616236247329,16.0,37.0,86.0,60.0,COMPLETE
2044,0.09989513770075611,2024-04-11 16:20:43.317845,2024-04-11 16:20:44.509745,0 days 00:00:01.191900,6.5749315381656,8.714570765771363,rbf,55,23.0,,,1.0,4.0,42.0,19.0,23.0,6.226393912999335,3.0454861432650424,5.939044913983096,11.0,26.0,92.0,108.0,COMPLETE
2045,0.4600580973129993,2024-04-11 16:20:44.511862,2024-04-11 16:20:45.178147,0 days 00:00:00.666285,98.23350045286074,8.055864589449717,sigmoid,48,15.0,,,7.0,5.0,14.0,,,,,,,,,,COMPLETE
2046,0.3967154791779169,2024-04-11 16:20:45.179150,2024-04-11 16:20:45.832939,0 days 00:00:00.653789,96.38915557153423,8.431053099575756,sigmoid,52,9.0,,,6.0,7.0,46.0,3.0,33.0,,,,,,,,COMPLETE
2047,0.5952371952371952,2024-04-11 16:20:45.834345,2024-04-11 16:20:46.384030,0 days 00:00:00.549685,98.43270502108878,7.412508750559432,sigmoid,8,,28.0,32.0,,,,,,,,,,,,,COMPLETE
2048,0.46414095458681454,2024-04-11 16:20:46.385027,2024-04-11 16:20:47.159102,0 days 00:00:00.774075,94.43398391273112,7.719972159982834,sigmoid,12,,27.0,30.0,,,,48.0,4.0,,,,,,,,COMPLETE
2049,0.36387488074144747,2024-04-11 16:20:47.161102,2024-04-11 16:20:47.908647,0 days 00:00:00.747545,96.4261335733573,8.16426098993828,sigmoid,13,,22.0,31.0,,,,15.0,34.0,,,,,,,38.0,COMPLETE
2050,0.5929369437606513,2024-04-11 16:20:47.910666,2024-04-11 16:20:48.450862,0 days 00:00:00.540196,99.99573419805398,7.893392806723874,sigmoid,8,,24.0,33.0,,,,,,,,,,,,,COMPLETE
2051,0.12622036262203626,2024-04-11 16:20:48.452044,2024-04-11 16:20:48.998232,0 days 00:00:00.546188,98.27787356102284,8.545160716152107,sigmoid,8,,26.0,29.0,,,,,,,,,,,,,COMPLETE
2052,0.3373432734666215,2024-04-11 16:20:48.999435,2024-04-11 16:20:49.672539,0 days 00:00:00.673104,71.86201864548184,8.295201680390745,sigmoid,44,26.0,23.0,31.0,,,,26.0,3.0,,,,,,,,COMPLETE
2053,0.5328967133329328,2024-04-11 16:20:49.674743,2024-04-11 16:20:50.301943,0 days 00:00:00.627200,99.98857278670285,8.020087942733461,sigmoid,36,42.0,,,,,,2.0,45.0,,,,,,,,COMPLETE
2054,0.5357689919271372,2024-04-11 16:20:50.302943,2024-04-11 16:20:50.891614,0 days 00:00:00.588671,96.47897181719352,7.720675475901904,sigmoid,40,32.0,25.0,34.0,,,,,,,,,,,,,COMPLETE
2055,0.5086377666190629,2024-04-11 16:20:50.892614,2024-04-11 16:20:51.605370,0 days 00:00:00.712756,99.94084903165228,8.133867738390768,sigmoid,7,,,,,,,37.0,48.0,5.723107549854285,1.7500552851731852,9.24709954869471,15.0,39.0,80.0,176.0,COMPLETE
2056,0.44701971028259324,2024-04-11 16:20:51.607370,2024-04-11 16:20:52.158152,0 days 00:00:00.550782,94.75256022986828,7.8923112849458406,sigmoid,8,,27.0,30.0,,,,,,,,,,,,,COMPLETE
2057,0.37679349218549835,2024-04-11 16:20:52.160152,2024-04-11 16:20:53.022827,0 days 00:00:00.862675,99.93046857726205,7.216415964631516,sigmoid,54,38.0,,,3.0,6.0,27.0,34.0,7.0,8.965645651302669,3.4307111659582272,6.7985501104278985,17.0,38.0,74.0,,COMPLETE
2058,0.4695071471935538,2024-04-11 16:20:53.024838,2024-04-11 16:20:53.930366,0 days 00:00:00.905528,98.07902296257332,8.974266446696573,sigmoid,27,,24.0,32.0,2.0,2.0,59.0,,,1.2785079451656767,5.4258213824455055,6.986466657240215,19.0,30.0,76.0,131.0,COMPLETE
2059,0.12622036262203626,2024-04-11 16:20:53.931451,2024-04-11 16:20:54.469685,0 days 00:00:00.538234,96.69438039210972,7.507829807306308,sigmoid,8,,26.0,29.0,,,,,,,,,,,,,COMPLETE
2060,0.4289956880550558,2024-04-11 16:20:54.471688,2024-04-11 16:20:55.252626,0 days 00:00:00.780938,10.689699177986476,8.345318943650291,sigmoid,60,18.0,23.0,31.0,8.0,3.0,55.0,41.0,29.0,,,,,,,,COMPLETE
2061,0.44701971028259324,2024-04-11 16:20:55.254627,2024-04-11 16:20:55.815647,0 days 00:00:00.561020,94.41562222300712,8.022122711419545,sigmoid,8,,25.0,30.0,,,,,,,,,,,,,COMPLETE
2062,0.2205810665886712,2024-04-11 16:20:55.816648,2024-04-11 16:20:56.752653,0 days 00:00:00.936005,16.691491145353964,8.56854534056866,rbf,5,,,,,,,30.0,35.0,,,,,,,185.0,COMPLETE
2063,0.5624266074106191,2024-04-11 16:20:56.754650,2024-04-11 16:20:57.276378,0 days 00:00:00.521728,98.22469754932425,8.212897003428052,sigmoid,32,6.0,,,,,,,,,,,,,,,COMPLETE
2064,0.5474894131881428,2024-04-11 16:20:57.277372,2024-04-11 16:20:57.848922,0 days 00:00:00.571550,99.95326220364676,7.787416403708941,sigmoid,33,3.0,,,,,,,,,,,,,,72.0,COMPLETE
2065,0.5014753913729023,2024-04-11 16:20:57.849923,2024-04-11 16:20:58.672562,0 days 00:00:00.822639,96.44576922663612,8.395157384867186,sigmoid,61,39.0,29.0,33.0,4.0,5.0,4.0,20.0,8.0,,,,,,,153.0,COMPLETE
2066,0.4326295467778016,2024-04-11 16:20:58.673563,2024-04-11 16:20:59.495703,0 days 00:00:00.822140,94.80819086543532,7.973308246270674,sigmoid,23,,,,5.0,1.0,82.0,32.0,31.0,0.7027751322915661,6.832146151202284,4.066935663462331,8.0,23.0,65.0,197.0,COMPLETE
2067,0.4763609635811836,2024-04-11 16:20:59.497703,2024-04-11 16:21:00.384632,0 days 00:00:00.886929,98.02708715406682,8.182378898259214,sigmoid,30,,27.0,31.0,1.0,8.0,72.0,23.0,37.0,5.308472186299181,4.652540164565865,8.98101642446315,14.0,35.0,51.0,,COMPLETE
2068,0.5931679318644695,2024-04-11 16:21:00.386831,2024-04-11 16:21:00.950479,0 days 00:00:00.563648,96.73983742231742,7.580826093372405,sigmoid,8,,25.0,27.0,,,,,,,,,,,,,COMPLETE
2069,0.48038801202555426,2024-04-11 16:21:00.951580,2024-04-11 16:21:01.655649,0 days 00:00:00.704069,98.18185710457857,7.831963981421645,sigmoid,45,21.0,26.0,32.0,,,,6.0,18.0,,,,,,,148.0,COMPLETE
2070,0.44701971028259324,2024-04-11 16:21:01.657675,2024-04-11 16:21:02.209379,0 days 00:00:00.551704,99.93375970784719,8.065717120299157,sigmoid,8,,28.0,30.0,,,,,,,,,,,,,COMPLETE
2071,0.17165695705188996,2024-04-11 16:21:02.211449,2024-04-11 16:21:02.741122,0 days 00:00:00.529673,96.51090186778494,8.394400189509364,sigmoid,4,,,,,,,42.0,40.0,,,,,,,,COMPLETE
2072,0.45952045133991537,2024-04-11 16:21:02.742129,2024-04-11 16:21:03.580770,0 days 00:00:00.838641,13.57734145256579,8.783962308897399,sigmoid,51,50.0,,,7.0,4.0,80.0,,,3.868398896344674,5.74688907651574,5.685441642180262,10.0,48.0,75.0,98.0,COMPLETE
2073,0.45347172512526845,2024-04-11 16:21:03.582933,2024-04-11 16:21:04.213363,0 days 00:00:00.630430,94.71288370270194,7.884136045439826,sigmoid,8,,21.0,28.0,,,,,,,,,,,,,COMPLETE
2074,0.4389179285444845,2024-04-11 16:21:04.214471,2024-04-11 16:21:04.902330,0 days 00:00:00.687859,98.10482443148204,8.237231830415144,sigmoid,53,23.0,,,8.0,6.0,86.0,12.0,24.0,,,,,,,82.0,COMPLETE
2075,0.404211197958207,2024-04-11 16:21:04.904331,2024-04-11 16:21:05.522154,0 days 00:00:00.617823,99.99746159669243,8.581844606373227,sigmoid,17,,,,2.0,8.0,94.0,,,,,,,,,139.0,COMPLETE
2076,0.5941143180531975,2024-04-11 16:21:05.524242,2024-04-11 16:21:06.071641,0 days 00:00:00.547399,98.0934465090095,7.393576823289581,sigmoid,8,,24.0,31.0,,,,,,,,,,,,,COMPLETE
2077,0.34783473045956065,2024-04-11 16:21:06.072641,2024-04-11 16:21:06.847633,0 days 00:00:00.774992,96.32879977454077,7.7193048301882765,sigmoid,19,,,,6.0,3.0,20.0,,,8.503151795680347,1.04791156702741,8.443165839213165,15.0,29.0,93.0,15.0,COMPLETE
2078,0.41513761467889904,2024-04-11 16:21:06.848807,2024-04-11 16:21:07.720870,0 days 00:00:00.872063,99.99480842675557,8.068326933892845,sigmoid,58,4.0,30.0,33.0,4.0,4.0,39.0,,,9.597922136397369,1.4115394370175265,9.976446562235715,18.0,34.0,68.0,,COMPLETE
2079,0.32526497231085194,2024-04-11 16:21:07.721872,2024-04-11 16:21:08.464231,0 days 00:00:00.742359,94.47696417214105,8.274521793230585,sigmoid,6,,,,,,,10.0,6.0,8.052146171957483,5.142908493607158,2.966499153932641,9.0,46.0,50.0,,COMPLETE
2080,0.4630108791531903,2024-04-11 16:21:08.465462,2024-04-11 16:21:09.713104,0 days 00:00:01.247642,67.7303406411666,7.97882767728579,rbf,8,,26.0,32.0,,,,,,,,,,,,,COMPLETE
2081,0.3318524786686412,2024-04-11 16:21:09.714533,2024-04-11 16:21:10.592640,0 days 00:00:00.878107,96.66513947947041,7.602597998311751,sigmoid,50,27.0,,,5.0,7.0,33.0,,,7.598326435731382,4.041065418816198,6.3991800165947685,7.0,25.0,87.0,,COMPLETE
2082,0.5044045060576718,2024-04-11 16:21:10.593675,2024-04-11 16:21:11.363298,0 days 00:00:00.769623,99.96047453515698,8.162767127363436,sigmoid,39,49.0,,,,,,40.0,2.0,1.7981706532913537,7.168569717630336,4.623752766389373,13.0,21.0,84.0,27.0,COMPLETE
2083,0.4318694783001225,2024-04-11 16:21:11.365500,2024-04-11 16:21:12.122618,0 days 00:00:00.757118,99.96079620612574,8.38810605623566,sigmoid,29,,25.0,29.0,3.0,2.0,92.0,28.0,42.0,,,,,,,127.0,COMPLETE
2084,0.44701971028259324,2024-04-11 16:21:12.124665,2024-04-11 16:21:12.703240,0 days 00:00:00.578575,98.19480429795382,7.826890039979444,sigmoid,8,,22.0,30.0,,,,,,,,,,,,,COMPLETE
2085,0.46041779079626916,2024-04-11 16:21:12.705240,2024-04-11 16:21:13.380300,0 days 00:00:00.675060,99.98584358516264,8.493093322220286,sigmoid,49,20.0,,,7.0,1.0,53.0,,,,,,,,,77.0,COMPLETE
2086,0.5069140556625241,2024-04-11 16:21:13.381328,2024-04-11 16:21:13.948818,0 days 00:00:00.567490,96.25435675044433,7.990042841229437,sigmoid,8,,24.0,35.0,,,,,,,,,,,,,COMPLETE
2087,0.5335980031838997,2024-04-11 16:21:13.950956,2024-04-11 16:21:14.598330,0 days 00:00:00.647374,94.51471747500966,8.171189353972608,sigmoid,34,34.0,,,,,,,,3.6659369148009837,0.507085294888852,3.7255763229267305,20.0,49.0,98.0,,COMPLETE
2088,0.35090350427975714,2024-04-11 16:21:14.599391,2024-04-11 16:21:15.166293,0 days 00:00:00.566902,98.18133079543954,5.9350046277252755,sigmoid,35,45.0,,,,,,,,3.1848111077615098,6.674503254478748,7.7956868210401655,11.0,45.0,89.0,112.0,COMPLETE
2089,0.4927851892186224,2024-04-11 16:21:15.167289,2024-04-11 16:21:15.859582,0 days 00:00:00.692293,96.60438080409298,8.684130924960332,sigmoid,25,,26.0,32.0,1.0,5.0,62.0,,,,,,,,,144.0,COMPLETE
2090,0.4030795660611458,2024-04-11 16:21:15.861032,2024-04-11 16:21:16.632335,0 days 00:00:00.771303,98.05964801026366,7.570707480955819,sigmoid,22,,,,3.0,4.0,100.0,17.0,19.0,2.4707220623604673,6.06683932698429,0.5258213061276003,16.0,43.0,62.0,,COMPLETE
2091,0.4824502403906036,2024-04-11 16:21:16.633960,2024-04-11 16:21:17.506943,0 days 00:00:00.872983,94.61953740759004,7.803801817074599,sigmoid,47,36.0,23.0,31.0,,,,45.0,17.0,5.9302545777632405,3.142291508132038,9.460014821961206,19.0,36.0,72.0,48.0,COMPLETE
2092,0.5986580986580987,2024-04-11 16:21:17.508943,2024-04-11 16:21:18.045891,0 days 00:00:00.536948,98.05797340619029,8.314241917786772,sigmoid,8,,27.0,31.0,,,,,,,,,,,,,COMPLETE
2093,0.12622036262203626,2024-04-11 16:21:18.047357,2024-04-11 16:21:18.585094,0 days 00:00:00.537737,96.68405952692365,7.98258632406737,sigmoid,8,,25.0,29.0,,,,,,,,,,,,,COMPLETE
2094,0.4363926965378989,2024-04-11 16:21:18.586091,2024-04-11 16:21:19.545748,0 days 00:00:00.959657,99.97632217040689,8.121621548323386,sigmoid,31,,27.0,34.0,6.0,7.0,89.0,35.0,14.0,6.510375730437901,2.327653089920656,3.20668528748149,14.0,40.0,59.0,56.0,COMPLETE
2095,0.5120944103178448,2024-04-11 16:21:19.546752,2024-04-11 16:21:20.266718,0 days 00:00:00.719966,98.09467373529867,7.762126140849926,sigmoid,21,,,,2.0,2.0,7.0,15.0,47.0,,,,,,,200.0,COMPLETE
2096,0.48037914691943134,2024-04-11 16:21:20.267719,2024-04-11 16:21:21.075048,0 days 00:00:00.807329,94.56388282690291,8.369231697281387,sigmoid,43,11.0,23.0,32.0,,,,,,7.084091718377216,1.2244279126737636,2.052218674419518,12.0,24.0,57.0,104.0,COMPLETE
2097,0.48486583020423113,2024-04-11 16:21:21.077044,2024-04-11 16:21:21.742211,0 days 00:00:00.665167,96.43253676531424,7.330691650129944,sigmoid,24,,25.0,30.0,8.0,3.0,75.0,,,,,,,,,,COMPLETE
