number,value,datetime_start,datetime_complete,duration,params_C,params_gamma,params_kernel,params_mask_number,params_rsi_window,params_so_smooth,params_so_window,params_srsi_smooth1,params_srsi_smooth2,params_srsi_window,params_tsi_window_fast,params_tsi_window_slow,params_ult_weight_1,params_ult_weight_2,params_ult_weight_3,params_ult_window_1,params_ult_window_2,params_ult_window_3,params_williams_lbp,state
7336,0.4106825289752867,2024-04-11 18:17:35.220093,2024-04-11 18:17:37.284421,0 days 00:00:02.064328,92.16136206107831,8.41569080744329,sigmoid,29,,24.0,34.0,7.0,8.0,44.0,19.0,49.0,,,,,,,183.0,COMPLETE
7337,0.35809927574633454,2024-04-11 18:17:37.287434,2024-04-11 18:17:39.373835,0 days 00:00:02.086401,96.69649615314756,7.982364786335492,rbf,18,,,,8.0,4.0,33.0,,,5.538365119049074,2.525120794253083,4.176160651788319,6.0,22.0,62.0,,COMPLETE
7338,0.5511229199798301,2024-04-11 18:17:39.376824,2024-04-11 18:17:41.046134,0 days 00:00:01.669310,98.11192304283618,4.035188768333469,sigmoid,6,,,,,,,35.0,39.0,7.273596453452775,1.8849449788262311,7.424106278132452,5.0,50.0,87.0,,COMPLETE
7339,0.5012831262545417,2024-04-11 18:17:41.049671,2024-04-11 18:17:42.786218,0 days 00:00:01.736547,95.1256429667181,7.662328688207862,sigmoid,25,,23.0,30.0,4.0,5.0,68.0,,,,,,,,,36.0,COMPLETE
7340,0.39553629003367485,2024-04-11 18:17:42.789757,2024-04-11 18:17:44.330329,0 days 00:00:01.540572,98.26953434468422,8.158478633535015,sigmoid,17,,,,2.0,7.0,96.0,,,,,,,,,110.0,COMPLETE
7341,0.5964036904537752,2024-04-11 18:17:44.332328,2024-04-11 18:17:45.617833,0 days 00:00:01.285505,98.1615640018093,7.319997539965092,sigmoid,8,,25.0,31.0,,,,,,,,,,,,,COMPLETE
7342,0.5929369437606513,2024-04-11 18:17:45.621853,2024-04-11 18:17:46.955171,0 days 00:00:01.333318,99.94767149099059,8.58970339938496,sigmoid,8,,26.0,33.0,,,,,,,,,,,,,COMPLETE
7343,0.4700837947763023,2024-04-11 18:17:46.957744,2024-04-11 18:17:48.556347,0 days 00:00:01.598603,99.96115040021749,7.858083695045973,sigmoid,49,32.0,,,3.0,2.0,71.0,,,,,,,,,164.0,COMPLETE
7344,0.5963643249384587,2024-04-11 18:17:48.559916,2024-04-11 18:17:50.147049,0 days 00:00:01.587133,95.24481523904053,8.300778756107041,sigmoid,8,,29.0,32.0,,,,,,,,,,,,,COMPLETE
7345,0.3971117951404807,2024-04-11 18:17:50.149592,2024-04-11 18:17:51.802239,0 days 00:00:01.652647,96.79784978884075,8.077279074060886,sigmoid,21,,,,6.0,3.0,67.0,5.0,36.0,,,,,,,116.0,COMPLETE
7346,0.12622036262203626,2024-04-11 18:17:51.805262,2024-04-11 18:17:53.255696,0 days 00:00:01.450434,93.74329263548614,7.666470166796829,sigmoid,8,,27.0,29.0,,,,,,,,,,,,,COMPLETE
7347,0.4806909826279756,2024-04-11 18:17:53.259231,2024-04-11 18:17:55.466622,0 days 00:00:02.207391,96.71134757016907,8.429619234004145,sigmoid,47,43.0,24.0,31.0,,,,37.0,30.0,2.183675595468098,2.993619495533037,4.8304413046536325,18.0,42.0,77.0,16.0,COMPLETE
7348,0.5007905138339921,2024-04-11 18:17:55.470378,2024-04-11 18:17:57.150257,0 days 00:00:01.679879,99.99828421676078,7.910606746108408,sigmoid,24,,26.0,31.0,1.0,6.0,6.0,,,,,,,,,,COMPLETE
7349,0.49314167606163095,2024-04-11 18:17:57.153270,2024-04-11 18:17:59.043176,0 days 00:00:01.889906,98.24460147464615,8.218347903612607,sigmoid,43,12.0,25.0,33.0,,,,,,4.162509801462778,4.702761441534025,2.057596786684522,12.0,45.0,85.0,148.0,COMPLETE
7350,0.35580410099983056,2024-04-11 18:17:59.046177,2024-04-11 18:18:00.769966,0 days 00:00:01.723789,96.78287812210591,8.025560159206353,sigmoid,35,14.0,,,,,,,,6.069207109306092,8.472373438683608,7.890906060494403,6.0,40.0,66.0,65.0,COMPLETE
7351,0.4408266534250786,2024-04-11 18:18:00.772952,2024-04-11 18:18:02.192095,0 days 00:00:01.419143,98.16577479982678,7.442779315699757,sigmoid,8,,27.0,22.0,,,,,,,,,,,,,COMPLETE
7352,0.48310419499420854,2024-04-11 18:18:02.196106,2024-04-11 18:18:04.613032,0 days 00:00:02.416926,94.84884298901473,7.76745027824675,sigmoid,31,,25.0,30.0,7.0,1.0,24.0,24.0,43.0,4.4243584592771015,8.010887916290354,5.029246214920037,15.0,23.0,72.0,193.0,COMPLETE
7353,0.4949332475470484,2024-04-11 18:18:04.616029,2024-04-11 18:18:06.544634,0 days 00:00:01.928605,98.11060239012524,8.533993926005369,sigmoid,39,38.0,,,,,,18.0,20.0,6.754855957286147,0.6865133164457653,3.800805831143326,19.0,20.0,80.0,128.0,COMPLETE
7354,0.28706340338103303,2024-04-11 18:18:06.547654,2024-04-11 18:18:08.734166,0 days 00:00:02.186512,93.10786203715925,8.284846864636613,sigmoid,22,,,,5.0,4.0,39.0,2.0,18.0,9.277119998119979,4.920728780134386,3.2426887223593095,2.0,43.0,81.0,,COMPLETE
7355,0.5636462904171639,2024-04-11 18:18:08.737164,2024-04-11 18:18:10.438699,0 days 00:00:01.701535,96.69479204025342,8.025720772272738,sigmoid,0,,,,,,,,,,,,,,,,COMPLETE
7356,0.48692143251747416,2024-04-11 18:18:10.442622,2024-04-11 18:18:12.618876,0 days 00:00:02.176254,95.49776602561211,8.15465656118232,sigmoid,15,,28.0,28.0,,,,30.0,4.0,2.4220676642756773,1.698777218623745,1.6273853382369574,3.0,27.0,55.0,179.0,COMPLETE
7357,0.3809737414167903,2024-04-11 18:18:12.621851,2024-04-11 18:18:14.825244,0 days 00:00:02.203393,99.95918201789762,7.823182122024716,sigmoid,38,20.0,,,,,,14.0,24.0,3.6637265250537547,3.37579214629824,1.2533888713285286,14.0,46.0,93.0,,COMPLETE
7358,0.4828789211374964,2024-04-11 18:18:14.828840,2024-04-11 18:18:17.287933,0 days 00:00:02.459093,99.98979296842587,7.634311103112598,rbf,8,,23.0,31.0,,,,,,,,,,,,,COMPLETE
7359,0.49946665429923015,2024-04-11 18:18:17.290996,2024-04-11 18:18:19.584991,0 days 00:00:02.293995,98.17034873451324,8.680422913563856,sigmoid,28,,24.0,32.0,8.0,3.0,22.0,32.0,45.0,,,,,,,,COMPLETE
7360,0.5487157894736842,2024-04-11 18:18:19.586976,2024-04-11 18:18:21.227241,0 days 00:00:01.640265,96.7885745530624,8.391806281397319,sigmoid,9,,26.0,32.0,,,,,,,,,,,,104.0,COMPLETE
7361,0.3305810281191735,2024-04-11 18:18:21.231788,2024-04-11 18:18:23.250840,0 days 00:00:02.019052,98.27204201860349,7.953543034568289,sigmoid,3,,,,,,,,,8.33705686387877,6.549218137956446,8.950788892972321,9.0,38.0,61.0,91.0,COMPLETE
7362,0.35711723346247665,2024-04-11 18:18:23.256832,2024-04-11 18:18:25.400009,0 days 00:00:02.143177,92.35513819402352,8.217304798312059,sigmoid,57,44.0,29.0,30.0,2.0,8.0,8.0,,,,,,,,,155.0,COMPLETE
7363,0.5931111524855706,2024-04-11 18:18:25.405036,2024-04-11 18:18:26.847890,0 days 00:00:01.442854,95.24632518537445,8.027116140173176,sigmoid,8,,22.0,26.0,,,,,,,,,,,,,COMPLETE
7364,0.5467306325515281,2024-04-11 18:18:26.851430,2024-04-11 18:18:29.184749,0 days 00:00:02.333319,98.15794742432682,7.509104594292862,sigmoid,42,36.0,24.0,34.0,,,,,,7.438679615497361,3.972730813421318,6.275446032917801,8.0,47.0,74.0,,COMPLETE
7365,0.1888695652173913,2024-04-11 18:18:29.187758,2024-04-11 18:18:30.679637,0 days 00:00:01.491879,93.9996954623482,7.773195441339734,sigmoid,16,,,,3.0,5.0,51.0,,,,,,,,,,COMPLETE
7366,0.45345352376492626,2024-04-11 18:18:30.682661,2024-04-11 18:18:32.301474,0 days 00:00:01.618813,98.24448475297375,8.386421727870227,sigmoid,8,,28.0,30.0,,,,,,,,,,,,,COMPLETE
7367,0.5963643249384587,2024-04-11 18:18:32.306465,2024-04-11 18:18:33.735505,0 days 00:00:01.429040,96.46308599947834,8.170972255787374,sigmoid,8,,27.0,32.0,,,,,,,,,,,,,COMPLETE
7368,0.422051965356429,2024-04-11 18:18:33.738501,2024-04-11 18:18:36.341370,0 days 00:00:02.602869,99.95193080721963,7.02013235749769,sigmoid,63,23.0,25.0,29.0,4.0,6.0,13.0,17.0,12.0,5.0046237806855745,5.32132505550246,9.808068318259414,4.0,32.0,65.0,68.0,COMPLETE
7369,0.6009432182607054,2024-04-11 18:18:36.345365,2024-04-11 18:18:37.876770,0 days 00:00:01.531405,96.69624816827822,7.914641298471502,sigmoid,8,,26.0,31.0,,,,,,,,,,,,,COMPLETE
7370,0.41519429804200003,2024-04-11 18:18:37.879336,2024-04-11 18:18:40.862757,0 days 00:00:02.983421,99.9922182763127,8.545156561960265,sigmoid,62,3.0,23.0,33.0,7.0,2.0,61.0,42.0,41.0,3.389452566985753,6.849270698206965,0.6848507950481268,10.0,36.0,58.0,,COMPLETE
7371,0.5492194366550873,2024-04-11 18:18:40.865763,2024-04-11 18:18:42.996663,0 days 00:00:02.130900,90.6927330821914,8.145166071196657,sigmoid,2,,,,,,,,,8.785671556393627,8.23697499815312,5.876543389094476,12.0,33.0,59.0,,COMPLETE
7372,0.3914480798343992,2024-04-11 18:18:43.001294,2024-04-11 18:18:45.622984,0 days 00:00:02.621690,99.95411587312327,7.729308979603382,sigmoid,46,29.0,25.0,28.0,,,,44.0,6.0,0.6678225221669436,7.555769615439363,2.5647012050720686,7.0,41.0,52.0,,COMPLETE
7373,0.5009414486967174,2024-04-11 18:18:45.625980,2024-04-11 18:18:47.577948,0 days 00:00:01.951968,95.34546835294972,8.331876408237965,sigmoid,10,,24.0,30.0,,,,,,6.43368826131024,6.357426982145627,6.802771923860725,18.0,34.0,97.0,,COMPLETE
7374,0.4785361441591874,2024-04-11 18:18:47.582478,2024-04-11 18:18:49.638140,0 days 00:00:02.055662,98.33069166729753,7.9767691941758345,sigmoid,11,,27.0,31.0,,,,,,1.8605055564595046,8.859390518495282,5.547040080022112,11.0,25.0,92.0,123.0,COMPLETE
7375,0.4863132132691335,2024-04-11 18:18:49.641711,2024-04-11 18:18:51.081219,0 days 00:00:01.439508,99.9941567401435,7.372025863063847,sigmoid,8,,26.0,37.0,,,,,,,,,,,,,COMPLETE
7376,0.4550733313379228,2024-04-11 18:18:51.085237,2024-04-11 18:18:53.492927,0 days 00:00:02.407690,96.67295275329897,8.136641531656986,rbf,8,,25.0,32.0,,,,,,,,,,,,,COMPLETE
7377,0.3487720281680272,2024-04-11 18:18:53.496908,2024-04-11 18:18:56.095660,0 days 00:00:02.598752,94.6617128878045,7.621004354501581,sigmoid,14,,24.0,29.0,,,,12.0,2.0,4.747563354226531,5.056948386925731,2.8950903862282527,13.0,44.0,70.0,,COMPLETE
7378,0.3606320851940914,2024-04-11 18:18:56.098645,2024-04-11 18:18:57.927071,0 days 00:00:01.828426,99.96129013796998,8.693532209680285,sigmoid,41,33.0,23.0,33.0,,,,,,,,,,,,26.0,COMPLETE
7379,0.4755352079702416,2024-04-11 18:18:57.930616,2024-04-11 18:19:00.176758,0 days 00:00:02.246142,96.93371928634362,7.823807940540822,sigmoid,26,,27.0,32.0,6.0,4.0,4.0,,,0.5059977989323379,1.3575446765608032,3.5715419201234635,17.0,49.0,85.0,,COMPLETE
7380,0.5963245096172158,2024-04-11 18:19:00.180273,2024-04-11 18:19:01.914425,0 days 00:00:01.734152,98.08222757676631,8.364106960695938,sigmoid,8,,21.0,31.0,,,,,,,,,,,,,COMPLETE
7381,0.13010974265586814,2024-04-11 18:19:01.918968,2024-04-11 18:19:03.596364,0 days 00:00:01.677396,21.58145725725113,8.004384098928211,sigmoid,20,,,,1.0,1.0,29.0,25.0,22.0,,,,,,,,COMPLETE
7382,0.4502698896972542,2024-04-11 18:19:03.599361,2024-04-11 18:19:04.972554,0 days 00:00:01.373193,92.95310445498693,8.229324839176291,sigmoid,8,,25.0,30.0,,,,,,,,,,,,,COMPLETE
7383,0.5300788303166425,2024-04-11 18:19:04.976556,2024-04-11 18:19:06.837645,0 days 00:00:01.861089,98.14626276974974,8.490773894457943,sigmoid,48,11.0,,,6.0,8.0,84.0,,,,,,,,,,COMPLETE
7384,0.33040271206646055,2024-04-11 18:19:06.842246,2024-04-11 18:19:09.576340,0 days 00:00:02.734094,86.83274626604735,8.87969498439233,sigmoid,37,48.0,,,,,,26.0,15.0,,,,,,,84.0,COMPLETE
7385,0.3373432734666215,2024-04-11 18:19:09.580877,2024-04-11 18:19:11.467493,0 days 00:00:01.886616,95.63177305540266,7.889779402896625,sigmoid,56,27.0,26.0,24.0,5.0,7.0,10.0,,,,,,,,,,COMPLETE
7386,0.44701971028259324,2024-04-11 18:19:11.473035,2024-04-11 18:19:13.002602,0 days 00:00:01.529567,98.30894333687174,7.6090129111314635,sigmoid,8,,24.0,30.0,,,,,,,,,,,,,COMPLETE
7387,0.5031818083096237,2024-04-11 18:19:13.006613,2024-04-11 18:19:15.251345,0 days 00:00:02.244732,93.96110280615568,8.071281621190057,sigmoid,52,35.0,,,4.0,2.0,35.0,46.0,26.0,,,,,,,,COMPLETE
7388,0.32911437535653165,2024-04-11 18:19:15.255343,2024-04-11 18:19:17.084710,0 days 00:00:01.829367,98.27691562504202,8.255878921596974,sigmoid,44,50.0,28.0,34.0,,,,6.0,19.0,,,,,,,,COMPLETE
7389,0.3637013827395954,2024-04-11 18:19:17.087724,2024-04-11 18:19:18.805152,0 days 00:00:01.717428,96.41496323606334,7.194158934294138,sigmoid,13,,26.0,31.0,,,,8.0,29.0,,,,,,,97.0,COMPLETE
7390,0.5929369437606513,2024-04-11 18:19:18.808150,2024-04-11 18:19:20.424597,0 days 00:00:01.616447,96.72612203892615,7.82191290666668,sigmoid,8,,23.0,33.0,,,,,,,,,,,,,COMPLETE
7391,0.3005812344312206,2024-04-11 18:19:20.428159,2024-04-11 18:19:22.078281,0 days 00:00:01.650122,98.08546426959936,8.048094806141561,sigmoid,12,,29.0,29.0,,,,29.0,8.0,,,,,,,,COMPLETE
7392,0.45081577253519145,2024-04-11 18:19:22.081863,2024-04-11 18:19:24.495944,0 days 00:00:02.414081,95.05333519506358,8.48932399211465,sigmoid,59,17.0,25.0,32.0,8.0,3.0,98.0,,,5.854108448704817,9.529063107057112,8.265068503807369,19.0,35.0,72.0,173.0,COMPLETE
7393,0.476743489973062,2024-04-11 18:19:24.498941,2024-04-11 18:19:26.754654,0 days 00:00:02.255713,98.17721169219506,8.271003399520376,rbf,8,,27.0,31.0,,,,,,,,,,,,,COMPLETE
7394,0.4309985017123288,2024-04-11 18:19:26.757638,2024-04-11 18:19:29.106926,0 days 00:00:02.349288,98.31591361306765,7.46322249797595,sigmoid,23,,,,3.0,5.0,73.0,36.0,11.0,2.63035814720235,9.237974251880923,1.8783525687194778,5.0,30.0,100.0,136.0,COMPLETE
7395,0.45347172512526845,2024-04-11 18:19:29.110906,2024-04-11 18:19:30.538264,0 days 00:00:01.427358,92.24712664785909,7.715315491089283,sigmoid,8,,24.0,28.0,,,,,,,,,,,,,COMPLETE
7396,0.387912558936991,2024-04-11 18:19:30.542805,2024-04-11 18:19:32.971487,0 days 00:00:02.428682,68.6328991052016,7.977955558256877,sigmoid,54,8.0,,,7.0,4.0,19.0,28.0,31.0,9.986569777558136,2.075719395662059,9.392563899739422,20.0,48.0,95.0,,COMPLETE
7397,0.44141609047542485,2024-04-11 18:19:32.975531,2024-04-11 18:19:35.373176,0 days 00:00:02.397645,95.28726734452025,8.16993461879242,sigmoid,55,24.0,,,1.0,6.0,94.0,23.0,5.0,0.941824059251382,3.597249697269934,9.985428389010234,14.0,28.0,89.0,76.0,COMPLETE
7398,0.5122431401501168,2024-04-11 18:19:35.377189,2024-04-11 18:19:36.991731,0 days 00:00:01.614542,95.96484079116325,8.673350939147356,sigmoid,36,39.0,,,,,,48.0,48.0,,,,,,,,COMPLETE
7399,0.5067413246887202,2024-04-11 18:19:36.994759,2024-04-11 18:19:39.240023,0 days 00:00:02.245264,96.84458621178048,8.38772033942959,sigmoid,60,46.0,26.0,30.0,4.0,2.0,64.0,4.0,32.0,,,,,,,,COMPLETE
7400,0.41592622096942217,2024-04-11 18:19:39.243112,2024-04-11 18:19:40.479645,0 days 00:00:01.236533,99.93990581720762,7.83577103019647,sigmoid,1,,,,,,,,,,,,,,,118.0,COMPLETE
7401,0.33067596744726785,2024-04-11 18:19:40.482182,2024-04-11 18:19:42.438048,0 days 00:00:01.955866,98.0321172067638,8.129788483624555,sigmoid,7,,,,,,,7.0,9.0,5.301516744532155,5.507408504328752,0.9800280283787473,15.0,37.0,63.0,43.0,COMPLETE
7402,0.5129881722829726,2024-04-11 18:19:42.441107,2024-04-11 18:19:44.334602,0 days 00:00:01.893495,99.94595087356696,7.611155228230299,sigmoid,40,10.0,22.0,32.0,,,,,,,,,,,,,COMPLETE
7403,0.6009432182607054,2024-04-11 18:19:44.338598,2024-04-11 18:19:46.047989,0 days 00:00:01.709391,93.76959285463262,7.94955407051176,sigmoid,8,,43.0,31.0,,,,,,,,,,,,,COMPLETE
7404,0.47088252951771065,2024-04-11 18:19:46.058551,2024-04-11 18:19:48.364513,0 days 00:00:02.305962,96.806414367779,8.347984063768282,sigmoid,61,18.0,25.0,35.0,2.0,7.0,54.0,39.0,7.0,,,,,,,141.0,COMPLETE
7405,0.44388761529029164,2024-04-11 18:19:48.367492,2024-04-11 18:19:51.010327,0 days 00:00:02.642835,98.26180109610274,8.070834174073601,sigmoid,30,,24.0,30.0,6.0,1.0,87.0,33.0,17.0,7.926134600724615,4.587349652889116,7.263754406290305,16.0,24.0,73.0,,COMPLETE
7406,0.5929369437606513,2024-04-11 18:19:51.013931,2024-04-11 18:19:52.480202,0 days 00:00:01.466271,94.9588986495646,7.786537149112242,sigmoid,8,,27.0,33.0,,,,,,,,,,,,,COMPLETE
7407,0.5963643249384587,2024-04-11 18:19:52.484739,2024-04-11 18:19:53.901469,0 days 00:00:01.416730,99.95459189014304,8.533670609935294,sigmoid,8,,48.0,32.0,,,,,,,,,,,,,COMPLETE
7408,0.30064067072688444,2024-04-11 18:19:53.904499,2024-04-11 18:19:55.808853,0 days 00:00:01.904354,96.71527410028158,8.211290654751682,sigmoid,34,25.0,,,,,,,,9.407627304548592,3.1586379890555305,9.648198411297823,11.0,43.0,57.0,,COMPLETE
7409,0.6009432182607054,2024-04-11 18:19:55.813393,2024-04-11 18:19:57.329703,0 days 00:00:01.516310,98.15039691582294,7.953350372061131,sigmoid,8,,25.0,31.0,,,,,,,,,,,,,COMPLETE
7410,0.42160903063967026,2024-04-11 18:19:57.333229,2024-04-11 18:19:59.239513,0 days 00:00:01.906284,93.58601562019878,7.450925904994653,sigmoid,45,22.0,26.0,29.0,,,,15.0,16.0,,,,,,,58.0,COMPLETE
7411,0.5751561592097617,2024-04-11 18:19:59.243089,2024-04-11 18:20:00.580216,0 days 00:00:01.337127,18.46908914640609,8.370330560724447,sigmoid,32,9.0,,,,,,,,,,,,,,,COMPLETE
7412,0.04336627732854148,2024-04-11 18:20:00.583763,2024-04-11 18:20:03.152701,0 days 00:00:02.568938,98.00401344313346,7.6917785732463795,rbf,27,,23.0,30.0,5.0,6.0,78.0,,,2.9527214535268316,7.791985974214319,4.445994796507356,3.0,39.0,91.0,170.0,COMPLETE
7413,0.5214069512576976,2024-04-11 18:20:03.156214,2024-04-11 18:20:04.530042,0 days 00:00:01.373828,99.9470189051021,8.066332119906408,sigmoid,4,,,,,,,31.0,35.0,,,,,,,,COMPLETE
7414,0.2582946842668569,2024-04-11 18:20:04.533573,2024-04-11 18:20:05.985567,0 days 00:00:01.451994,95.25958937260354,7.860331048699124,sigmoid,5,,,,,,,35.0,42.0,,,,,,,10.0,COMPLETE
7415,0.594268224819143,2024-04-11 18:20:05.988556,2024-04-11 18:20:07.622315,0 days 00:00:01.633759,98.17303167815146,8.26347158535849,sigmoid,8,,28.0,27.0,,,,,,,,,,,,,COMPLETE
7416,0.5929369437606513,2024-04-11 18:20:07.625335,2024-04-11 18:20:08.996304,0 days 00:00:01.370969,91.14795014385119,8.589462690931907,sigmoid,8,,26.0,33.0,,,,,,,,,,,,,COMPLETE
7417,0.4555156825278464,2024-04-11 18:20:08.998293,2024-04-11 18:20:10.693413,0 days 00:00:01.695120,96.60553874522758,8.09606788182669,sigmoid,49,13.0,,,8.0,8.0,49.0,,,,,,,,,185.0,COMPLETE
7418,0.4144037096073032,2024-04-11 18:20:10.697415,2024-04-11 18:20:12.828269,0 days 00:00:02.130854,98.07453089495992,8.965375727121968,sigmoid,51,5.0,,,3.0,3.0,32.0,,,1.4677784494960724,7.143438313996828,9.215984876805315,2.0,29.0,50.0,48.0,COMPLETE
7419,0.34815569133288077,2024-04-11 18:20:12.831265,2024-04-11 18:20:14.192925,0 days 00:00:01.361660,12.00820979261215,7.630191956020914,sigmoid,33,31.0,,,,,,,,,,,,,,190.0,COMPLETE
7420,0.5010317580149982,2024-04-11 18:20:14.196970,2024-04-11 18:20:16.604360,0 days 00:00:02.407390,98.19626584495549,7.89160126232011,sigmoid,58,41.0,25.0,31.0,7.0,5.0,59.0,,,9.678748997185325,2.6081750081416417,6.43773818741195,9.0,31.0,86.0,,COMPLETE
7421,0.3872486093281986,2024-04-11 18:20:16.608358,2024-04-11 18:20:18.419146,0 days 00:00:01.810788,99.99529658827534,8.41378521529235,sigmoid,53,2.0,,,2.0,1.0,46.0,47.0,44.0,,,,,,,54.0,COMPLETE
7422,0.5963643249384587,2024-04-11 18:20:18.422640,2024-04-11 18:20:19.900832,0 days 00:00:01.478192,95.39901340188968,8.184066953243235,sigmoid,8,,13.0,32.0,,,,,,,,,,,,,COMPLETE
7423,0.4502698896972542,2024-04-11 18:20:19.905377,2024-04-11 18:20:21.744930,0 days 00:00:01.839553,96.34650850823907,7.286212649714947,sigmoid,8,,27.0,30.0,,,,,,,,,,,,,COMPLETE
7424,0.38927568986257427,2024-04-11 18:20:21.747931,2024-04-11 18:20:23.309773,0 days 00:00:01.561842,98.2336702889785,7.973093665506676,sigmoid,17,,,,1.0,4.0,100.0,,,,,,,,,110.0,COMPLETE
7425,0.34854001820600805,2024-04-11 18:20:23.312278,2024-04-11 18:20:25.580383,0 days 00:00:02.268105,93.78301864678129,7.693528727897352,sigmoid,19,,,,5.0,7.0,15.0,,,3.9578049518592584,4.369375922527151,3.8981667638050537,7.0,26.0,96.0,20.0,COMPLETE
7426,0.24715521165225302,2024-04-11 18:20:25.582914,2024-04-11 18:20:27.533530,0 days 00:00:01.950616,99.96154741598407,6.669492086777599,sigmoid,6,,,,,,,16.0,39.0,8.184624414298382,9.826851003579748,4.0118873359090585,8.0,40.0,54.0,,COMPLETE
7427,0.5149071522971126,2024-04-11 18:20:27.536531,2024-04-11 18:20:29.459489,0 days 00:00:01.922958,99.97101762983354,8.275878058840464,sigmoid,18,,,,4.0,2.0,42.0,,,7.008764118504792,0.8593834330654238,8.111697467158354,13.0,50.0,83.0,,COMPLETE
7428,0.5010471078159978,2024-04-11 18:20:29.465016,2024-04-11 18:20:32.210301,0 days 00:00:02.745285,99.98246586256184,8.791678084487192,sigmoid,29,,24.0,29.0,2.0,3.0,36.0,11.0,28.0,,,,,,,30.0,COMPLETE
7429,0.5735949725171433,2024-04-11 18:20:32.212814,2024-04-11 18:20:33.765016,0 days 00:00:01.552202,96.50161653751172,8.526655357542747,sigmoid,8,,22.0,7.0,,,,,,,,,,,,,COMPLETE
7430,0.4754135623184745,2024-04-11 18:20:33.768015,2024-04-11 18:20:35.768698,0 days 00:00:02.000683,96.45680074863158,7.863828970110534,sigmoid,50,8.0,,,8.0,5.0,80.0,,,9.116904839469203,6.075938656907974,8.48559764450732,17.0,47.0,71.0,,COMPLETE
7431,0.19064098705988564,2024-04-11 18:20:35.771680,2024-04-11 18:20:38.273984,0 days 00:00:02.502304,98.18987018001259,8.060161780289224,rbf,43,21.0,23.0,31.0,,,,,,3.2529728097850894,2.2082017466415813,2.443000567505996,4.0,27.0,75.0,132.0,COMPLETE
7432,0.5952371952371952,2024-04-11 18:20:38.277546,2024-04-11 18:20:40.479230,0 days 00:00:02.201684,92.37555477210428,7.499779047445732,sigmoid,8,,28.0,32.0,,,,,,,,,,,,,COMPLETE
7433,0.1274049741905209,2024-04-11 18:20:40.483214,2024-04-11 18:20:42.112992,0 days 00:00:01.629778,98.1726233531608,3.21003982380969,sigmoid,8,,30.0,34.0,,,,,,,,,,,,,COMPLETE
7434,0.37241562406663786,2024-04-11 18:20:42.117354,2024-04-11 18:20:45.161740,0 days 00:00:03.044386,99.94432372280224,8.22832043051343,sigmoid,47,19.0,26.0,30.0,,,,37.0,50.0,4.426292935105523,5.763139874036463,7.728266640787803,5.0,38.0,68.0,197.0,COMPLETE
7435,0.48135015342652576,2024-04-11 18:20:45.167327,2024-04-11 18:20:47.192006,0 days 00:00:02.024679,99.96547529274129,7.844880279767192,sigmoid,24,,25.0,32.0,3.0,6.0,76.0,,,,,,,,,,COMPLETE
7436,0.3890156399828059,2024-04-11 18:20:47.194507,2024-04-11 18:20:49.407960,0 days 00:00:02.213453,99.9468234774726,8.442496151826566,sigmoid,39,16.0,,,,,,50.0,33.0,5.439799021701717,6.694306128926972,3.0716069835085618,20.0,33.0,84.0,79.0,COMPLETE
7437,0.4289360150695753,2024-04-11 18:20:49.411948,2024-04-11 18:20:51.614348,0 days 00:00:02.202400,94.49879924662389,8.067341962384504,sigmoid,22,,,,6.0,7.0,92.0,21.0,46.0,3.751034264608723,8.345198815177945,3.330999908083659,18.0,42.0,61.0,,COMPLETE
7438,0.46416207206052057,2024-04-11 18:20:51.617361,2024-04-11 18:20:53.381463,0 days 00:00:01.764102,96.77158068071427,7.734499502488692,sigmoid,25,,24.0,29.0,5.0,8.0,85.0,,,,,,,,,72.0,COMPLETE
