number,value,datetime_start,datetime_complete,duration,params_C,params_gamma,params_kernel,params_mask_number,params_rsi_window,params_so_smooth,params_so_window,params_srsi_smooth1,params_srsi_smooth2,params_srsi_window,params_tsi_window_fast,params_tsi_window_slow,params_ult_weight_1,params_ult_weight_2,params_ult_weight_3,params_ult_window_1,params_ult_window_2,params_ult_window_3,params_williams_lbp,state
4048,0.436157553400369,2024-04-11 16:58:14.542719,2024-04-11 16:58:15.822825,0 days 00:00:01.280106,99.94874261712853,8.121885960909093,sigmoid,56,8.0,27.0,33.0,3.0,8.0,86.0,,,,,,,,,,COMPLETE
4049,0.44701971028259324,2024-04-11 16:58:15.830882,2024-04-11 16:58:16.902524,0 days 00:00:01.071642,99.99718622551187,7.87010916156799,sigmoid,8,,26.0,30.0,,,,,,,,,,,,,COMPLETE
4050,0.5069140556625241,2024-04-11 16:58:16.902524,2024-04-11 16:58:17.857842,0 days 00:00:00.955318,96.80760026719413,8.207382870082089,sigmoid,8,,30.0,35.0,,,,,,,,,,,,,COMPLETE
4051,0.46455875928352985,2024-04-11 16:58:17.857842,2024-04-11 16:58:18.952711,0 days 00:00:01.094869,94.94417166852472,7.636529983341958,sigmoid,48,50.0,,,6.0,2.0,39.0,,,,,,,,,,COMPLETE
4052,0.4433587062448969,2024-04-11 16:58:18.960344,2024-04-11 16:58:20.159891,0 days 00:00:01.199547,98.25687640804885,8.593902863951278,sigmoid,52,29.0,,,4.0,5.0,4.0,35.0,17.0,,,,,,,,COMPLETE
4053,0.47808462785710554,2024-04-11 16:58:20.167359,2024-04-11 16:58:21.726161,0 days 00:00:01.558802,92.52048120298932,8.04518662124276,sigmoid,59,3.0,23.0,29.0,1.0,7.0,58.0,,,2.5778691506956983,2.9862879060772163,8.492781156029492,18.0,41.0,82.0,35.0,COMPLETE
4054,0.5963643249384587,2024-04-11 16:58:21.726161,2024-04-11 16:58:22.721661,0 days 00:00:00.995500,96.70578584032303,8.397272272161317,sigmoid,8,,22.0,32.0,,,,,,,,,,,,,COMPLETE
4055,0.4407844142527557,2024-04-11 16:58:22.721661,2024-04-11 16:58:23.989808,0 days 00:00:01.268147,98.13345485054208,7.8352803102403845,sigmoid,12,,25.0,31.0,,,,8.0,11.0,,,,,,,,COMPLETE
4056,0.4990018062553475,2024-04-11 16:58:23.989808,2024-04-11 16:58:25.693077,0 days 00:00:01.703269,94.15759999365079,7.26265936674899,sigmoid,55,31.0,,,6.0,6.0,44.0,50.0,23.0,3.282279700305627,1.2731439782158054,9.667033026043507,7.0,47.0,55.0,143.0,COMPLETE
4057,0.3520559631462208,2024-04-11 16:58:25.698136,2024-04-11 16:58:27.005645,0 days 00:00:01.307509,99.97913163697577,8.337183766144468,sigmoid,44,25.0,32.0,31.0,,,,47.0,15.0,,,,,,,,COMPLETE
4058,0.5186246418338109,2024-04-11 16:58:27.005645,2024-04-11 16:58:28.193917,0 days 00:00:01.188272,98.16410988966828,7.992597977983003,sigmoid,13,,24.0,30.0,,,,28.0,32.0,,,,,,,107.0,COMPLETE
4059,0.5895095625828441,2024-04-11 16:58:28.193917,2024-04-11 16:58:29.153895,0 days 00:00:00.959978,96.6697289648324,7.670613900004228,sigmoid,8,,28.0,34.0,,,,,,,,,,,,,COMPLETE
4060,0.34187803561791685,2024-04-11 16:58:29.153895,2024-04-11 16:58:30.522532,0 days 00:00:01.368637,98.10643895140691,8.230477351772146,sigmoid,60,18.0,26.0,32.0,2.0,2.0,6.0,31.0,18.0,,,,,,,,COMPLETE
4061,0.36028862901219205,2024-04-11 16:58:30.522532,2024-04-11 16:58:31.974630,0 days 00:00:01.452098,95.14536503387856,4.906921638705364,sigmoid,23,,,,7.0,4.0,69.0,34.0,20.0,9.3862388899597,4.298066887668959,7.6050058486466465,2.0,43.0,100.0,200.0,COMPLETE
4062,0.5413190618605384,2024-04-11 16:58:31.974630,2024-04-11 16:58:33.073505,0 days 00:00:01.098875,99.96110869185658,8.063961939464257,sigmoid,36,36.0,,,,,,25.0,43.0,,,,,,,,COMPLETE
4063,0.12622036262203626,2024-04-11 16:58:33.081422,2024-04-11 16:58:34.204323,0 days 00:00:01.122901,98.12871710556689,7.504706774550103,sigmoid,8,,27.0,29.0,,,,,,,,,,,,,COMPLETE
4064,0.5395056633191179,2024-04-11 16:58:34.204323,2024-04-11 16:58:35.095410,0 days 00:00:00.891087,99.96245034628781,8.778382987130335,sigmoid,1,,,,,,,,,,,,,,,187.0,COMPLETE
4065,0.3609558064171504,2024-04-11 16:58:35.102792,2024-04-11 16:58:36.506871,0 days 00:00:01.404079,95.39382463416366,7.837766180274271,sigmoid,7,,,,,,,5.0,3.0,7.203411429754567,9.788892397157749,4.844292078141615,12.0,29.0,97.0,50.0,COMPLETE
4066,0.1682238419018735,2024-04-11 16:58:36.506871,2024-04-11 16:58:38.344744,0 days 00:00:01.837873,99.99470474285783,8.25683488413954,rbf,54,21.0,,,3.0,1.0,42.0,38.0,47.0,9.115031156870096,3.8735199890787864,0.7108222490796674,11.0,44.0,85.0,,COMPLETE
4067,0.45345352376492626,2024-04-11 16:58:38.344744,2024-04-11 16:58:39.430852,0 days 00:00:01.086108,96.54032113162562,8.499405738461492,sigmoid,8,,25.0,30.0,,,,,,,,,,,,,COMPLETE
4068,0.4806834694593376,2024-04-11 16:58:39.430852,2024-04-11 16:58:40.733070,0 days 00:00:01.302218,93.9684182998172,7.962834544783807,sigmoid,61,17.0,24.0,31.0,5.0,6.0,94.0,18.0,7.0,,,,,,,20.0,COMPLETE
4069,0.5929369437606513,2024-04-11 16:58:40.741661,2024-04-11 16:58:41.679932,0 days 00:00:00.938271,20.7602963783024,8.109877919943486,sigmoid,8,,26.0,33.0,,,,,,,,,,,,,COMPLETE
4070,0.5046215874241352,2024-04-11 16:58:41.679932,2024-04-11 16:58:42.617237,0 days 00:00:00.937305,98.06690149101269,7.714175354114685,sigmoid,32,46.0,,,,,,,,,,,,,,,COMPLETE
4071,0.5278067069360549,2024-04-11 16:58:42.617237,2024-04-11 16:58:43.663527,0 days 00:00:01.046290,96.76504864476581,8.280468510911252,sigmoid,40,24.0,23.0,32.0,,,,,,,,,,,,,COMPLETE
4072,0.47906433306309304,2024-04-11 16:58:43.664816,2024-04-11 16:58:45.212420,0 days 00:00:01.547604,98.1712145898373,4.101091277092902,sigmoid,30,,25.0,29.0,8.0,7.0,60.0,15.0,21.0,5.451352150973913,2.6042446004039164,3.763238318816951,6.0,22.0,62.0,,COMPLETE
4073,0.44701971028259324,2024-04-11 16:58:45.219942,2024-04-11 16:58:46.175890,0 days 00:00:00.955948,93.2593735486661,7.876205606182129,sigmoid,8,,28.0,30.0,,,,,,,,,,,,,COMPLETE
4074,0.12003789673140693,2024-04-11 16:58:46.184973,2024-04-11 16:58:47.160677,0 days 00:00:00.975704,98.2136930063518,8.098474671718407,sigmoid,8,,27.0,28.0,,,,,,,,,,,,,COMPLETE
4075,0.4533629351322119,2024-04-11 16:58:47.160677,2024-04-11 16:58:48.603513,0 days 00:00:01.442836,95.35749462701693,8.58122386411683,sigmoid,27,,24.0,33.0,2.0,5.0,98.0,,,9.63365813762336,8.397570787334534,4.421034384928687,20.0,32.0,53.0,175.0,COMPLETE
4076,0.264004415185083,2024-04-11 16:58:48.612294,2024-04-11 16:58:49.532330,0 days 00:00:00.920036,90.51301566860677,7.366904860262207,sigmoid,4,,,,,,,12.0,39.0,,,,,,,,COMPLETE
4077,0.44626014162438005,2024-04-11 16:58:49.539296,2024-04-11 16:58:50.764507,0 days 00:00:01.225211,98.24649158411009,8.371212464057598,sigmoid,53,15.0,,,4.0,3.0,47.0,7.0,44.0,,,,,,,72.0,COMPLETE
4078,0.6009432182607054,2024-04-11 16:58:50.764507,2024-04-11 16:58:51.694703,0 days 00:00:00.930196,96.60062383146993,7.577965841091186,sigmoid,8,,26.0,31.0,,,,,,,,,,,,,COMPLETE
4079,0.5368427424236311,2024-04-11 16:58:51.703293,2024-04-11 16:58:52.881557,0 days 00:00:01.178264,98.2125987755174,7.916965054430197,sigmoid,34,6.0,,,,,,,,5.024452147156949,5.64819371036878,8.971553421238461,5.0,42.0,96.0,,COMPLETE
4080,0.48569290708775187,2024-04-11 16:58:52.881557,2024-04-11 16:58:53.966622,0 days 00:00:01.085065,99.99855103375712,8.161405201917564,sigmoid,17,,,,7.0,1.0,37.0,,,,,,,,,136.0,COMPLETE
4081,0.39695660975774344,2024-04-11 16:58:53.966622,2024-04-11 16:58:54.945414,0 days 00:00:00.978792,95.26194694140989,7.736315713467972,sigmoid,5,,,,,,,41.0,11.0,,,,,,,120.0,COMPLETE
4082,0.37678558610293583,2024-04-11 16:58:54.945414,2024-04-11 16:58:56.354100,0 days 00:00:01.408686,2.687162095993088,7.980800768311844,sigmoid,51,28.0,,,5.0,8.0,12.0,,,4.437170355115266,7.890045423450648,3.203948962361948,10.0,35.0,71.0,90.0,COMPLETE
4083,0.47356100247865596,2024-04-11 16:58:56.354100,2024-04-11 16:58:57.281611,0 days 00:00:00.927511,51.261002423690236,8.389877322740546,sigmoid,33,39.0,,,,,,,,,,,,,,31.0,COMPLETE
4084,0.5963643249384587,2024-04-11 16:58:57.281611,2024-04-11 16:58:58.239851,0 days 00:00:00.958240,96.78021047268744,8.20891221868058,sigmoid,8,,25.0,32.0,,,,,,,,,,,,,COMPLETE
4085,0.13455105400095577,2024-04-11 16:58:58.239851,2024-04-11 16:58:59.696914,0 days 00:00:01.457063,92.48830125713545,8.712567315698312,rbf,49,42.0,,,1.0,4.0,89.0,,,,,,,,,195.0,COMPLETE
4086,0.5964036904537752,2024-04-11 16:58:59.696914,2024-04-11 16:59:00.639710,0 days 00:00:00.942796,17.809892242355893,7.124315873756953,sigmoid,8,,22.0,31.0,,,,,,,,,,,,,COMPLETE
4087,0.3883479121967321,2024-04-11 16:59:00.639710,2024-04-11 16:59:01.874405,0 days 00:00:01.234695,98.26364323313518,7.829743778448708,sigmoid,45,13.0,24.0,30.0,,,,39.0,14.0,,,,,,,160.0,COMPLETE
4088,0.5929369437606513,2024-04-11 16:59:01.874405,2024-04-11 16:59:02.814267,0 days 00:00:00.939862,95.47767277702759,8.050905500805483,sigmoid,8,,27.0,33.0,,,,,,,,,,,,,COMPLETE
4089,0.26830272585028414,2024-04-11 16:59:02.816379,2024-04-11 16:59:04.094346,0 days 00:00:01.277967,96.80367560329375,8.532439839574163,sigmoid,6,,,,,,,17.0,41.0,2.068977653013291,1.9956418289660327,2.638969847165137,9.0,46.0,50.0,,COMPLETE
4090,0.4961302805546598,2024-04-11 16:59:04.094346,2024-04-11 16:59:05.372995,0 days 00:00:01.278649,98.19350532807114,7.577186320118652,sigmoid,18,,,,4.0,3.0,84.0,,,1.514396826402602,5.884714860893314,5.715318827576712,16.0,45.0,90.0,,COMPLETE
4091,0.4348652046375192,2024-04-11 16:59:05.373359,2024-04-11 16:59:06.842973,0 days 00:00:01.469614,79.8836647479936,8.270778761849677,sigmoid,58,38.0,29.0,32.0,3.0,2.0,76.0,,,4.063070384274445,6.508713813175904,6.2403497767974745,15.0,27.0,66.0,,COMPLETE
4092,0.12622036262203626,2024-04-11 16:59:06.842973,2024-04-11 16:59:07.797011,0 days 00:00:00.954038,99.98361019290019,8.003391300752838,sigmoid,8,,26.0,29.0,,,,,,,,,,,,,COMPLETE
4093,0.5263238445056626,2024-04-11 16:59:07.797011,2024-04-11 16:59:09.139943,0 days 00:00:01.342932,93.9453156136641,7.759763125913055,sigmoid,19,,,,6.0,5.0,21.0,,,5.898603929535541,0.9747644432441689,2.268071902534639,8.0,49.0,88.0,114.0,COMPLETE
4094,0.4966114016368454,2024-04-11 16:59:09.139943,2024-04-11 16:59:10.467485,0 days 00:00:01.327542,98.09576062190382,8.419591915270873,sigmoid,50,32.0,,,8.0,6.0,18.0,,,4.800306468739174,4.499266422787651,5.387483706541568,19.0,38.0,73.0,,COMPLETE
4095,0.44701971028259324,2024-04-11 16:59:10.475007,2024-04-11 16:59:11.414807,0 days 00:00:00.939800,99.97258022186917,8.172535781159826,sigmoid,8,,23.0,30.0,,,,,,,,,,,,,COMPLETE
4096,0.5120975609756098,2024-04-11 16:59:11.414807,2024-04-11 16:59:12.708511,0 days 00:00:01.293704,99.98720959273504,7.904377722292645,sigmoid,29,,25.0,31.0,1.0,8.0,52.0,21.0,28.0,,,,,,,61.0,COMPLETE
4097,0.3292585316160955,2024-04-11 16:59:12.708511,2024-04-11 16:59:13.869704,0 days 00:00:01.161193,99.99685582798814,7.44632860851905,sigmoid,24,,21.0,34.0,5.0,7.0,30.0,,,,,,,,,,COMPLETE
4098,0.6009432182607054,2024-04-11 16:59:13.869704,2024-04-11 16:59:14.843827,0 days 00:00:00.974123,96.61517910186697,8.101519660590773,sigmoid,8,,26.0,31.0,,,,,,,,,,,,,COMPLETE
4099,0.4982513143347097,2024-04-11 16:59:14.845958,2024-04-11 16:59:16.343040,0 days 00:00:01.497082,99.99012344603008,8.33178495551382,sigmoid,47,47.0,24.0,32.0,,,,49.0,49.0,7.940328213916069,3.193756813021314,1.8794122383889413,7.0,33.0,56.0,126.0,COMPLETE
4100,0.42840847520460834,2024-04-11 16:59:16.350617,2024-04-11 16:59:17.562792,0 days 00:00:01.212175,95.21141335611098,7.679547314218427,sigmoid,25,,27.0,30.0,7.0,4.0,27.0,,,,,,,,,54.0,COMPLETE
4101,0.3942281513748979,2024-04-11 16:59:17.562792,2024-04-11 16:59:19.007819,0 days 00:00:01.445027,96.51681203294423,8.590907765426914,sigmoid,22,,,,6.0,1.0,70.0,30.0,22.0,5.663550913851103,7.636217665331365,4.12600230141177,18.0,36.0,79.0,,COMPLETE
4102,0.3950004959825414,2024-04-11 16:59:19.015881,2024-04-11 16:59:20.351143,0 days 00:00:01.335262,98.20682553712042,7.963890805030411,sigmoid,39,12.0,,,,,,37.0,36.0,2.35474419530159,5.285913850427762,6.518090081245168,4.0,21.0,69.0,43.0,COMPLETE
4103,0.19075329912023462,2024-04-11 16:59:20.351143,2024-04-11 16:59:22.048816,0 days 00:00:01.697673,93.7420207594412,8.19683761233467,rbf,43,2.0,25.0,32.0,,,,,,2.8012210451756925,4.9600222259312154,8.778158897197335,11.0,31.0,75.0,24.0,COMPLETE
4104,0.5295788484537843,2024-04-11 16:59:22.048816,2024-04-11 16:59:23.312401,0 days 00:00:01.263585,96.75857990607368,7.785490663674982,sigmoid,35,44.0,,,,,,,,6.4390926817159215,9.237639217269411,4.973199233577309,13.0,24.0,76.0,77.0,COMPLETE
4105,0.12622036262203626,2024-04-11 16:59:23.312401,2024-04-11 16:59:24.265626,0 days 00:00:00.953225,98.21198592632035,8.389272388822539,sigmoid,8,,28.0,29.0,,,,,,,,,,,,,COMPLETE
4106,0.5109498709833932,2024-04-11 16:59:24.273665,2024-04-11 16:59:25.550033,0 days 00:00:01.276368,95.11137404814231,8.059513870331811,sigmoid,38,26.0,,,,,,26.0,34.0,3.7753743016116736,8.698978983159746,0.9338440734659015,3.0,48.0,86.0,,COMPLETE
4107,0.6009432182607054,2024-04-11 16:59:25.550033,2024-04-11 16:59:26.494661,0 days 00:00:00.944628,98.22374345667995,7.608826451977361,sigmoid,8,,25.0,31.0,,,,,,,,,,,,,COMPLETE
4108,0.5929369437606513,2024-04-11 16:59:26.494661,2024-04-11 16:59:27.459524,0 days 00:00:00.964863,71.93281999629772,7.884050333044045,sigmoid,8,,23.0,33.0,,,,,,,,,,,,,COMPLETE
4109,0.5336349109895798,2024-04-11 16:59:27.459524,2024-04-11 16:59:28.603125,0 days 00:00:01.143601,99.9973217343532,8.089550751826968,sigmoid,3,,,,,,,,,1.9188742393158273,8.117914539465232,1.4909120816198786,2.0,43.0,84.0,179.0,COMPLETE
4110,0.3791938963759733,2024-04-11 16:59:28.603125,2024-04-11 16:59:30.223345,0 days 00:00:01.620220,92.58577218017338,9.00850476981559,sigmoid,31,,26.0,27.0,2.0,3.0,24.0,42.0,8.0,0.9510299766986146,0.7386484243880798,3.6275982832078153,5.0,50.0,99.0,84.0,COMPLETE
4111,0.4774580335731416,2024-04-11 16:59:30.223345,2024-04-11 16:59:31.383151,0 days 00:00:01.159806,96.69900323757493,8.290724788995181,sigmoid,21,,,,3.0,5.0,33.0,9.0,26.0,,,,,,,103.0,COMPLETE
4112,0.45239228755058314,2024-04-11 16:59:31.383151,2024-04-11 16:59:32.339500,0 days 00:00:00.956349,99.9873813603132,7.316699007246852,sigmoid,8,,24.0,28.0,,,,,,,,,,,,,COMPLETE
4113,0.4840959021874105,2024-04-11 16:59:32.339500,2024-04-11 16:59:33.753144,0 days 00:00:01.413644,96.70200054662158,8.76481535174021,sigmoid,15,,26.0,30.0,,,,19.0,46.0,7.527239043672322,7.142923151573872,2.455974669412404,12.0,20.0,64.0,150.0,COMPLETE
4114,0.41887665749311986,2024-04-11 16:59:33.753144,2024-04-11 16:59:35.037898,0 days 00:00:01.284754,99.9745511246077,8.514013852295077,sigmoid,28,,27.0,32.0,4.0,8.0,78.0,40.0,13.0,,,,,,,,COMPLETE
4115,0.33937121237486184,2024-04-11 16:59:35.037898,2024-04-11 16:59:36.422680,0 days 00:00:01.384782,98.17802198217515,7.783633693558408,sigmoid,42,35.0,25.0,31.0,,,,,,8.669242036541265,3.586023904735613,3.4225492908259483,14.0,35.0,51.0,,COMPLETE
4116,0.34468466450095214,2024-04-11 16:59:36.422680,2024-04-11 16:59:37.758421,0 days 00:00:01.335741,99.99136500372514,8.187806054001703,sigmoid,14,,22.0,30.0,,,,45.0,48.0,6.831690563975714,2.4129380884491805,0.5122966180360988,13.0,40.0,74.0,,COMPLETE
4117,0.41436125620687436,2024-04-11 16:59:37.758421,2024-04-11 16:59:39.002162,0 days 00:00:01.243741,95.60858207748046,7.97195477957196,sigmoid,57,40.0,29.0,34.0,8.0,6.0,82.0,,,,,,,,,141.0,COMPLETE
4118,0.41007722254132356,2024-04-11 16:59:39.010189,2024-04-11 16:59:40.175648,0 days 00:00:01.165459,94.37218672610663,8.270759408274573,sigmoid,16,,,,2.0,2.0,67.0,,,,,,,,,,COMPLETE
4119,0.4435039260455532,2024-04-11 16:59:40.175648,2024-04-11 16:59:41.990969,0 days 00:00:01.815321,57.3684873966864,7.598045567900278,sigmoid,63,29.0,24.0,32.0,7.0,7.0,63.0,4.0,9.0,0.652906124469161,6.317860871439604,5.8330813411513525,17.0,39.0,95.0,167.0,COMPLETE
4120,0.12622036262203626,2024-04-11 16:59:41.990969,2024-04-11 16:59:43.084967,0 days 00:00:01.093998,98.13116671917138,7.908608436815726,sigmoid,8,,28.0,29.0,,,,,,,,,,,,,COMPLETE
4121,0.5034063943252278,2024-04-11 16:59:43.092000,2024-04-11 16:59:44.178368,0 days 00:00:01.086368,96.72949889252314,8.488614271338001,sigmoid,8,,23.0,36.0,,,,,,,,,,,,,COMPLETE
4122,0.2174017488229076,2024-04-11 16:59:44.178368,2024-04-11 16:59:45.734120,0 days 00:00:01.555752,91.84891361650484,8.072237322626629,rbf,41,10.0,26.0,31.0,,,,,,,,,,,,191.0,COMPLETE
4123,0.5268070414901945,2024-04-11 16:59:45.742143,2024-04-11 16:59:46.822818,0 days 00:00:01.080675,98.10837557884737,7.769243654376938,sigmoid,9,,27.0,33.0,,,,,,,,,,,,122.0,COMPLETE
4124,0.3845649117325418,2024-04-11 16:59:46.830658,2024-04-11 16:59:48.464564,0 days 00:00:01.633906,95.20700099459339,8.328844989616211,sigmoid,46,9.0,25.0,31.0,,,,3.0,2.0,8.390190733137317,7.423954486800517,1.77357226811923,3.0,34.0,61.0,,COMPLETE
4125,0.4371252498334444,2024-04-11 16:59:48.464564,2024-04-11 16:59:50.234109,0 days 00:00:01.769545,98.03859879163609,7.506193753756197,sigmoid,62,45.0,24.0,30.0,6.0,4.0,35.0,14.0,30.0,6.0580326174337005,4.140327353188329,1.1821916483836956,10.0,30.0,52.0,,COMPLETE
4126,0.5699741122831421,2024-04-11 16:59:50.234109,2024-04-11 16:59:51.665077,0 days 00:00:01.430968,98.13881932350363,8.114172357379998,sigmoid,2,,,,,,,,,1.6912485887458097,1.5503880505434737,6.837192283319469,20.0,37.0,87.0,,COMPLETE
4127,0.5952371952371952,2024-04-11 16:59:51.665077,2024-04-11 16:59:52.913999,0 days 00:00:01.248922,93.84117969412142,7.935675683447392,sigmoid,8,,26.0,32.0,,,,,,,,,,,,,COMPLETE
4128,0.4512950859356088,2024-04-11 16:59:52.913999,2024-04-11 16:59:54.053049,0 days 00:00:01.139050,96.0315487019881,8.593144438279964,sigmoid,8,,25.0,28.0,,,,,,,,,,,,,COMPLETE
4129,0.5986580986580987,2024-04-11 16:59:54.061596,2024-04-11 16:59:55.205768,0 days 00:00:01.144172,96.8590751148092,8.205986604401962,sigmoid,8,,23.0,31.0,,,,,,,,,,,,,COMPLETE
4130,0.12622036262203626,2024-04-11 16:59:55.205768,2024-04-11 16:59:56.260990,0 days 00:00:01.055222,98.24593644774001,7.777992367632638,sigmoid,8,,24.0,29.0,,,,,,,,,,,,,COMPLETE
4131,0.3808410532160496,2024-04-11 16:59:56.260990,2024-04-11 16:59:58.257812,0 days 00:00:01.996822,99.99005116368082,8.384768134102673,sigmoid,26,,28.0,33.0,1.0,1.0,55.0,,,3.203822501787955,6.6913450051777055,3.943660518169561,6.0,26.0,77.0,,COMPLETE
4132,0.5362378825835966,2024-04-11 16:59:58.265816,2024-04-11 16:59:59.421303,0 days 00:00:01.155487,99.97175218371616,8.008335692131068,sigmoid,37,48.0,,,,,,48.0,5.0,,,,,,,66.0,COMPLETE
4133,0.34377351729080813,2024-04-11 16:59:59.424131,2024-04-11 17:00:01.054804,0 days 00:00:01.630673,96.575875101038,7.691971978617554,sigmoid,10,,26.0,30.0,,,,,,4.634693895893383,3.936884082217318,8.401629818597039,8.0,29.0,65.0,,COMPLETE
4134,0.5963643249384587,2024-04-11 17:00:01.054804,2024-04-11 17:00:02.130834,0 days 00:00:01.076030,94.43605376325746,8.158164320827176,sigmoid,8,,30.0,32.0,,,,,,,,,,,,,COMPLETE
4135,0.3704714470901276,2024-04-11 17:00:02.139403,2024-04-11 17:00:03.821337,0 days 00:00:01.681934,99.9874106531162,8.85840547761587,sigmoid,11,,27.0,31.0,,,,,,3.4946501477153595,9.074379564174787,6.073690415292334,15.0,23.0,98.0,184.0,COMPLETE
4136,0.48778296802012217,2024-04-11 17:00:03.821337,2024-04-11 17:00:05.241073,0 days 00:00:01.419736,98.17169965173136,7.385774207872152,sigmoid,56,16.0,25.0,50.0,4.0,3.0,49.0,,,,,,,,,,COMPLETE
4137,0.451947904548421,2024-04-11 17:00:05.241073,2024-04-11 17:00:06.778347,0 days 00:00:01.537274,96.73518349545277,8.412405268814195,sigmoid,52,23.0,,,5.0,2.0,16.0,36.0,50.0,,,,,,,,COMPLETE
4138,0.12622036262203626,2024-04-11 17:00:06.778347,2024-04-11 17:00:07.836082,0 days 00:00:01.057735,98.16871664910728,8.007893179172449,sigmoid,8,,21.0,29.0,,,,,,,,,,,,,COMPLETE
4139,0.4515024944889198,2024-04-11 17:00:07.836082,2024-04-11 17:00:09.555107,0 days 00:00:01.719025,90.70910507101522,8.636127051072872,sigmoid,55,7.0,,,3.0,6.0,72.0,23.0,6.0,6.659328785017832,6.041332420333627,9.815817680537133,19.0,27.0,93.0,13.0,COMPLETE
4140,0.4628886951467597,2024-04-11 17:00:09.555107,2024-04-11 17:00:11.561786,0 days 00:00:02.006679,95.1021849771887,7.847562217320344,rbf,8,,24.0,34.0,,,,,,,,,,,,,COMPLETE
4141,0.4502698896972542,2024-04-11 17:00:11.570397,2024-04-11 17:00:12.627383,0 days 00:00:01.056986,98.16917579749784,8.227109804753324,sigmoid,8,,23.0,30.0,,,,,,,,,,,,,COMPLETE
4142,0.4691479188685893,2024-04-11 17:00:12.634903,2024-04-11 17:00:13.898218,0 days 00:00:01.263315,42.51963022002256,7.581371742817788,sigmoid,20,,,,8.0,5.0,59.0,33.0,16.0,,,,,,,,COMPLETE
4143,0.5088473623284273,2024-04-11 17:00:13.898218,2024-04-11 17:00:15.524966,0 days 00:00:01.626748,96.65769020387947,7.964477128220814,sigmoid,13,,26.0,32.0,,,,27.0,19.0,,,,,,,36.0,COMPLETE
4144,0.26563646566236454,2024-04-11 17:00:15.524966,2024-04-11 17:00:16.692744,0 days 00:00:01.167778,93.54353768359233,8.269281924722108,sigmoid,36,25.0,,,,,,20.0,35.0,,,,,,,,COMPLETE
4145,0.5929369437606513,2024-04-11 17:00:16.694744,2024-04-11 17:00:17.700073,0 days 00:00:01.005329,98.34176699441588,6.220599554451439,sigmoid,8,,25.0,33.0,,,,,,,,,,,,,COMPLETE
4146,0.4581224114127934,2024-04-11 17:00:17.702079,2024-04-11 17:00:19.522526,0 days 00:00:01.820447,95.4353145367815,7.088349019465122,sigmoid,59,37.0,27.0,31.0,2.0,3.0,91.0,,,2.999774753695013,3.324266124918052,7.432590386038132,14.0,23.0,60.0,163.0,COMPLETE
4147,0.5351947768450716,2024-04-11 17:00:19.526526,2024-04-11 17:00:20.842906,0 days 00:00:01.316380,99.95126973605764,7.699137726725513,sigmoid,48,21.0,,,7.0,7.0,10.0,,,,,,,,,,COMPLETE
4148,0.4968611479873096,2024-04-11 17:00:20.845879,2024-04-11 17:00:22.370427,0 days 00:00:01.524548,98.16961352467412,8.463300155378008,sigmoid,44,19.0,22.0,30.0,,,,32.0,40.0,,,,,,,,COMPLETE
4149,0.4437792222602349,2024-04-11 17:00:22.373395,2024-04-11 17:00:24.183250,0 days 00:00:01.809855,96.52149307768643,8.091192477765922,sigmoid,60,27.0,25.0,31.0,4.0,4.0,79.0,16.0,28.0,,,,,,,,COMPLETE
4150,0.4286461216706649,2024-04-11 17:00:24.184766,2024-04-11 17:00:25.549970,0 days 00:00:01.365204,92.97012408783782,7.864252718550627,sigmoid,54,33.0,,,1.0,8.0,87.0,2.0,37.0,7.699010856330492,1.0610614423147,7.8654743823998245,9.0,33.0,80.0,,COMPLETE
