number,value,datetime_start,datetime_complete,duration,params_C,params_gamma,params_kernel,params_mask_number,params_rsi_window,params_so_smooth,params_so_window,params_srsi_smooth1,params_srsi_smooth2,params_srsi_window,params_tsi_window_fast,params_tsi_window_slow,params_ult_weight_1,params_ult_weight_2,params_ult_weight_3,params_ult_window_1,params_ult_window_2,params_ult_window_3,params_williams_lbp,state
2304,0.4520663317166671,2024-04-11 16:23:56.164070,2024-04-11 16:23:57.127636,0 days 00:00:00.963566,93.65001913234207,8.302082385395737,sigmoid,59,7.0,27.0,30.0,4.0,7.0,100.0,,,8.465262288723803,3.129995045546053,5.103882734413614,11.0,30.0,66.0,61.0,COMPLETE
2305,0.3645654606490116,2024-04-11 16:23:57.128636,2024-04-11 16:23:58.242898,0 days 00:00:01.114262,99.99823002360397,8.827221043789855,rbf,12,,29.0,32.0,,,,4.0,10.0,,,,,,,,COMPLETE
2306,0.5883953883953884,2024-04-11 16:23:58.243923,2024-04-11 16:23:58.914131,0 days 00:00:00.670208,99.97109294387988,7.368740394243965,sigmoid,8,,25.0,34.0,,,,,,,,,,,,,COMPLETE
2307,0.45347172512526845,2024-04-11 16:23:58.916131,2024-04-11 16:23:59.703110,0 days 00:00:00.786979,96.64057489873038,7.8965549858693205,sigmoid,8,,26.0,28.0,,,,,,,,,,,,,COMPLETE
2308,0.5037447675076366,2024-04-11 16:23:59.705265,2024-04-11 16:24:00.526481,0 days 00:00:00.821216,96.83410559516179,8.177959185375085,sigmoid,7,,,,,,,36.0,35.0,7.952066398163854,7.645339485574416,2.4618393542277563,12.0,31.0,68.0,154.0,COMPLETE
2309,0.5473510947787474,2024-04-11 16:24:00.527491,2024-04-11 16:24:01.270848,0 days 00:00:00.743357,95.26784220976866,7.660166597793805,sigmoid,36,3.0,,,,,,48.0,2.0,,,,,,,,COMPLETE
2310,0.5963245096172158,2024-04-11 16:24:01.272847,2024-04-11 16:24:01.948699,0 days 00:00:00.675852,98.2553980010589,8.622407419698447,sigmoid,8,,24.0,31.0,,,,,,,,,,,,,COMPLETE
2311,0.4970034144361405,2024-04-11 16:24:01.950699,2024-04-11 16:24:02.778522,0 days 00:00:00.827823,98.23870243257966,7.9853649921530865,sigmoid,60,42.0,26.0,27.0,8.0,2.0,47.0,16.0,17.0,,,,,,,,COMPLETE
2312,0.45345352376492626,2024-04-11 16:24:02.780684,2024-04-11 16:24:03.412691,0 days 00:00:00.632007,99.94032603439247,8.265464509540953,sigmoid,8,,22.0,30.0,,,,,,,,,,,,,COMPLETE
2313,0.4790820784293571,2024-04-11 16:24:03.414724,2024-04-11 16:24:04.303608,0 days 00:00:00.888884,96.77311390775343,9.883842698812142,sigmoid,23,,,,2.0,7.0,54.0,46.0,12.0,5.2854798966918475,4.003610684155878,7.552873034447976,16.0,38.0,53.0,174.0,COMPLETE
2314,0.5955035642478522,2024-04-11 16:24:04.305796,2024-04-11 16:24:04.952940,0 days 00:00:00.647144,93.81323035619076,7.804056030622164,sigmoid,1,,,,,,,,,,,,,,,41.0,COMPLETE
2315,0.43064208120715025,2024-04-11 16:24:04.953941,2024-04-11 16:24:05.593759,0 days 00:00:00.639818,98.31130578489766,8.425380869892674,sigmoid,5,,,,,,,30.0,37.0,,,,,,,84.0,COMPLETE
2316,0.3561038542170618,2024-04-11 16:24:05.594759,2024-04-11 16:24:06.646018,0 days 00:00:01.051259,95.45591107210919,8.127469583221686,sigmoid,30,,27.0,31.0,3.0,8.0,13.0,8.0,44.0,1.0425210690231186,2.856660685494617,3.909486604250299,6.0,41.0,61.0,,COMPLETE
2317,0.43930879831156844,2024-04-11 16:24:06.647020,2024-04-11 16:24:07.574646,0 days 00:00:00.927626,98.04614424052268,7.526300053668701,sigmoid,54,48.0,,,5.0,6.0,19.0,33.0,29.0,4.026105619150954,5.582097722767562,7.058674847243941,9.0,49.0,50.0,,COMPLETE
2318,0.5585418781978537,2024-04-11 16:24:07.575644,2024-04-11 16:24:08.161830,0 days 00:00:00.586186,98.16493184416645,8.014245845051265,sigmoid,4,,,,,,,41.0,5.0,,,,,,,,COMPLETE
2319,0.5952371952371952,2024-04-11 16:24:08.163832,2024-04-11 16:24:08.786396,0 days 00:00:00.622564,76.7701594534231,7.817961699454559,sigmoid,8,,24.0,32.0,,,,,,,,,,,,,COMPLETE
2320,0.4319931808495525,2024-04-11 16:24:08.787453,2024-04-11 16:24:09.660823,0 days 00:00:00.873370,95.53143636486853,8.255965259074774,sigmoid,61,34.0,25.0,33.0,1.0,1.0,77.0,18.0,27.0,,,,,,,158.0,COMPLETE
2321,0.5113220039726329,2024-04-11 16:24:09.663022,2024-04-11 16:24:10.384210,0 days 00:00:00.721188,98.25620070944035,8.52880956529424,sigmoid,40,13.0,23.0,29.0,,,,,,,,,,,,,COMPLETE
2322,0.6009432182607054,2024-04-11 16:24:10.386287,2024-04-11 16:24:11.015054,0 days 00:00:00.628767,93.6616708690512,8.074652335832672,sigmoid,8,,26.0,31.0,,,,,,,,,,,,,COMPLETE
2323,0.44701971028259324,2024-04-11 16:24:11.017054,2024-04-11 16:24:11.652634,0 days 00:00:00.635580,96.66336362478353,7.691071145942667,sigmoid,8,,25.0,30.0,,,,,,,,,,,,,COMPLETE
2324,0.2628187675832653,2024-04-11 16:24:11.653637,2024-04-11 16:24:12.794969,0 days 00:00:01.141332,98.28260967936963,8.307407170276408,rbf,53,18.0,,,4.0,4.0,57.0,42.0,33.0,,,,,,,49.0,COMPLETE
2325,0.5407020164301718,2024-04-11 16:24:12.797035,2024-04-11 16:24:13.541677,0 days 00:00:00.744642,95.42511122036551,4.213996022698245,sigmoid,34,33.0,,,,,,,,3.5090685922804843,8.649887112247981,9.301874951972241,14.0,36.0,78.0,,COMPLETE
2326,0.5716972175564156,2024-04-11 16:24:13.543953,2024-04-11 16:24:14.129741,0 days 00:00:00.585788,99.92728308768248,7.8647794695641045,sigmoid,32,10.0,,,,,,,,,,,,,,,COMPLETE
2327,0.5202217203859577,2024-04-11 16:24:14.130923,2024-04-11 16:24:14.765676,0 days 00:00:00.634753,96.89621991584832,8.050742256060602,sigmoid,33,28.0,,,,,,,,,,,,,,28.0,COMPLETE
2328,0.4825159709880397,2024-04-11 16:24:14.767673,2024-04-11 16:24:15.673583,0 days 00:00:00.905910,4.884075579221097,7.1919335858349,sigmoid,51,5.0,,,7.0,4.0,66.0,,,5.716450065698611,4.800930040784912,1.9553642690524873,10.0,40.0,81.0,124.0,COMPLETE
2329,0.5929369437606513,2024-04-11 16:24:15.674583,2024-04-11 16:24:16.272554,0 days 00:00:00.597971,98.2265810997847,8.467067750274438,sigmoid,8,,27.0,33.0,,,,,,,,,,,,,COMPLETE
2330,0.3798655517297918,2024-04-11 16:24:16.273582,2024-04-11 16:24:16.926327,0 days 00:00:00.652745,93.82866653534538,8.205766665686317,sigmoid,17,,,,2.0,2.0,43.0,,,,,,,,,151.0,COMPLETE
2331,0.5952371952371952,2024-04-11 16:24:16.927328,2024-04-11 16:24:17.542495,0 days 00:00:00.615167,96.7868339327645,7.488519791389435,sigmoid,8,,28.0,32.0,,,,,,,,,,,,,COMPLETE
2332,0.5015072926364322,2024-04-11 16:24:17.544495,2024-04-11 16:24:18.343996,0 days 00:00:00.799501,99.91541118601015,7.931184689985626,sigmoid,18,,,,8.0,5.0,81.0,,,9.633143260757327,6.967316069170529,8.386783608012623,7.0,38.0,75.0,,COMPLETE
2333,0.4547987108756213,2024-04-11 16:24:18.345007,2024-04-11 16:24:19.333354,0 days 00:00:00.988347,98.05604635213993,8.678583472302018,sigmoid,27,,25.0,31.0,6.0,3.0,94.0,,,7.495462310494249,6.443906441285632,6.526234120180904,2.0,37.0,100.0,58.0,COMPLETE
2334,0.44701971028259324,2024-04-11 16:24:19.335352,2024-04-11 16:24:19.951005,0 days 00:00:00.615653,99.94130763218726,7.784768831280986,sigmoid,8,,24.0,30.0,,,,,,,,,,,,,COMPLETE
2335,0.3877335794087598,2024-04-11 16:24:19.952192,2024-04-11 16:24:20.724247,0 days 00:00:00.772055,94.96401989813643,8.193066585506703,sigmoid,45,46.0,23.0,32.0,,,,15.0,8.0,,,,,,,73.0,COMPLETE
2336,0.36639676113360325,2024-04-11 16:24:20.725246,2024-04-11 16:24:21.430972,0 days 00:00:00.705726,96.68712315586365,8.416241501372166,sigmoid,49,21.0,,,5.0,8.0,21.0,,,,,,,,,146.0,COMPLETE
2337,0.4730234716557165,2024-04-11 16:24:21.431974,2024-04-11 16:24:22.301456,0 days 00:00:00.869482,98.35281186319722,8.015308516917498,sigmoid,39,9.0,,,,,,2.0,23.0,0.500828744559823,5.435437299697462,4.265497701460964,15.0,34.0,65.0,79.0,COMPLETE
2338,0.5487861953889669,2024-04-11 16:24:22.303510,2024-04-11 16:24:23.089414,0 days 00:00:00.785904,96.73037505400312,7.688161222958349,sigmoid,6,,,,,,,23.0,13.0,6.786979173177162,4.181568838583109,5.78353236899059,9.0,47.0,73.0,,COMPLETE
2339,0.4606747180357321,2024-04-11 16:24:23.091415,2024-04-11 16:24:23.837972,0 days 00:00:00.746557,99.922382201628,8.292841484644418,sigmoid,25,,26.0,29.0,4.0,6.0,75.0,,,,,,,,,91.0,COMPLETE
2340,0.5087619131274979,2024-04-11 16:24:23.840121,2024-04-11 16:24:24.719337,0 days 00:00:00.879216,99.99880931925775,7.941661195490475,sigmoid,19,,,,3.0,5.0,17.0,,,9.237436574458187,7.92831007390298,3.6413149208717304,17.0,21.0,58.0,119.0,COMPLETE
2341,0.5895095625828441,2024-04-11 16:24:24.721381,2024-04-11 16:24:25.376834,0 days 00:00:00.655453,95.0054341444363,8.132394238476778,sigmoid,8,,27.0,34.0,,,,,,,,,,,,,COMPLETE
2342,0.47108544233200306,2024-04-11 16:24:25.378824,2024-04-11 16:24:26.287375,0 days 00:00:00.908551,98.04888548432314,7.573273651122547,sigmoid,43,50.0,25.0,31.0,,,,,,2.301735368185173,0.8523065501328535,6.016713905207983,18.0,25.0,82.0,64.0,COMPLETE
2343,0.4817948474189561,2024-04-11 16:24:26.288566,2024-04-11 16:24:27.130867,0 days 00:00:00.842301,93.77408230708414,8.789933978744383,sigmoid,50,3.0,,,1.0,7.0,72.0,,,6.361467158584686,3.8735147726424106,0.7192526273121773,20.0,46.0,72.0,,COMPLETE
2344,0.41665387802707105,2024-04-11 16:24:27.132867,2024-04-11 16:24:28.082520,0 days 00:00:00.949653,96.56046310789016,8.52755040446002,sigmoid,47,27.0,29.0,29.0,,,,27.0,48.0,8.630769987767476,8.298991899949982,3.1271296213257926,13.0,32.0,93.0,99.0,COMPLETE
2345,0.37240286022665947,2024-04-11 16:24:28.084520,2024-04-11 16:24:29.242157,0 days 00:00:01.157637,99.95202871781444,7.373263698218004,rbf,24,,21.0,30.0,7.0,1.0,25.0,,,,,,,,,,COMPLETE
2346,0.5952371952371952,2024-04-11 16:24:29.244155,2024-04-11 16:24:29.853601,0 days 00:00:00.609446,98.21321659353436,7.849526242565642,sigmoid,8,,24.0,32.0,,,,,,,,,,,,,COMPLETE
2347,0.45350519192023553,2024-04-11 16:24:29.854600,2024-04-11 16:24:30.691072,0 days 00:00:00.836472,96.62194021583029,8.16037889022937,sigmoid,29,,26.0,33.0,8.0,4.0,86.0,20.0,45.0,,,,,,,128.0,COMPLETE
2348,0.4713074099791687,2024-04-11 16:24:30.693071,2024-04-11 16:24:31.612972,0 days 00:00:00.919901,98.27947372822078,8.416694770630032,sigmoid,58,23.0,24.0,31.0,6.0,3.0,38.0,,,7.733413716376088,5.209952937578393,4.7991730891031885,19.0,35.0,69.0,,COMPLETE
2349,0.5069140556625241,2024-04-11 16:24:31.615062,2024-04-11 16:24:32.236897,0 days 00:00:00.621835,95.24380154038333,7.977605919660082,sigmoid,8,,23.0,35.0,,,,,,,,,,,,,COMPLETE
2350,0.4442391484198334,2024-04-11 16:24:32.238897,2024-04-11 16:24:32.982652,0 days 00:00:00.743755,98.31092600028656,7.694841407460262,sigmoid,21,,,,5.0,8.0,35.0,29.0,41.0,,,,,,,95.0,COMPLETE
2351,0.4833288419608516,2024-04-11 16:24:32.983653,2024-04-11 16:24:34.004600,0 days 00:00:01.020947,96.62595882592807,8.207723781655035,sigmoid,31,,27.0,28.0,4.0,7.0,29.0,3.0,18.0,2.8472570943758884,6.1558467537425745,8.856821950579269,4.0,42.0,97.0,108.0,COMPLETE
2352,0.44701971028259324,2024-04-11 16:24:34.006613,2024-04-11 16:24:34.618459,0 days 00:00:00.611846,99.9403865869713,8.013168205776056,sigmoid,8,,25.0,30.0,,,,,,,,,,,,,COMPLETE
2353,0.5464239949612318,2024-04-11 16:24:34.619460,2024-04-11 16:24:35.545591,0 days 00:00:00.926131,98.16301720002222,9.586785811793506,sigmoid,22,,,,7.0,2.0,15.0,34.0,15.0,9.805871590950048,9.369508751600172,7.9999540948276096,3.0,45.0,84.0,,COMPLETE
2354,0.5963643249384587,2024-04-11 16:24:35.547794,2024-04-11 16:24:36.151216,0 days 00:00:00.603422,93.55300042785898,8.376789447090918,sigmoid,8,,28.0,32.0,,,,,,,,,,,,,COMPLETE
2355,0.5261052953646437,2024-04-11 16:24:36.153216,2024-04-11 16:24:36.980714,0 days 00:00:00.827498,96.55326789700376,7.755760649013104,sigmoid,35,45.0,,,,,,,,5.46802206972478,2.5168127261816426,5.386291238383654,5.0,43.0,80.0,138.0,COMPLETE
2356,0.488212257177685,2024-04-11 16:24:36.982768,2024-04-11 16:24:37.749761,0 days 00:00:00.766993,99.9099971752005,8.588786189141683,sigmoid,28,,26.0,31.0,3.0,6.0,68.0,39.0,9.0,,,,,,,,COMPLETE
2357,0.44450155629800964,2024-04-11 16:24:37.751813,2024-04-11 16:24:38.597285,0 days 00:00:00.845472,95.12089049573358,8.107724860076056,sigmoid,57,40.0,30.0,33.0,2.0,5.0,62.0,,,,,,,,,25.0,COMPLETE
2358,0.44701971028259324,2024-04-11 16:24:38.599458,2024-04-11 16:24:39.226222,0 days 00:00:00.626764,99.93878410708939,7.895146590554659,sigmoid,8,,22.0,30.0,,,,,,,,,,,,,COMPLETE
2359,0.26678805219577756,2024-04-11 16:24:39.228268,2024-04-11 16:24:40.007047,0 days 00:00:00.778779,69.189127202848,8.33427566408649,sigmoid,3,,,,,,,,,1.7162076532726855,9.187697828719672,9.717296268285047,11.0,49.0,52.0,13.0,COMPLETE
2360,0.3783889723655844,2024-04-11 16:24:40.009352,2024-04-11 16:24:40.937352,0 days 00:00:00.928000,98.01777926028454,7.538553735593217,sigmoid,15,,24.0,29.0,,,,40.0,11.0,7.014622988941713,9.692703938175587,4.467047251598966,16.0,23.0,56.0,161.0,COMPLETE
2361,0.5986580986580987,2024-04-11 16:24:40.938353,2024-04-11 16:24:41.539383,0 days 00:00:00.601030,73.04009649634271,8.175237640144314,sigmoid,8,,26.0,31.0,,,,,,,,,,,,,COMPLETE
2362,0.32643197229836957,2024-04-11 16:24:41.540383,2024-04-11 16:24:42.358279,0 days 00:00:00.817896,99.99083610983924,7.952304639684002,sigmoid,38,39.0,,,,,,47.0,30.0,4.96729476147497,1.996776785499291,7.400447110973767,6.0,33.0,74.0,,COMPLETE
2363,0.21880666609101113,2024-04-11 16:24:42.359433,2024-04-11 16:24:43.557037,0 days 00:00:01.197604,96.65732149624596,7.735313963442064,rbf,42,36.0,25.0,32.0,,,,,,8.26656373681212,1.0729758429514602,4.085250899914355,8.0,24.0,87.0,,COMPLETE
2364,0.36344165188581373,2024-04-11 16:24:43.559249,2024-04-11 16:24:44.503055,0 days 00:00:00.943806,93.43255017208782,8.364259907242278,sigmoid,14,,27.0,30.0,,,,25.0,28.0,6.555255124721519,7.443385771290486,1.3122344615643629,12.0,44.0,99.0,,COMPLETE
2365,0.4621611343510621,2024-04-11 16:24:44.504056,2024-04-11 16:24:45.612316,0 days 00:00:01.108260,99.9814573869965,8.084320756723354,sigmoid,63,30.0,23.0,31.0,1.0,2.0,91.0,13.0,25.0,9.454609404738772,5.858732144421265,2.1650778894962475,14.0,28.0,92.0,186.0,COMPLETE
2366,0.5940618478467085,2024-04-11 16:24:45.614316,2024-04-11 16:24:46.289374,0 days 00:00:00.675058,98.13010462529265,8.918794335083128,sigmoid,8,,25.0,33.0,,,,,,,,,,,,,COMPLETE
2367,0.3919141647545487,2024-04-11 16:24:46.290369,2024-04-11 16:24:47.243232,0 days 00:00:00.952863,95.33409231835593,8.63503446682572,sigmoid,46,29.0,24.0,28.0,,,,5.0,40.0,0.8860130560915129,8.891884001969009,6.893944670462511,7.0,40.0,77.0,,COMPLETE
2368,0.5418471337579619,2024-04-11 16:24:47.245247,2024-04-11 16:24:47.900119,0 days 00:00:00.654872,96.90709617095743,7.904040199753097,sigmoid,9,,28.0,32.0,,,,,,,,,,,,104.0,COMPLETE
2369,0.5883953883953884,2024-04-11 16:24:47.902192,2024-04-11 16:24:48.510369,0 days 00:00:00.608177,98.06147523626714,7.294109151303378,sigmoid,8,,26.0,34.0,,,,,,,,,,,,,COMPLETE
2370,0.5667594449674594,2024-04-11 16:24:48.512513,2024-04-11 16:24:49.252386,0 days 00:00:00.739873,95.27595692618742,8.27044155217724,sigmoid,2,,,,,,,,,2.502502334180091,4.490125659801694,1.7349164322201007,2.0,26.0,89.0,,COMPLETE
2371,0.3782359179090512,2024-04-11 16:24:49.254527,2024-04-11 16:24:50.285427,0 days 00:00:01.030900,97.93603238195243,7.599335379604723,sigmoid,62,11.0,27.0,30.0,5.0,1.0,6.0,31.0,3.0,7.4066791856359595,3.389192578130052,5.197059050375264,10.0,30.0,95.0,,COMPLETE
2372,0.12622036262203626,2024-04-11 16:24:50.286427,2024-04-11 16:24:50.924692,0 days 00:00:00.638265,99.98297347773016,7.78479924383889,sigmoid,8,,25.0,29.0,,,,,,,,,,,,,COMPLETE
2373,0.49852271020081124,2024-04-11 16:24:50.927873,2024-04-11 16:24:51.821491,0 days 00:00:00.893618,96.6592038748626,8.105104153522293,sigmoid,26,,22.0,31.0,8.0,4.0,58.0,,,1.4089480027113077,7.205869425306289,9.081079408013487,20.0,31.0,76.0,,COMPLETE
2374,0.4855352311356751,2024-04-11 16:24:51.823582,2024-04-11 16:24:52.651482,0 days 00:00:00.827900,98.13900991079069,5.462288355355183,sigmoid,10,,24.0,32.0,,,,,,4.74324000842694,6.634433861038881,2.769973604029871,19.0,21.0,85.0,,COMPLETE
2375,0.3654234406545532,2024-04-11 16:24:52.652600,2024-04-11 16:24:53.381422,0 days 00:00:00.728822,93.44660948271007,8.53832561396538,sigmoid,41,24.0,26.0,31.0,,,,,,,,,,,,180.0,COMPLETE
2376,0.12622036262203626,2024-04-11 16:24:53.383430,2024-04-11 16:24:54.006157,0 days 00:00:00.622727,99.9631545190352,8.236270555314942,sigmoid,8,,25.0,29.0,,,,,,,,,,,,,COMPLETE
2377,0.20335174609118994,2024-04-11 16:24:54.007156,2024-04-11 16:24:54.706667,0 days 00:00:00.699511,99.95305572709776,7.925388504178972,sigmoid,20,,,,6.0,3.0,45.0,37.0,47.0,,,,,,,,COMPLETE
2378,0.44701971028259324,2024-04-11 16:24:54.707664,2024-04-11 16:24:55.412252,0 days 00:00:00.704588,95.39538499074057,7.4630693911955825,sigmoid,8,,24.0,30.0,,,,,,,,,,,,,COMPLETE
2379,0.41274228656324496,2024-04-11 16:24:55.413348,2024-04-11 16:24:56.276907,0 days 00:00:00.863559,99.98105318915775,8.396482245213607,sigmoid,11,,27.0,33.0,,,,,,5.923683621846315,1.5115154536220872,9.515156860570947,13.0,50.0,79.0,18.0,COMPLETE
2380,0.37839721254355396,2024-04-11 16:24:56.277903,2024-04-11 16:24:57.367655,0 days 00:00:01.089752,96.72032303716826,8.085194476634646,rbf,56,8.0,20.0,31.0,3.0,6.0,52.0,,,,,,,,,,COMPLETE
2381,0.5931679318644695,2024-04-11 16:24:57.369706,2024-04-11 16:24:57.980291,0 days 00:00:00.610585,98.19494012140206,7.697278491402504,sigmoid,8,,29.0,27.0,,,,,,,,,,,,,COMPLETE
2382,0.5952371952371952,2024-04-11 16:24:57.982291,2024-04-11 16:24:58.597173,0 days 00:00:00.614882,99.97441089533942,7.982878006214926,sigmoid,8,,23.0,32.0,,,,,,,,,,,,,COMPLETE
2383,0.45345352376492626,2024-04-11 16:24:58.599172,2024-04-11 16:24:59.277605,0 days 00:00:00.678433,95.19769955388853,8.266578978659675,sigmoid,8,,26.0,30.0,,,,,,,,,,,,,COMPLETE
2384,0.5555245535714285,2024-04-11 16:24:59.279714,2024-04-11 16:24:59.936055,0 days 00:00:00.656341,47.43925239718515,7.831602093065482,sigmoid,16,,,,7.0,8.0,79.0,,,,,,,,,,COMPLETE
2385,0.5219353276541416,2024-04-11 16:24:59.939204,2024-04-11 16:25:00.671180,0 days 00:00:00.731976,96.81087969859685,7.101419304513936,sigmoid,48,16.0,,,2.0,7.0,23.0,,,,,,,,,,COMPLETE
2386,0.3116748938124211,2024-04-11 16:25:00.672192,2024-04-11 16:25:01.345980,0 days 00:00:00.673788,93.36969338390551,8.131824054624005,sigmoid,37,19.0,,,,,,43.0,14.0,,,,,,,195.0,COMPLETE
2387,0.5906279643331437,2024-04-11 16:25:01.348200,2024-04-11 16:25:01.961689,0 days 00:00:00.613489,97.97504457735258,8.515683056457128,sigmoid,8,,23.0,34.0,,,,,,,,,,,,,COMPLETE
2388,0.39672511603919547,2024-04-11 16:25:01.962753,2024-04-11 16:25:02.647463,0 days 00:00:00.684710,98.11880780297504,7.641289936315739,sigmoid,12,,25.0,32.0,,,,45.0,30.0,,,,,,,,COMPLETE
2389,0.4740382998149883,2024-04-11 16:25:02.649523,2024-04-11 16:25:03.414777,0 days 00:00:00.765254,95.19267321497428,8.70061939114654,sigmoid,52,12.0,,,4.0,1.0,64.0,11.0,39.0,,,,,,,,COMPLETE
2390,0.5019738157105736,2024-04-11 16:25:03.416777,2024-04-11 16:25:04.141948,0 days 00:00:00.725171,98.123033865856,7.960558943386125,sigmoid,13,,28.0,36.0,,,,35.0,42.0,,,,,,,52.0,COMPLETE
2391,0.4382831890550275,2024-04-11 16:25:04.142950,2024-04-11 16:25:05.159929,0 days 00:00:01.016979,96.69036765567722,8.256445000768714,sigmoid,55,31.0,,,1.0,5.0,49.0,9.0,20.0,1.9809910019789627,1.774870141948234,6.347757841594703,17.0,41.0,98.0,113.0,COMPLETE
2392,0.37710827435676963,2024-04-11 16:25:05.161930,2024-04-11 16:25:06.180532,0 days 00:00:01.018602,98.19000560385255,7.8576552307485,sigmoid,59,33.0,26.0,31.0,7.0,2.0,8.0,,,5.149834893736992,2.676020664272525,0.9895869206740793,18.0,36.0,71.0,133.0,COMPLETE
2393,0.45345352376492626,2024-04-11 16:25:06.181533,2024-04-11 16:25:06.791129,0 days 00:00:00.609596,95.48137955652344,8.391130088953888,sigmoid,8,,24.0,30.0,,,,,,,,,,,,,COMPLETE
2394,0.49905080455613815,2024-04-11 16:25:06.792130,2024-04-11 16:25:07.593338,0 days 00:00:00.801208,93.43862177297515,8.086447375151218,sigmoid,44,48.0,27.0,33.0,,,,17.0,16.0,,,,,,,,COMPLETE
2395,0.45347172512526845,2024-04-11 16:25:07.595538,2024-04-11 16:25:08.226410,0 days 00:00:00.630872,98.1859741885337,7.467541538547895,sigmoid,8,,25.0,28.0,,,,,,,,,,,,,COMPLETE
2396,0.5504472271914133,2024-04-11 16:25:08.228412,2024-04-11 16:25:09.012111,0 days 00:00:00.783699,96.86572943322345,7.723494425455584,sigmoid,36,4.0,,,,,,22.0,7.0,,,,,,,,COMPLETE
2397,0.45309399517660354,2024-04-11 16:25:09.014228,2024-04-11 16:25:10.028394,0 days 00:00:01.014166,98.22007106812956,4.8773035653941195,sigmoid,23,,,,4.0,3.0,70.0,49.0,34.0,2.957390062372607,3.6560190514320645,8.267468835718276,7.0,48.0,64.0,122.0,COMPLETE
2398,0.4535156861721564,2024-04-11 16:25:10.030395,2024-04-11 16:25:11.011816,0 days 00:00:00.981421,95.2856870563022,8.16406451002184,sigmoid,54,22.0,,,6.0,6.0,83.0,26.0,4.0,4.4289819419002345,2.2628070999431547,8.707858107958533,9.0,34.0,90.0,,COMPLETE
2399,0.1512559602811778,2024-04-11 16:25:11.014000,2024-04-11 16:25:12.249605,0 days 00:00:01.235605,57.774396474128814,8.432744905185517,rbf,60,49.0,23.0,32.0,8.0,4.0,41.0,21.0,21.0,,,,,,,,COMPLETE
2400,0.12622036262203626,2024-04-11 16:25:12.251814,2024-04-11 16:25:12.875319,0 days 00:00:00.623505,96.69677917501647,7.949131235664622,sigmoid,8,,26.0,29.0,,,,,,,,,,,,,COMPLETE
2401,0.5986580986580987,2024-04-11 16:25:12.876334,2024-04-11 16:25:13.536743,0 days 00:00:00.660409,99.96770084633275,8.269524638911724,sigmoid,8,,24.0,31.0,,,,,,,,,,,,,COMPLETE
2402,0.49090000713724935,2024-04-11 16:25:13.537754,2024-04-11 16:25:14.430214,0 days 00:00:00.892460,93.43039600836991,7.7871580914263285,sigmoid,61,15.0,25.0,31.0,3.0,7.0,12.0,7.0,32.0,,,,,,,200.0,COMPLETE
2403,0.4448341684562156,2024-04-11 16:25:14.432214,2024-04-11 16:25:15.036410,0 days 00:00:00.604196,97.85064803188054,8.73929111710022,sigmoid,8,,22.0,30.0,,,,,,,,,,,,,COMPLETE
2404,0.12295002426006793,2024-04-11 16:25:15.037406,2024-04-11 16:25:15.662908,0 days 00:00:00.625502,98.27172338353078,8.027502163804826,sigmoid,32,25.0,,,,,,,,,,,,,,,COMPLETE
2405,0.5454200758331671,2024-04-11 16:25:15.663908,2024-04-11 16:25:16.389490,0 days 00:00:00.725582,95.2796851918459,7.579341007124894,sigmoid,40,42.0,27.0,32.0,,,,,,,,,,,,,COMPLETE
2406,0.5316579634464752,2024-04-11 16:25:16.391525,2024-04-11 16:25:17.011056,0 days 00:00:00.619531,99.99019782853415,8.496124347130342,sigmoid,33,41.0,,,,,,,,,,,,,,68.0,COMPLETE
2407,0.5831142381040548,2024-04-11 16:25:17.012059,2024-04-11 16:25:17.585641,0 days 00:00:00.573582,96.5193382725042,8.090058319182639,sigmoid,1,,,,,,,,,,,,,,,38.0,COMPLETE
