number,value,datetime_start,datetime_complete,duration,params_C,params_gamma,params_kernel,params_mask_number,params_rsi_window,params_so_smooth,params_so_window,params_srsi_smooth1,params_srsi_smooth2,params_srsi_window,params_tsi_window_fast,params_tsi_window_slow,params_ult_weight_1,params_ult_weight_2,params_ult_weight_3,params_ult_window_1,params_ult_window_2,params_ult_window_3,params_williams_lbp,state
6720,0.353253444709005,2024-04-11 17:58:55.919494,2024-04-11 17:58:58.629949,0 days 00:00:02.710455,98.22574735127124,7.809351206686774,rbf,19,,,,5.0,4.0,53.0,,,4.393297475747261,9.646256846924064,9.5839862796526,9.0,49.0,59.0,52.0,COMPLETE
6721,0.31574907543088404,2024-04-11 17:58:58.631831,2024-04-11 17:59:00.518445,0 days 00:00:01.886614,96.65468268463292,8.786781467596294,sigmoid,50,16.0,,,6.0,7.0,28.0,,,1.0624328107778638,9.26598502269007,1.4720965644396848,12.0,24.0,94.0,,COMPLETE
6722,0.45345352376492626,2024-04-11 17:59:00.522992,2024-04-11 17:59:01.953953,0 days 00:00:01.430961,94.28897701219039,8.2467910295584,sigmoid,8,,25.0,30.0,,,,,,,,,,,,,COMPLETE
6723,0.41219337627692104,2024-04-11 17:59:01.955932,2024-04-11 17:59:04.183919,0 days 00:00:02.227987,98.20902921825164,7.99981115974275,sigmoid,47,39.0,27.0,32.0,,,,24.0,36.0,4.9542521440988905,6.807339568964715,7.913379365211801,8.0,20.0,95.0,131.0,COMPLETE
6724,0.5513473996304044,2024-04-11 17:59:04.185914,2024-04-11 17:59:05.917322,0 days 00:00:01.731408,96.71502076826741,8.406188407858961,sigmoid,6,,,,,,,12.0,47.0,7.967597811361899,8.807172775211725,2.71484087346393,11.0,21.0,72.0,,COMPLETE
6725,0.4415336479821817,2024-04-11 17:59:05.919900,2024-04-11 17:59:07.749809,0 days 00:00:01.829909,95.40541372190883,7.733616088151461,sigmoid,29,,23.0,30.0,1.0,3.0,93.0,10.0,15.0,,,,,,,77.0,COMPLETE
6726,0.5986580986580987,2024-04-11 17:59:07.752760,2024-04-11 17:59:09.040966,0 days 00:00:01.288206,99.98181827877887,8.169737708624034,sigmoid,8,,25.0,31.0,,,,,,,,,,,,,COMPLETE
6727,0.5952371952371952,2024-04-11 17:59:09.043985,2024-04-11 17:59:10.380960,0 days 00:00:01.336975,98.03043717807637,7.897158087878853,sigmoid,8,,28.0,32.0,,,,,,,,,,,,,COMPLETE
6728,0.3910169600825434,2024-04-11 17:59:10.383960,2024-04-11 17:59:12.377868,0 days 00:00:01.993908,98.2202917529074,8.32863071230559,sigmoid,43,19.0,24.0,29.0,,,,,,8.994113873406175,7.332439130308192,8.487942098540437,16.0,29.0,53.0,172.0,COMPLETE
6729,0.3868129105251579,2024-04-11 17:59:12.383410,2024-04-11 17:59:13.979123,0 days 00:00:01.595713,99.9845038531719,8.10891262284658,sigmoid,24,,26.0,34.0,2.0,5.0,2.0,,,,,,,,,,COMPLETE
6730,0.44701971028259324,2024-04-11 17:59:13.981680,2024-04-11 17:59:15.214667,0 days 00:00:01.232987,96.78976590952541,7.571446959665308,sigmoid,8,,25.0,30.0,,,,,,,,,,,,,COMPLETE
6731,0.6009432182607054,2024-04-11 17:59:15.218254,2024-04-11 17:59:16.440106,0 days 00:00:01.221852,99.96874530747424,7.909727280581865,sigmoid,8,,23.0,31.0,,,,,,,,,,,,,COMPLETE
6732,0.5087013220613364,2024-04-11 17:59:16.443026,2024-04-11 17:59:18.288458,0 days 00:00:01.845432,99.95619712236477,8.682019874108178,sigmoid,39,45.0,,,,,,48.0,3.0,3.672326233586891,0.9205287219711016,6.642932374690966,15.0,47.0,86.0,144.0,COMPLETE
6733,0.288577610750484,2024-04-11 17:59:18.291922,2024-04-11 17:59:20.515463,0 days 00:00:02.223541,92.80211336779473,8.45862377567743,sigmoid,22,,,,7.0,6.0,42.0,19.0,29.0,4.742196319153425,3.888750901426384,7.4157455377430725,2.0,23.0,75.0,,COMPLETE
6734,0.41321505446480994,2024-04-11 17:59:20.519446,2024-04-11 17:59:22.900957,0 days 00:00:02.381511,95.01780130283282,4.770390353294889,sigmoid,15,,26.0,27.0,,,,32.0,25.0,6.613597704274699,0.6693700784195729,2.1293945849164975,14.0,34.0,66.0,89.0,COMPLETE
6735,0.5929369437606513,2024-04-11 17:59:22.903969,2024-04-11 17:59:24.234472,0 days 00:00:01.330503,99.99268716143813,8.202323762337631,sigmoid,8,,27.0,33.0,,,,,,,,,,,,,COMPLETE
6736,0.5952371952371952,2024-04-11 17:59:24.236580,2024-04-11 17:59:25.549032,0 days 00:00:01.312452,81.7708747535766,7.6962570055901125,sigmoid,8,,25.0,32.0,,,,,,,,,,,,,COMPLETE
6737,0.47759679301770946,2024-04-11 17:59:25.552616,2024-04-11 17:59:27.235601,0 days 00:00:01.682985,99.98683188993012,7.987131515727014,sigmoid,25,,46.0,30.0,8.0,4.0,78.0,,,,,,,,,188.0,COMPLETE
6738,0.32579592755090564,2024-04-11 17:59:27.237602,2024-04-11 17:59:29.154614,0 days 00:00:01.917012,96.31730201586257,8.296040547426633,sigmoid,3,,,,,,,,,5.238612082063776,5.497341872306033,4.006071228799071,19.0,22.0,56.0,27.0,COMPLETE
6739,0.4616534740545295,2024-04-11 17:59:29.156616,2024-04-11 17:59:31.287027,0 days 00:00:02.130411,90.54099412635414,7.479903272627604,rbf,8,,29.0,32.0,,,,,,,,,,,,,COMPLETE
6740,0.3849144376142216,2024-04-11 17:59:31.289030,2024-04-11 17:59:32.774615,0 days 00:00:01.485585,98.19303269004024,5.0615619909919785,sigmoid,21,,,,1.0,3.0,71.0,36.0,19.0,,,,,,,153.0,COMPLETE
6741,0.6009432182607054,2024-04-11 17:59:32.776604,2024-04-11 17:59:34.169616,0 days 00:00:01.393012,99.9771582922658,7.841924617937905,sigmoid,8,,24.0,31.0,,,,,,,,,,,,,COMPLETE
6742,0.3639147514615361,2024-04-11 17:59:34.172151,2024-04-11 17:59:36.146617,0 days 00:00:01.974466,99.96732517486667,8.06673571855282,sigmoid,28,,22.0,29.0,3.0,8.0,23.0,20.0,12.0,,,,,,,,COMPLETE
6743,0.33353035254850155,2024-04-11 17:59:36.148618,2024-04-11 17:59:38.144221,0 days 00:00:01.995603,95.09723030108209,8.539599867960119,sigmoid,35,2.0,,,,,,,,6.331681769819562,4.966843739357322,5.758451767944821,18.0,42.0,87.0,59.0,COMPLETE
6744,0.5340733455107489,2024-04-11 17:59:38.148215,2024-04-11 17:59:39.621034,0 days 00:00:01.472819,99.97292108442552,7.284865618243611,sigmoid,9,,26.0,35.0,,,,,,,,,,,,123.0,COMPLETE
6745,0.5214320563157773,2024-04-11 17:59:39.622967,2024-04-11 17:59:41.638784,0 days 00:00:02.015817,96.62151781610035,8.171282595789787,sigmoid,42,5.0,27.0,33.0,,,,,,9.554798253787347,1.812203134783985,4.594410034244072,10.0,37.0,83.0,,COMPLETE
6746,0.3310856855923389,2024-04-11 17:59:41.641297,2024-04-11 17:59:43.203659,0 days 00:00:01.562362,93.61763810714643,3.8205569316355463,sigmoid,38,46.0,,,,,,46.0,45.0,1.7855910105206716,8.970101141499727,7.154217895726478,7.0,43.0,74.0,,COMPLETE
6747,0.5637734351750817,2024-04-11 17:59:43.205659,2024-04-11 17:59:44.381854,0 days 00:00:01.176195,6.459640376928341,7.735739981718976,sigmoid,16,,,,5.0,2.0,32.0,,,,,,,,,,COMPLETE
6748,0.3670423190718394,2024-04-11 17:59:44.384852,2024-04-11 17:59:46.639043,0 days 00:00:02.254191,98.09977370763978,8.390145865306101,sigmoid,46,11.0,24.0,31.0,,,,22.0,33.0,2.724928049486075,1.39188097718981,3.6151029497900637,11.0,28.0,90.0,,COMPLETE
6749,0.38729996082095175,2024-04-11 17:59:46.641040,2024-04-11 17:59:49.434065,0 days 00:00:02.793025,96.309558760692,7.995463298241351,sigmoid,31,,28.0,28.0,6.0,6.0,14.0,50.0,43.0,7.131928674425618,4.311943930809238,4.328080141094215,4.0,39.0,62.0,36.0,COMPLETE
6750,0.25730532301374187,2024-04-11 17:59:49.436057,2024-04-11 17:59:50.906072,0 days 00:00:01.470015,98.1973685035707,9.071008663510735,sigmoid,2,,,,,,,,,8.45590426470778,6.51453580765982,9.107861366751504,13.0,27.0,69.0,,COMPLETE
6751,0.4562496378281277,2024-04-11 17:59:50.909119,2024-04-11 17:59:53.446887,0 days 00:00:02.537768,96.54944894088575,9.570147429961,sigmoid,62,37.0,25.0,30.0,4.0,1.0,96.0,41.0,23.0,3.211218830410036,0.5080321584031964,8.271833457337143,17.0,36.0,58.0,,COMPLETE
6752,0.5116546486836117,2024-04-11 17:59:53.448884,2024-04-11 17:59:55.756973,0 days 00:00:02.308089,98.01694819680237,7.0543288517108795,sigmoid,14,,21.0,32.0,,,,15.0,13.0,9.238426496360734,6.259779387218037,9.989279805875125,16.0,45.0,78.0,,COMPLETE
6753,0.4713169730924012,2024-04-11 17:59:55.760979,2024-04-11 17:59:58.407387,0 days 00:00:02.646408,85.17017556206194,8.230951338747188,sigmoid,63,35.0,23.0,31.0,8.0,7.0,65.0,29.0,50.0,2.401469264633346,2.675305790998174,3.1404760091879886,9.0,30.0,52.0,20.0,COMPLETE
6754,0.4722560445294835,2024-04-11 17:59:58.410382,2024-04-11 18:00:00.548811,0 days 00:00:02.138429,94.21475601685427,7.86641611068221,sigmoid,57,22.0,26.0,30.0,2.0,5.0,40.0,,,,,,,,,44.0,COMPLETE
6755,0.3023194017386023,2024-04-11 18:00:00.552021,2024-04-11 18:00:02.461263,0 days 00:00:01.909242,92.19705058112784,7.6119351823505665,sigmoid,10,,28.0,32.0,,,,,,5.977405814732407,7.91777176744951,7.692434674431227,10.0,33.0,82.0,,COMPLETE
6756,0.12622036262203626,2024-04-11 18:00:02.463431,2024-04-11 18:00:03.994395,0 days 00:00:01.530964,74.52692054647727,8.103497421611902,sigmoid,8,,25.0,29.0,,,,,,,,,,,,,COMPLETE
6757,0.2538235680792322,2024-04-11 18:00:03.996543,2024-04-11 18:00:06.364980,0 days 00:00:02.368437,98.23254383303762,8.463538668364196,rbf,41,48.0,24.0,33.0,,,,,,,,,,,,110.0,COMPLETE
6758,0.5906279643331437,2024-04-11 18:00:06.367008,2024-04-11 18:00:07.873902,0 days 00:00:01.506894,95.42888979022563,8.75460177691811,sigmoid,8,,23.0,34.0,,,,,,,,,,,,,COMPLETE
6759,0.38120225601484975,2024-04-11 18:00:07.876088,2024-04-11 18:00:10.518055,0 days 00:00:02.641967,98.08054160765595,7.984114671719927,sigmoid,11,,27.0,31.0,,,,,,2.080185929980023,4.490737343527224,5.217043725855187,3.0,35.0,88.0,183.0,COMPLETE
6760,0.45345352376492626,2024-04-11 18:00:10.523271,2024-04-11 18:00:12.476106,0 days 00:00:01.952835,96.78132621071393,8.346588104069948,sigmoid,8,,26.0,30.0,,,,,,,,,,,,,COMPLETE
6761,0.6009432182607054,2024-04-11 18:00:12.479610,2024-04-11 18:00:14.129439,0 days 00:00:01.649829,98.27162220911562,7.760718774374288,sigmoid,8,,25.0,31.0,,,,,,,,,,,,,COMPLETE
6762,0.490503640079921,2024-04-11 18:00:14.132029,2024-04-11 18:00:15.878172,0 days 00:00:01.746143,95.0039078560865,8.144357994634776,sigmoid,37,20.0,,,,,,25.0,24.0,,,,,,,73.0,COMPLETE
6763,0.48634713144517067,2024-04-11 18:00:15.880714,2024-04-11 18:00:17.513138,0 days 00:00:01.632424,96.74143366806607,7.894052347018946,sigmoid,56,41.0,26.0,32.0,5.0,2.0,5.0,,,,,,,,,,COMPLETE
6764,0.12622036262203626,2024-04-11 18:00:17.517144,2024-04-11 18:00:18.925676,0 days 00:00:01.408532,98.17703101821823,7.4070065050618865,sigmoid,8,,23.0,29.0,,,,,,,,,,,,,COMPLETE
6765,0.45345352376492626,2024-04-11 18:00:18.928682,2024-04-11 18:00:20.487768,0 days 00:00:01.559086,93.78599432552252,8.599000865610249,sigmoid,8,,29.0,30.0,,,,,,,,,,,,,COMPLETE
6766,0.47430484786722954,2024-04-11 18:00:20.490332,2024-04-11 18:00:21.992183,0 days 00:00:01.501851,98.19170191372996,8.050805523205813,sigmoid,20,,,,7.0,4.0,86.0,38.0,40.0,,,,,,,,COMPLETE
6767,0.5094114468410861,2024-04-11 18:00:21.996184,2024-04-11 18:00:23.450091,0 days 00:00:01.453907,99.9664135536624,8.228230541133094,sigmoid,48,15.0,,,3.0,8.0,83.0,,,,,,,,,,COMPLETE
6768,0.3946624900190406,2024-04-11 18:00:23.454015,2024-04-11 18:00:25.398870,0 days 00:00:01.944855,95.5180301281894,7.634666422916634,sigmoid,26,,27.0,33.0,1.0,3.0,45.0,,,4.012572226260682,5.96942783797642,6.5618038051806415,6.0,20.0,61.0,,COMPLETE
6769,0.39686487547861377,2024-04-11 18:00:25.401385,2024-04-11 18:00:27.575103,0 days 00:00:02.173718,96.71288458789392,8.33424319367421,sigmoid,59,31.0,24.0,32.0,6.0,6.0,27.0,,,1.2227600493150348,3.6630846564811224,2.3884243051840857,20.0,46.0,71.0,139.0,COMPLETE
6770,0.12003789673140693,2024-04-11 18:00:27.579102,2024-04-11 18:00:29.203169,0 days 00:00:01.624067,99.97293374700344,7.86676204492253,sigmoid,8,,25.0,28.0,,,,,,,,,,,,,COMPLETE
6771,0.47517797592299144,2024-04-11 18:00:29.204168,2024-04-11 18:00:30.857550,0 days 00:00:01.653382,96.71291905822821,8.07166229575885,sigmoid,13,,27.0,31.0,,,,23.0,10.0,,,,,,,92.0,COMPLETE
6772,0.45345352376492626,2024-04-11 18:00:30.860061,2024-04-11 18:00:32.068461,0 days 00:00:01.208400,92.42038102839902,8.522261661644727,sigmoid,8,,20.0,30.0,,,,,,,,,,,,,COMPLETE
6773,0.529414188020104,2024-04-11 18:00:32.071039,2024-04-11 18:00:33.768206,0 days 00:00:01.697167,98.11541997229929,7.778282796195673,sigmoid,12,,26.0,32.0,,,,31.0,18.0,,,,,,,,COMPLETE
6774,0.25440330302631003,2024-04-11 18:00:33.770755,2024-04-11 18:00:35.178330,0 days 00:00:01.407575,98.14714789519589,8.24618856781041,sigmoid,36,17.0,,,,,,43.0,14.0,,,,,,,,COMPLETE
6775,0.3963766673302807,2024-04-11 18:00:35.181748,2024-04-11 18:00:37.327312,0 days 00:00:02.145564,95.00771963281225,7.5104569494546825,sigmoid,54,47.0,,,2.0,1.0,59.0,40.0,36.0,7.338572413101517,1.1403659839299598,1.9706682138065492,5.0,50.0,100.0,,COMPLETE
6776,0.23116219667943808,2024-04-11 18:00:37.330858,2024-04-11 18:00:39.522025,0 days 00:00:02.191167,98.11904544259468,7.966080431791118,rbf,60,8.0,25.0,31.0,6.0,7.0,35.0,11.0,7.0,,,,,,,,COMPLETE
6777,0.415378966371898,2024-04-11 18:00:39.527022,2024-04-11 18:00:41.800401,0 days 00:00:02.273379,99.9460847050621,8.394344376993287,sigmoid,55,12.0,,,4.0,5.0,50.0,4.0,4.0,8.20029814696332,1.9949347557686008,5.028290374285259,14.0,38.0,98.0,98.0,COMPLETE
6778,0.3891839061736439,2024-04-11 18:00:41.803376,2024-04-11 18:00:43.569169,0 days 00:00:01.765793,99.98739949406601,8.126729574412984,sigmoid,52,49.0,,,7.0,1.0,76.0,16.0,28.0,,,,,,,,COMPLETE
6779,0.5929369437606513,2024-04-11 18:00:43.571683,2024-04-11 18:00:45.448760,0 days 00:00:01.877077,96.52325815368711,7.688417074629165,sigmoid,8,,24.0,33.0,,,,,,,,,,,,,COMPLETE
6780,0.5363820488220872,2024-04-11 18:00:45.454294,2024-04-11 18:00:46.879401,0 days 00:00:01.425107,99.96236744407797,7.882953763409849,sigmoid,44,42.0,22.0,29.0,,,,48.0,17.0,,,,,,,,COMPLETE
6781,0.5909795240730494,2024-04-11 18:00:46.881941,2024-04-11 18:00:48.097510,0 days 00:00:01.215569,3.4796236756391963,8.648716254653026,sigmoid,8,,28.0,27.0,,,,,,,,,,,,,COMPLETE
6782,0.5278067069360549,2024-04-11 18:00:48.101013,2024-04-11 18:00:49.473716,0 days 00:00:01.372703,95.18612069781936,8.254696414006201,sigmoid,40,24.0,30.0,31.0,,,,,,,,,,,,,COMPLETE
6783,0.5543880546220274,2024-04-11 18:00:49.476712,2024-04-11 18:00:50.624088,0 days 00:00:01.147376,71.61743352103512,8.035047997409158,sigmoid,1,,,,,,,,,,,,,,,177.0,COMPLETE
6784,0.4907065920914441,2024-04-11 18:00:50.628095,2024-04-11 18:00:52.628886,0 days 00:00:02.000791,90.61479938654529,8.393247630803062,sigmoid,7,,,,,,,9.0,20.0,0.5048341944771586,5.2308318603948125,5.928332664128232,8.0,40.0,80.0,66.0,COMPLETE
6785,0.4391957898717423,2024-04-11 18:00:52.631416,2024-04-11 18:00:54.571802,0 days 00:00:01.940386,99.97627170472934,7.810440372704633,sigmoid,23,,,,8.0,8.0,90.0,30.0,31.0,5.667870252068329,3.0328908429550148,0.6553147887743185,13.0,48.0,64.0,104.0,COMPLETE
6786,0.46116999592335917,2024-04-11 18:00:54.574814,2024-04-11 18:00:56.388950,0 days 00:00:01.814136,99.97864711021516,8.131760158058267,sigmoid,61,18.0,25.0,34.0,5.0,2.0,18.0,14.0,35.0,,,,,,,14.0,COMPLETE
6787,0.44701971028259324,2024-04-11 18:00:56.391493,2024-04-11 18:00:57.693443,0 days 00:00:01.301950,96.7697416733327,7.68295583839139,sigmoid,8,,26.0,30.0,,,,,,,,,,,,,COMPLETE
6788,0.5975287681569516,2024-04-11 18:00:57.695467,2024-04-11 18:00:59.073197,0 days 00:00:01.377730,98.17616952709061,7.381618042723155,sigmoid,8,,24.0,32.0,,,,,,,,,,,,,COMPLETE
6789,0.378527074418455,2024-04-11 18:00:59.077203,2024-04-11 18:01:01.559351,0 days 00:00:02.482148,94.03212384293849,6.854813131061895,sigmoid,30,,23.0,30.0,2.0,4.0,9.0,5.0,8.0,8.771917395383465,8.604256060894501,3.277296564474531,12.0,44.0,93.0,,COMPLETE
6790,0.19788341277823937,2024-04-11 18:01:01.561927,2024-04-11 18:01:03.417849,0 days 00:00:01.855922,96.06804639601926,8.826533555304872,sigmoid,34,34.0,,,,,,,,3.041980981426426,8.158885660318703,8.92398516303645,17.0,29.0,55.0,,COMPLETE
6791,0.5533110257363573,2024-04-11 18:01:03.419846,2024-04-11 18:01:04.672741,0 days 00:00:01.252895,98.19377432471583,7.929164188689066,sigmoid,5,,,,,,,2.0,48.0,,,,,,,192.0,COMPLETE
6792,0.5536169981720449,2024-04-11 18:01:04.675751,2024-04-11 18:01:05.986484,0 days 00:00:01.310733,23.51591358971822,8.499085049138262,sigmoid,32,3.0,,,,,,,,,,,,,,,COMPLETE
6793,0.5986580986580987,2024-04-11 18:01:05.988483,2024-04-11 18:01:07.221128,0 days 00:00:01.232645,99.98017744689218,8.262043047273966,sigmoid,8,,26.0,31.0,,,,,,,,,,,,,COMPLETE
6794,0.12003789673140693,2024-04-11 18:01:07.223651,2024-04-11 18:01:08.927814,0 days 00:00:01.704163,96.64801740719263,8.073397952991543,sigmoid,8,,28.0,28.0,,,,,,,,,,,,,COMPLETE
6795,0.4636638101918209,2024-04-11 18:01:08.931440,2024-04-11 18:01:11.024609,0 days 00:00:02.093169,94.02116312864193,7.6247681116642205,rbf,8,,25.0,35.0,,,,,,,,,,,,,COMPLETE
6796,0.46898510910623425,2024-04-11 18:01:11.026610,2024-04-11 18:01:13.145076,0 days 00:00:02.118466,98.01239702351401,7.869054576414773,sigmoid,51,28.0,,,3.0,3.0,98.0,,,1.4190769926810511,5.687138261386664,9.445852653622936,15.0,40.0,73.0,166.0,COMPLETE
6797,0.5130696325788722,2024-04-11 18:01:13.149076,2024-04-11 18:01:14.593027,0 days 00:00:01.443951,98.06658683088204,8.310257171202002,sigmoid,17,,,,4.0,6.0,16.0,,,,,,,,,162.0,COMPLETE
6798,0.5495354144592062,2024-04-11 18:01:14.595036,2024-04-11 18:01:15.895092,0 days 00:00:01.300056,95.2195911152802,8.092269824677459,sigmoid,33,26.0,,,,,,,,,,,,,,149.0,COMPLETE
6799,0.4804188885939724,2024-04-11 18:01:15.898071,2024-04-11 18:01:18.284936,0 days 00:00:02.386865,93.03024609807744,7.193818921385553,sigmoid,58,30.0,27.0,33.0,7.0,5.0,37.0,,,7.73622735259598,9.780753176812937,8.17491482349335,18.0,25.0,84.0,,COMPLETE
6800,0.49106431700517716,2024-04-11 18:01:18.286934,2024-04-11 18:01:20.691896,0 days 00:00:02.404962,96.58242121827129,8.571757907000638,sigmoid,27,,22.0,32.0,1.0,7.0,74.0,,,5.058930171230807,9.144857066345551,2.900507202935051,2.0,45.0,60.0,119.0,COMPLETE
6801,0.465967898704915,2024-04-11 18:01:20.694937,2024-04-11 18:01:22.494261,0 days 00:00:01.799324,98.15797242466262,7.529652830533394,sigmoid,49,21.0,,,8.0,2.0,11.0,,,,,,,,,55.0,COMPLETE
6802,0.34184433225583843,2024-04-11 18:01:22.497234,2024-04-11 18:01:24.118955,0 days 00:00:01.621721,98.18081706214208,9.299935674063242,sigmoid,45,40.0,24.0,29.0,,,,21.0,46.0,,,,,,,197.0,COMPLETE
6803,0.5726969394799417,2024-04-11 18:01:24.122562,2024-04-11 18:01:25.486612,0 days 00:00:01.364050,96.70233959743888,7.940950022764809,sigmoid,4,,,,,,,18.0,30.0,,,,,,,,COMPLETE
6804,0.5986580986580987,2024-04-11 18:01:25.489614,2024-04-11 18:01:26.801922,0 days 00:00:01.312308,98.13360208112607,8.223674888139765,sigmoid,8,,24.0,31.0,,,,,,,,,,,,,COMPLETE
6805,0.4150724091351742,2024-04-11 18:01:26.805886,2024-04-11 18:01:28.616825,0 days 00:00:01.810939,95.23519242106214,7.7501205978429395,sigmoid,53,32.0,,,6.0,3.0,54.0,8.0,39.0,,,,,,,200.0,COMPLETE
6806,0.587727022564667,2024-04-11 18:01:28.618821,2024-04-11 18:01:30.069459,0 days 00:00:01.450638,96.63417154325043,8.059136211232996,sigmoid,8,,26.0,39.0,,,,,,,,,,,,,COMPLETE
6807,0.3511835467597983,2024-04-11 18:01:30.071984,2024-04-11 18:01:32.191675,0 days 00:00:02.119691,92.17592435343393,8.431757148866458,sigmoid,50,14.0,,,3.0,4.0,22.0,,,6.486348289352679,4.185847086904141,1.3701832590602203,11.0,47.0,68.0,,COMPLETE
6808,0.5158699313382563,2024-04-11 18:01:32.195213,2024-04-11 18:01:34.013014,0 days 00:00:01.817801,99.98030496896472,8.235927614159987,sigmoid,18,,,,2.0,6.0,81.0,,,6.879070081973824,7.068935700051279,6.843677965205862,5.0,23.0,77.0,,COMPLETE
6809,0.5462161819946819,2024-04-11 18:01:34.015036,2024-04-11 18:01:35.947039,0 days 00:00:01.932003,0.25415119618728,7.881840209572038,sigmoid,6,,,,,,,27.0,26.0,1.9912708361987543,7.4831661570531205,6.229423053493695,7.0,32.0,57.0,,COMPLETE
6810,0.5023535680980504,2024-04-11 18:01:35.949033,2024-04-11 18:01:37.775019,0 days 00:00:01.825986,98.08094410424349,8.66145675527982,sigmoid,19,,,,4.0,5.0,62.0,,,5.30557409900271,2.3943719178489444,1.0206731496113823,6.0,24.0,65.0,132.0,COMPLETE
6811,0.40712609205893857,2024-04-11 18:01:37.778015,2024-04-11 18:01:39.239512,0 days 00:00:01.461497,94.0213522281336,8.372306310404829,sigmoid,25,,26.0,30.0,5.0,1.0,29.0,,,,,,,,,156.0,COMPLETE
6812,0.5929369437606513,2024-04-11 18:01:39.242119,2024-04-11 18:01:40.411095,0 days 00:00:01.168976,98.11763843836101,7.996851226422681,sigmoid,8,,25.0,33.0,,,,,,,,,,,,,COMPLETE
6813,0.44701971028259324,2024-04-11 18:01:40.414182,2024-04-11 18:01:41.642771,0 days 00:00:01.228589,95.30174606873685,7.652939198552796,sigmoid,8,,27.0,30.0,,,,,,,,,,,,,COMPLETE
6814,0.1895098967941367,2024-04-11 18:01:41.645782,2024-04-11 18:01:43.563807,0 days 00:00:01.918025,98.25875745102985,8.171002615143122,rbf,29,,23.0,31.0,1.0,8.0,69.0,35.0,5.0,,,,,,,83.0,COMPLETE
6815,0.45647218584800425,2024-04-11 18:01:43.565818,2024-04-11 18:01:45.381377,0 days 00:00:01.815559,96.7106451136566,7.460266204951472,sigmoid,43,43.0,25.0,32.0,,,,,,0.8585375664050456,3.2174490500197592,5.536969965675905,10.0,26.0,90.0,113.0,COMPLETE
6816,0.3838213739981913,2024-04-11 18:01:45.385978,2024-04-11 18:01:47.461157,0 days 00:00:02.075179,98.11987861916603,7.999931957842119,sigmoid,39,38.0,,,,,,39.0,2.0,3.2860577235012487,4.015497074317349,6.9865946213610695,20.0,35.0,54.0,49.0,COMPLETE
6817,0.49924210421688253,2024-04-11 18:01:47.465234,2024-04-11 18:01:48.852648,0 days 00:00:01.387414,95.41254028380405,7.83986899900807,sigmoid,24,,28.0,29.0,8.0,7.0,44.0,,,,,,,,,,COMPLETE
6818,0.4914342007256301,2024-04-11 18:01:48.854678,2024-04-11 18:01:51.752595,0 days 00:00:02.897917,98.2162556845652,4.108566637212379,sigmoid,47,35.0,24.0,31.0,,,,6.0,42.0,4.373733286961114,2.244855840123129,5.369932881836265,8.0,21.0,83.0,126.0,COMPLETE
6819,0.5963643249384587,2024-04-11 18:01:51.755544,2024-04-11 18:01:53.069789,0 days 00:00:01.314245,93.43407708650282,8.35157048773937,sigmoid,8,,29.0,32.0,,,,,,,,,,,,,COMPLETE
6820,0.4304339311193801,2024-04-11 18:01:53.073336,2024-04-11 18:01:54.575821,0 days 00:00:01.502485,99.9610431762916,8.182844900522962,sigmoid,21,,,,6.0,2.0,25.0,33.0,22.0,,,,,,,86.0,COMPLETE
6821,0.5895095625828441,2024-04-11 18:01:54.578817,2024-04-11 18:01:56.328525,0 days 00:00:01.749708,99.99571413437138,7.7512234587768045,sigmoid,8,,23.0,34.0,,,,,,,,,,,,,COMPLETE
