number,value,datetime_start,datetime_complete,duration,params_C,params_gamma,params_kernel,params_mask_number,params_rsi_window,params_so_smooth,params_so_window,params_srsi_smooth1,params_srsi_smooth2,params_srsi_window,params_tsi_window_fast,params_tsi_window_slow,params_ult_weight_1,params_ult_weight_2,params_ult_weight_3,params_ult_window_1,params_ult_window_2,params_ult_window_3,params_williams_lbp,state
7026,0.5929369437606513,2024-04-11 18:08:35.287603,2024-04-11 18:08:36.900473,0 days 00:00:01.612870,95.23211758926065,8.13173887831154,sigmoid,8,,23.0,33.0,,,,,,,,,,,,,COMPLETE
7027,0.48450750935708536,2024-04-11 18:08:36.903052,2024-04-11 18:08:38.748184,0 days 00:00:01.845132,96.79274676212448,8.6391028933991,sigmoid,20,,,,3.0,5.0,81.0,7.0,47.0,,,,,,,,COMPLETE
7028,0.12622036262203626,2024-04-11 18:08:38.751160,2024-04-11 18:08:40.329068,0 days 00:00:01.577908,92.55544877686492,7.9796212828977255,sigmoid,8,,24.0,29.0,,,,,,,,,,,,,COMPLETE
7029,0.23769852669594121,2024-04-11 18:08:40.332623,2024-04-11 18:08:41.902696,0 days 00:00:01.570073,99.99109447812171,8.308642108468222,sigmoid,48,18.0,,,5.0,6.0,27.0,,,,,,,,,,COMPLETE
7030,0.44418507212545644,2024-04-11 18:08:41.905738,2024-04-11 18:08:44.823688,0 days 00:00:02.917950,98.337660099854,7.604062563502164,sigmoid,59,27.0,27.0,34.0,7.0,2.0,49.0,,,1.1903428767848245,5.170856877441852,6.448915945654569,14.0,38.0,80.0,176.0,COMPLETE
7031,0.6009432182607054,2024-04-11 18:08:44.827688,2024-04-11 18:08:46.480626,0 days 00:00:01.652938,99.97987638864525,7.839263464057046,sigmoid,8,,26.0,31.0,,,,,,,,,,,,,COMPLETE
7032,0.5389883864380822,2024-04-11 18:08:46.485256,2024-04-11 18:08:48.324898,0 days 00:00:01.839642,95.61054147701788,9.714639024316828,sigmoid,13,,29.0,30.0,,,,43.0,46.0,,,,,,,165.0,COMPLETE
7033,0.5143518008591254,2024-04-11 18:08:48.328913,2024-04-11 18:08:50.662851,0 days 00:00:02.333938,98.08891930403996,8.432003264454865,sigmoid,37,25.0,,,,,,16.0,16.0,,,,,,,154.0,COMPLETE
7034,0.5231761724231824,2024-04-11 18:08:50.664914,2024-04-11 18:08:52.431579,0 days 00:00:01.766665,96.8270947193265,8.129752078538392,sigmoid,44,35.0,25.0,32.0,,,,50.0,21.0,,,,,,,,COMPLETE
7035,0.40252891091625365,2024-04-11 18:08:52.433115,2024-04-11 18:08:54.363770,0 days 00:00:01.930655,93.99547879275413,7.36641002492261,sigmoid,52,31.0,,,8.0,4.0,74.0,13.0,8.0,,,,,,,,COMPLETE
7036,0.45347172512526845,2024-04-11 18:08:54.366773,2024-04-11 18:08:55.745906,0 days 00:00:01.379133,99.95249896372815,7.961004224101497,sigmoid,8,,24.0,28.0,,,,,,,,,,,,,COMPLETE
7037,0.5986580986580987,2024-04-11 18:08:55.747909,2024-04-11 18:08:57.121492,0 days 00:00:01.373583,99.95268853028807,8.185146358211618,sigmoid,8,,28.0,31.0,,,,,,,,,,,,,COMPLETE
7038,0.051365003689199155,2024-04-11 18:08:57.125075,2024-04-11 18:08:59.847979,0 days 00:00:02.722904,96.56213002786745,7.6449889211691335,rbf,55,16.0,,,6.0,8.0,61.0,41.0,37.0,5.953101868685382,5.408877928803919,2.0563817319123103,8.0,32.0,82.0,117.0,COMPLETE
7039,0.45345352376492626,2024-04-11 18:08:59.850970,2024-04-11 18:09:01.333458,0 days 00:00:01.482488,99.98217501603445,8.478298289519705,sigmoid,8,,25.0,30.0,,,,,,,,,,,,,COMPLETE
7040,0.2831501379111605,2024-04-11 18:09:01.337494,2024-04-11 18:09:02.871391,0 days 00:00:01.533897,95.16769072211372,7.792026802090915,sigmoid,40,37.0,26.0,33.0,,,,,,,,,,,,,COMPLETE
7041,0.5468277945619336,2024-04-11 18:09:02.873945,2024-04-11 18:09:04.380756,0 days 00:00:01.506811,98.04502232824314,8.018553707094155,sigmoid,12,,22.0,29.0,,,,26.0,39.0,,,,,,,,COMPLETE
7042,0.49745477140740385,2024-04-11 18:09:04.383266,2024-04-11 18:09:06.349644,0 days 00:00:01.966378,98.09700586344182,8.311796111492418,sigmoid,60,49.0,27.0,32.0,2.0,1.0,41.0,5.0,23.0,,,,,,,,COMPLETE
7043,0.5986044733320588,2024-04-11 18:09:06.353216,2024-04-11 18:09:07.702157,0 days 00:00:01.348941,93.40533057731842,8.845252014166167,sigmoid,8,,23.0,31.0,,,,,,,,,,,,,COMPLETE
7044,0.490826472528278,2024-04-11 18:09:07.706708,2024-04-11 18:09:09.883227,0 days 00:00:02.176519,95.35656725195595,8.143835119753406,sigmoid,54,45.0,,,3.0,3.0,100.0,4.0,4.0,7.2138181073902405,2.389666751559439,3.171987390346495,9.0,40.0,64.0,,COMPLETE
7045,0.5047755374022064,2024-04-11 18:09:09.885768,2024-04-11 18:09:12.168277,0 days 00:00:02.282509,98.15484470342265,7.846298868840497,sigmoid,61,30.0,24.0,30.0,5.0,6.0,53.0,28.0,28.0,,,,,,,69.0,COMPLETE
7046,0.3605098924445625,2024-04-11 18:09:12.172273,2024-04-11 18:09:13.715287,0 days 00:00:01.543014,96.63357529691122,8.559686284395639,sigmoid,36,32.0,,,,,,35.0,35.0,,,,,,,,COMPLETE
7047,0.5906279643331437,2024-04-11 18:09:13.718281,2024-04-11 18:09:15.053135,0 days 00:00:01.334854,98.18924084812534,8.306336237766702,sigmoid,8,,26.0,34.0,,,,,,,,,,,,,COMPLETE
7048,0.2264420713998481,2024-04-11 18:09:15.057118,2024-04-11 18:09:16.833109,0 days 00:00:01.775991,99.95926369996705,7.577588301743948,sigmoid,34,23.0,,,,,,,,2.3160104415418705,8.196139275415952,4.815919490664076,20.0,37.0,93.0,,COMPLETE
7049,0.17707358570820927,2024-04-11 18:09:16.836078,2024-04-11 18:09:18.034988,0 days 00:00:01.198910,96.50750522161168,7.996628176713948,sigmoid,32,40.0,,,,,,,,,,,,,,,COMPLETE
7050,0.42493458218189817,2024-04-11 18:09:18.039972,2024-04-11 18:09:19.243418,0 days 00:00:01.203446,85.89305434612739,8.176115981339773,sigmoid,1,,,,,,,,,,,,,,,21.0,COMPLETE
7051,0.4203335645565039,2024-04-11 18:09:19.246388,2024-04-11 18:09:21.655188,0 days 00:00:02.408800,98.18015719697827,7.753998166150788,sigmoid,30,,25.0,32.0,4.0,7.0,70.0,31.0,50.0,6.488103854835183,3.9581666758956384,5.071256264579562,11.0,41.0,62.0,,COMPLETE
7052,0.5154035874439462,2024-04-11 18:09:21.658151,2024-04-11 18:09:23.659637,0 days 00:00:02.001486,99.99575356129381,7.963788849831378,sigmoid,7,,,,,,,12.0,26.0,2.037943819435782,4.663267325655379,4.529300411401008,4.0,44.0,95.0,103.0,COMPLETE
7053,0.5069140556625241,2024-04-11 18:09:23.662636,2024-04-11 18:09:25.025634,0 days 00:00:01.362998,94.27966572767018,8.423835896543764,sigmoid,8,,27.0,35.0,,,,,,,,,,,,,COMPLETE
7054,0.35177428542706835,2024-04-11 18:09:25.028874,2024-04-11 18:09:26.550858,0 days 00:00:01.521984,99.95837683278681,7.415008961109616,sigmoid,5,,,,,,,38.0,45.0,,,,,,,52.0,COMPLETE
7055,0.44657430252419816,2024-04-11 18:09:26.554371,2024-04-11 18:09:29.032310,0 days 00:00:02.477939,99.99459830578044,8.234551119396377,sigmoid,23,,,,1.0,7.0,92.0,45.0,6.0,3.1048551548294188,3.477715426347322,2.3052534171560817,18.0,20.0,83.0,97.0,COMPLETE
7056,0.4701298701298702,2024-04-11 18:09:29.037888,2024-04-11 18:09:31.464090,0 days 00:00:02.426202,90.92310668764637,8.734409671566068,rbf,8,,28.0,31.0,,,,,,,,,,,,,COMPLETE
7057,0.44701971028259324,2024-04-11 18:09:31.466120,2024-04-11 18:09:32.794008,0 days 00:00:01.327888,96.73117536180162,7.852911049292008,sigmoid,8,,25.0,30.0,,,,,,,,,,,,,COMPLETE
7058,0.3779626213761181,2024-04-11 18:09:32.797027,2024-04-11 18:09:34.602835,0 days 00:00:01.805808,96.65467478288214,8.027779370591956,sigmoid,53,21.0,,,8.0,5.0,23.0,25.0,10.0,,,,,,,180.0,COMPLETE
7059,0.5325378501522179,2024-04-11 18:09:34.606389,2024-04-11 18:09:36.558113,0 days 00:00:01.951724,94.0125103517235,8.438427068804751,sigmoid,4,,,,,,,40.0,41.0,,,,,,,,COMPLETE
7060,0.4507672120611627,2024-04-11 18:09:36.561109,2024-04-11 18:09:38.887457,0 days 00:00:02.326348,98.18778192581868,6.818116982009885,sigmoid,27,,26.0,32.0,2.0,2.0,21.0,,,5.667219243329678,9.651180301302357,2.6669469169926523,16.0,50.0,85.0,46.0,COMPLETE
7061,0.5931679318644695,2024-04-11 18:09:38.892466,2024-04-11 18:09:40.323999,0 days 00:00:01.431533,99.97976380631822,7.587769258877499,sigmoid,8,,24.0,27.0,,,,,,,,,,,,,COMPLETE
7062,0.4449440896963157,2024-04-11 18:09:40.327037,2024-04-11 18:09:41.482870,0 days 00:00:01.155833,95.56657267793894,8.175776864774928,sigmoid,33,47.0,,,,,,,,,,,,,,135.0,COMPLETE
7063,0.4625444706118154,2024-04-11 18:09:41.486402,2024-04-11 18:09:43.445586,0 days 00:00:01.959184,96.80680682805948,7.755682547439922,sigmoid,19,,,,5.0,8.0,94.0,,,4.6784835473430615,5.9994156959988985,6.891754478264243,5.0,47.0,88.0,143.0,COMPLETE
7064,0.3909890449004783,2024-04-11 18:09:43.448592,2024-04-11 18:09:45.185472,0 days 00:00:01.736880,98.20329300418604,7.960057967282584,sigmoid,45,42.0,23.0,49.0,,,,9.0,20.0,,,,,,,61.0,COMPLETE
7065,0.36031067454230986,2024-04-11 18:09:45.188473,2024-04-11 18:09:47.362977,0 days 00:00:02.174504,92.39465578411814,8.622322530858574,sigmoid,58,38.0,25.0,29.0,6.0,4.0,38.0,,,1.369628504614572,2.0593112215788465,9.285392044326455,15.0,31.0,77.0,,COMPLETE
7066,0.5929369437606513,2024-04-11 18:09:47.365501,2024-04-11 18:09:48.602567,0 days 00:00:01.237066,95.15324480208537,8.312311724439633,sigmoid,8,,29.0,33.0,,,,,,,,,,,,,COMPLETE
7067,0.4774800939035312,2024-04-11 18:09:48.606115,2024-04-11 18:09:50.521019,0 days 00:00:01.914904,96.66704416153182,8.091014713223728,sigmoid,51,4.0,,,3.0,3.0,15.0,,,1.6766461400749346,6.434148640425541,6.118198903038072,12.0,34.0,57.0,123.0,COMPLETE
7068,0.5177161862527716,2024-04-11 18:09:50.524032,2024-04-11 18:09:52.866417,0 days 00:00:02.342385,98.26271528266616,7.762592199248554,sigmoid,18,,,,4.0,2.0,31.0,,,8.880000296778814,5.570239327832812,7.116657212113559,9.0,26.0,100.0,,COMPLETE
7069,0.5964036904537752,2024-04-11 18:09:52.868405,2024-04-11 18:09:54.332108,0 days 00:00:01.463703,99.96338852245896,7.102247550307741,sigmoid,8,,27.0,31.0,,,,,,,,,,,,,COMPLETE
7070,0.5287132485235908,2024-04-11 18:09:54.334611,2024-04-11 18:09:56.161671,0 days 00:00:01.827060,34.5570888249067,7.419800817906503,sigmoid,6,,,,,,,17.0,36.0,8.298726356379227,7.535865304342,8.756494617104067,17.0,43.0,70.0,,COMPLETE
7071,0.38924731182795697,2024-04-11 18:09:56.165254,2024-04-11 18:09:57.695602,0 days 00:00:01.530348,99.983171260338,8.281514961652102,sigmoid,25,,26.0,28.0,7.0,5.0,77.0,,,,,,,,,150.0,COMPLETE
7072,0.44701971028259324,2024-04-11 18:09:57.698612,2024-04-11 18:09:58.914270,0 days 00:00:01.215658,98.12394724198714,7.983896722308602,sigmoid,8,,23.0,30.0,,,,,,,,,,,,,COMPLETE
7073,0.46240707150703836,2024-04-11 18:09:58.916288,2024-04-11 18:10:01.759774,0 days 00:00:02.843486,95.09194193646826,8.51274298397953,sigmoid,47,14.0,24.0,29.0,,,,18.0,12.0,0.9411979202602652,0.7546692292951551,8.495320526594647,13.0,39.0,52.0,74.0,COMPLETE
7074,0.48686027136396093,2024-04-11 18:10:01.762774,2024-04-11 18:10:03.229274,0 days 00:00:01.466500,99.98844772340027,8.144204503830172,sigmoid,17,,,,1.0,6.0,6.0,,,,,,,,,33.0,COMPLETE
7075,0.41490280134559854,2024-04-11 18:10:03.232266,2024-04-11 18:10:05.075597,0 days 00:00:01.843331,98.15267103422197,7.728078417629495,rbf,8,,25.0,14.0,,,,,,,,,,,,,COMPLETE
7076,0.4135567402894135,2024-04-11 18:10:05.079612,2024-04-11 18:10:07.245561,0 days 00:00:02.165949,96.55511884109016,4.586592964521564,sigmoid,50,26.0,,,5.0,1.0,56.0,,,5.403474924196462,2.9242178580599107,0.5021010198527751,19.0,45.0,60.0,,COMPLETE
7077,0.4124941349956431,2024-04-11 18:10:07.247559,2024-04-11 18:10:08.737631,0 days 00:00:01.490072,93.6020594910399,7.898587835436517,sigmoid,49,50.0,,,8.0,3.0,8.0,,,,,,,,,111.0,COMPLETE
7078,0.419281036405754,2024-04-11 18:10:08.740630,2024-04-11 18:10:10.432064,0 days 00:00:01.691434,98.25006843857042,8.33845265447712,sigmoid,29,,21.0,33.0,4.0,4.0,25.0,20.0,32.0,,,,,,,27.0,COMPLETE
7079,0.400373455903476,2024-04-11 18:10:10.437620,2024-04-11 18:10:11.986935,0 days 00:00:01.549315,96.78606540901093,8.073967173308475,sigmoid,24,,39.0,32.0,2.0,7.0,11.0,,,,,,,,,,COMPLETE
7080,0.5067318215367388,2024-04-11 18:10:11.989930,2024-04-11 18:10:13.608528,0 days 00:00:01.618598,95.2197188513267,7.520417895675569,sigmoid,8,,22.0,36.0,,,,,,,,,,,,,COMPLETE
7081,0.5265249927830703,2024-04-11 18:10:13.612528,2024-04-11 18:10:15.178693,0 days 00:00:01.566165,98.21810385336703,8.47272732516041,sigmoid,35,6.0,,,,,,,,9.530853742954594,3.7416411203838718,1.2763738229746369,7.0,40.0,98.0,195.0,COMPLETE
7082,0.503271890505525,2024-04-11 18:10:15.182694,2024-04-11 18:10:17.295797,0 days 00:00:02.113103,98.19563765079793,8.197088538065108,sigmoid,22,,,,6.0,6.0,65.0,21.0,40.0,4.009463136088406,4.343285607895896,5.535019620993947,2.0,24.0,56.0,,COMPLETE
7083,0.6009432182607054,2024-04-11 18:10:17.298811,2024-04-11 18:10:18.609374,0 days 00:00:01.310563,92.22594759346217,7.862650675218091,sigmoid,8,,26.0,31.0,,,,,,,,,,,,,COMPLETE
7084,0.5223897164931287,2024-04-11 18:10:18.612341,2024-04-11 18:10:20.431859,0 days 00:00:01.819518,99.96541117162627,7.675759672819367,sigmoid,38,9.0,,,,,,34.0,2.0,4.9728497930048015,1.8623560822496432,0.8555381895542435,3.0,32.0,72.0,,COMPLETE
7085,0.5622601668933872,2024-04-11 18:10:20.435398,2024-04-11 18:10:21.480354,0 days 00:00:01.044956,96.46897381299085,8.67496627747792,sigmoid,0,,,,,,,,,,,,,,,,COMPLETE
7086,0.5208466555825554,2024-04-11 18:10:21.483356,2024-04-11 18:10:23.031242,0 days 00:00:01.547886,93.96531408474685,8.064879928671415,sigmoid,3,,,,,,,,,7.5927145694246105,1.3205677615922893,9.575495311431858,6.0,23.0,65.0,172.0,COMPLETE
7087,0.4540816326530612,2024-04-11 18:10:23.034234,2024-04-11 18:10:25.427152,0 days 00:00:02.392918,99.95704942992616,8.30110461454452,sigmoid,31,,28.0,30.0,3.0,1.0,72.0,29.0,13.0,6.111248244610737,9.81809619376926,4.0553893949715505,10.0,27.0,66.0,90.0,COMPLETE
7088,0.5895095625828441,2024-04-11 18:10:25.431164,2024-04-11 18:10:26.874297,0 days 00:00:01.443133,99.96702375995898,7.905655746421959,sigmoid,8,,24.0,34.0,,,,,,,,,,,,,COMPLETE
7089,0.4961951127286477,2024-04-11 18:10:26.877556,2024-04-11 18:10:28.711188,0 days 00:00:01.833632,96.35437898538903,7.287305283370199,sigmoid,39,36.0,,,,,,3.0,43.0,4.294600848386954,2.423199325063982,7.969008421713501,13.0,28.0,95.0,191.0,COMPLETE
7090,0.4304693693447418,2024-04-11 18:10:28.713189,2024-04-11 18:10:30.356780,0 days 00:00:01.643591,98.14436459939051,8.112312449103047,sigmoid,57,12.0,27.0,32.0,7.0,8.0,47.0,,,,,,,,,38.0,COMPLETE
7091,0.5116578846197335,2024-04-11 18:10:30.359781,2024-04-11 18:10:32.270824,0 days 00:00:01.911043,95.21823448501851,7.6465201454251535,sigmoid,21,,,,1.0,5.0,17.0,14.0,31.0,,,,,,,129.0,COMPLETE
7092,0.3977636299001389,2024-04-11 18:10:32.273819,2024-04-11 18:10:34.249850,0 days 00:00:01.976031,96.83303206274549,8.33533855635418,sigmoid,15,,26.0,31.0,,,,31.0,48.0,7.8698474203866695,9.35485576607978,9.998770814359435,14.0,33.0,81.0,83.0,COMPLETE
7093,0.44701971028259324,2024-04-11 18:10:34.252840,2024-04-11 18:10:35.810747,0 days 00:00:01.557907,98.12892164915924,7.875092205503895,sigmoid,8,,25.0,30.0,,,,,,,,,,,,,COMPLETE
7094,0.5963245096172158,2024-04-11 18:10:35.814744,2024-04-11 18:10:37.362350,0 days 00:00:01.547606,99.99321746126942,8.57576425921623,sigmoid,8,,23.0,31.0,,,,,,,,,,,,,COMPLETE
7095,0.35796476087738227,2024-04-11 18:10:37.365852,2024-04-11 18:10:39.142568,0 days 00:00:01.776716,99.99822304833084,8.104998298603874,rbf,9,,20.0,33.0,,,,,,,,,,,,13.0,COMPLETE
7096,0.3436669313356579,2024-04-11 18:10:39.146095,2024-04-11 18:10:40.892891,0 days 00:00:01.746796,89.61127820261196,8.419497821050323,sigmoid,42,8.0,27.0,32.0,,,,,,2.5787377703343557,1.6284146009225262,1.6912537193653576,4.0,35.0,54.0,,COMPLETE
7097,0.12622036262203626,2024-04-11 18:10:40.897417,2024-04-11 18:10:42.169806,0 days 00:00:01.272389,99.99669040843766,7.9593609482015655,sigmoid,8,,24.0,29.0,,,,,,,,,,,,,COMPLETE
7098,0.3529569982853108,2024-04-11 18:10:42.172799,2024-04-11 18:10:44.058537,0 days 00:00:01.885738,95.21860448550892,8.985224626507698,sigmoid,14,,25.0,31.0,,,,27.0,18.0,7.098708672605088,6.972058328151887,2.8888042229482878,20.0,42.0,83.0,,COMPLETE
7099,0.5909107772212947,2024-04-11 18:10:44.061539,2024-04-11 18:10:45.268642,0 days 00:00:01.207103,99.98414313696443,7.748122401698213,sigmoid,8,,26.0,42.0,,,,,,,,,,,,,COMPLETE
7100,0.506457167455876,2024-04-11 18:10:45.270642,2024-04-11 18:10:47.194423,0 days 00:00:01.923781,96.73942284591615,8.262019366188255,sigmoid,43,27.0,22.0,30.0,,,,,,9.19530964652591,6.677725003204076,5.977253862839633,15.0,49.0,76.0,186.0,COMPLETE
7101,0.46938263342814124,2024-04-11 18:10:47.198970,2024-04-11 18:10:48.800105,0 days 00:00:01.601135,92.62389291028653,7.463220816780331,sigmoid,16,,,,7.0,2.0,2.0,,,,,,,,,,COMPLETE
7102,0.4892696800883812,2024-04-11 18:10:48.803094,2024-04-11 18:10:50.452953,0 days 00:00:01.649859,99.991495339595,8.09725514408249,sigmoid,28,,27.0,28.0,2.0,4.0,29.0,48.0,38.0,,,,,,,,COMPLETE
7103,0.5952371952371952,2024-04-11 18:10:50.456470,2024-04-11 18:10:51.737741,0 days 00:00:01.281271,96.61573291067275,7.828754711653151,sigmoid,8,,30.0,32.0,,,,,,,,,,,,,COMPLETE
7104,0.5986580986580987,2024-04-11 18:10:51.740749,2024-04-11 18:10:53.064865,0 days 00:00:01.324116,93.90955764952461,8.440155045524572,sigmoid,8,,24.0,31.0,,,,,,,,,,,,,COMPLETE
7105,0.5551915532927134,2024-04-11 18:10:53.068071,2024-04-11 18:10:54.493119,0 days 00:00:01.425048,99.98740251664923,8.201484959168825,sigmoid,2,,,,,,,,,3.3909815885751478,3.1203980530378574,3.762342561690043,7.0,22.0,74.0,,COMPLETE
7106,0.3636025445481939,2024-04-11 18:10:54.496637,2024-04-11 18:10:56.189201,0 days 00:00:01.692564,98.2046037394795,9.43279396441726,sigmoid,10,,28.0,29.0,,,,,,6.338903240552984,7.972811554204641,1.9482076622111415,18.0,48.0,92.0,,COMPLETE
7107,0.4810308675086556,2024-04-11 18:10:56.192203,2024-04-11 18:10:57.831091,0 days 00:00:01.638888,97.1298580033185,8.810171269929612,sigmoid,20,,,,5.0,3.0,89.0,37.0,16.0,,,,,,,,COMPLETE
7108,0.5929369437606513,2024-04-11 18:10:57.834103,2024-04-11 18:10:59.151354,0 days 00:00:01.317251,98.13899562481967,7.594638126581581,sigmoid,8,,25.0,33.0,,,,,,,,,,,,,COMPLETE
7109,0.45487660247359807,2024-04-11 18:10:59.154343,2024-04-11 18:11:01.516023,0 days 00:00:02.361680,95.12049417041196,7.985233063856203,sigmoid,63,35.0,26.0,30.0,6.0,7.0,97.0,46.0,7.0,8.519479825990969,2.7362607815384568,6.584504489816688,17.0,21.0,79.0,67.0,COMPLETE
7110,0.50409119367862,2024-04-11 18:11:01.520095,2024-04-11 18:11:03.243440,0 days 00:00:01.723345,96.78722671262489,8.0102673171462,sigmoid,11,,23.0,32.0,,,,,,2.861439232799561,4.172772736325736,7.59399636902641,5.0,38.0,86.0,108.0,COMPLETE
7111,0.45506285398535706,2024-04-11 18:11:03.246937,2024-04-11 18:11:05.752987,0 days 00:00:02.506050,98.0024127082243,8.269706746598622,sigmoid,62,43.0,25.0,31.0,8.0,5.0,80.0,8.0,30.0,5.835539066621435,7.261976944703198,9.765860659400332,9.0,46.0,63.0,,COMPLETE
7112,0.49471494569818353,2024-04-11 18:11:05.756575,2024-04-11 18:11:08.004428,0 days 00:00:02.247853,95.2424481685689,7.749271031138511,sigmoid,46,15.0,24.0,29.0,,,,24.0,27.0,6.69425611926303,8.722431941437677,4.2299462752688335,10.0,44.0,70.0,,COMPLETE
7113,0.4308241594763463,2024-04-11 18:11:08.007974,2024-04-11 18:11:10.310684,0 days 00:00:02.302710,93.64202831862167,2.683292553039916,rbf,8,,29.0,30.0,,,,,,,,,,,,,COMPLETE
7114,0.4937591682322361,2024-04-11 18:11:10.313684,2024-04-11 18:11:12.484022,0 days 00:00:02.170338,98.30467831899799,8.570420511843635,sigmoid,26,,27.0,33.0,3.0,6.0,68.0,,,4.52165434902697,8.43043219515048,9.155836653464718,11.0,35.0,90.0,,COMPLETE
7115,0.5402383338901882,2024-04-11 18:11:12.487559,2024-04-11 18:11:13.942359,0 days 00:00:01.454800,96.5044741298584,8.205879456982164,sigmoid,37,39.0,,,,,,44.0,9.0,,,,,,,169.0,COMPLETE
7116,0.5952371952371952,2024-04-11 18:11:13.945358,2024-04-11 18:11:15.259905,0 days 00:00:01.314547,98.19351261569759,7.939530026384632,sigmoid,8,,26.0,32.0,,,,,,,,,,,,,COMPLETE
7117,0.49324343306644186,2024-04-11 18:11:15.267470,2024-04-11 18:11:17.410233,0 days 00:00:02.142763,91.49960502385956,8.430614639071992,sigmoid,55,25.0,,,4.0,8.0,85.0,42.0,24.0,2.149696078005532,7.75900558671357,5.649723951135134,12.0,36.0,67.0,116.0,COMPLETE
7118,0.36288966498512476,2024-04-11 18:11:17.413224,2024-04-11 18:11:19.034316,0 days 00:00:01.621092,98.17464037049545,7.5838464880649985,sigmoid,56,20.0,25.0,31.0,5.0,3.0,35.0,,,,,,,,,,COMPLETE
7119,0.5895095625828441,2024-04-11 18:11:19.037798,2024-04-11 18:11:20.472821,0 days 00:00:01.435023,99.9999168384566,7.8081367515721825,sigmoid,8,,23.0,34.0,,,,,,,,,,,,,COMPLETE
7120,0.432951197456317,2024-04-11 18:11:20.475821,2024-04-11 18:11:21.907754,0 days 00:00:01.431933,28.185120537044455,8.038877890428546,sigmoid,48,48.0,,,2.0,2.0,50.0,,,,,,,,,,COMPLETE
7121,0.4502698896972542,2024-04-11 18:11:21.910768,2024-04-11 18:11:23.458540,0 days 00:00:01.547772,95.36255252292624,8.221136943046295,sigmoid,8,,24.0,30.0,,,,,,,,,,,,,COMPLETE
7122,0.38111949464818395,2024-04-11 18:11:23.463509,2024-04-11 18:11:24.970709,0 days 00:00:01.507200,98.13516368585638,7.340210721427838,sigmoid,41,11.0,26.0,31.0,,,,,,,,,,,,160.0,COMPLETE
7123,0.37159858027698506,2024-04-11 18:11:24.973714,2024-04-11 18:11:26.643862,0 days 00:00:01.670148,96.64243033542026,8.63848694882096,sigmoid,52,3.0,,,1.0,1.0,60.0,6.0,46.0,,,,,,,,COMPLETE
7124,0.3542618106458917,2024-04-11 18:11:26.646856,2024-04-11 18:11:28.118886,0 days 00:00:01.472030,77.65261358013194,8.03956637562388,sigmoid,13,,27.0,32.0,,,,32.0,34.0,,,,,,,139.0,COMPLETE
7125,0.5033555504481728,2024-04-11 18:11:28.120871,2024-04-11 18:11:29.930339,0 days 00:00:01.809468,98.20641455285853,8.323584802976969,sigmoid,44,22.0,28.0,33.0,,,,15.0,15.0,,,,,,,,COMPLETE
7126,0.4406286929803829,2024-04-11 18:11:29.932336,2024-04-11 18:11:31.206155,0 days 00:00:01.273819,95.12004273166471,3.3834500354405614,sigmoid,8,,25.0,28.0,,,,,,,,,,,,,COMPLETE
7127,0.551807276929821,2024-04-11 18:11:31.209285,2024-04-11 18:11:32.312957,0 days 00:00:01.103672,98.12004056520828,7.80430682267329,sigmoid,1,,,,,,,,,,,,,,,58.0,COMPLETE
7128,0.44701971028259324,2024-04-11 18:11:32.315946,2024-04-11 18:11:33.517388,0 days 00:00:01.201442,93.21436961560161,7.647750275834006,sigmoid,8,,22.0,30.0,,,,,,,,,,,,,COMPLETE
7129,0.34997583039845315,2024-04-11 18:11:33.520348,2024-04-11 18:11:35.164429,0 days 00:00:01.644081,98.22340430920792,8.1350530980226,sigmoid,7,,,,,,,19.0,22.0,2.407422811132662,4.7757972673352445,5.163599264843598,6.0,28.0,96.0,48.0,COMPLETE
