number,value,datetime_start,datetime_complete,duration,params_C,params_gamma,params_kernel,params_mask_number,params_rsi_window,params_so_smooth,params_so_window,params_srsi_smooth1,params_srsi_smooth2,params_srsi_window,params_tsi_window_fast,params_tsi_window_slow,params_ult_weight_1,params_ult_weight_2,params_ult_weight_3,params_ult_window_1,params_ult_window_2,params_ult_window_3,params_williams_lbp,state
1144,0.4015653406464733,2024-04-11 16:11:20.306257,2024-04-11 16:11:21.392881,0 days 00:00:01.086624,99.98332739482677,5.5427782963362375,rbf,0,,,,,,,,,,,,,,,,COMPLETE
1145,0.4221475883944398,2024-04-11 16:11:21.393882,2024-04-11 16:11:21.925700,0 days 00:00:00.531818,91.86568321070632,3.0723352083672815,sigmoid,20,,,,2.0,7.0,70.0,34.0,43.0,,,,,,,,COMPLETE
1146,0.4283490066637604,2024-04-11 16:11:21.926710,2024-04-11 16:11:22.660714,0 days 00:00:00.734004,56.49887173409182,1.6022545079810637,sigmoid,59,36.0,18.0,17.0,3.0,4.0,73.0,,,6.461995280744161,8.953221018477699,5.09379481663629,2.0,25.0,67.0,176.0,COMPLETE
1147,0.5819627241409769,2024-04-11 16:11:22.661714,2024-04-11 16:11:23.171382,0 days 00:00:00.509668,94.72792099145651,1.022449177109597,sigmoid,2,,,,,,,,,2.2965262535239814,7.531986580554334,3.805478414113704,8.0,35.0,64.0,,COMPLETE
1148,0.5347463070006423,2024-04-11 16:11:23.172399,2024-04-11 16:11:23.645183,0 days 00:00:00.472784,95.70235514103692,8.185139247424287,sigmoid,12,,22.0,41.0,,,,17.0,17.0,,,,,,,,COMPLETE
1149,0.5867358687757959,2024-04-11 16:11:23.647184,2024-04-11 16:11:24.094854,0 days 00:00:00.447670,89.47287149854215,1.3268954270335718,sigmoid,0,,,,,,,,,,,,,,,,COMPLETE
1150,0.4546887944627061,2024-04-11 16:11:24.096854,2024-04-11 16:11:24.818521,0 days 00:00:00.721667,82.8144297422884,0.7751643564564809,sigmoid,55,21.0,,,6.0,3.0,54.0,21.0,39.0,7.773878258538733,9.77035569882953,0.8371861828962617,18.0,33.0,66.0,94.0,COMPLETE
1151,0.18330970224832893,2024-04-11 16:11:24.819520,2024-04-11 16:11:25.306473,0 days 00:00:00.486953,96.77179951227932,0.4125703617049558,sigmoid,36,4.0,,,,,,28.0,20.0,,,,,,,,COMPLETE
1152,0.4477329608288226,2024-04-11 16:11:25.307469,2024-04-11 16:11:25.899326,0 days 00:00:00.591857,92.77258492399439,1.1244686904141143,sigmoid,60,12.0,10.0,18.0,7.0,6.0,49.0,22.0,10.0,,,,,,,,COMPLETE
1153,0.3097145523839154,2024-04-11 16:11:25.900335,2024-04-11 16:11:26.409003,0 days 00:00:00.508668,86.65192687426028,1.49002591814789,sigmoid,13,,12.0,46.0,,,,36.0,25.0,,,,,,,188.0,COMPLETE
1154,0.2961779717146531,2024-04-11 16:11:26.410002,2024-04-11 16:11:26.920460,0 days 00:00:00.510458,99.97195149028029,0.9246791564527505,sigmoid,44,23.0,9.0,15.0,,,,25.0,27.0,,,,,,,,COMPLETE
1155,0.43555253902634666,2024-04-11 16:11:26.921461,2024-04-11 16:11:27.491405,0 days 00:00:00.569944,98.04932139866285,1.2331025433291987,sigmoid,56,30.0,17.0,28.0,5.0,4.0,89.0,,,,,,,,,,COMPLETE
1156,0.5641220306475137,2024-04-11 16:11:27.492406,2024-04-11 16:11:27.875358,0 days 00:00:00.382952,21.906565723017643,4.299496947579503,sigmoid,0,,,,,,,,,,,,,,,,COMPLETE
1157,0.4243016214104317,2024-04-11 16:11:27.876348,2024-04-11 16:11:28.560081,0 days 00:00:00.683733,91.19452829824226,0.8034777417698487,sigmoid,23,,,,4.0,8.0,95.0,2.0,46.0,3.7950130258187325,7.353667316086474,2.8901874584559377,4.0,37.0,96.0,139.0,COMPLETE
1158,0.5836206735876839,2024-04-11 16:11:28.561082,2024-04-11 16:11:28.986754,0 days 00:00:00.425672,93.88169944501507,1.7397878606869022,sigmoid,0,,,,,,,,,,,,,,,,COMPLETE
1159,0.4239278366830195,2024-04-11 16:11:28.987752,2024-04-11 16:11:29.636366,0 days 00:00:00.648614,95.80610346082474,0.5201762795905578,sigmoid,61,38.0,31.0,7.0,8.0,1.0,80.0,44.0,6.0,,,,,,,111.0,COMPLETE
1160,0.38585596440819353,2024-04-11 16:11:29.637368,2024-04-11 16:11:30.349935,0 days 00:00:00.712567,88.847555226137,1.0460522925348243,sigmoid,30,,13.0,11.0,1.0,6.0,22.0,8.0,15.0,1.7860071881613422,6.848505168481012,3.5763994727736312,7.0,32.0,50.0,,COMPLETE
1161,0.5531806516074682,2024-04-11 16:11:30.350931,2024-04-11 16:11:30.889963,0 days 00:00:00.539032,97.1998885925915,1.3579286822538241,sigmoid,34,41.0,,,,,,,,5.666943865465335,5.890065319707988,4.524820708694989,10.0,45.0,71.0,,COMPLETE
1162,0.44211916157781816,2024-04-11 16:11:30.890971,2024-04-11 16:11:32.392482,0 days 00:00:01.501511,92.64959001726402,0.8821943497656615,rbf,54,31.0,,,3.0,5.0,85.0,14.0,30.0,3.531121627160233,8.618225961301487,8.841311964543172,9.0,38.0,63.0,,COMPLETE
1163,0.3814739315205749,2024-04-11 16:11:32.393611,2024-04-11 16:11:32.960370,0 days 00:00:00.566759,95.02503567859839,0.19126477687779542,sigmoid,7,,,,,,,42.0,21.0,6.957954379491705,1.8904888756923692,2.205954191421079,15.0,50.0,62.0,82.0,COMPLETE
1164,0.43823109010822325,2024-04-11 16:11:32.961369,2024-04-11 16:11:33.660285,0 days 00:00:00.698916,98.40599085337956,1.1559410574522273,sigmoid,27,,29.0,8.0,2.0,7.0,8.0,,,1.1601105178330815,8.205784626956639,2.432348748794367,3.0,32.0,90.0,89.0,COMPLETE
1165,0.5863711449328822,2024-04-11 16:11:33.662287,2024-04-11 16:11:34.041953,0 days 00:00:00.379666,90.70996626319814,0.6401733158985135,sigmoid,0,,,,,,,,,,,,,,,,COMPLETE
1166,0.5453271924774514,2024-04-11 16:11:34.042954,2024-04-11 16:11:34.588218,0 days 00:00:00.545264,93.48397363101594,1.9572048738423764,sigmoid,8,,41.0,44.0,,,,,,,,,,,,,COMPLETE
1167,0.5324624562847151,2024-04-11 16:11:34.589219,2024-04-11 16:11:35.061438,0 days 00:00:00.472219,96.88078737224181,9.559725321213897,sigmoid,40,24.0,43.0,26.0,,,,,,,,,,,,,COMPLETE
1168,0.5030052349253539,2024-04-11 16:11:35.062438,2024-04-11 16:11:35.533550,0 days 00:00:00.471112,94.76613804395981,0.9946033143879315,sigmoid,5,,,,,,,10.0,32.0,,,,,,,106.0,COMPLETE
1169,0.5862828235037213,2024-04-11 16:11:35.534549,2024-04-11 16:11:35.925113,0 days 00:00:00.390564,87.79529976501348,1.4597927689610517,sigmoid,0,,,,,,,,,,,,,,,,COMPLETE
1170,0.5577972168520184,2024-04-11 16:11:35.926207,2024-04-11 16:11:36.369064,0 days 00:00:00.442857,98.28888281313124,1.2253950723605123,sigmoid,4,,,,,,,37.0,34.0,,,,,,,,COMPLETE
1171,0.42596950782768855,2024-04-11 16:11:36.370065,2024-04-11 16:11:36.817533,0 days 00:00:00.447468,59.587097354280516,0.836809154250863,sigmoid,33,7.0,,,,,,,,,,,,,,128.0,COMPLETE
1172,0.0811295383236217,2024-04-11 16:11:36.818533,2024-04-11 16:11:37.227712,0 days 00:00:00.409179,91.70290930103367,0.713120419837017,sigmoid,32,50.0,,,,,,,,,,,,,,,COMPLETE
1173,0.4856579759699862,2024-04-11 16:11:37.228708,2024-04-11 16:11:37.814095,0 days 00:00:00.585387,94.94549520034414,1.5634169417739334,sigmoid,53,3.0,,,5.0,2.0,30.0,13.0,2.0,,,,,,,181.0,COMPLETE
1174,0.5906816394155942,2024-04-11 16:11:37.816092,2024-04-11 16:11:38.213134,0 days 00:00:00.397042,90.11551530126151,1.0798256323289648,sigmoid,0,,,,,,,,,,,,,,,,COMPLETE
1175,0.5867358687757959,2024-04-11 16:11:38.214135,2024-04-11 16:11:38.647183,0 days 00:00:00.433048,88.81044355287756,1.3276119525786334,sigmoid,0,,,,,,,,,,,,,,,,COMPLETE
1176,0.3346607879391267,2024-04-11 16:11:38.648273,2024-04-11 16:11:39.318632,0 days 00:00:00.670359,85.42517764948875,0.5442594057995428,sigmoid,50,14.0,,,6.0,4.0,35.0,,,4.330977302620231,9.170907696318398,4.150672796575512,13.0,49.0,69.0,,COMPLETE
1177,0.4421160892202867,2024-04-11 16:11:39.319633,2024-04-11 16:11:39.994394,0 days 00:00:00.674761,85.98616473008443,0.9506657755656402,sigmoid,19,,,,4.0,3.0,83.0,,,7.557263422415893,1.6853637592989106,1.0383152660748358,6.0,43.0,87.0,67.0,COMPLETE
1178,0.4427432505888748,2024-04-11 16:11:39.995395,2024-04-11 16:11:40.487665,0 days 00:00:00.492270,84.16955951503361,1.223085711841498,sigmoid,17,,,,7.0,5.0,93.0,,,,,,,,,171.0,COMPLETE
1179,0.4361195571108944,2024-04-11 16:11:40.488713,2024-04-11 16:11:41.176562,0 days 00:00:00.687849,87.69812715397964,0.7659362380699821,sigmoid,58,9.0,6.0,31.0,1.0,6.0,45.0,,,9.821205886894912,7.841197312151005,3.3237677112740087,14.0,24.0,83.0,,COMPLETE
1180,0.47031780931441125,2024-04-11 16:11:41.177563,2024-04-11 16:11:41.837877,0 days 00:00:00.660314,89.38524135450093,1.0963265267628004,sigmoid,51,17.0,,,2.0,1.0,26.0,,,4.650314937636384,2.531087884196774,0.5380788259589844,11.0,46.0,73.0,77.0,COMPLETE
1181,0.4770233360486847,2024-04-11 16:11:41.838878,2024-04-11 16:11:42.403112,0 days 00:00:00.564234,86.77141082254599,1.456299712495449,sigmoid,45,35.0,4.0,37.0,,,,31.0,12.0,,,,,,,113.0,COMPLETE
1182,0.10234925204338663,2024-04-11 16:11:42.405113,2024-04-11 16:11:43.252359,0 days 00:00:00.847246,90.17484988115334,0.3286856204606946,rbf,0,,,,,,,,,,,,,,,,COMPLETE
1183,0.5836206735876839,2024-04-11 16:11:43.253358,2024-04-11 16:11:43.654906,0 days 00:00:00.401548,89.54240082389182,1.6980962556243662,sigmoid,0,,,,,,,,,,,,,,,,COMPLETE
1184,0.44931733553992553,2024-04-11 16:11:43.655907,2024-04-11 16:11:44.302270,0 days 00:00:00.646363,99.99300557485068,0.9756735176993332,sigmoid,29,,21.0,24.0,5.0,7.0,57.0,47.0,8.0,,,,,,,99.0,COMPLETE
1185,0.26433572441046344,2024-04-11 16:11:44.303280,2024-04-11 16:11:44.889963,0 days 00:00:00.586683,90.97373632191045,1.2982372916569038,sigmoid,6,,,,,,,6.0,23.0,3.263058683489209,4.418448976415222,3.9521360382323696,6.0,39.0,97.0,,COMPLETE
1186,0.47496173190465774,2024-04-11 16:11:44.890972,2024-04-11 16:11:45.541498,0 days 00:00:00.650526,87.60124930242304,0.6755430782592833,sigmoid,18,,,,3.0,2.0,69.0,,,1.9456624114051695,6.155678591845415,5.326756718207,7.0,28.0,54.0,,COMPLETE
1187,0.40396150090668154,2024-04-11 16:11:45.543532,2024-04-11 16:11:46.180228,0 days 00:00:00.636696,91.6473560296152,0.8832014632863613,sigmoid,43,26.0,15.0,40.0,,,,,,5.1702394123691295,3.092434828723135,6.931533903928765,2.0,48.0,88.0,146.0,COMPLETE
1188,0.5049769476297434,2024-04-11 16:11:46.181229,2024-04-11 16:11:46.849045,0 days 00:00:00.667816,92.54930802698027,1.1439276402500016,sigmoid,39,27.0,,,,,,39.0,40.0,5.423347447331666,5.163809660123542,9.982523268286698,16.0,40.0,59.0,160.0,COMPLETE
1189,0.4641178210986554,2024-04-11 16:11:46.850047,2024-04-11 16:11:47.366737,0 days 00:00:00.516690,82.55147137967847,0.5035850663217664,sigmoid,49,34.0,,,4.0,3.0,13.0,,,,,,,,,122.0,COMPLETE
1190,0.5873516489526552,2024-04-11 16:11:47.367738,2024-04-11 16:11:47.764129,0 days 00:00:00.396391,88.97092521087266,1.4747264743775643,sigmoid,0,,,,,,,,,,,,,,,,COMPLETE
1191,0.5883304244792085,2024-04-11 16:11:47.766186,2024-04-11 16:11:48.159001,0 days 00:00:00.392815,90.60565458869253,0.816598880554041,sigmoid,0,,,,,,,,,,,,,,,,COMPLETE
1192,0.35812239885378994,2024-04-11 16:11:48.160002,2024-04-11 16:11:48.874703,0 days 00:00:00.714701,99.98627439569586,1.110069499718448,sigmoid,47,16.0,5.0,6.0,,,,19.0,41.0,3.015100756454414,9.417501494221852,2.6401243698798567,4.0,31.0,99.0,191.0,COMPLETE
1193,0.3511658822261344,2024-04-11 16:11:48.876703,2024-04-11 16:11:49.503140,0 days 00:00:00.626437,86.26866256425288,1.3717328734483192,sigmoid,35,42.0,,,,,,,,2.5652389054261113,6.468662866925251,1.8149904303758202,5.0,30.0,75.0,200.0,COMPLETE
1194,0.13828009358735616,2024-04-11 16:11:49.504143,2024-04-11 16:11:50.070781,0 days 00:00:00.566638,96.8327928346414,0.9742263729762578,sigmoid,2,,,,,,,,,6.163468480836442,3.9689574989128227,3.1497542789760073,3.0,41.0,81.0,,COMPLETE
1195,0.42628098674476883,2024-04-11 16:11:50.071782,2024-04-11 16:11:50.586638,0 days 00:00:00.514856,92.48004246069968,0.4184226778759787,sigmoid,24,,20.0,48.0,8.0,8.0,61.0,,,,,,,,,,COMPLETE
1196,0.5863711449328822,2024-04-11 16:11:50.587638,2024-04-11 16:11:51.040267,0 days 00:00:00.452629,98.14259138047457,0.7002538168684392,sigmoid,0,,,,,,,,,,,,,,,,COMPLETE
1197,0.4741537002326054,2024-04-11 16:11:51.041277,2024-04-11 16:11:51.597170,0 days 00:00:00.555893,88.10289414142886,3.5023935536661295,sigmoid,21,,,,1.0,4.0,47.0,41.0,22.0,,,,,,,10.0,COMPLETE
1198,0.3903709602495189,2024-04-11 16:11:51.598171,2024-04-11 16:11:52.284984,0 days 00:00:00.686813,96.46831852322057,1.2545065955213859,sigmoid,22,,,,6.0,7.0,66.0,29.0,44.0,5.916542563746964,8.391895656313142,9.237570072892787,12.0,20.0,77.0,,COMPLETE
1199,0.5820222138368908,2024-04-11 16:11:52.286983,2024-04-11 16:11:52.693961,0 days 00:00:00.406978,93.20846923567198,0.9979993228406919,sigmoid,0,,,,,,,,,,,,,,,,COMPLETE
1200,0.45230694215883466,2024-04-11 16:11:52.695006,2024-04-11 16:11:53.997305,0 days 00:00:01.302299,90.71049806627074,1.5727824463732905,rbf,25,,32.0,43.0,3.0,5.0,78.0,,,,,,,,,165.0,COMPLETE
1201,0.5880044316752108,2024-04-11 16:11:53.998338,2024-04-11 16:11:54.411123,0 days 00:00:00.412785,48.89343061043471,1.8496247077810744,sigmoid,0,,,,,,,,,,,,,,,,COMPLETE
1202,0.50609551504306,2024-04-11 16:11:54.412655,2024-04-11 16:11:55.037342,0 days 00:00:00.624687,95.24041068776675,0.8378448571357897,sigmoid,38,28.0,,,,,,17.0,26.0,3.8937800536601745,8.798776637378829,5.6951187814710185,8.0,37.0,60.0,,COMPLETE
1203,0.333546991426969,2024-04-11 16:11:55.039491,2024-04-11 16:11:55.682175,0 days 00:00:00.642684,98.43723639495138,1.2187221578472613,sigmoid,57,46.0,39.0,20.0,2.0,3.0,10.0,,,,,,,,,95.0,COMPLETE
1204,0.4109498491162523,2024-04-11 16:11:55.684177,2024-04-11 16:11:56.423313,0 days 00:00:00.739136,93.01635123668082,0.16511528484604143,sigmoid,31,,11.0,12.0,4.0,6.0,16.0,33.0,24.0,4.8834396571102,0.7986721294779171,4.878273332470094,19.0,36.0,93.0,151.0,COMPLETE
1205,0.5804144055254071,2024-04-11 16:11:56.425425,2024-04-11 16:11:56.908294,0 days 00:00:00.482869,89.59976902201956,0.5863156333601769,sigmoid,8,,25.0,27.0,,,,,,,,,,,,,COMPLETE
1206,0.47377287098947807,2024-04-11 16:11:56.909296,2024-04-11 16:11:57.581359,0 days 00:00:00.672063,96.78132632191955,1.031080454349669,sigmoid,28,,8.0,34.0,2.0,1.0,3.0,26.0,33.0,,,,,,,,COMPLETE
1207,0.5291841070189093,2024-04-11 16:11:57.582358,2024-04-11 16:11:58.135283,0 days 00:00:00.552925,94.24935078336051,1.3083235016156871,sigmoid,3,,,,,,,,,9.192627758377924,5.540226392159162,5.953578869023565,10.0,47.0,85.0,49.0,COMPLETE
1208,0.5863711449328822,2024-04-11 16:11:58.136282,2024-04-11 16:11:58.561527,0 days 00:00:00.425245,86.24960107866069,0.7371785688330592,sigmoid,0,,,,,,,,,,,,,,,,COMPLETE
1209,0.5084384840178511,2024-04-11 16:11:58.562742,2024-04-11 16:11:59.281571,0 days 00:00:00.718829,91.37702965410332,1.0887205366390273,sigmoid,15,,14.0,47.0,,,,49.0,37.0,0.9570059466335978,7.099540973720288,4.287056526809685,8.0,35.0,56.0,85.0,COMPLETE
1210,0.46295222022993354,2024-04-11 16:11:59.282729,2024-04-11 16:12:00.141338,0 days 00:00:00.858609,95.94388555471068,0.8812420723954688,sigmoid,63,21.0,23.0,14.0,5.0,8.0,38.0,46.0,9.0,3.6922225589856725,4.97063739305326,6.609565415646184,5.0,44.0,51.0,53.0,COMPLETE
1211,0.39206255965929954,2024-04-11 16:12:00.143338,2024-04-11 16:12:00.730300,0 days 00:00:00.586962,98.36923115457037,1.5657463885977236,sigmoid,9,,35.0,25.0,,,,,,,,,,,,116.0,COMPLETE
1212,0.5823323040111231,2024-04-11 16:12:00.731298,2024-04-11 16:12:01.235306,0 days 00:00:00.504008,89.06962217175685,0.38835576002885364,sigmoid,0,,,,,,,,,,,,,,,,COMPLETE
1213,0.40049700435729846,2024-04-11 16:12:01.236306,2024-04-11 16:12:01.728662,0 days 00:00:00.492356,92.0692666960854,1.2188202560423098,sigmoid,16,,,,6.0,2.0,71.0,,,,,,,,,,COMPLETE
1214,0.5622601668933872,2024-04-11 16:12:01.729772,2024-04-11 16:12:02.111038,0 days 00:00:00.381266,94.5724970592091,8.678358272524259,sigmoid,0,,,,,,,,,,,,,,,,COMPLETE
1215,0.5852178809510835,2024-04-11 16:12:02.112065,2024-04-11 16:12:02.528223,0 days 00:00:00.416158,98.18591306664389,1.4173771933178883,sigmoid,0,,,,,,,,,,,,,,,,COMPLETE
1216,0.14713453461590573,2024-04-11 16:12:02.529217,2024-04-11 16:12:03.226973,0 days 00:00:00.697756,96.89881870399377,0.5893949419457196,sigmoid,14,,2.0,4.0,,,,16.0,19.0,8.982700832124344,9.606894465217572,7.90863966985712,2.0,33.0,82.0,,COMPLETE
1217,0.34086629001883245,2024-04-11 16:12:03.227973,2024-04-11 16:12:03.689946,0 days 00:00:00.461973,69.0707620570505,6.482813906007749,sigmoid,37,20.0,,,,,,38.0,46.0,,,,,,,61.0,COMPLETE
1218,0.25656114428074395,2024-04-11 16:12:03.690946,2024-04-11 16:12:04.267194,0 days 00:00:00.576248,92.84980260903862,0.8861743745596313,sigmoid,10,,47.0,37.0,,,,,,2.387300524133626,7.959287020923921,2.042785434640514,12.0,42.0,91.0,,COMPLETE
1219,0.45582806284520505,2024-04-11 16:12:04.269204,2024-04-11 16:12:05.730890,0 days 00:00:01.461686,84.00571446552142,1.0972358811178988,rbf,11,,46.0,45.0,,,,,,4.06382711810989,6.970882708273491,1.2059107134264346,9.0,38.0,78.0,81.0,COMPLETE
1220,0.489691625541722,2024-04-11 16:12:05.731890,2024-04-11 16:12:06.562498,0 days 00:00:00.830608,99.95960523505083,0.7226832547068207,sigmoid,62,10.0,3.0,29.0,7.0,5.0,63.0,23.0,49.0,6.370239159507839,7.650861646082474,6.254301963889865,11.0,34.0,72.0,,COMPLETE
1221,0.5825349282830726,2024-04-11 16:12:06.564599,2024-04-11 16:12:06.964260,0 days 00:00:00.399661,95.85378677843472,1.6641850076041675,sigmoid,0,,,,,,,,,,,,,,,,COMPLETE
1222,0.5867358687757959,2024-04-11 16:12:06.965316,2024-04-11 16:12:07.365426,0 days 00:00:00.400110,88.07137203007498,1.3178361455980476,sigmoid,0,,,,,,,,,,,,,,,,COMPLETE
1223,0.5110625813425097,2024-04-11 16:12:07.366429,2024-04-11 16:12:07.981849,0 days 00:00:00.615420,90.63596942014748,0.9459359165739808,sigmoid,18,,,,4.0,4.0,100.0,,,7.122737581187946,8.578687536858144,8.539864990817076,3.0,28.0,94.0,,COMPLETE
1224,0.3999263487387222,2024-04-11 16:12:07.982849,2024-04-11 16:12:08.655531,0 days 00:00:00.672682,94.30296140641119,1.1525248822082557,sigmoid,46,13.0,28.0,21.0,,,,4.0,7.0,6.764037457650256,2.11114144750569,1.439923172143311,7.0,22.0,58.0,,COMPLETE
1225,0.4983480176211454,2024-04-11 16:12:08.656650,2024-04-11 16:12:09.411678,0 days 00:00:00.755028,96.98703233648584,2.196256714132551,sigmoid,26,,16.0,5.0,3.0,6.0,51.0,,,8.470083928868092,6.716588160996109,5.037462170620944,4.0,29.0,80.0,,COMPLETE
1226,0.3677959569771923,2024-04-11 16:12:09.412679,2024-04-11 16:12:10.048254,0 days 00:00:00.635575,93.00966702438981,0.7724217110281124,sigmoid,42,7.0,27.0,16.0,,,,,,2.7819947197788806,4.129888991939685,2.9822933559822205,6.0,27.0,70.0,,COMPLETE
1227,0.3427500386458494,2024-04-11 16:12:10.049353,2024-04-11 16:12:10.623597,0 days 00:00:00.574244,90.06643542368637,1.0070894994439703,sigmoid,41,5.0,44.0,10.0,,,,,,,,,,,,142.0,COMPLETE
1228,0.14682620158182924,2024-04-11 16:12:10.624686,2024-04-11 16:12:11.160715,0 days 00:00:00.536029,80.71027350546426,1.433000126991325,sigmoid,20,,,,1.0,7.0,20.0,35.0,35.0,,,,,,,,COMPLETE
1229,0.5575342202029147,2024-04-11 16:12:11.161714,2024-04-11 16:12:11.675778,0 days 00:00:00.514064,98.37870578099955,0.5577989385857209,sigmoid,48,29.0,,,8.0,3.0,41.0,,,,,,,,,,COMPLETE
1230,0.41785491186615603,2024-04-11 16:12:11.676777,2024-04-11 16:12:12.247338,0 days 00:00:00.570561,95.15022388018957,1.28943177174376,sigmoid,56,18.0,18.0,19.0,5.0,8.0,55.0,,,,,,,,,,COMPLETE
1231,0.5811777745179535,2024-04-11 16:12:12.249336,2024-04-11 16:12:12.693091,0 days 00:00:00.443755,87.22275682803158,0.015137605936411114,sigmoid,0,,,,,,,,,,,,,,,,COMPLETE
1232,0.38120225601484975,2024-04-11 16:12:12.695300,2024-04-11 16:12:13.263023,0 days 00:00:00.567723,66.38643993445098,0.8547173181023777,sigmoid,52,48.0,,,3.0,4.0,87.0,20.0,3.0,,,,,,,,COMPLETE
1233,0.46687665864728783,2024-04-11 16:12:13.264058,2024-04-11 16:12:14.165755,0 days 00:00:00.901697,91.62679439432536,1.1223150262955295,sigmoid,59,40.0,37.0,33.0,7.0,3.0,33.0,,,5.769935856344102,9.04740871074146,5.55488223558471,17.0,40.0,74.0,106.0,COMPLETE
1234,0.5698793073290187,2024-04-11 16:12:14.167756,2024-04-11 16:12:14.628464,0 days 00:00:00.460708,95.68103527203964,2.6215947157165016,sigmoid,0,,,,,,,,,,,,,,,,COMPLETE
1235,0.4923229447353704,2024-04-11 16:12:14.629466,2024-04-11 16:12:15.377302,0 days 00:00:00.747836,84.95100341896087,0.6320708198496079,sigmoid,23,,,,1.0,1.0,59.0,5.0,47.0,4.498064177374157,9.992713838465946,3.635989443468395,2.0,43.0,86.0,38.0,COMPLETE
1236,0.07163858419088545,2024-04-11 16:12:15.378329,2024-04-11 16:12:15.906797,0 days 00:00:00.528468,93.73695460819411,0.3698180223525472,sigmoid,12,,7.0,2.0,,,,43.0,15.0,,,,,,,,COMPLETE
1237,0.14816776616747726,2024-04-11 16:12:15.908955,2024-04-11 16:12:16.473237,0 days 00:00:00.564282,98.49054140392404,1.761404554788868,sigmoid,2,,,,,,,,,0.631491332441573,5.319990238400207,7.323062042812066,6.0,25.0,53.0,,COMPLETE
1238,0.5300531693943673,2024-04-11 16:12:16.474239,2024-04-11 16:12:17.073641,0 days 00:00:00.599402,88.8233683409437,0.9870161016586377,sigmoid,44,3.0,26.0,23.0,,,,30.0,18.0,,,,,,,,COMPLETE
1239,0.3746536240109505,2024-04-11 16:12:17.074643,2024-04-11 16:12:17.952002,0 days 00:00:00.877359,96.36931893546422,1.51680361480252,rbf,0,,,,,,,,,,,,,,,,COMPLETE
1240,0.5892718722546639,2024-04-11 16:12:17.953005,2024-04-11 16:12:18.394490,0 days 00:00:00.441485,91.22405693343558,1.2208031535520751,sigmoid,0,,,,,,,,,,,,,,,,COMPLETE
1241,0.5405027405027405,2024-04-11 16:12:18.395491,2024-04-11 16:12:18.901237,0 days 00:00:00.505746,99.8180387367691,0.800434170093411,sigmoid,36,33.0,,,,,,12.0,14.0,,,,,,,,COMPLETE
1242,0.3345529988683516,2024-04-11 16:12:18.902285,2024-04-11 16:12:19.391964,0 days 00:00:00.489679,93.51961257859979,1.0824847494603045,sigmoid,40,44.0,30.0,31.0,,,,,,,,,,,,,COMPLETE
1243,0.35858678504604313,2024-04-11 16:12:19.392965,2024-04-11 16:12:19.975551,0 days 00:00:00.582586,99.98384551579952,1.3898512827010345,sigmoid,13,,10.0,32.0,,,,9.0,5.0,,,,,,,135.0,COMPLETE
1244,0.48049826424341435,2024-04-11 16:12:19.976551,2024-04-11 16:12:20.756047,0 days 00:00:00.779496,97.04196137836273,0.9222985089535374,sigmoid,54,47.0,,,2.0,2.0,75.0,27.0,4.0,3.408258792211025,8.18115967658317,2.7686250396798737,10.0,46.0,83.0,,COMPLETE
1245,0.3555751253217721,2024-04-11 16:12:20.758047,2024-04-11 16:12:21.495528,0 days 00:00:00.737481,94.64975656706699,0.6497830814331396,sigmoid,55,38.0,,,6.0,5.0,6.0,7.0,17.0,7.407353300721943,3.29173332556516,0.7281800608787679,5.0,45.0,66.0,69.0,COMPLETE
1246,0.5086791205157878,2024-04-11 16:12:21.496529,2024-04-11 16:12:22.132762,0 days 00:00:00.636233,28.74870914312573,1.1952595210601964,sigmoid,60,39.0,34.0,25.0,4.0,7.0,43.0,40.0,10.0,,,,,,,,COMPLETE
