number,value,datetime_start,datetime_complete,duration,params_C,params_gamma,params_kernel,params_mask_number,params_rsi_window,params_so_smooth,params_so_window,params_srsi_smooth1,params_srsi_smooth2,params_srsi_window,params_tsi_window_fast,params_tsi_window_slow,params_ult_weight_1,params_ult_weight_2,params_ult_weight_3,params_ult_window_1,params_ult_window_2,params_ult_window_3,params_williams_lbp,state
2817,0.34232236606123845,2024-04-11 16:31:11.094565,2024-04-11 16:31:12.241904,0 days 00:00:01.147339,92.56282608216479,7.321018171737247,sigmoid,26,,28.0,34.0,5.0,2.0,12.0,,,7.3626023868425,8.640485997966412,6.726245301544996,8.0,27.0,55.0,,COMPLETE
2818,0.35641237375341417,2024-04-11 16:31:12.243903,2024-04-11 16:31:13.190865,0 days 00:00:00.946962,96.69289553220648,8.752569043207487,sigmoid,11,,30.0,30.0,,,,,,3.8094067326999084,6.570126790299486,9.981950674908713,15.0,20.0,57.0,57.0,COMPLETE
2819,0.6009432182607054,2024-04-11 16:31:13.193107,2024-04-11 16:31:13.882458,0 days 00:00:00.689351,98.20706829052985,8.04099056368537,sigmoid,8,,26.0,31.0,,,,,,,,,,,,,COMPLETE
2820,0.5931679318644695,2024-04-11 16:31:13.884455,2024-04-11 16:31:14.601369,0 days 00:00:00.716914,98.24520923167552,8.327701154556026,sigmoid,8,,25.0,27.0,,,,,,,,,,,,,COMPLETE
2821,0.5952371952371952,2024-04-11 16:31:14.603372,2024-04-11 16:31:15.307092,0 days 00:00:00.703720,94.79432836475554,8.07589176706793,sigmoid,8,,24.0,32.0,,,,,,,,,,,,,COMPLETE
2822,0.4725966081464167,2024-04-11 16:31:15.309089,2024-04-11 16:31:16.159234,0 days 00:00:00.850145,98.21598841980985,7.674589928744091,sigmoid,20,,,,8.0,7.0,86.0,46.0,21.0,,,,,,,,COMPLETE
2823,0.3889174711739249,2024-04-11 16:31:16.161234,2024-04-11 16:31:17.053239,0 days 00:00:00.892005,95.38859791067264,7.846023061022611,sigmoid,56,11.0,21.0,29.0,7.0,4.0,43.0,,,,,,,,,,COMPLETE
2824,0.4889421863165867,2024-04-11 16:31:17.055240,2024-04-11 16:31:17.783251,0 days 00:00:00.728011,98.23780445030442,3.376899082234483,sigmoid,8,,29.0,31.0,,,,,,,,,,,,,COMPLETE
2825,0.4200077349490782,2024-04-11 16:31:17.785793,2024-04-11 16:31:18.861961,0 days 00:00:01.076168,99.95810227667464,8.236603852372031,sigmoid,55,49.0,,,2.0,8.0,2.0,8.0,35.0,0.5167479871580536,7.103070272099933,4.105015037638005,18.0,22.0,70.0,123.0,COMPLETE
2826,0.5146646517269492,2024-04-11 16:31:18.862963,2024-04-11 16:31:19.661751,0 days 00:00:00.798788,96.60012323787447,8.507903885893187,sigmoid,48,8.0,,,6.0,3.0,9.0,,,,,,,,,,COMPLETE
2827,0.44701971028259324,2024-04-11 16:31:19.663749,2024-04-11 16:31:20.445710,0 days 00:00:00.781961,93.68334158890413,7.9631686368484145,sigmoid,8,,27.0,30.0,,,,,,,,,,,,,COMPLETE
2828,0.32606852702225364,2024-04-11 16:31:20.447706,2024-04-11 16:31:21.288731,0 days 00:00:00.841025,96.58464976265302,8.087751115040318,sigmoid,13,,23.0,33.0,,,,14.0,30.0,,,,,,,20.0,COMPLETE
2829,0.3421430321699863,2024-04-11 16:31:21.290912,2024-04-11 16:31:22.208368,0 days 00:00:00.917456,98.32032149510476,7.490991493921922,sigmoid,44,14.0,25.0,32.0,,,,21.0,31.0,,,,,,,,COMPLETE
2830,0.46039633244602185,2024-04-11 16:31:22.210420,2024-04-11 16:31:23.682171,0 days 00:00:01.471751,92.24728853983746,8.397498261859692,rbf,8,,26.0,28.0,,,,,,,,,,,,,COMPLETE
2831,0.5940087769509635,2024-04-11 16:31:23.684170,2024-04-11 16:31:24.401443,0 days 00:00:00.717273,98.09542230298413,9.043156912922859,sigmoid,8,,25.0,31.0,,,,,,,,,,,,,COMPLETE
2832,0.44746006007602546,2024-04-11 16:31:24.403441,2024-04-11 16:31:25.261247,0 days 00:00:00.857806,95.35250764699431,7.781703290089336,sigmoid,52,16.0,,,4.0,5.0,61.0,24.0,37.0,,,,,,,,COMPLETE
2833,0.2696238672570033,2024-04-11 16:31:25.263411,2024-04-11 16:31:26.019591,0 days 00:00:00.756180,98.14880470837578,8.204244807717338,sigmoid,36,19.0,,,,,,50.0,2.0,,,,,,,,COMPLETE
2834,0.45896499072963254,2024-04-11 16:31:26.021593,2024-04-11 16:31:27.083831,0 days 00:00:01.062238,99.95902798564248,7.058775016172905,sigmoid,54,27.0,,,2.0,6.0,73.0,30.0,27.0,4.662954080904925,8.199887310384442,4.96491426943635,6.0,34.0,88.0,,COMPLETE
2835,0.41840969224342023,2024-04-11 16:31:27.084828,2024-04-11 16:31:28.206784,0 days 00:00:01.121956,96.4758591237641,7.949919282445424,sigmoid,59,3.0,23.0,26.0,3.0,1.0,16.0,,,7.916911057157973,9.204082955869897,4.735013414007564,14.0,35.0,66.0,62.0,COMPLETE
2836,0.45345352376492626,2024-04-11 16:31:28.208905,2024-04-11 16:31:28.893628,0 days 00:00:00.684723,94.9331907534885,8.605503850705386,sigmoid,8,,27.0,30.0,,,,,,,,,,,,,COMPLETE
2837,0.41373917228103946,2024-04-11 16:31:28.896344,2024-04-11 16:31:29.867624,0 days 00:00:00.971280,98.42734180378562,7.680733982086436,sigmoid,60,48.0,22.0,32.0,1.0,4.0,24.0,9.0,38.0,,,,,,,,COMPLETE
2838,0.3281244334868206,2024-04-11 16:31:29.869700,2024-04-11 16:31:30.822375,0 days 00:00:00.952675,99.97993845110497,8.335064340036968,sigmoid,7,,,,,,,46.0,46.0,5.861271202423708,2.2906909935251125,3.716430733907745,20.0,47.0,54.0,39.0,COMPLETE
2839,0.4572565189616122,2024-04-11 16:31:30.824382,2024-04-11 16:31:31.903144,0 days 00:00:01.078762,99.96854416855754,8.102070362779624,sigmoid,23,,,,5.0,3.0,67.0,19.0,33.0,6.401771897763604,5.017990267672655,8.907777697706345,13.0,33.0,83.0,105.0,COMPLETE
2840,0.5809184377973914,2024-04-11 16:31:31.906156,2024-04-11 16:31:32.586630,0 days 00:00:00.680474,96.70587599419362,7.8770529138778285,sigmoid,32,20.0,,,,,,,,,,,,,,,COMPLETE
2841,0.346871532797633,2024-04-11 16:31:32.587848,2024-04-11 16:31:33.255281,0 days 00:00:00.667433,92.77015616513087,7.370590065290334,sigmoid,1,,,,,,,,,,,,,,,73.0,COMPLETE
2842,0.5929369437606513,2024-04-11 16:31:33.257290,2024-04-11 16:31:33.943297,0 days 00:00:00.686007,96.62941858607496,8.155042990155971,sigmoid,8,,28.0,33.0,,,,,,,,,,,,,COMPLETE
2843,0.4211628515749979,2024-04-11 16:31:33.945305,2024-04-11 16:31:35.072134,0 days 00:00:01.126829,94.53923663801663,8.451522375412488,sigmoid,30,,24.0,29.0,8.0,2.0,37.0,7.0,50.0,7.749115381316573,7.417218473218166,7.069805075009837,16.0,36.0,91.0,,COMPLETE
2844,0.4370911536345296,2024-04-11 16:31:35.073163,2024-04-11 16:31:36.172369,0 days 00:00:01.099206,99.99459840230746,7.582393111850574,sigmoid,61,37.0,26.0,30.0,1.0,8.0,82.0,38.0,25.0,,,,,,,112.0,COMPLETE
2845,0.4967554366786836,2024-04-11 16:31:36.174693,2024-04-11 16:31:37.270685,0 days 00:00:01.095992,99.97827516537853,7.89665290634038,sigmoid,27,,25.0,31.0,3.0,5.0,5.0,,,4.148286106707035,5.400030159744615,6.202168449507537,9.0,46.0,78.0,169.0,COMPLETE
2846,0.32987428401398494,2024-04-11 16:31:37.272778,2024-04-11 16:31:38.048336,0 days 00:00:00.775558,97.98104194429098,8.748679263598683,sigmoid,12,,27.0,34.0,,,,16.0,43.0,,,,,,,,COMPLETE
2847,0.5238784370477569,2024-04-11 16:31:38.050338,2024-04-11 16:31:38.806284,0 days 00:00:00.755946,96.60646963170284,8.303767108993872,sigmoid,5,,,,,,,29.0,5.0,,,,,,,68.0,COMPLETE
2848,0.5370046738467791,2024-04-11 16:31:38.808304,2024-04-11 16:31:39.626960,0 days 00:00:00.818656,98.15728604915077,8.084863981708047,sigmoid,40,34.0,24.0,32.0,,,,,,,,,,,,,COMPLETE
2849,0.47110322389825504,2024-04-11 16:31:39.628102,2024-04-11 16:31:41.283827,0 days 00:00:01.655725,99.95079137486495,7.80414269047981,rbf,8,,26.0,31.0,,,,,,,,,,,,,COMPLETE
2850,0.3094592083255901,2024-04-11 16:31:41.286043,2024-04-11 16:31:42.170496,0 days 00:00:00.884453,59.42113601777178,8.009510464830692,sigmoid,34,41.0,,,,,,,,6.9336426906083375,6.025950099723522,9.144255284587521,3.0,49.0,60.0,,COMPLETE
2851,0.4244616197648302,2024-04-11 16:31:42.172496,2024-04-11 16:31:43.065547,0 days 00:00:00.893051,95.35958607744696,8.235338182465657,sigmoid,53,6.0,,,7.0,7.0,59.0,48.0,22.0,,,,,,,149.0,COMPLETE
2852,0.12622036262203626,2024-04-11 16:31:43.067546,2024-04-11 16:31:43.763512,0 days 00:00:00.695966,99.9834780004223,8.548462775276017,sigmoid,8,,24.0,29.0,,,,,,,,,,,,,COMPLETE
2853,0.5094385403018392,2024-04-11 16:31:43.765578,2024-04-11 16:31:44.632065,0 days 00:00:00.866487,97.9397657495352,7.646345296975707,sigmoid,45,33.0,25.0,35.0,,,,44.0,26.0,,,,,,,185.0,COMPLETE
2854,0.5246376811594203,2024-04-11 16:31:44.634109,2024-04-11 16:31:45.363345,0 days 00:00:00.729236,96.65228912721565,7.967663083902542,sigmoid,33,25.0,,,,,,,,,,,,,,33.0,COMPLETE
2855,0.4393614041639436,2024-04-11 16:31:45.364347,2024-04-11 16:31:46.386931,0 days 00:00:01.022584,94.13839944817286,8.358162334813047,sigmoid,51,29.0,,,6.0,6.0,90.0,,,0.8566955121925668,6.797172494273297,2.4779034667502438,10.0,50.0,51.0,102.0,COMPLETE
2856,0.1787385685457902,2024-04-11 16:31:46.387956,2024-04-11 16:31:47.063926,0 days 00:00:00.675970,96.77181627629587,7.779362338848351,sigmoid,4,,,,,,,33.0,3.0,,,,,,,,COMPLETE
2857,0.4365653642064641,2024-04-11 16:31:47.065922,2024-04-11 16:31:48.039413,0 days 00:00:00.973491,98.20703597362738,8.170816609621202,sigmoid,19,,,,4.0,1.0,95.0,,,5.013342404997188,2.0220253428950743,2.138396559841949,17.0,30.0,62.0,157.0,COMPLETE
2858,0.5929369437606513,2024-04-11 16:31:48.040625,2024-04-11 16:31:48.743750,0 days 00:00:00.703125,95.10960384264048,7.481777915318403,sigmoid,8,,23.0,33.0,,,,,,,,,,,,,COMPLETE
2859,0.44701971028259324,2024-04-11 16:31:48.744749,2024-04-11 16:31:49.443952,0 days 00:00:00.699203,56.03722415733441,8.0070774646116,sigmoid,8,,27.0,30.0,,,,,,,,,,,,,COMPLETE
2860,0.4745874937097756,2024-04-11 16:31:49.446117,2024-04-11 16:31:50.451842,0 days 00:00:01.005725,98.2460705895473,8.455826562890811,sigmoid,50,23.0,,,4.0,2.0,69.0,,,9.597169818704916,9.51924163407191,5.918642977973426,15.0,23.0,74.0,,COMPLETE
2861,0.41085784545540527,2024-04-11 16:31:50.453847,2024-04-11 16:31:51.639822,0 days 00:00:01.185975,93.04684984515664,8.182082666002172,sigmoid,58,43.0,29.0,31.0,7.0,4.0,53.0,,,2.86303754134349,1.477317635424344,6.536945569118787,11.0,44.0,99.0,,COMPLETE
2862,0.5952371952371952,2024-04-11 16:31:51.641822,2024-04-11 16:31:52.349829,0 days 00:00:00.708007,98.38550744439337,7.784748690827325,sigmoid,8,,22.0,32.0,,,,,,,,,,,,,COMPLETE
2863,0.35753375862180625,2024-04-11 16:31:52.351828,2024-04-11 16:31:53.191911,0 days 00:00:00.840083,96.4909119841145,8.301084863619417,sigmoid,49,13.0,,,5.0,8.0,19.0,,,,,,,,,91.0,COMPLETE
2864,0.3825445222091331,2024-04-11 16:31:53.192987,2024-04-11 16:31:54.232147,0 days 00:00:01.039160,98.00919500501038,8.614944388875047,sigmoid,39,30.0,,,,,,17.0,29.0,8.720062626859686,9.995543512680674,1.3244324364375628,2.0,48.0,89.0,79.0,COMPLETE
2865,0.4894742977036951,2024-04-11 16:31:54.233144,2024-04-11 16:31:55.050624,0 days 00:00:00.817480,95.41436838086992,7.933206789764967,sigmoid,17,,,,6.0,7.0,85.0,,,,,,,,,48.0,COMPLETE
2866,0.4491845899314583,2024-04-11 16:31:55.052598,2024-04-11 16:31:55.772766,0 days 00:00:00.720168,98.18945608326443,7.247340918854153,sigmoid,8,,26.0,30.0,,,,,,,,,,,,,COMPLETE
2867,0.3773679859089112,2024-04-11 16:31:55.773824,2024-04-11 16:31:57.093746,0 days 00:00:01.319922,92.44482708795812,7.673594006100829,rbf,18,,,,8.0,3.0,65.0,,,6.663412594551028,4.560063416622248,1.7170892664745123,5.0,38.0,67.0,,COMPLETE
2868,0.5071472669421095,2024-04-11 16:31:57.095897,2024-04-11 16:31:58.072115,0 days 00:00:00.976218,32.33480880405813,8.103214144626815,sigmoid,25,,28.0,32.0,2.0,4.0,40.0,,,,,,,,,163.0,COMPLETE
2869,0.12003789673140693,2024-04-11 16:31:58.073231,2024-04-11 16:31:58.798157,0 days 00:00:00.724926,96.51366895751222,8.332146968639172,sigmoid,8,,25.0,28.0,,,,,,,,,,,,,COMPLETE
2870,0.381192752557331,2024-04-11 16:31:58.800233,2024-04-11 16:31:59.789719,0 days 00:00:00.989486,98.05278636049809,7.877653853366344,sigmoid,43,17.0,24.0,33.0,,,,,,1.187890212232162,0.701689807459517,0.8704589910124785,10.0,43.0,69.0,181.0,COMPLETE
2871,0.5098223313592373,2024-04-11 16:31:59.791927,2024-04-11 16:32:00.911867,0 days 00:00:01.119940,93.91346328790948,8.898751467526976,sigmoid,47,21.0,26.0,30.0,,,,2.0,17.0,8.215108347241788,3.5442371694917787,7.7185599089040196,7.0,32.0,71.0,115.0,COMPLETE
2872,0.6009432182607054,2024-04-11 16:32:00.913867,2024-04-11 16:32:01.651172,0 days 00:00:00.737305,98.1960192348519,8.091027808340526,sigmoid,8,,27.0,31.0,,,,,,,,,,,,,COMPLETE
2873,0.3492554702006044,2024-04-11 16:32:01.652172,2024-04-11 16:32:02.501803,0 days 00:00:00.849631,95.22698245904222,7.630633275428687,sigmoid,24,,23.0,29.0,3.0,5.0,26.0,,,,,,,,,,COMPLETE
2874,0.266785617315077,2024-04-11 16:32:02.503801,2024-04-11 16:32:03.540072,0 days 00:00:01.036271,99.97082411521076,8.370174131714837,sigmoid,22,,,,4.0,1.0,46.0,41.0,44.0,5.60730094415524,2.7172066019084973,2.9771069683374223,8.0,40.0,86.0,,COMPLETE
2875,0.5005841260758649,2024-04-11 16:32:03.542368,2024-04-11 16:32:04.508977,0 days 00:00:00.966609,98.10869283821,7.968548368357552,sigmoid,35,15.0,,,,,,,,6.0042112428062655,6.33590748465357,8.66542953792871,16.0,39.0,81.0,14.0,COMPLETE
2876,0.525537811798865,2024-04-11 16:32:04.510034,2024-04-11 16:32:05.465740,0 days 00:00:00.955706,96.33724969419082,8.154691482907554,sigmoid,38,18.0,,,,,,4.0,18.0,3.383223036145697,1.0534527091590622,4.276441018692057,4.0,24.0,94.0,,COMPLETE
2877,0.4549034849073714,2024-04-11 16:32:05.466789,2024-04-11 16:32:06.493730,0 days 00:00:01.026941,99.96174534705558,8.662496643375912,sigmoid,21,,,,1.0,2.0,76.0,42.0,9.0,,,,,,,85.0,COMPLETE
2878,0.44219402632201116,2024-04-11 16:32:06.495782,2024-04-11 16:32:07.548448,0 days 00:00:01.052666,98.28486666497157,7.491075896272305,sigmoid,29,,25.0,32.0,2.0,6.0,29.0,23.0,14.0,,,,,,,54.0,COMPLETE
2879,0.5295055124986355,2024-04-11 16:32:07.550446,2024-04-11 16:32:08.465026,0 days 00:00:00.914580,96.52119635698365,7.828734881282418,sigmoid,6,,,,,,,31.0,7.0,3.1306877863164924,3.1071631513208864,5.485890489533295,12.0,27.0,64.0,,COMPLETE
2880,0.4839694271371995,2024-04-11 16:32:08.466126,2024-04-11 16:32:09.638961,0 days 00:00:01.172835,94.25168797264686,8.194124803960397,sigmoid,31,,24.0,31.0,7.0,6.0,17.0,36.0,48.0,4.518909984453896,1.8047943587212978,0.5310472514321329,13.0,25.0,84.0,44.0,COMPLETE
2881,0.5906279643331437,2024-04-11 16:32:09.640961,2024-04-11 16:32:10.343684,0 days 00:00:00.702723,99.922111808842,8.49589217154545,sigmoid,8,,26.0,34.0,,,,,,,,,,,,,COMPLETE
2882,0.4211522352868179,2024-04-11 16:32:10.345684,2024-04-11 16:32:11.271649,0 days 00:00:00.925965,18.572148066347147,7.956447023083408,sigmoid,57,9.0,25.0,30.0,6.0,8.0,100.0,,,,,,,,,193.0,COMPLETE
2883,0.5381892471378292,2024-04-11 16:32:11.272685,2024-04-11 16:32:12.218754,0 days 00:00:00.946069,99.98798634374953,7.751078199355828,sigmoid,3,,,,,,,,,2.565580532493264,8.011670284938136,3.91692289693765,19.0,31.0,77.0,120.0,COMPLETE
2884,0.3732463405564383,2024-04-11 16:32:12.221741,2024-04-11 16:32:13.324936,0 days 00:00:01.103195,96.57196030555615,8.291360567604439,sigmoid,15,,28.0,32.0,,,,28.0,24.0,8.889588159261278,8.929496045862432,9.391893826737341,6.0,42.0,92.0,10.0,COMPLETE
2885,0.6009432182607054,2024-04-11 16:32:13.327185,2024-04-11 16:32:14.082504,0 days 00:00:00.755319,98.37092867250492,8.059507199132268,sigmoid,8,,23.0,31.0,,,,,,,,,,,,,COMPLETE
2886,0.4523620847302652,2024-04-11 16:32:14.084725,2024-04-11 16:32:15.556736,0 days 00:00:01.472011,95.158899756166,8.437887861053404,rbf,8,,26.0,29.0,,,,,,,,,,,,,COMPLETE
2887,0.5139242231510086,2024-04-11 16:32:15.557735,2024-04-11 16:32:16.600021,0 days 00:00:01.042286,99.99728601439382,7.639805221087866,sigmoid,42,4.0,20.0,30.0,,,,,,7.231750334488886,4.402443637729088,8.422143534398577,14.0,28.0,75.0,,COMPLETE
2888,0.5929369437606513,2024-04-11 16:32:16.602184,2024-04-11 16:32:17.318270,0 days 00:00:00.716086,99.98909149517378,7.332719132879819,sigmoid,8,,27.0,33.0,,,,,,,,,,,,,COMPLETE
2889,0.35838801102612877,2024-04-11 16:32:17.320270,2024-04-11 16:32:18.069740,0 days 00:00:00.749470,47.8920170842175,8.0543812532426,sigmoid,9,,25.0,31.0,,,,,,,,,,,,139.0,COMPLETE
2890,0.4866401770206287,2024-04-11 16:32:18.071807,2024-04-11 16:32:18.987115,0 days 00:00:00.915308,61.881078452177334,7.872319346176939,sigmoid,28,,22.0,28.0,8.0,2.0,21.0,6.0,40.0,,,,,,,,COMPLETE
2891,0.5975614331269932,2024-04-11 16:32:18.989334,2024-04-11 16:32:19.710637,0 days 00:00:00.721303,96.66419739875842,6.333744139000564,sigmoid,8,,24.0,32.0,,,,,,,,,,,,,COMPLETE
2892,0.5986580986580987,2024-04-11 16:32:19.711830,2024-04-11 16:32:20.477466,0 days 00:00:00.765636,98.24653659242043,8.237843887039347,sigmoid,8,,24.0,31.0,,,,,,,,,,,,,COMPLETE
2893,0.47419698168818053,2024-04-11 16:32:20.479465,2024-04-11 16:32:21.429589,0 days 00:00:00.950124,99.9654651588363,8.463824195586351,sigmoid,10,,26.0,30.0,,,,,,5.3303575838885155,2.387723826061268,7.306022070225037,18.0,41.0,80.0,,COMPLETE
2894,0.352063972336287,2024-04-11 16:32:21.431587,2024-04-11 16:32:22.444378,0 days 00:00:01.012791,70.78433568726844,8.781531922567773,sigmoid,14,,25.0,33.0,,,,39.0,20.0,1.6067009824628364,1.298649020063952,3.2173890956363396,9.0,34.0,96.0,,COMPLETE
2895,0.12622036262203626,2024-04-11 16:32:22.445378,2024-04-11 16:32:23.144866,0 days 00:00:00.699488,99.97484530121991,7.808956508826494,sigmoid,8,,27.0,29.0,,,,,,,,,,,,,COMPLETE
2896,0.5147030310864086,2024-04-11 16:32:23.145868,2024-04-11 16:32:23.963610,0 days 00:00:00.817742,93.67615165968152,8.192715426721138,sigmoid,41,36.0,23.0,32.0,,,,,,,,,,,,129.0,COMPLETE
2897,0.2062929946676436,2024-04-11 16:32:23.964610,2024-04-11 16:32:24.782305,0 days 00:00:00.817695,95.6197688474526,8.014259758236468,sigmoid,2,,,,,,,,,9.405182778596938,5.7404004803914574,5.209281701693666,3.0,26.0,56.0,,COMPLETE
2898,0.5069140556625241,2024-04-11 16:32:24.784298,2024-04-11 16:32:25.495329,0 days 00:00:00.711031,96.79406057918105,7.516456569904375,sigmoid,8,,28.0,35.0,,,,,,,,,,,,,COMPLETE
2899,0.4812574943954955,2024-04-11 16:32:25.497425,2024-04-11 16:32:26.740038,0 days 00:00:01.242613,98.05095960037907,8.333646071152739,sigmoid,62,10.0,25.0,31.0,3.0,4.0,49.0,21.0,28.0,6.173993199825488,9.676188617568771,4.4685536618999935,20.0,29.0,58.0,,COMPLETE
2900,0.4193750391383305,2024-04-11 16:32:26.741060,2024-04-11 16:32:27.456093,0 days 00:00:00.715033,92.17375207676781,7.708560369425048,sigmoid,16,,,,5.0,3.0,56.0,,,,,,,,,,COMPLETE
2901,0.3517046458222929,2024-04-11 16:32:27.458108,2024-04-11 16:32:28.268383,0 days 00:00:00.810275,96.73621651397849,8.006929421854153,sigmoid,37,7.0,,,,,,49.0,15.0,,,,,,,59.0,COMPLETE
2902,0.5258153968044367,2024-04-11 16:32:28.270560,2024-04-11 16:32:29.236599,0 days 00:00:00.966039,98.22800302513157,8.170575530149137,sigmoid,11,,26.0,30.0,,,,,,9.813302293421305,6.127290966292207,3.4978240517916843,4.0,45.0,53.0,134.0,COMPLETE
2903,0.4629564297054154,2024-04-11 16:32:29.238628,2024-04-11 16:32:30.468352,0 days 00:00:01.229724,98.07357828074434,8.62653794121841,sigmoid,63,45.0,24.0,34.0,1.0,7.0,87.0,45.0,49.0,8.369994382475973,4.829185398888072,1.0770658290211035,11.0,35.0,65.0,24.0,COMPLETE
2904,0.5952371952371952,2024-04-11 16:32:30.471351,2024-04-11 16:32:31.236027,0 days 00:00:00.764676,99.95230009255965,7.8542357524672095,sigmoid,8,,29.0,32.0,,,,,,,,,,,,,COMPLETE
2905,0.3900603408262051,2024-04-11 16:32:31.238083,2024-04-11 16:32:32.289197,0 days 00:00:01.051114,94.7647918677978,7.120216664719093,sigmoid,46,40.0,21.0,29.0,,,,10.0,36.0,2.2074486642888735,6.927482077397938,5.675728734685268,8.0,21.0,89.0,,COMPLETE
2906,0.476743489973062,2024-04-11 16:32:32.291463,2024-04-11 16:32:33.913609,0 days 00:00:01.622146,96.61093725767294,8.377349819997924,rbf,8,,26.0,31.0,,,,,,,,,,,,,COMPLETE
2907,0.4664948453608248,2024-04-11 16:32:33.914713,2024-04-11 16:32:34.963529,0 days 00:00:01.048816,98.22184728732965,8.015796775153865,sigmoid,52,22.0,,,4.0,5.0,71.0,34.0,32.0,,,,,,,,COMPLETE
2908,0.45347172512526845,2024-04-11 16:32:34.965622,2024-04-11 16:32:35.767358,0 days 00:00:00.801736,99.99843722968765,7.520860245860783,sigmoid,8,,27.0,28.0,,,,,,,,,,,,,COMPLETE
2909,0.3986663850586851,2024-04-11 16:32:35.769515,2024-04-11 16:32:36.883744,0 days 00:00:01.114229,95.59019436455874,8.227562346972658,sigmoid,26,,25.0,33.0,5.0,1.0,7.0,,,7.623284118754259,5.149916738885147,2.6448217894203743,15.0,32.0,73.0,,COMPLETE
2910,0.32335014712063886,2024-04-11 16:32:36.885736,2024-04-11 16:32:37.769034,0 days 00:00:00.883298,92.35581293498214,7.687063761512917,sigmoid,56,50.0,24.0,30.0,7.0,8.0,13.0,,,,,,,,,,COMPLETE
2911,0.5963643249384587,2024-04-11 16:32:37.771035,2024-04-11 16:32:38.528834,0 days 00:00:00.757799,99.98697134274957,8.525351335508649,sigmoid,8,,23.0,32.0,,,,,,,,,,,,,COMPLETE
2912,0.3781811954101729,2024-04-11 16:32:38.530884,2024-04-11 16:32:39.698016,0 days 00:00:01.167132,96.77409905847264,7.841608382801819,sigmoid,55,38.0,,,8.0,6.0,11.0,18.0,41.0,8.10627261845405,9.347626288608613,6.863577268701416,12.0,37.0,63.0,152.0,COMPLETE
2913,0.6009432182607054,2024-04-11 16:32:39.700013,2024-04-11 16:32:40.433415,0 days 00:00:00.733402,99.96440419120422,8.076806613902175,sigmoid,8,,26.0,31.0,,,,,,,,,,,,,COMPLETE
2914,0.4818563376903705,2024-04-11 16:32:40.435457,2024-04-11 16:32:41.301049,0 days 00:00:00.865592,94.22423352296416,8.28061434790705,sigmoid,20,,,,6.0,7.0,80.0,40.0,12.0,,,,,,,,COMPLETE
2915,0.5244091057618997,2024-04-11 16:32:41.303050,2024-04-11 16:32:42.195934,0 days 00:00:00.892884,98.30489861006234,7.927565976187762,sigmoid,44,28.0,28.0,30.0,,,,25.0,42.0,,,,,,,,COMPLETE
2916,0.3585836755276997,2024-04-11 16:32:42.197936,2024-04-11 16:32:43.093993,0 days 00:00:00.896057,99.97954161690181,8.178166063176425,sigmoid,13,,25.0,33.0,,,,13.0,45.0,,,,,,,97.0,COMPLETE
2917,0.12622036262203626,2024-04-11 16:32:43.094993,2024-04-11 16:32:43.792613,0 days 00:00:00.697620,96.82571695777452,8.522797200118273,sigmoid,8,,27.0,29.0,,,,,,,,,,,,,COMPLETE
2918,0.4695815680487457,2024-04-11 16:32:43.794722,2024-04-11 16:32:44.604438,0 days 00:00:00.809716,95.16289007205921,7.416872105413363,sigmoid,48,32.0,,,1.0,2.0,97.0,,,,,,,,,,COMPLETE
2919,0.47392935370981143,2024-04-11 16:32:44.605525,2024-04-11 16:32:45.754763,0 days 00:00:01.149238,98.15324523659899,7.796761326897238,sigmoid,54,12.0,,,2.0,3.0,63.0,33.0,22.0,5.191107972518956,7.67496734120515,8.221698060647563,10.0,47.0,100.0,,COMPLETE
