number,value,datetime_start,datetime_complete,duration,params_C,params_gamma,params_kernel,params_mask_number,params_rsi_window,params_so_smooth,params_so_window,params_srsi_smooth1,params_srsi_smooth2,params_srsi_window,params_tsi_window_fast,params_tsi_window_slow,params_ult_weight_1,params_ult_weight_2,params_ult_weight_3,params_ult_window_1,params_ult_window_2,params_ult_window_3,params_williams_lbp,state
7852,0.4959422714913198,2024-04-11 18:34:10.108226,2024-04-11 18:34:11.453311,0 days 00:00:01.345085,95.57164924756258,7.3374680571520905,sigmoid,32,41.0,,,,,,,,,,,,,,,COMPLETE
7853,0.42569783994553445,2024-04-11 18:34:11.456300,2024-04-11 18:34:13.940267,0 days 00:00:02.483967,96.70516345080917,8.19460494494677,sigmoid,27,,23.0,32.0,5.0,5.0,24.0,,,1.9184590826095236,1.8671337858473551,2.885962503761098,14.0,24.0,57.0,176.0,COMPLETE
7854,0.4678164918733535,2024-04-11 18:34:13.944259,2024-04-11 18:34:16.237435,0 days 00:00:02.293176,99.98232075579894,7.988630821766586,sigmoid,51,3.0,,,6.0,4.0,66.0,,,3.4394876585914105,4.7705731081861185,6.1006429949111185,6.0,28.0,83.0,13.0,COMPLETE
7855,0.5580572102849096,2024-04-11 18:34:16.240442,2024-04-11 18:34:18.044299,0 days 00:00:01.803857,94.41873606540327,8.426252927943867,sigmoid,34,42.0,,,,,,,,1.3685262524165105,0.834825709192911,5.463709748422819,16.0,48.0,73.0,,COMPLETE
7856,0.21436739361267665,2024-04-11 18:34:18.046850,2024-04-11 18:34:19.459916,0 days 00:00:01.413066,98.29482887527847,8.187376616722698,sigmoid,4,,,,,,,26.0,34.0,,,,,,,,COMPLETE
7857,0.5963245096172158,2024-04-11 18:34:19.461900,2024-04-11 18:34:21.015346,0 days 00:00:01.553446,96.8913871284417,8.685833562941411,sigmoid,8,,26.0,31.0,,,,,,,,,,,,,COMPLETE
7858,0.36915394894155706,2024-04-11 18:34:21.018888,2024-04-11 18:34:22.923534,0 days 00:00:01.904646,98.16208335613646,7.709375835055432,sigmoid,45,46.0,24.0,29.0,,,,22.0,19.0,,,,,,,118.0,COMPLETE
7859,0.40244256114458804,2024-04-11 18:34:22.926535,2024-04-11 18:34:24.851599,0 days 00:00:01.925064,93.54145277297398,7.996320249314341,sigmoid,19,,,,8.0,5.0,98.0,,,6.405821098289442,6.892610174966377,3.037404829461703,7.0,42.0,89.0,24.0,COMPLETE
7860,0.43696504154256155,2024-04-11 18:34:24.854600,2024-04-11 18:34:26.278075,0 days 00:00:01.423475,98.22817817635259,7.528481678496631,sigmoid,33,37.0,,,,,,,,,,,,,,152.0,COMPLETE
7861,0.2643059231541481,2024-04-11 18:34:26.281059,2024-04-11 18:34:28.415469,0 days 00:00:02.134410,95.62087026515323,8.255855367607806,rbf,49,49.0,,,4.0,8.0,87.0,,,,,,,,,89.0,COMPLETE
7862,0.5952371952371952,2024-04-11 18:34:28.419026,2024-04-11 18:34:29.926531,0 days 00:00:01.507505,96.74593070249307,7.914802718045619,sigmoid,8,,27.0,32.0,,,,,,,,,,,,,COMPLETE
7863,0.4395656543099598,2024-04-11 18:34:29.930550,2024-04-11 18:34:32.537688,0 days 00:00:02.607138,90.1987163208689,8.493904472008465,sigmoid,30,,25.0,30.0,3.0,7.0,38.0,13.0,31.0,8.927184939072067,9.191290741679703,9.718470119191013,11.0,38.0,71.0,,COMPLETE
7864,0.46195565480937945,2024-04-11 18:34:32.540697,2024-04-11 18:34:34.918181,0 days 00:00:02.377484,99.9762116003215,7.763900225601053,sigmoid,58,31.0,24.0,33.0,7.0,3.0,81.0,,,4.4067894487665376,3.613554196684964,8.545338307103659,2.0,45.0,69.0,,COMPLETE
7865,0.508833769435374,2024-04-11 18:34:34.921206,2024-04-11 18:34:36.407293,0 days 00:00:01.486087,98.16116912118238,8.174087076695436,sigmoid,5,,,,,,,50.0,37.0,,,,,,,67.0,COMPLETE
7866,0.3496695475343162,2024-04-11 18:34:36.410262,2024-04-11 18:34:38.464572,0 days 00:00:02.054310,99.99049682092567,8.042357963005683,sigmoid,50,13.0,,,2.0,2.0,21.0,,,1.1369406839731564,8.677726947551427,4.868781458584362,5.0,41.0,64.0,,COMPLETE
7867,0.5963245096172158,2024-04-11 18:34:38.468139,2024-04-11 18:34:39.967275,0 days 00:00:01.499136,99.97194218234178,8.401613185849904,sigmoid,8,,26.0,31.0,,,,,,,,,,,,,COMPLETE
7868,0.375170152208885,2024-04-11 18:34:39.969873,2024-04-11 18:34:41.909004,0 days 00:00:01.939131,39.969525131374276,8.903446622406555,sigmoid,25,,29.0,31.0,6.0,1.0,17.0,,,,,,,,,76.0,COMPLETE
7869,0.44701971028259324,2024-04-11 18:34:41.911929,2024-04-11 18:34:43.458174,0 days 00:00:01.546245,93.94265803136788,7.8955928418908075,sigmoid,8,,26.0,30.0,,,,,,,,,,,,,COMPLETE
7870,0.391184753421966,2024-04-11 18:34:43.461161,2024-04-11 18:34:45.768225,0 days 00:00:02.307064,99.9809572662835,7.527935407262802,sigmoid,43,14.0,22.0,34.0,,,,,,4.786117089603009,5.5380194439180785,0.6108652307268239,17.0,27.0,96.0,131.0,COMPLETE
7871,0.5102018690778204,2024-04-11 18:34:45.772227,2024-04-11 18:34:47.855371,0 days 00:00:02.083144,50.79543326745543,8.300891243556434,sigmoid,53,2.0,,,1.0,2.0,33.0,37.0,40.0,,,,,,,124.0,COMPLETE
7872,0.409840580153606,2024-04-11 18:34:47.859450,2024-04-11 18:34:50.436050,0 days 00:00:02.576600,96.66083941120628,8.035089940905813,sigmoid,47,6.0,28.0,25.0,,,,10.0,29.0,8.41340629718838,4.198386262890335,9.329397326822491,13.0,47.0,90.0,48.0,COMPLETE
7873,0.49311538178337383,2024-04-11 18:34:50.440600,2024-04-11 18:34:52.394360,0 days 00:00:01.953760,95.25354963371595,7.7009259116706525,sigmoid,6,,,,,,,41.0,46.0,2.540902129660211,8.1129962303762,3.3537195598893352,3.0,36.0,77.0,,COMPLETE
7874,0.5030357448264067,2024-04-11 18:34:52.397358,2024-04-11 18:34:54.081436,0 days 00:00:01.684078,98.16332351912703,8.526488229477193,sigmoid,17,,,,5.0,6.0,56.0,,,,,,,,,141.0,COMPLETE
7875,0.5014544950824213,2024-04-11 18:34:54.085436,2024-04-11 18:34:56.058708,0 days 00:00:01.973272,96.7189811289805,8.194449875183219,sigmoid,18,,,,4.0,4.0,84.0,,,6.1057574524071,9.631477070791092,7.581313683095014,15.0,29.0,56.0,,COMPLETE
7876,0.48597852028639626,2024-04-11 18:34:56.061678,2024-04-11 18:34:58.474850,0 days 00:00:02.413172,98.13228581940443,7.880073224495919,sigmoid,39,24.0,,,,,,34.0,35.0,9.66581265805919,1.3839118212711177,6.324171247471401,18.0,43.0,62.0,148.0,COMPLETE
7877,0.5998117115420825,2024-04-11 18:34:58.478382,2024-04-11 18:35:00.034552,0 days 00:00:01.556170,98.23093357555119,7.293365803476607,sigmoid,8,,24.0,32.0,,,,,,,,,,,,,COMPLETE
7878,0.49382197854088516,2024-04-11 18:35:00.037568,2024-04-11 18:35:01.845378,0 days 00:00:01.807810,92.45788418104033,8.086803800548246,sigmoid,24,,27.0,29.0,8.0,5.0,62.0,,,,,,,,,,COMPLETE
7879,0.2009690118098314,2024-04-11 18:35:01.849004,2024-04-11 18:35:04.375456,0 days 00:00:02.526452,99.97670940265394,8.296597180631174,rbf,22,,,,2.0,7.0,96.0,32.0,25.0,6.8702795130724,3.4503359286226294,7.328301418052474,8.0,35.0,95.0,,COMPLETE
7880,0.46013630463003025,2024-04-11 18:35:04.378126,2024-04-11 18:35:06.501774,0 days 00:00:02.123648,95.33895920217792,7.7949428624424195,sigmoid,29,,23.0,31.0,3.0,8.0,75.0,47.0,18.0,,,,,,,31.0,COMPLETE
7881,0.5929369437606513,2024-04-11 18:35:06.503769,2024-04-11 18:35:07.950805,0 days 00:00:01.447036,99.94674754149457,8.58387495706323,sigmoid,8,,25.0,33.0,,,,,,,,,,,,,COMPLETE
7882,0.44701971028259324,2024-04-11 18:35:07.954802,2024-04-11 18:35:09.297817,0 days 00:00:01.343015,96.86867608370056,8.049486229604934,sigmoid,8,,25.0,30.0,,,,,,,,,,,,,COMPLETE
7883,0.5134281923411264,2024-04-11 18:35:09.299948,2024-04-11 18:35:11.156423,0 days 00:00:01.856475,98.21591706189193,7.59496933796512,sigmoid,35,45.0,,,,,,,,5.210435774582462,7.566081507343027,8.861303892264374,7.0,39.0,80.0,162.0,COMPLETE
7884,0.29085992004389744,2024-04-11 18:35:11.159995,2024-04-11 18:35:12.942252,0 days 00:00:01.782257,94.85533641143365,8.36530883581925,sigmoid,3,,,,,,,,,7.338659290369636,9.036895328135941,2.2393186651276977,20.0,20.0,68.0,181.0,COMPLETE
7885,0.5952371952371952,2024-04-11 18:35:12.945237,2024-04-11 18:35:14.333484,0 days 00:00:01.388247,96.89747555835136,7.798642262118843,sigmoid,8,,26.0,32.0,,,,,,,,,,,,,COMPLETE
7886,0.3404687558782589,2024-04-11 18:35:14.337000,2024-04-11 18:35:16.419604,0 days 00:00:02.082604,95.41160168839423,8.770390243524908,sigmoid,38,22.0,,,,,,24.0,32.0,3.049844745653733,6.246905089957628,1.6236400747900888,4.0,34.0,91.0,,COMPLETE
7887,0.12622036262203626,2024-04-11 18:35:16.421595,2024-04-11 18:35:18.033719,0 days 00:00:01.612124,98.040997381193,8.139711899233815,sigmoid,8,,23.0,29.0,,,,,,,,,,,,,COMPLETE
7888,0.3334723815483019,2024-04-11 18:35:18.035704,2024-04-11 18:35:20.203987,0 days 00:00:02.168283,99.99684747166917,7.92644663108738,sigmoid,42,40.0,24.0,30.0,,,,,,6.697961083579738,4.531237927006867,4.203899798910512,6.0,46.0,52.0,,COMPLETE
7889,0.4728801045038905,2024-04-11 18:35:20.206987,2024-04-11 18:35:22.863640,0 days 00:00:02.656653,93.75221808877079,7.422261387663741,sigmoid,31,,28.0,31.0,6.0,6.0,91.0,14.0,27.0,8.550065960188286,5.96127722760076,9.985865634293361,12.0,23.0,60.0,10.0,COMPLETE
7890,0.5636462904171639,2024-04-11 18:35:22.866641,2024-04-11 18:35:24.191543,0 days 00:00:01.324902,96.60304505452392,8.312695286810051,sigmoid,0,,,,,,,,,,,,,,,,COMPLETE
7891,0.4013948704763129,2024-04-11 18:35:24.194542,2024-04-11 18:35:26.533795,0 days 00:00:02.339253,98.23205103596605,8.045048561988022,sigmoid,15,,27.0,32.0,,,,30.0,14.0,7.646307546229,6.65590271674759,3.604343188950862,10.0,31.0,87.0,171.0,COMPLETE
7892,0.5929369437606513,2024-04-11 18:35:26.536780,2024-04-11 18:35:28.062187,0 days 00:00:01.525407,28.85230187029515,8.507304750541419,sigmoid,8,,25.0,33.0,,,,,,,,,,,,,COMPLETE
7893,0.3793651330245766,2024-04-11 18:35:28.065186,2024-04-11 18:35:30.124453,0 days 00:00:02.059267,98.269329842384,7.669533237151064,sigmoid,57,8.0,21.0,28.0,1.0,2.0,6.0,,,,,,,,,94.0,COMPLETE
7894,0.37850024505799706,2024-04-11 18:35:30.127435,2024-04-11 18:35:32.350517,0 days 00:00:02.223082,99.96372573335616,8.204870273694443,sigmoid,14,,26.0,31.0,,,,5.0,42.0,4.594931670659183,3.252252038987684,0.9790271680279456,19.0,50.0,61.0,,COMPLETE
7895,0.510282579714579,2024-04-11 18:35:32.353522,2024-04-11 18:35:34.268860,0 days 00:00:01.915338,91.64203740586572,5.243432983054563,sigmoid,21,,,,7.0,1.0,28.0,19.0,20.0,,,,,,,137.0,COMPLETE
7896,0.5009959386398324,2024-04-11 18:35:34.271777,2024-04-11 18:35:36.342289,0 days 00:00:02.070512,95.5425897368185,7.865665884952301,sigmoid,28,,27.0,30.0,5.0,3.0,69.0,17.0,7.0,,,,,,,,COMPLETE
7897,0.4655948553054663,2024-04-11 18:35:36.345281,2024-04-11 18:35:38.792572,0 days 00:00:02.447291,99.9865552138619,8.01700462939905,rbf,8,,25.0,34.0,,,,,,,,,,,,,COMPLETE
7898,0.3504356243949661,2024-04-11 18:35:38.795555,2024-04-11 18:35:40.276199,0 days 00:00:01.480644,96.74131551795743,8.340753631865107,sigmoid,9,,35.0,31.0,,,,,,,,,,,,36.0,COMPLETE
7899,0.382790298063578,2024-04-11 18:35:40.278814,2024-04-11 18:35:42.612044,0 days 00:00:02.333230,93.62228297698181,8.657421510146357,sigmoid,46,29.0,24.0,32.0,,,,11.0,2.0,7.971056660987184,5.446880166575887,2.5805386798042216,9.0,21.0,94.0,,COMPLETE
7900,0.537929726197753,2024-04-11 18:35:42.615045,2024-04-11 18:35:44.539131,0 days 00:00:01.924086,98.10047110988903,7.663641778039076,sigmoid,2,,,,,,,,,5.837782033167153,7.0851457562551605,7.980051293754613,5.0,37.0,85.0,,COMPLETE
7901,0.4849517467419297,2024-04-11 18:35:44.541710,2024-04-11 18:35:46.086862,0 days 00:00:01.545152,96.48670350270181,8.15572919100419,sigmoid,16,,,,2.0,4.0,40.0,,,,,,,,,,COMPLETE
7902,0.12622036262203626,2024-04-11 18:35:46.089411,2024-04-11 18:35:47.625688,0 days 00:00:01.536277,98.17916738470888,7.883329081580091,sigmoid,8,,26.0,29.0,,,,,,,,,,,,,COMPLETE
7903,0.4405940594059406,2024-04-11 18:35:47.627690,2024-04-11 18:35:50.257721,0 days 00:00:02.630031,99.94806367829908,8.418547099729619,sigmoid,62,35.0,23.0,30.0,8.0,5.0,49.0,35.0,50.0,4.12565782373887,1.082224163570677,3.234773203418934,14.0,30.0,82.0,,COMPLETE
7904,0.32977444156979924,2024-04-11 18:35:50.261297,2024-04-11 18:35:52.237618,0 days 00:00:01.976321,94.96922990481056,8.076173353970546,sigmoid,10,,28.0,33.0,,,,,,4.928565598730782,2.726031224616441,4.372325816545136,16.0,43.0,79.0,,COMPLETE
7905,0.5952371952371952,2024-04-11 18:35:52.241134,2024-04-11 18:35:53.753787,0 days 00:00:01.512653,96.68441077729219,7.774615366192265,sigmoid,8,,25.0,32.0,,,,,,,,,,,,,COMPLETE
7906,0.37110786766750076,2024-04-11 18:35:53.757791,2024-04-11 18:35:55.540603,0 days 00:00:01.782812,96.66214909775735,7.520833021590937,sigmoid,41,20.0,24.0,31.0,,,,,,,,,,,,156.0,COMPLETE
7907,0.37198881439304604,2024-04-11 18:35:55.542608,2024-04-11 18:35:57.642609,0 days 00:00:02.100001,98.10934584605072,8.19895144648452,sigmoid,11,,27.0,30.0,,,,,,5.453742315658459,2.3394840532846746,5.08997566969058,17.0,25.0,98.0,54.0,COMPLETE
7908,0.42474666666666666,2024-04-11 18:35:57.645612,2024-04-11 18:35:59.946112,0 days 00:00:02.300500,98.1415042630711,7.887247391695553,sigmoid,26,,23.0,31.0,4.0,7.0,51.0,,,0.7681742799021425,8.288421827733305,3.7299011020058166,13.0,40.0,71.0,,COMPLETE
7909,0.5963643249384587,2024-04-11 18:35:59.949114,2024-04-11 18:36:01.355129,0 days 00:00:01.406015,99.99224327617341,8.374210451155172,sigmoid,8,,29.0,32.0,,,,,,,,,,,,,COMPLETE
7910,0.45024875621890553,2024-04-11 18:36:01.358122,2024-04-11 18:36:02.806236,0 days 00:00:01.448114,93.70486481807956,5.726427712397201,sigmoid,8,,26.0,28.0,,,,,,,,,,,,,COMPLETE
7911,0.4571436167384484,2024-04-11 18:36:02.808236,2024-04-11 18:36:04.600083,0 days 00:00:01.791847,98.24492671597248,7.193478563758572,sigmoid,56,38.0,25.0,33.0,6.0,8.0,94.0,,,,,,,,,,COMPLETE
7912,0.12622036262203626,2024-04-11 18:36:04.603100,2024-04-11 18:36:06.075003,0 days 00:00:01.471903,95.31644313168097,8.000306379656298,sigmoid,8,,24.0,29.0,,,,,,,,,,,,,COMPLETE
7913,0.5986580986580987,2024-04-11 18:36:06.078001,2024-04-11 18:36:07.512059,0 days 00:00:01.434058,4.26620114508323,8.247252945822025,sigmoid,8,,26.0,31.0,,,,,,,,,,,,,COMPLETE
7914,0.19540014081201595,2024-04-11 18:36:07.515056,2024-04-11 18:36:09.206128,0 days 00:00:01.691072,96.64170623204942,8.635306246243609,sigmoid,20,,,,3.0,2.0,31.0,45.0,5.0,,,,,,,,COMPLETE
7915,0.3919162757127391,2024-04-11 18:36:09.209658,2024-04-11 18:36:11.778589,0 days 00:00:02.568931,98.2618475235721,7.6862614043093025,sigmoid,59,44.0,22.0,30.0,1.0,6.0,10.0,,,2.853084373720202,6.436887510522004,5.646808079653068,2.0,44.0,93.0,63.0,COMPLETE
7916,0.03156976744186046,2024-04-11 18:36:11.781648,2024-04-11 18:36:14.795602,0 days 00:00:03.013954,99.98132669492377,8.038273840188497,rbf,63,7.0,26.0,32.0,7.0,3.0,15.0,33.0,22.0,3.305653932109377,1.7941412787874116,1.9959183284557547,18.0,33.0,76.0,102.0,COMPLETE
7917,0.49970602520514334,2024-04-11 18:36:14.799599,2024-04-11 18:36:16.581168,0 days 00:00:01.781569,92.15556296451042,7.429867530979594,sigmoid,52,36.0,,,5.0,4.0,64.0,9.0,13.0,,,,,,,,COMPLETE
7918,0.4589730161792674,2024-04-11 18:36:16.583155,2024-04-11 18:36:19.127955,0 days 00:00:02.544800,95.1106566582526,8.457525717669823,sigmoid,55,11.0,,,2.0,1.0,47.0,23.0,45.0,7.184016092765049,4.643811504984613,8.248305510012624,11.0,26.0,53.0,84.0,COMPLETE
7919,0.5929369437606513,2024-04-11 18:36:19.131531,2024-04-11 18:36:20.511127,0 days 00:00:01.379596,98.18542088658089,7.847121124438962,sigmoid,8,,24.0,33.0,,,,,,,,,,,,,COMPLETE
7920,0.5069140556625241,2024-04-11 18:36:20.514127,2024-04-11 18:36:21.893986,0 days 00:00:01.379859,99.98169811526338,8.22490009982224,sigmoid,8,,25.0,35.0,,,,,,,,,,,,,COMPLETE
7921,0.5013966158036889,2024-04-11 18:36:21.895986,2024-04-11 18:36:24.390825,0 days 00:00:02.494839,96.71607566456714,8.092661554815392,sigmoid,23,,,,4.0,3.0,54.0,2.0,12.0,8.805247785781285,7.717296920705506,6.485407031097409,9.0,49.0,91.0,110.0,COMPLETE
7922,0.5497367144115163,2024-04-11 18:36:24.393849,2024-04-11 18:36:26.064311,0 days 00:00:01.670462,93.86216214932315,7.638074344504217,sigmoid,12,,28.0,29.0,,,,49.0,24.0,,,,,,,,COMPLETE
7923,0.5141264988399575,2024-04-11 18:36:26.068309,2024-04-11 18:36:27.828182,0 days 00:00:01.759873,99.95047414246511,7.979736534382558,sigmoid,13,,27.0,27.0,,,,12.0,28.0,,,,,,,127.0,COMPLETE
7924,0.5974957313602731,2024-04-11 18:36:27.831780,2024-04-11 18:36:29.321950,0 days 00:00:01.490170,98.15454934073702,8.452820714949809,sigmoid,8,,23.0,31.0,,,,,,,,,,,,,COMPLETE
7925,0.31418762536645584,2024-04-11 18:36:29.324929,2024-04-11 18:36:31.035123,0 days 00:00:01.710194,95.46331732048591,8.208983925858082,sigmoid,37,16.0,,,,,,38.0,30.0,,,,,,,17.0,COMPLETE
7926,0.484046477314644,2024-04-11 18:36:31.038124,2024-04-11 18:36:33.260936,0 days 00:00:02.222812,99.9865263657577,8.831284187332656,sigmoid,60,4.0,25.0,30.0,8.0,5.0,72.0,42.0,47.0,,,,,,,,COMPLETE
7927,0.32606852702225364,2024-04-11 18:36:33.263958,2024-04-11 18:36:35.042804,0 days 00:00:01.778846,73.7806101911699,7.805596247163721,sigmoid,44,34.0,30.0,32.0,,,,4.0,8.0,,,,,,,,COMPLETE
7928,0.5297372356334117,2024-04-11 18:36:35.045807,2024-04-11 18:36:36.570793,0 days 00:00:01.524986,96.71422009935527,8.297102191459759,sigmoid,36,12.0,,,,,,20.0,11.0,,,,,,,,COMPLETE
7929,0.47021800846322775,2024-04-11 18:36:36.573730,2024-04-11 18:36:38.850685,0 days 00:00:02.276955,98.15192470843124,7.972428989256982,sigmoid,54,50.0,,,6.0,7.0,60.0,44.0,33.0,6.284329494588034,9.822620037408122,1.264511457131817,15.0,28.0,65.0,,COMPLETE
7930,0.3288149804359977,2024-04-11 18:36:38.854251,2024-04-11 18:36:40.239418,0 days 00:00:01.385167,96.57997763898113,7.54091221214496,sigmoid,1,,,,,,,,,,,,,,,75.0,COMPLETE
7931,0.4607254516780566,2024-04-11 18:36:40.241987,2024-04-11 18:36:41.870661,0 days 00:00:01.628674,98.21362029434276,8.557083268817019,sigmoid,48,47.0,,,5.0,8.0,42.0,,,,,,,,,,COMPLETE
7932,0.531157599875503,2024-04-11 18:36:41.874910,2024-04-11 18:36:43.958067,0 days 00:00:02.083157,93.86665387976008,8.140277325713244,sigmoid,7,,,,,,,3.0,3.0,3.8669384697498295,4.005037754305454,6.88343259973621,3.0,32.0,97.0,27.0,COMPLETE
7933,0.5711081543432807,2024-04-11 18:36:43.961671,2024-04-11 18:36:45.349636,0 days 00:00:01.387965,90.34442877205349,6.850671076172279,sigmoid,8,,27.0,44.0,,,,,,,,,,,,,COMPLETE
7934,0.45385908351932985,2024-04-11 18:36:45.352246,2024-04-11 18:36:46.697964,0 days 00:00:01.345718,98.2301364109402,7.797800959968407,sigmoid,32,37.0,,,,,,,,,,,,,,,COMPLETE
7935,0.47532079976126534,2024-04-11 18:36:46.700636,2024-04-11 18:36:48.934035,0 days 00:00:02.233399,95.52427330751745,8.306430598181313,rbf,8,,25.0,31.0,,,,,,,,,,,,,COMPLETE
7936,0.4574376356554574,2024-04-11 18:36:48.937022,2024-04-11 18:36:51.352379,0 days 00:00:02.415357,98.10168520347372,7.950848567516258,sigmoid,61,10.0,22.0,30.0,3.0,6.0,44.0,7.0,18.0,,,,,,,200.0,COMPLETE
7937,0.5864654693575264,2024-04-11 18:36:51.356377,2024-04-11 18:36:52.926736,0 days 00:00:01.570359,95.42013864447665,4.296278241135455,sigmoid,8,,24.0,34.0,,,,,,,,,,,,,COMPLETE
7938,0.5083543580711191,2024-04-11 18:36:52.929737,2024-04-11 18:36:55.297623,0 days 00:00:02.367886,92.55674627039889,8.136418423089285,sigmoid,27,,26.0,32.0,7.0,4.0,34.0,,,2.3706746125566136,5.07105662789688,4.692482370545417,12.0,22.0,67.0,187.0,COMPLETE
7939,0.5203207999166753,2024-04-11 18:36:55.301211,2024-04-11 18:36:56.647746,0 days 00:00:01.346535,86.0581164592125,7.765623871344586,sigmoid,4,,,,,,,46.0,17.0,,,,,,,,COMPLETE
7940,0.4512950859356088,2024-04-11 18:36:56.651336,2024-04-11 18:36:58.096604,0 days 00:00:01.445268,96.86192183303554,8.518036196048497,sigmoid,8,,27.0,28.0,,,,,,,,,,,,,COMPLETE
7941,0.5320223556199545,2024-04-11 18:36:58.099601,2024-04-11 18:36:59.823371,0 days 00:00:01.723770,96.72035486412837,7.407516659779171,sigmoid,40,28.0,18.0,31.0,,,,,,,,,,,,,COMPLETE
7942,0.37281762898057935,2024-04-11 18:36:59.826371,2024-04-11 18:37:01.775525,0 days 00:00:01.949154,98.21261559236211,8.032579096571393,sigmoid,45,49.0,23.0,47.0,,,,15.0,44.0,,,,,,,22.0,COMPLETE
7943,0.32736858308319866,2024-04-11 18:37:01.778529,2024-04-11 18:37:03.563345,0 days 00:00:01.784816,99.98917395503771,8.338090491745639,sigmoid,34,18.0,,,,,,,,9.107376167356271,5.7172190725616785,7.7638626015510965,20.0,47.0,58.0,,COMPLETE
7944,0.5940618478467085,2024-04-11 18:37:03.566339,2024-04-11 18:37:04.988160,0 days 00:00:01.421821,98.12829213695694,8.695298630679009,sigmoid,8,,32.0,33.0,,,,,,,,,,,,,COMPLETE
7945,0.43075467370111253,2024-04-11 18:37:04.991709,2024-04-11 18:37:07.591660,0 days 00:00:02.599951,94.26309701573523,7.631405088224704,sigmoid,30,,25.0,30.0,1.0,1.0,79.0,31.0,36.0,9.382297569265269,8.570316773753758,2.364960690129257,8.0,36.0,86.0,,COMPLETE
7946,0.5443439664827644,2024-04-11 18:37:07.595670,2024-04-11 18:37:09.146061,0 days 00:00:01.550391,98.31811998988222,6.381098415513763,sigmoid,5,,,,,,,48.0,16.0,,,,,,,192.0,COMPLETE
7947,0.4244483194035236,2024-04-11 18:37:09.149063,2024-04-11 18:37:10.941798,0 days 00:00:01.792735,99.95706214154787,7.869897992025325,sigmoid,17,,,,4.0,8.0,24.0,,,,,,,,,97.0,COMPLETE
7948,0.12622036262203626,2024-04-11 18:37:10.944837,2024-04-11 18:37:12.349848,0 days 00:00:01.405011,95.54800162184956,8.162440229252518,sigmoid,8,,20.0,29.0,,,,,,,,,,,,,COMPLETE
7949,0.48996434702231617,2024-04-11 18:37:12.353365,2024-04-11 18:37:13.798243,0 days 00:00:01.444878,99.9424838171597,8.987936153961403,sigmoid,33,39.0,,,,,,,,,,,,,,119.0,COMPLETE
7950,0.4621660335056361,2024-04-11 18:37:13.801744,2024-04-11 18:37:15.995536,0 days 00:00:02.193792,96.6659309481916,8.39115641611158,sigmoid,51,31.0,,,8.0,5.0,82.0,,,2.041558345387949,6.11832163713026,7.192201784855182,6.0,24.0,78.0,114.0,COMPLETE
7951,0.512522023659703,2024-04-11 18:37:15.998560,2024-04-11 18:37:17.996421,0 days 00:00:01.997861,98.25118793442395,7.969225772368652,sigmoid,53,23.0,,,6.0,2.0,8.0,25.0,41.0,,,,,,,143.0,COMPLETE
7952,0.6009432182607054,2024-04-11 18:37:18.000413,2024-04-11 18:37:19.599868,0 days 00:00:01.599455,92.53991836338581,8.168174153572938,sigmoid,8,,24.0,31.0,,,,,,,,,,,,,COMPLETE
7953,0.4468109535564614,2024-04-11 18:37:19.603427,2024-04-11 18:37:22.144038,0 days 00:00:02.540611,98.25819571659149,7.6939479068123,sigmoid,58,43.0,28.0,32.0,2.0,6.0,67.0,,,1.6415719392775263,9.455316153515152,8.768335710753849,17.0,42.0,66.0,,COMPLETE
7954,0.4807221724858251,2024-04-11 18:37:22.147039,2024-04-11 18:37:24.225389,0 days 00:00:02.078350,95.22932877821655,7.898736109467486,rbf,8,,26.0,30.0,,,,,,,,,,,,,COMPLETE
