number,value,datetime_start,datetime_complete,duration,params_C,params_gamma,params_kernel,params_mask_number,params_rsi_window,params_so_smooth,params_so_window,params_srsi_smooth1,params_srsi_smooth2,params_srsi_window,params_tsi_window_fast,params_tsi_window_slow,params_ult_weight_1,params_ult_weight_2,params_ult_weight_3,params_ult_window_1,params_ult_window_2,params_ult_window_3,params_williams_lbp,state
5075,0.5275372957101837,2024-04-11 17:17:08.534130,2024-04-11 17:17:09.649389,0 days 00:00:01.115259,96.75283278776064,6.998821788360895,sigmoid,35,19.0,,,,,,,,8.072573562716062,4.759549259523853,6.0208293653858105,7.0,28.0,88.0,126.0,COMPLETE
5076,0.23927104480430572,2024-04-11 17:17:09.651376,2024-04-11 17:17:11.204302,0 days 00:00:01.552926,98.14401789047179,8.219753876356231,rbf,15,,26.0,33.0,,,,25.0,17.0,6.574091006626448,8.363021328062693,9.771187347324226,17.0,24.0,90.0,39.0,COMPLETE
5077,0.39179781196981217,2024-04-11 17:17:11.206304,2024-04-11 17:17:12.447763,0 days 00:00:01.241459,95.6981847325684,7.879960563448412,sigmoid,28,,28.0,32.0,6.0,3.0,23.0,16.0,43.0,,,,,,,,COMPLETE
5078,0.45345352376492626,2024-04-11 17:17:12.449787,2024-04-11 17:17:13.371643,0 days 00:00:00.921856,98.19182584222486,8.524929919872406,sigmoid,8,,24.0,30.0,,,,,,,,,,,,,COMPLETE
5079,0.46411470734451443,2024-04-11 17:17:13.373618,2024-04-11 17:17:14.938034,0 days 00:00:01.564416,99.99551519522899,8.91398802236787,sigmoid,63,34.0,21.0,32.0,1.0,5.0,64.0,13.0,28.0,8.478388987020775,4.259559882772588,1.3251218561045253,20.0,49.0,77.0,100.0,COMPLETE
5080,0.6009432182607054,2024-04-11 17:17:14.940031,2024-04-11 17:17:15.868952,0 days 00:00:00.928921,91.39448681391117,7.587182531338872,sigmoid,8,,22.0,31.0,,,,,,,,,,,,,COMPLETE
5081,0.3528023800567657,2024-04-11 17:17:15.870497,2024-04-11 17:17:17.172134,0 days 00:00:01.301637,93.8330942616677,8.096255227054366,sigmoid,14,,26.0,29.0,,,,31.0,4.0,8.91061694384264,7.744921521525122,0.8747669161201355,10.0,23.0,79.0,,COMPLETE
5082,0.31645762067654876,2024-04-11 17:17:17.174130,2024-04-11 17:17:18.109237,0 days 00:00:00.935107,96.72099655950127,7.777434146071466,sigmoid,9,,25.0,33.0,,,,,,,,,,,,24.0,COMPLETE
5083,0.34219232866751503,2024-04-11 17:17:18.110238,2024-04-11 17:17:19.307381,0 days 00:00:01.197143,95.43609186858303,8.298317060482237,sigmoid,42,38.0,27.0,30.0,,,,,,2.465647202346159,1.4584750459301015,9.124129409846605,12.0,40.0,62.0,,COMPLETE
5084,0.6009432182607054,2024-04-11 17:17:19.309381,2024-04-11 17:17:20.140505,0 days 00:00:00.831124,96.96468160590696,7.937370620702997,sigmoid,8,,29.0,31.0,,,,,,,,,,,,,COMPLETE
5085,0.43900423785282117,2024-04-11 17:17:20.142508,2024-04-11 17:17:21.285221,0 days 00:00:01.142713,98.3280671741272,7.399459051206536,sigmoid,57,10.0,25.0,31.0,4.0,7.0,53.0,,,,,,,,,87.0,COMPLETE
5086,0.41673062164236374,2024-04-11 17:17:21.286814,2024-04-11 17:17:22.752632,0 days 00:00:01.465818,75.7816628521332,8.121033637514543,sigmoid,62,9.0,27.0,32.0,8.0,2.0,30.0,35.0,35.0,7.849377491715339,5.432087858960705,2.5383289800409803,13.0,31.0,97.0,,COMPLETE
5087,0.12622036262203626,2024-04-11 17:17:22.755239,2024-04-11 17:17:23.599757,0 days 00:00:00.844518,98.14864634405548,8.4729168267591,sigmoid,8,,24.0,29.0,,,,,,,,,,,,,COMPLETE
5088,0.41113990466135586,2024-04-11 17:17:23.601377,2024-04-11 17:17:24.486915,0 days 00:00:00.885538,95.22402860022848,7.775542533712878,sigmoid,16,,,,6.0,4.0,69.0,,,,,,,,,,COMPLETE
5089,0.5906279643331437,2024-04-11 17:17:24.488912,2024-04-11 17:17:25.321542,0 days 00:00:00.832630,99.94126323015492,8.245834442368723,sigmoid,8,,26.0,34.0,,,,,,,,,,,,,COMPLETE
5090,0.3652367532964548,2024-04-11 17:17:25.323556,2024-04-11 17:17:26.615180,0 days 00:00:01.291624,99.94168543669333,7.987442745066262,sigmoid,46,47.0,23.0,30.0,,,,37.0,50.0,4.362548267434296,6.868711718981192,8.09802309867456,8.0,45.0,74.0,,COMPLETE
5091,0.19997632482342262,2024-04-11 17:17:26.617157,2024-04-11 17:17:27.593809,0 days 00:00:00.976652,99.93503578361945,8.722055901148625,sigmoid,2,,,,,,,,,6.243064882868984,9.325740861005201,4.365352565811047,4.0,26.0,70.0,,COMPLETE
5092,0.4339686614516481,2024-04-11 17:17:27.595792,2024-04-11 17:17:28.459508,0 days 00:00:00.863716,93.85034022857687,8.12849938336475,sigmoid,8,,25.0,20.0,,,,,,,,,,,,,COMPLETE
5093,0.4863482707809656,2024-04-11 17:17:28.460508,2024-04-11 17:17:29.462159,0 days 00:00:01.001651,96.45302073769886,8.415046362549978,sigmoid,20,,,,7.0,8.0,20.0,10.0,40.0,,,,,,,,COMPLETE
5094,0.2856804640334609,2024-04-11 17:17:29.463695,2024-04-11 17:17:30.822002,0 days 00:00:01.358307,98.19702624189742,7.584130906053768,rbf,41,13.0,24.0,33.0,,,,,,,,,,,,74.0,COMPLETE
5095,0.36376137084831817,2024-04-11 17:17:30.824632,2024-04-11 17:17:31.987115,0 days 00:00:01.162483,98.31819649987415,7.891524896484944,sigmoid,10,,28.0,28.0,,,,,,7.039412932481829,9.587634978832037,1.1935867846400967,6.0,29.0,96.0,,COMPLETE
5096,0.5963643249384587,2024-04-11 17:17:31.989143,2024-04-11 17:17:32.856562,0 days 00:00:00.867419,96.1588181909618,8.208488099093419,sigmoid,8,,26.0,32.0,,,,,,,,,,,,,COMPLETE
5097,0.3323896243017828,2024-04-11 17:17:32.858143,2024-04-11 17:17:33.770654,0 days 00:00:00.912511,92.21108498556974,7.8196225995440845,sigmoid,37,26.0,,,,,,18.0,37.0,,,,,,,120.0,COMPLETE
5098,0.4227996308686123,2024-04-11 17:17:33.772647,2024-04-11 17:17:35.045434,0 days 00:00:01.272787,98.20988841345952,8.571919112329438,sigmoid,26,,22.0,31.0,2.0,7.0,78.0,,,2.2124374128208806,4.431441194926747,1.5861070689159305,11.0,25.0,63.0,,COMPLETE
5099,0.41187178987061956,2024-04-11 17:17:35.047437,2024-04-11 17:17:36.105274,0 days 00:00:01.057837,95.20230926800605,8.070202712695382,sigmoid,56,49.0,25.0,30.0,1.0,3.0,49.0,,,,,,,,,,COMPLETE
5100,0.5952371952371952,2024-04-11 17:17:36.107263,2024-04-11 17:17:36.948337,0 days 00:00:00.841074,96.7442403681862,7.503047885099076,sigmoid,8,,23.0,32.0,,,,,,,,,,,,,COMPLETE
5101,0.5193687230989957,2024-04-11 17:17:36.950289,2024-04-11 17:17:38.154583,0 days 00:00:01.204294,98.20204687665185,8.368635657278004,sigmoid,11,,27.0,31.0,,,,,,4.975592103610238,8.77732258878807,8.567646853823174,17.0,44.0,64.0,186.0,COMPLETE
5102,0.42508472560794347,2024-04-11 17:17:38.156575,2024-04-11 17:17:39.092127,0 days 00:00:00.935552,99.96047173421843,7.694555746395332,sigmoid,48,30.0,,,4.0,1.0,56.0,,,,,,,,,,COMPLETE
5103,0.5929369437606513,2024-04-11 17:17:39.094664,2024-04-11 17:17:39.957717,0 days 00:00:00.863053,93.58207295038905,7.987691474715229,sigmoid,8,,26.0,33.0,,,,,,,,,,,,,COMPLETE
5104,0.4485106160989097,2024-04-11 17:17:39.959699,2024-04-11 17:17:41.015548,0 days 00:00:01.055849,96.75505278142185,8.233783694600275,sigmoid,52,24.0,,,5.0,5.0,58.0,43.0,20.0,,,,,,,,COMPLETE
5105,0.46847755013077597,2024-04-11 17:17:41.017545,2024-04-11 17:17:42.387507,0 days 00:00:01.369962,99.9953624673743,7.9149841350408945,sigmoid,55,14.0,,,2.0,6.0,2.0,28.0,25.0,7.518442991053618,2.866129575532529,3.09981950770748,5.0,42.0,84.0,177.0,COMPLETE
5106,0.3427173019899253,2024-04-11 17:17:42.389506,2024-04-11 17:17:43.398915,0 days 00:00:01.009409,96.82650145611332,8.142365118254684,sigmoid,44,36.0,24.0,29.0,,,,21.0,8.0,,,,,,,,COMPLETE
5107,0.5975287681569516,2024-04-11 17:17:43.401528,2024-04-11 17:17:44.230065,0 days 00:00:00.828537,98.15047626667075,6.45795217957179,sigmoid,8,,25.0,31.0,,,,,,,,,,,,,COMPLETE
5108,0.5906279643331437,2024-04-11 17:17:44.232066,2024-04-11 17:17:45.090986,0 days 00:00:00.858920,99.93865009546052,8.396828499768334,sigmoid,8,,27.0,34.0,,,,,,,,,,,,,COMPLETE
5109,0.47443079611450895,2024-04-11 17:17:45.092988,2024-04-11 17:17:46.547217,0 days 00:00:01.454229,99.982804505884,7.720194852641384,sigmoid,59,18.0,23.0,30.0,8.0,3.0,95.0,,,7.248342209490971,7.901414296405971,4.787536553266481,3.0,34.0,68.0,18.0,COMPLETE
5110,0.5204600752046007,2024-04-11 17:17:46.549214,2024-04-11 17:17:47.546176,0 days 00:00:00.996962,95.09753323159005,9.237941492940864,sigmoid,12,,30.0,32.0,,,,2.0,10.0,,,,,,,,COMPLETE
5111,0.46850294010072313,2024-04-11 17:17:47.549193,2024-04-11 17:17:48.421143,0 days 00:00:00.871950,0.182587766414521,8.689509157439435,sigmoid,36,22.0,,,,,,45.0,38.0,,,,,,,,COMPLETE
5112,0.44701971028259324,2024-04-11 17:17:48.423137,2024-04-11 17:17:49.255700,0 days 00:00:00.832563,98.20134286345849,8.009560326282264,sigmoid,8,,29.0,30.0,,,,,,,,,,,,,COMPLETE
5113,0.20966262850523673,2024-04-11 17:17:49.257693,2024-04-11 17:17:50.647091,0 days 00:00:01.389398,99.96621917180501,7.2891042732142335,rbf,60,3.0,24.0,31.0,3.0,2.0,62.0,17.0,5.0,,,,,,,,COMPLETE
5114,0.5408029878618115,2024-04-11 17:17:50.649095,2024-04-11 17:17:51.422696,0 days 00:00:00.773601,95.20837177155067,8.262177224747507,sigmoid,1,,,,,,,,,,,,,,,153.0,COMPLETE
5115,0.5028359763861558,2024-04-11 17:17:51.424675,2024-04-11 17:17:52.782429,0 days 00:00:01.357754,90.59403285655222,8.514470323595926,sigmoid,23,,,,6.0,4.0,36.0,38.0,18.0,1.2052791096487088,2.0955582945619233,2.033445713103166,14.0,21.0,71.0,170.0,COMPLETE
5116,0.12003789673140693,2024-04-11 17:17:52.785426,2024-04-11 17:17:53.707274,0 days 00:00:00.921848,98.23191520269567,7.813871670107128,sigmoid,8,,26.0,28.0,,,,,,,,,,,,,COMPLETE
5117,0.5952371952371952,2024-04-11 17:17:53.709272,2024-04-11 17:17:54.578370,0 days 00:00:00.869098,99.94852800052553,7.584856812717786,sigmoid,8,,25.0,32.0,,,,,,,,,,,,,COMPLETE
5118,0.42868854947924573,2024-04-11 17:17:54.580370,2024-04-11 17:17:55.898857,0 days 00:00:01.318487,99.95076619825583,8.084515147653569,sigmoid,54,11.0,,,5.0,7.0,90.0,46.0,36.0,4.715261988626521,5.758831516494376,7.788831600080039,9.0,41.0,50.0,,COMPLETE
5119,0.44032772216318994,2024-04-11 17:17:55.900854,2024-04-11 17:17:57.319508,0 days 00:00:01.418654,93.94235531265356,8.300855937308155,sigmoid,30,,28.0,30.0,3.0,8.0,45.0,48.0,11.0,0.906640109341196,1.0702906624464283,7.476483707556699,15.0,46.0,60.0,,COMPLETE
5120,0.5074992211491388,2024-04-11 17:17:57.321533,2024-04-11 17:17:58.333759,0 days 00:00:01.012226,96.54838973817996,7.888931895752799,sigmoid,13,,20.0,33.0,,,,32.0,21.0,,,,,,,116.0,COMPLETE
5121,0.1763235916984329,2024-04-11 17:17:58.335355,2024-04-11 17:17:59.078767,0 days 00:00:00.743412,96.81007654268981,8.052929954121325,sigmoid,32,39.0,,,,,,,,,,,,,,,COMPLETE
5122,0.12622036262203626,2024-04-11 17:17:59.080768,2024-04-11 17:17:59.916370,0 days 00:00:00.835602,99.99302444653574,7.4429146974456035,sigmoid,8,,27.0,29.0,,,,,,,,,,,,,COMPLETE
5123,0.41160061853794605,2024-04-11 17:17:59.918352,2024-04-11 17:18:01.297748,0 days 00:00:01.379396,96.46513135876846,7.709445096025228,sigmoid,27,,24.0,31.0,1.0,6.0,42.0,,,3.2370593221394337,0.5080676350826936,5.623399729585707,2.0,48.0,91.0,10.0,COMPLETE
5124,0.5491552800454009,2024-04-11 17:18:01.300334,2024-04-11 17:18:02.498174,0 days 00:00:01.197840,59.26855383714839,8.480842670447052,sigmoid,7,,,,,,,22.0,48.0,8.649051788664988,3.552704021026134,1.868095537421012,7.0,37.0,94.0,191.0,COMPLETE
5125,0.5260977118119975,2024-04-11 17:18:02.500683,2024-04-11 17:18:03.413415,0 days 00:00:00.912732,92.80881432867908,8.208770593011465,sigmoid,40,28.0,26.0,32.0,,,,,,,,,,,,,COMPLETE
5126,0.594268224819143,2024-04-11 17:18:03.415997,2024-04-11 17:18:04.248574,0 days 00:00:00.832577,98.02808376210366,7.911514132186725,sigmoid,8,,25.0,27.0,,,,,,,,,,,,,COMPLETE
5127,0.5170292243462975,2024-04-11 17:18:04.250565,2024-04-11 17:18:05.086661,0 days 00:00:00.836096,96.68421621159375,8.314229282657179,sigmoid,33,17.0,,,,,,,,,,,,,,33.0,COMPLETE
5128,0.5747117747117747,2024-04-11 17:18:05.087661,2024-04-11 17:18:05.928886,0 days 00:00:00.841225,94.65192296186763,8.791059702206638,sigmoid,4,,,,,,,5.0,23.0,,,,,,,,COMPLETE
5129,0.20449089111707386,2024-04-11 17:18:05.930907,2024-04-11 17:18:06.995073,0 days 00:00:01.064166,98.13761806940332,7.164336803767619,sigmoid,34,48.0,,,,,,,,9.9972504853667,9.76430681985244,7.225885421027679,19.0,30.0,86.0,,COMPLETE
5130,0.6009432182607054,2024-04-11 17:18:06.997073,2024-04-11 17:18:07.842524,0 days 00:00:00.845451,98.22010158413015,8.010450226618339,sigmoid,8,,22.0,31.0,,,,,,,,,,,,,COMPLETE
5131,0.19649768715189278,2024-04-11 17:18:07.844159,2024-04-11 17:18:09.181535,0 days 00:00:01.337376,99.95226184263717,8.145677902741994,rbf,53,31.0,,,7.0,1.0,13.0,7.0,34.0,,,,,,,58.0,COMPLETE
5132,0.495625459159821,2024-04-11 17:18:09.183516,2024-04-11 17:18:10.253873,0 days 00:00:01.070357,95.23588860886113,7.71642887000622,sigmoid,45,45.0,26.0,30.0,,,,30.0,15.0,,,,,,,128.0,COMPLETE
5133,0.5887266678987249,2024-04-11 17:18:10.256903,2024-04-11 17:18:11.121496,0 days 00:00:00.864593,96.81312015069078,3.7632503607304213,sigmoid,8,,23.0,34.0,,,,,,,,,,,,,COMPLETE
5134,0.4567795364335767,2024-04-11 17:18:11.123473,2024-04-11 17:18:12.146762,0 days 00:00:01.023289,33.18599814958154,8.57134483062963,sigmoid,49,41.0,,,4.0,2.0,82.0,,,,,,,,,161.0,COMPLETE
5135,0.511277384854235,2024-04-11 17:18:12.148742,2024-04-11 17:18:13.076443,0 days 00:00:00.927701,56.61058341329907,7.88467381473247,sigmoid,17,,,,3.0,5.0,66.0,,,,,,,,,146.0,COMPLETE
5136,0.41326530612244894,2024-04-11 17:18:13.078483,2024-04-11 17:18:14.347947,0 days 00:00:01.269464,99.98122632854634,8.292176546733547,sigmoid,51,6.0,,,6.0,3.0,71.0,,,5.930739665662506,6.176421626053516,5.156110713625966,12.0,20.0,53.0,42.0,COMPLETE
5137,0.42301772786866554,2024-04-11 17:18:14.349945,2024-04-11 17:18:15.625053,0 days 00:00:01.275108,98.11469034911815,8.085910725173523,sigmoid,61,43.0,28.0,32.0,8.0,6.0,26.0,34.0,26.0,,,,,,,49.0,COMPLETE
5138,0.6009432182607054,2024-04-11 17:18:15.627633,2024-04-11 17:18:16.479302,0 days 00:00:00.851669,93.77609684275646,7.5976189274730705,sigmoid,8,,25.0,31.0,,,,,,,,,,,,,COMPLETE
5139,0.12622036262203626,2024-04-11 17:18:16.480891,2024-04-11 17:18:17.335151,0 days 00:00:00.854260,49.17582957293333,8.373884955136528,sigmoid,8,,24.0,29.0,,,,,,,,,,,,,COMPLETE
5140,0.5929369437606513,2024-04-11 17:18:17.337152,2024-04-11 17:18:18.189306,0 days 00:00:00.852154,96.82553937935349,7.838857474353417,sigmoid,8,,27.0,33.0,,,,,,,,,,,,,COMPLETE
5141,0.4234644539414168,2024-04-11 17:18:18.191304,2024-04-11 17:18:19.403736,0 days 00:00:01.212432,99.94345751251508,8.129310248303545,sigmoid,19,,,,7.0,7.0,10.0,,,3.612543243390161,8.59714955920146,6.739561574056651,16.0,35.0,82.0,136.0,COMPLETE
5142,0.45345352376492626,2024-04-11 17:18:19.406254,2024-04-11 17:18:20.235380,0 days 00:00:00.829126,99.95976789005952,8.515253154391479,sigmoid,8,,26.0,30.0,,,,,,,,,,,,,COMPLETE
5143,0.35882925422629136,2024-04-11 17:18:20.237920,2024-04-11 17:18:21.106590,0 days 00:00:00.868670,95.0069002953423,7.974067838714636,sigmoid,5,,,,,,,15.0,30.0,,,,,,,85.0,COMPLETE
5144,0.3356145910592678,2024-04-11 17:18:21.107593,2024-04-11 17:18:22.328970,0 days 00:00:01.221377,98.20834286984467,7.750574036520202,sigmoid,50,5.0,,,2.0,2.0,33.0,,,4.201363881225057,3.05955626144416,2.7738148174548893,10.0,33.0,95.0,,COMPLETE
5145,0.43446206600942994,2024-04-11 17:18:22.330985,2024-04-11 17:18:23.692406,0 days 00:00:01.361421,96.52516787183582,7.503095182021071,sigmoid,58,15.0,24.0,35.0,5.0,4.0,85.0,,,9.61781329001393,9.134384267066023,8.691805396213406,20.0,50.0,52.0,,COMPLETE
5146,0.42659011935337665,2024-04-11 17:18:23.694357,2024-04-11 17:18:24.878363,0 days 00:00:01.184006,92.15088462798575,8.184453458697625,sigmoid,29,,25.0,32.0,1.0,8.0,80.0,11.0,2.0,,,,,,,94.0,COMPLETE
5147,0.37742575589412436,2024-04-11 17:18:24.879360,2024-04-11 17:18:26.081001,0 days 00:00:01.201641,98.15777472187195,8.889165150179663,sigmoid,39,24.0,,,,,,27.0,6.0,2.8014614412060874,4.682121862077211,8.915773496071342,18.0,47.0,73.0,180.0,COMPLETE
5148,0.32783131706650265,2024-04-11 17:18:26.082996,2024-04-11 17:18:27.229288,0 days 00:00:01.146292,95.09318358571471,8.364673116034464,sigmoid,18,,,,4.0,1.0,39.0,,,4.537923206674559,2.6216866772255565,5.361126648273364,18.0,24.0,88.0,,COMPLETE
5149,0.5007905138339921,2024-04-11 17:18:27.231276,2024-04-11 17:18:28.221906,0 days 00:00:00.990630,96.66664854362882,7.960403470703957,sigmoid,24,,26.0,31.0,6.0,5.0,6.0,,,,,,,,,,COMPLETE
5150,0.27932098765432095,2024-04-11 17:18:28.223445,2024-04-11 17:18:29.622318,0 days 00:00:01.398873,98.16001815036788,8.635115415848752,rbf,6,,,,,,,4.0,31.0,1.9020648776732139,5.529078324250354,5.831050889794518,8.0,27.0,76.0,,COMPLETE
5151,0.4911995037605644,2024-04-11 17:18:29.624913,2024-04-11 17:18:30.482326,0 days 00:00:00.857413,98.07207077020587,8.202506385799603,sigmoid,8,,27.0,37.0,,,,,,,,,,,,,COMPLETE
5152,0.5198695197259094,2024-04-11 17:18:30.483327,2024-04-11 17:18:31.675818,0 days 00:00:01.192491,99.97338601316781,7.772107899853242,sigmoid,38,8.0,,,,,,36.0,29.0,3.8145110963321853,1.6575327390099623,6.388237204573846,16.0,44.0,72.0,,COMPLETE
5153,0.5918162918162918,2024-04-11 17:18:31.678342,2024-04-11 17:18:32.514502,0 days 00:00:00.836160,93.95866508580842,5.456417505750435,sigmoid,8,,23.0,33.0,,,,,,,,,,,,,COMPLETE
5154,0.35702805376972524,2024-04-11 17:18:32.516497,2024-04-11 17:18:33.570643,0 days 00:00:01.054146,99.96449872054251,8.047535389233175,sigmoid,3,,,,,,,,,1.4027602352051165,4.051332732106081,3.3619834687015935,10.0,28.0,67.0,156.0,COMPLETE
5155,0.45239228755058314,2024-04-11 17:18:33.572660,2024-04-11 17:18:34.436974,0 days 00:00:00.864314,96.73572251934567,7.387074674849947,sigmoid,8,,25.0,28.0,,,,,,,,,,,,,COMPLETE
5156,0.36553996598639454,2024-04-11 17:18:34.438562,2024-04-11 17:18:35.553436,0 days 00:00:01.114874,95.53950089197966,8.39742932292922,sigmoid,35,4.0,,,,,,,,0.6295526478945863,7.607390167781471,9.269128700279516,11.0,43.0,75.0,69.0,COMPLETE
5157,0.39275996280095066,2024-04-11 17:18:35.555450,2024-04-11 17:18:36.647936,0 days 00:00:01.092486,98.1671165163171,7.915815773635334,sigmoid,25,,31.0,30.0,5.0,4.0,97.0,,,,,,,,,197.0,COMPLETE
5158,0.6009432182607054,2024-04-11 17:18:36.649936,2024-04-11 17:18:37.508086,0 days 00:00:00.858150,96.72448290269604,7.653540483966268,sigmoid,8,,24.0,31.0,,,,,,,,,,,,,COMPLETE
5159,0.38804937930080574,2024-04-11 17:18:37.510539,2024-04-11 17:18:38.768762,0 days 00:00:01.258223,91.56868155502437,8.266702480662417,sigmoid,43,50.0,27.0,29.0,,,,,,3.084442235512678,6.4634567325451595,6.2246753104034624,14.0,22.0,58.0,105.0,COMPLETE
5160,0.46431787790301016,2024-04-11 17:18:38.770775,2024-04-11 17:18:40.246163,0 days 00:00:01.475388,78.22633492803902,8.082158942878541,sigmoid,31,,21.0,32.0,3.0,8.0,31.0,26.0,32.0,5.22703011932601,0.857232292795925,2.3019264115936937,9.0,36.0,85.0,79.0,COMPLETE
5161,0.3856820277963298,2024-04-11 17:18:40.249166,2024-04-11 17:18:41.612872,0 days 00:00:01.363706,98.16652598917727,7.8619384692551675,sigmoid,47,42.0,36.0,26.0,,,,41.0,44.0,9.162536470284913,5.956737797155687,3.709362192662764,15.0,25.0,69.0,20.0,COMPLETE
5162,0.4271386430678466,2024-04-11 17:18:41.614818,2024-04-11 17:18:42.756311,0 days 00:00:01.141493,95.20758608136906,8.497306748493864,sigmoid,57,38.0,29.0,30.0,7.0,3.0,51.0,,,,,,,,,26.0,COMPLETE
5163,0.33637110896679884,2024-04-11 17:18:42.758306,2024-04-11 17:18:43.965132,0 days 00:00:01.206826,98.13855629689999,8.233414176401956,sigmoid,42,10.0,26.0,31.0,,,,,,5.803260751412397,7.153475465901648,3.978119504098563,6.0,23.0,98.0,,COMPLETE
5164,0.5929369437606513,2024-04-11 17:18:43.967135,2024-04-11 17:18:44.786360,0 days 00:00:00.819225,99.96826145980242,7.638075483247521,sigmoid,8,,23.0,33.0,,,,,,,,,,,,,COMPLETE
5165,0.4840577452354988,2024-04-11 17:18:44.788363,2024-04-11 17:18:46.371366,0 days 00:00:01.583003,83.94540205537763,8.058591095609717,sigmoid,63,35.0,25.0,32.0,8.0,2.0,60.0,19.0,27.0,7.7509726924708575,4.967669088693605,2.5435803629930938,13.0,38.0,81.0,167.0,COMPLETE
5166,0.4792623488611866,2024-04-11 17:18:46.372364,2024-04-11 17:18:47.520942,0 days 00:00:01.148578,69.90986085804579,7.863303494244431,sigmoid,28,,24.0,29.0,4.0,7.0,74.0,23.0,14.0,,,,,,,,COMPLETE
5167,0.5963245096172158,2024-04-11 17:18:47.522943,2024-04-11 17:18:48.372207,0 days 00:00:00.849264,93.19349721005212,8.374260080683426,sigmoid,8,,28.0,31.0,,,,,,,,,,,,,COMPLETE
5168,0.24174160804914965,2024-04-11 17:18:48.374210,2024-04-11 17:18:49.837076,0 days 00:00:01.462866,99.99992697048988,7.501724959587723,rbf,14,,22.0,30.0,,,,9.0,40.0,6.546167491120434,2.303978788272387,8.325913402258783,20.0,34.0,87.0,,COMPLETE
5169,0.5929369437606513,2024-04-11 17:18:49.839082,2024-04-11 17:18:50.705478,0 days 00:00:00.866396,96.77823807904201,8.152194657448506,sigmoid,8,,26.0,33.0,,,,,,,,,,,,,COMPLETE
5170,0.4055528494885533,2024-04-11 17:18:50.707491,2024-04-11 17:18:51.781743,0 days 00:00:01.074252,64.76934652061317,9.035689529971732,sigmoid,21,,,,2.0,5.0,76.0,33.0,22.0,,,,,,,52.0,COMPLETE
5171,0.35645124232776454,2024-04-11 17:18:51.783857,2024-04-11 17:18:53.221961,0 days 00:00:01.438104,40.82121243366507,8.632218710527521,sigmoid,22,,,,1.0,6.0,23.0,29.0,7.0,6.074761018302487,5.235294779118507,4.92668714736397,8.0,40.0,56.0,,COMPLETE
5172,0.40622175119229453,2024-04-11 17:18:53.224501,2024-04-11 17:18:54.607495,0 days 00:00:01.382994,95.03123668924678,5.206701502939879,sigmoid,15,,25.0,31.0,,,,25.0,16.0,8.348783363639992,8.926884696338794,4.481882049779728,4.0,32.0,92.0,29.0,COMPLETE
5173,0.4537160407398207,2024-04-11 17:18:54.609492,2024-04-11 17:18:55.513046,0 days 00:00:00.903554,52.5933197622601,7.9466924557242615,sigmoid,16,,,,6.0,1.0,47.0,,,,,,,,,,COMPLETE
5174,0.37877428998505225,2024-04-11 17:18:55.516036,2024-04-11 17:18:56.858037,0 days 00:00:01.342001,98.14842553709914,7.745206886593827,sigmoid,46,32.0,27.0,32.0,,,,13.0,24.0,5.505487735388612,1.9462869182526639,9.989916428331039,2.0,39.0,65.0,,COMPLETE
5175,0.45345352376492626,2024-04-11 17:18:56.860041,2024-04-11 17:18:57.703372,0 days 00:00:00.843331,96.85035702434415,8.275291462241142,sigmoid,8,,24.0,30.0,,,,,,,,,,,,,COMPLETE
5176,0.5000123325851565,2024-04-11 17:18:57.704906,2024-04-11 17:18:59.181244,0 days 00:00:01.476338,99.97876252969958,7.1236076721569574,sigmoid,62,27.0,26.0,42.0,7.0,6.0,16.0,39.0,19.0,6.926020899587024,6.701668214565422,7.887434621169515,7.0,22.0,78.0,,COMPLETE
