number,value,datetime_start,datetime_complete,duration,params_C,params_gamma,params_kernel,params_mask_number,params_rsi_window,params_so_smooth,params_so_window,params_srsi_smooth1,params_srsi_smooth2,params_srsi_window,params_tsi_window_fast,params_tsi_window_slow,params_ult_weight_1,params_ult_weight_2,params_ult_weight_3,params_ult_window_1,params_ult_window_2,params_ult_window_3,params_williams_lbp,state
3945,0.4758942052376738,2024-04-11 16:56:09.089045,2024-04-11 16:56:10.282115,0 days 00:00:01.193070,93.3721202112042,8.219441216480067,sigmoid,57,23.0,26.0,33.0,1.0,3.0,80.0,,,,,,,,,171.0,COMPLETE
3946,0.4639268342411092,2024-04-11 16:56:10.282115,2024-04-11 16:56:11.219777,0 days 00:00:00.937662,96.56803271872506,7.907120084600672,sigmoid,16,,,,4.0,8.0,100.0,,,,,,,,,,COMPLETE
3947,0.3654783456343127,2024-04-11 16:56:11.219777,2024-04-11 16:56:12.484461,0 days 00:00:01.264684,98.09136133926798,8.065481907112648,sigmoid,42,13.0,25.0,31.0,,,,,,4.663267976361977,9.993153235175203,9.226091377751214,18.0,31.0,69.0,,COMPLETE
3948,0.5236056468410091,2024-04-11 16:56:12.484461,2024-04-11 16:56:13.573682,0 days 00:00:01.089221,95.20596486798168,7.744556216589485,sigmoid,41,15.0,21.0,30.0,,,,,,,,,,,,22.0,COMPLETE
3949,0.5940618478467085,2024-04-11 16:56:13.573682,2024-04-11 16:56:14.472407,0 days 00:00:00.898725,98.22737825466247,8.707932152837886,sigmoid,8,,24.0,33.0,,,,,,,,,,,,,COMPLETE
3950,0.4951273722003761,2024-04-11 16:56:14.481291,2024-04-11 16:56:16.082183,0 days 00:00:01.600892,96.60709329726457,7.424538558650484,sigmoid,62,42.0,29.0,32.0,7.0,7.0,34.0,37.0,7.0,8.800189846973488,8.770279172893966,0.8415680539548624,20.0,47.0,81.0,,COMPLETE
3951,0.5098832942736073,2024-04-11 16:56:16.082183,2024-04-11 16:56:17.438824,0 days 00:00:01.356641,91.09376912157569,8.361680226262434,sigmoid,26,,27.0,29.0,3.0,5.0,9.0,,,4.186826784484805,7.987086088626989,9.839300675976485,9.0,38.0,73.0,,COMPLETE
3952,0.3846562533205823,2024-04-11 16:56:17.438824,2024-04-11 16:56:18.709890,0 days 00:00:01.271066,75.87698053317587,8.154185414934657,sigmoid,11,,23.0,31.0,,,,,,5.622093495845903,4.360512311608609,4.524851415171479,5.0,35.0,94.0,195.0,COMPLETE
3953,0.47110322389825504,2024-04-11 16:56:18.709890,2024-04-11 16:56:20.551429,0 days 00:00:01.841539,98.14024997061233,7.904542866168692,rbf,8,,26.0,31.0,,,,,,,,,,,,,COMPLETE
3954,0.3078826303784745,2024-04-11 16:56:20.551429,2024-04-11 16:56:21.757043,0 days 00:00:01.205614,63.05168376658691,7.199348104607263,sigmoid,10,,25.0,27.0,,,,,,9.823318053908299,7.620751809598968,1.9436516521975427,6.0,30.0,52.0,,COMPLETE
3955,0.522246199355042,2024-04-11 16:56:21.757043,2024-04-11 16:56:22.825597,0 days 00:00:01.068554,44.61617302182063,8.475413767248186,sigmoid,2,,,,,,,,,1.9319474117146038,9.649289883316799,7.7575648070707,14.0,43.0,77.0,,COMPLETE
3956,0.12003789673140693,2024-04-11 16:56:22.834702,2024-04-11 16:56:23.779088,0 days 00:00:00.944386,93.47368626879641,7.623075415613143,sigmoid,8,,24.0,28.0,,,,,,,,,,,,,COMPLETE
3957,0.39926889988340214,2024-04-11 16:56:23.786658,2024-04-11 16:56:24.923009,0 days 00:00:01.136351,98.19458121654984,8.196814248719447,sigmoid,56,30.0,26.0,30.0,8.0,4.0,98.0,,,,,,,,,,COMPLETE
3958,0.16060337178349599,2024-04-11 16:56:24.930957,2024-04-11 16:56:26.024039,0 days 00:00:01.093082,95.19988420282043,7.985277030297055,sigmoid,20,,,,6.0,8.0,26.0,22.0,36.0,,,,,,,,COMPLETE
3959,0.31589331107485674,2024-04-11 16:56:26.024039,2024-04-11 16:56:27.045504,0 days 00:00:01.021465,99.97228368319192,7.847092946567794,sigmoid,37,26.0,,,,,,12.0,34.0,,,,,,,140.0,COMPLETE
3960,0.5963643249384587,2024-04-11 16:56:27.045504,2024-04-11 16:56:27.968142,0 days 00:00:00.922638,99.98148107001002,8.29186375897615,sigmoid,8,,28.0,32.0,,,,,,,,,,,,,COMPLETE
3961,0.3996430947916037,2024-04-11 16:56:27.975710,2024-04-11 16:56:29.209504,0 days 00:00:01.233794,96.80592475596141,8.079439390039937,sigmoid,28,,27.0,30.0,1.0,5.0,48.0,39.0,15.0,,,,,,,,COMPLETE
3962,0.5120756279326525,2024-04-11 16:56:29.209504,2024-04-11 16:56:30.224446,0 days 00:00:01.014942,96.60907081693624,8.490998874629385,sigmoid,48,6.0,,,4.0,3.0,71.0,,,,,,,,,,COMPLETE
3963,0.4593788429838562,2024-04-11 16:56:30.224446,2024-04-11 16:56:31.370974,0 days 00:00:01.146528,95.20882983526894,7.6212266007027445,sigmoid,52,38.0,,,5.0,1.0,61.0,19.0,47.0,,,,,,,,COMPLETE
3964,0.5952371952371952,2024-04-11 16:56:31.370974,2024-04-11 16:56:32.346923,0 days 00:00:00.975949,96.9539986211836,7.826939676068083,sigmoid,8,,23.0,32.0,,,,,,,,,,,,,COMPLETE
3965,0.44959437676716957,2024-04-11 16:56:32.346923,2024-04-11 16:56:33.846550,0 days 00:00:01.499627,99.97702175452928,8.155684002494352,sigmoid,59,9.0,25.0,31.0,2.0,2.0,43.0,,,7.281706231487432,6.0680564237584855,4.095723217018903,11.0,38.0,71.0,58.0,COMPLETE
3966,0.4277881070179308,2024-04-11 16:56:33.846550,2024-04-11 16:56:35.317199,0 days 00:00:01.470649,98.29266485255933,8.677043643898854,sigmoid,55,10.0,,,3.0,7.0,90.0,49.0,41.0,9.251153382568976,2.682920588653456,5.765664248070571,16.0,44.0,95.0,162.0,COMPLETE
3967,0.5929369437606513,2024-04-11 16:56:35.325245,2024-04-11 16:56:36.216169,0 days 00:00:00.890924,99.98769492350779,8.367694279096796,sigmoid,8,,24.0,33.0,,,,,,,,,,,,,COMPLETE
3968,0.3597098473054884,2024-04-11 16:56:36.225300,2024-04-11 16:56:37.319160,0 days 00:00:01.093860,93.21896227914526,8.010970511388178,sigmoid,44,17.0,26.0,29.0,,,,32.0,4.0,,,,,,,,COMPLETE
3969,0.45345352376492626,2024-04-11 16:56:37.321449,2024-04-11 16:56:38.250925,0 days 00:00:00.929476,97.97538869240073,9.263588126212115,sigmoid,8,,25.0,30.0,,,,,,,,,,,,,COMPLETE
3970,0.4145746059491878,2024-04-11 16:56:38.250925,2024-04-11 16:56:39.524542,0 days 00:00:01.273617,35.8535481471674,7.468135650581556,sigmoid,60,43.0,22.0,34.0,8.0,6.0,46.0,26.0,27.0,,,,,,,,COMPLETE
3971,0.47897677153778306,2024-04-11 16:56:39.533626,2024-04-11 16:56:41.271677,0 days 00:00:01.738051,95.43010996968783,7.758410726552683,rbf,8,,24.0,31.0,,,,,,,,,,,,,COMPLETE
3972,0.48845962644698526,2024-04-11 16:56:41.271677,2024-04-11 16:56:42.375242,0 days 00:00:01.103565,98.001840803853,8.205702944754387,sigmoid,13,,27.0,32.0,,,,7.0,6.0,,,,,,,74.0,COMPLETE
3973,0.5929369437606513,2024-04-11 16:56:42.375242,2024-04-11 16:56:43.313177,0 days 00:00:00.937935,99.99686283959103,7.965850158550058,sigmoid,8,,28.0,33.0,,,,,,,,,,,,,COMPLETE
3974,0.4772029122221415,2024-04-11 16:56:43.313177,2024-04-11 16:56:44.747050,0 days 00:00:01.433873,96.61324025641156,8.394839713802492,sigmoid,54,35.0,,,7.0,4.0,23.0,2.0,13.0,4.816622353389509,5.610345804710349,6.457775211012419,19.0,37.0,86.0,,COMPLETE
3975,0.4214719039156812,2024-04-11 16:56:44.753999,2024-04-11 16:56:45.583767,0 days 00:00:00.829768,99.96439440350127,8.062381649685653,sigmoid,1,,,,,,,,,,,,,,,119.0,COMPLETE
3976,0.5240707134555391,2024-04-11 16:56:45.592661,2024-04-11 16:56:46.554298,0 days 00:00:00.961637,94.52841256888138,8.861492520913899,sigmoid,36,40.0,,,,,,34.0,45.0,,,,,,,,COMPLETE
3977,0.5069140556625241,2024-04-11 16:56:46.554298,2024-04-11 16:56:47.479924,0 days 00:00:00.925626,96.71754689057474,7.755544569660634,sigmoid,8,,26.0,35.0,,,,,,,,,,,,,COMPLETE
3978,0.46487384801329507,2024-04-11 16:56:47.479924,2024-04-11 16:56:48.879363,0 days 00:00:01.399439,98.10760782381217,8.268083624257768,sigmoid,23,,,,6.0,8.0,75.0,14.0,12.0,9.487189554620164,4.861296854522684,3.3193386660405477,17.0,26.0,97.0,191.0,COMPLETE
3979,0.5479386576379207,2024-04-11 16:56:48.879363,2024-04-11 16:56:49.881257,0 days 00:00:01.001894,99.958478219847,5.570860533386278,sigmoid,40,39.0,23.0,29.0,,,,,,,,,,,,,COMPLETE
3980,0.44608110044418964,2024-04-11 16:56:49.889728,2024-04-11 16:56:51.234110,0 days 00:00:01.344382,99.97994429942625,7.950942396882142,sigmoid,61,21.0,25.0,31.0,4.0,6.0,57.0,16.0,21.0,,,,,,,154.0,COMPLETE
3981,0.3677959569771923,2024-04-11 16:56:51.234110,2024-04-11 16:56:52.465464,0 days 00:00:01.231354,93.1345525186273,8.608480806663744,sigmoid,7,,,,,,,29.0,16.0,4.476602808999636,3.47732040133656,7.369792861188097,10.0,23.0,79.0,84.0,COMPLETE
3982,0.5776845855523185,2024-04-11 16:56:52.473525,2024-04-11 16:56:53.331977,0 days 00:00:00.858452,98.25865195671223,7.547780420520434,sigmoid,32,19.0,,,,,,,,,,,,,,,COMPLETE
3983,0.5469028979535777,2024-04-11 16:56:53.331977,2024-04-11 16:56:54.425134,0 days 00:00:01.093157,95.32778667565836,8.166362832074638,sigmoid,12,,24.0,30.0,,,,27.0,30.0,,,,,,,,COMPLETE
3984,0.5952371952371952,2024-04-11 16:56:54.433438,2024-04-11 16:56:55.331736,0 days 00:00:00.898298,98.21086843023467,7.838604971060819,sigmoid,8,,26.0,32.0,,,,,,,,,,,,,COMPLETE
3985,0.4885290148448043,2024-04-11 16:56:55.340632,2024-04-11 16:56:56.244112,0 days 00:00:00.903480,96.55219070165695,8.394961717895555,sigmoid,8,,41.0,37.0,,,,,,,,,,,,,COMPLETE
3986,0.4922350246904745,2024-04-11 16:56:56.244112,2024-04-11 16:56:57.722467,0 days 00:00:01.478355,55.61973598428241,8.06795747737145,sigmoid,27,,29.0,30.0,5.0,3.0,40.0,,,5.32757863934227,6.59183245820979,9.47061098331991,15.0,34.0,88.0,105.0,COMPLETE
3987,0.2713964408317878,2024-04-11 16:56:57.730948,2024-04-11 16:56:58.932940,0 days 00:00:01.201992,96.4683472812257,7.644186691974502,sigmoid,34,33.0,,,,,,,,7.057516665897664,2.430379431366039,8.608539284870622,3.0,29.0,84.0,,COMPLETE
3988,0.5415215037889971,2024-04-11 16:56:58.941540,2024-04-11 16:56:59.928866,0 days 00:00:00.987326,98.25591141833952,7.403659274215948,sigmoid,5,,,,,,,15.0,50.0,,,,,,,40.0,COMPLETE
3989,0.20697541452258433,2024-04-11 16:56:59.928866,2024-04-11 16:57:00.829241,0 days 00:00:00.900375,92.470115784922,8.234118936907878,sigmoid,4,,,,,,,18.0,40.0,,,,,,,,COMPLETE
3990,0.41973718113888175,2024-04-11 16:57:00.829241,2024-04-11 16:57:02.300249,0 days 00:00:01.471008,99.9846013928176,7.954320216704086,rbf,33,11.0,,,,,,,,,,,,,,49.0,COMPLETE
3991,0.3522227814125146,2024-04-11 16:57:02.300249,2024-04-11 16:57:03.825037,0 days 00:00:01.524788,94.22673189835442,8.529045969875185,sigmoid,30,,22.0,23.0,1.0,2.0,29.0,37.0,26.0,6.301441120659989,0.5098667598417803,2.782194672078694,4.0,33.0,63.0,,COMPLETE
3992,0.12003789673140693,2024-04-11 16:57:03.833326,2024-04-11 16:57:04.770691,0 days 00:00:00.937365,98.02729561966683,7.8141282333404405,sigmoid,8,,25.0,28.0,,,,,,,,,,,,,COMPLETE
3993,0.6009432182607054,2024-04-11 16:57:04.770691,2024-04-11 16:57:05.702083,0 days 00:00:00.931392,95.46591481281271,8.15392534924274,sigmoid,8,,27.0,31.0,,,,,,,,,,,,,COMPLETE
3994,0.432655532891382,2024-04-11 16:57:05.702083,2024-04-11 16:57:06.713433,0 days 00:00:01.011350,98.2381583243509,7.005039979917203,sigmoid,17,,,,2.0,1.0,78.0,,,,,,,,,101.0,COMPLETE
3995,0.4625444706118154,2024-04-11 16:57:06.713433,2024-04-11 16:57:08.066446,0 days 00:00:01.353013,99.95184295392255,8.329071694957255,sigmoid,51,20.0,,,3.0,5.0,96.0,,,6.104330942470211,4.622835891776875,9.096960469417539,7.0,22.0,76.0,132.0,COMPLETE
3996,0.34642376125327856,2024-04-11 16:57:08.066446,2024-04-11 16:57:09.206042,0 days 00:00:01.139596,96.8438577090739,7.988271830081747,sigmoid,45,45.0,26.0,32.0,,,,40.0,44.0,,,,,,,181.0,COMPLETE
3997,0.4686812190890494,2024-04-11 16:57:09.206042,2024-04-11 16:57:10.384297,0 days 00:00:01.178255,99.96564085077786,9.111768529201413,sigmoid,53,4.0,,,7.0,4.0,11.0,48.0,10.0,,,,,,,129.0,COMPLETE
3998,0.12622036262203626,2024-04-11 16:57:10.393005,2024-04-11 16:57:11.315539,0 days 00:00:00.922534,94.80787438981466,7.705070397935539,sigmoid,8,,24.0,29.0,,,,,,,,,,,,,COMPLETE
3999,0.38376227289036763,2024-04-11 16:57:11.315539,2024-04-11 16:57:12.612236,0 days 00:00:01.296697,99.98917403570759,8.468832043003426,sigmoid,19,,,,8.0,7.0,68.0,,,0.9284274471529192,1.843857333065528,9.990353767051957,8.0,25.0,99.0,57.0,COMPLETE
4000,0.3336465825712943,2024-04-11 16:57:12.612236,2024-04-11 16:57:13.930451,0 days 00:00:01.318215,90.75885017858312,6.791739788496698,sigmoid,50,7.0,,,4.0,3.0,20.0,,,6.606466212250084,1.4695955422993285,1.5375250154871858,2.0,32.0,51.0,,COMPLETE
4001,0.4475742507727456,2024-04-11 16:57:13.930451,2024-04-11 16:57:14.973827,0 days 00:00:01.043376,96.36024412418799,8.139428739312692,sigmoid,49,37.0,,,3.0,2.0,14.0,,,,,,,,,65.0,COMPLETE
4002,0.4978511260099708,2024-04-11 16:57:14.973827,2024-04-11 16:57:16.540938,0 days 00:00:01.567111,98.20765139709948,3.3755194849473114,sigmoid,58,48.0,23.0,31.0,5.0,6.0,53.0,,,3.9618236310647905,9.036129037569271,3.10101095592412,18.0,45.0,91.0,,COMPLETE
4003,0.5929369437606513,2024-04-11 16:57:16.541175,2024-04-11 16:57:17.455212,0 days 00:00:00.914037,98.20425262450537,7.88049127815315,sigmoid,8,,28.0,33.0,,,,,,,,,,,,,COMPLETE
4004,0.41177651388424225,2024-04-11 16:57:17.455212,2024-04-11 16:57:18.749294,0 days 00:00:01.294082,96.91004395667376,8.675833481852175,sigmoid,29,,25.0,30.0,6.0,8.0,2.0,23.0,2.0,,,,,,,113.0,COMPLETE
4005,0.5906279643331437,2024-04-11 16:57:18.749294,2024-04-11 16:57:19.644227,0 days 00:00:00.894933,94.65132957944782,8.283866489104422,sigmoid,8,,26.0,34.0,,,,,,,,,,,,,COMPLETE
4006,0.34608030592734224,2024-04-11 16:57:19.652633,2024-04-11 16:57:20.991526,0 days 00:00:01.338893,98.19303238791952,7.177455201317967,sigmoid,39,30.0,,,,,,3.0,23.0,8.07590413771561,3.256030345120212,6.912200397477529,10.0,41.0,74.0,124.0,COMPLETE
4007,0.3919230108266025,2024-04-11 16:57:20.991526,2024-04-11 16:57:22.291568,0 days 00:00:01.300042,96.63132416670217,8.069395505113011,sigmoid,43,41.0,31.0,31.0,,,,,,1.7450734673957053,9.338031693382813,5.4658261769699505,13.0,42.0,78.0,151.0,COMPLETE
4008,0.29275619054954366,2024-04-11 16:57:22.291568,2024-04-11 16:57:23.548877,0 days 00:00:01.257309,92.38035179096728,7.589499704581822,sigmoid,6,,,,,,,4.0,33.0,3.495033192530715,3.6821403899217935,3.889090398030834,11.0,28.0,56.0,,COMPLETE
4009,0.4469800654567093,2024-04-11 16:57:23.548877,2024-04-11 16:57:25.263283,0 days 00:00:01.714406,98.2631112874992,7.85174221005162,rbf,8,,27.0,32.0,,,,,,,,,,,,,COMPLETE
4010,0.4502698896972542,2024-04-11 16:57:25.271234,2024-04-11 16:57:26.242013,0 days 00:00:00.970779,95.66797975973019,8.202960072839351,sigmoid,8,,24.0,30.0,,,,,,,,,,,,,COMPLETE
4011,0.5003981067810854,2024-04-11 16:57:26.242013,2024-04-11 16:57:27.589365,0 days 00:00:01.347352,98.05589610133288,8.435761222123904,sigmoid,18,,,,7.0,1.0,81.0,,,3.0765068201657066,0.7691481085630842,4.318281594046252,6.0,46.0,59.0,,COMPLETE
4012,0.4054100620261888,2024-04-11 16:57:27.596888,2024-04-11 16:57:28.944153,0 days 00:00:01.347265,93.75724370204938,7.368299115165944,sigmoid,25,,21.0,26.0,1.0,5.0,32.0,,,,,,,,,69.0,COMPLETE
4013,0.44380874540253373,2024-04-11 16:57:28.945110,2024-04-11 16:57:30.569603,0 days 00:00:01.624493,96.6295750380179,7.978433028593129,sigmoid,47,14.0,25.0,28.0,,,,44.0,8.0,9.988363738292367,6.962521277188305,2.428671794935563,14.0,48.0,62.0,60.0,COMPLETE
4014,0.50250338134447,2024-04-11 16:57:30.569603,2024-04-11 16:57:31.654938,0 days 00:00:01.085335,98.10006236931744,7.711379332061443,sigmoid,24,,27.0,33.0,2.0,7.0,36.0,,,,,,,,,,COMPLETE
4015,0.12622036262203626,2024-04-11 16:57:31.654938,2024-04-11 16:57:32.585555,0 days 00:00:00.930617,98.3230984614524,9.813419538131459,sigmoid,8,,23.0,29.0,,,,,,,,,,,,,COMPLETE
4016,0.3636102740708853,2024-04-11 16:57:32.593958,2024-04-11 16:57:33.714647,0 days 00:00:01.120689,95.12932888795243,8.253175937751138,sigmoid,3,,,,,,,,,5.841929119263533,4.07191532041785,1.0681383752959865,9.0,34.0,80.0,146.0,COMPLETE
4017,0.6009432182607054,2024-04-11 16:57:33.714647,2024-04-11 16:57:34.609779,0 days 00:00:00.895132,98.10630310769588,8.025128853661023,sigmoid,8,,26.0,31.0,,,,,,,,,,,,,COMPLETE
4018,0.5532031170934116,2024-04-11 16:57:34.609779,2024-04-11 16:57:35.804767,0 days 00:00:01.194988,96.55083400945088,8.781880092374857,sigmoid,35,49.0,,,,,,,,0.6494809357338367,8.257338888030667,7.920054611744836,20.0,40.0,65.0,10.0,COMPLETE
4019,0.5963643249384587,2024-04-11 16:57:35.813032,2024-04-11 16:57:36.718325,0 days 00:00:00.905293,99.92906272435211,8.450389180205283,sigmoid,8,,25.0,32.0,,,,,,,,,,,,,COMPLETE
4020,0.378973754054851,2024-04-11 16:57:36.720382,2024-04-11 16:57:37.965631,0 days 00:00:01.245249,93.6015903586682,7.809437380029099,sigmoid,28,,24.0,30.0,8.0,4.0,16.0,11.0,31.0,,,,,,,,COMPLETE
4021,0.6009432182607054,2024-04-11 16:57:37.965631,2024-04-11 16:57:38.931832,0 days 00:00:00.966201,98.22884400426317,8.095904669114464,sigmoid,8,,28.0,31.0,,,,,,,,,,,,,COMPLETE
4022,0.3905741806354766,2024-04-11 16:57:38.931832,2024-04-11 16:57:40.020376,0 days 00:00:01.088544,99.97715589765764,7.634653217736697,sigmoid,21,,,,4.0,2.0,65.0,13.0,19.0,,,,,,,157.0,COMPLETE
4023,0.4672268056891229,2024-04-11 16:57:40.020376,2024-04-11 16:57:41.408493,0 days 00:00:01.388117,99.99736478372996,8.587336013168814,sigmoid,22,,,,5.0,3.0,83.0,46.0,29.0,2.912062634416257,7.436476045967201,3.5387719391963004,16.0,21.0,54.0,,COMPLETE
4024,0.33850026973565905,2024-04-11 16:57:41.408493,2024-04-11 16:57:42.733585,0 days 00:00:01.325092,96.43416276249852,8.3098496372327,sigmoid,42,27.0,26.0,32.0,,,,,,7.45696510934141,5.389265495075231,4.763129422085632,3.0,39.0,60.0,,COMPLETE
4025,0.5382213631826002,2024-04-11 16:57:42.741665,2024-04-11 16:57:43.772615,0 days 00:00:01.030950,95.36651715389131,7.9503070045034825,sigmoid,9,,23.0,33.0,,,,,,,,,,,,94.0,COMPLETE
4026,0.48335410361402875,2024-04-11 16:57:43.778212,2024-04-11 16:57:45.338601,0 days 00:00:01.560389,96.52208533843982,8.173791236660973,sigmoid,31,,24.0,29.0,6.0,7.0,55.0,24.0,24.0,8.223285994711144,2.199086884031505,5.9559635176378105,12.0,49.0,92.0,45.0,COMPLETE
4027,0.5986580986580987,2024-04-11 16:57:45.338601,2024-04-11 16:57:46.260598,0 days 00:00:00.921997,97.97916710512243,7.462634071698347,sigmoid,8,,25.0,31.0,,,,,,,,,,,,,COMPLETE
4028,0.09408571098532978,2024-04-11 16:57:46.269719,2024-04-11 16:57:48.179923,0 days 00:00:01.910204,90.93555364071678,5.336755384233829,rbf,63,34.0,27.0,30.0,3.0,6.0,92.0,30.0,48.0,7.7971667345523885,2.896071678515364,2.1127095083809286,5.0,20.0,83.0,27.0,COMPLETE
4029,0.35678357803153893,2024-04-11 16:57:48.188671,2024-04-11 16:57:49.760950,0 days 00:00:01.572279,94.16201211848053,7.760034427101279,sigmoid,38,12.0,,,,,,20.0,35.0,1.3760024996494264,6.240906167290039,1.3545670307441156,17.0,36.0,67.0,,COMPLETE
4030,0.4392867179316864,2024-04-11 16:57:49.768842,2024-04-11 16:57:51.244662,0 days 00:00:01.475820,98.04719402610299,7.984753917017066,sigmoid,15,,45.0,34.0,,,,6.0,4.0,2.1984872016769703,7.20119099705868,6.678264963704388,19.0,24.0,70.0,80.0,COMPLETE
4031,0.5963643249384587,2024-04-11 16:57:51.252738,2024-04-11 16:57:52.216662,0 days 00:00:00.963924,99.98845156673686,8.367391173981105,sigmoid,8,,25.0,32.0,,,,,,,,,,,,,COMPLETE
4032,0.6009432182607054,2024-04-11 16:57:52.216662,2024-04-11 16:57:53.128823,0 days 00:00:00.912161,96.5623517015577,8.100678293755196,sigmoid,8,,29.0,31.0,,,,,,,,,,,,,COMPLETE
4033,0.3987675213129411,2024-04-11 16:57:53.137297,2024-04-11 16:57:54.113881,0 days 00:00:00.976584,98.075359382062,7.820277229129125,sigmoid,16,,,,1.0,8.0,63.0,,,,,,,,,,COMPLETE
4034,0.5135302672674821,2024-04-11 16:57:54.123297,2024-04-11 16:57:55.274243,0 days 00:00:01.150946,95.11233397053736,8.286804662282737,sigmoid,2,,,,,,,,,6.828826819414129,8.553658215714238,8.275880234489255,15.0,31.0,72.0,,COMPLETE
4035,0.12622036262203626,2024-04-11 16:57:55.274243,2024-04-11 16:57:55.950586,0 days 00:00:00.676343,98.38991370807503,8.482387266178876,sigmoid,8,,26.0,29.0,,,,,,,,,,,,,COMPLETE
4036,0.3756827616342582,2024-04-11 16:57:55.959273,2024-04-11 16:57:57.047852,0 days 00:00:01.088579,92.25880075131474,7.589111089086062,sigmoid,41,22.0,22.0,27.0,,,,,,,,,,,,88.0,COMPLETE
4037,0.38495517309076627,2024-04-11 16:57:57.047852,2024-04-11 16:57:58.545649,0 days 00:00:01.497797,98.17610588713417,7.9730359704524805,sigmoid,46,43.0,24.0,30.0,,,,33.0,37.0,3.6951063335966854,4.739518323996575,2.944661018509249,9.0,28.0,89.0,,COMPLETE
4038,0.352063972336287,2024-04-11 16:57:58.545649,2024-04-11 16:57:59.977559,0 days 00:00:01.431910,96.2840620329601,8.179500803353028,sigmoid,14,,27.0,32.0,,,,45.0,5.0,4.2320740693610475,1.722134096673472,5.126898712812339,13.0,37.0,87.0,,COMPLETE
4039,0.3580145549542825,2024-04-11 16:57:59.977559,2024-04-11 16:58:01.262447,0 days 00:00:01.284888,99.94339197016687,8.6568795168742,sigmoid,57,23.0,25.0,33.0,2.0,1.0,8.0,,,,,,,,,168.0,COMPLETE
4040,0.4502230100640439,2024-04-11 16:58:01.270907,2024-04-11 16:58:03.971116,0 days 00:00:02.700209,94.05900903182456,7.94940010588129,sigmoid,62,16.0,23.0,30.0,8.0,4.0,73.0,22.0,25.0,8.82873025811122,5.146786747425206,9.38012623262609,8.0,25.0,68.0,,COMPLETE
4041,0.5909107772212947,2024-04-11 16:58:03.971116,2024-04-11 16:58:05.189670,0 days 00:00:01.218554,99.94930148076875,7.7146790405908146,sigmoid,8,,28.0,42.0,,,,,,,,,,,,,COMPLETE
4042,0.3061613762326352,2024-04-11 16:58:05.197603,2024-04-11 16:58:06.751639,0 days 00:00:01.554036,96.41780516557294,8.337200582436205,sigmoid,10,,26.0,31.0,,,,,,8.505632870158966,6.760697886113203,7.2935520844712105,14.0,30.0,58.0,,COMPLETE
4043,0.3611509784016522,2024-04-11 16:58:06.759667,2024-04-11 16:58:08.437908,0 days 00:00:01.678241,96.86136868339482,8.129137148695731,sigmoid,37,5.0,,,,,,43.0,9.0,,,,,,,15.0,COMPLETE
4044,0.3473493026284226,2024-04-11 16:58:08.444918,2024-04-11 16:58:10.129817,0 days 00:00:01.684899,99.99095067205276,7.440813021628901,sigmoid,26,,25.0,28.0,7.0,5.0,25.0,,,5.130611213055691,8.881500023876052,8.144475575762549,4.0,26.0,93.0,,COMPLETE
4045,0.48119213637741653,2024-04-11 16:58:10.129817,2024-04-11 16:58:11.265038,0 days 00:00:01.135221,99.94646502829468,7.856677755792424,sigmoid,20,,,,5.0,3.0,50.0,10.0,38.0,,,,,,,,COMPLETE
4046,0.3503524341696797,2024-04-11 16:58:11.265038,2024-04-11 16:58:12.675456,0 days 00:00:01.410418,98.0680062445485,8.467337146114943,sigmoid,11,,20.0,32.0,,,,,,1.1372947811243899,9.479537038795792,7.03681081873594,17.0,50.0,81.0,98.0,COMPLETE
4047,0.459278508101498,2024-04-11 16:58:12.675456,2024-04-11 16:58:14.542719,0 days 00:00:01.867263,95.45113965242474,8.925471059037056,rbf,8,,24.0,31.0,,,,,,,,,,,,,COMPLETE
