number,value,datetime_start,datetime_complete,duration,params_C,params_gamma,params_kernel,params_mask_number,params_rsi_window,params_so_smooth,params_so_window,params_srsi_smooth1,params_srsi_smooth2,params_srsi_window,params_tsi_window_fast,params_tsi_window_slow,params_ult_weight_1,params_ult_weight_2,params_ult_weight_3,params_ult_window_1,params_ult_window_2,params_ult_window_3,params_williams_lbp,state
5897,0.4570947545641079,2024-04-11 17:33:40.810395,2024-04-11 17:33:42.648863,0 days 00:00:01.838468,98.21096785105624,7.938695829202905,sigmoid,23,,,,4.0,3.0,84.0,7.0,34.0,7.7257134460810075,7.014703524071959,6.282885995251313,14.0,36.0,55.0,167.0,COMPLETE
5898,0.31722764389563834,2024-04-11 17:33:42.651864,2024-04-11 17:33:44.410680,0 days 00:00:01.758816,96.76677319875657,8.317961551864606,rbf,52,21.0,,,8.0,3.0,21.0,28.0,37.0,,,,,,,,COMPLETE
5899,0.5334591408337221,2024-04-11 17:33:44.412671,2024-04-11 17:33:45.818280,0 days 00:00:01.405609,95.44445101744593,7.730103222169196,sigmoid,20,,,,4.0,5.0,45.0,35.0,22.0,,,,,,,,COMPLETE
5900,0.4221661224377795,2024-04-11 17:33:45.820273,2024-04-11 17:33:47.745330,0 days 00:00:01.925057,98.2866797578008,7.3759774869782175,sigmoid,54,30.0,,,6.0,8.0,4.0,25.0,26.0,3.1324311916416296,2.9837805574912726,9.796653813483692,2.0,43.0,71.0,,COMPLETE
5901,0.5366448023069269,2024-04-11 17:33:47.748373,2024-04-11 17:33:49.229810,0 days 00:00:01.481437,80.16215924192963,8.112516279551457,sigmoid,44,44.0,28.0,33.0,,,,30.0,43.0,,,,,,,,COMPLETE
5902,0.2630920176040699,2024-04-11 17:33:49.232075,2024-04-11 17:33:50.326755,0 days 00:00:01.094680,99.98846781041561,8.464022963663112,sigmoid,1,,,,,,,,,,,,,,,52.0,COMPLETE
5903,0.5277525407255594,2024-04-11 17:33:50.328342,2024-04-11 17:33:51.714329,0 days 00:00:01.385987,92.7924875203064,7.888943111735009,sigmoid,12,,24.0,31.0,,,,5.0,41.0,,,,,,,,COMPLETE
5904,0.5050575514475062,2024-04-11 17:33:51.716332,2024-04-11 17:33:53.408993,0 days 00:00:01.692661,99.9534938610156,8.134541740472722,sigmoid,60,36.0,26.0,29.0,2.0,4.0,56.0,14.0,36.0,,,,,,,,COMPLETE
5905,0.5253708879810793,2024-04-11 17:33:53.410991,2024-04-11 17:33:54.747311,0 days 00:00:01.336320,96.40795635991309,6.003084145638948,sigmoid,36,19.0,,,,,,17.0,12.0,,,,,,,,COMPLETE
5906,0.5069140556625241,2024-04-11 17:33:54.750323,2024-04-11 17:33:55.984303,0 days 00:00:01.233980,99.95993245825814,7.626317787278052,sigmoid,8,,25.0,35.0,,,,,,,,,,,,,COMPLETE
5907,0.6009432182607054,2024-04-11 17:33:55.988880,2024-04-11 17:33:57.264259,0 days 00:00:01.275379,86.46749430739415,7.929189157513704,sigmoid,8,,27.0,31.0,,,,,,,,,,,,,COMPLETE
5908,0.5043953056323349,2024-04-11 17:33:57.266849,2024-04-11 17:33:59.094651,0 days 00:00:01.827802,94.1780662005683,8.361900520098102,sigmoid,61,26.0,23.0,32.0,5.0,1.0,30.0,38.0,46.0,,,,,,,131.0,COMPLETE
5909,0.4443824456658204,2024-04-11 17:33:59.097721,2024-04-11 17:34:00.698068,0 days 00:00:01.600347,96.70839998273651,8.17104410481255,sigmoid,7,,,,,,,22.0,50.0,3.417367316196127,1.3263402145844143,6.609359943589369,9.0,29.0,83.0,13.0,COMPLETE
5910,0.45345352376492626,2024-04-11 17:34:00.700646,2024-04-11 17:34:01.969422,0 days 00:00:01.268776,97.01579116030682,8.59610307382611,sigmoid,8,,25.0,30.0,,,,,,,,,,,,,COMPLETE
5911,0.5511721876281012,2024-04-11 17:34:01.972448,2024-04-11 17:34:03.230022,0 days 00:00:01.257574,98.09303885947173,7.786205064990214,sigmoid,40,47.0,24.0,32.0,,,,,,,,,,,,,COMPLETE
5912,0.6009432182607054,2024-04-11 17:34:03.232014,2024-04-11 17:34:04.433044,0 days 00:00:01.201030,94.98462766977174,8.015141398958958,sigmoid,8,,26.0,31.0,,,,,,,,,,,,,COMPLETE
5913,0.38553669949018776,2024-04-11 17:34:04.435051,2024-04-11 17:34:05.719856,0 days 00:00:01.284805,98.33013507187617,7.586657830873149,sigmoid,5,,,,,,,36.0,10.0,,,,,,,118.0,COMPLETE
5914,0.5812078087940157,2024-04-11 17:34:05.721856,2024-04-11 17:34:06.790557,0 days 00:00:01.068701,98.17873674516215,8.3625525441858,sigmoid,32,29.0,,,,,,,,,,,,,,,COMPLETE
5915,0.30189428537389307,2024-04-11 17:34:06.792525,2024-04-11 17:34:08.251876,0 days 00:00:01.459351,90.61756185388094,8.176083535437039,sigmoid,34,6.0,,,,,,,,6.939610780461207,2.6145815327397415,7.515214082021767,4.0,24.0,90.0,,COMPLETE
5916,0.3933633916117942,2024-04-11 17:34:08.254871,2024-04-11 17:34:10.228684,0 days 00:00:01.973813,95.03366407295383,7.927823147860165,rbf,8,,26.0,45.0,,,,,,,,,,,,,COMPLETE
5917,0.4072460841722676,2024-04-11 17:34:10.231216,2024-04-11 17:34:12.319281,0 days 00:00:02.088065,96.76952543744461,7.76109441565191,sigmoid,30,,23.0,29.0,1.0,6.0,23.0,9.0,32.0,4.144648046782773,5.661596951078905,6.86435130678294,11.0,27.0,56.0,,COMPLETE
5918,0.5121176279598321,2024-04-11 17:34:12.321833,2024-04-11 17:34:14.056808,0 days 00:00:01.734975,96.65974212969209,8.750520167570222,sigmoid,51,3.0,,,7.0,2.0,61.0,,,8.283654905333243,5.2503140321834705,9.46263923350997,5.0,39.0,84.0,97.0,COMPLETE
5919,0.5929369437606513,2024-04-11 17:34:14.059373,2024-04-11 17:34:15.276015,0 days 00:00:01.216642,98.26324793363514,7.345056701852281,sigmoid,8,,28.0,33.0,,,,,,,,,,,,,COMPLETE
5920,0.5963643249384587,2024-04-11 17:34:15.278550,2024-04-11 17:34:16.493307,0 days 00:00:01.214757,99.9815258084375,8.430230993922873,sigmoid,8,,24.0,32.0,,,,,,,,,,,,,COMPLETE
5921,0.5674632001529344,2024-04-11 17:34:16.495825,2024-04-11 17:34:17.651861,0 days 00:00:01.156036,93.29014416794433,8.156266882942305,sigmoid,4,,,,,,,19.0,15.0,,,,,,,,COMPLETE
5922,0.44701971028259324,2024-04-11 17:34:17.655377,2024-04-11 17:34:18.902607,0 days 00:00:01.247230,95.40813328005041,8.02595430264208,sigmoid,8,,25.0,30.0,,,,,,,,,,,,,COMPLETE
5923,0.46305094656823326,2024-04-11 17:34:18.904633,2024-04-11 17:34:20.478845,0 days 00:00:01.574212,74.79816698565237,8.272977240649094,sigmoid,45,35.0,27.0,31.0,,,,32.0,23.0,,,,,,,84.0,COMPLETE
5924,0.5143669087464479,2024-04-11 17:34:20.481241,2024-04-11 17:34:21.944351,0 days 00:00:01.463110,98.14608453099595,7.629574831951951,sigmoid,49,7.0,,,3.0,7.0,17.0,,,,,,,,,112.0,COMPLETE
5925,0.3949682305371927,2024-04-11 17:34:21.946356,2024-04-11 17:34:23.756258,0 days 00:00:01.809902,99.994325616116,7.928764415190232,sigmoid,27,,22.0,34.0,8.0,4.0,12.0,,,3.7153841359589386,9.99313757693733,4.701543684036912,20.0,49.0,88.0,66.0,COMPLETE
5926,0.39695836629035736,2024-04-11 17:34:23.759236,2024-04-11 17:34:24.839098,0 days 00:00:01.079862,98.25887250793612,8.50926528114191,sigmoid,17,,,,5.0,8.0,92.0,,,,,,,,,93.0,COMPLETE
5927,0.44139527704892734,2024-04-11 17:34:24.841103,2024-04-11 17:34:26.231907,0 days 00:00:01.390804,99.99236848962849,8.170763373726295,sigmoid,29,,25.0,30.0,3.0,6.0,27.0,44.0,5.0,,,,,,,151.0,COMPLETE
5928,0.40017546938059306,2024-04-11 17:34:26.233906,2024-04-11 17:34:27.576110,0 days 00:00:01.342204,95.35662778161209,7.850311146019485,sigmoid,18,,,,4.0,3.0,77.0,,,2.6780099128987818,5.828853259908698,6.067742913346538,14.0,44.0,78.0,,COMPLETE
5929,0.46270383725310804,2024-04-11 17:34:27.578115,2024-04-11 17:34:29.154735,0 days 00:00:01.576620,99.93439386661943,6.716634502501212,sigmoid,58,14.0,38.0,32.0,6.0,2.0,48.0,,,1.7090912828351854,1.6755903833937422,1.457245892133531,18.0,34.0,67.0,,COMPLETE
5930,0.4846392333709132,2024-04-11 17:34:29.157703,2024-04-11 17:34:30.571738,0 days 00:00:01.414035,99.99038667193733,7.520683238042389,sigmoid,19,,,,1.0,5.0,72.0,,,8.870315586382905,2.137844511488304,3.0492916371964465,7.0,26.0,70.0,77.0,COMPLETE
5931,0.5986580986580987,2024-04-11 17:34:30.574736,2024-04-11 17:34:31.558891,0 days 00:00:00.984155,88.36238793717965,8.331624930902743,sigmoid,8,,26.0,31.0,,,,,,,,,,,,,COMPLETE
5932,0.4502052644288819,2024-04-11 17:34:31.560898,2024-04-11 17:34:32.560764,0 days 00:00:00.999866,96.81557772778164,8.90142264074264,sigmoid,8,,27.0,28.0,,,,,,,,,,,,,COMPLETE
5933,0.4598183967603189,2024-04-11 17:34:32.562763,2024-04-11 17:34:33.873954,0 days 00:00:01.311191,93.44329769497742,8.103698940730366,sigmoid,53,20.0,,,7.0,7.0,68.0,15.0,16.0,,,,,,,122.0,COMPLETE
5934,0.4981651376146789,2024-04-11 17:34:33.875924,2024-04-11 17:34:35.321955,0 days 00:00:01.446031,96.6422710670801,7.739481203566157,sigmoid,39,12.0,,,,,,34.0,48.0,4.97447989161031,6.812773021636103,0.9662640400867293,6.0,22.0,100.0,26.0,COMPLETE
5935,0.07490835993851246,2024-04-11 17:34:35.323993,2024-04-11 17:34:37.117677,0 days 00:00:01.793684,98.1645562285764,8.021880024978639,rbf,47,43.0,24.0,33.0,,,,4.0,30.0,5.619721865459835,4.331439494888704,0.5047685392255046,19.0,33.0,59.0,193.0,COMPLETE
5936,0.36222564876480423,2024-04-11 17:34:37.120784,2024-04-11 17:34:38.527323,0 days 00:00:01.406539,99.95236305496518,8.536115698095223,sigmoid,50,27.0,,,2.0,1.0,34.0,,,6.032289346105905,7.793830855257266,5.298494985923575,15.0,23.0,92.0,,COMPLETE
5937,0.12622036262203626,2024-04-11 17:34:38.530324,2024-04-11 17:34:39.519644,0 days 00:00:00.989320,27.464137136952594,8.27477595431444,sigmoid,8,,25.0,29.0,,,,,,,,,,,,,COMPLETE
5938,0.44701971028259324,2024-04-11 17:34:39.522179,2024-04-11 17:34:40.537505,0 days 00:00:01.015326,96.69796032235843,7.89891125983677,sigmoid,8,,28.0,30.0,,,,,,,,,,,,,COMPLETE
5939,0.4625444706118154,2024-04-11 17:34:40.539505,2024-04-11 17:34:41.874133,0 days 00:00:01.334628,94.2524581357756,7.21031917720011,sigmoid,25,,23.0,31.0,5.0,4.0,58.0,,,,,,,,,176.0,COMPLETE
5940,0.19689731826136309,2024-04-11 17:34:41.876115,2024-04-11 17:34:43.141631,0 days 00:00:01.265516,98.0488845007609,8.050504494872806,sigmoid,6,,,,,,,29.0,45.0,3.9087728189642923,8.978460100354102,7.889788608445967,12.0,47.0,85.0,,COMPLETE
5941,0.5416594901825696,2024-04-11 17:34:43.143624,2024-04-11 17:34:44.193238,0 days 00:00:01.049614,99.9697902574388,7.735920646165238,sigmoid,33,17.0,,,,,,,,,,,,,,49.0,COMPLETE
5942,0.5007712459907451,2024-04-11 17:34:44.195245,2024-04-11 17:34:45.378864,0 days 00:00:01.183619,91.73391611361824,8.320894921441475,sigmoid,24,,26.0,32.0,4.0,3.0,43.0,,,,,,,,,,COMPLETE
5943,0.4786384919575924,2024-04-11 17:34:45.380810,2024-04-11 17:34:46.823516,0 days 00:00:01.442706,96.62891848041066,7.466182478668396,sigmoid,22,,,,6.0,2.0,54.0,7.0,21.0,7.8564879236461795,3.78169239516943,4.181765264453111,10.0,31.0,75.0,,COMPLETE
5944,0.48546972665360577,2024-04-11 17:34:46.826516,2024-04-11 17:34:48.271724,0 days 00:00:01.445208,98.22641143301396,8.602314227255922,sigmoid,43,10.0,24.0,30.0,,,,,,2.0635169431853124,3.345896164849708,2.5414794106785306,9.0,25.0,73.0,147.0,COMPLETE
5945,0.37258390900844324,2024-04-11 17:34:48.272729,2024-04-11 17:34:49.589546,0 days 00:00:01.316817,99.95510919135765,8.175706985086956,sigmoid,38,50.0,,,,,,50.0,9.0,4.695078448677444,8.218786207017109,6.968349306441538,5.0,50.0,95.0,,COMPLETE
5946,0.5906279643331437,2024-04-11 17:34:49.591546,2024-04-11 17:34:50.578808,0 days 00:00:00.987262,94.8732794465242,7.937958330970711,sigmoid,8,,26.0,34.0,,,,,,,,,,,,,COMPLETE
5947,0.3912991974412889,2024-04-11 17:34:50.581344,2024-04-11 17:34:52.307287,0 days 00:00:01.725943,99.9875994814297,8.384727631397185,sigmoid,31,,30.0,33.0,8.0,5.0,6.0,26.0,28.0,7.114784319317451,8.462872000852961,8.545425430518094,3.0,42.0,50.0,42.0,COMPLETE
5948,0.12622036262203626,2024-04-11 17:34:52.308823,2024-04-11 17:34:53.306956,0 days 00:00:00.998133,99.97582271691672,7.774318785933807,sigmoid,8,,28.0,29.0,,,,,,,,,,,,,COMPLETE
5949,0.34159146278694713,2024-04-11 17:34:53.309960,2024-04-11 17:34:54.571321,0 days 00:00:01.261361,96.6057101767324,8.051269119268712,sigmoid,35,22.0,,,,,,,,2.4596379003772215,6.471407432359432,3.6150471748582946,16.0,30.0,82.0,37.0,COMPLETE
5950,0.3655439172999247,2024-04-11 17:34:54.573848,2024-04-11 17:34:56.110947,0 days 00:00:01.537099,95.16033358475308,7.603318156884766,sigmoid,15,,25.0,32.0,,,,41.0,47.0,2.8541986949991824,4.707766790449589,3.281877994365363,17.0,29.0,69.0,162.0,COMPLETE
5951,0.41662987954846437,2024-04-11 17:34:56.114922,2024-04-11 17:34:57.430301,0 days 00:00:01.315379,98.07823048337168,8.72469769826855,sigmoid,57,41.0,27.0,31.0,1.0,8.0,38.0,,,,,,,,,184.0,COMPLETE
5952,0.5439041523571653,2024-04-11 17:34:57.433296,2024-04-11 17:34:58.471557,0 days 00:00:01.038261,99.97147859359221,8.213164018442855,sigmoid,8,,23.0,50.0,,,,,,,,,,,,,COMPLETE
5953,0.5091598084344632,2024-04-11 17:34:58.474066,2024-04-11 17:34:59.708559,0 days 00:00:01.234493,96.93325345748923,7.975927409640715,sigmoid,21,,,,2.0,6.0,25.0,11.0,19.0,,,,,,,189.0,COMPLETE
5954,0.476743489973062,2024-04-11 17:34:59.710579,2024-04-11 17:35:01.562975,0 days 00:00:01.852396,93.06976313388789,8.42141495129228,rbf,8,,24.0,31.0,,,,,,,,,,,,,COMPLETE
5955,0.44701971028259324,2024-04-11 17:35:01.565969,2024-04-11 17:35:02.744099,0 days 00:00:01.178130,99.96745176497997,7.8245148064884225,sigmoid,8,,26.0,30.0,,,,,,,,,,,,,COMPLETE
5956,0.5200833687448148,2024-04-11 17:35:02.746089,2024-04-11 17:35:04.023358,0 days 00:00:01.277269,96.62843731187309,8.156114315350452,sigmoid,9,,20.0,28.0,,,,,,,,,,,,127.0,COMPLETE
5957,0.47583227049116317,2024-04-11 17:35:04.026373,2024-04-11 17:35:05.640082,0 days 00:00:01.613709,36.132783932622836,7.9626529252024945,sigmoid,28,,29.0,32.0,3.0,7.0,64.0,23.0,38.0,,,,,,,,COMPLETE
5958,0.30653118327074586,2024-04-11 17:35:05.643083,2024-04-11 17:35:07.291905,0 days 00:00:01.648822,98.28121445763968,7.521410357580279,sigmoid,42,33.0,25.0,31.0,,,,,,6.351006488734208,1.9509776204014537,8.905949399283816,8.0,40.0,87.0,,COMPLETE
5959,0.33931609095643117,2024-04-11 17:35:07.294120,2024-04-11 17:35:09.114798,0 days 00:00:01.820678,95.25588218848976,8.442573089723906,sigmoid,14,,25.0,33.0,,,,3.0,4.0,0.5035111305761548,3.5624786727580653,3.9312724206000795,4.0,37.0,60.0,,COMPLETE
5960,0.5648941457111619,2024-04-11 17:35:09.116788,2024-04-11 17:35:10.631958,0 days 00:00:01.515170,98.32163458557218,8.228818156976534,sigmoid,2,,,,,,,,,9.694150356000616,7.496062683017062,7.616578397600044,2.0,48.0,64.0,,COMPLETE
5961,0.46618554597847706,2024-04-11 17:35:10.634482,2024-04-11 17:35:12.837148,0 days 00:00:02.202666,96.56326474168164,7.7487877145029005,sigmoid,63,40.0,22.0,29.0,8.0,1.0,86.0,33.0,27.0,9.197181161761623,0.8014553994006439,1.1533671654085564,15.0,38.0,57.0,156.0,COMPLETE
5962,0.393978969928337,2024-04-11 17:35:12.840695,2024-04-11 17:35:14.792123,0 days 00:00:01.951428,98.17591155062246,8.065301971143775,sigmoid,46,18.0,27.0,35.0,,,,46.0,49.0,6.5714867650166795,9.505037438513572,7.211402405253432,12.0,41.0,96.0,,COMPLETE
5963,0.3574589474454157,2024-04-11 17:35:14.794118,2024-04-11 17:35:16.317537,0 days 00:00:01.523419,93.7728747253241,8.61370276756173,sigmoid,3,,,,,,,,,0.9637729684959044,6.240321665274297,9.303379331066651,18.0,28.0,77.0,74.0,COMPLETE
5964,0.5187052916870308,2024-04-11 17:35:16.319537,2024-04-11 17:35:17.562922,0 days 00:00:01.243385,98.2049776367894,8.316563111236416,sigmoid,16,,,,7.0,4.0,82.0,,,,,,,,,,COMPLETE
5965,0.4885290148448043,2024-04-11 17:35:17.565279,2024-04-11 17:35:18.733727,0 days 00:00:01.168448,94.94618471862942,7.837986471985088,sigmoid,8,,24.0,37.0,,,,,,,,,,,,,COMPLETE
5966,0.29706576998518874,2024-04-11 17:35:18.736730,2024-04-11 17:35:20.376908,0 days 00:00:01.640178,98.20280982019717,8.0934089360018,sigmoid,10,,26.0,30.0,,,,,,5.34432696443457,6.6627576431984155,8.290093592458005,20.0,32.0,93.0,,COMPLETE
5967,0.4761311402780085,2024-04-11 17:35:20.379950,2024-04-11 17:35:22.435976,0 days 00:00:02.056026,96.63577583400055,7.305871636187637,sigmoid,62,15.0,24.0,31.0,5.0,2.0,89.0,43.0,24.0,5.750330657547106,2.3839180514715173,2.094624661273594,13.0,20.0,62.0,,COMPLETE
5968,0.5952371952371952,2024-04-11 17:35:22.438976,2024-04-11 17:35:23.675313,0 days 00:00:01.236337,98.17351391813254,7.6502610503703865,sigmoid,8,,21.0,32.0,,,,,,,,,,,,,COMPLETE
5969,0.35755181303780087,2024-04-11 17:35:23.678315,2024-04-11 17:35:25.071974,0 days 00:00:01.393659,91.45299593993774,7.940685188362783,sigmoid,41,39.0,27.0,30.0,,,,,,,,,,,,56.0,COMPLETE
5970,0.47873771575803176,2024-04-11 17:35:25.073969,2024-04-11 17:35:26.739185,0 days 00:00:01.665216,95.36565857506461,2.4084928806503836,sigmoid,11,,25.0,32.0,,,,,,9.498072465984388,5.054252644865612,5.0787236765470105,19.0,37.0,89.0,136.0,COMPLETE
5971,0.5986580986580987,2024-04-11 17:35:26.741176,2024-04-11 17:35:27.945280,0 days 00:00:01.204104,99.99645129522285,8.320146931138666,sigmoid,8,,23.0,31.0,,,,,,,,,,,,,COMPLETE
5972,0.4467756865165073,2024-04-11 17:35:27.947235,2024-04-11 17:35:29.765449,0 days 00:00:01.818214,96.73190180462637,8.206110406906914,rbf,8,,26.0,33.0,,,,,,,,,,,,,COMPLETE
5973,0.12003789673140693,2024-04-11 17:35:29.767947,2024-04-11 17:35:30.969581,0 days 00:00:01.201634,98.20501447274358,7.830523519504238,sigmoid,8,,25.0,28.0,,,,,,,,,,,,,COMPLETE
5974,0.5359156357736767,2024-04-11 17:35:30.971622,2024-04-11 17:35:32.423217,0 days 00:00:01.451595,94.37123573784072,9.240074255283586,sigmoid,48,23.0,,,6.0,3.0,15.0,,,,,,,,,,COMPLETE
5975,0.12622036262203626,2024-04-11 17:35:32.425764,2024-04-11 17:35:33.624812,0 days 00:00:01.199048,98.14436443169885,8.515353218430315,sigmoid,8,,27.0,29.0,,,,,,,,,,,,,COMPLETE
5976,0.5240122615803815,2024-04-11 17:35:33.626811,2024-04-11 17:35:34.961489,0 days 00:00:01.334678,96.65785872719638,8.017243329847425,sigmoid,37,8.0,,,,,,20.0,13.0,,,,,,,141.0,COMPLETE
5977,0.44499424267886595,2024-04-11 17:35:34.963497,2024-04-11 17:35:36.855091,0 days 00:00:01.891594,98.12858390341776,7.556647360875987,sigmoid,26,,28.0,31.0,3.0,8.0,100.0,,,8.085700978268685,7.152608691885769,8.012288999483458,14.0,46.0,72.0,,COMPLETE
5978,0.3734327884462784,2024-04-11 17:35:36.857104,2024-04-11 17:35:38.384186,0 days 00:00:01.527082,92.33121218171681,8.752365375842176,sigmoid,56,24.0,24.0,30.0,4.0,6.0,31.0,,,,,,,,,,COMPLETE
5979,0.46090185676392575,2024-04-11 17:35:38.386186,2024-04-11 17:35:39.888911,0 days 00:00:01.502725,55.34929226792601,8.178749157072678,sigmoid,52,25.0,,,7.0,4.0,51.0,28.0,14.0,,,,,,,,COMPLETE
5980,0.5073185923388353,2024-04-11 17:35:39.892406,2024-04-11 17:35:41.320568,0 days 00:00:01.428162,99.9964384126432,7.0581469567737605,sigmoid,20,,,,2.0,5.0,42.0,24.0,6.0,,,,,,,,COMPLETE
5981,0.4666377373902389,2024-04-11 17:35:41.323554,2024-04-11 17:35:43.388777,0 days 00:00:02.065223,95.7796140755255,8.4098874324425,sigmoid,59,48.0,23.0,32.0,1.0,3.0,75.0,,,1.4155177380161148,4.497381571689145,5.5700549386296725,6.0,43.0,80.0,30.0,COMPLETE
5982,0.5929369437606513,2024-04-11 17:35:43.390775,2024-04-11 17:35:44.608357,0 days 00:00:01.217582,98.2324831778443,7.731547940973985,sigmoid,8,,26.0,33.0,,,,,,,,,,,,,COMPLETE
5983,0.3692159038041728,2024-04-11 17:35:44.611351,2024-04-11 17:35:46.013112,0 days 00:00:01.401761,93.9338490415031,7.964826744055087,sigmoid,12,,13.0,30.0,,,,39.0,40.0,,,,,,,,COMPLETE
5984,0.5986580986580987,2024-04-11 17:35:46.015110,2024-04-11 17:35:47.199471,0 days 00:00:01.184361,99.98553639230653,8.172778949037584,sigmoid,8,,25.0,31.0,,,,,,,,,,,,,COMPLETE
5985,0.4082914189910075,2024-04-11 17:35:47.201468,2024-04-11 17:35:49.267568,0 days 00:00:02.066100,68.21070145607166,7.450714476364419,sigmoid,55,4.0,,,4.0,7.0,10.0,40.0,2.0,4.313992744127607,5.866528596557342,9.08620713994693,11.0,45.0,66.0,19.0,COMPLETE
5986,0.3521271519289359,2024-04-11 17:35:49.270139,2024-04-11 17:35:50.746051,0 days 00:00:01.475912,99.98022820370666,7.871748012482474,sigmoid,13,,22.0,29.0,,,,47.0,32.0,,,,,,,87.0,COMPLETE
5987,0.5521569109186577,2024-04-11 17:35:50.748053,2024-04-11 17:35:52.242537,0 days 00:00:01.494484,96.75491788936473,8.475346427943709,sigmoid,44,37.0,28.0,27.0,,,,45.0,33.0,,,,,,,,COMPLETE
5988,0.5952371952371952,2024-04-11 17:35:52.244541,2024-04-11 17:35:53.406610,0 days 00:00:01.162069,95.32389811961562,8.11449510160388,sigmoid,8,,26.0,32.0,,,,,,,,,,,,,COMPLETE
5989,0.5357901284883846,2024-04-11 17:35:53.409613,2024-04-11 17:35:55.071075,0 days 00:00:01.661462,98.19258530631467,7.66442436395386,sigmoid,7,,,,,,,12.0,35.0,8.703613077968265,2.8380320841343893,5.8523533279352655,10.0,34.0,56.0,107.0,COMPLETE
5990,0.4617587337949706,2024-04-11 17:35:55.074088,2024-04-11 17:35:56.922735,0 days 00:00:01.848647,18.081849540825658,8.346898184338624,sigmoid,54,28.0,,,8.0,1.0,96.0,2.0,29.0,3.565609068811306,1.4332946732222744,0.6950560836617887,16.0,35.0,81.0,,COMPLETE
5991,0.4655948553054663,2024-04-11 17:35:56.925729,2024-04-11 17:35:58.890074,0 days 00:00:01.964345,96.80625851754769,8.006824005777611,rbf,8,,24.0,34.0,,,,,,,,,,,,,COMPLETE
5992,0.4448341684562156,2024-04-11 17:35:58.894120,2024-04-11 17:36:00.180916,0 days 00:00:01.286796,96.82872797582937,8.981918342443384,sigmoid,8,,25.0,30.0,,,,,,,,,,,,,COMPLETE
5993,0.45526955646851686,2024-04-11 17:36:00.182913,2024-04-11 17:36:02.092993,0 days 00:00:01.910080,99.99563452284617,8.61694029759151,sigmoid,23,,,,6.0,7.0,46.0,22.0,25.0,6.796165989151624,9.238581460558738,6.416636761096501,7.0,36.0,98.0,64.0,COMPLETE
5994,0.543565307920237,2024-04-11 17:36:02.094990,2024-04-11 17:36:03.390977,0 days 00:00:01.295987,99.98429049724037,8.268151076159874,sigmoid,36,31.0,,,,,,5.0,43.0,,,,,,,,COMPLETE
5995,0.5421574580044526,2024-04-11 17:36:03.392969,2024-04-11 17:36:04.660027,0 days 00:00:01.267058,93.60495185834911,7.831044505327637,sigmoid,40,34.0,27.0,31.0,,,,,,,,,,,,,COMPLETE
5996,0.5715229842855045,2024-04-11 17:36:04.662004,2024-04-11 17:36:05.745158,0 days 00:00:01.083154,98.08406816157535,8.04921847890937,sigmoid,32,10.0,,,,,,,,,,,,,,,COMPLETE
5997,0.43991937874207127,2024-04-11 17:36:05.747736,2024-04-11 17:36:06.845268,0 days 00:00:01.097532,95.42977084654886,7.656822853260918,sigmoid,1,,,,,,,,,,,,,,,114.0,COMPLETE
5998,0.5963643249384587,2024-04-11 17:36:06.848266,2024-04-11 17:36:08.111488,0 days 00:00:01.263222,99.94605384360325,8.25648623724046,sigmoid,8,,23.0,32.0,,,,,,,,,,,,,COMPLETE
5999,0.49918739226791425,2024-04-11 17:36:08.114019,2024-04-11 17:36:09.891748,0 days 00:00:01.777729,89.59297919630637,7.901933344396259,sigmoid,60,21.0,26.0,34.0,5.0,2.0,22.0,16.0,10.0,,,,,,,,COMPLETE
6000,0.38426199839905334,2024-04-11 17:36:09.893799,2024-04-11 17:36:11.640584,0 days 00:00:01.746785,15.190494784782246,7.367103783929771,sigmoid,61,19.0,29.0,31.0,3.0,6.0,4.0,42.0,7.0,,,,,,,197.0,COMPLETE
