number,value,datetime_start,datetime_complete,duration,params_C,params_gamma,params_kernel,params_mask_number,params_rsi_window,params_so_smooth,params_so_window,params_srsi_smooth1,params_srsi_smooth2,params_srsi_window,params_tsi_window_fast,params_tsi_window_slow,params_ult_weight_1,params_ult_weight_2,params_ult_weight_3,params_ult_window_1,params_ult_window_2,params_ult_window_3,params_williams_lbp,state
4151,0.5963643249384587,2024-04-11 17:00:25.551969,2024-04-11 17:00:26.880636,0 days 00:00:01.328667,99.97622688183561,8.243776391821642,sigmoid,8,,27.0,32.0,,,,,,,,,,,,,COMPLETE
4152,0.5082670620478951,2024-04-11 17:00:26.882624,2024-04-11 17:00:28.333571,0 days 00:00:01.450947,11.845924705352537,8.036483972630887,sigmoid,7,,,,,,,13.0,18.0,8.899504694658546,6.970121137267923,5.305665162511962,16.0,28.0,58.0,171.0,COMPLETE
4153,0.5069140556625241,2024-04-11 17:00:28.336550,2024-04-11 17:00:29.380383,0 days 00:00:01.043833,99.99740652526513,7.505806179359533,sigmoid,8,,24.0,35.0,,,,,,,,,,,,,COMPLETE
4154,0.12622036262203626,2024-04-11 17:00:29.382383,2024-04-11 17:00:30.600784,0 days 00:00:01.218401,96.57257955451554,8.6158548257448,sigmoid,8,,26.0,29.0,,,,,,,,,,,,,COMPLETE
4155,0.5197442884091386,2024-04-11 17:00:30.603779,2024-04-11 17:00:32.018495,0 days 00:00:01.414716,99.96594112563898,7.805702943270675,sigmoid,12,,23.0,30.0,,,,10.0,32.0,,,,,,,,COMPLETE
4156,0.5088301016362718,2024-04-11 17:00:32.020524,2024-04-11 17:00:33.412492,0 days 00:00:01.391968,95.04054144363303,8.382747843433425,sigmoid,27,,28.0,33.0,5.0,1.0,46.0,,,7.289169017520768,1.3382046920544468,2.9949949967025575,7.0,25.0,63.0,130.0,COMPLETE
4157,0.4249950393544546,2024-04-11 17:00:33.416522,2024-04-11 17:00:35.802777,0 days 00:00:02.386255,98.05049121151755,8.107139678990178,sigmoid,23,,,,6.0,5.0,66.0,38.0,42.0,9.792467617945487,2.236227584626904,4.608327330795229,4.0,42.0,55.0,110.0,COMPLETE
4158,0.5593948214831186,2024-04-11 17:00:35.804759,2024-04-11 17:00:36.906495,0 days 00:00:01.101736,98.18756375633384,7.904811888756714,sigmoid,32,4.0,,,,,,,,,,,,,,,COMPLETE
4159,0.3266779469825155,2024-04-11 17:00:36.909482,2024-04-11 17:00:39.214832,0 days 00:00:02.305350,96.60784075390856,8.194571832268768,rbf,1,,,,,,,,,,,,,,,154.0,COMPLETE
4160,0.5544996877926944,2024-04-11 17:00:39.217819,2024-04-11 17:00:40.702062,0 days 00:00:01.484243,94.07087159360685,7.284203533221595,sigmoid,40,50.0,25.0,38.0,,,,,,,,,,,,,COMPLETE
4161,0.5963643249384587,2024-04-11 17:00:40.705655,2024-04-11 17:00:41.574236,0 days 00:00:00.868581,98.03294633876966,8.425005256943106,sigmoid,8,,29.0,32.0,,,,,,,,,,,,,COMPLETE
4162,0.3217716922611392,2024-04-11 17:00:41.576236,2024-04-11 17:00:42.985558,0 days 00:00:01.409322,96.59109957702537,7.71720244607632,sigmoid,51,14.0,,,8.0,6.0,14.0,,,1.2852758694978532,2.8862685990495436,7.6489290664475424,11.0,44.0,57.0,134.0,COMPLETE
4163,0.537061143229067,2024-04-11 17:00:42.987555,2024-04-11 17:00:44.142262,0 days 00:00:01.154707,99.97494400390462,8.018496131278877,sigmoid,33,11.0,,,,,,,,,,,,,,118.0,COMPLETE
4164,0.5963245096172158,2024-04-11 17:00:44.144235,2024-04-11 17:00:45.025333,0 days 00:00:00.881098,92.08843734509543,8.349613370451436,sigmoid,8,,26.0,31.0,,,,,,,,,,,,,COMPLETE
4165,0.31457308730540257,2024-04-11 17:00:45.026334,2024-04-11 17:00:46.030547,0 days 00:00:01.004213,95.23321218390441,6.606233166028826,sigmoid,34,32.0,,,,,,,,6.211847119755254,0.5134098040894601,7.135925394597791,2.0,46.0,82.0,,COMPLETE
4166,0.21366060162005945,2024-04-11 17:00:46.032549,2024-04-11 17:00:46.784343,0 days 00:00:00.751794,98.11521766177582,8.7532374832835,sigmoid,4,,,,,,,24.0,31.0,,,,,,,,COMPLETE
4167,0.4723907107126459,2024-04-11 17:00:46.787872,2024-04-11 17:00:47.918600,0 days 00:00:01.130728,98.32352767686626,7.645624683290528,sigmoid,61,44.0,24.0,28.0,3.0,8.0,41.0,29.0,24.0,,,,,,,99.0,COMPLETE
4168,0.4760879961740794,2024-04-11 17:00:47.920589,2024-04-11 17:00:48.779059,0 days 00:00:00.858470,96.69447150357948,7.900941616005152,sigmoid,17,,,,6.0,2.0,57.0,,,,,,,,,39.0,COMPLETE
4169,0.3843994096684784,2024-04-11 17:00:48.781020,2024-04-11 17:00:49.856270,0 days 00:00:01.075250,48.829524626834306,8.209170257068518,sigmoid,45,46.0,25.0,30.0,,,,43.0,38.0,,,,,,,93.0,COMPLETE
4170,0.4305374638953389,2024-04-11 17:00:49.858857,2024-04-11 17:00:51.401389,0 days 00:00:01.542532,95.2899080255866,8.033833635063788,sigmoid,30,,27.0,31.0,2.0,3.0,96.0,35.0,33.0,0.5098955804871252,4.557934597212223,5.576435759930579,16.0,38.0,85.0,,COMPLETE
4171,0.5963643249384587,2024-04-11 17:00:51.405387,2024-04-11 17:00:52.362784,0 days 00:00:00.957397,98.15404245279014,8.598579134797992,sigmoid,8,,22.0,32.0,,,,,,,,,,,,,COMPLETE
4172,0.12622036262203626,2024-04-11 17:00:52.365427,2024-04-11 17:00:53.385540,0 days 00:00:01.020113,98.28991206006249,7.45088846533243,sigmoid,8,,24.0,29.0,,,,,,,,,,,,,COMPLETE
4173,0.3346522205376623,2024-04-11 17:00:53.388541,2024-04-11 17:00:54.440699,0 days 00:00:01.052158,93.33783676646975,8.246267910956977,sigmoid,5,,,,,,,6.0,45.0,,,,,,,71.0,COMPLETE
4174,0.5941143180531975,2024-04-11 17:00:54.442699,2024-04-11 17:00:55.319080,0 days 00:00:00.876381,96.64442565008144,3.8601979091582423,sigmoid,8,,26.0,33.0,,,,,,,,,,,,,COMPLETE
4175,0.4860626242010849,2024-04-11 17:00:55.321642,2024-04-11 17:00:56.475657,0 days 00:00:01.154015,98.31975317070403,7.795988460321593,sigmoid,29,,23.0,31.0,1.0,4.0,2.0,11.0,27.0,,,,,,,53.0,COMPLETE
4176,0.4181700812013726,2024-04-11 17:00:56.477656,2024-04-11 17:00:57.973400,0 days 00:00:01.495744,94.88780125128689,8.06518241399663,sigmoid,19,,,,7.0,1.0,100.0,,,8.15615604569605,9.681388510902309,9.193814215050867,6.0,45.0,92.0,138.0,COMPLETE
4177,0.2591744057603404,2024-04-11 17:00:57.976365,2024-04-11 17:00:59.921104,0 days 00:00:01.944739,98.1740513343796,7.868469597227798,rbf,50,31.0,,,5.0,7.0,7.0,,,2.524811746073614,2.694077150822868,2.0483480399644094,15.0,41.0,70.0,,COMPLETE
4178,0.3779626213761181,2024-04-11 17:00:59.923691,2024-04-11 17:01:01.057251,0 days 00:00:01.133560,98.21737893113941,8.237977738881694,sigmoid,49,34.0,,,4.0,6.0,51.0,,,,,,,,,197.0,COMPLETE
4179,0.4402919062361787,2024-04-11 17:01:01.061258,2024-04-11 17:01:02.481629,0 days 00:00:01.420371,99.99148245556192,8.45558430170599,sigmoid,58,18.0,28.0,32.0,3.0,5.0,75.0,,,5.4039532776946775,5.661076485727995,8.617544076499158,10.0,22.0,67.0,,COMPLETE
4180,0.5389355278938008,2024-04-11 17:01:02.483621,2024-04-11 17:01:03.580701,0 days 00:00:01.097080,96.37270905133997,7.655049743857458,sigmoid,6,,,,,,,42.0,12.0,4.296006326207023,5.463365485697034,6.300842760923026,20.0,47.0,94.0,,COMPLETE
4181,0.4976743120317119,2024-04-11 17:01:03.582659,2024-04-11 17:01:04.707117,0 days 00:00:01.124458,90.71425498904777,8.005913744086127,sigmoid,53,42.0,,,3.0,2.0,22.0,31.0,3.0,,,,,,,82.0,COMPLETE
4182,0.4148331499816649,2024-04-11 17:01:04.709660,2024-04-11 17:01:05.954092,0 days 00:00:01.244432,95.2177305349058,8.41344546856657,sigmoid,43,22.0,25.0,30.0,,,,,,9.233178635658117,8.381254628282166,2.7171019808548564,5.0,32.0,68.0,17.0,COMPLETE
4183,0.5895095625828441,2024-04-11 17:01:05.956090,2024-04-11 17:01:06.759647,0 days 00:00:00.803557,96.77527778777686,8.157835365714874,sigmoid,8,,26.0,34.0,,,,,,,,,,,,,COMPLETE
4184,0.6009432182607054,2024-04-11 17:01:06.762211,2024-04-11 17:01:07.546776,0 days 00:00:00.784565,99.94476595707495,7.865055483882891,sigmoid,8,,24.0,31.0,,,,,,,,,,,,,COMPLETE
4185,0.12003789673140693,2024-04-11 17:01:07.548781,2024-04-11 17:01:08.368869,0 days 00:00:00.820088,93.7546212913725,7.5639675154434585,sigmoid,8,,27.0,28.0,,,,,,,,,,,,,COMPLETE
4186,0.4154674671139754,2024-04-11 17:01:08.370880,2024-04-11 17:01:09.616091,0 days 00:00:01.245211,98.3174524149204,8.554649016927492,sigmoid,47,41.0,25.0,30.0,,,,18.0,25.0,5.727264456288209,7.73278822686072,4.230131490841284,18.0,40.0,91.0,28.0,COMPLETE
4187,0.3000038546043248,2024-04-11 17:01:09.619100,2024-04-11 17:01:10.704238,0 days 00:00:01.085138,60.688756561104356,8.137488974283738,sigmoid,38,5.0,,,,,,27.0,29.0,4.949856737711601,1.733733631530006,8.107160704858607,9.0,31.0,73.0,,COMPLETE
4188,0.4964936551855738,2024-04-11 17:01:10.706249,2024-04-11 17:01:11.755396,0 days 00:00:01.049147,96.61054795649186,7.746836641668494,sigmoid,24,,26.0,32.0,8.0,7.0,38.0,,,,,,,,,,COMPLETE
4189,0.49166968489677665,2024-04-11 17:01:11.757404,2024-04-11 17:01:12.774975,0 days 00:00:01.017571,98.33828294641145,8.326743056127432,sigmoid,25,,23.0,33.0,2.0,3.0,61.0,,,,,,,,,146.0,COMPLETE
4190,0.3106518396681804,2024-04-11 17:01:12.777000,2024-04-11 17:01:13.932768,0 days 00:00:01.155768,95.40729730320352,7.905016186368699,sigmoid,22,,,,5.0,4.0,28.0,25.0,21.0,3.9132088674674863,3.7553813012274366,6.683705653814283,13.0,21.0,54.0,,COMPLETE
4191,0.4245315706708601,2024-04-11 17:01:13.935138,2024-04-11 17:01:14.941102,0 days 00:00:01.005964,98.27985265704692,8.861955281101311,sigmoid,21,,,,4.0,8.0,44.0,47.0,7.0,,,,,,,107.0,COMPLETE
4192,0.44701971028259324,2024-04-11 17:01:14.943098,2024-04-11 17:01:15.850033,0 days 00:00:00.906935,99.97754537505001,8.058214940165707,sigmoid,8,,29.0,30.0,,,,,,,,,,,,,COMPLETE
4193,0.43199447288258014,2024-04-11 17:01:15.852033,2024-04-11 17:01:17.439628,0 days 00:00:01.587595,93.14353071640441,7.338196680459851,sigmoid,39,36.0,,,,,,46.0,17.0,0.8347546961415491,4.817010152045015,9.533015156833912,19.0,49.0,78.0,86.0,COMPLETE
4194,0.42410687115817663,2024-04-11 17:01:17.441637,2024-04-11 17:01:18.601483,0 days 00:00:01.159846,96.70336333144401,8.314317203709482,sigmoid,15,,27.0,29.0,,,,21.0,10.0,7.067198115800625,5.120536512956515,5.0515383858075715,17.0,29.0,89.0,74.0,COMPLETE
4195,0.34208039543505125,2024-04-11 17:01:18.603467,2024-04-11 17:01:19.580252,0 days 00:00:00.976785,98.2668947102248,7.706711879712253,sigmoid,35,8.0,,,,,,,,9.600160395879778,3.468496373896004,2.220317473852176,8.0,36.0,95.0,186.0,COMPLETE
4196,0.47110322389825504,2024-04-11 17:01:19.582559,2024-04-11 17:01:21.088971,0 days 00:00:01.506412,95.00257060239132,7.975628349898902,rbf,8,,24.0,31.0,,,,,,,,,,,,,COMPLETE
4197,0.5181077986514567,2024-04-11 17:01:21.090984,2024-04-11 17:01:22.209472,0 days 00:00:01.118488,98.16296048327611,6.897163223844455,sigmoid,3,,,,,,,,,1.0723745216743001,8.005680242567902,0.9466042442177791,4.0,48.0,71.0,96.0,COMPLETE
4198,0.46825237353694676,2024-04-11 17:01:22.211470,2024-04-11 17:01:23.872437,0 days 00:00:01.660967,96.87943126852022,8.61863554958353,sigmoid,57,49.0,25.0,32.0,7.0,5.0,94.0,,,,,,,,,177.0,COMPLETE
4199,0.5251183386776608,2024-04-11 17:01:23.874440,2024-04-11 17:01:25.051448,0 days 00:00:01.177008,96.6941428190015,8.170721946230318,sigmoid,18,,,,6.0,1.0,32.0,,,3.6449699940874973,1.9694703810897627,3.258716022748101,12.0,37.0,81.0,,COMPLETE
4200,0.5986580986580987,2024-04-11 17:01:25.053435,2024-04-11 17:01:25.922751,0 days 00:00:00.869316,98.25407930942376,7.5178528527122825,sigmoid,8,,26.0,31.0,,,,,,,,,,,,,COMPLETE
4201,0.44873925905057044,2024-04-11 17:01:25.924747,2024-04-11 17:01:27.366292,0 days 00:00:01.441545,93.74956652598597,7.903838428920581,sigmoid,31,,28.0,30.0,8.0,4.0,74.0,8.0,43.0,5.178074029712037,9.390267461898333,1.6217929815296128,3.0,24.0,61.0,159.0,COMPLETE
4202,0.12622036262203626,2024-04-11 17:01:27.369297,2024-04-11 17:01:28.127784,0 days 00:00:00.758487,98.25076720774716,8.452009738604925,sigmoid,8,,22.0,29.0,,,,,,,,,,,,,COMPLETE
4203,0.5895095625828441,2024-04-11 17:01:28.129784,2024-04-11 17:01:28.864761,0 days 00:00:00.734977,95.03444717495952,8.167442999528339,sigmoid,8,,19.0,34.0,,,,,,,,,,,,,COMPLETE
4204,0.4292898985569367,2024-04-11 17:01:28.867900,2024-04-11 17:01:30.251659,0 days 00:00:01.383759,98.27508024517903,7.749209058306747,sigmoid,62,47.0,24.0,33.0,2.0,6.0,85.0,7.0,15.0,1.7971013620326852,4.233983655594443,4.466300471568356,11.0,28.0,69.0,,COMPLETE
4205,0.3570974753385721,2024-04-11 17:01:30.253661,2024-04-11 17:01:31.515686,0 days 00:00:01.262025,92.41421268368909,8.288097874969766,sigmoid,42,15.0,27.0,32.0,,,,,,6.411341480794538,8.690187225688655,8.921050520864865,14.0,25.0,66.0,,COMPLETE
4206,0.6009432182607054,2024-04-11 17:01:31.518286,2024-04-11 17:01:32.575319,0 days 00:00:01.057033,96.52703650315621,7.9961529415924195,sigmoid,8,,25.0,31.0,,,,,,,,,,,,,COMPLETE
4207,0.531330268298474,2024-04-11 17:01:32.577334,2024-04-11 17:01:33.537176,0 days 00:00:00.959842,99.95948374261933,8.096213729260361,sigmoid,9,,26.0,26.0,,,,,,,,,,,,46.0,COMPLETE
4208,0.4448341684562156,2024-04-11 17:01:33.539788,2024-04-11 17:01:34.362761,0 days 00:00:00.822973,95.77319615045407,8.428121329591097,sigmoid,8,,23.0,30.0,,,,,,,,,,,,,COMPLETE
4209,0.5527093787684287,2024-04-11 17:01:34.364843,2024-04-11 17:01:35.359050,0 days 00:00:00.994207,68.89166031298272,7.844281116457308,sigmoid,16,,,,1.0,3.0,81.0,,,,,,,,,,COMPLETE
4210,0.3722512260718241,2024-04-11 17:01:35.361087,2024-04-11 17:01:36.472079,0 days 00:00:01.110992,98.25759929941823,7.583695790729627,sigmoid,28,,24.0,32.0,7.0,8.0,34.0,17.0,26.0,,,,,,,,COMPLETE
4211,0.4950883619151821,2024-04-11 17:01:36.474076,2024-04-11 17:01:38.232596,0 days 00:00:01.758520,98.17048949199898,8.250451833735696,sigmoid,14,,25.0,29.0,,,,50.0,20.0,2.7174025742150825,7.466461080440643,4.784272471442869,12.0,39.0,83.0,,COMPLETE
4212,0.3408662900188324,2024-04-11 17:01:38.235144,2024-04-11 17:01:39.649052,0 days 00:00:01.413908,95.3883966722293,8.664378520887242,sigmoid,10,,21.0,31.0,,,,,,7.945187370226318,6.16769417856234,7.345679083565202,7.0,35.0,97.0,,COMPLETE
4213,0.5279166666666666,2024-04-11 17:01:39.651070,2024-04-11 17:01:40.844257,0 days 00:00:01.193187,99.95754172003699,7.955784444633284,sigmoid,2,,,,,,,,,9.031035584889008,6.427119894444324,6.956942619874997,18.0,20.0,100.0,,COMPLETE
4214,0.5116131294097024,2024-04-11 17:01:40.847231,2024-04-11 17:01:41.741363,0 days 00:00:00.894132,99.95166124943282,9.148483063400349,sigmoid,41,13.0,26.0,33.0,,,,,,,,,,,,116.0,COMPLETE
4215,0.04492987464316743,2024-04-11 17:01:41.744371,2024-04-11 17:01:43.403509,0 days 00:00:01.659138,96.68607414710961,8.107155685644624,rbf,63,20.0,28.0,28.0,4.0,2.0,89.0,28.0,5.0,2.234867141313676,3.0782957396382606,9.374126403060757,6.0,40.0,50.0,63.0,COMPLETE
4216,0.4934619074064725,2024-04-11 17:01:43.406080,2024-04-11 17:01:44.821800,0 days 00:00:01.415720,98.20860725603141,7.683364479860897,sigmoid,26,,27.0,31.0,6.0,7.0,92.0,,,8.564844286805574,9.846791849435995,3.789845594957229,5.0,50.0,59.0,,COMPLETE
4217,0.45345352376492626,2024-04-11 17:01:44.823775,2024-04-11 17:01:45.594496,0 days 00:00:00.770721,93.89598312690428,8.384480572061854,sigmoid,8,,25.0,30.0,,,,,,,,,,,,,COMPLETE
4218,0.37518316000142954,2024-04-11 17:01:45.596496,2024-04-11 17:01:46.870137,0 days 00:00:01.273641,99.97818678882132,7.865656284539356,sigmoid,46,2.0,50.0,32.0,,,,44.0,47.0,3.325316016628726,0.9013534571934141,6.4511142214905774,8.0,30.0,72.0,,COMPLETE
4219,0.4502698896972542,2024-04-11 17:01:46.872146,2024-04-11 17:01:47.676329,0 days 00:00:00.804183,91.61212947212238,7.4177499016033615,sigmoid,8,,24.0,30.0,,,,,,,,,,,,,COMPLETE
4220,0.5906279643331437,2024-04-11 17:01:47.678307,2024-04-11 17:01:48.434522,0 days 00:00:00.756215,96.76424847404941,8.220597288631607,sigmoid,8,,38.0,34.0,,,,,,,,,,,,,COMPLETE
4221,0.3398880385487528,2024-04-11 17:01:48.436536,2024-04-11 17:01:49.248994,0 days 00:00:00.812458,77.95369277711157,7.124558882979613,sigmoid,37,29.0,,,,,,33.0,36.0,,,,,,,57.0,COMPLETE
4222,0.3863095053976306,2024-04-11 17:01:49.251005,2024-04-11 17:01:50.303742,0 days 00:00:01.052737,98.1918173814936,8.550601825068002,sigmoid,56,30.0,23.0,33.0,3.0,1.0,24.0,,,,,,,,,,COMPLETE
4223,0.6009432182607054,2024-04-11 17:01:50.305741,2024-04-11 17:01:51.245683,0 days 00:00:00.939942,94.99917260428127,8.01225669472759,sigmoid,8,,26.0,31.0,,,,,,,,,,,,,COMPLETE
4224,0.4716786311338382,2024-04-11 17:01:51.247226,2024-04-11 17:01:52.290038,0 days 00:00:01.042812,96.68674637773319,7.694555028158144,sigmoid,52,28.0,,,5.0,5.0,71.0,5.0,14.0,,,,,,,,COMPLETE
4225,0.5199173867628905,2024-04-11 17:01:52.292005,2024-04-11 17:01:53.391571,0 days 00:00:01.099566,96.63350424392495,8.303811520919815,sigmoid,11,,25.0,29.0,,,,,,4.58966878451587,2.43735388643712,2.835702224996946,16.0,43.0,74.0,23.0,COMPLETE
4226,0.4289480700299197,2024-04-11 17:01:53.393582,2024-04-11 17:01:54.199502,0 days 00:00:00.805920,98.37416772441088,8.074218833454225,sigmoid,48,24.0,,,1.0,2.0,69.0,,,,,,,,,,COMPLETE
4227,0.39228181406482504,2024-04-11 17:01:54.203499,2024-04-11 17:01:55.685619,0 days 00:00:01.482120,94.43352219572131,7.815105107352111,sigmoid,55,35.0,,,7.0,6.0,53.0,36.0,23.0,4.059892596618793,5.94591940873246,5.176543957974486,2.0,41.0,75.0,173.0,COMPLETE
4228,0.5227727171739613,2024-04-11 17:01:55.687949,2024-04-11 17:01:56.586842,0 days 00:00:00.898893,99.99067407636413,8.434428640998762,sigmoid,20,,,,5.0,3.0,20.0,22.0,16.0,,,,,,,,COMPLETE
4229,0.594268224819143,2024-04-11 17:01:56.589826,2024-04-11 17:01:57.363139,0 days 00:00:00.773313,99.96921470068564,8.162487160393232,sigmoid,8,,31.0,27.0,,,,,,,,,,,,,COMPLETE
4230,0.498352516361995,2024-04-11 17:01:57.365159,2024-04-11 17:01:58.353029,0 days 00:00:00.987870,96.45916311628984,7.947079313207203,sigmoid,44,39.0,27.0,32.0,,,,9.0,29.0,,,,,,,,COMPLETE
4231,0.3411056093415121,2024-04-11 17:01:58.355031,2024-04-11 17:01:59.277594,0 days 00:00:00.922563,98.20116546228866,9.642857451675042,sigmoid,13,,23.0,35.0,,,,41.0,49.0,,,,,,,78.0,COMPLETE
4232,0.5053849222177902,2024-04-11 17:01:59.279595,2024-04-11 17:02:00.660268,0 days 00:00:01.380673,99.98093685080683,7.590724168031164,sigmoid,59,9.0,26.0,31.0,8.0,2.0,4.0,,,6.941687515903918,7.234620584509562,6.039599744056553,10.0,38.0,53.0,123.0,COMPLETE
4233,0.4781747223056139,2024-04-11 17:02:00.662267,2024-04-11 17:02:02.073296,0 days 00:00:01.411029,65.6080779914819,8.78973142425921,rbf,8,,24.0,30.0,,,,,,,,,,,,,COMPLETE
4234,0.12505757715338553,2024-04-11 17:02:02.075303,2024-04-11 17:02:03.187494,0 days 00:00:01.112191,99.9406098831759,3.131428574075141,sigmoid,8,,29.0,33.0,,,,,,,,,,,,,COMPLETE
4235,0.5963643249384587,2024-04-11 17:02:03.190490,2024-04-11 17:02:04.167116,0 days 00:00:00.976626,95.10902401980056,8.298213425898265,sigmoid,8,,43.0,32.0,,,,,,,,,,,,,COMPLETE
4236,0.5952371952371952,2024-04-11 17:02:04.169632,2024-04-11 17:02:04.942567,0 days 00:00:00.772935,98.20028551488483,8.048232362020197,sigmoid,1,,,,,,,,,,,,,,,32.0,COMPLETE
4237,0.12622036262203626,2024-04-11 17:02:04.945566,2024-04-11 17:02:05.772964,0 days 00:00:00.827398,99.95158735368908,7.794232791423911,sigmoid,8,,25.0,29.0,,,,,,,,,,,,,COMPLETE
4238,0.31339631874129553,2024-04-11 17:02:05.775484,2024-04-11 17:02:06.658855,0 days 00:00:00.883371,92.38576357868436,8.55414030313031,sigmoid,12,,22.0,31.0,,,,13.0,38.0,,,,,,,,COMPLETE
4239,0.35753375862180625,2024-04-11 17:02:06.660884,2024-04-11 17:02:07.873051,0 days 00:00:01.212167,96.76128877674448,8.166739136206973,sigmoid,54,17.0,,,2.0,4.0,18.0,12.0,41.0,7.685741047988716,6.834102901611915,1.1482732211202888,20.0,34.0,90.0,,COMPLETE
4240,0.4983687729933594,2024-04-11 17:02:07.876056,2024-04-11 17:02:08.984887,0 days 00:00:01.108831,96.70895325647545,7.385953555363312,sigmoid,7,,,,,,,48.0,34.0,7.384447728333129,8.86124928471335,0.6479358740239665,3.0,27.0,63.0,128.0,COMPLETE
4241,0.4978511260099708,2024-04-11 17:02:08.987180,2024-04-11 17:02:10.125852,0 days 00:00:01.138672,0.47850126721657915,7.9247628779220065,sigmoid,61,26.0,27.0,30.0,3.0,8.0,65.0,40.0,45.0,,,,,,,40.0,COMPLETE
4242,0.37144872699288145,2024-04-11 17:02:10.127848,2024-04-11 17:02:11.411192,0 days 00:00:01.283344,98.11697934508345,8.329464667044396,sigmoid,23,,,,6.0,7.0,12.0,15.0,22.0,2.011615118221053,8.207471969251046,3.529152420310952,17.0,32.0,57.0,50.0,COMPLETE
4243,0.5952371952371952,2024-04-11 17:02:11.413741,2024-04-11 17:02:12.305344,0 days 00:00:00.891603,99.93500068075375,7.6725875431127,sigmoid,8,,24.0,32.0,,,,,,,,,,,,,COMPLETE
4244,0.4847863330357358,2024-04-11 17:02:12.307884,2024-04-11 17:02:13.695617,0 days 00:00:01.387733,94.46673804071699,8.06400975092429,sigmoid,30,,28.0,30.0,4.0,1.0,42.0,29.0,8.0,6.552375459692034,5.315693782278986,4.0560265929280455,7.0,45.0,60.0,,COMPLETE
4245,0.45617474096891625,2024-04-11 17:02:13.697611,2024-04-11 17:02:14.521605,0 days 00:00:00.823994,98.18757609561949,8.460203725105618,sigmoid,40,40.0,26.0,31.0,,,,,,,,,,,,,COMPLETE
4246,0.5091598084344632,2024-04-11 17:02:14.523536,2024-04-11 17:02:16.027541,0 days 00:00:01.504005,99.99199196412714,7.860292735165649,sigmoid,27,,25.0,28.0,1.0,6.0,47.0,,,4.8413281816326315,5.799970356960184,7.982143748669769,9.0,33.0,96.0,189.0,COMPLETE
4247,0.26166873192895496,2024-04-11 17:02:16.029547,2024-04-11 17:02:16.819214,0 days 00:00:00.789667,96.60432975838535,8.227223385672533,sigmoid,36,33.0,,,,,,19.0,13.0,,,,,,,,COMPLETE
4248,0.5975287681569516,2024-04-11 17:02:16.821208,2024-04-11 17:02:17.635517,0 days 00:00:00.814309,99.96687758244835,9.402012288681611,sigmoid,8,,24.0,32.0,,,,,,,,,,,,,COMPLETE
4249,0.29642974123812643,2024-04-11 17:02:17.638505,2024-04-11 17:02:18.551855,0 days 00:00:00.913350,95.1477756602672,8.667416049589969,sigmoid,34,43.0,,,,,,,,1.5183673395120643,1.1253701232885858,9.690382337510922,12.0,44.0,76.0,,COMPLETE
4250,0.4129760720762885,2024-04-11 17:02:18.554476,2024-04-11 17:02:19.606521,0 days 00:00:01.052045,93.33874489555247,7.521615231626466,sigmoid,60,12.0,23.0,33.0,2.0,5.0,30.0,32.0,27.0,,,,,,,,COMPLETE
4251,0.5964811022156022,2024-04-11 17:02:19.608520,2024-04-11 17:02:20.439655,0 days 00:00:00.831135,96.80021248500344,8.011512919275406,sigmoid,8,,26.0,25.0,,,,,,,,,,,,,COMPLETE
4252,0.3041710079655833,2024-04-11 17:02:20.441651,2024-04-11 17:02:21.800593,0 days 00:00:01.358942,98.35811650880535,7.221446610812318,rbf,32,3.0,,,,,,,,,,,,,,,COMPLETE
4253,0.11307063911580972,2024-04-11 17:02:21.803600,2024-04-11 17:02:22.577570,0 days 00:00:00.773970,90.53285147355489,4.464596974861255,sigmoid,8,,27.0,29.0,,,,,,,,,,,,,COMPLETE
