number,value,datetime_start,datetime_complete,duration,params_C,params_gamma,params_kernel,params_mask_number,params_rsi_window,params_so_smooth,params_so_window,params_srsi_smooth1,params_srsi_smooth2,params_srsi_window,params_tsi_window_fast,params_tsi_window_slow,params_ult_weight_1,params_ult_weight_2,params_ult_weight_3,params_ult_window_1,params_ult_window_2,params_ult_window_3,params_williams_lbp,state
9085,0.5250154289240897,2024-04-11 19:18:17.338533,2024-04-11 19:18:19.436840,0 days 00:00:02.098307,95.39658227770849,7.439143701473352,sigmoid,36,20.0,,,,,,15.0,27.0,,,,,,,,COMPLETE
9086,0.5130218618590712,2024-04-11 19:18:19.439832,2024-04-11 19:18:22.361438,0 days 00:00:02.921606,98.19687229712453,7.884335158476266,sigmoid,7,,,,,,,10.0,13.0,4.376919095212113,9.50590207771214,7.485927533380485,10.0,44.0,83.0,33.0,COMPLETE
9087,0.12622036262203626,2024-04-11 19:18:22.365439,2024-04-11 19:18:24.412795,0 days 00:00:02.047356,85.62863573794492,8.49706728127091,sigmoid,8,,22.0,29.0,,,,,,,,,,,,,COMPLETE
9088,0.383881230116649,2024-04-11 19:18:24.415795,2024-04-11 19:18:26.340108,0 days 00:00:01.924313,96.63953076404978,8.193870824283897,sigmoid,1,,,,,,,,,,,,,,,144.0,COMPLETE
9089,0.4575842696629213,2024-04-11 19:18:26.344108,2024-04-11 19:18:29.642297,0 days 00:00:03.298189,98.06247678232579,7.699970396143005,sigmoid,27,,25.0,30.0,5.0,2.0,51.0,,,2.7188686528064094,7.620863273614372,4.084443332593657,3.0,36.0,71.0,71.0,COMPLETE
9090,0.5964036904537752,2024-04-11 19:18:29.647299,2024-04-11 19:18:31.569699,0 days 00:00:01.922400,99.9921038354128,7.074947329333354,sigmoid,8,,4.0,31.0,,,,,,,,,,,,,COMPLETE
9091,0.40960919140047,2024-04-11 19:18:31.574687,2024-04-11 19:18:34.504590,0 days 00:00:02.929903,93.02786714822987,8.787525828611688,sigmoid,61,38.0,24.0,32.0,2.0,4.0,20.0,43.0,10.0,,,,,,,54.0,COMPLETE
9092,0.43962701359613615,2024-04-11 19:18:34.508581,2024-04-11 19:18:37.929284,0 days 00:00:03.420703,95.18483395249596,4.606070214209838,sigmoid,30,,30.0,30.0,4.0,7.0,62.0,40.0,39.0,7.015100698765838,9.185709718664047,0.7086620622435795,17.0,48.0,86.0,,COMPLETE
9093,0.4550733313379228,2024-04-11 19:18:37.934288,2024-04-11 19:18:40.956220,0 days 00:00:03.021932,98.16711936809712,8.084395682921318,rbf,8,,27.0,32.0,,,,,,,,,,,,,COMPLETE
9094,0.5275372957101837,2024-04-11 19:18:40.958220,2024-04-11 19:18:43.152089,0 days 00:00:02.193869,96.76899329032807,8.34199969344127,sigmoid,5,,,,,,,25.0,40.0,,,,,,,129.0,COMPLETE
9095,0.45347172512526845,2024-04-11 19:18:43.155089,2024-04-11 19:18:45.169055,0 days 00:00:02.013966,98.09708622571131,7.879149447249878,sigmoid,8,,24.0,28.0,,,,,,,,,,,,,COMPLETE
9096,0.6009432182607054,2024-04-11 19:18:45.172056,2024-04-11 19:18:47.045943,0 days 00:00:01.873887,99.98845166089427,8.06752857381771,sigmoid,8,,26.0,31.0,,,,,,,,,,,,,COMPLETE
9097,0.5650833173721509,2024-04-11 19:18:47.048947,2024-04-11 19:18:48.889167,0 days 00:00:01.840220,95.50013736340857,7.740096547075655,sigmoid,4,,,,,,,19.0,15.0,,,,,,,,COMPLETE
9098,0.37264523213121514,2024-04-11 19:18:48.892168,2024-04-11 19:18:51.028790,0 days 00:00:02.136622,98.12873796844906,8.292936068400564,sigmoid,33,36.0,,,,,,,,,,,,,,84.0,COMPLETE
9099,0.43912555761354455,2024-04-11 19:18:51.033795,2024-04-11 19:18:54.418970,0 days 00:00:03.385175,93.76165600097652,7.5522201213100395,sigmoid,51,46.0,,,6.0,3.0,100.0,,,8.91878294824729,1.8993389975438824,6.57696530058808,13.0,21.0,100.0,105.0,COMPLETE
9100,0.32326798471506896,2024-04-11 19:18:54.418970,2024-04-11 19:18:56.734128,0 days 00:00:02.315158,96.87789910980482,8.482560923292809,sigmoid,17,,,,7.0,5.0,69.0,,,,,,,,,155.0,COMPLETE
9101,0.4475195405965864,2024-04-11 19:18:56.734128,2024-04-11 19:18:59.655901,0 days 00:00:02.921773,65.68414405183252,7.934738310110766,sigmoid,53,17.0,,,3.0,2.0,93.0,8.0,38.0,,,,,,,26.0,COMPLETE
9102,0.12622036262203626,2024-04-11 19:18:59.659004,2024-04-11 19:19:01.458581,0 days 00:00:01.799577,96.92822870916982,8.186648109771719,sigmoid,8,,25.0,29.0,,,,,,,,,,,,,COMPLETE
9103,0.3961967302825091,2024-04-11 19:19:01.461761,2024-04-11 19:19:03.955015,0 days 00:00:02.493254,98.21417701765544,7.827650379544858,sigmoid,45,33.0,23.0,33.0,,,,23.0,7.0,,,,,,,120.0,COMPLETE
9104,0.48900998259913914,2024-04-11 19:19:03.958122,2024-04-11 19:19:06.671869,0 days 00:00:02.713747,95.08005395500237,8.069022969487415,sigmoid,19,,,,8.0,8.0,74.0,,,6.084579093256108,3.3145793602360616,4.245197934161774,11.0,37.0,69.0,126.0,COMPLETE
9105,0.4717920924950965,2024-04-11 19:19:06.675880,2024-04-11 19:19:08.528113,0 days 00:00:01.852233,99.97963090948286,5.514615537750574,sigmoid,49,40.0,,,5.0,6.0,13.0,,,,,,,,,49.0,COMPLETE
9106,0.26105410639963733,2024-04-11 19:19:08.532264,2024-04-11 19:19:10.497439,0 days 00:00:01.965175,99.99746544365331,7.352347151521228,sigmoid,34,31.0,,,,,,,,9.444755285805249,6.039604216471647,5.920513792326012,12.0,45.0,53.0,,COMPLETE
9107,0.41459243197019213,2024-04-11 19:19:10.500442,2024-04-11 19:19:13.375948,0 days 00:00:02.875506,96.80175475244917,8.538392482298983,sigmoid,58,4.0,26.0,30.0,1.0,4.0,6.0,,,4.973268762678943,8.70150193566446,2.151242076232834,8.0,28.0,77.0,,COMPLETE
9108,0.5354663996540974,2024-04-11 19:19:13.379099,2024-04-11 19:19:15.890464,0 days 00:00:02.511365,91.32278668739589,8.31361120708339,sigmoid,18,,,,4.0,1.0,24.0,,,8.667306953153753,5.648944672544842,6.952642189201122,18.0,20.0,80.0,,COMPLETE
9109,0.5816943051806145,2024-04-11 19:19:15.893538,2024-04-11 19:19:17.750390,0 days 00:00:01.856852,98.31375165581375,7.60246179382172,sigmoid,8,,28.0,3.0,,,,,,,,,,,,,COMPLETE
9110,0.5952371952371952,2024-04-11 19:19:17.753391,2024-04-11 19:19:19.566347,0 days 00:00:01.812956,99.96415072344551,7.9533863113322365,sigmoid,8,,24.0,32.0,,,,,,,,,,,,,COMPLETE
9111,0.5069140556625241,2024-04-11 19:19:19.569462,2024-04-11 19:19:21.410038,0 days 00:00:01.840576,95.12020872748005,8.172457137412048,sigmoid,8,,27.0,35.0,,,,,,,,,,,,,COMPLETE
9112,0.6009432182607054,2024-04-11 19:19:21.413165,2024-04-11 19:19:23.421014,0 days 00:00:02.007849,93.58478773957418,7.796954244215124,sigmoid,8,,25.0,31.0,,,,,,,,,,,,,COMPLETE
9113,0.4897465109655369,2024-04-11 19:19:23.424225,2024-04-11 19:19:26.044210,0 days 00:00:02.619985,96.71600288894118,6.330784834184908,rbf,8,,21.0,30.0,,,,,,,,,,,,,COMPLETE
9114,0.44325190470431736,2024-04-11 19:19:26.047304,2024-04-11 19:19:28.548279,0 days 00:00:02.500975,99.9678887065087,8.658495635842646,sigmoid,50,23.0,,,7.0,6.0,78.0,,,1.6212363662648133,4.061421375724095,3.4843516468202527,6.0,30.0,57.0,,COMPLETE
9115,0.4404930130318731,2024-04-11 19:19:28.551278,2024-04-11 19:19:31.106023,0 days 00:00:02.554745,99.96463688322027,8.420820505835206,sigmoid,29,,40.0,34.0,3.0,5.0,97.0,36.0,25.0,,,,,,,140.0,COMPLETE
9116,0.3722721885240187,2024-04-11 19:19:31.111127,2024-04-11 19:19:33.347861,0 days 00:00:02.236734,98.18832055265722,8.048031995173117,sigmoid,24,,31.0,29.0,6.0,7.0,30.0,,,,,,,,,,COMPLETE
9117,0.34158525754884544,2024-04-11 19:19:33.352048,2024-04-11 19:19:35.697133,0 days 00:00:02.345085,95.20135881829518,8.200086034769212,sigmoid,35,43.0,,,,,,,,2.0565546871222713,2.989248597644507,9.583478567280395,9.0,43.0,74.0,44.0,COMPLETE
9118,0.5662220516265234,2024-04-11 19:19:35.700133,2024-04-11 19:19:38.068536,0 days 00:00:02.368403,82.12357714336585,7.897664003035412,sigmoid,6,,,,,,,28.0,19.0,4.688258103971116,4.7362452003719335,7.8215393942212135,2.0,47.0,61.0,,COMPLETE
9119,0.47356469368613313,2024-04-11 19:19:38.071676,2024-04-11 19:19:40.054839,0 days 00:00:01.983163,98.27084937717197,7.6107460327542995,sigmoid,25,,25.0,32.0,2.0,2.0,88.0,,,,,,,,,148.0,COMPLETE
9120,0.5986580986580987,2024-04-11 19:19:40.059001,2024-04-11 19:19:42.179575,0 days 00:00:02.120574,99.98613481930678,8.325616509388094,sigmoid,8,,23.0,31.0,,,,,,,,,,,,,COMPLETE
9121,0.5928174679180234,2024-04-11 19:19:42.181752,2024-04-11 19:19:43.992922,0 days 00:00:01.811170,99.98741148132913,9.682652774350064,sigmoid,8,,26.0,33.0,,,,,,,,,,,,,COMPLETE
9122,0.4341643108027071,2024-04-11 19:19:43.995938,2024-04-11 19:19:46.313976,0 days 00:00:02.318038,96.70014207886176,8.040570447959297,sigmoid,21,,,,8.0,8.0,8.0,27.0,5.0,,,,,,,110.0,COMPLETE
9123,0.5367982668321309,2024-04-11 19:19:46.317010,2024-04-11 19:19:48.587244,0 days 00:00:02.270234,92.40054278434467,7.781226953752717,sigmoid,3,,,,,,,,,5.8724688592236935,8.092727506201458,1.6861868420958928,3.0,31.0,67.0,78.0,COMPLETE
9124,0.40932642487046633,2024-04-11 19:19:48.590350,2024-04-11 19:19:51.328271,0 days 00:00:02.737921,96.7274265178775,8.877488210903657,sigmoid,22,,,,5.0,1.0,2.0,38.0,49.0,8.384467531707372,6.527556523209245,5.058915878419623,19.0,40.0,96.0,,COMPLETE
9125,0.4935212219192626,2024-04-11 19:19:51.331326,2024-04-11 19:19:54.454504,0 days 00:00:03.123178,99.95759434550793,8.217816394365721,sigmoid,47,12.0,25.0,30.0,,,,50.0,36.0,6.62958853381116,6.799500246052844,6.318613804416566,15.0,24.0,81.0,14.0,COMPLETE
9126,0.40563744831286885,2024-04-11 19:19:54.458485,2024-04-11 19:19:57.249024,0 days 00:00:02.790539,94.82291758049915,7.257015915869888,sigmoid,43,18.0,22.0,32.0,,,,,,1.353801439163632,2.7551203247693112,1.1726213497732347,16.0,42.0,85.0,93.0,COMPLETE
9127,0.45898449018104615,2024-04-11 19:19:57.252285,2024-04-11 19:19:59.979412,0 days 00:00:02.727127,98.18794778078522,8.550834330558244,sigmoid,57,15.0,27.0,31.0,4.0,3.0,53.0,,,,,,,,,177.0,COMPLETE
9128,0.12622036262203626,2024-04-11 19:19:59.983560,2024-04-11 19:20:02.155676,0 days 00:00:02.172116,97.99969017462509,7.96160741357862,sigmoid,8,,24.0,29.0,,,,,,,,,,,,,COMPLETE
9129,0.48130225427017703,2024-04-11 19:20:02.160835,2024-04-11 19:20:04.523923,0 days 00:00:02.363088,95.38374399220224,8.400756476154925,sigmoid,28,,26.0,31.0,1.0,4.0,42.0,22.0,30.0,,,,,,,,COMPLETE
9130,0.5489063830671126,2024-04-11 19:20:04.527028,2024-04-11 19:20:07.035660,0 days 00:00:02.508632,98.21778019176683,7.547927868542293,sigmoid,38,8.0,,,,,,45.0,12.0,9.065657211995605,2.375247379399001,2.3542974968751524,4.0,32.0,79.0,,COMPLETE
9131,0.05356614382953536,2024-04-11 19:20:07.039758,2024-04-11 19:20:10.423209,0 days 00:00:03.383451,96.64517888426427,7.758690381362859,rbf,31,,2.0,33.0,7.0,7.0,85.0,34.0,14.0,2.520358945497836,2.0909606682771837,8.95375637402759,7.0,27.0,55.0,58.0,COMPLETE
9132,0.4068390925165583,2024-04-11 19:20:10.426201,2024-04-11 19:20:13.415232,0 days 00:00:02.989031,99.98433241544808,8.067184689551256,sigmoid,15,,29.0,30.0,,,,12.0,45.0,0.5035462401852531,0.8955707994779898,8.29615212828681,20.0,34.0,52.0,21.0,COMPLETE
9133,0.4820667613636364,2024-04-11 19:20:13.419367,2024-04-11 19:20:16.140841,0 days 00:00:02.721474,54.63204250078939,8.236326317628157,sigmoid,39,26.0,,,,,,31.0,32.0,4.030020187064827,9.712394990817508,0.9017631035436624,5.0,35.0,76.0,31.0,COMPLETE
9134,0.3573244997657766,2024-04-11 19:20:16.144852,2024-04-11 19:20:18.817645,0 days 00:00:02.672793,99.96308539981649,7.913889462232769,sigmoid,42,30.0,23.0,32.0,,,,,,7.4577577213254935,4.430060401722084,9.408637914512962,11.0,39.0,58.0,,COMPLETE
9135,0.45239228755058314,2024-04-11 19:20:18.820781,2024-04-11 19:20:20.671451,0 days 00:00:01.850670,93.93678886780522,7.422066000628036,sigmoid,8,,27.0,28.0,,,,,,,,,,,,,COMPLETE
9136,0.4454803102625299,2024-04-11 19:20:20.674594,2024-04-11 19:20:23.021389,0 days 00:00:02.346795,96.94105309034586,8.110219315094405,sigmoid,16,,,,6.0,5.0,35.0,,,,,,,,,,COMPLETE
9137,0.5963245096172158,2024-04-11 19:20:23.024594,2024-04-11 19:20:24.958351,0 days 00:00:01.933757,98.11467922838297,8.733101830642031,sigmoid,8,,24.0,31.0,,,,,,,,,,,,,COMPLETE
9138,0.12622036262203626,2024-04-11 19:20:24.962590,2024-04-11 19:20:26.902590,0 days 00:00:01.940000,99.96885545951028,8.331271969071743,sigmoid,8,,28.0,29.0,,,,,,,,,,,,,COMPLETE
9139,0.32505660966658856,2024-04-11 19:20:26.905730,2024-04-11 19:20:29.042447,0 days 00:00:02.136717,96.61610822280257,7.718191716109723,sigmoid,9,,25.0,33.0,,,,,,,,,,,,189.0,COMPLETE
9140,0.3998570546765862,2024-04-11 19:20:29.045631,2024-04-11 19:20:32.197955,0 days 00:00:03.152324,93.78687826008832,7.924288713269717,sigmoid,46,11.0,26.0,32.0,,,,9.0,33.0,7.724128660849641,7.094961825283204,5.406508321617817,14.0,25.0,99.0,,COMPLETE
9141,0.39890435111139094,2024-04-11 19:20:32.203148,2024-04-11 19:20:35.689112,0 days 00:00:03.485964,98.21966033872556,8.419522784483782,sigmoid,62,7.0,25.0,30.0,2.0,2.0,10.0,6.0,17.0,3.5517153547902143,7.311396726732408,4.610676402619514,17.0,40.0,87.0,,COMPLETE
9142,0.42184756946546403,2024-04-11 19:20:35.692246,2024-04-11 19:20:39.256311,0 days 00:00:03.564065,95.49654490659707,8.177930416022098,sigmoid,63,28.0,26.0,31.0,8.0,3.0,22.0,14.0,23.0,5.297995504626904,1.4463564758544467,2.9421050505307877,12.0,26.0,71.0,131.0,COMPLETE
9143,0.49759167537601673,2024-04-11 19:20:39.261317,2024-04-11 19:20:41.531849,0 days 00:00:02.270532,99.9822159559869,7.626326189910549,sigmoid,41,21.0,23.0,30.0,,,,,,,,,,,,163.0,COMPLETE
9144,0.27443939031202613,2024-04-11 19:20:41.534844,2024-04-11 19:20:43.599528,0 days 00:00:02.064684,96.97845974286017,8.603905429764014,sigmoid,2,,,,,,,,,5.677646515855801,4.93138907850649,3.9151656201061216,18.0,29.0,88.0,,COMPLETE
9145,0.5636462904171639,2024-04-11 19:20:43.602530,2024-04-11 19:20:44.904770,0 days 00:00:01.302240,96.91902830121094,8.025562739421593,sigmoid,0,,,,,,,,,,,,,,,,COMPLETE
9146,0.5952371952371952,2024-04-11 19:20:44.906770,2024-04-11 19:20:46.640905,0 days 00:00:01.734135,92.15574513550564,7.837270140068762,sigmoid,8,,24.0,32.0,,,,,,,,,,,,,COMPLETE
9147,0.12622036262203626,2024-04-11 19:20:46.644058,2024-04-11 19:20:48.518738,0 days 00:00:01.874680,89.3880136268966,8.299210924836297,sigmoid,8,,27.0,29.0,,,,,,,,,,,,,COMPLETE
9148,0.34048402850631265,2024-04-11 19:20:48.523922,2024-04-11 19:20:51.508764,0 days 00:00:02.984842,98.10342390070208,8.100280508688677,sigmoid,14,,22.0,31.0,,,,46.0,40.0,8.217461437270924,3.5150033373830496,7.315553328797886,13.0,23.0,63.0,,COMPLETE
9149,0.4657497781721384,2024-04-11 19:20:51.511941,2024-04-11 19:20:54.024659,0 days 00:00:02.512718,95.15614412316292,8.466196520855465,rbf,8,,24.0,34.0,,,,,,,,,,,,,COMPLETE
9150,0.5929369437606513,2024-04-11 19:20:54.027658,2024-04-11 19:20:55.990499,0 days 00:00:01.962841,99.97457193520249,7.8924922671950055,sigmoid,8,,28.0,33.0,,,,,,,,,,,,,COMPLETE
9151,0.4812482507696614,2024-04-11 19:20:55.996676,2024-04-11 19:20:58.854544,0 days 00:00:02.857868,98.13632414553085,7.495580709434526,sigmoid,26,,26.0,28.0,2.0,4.0,72.0,,,9.638056658578638,1.2278158202985479,9.779332317751264,8.0,37.0,64.0,,COMPLETE
9152,0.5370919881305638,2024-04-11 19:20:58.857652,2024-04-11 19:21:00.880471,0 days 00:00:02.022819,95.28706916869473,8.176071122439042,sigmoid,20,,,,5.0,8.0,26.0,42.0,28.0,,,,,,,,COMPLETE
9153,0.4991597362864653,2024-04-11 19:21:00.884582,2024-04-11 19:21:02.788129,0 days 00:00:01.903547,98.13532776883885,7.716246122224857,sigmoid,48,42.0,,,3.0,6.0,81.0,,,,,,,,,,COMPLETE
9154,0.5184389545291801,2024-04-11 19:21:02.791130,2024-04-11 19:21:05.166629,0 days 00:00:02.375499,99.95238552259784,6.630725812753955,sigmoid,11,,25.0,30.0,,,,,,1.1027934856247565,7.79653491186637,8.504001053743348,15.0,32.0,50.0,170.0,COMPLETE
9155,0.2984164717610521,2024-04-11 19:21:05.169650,2024-04-11 19:21:07.176768,0 days 00:00:02.007118,96.77153105627956,7.947052683084681,sigmoid,10,,27.0,32.0,,,,,,9.269709706169266,8.532209889633666,5.694777111354389,16.0,46.0,92.0,,COMPLETE
9156,0.43840307358222663,2024-04-11 19:21:07.179890,2024-04-11 19:21:08.934137,0 days 00:00:01.754247,93.52347283604037,8.379593292883966,sigmoid,52,27.0,,,1.0,5.0,61.0,24.0,16.0,,,,,,,,COMPLETE
9157,0.6009432182607054,2024-04-11 19:21:08.937215,2024-04-11 19:21:10.365197,0 days 00:00:01.427982,96.81616830640321,8.164200359203507,sigmoid,8,,24.0,31.0,,,,,,,,,,,,,COMPLETE
9158,0.5975287681569516,2024-04-11 19:21:10.368364,2024-04-11 19:21:12.068173,0 days 00:00:01.699809,98.19588419755559,9.201122467639244,sigmoid,8,,25.0,32.0,,,,,,,,,,,,,COMPLETE
9159,0.3585210182671851,2024-04-11 19:21:12.071318,2024-04-11 19:21:13.986084,0 days 00:00:01.914766,95.33922392877105,7.20999731572147,sigmoid,37,24.0,,,,,,16.0,42.0,,,,,,,97.0,COMPLETE
9160,0.40228103523907,2024-04-11 19:21:13.989188,2024-04-11 19:21:17.030980,0 days 00:00:03.041792,99.95172174180512,8.635338136179575,sigmoid,59,2.0,26.0,30.0,6.0,1.0,58.0,,,3.1412691889363478,3.6776471977457748,2.5746765163433447,14.0,44.0,66.0,151.0,COMPLETE
9161,0.4385188287021805,2024-04-11 19:21:17.033979,2024-04-11 19:21:19.242630,0 days 00:00:02.208651,98.10331793014937,7.74826432542947,sigmoid,56,13.0,23.0,31.0,7.0,7.0,90.0,,,,,,,,,,COMPLETE
9162,0.594268224819143,2024-04-11 19:21:19.245938,2024-04-11 19:21:21.015418,0 days 00:00:01.769480,99.95070568576006,7.980438559037313,sigmoid,8,,28.0,27.0,,,,,,,,,,,,,COMPLETE
9163,0.36793687982359424,2024-04-11 19:21:21.020530,2024-04-11 19:21:23.247459,0 days 00:00:02.226929,99.96739335900752,8.28860459762413,sigmoid,44,16.0,25.0,34.0,,,,49.0,20.0,,,,,,,,COMPLETE
9164,0.12622036262203626,2024-04-11 19:21:23.251638,2024-04-11 19:21:25.346294,0 days 00:00:02.094656,99.97837186068483,8.053785993000215,sigmoid,8,,22.0,29.0,,,,,,,,,,,,,COMPLETE
9165,0.49798396660499983,2024-04-11 19:21:25.351975,2024-04-11 19:21:28.055129,0 days 00:00:02.703154,96.69174447587473,9.405047883717666,sigmoid,60,49.0,24.0,33.0,4.0,3.0,49.0,3.0,35.0,,,,,,,,COMPLETE
9166,0.40363716313838804,2024-04-11 19:21:28.058259,2024-04-11 19:21:31.195309,0 days 00:00:03.137050,19.717827143067268,7.532315888152903,sigmoid,55,5.0,,,3.0,6.0,66.0,2.0,11.0,2.805551494071949,5.3173792570761425,6.7115899937075785,19.0,48.0,82.0,115.0,COMPLETE
9167,0.44701971028259324,2024-04-11 19:21:31.200143,2024-04-11 19:21:33.116207,0 days 00:00:01.916064,99.99007698895919,7.807458507534063,sigmoid,8,,27.0,30.0,,,,,,,,,,,,,COMPLETE
9168,0.4832207598045759,2024-04-11 19:21:33.120391,2024-04-11 19:21:34.705597,0 days 00:00:01.585206,93.62503049473627,8.223709799103082,sigmoid,1,,,,,,,,,,,,,,,137.0,COMPLETE
9169,0.3556972935700742,2024-04-11 19:21:34.708598,2024-04-11 19:21:36.766172,0 days 00:00:02.057574,96.71342634817199,8.449752902027596,sigmoid,13,,20.0,31.0,,,,21.0,41.0,,,,,,,62.0,COMPLETE
9170,0.3440032009602881,2024-04-11 19:21:36.769219,2024-04-11 19:21:39.208419,0 days 00:00:02.439200,95.08967035063716,8.002420465983654,rbf,32,19.0,,,,,,,,,,,,,,,COMPLETE
9171,0.546643088477816,2024-04-11 19:21:39.212490,2024-04-11 19:21:41.043775,0 days 00:00:01.831285,98.17610450663726,8.92311598070456,sigmoid,36,32.0,,,,,,18.0,29.0,,,,,,,,COMPLETE
9172,0.5425425621534783,2024-04-11 19:21:41.046774,2024-04-11 19:21:43.315867,0 days 00:00:02.269093,99.97305437997323,7.660121523550869,sigmoid,12,,26.0,32.0,,,,35.0,50.0,,,,,,,,COMPLETE
9173,0.5986580986580987,2024-04-11 19:21:43.321009,2024-04-11 19:21:45.109755,0 days 00:00:01.788746,98.21675515159167,8.202077854050827,sigmoid,8,,25.0,31.0,,,,,,,,,,,,,COMPLETE
9174,0.5212325277451655,2024-04-11 19:21:45.112876,2024-04-11 19:21:47.687486,0 days 00:00:02.574610,91.62757868806898,5.784050267956042,sigmoid,54,41.0,,,8.0,2.0,15.0,26.0,46.0,6.20916491549276,6.286308051771855,8.073032818361849,11.0,34.0,73.0,,COMPLETE
9175,0.3558863803939468,2024-04-11 19:21:47.690481,2024-04-11 19:21:49.720075,0 days 00:00:02.029594,99.97579562086571,8.632721755769127,sigmoid,7,,,,,,,29.0,2.0,4.5269523816945565,5.908467071986764,3.1225875391350626,6.0,21.0,90.0,37.0,COMPLETE
9176,0.5622527928379865,2024-04-11 19:21:49.723199,2024-04-11 19:21:51.765623,0 days 00:00:02.042424,95.14875159169597,7.898530448294526,sigmoid,40,45.0,29.0,26.0,,,,,,,,,,,,,COMPLETE
9177,0.49909235046761186,2024-04-11 19:21:51.768773,2024-04-11 19:21:54.490540,0 days 00:00:02.721767,99.98129638352123,8.398574589089618,sigmoid,61,47.0,27.0,30.0,5.0,4.0,44.0,11.0,34.0,,,,,,,122.0,COMPLETE
9178,0.44615384615384623,2024-04-11 19:21:54.494657,2024-04-11 19:21:57.537715,0 days 00:00:03.043058,96.65033312608332,8.083718275977974,sigmoid,23,,,,4.0,8.0,76.0,47.0,4.0,6.871942589445066,7.565653681690885,1.9952575004016424,10.0,28.0,65.0,67.0,COMPLETE
9179,0.5134281923411264,2024-04-11 19:21:57.540838,2024-04-11 19:22:00.359850,0 days 00:00:02.819012,99.99055958088408,7.8340466700105225,sigmoid,27,,23.0,29.0,7.0,1.0,47.0,,,3.7370852025276324,1.729753094453872,7.603303830323037,9.0,41.0,93.0,194.0,COMPLETE
9180,0.5929369437606513,2024-04-11 19:22:00.362969,2024-04-11 19:22:02.468549,0 days 00:00:02.105580,96.86974627271833,8.278052465061721,sigmoid,8,,24.0,33.0,,,,,,,,,,,,,COMPLETE
9181,0.41296701207339104,2024-04-11 19:22:02.473654,2024-04-11 19:22:05.869496,0 days 00:00:03.395842,93.92025037946637,7.431320405826638,sigmoid,30,,26.0,32.0,2.0,5.0,70.0,39.0,47.0,6.4868984375870244,9.828072723140544,4.821936578868558,2.0,33.0,97.0,,COMPLETE
9182,0.6009432182607054,2024-04-11 19:22:05.872497,2024-04-11 19:22:07.702136,0 days 00:00:01.829639,99.99652085254085,8.081539806889486,sigmoid,8,,25.0,31.0,,,,,,,,,,,,,COMPLETE
9183,0.5789503926450871,2024-04-11 19:22:07.705193,2024-04-11 19:22:09.509800,0 days 00:00:01.804607,99.97822693558426,8.546114311599016,sigmoid,4,,,,,,,4.0,21.0,,,,,,,,COMPLETE
9184,0.2989445697711892,2024-04-11 19:22:09.512909,2024-04-11 19:22:11.544362,0 days 00:00:02.031453,96.7044808006328,7.64150124328578,sigmoid,33,10.0,,,,,,,,,,,,,,75.0,COMPLETE
9185,0.45347172512526845,2024-04-11 19:22:11.548499,2024-04-11 19:22:13.547473,0 days 00:00:01.998974,96.78526941103411,7.8738117928998435,sigmoid,8,,28.0,28.0,,,,,,,,,,,,,COMPLETE
9186,0.45345352376492626,2024-04-11 19:22:13.550522,2024-04-11 19:22:15.624844,0 days 00:00:02.074322,98.07012814427856,8.244577441306774,sigmoid,8,,26.0,30.0,,,,,,,,,,,,,COMPLETE
9187,0.4774991675844582,2024-04-11 19:22:15.627942,2024-04-11 19:22:18.507960,0 days 00:00:02.880018,95.00118285375011,8.032470249731285,sigmoid,19,,,,8.0,3.0,37.0,,,2.310696645100744,9.029992420654484,9.15685833148344,7.0,30.0,59.0,45.0,COMPLETE
