number,value,datetime_start,datetime_complete,duration,params_C,params_gamma,params_kernel,params_mask_number,params_rsi_window,params_so_smooth,params_so_window,params_srsi_smooth1,params_srsi_smooth2,params_srsi_window,params_tsi_window_fast,params_tsi_window_slow,params_ult_weight_1,params_ult_weight_2,params_ult_weight_3,params_ult_window_1,params_ult_window_2,params_ult_window_3,params_williams_lbp,state
209,0.5863711449328822,2024-04-11 16:03:48.851776,2024-04-11 16:03:49.101563,0 days 00:00:00.249787,99.6185103213158,0.731811698411758,sigmoid,0,,,,,,,,,,,,,,,,COMPLETE
210,0.4264989779695662,2024-04-11 16:03:49.102564,2024-04-11 16:03:49.620369,0 days 00:00:00.517805,93.2855764001942,1.2364481774619605,sigmoid,63,25.0,17.0,24.0,4.0,2.0,11.0,15.0,15.0,5.649540655233602,7.287658880910892,9.325564705131786,10.0,30.0,74.0,76.0,COMPLETE
211,0.5857799611637595,2024-04-11 16:03:49.621370,2024-04-11 16:03:49.904471,0 days 00:00:00.283101,94.46349388086912,1.0459565617679107,sigmoid,0,,,,,,,,,,,,,,,,COMPLETE
212,0.4648221726911522,2024-04-11 16:03:49.905473,2024-04-11 16:03:50.335535,0 days 00:00:00.430062,96.84985931217619,0.8267349147045338,sigmoid,18,,,,6.0,7.0,71.0,,,1.4169759138200848,2.0541763621593323,8.5613262298858,4.0,44.0,54.0,,COMPLETE
213,0.5896947521427498,2024-04-11 16:03:50.336514,2024-04-11 16:03:50.601495,0 days 00:00:00.264981,88.762690036656,1.069943555783936,sigmoid,0,,,,,,,,,,,,,,,,COMPLETE
214,0.5863754004307459,2024-04-11 16:03:50.601495,2024-04-11 16:03:50.881227,0 days 00:00:00.279732,96.32382446854567,1.4086630508944633,sigmoid,0,,,,,,,,,,,,,,,,COMPLETE
215,0.2805718222528419,2024-04-11 16:03:50.882190,2024-04-11 16:03:51.265449,0 days 00:00:00.383259,88.48681830935168,1.159083541462739,sigmoid,10,,21.0,11.0,,,,,,1.9744115475760684,3.047986937129966,3.149449523104156,5.0,22.0,67.0,,COMPLETE
216,0.5177628672990767,2024-04-11 16:03:51.267463,2024-04-11 16:03:51.666262,0 days 00:00:00.398799,92.07894203727128,0.6565118517352897,sigmoid,37,32.0,,,,,,50.0,35.0,,,,,,,25.0,COMPLETE
217,0.5803755120197209,2024-04-11 16:03:51.667263,2024-04-11 16:03:51.926194,0 days 00:00:00.258931,99.88143445645645,1.6313628196639027,sigmoid,0,,,,,,,,,,,,,,,,COMPLETE
218,0.5041782729805014,2024-04-11 16:03:51.927218,2024-04-11 16:03:52.364460,0 days 00:00:00.437242,93.79644185082323,0.8583965460425907,sigmoid,62,15.0,6.0,32.0,7.0,6.0,6.0,18.0,11.0,9.351812738958525,4.014418154965734,2.3505023790191264,18.0,40.0,56.0,,COMPLETE
219,0.35415412402167373,2024-04-11 16:03:52.365462,2024-04-11 16:03:52.761024,0 days 00:00:00.395562,84.82191541215013,1.2725750157428133,sigmoid,11,,33.0,8.0,,,,,,6.306735370335632,6.871259119323771,4.140181153499341,12.0,24.0,88.0,147.0,COMPLETE
220,0.5187835028990264,2024-04-11 16:03:52.762026,2024-04-11 16:03:53.204258,0 days 00:00:00.442232,88.49691289327745,0.47301762028637256,sigmoid,46,48.0,38.0,6.0,,,,2.0,18.0,9.885574668931678,9.977974148920929,0.8587950436968228,15.0,48.0,63.0,,COMPLETE
221,0.5839382417329186,2024-04-11 16:03:53.205259,2024-04-11 16:03:53.513509,0 days 00:00:00.308250,90.67863165857503,1.0135631797114397,sigmoid,0,,,,,,,,,,,,,,,,COMPLETE
222,0.5857799611637595,2024-04-11 16:03:53.514694,2024-04-11 16:03:53.793429,0 days 00:00:00.278735,92.31427573307735,1.045423615297755,sigmoid,0,,,,,,,,,,,,,,,,COMPLETE
223,0.589341292515921,2024-04-11 16:03:53.795284,2024-04-11 16:03:54.058684,0 days 00:00:00.263400,95.92287578591856,0.8417554321311537,sigmoid,0,,,,,,,,,,,,,,,,COMPLETE
224,0.5873898933704218,2024-04-11 16:03:54.059686,2024-04-11 16:03:54.314036,0 days 00:00:00.254350,96.98606793203653,0.7804420135730902,sigmoid,0,,,,,,,,,,,,,,,,COMPLETE
225,0.5881014021858113,2024-04-11 16:03:54.316044,2024-04-11 16:03:54.631579,0 days 00:00:00.315535,95.2589136283242,1.2659988305398562,sigmoid,0,,,,,,,,,,,,,,,,COMPLETE
226,0.5836343453209522,2024-04-11 16:03:54.632576,2024-04-11 16:03:54.913292,0 days 00:00:00.280716,95.8569068126598,1.305060873173697,sigmoid,0,,,,,,,,,,,,,,,,COMPLETE
227,0.49276909003789693,2024-04-11 16:03:54.914295,2024-04-11 16:03:55.236898,0 days 00:00:00.322603,98.05148921157169,1.4484878133602876,sigmoid,48,23.0,,,1.0,1.0,89.0,,,,,,,,,,COMPLETE
228,0.3666105942531498,2024-04-11 16:03:55.237970,2024-04-11 16:03:55.599246,0 days 00:00:00.361276,94.86402135673106,1.199225618098851,sigmoid,41,17.0,14.0,42.0,,,,,,,,,,,,46.0,COMPLETE
229,0.46665675045862465,2024-04-11 16:03:55.600296,2024-04-11 16:03:56.114186,0 days 00:00:00.513890,21.108262101860678,0.6077709054585447,sigmoid,55,10.0,,,5.0,8.0,55.0,28.0,42.0,4.0457420119935845,8.851852594231762,6.174308558244392,20.0,42.0,98.0,113.0,COMPLETE
230,0.44668002206544144,2024-04-11 16:03:56.115192,2024-04-11 16:03:57.513011,0 days 00:00:01.397819,97.93664721081487,0.9114291456606158,rbf,26,,40.0,46.0,3.0,5.0,42.0,,,4.705580423146827,2.5355777234782515,1.4501839600454471,11.0,32.0,83.0,,COMPLETE
231,0.4997087206504395,2024-04-11 16:03:57.514011,2024-04-11 16:03:57.901875,0 days 00:00:00.387864,94.48318777566085,1.1267168437312114,sigmoid,20,,,,4.0,4.0,4.0,41.0,50.0,,,,,,,,COMPLETE
232,0.585513790372854,2024-04-11 16:03:57.902929,2024-04-11 16:03:58.179557,0 days 00:00:00.276628,93.13236521275465,1.1034641184948653,sigmoid,0,,,,,,,,,,,,,,,,COMPLETE
233,0.5902205516200023,2024-04-11 16:03:58.180721,2024-04-11 16:03:58.443018,0 days 00:00:00.262297,96.44121426242943,0.8832108001931265,sigmoid,0,,,,,,,,,,,,,,,,COMPLETE
234,0.4032118632796914,2024-04-11 16:03:58.444017,2024-04-11 16:03:58.797619,0 days 00:00:00.353602,96.05428115397672,0.8153059657045225,sigmoid,52,39.0,,,8.0,3.0,78.0,22.0,2.0,,,,,,,,COMPLETE
235,0.4630808591658237,2024-04-11 16:03:58.797619,2024-04-11 16:03:59.252487,0 days 00:00:00.454868,98.20683328502069,1.347267349094192,sigmoid,59,6.0,2.0,34.0,2.0,6.0,31.0,,,8.1412716551459,3.521539212858552,9.996193414460702,8.0,43.0,66.0,183.0,COMPLETE
236,0.551376684241359,2024-04-11 16:03:59.252689,2024-04-11 16:03:59.679264,0 days 00:00:00.426575,96.10368074174131,0.6465914291304056,sigmoid,56,28.0,24.0,4.0,1.0,3.0,17.0,,,,,,,,,,COMPLETE
237,0.13026268441885572,2024-04-11 16:03:59.679264,2024-04-11 16:03:59.911634,0 days 00:00:00.232370,99.90182189119723,0.30165313200561616,sigmoid,0,,,,,,,,,,,,,,,,COMPLETE
238,0.5871571537475874,2024-04-11 16:03:59.912634,2024-04-11 16:04:00.193314,0 days 00:00:00.280680,93.44679162210016,0.9308369018837459,sigmoid,0,,,,,,,,,,,,,,,,COMPLETE
239,0.38450170869123484,2024-04-11 16:04:00.194312,2024-04-11 16:04:00.618969,0 days 00:00:00.424657,95.16800607449618,1.6552869252244549,sigmoid,23,,,,6.0,2.0,37.0,26.0,24.0,5.156827899407762,4.7493309599378595,1.8937921606913446,17.0,38.0,91.0,10.0,COMPLETE
240,0.5852394231262724,2024-04-11 16:04:00.619997,2024-04-11 16:04:00.888834,0 days 00:00:00.268837,97.42204017301344,1.168860725447635,sigmoid,0,,,,,,,,,,,,,,,,COMPLETE
241,0.5881110587623675,2024-04-11 16:04:00.889835,2024-04-11 16:04:01.177043,0 days 00:00:00.287208,91.4443913999,0.9573404603792662,sigmoid,0,,,,,,,,,,,,,,,,COMPLETE
242,0.589341292515921,2024-04-11 16:04:01.177043,2024-04-11 16:04:01.432469,0 days 00:00:00.255426,91.94529555837573,0.8409789207873227,sigmoid,0,,,,,,,,,,,,,,,,COMPLETE
243,0.5280816921954778,2024-04-11 16:04:01.433469,2024-04-11 16:04:01.792238,0 days 00:00:00.358769,91.30953505173098,0.8243824310546726,sigmoid,13,,10.0,18.0,,,,43.0,27.0,,,,,,,192.0,COMPLETE
244,0.4344593407880101,2024-04-11 16:04:01.793239,2024-04-11 16:04:02.181230,0 days 00:00:00.387991,92.38989710543709,0.9675217148030314,sigmoid,60,30.0,27.0,39.0,3.0,8.0,48.0,6.0,47.0,,,,,,,,COMPLETE
245,0.5863711449328822,2024-04-11 16:04:02.182234,2024-04-11 16:04:02.436800,0 days 00:00:00.254566,89.6642402686873,0.6542284636531015,sigmoid,0,,,,,,,,,,,,,,,,COMPLETE
246,0.06018954719281715,2024-04-11 16:04:02.437801,2024-04-11 16:04:02.781798,0 days 00:00:00.343997,93.46071247934711,1.0427917979560204,sigmoid,2,,,,,,,,,2.3626874185409723,8.589548212935828,5.757501021940931,14.0,23.0,81.0,,COMPLETE
247,0.5823323040111231,2024-04-11 16:04:02.781798,2024-04-11 16:04:03.145831,0 days 00:00:00.364033,91.30498019233532,0.4886466429482453,sigmoid,0,,,,,,,,,,,,,,,,COMPLETE
248,0.5625927672132293,2024-04-11 16:04:03.146826,2024-04-11 16:04:03.470315,0 days 00:00:00.323489,96.68793317208137,0.8086615855695323,sigmoid,12,,36.0,12.0,,,,19.0,37.0,,,,,,,,COMPLETE
249,0.5906816394155942,2024-04-11 16:04:03.471317,2024-04-11 16:04:03.734159,0 days 00:00:00.262842,89.66267846111397,1.0833949051864866,sigmoid,0,,,,,,,,,,,,,,,,COMPLETE
250,0.5871571537475874,2024-04-11 16:04:03.735159,2024-04-11 16:04:04.019643,0 days 00:00:00.284484,93.8346699682028,0.928889647699282,sigmoid,0,,,,,,,,,,,,,,,,COMPLETE
251,0.5556485822728288,2024-04-11 16:04:04.020643,2024-04-11 16:04:04.314545,0 days 00:00:00.293902,87.25775115486866,0.7191927094516758,sigmoid,36,19.0,,,,,,9.0,40.0,,,,,,,,COMPLETE
252,0.2984876518381466,2024-04-11 16:04:04.315544,2024-04-11 16:04:04.761918,0 days 00:00:00.446374,98.37545374157114,1.0913749759830642,sigmoid,54,35.0,,,7.0,7.0,22.0,48.0,20.0,3.575991151675276,5.070348954534941,5.147644294226629,5.0,25.0,96.0,,COMPLETE
253,0.5312215362817528,2024-04-11 16:04:04.762919,2024-04-11 16:04:05.196516,0 days 00:00:00.433597,95.2868937368889,0.542801016571393,sigmoid,44,26.0,29.0,20.0,,,,32.0,34.0,,,,,,,,COMPLETE
254,0.26208423832034417,2024-04-11 16:04:05.196516,2024-04-11 16:04:05.610245,0 days 00:00:00.413729,92.41618436609733,0.8402251573903825,sigmoid,34,4.0,,,,,,,,8.787940931156639,5.498572426441829,6.572058600172097,3.0,29.0,93.0,,COMPLETE
255,0.43266932270916336,2024-04-11 16:04:05.611247,2024-04-11 16:04:06.043490,0 days 00:00:00.432243,88.35861529295481,1.4773602913831303,sigmoid,30,,16.0,26.0,5.0,1.0,76.0,20.0,17.0,9.169091895942536,6.585083589463606,4.704471823089431,6.0,27.0,78.0,,COMPLETE
256,0.2891847603441213,2024-04-11 16:04:06.044484,2024-04-11 16:04:06.401443,0 days 00:00:00.356959,31.211422188763667,1.069883255701577,sigmoid,40,8.0,19.0,44.0,,,,,,,,,,,,,COMPLETE
257,0.45481567738179146,2024-04-11 16:04:06.401443,2024-04-11 16:04:06.797462,0 days 00:00:00.396019,98.00881703234855,1.2568888481319167,sigmoid,61,12.0,22.0,3.0,4.0,4.0,100.0,3.0,31.0,,,,,,,35.0,COMPLETE
258,0.48443378361318024,2024-04-11 16:04:06.798544,2024-04-11 16:04:07.225625,0 days 00:00:00.427081,96.36540033626119,0.9393916857734269,sigmoid,7,,,,,,,12.0,12.0,2.8873459542512507,9.664159199861174,7.1087664543349,4.0,34.0,60.0,60.0,COMPLETE
259,0.4484069827735208,2024-04-11 16:04:07.226703,2024-04-11 16:04:07.715136,0 days 00:00:00.488433,91.20091887467945,0.6548075546909169,sigmoid,27,,46.0,47.0,2.0,6.0,82.0,,,0.5862817928036623,5.947877557816033,2.81961846276526,9.0,31.0,70.0,106.0,COMPLETE
260,0.4469135802469135,2024-04-11 16:04:07.716322,2024-04-11 16:04:08.565731,0 days 00:00:00.849409,99.97991808471782,0.4108244580391125,rbf,4,,,,,,,35.0,6.0,,,,,,,,COMPLETE
261,0.18740587349397592,2024-04-11 16:04:08.566724,2024-04-11 16:04:08.842408,0 days 00:00:00.275684,94.12317004385638,1.4643919202375937,sigmoid,32,50.0,,,,,,,,,,,,,,,COMPLETE
262,0.5057257159790869,2024-04-11 16:04:08.843408,2024-04-11 16:04:09.183051,0 days 00:00:00.339643,89.42001684466909,1.1676883071498771,sigmoid,5,,,,,,,23.0,22.0,,,,,,,85.0,COMPLETE
263,0.589341292515921,2024-04-11 16:04:09.184119,2024-04-11 16:04:09.448966,0 days 00:00:00.264847,92.74813509478892,0.8399967075181924,sigmoid,0,,,,,,,,,,,,,,,,COMPLETE
264,0.5318640955004591,2024-04-11 16:04:09.449977,2024-04-11 16:04:09.747751,0 days 00:00:00.297774,95.25042551985845,3.6684223458054794,sigmoid,33,42.0,,,,,,,,,,,,,,67.0,COMPLETE
265,0.4962538682881807,2024-04-11 16:04:09.748752,2024-04-11 16:04:10.093127,0 days 00:00:00.344375,97.04894437590306,0.6925345547413473,sigmoid,17,,,,8.0,2.0,58.0,,,,,,,,,23.0,COMPLETE
266,0.40029707872586234,2024-04-11 16:04:10.094128,2024-04-11 16:04:10.467930,0 days 00:00:00.373802,93.86470382643608,0.8556819407819778,sigmoid,45,21.0,31.0,31.0,,,,40.0,3.0,,,,,,,151.0,COMPLETE
267,0.5877770482494277,2024-04-11 16:04:10.468943,2024-04-11 16:04:10.734334,0 days 00:00:00.265391,92.88322119411028,1.3426673126614004,sigmoid,0,,,,,,,,,,,,,,,,COMPLETE
268,0.13026268441885572,2024-04-11 16:04:10.735336,2024-04-11 16:04:10.971297,0 days 00:00:00.235961,98.09418478372548,0.2703510742034153,sigmoid,0,,,,,,,,,,,,,,,,COMPLETE
269,0.42060864582670143,2024-04-11 16:04:10.971297,2024-04-11 16:04:11.351976,0 days 00:00:00.380679,95.54805290694114,1.0519264175615164,sigmoid,53,33.0,,,6.0,5.0,89.0,45.0,9.0,,,,,,,142.0,COMPLETE
270,0.5852394231262724,2024-04-11 16:04:11.351976,2024-04-11 16:04:11.616197,0 days 00:00:00.264221,96.61105207946669,1.1762699751763523,sigmoid,0,,,,,,,,,,,,,,,,COMPLETE
271,0.41921131224477354,2024-04-11 16:04:11.617198,2024-04-11 16:04:12.054654,0 days 00:00:00.437456,93.05288005233413,0.5355175828713461,sigmoid,58,46.0,4.0,49.0,7.0,8.0,84.0,,,4.375225785293721,1.1313458177709323,3.87029764574,18.0,50.0,99.0,,COMPLETE
272,0.25218792180084465,2024-04-11 16:04:12.055654,2024-04-11 16:04:12.510153,0 days 00:00:00.454499,89.75037809332395,0.7884733577929994,sigmoid,50,16.0,,,3.0,1.0,11.0,,,6.04343484335012,7.912541014647221,5.361084352690184,16.0,36.0,52.0,,COMPLETE
273,0.4843661971830986,2024-04-11 16:04:12.511241,2024-04-11 16:04:12.891277,0 days 00:00:00.380036,94.52348289101529,1.4792487969569832,sigmoid,49,40.0,,,1.0,5.0,50.0,,,,,,,,,102.0,COMPLETE
274,0.42009655257783,2024-04-11 16:04:12.892339,2024-04-11 16:04:13.295780,0 days 00:00:00.403441,98.53218786509527,1.0808927016407688,sigmoid,51,36.0,,,2.0,3.0,64.0,,,1.7992678645038978,4.473276911191359,4.384369550873291,15.0,48.0,68.0,166.0,COMPLETE
275,0.5873898933704218,2024-04-11 16:04:13.296777,2024-04-11 16:04:13.566476,0 days 00:00:00.269699,87.16099609866556,0.7971240941393041,sigmoid,0,,,,,,,,,,,,,,,,COMPLETE
276,0.582160889799292,2024-04-11 16:04:13.566476,2024-04-11 16:04:13.837193,0 days 00:00:00.270717,91.11199851336507,1.3818612433858168,sigmoid,0,,,,,,,,,,,,,,,,COMPLETE
277,0.3695795120263021,2024-04-11 16:04:13.838195,2024-04-11 16:04:14.260924,0 days 00:00:00.422729,99.8629174442286,0.9566480395691032,sigmoid,19,,,,4.0,4.0,34.0,,,3.8796314084740335,6.1345122528435585,3.316595799330969,10.0,45.0,58.0,159.0,COMPLETE
278,0.5237896602966863,2024-04-11 16:04:14.261943,2024-04-11 16:04:15.370272,0 days 00:00:01.108329,96.1597671367142,1.2215464820086075,rbf,25,,42.0,37.0,8.0,7.0,27.0,,,,,,,,,136.0,COMPLETE
279,0.23578294852214532,2024-04-11 16:04:15.371271,2024-04-11 16:04:15.727274,0 days 00:00:00.356003,94.21235099494127,0.5991449352375209,sigmoid,6,,,,,,,27.0,25.0,8.49672541117358,0.5181473642041725,8.754859893297336,13.0,21.0,89.0,,COMPLETE
280,0.5815744280095285,2024-04-11 16:04:15.728273,2024-04-11 16:04:15.995146,0 days 00:00:00.266873,69.75878977836436,1.59142202463218,sigmoid,0,,,,,,,,,,,,,,,,COMPLETE
281,0.3987429941361324,2024-04-11 16:04:15.996149,2024-04-11 16:04:16.423874,0 days 00:00:00.427725,92.2000393669454,1.0600024290255663,sigmoid,43,44.0,8.0,24.0,,,,,,3.2325945478915123,4.138879467539374,6.057302714596402,2.0,46.0,55.0,34.0,COMPLETE
282,0.45461395489023965,2024-04-11 16:04:16.424874,2024-04-11 16:04:16.813203,0 days 00:00:00.388329,97.28265028378193,0.8191531509221477,sigmoid,29,,48.0,10.0,5.0,6.0,96.0,30.0,7.0,,,,,,,86.0,COMPLETE
283,0.2716668810840945,2024-04-11 16:04:16.814204,2024-04-11 16:04:17.097026,0 days 00:00:00.282822,62.82217181491207,0.3990541606314333,sigmoid,1,,,,,,,,,,,,,,,110.0,COMPLETE
284,0.4047044092657186,2024-04-11 16:04:17.098021,2024-04-11 16:04:17.531940,0 days 00:00:00.433919,95.18702523986906,1.2012762443941325,sigmoid,47,14.0,13.0,14.0,,,,25.0,43.0,5.523513070437923,2.3731558649329254,7.855312903404959,7.0,39.0,72.0,65.0,COMPLETE
285,0.4921362691261929,2024-04-11 16:04:17.532940,2024-04-11 16:04:17.873242,0 days 00:00:00.340302,88.82514511786596,0.6620592341431553,sigmoid,24,,19.0,33.0,7.0,2.0,92.0,,,,,,,,,,COMPLETE
286,0.40507047898991255,2024-04-11 16:04:17.874242,2024-04-11 16:04:18.265477,0 days 00:00:00.391235,85.6208635800426,0.9524156616630262,sigmoid,39,38.0,,,,,,38.0,28.0,1.4675119453012124,1.9209292369838922,2.1889437882617693,3.0,41.0,79.0,117.0,COMPLETE
287,0.5881014021858113,2024-04-11 16:04:18.265477,2024-04-11 16:04:18.540357,0 days 00:00:00.274880,98.14597112173001,1.2664941671067163,sigmoid,0,,,,,,,,,,,,,,,,COMPLETE
288,0.5832088276060698,2024-04-11 16:04:18.542359,2024-04-11 16:04:18.833566,0 days 00:00:00.291207,92.3459492692394,1.3929931466672256,sigmoid,0,,,,,,,,,,,,,,,,COMPLETE
289,0.5825349282830726,2024-04-11 16:04:18.833566,2024-04-11 16:04:19.124460,0 days 00:00:00.290894,94.51446791734116,1.6736024818770163,sigmoid,0,,,,,,,,,,,,,,,,COMPLETE
290,0.3758971383196408,2024-04-11 16:04:19.124460,2024-04-11 16:04:19.509437,0 days 00:00:00.384977,90.32725744577579,1.0366576725379322,sigmoid,21,,,,6.0,4.0,44.0,33.0,15.0,,,,,,,48.0,COMPLETE
291,0.4714807454750523,2024-04-11 16:04:19.510441,2024-04-11 16:04:19.910990,0 days 00:00:00.400549,96.65511939077628,0.7535636174997656,sigmoid,22,,,,3.0,3.0,66.0,37.0,5.0,7.498354633205983,8.250656972107507,7.447285944044074,19.0,35.0,65.0,,COMPLETE
292,0.3888623652980494,2024-04-11 16:04:19.911981,2024-04-11 16:04:20.287242,0 days 00:00:00.375261,92.9619102705559,0.5378803077854967,sigmoid,35,3.0,,,,,,,,0.935895289683156,7.631000652242326,6.825521423528348,17.0,30.0,53.0,77.0,COMPLETE
293,0.13026268441885572,2024-04-11 16:04:20.288244,2024-04-11 16:04:20.500881,0 days 00:00:00.212637,98.46894389390394,0.1808278523275597,sigmoid,0,,,,,,,,,,,,,,,,COMPLETE
294,0.48400559804068577,2024-04-11 16:04:20.501881,2024-04-11 16:04:20.954924,0 days 00:00:00.453043,14.141707725460336,3.194316931790908,sigmoid,31,,5.0,41.0,1.0,5.0,70.0,15.0,33.0,2.182177042812254,0.8129301364861519,9.828512735594842,20.0,33.0,84.0,174.0,COMPLETE
295,0.30766388293548147,2024-04-11 16:04:20.955925,2024-04-11 16:04:21.328604,0 days 00:00:00.372679,95.68865474082723,0.8982421791644004,sigmoid,38,47.0,,,,,,21.0,30.0,6.530592768913135,9.384006573063399,8.269748067759817,8.0,28.0,87.0,,COMPLETE
296,0.34498532382876534,2024-04-11 16:04:21.329606,2024-04-11 16:04:21.671912,0 days 00:00:00.342306,99.97980552579388,7.407700807800692,sigmoid,3,,,,,,,,,6.877601554764413,1.433887966739133,9.516208958275172,16.0,26.0,76.0,195.0,COMPLETE
297,0.45208558821080685,2024-04-11 16:04:21.672910,2024-04-11 16:04:22.747223,0 days 00:00:01.074313,88.6636487856901,1.0637396388748592,rbf,15,,11.0,45.0,,,,49.0,39.0,8.942538458686482,3.2521403982473833,2.7093980416982135,11.0,44.0,57.0,180.0,COMPLETE
298,0.49940875049270783,2024-04-11 16:04:22.748281,2024-04-11 16:04:23.134817,0 days 00:00:00.386536,91.78270330420357,1.3857379315417093,sigmoid,28,,35.0,16.0,5.0,1.0,23.0,17.0,19.0,,,,,,,,COMPLETE
299,0.42567470674276536,2024-04-11 16:04:23.135817,2024-04-11 16:04:23.540323,0 days 00:00:00.404506,94.07503893696007,1.2595384712889364,sigmoid,57,23.0,40.0,29.0,4.0,7.0,19.0,,,,,,,,,55.0,COMPLETE
300,0.5873898933704218,2024-04-11 16:04:23.541440,2024-04-11 16:04:23.805016,0 days 00:00:00.263576,96.54382339817873,0.7743397890062803,sigmoid,0,,,,,,,,,,,,,,,,COMPLETE
301,0.5802729838167822,2024-04-11 16:04:23.805016,2024-04-11 16:04:24.111013,0 days 00:00:00.305997,66.484135202998,4.020414452281648,sigmoid,8,,33.0,21.0,,,,,,,,,,,,,COMPLETE
302,0.5886376209075821,2024-04-11 16:04:24.112200,2024-04-11 16:04:24.387092,0 days 00:00:00.274892,86.8859778261377,1.0911540459898708,sigmoid,0,,,,,,,,,,,,,,,,COMPLETE
303,0.5297326060928562,2024-04-11 16:04:24.388105,2024-04-11 16:04:24.721445,0 days 00:00:00.333340,83.92995270192597,0.9627990309983611,sigmoid,9,,43.0,19.0,,,,,,,,,,,,130.0,COMPLETE
304,0.2819523774200726,2024-04-11 16:04:24.722605,2024-04-11 16:04:25.095478,0 days 00:00:00.372873,82.00966079320436,0.41207844056667037,sigmoid,18,,,,2.0,2.0,47.0,,,4.934990551547609,3.808777808348169,4.909882639129149,9.0,50.0,94.0,,COMPLETE
305,0.5863711449328822,2024-04-11 16:04:25.096478,2024-04-11 16:04:25.355963,0 days 00:00:00.259485,86.44239592209068,0.6081115450718196,sigmoid,0,,,,,,,,,,,,,,,,COMPLETE
306,0.5153735790751574,2024-04-11 16:04:25.357074,2024-04-11 16:04:25.791340,0 days 00:00:00.434266,87.30084754752713,0.8784331207758198,sigmoid,42,7.0,8.0,6.0,,,,,,4.489530328644134,1.6734450243548906,3.9608169872020063,6.0,37.0,63.0,,COMPLETE
307,0.5865019492683915,2024-04-11 16:04:25.792339,2024-04-11 16:04:26.083296,0 days 00:00:00.290957,90.28293169060183,1.1146834844071873,sigmoid,0,,,,,,,,,,,,,,,,COMPLETE
308,0.4239703298848331,2024-04-11 16:04:26.083296,2024-04-11 16:04:26.461783,0 days 00:00:00.378487,88.41983478642224,1.5574330875460647,sigmoid,16,,,,6.0,6.0,56.0,,,,,,,,,,COMPLETE
309,0.5865019492683915,2024-04-11 16:04:26.461783,2024-04-11 16:04:26.733105,0 days 00:00:00.271322,85.07381318011271,1.118686385127743,sigmoid,0,,,,,,,,,,,,,,,,COMPLETE
310,0.3414846527828169,2024-04-11 16:04:26.734106,2024-04-11 16:04:27.183153,0 days 00:00:00.449047,90.98856841617125,0.7753247973710977,sigmoid,46,49.0,27.0,38.0,,,,47.0,41.0,9.77775348482971,8.812947669386094,0.6392799613307965,7.0,49.0,60.0,,COMPLETE
311,0.4573951560237372,2024-04-11 16:04:27.184298,2024-04-11 16:04:27.702903,0 days 00:00:00.518605,98.45954299137888,1.3596206304427374,sigmoid,63,27.0,49.0,35.0,8.0,8.0,53.0,5.0,47.0,9.28975558761221,7.457676111800103,3.592800400437855,14.0,25.0,51.0,122.0,COMPLETE
312,0.2916532388011602,2024-04-11 16:04:27.703903,2024-04-11 16:04:28.148961,0 days 00:00:00.445058,96.61941752405686,9.2952327283111,sigmoid,14,,28.0,2.0,,,,9.0,36.0,7.278834762916649,1.106958807348371,2.4401954300129853,12.0,22.0,74.0,,COMPLETE
313,0.2753247821082059,2024-04-11 16:04:28.149960,2024-04-11 16:04:28.598411,0 days 00:00:00.448451,92.64658551208105,0.9548077204939687,sigmoid,10,,16.0,27.0,,,,,,5.814544649587402,7.228429251461161,8.96003511632064,10.0,20.0,69.0,,COMPLETE
314,0.5863711449328822,2024-04-11 16:04:28.599414,2024-04-11 16:04:28.853571,0 days 00:00:00.254157,89.60452181869324,0.6255009219436962,sigmoid,0,,,,,,,,,,,,,,,,COMPLETE
