number,value,datetime_start,datetime_complete,duration,params_C,params_gamma,params_kernel,params_mask_number,params_rsi_window,params_so_smooth,params_so_window,params_srsi_smooth1,params_srsi_smooth2,params_srsi_window,params_tsi_window_fast,params_tsi_window_slow,params_ult_weight_1,params_ult_weight_2,params_ult_weight_3,params_ult_window_1,params_ult_window_2,params_ult_window_3,params_williams_lbp,state
6104,0.4053027844486273,2024-04-11 17:38:53.039984,2024-04-11 17:38:54.852466,0 days 00:00:01.812482,94.55958456854127,8.168336315265423,sigmoid,18,,,,3.0,6.0,96.0,,,6.855739096342291,2.695452816225909,5.251022124793853,6.0,42.0,60.0,,COMPLETE
6105,0.4101208459214501,2024-04-11 17:38:54.854117,2024-04-11 17:38:56.672151,0 days 00:00:01.818034,98.16670024236817,8.420279613467084,sigmoid,51,16.0,,,2.0,3.0,35.0,,,5.626413478459182,5.286095177137284,6.996070106143525,13.0,44.0,75.0,32.0,COMPLETE
6106,0.4712007809957697,2024-04-11 17:38:56.675721,2024-04-11 17:38:58.609497,0 days 00:00:01.933776,96.77247818518678,7.427195544013477,sigmoid,58,9.0,27.0,34.0,8.0,2.0,75.0,,,9.14120617856982,4.320814192439329,4.996539498279068,11.0,39.0,53.0,,COMPLETE
6107,0.4354700120295584,2024-04-11 17:38:58.612493,2024-04-11 17:39:00.047924,0 days 00:00:01.435431,98.13131474703566,7.979692997221299,sigmoid,49,44.0,,,6.0,8.0,29.0,,,,,,,,,162.0,COMPLETE
6108,0.44701971028259324,2024-04-11 17:39:00.050926,2024-04-11 17:39:01.343869,0 days 00:00:01.292943,94.01585940804163,7.793524375920649,sigmoid,8,,25.0,30.0,,,,,,,,,,,,,COMPLETE
6109,0.5986580986580987,2024-04-11 17:39:01.346421,2024-04-11 17:39:02.640879,0 days 00:00:01.294458,95.63436986799404,8.238810410371666,sigmoid,8,,30.0,31.0,,,,,,,,,,,,,COMPLETE
6110,0.4921972610793993,2024-04-11 17:39:02.643877,2024-04-11 17:39:04.652381,0 days 00:00:02.008504,98.25577080306225,8.502444416959317,sigmoid,47,25.0,26.0,28.0,,,,16.0,42.0,7.45567905319936,1.2426086860632113,9.737849778800133,7.0,23.0,82.0,124.0,COMPLETE
6111,0.5952371952371952,2024-04-11 17:39:04.655373,2024-04-11 17:39:05.895364,0 days 00:00:01.239991,99.96842498235122,8.081975747608418,sigmoid,8,,24.0,32.0,,,,,,,,,,,,,COMPLETE
6112,0.5219989386982904,2024-04-11 17:39:05.899924,2024-04-11 17:39:07.837872,0 days 00:00:01.937948,96.47913725274795,7.684681436416717,sigmoid,29,,21.0,31.0,5.0,7.0,9.0,35.0,44.0,,,,,,,73.0,COMPLETE
6113,0.5034989351067066,2024-04-11 17:39:07.839870,2024-04-11 17:39:09.736963,0 days 00:00:01.897093,99.93703112727353,8.30167035108138,sigmoid,22,,,,4.0,2.0,87.0,49.0,37.0,8.722880978242854,0.9687488868257894,2.856013679701902,9.0,31.0,70.0,,COMPLETE
6114,0.4094205309028009,2024-04-11 17:39:09.739935,2024-04-11 17:39:11.576660,0 days 00:00:01.836725,91.67640265134699,7.949915187779544,sigmoid,43,48.0,26.0,33.0,,,,,,0.6860601291145816,8.65482026100224,4.503057967714845,15.0,38.0,94.0,88.0,COMPLETE
6115,0.5034063943252278,2024-04-11 17:39:11.578708,2024-04-11 17:39:12.920686,0 days 00:00:01.341978,98.13371220093848,8.121667784007467,sigmoid,8,,25.0,36.0,,,,,,,,,,,,,COMPLETE
6116,0.12622036262203626,2024-04-11 17:39:12.923678,2024-04-11 17:39:14.157640,0 days 00:00:01.233962,95.56558226789024,7.814482703671479,sigmoid,8,,27.0,29.0,,,,,,,,,,,,,COMPLETE
6117,0.37978667599230637,2024-04-11 17:39:14.160654,2024-04-11 17:39:15.858137,0 days 00:00:01.697483,98.24549377516081,8.62138166908705,sigmoid,35,23.0,,,,,,,,4.677106380744833,7.36281442920667,1.9496041671326667,7.0,41.0,68.0,152.0,COMPLETE
6118,0.44916866572917535,2024-04-11 17:39:15.861112,2024-04-11 17:39:17.371038,0 days 00:00:01.509926,88.67070262482048,7.14103819877684,sigmoid,21,,,,1.0,6.0,20.0,20.0,35.0,,,,,,,41.0,COMPLETE
6119,0.47137896564423637,2024-04-11 17:39:17.374038,2024-04-11 17:39:18.921201,0 days 00:00:01.547163,96.69006759008202,8.373615660348065,sigmoid,25,,25.0,30.0,7.0,3.0,60.0,,,,,,,,,194.0,COMPLETE
6120,0.5986580986580987,2024-04-11 17:39:18.923230,2024-04-11 17:39:20.133583,0 days 00:00:01.210353,94.12554559420371,7.454732804753549,sigmoid,8,,20.0,31.0,,,,,,,,,,,,,COMPLETE
6121,0.2003597620035976,2024-04-11 17:39:20.136576,2024-04-11 17:39:21.871787,0 days 00:00:01.735211,98.24276507718812,8.01165419258382,sigmoid,6,,,,,,,7.0,13.0,1.6459547876105662,5.482437292789613,6.669311206404377,5.0,34.0,97.0,,COMPLETE
6122,0.44414248021108177,2024-04-11 17:39:21.873788,2024-04-11 17:39:23.519206,0 days 00:00:01.645418,98.11501980335865,8.201217472789937,sigmoid,57,12.0,29.0,32.0,7.0,5.0,52.0,,,,,,,,,96.0,COMPLETE
6123,0.45998037390232244,2024-04-11 17:39:23.521205,2024-04-11 17:39:25.713040,0 days 00:00:02.191835,96.62403044817462,7.792996252684615,sigmoid,31,,23.0,29.0,3.0,1.0,11.0,9.0,28.0,7.2607133086630515,4.907379945400951,3.3787572858597774,8.0,49.0,81.0,54.0,COMPLETE
6124,0.4657497781721384,2024-04-11 17:39:25.716064,2024-04-11 17:39:27.683128,0 days 00:00:01.967064,93.17270356541925,8.445102721171152,rbf,8,,24.0,34.0,,,,,,,,,,,,,COMPLETE
6125,0.5036985942963157,2024-04-11 17:39:27.687761,2024-04-11 17:39:29.469275,0 days 00:00:01.781514,98.21645641609469,7.6197829233545,sigmoid,39,34.0,,,,,,13.0,38.0,8.422227610805228,7.969875665419658,8.831136362675807,17.0,26.0,73.0,22.0,COMPLETE
6126,0.594268224819143,2024-04-11 17:39:29.472275,2024-04-11 17:39:30.722718,0 days 00:00:01.250443,99.94388011294468,8.03406622107179,sigmoid,8,,28.0,27.0,,,,,,,,,,,,,COMPLETE
6127,0.3359659339059543,2024-04-11 17:39:30.726258,2024-04-11 17:39:32.171995,0 days 00:00:01.445737,94.86934405107803,8.239534666233157,sigmoid,3,,,,,,,,,2.7059957550301035,2.344958067000487,1.2314575299255273,10.0,43.0,76.0,144.0,COMPLETE
6128,0.30744802629149587,2024-04-11 17:39:32.176964,2024-04-11 17:39:33.827798,0 days 00:00:01.650834,99.9984796550024,7.837082776380708,sigmoid,38,4.0,,,,,,25.0,2.0,7.771679429210835,6.608470786545702,0.711137887406708,14.0,22.0,92.0,,COMPLETE
6129,0.5039689324182399,2024-04-11 17:39:33.830797,2024-04-11 17:39:35.220043,0 days 00:00:01.389246,96.48780584968249,5.020953651617677,sigmoid,24,,27.0,30.0,8.0,4.0,42.0,,,,,,,,,,COMPLETE
6130,0.4651653944020356,2024-04-11 17:39:35.223039,2024-04-11 17:39:37.038597,0 days 00:00:01.815558,98.15644636824786,8.622463161055508,sigmoid,15,,26.0,32.0,,,,21.0,6.0,3.5376542467324112,7.106869879303345,9.27045833424064,6.0,28.0,80.0,104.0,COMPLETE
6131,0.40982874637242084,2024-04-11 17:39:37.041596,2024-04-11 17:39:38.616084,0 days 00:00:01.574488,95.5420161955226,8.032730931706311,sigmoid,16,,,,2.0,1.0,69.0,,,,,,,,,,COMPLETE
6132,0.3541084404695361,2024-04-11 17:39:38.619101,2024-04-11 17:39:40.460493,0 days 00:00:01.841392,98.26772189712172,8.292229499291848,sigmoid,14,,24.0,31.0,,,,28.0,48.0,5.110881538413822,5.152951932901648,7.529545627976877,20.0,25.0,66.0,,COMPLETE
6133,0.5929369437606513,2024-04-11 17:39:40.463489,2024-04-11 17:39:41.837581,0 days 00:00:01.374092,96.67538559902897,7.545263970675725,sigmoid,8,,25.0,33.0,,,,,,,,,,,,,COMPLETE
6134,0.4957222598987949,2024-04-11 17:39:41.841154,2024-04-11 17:39:43.910187,0 days 00:00:02.069033,93.84578658351188,7.891357458766759,sigmoid,28,,18.0,30.0,4.0,3.0,56.0,14.0,39.0,,,,,,,,COMPLETE
6135,0.5395399071173993,2024-04-11 17:39:43.914782,2024-04-11 17:39:45.249657,0 days 00:00:01.334875,99.96730001268479,9.058852977089387,sigmoid,9,,23.0,31.0,,,,,,,,,,,,168.0,COMPLETE
6136,0.5496343184637099,2024-04-11 17:39:45.252662,2024-04-11 17:39:46.899997,0 days 00:00:01.647335,96.04672457482663,8.172666450067458,sigmoid,42,46.0,26.0,32.0,,,,,,2.1020873564015936,3.0507709321559258,1.6885393976232317,4.0,50.0,96.0,,COMPLETE
6137,0.12622036262203626,2024-04-11 17:39:46.902012,2024-04-11 17:39:48.025967,0 days 00:00:01.123955,99.93789865579997,8.43492352442294,sigmoid,8,,22.0,29.0,,,,,,,,,,,,,COMPLETE
6138,0.2470121169513254,2024-04-11 17:39:48.027942,2024-04-11 17:39:49.373091,0 days 00:00:01.345149,92.00059800524085,7.720118764395512,sigmoid,2,,,,,,,,,7.007915303902299,3.8832280533836534,7.887253243937675,19.0,29.0,90.0,,COMPLETE
6139,0.41284174347758157,2024-04-11 17:39:49.377084,2024-04-11 17:39:51.473787,0 days 00:00:02.096703,98.12516193297841,8.020975612571718,sigmoid,46,28.0,27.0,33.0,,,,6.0,23.0,5.851183736753142,1.8331321321239953,5.9766773530974975,16.0,20.0,62.0,,COMPLETE
6140,0.5997714721005524,2024-04-11 17:39:51.476781,2024-04-11 17:39:52.770284,0 days 00:00:01.293503,96.51511516372652,8.741094089848833,sigmoid,8,,28.0,31.0,,,,,,,,,,,,,COMPLETE
6141,0.08981144558385709,2024-04-11 17:39:52.772831,2024-04-11 17:39:55.123212,0 days 00:00:02.350381,98.13211399147815,8.180495776127724,rbf,63,49.0,25.0,30.0,5.0,8.0,24.0,46.0,45.0,6.171481572505689,4.13523234292421,5.61083300260046,18.0,32.0,55.0,117.0,COMPLETE
6142,0.4160273334368691,2024-04-11 17:39:55.126228,2024-04-11 17:39:57.039554,0 days 00:00:01.913326,99.95639775067299,7.88143257632139,sigmoid,62,50.0,25.0,31.0,6.0,7.0,80.0,3.0,4.0,3.1775497958908767,8.47888827660007,3.66709658714663,2.0,48.0,89.0,,COMPLETE
6143,0.37846996899560176,2024-04-11 17:39:57.042112,2024-04-11 17:39:58.672155,0 days 00:00:01.630043,94.08538166953397,6.287237071327546,sigmoid,11,,24.0,34.0,,,,,,9.678705880339477,0.5048597172308202,2.4000874711166387,13.0,36.0,91.0,134.0,COMPLETE
6144,0.5963643249384587,2024-04-11 17:39:58.675581,2024-04-11 17:39:59.824306,0 days 00:00:01.148725,99.95082354108273,8.34809260670865,sigmoid,8,,26.0,32.0,,,,,,,,,,,,,COMPLETE
6145,0.4130916548142758,2024-04-11 17:39:59.826303,2024-04-11 17:40:02.195981,0 days 00:00:02.369678,98.24077384201327,7.246494247084206,sigmoid,26,,24.0,28.0,1.0,5.0,90.0,,,2.4592527193198697,2.4731256234013763,9.978437263345686,8.0,34.0,98.0,,COMPLETE
6146,0.12622036262203626,2024-04-11 17:40:02.198982,2024-04-11 17:40:03.276875,0 days 00:00:01.077893,99.9760926186526,7.55147701115712,sigmoid,8,,27.0,29.0,,,,,,,,,,,,,COMPLETE
6147,0.44701971028259324,2024-04-11 17:40:03.278875,2024-04-11 17:40:04.510278,0 days 00:00:01.231403,99.9912637953366,8.073937958143386,sigmoid,8,,23.0,30.0,,,,,,,,,,,,,COMPLETE
6148,0.5120979606618229,2024-04-11 17:40:04.512263,2024-04-11 17:40:05.940611,0 days 00:00:01.428348,99.96168224389545,8.525458685565196,sigmoid,20,,,,8.0,8.0,50.0,31.0,14.0,,,,,,,,COMPLETE
6149,0.3119988008693697,2024-04-11 17:40:05.942598,2024-04-11 17:40:07.409963,0 days 00:00:01.467365,73.3833739951601,7.802450167895605,sigmoid,10,,26.0,32.0,,,,,,8.921776098495592,5.7181384770448425,5.450777083096856,12.0,45.0,59.0,,COMPLETE
6150,0.3572449465731981,2024-04-11 17:40:07.412551,2024-04-11 17:40:08.761205,0 days 00:00:01.348654,96.6228137564341,8.279399009476881,sigmoid,41,30.0,25.0,33.0,,,,,,,,,,,,59.0,COMPLETE
6151,0.6009432182607054,2024-04-11 17:40:08.763718,2024-04-11 17:40:09.938305,0 days 00:00:01.174587,59.883961655323354,7.96719517653943,sigmoid,8,,24.0,31.0,,,,,,,,,,,,,COMPLETE
6152,0.5362781019586557,2024-04-11 17:40:09.941303,2024-04-11 17:40:11.178689,0 days 00:00:01.237386,96.61456623369328,8.147030086298786,sigmoid,37,38.0,,,,,,43.0,25.0,,,,,,,175.0,COMPLETE
6153,0.44701971028259324,2024-04-11 17:40:11.180687,2024-04-11 17:40:12.312951,0 days 00:00:01.132264,95.03029319704022,7.680895752907652,sigmoid,8,,28.0,30.0,,,,,,,,,,,,,COMPLETE
6154,0.4824403366321972,2024-04-11 17:40:12.315965,2024-04-11 17:40:14.274354,0 days 00:00:01.958389,57.39701637788381,8.486825901475742,sigmoid,55,8.0,,,3.0,4.0,65.0,39.0,17.0,9.346244595404851,6.124789138826217,3.967765566214832,4.0,46.0,78.0,121.0,COMPLETE
6155,0.4960731477003156,2024-04-11 17:40:14.277351,2024-04-11 17:40:16.206296,0 days 00:00:01.928945,98.2405711517307,7.904289241230138,sigmoid,59,43.0,27.0,32.0,4.0,6.0,14.0,,,8.144084507434549,7.6293515881479985,9.504286502552471,17.0,39.0,65.0,127.0,COMPLETE
6156,0.5162531691416153,2024-04-11 17:40:16.209275,2024-04-11 17:40:17.461191,0 days 00:00:01.251916,99.96638577664496,8.274656317101753,sigmoid,48,40.0,,,5.0,2.0,71.0,,,,,,,,,,COMPLETE
6157,0.45347172512526845,2024-04-11 17:40:17.464739,2024-04-11 17:40:18.655667,0 days 00:00:01.190928,96.63899953982538,7.5001553745932155,sigmoid,8,,25.0,28.0,,,,,,,,,,,,,COMPLETE
6158,0.302946557160095,2024-04-11 17:40:18.659667,2024-04-11 17:40:19.922553,0 days 00:00:01.262886,93.62908300767522,8.036720246251809,sigmoid,12,,23.0,31.0,,,,24.0,12.0,,,,,,,,COMPLETE
6159,0.1997792494481236,2024-04-11 17:40:19.925743,2024-04-11 17:40:21.717101,0 days 00:00:01.791358,98.21492280918376,7.717769659040116,rbf,13,,26.0,35.0,,,,26.0,9.0,,,,,,,112.0,COMPLETE
6160,0.4294321480972747,2024-04-11 17:40:21.719100,2024-04-11 17:40:23.158972,0 days 00:00:01.439872,95.63542781538992,8.819392683558936,sigmoid,56,19.0,29.0,30.0,2.0,3.0,100.0,,,,,,,,,,COMPLETE
6161,0.46121428921448526,2024-04-11 17:40:23.160972,2024-04-11 17:40:24.556935,0 days 00:00:01.395963,96.64816399535037,8.397311629250757,sigmoid,52,32.0,,,6.0,7.0,94.0,22.0,41.0,,,,,,,,COMPLETE
6162,0.3431159165906059,2024-04-11 17:40:24.559932,2024-04-11 17:40:25.944196,0 days 00:00:01.384264,98.25604265304133,8.123347304352748,sigmoid,44,11.0,30.0,33.0,,,,38.0,20.0,,,,,,,,COMPLETE
6163,0.396894055450422,2024-04-11 17:40:25.947207,2024-04-11 17:40:28.114876,0 days 00:00:02.167669,91.61852054943532,7.855863534660896,sigmoid,60,2.0,22.0,29.0,7.0,1.0,19.0,5.0,31.0,,,,,,,,COMPLETE
6164,0.5963643249384587,2024-04-11 17:40:28.117869,2024-04-11 17:40:29.593878,0 days 00:00:01.476009,98.15329649144374,8.558071614750848,sigmoid,8,,24.0,32.0,,,,,,,,,,,,,COMPLETE
6165,0.5986580986580987,2024-04-11 17:40:29.597870,2024-04-11 17:40:31.061174,0 days 00:00:01.463304,94.44287653664989,8.186601681455564,sigmoid,8,,25.0,31.0,,,,,,,,,,,,,COMPLETE
6166,0.5370429543068426,2024-04-11 17:40:31.063691,2024-04-11 17:40:32.474942,0 days 00:00:01.411251,82.40220376889914,7.308100080666095,sigmoid,1,,,,,,,,,,,,,,,187.0,COMPLETE
6167,0.4373741441804269,2024-04-11 17:40:32.477946,2024-04-11 17:40:34.872136,0 days 00:00:02.394190,96.9586966872665,7.951848645388943,sigmoid,54,26.0,,,3.0,2.0,45.0,8.0,21.0,3.97953374192425,3.4343553544649827,3.1242999582914064,11.0,25.0,52.0,,COMPLETE
6168,0.5888531538733245,2024-04-11 17:40:34.875707,2024-04-11 17:40:36.200251,0 days 00:00:01.324544,98.14644931578843,8.337726785472569,sigmoid,32,21.0,,,,,,,,,,,,,,,COMPLETE
6169,0.43078776481650166,2024-04-11 17:40:36.203242,2024-04-11 17:40:38.659835,0 days 00:00:02.456593,77.92353496710741,7.597622263575557,sigmoid,23,,,,1.0,5.0,39.0,41.0,32.0,5.453798423898685,4.562212121564913,2.141639009603657,16.0,31.0,85.0,179.0,COMPLETE
6170,0.5952371952371952,2024-04-11 17:40:38.663951,2024-04-11 17:40:40.179481,0 days 00:00:01.515530,95.14921921845203,8.063285681402846,sigmoid,8,,26.0,32.0,,,,,,,,,,,,,COMPLETE
6171,0.5077195817063865,2024-04-11 17:40:40.183490,2024-04-11 17:40:42.461555,0 days 00:00:02.278065,96.7249509064031,7.7686979785043855,sigmoid,7,,,,,,,18.0,43.0,6.310921700134521,9.755298874837758,2.6767750509438555,6.0,37.0,95.0,79.0,COMPLETE
6172,0.4141236125282132,2024-04-11 17:40:42.466186,2024-04-11 17:40:44.022600,0 days 00:00:01.556414,99.94209258075853,8.237449655020264,sigmoid,36,13.0,,,,,,47.0,27.0,,,,,,,,COMPLETE
6173,0.4448341684562156,2024-04-11 17:40:44.025175,2024-04-11 17:40:45.572023,0 days 00:00:01.546848,98.1050241217616,8.64626692878615,sigmoid,8,,27.0,30.0,,,,,,,,,,,,,COMPLETE
6174,0.40679307397676545,2024-04-11 17:40:45.575612,2024-04-11 17:40:47.281026,0 days 00:00:01.705414,95.32426612220726,7.9371774017564745,sigmoid,40,36.0,28.0,33.0,,,,,,,,,,,,,COMPLETE
6175,0.4168345903621394,2024-04-11 17:40:47.283622,2024-04-11 17:40:49.636213,0 days 00:00:02.352591,92.78179586681479,5.5098138887067085,sigmoid,27,,25.0,30.0,5.0,6.0,67.0,,,1.2299472960264621,2.0886416538133177,6.391984566755433,5.0,24.0,72.0,91.0,COMPLETE
6176,0.5931111524855706,2024-04-11 17:40:49.640211,2024-04-11 17:40:51.143474,0 days 00:00:01.503263,98.26925679611344,8.4246771476436,sigmoid,8,,21.0,26.0,,,,,,,,,,,,,COMPLETE
6177,0.5406546772964177,2024-04-11 17:40:51.146993,2024-04-11 17:40:53.165615,0 days 00:00:02.018622,96.66963253184193,7.742225154685963,sigmoid,34,15.0,,,,,,,,6.540654458396941,2.8275017789459795,8.408223230791306,9.0,35.0,83.0,,COMPLETE
6178,0.1593699554859854,2024-04-11 17:40:53.168597,2024-04-11 17:40:55.981669,0 days 00:00:02.813072,98.20408887538696,8.108350936367717,rbf,30,,24.0,31.0,8.0,8.0,36.0,32.0,18.0,0.8700519507596507,1.436178052596989,4.802582700835171,2.0,40.0,58.0,,COMPLETE
6179,0.45239228755058314,2024-04-11 17:40:55.985242,2024-04-11 17:40:57.472533,0 days 00:00:01.487291,95.14329362642245,7.41520800889596,sigmoid,8,,23.0,28.0,,,,,,,,,,,,,COMPLETE
6180,0.568550086190385,2024-04-11 17:40:57.477114,2024-04-11 17:40:58.932086,0 days 00:00:01.454972,98.34660965013951,7.9703389960795,sigmoid,4,,,,,,,17.0,16.0,,,,,,,,COMPLETE
6181,0.5470591791089886,2024-04-11 17:40:58.934632,2024-04-11 17:41:00.417955,0 days 00:00:01.483323,99.9251155258645,8.315877446809356,sigmoid,33,45.0,,,,,,,,,,,,,,46.0,COMPLETE
6182,0.5037105751391466,2024-04-11 17:41:00.420948,2024-04-11 17:41:01.994961,0 days 00:00:01.574013,99.97841202640929,8.20225227791224,sigmoid,5,,,,,,,29.0,47.0,,,,,,,148.0,COMPLETE
6183,0.5895095625828441,2024-04-11 17:41:01.998996,2024-04-11 17:41:03.474410,0 days 00:00:01.475414,93.5596558293471,7.665940484767341,sigmoid,8,,26.0,34.0,,,,,,,,,,,,,COMPLETE
6184,0.4407677983096977,2024-04-11 17:41:03.477449,2024-04-11 17:41:05.375728,0 days 00:00:01.898279,96.93677067153656,7.891273790027671,sigmoid,45,14.0,26.0,29.0,,,,10.0,26.0,,,,,,,64.0,COMPLETE
6185,0.3720575558649957,2024-04-11 17:41:05.378259,2024-04-11 17:41:07.076988,0 days 00:00:01.698729,96.79603491474313,8.529005703344307,sigmoid,17,,,,7.0,4.0,48.0,,,,,,,,,84.0,COMPLETE
6186,0.39672721813541517,2024-04-11 17:41:07.079576,2024-04-11 17:41:09.016296,0 days 00:00:01.936720,99.93368392222601,8.217794393894675,sigmoid,53,10.0,,,2.0,6.0,4.0,50.0,10.0,,,,,,,15.0,COMPLETE
6187,0.4511322055470117,2024-04-11 17:41:09.020284,2024-04-11 17:41:11.227925,0 days 00:00:02.207641,98.14399969866852,8.02938826151712,sigmoid,19,,,,3.0,7.0,84.0,,,2.9762231775301253,9.405340349499642,7.719004607403846,3.0,47.0,99.0,36.0,COMPLETE
6188,0.43199332873245916,2024-04-11 17:41:11.230914,2024-04-11 17:41:13.396550,0 days 00:00:02.165636,89.56556068547195,7.830380518881005,sigmoid,61,19.0,27.0,32.0,4.0,4.0,73.0,43.0,34.0,,,,,,,157.0,COMPLETE
6189,0.5963245096172158,2024-04-11 17:41:13.399545,2024-04-11 17:41:15.165309,0 days 00:00:01.765764,94.32566047833545,8.407021402427318,sigmoid,8,,25.0,31.0,,,,,,,,,,,,,COMPLETE
6190,0.12622036262203626,2024-04-11 17:41:15.169312,2024-04-11 17:41:16.737563,0 days 00:00:01.568251,95.2766713926998,8.806042045800158,sigmoid,8,,24.0,29.0,,,,,,,,,,,,,COMPLETE
6191,0.47110379262721763,2024-04-11 17:41:16.740563,2024-04-11 17:41:18.950484,0 days 00:00:02.209921,99.98345929131078,7.507729332531989,sigmoid,51,5.0,,,6.0,5.0,2.0,,,4.29444327122094,4.775231945316749,5.78434460962894,12.0,44.0,77.0,106.0,COMPLETE
6192,0.3792333585216734,2024-04-11 17:41:18.953484,2024-04-11 17:41:20.706813,0 days 00:00:01.753329,96.61405624359354,8.013135730568711,sigmoid,49,29.0,,,2.0,1.0,32.0,,,,,,,,,172.0,COMPLETE
6193,0.44701971028259324,2024-04-11 17:41:20.710811,2024-04-11 17:41:22.195492,0 days 00:00:01.484681,98.38314073657507,8.126404521879278,sigmoid,8,,22.0,30.0,,,,,,,,,,,,,COMPLETE
6194,0.17202870313168275,2024-04-11 17:41:22.198477,2024-04-11 17:41:24.241635,0 days 00:00:02.043158,99.95054475049527,7.745033892982356,sigmoid,6,,,,,,,30.0,45.0,7.571608266980292,8.99192517024851,8.676638833783406,15.0,27.0,86.0,,COMPLETE
6195,0.45982216822223454,2024-04-11 17:41:24.245170,2024-04-11 17:41:26.616044,0 days 00:00:02.370874,98.14388931041685,8.349697658698457,sigmoid,58,47.0,26.0,31.0,5.0,2.0,88.0,,,4.874902401368958,3.1990336056529722,4.18948008779482,18.0,21.0,70.0,,COMPLETE
6196,0.5998117115420825,2024-04-11 17:41:26.620080,2024-04-11 17:41:28.118308,0 days 00:00:01.498228,99.95134061767918,7.043140821799994,sigmoid,8,,24.0,32.0,,,,,,,,,,,,,COMPLETE
6197,0.2803424687002538,2024-04-11 17:41:28.121308,2024-04-11 17:41:30.749238,0 days 00:00:02.627930,96.48773344186067,7.88550434997626,rbf,29,,28.0,33.0,8.0,3.0,41.0,27.0,30.0,,,,,,,56.0,COMPLETE
6198,0.4120600081723192,2024-04-11 17:41:30.752236,2024-04-11 17:41:32.886721,0 days 00:00:02.134485,93.00000920553896,8.131050735344004,sigmoid,43,27.0,25.0,30.0,,,,,,5.2938109874277455,6.839688552641572,1.3132827703079997,14.0,32.0,88.0,67.0,COMPLETE
6199,0.5054731330258073,2024-04-11 17:41:32.889731,2024-04-11 17:41:34.909064,0 days 00:00:02.019333,96.73689071956275,8.521932577970652,sigmoid,18,,,,1.0,5.0,22.0,,,8.554953587690077,8.837768330321692,5.150995382174518,10.0,42.0,61.0,,COMPLETE
6200,0.41089013940401586,2024-04-11 17:41:34.912051,2024-04-11 17:41:37.052841,0 days 00:00:02.140790,98.19485908749547,7.605502681388612,sigmoid,50,7.0,,,6.0,7.0,78.0,,,1.4934353046315483,4.381965597734561,9.052586249887227,20.0,22.0,51.0,,COMPLETE
6201,0.3878616113088861,2024-04-11 17:41:37.056447,2024-04-11 17:41:39.010386,0 days 00:00:01.953939,99.9447078548364,8.197908449778009,sigmoid,25,,44.0,31.0,4.0,3.0,98.0,,,,,,,,,140.0,COMPLETE
6202,0.4544178387279648,2024-04-11 17:41:39.012379,2024-04-11 17:41:40.746612,0 days 00:00:01.734233,95.24747849482097,7.952643068842406,sigmoid,47,6.0,27.0,32.0,,,,36.0,36.0,6.029702116774855,7.186391553521938,0.9784689655213876,19.0,48.0,64.0,74.0,COMPLETE
6203,0.3872416079069488,2024-04-11 17:41:40.749606,2024-04-11 17:41:42.295352,0 days 00:00:01.545746,96.7621536395769,7.3705383665976285,sigmoid,39,23.0,,,,,,33.0,22.0,5.799828316640993,9.20287898260083,8.015314230430576,7.0,30.0,57.0,26.0,COMPLETE
6204,0.45345352376492626,2024-04-11 17:41:42.298308,2024-04-11 17:41:43.352478,0 days 00:00:01.054170,99.97529844006823,8.371487294117657,sigmoid,8,,29.0,30.0,,,,,,,,,,,,,COMPLETE
6205,0.5112876926256804,2024-04-11 17:41:43.355121,2024-04-11 17:41:45.180119,0 days 00:00:01.824998,98.18317958645498,8.641989211369122,sigmoid,22,,,,7.0,8.0,7.0,19.0,11.0,7.9389550975159615,7.915417079426279,0.5108903373603315,13.0,29.0,79.0,,COMPLETE
