number,value,datetime_start,datetime_complete,duration,params_C,params_gamma,params_kernel,params_mask_number,params_rsi_window,params_so_smooth,params_so_window,params_srsi_smooth1,params_srsi_smooth2,params_srsi_window,params_tsi_window_fast,params_tsi_window_slow,params_ult_weight_1,params_ult_weight_2,params_ult_weight_3,params_ult_window_1,params_ult_window_2,params_ult_window_3,params_williams_lbp,state
4459,0.3473152667901027,2024-04-11 17:06:11.516562,2024-04-11 17:06:12.829785,0 days 00:00:01.313223,96.78038931832674,8.187073159683228,sigmoid,15,,26.0,32.0,,,,46.0,21.0,2.2017361729321143,9.041488033117865,8.388406091684262,10.0,41.0,54.0,10.0,COMPLETE
4460,0.34780221665580074,2024-04-11 17:06:12.832295,2024-04-11 17:06:14.029284,0 days 00:00:01.196989,99.95266418379826,8.676991748638057,sigmoid,38,11.0,,,,,,18.0,15.0,6.9314711122243455,8.89009084356227,2.9334049620741287,14.0,40.0,85.0,,COMPLETE
4461,0.6009432182607054,2024-04-11 17:06:14.031880,2024-04-11 17:06:14.839371,0 days 00:00:00.807491,99.96761844865105,7.832075107913055,sigmoid,8,,23.0,31.0,,,,,,,,,,,,,COMPLETE
4462,0.5048630818113464,2024-04-11 17:06:14.842378,2024-04-11 17:06:16.060822,0 days 00:00:01.218444,94.11437423512604,7.681852316020429,sigmoid,28,,25.0,30.0,4.0,4.0,7.0,9.0,36.0,,,,,,,,COMPLETE
4463,0.3451444024546683,2024-04-11 17:06:16.064399,2024-04-11 17:06:17.654940,0 days 00:00:01.590541,96.6433101827323,8.36415278475984,sigmoid,42,24.0,24.0,33.0,,,,,,4.169695002783695,2.3608481501552294,5.948658433676533,9.0,29.0,73.0,,COMPLETE
4464,0.42075833254798484,2024-04-11 17:06:17.658511,2024-04-11 17:06:19.013211,0 days 00:00:01.354700,98.09902838820281,7.398758341903351,sigmoid,57,39.0,28.0,30.0,2.0,8.0,72.0,,,,,,,,,178.0,COMPLETE
4465,0.6009432182607054,2024-04-11 17:06:19.015216,2024-04-11 17:06:19.835677,0 days 00:00:00.820461,98.1255402140306,8.040257303943838,sigmoid,8,,22.0,31.0,,,,,,,,,,,,,COMPLETE
4466,0.5264753477129807,2024-04-11 17:06:19.837679,2024-04-11 17:06:20.694696,0 days 00:00:00.857017,90.32007681452417,8.153264166443257,sigmoid,9,,26.0,46.0,,,,,,,,,,,,123.0,COMPLETE
4467,0.5172024426777279,2024-04-11 17:06:20.697265,2024-04-11 17:06:21.940405,0 days 00:00:01.243140,95.39947713246937,7.877012380291579,sigmoid,43,46.0,24.0,28.0,,,,,,7.188553920740629,1.9510320880911793,6.183210802252117,4.0,34.0,69.0,170.0,COMPLETE
4468,0.4106118848068561,2024-04-11 17:06:21.942399,2024-04-11 17:06:22.819531,0 days 00:00:00.877132,98.16456943442276,8.313325782012093,sigmoid,16,,,,5.0,1.0,57.0,,,,,,,,,,COMPLETE
4469,0.5952371952371952,2024-04-11 17:06:22.821546,2024-04-11 17:06:23.612533,0 days 00:00:00.790987,80.37565352217098,7.617192429422591,sigmoid,8,,25.0,32.0,,,,,,,,,,,,,COMPLETE
4470,0.44078835589284704,2024-04-11 17:06:23.614532,2024-04-11 17:06:25.071078,0 days 00:00:01.456546,96.7778644426155,6.537529506085624,sigmoid,62,31.0,27.0,31.0,6.0,7.0,93.0,32.0,10.0,6.288659592608074,9.505201242878822,6.528740860977694,19.0,47.0,89.0,,COMPLETE
4471,0.4990018062553475,2024-04-11 17:06:25.073579,2024-04-11 17:06:26.513391,0 days 00:00:01.439812,99.99806218255863,8.595719779854974,sigmoid,63,44.0,23.0,29.0,3.0,3.0,24.0,42.0,46.0,5.343515460111269,2.6706615523604897,4.657368609758619,3.0,27.0,81.0,143.0,COMPLETE
4472,0.5929369437606513,2024-04-11 17:06:26.514393,2024-04-11 17:06:27.309855,0 days 00:00:00.795462,93.5226098050847,8.018303667044295,sigmoid,8,,26.0,33.0,,,,,,,,,,,,,COMPLETE
4473,0.35040586896715686,2024-04-11 17:06:27.311870,2024-04-11 17:06:28.495407,0 days 00:00:01.183537,96.75850803994574,8.209505547528384,sigmoid,14,,25.0,30.0,,,,3.0,48.0,2.8739916590449686,3.4224999092183213,4.911528370738277,6.0,48.0,78.0,,COMPLETE
4474,0.5335324839756271,2024-04-11 17:06:28.498972,2024-04-11 17:06:29.289784,0 days 00:00:00.790812,99.96149143922761,7.911383456232178,sigmoid,8,,27.0,48.0,,,,,,,,,,,,,COMPLETE
4475,0.5963643249384587,2024-04-11 17:06:29.291807,2024-04-11 17:06:30.079791,0 days 00:00:00.787984,98.19602856122245,8.486886846076196,sigmoid,8,,24.0,32.0,,,,,,,,,,,,,COMPLETE
4476,0.543496911461908,2024-04-11 17:06:30.083334,2024-04-11 17:06:31.161542,0 days 00:00:01.078208,95.52448374763715,7.7442241389052295,sigmoid,3,,,,,,,,,2.6284699316893847,6.535171697929915,1.718971173404821,16.0,43.0,74.0,39.0,COMPLETE
4477,0.5186246418338109,2024-04-11 17:06:31.163538,2024-04-11 17:06:32.304107,0 days 00:00:01.140569,99.98395216957118,8.129080310276606,sigmoid,11,,26.0,31.0,,,,,,8.506958188026598,1.6498915430141614,0.662220839033588,11.0,46.0,70.0,126.0,COMPLETE
4478,0.29082280845975633,2024-04-11 17:06:32.306691,2024-04-11 17:06:33.797828,0 days 00:00:01.491137,96.64939000338505,8.33412761958541,rbf,2,,,,,,,,,2.3303287262512256,7.987880894015547,3.8793397299531507,17.0,33.0,95.0,,COMPLETE
4479,0.32964133060769374,2024-04-11 17:06:33.800324,2024-04-11 17:06:35.021203,0 days 00:00:01.220879,92.90986828428018,7.882389974339155,sigmoid,10,,28.0,29.0,,,,,,7.3471784547144345,3.9581657878599126,6.876529084921278,12.0,28.0,61.0,,COMPLETE
4480,0.5095920906174294,2024-04-11 17:06:35.023199,2024-04-11 17:06:35.953970,0 days 00:00:00.930771,98.28760787127443,7.425415592180615,sigmoid,41,41.0,22.0,34.0,,,,,,,,,,,,110.0,COMPLETE
4481,0.32145394269476674,2024-04-11 17:06:35.955999,2024-04-11 17:06:36.900576,0 days 00:00:00.944577,95.61392562929433,8.045038709696993,sigmoid,37,8.0,,,,,,15.0,32.0,,,,,,,119.0,COMPLETE
4482,0.36932494473728955,2024-04-11 17:06:36.902591,2024-04-11 17:06:38.191054,0 days 00:00:01.288463,98.19498627942342,8.732947357199437,sigmoid,46,49.0,33.0,30.0,,,,40.0,22.0,3.834085089187854,3.0166596160113985,7.4059539259125895,7.0,44.0,59.0,,COMPLETE
4483,0.5998117115420825,2024-04-11 17:06:38.194056,2024-04-11 17:06:38.968091,0 days 00:00:00.774035,98.07016637987496,7.199386949252727,sigmoid,8,,40.0,32.0,,,,,,,,,,,,,COMPLETE
4484,0.4260184808508165,2024-04-11 17:06:38.970709,2024-04-11 17:06:40.177130,0 days 00:00:01.206421,94.25243308562965,8.26774695685259,sigmoid,26,,25.0,31.0,1.0,5.0,84.0,,,1.920228357030604,7.456937082061171,5.2798863242886895,15.0,26.0,90.0,,COMPLETE
4485,0.5951910283216119,2024-04-11 17:06:40.179788,2024-04-11 17:06:41.026832,0 days 00:00:00.847044,96.75529011271006,9.132391227079497,sigmoid,8,,24.0,33.0,,,,,,,,,,,,,COMPLETE
4486,0.4776288198289471,2024-04-11 17:06:41.030820,2024-04-11 17:06:42.029237,0 days 00:00:00.998417,98.00034581306825,7.755330394957204,sigmoid,20,,,,7.0,4.0,42.0,21.0,3.0,,,,,,,,COMPLETE
4487,0.40498735326545177,2024-04-11 17:06:42.031266,2024-04-11 17:06:43.018521,0 days 00:00:00.987255,95.25698765429067,8.043507090942581,sigmoid,56,43.0,29.0,28.0,4.0,6.0,67.0,,,,,,,,,,COMPLETE
4488,0.5151476819935488,2024-04-11 17:06:43.020517,2024-04-11 17:06:43.963989,0 days 00:00:00.943472,98.17671500936324,8.454357051150916,sigmoid,48,5.0,,,8.0,7.0,100.0,,,,,,,,,,COMPLETE
4489,0.45806549577364986,2024-04-11 17:06:43.965985,2024-04-11 17:06:45.036787,0 days 00:00:01.070802,99.96108020142182,7.6167229767051365,sigmoid,52,34.0,,,5.0,8.0,88.0,17.0,20.0,,,,,,,,COMPLETE
4490,0.5963643249384587,2024-04-11 17:06:45.038819,2024-04-11 17:06:45.930637,0 days 00:00:00.891818,99.95315699397749,8.183626974703822,sigmoid,8,,26.0,32.0,,,,,,,,,,,,,COMPLETE
4491,0.44701971028259324,2024-04-11 17:06:45.932653,2024-04-11 17:06:46.768533,0 days 00:00:00.835880,96.79783951536413,7.878495036505681,sigmoid,8,,25.0,30.0,,,,,,,,,,,,,COMPLETE
4492,0.35079904794287653,2024-04-11 17:06:46.770514,2024-04-11 17:06:47.954491,0 days 00:00:01.183977,92.2648637137159,8.338298022888694,sigmoid,44,16.0,27.0,31.0,,,,7.0,34.0,,,,,,,,COMPLETE
4493,0.4231567257956107,2024-04-11 17:06:47.956474,2024-04-11 17:06:49.573212,0 days 00:00:01.616738,99.96061454814296,7.993253600882961,sigmoid,55,9.0,,,6.0,2.0,55.0,34.0,26.0,1.216706080979634,8.238835513242691,8.933340396947703,8.0,42.0,96.0,31.0,COMPLETE
4494,0.5929369437606513,2024-04-11 17:06:49.575190,2024-04-11 17:06:50.390538,0 days 00:00:00.815348,95.09337776089882,7.570069181572075,sigmoid,8,,23.0,33.0,,,,,,,,,,,,,COMPLETE
4495,0.09900990099009901,2024-04-11 17:06:50.392538,2024-04-11 17:06:52.091835,0 days 00:00:01.699297,55.271683146529384,8.575217957877678,rbf,59,26.0,28.0,30.0,1.0,6.0,47.0,,,8.252626603784478,9.285014894638184,7.163649538789913,11.0,31.0,66.0,64.0,COMPLETE
4496,0.5963643249384587,2024-04-11 17:06:52.094824,2024-04-11 17:06:52.889149,0 days 00:00:00.794325,97.04131757197752,8.178643763963507,sigmoid,8,,26.0,32.0,,,,,,,,,,,,,COMPLETE
4497,0.5986044733320588,2024-04-11 17:06:52.892211,2024-04-11 17:06:53.662875,0 days 00:00:00.770664,39.717501940562116,8.88624720060523,sigmoid,8,,24.0,31.0,,,,,,,,,,,,,COMPLETE
4498,0.47786789715291483,2024-04-11 17:06:53.664873,2024-04-11 17:06:54.999987,0 days 00:00:01.335114,93.86596151493566,7.744560588509563,sigmoid,23,,,,7.0,3.0,21.0,30.0,23.0,3.1518306712572954,1.0251236866005282,8.605758522536483,9.0,50.0,82.0,21.0,COMPLETE
4499,0.3388103161397671,2024-04-11 17:06:55.002522,2024-04-11 17:06:56.118110,0 days 00:00:01.115588,98.1576914734287,7.966599584950985,sigmoid,13,,23.0,29.0,,,,19.0,30.0,,,,,,,50.0,COMPLETE
4500,0.46685698545062976,2024-04-11 17:06:56.120700,2024-04-11 17:06:57.651398,0 days 00:00:01.530698,99.9979303477071,3.6319119048472484,sigmoid,60,2.0,25.0,30.0,2.0,5.0,98.0,4.0,48.0,,,,,,,,COMPLETE
4501,0.48986238532110093,2024-04-11 17:06:57.653393,2024-04-11 17:06:58.830671,0 days 00:00:01.177278,99.98807096132715,8.412351137674548,sigmoid,7,,,,,,,50.0,42.0,6.4852524942233485,6.006285624409562,7.844698082027218,5.0,39.0,63.0,102.0,COMPLETE
4502,0.2868906328526694,2024-04-11 17:06:58.832208,2024-04-11 17:06:59.833655,0 days 00:00:01.001447,96.53241819670293,8.158994204991542,sigmoid,12,,27.0,2.0,,,,23.0,33.0,,,,,,,,COMPLETE
4503,0.42256398284063384,2024-04-11 17:06:59.836659,2024-04-11 17:07:01.275427,0 days 00:00:01.438768,98.20758943220119,7.836279789480765,sigmoid,54,13.0,,,3.0,2.0,14.0,36.0,16.0,1.024799568202666,5.079999136083954,3.336176008460851,13.0,25.0,50.0,,COMPLETE
4504,0.4536210174569338,2024-04-11 17:07:01.277427,2024-04-11 17:07:02.468661,0 days 00:00:01.191234,95.3689144584566,7.435547248975947,sigmoid,61,7.0,24.0,32.0,8.0,1.0,82.0,27.0,19.0,,,,,,,148.0,COMPLETE
4505,0.5399717798830881,2024-04-11 17:07:02.470257,2024-04-11 17:07:03.466553,0 days 00:00:00.996296,98.193695214427,6.056002768754395,sigmoid,40,40.0,26.0,34.0,,,,,,,,,,,,,COMPLETE
4506,0.5986580986580987,2024-04-11 17:07:03.468554,2024-04-11 17:07:04.331094,0 days 00:00:00.862540,96.46584717393726,8.285322481578836,sigmoid,8,,25.0,31.0,,,,,,,,,,,,,COMPLETE
4507,0.12003789673140693,2024-04-11 17:07:04.333089,2024-04-11 17:07:05.206236,0 days 00:00:00.873147,90.44738749687978,8.109440446898605,sigmoid,8,,28.0,28.0,,,,,,,,,,,,,COMPLETE
4508,0.4424261305087589,2024-04-11 17:07:05.208235,2024-04-11 17:07:06.004079,0 days 00:00:00.795844,98.05283756602127,7.680109980705371,sigmoid,4,,,,,,,8.0,39.0,,,,,,,,COMPLETE
4509,0.5395056633191179,2024-04-11 17:07:06.006054,2024-04-11 17:07:06.744260,0 days 00:00:00.738206,93.5522341363196,7.947482980386118,sigmoid,1,,,,,,,,,,,,,,,192.0,COMPLETE
4510,0.4007899697776714,2024-04-11 17:07:06.746805,2024-04-11 17:07:08.199366,0 days 00:00:01.452561,99.98520277891996,8.569209876562558,sigmoid,30,,25.0,31.0,4.0,4.0,62.0,29.0,5.0,1.3903965579662025,4.179213436271125,1.93220469593281,2.0,20.0,72.0,,COMPLETE
4511,0.45345352376492626,2024-04-11 17:07:08.201359,2024-04-11 17:07:09.038819,0 days 00:00:00.837460,96.60012850158915,8.275766682532488,sigmoid,8,,26.0,30.0,,,,,,,,,,,,,COMPLETE
4512,0.5952371952371952,2024-04-11 17:07:09.039872,2024-04-11 17:07:09.851950,0 days 00:00:00.812078,99.98388637502421,8.07257595878082,sigmoid,8,,23.0,32.0,,,,,,,,,,,,,COMPLETE
4513,0.31133380697752683,2024-04-11 17:07:09.852951,2024-04-11 17:07:10.715639,0 days 00:00:00.862688,95.47382091879476,7.8159315885158716,sigmoid,5,,,,,,,25.0,12.0,,,,,,,71.0,COMPLETE
4514,0.34778507546115145,2024-04-11 17:07:10.717627,2024-04-11 17:07:12.127343,0 days 00:00:01.409716,98.16536623371411,8.412283303976004,rbf,34,20.0,,,,,,,,9.32679454934803,6.79967449799172,9.797269262376862,18.0,45.0,68.0,,COMPLETE
4515,0.5558622298242887,2024-04-11 17:07:12.130977,2024-04-11 17:07:12.981038,0 days 00:00:00.850061,98.19405589262642,8.005813399713677,sigmoid,36,48.0,,,,,,39.0,8.0,,,,,,,,COMPLETE
4516,0.5536169981720449,2024-04-11 17:07:12.983025,2024-04-11 17:07:13.751856,0 days 00:00:00.768831,94.630238542907,8.738111756468419,sigmoid,32,3.0,,,,,,,,,,,,,,,COMPLETE
4517,0.3005812344312206,2024-04-11 17:07:13.755477,2024-04-11 17:07:14.555865,0 days 00:00:00.800388,96.92005816450326,7.576689201290075,sigmoid,33,35.0,,,,,,,,,,,,,,15.0,COMPLETE
4518,0.46192136648473825,2024-04-11 17:07:14.559023,2024-04-11 17:07:16.037411,0 days 00:00:01.478388,98.14762188049514,8.193087883497935,sigmoid,51,14.0,,,5.0,8.0,74.0,,,7.71383104028018,7.608676844347835,1.0623112769351941,19.0,21.0,86.0,131.0,COMPLETE
4519,0.5931111524855706,2024-04-11 17:07:16.039446,2024-04-11 17:07:16.896665,0 days 00:00:00.857219,77.00762632891137,7.83751270540057,sigmoid,8,,22.0,26.0,,,,,,,,,,,,,COMPLETE
4520,0.12622036262203626,2024-04-11 17:07:16.897664,2024-04-11 17:07:17.778379,0 days 00:00:00.880715,92.11421377880039,8.413426583683277,sigmoid,8,,21.0,29.0,,,,,,,,,,,,,COMPLETE
4521,0.4818699749747085,2024-04-11 17:07:17.780941,2024-04-11 17:07:19.171328,0 days 00:00:01.390387,95.41565984437513,2.959163251308482,sigmoid,27,,24.0,33.0,3.0,3.0,49.0,,,5.980469649734834,8.720167601727713,9.417832390005206,14.0,38.0,76.0,58.0,COMPLETE
4522,0.5035601452350639,2024-04-11 17:07:19.173316,2024-04-11 17:07:20.357113,0 days 00:00:01.183797,98.15719466238455,7.3540702680222445,sigmoid,19,,,,1.0,6.0,60.0,,,4.567492193427816,2.847215130412904,5.029294235508519,20.0,34.0,79.0,164.0,COMPLETE
4523,0.5864669774809641,2024-04-11 17:07:20.359716,2024-04-11 17:07:21.267819,0 days 00:00:00.908103,99.98197964379568,7.929925918479359,sigmoid,8,,27.0,5.0,,,,,,,,,,,,,COMPLETE
4524,0.5179730578627767,2024-04-11 17:07:21.270805,2024-04-11 17:07:22.404432,0 days 00:00:01.133627,96.66615771314454,6.379182787112153,sigmoid,29,,20.0,30.0,6.0,1.0,44.0,12.0,43.0,,,,,,,92.0,COMPLETE
4525,0.3809828864281139,2024-04-11 17:07:22.407424,2024-04-11 17:07:23.674963,0 days 00:00:01.267539,93.87978897863749,8.16213217782042,sigmoid,58,12.0,26.0,31.0,6.0,5.0,18.0,,,3.4646498536606165,4.404625294073424,2.4328467982048108,3.0,46.0,93.0,,COMPLETE
4526,0.5464230761739672,2024-04-11 17:07:23.676961,2024-04-11 17:07:24.806536,0 days 00:00:01.129575,98.14312489887955,7.76534380628165,sigmoid,6,,,,,,,41.0,37.0,4.962593127030716,7.0691291713938496,1.5516669308459337,12.0,32.0,52.0,,COMPLETE
4527,0.34767575873991546,2024-04-11 17:07:24.808530,2024-04-11 17:07:25.852854,0 days 00:00:01.044324,99.9660365594571,8.506603712843969,sigmoid,45,22.0,31.0,32.0,,,,24.0,44.0,,,,,,,197.0,COMPLETE
4528,0.5929369437606513,2024-04-11 17:07:25.855388,2024-04-11 17:07:26.713006,0 days 00:00:00.857618,99.96274197022818,8.035849811183056,sigmoid,8,,24.0,33.0,,,,,,,,,,,,,COMPLETE
4529,0.4150724091351742,2024-04-11 17:07:26.715007,2024-04-11 17:07:27.715403,0 days 00:00:01.000396,96.6696322299689,8.287269431037782,sigmoid,17,,,,2.0,7.0,90.0,,,,,,,,,200.0,COMPLETE
4530,0.4800117866614282,2024-04-11 17:07:27.717395,2024-04-11 17:07:28.965608,0 days 00:00:01.248213,95.33934509519389,7.640563369776723,sigmoid,49,15.0,,,8.0,4.0,25.0,,,,,,,,,75.0,COMPLETE
4531,0.5020332369602519,2024-04-11 17:07:28.967603,2024-04-11 17:07:30.070502,0 days 00:00:01.102899,96.67840780058803,8.090856415510101,sigmoid,53,10.0,,,7.0,3.0,40.0,13.0,29.0,,,,,,,35.0,COMPLETE
4532,0.48764563106796116,2024-04-11 17:07:30.073039,2024-04-11 17:07:31.633799,0 days 00:00:01.560760,98.35876213786473,8.659202994825304,sigmoid,39,29.0,,,,,,11.0,27.0,9.761566185603012,3.677383012387744,5.59262747503984,4.0,48.0,100.0,86.0,COMPLETE
4533,0.4381535151127996,2024-04-11 17:07:31.637360,2024-04-11 17:07:33.447402,0 days 00:00:01.810042,98.19773875478032,7.112618974124661,rbf,18,,,,5.0,5.0,36.0,,,3.9963094611007177,2.141981150439649,4.375056347759507,5.0,36.0,65.0,,COMPLETE
4534,0.47614871974745704,2024-04-11 17:07:33.450976,2024-04-11 17:07:35.316440,0 days 00:00:01.865464,99.9940789426857,7.906504225089455,sigmoid,47,45.0,27.0,29.0,,,,5.0,50.0,8.031938721042785,9.99586406087803,3.7261135269684216,10.0,30.0,57.0,185.0,COMPLETE
4535,0.5986580986580987,2024-04-11 17:07:35.318434,2024-04-11 17:07:36.105824,0 days 00:00:00.787390,92.32928023826257,8.322506261971515,sigmoid,8,,25.0,31.0,,,,,,,,,,,,,COMPLETE
4536,0.3222819700153128,2024-04-11 17:07:36.107850,2024-04-11 17:07:37.273351,0 days 00:00:01.165501,95.15072887536559,7.496371189733258,sigmoid,50,6.0,,,3.0,8.0,33.0,,,0.6652447787504121,1.4006662837543544,2.691471926393201,13.0,22.0,98.0,,COMPLETE
4537,0.44701971028259324,2024-04-11 17:07:37.275377,2024-04-11 17:07:38.093075,0 days 00:00:00.817698,98.13244774180508,7.751578787887061,sigmoid,8,,26.0,30.0,,,,,,,,,,,,,COMPLETE
4538,0.3922391900585785,2024-04-11 17:07:38.095073,2024-04-11 17:07:39.117987,0 days 00:00:01.022914,96.30765797638381,8.224313903716546,sigmoid,25,,30.0,32.0,4.0,2.0,2.0,,,,,,,,,96.0,COMPLETE
4539,0.44143837558845217,2024-04-11 17:07:39.119977,2024-04-11 17:07:40.309851,0 days 00:00:01.189874,98.14441796440673,7.959893842274812,sigmoid,22,,,,2.0,7.0,8.0,37.0,28.0,4.281358491926167,3.228918317129862,3.140904365729665,6.0,29.0,88.0,,COMPLETE
4540,0.5906279643331437,2024-04-11 17:07:40.312366,2024-04-11 17:07:41.184715,0 days 00:00:00.872349,94.2042222149311,8.489254557221598,sigmoid,8,,23.0,34.0,,,,,,,,,,,,,COMPLETE
4541,0.33919268393238633,2024-04-11 17:07:41.186670,2024-04-11 17:07:42.286682,0 days 00:00:01.100012,96.77198617174537,8.087297878836706,sigmoid,3,,,,,,,,,5.7878182629624595,5.28813220771772,4.093326221873138,17.0,40.0,91.0,82.0,COMPLETE
4542,0.387926415431327,2024-04-11 17:07:42.288683,2024-04-11 17:07:43.800629,0 days 00:00:01.511946,99.99934764152654,7.686872669562334,sigmoid,35,37.0,,,,,,,,5.543235815886008,0.651649760392587,6.349472968499324,7.0,37.0,84.0,152.0,COMPLETE
4543,0.5986580986580987,2024-04-11 17:07:43.802608,2024-04-11 17:07:44.811372,0 days 00:00:01.008764,98.16369323957956,8.332793912700074,sigmoid,8,,25.0,31.0,,,,,,,,,,,,,COMPLETE
4544,0.4681143549476921,2024-04-11 17:07:44.813328,2024-04-11 17:07:46.091628,0 days 00:00:01.278300,8.43697583778274,7.931781018423297,sigmoid,24,,29.0,29.0,7.0,6.0,53.0,,,,,,,,,,COMPLETE
4545,0.4798792492453078,2024-04-11 17:07:46.094566,2024-04-11 17:07:47.310791,0 days 00:00:01.216225,96.60316368278679,8.168859866182665,sigmoid,21,,,,5.0,1.0,29.0,48.0,47.0,,,,,,,160.0,COMPLETE
4546,0.41276398849852924,2024-04-11 17:07:47.312382,2024-04-11 17:07:48.928741,0 days 00:00:01.616359,93.99915570691442,8.90809336189239,sigmoid,43,17.0,24.0,31.0,,,,,,1.561843253000927,6.318543770423009,4.671789154957817,18.0,43.0,77.0,138.0,COMPLETE
4547,0.32317895273840325,2024-04-11 17:07:48.931757,2024-04-11 17:07:50.108122,0 days 00:00:01.176365,98.18357670079186,7.789862377863005,sigmoid,38,27.0,,,,,,26.0,35.0,9.153918675843126,4.920962936348238,9.133656806565453,8.0,35.0,80.0,,COMPLETE
4548,0.5929369437606513,2024-04-11 17:07:50.110108,2024-04-11 17:07:50.968679,0 days 00:00:00.858571,95.44990260795554,8.56569576718402,sigmoid,8,,27.0,33.0,,,,,,,,,,,,,COMPLETE
4549,0.44701971028259324,2024-04-11 17:07:50.970680,2024-04-11 17:07:51.924742,0 days 00:00:00.954062,98.34753021181544,8.065482254474615,sigmoid,8,,28.0,30.0,,,,,,,,,,,,,COMPLETE
4550,0.45383856881250884,2024-04-11 17:07:51.926739,2024-04-11 17:07:53.072284,0 days 00:00:01.145545,96.76136623535567,7.47816397444091,sigmoid,57,25.0,26.0,32.0,1.0,2.0,76.0,,,,,,,,,25.0,COMPLETE
4551,0.32649379932356254,2024-04-11 17:07:53.074298,2024-04-11 17:07:53.955636,0 days 00:00:00.881338,98.2000176582057,8.357892605110573,sigmoid,9,,25.0,28.0,,,,,,,,,,,,43.0,COMPLETE
4552,0.06308818403624956,2024-04-11 17:07:53.957635,2024-04-11 17:07:55.605463,0 days 00:00:01.647828,92.59476847422867,7.931002943049835,rbf,15,,24.0,27.0,,,,16.0,9.0,5.2675468191339485,0.8884956219383673,1.2675436773256261,15.0,28.0,60.0,188.0,COMPLETE
4553,0.41880051829456405,2024-04-11 17:07:55.607464,2024-04-11 17:07:57.486038,0 days 00:00:01.878574,67.55591726841098,8.217188133613849,sigmoid,63,32.0,22.0,30.0,4.0,3.0,11.0,14.0,13.0,2.095857249587728,4.590822609939793,0.7970362687393671,16.0,27.0,87.0,176.0,COMPLETE
4554,0.48766178173943703,2024-04-11 17:07:57.488048,2024-04-11 17:07:59.493943,0 days 00:00:02.005895,90.16899753059501,7.682070748146364,sigmoid,31,,27.0,31.0,6.0,4.0,68.0,45.0,31.0,3.00555423704275,5.802722843335527,7.995761869688854,2.0,23.0,71.0,167.0,COMPLETE
4555,0.5929369437606513,2024-04-11 17:07:59.496934,2024-04-11 17:08:00.609628,0 days 00:00:01.112694,99.95011462340258,7.305153440848479,sigmoid,8,,25.0,33.0,,,,,,,,,,,,,COMPLETE
4556,0.36599595584579175,2024-04-11 17:08:00.612654,2024-04-11 17:08:02.380688,0 days 00:00:01.768034,95.4585811812852,8.071818871081836,sigmoid,14,,26.0,32.0,,,,2.0,21.0,6.2126796115934155,8.378779608851284,6.652860047949275,9.0,24.0,54.0,,COMPLETE
4557,0.47902833242751475,2024-04-11 17:08:02.383683,2024-04-11 17:08:04.076207,0 days 00:00:01.692524,96.72329884769832,8.481548989003246,sigmoid,28,,23.0,29.0,2.0,6.0,64.0,33.0,2.0,,,,,,,,COMPLETE
4558,0.4885290148448043,2024-04-11 17:08:04.078207,2024-04-11 17:08:05.220124,0 days 00:00:01.141917,98.13988305040571,7.850572412079805,sigmoid,8,,24.0,37.0,,,,,,,,,,,,,COMPLETE
4559,0.37420776139637346,2024-04-11 17:08:05.222702,2024-04-11 17:08:06.596986,0 days 00:00:01.374284,99.9649440969963,8.727220477388181,sigmoid,42,21.0,26.0,31.0,,,,,,2.4040879401580963,2.5788502679099383,7.298088517959856,11.0,49.0,62.0,,COMPLETE
4560,0.3385550619593172,2024-04-11 17:08:06.601004,2024-04-11 17:08:07.733394,0 days 00:00:01.132390,93.92819036207747,8.347719136810687,sigmoid,10,,28.0,30.0,,,,,,7.443546443837265,1.773316530949257,5.944534853347494,19.0,41.0,94.0,,COMPLETE
