number,value,datetime_start,datetime_complete,duration,params_C,params_gamma,params_kernel,params_mask_number,params_rsi_window,params_so_smooth,params_so_window,params_srsi_smooth1,params_srsi_smooth2,params_srsi_window,params_tsi_window_fast,params_tsi_window_slow,params_ult_weight_1,params_ult_weight_2,params_ult_weight_3,params_ult_window_1,params_ult_window_2,params_ult_window_3,params_williams_lbp,state
4561,0.4396883900150779,2024-04-11 17:08:07.735389,2024-04-11 17:08:09.310254,0 days 00:00:01.574865,96.59581551443642,8.06359187776675,sigmoid,62,18.0,25.0,34.0,8.0,5.0,96.0,20.0,25.0,6.784511862834091,9.689385475881075,5.422536940609043,12.0,20.0,97.0,,COMPLETE
4562,0.5952371952371952,2024-04-11 17:08:09.313255,2024-04-11 17:08:10.228156,0 days 00:00:00.914901,99.94608276145479,7.6167420875158935,sigmoid,8,,23.0,32.0,,,,,,,,,,,,,COMPLETE
4563,0.5963643249384587,2024-04-11 17:08:10.232760,2024-04-11 17:08:11.070530,0 days 00:00:00.837770,98.32176859805847,8.219875509181751,sigmoid,8,,27.0,32.0,,,,,,,,,,,,,COMPLETE
4564,0.5240157749561173,2024-04-11 17:08:11.073034,2024-04-11 17:08:12.409275,0 days 00:00:01.336241,95.35237187156837,7.961327292277975,sigmoid,20,,,,3.0,8.0,16.0,6.0,45.0,,,,,,,,COMPLETE
4565,0.5433659403271591,2024-04-11 17:08:12.411269,2024-04-11 17:08:13.724607,0 days 00:00:01.313338,96.90920961040698,7.817901218044227,sigmoid,2,,,,,,,,,1.8428238722838732,5.560426586071562,7.0408211361236015,14.0,44.0,53.0,,COMPLETE
4566,0.5134688440475603,2024-04-11 17:08:13.727663,2024-04-11 17:08:15.255172,0 days 00:00:01.527509,99.97851819178148,8.240977563275216,sigmoid,11,,25.0,30.0,,,,,,8.398436703867027,3.518567450856895,2.2000310527380496,10.0,38.0,70.0,113.0,COMPLETE
4567,0.5963245096172158,2024-04-11 17:08:15.258181,2024-04-11 17:08:16.299879,0 days 00:00:01.041698,98.27786433163973,8.565767573564443,sigmoid,8,,24.0,31.0,,,,,,,,,,,,,COMPLETE
4568,0.3993821712268314,2024-04-11 17:08:16.302881,2024-04-11 17:08:18.107117,0 days 00:00:01.804236,94.05307950131633,8.073388642474766,sigmoid,46,38.0,26.0,35.0,,,,18.0,41.0,8.921510532945714,9.162073666915472,8.21134493669013,20.0,42.0,68.0,,COMPLETE
4569,0.12622036262203626,2024-04-11 17:08:18.109139,2024-04-11 17:08:19.533595,0 days 00:00:01.424456,97.97593775029993,7.618608700217706,sigmoid,8,,22.0,29.0,,,,,,,,,,,,,COMPLETE
4570,0.410586011342155,2024-04-11 17:08:19.536125,2024-04-11 17:08:21.207953,0 days 00:00:01.671828,95.73938356361893,8.374687362430034,rbf,16,,,,7.0,2.0,85.0,,,,,,,,,,COMPLETE
4571,0.3053507903326365,2024-04-11 17:08:21.209951,2024-04-11 17:08:22.320912,0 days 00:00:01.110961,98.1477971148788,7.90310096143499,sigmoid,37,47.0,,,,,,3.0,10.0,,,,,,,53.0,COMPLETE
4572,0.6009432182607054,2024-04-11 17:08:22.323903,2024-04-11 17:08:23.310902,0 days 00:00:00.986999,98.16146090185333,8.155243383141073,sigmoid,8,,27.0,31.0,,,,,,,,,,,,,COMPLETE
4573,0.5929369437606513,2024-04-11 17:08:23.312908,2024-04-11 17:08:24.336634,0 days 00:00:01.023726,95.25176255525761,7.773266939727531,sigmoid,8,,25.0,33.0,,,,,,,,,,,,,COMPLETE
4574,0.32303482192432775,2024-04-11 17:08:24.338636,2024-04-11 17:08:25.422283,0 days 00:00:01.083647,96.58268399872964,7.41134780091096,sigmoid,48,24.0,,,1.0,4.0,92.0,,,,,,,,,,COMPLETE
4575,0.41237113402061853,2024-04-11 17:08:25.425264,2024-04-11 17:08:26.880560,0 days 00:00:01.455296,98.23175204897336,8.423997656993775,sigmoid,26,,26.0,30.0,5.0,1.0,81.0,,,7.137533963809656,7.8287693218988155,9.674848156506274,19.0,35.0,64.0,,COMPLETE
4576,0.5975287681569516,2024-04-11 17:08:26.882595,2024-04-11 17:08:27.806559,0 days 00:00:00.923964,92.58087324298837,9.293537707512566,sigmoid,8,,29.0,32.0,,,,,,,,,,,,,COMPLETE
4577,0.3074629119323544,2024-04-11 17:08:27.808562,2024-04-11 17:08:28.972831,0 days 00:00:01.164269,98.19133564496116,7.993177659078571,sigmoid,12,,24.0,33.0,,,,31.0,4.0,,,,,,,,COMPLETE
4578,0.42095326693663127,2024-04-11 17:08:28.974868,2024-04-11 17:08:30.151418,0 days 00:00:01.176550,96.58494481542711,8.231213043587825,sigmoid,56,50.0,23.0,30.0,6.0,7.0,5.0,,,,,,,,,,COMPLETE
4579,0.35219179088038766,2024-04-11 17:08:30.153981,2024-04-11 17:08:31.319663,0 days 00:00:01.165682,98.23739148537899,8.702072361789602,sigmoid,41,19.0,28.0,32.0,,,,,,,,,,,,134.0,COMPLETE
4580,0.4609507640067912,2024-04-11 17:08:31.322630,2024-04-11 17:08:32.599579,0 days 00:00:01.276949,41.18638256868671,7.822468094622685,sigmoid,52,42.0,,,8.0,5.0,22.0,36.0,24.0,,,,,,,,COMPLETE
4581,0.3885760540578588,2024-04-11 17:08:32.602132,2024-04-11 17:08:33.673391,0 days 00:00:01.071259,94.00427181330093,7.563720187946168,sigmoid,13,,25.0,29.0,,,,10.0,6.0,,,,,,,182.0,COMPLETE
4582,0.6009432182607054,2024-04-11 17:08:33.675390,2024-04-11 17:08:34.494693,0 days 00:00:00.819303,95.52063380148337,8.084134627642838,sigmoid,8,,24.0,31.0,,,,,,,,,,,,,COMPLETE
4583,0.4625690536424183,2024-04-11 17:08:34.496711,2024-04-11 17:08:36.220053,0 days 00:00:01.723342,73.3415440002687,8.409263242917167,sigmoid,59,33.0,26.0,28.0,4.0,3.0,66.0,,,9.534899522663885,8.04405405800389,2.924232117143176,17.0,50.0,83.0,63.0,COMPLETE
4584,0.3658987138824022,2024-04-11 17:08:36.222052,2024-04-11 17:08:37.207128,0 days 00:00:00.985076,96.56385380518206,7.934184940569086,sigmoid,44,28.0,27.0,31.0,,,,28.0,7.0,,,,,,,,COMPLETE
4585,0.4854218438599513,2024-04-11 17:08:37.209123,2024-04-11 17:08:38.383635,0 days 00:00:01.174512,99.94398942648877,8.231850738519242,sigmoid,60,12.0,24.0,30.0,3.0,6.0,38.0,35.0,49.0,,,,,,,,COMPLETE
4586,0.5952371952371952,2024-04-11 17:08:38.385630,2024-04-11 17:08:39.294376,0 days 00:00:00.908746,99.96428358393493,7.6991602059938185,sigmoid,8,,27.0,32.0,,,,,,,,,,,,,COMPLETE
4587,0.4991770828699791,2024-04-11 17:08:39.296341,2024-04-11 17:08:39.997194,0 days 00:00:00.700853,83.4428713287838,6.961000324230885,sigmoid,1,,,,,,,,,,,,,,,88.0,COMPLETE
4588,0.5025146212138453,2024-04-11 17:08:39.999187,2024-04-11 17:08:41.356468,0 days 00:00:01.357281,91.71562266222412,8.05512161262983,sigmoid,54,43.0,,,2.0,8.0,27.0,42.0,14.0,3.585429193195961,7.3958336389264785,7.603136715531665,6.0,33.0,85.0,,COMPLETE
4589,0.33174745544593065,2024-04-11 17:08:41.358501,2024-04-11 17:08:42.648315,0 days 00:00:01.289814,98.3950706057241,7.207315013153348,rbf,36,41.0,,,,,,49.0,38.0,,,,,,,,COMPLETE
4590,0.5182819383259912,2024-04-11 17:08:42.650322,2024-04-11 17:08:43.750050,0 days 00:00:01.099728,49.672001721549314,8.558673040693021,sigmoid,7,,,,,,,22.0,18.0,8.74735863418551,9.446333303741422,3.504050954208046,4.0,32.0,92.0,104.0,COMPLETE
4591,0.5906279643331437,2024-04-11 17:08:43.752044,2024-04-11 17:08:44.558689,0 days 00:00:00.806645,99.96482761863302,8.24131706975372,sigmoid,8,,25.0,34.0,,,,,,,,,,,,,COMPLETE
4592,0.4384588764563387,2024-04-11 17:08:44.560690,2024-04-11 17:08:45.983864,0 days 00:00:01.423174,99.94784511540468,7.897357531816739,sigmoid,55,11.0,,,7.0,7.0,58.0,21.0,20.0,3.2850027491591955,2.3293484503573114,5.168621636641574,8.0,36.0,58.0,156.0,COMPLETE
4593,0.461722028691335,2024-04-11 17:08:45.986882,2024-04-11 17:08:47.207054,0 days 00:00:01.220172,96.59492459905275,7.740473081893399,sigmoid,61,31.0,21.0,29.0,5.0,1.0,70.0,44.0,33.0,,,,,,,29.0,COMPLETE
4594,0.4312604241124613,2024-04-11 17:08:47.208560,2024-04-11 17:08:48.544942,0 days 00:00:01.336382,94.78552905478575,8.393046198867292,sigmoid,23,,,,1.0,3.0,45.0,20.0,11.0,4.722485324053334,1.2733864426608372,8.59356403183112,18.0,25.0,56.0,146.0,COMPLETE
4595,0.6009432182607054,2024-04-11 17:08:48.548938,2024-04-11 17:08:49.454897,0 days 00:00:00.905959,19.237947877456058,8.100091060720226,sigmoid,8,,23.0,31.0,,,,,,,,,,,,,COMPLETE
4596,0.5159144893111639,2024-04-11 17:08:49.456879,2024-04-11 17:08:50.551159,0 days 00:00:01.094280,98.16716532710066,7.92232505887397,sigmoid,40,4.0,28.0,33.0,,,,,,,,,,,,,COMPLETE
4597,0.5101966730017724,2024-04-11 17:08:50.553194,2024-04-11 17:08:51.421305,0 days 00:00:00.868111,96.60704398958036,7.503374856786959,sigmoid,32,46.0,,,,,,,,,,,,,,,COMPLETE
4598,0.5963643249384587,2024-04-11 17:08:51.423302,2024-04-11 17:08:52.248313,0 days 00:00:00.825011,99.98122944635631,8.245267656301596,sigmoid,8,,26.0,32.0,,,,,,,,,,,,,COMPLETE
4599,0.4463175905190851,2024-04-11 17:08:52.251312,2024-04-11 17:08:53.639144,0 days 00:00:01.387832,93.7987376066375,8.570832779165224,sigmoid,27,,25.0,30.0,6.0,5.0,31.0,,,2.7965436819242098,7.2500461359874135,1.7371980080718643,3.0,31.0,80.0,78.0,COMPLETE
4600,0.573797264063941,2024-04-11 17:08:53.642109,2024-04-11 17:08:54.425514,0 days 00:00:00.783405,98.23973337852505,8.075901263694933,sigmoid,4,,,,,,,34.0,16.0,,,,,,,,COMPLETE
4601,0.12622036262203626,2024-04-11 17:08:54.427515,2024-04-11 17:08:55.288109,0 days 00:00:00.860594,95.18489978489788,7.762191881123343,sigmoid,8,,26.0,29.0,,,,,,,,,,,,,COMPLETE
4602,0.19442330931387908,2024-04-11 17:08:55.290117,2024-04-11 17:08:56.307511,0 days 00:00:01.017394,98.09481574314607,8.342314429680007,sigmoid,34,36.0,,,,,,,,5.11059185114633,6.66584206898531,5.775839874064069,15.0,39.0,82.0,,COMPLETE
4603,0.37703424033328997,2024-04-11 17:08:56.309482,2024-04-11 17:08:57.276050,0 days 00:00:00.966568,99.99468521810338,8.845143875826903,sigmoid,5,,,,,,,46.0,31.0,,,,,,,46.0,COMPLETE
4604,0.37182333256022004,2024-04-11 17:08:57.279077,2024-04-11 17:08:58.630910,0 days 00:00:01.351833,99.98219839325645,7.964260350696101,sigmoid,51,17.0,,,4.0,4.0,19.0,,,6.909307230476363,6.219119033362615,0.9423289807656365,16.0,45.0,74.0,100.0,COMPLETE
4605,0.6009432182607054,2024-04-11 17:08:58.633911,2024-04-11 17:08:59.836508,0 days 00:00:01.202597,99.98137175617173,7.638513923004644,sigmoid,8,,24.0,31.0,,,,,,,,,,,,,COMPLETE
4606,0.5327841324403879,2024-04-11 17:08:59.838536,2024-04-11 17:09:00.958439,0 days 00:00:01.119903,96.59001057450315,5.049434811502811,sigmoid,33,23.0,,,,,,,,,,,,,,121.0,COMPLETE
4607,0.4467756865165073,2024-04-11 17:09:00.961441,2024-04-11 17:09:03.133265,0 days 00:00:02.171824,96.86376472454108,8.172114327267282,rbf,8,,22.0,33.0,,,,,,,,,,,,,COMPLETE
4608,0.4914909056859945,2024-04-11 17:09:03.135268,2024-04-11 17:09:04.228695,0 days 00:00:01.093427,93.8985279406228,8.491120721791082,sigmoid,45,30.0,25.0,30.0,,,,17.0,36.0,,,,,,,108.0,COMPLETE
4609,0.6009432182607054,2024-04-11 17:09:04.230694,2024-04-11 17:09:05.013142,0 days 00:00:00.782448,98.00720879193219,7.950107473303533,sigmoid,8,,27.0,31.0,,,,,,,,,,,,,COMPLETE
4610,0.40711246200607903,2024-04-11 17:09:05.015140,2024-04-11 17:09:06.219862,0 days 00:00:01.204722,95.34175595455783,7.393333206307904,sigmoid,19,,,,3.0,2.0,51.0,,,7.77672499512861,8.851904220150058,7.798164063262284,14.0,46.0,89.0,18.0,COMPLETE
4611,0.42771754239644155,2024-04-11 17:09:06.221859,2024-04-11 17:09:07.142040,0 days 00:00:00.920181,98.1856514074677,8.202638679667734,sigmoid,49,40.0,,,8.0,7.0,78.0,,,,,,,,,129.0,COMPLETE
4612,0.3539805105034225,2024-04-11 17:09:07.144039,2024-04-11 17:09:07.987420,0 days 00:00:00.843381,96.7346541614668,7.774428211417751,sigmoid,17,,,,2.0,6.0,41.0,,,,,,,,,140.0,COMPLETE
4613,0.3823576481131773,2024-04-11 17:09:07.989410,2024-04-11 17:09:09.271495,0 days 00:00:01.282085,99.94976549258209,8.34357178346013,sigmoid,30,,23.0,32.0,7.0,8.0,9.0,39.0,3.0,6.64083347353438,8.58977886090273,6.15751393505472,2.0,22.0,77.0,,COMPLETE
4614,0.4499860473375783,2024-04-11 17:09:09.273490,2024-04-11 17:09:10.527921,0 days 00:00:01.254431,98.27185590904537,8.049378763646622,sigmoid,58,8.0,29.0,27.0,1.0,4.0,55.0,,,3.8709797925503713,4.032732568976234,8.77758174923662,5.0,26.0,96.0,,COMPLETE
4615,0.4992938164805579,2024-04-11 17:09:10.529917,2024-04-11 17:09:11.621880,0 days 00:00:01.091963,99.96901020695483,7.817945415356875,sigmoid,18,,,,6.0,2.0,87.0,,,6.080968119864315,3.8124172173697426,2.025513507729614,11.0,37.0,99.0,,COMPLETE
4616,0.5963245096172158,2024-04-11 17:09:11.622877,2024-04-11 17:09:12.390130,0 days 00:00:00.767253,93.07155762846199,8.718542414818089,sigmoid,8,,26.0,31.0,,,,,,,,,,,,,COMPLETE
4617,0.43051123020413085,2024-04-11 17:09:12.392130,2024-04-11 17:09:13.392706,0 days 00:00:01.000576,95.34828490089562,7.605198700434509,sigmoid,53,6.0,,,4.0,1.0,94.0,27.0,23.0,,,,,,,67.0,COMPLETE
4618,0.12003789673140693,2024-04-11 17:09:13.393704,2024-04-11 17:09:14.224494,0 days 00:00:00.830790,96.81182489818343,8.150420539648621,sigmoid,8,,24.0,28.0,,,,,,,,,,,,,COMPLETE
4619,0.4839345185046203,2024-04-11 17:09:14.226496,2024-04-11 17:09:15.377648,0 days 00:00:01.151152,90.65919392346538,8.47509256425936,sigmoid,50,13.0,,,3.0,5.0,60.0,,,9.994324719884546,6.429768479092186,4.832304441310383,9.0,29.0,72.0,,COMPLETE
4620,0.4242873309263351,2024-04-11 17:09:15.380233,2024-04-11 17:09:16.353514,0 days 00:00:00.973281,98.24404673588252,7.93637967249661,sigmoid,25,,25.0,35.0,5.0,6.0,48.0,,,,,,,,,173.0,COMPLETE
4621,0.45345352376492626,2024-04-11 17:09:16.355062,2024-04-11 17:09:17.141592,0 days 00:00:00.786530,96.57646682510098,8.30351697209114,sigmoid,8,,27.0,30.0,,,,,,,,,,,,,COMPLETE
4622,0.4809136115444619,2024-04-11 17:09:17.143597,2024-04-11 17:09:18.274401,0 days 00:00:01.130804,95.28554907966195,8.100311032218391,sigmoid,29,,24.0,32.0,8.0,3.0,34.0,43.0,34.0,,,,,,,13.0,COMPLETE
4623,0.534507682141087,2024-04-11 17:09:18.276373,2024-04-11 17:09:19.274147,0 days 00:00:00.997774,98.1923851216286,7.5253145526293705,sigmoid,6,,,,,,,9.0,30.0,4.415964914587043,6.970637019466091,9.39745208858606,13.0,43.0,76.0,,COMPLETE
4624,0.44692656286311877,2024-04-11 17:09:19.276147,2024-04-11 17:09:20.511425,0 days 00:00:01.235278,99.95195273085889,7.901358097685318,sigmoid,47,35.0,28.0,29.0,,,,15.0,40.0,0.866565010096771,2.034066461992137,4.293994351659219,12.0,48.0,69.0,38.0,COMPLETE
4625,0.5942174967356836,2024-04-11 17:09:20.512973,2024-04-11 17:09:21.327362,0 days 00:00:00.814389,98.08351834340772,4.346773517649345,sigmoid,8,,26.0,31.0,,,,,,,,,,,,,COMPLETE
4626,0.2220749901845308,2024-04-11 17:09:21.329365,2024-04-11 17:09:22.784120,0 days 00:00:01.454755,92.55676185410225,8.361660293493268,rbf,22,,,,2.0,8.0,72.0,38.0,43.0,2.5332403465191593,4.756323793394442,0.5136271824849574,7.0,23.0,78.0,,COMPLETE
4627,0.4698075322004016,2024-04-11 17:09:22.785627,2024-04-11 17:09:23.962476,0 days 00:00:01.176849,96.68530406343474,7.719555116156644,sigmoid,43,44.0,23.0,33.0,,,,,,6.384512241956986,6.010800202642841,6.7959986330215925,20.0,34.0,66.0,117.0,COMPLETE
4628,0.38973433817324754,2024-04-11 17:09:23.964001,2024-04-11 17:09:25.081759,0 days 00:00:01.117758,98.10819040511021,9.014812600850233,sigmoid,39,26.0,,,,,,13.0,25.0,1.2323309837046752,1.5187207843751098,4.074886539052748,8.0,33.0,51.0,33.0,COMPLETE
4629,0.438338301043219,2024-04-11 17:09:25.083798,2024-04-11 17:09:26.035757,0 days 00:00:00.951959,94.23920054470945,8.103895185482518,sigmoid,24,,25.0,30.0,7.0,1.0,75.0,,,,,,,,,,COMPLETE
4630,0.5394151369026677,2024-04-11 17:09:26.037340,2024-04-11 17:09:27.012726,0 days 00:00:00.975386,99.99448533765644,8.612883488721405,sigmoid,21,,,,5.0,2.0,14.0,8.0,17.0,,,,,,,125.0,COMPLETE
4631,0.5975614331269932,2024-04-11 17:09:27.014722,2024-04-11 17:09:27.800258,0 days 00:00:00.785536,96.59584448659146,6.739801224257824,sigmoid,8,,26.0,32.0,,,,,,,,,,,,,COMPLETE
4632,0.2805657818252277,2024-04-11 17:09:27.802231,2024-04-11 17:09:28.878329,0 days 00:00:01.076098,98.25124294242346,7.8863041183983045,sigmoid,38,20.0,,,,,,31.0,8.0,8.195670587646745,3.113324325703671,2.49596110207806,3.0,47.0,61.0,,COMPLETE
4633,0.352003111629716,2024-04-11 17:09:28.879334,2024-04-11 17:09:29.877242,0 days 00:00:00.997908,10.353516942767428,8.232191571838248,sigmoid,35,5.0,,,,,,,,8.615348089440001,8.256976131738643,3.6930505374132716,10.0,40.0,93.0,59.0,COMPLETE
4634,0.5018948146778816,2024-04-11 17:09:29.879282,2024-04-11 17:09:31.262850,0 days 00:00:01.383568,95.19894312715383,8.056216416933573,sigmoid,31,,27.0,31.0,1.0,4.0,6.0,47.0,47.0,4.894115302792426,5.200688242619851,1.103793446412059,16.0,32.0,55.0,150.0,COMPLETE
4635,0.5092876424028915,2024-04-11 17:09:31.263855,2024-04-11 17:09:32.461610,0 days 00:00:01.197755,99.99969199652598,7.360221039980628,sigmoid,15,,24.0,29.0,,,,50.0,32.0,7.52605633699167,3.3598376567050012,4.550946630813838,4.0,28.0,73.0,190.0,COMPLETE
4636,0.33304623575930786,2024-04-11 17:09:32.463617,2024-04-11 17:09:33.362256,0 days 00:00:00.898639,98.12186607040142,8.461516518788951,sigmoid,3,,,,,,,,,1.6151722012910081,4.370012500375268,8.319308202878352,18.0,41.0,81.0,71.0,COMPLETE
4637,0.5917506177532789,2024-04-11 17:09:33.364249,2024-04-11 17:09:34.133892,0 days 00:00:00.769643,96.54011194824186,9.48615454611331,sigmoid,8,,25.0,34.0,,,,,,,,,,,,,COMPLETE
4638,0.5929369437606513,2024-04-11 17:09:34.134894,2024-04-11 17:09:34.918339,0 days 00:00:00.783445,98.27047656211178,7.737712531236806,sigmoid,8,,22.0,33.0,,,,,,,,,,,,,COMPLETE
4639,0.46746571048870394,2024-04-11 17:09:34.920342,2024-04-11 17:09:35.985421,0 days 00:00:01.065079,94.23600449145142,8.229494232422534,sigmoid,57,15.0,26.0,31.0,6.0,7.0,24.0,,,,,,,,,91.0,COMPLETE
4640,0.44701971028259324,2024-04-11 17:09:35.987425,2024-04-11 17:09:36.771966,0 days 00:00:00.784541,99.9403731865305,7.9352565145283505,sigmoid,8,,28.0,30.0,,,,,,,,,,,,,COMPLETE
4641,0.3629511824090721,2024-04-11 17:09:36.773959,2024-04-11 17:09:37.849881,0 days 00:00:01.075922,96.6358521656645,8.339009937206901,sigmoid,42,29.0,23.0,28.0,,,,,,5.606722702561077,2.797632776052663,1.3603194584925995,7.0,49.0,67.0,,COMPLETE
4642,0.3912927794592077,2024-04-11 17:09:37.851420,2024-04-11 17:09:38.946466,0 days 00:00:01.095046,98.18129651588265,7.559884677684988,sigmoid,14,,25.0,32.0,,,,7.0,11.0,7.979680192151923,1.0631381312083468,3.87914627221825,6.0,30.0,50.0,,COMPLETE
4643,0.4000448444857298,2024-04-11 17:09:38.949004,2024-04-11 17:09:39.718817,0 days 00:00:00.769813,99.98480936152419,8.054312022131732,sigmoid,16,,,,4.0,7.0,62.0,,,,,,,,,,COMPLETE
4644,0.4448341684562156,2024-04-11 17:09:39.722357,2024-04-11 17:09:40.494945,0 days 00:00:00.772588,92.08866190207618,8.621444316988484,sigmoid,8,,27.0,30.0,,,,,,,,,,,,,COMPLETE
4645,0.15491894069076628,2024-04-11 17:09:40.496945,2024-04-11 17:09:41.908150,0 days 00:00:01.411205,99.96087357811246,7.806813606656058,rbf,46,37.0,24.0,32.0,,,,26.0,19.0,4.144222517507483,5.479581345283835,9.105993998209845,15.0,21.0,88.0,,COMPLETE
4646,0.4772029122221415,2024-04-11 17:09:41.910144,2024-04-11 17:09:42.931346,0 days 00:00:01.021202,95.28186652021175,8.158599615569617,sigmoid,28,,20.0,31.0,8.0,5.0,37.0,41.0,26.0,,,,,,,,COMPLETE
4647,0.31645762067654876,2024-04-11 17:09:42.933361,2024-04-11 17:09:43.794528,0 days 00:00:00.861167,96.70562472387189,8.425761407086704,sigmoid,9,,25.0,33.0,,,,,,,,,,,,24.0,COMPLETE
4648,0.44701971028259324,2024-04-11 17:09:43.796568,2024-04-11 17:09:44.587723,0 days 00:00:00.791155,98.19811628093845,7.972725045672763,sigmoid,8,,26.0,30.0,,,,,,,,,,,,,COMPLETE
4649,0.12622036262203626,2024-04-11 17:09:44.589729,2024-04-11 17:09:45.379046,0 days 00:00:00.789317,44.39034138976999,8.27571015419209,sigmoid,8,,24.0,29.0,,,,,,,,,,,,,COMPLETE
4650,0.5126106638717303,2024-04-11 17:09:45.380986,2024-04-11 17:09:46.266615,0 days 00:00:00.885629,94.08401499153749,7.629406048784267,sigmoid,41,48.0,28.0,32.0,,,,,,,,,,,,81.0,COMPLETE
4651,0.5964036904537752,2024-04-11 17:09:46.268617,2024-04-11 17:09:47.043426,0 days 00:00:00.774809,96.45733382431482,7.250513756723542,sigmoid,8,,23.0,31.0,,,,,,,,,,,,,COMPLETE
4652,0.5651056014692378,2024-04-11 17:09:47.046011,2024-04-11 17:09:47.986727,0 days 00:00:00.940716,98.16314852261036,7.802619469304834,sigmoid,2,,,,,,,,,4.457723744527728,7.568227568135875,3.2240541784259964,5.0,26.0,62.0,,COMPLETE
4653,0.44701971028259324,2024-04-11 17:09:47.989697,2024-04-11 17:09:48.759633,0 days 00:00:00.769936,95.15761652822906,8.068917605284666,sigmoid,8,,26.0,30.0,,,,,,,,,,,,,COMPLETE
4654,0.35846654406563866,2024-04-11 17:09:48.761644,2024-04-11 17:09:49.843577,0 days 00:00:01.081933,98.1602676151491,8.830340262800084,sigmoid,11,,48.0,34.0,,,,,,9.66108498190669,1.7167241558967827,2.807914469184014,11.0,25.0,64.0,144.0,COMPLETE
4655,0.35046646717127267,2024-04-11 17:09:49.845579,2024-04-11 17:09:50.864475,0 days 00:00:01.018896,96.58183204967968,8.485279632875054,sigmoid,10,,25.0,32.0,,,,,,7.086199293119789,4.98481135953902,6.541407062932903,17.0,47.0,60.0,,COMPLETE
4656,0.4598235948962407,2024-04-11 17:09:50.866447,2024-04-11 17:09:52.261313,0 days 00:00:01.394866,93.28980347567312,8.216424552589347,sigmoid,63,10.0,27.0,29.0,3.0,8.0,98.0,29.0,22.0,1.0226581445894123,5.809793450059377,5.637794286242124,19.0,24.0,86.0,97.0,COMPLETE
4657,0.5383772420271055,2024-04-11 17:09:52.263314,2024-04-11 17:09:53.138446,0 days 00:00:00.875132,60.940091556361736,7.825898733580364,sigmoid,37,2.0,,,,,,33.0,46.0,,,,,,,193.0,COMPLETE
4658,0.45830036398164276,2024-04-11 17:09:53.140962,2024-04-11 17:09:54.496350,0 days 00:00:01.355388,98.14381944317206,7.498604803517346,sigmoid,62,49.0,30.0,31.0,5.0,6.0,89.0,38.0,15.0,3.036985293468267,0.7977201414392878,5.339966790233638,13.0,44.0,84.0,,COMPLETE
4659,0.5929369437606513,2024-04-11 17:09:54.498353,2024-04-11 17:09:55.277799,0 days 00:00:00.779446,98.12793916832884,7.984401261190462,sigmoid,8,,21.0,33.0,,,,,,,,,,,,,COMPLETE
4660,0.47127902651575543,2024-04-11 17:09:55.279799,2024-04-11 17:09:56.240969,0 days 00:00:00.961170,95.254405372799,8.212084075867235,sigmoid,52,27.0,,,2.0,4.0,57.0,32.0,5.0,,,,,,,,COMPLETE
4661,0.5026075177785303,2024-04-11 17:09:56.242969,2024-04-11 17:09:57.120035,0 days 00:00:00.877066,96.5540998590274,8.679393437356145,sigmoid,48,33.0,,,7.0,3.0,80.0,,,,,,,,,,COMPLETE
4662,0.6009432182607054,2024-04-11 17:09:57.121052,2024-04-11 17:09:57.897607,0 days 00:00:00.776555,89.79582062336341,7.711859367288916,sigmoid,8,,25.0,31.0,,,,,,,,,,,,,COMPLETE
4663,0.4502698896972542,2024-04-11 17:09:57.899608,2024-04-11 17:09:58.677299,0 days 00:00:00.777691,98.19202005936381,5.450408669462898,sigmoid,8,,29.0,30.0,,,,,,,,,,,,,COMPLETE
