number,value,datetime_start,datetime_complete,duration,params_C,params_gamma,params_kernel,params_mask_number,params_rsi_window,params_so_smooth,params_so_window,params_srsi_smooth1,params_srsi_smooth2,params_srsi_window,params_tsi_window_fast,params_tsi_window_slow,params_ult_weight_1,params_ult_weight_2,params_ult_weight_3,params_ult_window_1,params_ult_window_2,params_ult_window_3,params_williams_lbp,state
9291,0.45345352376492626,2024-04-11 19:26:26.300864,2024-04-11 19:26:28.228262,0 days 00:00:01.927398,99.94784151641714,8.37959085093532,sigmoid,8,,26.0,30.0,,,,,,,,,,,,,COMPLETE
9292,0.3746919462425657,2024-04-11 19:26:28.228262,2024-04-11 19:26:30.717209,0 days 00:00:02.488947,99.97212645703983,7.095684657763222,sigmoid,25,,28.0,32.0,1.0,1.0,2.0,,,,,,,,,79.0,COMPLETE
9293,0.4548589760727176,2024-04-11 19:26:30.717209,2024-04-11 19:26:33.948140,0 days 00:00:03.230931,96.65732446376568,7.857674380362991,sigmoid,47,13.0,24.0,31.0,,,,22.0,3.0,3.5066840267597037,6.43728614299345,9.996915152825576,16.0,39.0,64.0,61.0,COMPLETE
9294,0.44701971028259324,2024-04-11 19:26:33.963169,2024-04-11 19:26:36.161471,0 days 00:00:02.198302,93.9605061263746,8.124355492076786,sigmoid,8,,27.0,30.0,,,,,,,,,,,,,COMPLETE
9295,0.3807168642164805,2024-04-11 19:26:36.182792,2024-04-11 19:26:40.246709,0 days 00:00:04.063917,96.7050854114141,8.529357103938834,sigmoid,22,,,,6.0,6.0,19.0,47.0,26.0,5.054594135631576,1.1703947530630643,3.252731220079488,14.0,21.0,92.0,,COMPLETE
9296,0.5929369437606513,2024-04-11 19:26:40.251702,2024-04-11 19:26:42.343502,0 days 00:00:02.091800,99.97941162051694,7.636572635230547,sigmoid,8,,25.0,33.0,,,,,,,,,,,,,COMPLETE
9297,0.4151994518425835,2024-04-11 19:26:42.349129,2024-04-11 19:26:45.406513,0 days 00:00:03.057384,98.202518032547,7.38702916120502,sigmoid,43,9.0,22.0,31.0,,,,,,6.221587245853169,9.993626227452149,4.851549804855825,7.0,20.0,55.0,13.0,COMPLETE
9298,0.36530571731074646,2024-04-11 19:26:45.410101,2024-04-11 19:26:48.089604,0 days 00:00:02.679503,99.9867505634092,8.288588005029402,sigmoid,39,5.0,,,,,,46.0,24.0,6.647514673553513,9.6612039164761,5.896833424126228,9.0,26.0,53.0,32.0,COMPLETE
9299,0.44831393613846615,2024-04-11 19:26:48.095475,2024-04-11 19:26:50.686639,0 days 00:00:02.591164,95.347057887071,7.994266233928107,rbf,8,,26.0,32.0,,,,,,,,,,,,,COMPLETE
9300,0.500680021207441,2024-04-11 19:26:50.696378,2024-04-11 19:26:53.105898,0 days 00:00:02.409520,91.56325309718679,3.4756786073143484,sigmoid,35,18.0,,,,,,,,6.990438043459759,3.714592408896922,2.6334787114751617,3.0,23.0,99.0,19.0,COMPLETE
9301,0.12622036262203626,2024-04-11 19:26:53.105898,2024-04-11 19:26:55.007169,0 days 00:00:01.901271,98.09411714664509,7.787423554348945,sigmoid,8,,24.0,29.0,,,,,,,,,,,,,COMPLETE
9302,0.36572025779480927,2024-04-11 19:26:55.024024,2024-04-11 19:26:57.295317,0 days 00:00:02.271293,42.61819695767415,8.174784382602764,sigmoid,24,,30.0,29.0,5.0,4.0,31.0,,,,,,,,,,COMPLETE
9303,0.3751420739453099,2024-04-11 19:26:57.295317,2024-04-11 19:27:00.105436,0 days 00:00:02.810119,95.45949988454663,8.546252604363325,sigmoid,15,,29.0,34.0,,,,26.0,23.0,1.47236766227268,8.53662640989063,3.7604321558103218,4.0,37.0,71.0,161.0,COMPLETE
9304,0.3369491282712205,2024-04-11 19:27:00.105436,2024-04-11 19:27:02.386803,0 days 00:00:02.281367,99.98145453785713,2.8582274705654136,sigmoid,21,,,,2.0,2.0,49.0,23.0,27.0,,,,,,,197.0,COMPLETE
9305,0.5997714721005524,2024-04-11 19:27:02.404455,2024-04-11 19:27:04.384725,0 days 00:00:01.980270,96.74589118410096,8.78703177573129,sigmoid,8,,27.0,31.0,,,,,,,,,,,,,COMPLETE
9306,0.518546441495778,2024-04-11 19:27:04.387941,2024-04-11 19:27:06.833192,0 days 00:00:02.445251,93.91172450836257,8.044771757142666,sigmoid,3,,,,,,,,,5.428065140509277,3.352198065101792,2.814494229077256,13.0,29.0,62.0,75.0,COMPLETE
9307,0.2984090347044761,2024-04-11 19:27:06.833192,2024-04-11 19:27:09.441742,0 days 00:00:02.608550,98.02222158783547,8.336996251157437,sigmoid,38,6.0,,,,,,42.0,30.0,8.722571636097461,2.1420943964758647,6.765337735530876,12.0,49.0,94.0,,COMPLETE
9308,0.5636462904171639,2024-04-11 19:27:09.444738,2024-04-11 19:27:10.824808,0 days 00:00:01.380070,98.21958038109902,7.828016964649551,sigmoid,0,,,,,,,,,,,,,,,,COMPLETE
9309,0.44701971028259324,2024-04-11 19:27:10.827808,2024-04-11 19:27:12.520795,0 days 00:00:01.692987,98.13972429655307,8.184773442765625,sigmoid,8,,18.0,30.0,,,,,,,,,,,,,COMPLETE
9310,0.5393185645809042,2024-04-11 19:27:12.526849,2024-04-11 19:27:14.223002,0 days 00:00:01.696153,95.32410518601837,7.590626276072291,sigmoid,9,,26.0,32.0,,,,,,,,,,,,175.0,COMPLETE
9311,0.3406363184432924,2024-04-11 19:27:14.225530,2024-04-11 19:27:17.078872,0 days 00:00:02.853342,96.6524877211101,5.237780964807421,sigmoid,42,29.0,23.0,33.0,,,,,,7.709858799297379,5.721925623254906,0.8049807160567344,6.0,42.0,87.0,,COMPLETE
9312,0.45347172512526845,2024-04-11 19:27:17.078872,2024-04-11 19:27:18.902599,0 days 00:00:01.823727,98.234915029729,7.922206109048762,sigmoid,8,,25.0,28.0,,,,,,,,,,,,,COMPLETE
9313,0.4099474542489581,2024-04-11 19:27:18.902599,2024-04-11 19:27:22.647248,0 days 00:00:03.744649,93.35545988110763,8.42828050800606,sigmoid,31,,24.0,31.0,8.0,5.0,15.0,2.0,6.0,2.6940269431650297,1.6947519785799896,9.228598399959683,18.0,41.0,50.0,166.0,COMPLETE
9314,0.48317967224460545,2024-04-11 19:27:22.649155,2024-04-11 19:27:26.086467,0 days 00:00:03.437312,99.94637861148368,8.090432953786928,sigmoid,63,40.0,25.0,30.0,4.0,8.0,26.0,49.0,14.0,5.6710761702321255,6.985408394999383,9.828156055859885,20.0,35.0,75.0,136.0,COMPLETE
9315,0.4493353264641504,2024-04-11 19:27:26.086467,2024-04-11 19:27:28.565211,0 days 00:00:02.478744,96.68471422057102,7.805741386859767,sigmoid,28,,28.0,32.0,7.0,1.0,8.0,39.0,49.0,,,,,,,,COMPLETE
9316,0.45345352376492626,2024-04-11 19:27:28.565211,2024-04-11 19:27:30.365707,0 days 00:00:01.800496,98.06509228036714,8.236053495863498,sigmoid,8,,22.0,30.0,,,,,,,,,,,,,COMPLETE
9317,0.46809568806883173,2024-04-11 19:27:30.365707,2024-04-11 19:27:32.797123,0 days 00:00:02.431416,95.68755900608842,7.667445102340042,sigmoid,57,26.0,26.0,31.0,6.0,4.0,87.0,,,,,,,,,108.0,COMPLETE
9318,0.4396761133603239,2024-04-11 19:27:32.797123,2024-04-11 19:27:35.021153,0 days 00:00:02.224030,22.50220373090911,8.625668272922201,rbf,8,,25.0,33.0,,,,,,,,,,,,,COMPLETE
9319,0.4727024001989803,2024-04-11 19:27:35.036779,2024-04-11 19:27:37.946515,0 days 00:00:02.909736,98.27468594432798,7.986949793537889,sigmoid,14,,26.0,29.0,,,,37.0,11.0,1.1051282393765858,9.368298973649043,8.795713882114237,8.0,25.0,65.0,,COMPLETE
9320,0.31543404857858626,2024-04-11 19:27:37.946515,2024-04-11 19:27:39.990348,0 days 00:00:02.043833,95.43873534052354,8.37519349504518,sigmoid,2,,,,,,,,,2.189019589219699,2.3293028717325566,4.071910796491566,7.0,28.0,73.0,,COMPLETE
9321,0.3080912041801916,2024-04-11 19:27:39.990348,2024-04-11 19:27:42.167834,0 days 00:00:02.177486,91.8210362421257,7.48234683202994,sigmoid,10,,23.0,32.0,,,,,,3.7174396257558553,7.70690402685975,4.38519568576146,16.0,46.0,96.0,,COMPLETE
9322,0.4193750391383305,2024-04-11 19:27:42.167834,2024-04-11 19:27:43.960265,0 days 00:00:01.792431,99.96401400055761,8.107483043588307,sigmoid,16,,,,1.0,3.0,56.0,,,,,,,,,,COMPLETE
9323,0.4384641087041265,2024-04-11 19:27:43.962264,2024-04-11 19:27:46.917657,0 days 00:00:02.955393,98.18390221538192,7.916298312391632,sigmoid,26,,27.0,30.0,4.0,7.0,83.0,,,9.563350984237617,4.5775788606933,1.8084616087561134,15.0,47.0,78.0,,COMPLETE
9324,0.5986580986580987,2024-04-11 19:27:46.917657,2024-04-11 19:27:48.500336,0 days 00:00:01.582679,99.97589631664118,8.246758479769065,sigmoid,8,,13.0,31.0,,,,,,,,,,,,,COMPLETE
9325,0.3660327822323139,2024-04-11 19:27:48.500336,2024-04-11 19:27:51.024842,0 days 00:00:02.524506,99.99746675727808,7.75389419259,sigmoid,46,50.0,24.0,34.0,,,,29.0,17.0,4.779622775726484,2.85027976100671,1.03609778296902,2.0,33.0,58.0,,COMPLETE
9326,0.5975287681569516,2024-04-11 19:27:51.024842,2024-04-11 19:27:52.874410,0 days 00:00:01.849568,99.97254943680237,8.858425376263797,sigmoid,8,,25.0,32.0,,,,,,,,,,,,,COMPLETE
9327,0.46240707150703836,2024-04-11 19:27:52.874410,2024-04-11 19:27:56.160965,0 days 00:00:03.286555,93.8659330108752,7.3231052973689605,sigmoid,62,20.0,28.0,29.0,3.0,2.0,36.0,5.0,39.0,8.988709158866607,8.411677367165606,2.372998452204281,19.0,45.0,60.0,,COMPLETE
9328,0.3306284469736888,2024-04-11 19:27:56.163756,2024-04-11 19:27:57.954607,0 days 00:00:01.790851,96.34503865591309,8.030687875287668,sigmoid,41,32.0,24.0,31.0,,,,,,,,,,,,51.0,COMPLETE
9329,0.5079050030798713,2024-04-11 19:27:57.954607,2024-04-11 19:28:00.147673,0 days 00:00:02.193066,99.95786605833936,8.437519164847195,sigmoid,11,,27.0,32.0,,,,,,2.9551116097847885,2.5341949499678047,1.5297231803521503,11.0,31.0,70.0,200.0,COMPLETE
9330,0.45345352376492626,2024-04-11 19:28:00.147673,2024-04-11 19:28:01.934555,0 days 00:00:01.786882,99.99630327741963,8.250822444487298,sigmoid,8,,25.0,30.0,,,,,,,,,,,,,COMPLETE
9331,0.495115279406018,2024-04-11 19:28:01.937553,2024-04-11 19:28:03.859242,0 days 00:00:01.921689,96.73067598955461,7.884769075876981,sigmoid,37,47.0,,,,,,30.0,46.0,,,,,,,90.0,COMPLETE
9332,0.5069140556625241,2024-04-11 19:28:03.874856,2024-04-11 19:28:05.490073,0 days 00:00:01.615217,96.71990308338147,8.591525739162496,sigmoid,8,,23.0,35.0,,,,,,,,,,,,,COMPLETE
9333,0.4733573063092514,2024-04-11 19:28:05.490073,2024-04-11 19:28:07.574669,0 days 00:00:02.084596,94.17412510397784,8.11014614359741,sigmoid,52,16.0,,,5.0,7.0,6.0,12.0,43.0,,,,,,,,COMPLETE
9334,0.45347172512526845,2024-04-11 19:28:07.577563,2024-04-11 19:28:09.322075,0 days 00:00:01.744512,96.54740512936544,7.542555687961972,sigmoid,8,,26.0,28.0,,,,,,,,,,,,,COMPLETE
9335,0.45507415684681024,2024-04-11 19:28:09.324357,2024-04-11 19:28:11.638663,0 days 00:00:02.314306,95.0184662929541,7.845133807355079,sigmoid,56,30.0,27.0,31.0,8.0,5.0,71.0,,,,,,,,,,COMPLETE
9336,0.46968860424028264,2024-04-11 19:28:11.638663,2024-04-11 19:28:13.808711,0 days 00:00:02.170048,98.10510697149756,8.326085387364206,sigmoid,20,,,,6.0,6.0,39.0,33.0,13.0,,,,,,,,COMPLETE
9337,0.44540141494924634,2024-04-11 19:28:13.808711,2024-04-11 19:28:16.071911,0 days 00:00:02.263200,99.96639083734398,8.051476853732911,rbf,8,,23.0,33.0,,,,,,,,,,,,,COMPLETE
9338,0.5085820082770638,2024-04-11 19:28:16.071911,2024-04-11 19:28:18.113477,0 days 00:00:02.041566,98.20601590817404,7.712664611896449,sigmoid,12,,20.0,30.0,,,,4.0,37.0,,,,,,,,COMPLETE
9339,0.347263403913908,2024-04-11 19:28:18.117478,2024-04-11 19:28:20.312354,0 days 00:00:02.194876,98.27782060581417,8.45189463779216,sigmoid,44,17.0,24.0,31.0,,,,8.0,47.0,,,,,,,,COMPLETE
9340,0.49053929734702506,2024-04-11 19:28:20.312354,2024-04-11 19:28:23.361801,0 days 00:00:03.049447,79.8503598053395,8.240211067640418,sigmoid,59,38.0,26.0,29.0,3.0,6.0,62.0,,,3.9717730736553407,5.367933446391818,5.0015725836963085,9.0,26.0,84.0,120.0,COMPLETE
9341,0.4828181390240075,2024-04-11 19:28:23.361801,2024-04-11 19:28:26.130080,0 days 00:00:02.768279,68.86967347827928,8.004398726972985,sigmoid,55,44.0,,,7.0,4.0,59.0,25.0,2.0,7.896602559685468,6.704470597572777,5.371737854069627,3.0,40.0,86.0,41.0,COMPLETE
9342,0.35145631067961164,2024-04-11 19:28:26.145701,2024-04-11 19:28:28.556820,0 days 00:00:02.411119,89.27716715186308,7.69981255787149,sigmoid,13,,25.0,27.0,,,,14.0,28.0,,,,,,,26.0,COMPLETE
9343,0.49026073439008877,2024-04-11 19:28:28.556820,2024-04-11 19:28:30.467403,0 days 00:00:01.910583,96.67005758820147,8.18667724588489,sigmoid,48,22.0,,,2.0,3.0,68.0,,,,,,,,,,COMPLETE
9344,0.5929369437606513,2024-04-11 19:28:30.467403,2024-04-11 19:28:32.422532,0 days 00:00:01.955129,4.4292476235561296,6.473443218897473,sigmoid,8,,27.0,33.0,,,,,,,,,,,,,COMPLETE
9345,0.48764358666634,2024-04-11 19:28:32.422532,2024-04-11 19:28:34.881320,0 days 00:00:02.458788,98.13311463278761,7.899584257183215,sigmoid,60,25.0,24.0,32.0,4.0,8.0,23.0,32.0,10.0,,,,,,,,COMPLETE
9346,0.46093814178920567,2024-04-11 19:28:34.884067,2024-04-11 19:28:38.018348,0 days 00:00:03.134281,92.62204826162045,6.131443827016925,sigmoid,54,10.0,,,1.0,1.0,65.0,34.0,22.0,9.189165108153372,4.904479446475721,7.112051321503855,20.0,50.0,83.0,,COMPLETE
9347,0.5168497689423664,2024-04-11 19:28:38.018348,2024-04-11 19:28:40.095544,0 days 00:00:02.077196,95.09494328534143,8.669079837841252,sigmoid,7,,,,,,,41.0,7.0,7.441019896660435,4.319339338876615,6.0603533998051775,5.0,21.0,68.0,144.0,COMPLETE
9348,0.458563224862065,2024-04-11 19:28:40.102593,2024-04-11 19:28:41.811215,0 days 00:00:01.708622,96.66233746212944,8.445987753659045,sigmoid,36,35.0,,,,,,45.0,31.0,,,,,,,,COMPLETE
9349,0.44701971028259324,2024-04-11 19:28:41.811215,2024-04-11 19:28:43.378309,0 days 00:00:01.567094,98.28190497272122,7.587096485327525,sigmoid,8,,26.0,30.0,,,,,,,,,,,,,COMPLETE
9350,0.5462328064052556,2024-04-11 19:28:43.378309,2024-04-11 19:28:45.416023,0 days 00:00:02.037714,98.20503248890282,8.137464271262148,sigmoid,40,28.0,29.0,25.0,,,,,,,,,,,,,COMPLETE
9351,0.47361535106846925,2024-04-11 19:28:45.416023,2024-04-11 19:28:48.441599,0 days 00:00:03.025576,93.95790329029356,7.36502646882689,sigmoid,23,,,,5.0,5.0,76.0,17.0,33.0,5.884005634341415,7.471680782541375,6.345343122632578,13.0,38.0,67.0,129.0,COMPLETE
9352,0.6009432182607054,2024-04-11 19:28:48.441599,2024-04-11 19:28:50.384290,0 days 00:00:01.942691,98.16325606798713,7.916217019710856,sigmoid,8,,22.0,31.0,,,,,,,,,,,,,COMPLETE
9353,0.4686779902601259,2024-04-11 19:28:50.384290,2024-04-11 19:28:52.548183,0 days 00:00:02.163893,95.47668681854135,8.29958340383788,sigmoid,61,39.0,25.0,32.0,8.0,2.0,34.0,19.0,4.0,,,,,,,158.0,COMPLETE
9354,0.5536169981720449,2024-04-11 19:28:52.548183,2024-04-11 19:28:53.974677,0 days 00:00:01.426494,96.93924474645978,8.055615198061036,sigmoid,32,3.0,,,,,,,,,,,,,,,COMPLETE
9355,0.5929369437606513,2024-04-11 19:28:53.974677,2024-04-11 19:28:55.541344,0 days 00:00:01.566667,98.14770694660912,7.764031870522524,sigmoid,8,,27.0,33.0,,,,,,,,,,,,,COMPLETE
9356,0.5415327389977156,2024-04-11 19:28:55.557025,2024-04-11 19:28:57.109163,0 days 00:00:01.552138,98.17217894759136,8.47255880512455,sigmoid,1,,,,,,,,,,,,,,,55.0,COMPLETE
9357,0.3409561843047131,2024-04-11 19:28:57.109163,2024-04-11 19:28:59.601263,0 days 00:00:02.492100,92.78054265620095,8.978226031174955,rbf,34,48.0,,,,,,,,1.9419870568774185,6.3431465507247875,7.447157171281738,14.0,22.0,81.0,,COMPLETE
9358,0.40675521567049044,2024-04-11 19:28:59.601263,2024-04-11 19:29:02.148175,0 days 00:00:02.546912,95.37000298735796,8.197940273044273,sigmoid,27,,25.0,29.0,6.0,4.0,11.0,,,8.168186275767527,1.4508881612336806,3.6178970390625413,17.0,34.0,89.0,184.0,COMPLETE
9359,0.44701971028259324,2024-04-11 19:29:02.148175,2024-04-11 19:29:03.583140,0 days 00:00:01.434965,98.20565841835368,7.982713381364525,sigmoid,8,,28.0,30.0,,,,,,,,,,,,,COMPLETE
9360,0.5986580986580987,2024-04-11 19:29:03.598708,2024-04-11 19:29:05.087204,0 days 00:00:01.488496,8.422362925313635,7.720898615091352,sigmoid,8,,23.0,31.0,,,,,,,,,,,,,COMPLETE
9361,0.31242448303241616,2024-04-11 19:29:05.087204,2024-04-11 19:29:06.560803,0 days 00:00:01.473599,99.96655621286736,7.131937799688296,sigmoid,4,,,,,,,48.0,9.0,,,,,,,,COMPLETE
9362,0.44757194717735577,2024-04-11 19:29:06.560803,2024-04-11 19:29:09.163340,0 days 00:00:02.602537,96.29851077568641,8.298795178520356,sigmoid,51,8.0,,,3.0,3.0,95.0,,,1.77800396569104,5.148261527090778,5.7652744860810055,10.0,24.0,77.0,85.0,COMPLETE
9363,0.4202875500986067,2024-04-11 19:29:09.163340,2024-04-11 19:29:11.013003,0 days 00:00:01.849663,99.98848425443128,3.235904394102773,sigmoid,5,,,,,,,20.0,34.0,,,,,,,112.0,COMPLETE
9364,0.5952371952371952,2024-04-11 19:29:11.028624,2024-04-11 19:29:12.703761,0 days 00:00:01.675137,34.37169305794654,7.868781766344849,sigmoid,8,,10.0,32.0,,,,,,,,,,,,,COMPLETE
9365,0.4657064298867392,2024-04-11 19:29:12.703761,2024-04-11 19:29:15.683980,0 days 00:00:02.980219,99.95572861915247,7.461610794419166,sigmoid,30,,26.0,34.0,2.0,7.0,43.0,3.0,25.0,4.433256053487863,3.151688691425487,3.8518798067308335,12.0,39.0,57.0,,COMPLETE
9366,0.34007804596039887,2024-04-11 19:29:15.699858,2024-04-11 19:29:17.768111,0 days 00:00:02.068253,94.28048129901963,8.677430239998191,sigmoid,53,41.0,,,7.0,8.0,21.0,15.0,16.0,,,,,,,155.0,COMPLETE
9367,0.12003789673140693,2024-04-11 19:29:17.768111,2024-04-11 19:29:19.271240,0 days 00:00:01.503129,96.78276576764534,8.095250371556613,sigmoid,8,,24.0,28.0,,,,,,,,,,,,,COMPLETE
9368,0.5113105456441904,2024-04-11 19:29:19.271240,2024-04-11 19:29:21.766686,0 days 00:00:02.495446,99.96921577950617,8.380330400883414,sigmoid,19,,,,1.0,6.0,51.0,,,2.408010199367438,0.8425320443466031,8.21733470812358,6.0,32.0,92.0,123.0,COMPLETE
9369,0.6009432182607054,2024-04-11 19:29:21.766686,2024-04-11 19:29:23.645489,0 days 00:00:01.878803,98.1394843864043,7.992329592907447,sigmoid,8,,25.0,31.0,,,,,,,,,,,,,COMPLETE
9370,0.3588132517975942,2024-04-11 19:29:23.645489,2024-04-11 19:29:25.935350,0 days 00:00:02.289861,95.8041440442849,7.619880457855076,sigmoid,17,,,,5.0,1.0,47.0,,,,,,,,,95.0,COMPLETE
9371,0.28375200627076264,2024-04-11 19:29:25.935350,2024-04-11 19:29:27.506995,0 days 00:00:01.571645,98.24801989693924,8.2127691552975,sigmoid,33,13.0,,,,,,,,,,,,,,37.0,COMPLETE
9372,0.503183956660172,2024-04-11 19:29:27.506995,2024-04-11 19:29:29.491943,0 days 00:00:01.984948,99.9664614887724,8.527651911794337,sigmoid,18,,,,4.0,2.0,30.0,,,1.1985737911373988,5.537815460657253,1.2653454621839129,15.0,30.0,55.0,,COMPLETE
9373,0.2502618678510076,2024-04-11 19:29:29.491943,2024-04-11 19:29:31.671001,0 days 00:00:02.179058,92.01035205436887,7.894446694046778,sigmoid,6,,,,,,,10.0,45.0,9.708773472859754,7.199422580976584,4.528456786161565,4.0,49.0,53.0,,COMPLETE
9374,0.19694389251584823,2024-04-11 19:29:31.671001,2024-04-11 19:29:34.288892,0 days 00:00:02.617891,99.96460198834046,8.088154165275856,rbf,45,14.0,28.0,30.0,,,,31.0,29.0,,,,,,,116.0,COMPLETE
9375,0.5952371952371952,2024-04-11 19:29:34.288892,2024-04-11 19:29:36.278758,0 days 00:00:01.989866,99.98129431083362,7.772533879245021,sigmoid,8,,21.0,32.0,,,,,,,,,,,,,COMPLETE
9376,0.4590501256131116,2024-04-11 19:29:36.278758,2024-04-11 19:29:38.895846,0 days 00:00:02.617088,96.37458183286321,8.30464125302769,sigmoid,50,36.0,,,2.0,3.0,85.0,,,8.461836160511565,6.10379129825349,7.9527297680219915,11.0,36.0,69.0,,COMPLETE
9377,0.4172318177262553,2024-04-11 19:29:38.895846,2024-04-11 19:29:40.737583,0 days 00:00:01.841737,94.08249122875591,8.070414857854404,sigmoid,49,33.0,,,3.0,5.0,98.0,,,,,,,,,71.0,COMPLETE
9378,0.5929369437606513,2024-04-11 19:29:40.737583,2024-04-11 19:29:42.501245,0 days 00:00:01.763662,99.97147891000067,8.557051727054878,sigmoid,8,,26.0,33.0,,,,,,,,,,,,,COMPLETE
9379,0.45587104642222753,2024-04-11 19:29:42.501245,2024-04-11 19:29:45.166230,0 days 00:00:02.664985,72.1566712331367,7.591034128504788,sigmoid,29,,45.0,31.0,8.0,6.0,53.0,24.0,42.0,,,,,,,81.0,COMPLETE
9380,0.5028971740679173,2024-04-11 19:29:45.166230,2024-04-11 19:29:47.485896,0 days 00:00:02.319666,96.80161694028932,7.884143584175314,sigmoid,24,,24.0,30.0,6.0,4.0,4.0,,,,,,,,,,COMPLETE
9381,0.12622036262203626,2024-04-11 19:29:47.485896,2024-04-11 19:29:49.258419,0 days 00:00:01.772523,96.5537221029109,8.209415160924452,sigmoid,8,,27.0,29.0,,,,,,,,,,,,,COMPLETE
9382,0.4768817482047838,2024-04-11 19:29:49.258419,2024-04-11 19:29:51.420428,0 days 00:00:02.162009,98.10017120016141,8.434165388784013,sigmoid,25,,23.0,32.0,5.0,8.0,80.0,,,,,,,,,171.0,COMPLETE
9383,0.5090277449543886,2024-04-11 19:29:51.420428,2024-04-11 19:29:54.273251,0 days 00:00:02.852823,99.9625102527187,7.789775727074434,sigmoid,47,30.0,25.0,30.0,,,,7.0,19.0,3.3112551269084056,1.9395711209795645,3.0664384617206,16.0,37.0,72.0,189.0,COMPLETE
9384,0.37456886640607034,2024-04-11 19:29:54.273251,2024-04-11 19:29:56.750263,0 days 00:00:02.477012,99.9888354044377,8.774586360470957,sigmoid,39,21.0,,,,,,36.0,48.0,0.9075211640450869,8.821502841376994,2.1457645654295883,10.0,48.0,74.0,60.0,COMPLETE
9385,0.4610146584884084,2024-04-11 19:29:56.750263,2024-04-11 19:29:59.742821,0 days 00:00:02.992558,95.0100117048542,8.029514800623545,sigmoid,58,45.0,26.0,31.0,1.0,1.0,73.0,,,6.5429408439632475,3.6004070069819827,7.6917977256531636,8.0,44.0,99.0,,COMPLETE
9386,0.5929369437606513,2024-04-11 19:29:59.742821,2024-04-11 19:30:01.580520,0 days 00:00:01.837699,96.74373107723736,7.471936498480826,sigmoid,8,,24.0,33.0,,,,,,,,,,,,,COMPLETE
9387,0.3989800954104294,2024-04-11 19:30:01.580520,2024-04-11 19:30:04.617861,0 days 00:00:03.037341,98.176853086251,8.224872250784493,sigmoid,43,23.0,22.0,29.0,,,,,,4.8817473405732095,4.49518827467118,4.176883688044055,18.0,20.0,82.0,152.0,COMPLETE
9388,0.28681380871533674,2024-04-11 19:30:04.617861,2024-04-11 19:30:07.533219,0 days 00:00:02.915358,93.988205701093,7.970406527826917,sigmoid,22,,,,7.0,7.0,28.0,38.0,12.0,3.579346555171309,4.032179966868189,5.190431868843244,5.0,43.0,64.0,,COMPLETE
9389,0.39275996280095066,2024-04-11 19:30:07.548858,2024-04-11 19:30:09.616836,0 days 00:00:02.067978,98.1568020228201,7.6915803545925785,sigmoid,21,,,,4.0,2.0,90.0,26.0,5.0,,,,,,,141.0,COMPLETE
9390,0.5963643249384587,2024-04-11 19:30:09.616836,2024-04-11 19:30:11.484019,0 days 00:00:01.867183,96.70231495514389,8.33723359455152,sigmoid,8,,25.0,32.0,,,,,,,,,,,,,COMPLETE
9391,0.5636462904171639,2024-04-11 19:30:11.484019,2024-04-11 19:30:13.144319,0 days 00:00:01.660300,94.73889492857438,7.290465574242517,sigmoid,0,,,,,,,,,,,,,,,,COMPLETE
9392,0.23525843767601054,2024-04-11 19:30:13.144319,2024-04-11 19:30:15.810263,0 days 00:00:02.665944,96.84501277451356,8.174608489238475,rbf,35,19.0,,,,,,,,9.344126603544657,1.031331619633212,9.294833562602184,2.0,27.0,91.0,100.0,COMPLETE
9393,0.2589619267148875,2024-04-11 19:30:15.810263,2024-04-11 19:30:18.567808,0 days 00:00:02.757545,99.99693917127045,7.857560946256261,sigmoid,3,,,,,,,,,0.5013687351659728,9.219140735263744,0.7087920874274074,13.0,41.0,87.0,48.0,COMPLETE
