number,value,datetime_start,datetime_complete,duration,params_C,params_gamma,params_kernel,params_mask_number,params_rsi_window,params_so_smooth,params_so_window,params_srsi_smooth1,params_srsi_smooth2,params_srsi_window,params_tsi_window_fast,params_tsi_window_slow,params_ult_weight_1,params_ult_weight_2,params_ult_weight_3,params_ult_window_1,params_ult_window_2,params_ult_window_3,params_williams_lbp,state
3330,0.4915258346870984,2024-04-11 16:44:49.299832,2024-04-11 16:44:50.613542,0 days 00:00:01.313710,95.06193264480088,8.089285946634584,sigmoid,46,5.0,24.0,29.0,,,,27.0,44.0,1.4775237955243083,4.974007094277773,4.087594052188223,15.0,41.0,53.0,,COMPLETE
3331,0.45401337792642144,2024-04-11 16:44:50.613542,2024-04-11 16:44:52.118011,0 days 00:00:01.504469,98.16142274636663,8.445702561307524,sigmoid,63,40.0,26.0,30.0,7.0,8.0,79.0,39.0,21.0,8.4691753030841,8.423438565935836,2.2971260682152863,4.0,42.0,63.0,47.0,COMPLETE
3332,0.4491656326757995,2024-04-11 16:44:52.118011,2024-04-11 16:44:53.017042,0 days 00:00:00.899031,93.57908414568138,7.545248623662176,sigmoid,16,,,,3.0,7.0,9.0,,,,,,,,,,COMPLETE
3333,0.47009464825312786,2024-04-11 16:44:53.017042,2024-04-11 16:44:54.210162,0 days 00:00:01.193120,96.92886027287922,8.259098570724513,sigmoid,57,33.0,24.0,32.0,8.0,1.0,36.0,,,,,,,,,66.0,COMPLETE
3334,0.6009432182607054,2024-04-11 16:44:54.210162,2024-04-11 16:44:55.149021,0 days 00:00:00.938859,91.96706287077654,7.953987257524016,sigmoid,8,,26.0,31.0,,,,,,,,,,,,,COMPLETE
3335,0.19352643856920684,2024-04-11 16:44:55.149021,2024-04-11 16:44:56.553863,0 days 00:00:01.404842,99.99655376916185,7.686411857766034,rbf,11,,23.0,30.0,,,,,,1.9753699835386636,5.733963682149687,3.343064838092314,3.0,35.0,56.0,150.0,COMPLETE
3336,0.273403824190399,2024-04-11 16:44:56.553863,2024-04-11 16:44:57.570500,0 days 00:00:01.016637,98.02520266252128,8.176968213843896,sigmoid,2,,,,,,,,,5.618324698077437,2.7457270238276776,9.243994859458,5.0,29.0,71.0,,COMPLETE
3337,0.4696663033888629,2024-04-11 16:44:57.570500,2024-04-11 16:44:58.912538,0 days 00:00:01.342038,95.21953740599234,7.067155581057143,sigmoid,62,26.0,27.0,32.0,4.0,6.0,60.0,16.0,24.0,2.64414099084074,8.904792655034447,6.654912806940235,14.0,24.0,89.0,,COMPLETE
3338,0.31716054670768273,2024-04-11 16:44:58.920468,2024-04-11 16:45:00.041627,0 days 00:00:01.121159,98.13994384988204,8.737489692999205,sigmoid,10,,25.0,29.0,,,,,,9.056458605761868,6.545775738157532,8.744010203479766,7.0,40.0,93.0,,COMPLETE
3339,0.4962166904265819,2024-04-11 16:45:00.041627,2024-04-11 16:45:00.963459,0 days 00:00:00.921832,51.63635309970981,7.935221453196674,sigmoid,41,3.0,25.0,34.0,,,,,,,,,,,,154.0,COMPLETE
3340,0.5963245096172158,2024-04-11 16:45:00.970997,2024-04-11 16:45:01.761490,0 days 00:00:00.790493,96.83592165867735,8.393755794941377,sigmoid,8,,29.0,31.0,,,,,,,,,,,,,COMPLETE
3341,0.36060266467438673,2024-04-11 16:45:01.770044,2024-04-11 16:45:03.114271,0 days 00:00:01.344227,99.99991249379029,8.11473895068741,sigmoid,26,,23.0,33.0,1.0,2.0,23.0,,,3.9719674175904953,8.585387979894444,0.5136733524287065,9.0,38.0,74.0,,COMPLETE
3342,0.6009432182607054,2024-04-11 16:45:03.122318,2024-04-11 16:45:03.914338,0 days 00:00:00.792020,95.31427555059567,7.761755947350602,sigmoid,8,,24.0,31.0,,,,,,,,,,,,,COMPLETE
3343,0.2048026150364596,2024-04-11 16:45:03.914593,2024-04-11 16:45:04.921276,0 days 00:00:01.006683,96.66633154569111,7.466429156456037,sigmoid,20,,,,6.0,5.0,45.0,29.0,37.0,,,,,,,,COMPLETE
3344,0.4634235552304316,2024-04-11 16:45:04.921276,2024-04-11 16:45:06.073373,0 days 00:00:01.152097,98.37500094160893,8.300507511493796,sigmoid,56,10.0,22.0,30.0,8.0,4.0,73.0,,,,,,,,,,COMPLETE
3345,0.5952371952371952,2024-04-11 16:45:06.073373,2024-04-11 16:45:06.961376,0 days 00:00:00.888003,98.1879732037007,7.9262744801874145,sigmoid,8,,28.0,32.0,,,,,,,,,,,,,COMPLETE
3346,0.4892696800883812,2024-04-11 16:45:06.969537,2024-04-11 16:45:08.233251,0 days 00:00:01.263714,99.9647417772014,8.629448212257223,sigmoid,14,,26.0,28.0,,,,49.0,2.0,2.2090284481413542,6.80406094405015,4.567517558309556,17.0,47.0,79.0,,COMPLETE
3347,0.5271004476898336,2024-04-11 16:45:08.241698,2024-04-11 16:45:09.124788,0 days 00:00:00.883090,94.30422422684504,8.075432373614388,sigmoid,37,43.0,,,,,,6.0,26.0,,,,,,,173.0,COMPLETE
3348,0.45345352376492626,2024-04-11 16:45:09.124788,2024-04-11 16:45:10.058472,0 days 00:00:00.933684,96.60327749928305,8.435889885033742,sigmoid,8,,30.0,30.0,,,,,,,,,,,,,COMPLETE
3349,0.5952371952371952,2024-04-11 16:45:10.066009,2024-04-11 16:45:10.919476,0 days 00:00:00.853467,98.0213066419035,7.730850815065625,sigmoid,8,,25.0,32.0,,,,,,,,,,,,,COMPLETE
3350,0.47074122236670995,2024-04-11 16:45:10.928546,2024-04-11 16:45:12.056770,0 days 00:00:01.128224,98.21097159576247,8.195746785357166,sigmoid,52,37.0,,,2.0,3.0,64.0,14.0,11.0,,,,,,,,COMPLETE
3351,0.45231591794037307,2024-04-11 16:45:12.056770,2024-04-11 16:45:13.337581,0 days 00:00:01.280811,93.42812650226446,7.87739743531148,sigmoid,59,13.0,26.0,33.0,6.0,7.0,81.0,,,7.052837742913,5.413381424040713,0.8000687043803847,13.0,43.0,82.0,132.0,COMPLETE
3352,0.4984279797914092,2024-04-11 16:45:13.337801,2024-04-11 16:45:14.209986,0 days 00:00:00.872185,95.60919186223721,7.375023725469461,sigmoid,48,45.0,,,4.0,8.0,53.0,,,,,,,,,,COMPLETE
3353,0.44701971028259324,2024-04-11 16:45:14.209986,2024-04-11 16:45:15.078225,0 days 00:00:00.868239,98.2119310816579,8.032236339741756,sigmoid,8,,27.0,30.0,,,,,,,,,,,,,COMPLETE
3354,0.5986580986580987,2024-04-11 16:45:15.078225,2024-04-11 16:45:16.049605,0 days 00:00:00.971380,24.468483909726473,8.330118421854705,sigmoid,8,,24.0,31.0,,,,,,,,,,,,,COMPLETE
3355,0.3767469521260779,2024-04-11 16:45:16.049605,2024-04-11 16:45:17.537092,0 days 00:00:01.487487,96.17459396470491,7.583265120117934,rbf,12,,25.0,29.0,,,,43.0,10.0,,,,,,,,COMPLETE
3356,0.3436626782259798,2024-04-11 16:45:17.545095,2024-04-11 16:45:19.152723,0 days 00:00:01.607628,91.70180700145815,8.198397533771505,sigmoid,55,47.0,,,5.0,1.0,10.0,33.0,33.0,6.48863485372967,5.9868505515345865,5.986474822156647,6.0,48.0,67.0,165.0,COMPLETE
3357,0.34653430242864736,2024-04-11 16:45:19.160744,2024-04-11 16:45:20.305001,0 days 00:00:01.144257,96.65793669738743,8.524207806875202,sigmoid,44,12.0,27.0,31.0,,,,45.0,19.0,,,,,,,,COMPLETE
3358,0.40032438808611026,2024-04-11 16:45:20.305001,2024-04-11 16:45:21.542793,0 days 00:00:01.237792,16.78207702898844,7.845924399521075,sigmoid,60,20.0,22.0,39.0,7.0,3.0,17.0,5.0,35.0,,,,,,,,COMPLETE
3359,0.4165455426356589,2024-04-11 16:45:21.542793,2024-04-11 16:45:22.883016,0 days 00:00:01.340223,97.93618811785586,8.051616708883405,sigmoid,54,16.0,,,3.0,6.0,34.0,24.0,31.0,8.110887396209563,4.481196245303601,2.071754543216793,12.0,20.0,68.0,,COMPLETE
3360,0.3814739315205749,2024-04-11 16:45:22.884016,2024-04-11 16:45:23.958454,0 days 00:00:01.074438,98.24340608321349,7.664175462706596,sigmoid,13,,24.0,34.0,,,,30.0,13.0,,,,,,,87.0,COMPLETE
3361,0.5178773594615179,2024-04-11 16:45:23.958454,2024-04-11 16:45:24.839490,0 days 00:00:00.881036,94.73851835302945,8.256277954688045,sigmoid,36,38.0,,,,,,44.0,47.0,,,,,,,,COMPLETE
3362,0.5953726073220592,2024-04-11 16:45:24.839490,2024-04-11 16:45:25.709310,0 days 00:00:00.869820,99.9121900652268,8.766603805857587,sigmoid,8,,28.0,25.0,,,,,,,,,,,,,COMPLETE
3363,0.5943780375673191,2024-04-11 16:45:25.716359,2024-04-11 16:45:26.483844,0 days 00:00:00.767485,98.28676162218304,7.95852390403246,sigmoid,1,,,,,,,,,,,,,,,24.0,COMPLETE
3364,0.5963643249384587,2024-04-11 16:45:26.483844,2024-04-11 16:45:27.298530,0 days 00:00:00.814686,95.55502355476573,8.424245730406996,sigmoid,8,,26.0,32.0,,,,,,,,,,,,,COMPLETE
3365,0.5023164208500257,2024-04-11 16:45:27.298530,2024-04-11 16:45:28.449317,0 days 00:00:01.150787,96.62835426061146,7.798051578535403,sigmoid,7,,,,,,,37.0,49.0,1.7278755678381863,2.9950558050725227,1.3014299818748833,16.0,45.0,97.0,73.0,COMPLETE
3366,0.5141079812206572,2024-04-11 16:45:28.449317,2024-04-11 16:45:29.811117,0 days 00:00:01.361800,98.30390541363394,8.114156827509174,sigmoid,23,,,,1.0,5.0,19.0,7.0,28.0,8.76661393939246,9.487349254648652,3.6874659991256835,11.0,30.0,60.0,103.0,COMPLETE
3367,0.5900242633031432,2024-04-11 16:45:29.811117,2024-04-11 16:45:30.700759,0 days 00:00:00.889642,93.71961312387154,8.293985613872769,sigmoid,32,22.0,,,,,,,,,,,,,,,COMPLETE
3368,0.5276534592486144,2024-04-11 16:45:30.700759,2024-04-11 16:45:31.690022,0 days 00:00:00.989263,99.96221973532336,7.180573422942799,sigmoid,40,27.0,23.0,29.0,,,,,,,,,,,,,COMPLETE
3369,0.5929369437606513,2024-04-11 16:45:31.690022,2024-04-11 16:45:32.525648,0 days 00:00:00.835626,99.92071274064814,7.99563012249487,sigmoid,8,,25.0,33.0,,,,,,,,,,,,,COMPLETE
3370,0.5963245096172158,2024-04-11 16:45:32.525648,2024-04-11 16:45:33.413416,0 days 00:00:00.887768,95.54295262637714,8.591001735151433,sigmoid,8,,27.0,31.0,,,,,,,,,,,,,COMPLETE
3371,0.44701971028259324,2024-04-11 16:45:33.413416,2024-04-11 16:45:34.263793,0 days 00:00:00.850377,98.17137806335911,7.615799582847607,sigmoid,8,,24.0,30.0,,,,,,,,,,,,,COMPLETE
3372,0.4881223178481814,2024-04-11 16:45:34.263793,2024-04-11 16:45:35.635539,0 days 00:00:01.371746,96.73986871128484,7.855722734742395,sigmoid,51,19.0,,,7.0,2.0,13.0,,,4.605984659857208,7.956408082780095,8.020118625207175,19.0,31.0,70.0,81.0,COMPLETE
3373,0.2971956963228622,2024-04-11 16:45:35.635539,2024-04-11 16:45:36.910348,0 days 00:00:01.274809,98.151455939444,8.169107530851312,sigmoid,34,21.0,,,,,,,,7.317785207753063,7.121547031749776,6.859267268033038,17.0,33.0,73.0,,COMPLETE
3374,0.3980673108963678,2024-04-11 16:45:36.918362,2024-04-11 16:45:38.097440,0 days 00:00:01.179078,11.765788901018624,8.404130270012931,rbf,33,8.0,,,,,,,,,,,,,,33.0,COMPLETE
3375,0.5941143180531975,2024-04-11 16:45:38.097440,2024-04-11 16:45:38.999107,0 days 00:00:00.901667,99.98348937133379,7.382940036835464,sigmoid,8,,26.0,31.0,,,,,,,,,,,,,COMPLETE
3376,0.4995825022034606,2024-04-11 16:45:38.999107,2024-04-11 16:45:40.063178,0 days 00:00:01.064071,99.93410646049597,8.055943362315684,sigmoid,45,6.0,25.0,32.0,,,,26.0,17.0,,,,,,,190.0,COMPLETE
3377,0.4538909561559618,2024-04-11 16:45:40.063178,2024-04-11 16:45:41.405245,0 days 00:00:01.342067,99.999621639082,7.745646748427639,sigmoid,61,29.0,23.0,28.0,4.0,7.0,30.0,50.0,7.0,,,,,,,57.0,COMPLETE
3378,0.40852518217579153,2024-04-11 16:45:41.405245,2024-04-11 16:45:42.810447,0 days 00:00:01.405202,93.56525418442754,8.242317994585829,sigmoid,27,,29.0,30.0,2.0,4.0,89.0,,,6.788896479074246,1.764585629279844,5.241614606831327,2.0,36.0,83.0,13.0,COMPLETE
3379,0.4679200940070505,2024-04-11 16:45:42.810447,2024-04-11 16:45:44.281450,0 days 00:00:01.471003,96.72284052416434,7.936297400763965,sigmoid,30,,21.0,31.0,5.0,8.0,77.0,11.0,5.0,0.9806603601747099,6.3120276496205,4.778404779955637,7.0,21.0,50.0,,COMPLETE
3380,0.545051113400428,2024-04-11 16:45:44.289778,2024-04-11 16:45:45.324919,0 days 00:00:01.035141,79.28729008597078,8.343213318667111,sigmoid,5,,,,,,,20.0,25.0,,,,,,,143.0,COMPLETE
3381,0.5041108709698982,2024-04-11 16:45:45.324919,2024-04-11 16:45:46.312971,0 days 00:00:00.988052,96.59407284982946,7.559085051774215,sigmoid,17,,,,8.0,5.0,25.0,,,,,,,,,99.0,COMPLETE
3382,0.5929369437606513,2024-04-11 16:45:46.312971,2024-04-11 16:45:47.176128,0 days 00:00:00.863157,99.99792427688115,8.551713612670177,sigmoid,8,,26.0,33.0,,,,,,,,,,,,,COMPLETE
3383,0.2539790722848093,2024-04-11 16:45:47.185025,2024-04-11 16:45:48.290371,0 days 00:00:01.105346,95.10689971486836,8.066470560878743,sigmoid,18,,,,6.0,3.0,43.0,,,4.369161271179534,4.092292088506172,7.698522743569889,4.0,22.0,78.0,,COMPLETE
3384,0.529676036600445,2024-04-11 16:45:48.290371,2024-04-11 16:45:49.098856,0 days 00:00:00.808485,98.13706045970734,7.80563753524485,sigmoid,4,,,,,,,38.0,38.0,,,,,,,,COMPLETE
3385,0.3788592360020932,2024-04-11 16:45:49.098856,2024-04-11 16:45:50.331948,0 days 00:00:01.233092,92.49127313595915,8.21260223673425,sigmoid,19,,,,1.0,4.0,67.0,,,5.983093900539017,3.373018752959048,1.8035363272408507,15.0,28.0,56.0,157.0,COMPLETE
3386,0.43099184907042765,2024-04-11 16:45:50.331948,2024-04-11 16:45:51.659628,0 days 00:00:01.327680,98.232980183226,7.950237803741682,sigmoid,53,14.0,,,3.0,1.0,70.0,35.0,27.0,,,,,,,137.0,COMPLETE
3387,0.12622036262203626,2024-04-11 16:45:51.659628,2024-04-11 16:45:52.516891,0 days 00:00:00.857263,96.58015876140088,8.953193014004649,sigmoid,8,,27.0,29.0,,,,,,,,,,,,,COMPLETE
3388,0.43278427205100956,2024-04-11 16:45:52.516891,2024-04-11 16:45:54.017013,0 days 00:00:01.500122,99.98843659227359,8.432655520889197,sigmoid,58,34.0,24.0,32.0,2.0,6.0,75.0,,,7.850173560669994,1.2711543897036024,5.005609249220004,10.0,35.0,85.0,,COMPLETE
3389,0.44701971028259324,2024-04-11 16:45:54.021576,2024-04-11 16:45:54.840406,0 days 00:00:00.818830,94.6683265056388,8.160744412908214,sigmoid,8,,25.0,30.0,,,,,,,,,,,,,COMPLETE
3390,0.39198374092090355,2024-04-11 16:45:54.848429,2024-04-11 16:45:55.840618,0 days 00:00:00.992189,66.81999284654422,7.714893253230971,sigmoid,49,25.0,,,5.0,2.0,55.0,,,,,,,,,184.0,COMPLETE
3391,0.2112610299267006,2024-04-11 16:45:55.840618,2024-04-11 16:45:57.304204,0 days 00:00:01.463586,98.1783895114969,8.688357394436741,rbf,29,,28.0,32.0,6.0,8.0,50.0,3.0,45.0,,,,,,,127.0,COMPLETE
3392,0.2533493301339732,2024-04-11 16:45:57.304204,2024-04-11 16:45:58.435381,0 days 00:00:01.131177,96.43532257920549,7.944390943252265,sigmoid,6,,,,,,,41.0,20.0,3.664725429169324,9.301388820487539,2.4255941507528105,3.0,29.0,52.0,,COMPLETE
3393,0.38920681163944093,2024-04-11 16:45:58.443094,2024-04-11 16:45:59.445003,0 days 00:00:01.001909,98.19325273525754,7.457455209688468,sigmoid,25,,26.0,34.0,7.0,5.0,98.0,,,,,,,,,200.0,COMPLETE
3394,0.36826656882692377,2024-04-11 16:45:59.452898,2024-04-11 16:46:00.587142,0 days 00:00:01.134244,91.55914697033873,8.289678472932511,sigmoid,50,31.0,,,4.0,7.0,47.0,,,6.317870918020944,0.6642707894295778,7.3548511994340835,8.0,50.0,62.0,,COMPLETE
3395,0.594268224819143,2024-04-11 16:46:00.587615,2024-04-11 16:46:01.434429,0 days 00:00:00.846814,99.94652046434477,8.076116952699817,sigmoid,8,,25.0,27.0,,,,,,,,,,,,,COMPLETE
3396,0.48149597058133164,2024-04-11 16:46:01.434429,2024-04-11 16:46:02.733754,0 days 00:00:01.299325,95.2215973729487,7.729502197187608,sigmoid,47,3.0,24.0,31.0,,,,23.0,23.0,9.652112241426108,2.503144332693168,4.255847684868961,13.0,44.0,81.0,53.0,COMPLETE
3397,0.12622036262203626,2024-04-11 16:46:02.733754,2024-04-11 16:46:03.530381,0 days 00:00:00.796627,96.88636421428296,8.484234269660957,sigmoid,8,,27.0,29.0,,,,,,,,,,,,,COMPLETE
3398,0.44701971028259324,2024-04-11 16:46:03.530381,2024-04-11 16:46:04.394132,0 days 00:00:00.863751,94.25486118904956,7.880878314242632,sigmoid,8,,23.0,30.0,,,,,,,,,,,,,COMPLETE
3399,0.4926771691477574,2024-04-11 16:46:04.402169,2024-04-11 16:46:05.651708,0 days 00:00:01.249539,99.95767060965392,8.144915670051347,sigmoid,39,18.0,,,,,,22.0,43.0,3.197360004004815,5.295640179098115,5.810816112029898,9.0,41.0,95.0,161.0,COMPLETE
3400,0.5122337106694002,2024-04-11 16:46:05.651708,2024-04-11 16:46:06.799829,0 days 00:00:01.148121,98.25509909793601,7.605416603269259,sigmoid,35,46.0,,,,,,,,2.7789018648236055,3.6149020432397623,8.384412169819853,20.0,34.0,75.0,148.0,COMPLETE
3401,0.34483626298572917,2024-04-11 16:46:06.799829,2024-04-11 16:46:08.039179,0 days 00:00:01.239350,98.174514569077,8.356218036391356,sigmoid,43,42.0,24.0,31.0,,,,,,9.396286845795371,4.304757345933624,3.0787040666142333,6.0,26.0,57.0,108.0,COMPLETE
3402,0.502008416220352,2024-04-11 16:46:08.048046,2024-04-11 16:46:08.976671,0 days 00:00:00.928625,96.79462565930677,7.971127619653086,sigmoid,24,,26.0,33.0,8.0,4.0,38.0,,,,,,,,,,COMPLETE
3403,0.5963643249384587,2024-04-11 16:46:08.976671,2024-04-11 16:46:09.833459,0 days 00:00:00.856788,98.2011531849252,8.161354062785207,sigmoid,8,,22.0,32.0,,,,,,,,,,,,,COMPLETE
3404,0.5069140556625241,2024-04-11 16:46:09.833459,2024-04-11 16:46:10.661737,0 days 00:00:00.828278,95.13976449031344,7.807458238215544,sigmoid,8,,25.0,35.0,,,,,,,,,,,,,COMPLETE
3405,0.3296647936446425,2024-04-11 16:46:10.661737,2024-04-11 16:46:11.658107,0 days 00:00:00.996370,96.71636895564437,8.670289634526057,sigmoid,3,,,,,,,,,0.6510598582002967,7.6637967592633185,9.795445589372525,14.0,23.0,65.0,44.0,COMPLETE
3406,0.5214718359383862,2024-04-11 16:46:11.658107,2024-04-11 16:46:12.718093,0 days 00:00:01.059986,93.33947300878036,8.291583688769549,sigmoid,38,23.0,,,,,,28.0,9.0,5.141951130373939,1.0615843510056884,8.196246116363843,11.0,27.0,98.0,,COMPLETE
3407,0.42691076542932554,2024-04-11 16:46:12.726111,2024-04-11 16:46:13.916367,0 days 00:00:01.190256,39.65965925250923,8.067353227590376,sigmoid,22,,,,1.0,3.0,84.0,9.0,50.0,4.14125721358228,8.302176706654357,2.660462948083001,15.0,46.0,72.0,,COMPLETE
3408,0.47191388300893183,2024-04-11 16:46:13.916367,2024-04-11 16:46:15.297746,0 days 00:00:01.381379,98.28919266084387,7.252412623328956,sigmoid,31,,27.0,30.0,5.0,1.0,58.0,15.0,14.0,7.563563078155671,5.054604204646111,1.5946450911248151,18.0,39.0,59.0,94.0,COMPLETE
3409,0.5986580986580987,2024-04-11 16:46:15.305769,2024-04-11 16:46:16.102934,0 days 00:00:00.797165,99.9343619657447,6.658219862802641,sigmoid,8,,28.0,31.0,,,,,,,,,,,,,COMPLETE
3410,0.2077971777086821,2024-04-11 16:46:16.102934,2024-04-11 16:46:17.555980,0 days 00:00:01.453046,96.64941407420463,8.498666559746466,rbf,57,36.0,26.0,28.0,3.0,6.0,4.0,,,,,,,,,62.0,COMPLETE
3411,0.5952371952371952,2024-04-11 16:46:17.555980,2024-04-11 16:46:18.346343,0 days 00:00:00.790363,99.98613602197253,7.583796125046676,sigmoid,8,,23.0,32.0,,,,,,,,,,,,,COMPLETE
3412,0.47637847085142776,2024-04-11 16:46:18.351405,2024-04-11 16:46:19.794586,0 days 00:00:01.443181,95.33462974378712,7.897607294665012,sigmoid,63,24.0,24.0,29.0,4.0,7.0,62.0,34.0,3.0,2.978923628777879,4.6998953810146995,3.8135270584865166,8.0,36.0,90.0,168.0,COMPLETE
3413,0.43603588635986046,2024-04-11 16:46:19.794586,2024-04-11 16:46:20.774630,0 days 00:00:00.980044,98.21629437376741,8.241396752364258,sigmoid,21,,,,6.0,5.0,93.0,19.0,18.0,,,,,,,30.0,COMPLETE
3414,0.43483183299276523,2024-04-11 16:46:20.774630,2024-04-11 16:46:21.856268,0 days 00:00:01.081638,99.9904561925594,8.018882100325976,sigmoid,28,,25.0,30.0,2.0,2.0,96.0,17.0,29.0,,,,,,,,COMPLETE
3415,0.3601924886026486,2024-04-11 16:46:21.856268,2024-04-11 16:46:23.059043,0 days 00:00:01.202775,96.87354476527585,7.806952344377684,sigmoid,15,,26.0,32.0,,,,46.0,48.0,9.812329975416638,2.1004026138051346,3.4784629060512833,5.0,49.0,61.0,120.0,COMPLETE
3416,0.5051004854255094,2024-04-11 16:46:23.059043,2024-04-11 16:46:24.195286,0 days 00:00:01.136243,93.26044303348309,8.4276618712465,sigmoid,42,40.0,27.0,31.0,,,,,,1.269648191780612,7.5056845978978615,6.416448358457218,13.0,37.0,80.0,,COMPLETE
3417,0.5412537652246038,2024-04-11 16:46:24.203961,2024-04-11 16:46:25.059623,0 days 00:00:00.855662,98.1221298007674,8.082527066295489,sigmoid,9,,30.0,33.0,,,,,,,,,,,,193.0,COMPLETE
3418,0.18258771929824563,2024-04-11 16:46:25.059623,2024-04-11 16:46:25.906240,0 days 00:00:00.846617,95.53955131433683,7.401733284281144,sigmoid,16,,,,8.0,3.0,52.0,,,,,,,,,,COMPLETE
3419,0.38779418925499104,2024-04-11 16:46:25.906240,2024-04-11 16:46:27.100294,0 days 00:00:01.194054,98.13659096111121,7.76258813249862,sigmoid,14,,25.0,31.0,,,,8.0,40.0,4.773807185230423,5.627513746334205,9.066115697806307,16.0,24.0,66.0,,COMPLETE
3420,0.12622036262203626,2024-04-11 16:46:27.108204,2024-04-11 16:46:27.946263,0 days 00:00:00.838059,99.95903670842004,8.273897275035285,sigmoid,8,,24.0,29.0,,,,,,,,,,,,,COMPLETE
3421,0.3031273892307132,2024-04-11 16:46:27.946263,2024-04-11 16:46:28.989610,0 days 00:00:01.043347,95.55403143043195,8.734666738625602,sigmoid,10,,22.0,30.0,,,,,,5.367684921728064,9.994063722653932,7.0544025114314275,12.0,31.0,54.0,,COMPLETE
3422,0.5126803240893222,2024-04-11 16:46:28.997555,2024-04-11 16:46:30.253388,0 days 00:00:01.255833,98.28748367792437,7.965239241515255,sigmoid,46,2.0,28.0,32.0,,,,48.0,36.0,2.5322654382049965,6.459056886015259,7.518416903221041,10.0,42.0,84.0,,COMPLETE
3423,0.5375289858020422,2024-04-11 16:46:30.262056,2024-04-11 16:46:31.288775,0 days 00:00:01.026719,96.63859297876486,7.592340861242716,sigmoid,2,,,,,,,,,6.584393995464535,1.9002272351883684,1.1401644027905053,3.0,33.0,88.0,,COMPLETE
3424,0.5906279643331437,2024-04-11 16:46:31.296340,2024-04-11 16:46:32.087005,0 days 00:00:00.790665,93.72915019410756,8.20000635095068,sigmoid,8,,23.0,34.0,,,,,,,,,,,,,COMPLETE
3425,0.5111364153951264,2024-04-11 16:46:32.087005,2024-04-11 16:46:33.058081,0 days 00:00:00.971076,98.29840662028053,5.6657007873610254,sigmoid,41,44.0,26.0,31.0,,,,,,,,,,,,36.0,COMPLETE
3426,0.5929369437606513,2024-04-11 16:46:33.066136,2024-04-11 16:46:33.888622,0 days 00:00:00.822486,91.71852153983546,8.521301013845388,sigmoid,8,,25.0,33.0,,,,,,,,,,,,,COMPLETE
3427,0.4885290148448043,2024-04-11 16:46:33.888847,2024-04-11 16:46:34.707398,0 days 00:00:00.818551,96.64792114929979,7.92052451946312,sigmoid,8,,24.0,37.0,,,,,,,,,,,,,COMPLETE
3428,0.3394310381430897,2024-04-11 16:46:34.707398,2024-04-11 16:46:35.925868,0 days 00:00:01.218470,98.22261242001196,8.34894643907403,sigmoid,26,,27.0,30.0,7.0,4.0,22.0,,,3.460902410208438,3.8639926988670115,8.620715550102606,2.0,43.0,96.0,,COMPLETE
3429,0.12003789673140693,2024-04-11 16:46:35.934214,2024-04-11 16:46:36.807825,0 days 00:00:00.873611,95.11931698467792,8.097904220637911,sigmoid,8,,29.0,28.0,,,,,,,,,,,,,COMPLETE
3430,0.3147953405597799,2024-04-11 16:46:36.807825,2024-04-11 16:46:38.180954,0 days 00:00:01.373129,99.93009551902205,7.685774719558703,rbf,37,48.0,,,,,,31.0,23.0,,,,,,,77.0,COMPLETE
3431,0.36069403882494416,2024-04-11 16:46:38.180954,2024-04-11 16:46:39.307332,0 days 00:00:01.126378,96.75918821772105,7.890522925187553,sigmoid,11,,26.0,32.0,,,,,,9.166367161318643,1.625208725694451,5.410220634668192,4.0,32.0,64.0,21.0,COMPLETE
