number,value,datetime_start,datetime_complete,duration,params_C,params_gamma,params_kernel,params_mask_number,params_rsi_window,params_so_smooth,params_so_window,params_srsi_smooth1,params_srsi_smooth2,params_srsi_window,params_tsi_window_fast,params_tsi_window_slow,params_ult_weight_1,params_ult_weight_2,params_ult_weight_3,params_ult_window_1,params_ult_window_2,params_ult_window_3,params_williams_lbp,state
7130,0.5452111340436213,2024-04-11 18:11:35.167955,2024-04-11 18:11:36.472627,0 days 00:00:01.304672,95.23472024790728,8.431088139073639,sigmoid,36,13.0,,,,,,50.0,44.0,,,,,,,,COMPLETE
7131,0.45107240382830927,2024-04-11 18:11:36.475621,2024-04-11 18:11:38.561760,0 days 00:00:02.086139,96.84783607704429,7.912430994370607,sigmoid,59,44.0,26.0,31.0,4.0,4.0,63.0,,,3.7157909226724892,9.196873751772312,3.1215161637359716,2.0,30.0,50.0,78.0,COMPLETE
7132,0.21693348172245527,2024-04-11 18:11:38.565759,2024-04-11 18:11:40.867420,0 days 00:00:02.301661,99.98730201573514,8.138969408692162,rbf,60,29.0,24.0,29.0,6.0,7.0,45.0,33.0,19.0,,,,,,,,COMPLETE
7133,0.5533866415804326,2024-04-11 18:11:40.869381,2024-04-11 18:11:42.342641,0 days 00:00:01.473260,96.75789096434173,7.475517931731341,sigmoid,12,,25.0,32.0,,,,36.0,33.0,,,,,,,,COMPLETE
7134,0.44701971028259324,2024-04-11 18:11:42.345163,2024-04-11 18:11:43.923925,0 days 00:00:01.578762,98.18627356448802,7.907310357546232,sigmoid,8,,28.0,30.0,,,,,,,,,,,,,COMPLETE
7135,0.5963245096172158,2024-04-11 18:11:43.925924,2024-04-11 18:11:45.124547,0 days 00:00:01.198623,95.33524292602412,8.35835937034453,sigmoid,8,,23.0,31.0,,,,,,,,,,,,,COMPLETE
7136,0.4535204209471311,2024-04-11 18:11:45.127545,2024-04-11 18:11:47.317449,0 days 00:00:02.189904,99.99621341842536,7.694179329596804,sigmoid,54,37.0,,,8.0,6.0,53.0,23.0,5.0,8.103889621603543,4.463654286702037,1.4494371002638204,16.0,21.0,61.0,,COMPLETE
7137,0.39479086476777003,2024-04-11 18:11:47.320464,2024-04-11 18:11:49.574278,0 days 00:00:02.253814,98.20117402152748,8.13238348729719,sigmoid,23,,,,3.0,8.0,19.0,10.0,28.0,9.425087388446517,6.156006282023269,8.192239434470068,8.0,26.0,73.0,146.0,COMPLETE
7138,0.4662064702246034,2024-04-11 18:11:49.576273,2024-04-11 18:11:51.790170,0 days 00:00:02.213897,96.42190771253745,8.61980609354527,sigmoid,30,,26.0,33.0,7.0,5.0,39.0,30.0,13.0,3.2228664730903667,3.2891666903078987,2.4329977804032517,3.0,31.0,58.0,,COMPLETE
7139,0.5716266440717134,2024-04-11 18:11:51.793169,2024-04-11 18:11:53.544516,0 days 00:00:01.751347,93.85506859189663,7.974762919706282,sigmoid,40,46.0,24.0,16.0,,,,,,,,,,,,,COMPLETE
7140,0.46047694916996457,2024-04-11 18:11:53.548649,2024-04-11 18:11:55.746975,0 days 00:00:02.198326,99.98239756364481,8.304175511174911,sigmoid,27,,27.0,29.0,1.0,1.0,33.0,,,9.810926010138996,2.149452002720759,1.1030342230836307,19.0,41.0,71.0,175.0,COMPLETE
7141,0.5931679318644695,2024-04-11 18:11:55.750847,2024-04-11 18:11:57.044227,0 days 00:00:01.293380,91.3123427352236,7.795310303349406,sigmoid,8,,25.0,27.0,,,,,,,,,,,,,COMPLETE
7142,0.48624119654396275,2024-04-11 18:11:57.046219,2024-04-11 18:11:59.176628,0 days 00:00:02.130409,98.23441654199134,8.456082626678448,sigmoid,61,33.0,23.0,31.0,2.0,4.0,14.0,26.0,25.0,,,,,,,105.0,COMPLETE
7143,0.4440679946258544,2024-04-11 18:11:59.179195,2024-04-11 18:12:00.762716,0 days 00:00:01.583521,96.73526002660256,7.110402055514589,sigmoid,5,,,,,,,25.0,39.0,,,,,,,133.0,COMPLETE
7144,0.5558867631384026,2024-04-11 18:12:00.765716,2024-04-11 18:12:02.035143,0 days 00:00:01.269427,94.04326189347528,8.154980844935352,sigmoid,32,5.0,,,,,,,,,,,,,,,COMPLETE
7145,0.5975287681569516,2024-04-11 18:12:02.038131,2024-04-11 18:12:03.382835,0 days 00:00:01.344704,96.66204406427379,8.82682888285187,sigmoid,8,,26.0,32.0,,,,,,,,,,,,,COMPLETE
7146,0.5605429172242401,2024-04-11 18:12:03.385831,2024-04-11 18:12:04.687078,0 days 00:00:01.301247,99.98469737610256,7.9795032309027665,sigmoid,4,,,,,,,12.0,29.0,,,,,,,,COMPLETE
7147,0.5895095625828441,2024-04-11 18:12:04.690158,2024-04-11 18:12:05.995154,0 days 00:00:01.304996,99.96915887192664,7.692096298729114,sigmoid,8,,10.0,34.0,,,,,,,,,,,,,COMPLETE
7148,0.21705640883723074,2024-04-11 18:12:05.998136,2024-04-11 18:12:07.461217,0 days 00:00:01.463081,75.59443645851536,8.249423774500585,sigmoid,34,17.0,,,,,,,,1.5291259736950824,5.040579791429889,6.289359044380586,14.0,47.0,91.0,,COMPLETE
7149,0.3958729554963864,2024-04-11 18:12:07.464850,2024-04-11 18:12:09.313889,0 days 00:00:01.849039,96.68450672557661,7.892639026769884,sigmoid,45,34.0,24.0,30.0,,,,7.0,42.0,,,,,,,41.0,COMPLETE
7150,0.4628886951467597,2024-04-11 18:12:09.318564,2024-04-11 18:12:11.761709,0 days 00:00:02.443145,70.7059381753207,7.4859672901811,rbf,8,,22.0,32.0,,,,,,,,,,,,,COMPLETE
7151,0.5020288664029996,2024-04-11 18:12:11.764721,2024-04-11 18:12:13.170909,0 days 00:00:01.406188,98.21357938893502,8.541090826631082,sigmoid,17,,,,5.0,2.0,57.0,,,,,,,,,19.0,COMPLETE
7152,0.47137896564423637,2024-04-11 18:12:13.174428,2024-04-11 18:12:14.929888,0 days 00:00:01.755460,98.05381437967017,8.07651441721089,sigmoid,19,,,,6.0,3.0,83.0,,,7.466030125722763,8.93385687514009,7.209003270641615,17.0,23.0,87.0,55.0,COMPLETE
7153,0.4442399140972542,2024-04-11 18:12:14.932883,2024-04-11 18:12:16.954501,0 days 00:00:02.021618,95.35414967743024,8.273806658115614,sigmoid,51,42.0,,,8.0,7.0,87.0,,,5.225779143203002,3.585497487595923,7.796628883833072,20.0,29.0,99.0,87.0,COMPLETE
7154,0.4720226929587776,2024-04-11 18:12:16.957514,2024-04-11 18:12:18.693824,0 days 00:00:01.736310,98.20590437873001,7.797415415267598,sigmoid,18,,,,3.0,5.0,93.0,,,1.7849056879286396,1.0518551748330456,3.428571476568256,18.0,24.0,75.0,,COMPLETE
7155,0.4788714981579013,2024-04-11 18:12:18.696822,2024-04-11 18:12:20.790887,0 days 00:00:02.094065,99.98287001265861,8.047515695157795,sigmoid,58,31.0,27.0,31.0,4.0,6.0,42.0,,,4.8571367892294175,8.281305191510206,4.4226226599359135,7.0,34.0,52.0,,COMPLETE
7156,0.5479386576379207,2024-04-11 18:12:20.794882,2024-04-11 18:12:22.090036,0 days 00:00:01.295154,87.77824609170783,8.446819458693417,sigmoid,33,41.0,,,,,,,,,,,,,,30.0,COMPLETE
7157,0.12622036262203626,2024-04-11 18:12:22.093046,2024-04-11 18:12:23.598433,0 days 00:00:01.505387,93.55428520175684,7.6127426893046035,sigmoid,8,,25.0,29.0,,,,,,,,,,,,,COMPLETE
7158,0.4754513325054924,2024-04-11 18:12:23.601970,2024-04-11 18:12:25.471253,0 days 00:00:01.869283,95.41800565169281,8.231717217538518,sigmoid,53,10.0,,,7.0,1.0,75.0,49.0,50.0,,,,,,,101.0,COMPLETE
7159,0.4207128099173554,2024-04-11 18:12:25.474260,2024-04-11 18:12:27.312406,0 days 00:00:01.838146,98.16517559536027,7.949562053631123,sigmoid,50,2.0,,,5.0,7.0,78.0,,,0.7216319119809862,5.828660032008752,8.832471648905454,15.0,39.0,84.0,,COMPLETE
7160,0.5975287681569516,2024-04-11 18:12:27.315413,2024-04-11 18:12:28.609156,0 days 00:00:01.293743,96.45945109036245,8.722137440482475,sigmoid,8,,29.0,32.0,,,,,,,,,,,,,COMPLETE
7161,0.25195879568866086,2024-04-11 18:12:28.612167,2024-04-11 18:12:30.374250,0 days 00:00:01.762083,98.21749845332431,7.221484175267003,sigmoid,6,,,,,,,21.0,11.0,9.096804196152203,9.610136900397361,7.4392019640275215,11.0,20.0,78.0,,COMPLETE
7162,0.5193805511273059,2024-04-11 18:12:30.377248,2024-04-11 18:12:32.134708,0 days 00:00:01.757460,92.50762303232325,7.793575437182628,sigmoid,25,,26.0,40.0,1.0,8.0,9.0,,,,,,,,,10.0,COMPLETE
7163,0.44701971028259324,2024-04-11 18:12:32.137717,2024-04-11 18:12:33.547198,0 days 00:00:01.409481,99.95849574752813,8.08469852505469,sigmoid,8,,24.0,30.0,,,,,,,,,,,,,COMPLETE
7164,0.4960065581449819,2024-04-11 18:12:33.551794,2024-04-11 18:12:35.738730,0 days 00:00:02.186936,96.86457179232379,8.417637973122183,sigmoid,43,24.0,25.0,33.0,,,,,,6.932786326694229,3.9081419191316598,4.882170821341368,9.0,45.0,72.0,153.0,COMPLETE
7165,0.5986580986580987,2024-04-11 18:12:35.743284,2024-04-11 18:12:37.126485,0 days 00:00:01.383201,95.31645679195698,8.228108815473412,sigmoid,8,,27.0,31.0,,,,,,,,,,,,,COMPLETE
7166,0.4130916548142758,2024-04-11 18:12:37.130013,2024-04-11 18:12:38.727289,0 days 00:00:01.597276,98.24096212179094,7.438192210060089,sigmoid,49,19.0,,,6.0,4.0,98.0,,,,,,,,,72.0,COMPLETE
7167,0.34974638556295506,2024-04-11 18:12:38.729792,2024-04-11 18:12:41.367418,0 days 00:00:02.637626,96.89071456488898,7.943406747816765,sigmoid,39,8.0,,,,,,11.0,3.0,4.038932488046916,5.4025749180319815,2.115661975715748,12.0,25.0,98.0,95.0,COMPLETE
7168,0.43451317552478785,2024-04-11 18:12:41.371031,2024-04-11 18:12:43.469100,0 days 00:00:02.098069,98.24875330954268,7.6421612909387,sigmoid,47,6.0,23.0,28.0,,,,14.0,10.0,8.635647949331545,7.563407008119784,3.9585009869262855,10.0,50.0,69.0,65.0,COMPLETE
7169,0.4115451182678928,2024-04-11 18:12:43.473054,2024-04-11 18:12:45.359366,0 days 00:00:01.886312,99.95845831445212,8.336872529532505,rbf,24,,28.0,30.0,8.0,2.0,26.0,,,,,,,,,,COMPLETE
7170,0.48486583020423113,2024-04-11 18:12:45.362343,2024-04-11 18:12:47.607997,0 days 00:00:02.245654,94.255816689412,8.104512961114981,sigmoid,22,,,,4.0,3.0,73.0,18.0,35.0,5.695918686387537,6.833980750863786,8.363501162051445,4.0,49.0,85.0,,COMPLETE
7171,0.5963643249384587,2024-04-11 18:12:47.613610,2024-04-11 18:12:48.943068,0 days 00:00:01.329458,61.898881984264044,8.58281775062093,sigmoid,8,,26.0,32.0,,,,,,,,,,,,,COMPLETE
7172,0.5328151803299519,2024-04-11 18:12:48.946069,2024-04-11 18:12:50.648085,0 days 00:00:01.702016,98.23328308779882,7.809136380824228,sigmoid,35,18.0,,,,,,,,7.722181205787668,2.494244413369424,6.757506106672121,8.0,42.0,94.0,126.0,COMPLETE
7173,0.35434364621569653,2024-04-11 18:12:50.651662,2024-04-11 18:12:52.442330,0 days 00:00:01.790668,95.39100630244776,8.008212054805416,sigmoid,38,26.0,,,,,,43.0,18.0,6.571024473490818,6.488378240724611,2.740293211163004,6.0,43.0,56.0,,COMPLETE
7174,0.44976562941209686,2024-04-11 18:12:52.446329,2024-04-11 18:12:54.156642,0 days 00:00:01.710313,66.99657595535963,8.257772994742218,sigmoid,29,,8.0,26.0,7.0,8.0,5.0,47.0,49.0,,,,,,,184.0,COMPLETE
7175,0.47321474342543707,2024-04-11 18:12:54.160152,2024-04-11 18:12:55.669771,0 days 00:00:01.509619,98.19052823904342,7.8190002785616635,sigmoid,21,,,,2.0,6.0,70.0,39.0,8.0,,,,,,,164.0,COMPLETE
7176,0.5963643249384587,2024-04-11 18:12:55.672799,2024-04-11 18:12:57.114093,0 days 00:00:01.441294,96.62607998947732,8.452209665628203,sigmoid,8,,25.0,31.0,,,,,,,,,,,,,COMPLETE
7177,0.2700110817492115,2024-04-11 18:12:57.117086,2024-04-11 18:12:58.881629,0 days 00:00:01.764543,99.98698949547872,8.08350690953741,sigmoid,3,,,,,,,,,3.0036703168393832,1.4609225889592619,9.336087264524707,2.0,33.0,89.0,24.0,COMPLETE
7178,0.49626340563886057,2024-04-11 18:12:58.884627,2024-04-11 18:13:01.200423,0 days 00:00:02.315796,99.98728572808282,7.633638790505362,sigmoid,31,,24.0,30.0,3.0,4.0,47.0,45.0,32.0,1.1421812665125817,8.0523530550128,5.824416478969578,5.0,37.0,77.0,189.0,COMPLETE
7179,0.12622036262203626,2024-04-11 18:13:01.203465,2024-04-11 18:13:02.812930,0 days 00:00:01.609465,92.3207854851489,8.227361911645081,sigmoid,8,,21.0,29.0,,,,,,,,,,,,,COMPLETE
7180,0.5636462904171639,2024-04-11 18:13:02.815930,2024-04-11 18:13:03.821440,0 days 00:00:01.005510,95.22005066842502,7.896746316822664,sigmoid,0,,,,,,,,,,,,,,,,COMPLETE
7181,0.4326295467778016,2024-04-11 18:13:03.825466,2024-04-11 18:13:05.734735,0 days 00:00:01.909269,96.64084043020733,7.337749874766511,sigmoid,57,21.0,26.0,35.0,1.0,5.0,66.0,,,,,,,,,180.0,COMPLETE
7182,0.5929369437606513,2024-04-11 18:13:05.736729,2024-04-11 18:13:07.096456,0 days 00:00:01.359727,98.26686773911237,8.642839529306174,sigmoid,8,,25.0,33.0,,,,,,,,,,,,,COMPLETE
7183,0.3997791275538376,2024-04-11 18:13:07.101008,2024-04-11 18:13:09.214239,0 days 00:00:02.113231,98.2430749171167,8.068889752352199,sigmoid,15,,27.0,32.0,,,,41.0,22.0,3.5940730506626832,7.3758213910658394,1.81757255624039,4.0,40.0,88.0,157.0,COMPLETE
7184,0.5940087769509635,2024-04-11 18:13:09.216235,2024-04-11 18:13:10.437707,0 days 00:00:01.221472,94.52648366062601,9.086906652699982,sigmoid,8,,23.0,31.0,,,,,,,,,,,,,COMPLETE
7185,0.5281186298413205,2024-04-11 18:13:10.441253,2024-04-11 18:13:11.834882,0 days 00:00:01.393629,99.97247861799127,8.387693121068489,sigmoid,9,,24.0,34.0,,,,,,,,,,,,120.0,COMPLETE
7186,0.5080093099671413,2024-04-11 18:13:11.838878,2024-04-11 18:13:13.874105,0 days 00:00:02.035227,96.56771453746332,7.649007322887192,sigmoid,28,,31.0,30.0,6.0,2.0,12.0,28.0,47.0,,,,,,,,COMPLETE
7187,0.45801043808318836,2024-04-11 18:13:13.877086,2024-04-11 18:13:16.423013,0 days 00:00:02.545927,98.19057239695508,7.9216314396686744,sigmoid,63,16.0,28.0,33.0,4.0,1.0,51.0,17.0,37.0,1.3505215835646585,1.183279624967697,5.436128873871762,13.0,38.0,53.0,112.0,COMPLETE
7188,0.476743489973062,2024-04-11 18:13:16.426013,2024-04-11 18:13:18.875231,0 days 00:00:02.449218,99.96554790698042,8.236589783081325,rbf,8,,26.0,31.0,,,,,,,,,,,,,COMPLETE
7189,0.40498735326545177,2024-04-11 18:13:18.878228,2024-04-11 18:13:20.531198,0 days 00:00:01.652970,89.75439267689515,7.791775739540292,sigmoid,16,,,,2.0,6.0,58.0,,,,,,,,,,COMPLETE
7190,0.3939466077197755,2024-04-11 18:13:20.544738,2024-04-11 18:13:22.690289,0 days 00:00:02.145551,43.17897860592715,5.385470413925836,sigmoid,42,7.0,25.0,29.0,,,,,,2.716609034314915,4.632059603686065,4.587912535937608,14.0,30.0,64.0,,COMPLETE
7191,0.47824291965981336,2024-04-11 18:13:22.693318,2024-04-11 18:13:25.113617,0 days 00:00:02.420299,99.97472112321215,8.105919330666744,sigmoid,62,28.0,27.0,32.0,5.0,7.0,90.0,3.0,20.0,8.27536865299294,6.191473944345844,6.981387858363941,16.0,28.0,80.0,,COMPLETE
7192,0.45022721836881124,2024-04-11 18:13:25.117631,2024-04-11 18:13:26.398067,0 days 00:00:01.280436,93.6218470624192,8.405643482499443,sigmoid,8,,22.0,28.0,,,,,,,,,,,,,COMPLETE
7193,0.4788714981579013,2024-04-11 18:13:26.400587,2024-04-11 18:13:28.602295,0 days 00:00:02.201708,95.60541051361467,7.560334857301521,sigmoid,14,,29.0,31.0,,,,16.0,30.0,9.65498518697401,7.101485579293243,3.237679002390361,20.0,46.0,81.0,,COMPLETE
7194,0.3408662900188324,2024-04-11 18:13:28.605278,2024-04-11 18:13:30.160886,0 days 00:00:01.555608,98.2053611614202,7.923313590326445,sigmoid,41,48.0,24.0,30.0,,,,,,,,,,,,92.0,COMPLETE
7195,0.5163342067449919,2024-04-11 18:13:30.164840,2024-04-11 18:13:31.785830,0 days 00:00:01.620990,96.76221266673268,8.823151143363118,sigmoid,2,,,,,,,,,1.9584851793843727,0.8696193289908773,0.6983777846990202,19.0,27.0,68.0,,COMPLETE
7196,0.5963643249384587,2024-04-11 18:13:31.788829,2024-04-11 18:13:33.403993,0 days 00:00:01.615164,96.82084805856219,8.18613321861754,sigmoid,8,,25.0,32.0,,,,,,,,,,,,,COMPLETE
7197,0.5906279643331437,2024-04-11 18:13:33.408972,2024-04-11 18:13:35.014420,0 days 00:00:01.605448,98.16179614464589,8.546558424275977,sigmoid,8,,26.0,34.0,,,,,,,,,,,,,COMPLETE
7198,0.404055966043075,2024-04-11 18:13:35.017925,2024-04-11 18:13:37.253218,0 days 00:00:02.235293,94.08769108785525,8.02650461984603,sigmoid,46,30.0,23.0,30.0,,,,35.0,6.0,8.948896245356394,0.6755469393583926,8.978551323493132,17.0,22.0,65.0,,COMPLETE
7199,0.27632415928077686,2024-04-11 18:13:37.256222,2024-04-11 18:13:38.941928,0 days 00:00:01.685706,98.15198930516344,8.289593546879159,sigmoid,10,,25.0,29.0,,,,,,0.9125437414274469,1.7451165816500507,3.691564060324061,7.0,39.0,97.0,,COMPLETE
7200,0.29657082666874734,2024-04-11 18:13:38.944925,2024-04-11 18:13:40.408282,0 days 00:00:01.463357,99.98378599086178,7.78392784863471,sigmoid,37,36.0,,,,,,37.0,14.0,,,,,,,197.0,COMPLETE
7201,0.6009432182607054,2024-04-11 18:13:40.410876,2024-04-11 18:13:41.827783,0 days 00:00:01.416907,91.46907870154946,8.095279652355883,sigmoid,8,,26.0,31.0,,,,,,,,,,,,,COMPLETE
7202,0.42301627527172386,2024-04-11 18:13:41.831321,2024-04-11 18:13:44.050859,0 days 00:00:02.219538,96.63328108780603,7.729048863863495,sigmoid,26,,24.0,32.0,3.0,4.0,95.0,,,5.492291177512926,8.526404192970436,8.005891932608327,15.0,35.0,62.0,,COMPLETE
7203,0.5941143180531975,2024-04-11 18:13:44.053819,2024-04-11 18:13:45.348427,0 days 00:00:01.294608,95.07314991493212,7.383460317528001,sigmoid,8,,28.0,31.0,,,,,,,,,,,,,COMPLETE
7204,0.37442407146215334,2024-04-11 18:13:45.351035,2024-04-11 18:13:47.216685,0 days 00:00:01.865650,98.2079030470844,8.386520447803328,sigmoid,11,,27.0,33.0,,,,,,5.006576038929776,5.156357274047536,8.568451771699138,18.0,26.0,60.0,63.0,COMPLETE
7205,0.44701971028259324,2024-04-11 18:13:47.219673,2024-04-11 18:13:48.524378,0 days 00:00:01.304705,96.69421671895637,8.032271220667006,sigmoid,8,,23.0,30.0,,,,,,,,,,,,,COMPLETE
7206,0.3581048247136411,2024-04-11 18:13:48.527374,2024-04-11 18:13:50.214849,0 days 00:00:01.687475,95.36619116670366,7.538326712145283,rbf,48,13.0,,,8.0,3.0,20.0,,,,,,,,,,COMPLETE
7207,0.44094957096066917,2024-04-11 18:13:50.217846,2024-04-11 18:13:52.426378,0 days 00:00:02.208532,98.22574870147967,8.616405275233788,sigmoid,59,49.0,27.0,32.0,7.0,5.0,37.0,,,4.656557474375338,9.4666881128607,1.5900446181391104,5.0,36.0,59.0,35.0,COMPLETE
7208,0.4917394816065791,2024-04-11 18:13:52.429880,2024-04-11 18:13:55.499394,0 days 00:00:03.069514,93.25468360667628,7.8774127337135535,sigmoid,55,23.0,,,5.0,1.0,55.0,4.0,45.0,6.11617109881459,3.804419742537104,2.51836080153757,11.0,48.0,55.0,136.0,COMPLETE
7209,0.5380592804756327,2024-04-11 18:13:55.502257,2024-04-11 18:13:57.149935,0 days 00:00:01.647678,98.30712203089412,8.235106223750652,sigmoid,20,,,,7.0,8.0,16.0,33.0,26.0,,,,,,,,COMPLETE
7210,0.5816943051806145,2024-04-11 18:13:57.154474,2024-04-11 18:13:58.444489,0 days 00:00:01.290015,96.70514554717346,7.954791862536539,sigmoid,8,,25.0,3.0,,,,,,,,,,,,,COMPLETE
7211,0.5986580986580987,2024-04-11 18:13:58.447484,2024-04-11 18:13:59.837255,0 days 00:00:01.389771,99.98803910720791,8.441682905400823,sigmoid,8,,30.0,31.0,,,,,,,,,,,,,COMPLETE
7212,0.5007851641366934,2024-04-11 18:13:59.840258,2024-04-11 18:14:01.664573,0 days 00:00:01.824315,98.17075443164272,8.187576431742501,sigmoid,60,45.0,24.0,29.0,4.0,2.0,62.0,30.0,17.0,,,,,,,,COMPLETE
7213,0.38511825834900865,2024-04-11 18:14:01.667573,2024-04-11 18:14:03.234322,0 days 00:00:01.566749,95.57637934573906,7.685967589849937,sigmoid,56,32.0,26.0,33.0,6.0,3.0,23.0,,,,,,,,,,COMPLETE
7214,0.3517046458222929,2024-04-11 18:14:03.236862,2024-04-11 18:14:04.836088,0 days 00:00:01.599226,98.25034251604494,7.933912772537426,sigmoid,44,15.0,26.0,30.0,,,,24.0,42.0,,,,,,,,COMPLETE
7215,0.5187028657616893,2024-04-11 18:14:04.839641,2024-04-11 18:14:06.357110,0 days 00:00:01.517469,58.367164251358545,8.242641227325167,sigmoid,12,,24.0,31.0,,,,2.0,40.0,,,,,,,,COMPLETE
7216,0.38146672374617185,2024-04-11 18:14:06.360110,2024-04-11 18:14:07.918070,0 days 00:00:01.557960,96.66592748078736,8.693095613808735,sigmoid,13,,25.0,32.0,,,,38.0,4.0,,,,,,,52.0,COMPLETE
7217,0.38054602232322293,2024-04-11 18:14:07.921656,2024-04-11 18:14:09.902497,0 days 00:00:01.980841,94.17537129183168,6.239642938318432,sigmoid,23,,,,2.0,5.0,31.0,7.0,21.0,7.310800586469259,2.9031304349363034,5.052862704031261,3.0,44.0,51.0,82.0,COMPLETE
7218,0.12622036262203626,2024-04-11 18:14:09.905494,2024-04-11 18:14:11.422325,0 days 00:00:01.516831,96.74591780595439,8.089324911709847,sigmoid,8,,22.0,29.0,,,,,,,,,,,,,COMPLETE
7219,0.5929369437606513,2024-04-11 18:14:11.425357,2024-04-11 18:14:12.688780,0 days 00:00:01.263423,98.1204554807672,7.764731977539775,sigmoid,8,,27.0,33.0,,,,,,,,,,,,,COMPLETE
7220,0.31979975705819563,2024-04-11 18:14:12.693218,2024-04-11 18:14:14.237420,0 days 00:00:01.544202,98.17175633942985,7.5021334624827265,sigmoid,36,20.0,,,,,,27.0,28.0,,,,,,,,COMPLETE
7221,0.5174157797519571,2024-04-11 18:14:14.240420,2024-04-11 18:14:16.013693,0 days 00:00:01.773273,92.63215443123336,8.40535221983141,sigmoid,7,,,,,,,22.0,34.0,3.882883018250146,4.133265009164651,6.524754887517101,8.0,34.0,76.0,142.0,COMPLETE
7222,0.3624054026538161,2024-04-11 18:14:16.016700,2024-04-11 18:14:17.700308,0 days 00:00:01.683608,94.86253206676564,7.97775173104771,sigmoid,52,40.0,,,1.0,6.0,28.0,5.0,36.0,,,,,,,,COMPLETE
7223,0.5168452275544537,2024-04-11 18:14:17.703886,2024-04-11 18:14:18.907678,0 days 00:00:01.203792,98.13856477956189,8.256476364816008,sigmoid,1,,,,,,,,,,,,,,,149.0,COMPLETE
7224,0.4512950859356088,2024-04-11 18:14:18.912218,2024-04-11 18:14:20.275707,0 days 00:00:01.363489,96.6712685474337,8.532425271912938,sigmoid,8,,23.0,28.0,,,,,,,,,,,,,COMPLETE
7225,0.13589863913655562,2024-04-11 18:14:20.277705,2024-04-11 18:14:21.521849,0 days 00:00:01.244144,98.18361504507256,8.071002101763986,sigmoid,32,38.0,,,,,,,,,,,,,,,COMPLETE
7226,0.08927494930673535,2024-04-11 18:14:21.525431,2024-04-11 18:14:24.076150,0 days 00:00:02.550719,95.35037264208607,7.768465074098988,rbf,27,,25.0,30.0,8.0,7.0,2.0,,,9.327376194288792,2.1853337269046236,7.273674682274067,13.0,40.0,93.0,130.0,COMPLETE
7227,0.5963245096172158,2024-04-11 18:14:24.080131,2024-04-11 18:14:25.704261,0 days 00:00:01.624130,96.7653441889951,8.344470624271587,sigmoid,8,,28.0,31.0,,,,,,,,,,,,,COMPLETE
7228,0.5103014530470613,2024-04-11 18:14:25.708275,2024-04-11 18:14:27.217014,0 days 00:00:01.508739,98.25499263390023,7.876022260216066,sigmoid,40,12.0,26.0,27.0,,,,,,,,,,,,,COMPLETE
7229,0.4811386868369541,2024-04-11 18:14:27.220014,2024-04-11 18:14:29.245955,0 days 00:00:02.025941,94.1554616350481,7.038952084820179,sigmoid,61,27.0,24.0,31.0,3.0,3.0,40.0,9.0,23.0,,,,,,,99.0,COMPLETE
7230,0.1752445984508765,2024-04-11 18:14:29.248949,2024-04-11 18:14:31.033589,0 days 00:00:01.784640,98.35455564588119,7.580267846266862,sigmoid,34,47.0,,,,,,,,0.5206794701274475,2.6434309809944816,2.9447108356324736,10.0,31.0,74.0,,COMPLETE
7231,0.46553004189425684,2024-04-11 18:14:31.038619,2024-04-11 18:14:33.506992,0 days 00:00:02.468373,91.60018922118634,7.258511669971897,sigmoid,30,,29.0,32.0,1.0,2.0,83.0,32.0,48.0,4.174955661752941,3.1381158695950577,4.7433925900651746,9.0,41.0,71.0,,COMPLETE
7232,0.5906279643331437,2024-04-11 18:14:33.509993,2024-04-11 18:14:34.843879,0 days 00:00:01.333886,96.59244928502092,8.89981294094642,sigmoid,8,,21.0,34.0,,,,,,,,,,,,,COMPLETE
