number,value,datetime_start,datetime_complete,duration,params_C,params_gamma,params_kernel,params_mask_number,params_rsi_window,params_so_smooth,params_so_window,params_srsi_smooth1,params_srsi_smooth2,params_srsi_window,params_tsi_window_fast,params_tsi_window_slow,params_ult_weight_1,params_ult_weight_2,params_ult_weight_3,params_ult_window_1,params_ult_window_2,params_ult_window_3,params_williams_lbp,state
420,0.5456116165793585,2024-04-11 16:05:17.179511,2024-04-11 16:05:17.536859,0 days 00:00:00.357348,86.00659157692108,1.07854525535764,sigmoid,12,,48.0,38.0,,,,41.0,23.0,,,,,,,,COMPLETE
421,0.5823323040111231,2024-04-11 16:05:17.537860,2024-04-11 16:05:17.945985,0 days 00:00:00.408125,95.8645595012698,0.3993101491678601,sigmoid,0,,,,,,,,,,,,,,,,COMPLETE
422,0.4024721232137601,2024-04-11 16:05:17.945985,2024-04-11 16:05:18.392560,0 days 00:00:00.446575,90.70883756465955,4.326302924140294,sigmoid,55,34.0,,,4.0,3.0,26.0,20.0,39.0,2.3345035990629706,7.1962405741272875,7.0307559082094135,20.0,50.0,87.0,93.0,COMPLETE
423,0.586206338153612,2024-04-11 16:05:18.393569,2024-04-11 16:05:18.670403,0 days 00:00:00.276834,98.21203615445887,0.9142304946397491,sigmoid,0,,,,,,,,,,,,,,,,COMPLETE
424,0.5842605449660073,2024-04-11 16:05:18.672397,2024-04-11 16:05:18.969781,0 days 00:00:00.297384,93.90246518349174,1.4002083654305109,sigmoid,0,,,,,,,,,,,,,,,,COMPLETE
425,0.2776803717015867,2024-04-11 16:05:18.970782,2024-04-11 16:05:19.353093,0 days 00:00:00.382311,88.25281673354188,0.5701638181208977,sigmoid,20,,,,8.0,8.0,81.0,27.0,15.0,,,,,,,,COMPLETE
426,0.3750594469732999,2024-04-11 16:05:19.354099,2024-04-11 16:05:19.762813,0 days 00:00:00.408714,91.82609347343708,1.228632754028169,sigmoid,7,,,,,,,31.0,19.0,1.6896392496957957,2.4157407288021697,5.078879046551862,13.0,26.0,66.0,131.0,COMPLETE
427,0.48049826424341435,2024-04-11 16:05:19.763803,2024-04-11 16:05:20.276108,0 days 00:00:00.512305,81.34810957542635,1.5806473602793367,sigmoid,23,,,,7.0,2.0,73.0,23.0,17.0,1.2986157740214646,5.128384026895056,5.609761781897103,19.0,37.0,56.0,45.0,COMPLETE
428,0.09939593629873696,2024-04-11 16:05:20.277107,2024-04-11 16:05:20.573747,0 days 00:00:00.296640,96.83844848162454,0.761030949999959,sigmoid,32,42.0,,,,,,,,,,,,,,,COMPLETE
429,0.4994345682363052,2024-04-11 16:05:20.574749,2024-04-11 16:05:20.942366,0 days 00:00:00.367617,95.03469297037775,1.0459792053798191,sigmoid,13,,26.0,41.0,,,,15.0,25.0,,,,,,,194.0,COMPLETE
430,0.5917108398130876,2024-04-11 16:05:20.943367,2024-04-11 16:05:21.333378,0 days 00:00:00.390011,93.06009210897145,0.9167002061997886,sigmoid,2,,,,,,,,,2.816361124912621,8.245781461829413,3.6883646399837993,3.0,35.0,83.0,,COMPLETE
431,0.5472279458491401,2024-04-11 16:05:21.334380,2024-04-11 16:05:21.663527,0 days 00:00:00.329147,90.16020705205194,0.6509723100287677,sigmoid,40,24.0,6.0,47.0,,,,,,,,,,,,,COMPLETE
432,0.49274436001230976,2024-04-11 16:05:21.664526,2024-04-11 16:05:22.107712,0 days 00:00:00.443186,92.74055426022005,0.24322216713091738,sigmoid,54,29.0,,,5.0,5.0,35.0,11.0,29.0,2.8404860696484993,8.122997377441752,4.0550361153183,3.0,38.0,77.0,,COMPLETE
433,0.47394066349415975,2024-04-11 16:05:22.108710,2024-04-11 16:05:22.589375,0 days 00:00:00.480665,87.99090883569158,0.8753073761811552,sigmoid,30,,39.0,9.0,3.0,4.0,61.0,6.0,2.0,1.9349454819589442,9.550307384506851,3.6778633954650064,5.0,33.0,89.0,,COMPLETE
434,0.3804093164277839,2024-04-11 16:05:22.590376,2024-04-11 16:05:23.334569,0 days 00:00:00.744193,83.4195567615255,0.44678894430627236,rbf,4,,,,,,,38.0,30.0,,,,,,,,COMPLETE
435,0.5354508475895758,2024-04-11 16:05:23.335570,2024-04-11 16:05:23.668420,0 days 00:00:00.332850,91.05672360888362,0.9907473628856192,sigmoid,36,20.0,,,,,,45.0,48.0,,,,,,,,COMPLETE
436,0.1376229625053462,2024-04-11 16:05:23.669416,2024-04-11 16:05:24.045541,0 days 00:00:00.376125,86.05871856164397,0.7406812863549008,sigmoid,2,,,,,,,,,4.5113808950653045,8.597006588452675,2.4575065278436607,2.0,35.0,79.0,,COMPLETE
437,0.4988172610982248,2024-04-11 16:05:24.046540,2024-04-11 16:05:24.436857,0 days 00:00:00.390317,61.17959655970604,1.1730920421091018,sigmoid,45,18.0,16.0,2.0,,,,18.0,42.0,,,,,,,79.0,COMPLETE
438,0.5733160667098333,2024-04-11 16:05:24.437857,2024-04-11 16:05:24.800338,0 days 00:00:00.362481,89.19490287505967,0.8720969268742478,sigmoid,2,,,,,,,,,0.5425254078167927,9.990049654015415,4.217476573422804,4.0,41.0,86.0,,COMPLETE
439,0.429431804355761,2024-04-11 16:05:24.800512,2024-04-11 16:05:25.200107,0 days 00:00:00.399595,92.9872347052207,0.5500753492753145,sigmoid,5,,,,,,,3.0,36.0,,,,,,,147.0,COMPLETE
440,0.3541084404695361,2024-04-11 16:05:25.201149,2024-04-11 16:05:25.669522,0 days 00:00:00.468373,94.03566085475552,1.070309876420817,sigmoid,60,22.0,3.0,7.0,4.0,7.0,38.0,49.0,13.0,,,,,,,,COMPLETE
441,0.2052805879417502,2024-04-11 16:05:25.670522,2024-04-11 16:05:26.074362,0 days 00:00:00.403840,91.01716383999313,1.3327098207791495,sigmoid,2,,,,,,,,,3.061336302493595,7.018115269903118,3.4339131717790448,6.0,34.0,82.0,,COMPLETE
442,0.4459875679005432,2024-04-11 16:05:26.075362,2024-04-11 16:05:26.562828,0 days 00:00:00.487466,95.69585253017887,2.0666305403616416,sigmoid,27,,36.0,26.0,2.0,1.0,65.0,,,0.9891288574462713,7.7434342683604935,1.5096683826599384,5.0,27.0,83.0,175.0,COMPLETE
443,0.46948995839539776,2024-04-11 16:05:26.563935,2024-04-11 16:05:26.987982,0 days 00:00:00.424047,99.96471132067481,3.5154072840042137,sigmoid,61,12.0,25.0,40.0,6.0,2.0,57.0,17.0,6.0,,,,,,,56.0,COMPLETE
444,0.5854322450482764,2024-04-11 16:05:26.988983,2024-04-11 16:05:27.268519,0 days 00:00:00.279536,84.93243696747416,0.7447777496624116,sigmoid,0,,,,,,,,,,,,,,,,COMPLETE
445,0.5057884231536928,2024-04-11 16:05:27.269520,2024-04-11 16:05:27.694856,0 days 00:00:00.425336,87.88098158954806,0.949553227485696,sigmoid,33,15.0,,,,,,,,,,,,,,153.0,COMPLETE
446,0.29284380833851903,2024-04-11 16:05:27.695856,2024-04-11 16:05:28.098372,0 days 00:00:00.402516,92.78848575838794,1.1727572409648184,sigmoid,17,,,,1.0,8.0,21.0,,,,,,,,,61.0,COMPLETE
447,0.5863711449328822,2024-04-11 16:05:28.099374,2024-04-11 16:05:28.377035,0 days 00:00:00.277661,97.77293346335327,0.6093263303154374,sigmoid,0,,,,,,,,,,,,,,,,COMPLETE
448,0.2060623310089654,2024-04-11 16:05:28.378039,2024-04-11 16:05:28.760706,0 days 00:00:00.382667,94.66294785358991,0.2690036905449841,sigmoid,34,50.0,,,,,,,,2.5964222924313867,6.296026095391158,1.9012157718828115,10.0,30.0,93.0,,COMPLETE
449,0.451784674265746,2024-04-11 16:05:28.762704,2024-04-11 16:05:29.258083,0 days 00:00:00.495379,90.49266130824624,1.4093518525049682,sigmoid,51,38.0,,,8.0,6.0,68.0,,,3.283924439463861,7.347653817848804,2.7392360665288,7.0,39.0,96.0,70.0,COMPLETE
450,0.5881110587623675,2024-04-11 16:05:29.259246,2024-04-11 16:05:29.547212,0 days 00:00:00.287966,96.44775610078116,0.9542987651179644,sigmoid,0,,,,,,,,,,,,,,,,COMPLETE
451,0.5873898933704218,2024-04-11 16:05:29.548213,2024-04-11 16:05:29.833771,0 days 00:00:00.285558,89.23396268678243,0.7877215735275516,sigmoid,0,,,,,,,,,,,,,,,,COMPLETE
452,0.4396124149920745,2024-04-11 16:05:29.834782,2024-04-11 16:05:30.220732,0 days 00:00:00.385950,92.73523503689415,1.1899130592126044,sigmoid,49,45.0,,,7.0,5.0,95.0,,,,,,,,,88.0,COMPLETE
453,0.40094936708860757,2024-04-11 16:05:30.221729,2024-04-11 16:05:31.169882,0 days 00:00:00.948153,35.564812573352334,1.072267208762958,rbf,53,14.0,,,4.0,4.0,17.0,2.0,24.0,,,,,,,101.0,COMPLETE
454,0.5262584045066326,2024-04-11 16:05:31.170893,2024-04-11 16:05:31.673974,0 days 00:00:00.503081,86.54348156237037,1.66530034299368,sigmoid,58,47.0,45.0,43.0,3.0,3.0,9.0,,,3.8587129955493773,4.747541905301667,3.0642976153047115,4.0,29.0,76.0,,COMPLETE
455,0.5498156391494565,2024-04-11 16:05:31.674973,2024-04-11 16:05:32.104650,0 days 00:00:00.429677,98.20649033554405,0.5166017512244411,sigmoid,6,,,,,,,47.0,26.0,1.5787717588798524,6.817248017574979,5.363532616295095,3.0,45.0,70.0,,COMPLETE
456,0.4240862230552952,2024-04-11 16:05:32.105759,2024-04-11 16:05:32.600272,0 days 00:00:00.494513,95.7714215502948,0.8309759625163087,sigmoid,19,,,,5.0,7.0,78.0,,,4.686217823191962,6.607045046545375,4.732117565552329,9.0,34.0,71.0,123.0,COMPLETE
457,0.3428726067248494,2024-04-11 16:05:32.601276,2024-04-11 16:05:33.064767,0 days 00:00:00.463491,72.76070437311802,1.3733714730930788,sigmoid,50,43.0,,,3.0,1.0,49.0,,,4.8833309535334335,9.453603985172016,4.365851027301818,8.0,28.0,91.0,,COMPLETE
458,0.5880365043344815,2024-04-11 16:05:33.065767,2024-04-11 16:05:33.350605,0 days 00:00:00.284838,93.8819740051592,0.9873659417278154,sigmoid,0,,,,,,,,,,,,,,,,COMPLETE
459,0.37341421357310023,2024-04-11 16:05:33.351761,2024-04-11 16:05:33.767786,0 days 00:00:00.416025,42.360485246399804,0.6818482460179087,sigmoid,29,,18.0,35.0,6.0,6.0,71.0,36.0,40.0,,,,,,,22.0,COMPLETE
460,0.5902886822079962,2024-04-11 16:05:33.769776,2024-04-11 16:05:34.102386,0 days 00:00:00.332610,91.50353219334669,1.2223777525633737,sigmoid,0,,,,,,,,,,,,,,,,COMPLETE
461,0.48191520566799795,2024-04-11 16:05:34.103387,2024-04-11 16:05:34.547933,0 days 00:00:00.444546,91.25106642551633,1.557105605906239,sigmoid,39,4.0,,,,,,10.0,38.0,0.8321261439734231,8.269231560585746,3.809278652013128,2.0,43.0,98.0,109.0,COMPLETE
462,0.41491694352159464,2024-04-11 16:05:34.548935,2024-04-11 16:05:34.947491,0 days 00:00:00.398556,92.49072458850763,1.2364442659645345,sigmoid,25,,9.0,20.0,2.0,8.0,51.0,,,,,,,,,10.0,COMPLETE
463,0.4094319092887413,2024-04-11 16:05:34.948591,2024-04-11 16:05:35.469683,0 days 00:00:00.521092,94.61711057576441,1.4662555899359613,sigmoid,47,6.0,31.0,15.0,,,,13.0,21.0,2.5011702216087497,8.848557218499794,2.0870341404878126,10.0,40.0,68.0,51.0,COMPLETE
464,0.521783605337797,2024-04-11 16:05:35.470684,2024-04-11 16:05:35.923573,0 days 00:00:00.452889,96.92663322276167,1.2232322054893618,sigmoid,43,9.0,33.0,49.0,,,,,,2.784102041813263,7.9916780474067455,3.2073438403013292,6.0,46.0,85.0,187.0,COMPLETE
465,0.08920162085204249,2024-04-11 16:05:35.924600,2024-04-11 16:05:36.297593,0 days 00:00:00.372993,91.18126759840456,1.045077695958869,sigmoid,2,,,,,,,,,6.207497883604847,9.116304944362,6.490981958354254,11.0,26.0,89.0,,COMPLETE
466,0.34353499406880184,2024-04-11 16:05:36.298593,2024-04-11 16:05:36.686608,0 days 00:00:00.388015,94.42651576473833,1.3555983377110825,sigmoid,24,,15.0,30.0,1.0,3.0,31.0,,,,,,,,,,COMPLETE
467,0.5894865401251845,2024-04-11 16:05:36.687786,2024-04-11 16:05:36.995613,0 days 00:00:00.307827,98.72970093862148,1.1498568701034528,sigmoid,0,,,,,,,,,,,,,,,,COMPLETE
468,0.5847104737362986,2024-04-11 16:05:36.996613,2024-04-11 16:05:37.321355,0 days 00:00:00.324742,99.58742538365615,1.8976697247987055,sigmoid,0,,,,,,,,,,,,,,,,COMPLETE
469,0.5836206735876839,2024-04-11 16:05:37.322356,2024-04-11 16:05:37.612551,0 days 00:00:00.290195,97.66712465546941,1.7444194622566784,sigmoid,0,,,,,,,,,,,,,,,,COMPLETE
470,0.3396593846262791,2024-04-11 16:05:37.613550,2024-04-11 16:05:38.117404,0 days 00:00:00.503854,98.85852084846839,1.5660702330380645,sigmoid,38,32.0,,,,,,25.0,49.0,2.231755476503588,5.5644906723111,6.802154927092734,8.0,24.0,62.0,,COMPLETE
471,0.4958414570942028,2024-04-11 16:05:38.118474,2024-04-11 16:05:38.641411,0 days 00:00:00.522937,96.35628118183624,1.2145698945464065,sigmoid,31,,7.0,18.0,8.0,4.0,40.0,31.0,3.0,6.013792820651246,7.658878081761375,1.2141156030470834,4.0,41.0,83.0,127.0,COMPLETE
472,0.5898705322956922,2024-04-11 16:05:38.642421,2024-04-11 16:05:38.954573,0 days 00:00:00.312152,99.73974556933145,1.3687601818526478,sigmoid,0,,,,,,,,,,,,,,,,COMPLETE
473,0.5148185943504788,2024-04-11 16:05:38.955572,2024-04-11 16:05:39.270837,0 days 00:00:00.315265,99.83733191118823,1.4561689235781086,sigmoid,1,,,,,,,,,,,,,,,140.0,COMPLETE
474,0.38038945259908713,2024-04-11 16:05:39.271024,2024-04-11 16:05:40.024989,0 days 00:00:00.753965,98.01369600209478,1.3601730380779355,rbf,0,,,,,,,,,,,,,,,,COMPLETE
475,0.5049769476297434,2024-04-11 16:05:40.025991,2024-04-11 16:05:40.492938,0 days 00:00:00.466947,98.4607588330086,1.7542216127509223,sigmoid,15,,29.0,11.0,,,,8.0,46.0,1.120811555152675,4.505007140126184,5.882620223616186,7.0,31.0,88.0,170.0,COMPLETE
476,0.5886376209075821,2024-04-11 16:05:40.494095,2024-04-11 16:05:40.803676,0 days 00:00:00.309581,99.89922617091563,1.0928927844365806,sigmoid,0,,,,,,,,,,,,,,,,COMPLETE
477,0.36996053002537355,2024-04-11 16:05:40.805670,2024-04-11 16:05:41.198760,0 days 00:00:00.393090,96.04611680366664,4.005056208824466,sigmoid,35,35.0,,,,,,,,4.099389352825212,5.313440485746867,2.9168883647185693,3.0,32.0,81.0,157.0,COMPLETE
478,0.38521647978145546,2024-04-11 16:05:41.199760,2024-04-11 16:05:41.603559,0 days 00:00:00.403799,97.76494947514577,1.5628742713749129,sigmoid,21,,,,5.0,2.0,46.0,42.0,11.0,,,,,,,34.0,COMPLETE
479,0.37915022867716375,2024-04-11 16:05:41.604558,2024-04-11 16:05:42.024474,0 days 00:00:00.419916,95.34474698275058,1.235319376136375,sigmoid,3,,,,,,,,,3.7305655669387514,3.6373410734247473,7.859225127083697,5.0,48.0,75.0,82.0,COMPLETE
480,0.3629005309471651,2024-04-11 16:05:42.025470,2024-04-11 16:05:42.486154,0 days 00:00:00.460684,93.66338348849474,0.9640248481021025,sigmoid,22,,,,6.0,5.0,99.0,16.0,44.0,5.100484889739713,8.403411452533831,6.056120042663437,2.0,38.0,59.0,,COMPLETE
481,0.5143089100872742,2024-04-11 16:05:42.487154,2024-04-11 16:05:42.944738,0 days 00:00:00.457584,18.346834486502566,1.351041757109591,sigmoid,28,,11.0,5.0,7.0,6.0,43.0,40.0,7.0,,,,,,,,COMPLETE
482,0.5839382417329186,2024-04-11 16:05:42.945739,2024-04-11 16:05:43.257234,0 days 00:00:00.311495,99.72473073400779,1.0083693361014476,sigmoid,0,,,,,,,,,,,,,,,,COMPLETE
483,0.5852394231262724,2024-04-11 16:05:43.258226,2024-04-11 16:05:43.553436,0 days 00:00:00.295210,96.65240936339686,1.1704719517481497,sigmoid,0,,,,,,,,,,,,,,,,COMPLETE
484,0.5137563417741322,2024-04-11 16:05:43.554437,2024-04-11 16:05:43.997131,0 days 00:00:00.442694,89.340001045706,0.9119631240681206,sigmoid,42,41.0,41.0,46.0,,,,,,3.524481256827948,6.156214451575829,2.5643402383234646,12.0,44.0,78.0,,COMPLETE
485,0.4370911536345296,2024-04-11 16:05:43.998265,2024-04-11 16:05:44.445746,0 days 00:00:00.447481,94.80400595655463,1.489267605199771,sigmoid,57,30.0,21.0,37.0,4.0,2.0,91.0,,,,,,,,,90.0,COMPLETE
486,0.47999728008341075,2024-04-11 16:05:44.446748,2024-04-11 16:05:44.852801,0 days 00:00:00.406053,92.19202820434431,0.7589238119843156,sigmoid,16,,,,2.0,1.0,61.0,,,,,,,,,,COMPLETE
487,0.5489063830671126,2024-04-11 16:05:44.853929,2024-04-11 16:05:45.336545,0 days 00:00:00.482616,97.66202894168401,1.1533960104925924,sigmoid,14,,4.0,13.0,,,,34.0,32.0,3.011878706673035,6.38845501625559,3.5323106074295776,9.0,33.0,84.0,,COMPLETE
488,0.5900929395163252,2024-04-11 16:05:45.336682,2024-04-11 16:05:45.637787,0 days 00:00:00.301105,93.22837476291306,0.9505904961023636,sigmoid,0,,,,,,,,,,,,,,,,COMPLETE
489,0.4710540158919128,2024-04-11 16:05:45.638788,2024-04-11 16:05:46.079244,0 days 00:00:00.440456,93.42400697918467,0.5978235646902419,sigmoid,18,,,,1.0,7.0,63.0,,,5.452617516550123,9.765090485926002,0.8253114333739369,4.0,39.0,86.0,,COMPLETE
490,0.4731069792508758,2024-04-11 16:05:46.081268,2024-04-11 16:05:46.493733,0 days 00:00:00.412465,95.73684062839429,0.8705532023669567,sigmoid,9,,23.0,33.0,,,,,,,,,,,,27.0,COMPLETE
491,0.20412574597058408,2024-04-11 16:05:46.494734,2024-04-11 16:05:46.916733,0 days 00:00:00.421999,93.71051872786488,0.8918540238488417,sigmoid,10,,14.0,25.0,,,,,,1.3338142637159882,4.8997275664832705,1.7612735489624807,15.0,36.0,99.0,,COMPLETE
492,0.4696663033888629,2024-04-11 16:05:46.917733,2024-04-11 16:05:47.475159,0 days 00:00:00.557426,97.76190100154668,0.3686859636842287,sigmoid,63,37.0,34.0,22.0,3.0,4.0,56.0,21.0,35.0,7.110224079596201,8.666611516767434,4.006882716953129,11.0,25.0,72.0,119.0,COMPLETE
493,0.44354979870470856,2024-04-11 16:05:47.476312,2024-04-11 16:05:48.692912,0 days 00:00:01.216600,95.66497597149348,2.6501805833457617,rbf,8,,20.0,16.0,,,,,,,,,,,,,COMPLETE
494,0.5867358687757959,2024-04-11 16:05:48.693951,2024-04-11 16:05:48.997682,0 days 00:00:00.303731,92.2002332019364,1.3363459368475512,sigmoid,0,,,,,,,,,,,,,,,,COMPLETE
495,0.4772029122221415,2024-04-11 16:05:48.998683,2024-04-11 16:05:49.454414,0 days 00:00:00.455731,95.41141996741689,0.7212754775714978,sigmoid,46,25.0,43.0,45.0,,,,28.0,8.0,0.7044472776896971,6.978316661594994,4.81355566173288,13.0,35.0,80.0,,COMPLETE
496,0.5638855948385022,2024-04-11 16:05:49.455412,2024-04-11 16:05:49.728192,0 days 00:00:00.272780,99.88006079319238,5.1569717205391985,sigmoid,0,,,,,,,,,,,,,,,,COMPLETE
497,0.5116494777058811,2024-04-11 16:05:49.729216,2024-04-11 16:05:50.249687,0 days 00:00:00.520471,90.43888886175361,1.0067264969817438,sigmoid,26,,5.0,9.0,2.0,8.0,7.0,,,3.1579514449947603,5.7523892470136175,4.5011572003159115,6.0,45.0,91.0,,COMPLETE
498,0.35967495830524115,2024-04-11 16:05:50.250687,2024-04-11 16:05:50.726871,0 days 00:00:00.476184,93.50406208860394,1.684804036935402,sigmoid,11,,19.0,28.0,,,,,,1.889823445939406,9.339142992158425,5.0610561976553825,5.0,42.0,93.0,77.0,COMPLETE
499,0.5881014021858113,2024-04-11 16:05:50.727874,2024-04-11 16:05:51.021113,0 days 00:00:00.293239,96.89951735324938,1.2647777990655695,sigmoid,0,,,,,,,,,,,,,,,,COMPLETE
500,0.5229338450831945,2024-04-11 16:05:51.022114,2024-04-11 16:05:51.464918,0 days 00:00:00.442804,56.9935083546292,0.49090730331313465,sigmoid,37,17.0,,,,,,5.0,28.0,,,,,,,105.0,COMPLETE
501,0.5636462904171639,2024-04-11 16:05:51.466086,2024-04-11 16:05:51.722032,0 days 00:00:00.255946,91.75026985241213,6.898160714794416,sigmoid,0,,,,,,,,,,,,,,,,COMPLETE
502,0.3292986299335388,2024-04-11 16:05:51.723276,2024-04-11 16:05:52.135791,0 days 00:00:00.412515,98.31207168544996,1.0645450915957193,sigmoid,41,21.0,12.0,42.0,,,,,,,,,,,,200.0,COMPLETE
503,0.4151742390824879,2024-04-11 16:05:52.136791,2024-04-11 16:05:52.693200,0 days 00:00:00.556409,94.50675275727181,0.8004361512340494,sigmoid,62,31.0,37.0,39.0,7.0,3.0,14.0,41.0,17.0,4.268341454268198,7.447094257995346,5.401394698582615,8.0,29.0,63.0,,COMPLETE
504,0.5649292231993684,2024-04-11 16:05:52.694201,2024-04-11 16:05:53.135657,0 days 00:00:00.441456,90.26974370125065,0.6453426948470744,sigmoid,52,49.0,,,5.0,5.0,26.0,22.0,20.0,,,,,,,,COMPLETE
505,0.5873516489526552,2024-04-11 16:05:53.136659,2024-04-11 16:05:53.474630,0 days 00:00:00.337971,96.47419180871476,1.4689066160408968,sigmoid,0,,,,,,,,,,,,,,,,COMPLETE
506,0.4689914033175929,2024-04-11 16:05:53.475667,2024-04-11 16:05:53.867427,0 days 00:00:00.391760,93.34924973830772,1.0531340983794237,sigmoid,20,,,,8.0,7.0,80.0,39.0,9.0,,,,,,,,COMPLETE
507,0.46296392963407634,2024-04-11 16:05:53.867484,2024-04-11 16:05:54.347157,0 days 00:00:00.479673,99.83954235192859,1.190318981640699,sigmoid,56,46.0,46.0,48.0,4.0,1.0,94.0,,,,,,,,,,COMPLETE
508,0.4545921570865917,2024-04-11 16:05:54.348159,2024-04-11 16:05:54.935805,0 days 00:00:00.587646,92.03485546097731,0.8852858754276981,sigmoid,59,10.0,30.0,31.0,6.0,3.0,59.0,,,2.116504660715354,3.97570935207455,3.309296439272889,2.0,43.0,67.0,95.0,COMPLETE
509,0.46285581443405494,2024-04-11 16:05:54.936857,2024-04-11 16:05:55.464994,0 days 00:00:00.528137,68.34148830053292,1.352359564320225,sigmoid,55,16.0,,,1.0,6.0,76.0,46.0,15.0,4.818564705010171,4.257554078252016,6.347219573729351,16.0,30.0,73.0,181.0,COMPLETE
510,0.5863711449328822,2024-04-11 16:05:55.465994,2024-04-11 16:05:55.762480,0 days 00:00:00.296486,48.39508146187876,0.6434803002749399,sigmoid,0,,,,,,,,,,,,,,,,COMPLETE
511,0.5370381507989014,2024-04-11 16:05:55.763517,2024-04-11 16:05:56.156419,0 days 00:00:00.392902,89.15009982759652,2.3121583908077854,sigmoid,2,,,,,,,,,1.5475786253485442,8.087242189801815,2.2941471306990944,9.0,27.0,97.0,,COMPLETE
512,0.3732846831125565,2024-04-11 16:05:56.157605,2024-04-11 16:05:57.105026,0 days 00:00:00.947421,95.0546548696681,0.954161071738804,rbf,48,28.0,,,7.0,2.0,84.0,,,,,,,,,,COMPLETE
513,0.5335592676519542,2024-04-11 16:05:57.106028,2024-04-11 16:05:57.614589,0 days 00:00:00.508561,98.37461822334093,1.9074369728520586,sigmoid,44,3.0,39.0,4.0,,,,14.0,37.0,,,,,,,,COMPLETE
514,0.5194577113362319,2024-04-11 16:05:57.616590,2024-04-11 16:05:58.025566,0 days 00:00:00.408976,96.21254323340106,1.6077108354761027,sigmoid,12,,42.0,12.0,,,,7.0,4.0,,,,,,,,COMPLETE
515,0.5852394231262724,2024-04-11 16:05:58.026620,2024-04-11 16:05:58.320257,0 days 00:00:00.293637,93.3114854483162,1.1677235655256413,sigmoid,0,,,,,,,,,,,,,,,,COMPLETE
516,0.4108543128353281,2024-04-11 16:05:58.321257,2024-04-11 16:05:58.753440,0 days 00:00:00.432183,90.77957365685552,0.7844276998772629,sigmoid,13,,48.0,19.0,,,,32.0,33.0,,,,,,,144.0,COMPLETE
517,0.47917402047299684,2024-04-11 16:05:58.754433,2024-04-11 16:05:59.289969,0 days 00:00:00.535536,97.31052706439105,1.3711752031044284,sigmoid,23,,,,3.0,5.0,23.0,10.0,23.0,6.621270374661433,2.1420183151939955,8.623634136789022,12.0,23.0,95.0,41.0,COMPLETE
518,0.5077357961288652,2024-04-11 16:05:59.290971,2024-04-11 16:05:59.728380,0 days 00:00:00.437409,94.91743575776023,0.38267350885767215,sigmoid,60,23.0,28.0,43.0,4.0,4.0,36.0,26.0,48.0,,,,,,,,COMPLETE
519,0.5896947521427498,2024-04-11 16:05:59.730416,2024-04-11 16:06:00.125837,0 days 00:00:00.395421,89.00599060554916,1.0710395782341084,sigmoid,0,,,,,,,,,,,,,,,,COMPLETE
520,0.39365654734934297,2024-04-11 16:06:00.126838,2024-04-11 16:06:00.659346,0 days 00:00:00.532508,91.77384851686708,0.9559419238172411,sigmoid,54,8.0,,,5.0,6.0,32.0,27.0,5.0,7.813584224199449,5.918171421129595,1.0512625148169628,10.0,47.0,53.0,,COMPLETE
521,0.09651789047085797,2024-04-11 16:06:00.660348,2024-04-11 16:06:00.974994,0 days 00:00:00.314646,89.18195583036618,0.555569119185175,sigmoid,0,,,,,,,,,,,,,,,,COMPLETE
522,0.5636462904171639,2024-04-11 16:06:00.976061,2024-04-11 16:06:01.240538,0 days 00:00:00.264477,99.97748956353243,7.824505659809541,sigmoid,0,,,,,,,,,,,,,,,,COMPLETE
