number,value,datetime_start,datetime_complete,duration,params_C,params_gamma,params_kernel,params_mask_number,params_rsi_window,params_so_smooth,params_so_window,params_srsi_smooth1,params_srsi_smooth2,params_srsi_window,params_tsi_window_fast,params_tsi_window_slow,params_ult_weight_1,params_ult_weight_2,params_ult_weight_3,params_ult_window_1,params_ult_window_2,params_ult_window_3,params_williams_lbp,state
1790,0.4203857235256071,2024-04-11 16:17:47.566230,2024-04-11 16:17:48.338996,0 days 00:00:00.772766,98.18417958324136,8.227628392989782,sigmoid,55,3.0,,,7.0,8.0,26.0,33.0,45.0,6.924364453455675,2.3624947571012855,8.336941249343312,19.0,27.0,51.0,175.0,COMPLETE
1791,0.5001812086617741,2024-04-11 16:17:48.340996,2024-04-11 16:17:49.006591,0 days 00:00:00.665595,67.75896676901772,8.773580063812267,sigmoid,44,35.0,24.0,33.0,,,,19.0,31.0,,,,,,,,COMPLETE
1792,0.5101193910612046,2024-04-11 16:17:49.007588,2024-04-11 16:17:49.600617,0 days 00:00:00.593029,95.88875602278638,7.607254286504048,sigmoid,48,5.0,,,6.0,7.0,49.0,,,,,,,,,,COMPLETE
1793,0.44701971028259324,2024-04-11 16:17:49.601615,2024-04-11 16:17:50.102287,0 days 00:00:00.500672,98.069716782469,8.071925646484933,sigmoid,8,,27.0,30.0,,,,,,,,,,,,,COMPLETE
1794,0.5292726933366515,2024-04-11 16:17:50.103285,2024-04-11 16:17:50.778847,0 days 00:00:00.675562,98.18864514952328,8.40491503282747,sigmoid,13,,26.0,32.0,,,,42.0,37.0,,,,,,,108.0,COMPLETE
1795,0.44701971028259324,2024-04-11 16:17:50.781051,2024-04-11 16:17:51.375261,0 days 00:00:00.594210,96.03530138087312,7.944305952944787,sigmoid,8,,25.0,30.0,,,,,,,,,,,,,COMPLETE
1796,0.34908389585342336,2024-04-11 16:17:51.376251,2024-04-11 16:17:52.374103,0 days 00:00:00.997852,98.04931609995896,8.256984907154234,sigmoid,54,26.0,,,1.0,1.0,31.0,37.0,26.0,0.8866075008455114,0.7279260479135505,6.722334140568823,18.0,23.0,95.0,,COMPLETE
1797,0.34991542099630607,2024-04-11 16:17:52.376102,2024-04-11 16:17:53.072003,0 days 00:00:00.695901,99.9953052723104,7.764339945060308,sigmoid,60,19.0,24.0,35.0,6.0,3.0,9.0,6.0,47.0,,,,,,,,COMPLETE
1798,0.42035440460662366,2024-04-11 16:17:53.073102,2024-04-11 16:17:53.819272,0 days 00:00:00.746170,95.83651715315976,8.592994986871371,sigmoid,23,,,,8.0,1.0,93.0,46.0,33.0,9.022820515591595,0.8953313274507755,9.00801883095693,16.0,50.0,88.0,196.0,COMPLETE
1799,0.38570980883735506,2024-04-11 16:17:53.820331,2024-04-11 16:17:54.898504,0 days 00:00:01.078173,99.96716007795271,7.325955120487276,rbf,12,,26.0,28.0,,,,16.0,12.0,,,,,,,,COMPLETE
1800,0.27107872900222624,2024-04-11 16:17:54.900513,2024-04-11 16:17:55.440753,0 days 00:00:00.540240,97.98635294122381,8.036030051264445,sigmoid,36,7.0,,,,,,32.0,30.0,,,,,,,,COMPLETE
1801,0.5986580986580987,2024-04-11 16:17:55.442753,2024-04-11 16:17:55.958962,0 days 00:00:00.516209,95.75892768399784,8.20976009520111,sigmoid,8,,25.0,31.0,,,,,,,,,,,,,COMPLETE
1802,0.5392721455708859,2024-04-11 16:17:55.959963,2024-04-11 16:17:56.726716,0 days 00:00:00.766753,97.90239313634488,7.633873078971099,sigmoid,40,43.0,23.0,33.0,,,,,,,,,,,,,COMPLETE
1803,0.5974957313602731,2024-04-11 16:17:56.728738,2024-04-11 16:17:57.227757,0 days 00:00:00.499019,97.9880917373555,8.469071119478222,sigmoid,8,,27.0,31.0,,,,,,,,,,,,,COMPLETE
1804,0.4919861280344924,2024-04-11 16:17:57.228893,2024-04-11 16:17:58.173333,0 days 00:00:00.944440,99.99214514095719,7.84891200789278,sigmoid,59,50.0,24.0,32.0,7.0,2.0,46.0,,,6.2833920689010085,1.5816624172276326,8.224689382775258,13.0,22.0,92.0,147.0,COMPLETE
1805,0.12622036262203626,2024-04-11 16:17:58.176548,2024-04-11 16:17:58.869057,0 days 00:00:00.692509,95.87739974569683,8.102168438189493,sigmoid,8,,29.0,29.0,,,,,,,,,,,,,COMPLETE
1806,0.48731116318492296,2024-04-11 16:17:58.871056,2024-04-11 16:17:59.659204,0 days 00:00:00.788148,97.8358096115573,8.318016108141576,sigmoid,61,20.0,25.0,30.0,5.0,6.0,81.0,47.0,35.0,,,,,,,163.0,COMPLETE
1807,0.4687260523742833,2024-04-11 16:17:59.661236,2024-04-11 16:18:00.549700,0 days 00:00:00.888464,99.97867718785183,7.455607635300294,sigmoid,30,,26.0,32.0,6.0,4.0,44.0,14.0,22.0,1.2472404609969185,3.9560363533448135,6.321393924071176,20.0,20.0,62.0,,COMPLETE
1808,0.5062087481821234,2024-04-11 16:18:00.550700,2024-04-11 16:18:01.302716,0 days 00:00:00.752016,95.79895252311876,7.928306649124764,sigmoid,7,,,,,,,26.0,8.0,6.4899707665184945,1.9753860741126728,6.965938174069748,14.0,30.0,60.0,168.0,COMPLETE
1809,0.5778436245459759,2024-04-11 16:18:01.304715,2024-04-11 16:18:01.808083,0 days 00:00:00.503368,98.15480819752476,8.136614384026238,sigmoid,4,,,,,,,24.0,3.0,,,,,,,,COMPLETE
1810,0.5750784907221147,2024-04-11 16:18:01.810089,2024-04-11 16:18:02.336070,0 days 00:00:00.525981,99.96674098066671,8.345814115240598,sigmoid,32,18.0,,,,,,,,,,,,,,,COMPLETE
1811,0.6009432182607054,2024-04-11 16:18:02.337420,2024-04-11 16:18:02.851829,0 days 00:00:00.514409,96.28856848024546,7.651950033531636,sigmoid,8,,28.0,31.0,,,,,,,,,,,,,COMPLETE
1812,0.28618982232763285,2024-04-11 16:18:02.853829,2024-04-11 16:18:03.426256,0 days 00:00:00.572427,99.956213379493,7.8976700227151335,sigmoid,5,,,,,,,30.0,9.0,,,,,,,178.0,COMPLETE
1813,0.29689513766842407,2024-04-11 16:18:03.427258,2024-04-11 16:18:04.132262,0 days 00:00:00.705004,97.916772606237,8.533385860561175,sigmoid,34,30.0,,,,,,,,8.138652227287356,1.216112170993636,7.849347994748356,15.0,32.0,64.0,,COMPLETE
1814,0.5895095625828441,2024-04-11 16:18:04.133424,2024-04-11 16:18:04.648652,0 days 00:00:00.515228,96.43921344040288,8.093180242440486,sigmoid,8,,22.0,34.0,,,,,,,,,,,,,COMPLETE
1815,0.44701971028259324,2024-04-11 16:18:04.649653,2024-04-11 16:18:05.168788,0 days 00:00:00.519135,98.02840750429617,7.795741041968964,sigmoid,8,,26.0,30.0,,,,,,,,,,,,,COMPLETE
1816,0.44008524944467786,2024-04-11 16:18:05.169797,2024-04-11 16:18:05.707222,0 days 00:00:00.537425,95.94203275054616,8.22988385405759,sigmoid,17,,,,8.0,2.0,87.0,,,,,,,,,190.0,COMPLETE
1817,0.48827741808907205,2024-04-11 16:18:05.709202,2024-04-11 16:18:06.479881,0 days 00:00:00.770679,98.2129434718051,8.666302185012368,sigmoid,27,,23.0,29.0,1.0,8.0,20.0,,,7.557910719470172,1.82866320178349,9.178056205429103,17.0,47.0,50.0,150.0,COMPLETE
1818,0.5016470160612463,2024-04-11 16:18:06.480916,2024-04-11 16:18:07.126623,0 days 00:00:00.645707,95.54831938954149,8.013275882609658,sigmoid,45,14.0,27.0,33.0,,,,35.0,43.0,,,,,,,127.0,COMPLETE
1819,0.11206852071616533,2024-04-11 16:18:07.128623,2024-04-11 16:18:08.192656,0 days 00:00:01.064033,97.3222304456592,8.339319449470192,rbf,51,4.0,,,5.0,7.0,23.0,,,9.321109758408689,4.304872713108902,9.780925147630388,19.0,24.0,97.0,98.0,COMPLETE
1820,0.4374862667545594,2024-04-11 16:18:08.194794,2024-04-11 16:18:08.757999,0 days 00:00:00.563205,98.1580758155367,7.689963484177118,sigmoid,33,39.0,,,,,,,,,,,,,,137.0,COMPLETE
1821,0.6009432182607054,2024-04-11 16:18:08.758995,2024-04-11 16:18:09.344998,0 days 00:00:00.586003,99.9129094806884,8.044677611580365,sigmoid,8,,25.0,31.0,,,,,,,,,,,,,COMPLETE
1822,0.3911756882564171,2024-04-11 16:18:09.346196,2024-04-11 16:18:09.976209,0 days 00:00:00.630013,99.94494729622373,7.331563227118963,sigmoid,49,34.0,,,1.0,8.0,52.0,,,,,,,,,155.0,COMPLETE
1823,0.5974957313602731,2024-04-11 16:18:09.977218,2024-04-11 16:18:10.484919,0 days 00:00:00.507701,95.36138631631006,8.468626006221042,sigmoid,8,,24.0,31.0,,,,,,,,,,,,,COMPLETE
1824,0.2233444540925917,2024-04-11 16:18:10.487040,2024-04-11 16:18:11.163241,0 days 00:00:00.676201,99.96291109952054,7.893932662645486,sigmoid,6,,,,,,,39.0,17.0,8.762090205593863,3.0821047136320527,8.837596992513092,12.0,26.0,93.0,,COMPLETE
1825,0.5963643249384587,2024-04-11 16:18:11.164240,2024-04-11 16:18:11.679105,0 days 00:00:00.514865,98.0167240562977,8.221951732315963,sigmoid,8,,27.0,32.0,,,,,,,,,,,,,COMPLETE
1826,0.49358357394931024,2024-04-11 16:18:11.680106,2024-04-11 16:18:12.327176,0 days 00:00:00.647070,95.5854835196368,6.685589933451178,sigmoid,53,17.0,,,8.0,7.0,36.0,20.0,41.0,,,,,,,118.0,COMPLETE
1827,0.5146454844969987,2024-04-11 16:18:12.328176,2024-04-11 16:18:13.085410,0 days 00:00:00.757234,97.89727858023598,7.602224164472313,sigmoid,19,,,,7.0,4.0,17.0,,,0.6972385850590257,3.343369974728006,7.132703798971904,13.0,23.0,99.0,184.0,COMPLETE
1828,0.35424392253811293,2024-04-11 16:18:13.086944,2024-04-11 16:18:13.797990,0 days 00:00:00.711046,96.82669954841577,8.11232655005582,sigmoid,50,47.0,,,6.0,3.0,39.0,,,7.919021118477527,0.936092928696068,7.728446346025297,17.0,21.0,60.0,,COMPLETE
1829,0.46780205130995456,2024-04-11 16:18:13.799990,2024-04-11 16:18:14.422501,0 days 00:00:00.622511,99.92503533451004,8.95594836130801,sigmoid,25,,24.0,30.0,5.0,6.0,68.0,,,,,,,,,121.0,COMPLETE
1830,0.409427156569053,2024-04-11 16:18:14.423524,2024-04-11 16:18:15.209205,0 days 00:00:00.785681,98.08470567058382,7.795169880295829,sigmoid,29,,26.0,29.0,7.0,1.0,77.0,38.0,14.0,,,,,,,172.0,COMPLETE
1831,0.3838155824611807,2024-04-11 16:18:15.210273,2024-04-11 16:18:16.040434,0 days 00:00:00.830161,95.51409139205902,8.403059079138124,sigmoid,39,32.0,,,,,,27.0,5.0,6.718020329123836,4.639662371167411,9.345217140510279,19.0,29.0,56.0,132.0,COMPLETE
1832,0.3801023756398477,2024-04-11 16:18:16.042433,2024-04-11 16:18:16.758825,0 days 00:00:00.716392,99.95497815956816,7.9544344726445795,sigmoid,43,12.0,28.0,28.0,,,,,,7.1584593726096495,2.28305774816313,7.4366634469736965,16.0,48.0,57.0,142.0,COMPLETE
1833,0.5963643249384587,2024-04-11 16:18:16.759826,2024-04-11 16:18:17.301373,0 days 00:00:00.541547,96.69471169589434,8.22223432138803,sigmoid,8,,25.0,32.0,,,,,,,,,,,,,COMPLETE
1834,0.5929369437606513,2024-04-11 16:18:17.302371,2024-04-11 16:18:17.806676,0 days 00:00:00.504305,97.97002805633919,7.4944423676501115,sigmoid,8,,23.0,33.0,,,,,,,,,,,,,COMPLETE
1835,0.47989015931633633,2024-04-11 16:18:17.808675,2024-04-11 16:18:18.603897,0 days 00:00:00.795222,99.97479890050768,8.578905272654806,sigmoid,58,28.0,25.0,31.0,4.0,5.0,11.0,,,8.494881188314135,2.5353407195461655,5.908144764369305,20.0,30.0,86.0,,COMPLETE
1836,0.37153393869811785,2024-04-11 16:18:18.605891,2024-04-11 16:18:19.305098,0 days 00:00:00.699207,95.51430188882496,7.974372375303707,sigmoid,38,24.0,,,,,,48.0,24.0,1.7571608496218576,3.49363987320791,6.455331730435486,11.0,50.0,65.0,,COMPLETE
1837,0.48323939483832695,2024-04-11 16:18:19.306112,2024-04-11 16:18:20.676040,0 days 00:00:01.369928,98.09299338442423,7.776391361478801,rbf,8,,26.0,30.0,,,,,,,,,,,,,COMPLETE
1838,0.5071510367175889,2024-04-11 16:18:20.677227,2024-04-11 16:18:21.280877,0 days 00:00:00.603650,98.06831826665514,8.748436326493643,sigmoid,24,,26.0,32.0,1.0,3.0,42.0,,,,,,,,,,COMPLETE
1839,0.4515571882881895,2024-04-11 16:18:21.281887,2024-04-11 16:18:22.212805,0 days 00:00:00.930918,99.94860320574301,8.30225756064635,sigmoid,22,,,,6.0,8.0,71.0,5.0,27.0,5.9412914024404575,4.805778268784379,8.01537156061535,18.0,28.0,63.0,,COMPLETE
1840,0.43870253448637003,2024-04-11 16:18:22.214804,2024-04-11 16:18:23.010698,0 days 00:00:00.795894,99.99441567120155,8.077199761984422,sigmoid,47,27.0,22.0,31.0,,,,12.0,11.0,8.306587445075566,4.4726492590506695,9.567908853814632,12.0,31.0,53.0,106.0,COMPLETE
1841,0.12622036262203626,2024-04-11 16:18:23.011849,2024-04-11 16:18:23.599628,0 days 00:00:00.587779,96.61524072509116,8.199687443863402,sigmoid,8,,24.0,29.0,,,,,,,,,,,,,COMPLETE
1842,0.46604735699500177,2024-04-11 16:18:23.600798,2024-04-11 16:18:24.250146,0 days 00:00:00.649348,96.474771508256,7.631131045633212,sigmoid,57,40.0,27.0,33.0,8.0,6.0,97.0,,,,,,,,,165.0,COMPLETE
1843,0.4535835607284068,2024-04-11 16:18:24.251297,2024-04-11 16:18:24.883871,0 days 00:00:00.632574,95.21932670292115,7.889739437672036,sigmoid,21,,,,4.0,7.0,7.0,50.0,39.0,,,,,,,194.0,COMPLETE
1844,0.5906279643331437,2024-04-11 16:18:24.885896,2024-04-11 16:18:25.450493,0 days 00:00:00.564597,98.03502864476643,8.407128828014809,sigmoid,8,,25.0,34.0,,,,,,,,,,,,,COMPLETE
1845,0.5222113793542364,2024-04-11 16:18:25.451562,2024-04-11 16:18:26.164819,0 days 00:00:00.713257,98.08603198446981,8.036192200301361,sigmoid,35,8.0,,,,,,,,9.974534672217501,1.105037471375959,8.496012884610181,15.0,25.0,98.0,113.0,COMPLETE
1846,0.4491845899314583,2024-04-11 16:18:26.165819,2024-04-11 16:18:26.686578,0 days 00:00:00.520759,95.1753126196918,7.1145527241031115,sigmoid,8,,29.0,30.0,,,,,,,,,,,,,COMPLETE
1847,0.4065849432000513,2024-04-11 16:18:26.688836,2024-04-11 16:18:27.429110,0 days 00:00:00.740274,99.9820477002031,7.456896276774746,sigmoid,15,,23.0,32.0,,,,18.0,40.0,7.6367959205774705,1.3744202835884716,6.615540383232191,18.0,20.0,94.0,89.0,COMPLETE
1848,0.4470013751297954,2024-04-11 16:18:27.430329,2024-04-11 16:18:28.273140,0 days 00:00:00.842811,97.9731365088997,7.783102511659961,sigmoid,31,,28.0,31.0,5.0,4.0,83.0,15.0,7.0,1.4252474674694158,3.8043777557785354,6.054344306594195,13.0,22.0,59.0,179.0,COMPLETE
1849,0.44701971028259324,2024-04-11 16:18:28.275140,2024-04-11 16:18:28.790523,0 days 00:00:00.515383,99.95794257128962,8.197417202329662,sigmoid,8,,24.0,30.0,,,,,,,,,,,,,COMPLETE
1850,0.5215158158471656,2024-04-11 16:18:28.792531,2024-04-11 16:18:29.453751,0 days 00:00:00.661220,64.22164454811951,8.479879764367595,sigmoid,3,,,,,,,,,9.014910815267168,4.142505613972181,7.3150213580420544,12.0,34.0,90.0,160.0,COMPLETE
1851,0.4218984818279405,2024-04-11 16:18:29.454751,2024-04-11 16:18:30.253441,0 days 00:00:00.798690,95.29661993027962,7.97605665663247,sigmoid,46,21.0,27.0,32.0,,,,23.0,15.0,9.595022345195037,2.791929026440064,6.79859549258714,14.0,28.0,61.0,,COMPLETE
1852,0.12003789673140693,2024-04-11 16:18:30.255449,2024-04-11 16:18:30.839176,0 days 00:00:00.583727,96.50467215554505,8.312612894199154,sigmoid,8,,25.0,28.0,,,,,,,,,,,,,COMPLETE
1853,0.5394878241651291,2024-04-11 16:18:30.840175,2024-04-11 16:18:31.512529,0 days 00:00:00.672354,97.80536790289464,7.785124554701884,sigmoid,9,,26.0,33.0,,,,,,,,,,,,128.0,COMPLETE
1854,0.328319854886252,2024-04-11 16:18:31.515528,2024-04-11 16:18:32.231446,0 days 00:00:00.715918,97.79105983231113,8.108351354877176,sigmoid,42,33.0,24.0,31.0,,,,,,0.5327595757184849,4.9373020342297265,6.314973287399934,20.0,33.0,88.0,,COMPLETE
1855,0.5137025179937789,2024-04-11 16:18:32.232446,2024-04-11 16:18:32.961876,0 days 00:00:00.729430,8.737241782190466,8.576843417475871,sigmoid,14,,25.0,30.0,,,,43.0,29.0,1.0825931484713172,3.211239240525981,9.721894687282042,16.0,45.0,54.0,,COMPLETE
1856,0.42171008309005165,2024-04-11 16:18:32.964056,2024-04-11 16:18:33.820453,0 days 00:00:00.856397,95.48754702362285,7.620124699516856,sigmoid,62,10.0,27.0,29.0,2.0,1.0,28.0,9.0,42.0,6.136481038565282,1.6820205996980753,8.938063407634816,11.0,49.0,67.0,,COMPLETE
1857,0.5952371952371952,2024-04-11 16:18:33.822452,2024-04-11 16:18:34.356169,0 days 00:00:00.533717,98.2014732337347,7.91505381084805,sigmoid,8,,22.0,32.0,,,,,,,,,,,,,COMPLETE
1858,0.16371375365788776,2024-04-11 16:18:34.358170,2024-04-11 16:18:35.677006,0 days 00:00:01.318836,99.9534718031603,8.306889742835828,rbf,63,36.0,26.0,34.0,7.0,2.0,5.0,7.0,50.0,0.9385184163432516,2.155072285540216,8.733435601301316,17.0,29.0,71.0,152.0,COMPLETE
1859,0.49422580725970083,2024-04-11 16:18:35.678998,2024-04-11 16:18:36.466521,0 days 00:00:00.787523,96.72953465900484,8.120447297033829,sigmoid,26,,23.0,31.0,8.0,5.0,55.0,,,7.405206232865914,4.302416773795488,7.608973828902972,14.0,26.0,92.0,,COMPLETE
1860,0.5588088835773329,2024-04-11 16:18:36.468521,2024-04-11 16:18:37.058598,0 days 00:00:00.590077,98.07578950050699,7.384302219052839,sigmoid,16,,,,1.0,2.0,33.0,,,,,,,,,,COMPLETE
1861,0.24816050454732416,2024-04-11 16:18:37.059598,2024-04-11 16:18:37.708190,0 days 00:00:00.648592,96.49052485128864,8.678540498999443,sigmoid,10,,25.0,30.0,,,,,,1.9106776740125917,2.9623423487917004,8.221214331782196,15.0,48.0,97.0,,COMPLETE
1862,0.5952371952371952,2024-04-11 16:18:37.709333,2024-04-11 16:18:38.256167,0 days 00:00:00.546834,98.15823433941948,7.915620424215119,sigmoid,8,,21.0,32.0,,,,,,,,,,,,,COMPLETE
1863,0.35299528996173096,2024-04-11 16:18:38.257217,2024-04-11 16:18:38.825785,0 days 00:00:00.568568,99.94716296398745,8.38048157734024,sigmoid,41,15.0,24.0,29.0,,,,,,,,,,,,145.0,COMPLETE
1864,0.6009432182607054,2024-04-11 16:18:38.826785,2024-04-11 16:18:39.350695,0 days 00:00:00.523910,99.96135465032255,8.14162050052445,sigmoid,8,,27.0,31.0,,,,,,,,,,,,,COMPLETE
1865,0.48889045471627207,2024-04-11 16:18:39.351694,2024-04-11 16:18:40.075447,0 days 00:00:00.723753,95.24305310664052,7.708272531156407,sigmoid,28,,28.0,33.0,6.0,3.0,74.0,36.0,20.0,,,,,,,,COMPLETE
1866,0.25124255585904265,2024-04-11 16:18:40.077446,2024-04-11 16:18:40.695947,0 days 00:00:00.618501,98.08943508665394,7.9966829677569855,sigmoid,20,,,,3.0,6.0,90.0,31.0,28.0,,,,,,,,COMPLETE
1867,0.49858796296296304,2024-04-11 16:18:40.697948,2024-04-11 16:18:41.417249,0 days 00:00:00.719301,96.35025251598725,8.240324572060572,sigmoid,11,,26.0,31.0,,,,,,5.6749441503513,0.7150654630481785,7.9246963593339705,16.0,30.0,100.0,80.0,COMPLETE
1868,0.45022721836881124,2024-04-11 16:18:41.418250,2024-04-11 16:18:41.982833,0 days 00:00:00.564583,95.05884716341335,8.494707989605581,sigmoid,8,,24.0,28.0,,,,,,,,,,,,,COMPLETE
1869,0.44701971028259324,2024-04-11 16:18:41.983834,2024-04-11 16:18:42.504727,0 days 00:00:00.520893,99.95407292968382,7.796916514998564,sigmoid,8,,26.0,30.0,,,,,,,,,,,,,COMPLETE
1870,0.5952371952371952,2024-04-11 16:18:42.505812,2024-04-11 16:18:43.077576,0 days 00:00:00.571764,98.16461721943465,7.550226432018073,sigmoid,8,,25.0,32.0,,,,,,,,,,,,,COMPLETE
1871,0.5088891237712716,2024-04-11 16:18:43.078736,2024-04-11 16:18:43.732841,0 days 00:00:00.654105,70.35698009265232,8.787059501207214,sigmoid,52,46.0,,,2.0,4.0,15.0,40.0,25.0,,,,,,,,COMPLETE
1872,0.12622036262203626,2024-04-11 16:18:43.734843,2024-04-11 16:18:44.271337,0 days 00:00:00.536494,96.83615586208289,8.067837733733503,sigmoid,8,,29.0,29.0,,,,,,,,,,,,,COMPLETE
1873,0.5069140556625241,2024-04-11 16:18:44.272404,2024-04-11 16:18:44.802806,0 days 00:00:00.530402,95.45556939087982,8.323307410545482,sigmoid,8,,23.0,35.0,,,,,,,,,,,,,COMPLETE
1874,0.34218141131988117,2024-04-11 16:18:44.803826,2024-04-11 16:18:45.764801,0 days 00:00:00.960975,97.72784307303556,7.8614750245980956,rbf,56,7.0,25.0,31.0,5.0,7.0,65.0,,,,,,,,,,COMPLETE
1875,0.48237163814180933,2024-04-11 16:18:45.766800,2024-04-11 16:18:46.602884,0 days 00:00:00.836084,98.21949485766851,8.126964086316772,sigmoid,59,44.0,27.0,30.0,7.0,8.0,24.0,,,9.22078800309744,3.5147019671888784,9.401087460332729,18.0,32.0,89.0,102.0,COMPLETE
1876,0.32890890416370383,2024-04-11 16:18:46.603892,2024-04-11 16:18:47.162064,0 days 00:00:00.558172,95.19195397898602,7.688651515573559,sigmoid,48,25.0,,,4.0,1.0,92.0,,,,,,,,,,COMPLETE
1877,0.5427851475457631,2024-04-11 16:18:47.163064,2024-04-11 16:18:47.717227,0 days 00:00:00.554163,98.02100531357577,8.441362431758465,sigmoid,37,22.0,,,,,,17.0,36.0,,,,,,,124.0,COMPLETE
1878,0.49538565935308754,2024-04-11 16:18:47.719411,2024-04-11 16:18:48.370231,0 days 00:00:00.650820,96.72416960000822,7.286374839199906,sigmoid,44,41.0,24.0,33.0,,,,4.0,12.0,,,,,,,,COMPLETE
1879,0.30441584855477766,2024-04-11 16:18:48.371239,2024-04-11 16:18:48.938745,0 days 00:00:00.567506,98.18999275153121,7.971911237438133,sigmoid,12,,26.0,32.0,,,,10.0,46.0,,,,,,,,COMPLETE
1880,0.46628277011668434,2024-04-11 16:18:48.939746,2024-04-11 16:18:49.775890,0 days 00:00:00.836144,95.21222842728508,8.253477368940429,sigmoid,55,2.0,,,1.0,5.0,85.0,21.0,38.0,1.6013980667942431,1.9421693122479224,6.0645993035460855,10.0,46.0,96.0,135.0,COMPLETE
1881,0.41160061853794605,2024-04-11 16:18:49.776884,2024-04-11 16:18:50.555133,0 days 00:00:00.778249,99.95555076772719,7.863111407165,sigmoid,60,29.0,28.0,31.0,8.0,2.0,47.0,44.0,34.0,,,,,,,,COMPLETE
1882,0.4502698896972542,2024-04-11 16:18:50.556141,2024-04-11 16:18:51.075019,0 days 00:00:00.518878,99.91721871107643,6.33278736674496,sigmoid,8,,25.0,30.0,,,,,,,,,,,,,COMPLETE
1883,0.3311015987999854,2024-04-11 16:18:51.076018,2024-04-11 16:18:51.675806,0 days 00:00:00.599788,98.1425852974796,8.110265090097794,sigmoid,13,,23.0,33.0,,,,25.0,18.0,,,,,,,200.0,COMPLETE
1884,0.45372787181806434,2024-04-11 16:18:51.676807,2024-04-11 16:18:52.457457,0 days 00:00:00.780650,99.97850771131729,7.5409958363534075,sigmoid,23,,,,6.0,4.0,79.0,33.0,16.0,6.4818762130868395,2.4229222025834707,6.971213156960417,20.0,27.0,52.0,168.0,COMPLETE
1885,0.5952371952371952,2024-04-11 16:18:52.458680,2024-04-11 16:18:53.049617,0 days 00:00:00.590937,95.24124645314699,8.62777556930939,sigmoid,8,,26.0,32.0,,,,,,,,,,,,,COMPLETE
1886,0.5170292243462975,2024-04-11 16:18:53.050615,2024-04-11 16:18:53.592525,0 days 00:00:00.541910,96.62183002583322,8.35659430550117,sigmoid,40,11.0,24.0,31.0,,,,,,,,,,,,,COMPLETE
1887,0.5035708026638627,2024-04-11 16:18:53.593526,2024-04-11 16:18:54.195263,0 days 00:00:00.601737,99.97859106011126,9.157801629749187,sigmoid,32,48.0,,,,,,,,,,,,,,,COMPLETE
1888,0.4056779977586851,2024-04-11 16:18:54.197409,2024-04-11 16:18:55.021453,0 days 00:00:00.824044,98.1259106995536,7.972829752436974,sigmoid,54,17.0,,,3.0,6.0,31.0,34.0,43.0,9.78018804354879,5.514442598820629,5.769881243827164,13.0,47.0,50.0,,COMPLETE
1889,0.48217301334348167,2024-04-11 16:18:55.022972,2024-04-11 16:18:55.796612,0 days 00:00:00.773640,96.8846795768058,7.698762886025075,sigmoid,7,,,,,,,14.0,4.0,5.398879616714755,5.304864685280736,8.423579965943121,19.0,37.0,66.0,74.0,COMPLETE
1890,0.45205726350481484,2024-04-11 16:18:55.797776,2024-04-11 16:18:56.594592,0 days 00:00:00.796816,98.08219500595374,8.1814813176169,sigmoid,61,23.0,22.0,29.0,5.0,8.0,60.0,11.0,48.0,,,,,,,95.0,COMPLETE
1891,0.594268224819143,2024-04-11 16:18:56.596592,2024-04-11 16:18:57.122537,0 days 00:00:00.525945,99.9845098477144,7.858157931707217,sigmoid,8,,27.0,27.0,,,,,,,,,,,,,COMPLETE
1892,0.5499901980003922,2024-04-11 16:18:57.124689,2024-04-11 16:18:57.659415,0 days 00:00:00.534726,95.25047265841698,8.486211091054678,sigmoid,36,38.0,,,,,,16.0,22.0,,,,,,,,COMPLETE
