number,value,datetime_start,datetime_complete,duration,params_C,params_gamma,params_kernel,params_mask_number,params_rsi_window,params_so_smooth,params_so_window,params_srsi_smooth1,params_srsi_smooth2,params_srsi_window,params_tsi_window_fast,params_tsi_window_slow,params_ult_weight_1,params_ult_weight_2,params_ult_weight_3,params_ult_window_1,params_ult_window_2,params_ult_window_3,params_williams_lbp,state
1893,0.5895095625828441,2024-04-11 16:18:57.660414,2024-04-11 16:18:58.190368,0 days 00:00:00.529954,96.74330421650987,8.07251050867174,sigmoid,8,,25.0,34.0,,,,,,,,,,,,,COMPLETE
1894,0.45345352376492626,2024-04-11 16:18:58.192461,2024-04-11 16:18:58.729094,0 days 00:00:00.536633,98.13236017368627,8.280621774777485,sigmoid,8,,24.0,30.0,,,,,,,,,,,,,COMPLETE
1895,0.30890886335191714,2024-04-11 16:18:58.731089,2024-04-11 16:18:59.743428,0 days 00:00:01.012339,94.97770648274536,7.666889112973396,rbf,34,4.0,,,,,,,,7.2193641672715065,0.9663259535296262,9.052999971628928,17.0,23.0,54.0,,COMPLETE
1896,0.5952371952371952,2024-04-11 16:18:59.744432,2024-04-11 16:19:00.273108,0 days 00:00:00.528676,98.05456536124177,7.925196476582049,sigmoid,8,,28.0,32.0,,,,,,,,,,,,,COMPLETE
1897,0.4332062760393582,2024-04-11 16:19:00.274200,2024-04-11 16:19:01.070879,0 days 00:00:00.796679,98.2028565173834,8.163847763920629,sigmoid,27,,26.0,31.0,2.0,3.0,37.0,,,2.63079743798879,4.051972394170075,9.489440797712275,14.0,25.0,58.0,63.0,COMPLETE
1898,0.5025534235708266,2024-04-11 16:19:01.071881,2024-04-11 16:19:01.913766,0 days 00:00:00.841885,96.51549118155829,7.467131384600069,sigmoid,30,,23.0,28.0,4.0,7.0,57.0,28.0,33.0,8.655181702553222,4.795517386685235,5.609218780507959,11.0,31.0,63.0,,COMPLETE
1899,0.5395576223692841,2024-04-11 16:19:01.914767,2024-04-11 16:19:02.458642,0 days 00:00:00.543875,98.2968120929209,8.372389872520706,sigmoid,5,,,,,,,13.0,13.0,,,,,,,110.0,COMPLETE
1900,0.5703019076899575,2024-04-11 16:19:02.460643,2024-04-11 16:19:02.966807,0 days 00:00:00.506164,95.09722731609719,8.763433961172472,sigmoid,4,,,,,,,22.0,32.0,,,,,,,,COMPLETE
1901,0.44701971028259324,2024-04-11 16:19:02.967851,2024-04-11 16:19:03.503939,0 days 00:00:00.536088,98.12315812738974,7.785800002591861,sigmoid,8,,21.0,30.0,,,,,,,,,,,,,COMPLETE
1902,0.5008256348462533,2024-04-11 16:19:03.505093,2024-04-11 16:19:04.218787,0 days 00:00:00.713694,99.94250911433559,8.049983232677631,sigmoid,19,,,,7.0,1.0,49.0,,,2.1100779135591323,2.7088061897965305,6.182342585781397,12.0,42.0,84.0,174.0,COMPLETE
1903,0.4777175690194797,2024-04-11 16:19:04.219806,2024-04-11 16:19:04.913478,0 days 00:00:00.693672,96.572024809993,6.947105445221368,sigmoid,53,6.0,,,6.0,5.0,88.0,19.0,6.0,,,,,,,116.0,COMPLETE
1904,0.5929369437606513,2024-04-11 16:19:04.915477,2024-04-11 16:19:05.435768,0 days 00:00:00.520291,99.96411898632005,8.533096690209403,sigmoid,8,,25.0,33.0,,,,,,,,,,,,,COMPLETE
1905,0.5986580986580987,2024-04-11 16:19:05.436305,2024-04-11 16:19:05.956562,0 days 00:00:00.520257,94.9574331413862,8.207889925594445,sigmoid,8,,27.0,31.0,,,,,,,,,,,,,COMPLETE
1906,0.4404030320990736,2024-04-11 16:19:05.957619,2024-04-11 16:19:06.504930,0 days 00:00:00.547311,99.95124887578443,7.975009785046554,sigmoid,33,43.0,,,,,,,,,,,,,,140.0,COMPLETE
1907,0.35940430226144515,2024-04-11 16:19:06.505929,2024-04-11 16:19:07.328379,0 days 00:00:00.822450,96.65061610302779,7.800734081077684,sigmoid,51,31.0,,,1.0,2.0,12.0,,,6.9282493859790435,1.4869619328890735,8.608925381912464,18.0,34.0,99.0,158.0,COMPLETE
1908,0.4702578314445489,2024-04-11 16:19:07.330451,2024-04-11 16:19:07.965004,0 days 00:00:00.634553,97.95379551967963,8.34267524230812,sigmoid,25,,25.0,29.0,8.0,6.0,69.0,,,,,,,,,185.0,COMPLETE
1909,0.5952371952371952,2024-04-11 16:19:07.967003,2024-04-11 16:19:08.490991,0 days 00:00:00.523988,96.81625932568282,7.556723842916948,sigmoid,8,,26.0,32.0,,,,,,,,,,,,,COMPLETE
1910,0.47220461305895556,2024-04-11 16:19:08.492979,2024-04-11 16:19:09.049607,0 days 00:00:00.556628,98.34466565289341,8.148804452656853,sigmoid,17,,,,3.0,4.0,96.0,,,,,,,,,84.0,COMPLETE
1911,0.43844331461122793,2024-04-11 16:19:09.050630,2024-04-11 16:19:09.664791,0 days 00:00:00.614161,96.32818560154172,7.969511658110935,sigmoid,49,27.0,,,5.0,3.0,19.0,,,,,,,,,54.0,COMPLETE
1912,0.16679465519889417,2024-04-11 16:19:09.665907,2024-04-11 16:19:10.765471,0 days 00:00:01.099564,3.018368932146842,8.458104981110074,rbf,58,13.0,24.0,30.0,4.0,7.0,100.0,,,8.181552601150244,4.4312184832653,5.00127032947124,15.0,41.0,85.0,,COMPLETE
1913,0.39461326893405785,2024-04-11 16:19:10.767472,2024-04-11 16:19:11.410981,0 days 00:00:00.643509,99.93276650695363,7.721099230318098,sigmoid,45,14.0,26.0,31.0,,,,8.0,10.0,,,,,,,193.0,COMPLETE
1914,0.28610946453270103,2024-04-11 16:19:11.411982,2024-04-11 16:19:12.132842,0 days 00:00:00.720860,99.99051624482516,7.333880808331638,sigmoid,6,,,,,,,2.0,45.0,7.841957827703812,3.65466167985896,8.111771695450033,11.0,20.0,62.0,,COMPLETE
1915,0.5963643249384587,2024-04-11 16:19:12.135077,2024-04-11 16:19:12.666253,0 days 00:00:00.531176,95.18119533370921,8.236226138658242,sigmoid,8,,23.0,32.0,,,,,,,,,,,,,COMPLETE
1916,0.5906279643331437,2024-04-11 16:19:12.667324,2024-04-11 16:19:13.240091,0 days 00:00:00.572767,99.9820704933124,8.020133860851756,sigmoid,8,,27.0,34.0,,,,,,,,,,,,,COMPLETE
1917,0.3846312037290924,2024-04-11 16:19:13.241628,2024-04-11 16:19:14.007050,0 days 00:00:00.765422,97.82654765520456,8.922329738162645,sigmoid,43,50.0,30.0,29.0,,,,,,2.8760545268603375,3.9242026826692378,5.262758612184096,13.0,36.0,55.0,150.0,COMPLETE
1918,0.3439519054693708,2024-04-11 16:19:14.008050,2024-04-11 16:19:14.760806,0 days 00:00:00.752756,94.98328336449212,8.607897121364065,sigmoid,50,37.0,,,1.0,8.0,22.0,,,8.887797723543933,1.1673980483071666,7.1418065618794895,19.0,50.0,86.0,,COMPLETE
1919,0.4495308763107868,2024-04-11 16:19:14.762806,2024-04-11 16:19:15.489037,0 days 00:00:00.726231,96.70129786206698,7.850175918482341,sigmoid,29,,25.0,30.0,5.0,3.0,42.0,26.0,2.0,,,,,,,181.0,COMPLETE
1920,0.5117931034482759,2024-04-11 16:19:15.490037,2024-04-11 16:19:16.124846,0 days 00:00:00.634809,98.27992428116868,8.2766692353524,sigmoid,21,,,,2.0,5.0,51.0,45.0,35.0,,,,,,,68.0,COMPLETE
1921,0.49305366385181143,2024-04-11 16:19:16.125847,2024-04-11 16:19:16.942952,0 days 00:00:00.817105,75.99330866620116,8.07204316414667,sigmoid,47,9.0,23.0,33.0,,,,42.0,37.0,9.485521980559152,1.7985978980761304,0.5080763074676691,16.0,27.0,91.0,91.0,COMPLETE
1922,0.5041030486895111,2024-04-11 16:19:16.944954,2024-04-11 16:19:17.687403,0 days 00:00:00.742449,98.25498975689727,7.61925552908906,sigmoid,39,35.0,,,,,,38.0,3.0,1.2216167057757374,4.996110045028242,6.856375285375525,12.0,32.0,68.0,189.0,COMPLETE
1923,0.6009432182607054,2024-04-11 16:19:17.689425,2024-04-11 16:19:18.238246,0 days 00:00:00.548821,99.97688702459571,7.899165527140224,sigmoid,8,,28.0,31.0,,,,,,,,,,,,,COMPLETE
1924,0.5986314388899449,2024-04-11 16:19:18.239247,2024-04-11 16:19:18.746333,0 days 00:00:00.507086,96.6653193253962,8.486161376197671,sigmoid,8,,24.0,31.0,,,,,,,,,,,,,COMPLETE
1925,0.39179720877242946,2024-04-11 16:19:18.748875,2024-04-11 16:19:19.388768,0 days 00:00:00.639893,99.9641204226139,8.189680797645707,sigmoid,24,,26.0,32.0,6.0,2.0,9.0,,,,,,,,,,COMPLETE
1926,0.31853607729052186,2024-04-11 16:19:19.389951,2024-04-11 16:19:20.176999,0 days 00:00:00.787048,99.9768732915766,7.80773634203154,sigmoid,22,,,,7.0,6.0,44.0,49.0,30.0,6.215611896827242,0.6361292431444978,0.6984656735573482,20.0,21.0,65.0,,COMPLETE
1927,0.5206319663289694,2024-04-11 16:19:20.179163,2024-04-11 16:19:20.939747,0 days 00:00:00.760584,94.84677929838551,8.358917048227966,sigmoid,35,39.0,,,,,,,,6.748010827618438,2.5867766472764835,7.390462512005845,9.0,26.0,75.0,98.0,COMPLETE
1928,0.44701971028259324,2024-04-11 16:19:20.941755,2024-04-11 16:19:21.481852,0 days 00:00:00.540097,97.0293495449435,8.025569382928802,sigmoid,8,,22.0,30.0,,,,,,,,,,,,,COMPLETE
1929,0.49495079990526025,2024-04-11 16:19:21.483847,2024-04-11 16:19:22.221062,0 days 00:00:00.737215,98.16184673137386,7.422506697423146,sigmoid,38,16.0,,,,,,20.0,26.0,3.259963569597052,2.212274617468595,5.891000467714863,13.0,49.0,80.0,,COMPLETE
1930,0.32850533807829185,2024-04-11 16:19:22.223266,2024-04-11 16:19:23.261045,0 days 00:00:01.037779,95.12092043744704,8.665258719738722,rbf,9,,25.0,28.0,,,,,,,,,,,,104.0,COMPLETE
1931,0.4852182191712182,2024-04-11 16:19:23.262056,2024-04-11 16:19:24.070371,0 days 00:00:00.808315,98.01630102990296,7.640641661080801,sigmoid,15,,27.0,32.0,,,,23.0,31.0,2.317423267393038,3.249079424778304,6.65447226197807,14.0,33.0,94.0,164.0,COMPLETE
1932,0.3605697400312095,2024-04-11 16:19:24.071553,2024-04-11 16:19:24.761082,0 days 00:00:00.689529,96.75943724898973,8.122022915731284,sigmoid,57,26.0,24.0,30.0,3.0,1.0,26.0,,,,,,,,,124.0,COMPLETE
1933,0.3190683369589678,2024-04-11 16:19:24.763082,2024-04-11 16:19:25.399794,0 days 00:00:00.636712,99.96115029761879,8.339627726326036,sigmoid,3,,,,,,,,,5.811356753722742,5.740668843466614,7.746470928713534,19.0,38.0,87.0,59.0,COMPLETE
1934,0.5929369437606513,2024-04-11 16:19:25.401793,2024-04-11 16:19:25.921138,0 days 00:00:00.519345,94.98018461498259,7.9514331191465555,sigmoid,8,,26.0,33.0,,,,,,,,,,,,,COMPLETE
1935,0.5077891567639076,2024-04-11 16:19:25.923138,2024-04-11 16:19:26.662397,0 days 00:00:00.739259,97.00299686105515,8.168248393976452,sigmoid,42,45.0,25.0,29.0,,,,,,3.663758903128305,4.591060676129617,9.9763974799545,17.0,22.0,70.0,,COMPLETE
1936,0.3419962210362316,2024-04-11 16:19:26.664397,2024-04-11 16:19:27.408613,0 days 00:00:00.744216,98.14283031680925,7.183710359321262,sigmoid,14,,28.0,31.0,,,,47.0,8.0,0.7298687772162342,5.152200711574347,9.304775750285891,10.0,30.0,51.0,,COMPLETE
1937,0.5952371952371952,2024-04-11 16:19:27.410609,2024-04-11 16:19:27.951833,0 days 00:00:00.541224,98.17375143770018,7.758948880528688,sigmoid,8,,29.0,32.0,,,,,,,,,,,,,COMPLETE
1938,0.49385518411519236,2024-04-11 16:19:27.952835,2024-04-11 16:19:28.651460,0 days 00:00:00.698625,95.0960818235117,8.44441039298073,sigmoid,28,,24.0,30.0,4.0,4.0,82.0,37.0,49.0,,,,,,,,COMPLETE
1939,0.40584259585508825,2024-04-11 16:19:28.652464,2024-04-11 16:19:29.184796,0 days 00:00:00.532332,98.28209479085635,9.49637035172223,sigmoid,16,,,,8.0,5.0,63.0,,,,,,,,,,COMPLETE
1940,0.4199662508286627,2024-04-11 16:19:29.186796,2024-04-11 16:19:29.968814,0 days 00:00:00.782018,99.96039871097918,7.9626297353821105,sigmoid,46,33.0,26.0,31.0,,,,32.0,14.0,8.497129153446762,5.487414132725063,6.4419558799777175,11.0,45.0,57.0,,COMPLETE
1941,0.5929369437606513,2024-04-11 16:19:29.969813,2024-04-11 16:19:30.498989,0 days 00:00:00.529176,96.73965132814877,8.237192934030661,sigmoid,8,,23.0,33.0,,,,,,,,,,,,,COMPLETE
1942,0.46688415143008877,2024-04-11 16:19:30.499989,2024-04-11 16:19:31.393253,0 days 00:00:00.893264,99.96022963799753,7.50755905359942,sigmoid,31,,25.0,29.0,2.0,7.0,16.0,27.0,21.0,3.0487608662532177,1.3634078673659786,9.747167723197947,18.0,35.0,81.0,77.0,COMPLETE
1943,0.47262225035606903,2024-04-11 16:19:31.395306,2024-04-11 16:19:32.355298,0 days 00:00:00.959992,73.82283526089152,7.8094701249333855,sigmoid,63,18.0,27.0,31.0,3.0,8.0,76.0,3.0,42.0,5.305461006962769,5.882091004106896,8.91905298496549,16.0,43.0,83.0,176.0,COMPLETE
1944,0.5952371952371952,2024-04-11 16:19:32.356299,2024-04-11 16:19:32.879887,0 days 00:00:00.523588,94.77290712093783,8.074133271647083,sigmoid,8,,22.0,32.0,,,,,,,,,,,,,COMPLETE
1945,0.307942154512412,2024-04-11 16:19:32.881888,2024-04-11 16:19:33.549610,0 days 00:00:00.667722,99.99707518374875,8.681062373486288,sigmoid,10,,26.0,30.0,,,,,,7.067234383993277,3.0409504576797035,5.406888341467968,15.0,36.0,95.0,,COMPLETE
1946,0.3951965065502183,2024-04-11 16:19:33.550611,2024-04-11 16:19:34.351128,0 days 00:00:00.800517,96.90444194701766,8.33901294423529,sigmoid,11,,24.0,31.0,,,,,,3.900090278204833,1.9964645832056607,8.586553359614479,13.0,24.0,72.0,134.0,COMPLETE
1947,0.5929369437606513,2024-04-11 16:19:34.352129,2024-04-11 16:19:34.881498,0 days 00:00:00.529369,98.16592558168672,7.884280283013122,sigmoid,8,,25.0,33.0,,,,,,,,,,,,,COMPLETE
1948,0.44599795121681113,2024-04-11 16:19:34.883490,2024-04-11 16:19:35.851699,0 days 00:00:00.968209,96.55198580993599,7.669240436153595,sigmoid,62,46.0,27.0,32.0,7.0,6.0,53.0,35.0,27.0,7.715278463801422,3.635858589897473,7.927897629705491,15.0,44.0,77.0,,COMPLETE
1949,0.45098754178061373,2024-04-11 16:19:35.852837,2024-04-11 16:19:37.190880,0 days 00:00:01.338043,99.99906156561781,8.166464758221093,rbf,8,,25.0,29.0,,,,,,,,,,,,,COMPLETE
1950,0.5906279643331437,2024-04-11 16:19:37.191880,2024-04-11 16:19:37.784892,0 days 00:00:00.593012,98.05864037772199,7.999979989611108,sigmoid,8,,24.0,34.0,,,,,,,,,,,,,COMPLETE
1951,0.5319282925395692,2024-04-11 16:19:37.785962,2024-04-11 16:19:38.379796,0 days 00:00:00.593834,94.92166146408323,8.486384710384641,sigmoid,37,42.0,,,,,,29.0,9.0,,,,,,,118.0,COMPLETE
1952,0.45345352376492626,2024-04-11 16:19:38.381796,2024-04-11 16:19:38.912640,0 days 00:00:00.530844,96.63098480650379,8.236460713340682,sigmoid,8,,28.0,30.0,,,,,,,,,,,,,COMPLETE
1953,0.24531443618339527,2024-04-11 16:19:38.913640,2024-04-11 16:19:39.566216,0 days 00:00:00.652576,99.99372635790031,7.802928864935458,sigmoid,20,,,,5.0,3.0,35.0,5.0,23.0,,,,,,,,COMPLETE
1954,0.3571008272472397,2024-04-11 16:19:39.568215,2024-04-11 16:19:40.193266,0 days 00:00:00.625051,95.2336408615264,8.056107521425298,sigmoid,41,34.0,23.0,32.0,,,,,,,,,,,,35.0,COMPLETE
1955,0.4268867924528301,2024-04-11 16:19:40.194266,2024-04-11 16:19:40.856185,0 days 00:00:00.661919,98.36339505055102,7.650115502591355,sigmoid,56,5.0,26.0,31.0,6.0,1.0,72.0,,,,,,,,,,COMPLETE
1956,0.4512950859356088,2024-04-11 16:19:40.858204,2024-04-11 16:19:41.395495,0 days 00:00:00.537291,98.26325027168517,8.510272499360061,sigmoid,8,,27.0,28.0,,,,,,,,,,,,,COMPLETE
1957,0.5003854435258779,2024-04-11 16:19:41.396496,2024-04-11 16:19:42.044378,0 days 00:00:00.647882,99.99247448655099,7.376481172064108,sigmoid,52,48.0,,,1.0,4.0,2.0,6.0,17.0,,,,,,,,COMPLETE
1958,0.431307854458803,2024-04-11 16:19:42.045376,2024-04-11 16:19:42.902908,0 days 00:00:00.857532,96.46239177170602,8.323599880767858,sigmoid,59,20.0,29.0,32.0,7.0,8.0,98.0,,,6.409575131815458,4.256912898388872,6.259830794218115,12.0,41.0,93.0,109.0,COMPLETE
1959,0.5090741120919728,2024-04-11 16:19:42.904049,2024-04-11 16:19:43.563563,0 days 00:00:00.659514,94.88271978853842,7.992080461133324,sigmoid,48,8.0,,,2.0,7.0,13.0,,,,,,,,,,COMPLETE
1960,0.40363716313838804,2024-04-11 16:19:43.565564,2024-04-11 16:19:44.329867,0 days 00:00:00.764303,99.9922192185271,8.808833656479962,sigmoid,26,,24.0,31.0,8.0,4.0,66.0,,,1.429316019263437,0.539398720766795,7.485179653070437,14.0,23.0,64.0,,COMPLETE
1961,0.5069140556625241,2024-04-11 16:19:44.330873,2024-04-11 16:19:44.930304,0 days 00:00:00.599431,98.06396803772066,8.19413198228143,sigmoid,8,,26.0,35.0,,,,,,,,,,,,,COMPLETE
1962,0.44701971028259324,2024-04-11 16:19:44.932547,2024-04-11 16:19:45.535204,0 days 00:00:00.602657,96.87199836906163,7.8452766232061055,sigmoid,8,,22.0,30.0,,,,,,,,,,,,,COMPLETE
1963,0.3493708893337146,2024-04-11 16:19:45.537217,2024-04-11 16:19:46.361093,0 days 00:00:00.823876,98.22119526077041,7.558903242585177,sigmoid,23,,,,4.0,2.0,29.0,18.0,28.0,0.504235016732423,0.9921466795243417,7.193701710713987,17.0,28.0,79.0,155.0,COMPLETE
1964,0.5324624562847151,2024-04-11 16:19:46.363094,2024-04-11 16:19:47.007846,0 days 00:00:00.644752,94.930850943687,8.55571801181531,sigmoid,12,,25.0,29.0,,,,25.0,19.0,,,,,,,,COMPLETE
1965,0.3401170005318206,2024-04-11 16:19:47.008947,2024-04-11 16:19:47.624741,0 days 00:00:00.615794,98.07235570729667,8.02224389325838,sigmoid,44,36.0,27.0,33.0,,,,39.0,25.0,,,,,,,,COMPLETE
1966,0.5273802382380667,2024-04-11 16:19:47.626824,2024-04-11 16:19:48.326061,0 days 00:00:00.699237,96.50391630696085,8.227400547849829,sigmoid,13,,21.0,31.0,,,,40.0,44.0,,,,,,,147.0,COMPLETE
1967,0.4570000515277992,2024-04-11 16:19:48.327209,2024-04-11 16:19:49.043788,0 days 00:00:00.716579,98.1029851469297,7.795628803074285,sigmoid,60,30.0,23.0,30.0,1.0,5.0,93.0,43.0,47.0,,,,,,,,COMPLETE
1968,0.5929369437606513,2024-04-11 16:19:49.045858,2024-04-11 16:19:49.612665,0 days 00:00:00.566807,96.42831521091694,8.449131672877037,sigmoid,8,,25.0,33.0,,,,,,,,,,,,,COMPLETE
1969,0.32632603757256695,2024-04-11 16:19:49.613666,2024-04-11 16:19:50.319557,0 days 00:00:00.705891,99.98223050168639,8.11746534337105,sigmoid,7,,,,,,,31.0,40.0,4.944957070092197,2.8650795996166907,0.9180083315718459,9.0,31.0,61.0,197.0,COMPLETE
1970,0.45756966388968684,2024-04-11 16:19:50.320559,2024-04-11 16:19:51.742380,0 days 00:00:01.421821,95.03394952674874,7.913674889722795,rbf,8,,24.0,27.0,,,,,,,,,,,,,COMPLETE
1971,0.5084494580844946,2024-04-11 16:19:51.744386,2024-04-11 16:19:52.410159,0 days 00:00:00.665773,98.10804395771116,8.329471519429916,sigmoid,40,11.0,28.0,32.0,,,,,,,,,,,,,COMPLETE
1972,0.4989883150386969,2024-04-11 16:19:52.411154,2024-04-11 16:19:53.275126,0 days 00:00:00.863972,98.22740025445428,7.702308862566776,sigmoid,27,,26.0,30.0,5.0,3.0,58.0,,,4.621627428062825,1.6093751055840708,4.69445017383511,20.0,37.0,89.0,72.0,COMPLETE
1973,0.3919660830842433,2024-04-11 16:19:53.277127,2024-04-11 16:19:54.036496,0 days 00:00:00.759369,99.9804689405516,8.043422918842717,sigmoid,61,29.0,25.0,34.0,3.0,6.0,5.0,46.0,13.0,,,,,,,10.0,COMPLETE
1974,0.5838604458380638,2024-04-11 16:19:54.037567,2024-04-11 16:19:54.569269,0 days 00:00:00.531702,95.08333770885021,8.314131605088074,sigmoid,32,12.0,,,,,,,,,,,,,,,COMPLETE
1975,0.4290309836898245,2024-04-11 16:19:54.570293,2024-04-11 16:19:55.456857,0 days 00:00:00.886564,96.92725685070067,7.443573328427834,sigmoid,55,24.0,,,6.0,2.0,56.0,11.0,41.0,2.43779601676585,4.8722673157790135,5.200897661290941,10.0,39.0,74.0,86.0,COMPLETE
1976,0.42453715286464844,2024-04-11 16:19:55.460000,2024-04-11 16:19:56.250938,0 days 00:00:00.790938,98.14661226446711,8.656754296290407,sigmoid,54,49.0,,,2.0,1.0,79.0,50.0,24.0,9.989622816975356,3.4260628018442905,5.61909802616289,19.0,25.0,91.0,,COMPLETE
1977,0.6009432182607054,2024-04-11 16:19:56.252104,2024-04-11 16:19:56.823934,0 days 00:00:00.571830,99.9915502045652,7.914642626473109,sigmoid,8,,26.0,31.0,,,,,,,,,,,,,COMPLETE
1978,0.4297649059037345,2024-04-11 16:19:56.824943,2024-04-11 16:19:57.739062,0 days 00:00:00.914119,96.66212372945819,8.14395881889378,sigmoid,30,,27.0,28.0,4.0,5.0,87.0,30.0,20.0,9.408763161416479,6.051049867570734,6.879705058431527,16.0,29.0,59.0,,COMPLETE
1979,0.5424613321037852,2024-04-11 16:19:57.741203,2024-04-11 16:19:58.326472,0 days 00:00:00.585269,95.14152980507025,7.1949734022845515,sigmoid,5,,,,,,,4.0,36.0,,,,,,,171.0,COMPLETE
1980,0.12622036262203626,2024-04-11 16:19:58.328613,2024-04-11 16:19:58.877051,0 days 00:00:00.548438,99.9838622585767,7.771205676257312,sigmoid,8,,23.0,29.0,,,,,,,,,,,,,COMPLETE
1981,0.4498437795871994,2024-04-11 16:19:58.879205,2024-04-11 16:19:59.391011,0 days 00:00:00.511806,96.6504465853974,8.410456572395862,sigmoid,4,,,,,,,41.0,7.0,,,,,,,,COMPLETE
1982,0.3202092821921933,2024-04-11 16:19:59.393164,2024-04-11 16:19:59.972014,0 days 00:00:00.578850,98.3911944640938,8.11711260866183,sigmoid,36,19.0,,,,,,12.0,39.0,,,,,,,,COMPLETE
1983,0.5952371952371952,2024-04-11 16:19:59.973039,2024-04-11 16:20:00.514150,0 days 00:00:00.541111,98.31696079699365,7.598683975497599,sigmoid,8,,24.0,32.0,,,,,,,,,,,,,COMPLETE
1984,0.5244834537208131,2024-04-11 16:20:00.515151,2024-04-11 16:20:01.196540,0 days 00:00:00.681389,94.9413439253029,7.901352063378687,sigmoid,34,22.0,,,,,,,,9.15924772553211,5.315865197950781,7.702852980238402,18.0,40.0,76.0,,COMPLETE
1985,0.38441431138702825,2024-04-11 16:20:01.197542,2024-04-11 16:20:01.880947,0 days 00:00:00.683405,96.61122234594431,8.215221882494788,sigmoid,45,2.0,25.0,31.0,,,,16.0,46.0,,,,,,,45.0,COMPLETE
1986,0.44701971028259324,2024-04-11 16:20:01.881947,2024-04-11 16:20:02.515363,0 days 00:00:00.633416,98.09491822593364,7.988878183213589,sigmoid,8,,29.0,30.0,,,,,,,,,,,,,COMPLETE
1987,0.4523637458596808,2024-04-11 16:20:02.516510,2024-04-11 16:20:03.825247,0 days 00:00:01.308737,94.69774603780793,8.495990541595107,rbf,8,,24.0,32.0,,,,,,,,,,,,,COMPLETE
1988,0.5019456993335422,2024-04-11 16:20:03.827247,2024-04-11 16:20:04.489524,0 days 00:00:00.662277,98.04680761230892,9.034413681117858,sigmoid,49,28.0,,,7.0,7.0,40.0,,,,,,,,,161.0,COMPLETE
1989,0.6009432182607054,2024-04-11 16:20:04.490525,2024-04-11 16:20:05.040156,0 days 00:00:00.549631,98.15227979505485,7.660976534735641,sigmoid,8,,26.0,31.0,,,,,,,,,,,,,COMPLETE
1990,0.4905040094182457,2024-04-11 16:20:05.041156,2024-04-11 16:20:05.804657,0 days 00:00:00.763501,96.4659662142406,8.373832327341356,sigmoid,19,,,,8.0,8.0,33.0,,,3.4957213982142106,2.2798793754615985,4.886443654240323,13.0,47.0,84.0,129.0,COMPLETE
1991,0.39933501134209626,2024-04-11 16:20:05.806810,2024-04-11 16:20:06.626671,0 days 00:00:00.819861,98.34853550525588,8.118542296307044,sigmoid,51,10.0,,,6.0,3.0,45.0,,,7.950216616415502,1.2400133216737368,9.150617187102053,10.0,48.0,67.0,94.0,COMPLETE
1992,0.4564757565896518,2024-04-11 16:20:06.628819,2024-04-11 16:20:07.446461,0 days 00:00:00.817642,96.65373079170561,8.843226773465574,sigmoid,58,41.0,27.0,33.0,3.0,2.0,74.0,,,4.276507746204007,4.720581631066422,9.581239197117892,17.0,46.0,97.0,,COMPLETE
1993,0.5622209279751504,2024-04-11 16:20:07.449611,2024-04-11 16:20:08.126777,0 days 00:00:00.677166,94.39543178892127,7.83375132363318,sigmoid,33,44.0,,,,,,,,,,,,,,18.0,COMPLETE
1994,0.35273167125865196,2024-04-11 16:20:08.128783,2024-04-11 16:20:08.970877,0 days 00:00:00.842094,98.17317055418424,8.281288707615074,sigmoid,50,40.0,,,5.0,4.0,48.0,,,2.678691776435364,3.858447418211649,0.7192663281033429,12.0,42.0,73.0,,COMPLETE
1995,0.4534749711880543,2024-04-11 16:20:08.971878,2024-04-11 16:20:09.589227,0 days 00:00:00.617349,96.50028189968863,8.588171049856282,sigmoid,17,,,,4.0,6.0,84.0,,,,,,,,,142.0,COMPLETE
