number,value,datetime_start,datetime_complete,duration,params_C,params_gamma,params_kernel,params_mask_number,params_rsi_window,params_so_smooth,params_so_window,params_srsi_smooth1,params_srsi_smooth2,params_srsi_window,params_tsi_window_fast,params_tsi_window_slow,params_ult_weight_1,params_ult_weight_2,params_ult_weight_3,params_ult_window_1,params_ult_window_2,params_ult_window_3,params_williams_lbp,state
7439,0.5929369437606513,2024-04-11 18:20:53.384956,2024-04-11 18:20:54.894536,0 days 00:00:01.509580,95.20641675054817,8.253592669792702,sigmoid,8,,26.0,33.0,,,,,,,,,,,,,COMPLETE
7440,0.6009432182607054,2024-04-11 18:20:54.898517,2024-04-11 18:20:56.363461,0 days 00:00:01.464944,96.6541665904123,7.93557025211504,sigmoid,8,,27.0,31.0,,,,,,,,,,,,,COMPLETE
7441,0.39143345921693945,2024-04-11 18:20:56.366041,2024-04-11 18:20:58.531824,0 days 00:00:02.165783,96.67160759176922,8.652551407187108,sigmoid,15,,25.0,31.0,,,,49.0,21.0,6.307000055854616,1.1315184572367727,1.4352519898512326,10.0,29.0,97.0,87.0,COMPLETE
7442,0.12003789673140693,2024-04-11 18:20:58.535358,2024-04-11 18:20:59.898798,0 days 00:00:01.363440,99.98100330914512,8.09582436027879,sigmoid,8,,23.0,28.0,,,,,,,,,,,,,COMPLETE
7443,0.35251306932722865,2024-04-11 18:20:59.901797,2024-04-11 18:21:01.833635,0 days 00:00:01.931838,99.97877795753483,7.517090064771154,sigmoid,38,28.0,,,,,,20.0,24.0,7.703558946958015,2.798174440101137,8.807521477095396,16.0,23.0,53.0,,COMPLETE
7444,0.5611209045042855,2024-04-11 18:21:01.837581,2024-04-11 18:21:03.082618,0 days 00:00:01.245037,99.96845499381132,8.381358934839929,sigmoid,0,,,,,,,,,,,,,,,,COMPLETE
7445,0.42508472560794347,2024-04-11 18:21:03.086154,2024-04-11 18:21:04.961617,0 days 00:00:01.875463,98.20877942911076,7.711844263948706,sigmoid,28,,29.0,30.0,1.0,2.0,66.0,10.0,14.0,,,,,,,,COMPLETE
7446,0.46559200372375614,2024-04-11 18:21:04.965160,2024-04-11 18:21:07.840651,0 days 00:00:02.875491,94.52594891250241,8.170847916678719,sigmoid,31,,24.0,32.0,7.0,4.0,26.0,13.0,25.0,5.096216790607935,7.393851873395285,5.645843426089745,6.0,21.0,67.0,107.0,COMPLETE
7447,0.33389804984564414,2024-04-11 18:21:07.843646,2024-04-11 18:21:09.944839,0 days 00:00:02.101193,98.18912575749155,7.944806109136499,sigmoid,42,32.0,27.0,34.0,,,,,,1.118092016075325,8.595309699652962,7.506876386752659,12.0,46.0,94.0,,COMPLETE
7448,0.3194689586370962,2024-04-11 18:21:09.947854,2024-04-11 18:21:11.673654,0 days 00:00:01.725800,96.73245586550563,8.399809877387492,sigmoid,35,38.0,,,,,,,,1.6129779223080551,2.361901048244052,7.042913494463288,19.0,32.0,88.0,37.0,COMPLETE
7449,0.12060923369823894,2024-04-11 18:21:11.676681,2024-04-11 18:21:13.082371,0 days 00:00:01.405690,93.91494564356618,5.564195892669664,sigmoid,8,,20.0,29.0,,,,,,,,,,,,,COMPLETE
7450,0.44540141494924634,2024-04-11 18:21:13.085928,2024-04-11 18:21:15.091338,0 days 00:00:02.005410,96.5439311615038,8.052601160746484,rbf,8,,26.0,33.0,,,,,,,,,,,,,COMPLETE
7451,0.4696037035152872,2024-04-11 18:21:15.094907,2024-04-11 18:21:16.854563,0 days 00:00:01.759656,98.3093547710753,7.22357901710913,sigmoid,21,,,,6.0,1.0,70.0,43.0,48.0,,,,,,,177.0,COMPLETE
7452,0.363338615953513,2024-04-11 18:21:16.858593,2024-04-11 18:21:18.334131,0 days 00:00:01.475538,91.08241716008577,7.800934717382896,sigmoid,9,,25.0,31.0,,,,,,,,,,,,152.0,COMPLETE
7453,0.5190832397294649,2024-04-11 18:21:18.337175,2024-04-11 18:21:20.602735,0 days 00:00:02.265560,99.97094077629356,8.231837168692707,sigmoid,46,15.0,22.0,30.0,,,,3.0,18.0,3.488613592668809,1.5507390750183911,4.793436251781088,15.0,20.0,78.0,,COMPLETE
7454,0.5335021587512455,2024-04-11 18:21:20.605279,2024-04-11 18:21:22.432590,0 days 00:00:01.827311,95.55236692443258,8.556948948649334,sigmoid,3,,,,,,,,,2.0871155917755257,9.99500794480128,6.112359616626581,13.0,36.0,69.0,146.0,COMPLETE
7455,0.37173957691517767,2024-04-11 18:21:22.437158,2024-04-11 18:21:24.839791,0 days 00:00:02.402633,99.95372913285378,7.97903766163254,sigmoid,57,37.0,25.0,32.0,4.0,3.0,21.0,,,,,,,,,162.0,COMPLETE
7456,0.18258771929824563,2024-04-11 18:21:24.842788,2024-04-11 18:21:26.371397,0 days 00:00:01.528609,98.07963803457987,7.599166903314296,sigmoid,16,,,,3.0,8.0,52.0,,,,,,,,,,COMPLETE
7457,0.4494501596310749,2024-04-11 18:21:26.374400,2024-04-11 18:21:29.627154,0 days 00:00:03.252754,92.7419959284147,8.277350078922023,sigmoid,63,42.0,24.0,31.0,8.0,6.0,2.0,26.0,41.0,4.27109950646409,9.080397839910525,2.227244696611092,5.0,49.0,59.0,115.0,COMPLETE
7458,0.12622036262203626,2024-04-11 18:21:29.631155,2024-04-11 18:21:31.138275,0 days 00:00:01.507120,96.88760969230485,7.909646382085951,sigmoid,8,,28.0,29.0,,,,,,,,,,,,,COMPLETE
7459,0.3736171585228189,2024-04-11 18:21:31.142260,2024-04-11 18:21:33.779787,0 days 00:00:02.637527,89.39362844542156,7.386486121249643,sigmoid,14,,27.0,30.0,,,,12.0,27.0,6.608226212809275,3.760677285318451,5.357470807555759,14.0,22.0,64.0,,COMPLETE
7460,0.5732178248166234,2024-04-11 18:21:33.782791,2024-04-11 18:21:35.876994,0 days 00:00:02.094203,99.97738782714177,8.136352565681365,sigmoid,2,,,,,,,,,6.1571676771261945,4.771766707351044,5.0282885066293765,4.0,25.0,82.0,,COMPLETE
7461,0.46625973007784055,2024-04-11 18:21:35.879973,2024-04-11 18:21:38.475943,0 days 00:00:02.595970,95.09500877712897,8.428945362211445,sigmoid,62,4.0,26.0,32.0,2.0,5.0,82.0,36.0,4.0,8.832574359889096,5.231989210331922,0.8044036145196616,11.0,44.0,51.0,,COMPLETE
7462,0.6009432182607054,2024-04-11 18:21:38.479943,2024-04-11 18:21:40.463340,0 days 00:00:01.983397,98.29055874060371,7.657293939200628,sigmoid,8,,24.0,31.0,,,,,,,,,,,,,COMPLETE
7463,0.2592110402291368,2024-04-11 18:21:40.466936,2024-04-11 18:21:42.742853,0 days 00:00:02.275917,99.98961044489428,8.759548356622382,sigmoid,10,,23.0,33.0,,,,,,0.5014166147505188,0.5073522697023805,4.313850270122286,8.0,35.0,81.0,,COMPLETE
7464,0.45347172512526845,2024-04-11 18:21:42.746386,2024-04-11 18:21:44.368064,0 days 00:00:01.621678,98.1928785100988,7.791822932120415,sigmoid,8,,37.0,28.0,,,,,,,,,,,,,COMPLETE
7465,0.3836371343789742,2024-04-11 18:21:44.371057,2024-04-11 18:21:46.798635,0 days 00:00:02.427578,99.96167470187939,8.133087800556966,sigmoid,26,,25.0,30.0,1.0,7.0,12.0,,,8.631644221080373,1.8697012771258503,7.932481382720402,9.0,45.0,56.0,,COMPLETE
7466,0.5964811022156022,2024-04-11 18:21:46.802614,2024-04-11 18:21:48.375156,0 days 00:00:01.572542,96.63229045147243,8.312964554233856,sigmoid,8,,27.0,25.0,,,,,,,,,,,,,COMPLETE
7467,0.3881205103463064,2024-04-11 18:21:48.378186,2024-04-11 18:21:50.176849,0 days 00:00:01.798663,99.97995440190165,5.116566075332731,sigmoid,41,27.0,26.0,31.0,,,,,,,,,,,,94.0,COMPLETE
7468,0.5952371952371952,2024-04-11 18:21:50.179778,2024-04-11 18:21:51.681386,0 days 00:00:01.501608,93.84314329556867,7.946372535256407,sigmoid,8,,25.0,32.0,,,,,,,,,,,,,COMPLETE
7469,0.2230731986443065,2024-04-11 18:21:51.684980,2024-04-11 18:21:53.643569,0 days 00:00:01.958589,96.77349285079856,8.612277096770606,rbf,37,40.0,,,,,,41.0,31.0,,,,,,,127.0,COMPLETE
7470,0.4796067457467621,2024-04-11 18:21:53.647104,2024-04-11 18:21:55.956957,0 days 00:00:02.309853,95.5915746265642,8.117131147511195,sigmoid,11,,23.0,30.0,,,,,,2.8130222895958465,4.113957222130086,2.797089173551114,3.0,41.0,98.0,40.0,COMPLETE
7471,0.42508472560794347,2024-04-11 18:21:55.959932,2024-04-11 18:21:57.635980,0 days 00:00:01.676048,98.13420674228385,7.860963865387914,sigmoid,48,30.0,,,5.0,3.0,56.0,,,,,,,,,,COMPLETE
7472,0.12622036262203626,2024-04-11 18:21:57.639959,2024-04-11 18:21:59.187777,0 days 00:00:01.547818,96.74337390089443,8.408643140843434,sigmoid,8,,28.0,29.0,,,,,,,,,,,,,COMPLETE
7473,0.48445634024162654,2024-04-11 18:21:59.191777,2024-04-11 18:22:01.441935,0 days 00:00:02.250158,95.13315919141088,2.256596240439036,sigmoid,56,7.0,16.0,33.0,6.0,4.0,39.0,,,,,,,,,,COMPLETE
7474,0.4508645110872326,2024-04-11 18:22:01.447538,2024-04-11 18:22:03.202260,0 days 00:00:01.754722,99.96056343156401,7.6334931659399725,sigmoid,52,48.0,,,8.0,1.0,17.0,29.0,10.0,,,,,,,,COMPLETE
7475,0.433985177804073,2024-04-11 18:22:03.205260,2024-04-11 18:22:06.347632,0 days 00:00:03.142372,98.30298425960736,8.029798066889143,sigmoid,59,34.0,21.0,31.0,4.0,7.0,28.0,,,7.197379850332219,8.126661858693438,9.0544057085629,20.0,37.0,62.0,181.0,COMPLETE
7476,0.456980198019802,2024-04-11 18:22:06.351627,2024-04-11 18:22:08.622287,0 days 00:00:02.270660,99.978611864091,8.268534834390106,sigmoid,55,13.0,,,7.0,2.0,44.0,22.0,38.0,5.944610731281208,6.290776716561317,9.541642431116527,12.0,39.0,76.0,102.0,COMPLETE
7477,0.5952371952371952,2024-04-11 18:22:08.625808,2024-04-11 18:22:09.964196,0 days 00:00:01.338388,93.29115674850067,7.788747268996925,sigmoid,8,,24.0,32.0,,,,,,,,,,,,,COMPLETE
7478,0.37438540571699847,2024-04-11 18:22:09.967794,2024-04-11 18:22:11.582311,0 days 00:00:01.614517,97.05394504315323,8.498299048262053,sigmoid,44,26.0,26.0,34.0,,,,14.0,23.0,,,,,,,,COMPLETE
7479,0.4502698896972542,2024-04-11 18:22:11.585311,2024-04-11 18:22:12.987552,0 days 00:00:01.402241,95.21326791888634,7.434193737083959,sigmoid,8,,27.0,30.0,,,,,,,,,,,,,COMPLETE
7480,0.5909107772212947,2024-04-11 18:22:12.990537,2024-04-11 18:22:14.440734,0 days 00:00:01.450197,98.15660646584763,6.929608432212182,sigmoid,8,,25.0,27.0,,,,,,,,,,,,,COMPLETE
7481,0.5005667135149838,2024-04-11 18:22:14.444732,2024-04-11 18:22:16.090560,0 days 00:00:01.645828,99.96468586421976,8.034857607784806,sigmoid,20,,,,3.0,5.0,89.0,45.0,2.0,,,,,,,,COMPLETE
7482,0.4738697009364615,2024-04-11 18:22:16.093556,2024-04-11 18:22:18.021313,0 days 00:00:01.927757,99.96990883199112,8.243759282179397,sigmoid,60,47.0,19.0,31.0,2.0,4.0,24.0,33.0,37.0,,,,,,,,COMPLETE
7483,0.49217651803203133,2024-04-11 18:22:18.023306,2024-04-11 18:22:19.640306,0 days 00:00:01.617000,96.69528147687326,7.834419671616489,sigmoid,13,,24.0,32.0,,,,9.0,29.0,,,,,,,158.0,COMPLETE
7484,0.298377730321082,2024-04-11 18:22:19.642850,2024-04-11 18:22:21.244474,0 days 00:00:01.601624,98.18594296317498,8.071341021168333,sigmoid,12,,23.0,35.0,,,,2.0,20.0,,,,,,,,COMPLETE
7485,0.12622036262203626,2024-04-11 18:22:21.248037,2024-04-11 18:22:22.679143,0 days 00:00:01.431106,94.05365566596633,7.627551525689451,sigmoid,8,,26.0,29.0,,,,,,,,,,,,,COMPLETE
7486,0.1901351286826147,2024-04-11 18:22:22.682119,2024-04-11 18:22:25.213639,0 days 00:00:02.531520,96.84666337627492,8.825296896636402,rbf,54,45.0,,,5.0,6.0,31.0,18.0,45.0,7.511432163709124,8.92610641704209,6.676482648860155,6.0,28.0,79.0,,COMPLETE
7487,0.13538404001682952,2024-04-11 18:22:25.218170,2024-04-11 18:22:26.452250,0 days 00:00:01.234080,98.15873365727602,8.313826342606664,sigmoid,32,36.0,,,,,,,,,,,,,,,COMPLETE
7488,0.5415215037889971,2024-04-11 18:22:26.455891,2024-04-11 18:22:27.973153,0 days 00:00:01.517262,95.16268457678139,5.778276402450795,sigmoid,36,43.0,,,,,,24.0,43.0,,,,,,,,COMPLETE
7489,0.49572789625225316,2024-04-11 18:22:27.976190,2024-04-11 18:22:29.229909,0 days 00:00:01.253719,91.85157691976212,8.555844513909133,sigmoid,1,,,,,,,,,,,,,,,121.0,COMPLETE
7490,0.39790310306924837,2024-04-11 18:22:29.231909,2024-04-11 18:22:31.321868,0 days 00:00:02.089959,99.99503644367125,7.941561091709425,sigmoid,23,,,,4.0,8.0,47.0,42.0,26.0,2.3800067278490697,6.994303668689279,4.104641827325132,7.0,26.0,66.0,51.0,COMPLETE
7491,0.4753177818131024,2024-04-11 18:22:31.324866,2024-04-11 18:22:33.291025,0 days 00:00:01.966159,96.7829133291489,8.154035983427946,sigmoid,61,11.0,22.0,31.0,7.0,2.0,62.0,17.0,12.0,,,,,,,168.0,COMPLETE
7492,0.5929369437606513,2024-04-11 18:22:33.293993,2024-04-11 18:22:34.642969,0 days 00:00:01.348976,98.21924773513987,7.762003481988697,sigmoid,8,,25.0,33.0,,,,,,,,,,,,,COMPLETE
7493,0.49391267842149456,2024-04-11 18:22:34.645965,2024-04-11 18:22:36.823251,0 days 00:00:02.177286,99.9815219186188,8.383304384895514,sigmoid,27,,28.0,28.0,2.0,3.0,7.0,,,6.824110291377172,7.919561572429803,1.9158569222004163,14.0,31.0,77.0,143.0,COMPLETE
7494,0.44701971028259324,2024-04-11 18:22:36.826752,2024-04-11 18:22:38.226153,0 days 00:00:01.399401,95.14768803622272,7.4797976473038235,sigmoid,8,,26.0,30.0,,,,,,,,,,,,,COMPLETE
7495,0.33772363077598505,2024-04-11 18:22:38.228492,2024-04-11 18:22:40.082660,0 days 00:00:01.854168,98.101403384028,7.990426312096845,sigmoid,7,,,,,,,27.0,15.0,4.624228565154173,3.0591353478494137,1.1696924757908915,18.0,48.0,99.0,200.0,COMPLETE
7496,0.3266520754137388,2024-04-11 18:22:40.086188,2024-04-11 18:22:41.453871,0 days 00:00:01.367683,96.74975824892002,8.147455322154014,sigmoid,5,,,,,,,5.0,7.0,,,,,,,83.0,COMPLETE
7497,0.28578580506026874,2024-04-11 18:22:41.456402,2024-04-11 18:22:42.769003,0 days 00:00:01.312601,99.96603188687055,7.8217332767524,sigmoid,4,,,,,,,40.0,13.0,,,,,,,,COMPLETE
7498,0.560964810964811,2024-04-11 18:22:42.772003,2024-04-11 18:22:44.297117,0 days 00:00:01.525114,93.11112373089621,2.5079413183999266,sigmoid,40,50.0,29.0,32.0,,,,,,,,,,,,,COMPLETE
7499,0.5986580986580987,2024-04-11 18:22:44.301148,2024-04-11 18:22:45.730271,0 days 00:00:01.429123,96.81295628650088,8.27670940490089,sigmoid,8,,24.0,31.0,,,,,,,,,,,,,COMPLETE
7500,0.4776099905946285,2024-04-11 18:22:45.733261,2024-04-11 18:22:47.815544,0 days 00:00:02.082283,98.06014272092065,8.674670570929791,sigmoid,51,14.0,,,1.0,1.0,74.0,,,5.636993916178104,4.512962878149336,1.626383522030375,2.0,34.0,74.0,62.0,COMPLETE
7501,0.28697792798431176,2024-04-11 18:22:47.820764,2024-04-11 18:22:49.565619,0 days 00:00:01.744855,95.60414156530727,4.436843108874925,sigmoid,34,25.0,,,,,,,,9.471814250123371,9.48352243658864,6.8744571547009805,17.0,30.0,52.0,,COMPLETE
7502,0.5929369437606513,2024-04-11 18:22:49.569790,2024-04-11 18:22:51.082182,0 days 00:00:01.512392,98.01675758113284,7.961402839262957,sigmoid,8,,27.0,33.0,,,,,,,,,,,,,COMPLETE
7503,0.464750461185621,2024-04-11 18:22:51.084182,2024-04-11 18:22:53.282098,0 days 00:00:02.197916,26.13753771574855,8.459808454578065,sigmoid,30,,25.0,29.0,6.0,5.0,96.0,31.0,49.0,4.886942564386394,3.3353523190094534,4.634487011865806,10.0,43.0,87.0,,COMPLETE
7504,0.5291815963597195,2024-04-11 18:22:53.285099,2024-04-11 18:22:54.639949,0 days 00:00:01.354850,93.93273798840474,7.676619552706329,sigmoid,33,6.0,,,,,,,,,,,,,,16.0,COMPLETE
7505,0.18198437000137105,2024-04-11 18:22:54.643957,2024-04-11 18:22:56.778974,0 days 00:00:02.135017,95.47409424682309,7.157962072266521,rbf,45,21.0,25.0,30.0,,,,20.0,22.0,,,,,,,98.0,COMPLETE
7506,0.48462262102901804,2024-04-11 18:22:56.781959,2024-04-11 18:22:58.518171,0 days 00:00:01.736212,98.14901920747239,8.14714405420369,sigmoid,53,28.0,,,3.0,6.0,54.0,8.0,34.0,,,,,,,137.0,COMPLETE
7507,0.5952371952371952,2024-04-11 18:22:58.521217,2024-04-11 18:22:59.914623,0 days 00:00:01.393406,98.14165571803443,7.943112964404929,sigmoid,8,,26.0,32.0,,,,,,,,,,,,,COMPLETE
7508,0.38120383370978567,2024-04-11 18:22:59.917260,2024-04-11 18:23:01.430135,0 days 00:00:01.512875,96.7256395580146,8.288951805796774,sigmoid,49,9.0,,,5.0,2.0,49.0,,,,,,,,,45.0,COMPLETE
7509,0.40004778829784055,2024-04-11 18:23:01.432135,2024-04-11 18:23:03.658297,0 days 00:00:02.226162,97.98019945052687,7.566841131230616,sigmoid,58,44.0,23.0,31.0,7.0,8.0,4.0,,,3.9906900637980187,5.640550430861014,3.4624120849333844,15.0,45.0,90.0,,COMPLETE
7510,0.4458981104998804,2024-04-11 18:23:03.661294,2024-04-11 18:23:05.227158,0 days 00:00:01.565864,92.58229462975557,9.51796158817262,sigmoid,8,,27.0,30.0,,,,,,,,,,,,,COMPLETE
7511,0.5952371952371952,2024-04-11 18:23:05.229738,2024-04-11 18:23:06.657156,0 days 00:00:01.427418,99.99288428389494,8.097618735085936,sigmoid,8,,24.0,32.0,,,,,,,,,,,,,COMPLETE
7512,0.5906279643331437,2024-04-11 18:23:06.659720,2024-04-11 18:23:08.030227,0 days 00:00:01.370507,95.24026594507707,8.528070122486524,sigmoid,8,,26.0,34.0,,,,,,,,,,,,,COMPLETE
7513,0.28866472628683065,2024-04-11 18:23:08.034233,2024-04-11 18:23:09.837416,0 days 00:00:01.803183,98.0380214544278,7.876584972518848,sigmoid,6,,,,,,,19.0,3.0,9.819648371306137,7.673525753242928,6.392955185878917,19.0,27.0,93.0,,COMPLETE
7514,0.4088201247917784,2024-04-11 18:23:09.840004,2024-04-11 18:23:11.400537,0 days 00:00:01.560533,98.1814951486227,7.308345235116087,sigmoid,17,,,,8.0,4.0,64.0,,,,,,,,,27.0,COMPLETE
7515,0.4296259585789556,2024-04-11 18:23:11.403537,2024-04-11 18:23:13.364972,0 days 00:00:01.961435,95.1936455233825,8.305720216999852,sigmoid,50,3.0,,,3.0,1.0,58.0,,,8.40495463582926,5.027765698464458,2.677181578459092,16.0,33.0,54.0,,COMPLETE
7516,0.49955211233506847,2024-04-11 18:23:13.367571,2024-04-11 18:23:15.285180,0 days 00:00:01.917609,96.82143626691303,7.733335150340244,sigmoid,18,,,,6.0,7.0,14.0,,,1.744805985810212,4.029191420710857,5.921593238601258,10.0,40.0,61.0,,COMPLETE
7517,0.4366443519691212,2024-04-11 18:23:15.287742,2024-04-11 18:23:17.486419,0 days 00:00:02.198677,98.09224845535137,8.078837427497456,sigmoid,47,33.0,24.0,30.0,,,,6.0,40.0,1.3022057522691313,0.9643378783364964,5.168341021811837,11.0,47.0,60.0,90.0,COMPLETE
7518,0.5330774894575961,2024-04-11 18:23:17.488977,2024-04-11 18:23:19.448226,0 days 00:00:01.959249,85.12106101071322,8.219818326224615,sigmoid,19,,,,4.0,3.0,33.0,,,9.991093888199611,5.3720470242272125,2.359513302742662,3.0,24.0,71.0,130.0,COMPLETE
7519,0.5963245096172158,2024-04-11 18:23:19.452271,2024-04-11 18:23:20.913704,0 days 00:00:01.461433,90.7488298090841,9.006155481501603,sigmoid,8,,28.0,31.0,,,,,,,,,,,,,COMPLETE
7520,0.4566164666309915,2024-04-11 18:23:20.915715,2024-04-11 18:23:23.089893,0 days 00:00:02.174178,94.07474593030857,7.795797889683798,sigmoid,29,,22.0,33.0,1.0,6.0,37.0,23.0,47.0,,,,,,,56.0,COMPLETE
7521,0.47893836531779554,2024-04-11 18:23:23.092890,2024-04-11 18:23:25.122588,0 days 00:00:02.029698,98.1396520343253,8.400530807132306,sigmoid,25,,25.0,31.0,8.0,5.0,68.0,,,,,,,,,192.0,COMPLETE
7522,0.12622036262203626,2024-04-11 18:23:25.125587,2024-04-11 18:23:26.637644,0 days 00:00:01.512057,96.58372544002606,8.007830146134653,sigmoid,8,,27.0,29.0,,,,,,,,,,,,,COMPLETE
7523,0.42275194064711136,2024-04-11 18:23:26.639615,2024-04-11 18:23:28.962028,0 days 00:00:02.322413,95.47552890500046,8.71557041459799,sigmoid,22,,,,2.0,8.0,91.0,48.0,19.0,3.1809933784456326,2.4684827479308615,8.415130483684695,7.0,42.0,64.0,,COMPLETE
7524,0.16905077913778693,2024-04-11 18:23:28.965028,2024-04-11 18:23:31.446439,0 days 00:00:02.481411,98.12583781105928,7.585499058670244,rbf,39,18.0,,,,,,44.0,30.0,7.920280832528982,5.893935415281416,7.213727584312102,4.0,20.0,80.0,33.0,COMPLETE
7525,0.42682114112882547,2024-04-11 18:23:31.448968,2024-04-11 18:23:33.396511,0 days 00:00:01.947543,98.12928593508816,8.143141952074638,sigmoid,21,,,,5.0,7.0,81.0,32.0,36.0,,,,,,,150.0,COMPLETE
7526,0.5952371952371952,2024-04-11 18:23:33.399588,2024-04-11 18:23:35.040756,0 days 00:00:01.641168,98.2305704391387,7.904968133642059,sigmoid,8,,23.0,32.0,,,,,,,,,,,,,COMPLETE
7527,0.50691044878071,2024-04-11 18:23:35.043743,2024-04-11 18:23:37.377754,0 days 00:00:02.334011,93.74831336851932,8.515249592028235,sigmoid,43,4.0,26.0,30.0,,,,,,2.6160212153921867,7.24412463040685,9.220632586772654,13.0,38.0,55.0,124.0,COMPLETE
7528,0.34643024809504885,2024-04-11 18:23:37.380780,2024-04-11 18:23:39.232077,0 days 00:00:01.851297,96.54834903674956,8.255725187019387,sigmoid,24,,24.0,28.0,1.0,4.0,19.0,,,,,,,,,,COMPLETE
7529,0.6009432182607054,2024-04-11 18:23:39.237089,2024-04-11 18:23:41.058278,0 days 00:00:01.821189,98.14779098019686,7.803758509397962,sigmoid,8,,25.0,31.0,,,,,,,,,,,,,COMPLETE
7530,0.5636462904171639,2024-04-11 18:23:41.061230,2024-04-11 18:23:42.289014,0 days 00:00:01.227784,95.278265935367,7.487554904086016,sigmoid,0,,,,,,,,,,,,,,,,COMPLETE
7531,0.48274571274828626,2024-04-11 18:23:42.292003,2024-04-11 18:23:44.378150,0 days 00:00:02.086147,96.77387581273103,8.041997344973408,sigmoid,38,23.0,,,,,,38.0,10.0,2.2449730432346735,3.5261385598684125,3.6333480009677728,12.0,22.0,85.0,,COMPLETE
7532,0.5963643249384587,2024-04-11 18:23:44.381184,2024-04-11 18:23:45.985702,0 days 00:00:01.604518,98.32026317448148,8.384490569783079,sigmoid,8,,27.0,32.0,,,,,,,,,,,,,COMPLETE
7533,0.49236685974251343,2024-04-11 18:23:45.989236,2024-04-11 18:23:48.097393,0 days 00:00:02.108157,92.37685148880924,8.03162920438538,sigmoid,28,,26.0,29.0,7.0,1.0,41.0,35.0,42.0,,,,,,,,COMPLETE
7534,0.4422853153362811,2024-04-11 18:23:48.100852,2024-04-11 18:23:50.772750,0 days 00:00:02.671898,99.9678672724207,7.747353558919733,sigmoid,31,,29.0,31.0,3.0,3.0,79.0,34.0,25.0,0.7695574302854329,2.0468175870178755,7.568278058408133,18.0,44.0,100.0,75.0,COMPLETE
7535,0.3319906491638195,2024-04-11 18:23:50.775749,2024-04-11 18:23:52.471688,0 days 00:00:01.695939,95.36613228093057,8.247084846285848,sigmoid,9,,24.0,33.0,,,,,,,,,,,,66.0,COMPLETE
7536,0.45345352376492626,2024-04-11 18:23:52.474692,2024-04-11 18:23:53.992435,0 days 00:00:01.517743,87.97838346892266,8.594016682158179,sigmoid,8,,25.0,30.0,,,,,,,,,,,,,COMPLETE
7537,0.5572284075573549,2024-04-11 18:23:53.995433,2024-04-11 18:23:56.063501,0 days 00:00:02.068068,96.50431068959684,7.936628310057255,sigmoid,3,,,,,,,,,8.094819354442158,9.289163863626772,5.686303413000001,2.0,36.0,57.0,69.0,COMPLETE
7538,0.5321843759895055,2024-04-11 18:23:56.066498,2024-04-11 18:23:58.049136,0 days 00:00:01.982638,97.98749576200638,7.660938267973325,sigmoid,35,29.0,,,,,,,,1.9221087301004491,2.8989281195976915,2.0375136003257017,8.0,50.0,78.0,187.0,COMPLETE
7539,0.48096843244839205,2024-04-11 18:23:58.051155,2024-04-11 18:24:00.610538,0 days 00:00:02.559383,98.1179041448842,7.403819409954456,sigmoid,15,,22.0,32.0,,,,4.0,6.0,7.387345104270214,6.811470876698102,8.708440196852713,16.0,32.0,86.0,25.0,COMPLETE
7540,0.33468692215655704,2024-04-11 18:24:00.614538,2024-04-11 18:24:02.757564,0 days 00:00:02.143026,45.19314918057748,8.150488289617025,sigmoid,42,41.0,28.0,31.0,,,,,,5.779904064252061,1.6737748226613736,2.9482819176569826,6.0,26.0,92.0,,COMPLETE
7541,0.5906279643331437,2024-04-11 18:24:02.760103,2024-04-11 18:24:04.354223,0 days 00:00:01.594120,98.23283472064935,8.38501036405428,sigmoid,8,,26.0,34.0,,,,,,,,,,,,,COMPLETE
