number,value,datetime_start,datetime_complete,duration,params_C,params_gamma,params_kernel,params_mask_number,params_rsi_window,params_so_smooth,params_so_window,params_srsi_smooth1,params_srsi_smooth2,params_srsi_window,params_tsi_window_fast,params_tsi_window_slow,params_ult_weight_1,params_ult_weight_2,params_ult_weight_3,params_ult_window_1,params_ult_window_2,params_ult_window_3,params_williams_lbp,state
833,0.5195624166534818,2024-04-11 16:08:30.779420,2024-04-11 16:08:31.273417,0 days 00:00:00.493997,49.584229837109866,3.8594854171251294,sigmoid,35,21.0,,,,,,,,4.131518885537508,8.415711892673114,4.682242535331897,2.0,30.0,85.0,15.0,COMPLETE
834,0.3379200663808602,2024-04-11 16:08:31.274470,2024-04-11 16:08:31.834434,0 days 00:00:00.559964,32.60737481363416,1.6130516846966914,sigmoid,14,,25.0,38.0,,,,4.0,27.0,4.944818760498149,9.267891269242265,1.5671689164838714,11.0,43.0,67.0,,COMPLETE
835,0.4689235981366615,2024-04-11 16:08:31.835432,2024-04-11 16:08:32.393803,0 days 00:00:00.558371,36.27030796558801,1.8960840038545603,sigmoid,43,2.0,21.0,31.0,,,,,,9.984465823084525,3.3340083520488815,1.1723671729996377,8.0,40.0,71.0,49.0,COMPLETE
836,0.4421304457315537,2024-04-11 16:08:32.394800,2024-04-11 16:08:32.924293,0 days 00:00:00.529493,25.518359977577468,1.326799156884003,sigmoid,57,27.0,8.0,15.0,5.0,1.0,15.0,,,,,,,,,29.0,COMPLETE
837,0.5397820684381571,2024-04-11 16:08:32.925456,2024-04-11 16:08:33.376133,0 days 00:00:00.450677,91.60362841438707,1.2350149167337088,sigmoid,1,,,,,,,,,,,,,,,41.0,COMPLETE
838,0.08669043691128733,2024-04-11 16:08:33.377134,2024-04-11 16:08:33.824198,0 days 00:00:00.447064,42.93853152890559,0.837816988519148,sigmoid,8,,30.0,24.0,,,,,,,,,,,,,COMPLETE
839,0.07739176910742919,2024-04-11 16:08:33.825198,2024-04-11 16:08:34.311520,0 days 00:00:00.486322,88.88209823465228,1.0671638705577604,sigmoid,1,,,,,,,,,,,,,,,25.0,COMPLETE
840,0.4201844950821675,2024-04-11 16:08:34.313520,2024-04-11 16:08:35.894929,0 days 00:00:01.581409,93.16054371024596,0.4684722020337167,rbf,31,,16.0,5.0,1.0,4.0,58.0,35.0,11.0,4.500362825207291,4.28421388857893,1.9618896530226388,4.0,28.0,58.0,63.0,COMPLETE
841,0.4941883142210781,2024-04-11 16:08:35.896666,2024-04-11 16:08:36.382901,0 days 00:00:00.486235,28.076231234647878,1.4408241546394678,sigmoid,21,,,,7.0,7.0,69.0,15.0,24.0,,,,,,,35.0,COMPLETE
842,0.45521190068493156,2024-04-11 16:08:36.383902,2024-04-11 16:08:37.056903,0 days 00:00:00.673001,37.59300381909931,1.1474163342407318,sigmoid,63,43.0,32.0,2.0,2.0,6.0,74.0,23.0,43.0,1.2838124370260426,5.9578362479444635,7.663815850899869,10.0,38.0,61.0,84.0,COMPLETE
843,0.278134983218084,2024-04-11 16:08:37.058898,2024-04-11 16:08:37.432993,0 days 00:00:00.374095,46.66558162261441,0.7066732558051873,sigmoid,1,,,,,,,,,,,,,,,45.0,COMPLETE
844,0.586206338153612,2024-04-11 16:08:37.434180,2024-04-11 16:08:37.780461,0 days 00:00:00.346281,39.78783222510843,0.9168426341653393,sigmoid,0,,,,,,,,,,,,,,,,COMPLETE
845,0.5049946441471739,2024-04-11 16:08:37.781459,2024-04-11 16:08:38.387222,0 days 00:00:00.605763,45.01192179220091,1.3369022399237396,sigmoid,15,,28.0,45.0,,,,48.0,38.0,8.141266474548761,8.846822821903062,6.415748153548157,5.0,33.0,60.0,58.0,COMPLETE
846,0.421695975489101,2024-04-11 16:08:38.389300,2024-04-11 16:08:38.864221,0 days 00:00:00.474921,33.278024558691094,1.6306409048890806,sigmoid,24,,2.0,40.0,4.0,3.0,90.0,,,,,,,,,,COMPLETE
847,0.3144842836834624,2024-04-11 16:08:38.865226,2024-04-11 16:08:39.402521,0 days 00:00:00.537295,90.44587929503982,0.9550465082648568,sigmoid,42,22.0,5.0,8.0,,,,,,0.5185417728598285,6.4335113294532915,3.349574339540934,20.0,32.0,76.0,,COMPLETE
848,0.3933399380013422,2024-04-11 16:08:39.403522,2024-04-11 16:08:39.797032,0 days 00:00:00.393510,51.46453304147454,1.153409358514538,sigmoid,1,,,,,,,,,,,,,,,12.0,COMPLETE
849,0.3453525953039212,2024-04-11 16:08:39.798033,2024-04-11 16:08:40.463483,0 days 00:00:00.665450,86.88491168182617,0.6389152018967285,sigmoid,62,48.0,23.0,19.0,5.0,8.0,7.0,46.0,45.0,6.288397613650908,5.609029806203408,2.320752257171844,6.0,29.0,65.0,,COMPLETE
850,0.589341292515921,2024-04-11 16:08:40.464540,2024-04-11 16:08:40.808650,0 days 00:00:00.344110,48.255181746667745,0.8568823686057504,sigmoid,0,,,,,,,,,,,,,,,,COMPLETE
851,0.5281705948372615,2024-04-11 16:08:40.809651,2024-04-11 16:08:41.298964,0 days 00:00:00.489313,94.2891999694562,0.4058662805280566,sigmoid,37,41.0,,,,,,39.0,22.0,,,,,,,53.0,COMPLETE
852,0.32628751192958894,2024-04-11 16:08:41.299139,2024-04-11 16:08:41.751222,0 days 00:00:00.452083,15.455416932316563,1.4096251326853695,sigmoid,41,36.0,20.0,33.0,,,,,,,,,,,,21.0,COMPLETE
853,0.2329472329472329,2024-04-11 16:08:41.752290,2024-04-11 16:08:42.186230,0 days 00:00:00.433940,34.601672655888756,1.1342017895049685,sigmoid,1,,,,,,,,,,,,,,,39.0,COMPLETE
854,0.38563573883161506,2024-04-11 16:08:42.187432,2024-04-11 16:08:42.670324,0 days 00:00:00.482892,30.89201262316589,0.74132304242968,sigmoid,3,,,,,,,,,2.5544744208939667,8.215149227317267,2.7696793765690577,12.0,41.0,100.0,70.0,COMPLETE
855,0.5909107772212947,2024-04-11 16:08:42.671325,2024-04-11 16:08:43.080981,0 days 00:00:00.409656,37.86539451247216,1.7247167456536878,sigmoid,1,,,,,,,,,,,,,,,29.0,COMPLETE
856,0.4810119854367642,2024-04-11 16:08:43.081973,2024-04-11 16:08:43.574382,0 days 00:00:00.492409,39.700038300746535,1.6936388805162363,sigmoid,9,,14.0,47.0,,,,,,,,,,,,27.0,COMPLETE
857,0.42943032002372544,2024-04-11 16:08:43.575385,2024-04-11 16:08:44.092073,0 days 00:00:00.516688,43.744057588319706,3.629719873991073,sigmoid,28,,9.0,25.0,1.0,4.0,5.0,6.0,29.0,,,,,,,,COMPLETE
858,0.4284023668639053,2024-04-11 16:08:44.094220,2024-04-11 16:08:44.466259,0 days 00:00:00.372039,85.47912876649599,2.152352878420087,sigmoid,1,,,,,,,,,,,,,,,31.0,COMPLETE
859,0.08577747354009795,2024-04-11 16:08:44.467260,2024-04-11 16:08:44.847064,0 days 00:00:00.379804,39.02116243672039,1.3710346921928882,sigmoid,1,,,,,,,,,,,,,,,19.0,COMPLETE
860,0.4759351395942357,2024-04-11 16:08:44.848125,2024-04-11 16:08:45.715298,0 days 00:00:00.867173,37.12597292737685,1.972982101842561,rbf,1,,,,,,,,,,,,,,,13.0,COMPLETE
861,0.4100017424638439,2024-04-11 16:08:45.716297,2024-04-11 16:08:46.278627,0 days 00:00:00.562330,52.85690567967049,1.7657876171030655,sigmoid,26,,16.0,20.0,3.0,7.0,77.0,,,5.246921673883089,2.523870483668107,7.302009650882227,9.0,48.0,86.0,,COMPLETE
862,0.5442500193993948,2024-04-11 16:08:46.279634,2024-04-11 16:08:46.689799,0 days 00:00:00.410165,42.46903857159011,1.5855616299829176,sigmoid,1,,,,,,,,,,,,,,,50.0,COMPLETE
863,0.5310248478195788,2024-04-11 16:08:46.690859,2024-04-11 16:08:47.085015,0 days 00:00:00.394156,39.71889518605001,1.2637291258037575,sigmoid,1,,,,,,,,,,,,,,,62.0,COMPLETE
864,0.09431504350997862,2024-04-11 16:08:47.086016,2024-04-11 16:08:47.559933,0 days 00:00:00.473917,38.38110281792172,1.561289061572408,sigmoid,1,,,,,,,,,,,,,,,24.0,COMPLETE
865,0.5880363063938105,2024-04-11 16:08:47.561936,2024-04-11 16:08:47.938896,0 days 00:00:00.376960,89.08575544073739,0.18132004657563416,sigmoid,16,,,,2.0,5.0,94.0,,,,,,,,,,COMPLETE
866,0.33613720777802053,2024-04-11 16:08:47.939895,2024-04-11 16:08:48.517830,0 days 00:00:00.577935,35.263946304148234,1.0226888997223529,sigmoid,46,15.0,33.0,7.0,,,,31.0,36.0,8.986452110521343,9.097404468595089,5.001582839688645,17.0,36.0,95.0,,COMPLETE
867,0.5486328814333465,2024-04-11 16:08:48.518832,2024-04-11 16:08:49.092089,0 days 00:00:00.573257,37.537085778261485,1.3179588532541808,sigmoid,10,,12.0,37.0,,,,,,3.6868270302234896,5.414943900423006,3.888466864817089,3.0,31.0,50.0,,COMPLETE
868,0.43918079667234755,2024-04-11 16:08:49.093134,2024-04-11 16:08:49.615362,0 days 00:00:00.522228,91.70290255624371,0.9300174061297268,sigmoid,18,,,,8.0,2.0,65.0,,,1.5590899826465139,8.565300793353302,8.732516757556105,15.0,44.0,52.0,,COMPLETE
869,0.5327822580645162,2024-04-11 16:08:49.617520,2024-04-11 16:08:50.124701,0 days 00:00:00.507181,34.894260996319275,1.4964601729326152,sigmoid,20,,,,7.0,3.0,51.0,44.0,21.0,,,,,,,,COMPLETE
870,0.4474005953646609,2024-04-11 16:08:50.125709,2024-04-11 16:08:50.774969,0 days 00:00:00.649260,40.66519455089065,0.5742523615392716,sigmoid,59,12.0,18.0,29.0,6.0,6.0,31.0,,,3.147585059240229,5.10602500641737,1.671737569491671,8.0,42.0,75.0,44.0,COMPLETE
871,0.4883971937398813,2024-04-11 16:08:50.775971,2024-04-11 16:08:51.218295,0 days 00:00:00.442324,33.29588540661176,1.1706727579290908,sigmoid,48,32.0,,,4.0,1.0,54.0,,,,,,,,,,COMPLETE
872,0.3309805068939034,2024-04-11 16:08:51.219346,2024-04-11 16:08:51.803362,0 days 00:00:00.584016,37.787934996356626,0.831687984520602,sigmoid,11,,29.0,4.0,,,,,,7.477072559437352,9.453598804508,4.455847929313614,14.0,23.0,83.0,19.0,COMPLETE
873,0.43465209821696577,2024-04-11 16:08:51.804363,2024-04-11 16:08:52.368602,0 days 00:00:00.564239,99.85550878823713,7.083755373463769,sigmoid,23,,,,3.0,8.0,88.0,36.0,42.0,6.515835999845202,7.336462545381012,5.7216625567294574,2.0,27.0,63.0,38.0,COMPLETE
874,0.4909214194228885,2024-04-11 16:08:52.370602,2024-04-11 16:08:52.959566,0 days 00:00:00.588964,33.35694970202956,1.7955518944848723,sigmoid,54,30.0,,,4.0,5.0,61.0,2.0,10.0,7.299212486307933,6.174117528471511,4.198085169297366,5.0,34.0,93.0,,COMPLETE
875,0.19721733299807223,2024-04-11 16:08:52.960726,2024-04-11 16:08:53.414748,0 days 00:00:00.454022,42.580439434076034,2.469321224142788,sigmoid,2,,,,,,,,,5.853480071917489,6.984861365921268,3.1701057966389863,16.0,33.0,88.0,,COMPLETE
876,0.4535264018568339,2024-04-11 16:08:53.415909,2024-04-11 16:08:54.040583,0 days 00:00:00.624674,55.3741636337308,1.1038258956508837,sigmoid,55,38.0,,,5.0,7.0,82.0,9.0,6.0,8.484435559851994,6.706626434342157,3.638433416057959,3.0,21.0,81.0,34.0,COMPLETE
877,0.10504933255948928,2024-04-11 16:08:54.042635,2024-04-11 16:08:54.446980,0 days 00:00:00.404345,41.55496016052163,0.459211600023441,sigmoid,0,,,,,,,,,,,,,,,,COMPLETE
878,0.34768291427983394,2024-04-11 16:08:54.446980,2024-04-11 16:08:55.120196,0 days 00:00:00.673216,37.21544540738733,1.4207959222131572,rbf,0,,,,,,,,,,,,,,,,COMPLETE
879,0.5128579401536942,2024-04-11 16:08:55.121197,2024-04-11 16:08:55.631455,0 days 00:00:00.510258,87.77416218379585,0.68688801312104,sigmoid,44,25.0,11.0,43.0,,,,19.0,39.0,,,,,,,,COMPLETE
880,0.509442880776916,2024-04-11 16:08:55.632456,2024-04-11 16:08:56.141074,0 days 00:00:00.508618,35.303932198477845,1.029240961893338,sigmoid,12,,26.0,34.0,,,,48.0,26.0,,,,,,,,COMPLETE
881,0.36016193220804177,2024-04-11 16:08:56.141596,2024-04-11 16:08:56.613059,0 days 00:00:00.471463,92.76145166038819,1.2645905437466658,sigmoid,13,,35.0,18.0,,,,42.0,8.0,,,,,,,29.0,COMPLETE
882,0.5295802120727937,2024-04-11 16:08:56.614197,2024-04-11 16:08:57.144429,0 days 00:00:00.530232,39.823628615167756,0.8946923309454904,sigmoid,40,17.0,2.0,21.0,,,,,,,,,,,,,COMPLETE
883,0.3351519359851866,2024-04-11 16:08:57.145438,2024-04-11 16:08:57.639503,0 days 00:00:00.494065,90.02197209297772,0.7482573287701487,sigmoid,52,6.0,,,2.0,4.0,37.0,13.0,12.0,,,,,,,,COMPLETE
884,0.30913162289357826,2024-04-11 16:08:57.640503,2024-04-11 16:08:58.055570,0 days 00:00:00.415067,95.44723218485898,1.1885004313861336,sigmoid,36,45.0,,,,,,34.0,15.0,,,,,,,,COMPLETE
885,0.3384609956603042,2024-04-11 16:08:58.056580,2024-04-11 16:08:58.603930,0 days 00:00:00.547350,91.82764872034076,0.9978419627078255,sigmoid,56,24.0,6.0,9.0,1.0,6.0,41.0,,,,,,,,,,COMPLETE
886,0.35023219814241485,2024-04-11 16:08:58.604926,2024-04-11 16:08:59.162632,0 days 00:00:00.557706,83.8184077416794,1.4321223322595464,sigmoid,7,,,,,,,37.0,32.0,6.82583364287194,7.806707647813622,9.30455045406324,7.0,46.0,62.0,55.0,COMPLETE
887,0.4764771809106784,2024-04-11 16:08:59.163820,2024-04-11 16:08:59.691151,0 days 00:00:00.527331,97.1987647394644,0.3850140686754554,sigmoid,60,50.0,4.0,49.0,6.0,3.0,27.0,21.0,17.0,,,,,,,,COMPLETE
888,0.4481567524607202,2024-04-11 16:08:59.692151,2024-04-11 16:09:00.292063,0 days 00:00:00.599912,36.48657224117779,0.9092675859747943,sigmoid,27,,23.0,31.0,3.0,2.0,92.0,,,2.9287833155633676,4.604393872544338,4.856954416888132,10.0,45.0,91.0,16.0,COMPLETE
889,0.5814442549386498,2024-04-11 16:09:00.293065,2024-04-11 16:09:00.737921,0 days 00:00:00.444856,93.94310125350287,0.6470062447953374,sigmoid,8,,17.0,13.0,,,,,,,,,,,,,COMPLETE
890,0.10428997957152585,2024-04-11 16:09:00.738920,2024-04-11 16:09:01.134737,0 days 00:00:00.395817,23.156879746465517,1.3103682652244286,sigmoid,32,14.0,,,,,,,,,,,,,,,COMPLETE
891,0.5803755120197209,2024-04-11 16:09:01.135740,2024-04-11 16:09:01.491968,0 days 00:00:00.356228,80.97748343407642,1.6377301151701777,sigmoid,0,,,,,,,,,,,,,,,,COMPLETE
892,0.4765427145758632,2024-04-11 16:09:01.492968,2024-04-11 16:09:02.139847,0 days 00:00:00.646879,41.32736129489821,1.1057779577862878,sigmoid,61,23.0,31.0,32.0,7.0,7.0,47.0,11.0,25.0,,,,,,,66.0,COMPLETE
893,0.5872537659327925,2024-04-11 16:09:02.141026,2024-04-11 16:09:02.549468,0 days 00:00:00.408442,45.06067901366349,0.7670071772002977,sigmoid,4,,,,,,,25.0,2.0,,,,,,,,COMPLETE
894,0.44361465932354893,2024-04-11 16:09:02.550468,2024-04-11 16:09:03.208271,0 days 00:00:00.657803,96.88820677203061,1.2058860706213146,sigmoid,30,,9.0,41.0,4.0,5.0,49.0,18.0,20.0,7.721288034402365,4.150018895014657,0.7678992662709385,6.0,35.0,98.0,,COMPLETE
895,0.13026268441885572,2024-04-11 16:09:03.210257,2024-04-11 16:09:03.533718,0 days 00:00:00.323461,98.39227944558125,0.2506985576755162,sigmoid,0,,,,,,,,,,,,,,,,COMPLETE
896,0.2852514993652322,2024-04-11 16:09:03.534741,2024-04-11 16:09:04.033709,0 days 00:00:00.498968,90.48595426808099,0.9837086647633975,sigmoid,34,20.0,,,,,,,,2.0361317105478687,8.024894572885376,2.1782259154609456,13.0,47.0,79.0,,COMPLETE
897,0.3538429879617245,2024-04-11 16:09:04.034719,2024-04-11 16:09:05.164096,0 days 00:00:01.129377,95.33136227838736,1.5079810607600084,rbf,53,9.0,,,2.0,8.0,68.0,41.0,44.0,,,,,,,11.0,COMPLETE
898,0.38057691044089625,2024-04-11 16:09:05.165265,2024-04-11 16:09:05.743171,0 days 00:00:00.577906,91.96236598825787,0.5131309843849716,sigmoid,51,35.0,,,5.0,4.0,56.0,,,8.724284867368429,7.190712824480649,5.937732777821433,4.0,43.0,68.0,93.0,COMPLETE
899,0.5827374211292671,2024-04-11 16:09:05.744170,2024-04-11 16:09:06.136515,0 days 00:00:00.392345,94.22451944122784,0.04634010880111239,sigmoid,1,,,,,,,,,,,,,,,41.0,COMPLETE
900,0.40846100057211876,2024-04-11 16:09:06.137753,2024-04-11 16:09:06.599316,0 days 00:00:00.461563,88.78398354269552,5.339366419530947,sigmoid,5,,,,,,,28.0,28.0,,,,,,,89.0,COMPLETE
901,0.589341292515921,2024-04-11 16:09:06.599484,2024-04-11 16:09:06.962504,0 days 00:00:00.363020,58.60147040400635,0.8428027157073458,sigmoid,0,,,,,,,,,,,,,,,,COMPLETE
902,0.5874934491910808,2024-04-11 16:09:06.963507,2024-04-11 16:09:07.354796,0 days 00:00:00.391289,98.46982634317187,1.1257859419887897,sigmoid,0,,,,,,,,,,,,,,,,COMPLETE
903,0.5457505829380075,2024-04-11 16:09:07.356802,2024-04-11 16:09:07.842505,0 days 00:00:00.485703,96.51598112705734,1.31815163527285,sigmoid,33,28.0,,,,,,,,,,,,,,48.0,COMPLETE
904,0.3894334209897203,2024-04-11 16:09:07.843505,2024-04-11 16:09:08.415533,0 days 00:00:00.572028,30.352462900610718,0.5608580960230356,sigmoid,45,19.0,37.0,27.0,,,,47.0,46.0,,,,,,,77.0,COMPLETE
905,0.43795555024495164,2024-04-11 16:09:08.416741,2024-04-11 16:09:08.920861,0 days 00:00:00.504120,93.07596721526428,0.9850779294346319,sigmoid,17,,,,3.0,1.0,79.0,,,,,,,,,82.0,COMPLETE
906,0.39304446597400855,2024-04-11 16:09:08.921863,2024-04-11 16:09:09.400548,0 days 00:00:00.478685,99.96201590726152,0.7742301248296637,sigmoid,49,31.0,,,8.0,6.0,99.0,,,,,,,,,60.0,COMPLETE
907,0.5858043514863523,2024-04-11 16:09:09.401656,2024-04-11 16:09:09.763912,0 days 00:00:00.362256,86.21127094405966,1.8086661165167268,sigmoid,0,,,,,,,,,,,,,,,,COMPLETE
908,0.33321490859763575,2024-04-11 16:09:09.764914,2024-04-11 16:09:10.320222,0 days 00:00:00.555308,95.32293517905366,1.4296092011332857,sigmoid,50,4.0,,,6.0,3.0,10.0,,,6.122608574483275,8.951025350865551,2.556424927923188,5.0,25.0,87.0,,COMPLETE
909,0.47845868388277457,2024-04-11 16:09:10.321223,2024-04-11 16:09:10.902773,0 days 00:00:00.581550,99.99686411896434,4.903690610917156,sigmoid,58,33.0,41.0,44.0,1.0,5.0,44.0,,,4.621885768233332,7.591879942563825,2.893331493373027,9.0,37.0,70.0,,COMPLETE
910,0.4813307283186801,2024-04-11 16:09:10.903775,2024-04-11 16:09:11.494806,0 days 00:00:00.591031,91.08715109532028,1.1611945303917455,sigmoid,19,,,,4.0,4.0,2.0,,,3.9789570981264886,9.751784370909299,6.634878035396026,17.0,50.0,82.0,22.0,COMPLETE
911,0.5880365043344815,2024-04-11 16:09:11.495807,2024-04-11 16:09:11.881175,0 days 00:00:00.385368,97.2607506926804,0.9762243730437793,sigmoid,0,,,,,,,,,,,,,,,,COMPLETE
912,0.5376617865478465,2024-04-11 16:09:11.882176,2024-04-11 16:09:12.411183,0 days 00:00:00.529007,93.21731107932975,0.6936453506222953,sigmoid,6,,,,,,,32.0,34.0,5.34441446363082,1.7972368288463971,8.201896914579253,11.0,40.0,73.0,,COMPLETE
913,0.45895551059088696,2024-04-11 16:09:12.412184,2024-04-11 16:09:13.004851,0 days 00:00:00.592667,88.2999977664568,1.2145620916985562,sigmoid,29,,15.0,23.0,2.0,2.0,21.0,16.0,23.0,,,,,,,71.0,COMPLETE
914,0.40539546700541546,2024-04-11 16:09:13.005852,2024-04-11 16:09:13.489419,0 days 00:00:00.483567,95.14511931337574,1.6333288628494556,sigmoid,25,,27.0,10.0,4.0,7.0,96.0,,,,,,,,,10.0,COMPLETE
915,0.46021282606648456,2024-04-11 16:09:13.490478,2024-04-11 16:09:14.055188,0 days 00:00:00.564710,97.01885779220513,0.8883153387687952,sigmoid,18,,,,7.0,6.0,72.0,,,3.346307859498969,6.300669608942298,4.031788832234319,2.0,32.0,66.0,,COMPLETE
916,0.321244390864644,2024-04-11 16:09:14.056184,2024-04-11 16:09:15.265088,0 days 00:00:01.208904,90.25085216446553,1.326908956513481,rbf,39,37.0,,,,,,14.0,10.0,1.7756932942857393,8.435117268376915,5.302415659533486,3.0,37.0,89.0,27.0,COMPLETE
917,0.5886376209075821,2024-04-11 16:09:15.266087,2024-04-11 16:09:15.706439,0 days 00:00:00.440352,93.70577379281646,1.0909425442682044,sigmoid,0,,,,,,,,,,,,,,,,COMPLETE
918,0.39318520357497516,2024-04-11 16:09:15.707439,2024-04-11 16:09:16.388563,0 days 00:00:00.681124,99.95742134567547,0.5900547756753767,sigmoid,47,13.0,6.0,6.0,,,,26.0,31.0,4.802073518085516,1.0970745287475152,3.420978694575628,8.0,38.0,67.0,35.0,COMPLETE
919,0.47654589371980677,2024-04-11 16:09:16.389659,2024-04-11 16:09:16.992354,0 days 00:00:00.602695,97.98721609668063,1.5279501009519123,sigmoid,43,26.0,13.0,38.0,,,,,,7.026271430302127,8.725498870781292,1.1176837664655075,7.0,28.0,77.0,103.0,COMPLETE
920,0.4778975447765257,2024-04-11 16:09:16.993499,2024-04-11 16:09:17.471324,0 days 00:00:00.477825,94.36799179086145,0.8716751955381122,sigmoid,24,,3.0,15.0,5.0,8.0,59.0,,,,,,,,,,COMPLETE
921,0.12158321707228854,2024-04-11 16:09:17.471493,2024-04-11 16:09:17.830729,0 days 00:00:00.359236,91.68715067454292,0.36171015719990574,sigmoid,0,,,,,,,,,,,,,,,,COMPLETE
922,0.34377351729080813,2024-04-11 16:09:17.831731,2024-04-11 16:09:18.426361,0 days 00:00:00.594630,95.93504593279742,1.0402202912769956,sigmoid,35,42.0,,,,,,,,5.700220771665391,3.82598457676491,1.747256147206922,16.0,23.0,61.0,46.0,COMPLETE
923,0.14097259407097307,2024-04-11 16:09:18.429355,2024-04-11 16:09:18.915114,0 days 00:00:00.485759,98.32547784001598,1.2946039593642698,sigmoid,2,,,,,,,,,5.541805123105689,6.88933914509306,3.7410952845538414,4.0,24.0,72.0,,COMPLETE
924,0.4777928701401882,2024-04-11 16:09:18.916136,2024-04-11 16:09:19.391396,0 days 00:00:00.475260,87.75726270934679,0.6937848069933654,sigmoid,21,,,,3.0,5.0,63.0,45.0,47.0,,,,,,,53.0,COMPLETE
925,0.5865019492683915,2024-04-11 16:09:19.392520,2024-04-11 16:09:19.754488,0 days 00:00:00.361968,92.11403849846698,1.1129037314984989,sigmoid,0,,,,,,,,,,,,,,,,COMPLETE
926,0.4353407884050728,2024-04-11 16:09:19.755499,2024-04-11 16:09:20.344189,0 days 00:00:00.588690,95.16932108115392,0.8810361767658051,sigmoid,22,,,,6.0,4.0,84.0,5.0,41.0,3.5271501035526756,5.849567125770117,1.968925792856938,6.0,31.0,74.0,,COMPLETE
927,0.5888219294970936,2024-04-11 16:09:20.345189,2024-04-11 16:09:20.708646,0 days 00:00:00.363457,90.0455215522235,1.3607802811557892,sigmoid,0,,,,,,,,,,,,,,,,COMPLETE
928,0.5825355334095736,2024-04-11 16:09:20.708646,2024-04-11 16:09:21.090906,0 days 00:00:00.382260,47.28458925330881,0.5179041334964822,sigmoid,1,,,,,,,,,,,,,,,31.0,COMPLETE
929,0.0,2024-04-11 16:09:21.091909,2024-04-11 16:09:21.652021,0 days 00:00:00.560112,96.72310640260447,0.007784551161642071,sigmoid,8,,8.0,12.0,,,,,,,,,,,,,COMPLETE
930,0.5219168136085468,2024-04-11 16:09:21.653030,2024-04-11 16:09:22.190069,0 days 00:00:00.537039,93.29235511082078,1.9018149396703885,sigmoid,3,,,,,,,,,5.116831054684045,3.0052700987764007,4.607789482973419,4.0,26.0,59.0,66.0,COMPLETE
931,0.4763284510486722,2024-04-11 16:09:22.191069,2024-04-11 16:09:22.855776,0 days 00:00:00.664707,97.49791795328636,0.7852851292701633,sigmoid,31,,42.0,30.0,5.0,1.0,53.0,49.0,35.0,2.296530416797815,5.295940885769214,9.12938853826349,12.0,39.0,80.0,74.0,COMPLETE
932,0.5857799611637595,2024-04-11 16:09:22.856847,2024-04-11 16:09:23.207242,0 days 00:00:00.350395,95.07557879637221,1.036384250655698,sigmoid,0,,,,,,,,,,,,,,,,COMPLETE
933,0.411969473825144,2024-04-11 16:09:23.208244,2024-04-11 16:09:23.632584,0 days 00:00:00.424340,91.97481292794512,1.561104683498522,sigmoid,16,,,,1.0,3.0,75.0,,,,,,,,,,COMPLETE
934,0.5391473429452041,2024-04-11 16:09:23.633584,2024-04-11 16:09:24.310075,0 days 00:00:00.676491,99.9220339201194,1.253229711659512,sigmoid,38,47.0,,,,,,38.0,33.0,4.436732898559832,6.535616553503649,6.985657090037954,5.0,49.0,69.0,,COMPLETE
935,0.43067813961209633,2024-04-11 16:09:24.312108,2024-04-11 16:09:25.643170,0 days 00:00:01.331062,85.04723384332459,0.946997620993436,rbf,42,18.0,34.0,28.0,,,,,,4.20611255926514,0.8049513625948732,7.922177911151276,19.0,41.0,78.0,,COMPLETE
936,0.37627330053357355,2024-04-11 16:09:25.645168,2024-04-11 16:09:26.140217,0 days 00:00:00.495049,98.21087296634836,0.6646902017483661,sigmoid,9,,24.0,36.0,,,,,,,,,,,,96.0,COMPLETE
