number,value,datetime_start,datetime_complete,duration,params_C,params_gamma,params_kernel,params_mask_number,params_rsi_window,params_so_smooth,params_so_window,params_srsi_smooth1,params_srsi_smooth2,params_srsi_window,params_tsi_window_fast,params_tsi_window_slow,params_ult_weight_1,params_ult_weight_2,params_ult_weight_3,params_ult_window_1,params_ult_window_2,params_ult_window_3,params_williams_lbp,state
5691,0.4946227080394922,2024-04-11 17:28:48.167259,2024-04-11 17:28:49.425549,0 days 00:00:01.258290,98.12961743094483,8.391081696278968,sigmoid,57,44.0,22.0,31.0,5.0,8.0,35.0,,,,,,,,,141.0,COMPLETE
5692,0.19272093698577097,2024-04-11 17:28:49.428117,2024-04-11 17:28:51.105009,0 days 00:00:01.676892,99.98641627968634,7.741236698426909,rbf,15,,27.0,30.0,,,,43.0,16.0,6.461332893592883,1.5357137708399762,1.6903919482992817,17.0,34.0,95.0,30.0,COMPLETE
5693,0.4543859221526237,2024-04-11 17:28:51.108017,2024-04-11 17:28:52.127367,0 days 00:00:01.019350,95.63101789023155,8.096664641981238,sigmoid,9,,25.0,29.0,,,,,,,,,,,,46.0,COMPLETE
5694,0.5895095625828441,2024-04-11 17:28:52.129381,2024-04-11 17:28:53.112340,0 days 00:00:00.982959,97.97868673995465,7.585043068490882,sigmoid,8,,24.0,34.0,,,,,,,,,,,,,COMPLETE
5695,0.4859589289601625,2024-04-11 17:28:53.113338,2024-04-11 17:28:54.375678,0 days 00:00:01.262340,96.7061539468713,8.565299145782847,sigmoid,28,,23.0,31.0,6.0,7.0,44.0,46.0,29.0,,,,,,,,COMPLETE
5696,0.48952873315621925,2024-04-11 17:28:54.377685,2024-04-11 17:28:55.796658,0 days 00:00:01.418973,93.98547097364778,8.235979683935463,sigmoid,14,,26.0,28.0,,,,12.0,22.0,1.1176158234568803,8.56295178451884,1.905283626309906,4.0,44.0,98.0,,COMPLETE
5697,0.5952371952371952,2024-04-11 17:28:55.798243,2024-04-11 17:28:56.767316,0 days 00:00:00.969073,99.96670649426252,7.944052774605701,sigmoid,8,,24.0,32.0,,,,,,,,,,,,,COMPLETE
5698,0.47436984506282276,2024-04-11 17:28:56.769320,2024-04-11 17:28:58.499419,0 days 00:00:01.730099,99.99062946342785,8.895174713210803,sigmoid,63,20.0,25.0,30.0,4.0,6.0,65.0,8.0,48.0,0.5036078705873237,8.878192116031189,9.138781970018135,8.0,49.0,68.0,82.0,COMPLETE
5699,0.12622036262203626,2024-04-11 17:28:58.501470,2024-04-11 17:28:59.443797,0 days 00:00:00.942327,98.09570059505816,8.336530068580068,sigmoid,8,,31.0,29.0,,,,,,,,,,,,,COMPLETE
5700,0.39969329857383834,2024-04-11 17:28:59.446818,2024-04-11 17:29:00.915280,0 days 00:00:01.468462,99.99181161938941,7.989550237263508,sigmoid,46,15.0,26.0,32.0,,,,34.0,31.0,3.1277785939184843,1.0167893420115082,8.652547951837455,11.0,48.0,54.0,,COMPLETE
5701,0.46720980882471563,2024-04-11 17:29:00.917816,2024-04-11 17:29:01.890497,0 days 00:00:00.972681,95.61628187813545,7.751642855693447,sigmoid,16,,,,3.0,5.0,18.0,,,,,,,,,,COMPLETE
5702,0.5929369437606513,2024-04-11 17:29:01.893056,2024-04-11 17:29:02.845506,0 days 00:00:00.952450,96.66683760466357,8.195774048148802,sigmoid,8,,28.0,33.0,,,,,,,,,,,,,COMPLETE
5703,0.2339768983778825,2024-04-11 17:29:02.848099,2024-04-11 17:29:04.104114,0 days 00:00:01.256015,97.9500683014941,9.606645653345936,sigmoid,10,,27.0,31.0,,,,,,1.7716330185293705,7.642059126957941,5.67397927377761,9.0,41.0,91.0,,COMPLETE
5704,0.5481817995784475,2024-04-11 17:29:04.106634,2024-04-11 17:29:05.195285,0 days 00:00:01.088651,43.84153200825295,8.509317496406009,sigmoid,2,,,,,,,,,0.8818440895376156,4.57448045773584,6.935652311565679,6.0,26.0,52.0,,COMPLETE
5705,0.44973241590214064,2024-04-11 17:29:05.197278,2024-04-11 17:29:06.872832,0 days 00:00:01.675554,98.17184944494453,8.058710404861117,sigmoid,62,25.0,23.0,31.0,1.0,2.0,38.0,42.0,28.0,3.868280498618468,8.290865348305969,3.619434226695391,19.0,43.0,70.0,,COMPLETE
5706,0.44701971028259324,2024-04-11 17:29:06.875827,2024-04-11 17:29:07.845468,0 days 00:00:00.969641,93.74150398586028,7.463733612499083,sigmoid,8,,26.0,30.0,,,,,,,,,,,,,COMPLETE
5707,0.49392100967278224,2024-04-11 17:29:07.847412,2024-04-11 17:29:09.286010,0 days 00:00:01.438598,96.74146898367184,7.785478832307521,sigmoid,26,,24.0,33.0,5.0,1.0,26.0,,,8.17392645069933,5.55696360994188,4.61557759122276,13.0,45.0,86.0,,COMPLETE
5708,0.5998117115420825,2024-04-11 17:29:09.288530,2024-04-11 17:29:10.236680,0 days 00:00:00.948150,99.9939862133038,7.192721598428301,sigmoid,8,,25.0,32.0,,,,,,,,,,,,,COMPLETE
5709,0.3095593319020415,2024-04-11 17:29:10.238678,2024-04-11 17:29:11.345522,0 days 00:00:01.106844,95.09209608090242,8.308840184744879,sigmoid,20,,,,7.0,3.0,46.0,41.0,4.0,,,,,,,,COMPLETE
5710,0.49228516135781164,2024-04-11 17:29:11.347531,2024-04-11 17:29:12.559634,0 days 00:00:01.212103,92.01755309345923,7.945375677026986,sigmoid,56,40.0,27.0,31.0,6.0,7.0,57.0,,,,,,,,,,COMPLETE
5711,0.22584536039595723,2024-04-11 17:29:12.561648,2024-04-11 17:29:13.847908,0 days 00:00:01.286260,98.16061542337246,9.982333525571917,rbf,41,22.0,22.0,29.0,,,,,,,,,,,,87.0,COMPLETE
5712,0.5266731328806984,2024-04-11 17:29:13.850447,2024-04-11 17:29:14.883692,0 days 00:00:01.033245,96.75207107887096,7.640850320218195,sigmoid,37,8.0,,,,,,47.0,2.0,,,,,,,169.0,COMPLETE
5713,0.594268224819143,2024-04-11 17:29:14.886269,2024-04-11 17:29:15.842890,0 days 00:00:00.956621,99.9933916016681,8.085786643285603,sigmoid,8,,24.0,27.0,,,,,,,,,,,,,COMPLETE
5714,0.5274129197113014,2024-04-11 17:29:15.844896,2024-04-11 17:29:17.135955,0 days 00:00:01.291059,95.1592978868366,8.426783193843825,sigmoid,11,,25.0,30.0,,,,,,6.894380091336973,2.315604197995103,8.015664779743593,15.0,29.0,89.0,174.0,COMPLETE
5715,0.4131539702346533,2024-04-11 17:29:17.137938,2024-04-11 17:29:18.161041,0 days 00:00:01.023103,98.06556207694327,8.747932987093074,sigmoid,48,49.0,,,2.0,4.0,68.0,,,,,,,,,,COMPLETE
5716,0.5963643249384587,2024-04-11 17:29:18.163041,2024-04-11 17:29:19.095144,0 days 00:00:00.932103,89.4783018969524,8.198689068430088,sigmoid,8,,26.0,32.0,,,,,,,,,,,,,COMPLETE
5717,0.33761785254018856,2024-04-11 17:29:19.097140,2024-04-11 17:29:20.253446,0 days 00:00:01.156306,99.99612110582214,5.122579737747358,sigmoid,52,16.0,,,8.0,8.0,30.0,31.0,25.0,,,,,,,,COMPLETE
5718,0.49202221959579245,2024-04-11 17:29:20.255451,2024-04-11 17:29:21.834327,0 days 00:00:01.578876,96.97045164380039,7.8607395431503555,sigmoid,55,43.0,,,3.0,6.0,4.0,23.0,27.0,6.208069404432653,5.947254432310768,2.787522584968715,12.0,21.0,65.0,14.0,COMPLETE
5719,0.5895095625828441,2024-04-11 17:29:21.836865,2024-04-11 17:29:22.780761,0 days 00:00:00.943896,98.11627274394472,8.152125591105829,sigmoid,8,,23.0,34.0,,,,,,,,,,,,,COMPLETE
5720,0.349728813559322,2024-04-11 17:29:22.782756,2024-04-11 17:29:24.184959,0 days 00:00:01.402203,95.24340990455075,8.551560258537137,sigmoid,13,,29.0,30.0,,,,9.0,24.0,,,,,,,103.0,COMPLETE
5721,0.6009432182607054,2024-04-11 17:29:24.186962,2024-04-11 17:29:25.164733,0 days 00:00:00.977771,96.88859894752154,7.611961690331152,sigmoid,8,,21.0,31.0,,,,,,,,,,,,,COMPLETE
5722,0.46891191709844554,2024-04-11 17:29:25.166321,2024-04-11 17:29:26.661830,0 days 00:00:01.495509,98.34622688198856,5.869686215778797,sigmoid,23,,,,4.0,5.0,78.0,7.0,42.0,2.6117507348308266,6.878878758375061,5.333052975114196,10.0,33.0,94.0,186.0,COMPLETE
5723,0.45347172512526845,2024-04-11 17:29:26.664830,2024-04-11 17:29:27.639247,0 days 00:00:00.974417,93.43021735004443,7.926037738159726,sigmoid,8,,27.0,28.0,,,,,,,,,,,,,COMPLETE
5724,0.33443485058451483,2024-04-11 17:29:27.641247,2024-04-11 17:29:28.679792,0 days 00:00:01.038545,95.35046673180643,8.333751128530784,sigmoid,12,,25.0,32.0,,,,40.0,33.0,,,,,,,,COMPLETE
5725,0.341282165039929,2024-04-11 17:29:28.682356,2024-04-11 17:29:29.850642,0 days 00:00:01.168286,98.30637548560661,8.034134682112855,sigmoid,44,3.0,24.0,31.0,,,,13.0,37.0,,,,,,,,COMPLETE
5726,0.5895095625828441,2024-04-11 17:29:29.852654,2024-04-11 17:29:30.789591,0 days 00:00:00.936937,96.62882310028291,7.802578753823408,sigmoid,8,,28.0,34.0,,,,,,,,,,,,,COMPLETE
5727,0.40143578369860217,2024-04-11 17:29:30.791598,2024-04-11 17:29:32.359947,0 days 00:00:01.568349,98.17442312214028,7.3339125856546845,sigmoid,59,37.0,26.0,29.0,7.0,1.0,11.0,,,4.813723663619557,3.6148302687987424,3.1836885652752698,18.0,46.0,56.0,57.0,COMPLETE
5728,0.47034620902471375,2024-04-11 17:29:32.361934,2024-04-11 17:29:33.329133,0 days 00:00:00.967199,99.96786107719687,8.268983956026013,sigmoid,36,32.0,,,,,,38.0,35.0,,,,,,,,COMPLETE
5729,0.258090999438275,2024-04-11 17:29:33.331144,2024-04-11 17:29:34.912860,0 days 00:00:01.581716,92.71743530863785,8.073861931641895,rbf,60,18.0,40.0,33.0,1.0,2.0,42.0,20.0,43.0,,,,,,,,COMPLETE
5730,0.48163686052644195,2024-04-11 17:29:34.914862,2024-04-11 17:29:36.416851,0 days 00:00:01.501989,98.22260674162165,8.637723541967224,sigmoid,54,4.0,,,5.0,3.0,93.0,29.0,41.0,5.856370134191743,0.6316430642639999,1.3695769481230617,2.0,38.0,76.0,,COMPLETE
5731,0.5870341178815386,2024-04-11 17:29:36.419838,2024-04-11 17:29:37.288298,0 days 00:00:00.868460,95.17134974898067,7.676424368097873,sigmoid,32,14.0,,,,,,,,,,,,,,,COMPLETE
5732,0.45345352376492626,2024-04-11 17:29:37.290294,2024-04-11 17:29:38.242265,0 days 00:00:00.951971,96.51869147003211,8.389075560848292,sigmoid,8,,5.0,30.0,,,,,,,,,,,,,COMPLETE
5733,0.4203937119388189,2024-04-11 17:29:38.244274,2024-04-11 17:29:39.859867,0 days 00:00:01.615593,98.19616996641061,4.238066431338677,sigmoid,30,,27.0,32.0,4.0,4.0,23.0,6.0,12.0,3.416258619107983,5.163561419404579,7.366486922946885,14.0,32.0,62.0,,COMPLETE
5734,0.5141818982602951,2024-04-11 17:29:39.862845,2024-04-11 17:29:40.885370,0 days 00:00:01.022525,94.09662665475773,7.903265488360151,sigmoid,40,12.0,25.0,31.0,,,,,,,,,,,,,COMPLETE
5735,0.44701971028259324,2024-04-11 17:29:40.887371,2024-04-11 17:29:41.832859,0 days 00:00:00.945488,99.95877320177073,8.176345602295932,sigmoid,8,,26.0,30.0,,,,,,,,,,,,,COMPLETE
5736,0.5886452332280246,2024-04-11 17:29:41.834833,2024-04-11 17:29:42.842046,0 days 00:00:01.007213,96.67195959447317,2.72281908430032,sigmoid,8,,23.0,29.0,,,,,,,,,,,,,COMPLETE
5737,0.5602960969044414,2024-04-11 17:29:42.844157,2024-04-11 17:29:43.767338,0 days 00:00:00.923181,99.9697753824398,7.537770428755015,sigmoid,4,,,,,,,18.0,13.0,,,,,,,,COMPLETE
5738,0.4261008662058975,2024-04-11 17:29:43.768921,2024-04-11 17:29:45.145567,0 days 00:00:01.376646,99.97481655687987,7.9900899180505345,sigmoid,61,5.0,24.0,32.0,3.0,6.0,70.0,35.0,20.0,,,,,,,195.0,COMPLETE
5739,0.5222158107328333,2024-04-11 17:29:45.148119,2024-04-11 17:29:45.987972,0 days 00:00:00.839853,96.88260435561342,8.467086998597757,sigmoid,1,,,,,,,,,,,,,,,70.0,COMPLETE
5740,0.5247530691406407,2024-04-11 17:29:45.989978,2024-04-11 17:29:46.902116,0 days 00:00:00.912138,87.99284853938889,7.752234205710949,sigmoid,33,10.0,,,,,,,,,,,,,,163.0,COMPLETE
5741,0.5929369437606513,2024-04-11 17:29:46.904117,2024-04-11 17:29:47.844484,0 days 00:00:00.940367,98.30174988525322,8.268508891651152,sigmoid,8,,25.0,33.0,,,,,,,,,,,,,COMPLETE
5742,0.40741210411184736,2024-04-11 17:29:47.846484,2024-04-11 17:29:48.839812,0 days 00:00:00.993328,91.60639474287221,8.08668317999985,sigmoid,5,,,,,,,30.0,49.0,,,,,,,78.0,COMPLETE
5743,0.5009652285149436,2024-04-11 17:29:48.841812,2024-04-11 17:29:49.887821,0 days 00:00:01.046009,95.31046234582693,7.873610757866053,sigmoid,17,,,,8.0,7.0,53.0,,,,,,,,,153.0,COMPLETE
5744,0.5986580986580987,2024-04-11 17:29:49.889842,2024-04-11 17:29:50.855111,0 days 00:00:00.965269,99.97976790727897,8.228323654963337,sigmoid,8,,26.0,31.0,,,,,,,,,,,,,COMPLETE
5745,0.5138650468770632,2024-04-11 17:29:50.857130,2024-04-11 17:29:52.057179,0 days 00:00:01.200049,98.22034263045607,8.561816423406993,sigmoid,45,46.0,28.0,31.0,,,,37.0,39.0,,,,,,,119.0,COMPLETE
5746,0.4277336912125103,2024-04-11 17:29:52.059204,2024-04-11 17:29:53.758677,0 days 00:00:01.699473,94.1376288768156,9.155788389405542,sigmoid,27,,24.0,28.0,6.0,5.0,74.0,,,9.164603953888495,9.212907000418955,2.149117308183422,16.0,28.0,66.0,137.0,COMPLETE
5747,0.5077079011880069,2024-04-11 17:29:53.761645,2024-04-11 17:29:55.373830,0 days 00:00:01.612185,5.220825298958161,7.424780765082202,sigmoid,7,,,,,,,16.0,18.0,2.97916384905795,2.7887078102158944,4.3771979780108605,8.0,48.0,74.0,43.0,COMPLETE
5748,0.3355580274378939,2024-04-11 17:29:55.376822,2024-04-11 17:29:57.228868,0 days 00:00:01.852046,96.67357144206908,7.904689260505008,rbf,34,7.0,,,,,,,,7.552750623039851,8.033078511926147,4.95987040036651,3.0,39.0,53.0,,COMPLETE
5749,0.4581805031771452,2024-04-11 17:29:57.230896,2024-04-11 17:29:58.675264,0 days 00:00:01.444368,98.0146011001842,7.666030063431228,sigmoid,51,39.0,,,2.0,8.0,81.0,,,1.3712315194901037,3.0412250005815546,6.709262392826581,17.0,24.0,92.0,66.0,COMPLETE
5750,0.5069140556625241,2024-04-11 17:29:58.677264,2024-04-11 17:29:59.672307,0 days 00:00:00.995043,96.65652338268416,8.144395604768711,sigmoid,8,,23.0,35.0,,,,,,,,,,,,,COMPLETE
5751,0.5268989484135939,2024-04-11 17:29:59.674313,2024-04-11 17:30:00.831529,0 days 00:00:01.157216,98.1209511585518,8.392752243967724,sigmoid,49,21.0,,,1.0,2.0,14.0,,,,,,,,,181.0,COMPLETE
5752,0.42026216788149545,2024-04-11 17:30:00.833523,2024-04-11 17:30:02.450252,0 days 00:00:01.616729,95.43011250870725,7.915163882567507,sigmoid,53,28.0,,,5.0,4.0,28.0,25.0,44.0,,,,,,,33.0,COMPLETE
5753,0.4448341684562156,2024-04-11 17:30:02.452300,2024-04-11 17:30:03.616354,0 days 00:00:01.164054,98.24488653893145,8.746752886595447,sigmoid,8,,22.0,30.0,,,,,,,,,,,,,COMPLETE
5754,0.5963643249384587,2024-04-11 17:30:03.618867,2024-04-11 17:30:04.855457,0 days 00:00:01.236590,93.6411771169888,8.162523743119557,sigmoid,8,,27.0,32.0,,,,,,,,,,,,,COMPLETE
5755,0.34899105747814235,2024-04-11 17:30:04.857964,2024-04-11 17:30:06.794528,0 days 00:00:01.936564,98.13546953716059,7.731201158039697,sigmoid,58,34.0,47.0,29.0,2.0,1.0,8.0,,,8.603771496613028,4.234470763863092,2.463037090301955,7.0,40.0,97.0,,COMPLETE
5756,0.3599890268157191,2024-04-11 17:30:06.796530,2024-04-11 17:30:08.555564,0 days 00:00:01.759034,96.55530661637253,8.386029909852494,sigmoid,43,19.0,25.0,33.0,,,,,,5.063615666227927,0.8637366915629547,0.9408904628693984,4.0,36.0,61.0,90.0,COMPLETE
5757,0.47273914462944827,2024-04-11 17:30:08.558109,2024-04-11 17:30:10.254147,0 days 00:00:01.696038,95.18643510085157,8.080587376531755,sigmoid,29,,25.0,30.0,6.0,7.0,49.0,44.0,10.0,,,,,,,126.0,COMPLETE
5758,0.49242459777663117,2024-04-11 17:30:10.258144,2024-04-11 17:30:11.798438,0 days 00:00:01.540294,98.0053187908516,3.066089620595714,sigmoid,25,,27.0,31.0,8.0,3.0,32.0,,,,,,,,,111.0,COMPLETE
5759,0.3411367919849222,2024-04-11 17:30:11.800445,2024-04-11 17:30:13.445102,0 days 00:00:01.644657,97.9849911719536,7.513331927163215,sigmoid,50,24.0,,,4.0,6.0,34.0,,,7.014387146772084,6.258298820703464,7.1368678430419195,11.0,31.0,77.0,,COMPLETE
5760,0.22682719419952557,2024-04-11 17:30:13.448101,2024-04-11 17:30:15.012739,0 days 00:00:01.564638,99.98498044186249,7.972291232840082,sigmoid,6,,,,,,,49.0,38.0,9.301565443320989,6.489209252979498,3.0160943856516944,9.0,42.0,81.0,,COMPLETE
5761,0.5963643249384587,2024-04-11 17:30:15.014716,2024-04-11 17:30:16.261001,0 days 00:00:01.246285,95.29267162068157,8.345084775788406,sigmoid,8,,26.0,32.0,,,,,,,,,,,,,COMPLETE
5762,0.5005099843604796,2024-04-11 17:30:16.263001,2024-04-11 17:30:18.065044,0 days 00:00:01.802043,96.75543433661227,4.443810274476883,sigmoid,19,,,,3.0,5.0,63.0,,,5.351727524606571,4.019996793257457,3.9710216058322043,13.0,22.0,79.0,106.0,COMPLETE
5763,0.47756032583636454,2024-04-11 17:30:18.067086,2024-04-11 17:30:19.695944,0 days 00:00:01.628858,92.11616540371986,7.062895519187629,sigmoid,18,,,,7.0,8.0,58.0,,,1.9688343066355074,0.5190709534505222,3.464843749153883,20.0,34.0,59.0,,COMPLETE
5764,0.6009432182607054,2024-04-11 17:30:19.698954,2024-04-11 17:30:20.925549,0 days 00:00:01.226595,98.14626605356945,7.786420632240067,sigmoid,8,,24.0,31.0,,,,,,,,,,,,,COMPLETE
5765,0.40148067062280346,2024-04-11 17:30:20.927553,2024-04-11 17:30:22.702557,0 days 00:00:01.775004,72.16274816572421,8.18695995031654,sigmoid,22,,,,1.0,2.0,88.0,28.0,46.0,4.305010645767044,9.804143019614788,5.80825897603141,18.0,37.0,71.0,,COMPLETE
5766,0.5929369437606513,2024-04-11 17:30:22.704538,2024-04-11 17:30:23.840256,0 days 00:00:01.135718,98.12717756228734,7.998181684700459,sigmoid,8,,23.0,33.0,,,,,,,,,,,,,COMPLETE
5767,0.37463039621525723,2024-04-11 17:30:23.842251,2024-04-11 17:30:25.740924,0 days 00:00:01.898673,93.80219601938013,7.61430729100284,sigmoid,47,31.0,26.0,30.0,,,,15.0,32.0,7.40919984714281,1.081496897802011,4.180263847650687,5.0,47.0,83.0,131.0,COMPLETE
5768,0.16911936463443125,2024-04-11 17:30:25.742908,2024-04-11 17:30:27.772149,0 days 00:00:02.029241,96.46872558754333,8.406002340959267,rbf,38,41.0,,,,,,22.0,17.0,6.03684455561026,1.7663707905488417,9.406588323703609,19.0,23.0,64.0,,COMPLETE
5769,0.5952371952371952,2024-04-11 17:30:27.774163,2024-04-11 17:30:28.950721,0 days 00:00:01.176558,98.25124541847572,8.634588716283822,sigmoid,8,,28.0,32.0,,,,,,,,,,,,,COMPLETE
5770,0.449572550831793,2024-04-11 17:30:28.952723,2024-04-11 17:30:30.629594,0 days 00:00:01.676871,61.250562233664404,7.879937283822179,sigmoid,39,26.0,,,,,,10.0,22.0,0.6585516668760274,3.8240928676530554,1.1055577313369769,10.0,25.0,69.0,52.0,COMPLETE
5771,0.4941363593201026,2024-04-11 17:30:30.633150,2024-04-11 17:30:32.114068,0 days 00:00:01.480918,99.98239428927003,8.202018659565821,sigmoid,24,,24.0,29.0,6.0,4.0,39.0,,,,,,,,,,COMPLETE
5772,0.5986044733320588,2024-04-11 17:30:32.117632,2024-04-11 17:30:33.316604,0 days 00:00:01.198972,95.70114956833355,8.916993188308071,sigmoid,8,,25.0,31.0,,,,,,,,,,,,,COMPLETE
5773,0.5312885523461097,2024-04-11 17:30:33.318606,2024-04-11 17:30:34.849472,0 days 00:00:01.530866,77.51058426448057,8.032571674070729,sigmoid,3,,,,,,,,,4.612636296885009,7.42820053842464,7.908559624168408,14.0,44.0,51.0,171.0,COMPLETE
5774,0.4883001079116261,2024-04-11 17:30:34.851468,2024-04-11 17:30:36.325836,0 days 00:00:01.474368,98.11274454304439,7.758699265763964,sigmoid,57,9.0,27.0,34.0,5.0,1.0,84.0,,,,,,,,,25.0,COMPLETE
5775,0.48186514840002104,2024-04-11 17:30:36.328810,2024-04-11 17:30:37.817964,0 days 00:00:01.489154,95.36724460926054,3.7230342064715805,sigmoid,28,,20.0,31.0,2.0,3.0,67.0,17.0,6.0,,,,,,,,COMPLETE
5776,0.30434945071369857,2024-04-11 17:30:37.820958,2024-04-11 17:30:39.299098,0 days 00:00:01.478140,38.49393731519615,7.32056879299455,sigmoid,35,2.0,,,,,,,,1.6177918398023707,2.5679271003279673,7.630753408901571,15.0,45.0,87.0,37.0,COMPLETE
5777,0.4370104088421505,2024-04-11 17:30:39.301608,2024-04-11 17:30:40.710604,0 days 00:00:01.408996,90.83064671362446,8.531786478287888,sigmoid,21,,,,4.0,7.0,36.0,14.0,47.0,,,,,,,146.0,COMPLETE
5778,0.40991176470588236,2024-04-11 17:30:40.713598,2024-04-11 17:30:42.804136,0 days 00:00:02.090538,98.25603920843768,8.280141421206892,sigmoid,31,,30.0,28.0,8.0,6.0,20.0,3.0,21.0,7.20382138985987,7.194499802133957,6.1883247788650895,11.0,30.0,100.0,84.0,COMPLETE
5779,0.44701971028259324,2024-04-11 17:30:42.807674,2024-04-11 17:30:44.019445,0 days 00:00:01.211771,96.67760511339057,8.053219228073452,sigmoid,8,,25.0,30.0,,,,,,,,,,,,,COMPLETE
5780,0.5952371952371952,2024-04-11 17:30:44.021010,2024-04-11 17:30:45.314775,0 days 00:00:01.293765,93.55572324142412,7.5758363420586745,sigmoid,8,,26.0,32.0,,,,,,,,,,,,,COMPLETE
5781,0.12622036262203626,2024-04-11 17:30:45.317778,2024-04-11 17:30:46.538693,0 days 00:00:01.220915,98.17633523918379,7.833121104150648,sigmoid,8,,23.0,29.0,,,,,,,,,,,,,COMPLETE
5782,0.5873757268805103,2024-04-11 17:30:46.541246,2024-04-11 17:30:47.691288,0 days 00:00:01.150042,99.93733052586015,8.260632328775534,sigmoid,8,,24.0,43.0,,,,,,,,,,,,,COMPLETE
5783,0.3692024745025915,2024-04-11 17:30:47.693284,2024-04-11 17:30:49.273167,0 days 00:00:01.579883,99.93875885361169,8.003755427478866,sigmoid,42,30.0,29.0,33.0,,,,,,6.689826797370501,2.2046595939737847,9.992626557131818,16.0,27.0,60.0,,COMPLETE
5784,0.5288474118006192,2024-04-11 17:30:49.275181,2024-04-11 17:30:50.597096,0 days 00:00:01.321915,99.98662747238765,8.565011753132028,sigmoid,9,,27.0,30.0,,,,,,,,,,,,95.0,COMPLETE
5785,0.37451778073928593,2024-04-11 17:30:50.599091,2024-04-11 17:30:52.416991,0 days 00:00:01.817900,96.44798310993338,8.140548117067167,sigmoid,15,,26.0,32.0,,,,32.0,15.0,2.758352380445,1.2989087462295075,8.426589862171703,6.0,35.0,88.0,192.0,COMPLETE
5786,0.387178715866172,2024-04-11 17:30:52.419985,2024-04-11 17:30:54.373754,0 days 00:00:01.953769,94.85459234978461,7.724211965081943,rbf,16,,,,7.0,8.0,61.0,,,,,,,,,,COMPLETE
5787,0.4038801252053181,2024-04-11 17:30:54.375750,2024-04-11 17:30:56.131177,0 days 00:00:01.755427,98.03816392435913,8.385769076089833,sigmoid,46,36.0,22.0,31.0,,,,45.0,8.0,3.738339543971957,6.055740286463808,9.04253639633465,12.0,50.0,55.0,,COMPLETE
5788,0.5747164973868454,2024-04-11 17:30:56.133219,2024-04-11 17:30:57.441690,0 days 00:00:01.308471,99.9632468783335,7.906096470530394,sigmoid,2,,,,,,,,,9.63888149899431,4.922993481473867,4.782245510353852,2.0,32.0,63.0,,COMPLETE
5789,0.36485367697347115,2024-04-11 17:30:57.444733,2024-04-11 17:30:58.896423,0 days 00:00:01.451690,96.56894312138692,7.456485612406387,sigmoid,10,,25.0,30.0,,,,,,8.00706993919295,3.224217974245663,5.442123669841669,8.0,43.0,90.0,,COMPLETE
5790,0.39394214201505395,2024-04-11 17:30:58.898419,2024-04-11 17:31:00.971862,0 days 00:00:02.073443,98.22753998684962,8.17547361392149,sigmoid,63,17.0,25.0,32.0,3.0,5.0,6.0,21.0,27.0,2.1658779861787467,5.505228056147194,6.378207927598832,9.0,20.0,93.0,10.0,COMPLETE
5791,0.5929369437606513,2024-04-11 17:31:00.973861,2024-04-11 17:31:02.234496,0 days 00:00:01.260635,93.0939641516995,7.990696640256584,sigmoid,8,,23.0,33.0,,,,,,,,,,,,,COMPLETE
5792,0.49789106913625525,2024-04-11 17:31:02.238051,2024-04-11 17:31:03.633875,0 days 00:00:01.395824,96.51359447298644,8.466495662907466,sigmoid,41,39.0,27.0,31.0,,,,,,,,,,,,76.0,COMPLETE
5793,0.44701971028259324,2024-04-11 17:31:03.635880,2024-04-11 17:31:04.831760,0 days 00:00:01.195880,94.93961414743123,7.773647351070817,sigmoid,8,,24.0,30.0,,,,,,,,,,,,,COMPLETE
