number,value,datetime_start,datetime_complete,duration,params_C,params_gamma,params_kernel,params_mask_number,params_rsi_window,params_so_smooth,params_so_window,params_srsi_smooth1,params_srsi_smooth2,params_srsi_window,params_tsi_window_fast,params_tsi_window_slow,params_ult_weight_1,params_ult_weight_2,params_ult_weight_3,params_ult_window_1,params_ult_window_2,params_ult_window_3,params_williams_lbp,state
3535,0.4535204209471311,2024-04-11 16:48:27.526613,2024-04-11 16:48:28.792595,0 days 00:00:01.265982,98.06691177967284,8.002117594966277,sigmoid,23,,,,4.0,3.0,4.0,41.0,20.0,9.244870399966137,0.5189645921828907,2.736015182332045,14.0,22.0,68.0,127.0,COMPLETE
3536,0.30950301971912975,2024-04-11 16:48:28.792595,2024-04-11 16:48:29.748389,0 days 00:00:00.955794,94.93550730172332,8.560812625402042,sigmoid,12,,24.0,34.0,,,,31.0,28.0,,,,,,,,COMPLETE
3537,0.45345352376492626,2024-04-11 16:48:29.748389,2024-04-11 16:48:30.604048,0 days 00:00:00.855659,96.5255733598634,8.312906091917114,sigmoid,8,,25.0,30.0,,,,,,,,,,,,,COMPLETE
3538,0.12003789673140693,2024-04-11 16:48:30.612776,2024-04-11 16:48:31.399307,0 days 00:00:00.786531,98.04021468131144,8.811620481733419,sigmoid,1,,,,,,,,,,,,,,,28.0,COMPLETE
3539,0.5929369437606513,2024-04-11 16:48:31.399307,2024-04-11 16:48:32.288924,0 days 00:00:00.889617,99.99808321604372,7.223725409831718,sigmoid,8,,26.0,33.0,,,,,,,,,,,,,COMPLETE
3540,0.5326008721791778,2024-04-11 16:48:32.288924,2024-04-11 16:48:33.412233,0 days 00:00:01.123309,92.64934606276613,7.763326807560592,sigmoid,7,,,,,,,22.0,9.0,4.682205624221803,4.7652517256449975,8.134482262028358,11.0,41.0,81.0,118.0,COMPLETE
3541,0.11303508572726241,2024-04-11 16:48:33.412233,2024-04-11 16:48:34.868339,0 days 00:00:01.456106,98.22930482503067,7.99105230760956,rbf,60,39.0,28.0,28.0,6.0,6.0,81.0,25.0,5.0,,,,,,,,COMPLETE
3542,0.47500328040939505,2024-04-11 16:48:34.868339,2024-04-11 16:48:36.067757,0 days 00:00:01.199418,96.43044937362932,4.589704470340623,sigmoid,61,10.0,24.0,29.0,5.0,5.0,27.0,37.0,26.0,,,,,,,32.0,COMPLETE
3543,0.5224430035557415,2024-04-11 16:48:36.075804,2024-04-11 16:48:37.038269,0 days 00:00:00.962465,94.04473588289046,8.161545612907736,sigmoid,40,25.0,25.0,32.0,,,,,,,,,,,,,COMPLETE
3544,0.5931111524855706,2024-04-11 16:48:37.038269,2024-04-11 16:48:37.877520,0 days 00:00:00.839251,98.06265347898744,7.54160950884999,sigmoid,8,,27.0,26.0,,,,,,,,,,,,,COMPLETE
3545,0.5687791764299857,2024-04-11 16:48:37.877520,2024-04-11 16:48:38.686131,0 days 00:00:00.808611,95.41130405042196,7.734087486705548,sigmoid,32,7.0,,,,,,,,,,,,,,,COMPLETE
3546,0.4753428654800117,2024-04-11 16:48:38.686131,2024-04-11 16:48:40.075801,0 days 00:00:01.389670,99.99015720550165,8.41896109022811,sigmoid,30,,23.0,31.0,8.0,8.0,21.0,28.0,21.0,3.051454507014093,7.567785059031893,6.639601794429483,17.0,27.0,75.0,,COMPLETE
3547,0.5546215099284346,2024-04-11 16:48:40.083822,2024-04-11 16:48:41.106170,0 days 00:00:01.022348,99.97908512770401,5.906464585641561,sigmoid,34,2.0,,,,,,,,5.799310521961304,3.1378569143661763,1.292340681404311,5.0,34.0,62.0,,COMPLETE
3548,0.5282579185520363,2024-04-11 16:48:41.106170,2024-04-11 16:48:42.414442,0 days 00:00:01.308272,96.46370223398684,7.975632039582283,sigmoid,54,45.0,,,1.0,2.0,51.0,40.0,41.0,5.268797754248416,6.023157785415093,9.706121567131884,2.0,44.0,87.0,,COMPLETE
3549,0.5986580986580987,2024-04-11 16:48:42.423575,2024-04-11 16:48:43.262063,0 days 00:00:00.838488,98.35939456150854,8.252012316771653,sigmoid,8,,26.0,31.0,,,,,,,,,,,,,COMPLETE
3550,0.3272090020291459,2024-04-11 16:48:43.270139,2024-04-11 16:48:44.099809,0 days 00:00:00.829670,99.93541456053369,7.8423811488817785,sigmoid,33,31.0,,,,,,,,,,,,,,61.0,COMPLETE
3551,0.4503226159230096,2024-04-11 16:48:44.099809,2024-04-11 16:48:45.456933,0 days 00:00:01.357124,96.67800520923544,8.623019720090145,sigmoid,27,,24.0,30.0,7.0,7.0,72.0,,,6.084590124126681,9.813767538601798,7.446144951071105,7.0,36.0,57.0,89.0,COMPLETE
3552,0.3279744004934845,2024-04-11 16:48:45.462999,2024-04-11 16:48:46.354959,0 days 00:00:00.891960,93.97037681931427,8.096980848948432,sigmoid,5,,,,,,,5.0,15.0,,,,,,,112.0,COMPLETE
3553,0.35171535781291885,2024-04-11 16:48:46.354959,2024-04-11 16:48:47.446415,0 days 00:00:01.091456,96.81336219582685,8.356697797327083,sigmoid,45,30.0,26.0,32.0,,,,13.0,36.0,,,,,,,10.0,COMPLETE
3554,0.43978674718690286,2024-04-11 16:48:47.446415,2024-04-11 16:48:48.312378,0 days 00:00:00.865963,98.11137272307388,7.473500629439791,sigmoid,8,,25.0,24.0,,,,,,,,,,,,,COMPLETE
3555,0.5895095625828441,2024-04-11 16:48:48.312378,2024-04-11 16:48:49.155284,0 days 00:00:00.842906,98.21465976319419,7.861927614833208,sigmoid,8,,29.0,34.0,,,,,,,,,,,,,COMPLETE
3556,0.12622036262203626,2024-04-11 16:48:49.155284,2024-04-11 16:48:50.019442,0 days 00:00:00.864158,32.349469546410944,8.093370531934443,sigmoid,8,,27.0,29.0,,,,,,,,,,,,,COMPLETE
3557,0.4043014870125725,2024-04-11 16:48:50.019442,2024-04-11 16:48:50.948668,0 days 00:00:00.929226,95.27243715418675,7.641489179061518,sigmoid,17,,,,2.0,1.0,66.0,,,,,,,,,102.0,COMPLETE
3558,0.3135067724391173,2024-04-11 16:48:50.948668,2024-04-11 16:48:51.756267,0 days 00:00:00.807599,91.64636433900709,8.242919029969977,sigmoid,4,,,,,,,42.0,12.0,,,,,,,,COMPLETE
3559,0.5052949726599452,2024-04-11 16:48:51.764705,2024-04-11 16:48:53.345885,0 days 00:00:01.581180,98.37082823454452,8.507519656787382,sigmoid,58,42.0,23.0,33.0,6.0,3.0,11.0,,,2.8565999111962874,1.950778308356699,9.987877899708192,12.0,30.0,72.0,,COMPLETE
3560,0.20594637380033642,2024-04-11 16:48:53.345885,2024-04-11 16:48:54.784455,0 days 00:00:01.438570,95.31367891454171,7.957001269503148,rbf,53,36.0,,,3.0,6.0,32.0,11.0,50.0,,,,,,,190.0,COMPLETE
3561,0.6009432182607054,2024-04-11 16:48:54.793398,2024-04-11 16:48:55.649287,0 days 00:00:00.855889,99.96858411959023,7.703321449232612,sigmoid,8,,25.0,31.0,,,,,,,,,,,,,COMPLETE
3562,0.4254120178965849,2024-04-11 16:48:55.649287,2024-04-11 16:48:56.913187,0 days 00:00:01.263900,98.15215051252929,8.741417081052754,sigmoid,51,28.0,,,4.0,4.0,96.0,,,4.037227039618683,6.680749605625673,4.76075216397926,6.0,25.0,92.0,55.0,COMPLETE
3563,0.5041318509311051,2024-04-11 16:48:56.913187,2024-04-11 16:48:58.087298,0 days 00:00:01.174111,96.64952643360986,8.104685000117563,sigmoid,18,,,,8.0,2.0,41.0,,,9.726664921581785,7.002039407252182,5.608626004059748,13.0,37.0,69.0,,COMPLETE
3564,0.5107568375862235,2024-04-11 16:48:58.087298,2024-04-11 16:48:59.270873,0 days 00:00:01.183575,99.96459831065715,8.2783184204136,sigmoid,29,,24.0,30.0,5.0,7.0,30.0,21.0,34.0,,,,,,,95.0,COMPLETE
3565,0.38400404108435765,2024-04-11 16:48:59.279736,2024-04-11 16:49:00.487333,0 days 00:00:01.207597,93.44733402363764,4.962172205802154,sigmoid,19,,,,6.0,5.0,63.0,,,7.238650707932233,8.39146926298477,6.120969116529928,16.0,23.0,86.0,152.0,COMPLETE
3566,0.2925454330429298,2024-04-11 16:49:00.487333,2024-04-11 16:49:01.701918,0 days 00:00:01.214585,98.3018560099891,7.8704028983360255,sigmoid,50,5.0,,,2.0,8.0,19.0,,,0.8842422472115548,7.309277890840997,7.938296196645962,9.0,46.0,52.0,,COMPLETE
3567,0.5963643249384587,2024-04-11 16:49:01.709825,2024-04-11 16:49:02.533176,0 days 00:00:00.823351,96.63869356286581,8.393698278672696,sigmoid,8,,26.0,32.0,,,,,,,,,,,,,COMPLETE
3568,0.39964251918830823,2024-04-11 16:49:02.533176,2024-04-11 16:49:03.609038,0 days 00:00:01.075862,98.25826901987527,8.097307670447508,sigmoid,25,,28.0,27.0,7.0,2.0,92.0,,,,,,,,,196.0,COMPLETE
3569,0.6009432182607054,2024-04-11 16:49:03.609038,2024-04-11 16:49:04.443861,0 days 00:00:00.834823,95.25999741542311,7.797682456672156,sigmoid,8,,25.0,31.0,,,,,,,,,,,,,COMPLETE
3570,0.4523260284505959,2024-04-11 16:49:04.443861,2024-04-11 16:49:05.421295,0 days 00:00:00.977434,96.7540641707539,7.375928808545786,sigmoid,49,26.0,,,1.0,6.0,87.0,,,,,,,,,41.0,COMPLETE
3571,0.4420341904898721,2024-04-11 16:49:05.421295,2024-04-11 16:49:06.730327,0 days 00:00:01.309032,93.0238907176905,8.063304895971381,sigmoid,47,35.0,27.0,30.0,,,,8.0,39.0,7.973107674578438,5.862278156520063,0.7371416682999499,20.0,49.0,61.0,21.0,COMPLETE
3572,0.36177463219633677,2024-04-11 16:49:06.730327,2024-04-11 16:49:07.978347,0 days 00:00:01.248020,99.94323353265673,8.509770067516815,sigmoid,43,16.0,23.0,29.0,,,,,,3.8141436998888407,8.896242156760012,8.501354386722273,3.0,35.0,56.0,108.0,COMPLETE
3573,0.5929369437606513,2024-04-11 16:49:07.986371,2024-04-11 16:49:08.812062,0 days 00:00:00.825691,98.0698441596768,7.669677196609107,sigmoid,8,,22.0,33.0,,,,,,,,,,,,,COMPLETE
3574,0.5963643249384587,2024-04-11 16:49:08.820758,2024-04-11 16:49:09.648696,0 days 00:00:00.827938,99.91920670159784,8.217095291437047,sigmoid,8,,26.0,32.0,,,,,,,,,,,,,COMPLETE
3575,0.5086377666190629,2024-04-11 16:49:09.648696,2024-04-11 16:49:10.898480,0 days 00:00:01.249784,94.90550835741023,4.2265121560050645,sigmoid,39,40.0,,,,,,4.0,30.0,5.005268212483095,1.254364066873777,4.508717616879018,4.0,21.0,66.0,176.0,COMPLETE
3576,0.5162935430892903,2024-04-11 16:49:10.898480,2024-04-11 16:49:12.015466,0 days 00:00:01.116986,96.75774285279886,7.957199956663184,sigmoid,35,9.0,,,,,,,,1.466114716086722,0.7980227584791626,3.994420470296957,15.0,26.0,53.0,142.0,COMPLETE
3577,0.4365178154660027,2024-04-11 16:49:12.015466,2024-04-11 16:49:13.032712,0 days 00:00:01.017246,99.94127267328905,8.332283194991987,sigmoid,24,,24.0,31.0,8.0,4.0,48.0,,,,,,,,,,COMPLETE
3578,0.46553004189425684,2024-04-11 16:49:13.032712,2024-04-11 16:49:14.426289,0 days 00:00:01.393577,98.1485266427365,7.9605394870090125,sigmoid,31,,25.0,31.0,5.0,1.0,85.0,19.0,32.0,0.6546392940167056,4.456835281125462,9.247388124497112,13.0,47.0,55.0,185.0,COMPLETE
3579,0.4930165169516083,2024-04-11 16:49:14.426289,2024-04-11 16:49:16.038337,0 days 00:00:01.612048,95.2449403956821,7.518658783529661,rbf,8,,28.0,30.0,,,,,,,,,,,,,COMPLETE
3580,0.3351135797194332,2024-04-11 16:49:16.045901,2024-04-11 16:49:17.229579,0 days 00:00:01.183678,81.37364071470603,8.640044707418449,sigmoid,38,6.0,,,,,,18.0,25.0,6.221328056846267,7.932138599225299,5.855336899423659,18.0,32.0,58.0,,COMPLETE
3581,0.5279684282772821,2024-04-11 16:49:17.238260,2024-04-11 16:49:18.306936,0 days 00:00:01.068676,98.21017582329594,7.804941459529689,sigmoid,3,,,,,,,,,3.509643927097808,3.7486793526329634,2.2771555369826717,14.0,45.0,76.0,49.0,COMPLETE
3582,0.5600642356351102,2024-04-11 16:49:18.307393,2024-04-11 16:49:19.440134,0 days 00:00:01.132741,96.77499697900767,8.196086205376696,sigmoid,6,,,,,,,39.0,16.0,4.4856973119217045,2.4326686680421252,3.7842778307180884,8.0,50.0,89.0,,COMPLETE
3583,0.5069140556625241,2024-04-11 16:49:19.440134,2024-04-11 16:49:20.279337,0 days 00:00:00.839203,93.42887463072452,8.388271968803334,sigmoid,8,,26.0,35.0,,,,,,,,,,,,,COMPLETE
3584,0.5929369437606513,2024-04-11 16:49:20.279337,2024-04-11 16:49:21.122234,0 days 00:00:00.842897,98.39665415479351,8.008075625478464,sigmoid,8,,23.0,33.0,,,,,,,,,,,,,COMPLETE
3585,0.446207025911734,2024-04-11 16:49:21.122234,2024-04-11 16:49:22.317067,0 days 00:00:01.194833,91.45919019926455,7.179915429638543,sigmoid,57,15.0,27.0,32.0,4.0,3.0,57.0,,,,,,,,,123.0,COMPLETE
3586,0.4800366476998746,2024-04-11 16:49:22.317067,2024-04-11 16:49:23.530238,0 days 00:00:01.213171,96.57902314973761,7.702293453606969,sigmoid,22,,,,3.0,8.0,75.0,32.0,45.0,8.985032979326718,1.0948087904140458,7.1289323913947085,19.0,28.0,74.0,,COMPLETE
3587,0.5278652929155313,2024-04-11 16:49:23.530238,2024-04-11 16:49:24.416382,0 days 00:00:00.886144,98.26872076379432,8.137837842318609,sigmoid,9,,25.0,30.0,,,,,,,,,,,,146.0,COMPLETE
3588,0.413801401798875,2024-04-11 16:49:24.416382,2024-04-11 16:49:25.698226,0 days 00:00:01.281844,95.16912584567805,8.537657980745385,sigmoid,15,,24.0,28.0,,,,49.0,2.0,1.1746320460475879,6.820152119825373,1.6028944369465483,9.0,38.0,80.0,72.0,COMPLETE
3589,0.3563233996334261,2024-04-11 16:49:25.706273,2024-04-11 16:49:26.920374,0 days 00:00:01.214101,98.23103594040904,7.86192303160973,sigmoid,14,,26.0,29.0,,,,29.0,23.0,0.5062283865255175,6.2298558312416015,3.3023481340896303,10.0,33.0,94.0,,COMPLETE
3590,0.35046646717127267,2024-04-11 16:49:26.920374,2024-04-11 16:49:28.090818,0 days 00:00:01.170444,99.95746185571599,8.262399246149267,sigmoid,42,48.0,24.0,31.0,,,,,,3.2072762678809656,7.7273236368701905,2.961772853179413,6.0,24.0,64.0,,COMPLETE
3591,0.43247787610619465,2024-04-11 16:49:28.090818,2024-04-11 16:49:29.628521,0 days 00:00:01.537703,99.95043890270284,3.5574694367240527,sigmoid,63,33.0,29.0,32.0,2.0,5.0,34.0,34.0,40.0,2.595378220087616,2.9050245114111344,1.974154475897112,3.0,36.0,91.0,102.0,COMPLETE
3592,0.44701971028259324,2024-04-11 16:49:29.628521,2024-04-11 16:49:30.504593,0 days 00:00:00.876072,96.50931298039967,8.038805446771374,sigmoid,8,,22.0,30.0,,,,,,,,,,,,,COMPLETE
3593,0.5042743183712347,2024-04-11 16:49:30.504593,2024-04-11 16:49:31.583062,0 days 00:00:01.078469,99.95983306648156,7.661867618606866,sigmoid,21,,,,7.0,7.0,14.0,24.0,48.0,,,,,,,168.0,COMPLETE
3594,0.39895802023845306,2024-04-11 16:49:31.583062,2024-04-11 16:49:32.817528,0 days 00:00:01.234466,94.11477890173616,7.466468571382033,sigmoid,46,23.0,27.0,32.0,,,,26.0,38.0,7.024959921425576,9.026553055555553,9.530236650024491,11.0,42.0,84.0,,COMPLETE
3595,0.5951910283216119,2024-04-11 16:49:32.817528,2024-04-11 16:49:33.671315,0 days 00:00:00.853787,96.75563160093408,9.141094445537757,sigmoid,8,,26.0,33.0,,,,,,,,,,,,,COMPLETE
3596,0.46083500038970154,2024-04-11 16:49:33.671601,2024-04-11 16:49:34.614586,0 days 00:00:00.942985,98.21216443921604,2.406233437916412,sigmoid,16,,,,3.0,6.0,6.0,,,,,,,,,,COMPLETE
3597,0.2722031915782438,2024-04-11 16:49:34.614586,2024-04-11 16:49:36.060849,0 days 00:00:01.446263,95.38469944332242,8.404223121540207,rbf,28,,25.0,31.0,6.0,2.0,60.0,47.0,6.0,,,,,,,,COMPLETE
3598,0.5440997761432682,2024-04-11 16:49:36.060849,2024-04-11 16:49:37.078001,0 days 00:00:01.017152,98.07531379670868,7.906436005088005,sigmoid,2,,,,,,,,,1.7773955449359065,3.910411740699546,5.313746542621991,7.0,20.0,63.0,,COMPLETE
3599,0.4553979871912168,2024-04-11 16:49:37.078001,2024-04-11 16:49:38.487249,0 days 00:00:01.409248,96.70379381679898,8.173032290506846,sigmoid,62,12.0,28.0,29.0,1.0,1.0,79.0,46.0,19.0,2.1286995723250053,1.8235597943043298,3.5368197446135934,5.0,39.0,96.0,,COMPLETE
3600,0.49757503967101,2024-04-11 16:49:38.495280,2024-04-11 16:49:39.454017,0 days 00:00:00.958737,99.99708437510427,8.798719218210998,sigmoid,41,37.0,25.0,31.0,,,,,,,,,,,,87.0,COMPLETE
3601,0.28879433784723646,2024-04-11 16:49:39.454017,2024-04-11 16:49:40.603182,0 days 00:00:01.149165,99.98483588972665,8.05040880113874,sigmoid,10,,23.0,34.0,,,,,,8.547303498114555,5.127670251807185,1.1612752381887166,2.0,25.0,83.0,,COMPLETE
3602,0.45345352376492626,2024-04-11 16:49:40.603182,2024-04-11 16:49:41.465018,0 days 00:00:00.861836,93.33628533610339,8.305519278159178,sigmoid,8,,24.0,30.0,,,,,,,,,,,,,COMPLETE
3603,0.12622036262203626,2024-04-11 16:49:41.465018,2024-04-11 16:49:42.301961,0 days 00:00:00.836943,99.9953501457319,7.7738991570663725,sigmoid,8,,21.0,29.0,,,,,,,,,,,,,COMPLETE
3604,0.4869591211419177,2024-04-11 16:49:42.301961,2024-04-11 16:49:43.525246,0 days 00:00:01.223285,96.5701227154862,8.54706932434231,sigmoid,26,,27.0,32.0,5.0,3.0,24.0,,,7.737018927860151,4.264572451982115,2.6380494896423388,17.0,37.0,79.0,,COMPLETE
3605,0.45347172512526845,2024-04-11 16:49:43.534225,2024-04-11 16:49:44.390298,0 days 00:00:00.856073,47.94632545171556,7.917213111915342,sigmoid,8,,26.0,28.0,,,,,,,,,,,,,COMPLETE
3606,0.6009432182607054,2024-04-11 16:49:44.390298,2024-04-11 16:49:45.244060,0 days 00:00:00.853762,98.31653282693401,8.161604583240498,sigmoid,8,,25.0,31.0,,,,,,,,,,,,,COMPLETE
3607,0.5332042757343657,2024-04-11 16:49:45.244060,2024-04-11 16:49:46.278108,0 days 00:00:01.034048,94.975029892007,7.583995691699146,sigmoid,20,,,,8.0,4.0,39.0,2.0,4.0,,,,,,,,COMPLETE
3608,0.3831817866314986,2024-04-11 16:49:46.278108,2024-04-11 16:49:47.428594,0 days 00:00:01.150486,99.99648422618091,8.388862257491972,sigmoid,11,,23.0,33.0,,,,,,6.675473398596597,8.519746653811774,6.417199603574291,4.0,40.0,88.0,172.0,COMPLETE
3609,0.4262438730523837,2024-04-11 16:49:47.436614,2024-04-11 16:49:48.563698,0 days 00:00:01.127084,98.15102131932584,7.367414482491661,sigmoid,56,50.0,24.0,31.0,4.0,5.0,54.0,,,,,,,,,,COMPLETE
3610,0.44701971028259324,2024-04-11 16:49:48.563698,2024-04-11 16:49:49.443209,0 days 00:00:00.879511,96.61791847220806,8.025191479969317,sigmoid,8,,27.0,30.0,,,,,,,,,,,,,COMPLETE
3611,0.4000461832816521,2024-04-11 16:49:49.451970,2024-04-11 16:49:50.495653,0 days 00:00:01.043683,95.23185808131515,7.884640404131054,sigmoid,52,29.0,,,7.0,7.0,83.0,6.0,22.0,,,,,,,,COMPLETE
3612,0.5424498009162135,2024-04-11 16:49:50.495653,2024-04-11 16:49:51.460372,0 days 00:00:00.964719,91.55099131249932,8.240003520358792,sigmoid,37,20.0,,,,,,33.0,42.0,,,,,,,162.0,COMPLETE
3613,0.4903983268371518,2024-04-11 16:49:51.462455,2024-04-11 16:49:52.361758,0 days 00:00:00.899303,99.94280171750559,7.702717675983637,sigmoid,48,18.0,,,3.0,1.0,71.0,,,,,,,,,,COMPLETE
3614,0.5952371952371952,2024-04-11 16:49:52.361758,2024-04-11 16:49:53.231637,0 days 00:00:00.869879,99.97010934186352,8.644254630511194,sigmoid,8,,26.0,32.0,,,,,,,,,,,,,COMPLETE
3615,0.12622036262203626,2024-04-11 16:49:53.231637,2024-04-11 16:49:54.091101,0 days 00:00:00.859464,96.74414736724313,8.06598379322112,sigmoid,8,,25.0,29.0,,,,,,,,,,,,,COMPLETE
3616,0.2286797220467467,2024-04-11 16:49:54.091101,2024-04-11 16:49:55.578932,0 days 00:00:01.487831,97.92969324523347,8.375531453084747,rbf,60,11.0,28.0,31.0,6.0,6.0,45.0,16.0,11.0,,,,,,,,COMPLETE
3617,0.45233508616650175,2024-04-11 16:49:55.580026,2024-04-11 16:49:56.952447,0 days 00:00:01.372421,93.79308214617986,7.855611476593128,sigmoid,59,27.0,24.0,32.0,2.0,8.0,90.0,,,5.669039852236097,1.6506621479555772,4.2479252646542545,10.0,46.0,77.0,193.0,COMPLETE
3618,0.5234916975102644,2024-04-11 16:49:56.952447,2024-04-11 16:49:57.991130,0 days 00:00:01.038683,99.95518307554839,8.207228567170995,sigmoid,44,3.0,22.0,30.0,,,,43.0,44.0,,,,,,,,COMPLETE
3619,0.363697253851306,2024-04-11 16:49:57.991130,2024-04-11 16:49:59.055417,0 days 00:00:01.064287,65.20229388694435,7.575242807356788,sigmoid,13,,30.0,34.0,,,,45.0,8.0,,,,,,,25.0,COMPLETE
3620,0.524138659902769,2024-04-11 16:49:59.055417,2024-04-11 16:50:00.052479,0 days 00:00:00.997062,96.79213126078513,8.460346378167724,sigmoid,12,,26.0,33.0,,,,12.0,28.0,,,,,,,,COMPLETE
3621,0.44356962223323,2024-04-11 16:50:00.060486,2024-04-11 16:50:01.435584,0 days 00:00:01.375098,99.9732438613944,8.046238766315941,sigmoid,55,38.0,,,1.0,3.0,68.0,30.0,47.0,9.435551077042497,4.943553999045375,4.906069113347291,16.0,22.0,99.0,81.0,COMPLETE
3622,0.4523933034661636,2024-04-11 16:50:01.435584,2024-04-11 16:50:02.331293,0 days 00:00:00.895709,98.22079411263515,6.603430159832772,sigmoid,8,,25.0,30.0,,,,,,,,,,,,,COMPLETE
3623,0.5952828415711333,2024-04-11 16:50:02.331293,2024-04-11 16:50:03.181281,0 days 00:00:00.849988,95.16745344865227,5.449565397253666,sigmoid,8,,27.0,32.0,,,,,,,,,,,,,COMPLETE
3624,0.6009432182607054,2024-04-11 16:50:03.181281,2024-04-11 16:50:04.035608,0 days 00:00:00.854327,71.83929473525154,7.804532816923145,sigmoid,8,,24.0,31.0,,,,,,,,,,,,,COMPLETE
3625,0.4445596703326693,2024-04-11 16:50:04.044097,2024-04-11 16:50:05.328019,0 days 00:00:01.283922,96.85715803533563,8.221533202915037,sigmoid,23,,,,4.0,4.0,37.0,23.0,13.0,4.332491464920333,3.315465315568437,8.278565424552497,8.0,34.0,67.0,67.0,COMPLETE
3626,0.4985760306270134,2024-04-11 16:50:05.328019,2024-04-11 16:50:06.586315,0 days 00:00:01.258296,98.138475416697,7.035326890622185,sigmoid,61,41.0,26.0,30.0,5.0,2.0,16.0,9.0,37.0,,,,,,,115.0,COMPLETE
3627,0.533733103762196,2024-04-11 16:50:06.594355,2024-04-11 16:50:07.398052,0 days 00:00:00.803697,93.42280345217559,7.978326172927374,sigmoid,1,,,,,,,,,,,,,,,45.0,COMPLETE
3628,0.4502052644288819,2024-04-11 16:50:07.398052,2024-04-11 16:50:08.237518,0 days 00:00:00.839466,96.89764517183824,8.98583027752264,sigmoid,8,,23.0,28.0,,,,,,,,,,,,,COMPLETE
3629,0.3244795668239857,2024-04-11 16:50:08.237518,2024-04-11 16:50:09.387504,0 days 00:00:01.149986,98.29532384070335,8.66849588177983,sigmoid,7,,,,,,,20.0,32.0,8.79601406186493,7.392444976982334,8.683350718584354,12.0,35.0,71.0,200.0,COMPLETE
3630,0.5022728474020826,2024-04-11 16:50:09.387504,2024-04-11 16:50:10.695645,0 days 00:00:01.308141,99.95091962435644,7.698725362589444,sigmoid,54,31.0,,,8.0,5.0,2.0,38.0,10.0,5.526816079695635,6.59895169169404,7.516514494144294,20.0,31.0,51.0,,COMPLETE
3631,0.21793613985016053,2024-04-11 16:50:10.704089,2024-04-11 16:50:11.788883,0 days 00:00:01.084794,95.19508463223035,8.28159688413557,sigmoid,34,43.0,,,,,,,,9.626849522164,9.368013214079543,6.873987472352894,15.0,43.0,69.0,,COMPLETE
3632,0.6009432182607054,2024-04-11 16:50:11.788883,2024-04-11 16:50:12.634762,0 days 00:00:00.845879,98.1901976683238,8.098671137823546,sigmoid,8,,29.0,31.0,,,,,,,,,,,,,COMPLETE
3633,0.31222109723628455,2024-04-11 16:50:12.634762,2024-04-11 16:50:13.551051,0 days 00:00:00.916289,95.29071506565687,7.390384803455853,sigmoid,36,34.0,,,,,,27.0,24.0,,,,,,,,COMPLETE
3634,0.5812886531720836,2024-04-11 16:50:13.551051,2024-04-11 16:50:14.362526,0 days 00:00:00.811475,98.05558967864442,8.481703513708052,sigmoid,32,15.0,,,,,,,,,,,,,,,COMPLETE
3635,0.11541527179977681,2024-04-11 16:50:14.362526,2024-04-11 16:50:16.038211,0 days 00:00:01.675685,96.62552181395162,7.847849071666952,rbf,27,,25.0,33.0,2.0,8.0,8.0,,,4.8187448601221,5.708728524697956,9.02479779128908,18.0,41.0,93.0,129.0,COMPLETE
3636,0.594268224819143,2024-04-11 16:50:16.038211,2024-04-11 16:50:16.891187,0 days 00:00:00.852976,91.91060393217018,8.09277236114325,sigmoid,8,,27.0,27.0,,,,,,,,,,,,,COMPLETE
3637,0.42817787093876325,2024-04-11 16:50:16.891187,2024-04-11 16:50:18.173226,0 days 00:00:01.282039,98.21570982895797,8.322333251103174,sigmoid,51,24.0,,,6.0,6.0,52.0,,,8.341392709849782,2.303720011644922,2.3801780573224396,19.0,30.0,54.0,158.0,COMPLETE
