number,value,datetime_start,datetime_complete,duration,params_C,params_gamma,params_kernel,params_mask_number,params_rsi_window,params_so_smooth,params_so_window,params_srsi_smooth1,params_srsi_smooth2,params_srsi_window,params_tsi_window_fast,params_tsi_window_slow,params_ult_weight_1,params_ult_weight_2,params_ult_weight_3,params_ult_window_1,params_ult_window_2,params_ult_window_3,params_williams_lbp,state
9600,0.48758899365018277,2024-04-11 19:38:12.290577,2024-04-11 19:38:15.581123,0 days 00:00:03.290546,95.33336423534347,7.9353380114490975,sigmoid,55,5.0,,,3.0,1.0,18.0,10.0,24.0,9.598663291707197,8.506581054643314,8.352229296931792,6.0,22.0,84.0,142.0,COMPLETE
9601,0.44129598526304387,2024-04-11 19:38:15.581123,2024-04-11 19:38:18.544490,0 days 00:00:02.963367,99.97615355293006,7.6661018897445,sigmoid,26,,26.0,32.0,6.0,2.0,92.0,,,5.462312381411767,5.4337987088698725,8.630441045173868,5.0,32.0,59.0,,COMPLETE
9602,0.5203564873172782,2024-04-11 19:38:18.560110,2024-04-11 19:38:20.706931,0 days 00:00:02.146821,41.16315280254871,8.38007502735995,sigmoid,48,38.0,,,7.0,6.0,65.0,,,,,,,,,,COMPLETE
9603,0.5119328673944041,2024-04-11 19:38:20.706931,2024-04-11 19:38:24.017120,0 days 00:00:03.310189,98.25609368837176,8.124248944997893,sigmoid,59,40.0,28.0,28.0,8.0,5.0,16.0,,,4.345905124931976,0.722547814982784,8.122546861700771,8.0,40.0,99.0,95.0,COMPLETE
9604,0.33826912018401384,2024-04-11 19:38:24.021129,2024-04-11 19:38:25.982364,0 days 00:00:01.961235,96.62131231143535,7.913531946433005,sigmoid,44,36.0,26.0,30.0,,,,19.0,50.0,,,,,,,,COMPLETE
9605,0.5929369437606513,2024-04-11 19:38:25.982364,2024-04-11 19:38:27.801299,0 days 00:00:01.818935,98.22445210744405,8.210264718135507,sigmoid,8,,23.0,33.0,,,,,,,,,,,,,COMPLETE
9606,0.5526397155445621,2024-04-11 19:38:27.801299,2024-04-11 19:38:29.654989,0 days 00:00:01.853690,99.97756889825195,7.7359730639539706,sigmoid,8,,24.0,50.0,,,,,,,,,,,,,COMPLETE
9607,0.38707831325301206,2024-04-11 19:38:29.670646,2024-04-11 19:38:31.595848,0 days 00:00:01.925202,93.88855182521297,5.686484209437259,sigmoid,13,,25.0,27.0,,,,34.0,22.0,,,,,,,104.0,COMPLETE
9608,0.5467138839704198,2024-04-11 19:38:31.600844,2024-04-11 19:38:33.903742,0 days 00:00:02.302898,70.2955761317789,8.41397129164608,sigmoid,2,,,,,,,,,6.2105923459354555,6.325931140266754,5.062301733739136,9.0,36.0,65.0,,COMPLETE
9609,0.4653482130244385,2024-04-11 19:38:33.906738,2024-04-11 19:38:36.298823,0 days 00:00:02.392085,61.976498874241514,8.011187307209795,sigmoid,60,22.0,27.0,32.0,4.0,7.0,85.0,2.0,37.0,,,,,,,,COMPLETE
