number,value,datetime_start,datetime_complete,duration,params_C,params_gamma,params_kernel,params_mask_number,params_rsi_window,params_so_smooth,params_so_window,params_srsi_smooth1,params_srsi_smooth2,params_srsi_window,params_tsi_window_fast,params_tsi_window_slow,params_ult_weight_1,params_ult_weight_2,params_ult_weight_3,params_ult_window_1,params_ult_window_2,params_ult_window_3,params_williams_lbp,state
6001,0.4829567307692308,2024-04-11 17:36:11.642580,2024-04-11 17:36:13.651192,0 days 00:00:02.008612,99.97685577141067,8.470465046241102,sigmoid,27,,24.0,29.0,2.0,8.0,28.0,,,8.467882044670317,5.3473433929616485,4.561961906959372,2.0,48.0,74.0,102.0,COMPLETE
6002,0.45450441554044524,2024-04-11 17:36:13.653238,2024-04-11 17:36:14.795605,0 days 00:00:01.142367,99.98442180138274,8.080514927639141,sigmoid,4,,,,,,,37.0,37.0,,,,,,,,COMPLETE
6003,0.5929369437606513,2024-04-11 17:36:14.798630,2024-04-11 17:36:15.998807,0 days 00:00:01.200177,96.50499262593513,7.764998207147833,sigmoid,8,,25.0,33.0,,,,,,,,,,,,,COMPLETE
6004,0.2760283571016404,2024-04-11 17:36:16.001787,2024-04-11 17:36:17.648610,0 days 00:00:01.646823,99.96458440347223,8.259074633304234,sigmoid,34,44.0,,,,,,,,3.27045320027122,2.5671668176270472,1.9015350112824358,8.0,21.0,94.0,,COMPLETE
6005,0.5308365861377783,2024-04-11 17:36:17.650610,2024-04-11 17:36:18.904775,0 days 00:00:01.254165,99.99321672120944,7.930808699483414,sigmoid,33,49.0,,,,,,,,,,,,,,169.0,COMPLETE
6006,0.5499035184957096,2024-04-11 17:36:18.907771,2024-04-11 17:36:20.217615,0 days 00:00:01.309844,96.52003065016908,8.699741221047514,sigmoid,5,,,,,,,6.0,47.0,,,,,,,177.0,COMPLETE
6007,0.44701971028259324,2024-04-11 17:36:20.219615,2024-04-11 17:36:21.472904,0 days 00:00:01.253289,94.22092649698914,7.570339657411969,sigmoid,8,,27.0,30.0,,,,,,,,,,,,,COMPLETE
6008,0.5001937033497765,2024-04-11 17:36:21.474921,2024-04-11 17:36:22.891344,0 days 00:00:01.416423,97.93234453143539,8.118183752130115,sigmoid,17,,,,1.0,4.0,62.0,,,,,,,,,14.0,COMPLETE
6009,0.5963643249384587,2024-04-11 17:36:22.894326,2024-04-11 17:36:24.104239,0 days 00:00:01.209913,95.34540210947588,8.466105919483702,sigmoid,8,,22.0,32.0,,,,,,,,,,,,,COMPLETE
6010,0.4325692552808758,2024-04-11 17:36:24.105758,2024-04-11 17:36:25.732310,0 days 00:00:01.626552,96.8662511926003,7.846638200397443,sigmoid,53,30.0,,,7.0,1.0,94.0,31.0,21.0,,,,,,,122.0,COMPLETE
6011,0.4761284295407612,2024-04-11 17:36:25.735313,2024-04-11 17:36:27.183068,0 days 00:00:01.447755,98.35031267720667,8.2544105756554,sigmoid,49,16.0,,,4.0,5.0,71.0,,,,,,,,,91.0,COMPLETE
6012,0.1798734243422773,2024-04-11 17:36:27.186063,2024-04-11 17:36:29.430285,0 days 00:00:02.244222,93.02250081771281,8.009732727187965,rbf,30,,24.0,31.0,5.0,2.0,65.0,9.0,3.0,9.818530195715521,8.059176811408287,2.7776726713967688,5.0,24.0,53.0,,COMPLETE
6013,0.45345352376492626,2024-04-11 17:36:29.433279,2024-04-11 17:36:30.655664,0 days 00:00:01.222385,98.22275343934201,8.368470905996354,sigmoid,8,,26.0,30.0,,,,,,,,,,,,,COMPLETE
6014,0.4481524342654143,2024-04-11 17:36:30.658790,2024-04-11 17:36:32.525932,0 days 00:00:01.867142,98.07381447289272,5.671002132942377,sigmoid,51,42.0,,,8.0,3.0,69.0,,,1.846677166859545,1.1288924828973759,8.779960145387154,13.0,44.0,62.0,59.0,COMPLETE
6015,0.5020003436173085,2024-04-11 17:36:32.530498,2024-04-11 17:36:34.110957,0 days 00:00:01.580459,95.3171868965157,8.122585141324862,sigmoid,45,14.0,28.0,32.0,,,,13.0,17.0,,,,,,,80.0,COMPLETE
6016,0.2750063307166371,2024-04-11 17:36:34.112491,2024-04-11 17:36:35.793998,0 days 00:00:01.681507,99.98412060336791,7.6626232693690035,sigmoid,18,,,,6.0,5.0,36.0,,,2.1929989064842927,3.977907940217238,9.861324587561558,17.0,27.0,79.0,,COMPLETE
6017,0.12622036262203626,2024-04-11 17:36:35.796998,2024-04-11 17:36:36.955477,0 days 00:00:01.158479,96.66762054243821,7.831288825291904,sigmoid,8,,25.0,29.0,,,,,,,,,,,,,COMPLETE
6018,0.35023219814241485,2024-04-11 17:36:36.957012,2024-04-11 17:36:38.678115,0 days 00:00:01.721103,91.76770911066555,7.27277391101652,sigmoid,19,,,,2.0,6.0,8.0,,,9.999472812878667,9.77666655904282,4.9078494050769566,12.0,31.0,67.0,70.0,COMPLETE
6019,0.5963245096172158,2024-04-11 17:36:38.681094,2024-04-11 17:36:39.940266,0 days 00:00:01.259172,99.96060489260553,8.597248704856883,sigmoid,8,,23.0,31.0,,,,,,,,,,,,,COMPLETE
6020,0.5929369437606513,2024-04-11 17:36:39.943837,2024-04-11 17:36:41.246369,0 days 00:00:01.302532,99.99005583967423,8.081781829088861,sigmoid,8,,26.0,33.0,,,,,,,,,,,,,COMPLETE
6021,0.3889568721086405,2024-04-11 17:36:41.248370,2024-04-11 17:36:43.287773,0 days 00:00:02.039403,98.11544304270795,9.724307193262792,sigmoid,58,5.0,27.0,29.0,3.0,4.0,18.0,,,7.360745604883574,4.819763527693151,1.7143746364890728,15.0,40.0,61.0,,COMPLETE
6022,0.3288149804359977,2024-04-11 17:36:43.289787,2024-04-11 17:36:45.013948,0 days 00:00:01.724161,94.95717664869701,8.348807982790031,sigmoid,39,12.0,,,,,,35.0,23.0,5.94714588389967,8.665628076787515,7.3261834387563916,4.0,39.0,68.0,10.0,COMPLETE
6023,0.23832986450324936,2024-04-11 17:36:45.015922,2024-04-11 17:36:46.733935,0 days 00:00:01.718013,96.67979046005895,7.515239799016218,sigmoid,6,,,,,,,29.0,42.0,4.851895680565997,7.677477927473182,6.749905270845586,3.0,26.0,52.0,,COMPLETE
6024,0.568009210257553,2024-04-11 17:36:46.736909,2024-04-11 17:36:48.083968,0 days 00:00:01.347059,99.98336090059752,7.947259203395423,sigmoid,8,,24.0,2.0,,,,,,,,,,,,,COMPLETE
6025,0.46848649802540293,2024-04-11 17:36:48.086965,2024-04-11 17:36:49.819193,0 days 00:00:01.732228,96.69983198646732,8.186003958494739,sigmoid,50,26.0,,,7.0,8.0,2.0,,,6.142139422244609,7.349517127279274,3.4688274082794006,14.0,30.0,58.0,,COMPLETE
6026,0.42860140279359754,2024-04-11 17:36:49.821189,2024-04-11 17:36:51.474514,0 days 00:00:01.653325,98.22214561940297,7.757467652617818,sigmoid,25,,25.0,30.0,5.0,7.0,49.0,,,,,,,,,23.0,COMPLETE
6027,0.4483065705618791,2024-04-11 17:36:51.476510,2024-04-11 17:36:53.245767,0 days 00:00:01.769257,94.4030535467692,8.521213699368674,sigmoid,29,,26.0,32.0,4.0,3.0,90.0,27.0,15.0,,,,,,,45.0,COMPLETE
6028,0.15023680484351348,2024-04-11 17:36:53.248762,2024-04-11 17:36:55.568800,0 days 00:00:02.320038,46.28492131698366,8.904218401993678,rbf,47,46.0,23.0,31.0,,,,48.0,44.0,5.226795454362793,3.4999934100724435,2.37246296260982,11.0,22.0,64.0,35.0,COMPLETE
6029,0.44701971028259324,2024-04-11 17:36:55.571792,2024-04-11 17:36:56.802305,0 days 00:00:01.230513,97.92211650106924,7.967111643043536,sigmoid,8,,25.0,30.0,,,,,,,,,,,,,COMPLETE
6030,0.3708629970480986,2024-04-11 17:36:56.804309,2024-04-11 17:36:58.640651,0 days 00:00:01.836342,96.64376159635928,8.200237231245683,sigmoid,43,3.0,29.0,34.0,,,,,,3.0293380146724753,8.88690929416724,4.3525491885805225,9.0,47.0,90.0,154.0,COMPLETE
6031,0.45347172512526845,2024-04-11 17:36:58.643644,2024-04-11 17:36:59.879268,0 days 00:00:01.235624,99.98042048013535,7.699967773455313,sigmoid,8,,27.0,28.0,,,,,,,,,,,,,COMPLETE
6032,0.36851630417218756,2024-04-11 17:36:59.883257,2024-04-11 17:37:01.686327,0 days 00:00:01.803070,92.44550644706473,8.381022757689891,sigmoid,22,,,,1.0,1.0,40.0,18.0,12.0,2.548884067087443,1.5734373919145117,6.227215661227061,16.0,49.0,86.0,,COMPLETE
6033,0.4970186725247136,2024-04-11 17:37:01.688333,2024-04-11 17:37:03.202605,0 days 00:00:01.514272,99.97832913324326,7.9994502000557315,sigmoid,24,,31.0,31.0,6.0,5.0,59.0,,,,,,,,,,COMPLETE
6034,0.41117673784643344,2024-04-11 17:37:03.204602,2024-04-11 17:37:04.908795,0 days 00:00:01.704193,95.1106051217171,8.191034239776789,sigmoid,57,38.0,48.0,33.0,3.0,8.0,83.0,,,,,,,,,143.0,COMPLETE
6035,0.5952371952371952,2024-04-11 17:37:04.911788,2024-04-11 17:37:06.136665,0 days 00:00:01.224877,98.14952600849148,7.451497594899784,sigmoid,8,,24.0,32.0,,,,,,,,,,,,,COMPLETE
6036,0.4410901676033222,2024-04-11 17:37:06.138660,2024-04-11 17:37:07.699547,0 days 00:00:01.560887,98.12640982037536,7.84465049064741,sigmoid,21,,,,8.0,6.0,81.0,45.0,8.0,,,,,,,129.0,COMPLETE
6037,0.4888617004085968,2024-04-11 17:37:07.702544,2024-04-11 17:37:09.833746,0 days 00:00:02.131202,30.32348680515308,8.38151948104784,sigmoid,31,,21.0,30.0,2.0,2.0,53.0,34.0,26.0,0.7925602117970802,3.2596192599110667,3.0647492786764166,20.0,42.0,76.0,39.0,COMPLETE
6038,0.5122563564157575,2024-04-11 17:37:09.836746,2024-04-11 17:37:11.400237,0 days 00:00:01.563491,95.4718104621339,8.686386494747246,sigmoid,35,7.0,,,,,,,,7.110154784708281,3.024575129328309,1.3782645739719022,18.0,23.0,54.0,172.0,COMPLETE
6039,0.3341826372733651,2024-04-11 17:37:11.404241,2024-04-11 17:37:13.108043,0 days 00:00:01.703802,99.97496312031181,8.09261124107677,sigmoid,38,9.0,,,,,,21.0,20.0,1.2088976049985583,5.596341037714631,5.4265280817387564,19.0,33.0,91.0,,COMPLETE
6040,0.5952371952371952,2024-04-11 17:37:13.110046,2024-04-11 17:37:14.374812,0 days 00:00:01.264766,96.73431442310543,7.650968813354223,sigmoid,8,,26.0,32.0,,,,,,,,,,,,,COMPLETE
6041,0.5273802382380667,2024-04-11 17:37:14.377810,2024-04-11 17:37:15.735636,0 days 00:00:01.357826,98.16218569684398,7.920468226178757,sigmoid,9,,24.0,29.0,,,,,,,,,,,,149.0,COMPLETE
6042,0.4064023607903515,2024-04-11 17:37:15.737634,2024-04-11 17:37:17.443367,0 days 00:00:01.705733,93.14874862899386,8.27248533606966,sigmoid,28,,25.0,48.0,7.0,7.0,79.0,32.0,36.0,,,,,,,,COMPLETE
6043,0.3889431529595624,2024-04-11 17:37:17.445362,2024-04-11 17:37:19.430704,0 days 00:00:01.985342,96.77500045630238,8.065990671604352,sigmoid,15,,28.0,31.0,,,,10.0,34.0,7.624759305066184,6.121867969559927,5.7209444667756335,8.0,36.0,51.0,165.0,COMPLETE
6044,0.45022721836881124,2024-04-11 17:37:19.433734,2024-04-11 17:37:20.656273,0 days 00:00:01.222539,98.16567461315032,8.490562934939872,sigmoid,8,,27.0,28.0,,,,,,,,,,,,,COMPLETE
6045,0.4966114016368454,2024-04-11 17:37:20.658272,2024-04-11 17:37:22.357168,0 days 00:00:01.698896,95.22377845739996,7.824930002922967,sigmoid,14,,23.0,33.0,,,,14.0,41.0,9.010893945315,4.172889104583923,7.751544610317186,10.0,20.0,84.0,,COMPLETE
6046,0.3434024031844054,2024-04-11 17:37:22.360178,2024-04-11 17:37:24.138946,0 days 00:00:01.778768,98.20111070705573,8.268968910868299,sigmoid,42,41.0,26.0,31.0,,,,,,4.09025374115977,8.35516550435739,9.523497554913192,6.0,25.0,97.0,,COMPLETE
6047,0.5000569638279693,2024-04-11 17:37:24.142935,2024-04-11 17:37:26.159580,0 days 00:00:02.016645,98.2038086566842,6.928790853964193,rbf,8,,25.0,30.0,,,,,,,,,,,,,COMPLETE
6048,0.3640694473851366,2024-04-11 17:37:26.161575,2024-04-11 17:37:27.762345,0 days 00:00:01.600770,94.40386724315277,7.529420766157752,sigmoid,3,,,,,,,,,5.486631484838345,6.978896702536575,2.5956103364576215,9.0,41.0,87.0,117.0,COMPLETE
6049,0.4519885392844939,2024-04-11 17:37:27.766346,2024-04-11 17:37:30.014197,0 days 00:00:02.247851,24.880470078990882,8.009618352078284,sigmoid,63,33.0,24.0,32.0,6.0,4.0,21.0,50.0,18.0,4.33197781893113,0.6646304933104377,1.0946640449823466,13.0,32.0,71.0,52.0,COMPLETE
6050,0.2507435928778063,2024-04-11 17:37:30.018721,2024-04-11 17:37:31.430616,0 days 00:00:01.411895,96.59538134433173,7.7564180230733095,sigmoid,2,,,,,,,,,8.230093850345696,9.339892083790662,7.107952673842589,11.0,50.0,83.0,,COMPLETE
6051,0.467090806888446,2024-04-11 17:37:31.432622,2024-04-11 17:37:33.618104,0 days 00:00:02.185482,90.6898359634063,7.188609240601129,sigmoid,62,32.0,27.0,31.0,2.0,2.0,57.0,2.0,50.0,6.359686549328496,2.1739374540239282,3.715877245539854,7.0,37.0,78.0,,COMPLETE
6052,0.5069140556625241,2024-04-11 17:37:33.621100,2024-04-11 17:37:34.867177,0 days 00:00:01.246077,98.20351710366367,8.16002110881388,sigmoid,8,,22.0,35.0,,,,,,,,,,,,,COMPLETE
6053,0.5106327493421209,2024-04-11 17:37:34.869174,2024-04-11 17:37:36.788771,0 days 00:00:01.919597,96.66692293669873,8.831950621658116,sigmoid,46,11.0,26.0,30.0,,,,38.0,22.0,3.709290601930647,1.939400404488072,8.578528332944954,2.0,38.0,99.0,,COMPLETE
6054,0.47056933368387227,2024-04-11 17:37:36.792286,2024-04-11 17:37:38.316652,0 days 00:00:01.524366,93.68754233951104,8.41568569614373,sigmoid,16,,,,5.0,1.0,98.0,,,,,,,,,,COMPLETE
6055,0.29096255636149776,2024-04-11 17:37:38.318675,2024-04-11 17:37:39.963372,0 days 00:00:01.644697,99.95390736872336,7.926498255029991,sigmoid,10,,25.0,32.0,,,,,,2.325147008027253,6.476430650190937,2.2367416984614943,17.0,46.0,65.0,,COMPLETE
6056,0.42751440071340774,2024-04-11 17:37:39.965379,2024-04-11 17:37:41.136675,0 days 00:00:01.171296,98.05255550138715,8.163132947499575,sigmoid,8,,23.0,19.0,,,,,,,,,,,,,COMPLETE
6057,0.5306279895077921,2024-04-11 17:37:41.138681,2024-04-11 17:37:42.520301,0 days 00:00:01.381620,95.65910132854023,7.673220512331067,sigmoid,20,,,,1.0,5.0,13.0,17.0,39.0,,,,,,,,COMPLETE
6058,0.12622036262203626,2024-04-11 17:37:42.523864,2024-04-11 17:37:43.598680,0 days 00:00:01.074816,96.8501397899553,8.350189106905848,sigmoid,8,,28.0,29.0,,,,,,,,,,,,,COMPLETE
6059,0.3491565171344277,2024-04-11 17:37:43.600692,2024-04-11 17:37:44.869266,0 days 00:00:01.268574,99.99189391597967,7.9712988125117095,sigmoid,41,35.0,24.0,33.0,,,,,,,,,,,,132.0,COMPLETE
6060,0.5963245096172158,2024-04-11 17:37:44.871264,2024-04-11 17:37:46.106066,0 days 00:00:01.234802,98.24317170922835,8.671809616537779,sigmoid,8,,26.0,31.0,,,,,,,,,,,,,COMPLETE
6061,0.44701971028259324,2024-04-11 17:37:46.107646,2024-04-11 17:37:47.265836,0 days 00:00:01.158190,95.27904277069202,7.480303312364452,sigmoid,8,,27.0,30.0,,,,,,,,,,,,,COMPLETE
6062,0.30907414364263514,2024-04-11 17:37:47.268791,2024-04-11 17:37:49.175766,0 days 00:00:01.906975,70.69903504732812,8.523980556402554,sigmoid,26,,25.0,39.0,4.0,6.0,33.0,,,2.820068786291558,4.60899801942705,4.718668543639373,5.0,30.0,93.0,,COMPLETE
6063,0.49538432991603654,2024-04-11 17:37:49.177725,2024-04-11 17:37:50.987173,0 days 00:00:01.809448,96.89730351556435,7.777562450806631,sigmoid,11,,25.0,27.0,,,,,,7.917733068149117,9.608655324992831,4.198143356897819,12.0,27.0,55.0,186.0,COMPLETE
6064,0.5204140310523289,2024-04-11 17:37:50.989171,2024-04-11 17:37:52.360505,0 days 00:00:01.371334,99.9872541453557,8.121967215692685,sigmoid,37,27.0,,,,,,19.0,30.0,,,,,,,191.0,COMPLETE
6065,0.49314167606163095,2024-04-11 17:37:52.363505,2024-04-11 17:37:53.869555,0 days 00:00:01.506050,92.73263383225766,7.944105443803973,sigmoid,48,15.0,,,5.0,7.0,73.0,,,,,,,,,,COMPLETE
6066,0.022632072522663332,2024-04-11 17:37:53.872569,2024-04-11 17:37:56.211894,0 days 00:00:02.339325,99.96506489353332,8.274971403352739,rbf,59,2.0,23.0,31.0,3.0,3.0,25.0,,,9.419470967000088,3.7143535662210976,3.9729619960670233,3.0,28.0,72.0,158.0,COMPLETE
6067,0.5952371952371952,2024-04-11 17:37:56.216399,2024-04-11 17:37:57.442203,0 days 00:00:01.225804,98.25192776368434,8.137168704305184,sigmoid,8,,26.0,32.0,,,,,,,,,,,,,COMPLETE
6068,0.5029017006878935,2024-04-11 17:37:57.444200,2024-04-11 17:37:59.095803,0 days 00:00:01.651603,95.23089421717287,7.8150219929375835,sigmoid,44,47.0,28.0,33.0,,,,24.0,11.0,,,,,,,,COMPLETE
6069,0.12622036262203626,2024-04-11 17:37:59.097804,2024-04-11 17:38:00.370867,0 days 00:00:01.273063,98.2852941968226,7.611306959863117,sigmoid,8,,29.0,29.0,,,,,,,,,,,,,COMPLETE
6070,0.45345352376492626,2024-04-11 17:38:00.373903,2024-04-11 17:38:01.615289,0 days 00:00:01.241386,96.53934654751293,8.370470048641376,sigmoid,8,,24.0,30.0,,,,,,,,,,,,,COMPLETE
6071,0.4507909573594614,2024-04-11 17:38:01.617289,2024-04-11 17:38:03.355816,0 days 00:00:01.738527,93.58228025161442,8.578626641963274,sigmoid,60,20.0,22.0,31.0,7.0,8.0,67.0,8.0,46.0,,,,,,,,COMPLETE
6072,0.450088809946714,2024-04-11 17:38:03.358353,2024-04-11 17:38:04.895404,0 days 00:00:01.537051,96.7256748558257,8.005954247144542,sigmoid,56,36.0,27.0,32.0,8.0,4.0,85.0,,,,,,,,,,COMPLETE
6073,0.524324784868365,2024-04-11 17:38:04.897402,2024-04-11 17:38:06.486528,0 days 00:00:01.589126,98.17713759560372,7.394828655494638,sigmoid,12,,25.0,34.0,,,,36.0,14.0,,,,,,,,COMPLETE
6074,0.46455395255849136,2024-04-11 17:38:06.488062,2024-04-11 17:38:08.522933,0 days 00:00:02.034871,50.67087708788627,8.191582180355828,sigmoid,55,17.0,,,4.0,3.0,92.0,40.0,16.0,4.529818926130337,9.047367879068146,6.092015706059357,18.0,43.0,69.0,27.0,COMPLETE
6075,0.3547501959945834,2024-04-11 17:38:08.524937,2024-04-11 17:38:10.035378,0 days 00:00:01.510441,98.12678952356697,7.815886781417306,sigmoid,13,,24.0,30.0,,,,11.0,5.0,,,,,,,95.0,COMPLETE
6076,0.3417892899134215,2024-04-11 17:38:10.037376,2024-04-11 17:38:11.423904,0 days 00:00:01.386528,95.34000079717171,8.009316433134403,sigmoid,36,45.0,,,,,,33.0,24.0,,,,,,,,COMPLETE
6077,0.45737465088442614,2024-04-11 17:38:11.426872,2024-04-11 17:38:13.275603,0 days 00:00:01.848731,98.10592046487746,8.378244389260935,sigmoid,54,13.0,,,1.0,2.0,77.0,15.0,29.0,1.0657432744152073,6.790947279832246,1.5379872335082965,10.0,29.0,88.0,,COMPLETE
6078,0.12622036262203626,2024-04-11 17:38:13.278597,2024-04-11 17:38:14.559481,0 days 00:00:01.280884,95.34819136623565,7.597234511701803,sigmoid,8,,26.0,29.0,,,,,,,,,,,,,COMPLETE
6079,0.5164565361645653,2024-04-11 17:38:14.561482,2024-04-11 17:38:15.946664,0 days 00:00:01.385182,99.95059632325119,8.116978947692646,sigmoid,40,6.0,24.0,32.0,,,,,,,,,,,,,COMPLETE
6080,0.5929369437606513,2024-04-11 17:38:15.948661,2024-04-11 17:38:17.185677,0 days 00:00:01.237016,96.8816601321735,8.278611863338128,sigmoid,8,,27.0,33.0,,,,,,,,,,,,,COMPLETE
6081,0.5046125252158934,2024-04-11 17:38:17.187687,2024-04-11 17:38:18.259475,0 days 00:00:01.071788,93.4642423795847,7.870500604954635,sigmoid,1,,,,,,,,,,,,,,,109.0,COMPLETE
6082,0.5986314388899449,2024-04-11 17:38:18.262012,2024-04-11 17:38:19.486493,0 days 00:00:01.224481,97.98543720609206,8.539672275076816,sigmoid,8,,25.0,31.0,,,,,,,,,,,,,COMPLETE
6083,0.4733680312799399,2024-04-11 17:38:19.488490,2024-04-11 17:38:21.407770,0 days 00:00:01.919280,7.7255089865638595,7.7047975967706135,sigmoid,61,22.0,26.0,28.0,8.0,1.0,55.0,4.0,7.0,,,,,,,84.0,COMPLETE
6084,0.4523092671764918,2024-04-11 17:38:21.410303,2024-04-11 17:38:23.397209,0 days 00:00:01.986906,98.34947017864063,8.072643553251764,sigmoid,27,,33.0,30.0,6.0,5.0,47.0,,,4.988148142598049,7.796502143940548,3.2380131069247127,4.0,21.0,74.0,181.0,COMPLETE
6085,0.451005703992795,2024-04-11 17:38:23.400208,2024-04-11 17:38:25.231988,0 days 00:00:01.831780,95.38676311228679,8.267203089330577,rbf,8,,23.0,32.0,,,,,,,,,,,,,COMPLETE
6086,0.33581858787149976,2024-04-11 17:38:25.233999,2024-04-11 17:38:26.831829,0 days 00:00:01.597830,98.1422042992072,7.921210056258205,sigmoid,52,29.0,,,3.0,6.0,31.0,30.0,27.0,,,,,,,,COMPLETE
6087,0.4806666514045009,2024-04-11 17:38:26.835425,2024-04-11 17:38:28.086273,0 days 00:00:01.250848,90.65024125953673,6.5112352509283244,sigmoid,5,,,,,,,42.0,31.0,,,,,,,100.0,COMPLETE
6088,0.6009158557527189,2024-04-11 17:38:28.088265,2024-04-11 17:38:29.451744,0 days 00:00:01.363479,99.95447559625194,8.837499443634897,sigmoid,8,,25.0,31.0,,,,,,,,,,,,,COMPLETE
6089,0.1298421807747489,2024-04-11 17:38:29.454749,2024-04-11 17:38:30.667165,0 days 00:00:01.212416,98.23092472798402,7.309065465201553,sigmoid,32,39.0,,,,,,,,,,,,,,,COMPLETE
6090,0.501824644549763,2024-04-11 17:38:30.670164,2024-04-11 17:38:32.626409,0 days 00:00:01.956245,96.51738563581068,9.353476205894435,sigmoid,23,,,,1.0,7.0,6.0,26.0,3.0,1.4798719161423732,0.8434517207200924,0.9054534601502366,15.0,33.0,100.0,68.0,COMPLETE
6091,0.3305258450415533,2024-04-11 17:38:32.628422,2024-04-11 17:38:34.346844,0 days 00:00:01.718422,93.81358378693542,8.415319372399914,sigmoid,7,,,,,,,12.0,33.0,3.345415887319834,5.926951890512488,6.498082446507899,14.0,45.0,59.0,200.0,COMPLETE
6092,0.1666374397194213,2024-04-11 17:38:34.349839,2024-04-11 17:38:35.564031,0 days 00:00:01.214192,98.18892813490204,7.776719971064375,sigmoid,4,,,,,,,23.0,19.0,,,,,,,,COMPLETE
6093,0.2827572739699277,2024-04-11 17:38:35.566028,2024-04-11 17:38:37.265779,0 days 00:00:01.699751,99.94613484315504,8.067905869788449,sigmoid,34,42.0,,,,,,,,6.653499461005093,9.999559917586282,8.107198122808587,3.0,24.0,63.0,,COMPLETE
6094,0.4502698896972542,2024-04-11 17:38:37.269303,2024-04-11 17:38:38.455425,0 days 00:00:01.186122,96.64008437127727,8.220308372809818,sigmoid,8,,28.0,30.0,,,,,,,,,,,,,COMPLETE
6095,0.480106100795756,2024-04-11 17:38:38.457952,2024-04-11 17:38:39.977854,0 days 00:00:01.519902,94.99105829769069,7.600394455433823,sigmoid,45,24.0,23.0,33.0,,,,44.0,9.0,,,,,,,77.0,COMPLETE
6096,0.5986314388899449,2024-04-11 17:38:39.980853,2024-04-11 17:38:41.303933,0 days 00:00:01.323080,98.2140734923584,8.556117161987196,sigmoid,8,,26.0,31.0,,,,,,,,,,,,,COMPLETE
6097,0.12622036262203626,2024-04-11 17:38:41.305934,2024-04-11 17:38:42.573446,0 days 00:00:01.267512,98.19475904293128,7.892902924850754,sigmoid,8,,24.0,29.0,,,,,,,,,,,,,COMPLETE
6098,0.4001040244457448,2024-04-11 17:38:42.575453,2024-04-11 17:38:44.843391,0 days 00:00:02.267938,99.95226648674453,4.65470272335612,sigmoid,30,,22.0,32.0,2.0,4.0,16.0,48.0,40.0,1.8805234040705887,1.686012140058505,7.404928848654246,16.0,35.0,50.0,,COMPLETE
6099,0.5346622598636646,2024-04-11 17:38:44.846389,2024-04-11 17:38:46.199259,0 days 00:00:01.352870,96.60258761909964,8.06366452513869,sigmoid,33,31.0,,,,,,,,,,,,,,17.0,COMPLETE
6100,0.44979910351394664,2024-04-11 17:38:46.202268,2024-04-11 17:38:47.492116,0 days 00:00:01.289848,92.30465100245623,8.293015824483552,sigmoid,17,,,,5.0,8.0,27.0,,,,,,,,,138.0,COMPLETE
6101,0.4555488556222636,2024-04-11 17:38:47.494114,2024-04-11 17:38:49.206361,0 days 00:00:01.712247,95.44097232045861,7.919175578746568,sigmoid,53,18.0,,,6.0,1.0,44.0,37.0,49.0,,,,,,,62.0,COMPLETE
6102,0.4394816341511618,2024-04-11 17:38:49.209354,2024-04-11 17:38:51.006368,0 days 00:00:01.797014,98.2669885931349,8.724832214982648,sigmoid,19,,,,7.0,4.0,62.0,,,3.917968691514372,8.184879766612836,8.314943406834711,19.0,40.0,85.0,49.0,COMPLETE
6103,0.1774178491411501,2024-04-11 17:38:51.008364,2024-04-11 17:38:53.037986,0 days 00:00:02.029622,96.76587914160515,7.674325173304606,rbf,50,37.0,,,4.0,5.0,38.0,,,9.998979655462849,6.312827986311705,9.159752015029925,20.0,47.0,57.0,,COMPLETE
