number,value,datetime_start,datetime_complete,duration,params_C,params_gamma,params_kernel,params_mask_number,params_rsi_window,params_so_smooth,params_so_window,params_srsi_smooth1,params_srsi_smooth2,params_srsi_window,params_tsi_window_fast,params_tsi_window_slow,params_ult_weight_1,params_ult_weight_2,params_ult_weight_3,params_ult_window_1,params_ult_window_2,params_ult_window_3,params_williams_lbp,state
7645,0.5223976719778648,2024-04-11 18:27:29.615974,2024-04-11 18:27:32.025342,0 days 00:00:02.409368,95.43133797545369,6.295045510673426,sigmoid,14,,27.0,30.0,,,,13.0,12.0,6.620329346839737,2.5927232172648216,2.604636593618348,6.0,41.0,76.0,,COMPLETE
7646,0.5963643249384587,2024-04-11 18:27:32.028361,2024-04-11 18:27:33.581401,0 days 00:00:01.553040,96.68833009542212,8.24888438987471,sigmoid,8,,24.0,32.0,,,,,,,,,,,,,COMPLETE
7647,0.523975360773132,2024-04-11 18:27:33.583398,2024-04-11 18:27:35.305377,0 days 00:00:01.721979,34.06091807462302,7.705806056604453,sigmoid,48,35.0,,,1.0,3.0,44.0,,,,,,,,,,COMPLETE
7648,0.6009432182607054,2024-04-11 18:27:35.307401,2024-04-11 18:27:36.751769,0 days 00:00:01.444368,99.96796216116651,7.9320158284638,sigmoid,8,,26.0,31.0,,,,,,,,,,,,,COMPLETE
7649,0.12622036262203626,2024-04-11 18:27:36.754768,2024-04-11 18:27:38.340425,0 days 00:00:01.585657,99.99554252959543,8.454781862124392,sigmoid,8,,25.0,29.0,,,,,,,,,,,,,COMPLETE
7650,0.3953643589588011,2024-04-11 18:27:38.343426,2024-04-11 18:27:40.879166,0 days 00:00:02.535740,42.04679686368603,8.155617778350363,sigmoid,26,,28.0,32.0,4.0,2.0,48.0,,,9.176214225046651,3.7804050094088995,8.508115360105677,14.0,28.0,92.0,,COMPLETE
7651,0.47778266608007036,2024-04-11 18:27:40.881683,2024-04-11 18:27:42.759214,0 days 00:00:01.877531,99.96830829982612,7.849113450885708,sigmoid,52,24.0,,,8.0,5.0,89.0,16.0,4.0,,,,,,,,COMPLETE
7652,0.5379384878641871,2024-04-11 18:27:42.761215,2024-04-11 18:27:44.696021,0 days 00:00:01.934806,99.99179154802381,8.04477058381461,sigmoid,13,,24.0,34.0,,,,49.0,16.0,,,,,,,189.0,COMPLETE
7653,0.4784907474164864,2024-04-11 18:27:44.699031,2024-04-11 18:27:46.716933,0 days 00:00:02.017902,93.63936386155677,8.322032155124068,sigmoid,44,6.0,30.0,31.0,,,,3.0,15.0,,,,,,,,COMPLETE
7654,0.44701971028259324,2024-04-11 18:27:46.719950,2024-04-11 18:27:48.281179,0 days 00:00:01.561229,96.73368980776806,7.6482549214568945,sigmoid,8,,27.0,30.0,,,,,,,,,,,,,COMPLETE
7655,0.47523885931004295,2024-04-11 18:27:48.284172,2024-04-11 18:27:50.156982,0 days 00:00:01.872810,91.52819645789036,8.547289571204685,sigmoid,20,,,,1.0,7.0,2.0,42.0,34.0,,,,,,,,COMPLETE
7656,0.09408571098532978,2024-04-11 18:27:50.159968,2024-04-11 18:27:52.902836,0 days 00:00:02.742868,98.11078970603049,8.131605449535584,rbf,54,3.0,,,3.0,6.0,92.0,17.0,11.0,5.388004985734961,2.941028753327508,0.6785325351939031,20.0,25.0,61.0,,COMPLETE
7657,0.37808104720790975,2024-04-11 18:27:52.906379,2024-04-11 18:27:54.695532,0 days 00:00:01.789153,99.99622925805159,7.86514843188213,sigmoid,37,23.0,,,,,,9.0,29.0,,,,,,,75.0,COMPLETE
7658,0.48222200089636974,2024-04-11 18:27:54.698730,2024-04-11 18:27:57.081555,0 days 00:00:02.382825,95.28347220521253,7.469193121397221,sigmoid,55,31.0,,,5.0,8.0,38.0,34.0,33.0,1.3442500399249884,8.922290444196996,4.508097390169166,17.0,36.0,96.0,46.0,COMPLETE
7659,0.5929369437606513,2024-04-11 18:27:57.084549,2024-04-11 18:27:58.727331,0 days 00:00:01.642782,96.8956942588968,8.282800843056409,sigmoid,8,,26.0,33.0,,,,,,,,,,,,,COMPLETE
7660,0.3936418588287971,2024-04-11 18:27:58.730330,2024-04-11 18:28:00.581736,0 days 00:00:01.851406,95.23773160176722,8.705298574120055,sigmoid,12,,22.0,31.0,,,,23.0,31.0,,,,,,,,COMPLETE
7661,0.47540066635861766,2024-04-11 18:28:00.583712,2024-04-11 18:28:03.409866,0 days 00:00:02.826154,99.99039132938671,8.011371822766849,sigmoid,59,33.0,25.0,29.0,7.0,1.0,41.0,,,5.019004011367145,3.4526269038843767,4.9628213139244854,9.0,21.0,54.0,110.0,COMPLETE
7662,0.5007851641366934,2024-04-11 18:28:03.413866,2024-04-11 18:28:05.563064,0 days 00:00:02.149198,99.99440358037481,7.691184912271165,sigmoid,60,15.0,24.0,30.0,2.0,7.0,65.0,46.0,24.0,,,,,,,,COMPLETE
7663,0.25845954132410215,2024-04-11 18:28:05.566571,2024-04-11 18:28:07.194287,0 days 00:00:01.627716,96.40958464950037,8.400782995652184,sigmoid,36,39.0,,,,,,36.0,3.0,,,,,,,,COMPLETE
7664,0.5963643249384587,2024-04-11 18:28:07.196812,2024-04-11 18:28:08.705726,0 days 00:00:01.508914,98.25020915554958,8.169388726521484,sigmoid,8,,26.0,32.0,,,,,,,,,,,,,COMPLETE
7665,0.43101274688331703,2024-04-11 18:28:08.709244,2024-04-11 18:28:10.169393,0 days 00:00:01.460149,93.11867840670023,7.920500580478941,sigmoid,1,,,,,,,,,,,,,,,168.0,COMPLETE
7666,0.28031476288141977,2024-04-11 18:28:10.172395,2024-04-11 18:28:11.790730,0 days 00:00:01.618335,98.06814229600084,7.747899983120949,sigmoid,40,36.0,23.0,35.0,,,,,,,,,,,,,COMPLETE
7667,0.42674635376686043,2024-04-11 18:28:11.793730,2024-04-11 18:28:14.159570,0 days 00:00:02.365840,99.98484310013433,8.127383910974814,sigmoid,23,,,,3.0,5.0,60.0,6.0,43.0,9.707390250463185,1.735204609551146,7.852230157897217,16.0,31.0,97.0,142.0,COMPLETE
7668,0.5929369437606513,2024-04-11 18:28:14.161567,2024-04-11 18:28:15.673128,0 days 00:00:01.511561,96.69760522119246,8.400637466926156,sigmoid,8,,27.0,33.0,,,,,,,,,,,,,COMPLETE
7669,0.4724639164704678,2024-04-11 18:28:15.677677,2024-04-11 18:28:18.064112,0 days 00:00:02.386435,94.22480058335329,8.00052074146599,sigmoid,61,13.0,25.0,31.0,8.0,2.0,72.0,30.0,27.0,,,,,,,129.0,COMPLETE
7670,0.5779054916985951,2024-04-11 18:28:18.068704,2024-04-11 18:28:19.482773,0 days 00:00:01.414069,98.21374849204855,7.48312324883331,sigmoid,32,28.0,,,,,,,,,,,,,,,COMPLETE
7671,0.4887158832662062,2024-04-11 18:28:19.484772,2024-04-11 18:28:21.696975,0 days 00:00:02.212203,99.96611695432092,8.232345695543025,sigmoid,7,,,,,,,22.0,23.0,2.579845027940037,0.7071321498811214,8.166850901020684,13.0,24.0,79.0,53.0,COMPLETE
7672,0.4326172146410605,2024-04-11 18:28:21.700987,2024-04-11 18:28:24.383844,0 days 00:00:02.682857,99.99847150953704,8.589352944105562,sigmoid,30,,28.0,30.0,4.0,8.0,50.0,8.0,28.0,5.867388556361579,4.9449371711049634,1.8949070073167382,11.0,43.0,93.0,,COMPLETE
7673,0.4496894409937888,2024-04-11 18:28:24.387380,2024-04-11 18:28:26.667450,0 days 00:00:02.280070,95.45020919771343,7.80687106641715,rbf,8,,25.0,32.0,,,,,,,,,,,,,COMPLETE
7674,0.4624237978397794,2024-04-11 18:28:26.670450,2024-04-11 18:28:29.220431,0 days 00:00:02.549981,96.75010005483364,7.296737064101974,sigmoid,27,,24.0,28.0,6.0,3.0,19.0,,,3.849629010243784,6.539490234307236,5.291827564757685,4.0,35.0,63.0,197.0,COMPLETE
7675,0.44701971028259324,2024-04-11 18:28:29.223427,2024-04-11 18:28:30.871886,0 days 00:00:01.648459,99.98803354077667,7.988043049316766,sigmoid,8,,29.0,30.0,,,,,,,,,,,,,COMPLETE
7676,0.5160587002096436,2024-04-11 18:28:30.874880,2024-04-11 18:28:32.958302,0 days 00:00:02.083422,96.610624917693,8.292028050854904,sigmoid,34,25.0,,,,,,,,5.687916605368893,6.043898330013991,7.326202738117894,10.0,48.0,100.0,,COMPLETE
7677,0.33324566017885326,2024-04-11 18:28:32.962303,2024-04-11 18:28:34.525330,0 days 00:00:01.563027,98.03175117450374,7.628782837970984,sigmoid,33,47.0,,,,,,,,,,,,,,182.0,COMPLETE
7678,0.6009158557527189,2024-04-11 18:28:34.528864,2024-04-11 18:28:36.113033,0 days 00:00:01.584169,92.9798704475805,8.820866394964849,sigmoid,8,,23.0,31.0,,,,,,,,,,,,,COMPLETE
7679,0.49784208054741835,2024-04-11 18:28:36.115034,2024-04-11 18:28:38.225725,0 days 00:00:02.110691,96.63712082560059,8.090722096580134,sigmoid,45,11.0,26.0,29.0,,,,5.0,48.0,,,,,,,121.0,COMPLETE
7680,0.30681594197185313,2024-04-11 18:28:38.228779,2024-04-11 18:28:39.898542,0 days 00:00:01.669763,94.94421224714094,7.843668043297657,sigmoid,5,,,,,,,10.0,41.0,,,,,,,28.0,COMPLETE
7681,0.3907452599962455,2024-04-11 18:28:39.901548,2024-04-11 18:28:42.223728,0 days 00:00:02.322180,98.07861309935146,8.386599249215596,sigmoid,51,9.0,,,1.0,1.0,35.0,,,8.230492429857142,2.1569835336474634,6.543373762548805,15.0,34.0,56.0,96.0,COMPLETE
7682,0.5929369437606513,2024-04-11 18:28:42.226721,2024-04-11 18:28:43.822404,0 days 00:00:01.595683,98.03100240860813,8.11836734830102,sigmoid,8,,21.0,33.0,,,,,,,,,,,,,COMPLETE
7683,0.5952371952371952,2024-04-11 18:28:43.826923,2024-04-11 18:28:45.384175,0 days 00:00:01.557252,91.2483381851341,7.905242203602429,sigmoid,8,,27.0,32.0,,,,,,,,,,,,,COMPLETE
7684,0.17782998718496368,2024-04-11 18:28:45.386680,2024-04-11 18:28:46.935012,0 days 00:00:01.548332,98.26466743739384,8.599658881839558,sigmoid,4,,,,,,,25.0,7.0,,,,,,,,COMPLETE
7685,0.4252196729314132,2024-04-11 18:28:46.937515,2024-04-11 18:28:49.195223,0 days 00:00:02.257708,95.22363285717203,7.6531445707361705,sigmoid,53,19.0,,,4.0,4.0,78.0,20.0,5.0,,,,,,,81.0,COMPLETE
7686,0.4994916485112563,2024-04-11 18:28:49.197750,2024-04-11 18:28:51.004678,0 days 00:00:01.806928,62.78807483076463,8.271878767237332,sigmoid,17,,,,2.0,7.0,16.0,,,,,,,,,40.0,COMPLETE
7687,0.35619742897952705,2024-04-11 18:28:51.007283,2024-04-11 18:28:53.595080,0 days 00:00:02.587797,98.07263650634879,8.018574695086128,sigmoid,58,18.0,24.0,31.0,7.0,6.0,4.0,,,6.416134134864105,8.523101468410339,2.3102481173223013,7.0,40.0,65.0,,COMPLETE
7688,0.4365653642064641,2024-04-11 18:28:53.598639,2024-04-11 18:28:55.956392,0 days 00:00:02.357753,98.16176586526126,7.826244100471971,sigmoid,19,,,,6.0,3.0,86.0,,,2.938109015754719,1.1877437785109075,3.186076076454587,6.0,47.0,60.0,60.0,COMPLETE
7689,0.4502698896972542,2024-04-11 18:28:55.960944,2024-04-11 18:28:57.570402,0 days 00:00:01.609458,67.78950957303628,8.202493245032349,sigmoid,8,,26.0,30.0,,,,,,,,,,,,,COMPLETE
7690,0.4941672871680317,2024-04-11 18:28:57.572398,2024-04-11 18:28:59.815254,0 days 00:00:02.242856,96.67567589197793,8.503001207705143,sigmoid,50,41.0,,,5.0,5.0,63.0,,,2.2139263062801975,5.1526065200656195,6.2055650579637085,3.0,33.0,90.0,,COMPLETE
7691,0.41751245617272553,2024-04-11 18:28:59.817761,2024-04-11 18:29:01.782442,0 days 00:00:01.964681,93.89079595725183,7.503231735825499,sigmoid,49,21.0,,,1.0,8.0,9.0,,,,,,,,,165.0,COMPLETE
7692,0.2158282913041558,2024-04-11 18:29:01.786435,2024-04-11 18:29:04.139947,0 days 00:00:02.353512,96.62202347786007,8.031447328797661,sigmoid,6,,,,,,,43.0,14.0,3.201940764401395,5.608780210003283,4.735876090841596,8.0,32.0,86.0,,COMPLETE
7693,0.451005703992795,2024-04-11 18:29:04.143499,2024-04-11 18:29:06.677583,0 days 00:00:02.534084,98.29749816680835,8.375481214772574,rbf,8,,25.0,32.0,,,,,,,,,,,,,COMPLETE
7694,0.40203271185299855,2024-04-11 18:29:06.680535,2024-04-11 18:29:08.947517,0 days 00:00:02.266982,76.28980078527182,7.735586843415945,sigmoid,18,,,,8.0,2.0,83.0,,,3.6634073779820553,6.303619274778281,4.269482731837336,2.0,50.0,67.0,,COMPLETE
7695,0.6009432182607054,2024-04-11 18:29:08.950460,2024-04-11 18:29:10.513720,0 days 00:00:01.563260,98.18274475921001,8.168959194202053,sigmoid,8,,23.0,31.0,,,,,,,,,,,,,COMPLETE
7696,0.12003789673140693,2024-04-11 18:29:10.516723,2024-04-11 18:29:12.131402,0 days 00:00:01.614679,94.82079119458432,7.8615768999734925,sigmoid,8,,26.0,28.0,,,,,,,,,,,,,COMPLETE
7697,0.42363955529549446,2024-04-11 18:29:12.134395,2024-04-11 18:29:14.368251,0 days 00:00:02.233856,98.19233886363615,9.979265825276975,sigmoid,39,34.0,,,,,,28.0,10.0,8.540957168464514,6.7884606904923315,1.326867281439434,12.0,27.0,89.0,88.0,COMPLETE
7698,0.4869591211419177,2024-04-11 18:29:14.371301,2024-04-11 18:29:16.950936,0 days 00:00:02.579635,95.75269633066263,8.483114977827263,sigmoid,47,37.0,28.0,29.0,,,,35.0,9.0,6.9110232015507975,5.827608089005821,7.5694310593600225,5.0,41.0,71.0,19.0,COMPLETE
7699,0.12791519434628976,2024-04-11 18:29:16.953469,2024-04-11 18:29:18.523432,0 days 00:00:01.569963,98.18990153327424,1.98994126853575,sigmoid,8,,24.0,34.0,,,,,,,,,,,,,COMPLETE
7700,0.3911281851196014,2024-04-11 18:29:18.526414,2024-04-11 18:29:20.655053,0 days 00:00:02.128639,93.03899038976162,7.996213996758022,sigmoid,21,,,,3.0,1.0,27.0,12.0,44.0,,,,,,,105.0,COMPLETE
7701,0.5929369437606513,2024-04-11 18:29:20.658068,2024-04-11 18:29:22.358245,0 days 00:00:01.700177,99.98772991306367,8.249763840205457,sigmoid,8,,25.0,33.0,,,,,,,,,,,,,COMPLETE
7702,0.4275508440398687,2024-04-11 18:29:22.361169,2024-04-11 18:29:24.721900,0 days 00:00:02.360731,89.77768027763749,9.316108466371332,sigmoid,29,,27.0,31.0,4.0,6.0,67.0,15.0,26.0,,,,,,,174.0,COMPLETE
7703,0.44701971028259324,2024-04-11 18:29:24.724900,2024-04-11 18:29:26.501606,0 days 00:00:01.776706,96.73293583013232,7.604655339813853,sigmoid,8,,22.0,30.0,,,,,,,,,,,,,COMPLETE
7704,0.5296322276781241,2024-04-11 18:29:26.504606,2024-04-11 18:29:28.419518,0 days 00:00:01.914912,95.41381148414287,8.737055707342757,sigmoid,3,,,,,,,,,5.560796718055971,9.510174372094259,7.020641798055012,19.0,38.0,73.0,154.0,COMPLETE
7705,0.5811777745179535,2024-04-11 18:29:28.424499,2024-04-11 18:29:29.707081,0 days 00:00:01.282582,99.9472801005856,0.013505729920066933,sigmoid,0,,,,,,,,,,,,,,,,COMPLETE
7706,0.42559800278680915,2024-04-11 18:29:29.709670,2024-04-11 18:29:31.944356,0 days 00:00:02.234686,98.26218641963065,7.3628652538747,sigmoid,57,26.0,26.0,32.0,2.0,4.0,25.0,,,,,,,,,13.0,COMPLETE
7707,0.45861131128106186,2024-04-11 18:29:31.947353,2024-04-11 18:29:33.785461,0 days 00:00:01.838108,98.22014535199584,8.040825647768521,sigmoid,24,,25.0,20.0,5.0,8.0,53.0,,,,,,,,,,COMPLETE
7708,0.4359893794651411,2024-04-11 18:29:33.788987,2024-04-11 18:29:35.682087,0 days 00:00:01.893100,96.71428543986583,7.851087937933062,sigmoid,25,,24.0,30.0,7.0,7.0,30.0,,,,,,,,,200.0,COMPLETE
7709,0.4832926457125418,2024-04-11 18:29:35.685088,2024-04-11 18:29:37.796814,0 days 00:00:02.111726,93.39310612755021,8.318724208262577,sigmoid,35,17.0,,,,,,,,8.937387352041753,7.557864525858232,3.590517806798758,18.0,42.0,76.0,35.0,COMPLETE
7710,0.4640136087019024,2024-04-11 18:29:37.799348,2024-04-11 18:29:40.124734,0 days 00:00:02.325386,99.99177934495609,8.1796853519005,sigmoid,43,22.0,29.0,32.0,,,,,,0.958931579823826,4.726527387529494,5.503501313154161,16.0,45.0,84.0,113.0,COMPLETE
7711,0.2789144765002996,2024-04-11 18:29:40.129248,2024-04-11 18:29:42.622260,0 days 00:00:02.493012,96.49208187198553,7.676575609129635,rbf,38,5.0,,,,,,40.0,20.0,1.8718185098931457,9.205630585391408,2.0632914695042808,14.0,30.0,95.0,,COMPLETE
7712,0.501248670969018,2024-04-11 18:29:42.626260,2024-04-11 18:29:44.973073,0 days 00:00:02.346813,95.35818366415887,8.538496500331387,sigmoid,15,,27.0,33.0,,,,49.0,17.0,7.7511884333970755,3.8846546675298046,8.838968691823307,17.0,20.0,83.0,68.0,COMPLETE
7713,0.3846562533205823,2024-04-11 18:29:44.976592,2024-04-11 18:29:47.315089,0 days 00:00:02.338497,1.704074352643758,7.964134650294503,sigmoid,22,,,,3.0,3.0,98.0,50.0,34.0,9.298528644341609,7.926421405882854,1.7178575041048338,13.0,29.0,72.0,,COMPLETE
7714,0.41193874565139643,2024-04-11 18:29:47.318597,2024-04-11 18:29:49.444529,0 days 00:00:02.125932,98.08672070280187,8.122438647711963,sigmoid,28,,23.0,31.0,5.0,5.0,70.0,31.0,39.0,,,,,,,,COMPLETE
7715,0.4360834850819442,2024-04-11 18:29:49.448518,2024-04-11 18:29:52.186186,0 days 00:00:02.737668,98.14321692688196,6.584742556585709,sigmoid,31,,25.0,23.0,6.0,6.0,76.0,37.0,21.0,6.111076452533612,9.993295151699257,8.371258498624666,11.0,22.0,69.0,72.0,COMPLETE
7716,0.5931679318644695,2024-04-11 18:29:52.188761,2024-04-11 18:29:53.765682,0 days 00:00:01.576921,95.41906951022197,8.302721660410716,sigmoid,8,,20.0,27.0,,,,,,,,,,,,,COMPLETE
7717,0.5239010692299385,2024-04-11 18:29:53.770195,2024-04-11 18:29:55.491876,0 days 00:00:01.721681,99.98923167877705,7.839389547757699,sigmoid,9,,26.0,29.0,,,,,,,,,,,,160.0,COMPLETE
7718,0.4502698896972542,2024-04-11 18:29:55.494874,2024-04-11 18:29:57.085522,0 days 00:00:01.590648,98.13915929335437,5.399293849716319,sigmoid,8,,27.0,30.0,,,,,,,,,,,,,COMPLETE
7719,0.40498735326545177,2024-04-11 18:29:57.087513,2024-04-11 18:29:58.747125,0 days 00:00:01.659612,92.24487843669984,7.520434043682975,sigmoid,16,,,,8.0,1.0,58.0,,,,,,,,,,COMPLETE
7720,0.3381660563485539,2024-04-11 18:29:58.749651,2024-04-11 18:30:00.947830,0 days 00:00:02.198179,96.85389000172533,9.009606348800526,sigmoid,42,45.0,24.0,31.0,,,,,,4.729967673435976,4.2651745559323695,3.995565672650943,20.0,35.0,87.0,,COMPLETE
7721,0.5929369437606513,2024-04-11 18:30:00.950344,2024-04-11 18:30:02.502612,0 days 00:00:01.552268,94.11659463970493,7.241003231671336,sigmoid,8,,25.0,33.0,,,,,,,,,,,,,COMPLETE
7722,0.5963643249384587,2024-04-11 18:30:02.504608,2024-04-11 18:30:04.081548,0 days 00:00:01.576940,96.75401297762551,8.457735491502905,sigmoid,8,,28.0,32.0,,,,,,,,,,,,,COMPLETE
7723,0.3448509703878322,2024-04-11 18:30:04.084543,2024-04-11 18:30:06.430467,0 days 00:00:02.345924,98.22153841993737,8.075839563762365,sigmoid,14,,23.0,30.0,,,,21.0,8.0,1.5780649011068477,2.7954433490720447,9.836294448709246,9.0,21.0,50.0,,COMPLETE
7724,0.5260511689083118,2024-04-11 18:30:06.434473,2024-04-11 18:30:08.247959,0 days 00:00:01.813486,98.193066865146,7.731663699595386,sigmoid,41,49.0,26.0,34.0,,,,,,,,,,,,119.0,COMPLETE
7725,0.48758899365018277,2024-04-11 18:30:08.250525,2024-04-11 18:30:11.102329,0 days 00:00:02.851804,94.92833273672909,7.950507538950243,sigmoid,63,46.0,24.0,29.0,1.0,4.0,12.0,13.0,32.0,9.528390613336576,2.364304651290488,5.810761070440283,15.0,49.0,82.0,147.0,COMPLETE
7726,0.46983076727319,2024-04-11 18:30:11.106310,2024-04-11 18:30:13.780511,0 days 00:00:02.674201,98.08978820176065,8.322114621307737,sigmoid,62,27.0,22.0,31.0,4.0,2.0,80.0,26.0,18.0,3.452957730895477,3.0952345439463986,2.7816718782653806,19.0,23.0,74.0,,COMPLETE
7727,0.5931111524855706,2024-04-11 18:30:13.783511,2024-04-11 18:30:15.371375,0 days 00:00:01.587864,96.60620919182199,8.69576444524131,sigmoid,8,,25.0,26.0,,,,,,,,,,,,,COMPLETE
7728,0.322500178176894,2024-04-11 18:30:15.374350,2024-04-11 18:30:17.155236,0 days 00:00:01.780886,99.99178227729199,8.163340538490273,sigmoid,2,,,,,,,,,7.287411729265879,8.335842698972248,9.261067038486095,10.0,31.0,94.0,,COMPLETE
7729,0.4496894409937888,2024-04-11 18:30:17.158240,2024-04-11 18:30:19.548629,0 days 00:00:02.390389,99.95347569395877,7.809769268967782,rbf,8,,26.0,32.0,,,,,,,,,,,,,COMPLETE
7730,0.3792662570586356,2024-04-11 18:30:19.551148,2024-04-11 18:30:21.689440,0 days 00:00:02.138292,93.77116635973084,8.021007791084475,sigmoid,11,,27.0,29.0,,,,,,4.37177404958021,4.5236241543001725,6.671235178398822,12.0,40.0,58.0,137.0,COMPLETE
7731,0.5986580986580987,2024-04-11 18:30:21.692985,2024-04-11 18:30:23.219451,0 days 00:00:01.526466,95.5315329215085,8.427209692592262,sigmoid,8,,25.0,31.0,,,,,,,,,,,,,COMPLETE
7732,0.44701971028259324,2024-04-11 18:30:23.221463,2024-04-11 18:30:24.749585,0 days 00:00:01.528122,98.22031557033907,7.618367365283663,sigmoid,8,,24.0,30.0,,,,,,,,,,,,,COMPLETE
7733,0.3968111609367215,2024-04-11 18:30:24.753569,2024-04-11 18:30:27.220031,0 days 00:00:02.466462,98.19083304967907,6.872667749880972,sigmoid,46,30.0,28.0,33.0,,,,19.0,45.0,2.674610321207689,6.930850290390377,7.176650196740109,2.0,37.0,52.0,,COMPLETE
7734,0.4406996860383161,2024-04-11 18:30:27.222990,2024-04-11 18:30:29.323211,0 days 00:00:02.100221,96.67794570552074,8.18784210827577,sigmoid,56,4.0,23.0,32.0,2.0,4.0,94.0,,,,,,,,,,COMPLETE
7735,0.40503087002237737,2024-04-11 18:30:29.326211,2024-04-11 18:30:31.297367,0 days 00:00:01.971156,98.22401602302557,7.902531150420971,sigmoid,48,2.0,,,6.0,7.0,6.0,,,,,,,,,,COMPLETE
7736,0.5986580986580987,2024-04-11 18:30:31.300952,2024-04-11 18:30:33.061817,0 days 00:00:01.760865,99.94869904227768,8.31052762792354,sigmoid,8,,26.0,31.0,,,,,,,,,,,,,COMPLETE
7737,0.34623739584346525,2024-04-11 18:30:33.064811,2024-04-11 18:30:35.588450,0 days 00:00:02.523639,95.63682162457734,8.027378978340717,sigmoid,26,,24.0,40.0,7.0,5.0,34.0,,,9.823692443673684,7.295961238003395,3.0675031655389637,7.0,26.0,85.0,,COMPLETE
7738,0.31112167648026917,2024-04-11 18:30:35.592044,2024-04-11 18:30:37.765803,0 days 00:00:02.173759,91.01683244812696,8.575691626855553,sigmoid,10,,27.0,35.0,,,,,,5.315774069358469,1.404285938134263,3.745006133833243,8.0,44.0,80.0,,COMPLETE
7739,0.43507064548279295,2024-04-11 18:30:37.768805,2024-04-11 18:30:40.432479,0 days 00:00:02.663674,99.99728749423971,7.71460850023772,sigmoid,59,38.0,30.0,28.0,8.0,3.0,88.0,,,7.567228127129199,1.689368147365193,5.05832917481257,5.0,24.0,55.0,78.0,COMPLETE
7740,0.36638479872016716,2024-04-11 18:30:40.434483,2024-04-11 18:30:42.383030,0 days 00:00:01.948547,7.512755828035296,7.379990480387312,sigmoid,13,,21.0,30.0,,,,5.0,35.0,,,,,,,47.0,COMPLETE
7741,0.5375567924788073,2024-04-11 18:30:42.386023,2024-04-11 18:30:44.269177,0 days 00:00:01.883154,96.59418387550436,8.174148026551283,sigmoid,20,,,,3.0,2.0,42.0,39.0,46.0,,,,,,,,COMPLETE
7742,0.3378348704435661,2024-04-11 18:30:44.271692,2024-04-11 18:30:46.061553,0 days 00:00:01.789861,99.9954325171579,7.9277948340996405,sigmoid,37,7.0,,,,,,27.0,50.0,,,,,,,55.0,COMPLETE
7743,0.5963643249384587,2024-04-11 18:30:46.064553,2024-04-11 18:30:47.847917,0 days 00:00:01.783364,93.70127279898746,8.408696770847863,sigmoid,8,,26.0,32.0,,,,,,,,,,,,,COMPLETE
7744,0.5004901837560645,2024-04-11 18:30:47.852484,2024-04-11 18:30:50.488095,0 days 00:00:02.635611,99.94768471137884,7.595295480613508,sigmoid,55,32.0,,,2.0,6.0,46.0,11.0,15.0,6.260269533669158,9.655885847236998,0.9210479953787818,4.0,48.0,62.0,23.0,COMPLETE
7745,0.44701971028259324,2024-04-11 18:30:50.490708,2024-04-11 18:30:52.192617,0 days 00:00:01.701909,96.70206976757521,8.165078451990405,sigmoid,8,,25.0,30.0,,,,,,,,,,,,,COMPLETE
7746,0.5458054399614015,2024-04-11 18:30:52.195611,2024-04-11 18:30:54.860343,0 days 00:00:02.664732,98.12979915077402,7.8128002245362715,sigmoid,44,43.0,29.0,31.0,,,,41.0,37.0,,,,,,,,COMPLETE
7747,0.25432172358000515,2024-04-11 18:30:54.865364,2024-04-11 18:30:57.161506,0 days 00:00:02.296142,65.99172599836024,3.9016338984720265,sigmoid,52,8.0,,,1.0,8.0,20.0,18.0,40.0,,,,,,,,COMPLETE
