number,value,datetime_start,datetime_complete,duration,params_C,params_gamma,params_kernel,params_mask_number,params_rsi_window,params_so_smooth,params_so_window,params_srsi_smooth1,params_srsi_smooth2,params_srsi_window,params_tsi_window_fast,params_tsi_window_slow,params_ult_weight_1,params_ult_weight_2,params_ult_weight_3,params_ult_window_1,params_ult_window_2,params_ult_window_3,params_williams_lbp,state
6514,0.18413021363173956,2024-04-11 17:51:38.245425,2024-04-11 17:51:41.270624,0 days 00:00:03.025199,96.64138543479466,7.519137856503807,rbf,54,43.0,,,7.0,2.0,32.0,18.0,23.0,6.717588603842925,8.323338724516814,8.801434151497006,17.0,32.0,80.0,,COMPLETE
6515,0.5929369437606513,2024-04-11 17:51:41.274233,2024-04-11 17:51:43.012586,0 days 00:00:01.738353,93.56535918018469,8.46594421768244,sigmoid,8,,26.0,33.0,,,,,,,,,,,,,COMPLETE
6516,0.5370046738467791,2024-04-11 17:51:43.016522,2024-04-11 17:51:44.882731,0 days 00:00:01.866209,99.98898036777261,8.726972321197188,sigmoid,36,28.0,,,,,,39.0,4.0,,,,,,,,COMPLETE
6517,0.5963643249384587,2024-04-11 17:51:44.886758,2024-04-11 17:51:46.927562,0 days 00:00:02.040804,96.57505927028525,8.193087765639634,sigmoid,8,,23.0,32.0,,,,,,,,,,,,,COMPLETE
6518,0.5348184161445126,2024-04-11 17:51:46.930580,2024-04-11 17:51:48.710330,0 days 00:00:01.779750,98.38619489555234,7.684043886524418,sigmoid,37,50.0,,,,,,25.0,20.0,,,,,,,124.0,COMPLETE
6519,0.45952045133991537,2024-04-11 17:51:48.714889,2024-04-11 17:51:51.371217,0 days 00:00:02.656328,99.97284069786993,9.354481693431083,sigmoid,23,,,,4.0,1.0,82.0,44.0,43.0,7.721520885595814,3.3245525029155694,2.021956952538253,13.0,20.0,55.0,169.0,COMPLETE
6520,0.44701971028259324,2024-04-11 17:51:51.374775,2024-04-11 17:51:53.015419,0 days 00:00:01.640644,99.98651139489425,8.046252035995261,sigmoid,8,,27.0,30.0,,,,,,,,,,,,,COMPLETE
6521,0.45385908351932985,2024-04-11 17:51:53.018419,2024-04-11 17:51:54.448475,0 days 00:00:01.430056,91.66710908781829,7.948510142393898,sigmoid,32,37.0,,,,,,,,,,,,,,,COMPLETE
6522,0.43156369782392184,2024-04-11 17:51:54.453586,2024-04-11 17:51:57.266293,0 days 00:00:02.812707,94.91616558887704,8.313787088326048,sigmoid,27,,25.0,31.0,8.0,5.0,100.0,,,9.80392278131685,2.5830809761227758,4.6640540931202015,9.0,47.0,69.0,85.0,COMPLETE
6523,0.12622036262203626,2024-04-11 17:51:57.270289,2024-04-11 17:51:58.925357,0 days 00:00:01.655068,96.68779346802938,7.8199693594978,sigmoid,8,,28.0,29.0,,,,,,,,,,,,,COMPLETE
6524,0.3083841825818211,2024-04-11 17:51:58.928354,2024-04-11 17:52:01.120890,0 days 00:00:02.192536,99.97166755695424,8.572781086123616,sigmoid,7,,,,,,,21.0,2.0,3.00138564175847,3.72738923676432,5.994292503430025,18.0,40.0,92.0,134.0,COMPLETE
6525,0.21696856686201382,2024-04-11 17:52:01.124421,2024-04-11 17:52:03.068485,0 days 00:00:01.944064,98.23316133795139,8.125258088267868,sigmoid,34,22.0,,,,,,,,1.2386767666801601,0.7420489802754968,9.234213461019937,3.0,38.0,68.0,,COMPLETE
6526,0.34570921154039475,2024-04-11 17:52:03.071480,2024-04-11 17:52:04.704397,0 days 00:00:01.632917,72.65005426621481,7.401912459976216,sigmoid,1,,,,,,,,,,,,,,,72.0,COMPLETE
6527,0.47413837382505525,2024-04-11 17:52:04.708417,2024-04-11 17:52:07.719955,0 days 00:00:03.011538,99.95706849531248,7.705542804744255,sigmoid,30,,25.0,33.0,3.0,6.0,59.0,9.0,29.0,5.627127358564056,7.410729183340309,3.7327471686964206,8.0,49.0,93.0,,COMPLETE
6528,0.4310755453939222,2024-04-11 17:52:07.724606,2024-04-11 17:52:09.243022,0 days 00:00:01.518416,93.93489397953826,8.062102906233791,sigmoid,4,,,,,,,29.0,7.0,,,,,,,,COMPLETE
6529,0.45345352376492626,2024-04-11 17:52:09.245994,2024-04-11 17:52:10.820917,0 days 00:00:01.574923,96.70130071361454,8.311889775235864,sigmoid,8,,23.0,30.0,,,,,,,,,,,,,COMPLETE
6530,0.5248647478900671,2024-04-11 17:52:10.825446,2024-04-11 17:52:12.494119,0 days 00:00:01.668673,96.53479369209812,7.900914369980348,sigmoid,40,19.0,21.0,31.0,,,,,,,,,,,,,COMPLETE
6531,0.5963643249384587,2024-04-11 17:52:12.498139,2024-04-11 17:52:14.150458,0 days 00:00:01.652319,98.18224955276565,8.51050291686045,sigmoid,8,,26.0,32.0,,,,,,,,,,,,,COMPLETE
6532,0.44038929440389296,2024-04-11 17:52:14.153437,2024-04-11 17:52:16.542016,0 days 00:00:02.388579,95.19434557142579,9.059369234944064,sigmoid,61,11.0,27.0,30.0,6.0,3.0,20.0,6.0,48.0,,,,,,,76.0,COMPLETE
6533,0.2853282288030627,2024-04-11 17:52:16.545587,2024-04-11 17:52:18.570606,0 days 00:00:02.025019,96.38637672237695,8.167088446336649,rbf,5,,,,,,,31.0,40.0,,,,,,,21.0,COMPLETE
6534,0.4325822040130266,2024-04-11 17:52:18.574208,2024-04-11 17:52:20.867497,0 days 00:00:02.293289,98.34722799349332,7.687439888845392,sigmoid,17,,,,1.0,4.0,5.0,,,,,,,,,143.0,COMPLETE
6535,0.5929369437606513,2024-04-11 17:52:20.870492,2024-04-11 17:52:22.697089,0 days 00:00:01.826597,98.15141901142817,7.911947660487204,sigmoid,8,,24.0,33.0,,,,,,,,,,,,,COMPLETE
6536,0.37058522436444297,2024-04-11 17:52:22.702120,2024-04-11 17:52:24.689112,0 days 00:00:01.986992,99.97652013749702,8.275799777922984,sigmoid,45,40.0,26.0,29.0,,,,49.0,13.0,,,,,,,10.0,COMPLETE
6537,0.3870702418160881,2024-04-11 17:52:24.692143,2024-04-11 17:52:27.119214,0 days 00:00:02.427071,99.95327869669116,8.075055271516549,sigmoid,19,,,,2.0,8.0,7.0,,,7.991573663905454,5.645856915554548,7.04330712661201,12.0,33.0,87.0,152.0,COMPLETE
6538,0.4349654550916191,2024-04-11 17:52:27.122209,2024-04-11 17:52:30.080713,0 days 00:00:02.958504,90.32795527863425,7.289272115780658,sigmoid,58,13.0,25.0,41.0,7.0,7.0,54.0,,,2.225831982646135,8.061241391612059,9.849388652438815,19.0,42.0,74.0,,COMPLETE
6539,0.33873173540631973,2024-04-11 17:52:30.085229,2024-04-11 17:52:31.594560,0 days 00:00:01.509331,93.62564122672742,8.437138647434066,sigmoid,33,42.0,,,,,,,,,,,,,,60.0,COMPLETE
6540,0.5963245096172158,2024-04-11 17:52:31.598561,2024-04-11 17:52:33.230923,0 days 00:00:01.632362,99.96443042025749,8.686744341119981,sigmoid,8,,27.0,31.0,,,,,,,,,,,,,COMPLETE
6541,0.4683501844841631,2024-04-11 17:52:33.234461,2024-04-11 17:52:35.372174,0 days 00:00:02.137713,96.63483300428928,7.500592009982864,sigmoid,53,4.0,,,4.0,1.0,23.0,43.0,16.0,,,,,,,116.0,COMPLETE
6542,0.39848191108336345,2024-04-11 17:52:35.376787,2024-04-11 17:52:38.030590,0 days 00:00:02.653803,95.23253622540122,7.864136800463157,sigmoid,51,38.0,,,5.0,5.0,39.0,,,8.885779233968714,6.325699106760337,5.151978276736621,14.0,30.0,89.0,200.0,COMPLETE
6543,0.4810885825845604,2024-04-11 17:52:38.034104,2024-04-11 17:52:40.121919,0 days 00:00:02.087815,98.12943864361137,8.057159768274902,sigmoid,18,,,,8.0,2.0,91.0,,,7.204130788250627,8.82205439667138,6.841588065737119,20.0,24.0,99.0,,COMPLETE
6544,0.3856142842649894,2024-04-11 17:52:40.125508,2024-04-11 17:52:41.903951,0 days 00:00:01.778443,98.22499256678768,8.272983283317682,sigmoid,49,9.0,,,5.0,3.0,2.0,,,,,,,,,108.0,COMPLETE
6545,0.47658942933741855,2024-04-11 17:52:41.906933,2024-04-11 17:52:44.077893,0 days 00:00:02.170960,96.87424717728226,7.7018099551999954,sigmoid,50,30.0,,,6.0,4.0,75.0,,,9.550489755588497,2.8718344472161177,3.025300672905236,15.0,29.0,95.0,,COMPLETE
6546,0.5952371952371952,2024-04-11 17:52:44.081888,2024-04-11 17:52:45.931029,0 days 00:00:01.849141,93.1705209903757,8.064823913379673,sigmoid,8,,29.0,32.0,,,,,,,,,,,,,COMPLETE
6547,0.2960617371975003,2024-04-11 17:52:45.934572,2024-04-11 17:52:48.302553,0 days 00:00:02.367981,22.42113355554094,8.437747030230764,sigmoid,6,,,,,,,35.0,49.0,3.8605726230929633,5.353671040915518,8.400148641100344,6.0,21.0,66.0,,COMPLETE
6548,0.5952371952371952,2024-04-11 17:52:48.306119,2024-04-11 17:52:49.949356,0 days 00:00:01.643237,79.27065692393856,7.864935896603475,sigmoid,8,,24.0,32.0,,,,,,,,,,,,,COMPLETE
6549,0.48402192806524935,2024-04-11 17:52:49.954345,2024-04-11 17:52:51.984565,0 days 00:00:02.030220,98.21303243719844,8.245536326344494,sigmoid,25,,22.0,28.0,3.0,8.0,67.0,,,,,,,,,160.0,COMPLETE
6550,0.4968346604678767,2024-04-11 17:52:51.988583,2024-04-11 17:52:54.156739,0 days 00:00:02.168156,95.29585166422446,7.5635228419852645,sigmoid,29,,25.0,30.0,2.0,6.0,57.0,12.0,32.0,,,,,,,42.0,COMPLETE
6551,0.4929641398093509,2024-04-11 17:52:54.160740,2024-04-11 17:52:56.605084,0 days 00:00:02.444344,98.26097554591948,7.984626924892273,sigmoid,39,48.0,,,,,,27.0,16.0,9.076208268825521,7.81779284718918,9.993849155361842,11.0,43.0,57.0,137.0,COMPLETE
6552,0.5986044733320588,2024-04-11 17:52:56.608141,2024-04-11 17:52:58.139935,0 days 00:00:01.531794,95.46584698921464,8.942324610950994,sigmoid,8,,26.0,31.0,,,,,,,,,,,,,COMPLETE
6553,0.5906279643331437,2024-04-11 17:52:58.142935,2024-04-11 17:52:59.759860,0 days 00:00:01.616925,99.96547670324921,8.550443028874918,sigmoid,8,,24.0,34.0,,,,,,,,,,,,,COMPLETE
6554,0.473906575423981,2024-04-11 17:52:59.762856,2024-04-11 17:53:02.216948,0 days 00:00:02.454092,99.96606751041487,8.171559980929716,rbf,8,,26.0,31.0,,,,,,,,,,,,,COMPLETE
6555,0.47414735878328557,2024-04-11 17:53:02.220940,2024-04-11 17:53:05.068490,0 days 00:00:02.847550,99.99597303299652,7.75841287571361,sigmoid,22,,,,7.0,1.0,62.0,7.0,5.0,1.6712658147341202,4.726315726661324,7.810847333680484,4.0,34.0,69.0,,COMPLETE
6556,0.4659344431096619,2024-04-11 17:53:05.072489,2024-04-11 17:53:07.812944,0 days 00:00:02.740455,96.82622096405113,8.305536059121373,sigmoid,47,26.0,31.0,28.0,,,,32.0,12.0,3.662240929859351,8.565450481923213,6.402320043377893,8.0,26.0,50.0,88.0,COMPLETE
6557,0.44281898294929734,2024-04-11 17:53:07.815446,2024-04-11 17:53:09.937302,0 days 00:00:02.121856,96.7918311272454,5.373384583600451,sigmoid,24,,23.0,30.0,2.0,7.0,70.0,,,,,,,,,,COMPLETE
6558,0.3767773347916593,2024-04-11 17:53:09.941320,2024-04-11 17:53:12.199776,0 days 00:00:02.258456,92.28170313077385,7.962992130641897,sigmoid,35,28.0,,,,,,,,2.4665724937746214,7.078901175185152,8.936929988812103,13.0,41.0,77.0,82.0,COMPLETE
6559,0.4129591603924253,2024-04-11 17:53:12.205329,2024-04-11 17:53:14.607304,0 days 00:00:02.401975,98.16977988739639,8.097400042853456,sigmoid,43,32.0,28.0,33.0,,,,,,5.97733092575952,5.112739363091879,5.8577526826037545,16.0,23.0,81.0,94.0,COMPLETE
6560,0.3954153846153846,2024-04-11 17:53:14.610310,2024-04-11 17:53:17.597174,0 days 00:00:02.986864,94.39004432867594,7.764819396689845,sigmoid,31,,27.0,29.0,4.0,2.0,27.0,3.0,42.0,1.9958921331311261,5.95632376153946,9.578677183758405,5.0,36.0,91.0,103.0,COMPLETE
6561,0.5975287681569516,2024-04-11 17:53:17.600166,2024-04-11 17:53:19.570854,0 days 00:00:01.970688,98.13654894539008,8.726961898292409,sigmoid,8,,25.0,32.0,,,,,,,,,,,,,COMPLETE
6562,0.3965746026847709,2024-04-11 17:53:19.575493,2024-04-11 17:53:22.107761,0 days 00:00:02.532268,96.82059475092277,8.38542455354669,sigmoid,15,,25.0,36.0,,,,23.0,34.0,8.30809169626794,3.6196531040062783,5.527740898010627,7.0,22.0,65.0,18.0,COMPLETE
6563,0.36298524566680995,2024-04-11 17:53:22.111757,2024-04-11 17:53:24.024247,0 days 00:00:01.912490,95.33358081125189,7.570439543018102,sigmoid,21,,,,1.0,5.0,13.0,38.0,30.0,,,,,,,25.0,COMPLETE
6564,0.6009432182607054,2024-04-11 17:53:24.029376,2024-04-11 17:53:26.005440,0 days 00:00:01.976064,29.731293882185085,7.908144844572361,sigmoid,8,,24.0,31.0,,,,,,,,,,,,,COMPLETE
6565,0.4077101300038614,2024-04-11 17:53:26.009516,2024-04-11 17:53:28.209791,0 days 00:00:02.200275,98.2340907446281,7.177117503367807,sigmoid,28,,27.0,32.0,8.0,3.0,79.0,46.0,10.0,,,,,,,,COMPLETE
6566,0.3410881929692318,2024-04-11 17:53:28.213789,2024-04-11 17:53:30.587786,0 days 00:00:02.373997,99.96119916520425,8.189500180766766,sigmoid,38,8.0,,,,,,14.0,26.0,5.10895942682326,3.974459665381233,2.594231228258813,9.0,28.0,58.0,,COMPLETE
6567,0.3618123935737025,2024-04-11 17:53:30.591782,2024-04-11 17:53:32.397274,0 days 00:00:01.805492,96.85598862996642,8.488660907707144,sigmoid,9,,20.0,30.0,,,,,,,,,,,,183.0,COMPLETE
6568,0.49462792544494794,2024-04-11 17:53:32.401240,2024-04-11 17:53:34.524182,0 days 00:00:02.122942,93.97929167102829,8.060100245689926,sigmoid,57,44.0,29.0,33.0,7.0,8.0,36.0,,,,,,,,,193.0,COMPLETE
6569,0.44701971028259324,2024-04-11 17:53:34.529773,2024-04-11 17:53:36.416439,0 days 00:00:01.886666,97.99175170626741,7.827418562744233,sigmoid,8,,22.0,30.0,,,,,,,,,,,,,COMPLETE
6570,0.29850394628342564,2024-04-11 17:53:36.419445,2024-04-11 17:53:38.379147,0 days 00:00:01.959702,99.97796337970188,8.2532751458879,sigmoid,3,,,,,,,,,2.8796094841375677,2.3457957511862344,7.321523435376118,2.0,25.0,56.0,38.0,COMPLETE
6571,0.23161647091083587,2024-04-11 17:53:38.383147,2024-04-11 17:53:41.196920,0 days 00:00:02.813773,96.65009639609943,8.002713597048544,rbf,14,,23.0,31.0,,,,34.0,37.0,3.263467169670071,6.7361457926092445,0.5000569236251549,10.0,35.0,97.0,,COMPLETE
6572,0.45704851163016563,2024-04-11 17:53:41.199910,2024-04-11 17:53:42.980502,0 days 00:00:01.780592,98.1359051817534,7.66496763983959,sigmoid,16,,,,5.0,6.0,30.0,,,,,,,,,,COMPLETE
6573,0.12622036262203626,2024-04-11 17:53:42.983483,2024-04-11 17:53:44.755698,0 days 00:00:01.772215,99.94831037068221,7.444403728459264,sigmoid,8,,26.0,29.0,,,,,,,,,,,,,COMPLETE
6574,0.5041903801359171,2024-04-11 17:53:44.758854,2024-04-11 17:53:47.172670,0 days 00:00:02.413816,95.19521776325631,5.957377777311581,sigmoid,42,36.0,24.0,31.0,,,,,,6.355429075084963,1.854475473002812,1.2163895455839295,18.0,30.0,86.0,,COMPLETE
6575,0.3631310639697418,2024-04-11 17:53:47.176247,2024-04-11 17:53:49.627191,0 days 00:00:02.450944,92.55765019360535,9.808930110261704,sigmoid,46,5.0,25.0,26.0,,,,17.0,22.0,6.991259815738205,9.519692440771422,6.2344865688911355,15.0,48.0,64.0,,COMPLETE
6576,0.5963643249384587,2024-04-11 17:53:49.630209,2024-04-11 17:53:51.266360,0 days 00:00:01.636151,98.141056649879,8.45144859043887,sigmoid,8,,26.0,32.0,,,,,,,,,,,,,COMPLETE
6577,0.5895095625828441,2024-04-11 17:53:51.269321,2024-04-11 17:53:52.999830,0 days 00:00:01.730509,96.67069036551428,8.191878973333926,sigmoid,8,,27.0,34.0,,,,,,,,,,,,,COMPLETE
6578,0.25603200905306556,2024-04-11 17:53:53.002829,2024-04-11 17:53:54.789154,0 days 00:00:01.786325,95.07837990751887,8.661004859190323,sigmoid,2,,,,,,,,,7.413377294087677,9.219292434412234,8.167278499270692,12.0,45.0,71.0,,COMPLETE
6579,0.46617280016993257,2024-04-11 17:53:54.792152,2024-04-11 17:53:57.679431,0 days 00:00:02.887279,98.33156104827833,7.791379339329028,sigmoid,62,25.0,23.0,30.0,6.0,4.0,49.0,36.0,41.0,4.675689073693272,2.710416710905398,4.837955188253412,14.0,39.0,61.0,,COMPLETE
6580,0.2873366711442179,2024-04-11 17:53:57.683418,2024-04-11 17:53:59.728513,0 days 00:00:02.045095,98.08375923721381,7.991696057793491,sigmoid,10,,28.0,31.0,,,,,,0.7495997630646762,1.471826915837502,3.4246293561106276,19.0,50.0,54.0,,COMPLETE
6581,0.45341502429601904,2024-04-11 17:53:59.732509,2024-04-11 17:54:02.644379,0 days 00:00:02.911870,90.75069974428052,8.305872637970028,sigmoid,63,49.0,25.0,29.0,3.0,7.0,98.0,25.0,24.0,4.555034718429022,2.1308849660597877,3.920345790928046,20.0,31.0,62.0,122.0,COMPLETE
6582,0.33797759264579147,2024-04-11 17:54:02.647929,2024-04-11 17:54:04.721884,0 days 00:00:02.073955,99.97405419773781,8.062711060545707,sigmoid,41,45.0,26.0,32.0,,,,,,,,,,,,49.0,COMPLETE
6583,0.6009432182607054,2024-04-11 17:54:04.727401,2024-04-11 17:54:06.903791,0 days 00:00:02.176390,96.58774838972897,7.850665129094589,sigmoid,8,,24.0,31.0,,,,,,,,,,,,,COMPLETE
6584,0.49075776866129106,2024-04-11 17:54:06.908364,2024-04-11 17:54:08.730711,0 days 00:00:01.822347,93.67075913011354,7.583817143296119,sigmoid,20,,,,4.0,5.0,83.0,26.0,47.0,,,,,,,,COMPLETE
6585,0.5929369437606513,2024-04-11 17:54:08.733711,2024-04-11 17:54:10.598187,0 days 00:00:01.864476,98.25436279077195,8.376736870903086,sigmoid,8,,27.0,33.0,,,,,,,,,,,,,COMPLETE
6586,0.5103176725080816,2024-04-11 17:54:10.602200,2024-04-11 17:54:13.214577,0 days 00:00:02.612377,96.66552628451974,8.136338593104032,sigmoid,11,,25.0,27.0,,,,,,8.552648344865215,3.09095181978053,4.38955177838258,7.0,38.0,79.0,63.0,COMPLETE
6587,0.47397134059113055,2024-04-11 17:54:13.218680,2024-04-11 17:54:15.690222,0 days 00:00:02.471542,94.85499976001606,7.377033871024908,sigmoid,26,,26.0,30.0,5.0,2.0,18.0,,,1.0236769710091265,0.9136995652671427,6.557356944649557,9.0,37.0,84.0,,COMPLETE
6588,0.5929369437606513,2024-04-11 17:54:15.695233,2024-04-11 17:54:17.443232,0 days 00:00:01.747999,98.12105593108429,8.605605580747175,sigmoid,8,,21.0,33.0,,,,,,,,,,,,,COMPLETE
6589,0.31968424467433226,2024-04-11 17:54:17.445228,2024-04-11 17:54:19.973212,0 days 00:00:02.527984,95.73507062631995,7.883525553117709,rbf,56,33.0,24.0,29.0,3.0,1.0,41.0,,,,,,,,,,COMPLETE
6590,0.35568212096989077,2024-04-11 17:54:19.975345,2024-04-11 17:54:21.775895,0 days 00:00:01.800550,99.94498264800556,8.219975536153044,sigmoid,37,14.0,,,,,,28.0,3.0,,,,,,,68.0,COMPLETE
6591,0.5030707849553951,2024-04-11 17:54:21.779428,2024-04-11 17:54:23.541658,0 days 00:00:01.762230,98.12194887135128,7.7495526304555264,sigmoid,48,20.0,,,1.0,3.0,89.0,,,,,,,,,,COMPLETE
6592,0.5952371952371952,2024-04-11 17:54:23.544658,2024-04-11 17:54:25.120918,0 days 00:00:01.576260,96.47079300704358,8.017670037709308,sigmoid,8,,23.0,32.0,,,,,,,,,,,,,COMPLETE
6593,0.5963245096172158,2024-04-11 17:54:25.124924,2024-04-11 17:54:26.693073,0 days 00:00:01.568149,98.18450605186449,8.513444623253712,sigmoid,8,,27.0,31.0,,,,,,,,,,,,,COMPLETE
6594,0.3609477455553302,2024-04-11 17:54:26.696630,2024-04-11 17:54:28.758565,0 days 00:00:02.061935,93.8775447323348,8.309771734133127,sigmoid,44,17.0,25.0,35.0,,,,50.0,8.0,,,,,,,,COMPLETE
6595,0.5350880769858098,2024-04-11 17:54:28.761561,2024-04-11 17:54:30.898659,0 days 00:00:02.137098,98.27725208779154,8.805122177216072,sigmoid,12,,28.0,30.0,,,,20.0,28.0,,,,,,,,COMPLETE
6596,0.4653932938028021,2024-04-11 17:54:30.902234,2024-04-11 17:54:33.595876,0 days 00:00:02.693642,95.6525915386164,7.6274558720521135,sigmoid,55,35.0,,,8.0,7.0,64.0,33.0,15.0,1.4697917372545262,7.2512480975486735,2.4123755879200406,17.0,40.0,96.0,165.0,COMPLETE
6597,0.12003789673140693,2024-04-11 17:54:33.599457,2024-04-11 17:54:35.385668,0 days 00:00:01.786211,92.25456140910507,8.120673149538344,sigmoid,8,,24.0,28.0,,,,,,,,,,,,,COMPLETE
6598,0.506476508552602,2024-04-11 17:54:35.390240,2024-04-11 17:54:37.377526,0 days 00:00:01.987286,96.5934100007026,7.942174538577263,sigmoid,13,,26.0,31.0,,,,8.0,45.0,,,,,,,175.0,COMPLETE
6599,0.4795972443031266,2024-04-11 17:54:37.380480,2024-04-11 17:54:39.563091,0 days 00:00:02.182611,98.24363542358873,8.317413979467428,sigmoid,52,46.0,,,6.0,4.0,95.0,10.0,21.0,,,,,,,,COMPLETE
6600,0.4872397139162334,2024-04-11 17:54:39.566098,2024-04-11 17:54:41.382632,0 days 00:00:01.816534,99.95760546598545,7.745343624447471,sigmoid,8,,29.0,37.0,,,,,,,,,,,,,COMPLETE
6601,0.48671960222227856,2024-04-11 17:54:41.385632,2024-04-11 17:54:44.015702,0 days 00:00:02.630070,98.21685573144582,8.13332613489316,sigmoid,59,12.0,22.0,32.0,2.0,8.0,51.0,,,2.673406094582911,6.473643814746357,2.0009068221607733,5.0,36.0,53.0,128.0,COMPLETE
6602,0.5952371952371952,2024-04-11 17:54:44.018215,2024-04-11 17:54:45.810830,0 days 00:00:01.792615,95.3360904661662,7.9262787746853025,sigmoid,8,,25.0,32.0,,,,,,,,,,,,,COMPLETE
6603,0.45345352376492626,2024-04-11 17:54:45.813830,2024-04-11 17:54:47.439881,0 days 00:00:01.626051,96.55610790938623,8.485761020753879,sigmoid,8,,6.0,30.0,,,,,,,,,,,,,COMPLETE
6604,0.4823511665325824,2024-04-11 17:54:47.442856,2024-04-11 17:54:49.688916,0 days 00:00:02.246060,99.99723681820878,7.426534605149124,sigmoid,60,10.0,24.0,34.0,4.0,6.0,73.0,12.0,36.0,,,,,,,,COMPLETE
6605,0.4203147845531951,2024-04-11 17:54:49.691914,2024-04-11 17:54:52.832445,0 days 00:00:03.140531,94.27701456330423,8.10747137675694,sigmoid,23,,,,7.0,1.0,34.0,22.0,33.0,4.06288877499699,4.970908882827531,0.7771447301392866,8.0,27.0,98.0,33.0,COMPLETE
6606,0.5529703246958887,2024-04-11 17:54:52.835444,2024-04-11 17:54:54.469243,0 days 00:00:01.633799,98.17624369574122,8.383316929585803,sigmoid,36,15.0,,,,,,47.0,44.0,,,,,,,,COMPLETE
6607,0.14786160499759732,2024-04-11 17:54:54.472255,2024-04-11 17:54:56.120327,0 days 00:00:01.648072,98.15299082210551,7.697131222659129,sigmoid,32,27.0,,,,,,,,,,,,,,,COMPLETE
6608,0.3273594212430122,2024-04-11 17:54:56.123314,2024-04-11 17:54:58.322090,0 days 00:00:02.198776,96.88016953395933,7.930462196079673,rbf,40,22.0,27.0,29.0,,,,,,,,,,,,,COMPLETE
6609,0.45671764766465833,2024-04-11 17:54:58.326109,2024-04-11 17:55:01.347144,0 days 00:00:03.021035,95.22051333363598,8.181786301760424,sigmoid,54,6.0,,,3.0,5.0,60.0,15.0,27.0,5.773555945783649,4.509238122976473,1.6093670016703143,4.0,25.0,59.0,,COMPLETE
6610,0.5986580986580987,2024-04-11 17:55:01.350669,2024-04-11 17:55:02.953894,0 days 00:00:01.603225,92.48970470119977,6.6911881771745945,sigmoid,8,,26.0,31.0,,,,,,,,,,,,,COMPLETE
6611,0.2500647612468699,2024-04-11 17:55:02.956894,2024-04-11 17:55:05.000861,0 days 00:00:02.043967,99.95522307936228,7.867748828784055,sigmoid,34,29.0,,,,,,,,6.78691775974413,0.666889295140761,5.366155429895205,11.0,44.0,88.0,,COMPLETE
6612,0.45345352376492626,2024-04-11 17:55:05.003848,2024-04-11 17:55:06.971301,0 days 00:00:01.967453,98.18739777581447,8.267606321430526,sigmoid,8,,23.0,30.0,,,,,,,,,,,,,COMPLETE
6613,0.5929369437606513,2024-04-11 17:55:06.974293,2024-04-11 17:55:08.611926,0 days 00:00:01.637633,96.46047613089672,7.548023324434563,sigmoid,8,,25.0,33.0,,,,,,,,,,,,,COMPLETE
6614,0.312206175804106,2024-04-11 17:55:08.615923,2024-04-11 17:55:11.075941,0 days 00:00:02.460018,98.1572151834045,7.165735838531987,sigmoid,7,,,,,,,19.0,9.0,4.914716550014973,6.215993807826141,4.111380071577854,10.0,46.0,52.0,54.0,COMPLETE
6615,0.4349849158868947,2024-04-11 17:55:11.080557,2024-04-11 17:55:13.923547,0 days 00:00:02.842990,99.95613471685894,8.558189868368192,sigmoid,51,3.0,,,1.0,3.0,93.0,,,1.8546912323848996,4.2889977975051625,0.9957713150966265,13.0,20.0,82.0,111.0,COMPLETE
6616,0.3936418588287971,2024-04-11 17:55:13.927621,2024-04-11 17:55:16.611936,0 days 00:00:02.684315,95.09981583406086,8.0331356621662,sigmoid,61,42.0,24.0,32.0,6.0,6.0,9.0,41.0,14.0,,,,,,,28.0,COMPLETE
