number,value,datetime_start,datetime_complete,duration,params_C,params_gamma,params_kernel,params_mask_number,params_rsi_window,params_so_smooth,params_so_window,params_srsi_smooth1,params_srsi_smooth2,params_srsi_window,params_tsi_window_fast,params_tsi_window_slow,params_ult_weight_1,params_ult_weight_2,params_ult_weight_3,params_ult_window_1,params_ult_window_2,params_ult_window_3,params_williams_lbp,state
1350,0.5860647931709175,2024-04-11 16:13:25.710005,2024-04-11 16:13:26.142835,0 days 00:00:00.432830,86.59710715223402,1.2362468946577538,sigmoid,0,,,,,,,,,,,,,,,,COMPLETE
1351,0.5836206735876839,2024-04-11 16:13:26.143837,2024-04-11 16:13:26.559172,0 days 00:00:00.415335,30.278382786327178,1.7542003530567405,sigmoid,0,,,,,,,,,,,,,,,,COMPLETE
1352,0.17881168556240298,2024-04-11 16:13:26.560173,2024-04-11 16:13:27.559771,0 days 00:00:00.999598,95.34194618743476,5.278477485130314,rbf,58,39.0,16.0,8.0,1.0,5.0,69.0,,,4.023139533367758,9.806435389579915,3.7472900092127155,4.0,42.0,65.0,,COMPLETE
1353,0.534078630205303,2024-04-11 16:13:27.560968,2024-04-11 16:13:28.117644,0 days 00:00:00.556676,51.308537481998684,0.9533665096983968,sigmoid,17,,,,7.0,6.0,24.0,,,,,,,,,76.0,COMPLETE
1354,0.5851186236370609,2024-04-11 16:13:28.118697,2024-04-11 16:13:28.545904,0 days 00:00:00.427207,97.80074966131859,1.4998353475997306,sigmoid,0,,,,,,,,,,,,,,,,COMPLETE
1355,0.5269347148358702,2024-04-11 16:13:28.546979,2024-04-11 16:13:29.245823,0 days 00:00:00.698844,92.90097328009249,1.0938080008825468,sigmoid,18,,,,6.0,3.0,21.0,,,3.7452439856416286,7.744110920649218,2.8823350124947678,17.0,43.0,76.0,,COMPLETE
1356,0.3872132987304482,2024-04-11 16:13:29.247823,2024-04-11 16:13:29.868624,0 days 00:00:00.620801,89.93804355549884,0.431712449861155,sigmoid,29,,48.0,11.0,3.0,7.0,91.0,35.0,39.0,,,,,,,182.0,COMPLETE
1357,0.4141750061020259,2024-04-11 16:13:29.869627,2024-04-11 16:13:30.399919,0 days 00:00:00.530292,96.03297431329945,2.8167468615476037,sigmoid,49,13.0,,,5.0,8.0,78.0,,,,,,,,,44.0,COMPLETE
1358,0.401885699575235,2024-04-11 16:13:30.400920,2024-04-11 16:13:31.074456,0 days 00:00:00.673536,98.49119484262773,0.7844618561425808,sigmoid,19,,,,2.0,2.0,72.0,,,4.155960101945381,4.922724623641071,4.1102629622375915,11.0,45.0,88.0,89.0,COMPLETE
1359,0.4658239345999545,2024-04-11 16:13:31.075456,2024-04-11 16:13:31.745294,0 days 00:00:00.669838,92.80451521566162,1.3854338875547012,sigmoid,50,40.0,,,4.0,1.0,98.0,,,7.087591676620175,6.15518504042052,2.042923822398093,7.0,20.0,53.0,,COMPLETE
1360,0.5873898933704218,2024-04-11 16:13:31.746293,2024-04-11 16:13:32.170245,0 days 00:00:00.423952,88.27029119213259,0.7978288904467606,sigmoid,0,,,,,,,,,,,,,,,,COMPLETE
1361,0.580355311969875,2024-04-11 16:13:32.172244,2024-04-11 16:13:32.803602,0 days 00:00:00.631358,94.77579417241974,1.0282381309422788,sigmoid,6,,,,,,,13.0,7.0,2.309967857892391,7.4563655069848656,8.769252508338027,2.0,38.0,86.0,,COMPLETE
1362,0.3651893200618737,2024-04-11 16:13:32.804601,2024-04-11 16:13:33.470701,0 days 00:00:00.666100,99.93074765226923,1.294475641721811,sigmoid,39,21.0,,,,,,18.0,30.0,4.748486984044559,4.131383004482837,5.220649759597432,18.0,25.0,79.0,134.0,COMPLETE
1363,0.39291320174999156,2024-04-11 16:13:33.472749,2024-04-11 16:13:34.191570,0 days 00:00:00.718821,75.32790864745618,0.1944886972423323,sigmoid,47,34.0,10.0,5.0,,,,49.0,12.0,8.872436594399625,9.036929184631223,0.9887105734084862,14.0,44.0,80.0,84.0,COMPLETE
1364,0.396341032704669,2024-04-11 16:13:34.192681,2024-04-11 16:13:34.829602,0 days 00:00:00.636921,97.0111171959365,0.6204093485723263,sigmoid,25,,41.0,32.0,1.0,4.0,83.0,,,,,,,,,101.0,COMPLETE
1365,0.5874934491910808,2024-04-11 16:13:34.830603,2024-04-11 16:13:35.272500,0 days 00:00:00.441897,91.09665268873053,1.1305699245001302,sigmoid,0,,,,,,,,,,,,,,,,COMPLETE
1366,0.39574512389810507,2024-04-11 16:13:35.273633,2024-04-11 16:13:35.966559,0 days 00:00:00.692926,83.62633519080423,1.5485548933884357,sigmoid,43,44.0,28.0,21.0,,,,,,5.14346490162949,6.562847207438551,3.5587449353511036,5.0,40.0,71.0,174.0,COMPLETE
1367,0.26971649964609024,2024-04-11 16:13:35.967560,2024-04-11 16:13:36.571748,0 days 00:00:00.604188,17.368507933248114,0.9274815730633126,sigmoid,24,,19.0,34.0,7.0,6.0,41.0,,,,,,,,,,COMPLETE
1368,0.5863711449328822,2024-04-11 16:13:36.572747,2024-04-11 16:13:37.071445,0 days 00:00:00.498698,99.99504444075447,0.7348395841218576,sigmoid,0,,,,,,,,,,,,,,,,COMPLETE
1369,0.3868571040846791,2024-04-11 16:13:37.073482,2024-04-11 16:13:38.354566,0 days 00:00:01.281084,93.70691306280393,2.024750890894736,rbf,21,,,,8.0,3.0,75.0,24.0,49.0,,,,,,,22.0,COMPLETE
1370,0.29061648183413613,2024-04-11 16:13:38.355564,2024-04-11 16:13:39.057203,0 days 00:00:00.701639,96.49115606368728,0.47616502839273234,sigmoid,22,,,,3.0,5.0,34.0,30.0,4.0,1.613244447801454,2.8581393922061844,2.403457983497828,3.0,22.0,90.0,,COMPLETE
1371,0.4766325309216651,2024-04-11 16:13:39.058203,2024-04-11 16:13:39.878511,0 days 00:00:00.820308,89.7716438403603,1.2695499970466264,sigmoid,31,,6.0,2.0,2.0,6.0,47.0,36.0,27.0,1.8885639164945134,9.355639712646894,1.4578069180690034,10.0,34.0,52.0,153.0,COMPLETE
1372,0.5669391618621461,2024-04-11 16:13:39.879702,2024-04-11 16:13:40.442169,0 days 00:00:00.562467,95.08149320998096,0.9557414705053672,sigmoid,2,,,,,,,,,0.8101947450301958,3.146015063235661,6.897072899680554,6.0,48.0,66.0,,COMPLETE
1373,0.5836206735876839,2024-04-11 16:13:40.443169,2024-04-11 16:13:40.885332,0 days 00:00:00.442163,92.0769078214102,1.6970059207741484,sigmoid,0,,,,,,,,,,,,,,,,COMPLETE
1374,0.3307360799862093,2024-04-11 16:13:40.886329,2024-04-11 16:13:41.529365,0 days 00:00:00.643036,86.75597572938565,1.1006740042907155,sigmoid,35,29.0,,,,,,,,2.91619638746456,7.959477837352629,3.173387599985559,5.0,30.0,61.0,55.0,COMPLETE
1375,0.5867358687757959,2024-04-11 16:13:41.531365,2024-04-11 16:13:41.954101,0 days 00:00:00.422736,96.7830409521024,1.321591478717633,sigmoid,0,,,,,,,,,,,,,,,,COMPLETE
1376,0.3291764094570018,2024-04-11 16:13:41.956100,2024-04-11 16:13:42.595652,0 days 00:00:00.639552,97.73812212911639,0.7337755124523602,sigmoid,38,6.0,,,,,,10.0,25.0,6.057142124623748,5.603614976813574,4.53297745573458,19.0,39.0,82.0,,COMPLETE
1377,0.35271400226757366,2024-04-11 16:13:42.596652,2024-04-11 16:13:43.226062,0 days 00:00:00.629410,93.86477933665448,0.9087692827790984,sigmoid,3,,,,,,,,,6.573329254677517,7.14429797192169,6.229497157543282,8.0,32.0,69.0,62.0,COMPLETE
1378,0.5862828235037213,2024-04-11 16:13:43.227059,2024-04-11 16:13:43.655485,0 days 00:00:00.428426,91.52220558394245,1.4584485396386606,sigmoid,0,,,,,,,,,,,,,,,,COMPLETE
1379,0.5035003940841022,2024-04-11 16:13:43.656485,2024-04-11 16:13:44.415930,0 days 00:00:00.759445,88.48526098125292,1.1433944013934758,sigmoid,15,,26.0,18.0,,,,11.0,24.0,8.491672697176615,9.575669868343564,0.7287604619120875,4.0,41.0,95.0,114.0,COMPLETE
1380,0.40509853157923476,2024-04-11 16:13:44.416929,2024-04-11 16:13:45.056073,0 days 00:00:00.639144,95.23193491148122,0.550803977363108,sigmoid,28,,23.0,28.0,6.0,3.0,67.0,5.0,15.0,,,,,,,,COMPLETE
1381,0.35277649810411427,2024-04-11 16:13:45.057074,2024-04-11 16:13:45.499447,0 days 00:00:00.442373,98.24774784994231,0.8758284705750041,sigmoid,1,,,,,,,,,,,,,,,105.0,COMPLETE
1382,0.48643296635941446,2024-04-11 16:13:45.500449,2024-04-11 16:13:46.156779,0 days 00:00:00.656330,99.99450152220349,1.1764347432472926,sigmoid,57,10.0,44.0,36.0,4.0,7.0,64.0,,,,,,,,,47.0,COMPLETE
1383,0.4966114016368454,2024-04-11 16:13:46.157850,2024-04-11 16:13:46.822644,0 days 00:00:00.664794,84.7112349569626,1.5928050166351375,sigmoid,42,12.0,3.0,23.0,,,,,,3.583460384042438,6.379096054492426,5.385058765019375,9.0,40.0,72.0,,COMPLETE
1384,0.5863711449328822,2024-04-11 16:13:46.824665,2024-04-11 16:13:47.244089,0 days 00:00:00.419424,93.34711297316427,0.6760570093544036,sigmoid,0,,,,,,,,,,,,,,,,COMPLETE
1385,0.09480907233775077,2024-04-11 16:13:47.245214,2024-04-11 16:13:47.733315,0 days 00:00:00.488101,89.73046992885463,0.9897522178713836,sigmoid,8,,13.0,17.0,,,,,,,,,,,,,COMPLETE
1386,0.5137504730667339,2024-04-11 16:13:47.734425,2024-04-11 16:13:48.359703,0 days 00:00:00.625278,95.61246893912076,0.3407729524806564,sigmoid,9,,4.0,44.0,,,,,,,,,,,,96.0,COMPLETE
1387,0.49464814393076756,2024-04-11 16:13:48.360792,2024-04-11 16:13:49.278115,0 days 00:00:00.917323,97.92476774731944,1.3121090280972538,sigmoid,63,24.0,5.0,40.0,3.0,4.0,54.0,50.0,6.0,1.3514204186313523,3.890981877171919,9.08096418218847,11.0,47.0,75.0,37.0,COMPLETE
1388,0.5873898933704218,2024-04-11 16:13:49.280115,2024-04-11 16:13:49.698497,0 days 00:00:00.418382,92.18821745986877,0.7959157227634911,sigmoid,0,,,,,,,,,,,,,,,,COMPLETE
1389,0.42336460609176196,2024-04-11 16:13:49.700504,2024-04-11 16:13:51.476619,0 days 00:00:01.776115,87.40300238840473,1.10597929775209,rbf,14,,17.0,31.0,,,,39.0,3.0,4.325930702063091,8.824507296166207,4.249441028668706,2.0,28.0,63.0,,COMPLETE
1390,0.5851186236370609,2024-04-11 16:13:51.477619,2024-04-11 16:13:51.902155,0 days 00:00:00.424536,90.49841378050354,1.4885049980229477,sigmoid,0,,,,,,,,,,,,,,,,COMPLETE
1391,0.5297808784908081,2024-04-11 16:13:51.903164,2024-04-11 16:13:52.542237,0 days 00:00:00.639073,26.5691534176395,0.5629335954791744,sigmoid,10,,36.0,47.0,,,,,,5.293969870967433,5.896458897851911,2.6593455642888935,3.0,29.0,98.0,,COMPLETE
1392,0.48158092059115204,2024-04-11 16:13:52.543239,2024-04-11 16:13:53.376793,0 days 00:00:00.833554,94.65583249949744,1.7908926157534517,sigmoid,62,36.0,30.0,30.0,2.0,2.0,27.0,43.0,36.0,2.7168292685876816,8.635148816562236,4.887694130331566,6.0,37.0,83.0,,COMPLETE
1393,0.4095530345297873,2024-04-11 16:13:53.378792,2024-04-11 16:13:54.202146,0 days 00:00:00.823354,96.96435646251996,0.9091770729426404,sigmoid,26,,34.0,26.0,5.0,8.0,49.0,,,2.1353619750414845,9.882074430617937,5.809162218593293,13.0,42.0,85.0,,COMPLETE
1394,0.5867358687757959,2024-04-11 16:13:54.204127,2024-04-11 16:13:54.637491,0 days 00:00:00.433364,92.91250100545881,1.3184430431455496,sigmoid,0,,,,,,,,,,,,,,,,COMPLETE
1395,0.3396764628607889,2024-04-11 16:13:54.638494,2024-04-11 16:13:55.243942,0 days 00:00:00.605448,98.05911691438499,1.06039752343851,sigmoid,41,23.0,21.0,19.0,,,,,,,,,,,,80.0,COMPLETE
1396,0.5873898933704218,2024-04-11 16:13:55.244943,2024-04-11 16:13:55.704209,0 days 00:00:00.459266,58.05994711628439,0.7803024417632889,sigmoid,0,,,,,,,,,,,,,,,,COMPLETE
1397,0.15400159532039354,2024-04-11 16:13:55.705207,2024-04-11 16:13:56.308332,0 days 00:00:00.603125,95.14917757622021,1.1873506874807596,sigmoid,20,,,,1.0,4.0,32.0,32.0,29.0,,,,,,,,COMPLETE
1398,0.13026268441885572,2024-04-11 16:13:56.310465,2024-04-11 16:13:56.677863,0 days 00:00:00.367398,90.91616812881465,0.20860473602338014,sigmoid,0,,,,,,,,,,,,,,,,COMPLETE
1399,0.28224710115953616,2024-04-11 16:13:56.678865,2024-04-11 16:13:57.314570,0 days 00:00:00.635705,93.57637214054346,0.9813904105343866,sigmoid,37,30.0,,,,,,15.0,16.0,,,,,,,10.0,COMPLETE
1400,0.48867290086640647,2024-04-11 16:13:57.315607,2024-04-11 16:13:58.118966,0 days 00:00:00.803359,96.87551736812051,1.3780509313151583,sigmoid,46,27.0,22.0,14.0,,,,7.0,46.0,1.0854985299713524,7.505128564579323,1.583946898433343,8.0,31.0,78.0,,COMPLETE
1401,0.4783517948246541,2024-04-11 16:13:58.121027,2024-04-11 16:13:58.647841,0 days 00:00:00.526814,88.5208225540692,0.6282720562744316,sigmoid,16,,,,4.0,5.0,88.0,,,,,,,,,,COMPLETE
1402,0.4325708432912257,2024-04-11 16:13:58.648840,2024-04-11 16:13:59.366309,0 days 00:00:00.717469,98.2963833735406,0.42666833077255717,sigmoid,11,,8.0,37.0,,,,,,6.978800346732548,4.690481333860359,3.8051984213698917,3.0,33.0,87.0,124.0,COMPLETE
1403,0.25603200905306556,2024-04-11 16:13:59.367311,2024-04-11 16:14:00.008119,0 days 00:00:00.640808,92.2847961615806,1.1683351853039334,sigmoid,18,,,,7.0,2.0,40.0,,,9.326210829081123,7.3084779995373035,6.507632403815154,7.0,35.0,70.0,,COMPLETE
1404,0.37490937963889936,2024-04-11 16:14:00.010170,2024-04-11 16:14:00.735322,0 days 00:00:00.725152,85.9624740592663,1.5903071774101125,sigmoid,52,15.0,,,5.0,1.0,11.0,12.0,40.0,,,,,,,,COMPLETE
1405,0.5912864723598872,2024-04-11 16:14:00.736323,2024-04-11 16:14:01.176022,0 days 00:00:00.439699,94.92521944620566,0.8712982703891068,sigmoid,0,,,,,,,,,,,,,,,,COMPLETE
1406,0.10504933255948928,2024-04-11 16:14:01.177025,2024-04-11 16:14:01.632432,0 days 00:00:00.455407,95.72098154342238,0.44706717727005085,sigmoid,0,,,,,,,,,,,,,,,,COMPLETE
1407,0.41226043666417206,2024-04-11 16:14:01.633651,2024-04-11 16:14:03.045522,0 days 00:00:01.411871,95.93871003805776,0.7690905980340228,rbf,48,2.0,,,6.0,8.0,100.0,,,,,,,,,,COMPLETE
1408,0.4169610222072058,2024-04-11 16:14:03.047523,2024-04-11 16:14:03.821500,0 days 00:00:00.773977,94.44761046391741,0.613095352425466,sigmoid,55,32.0,,,3.0,7.0,56.0,16.0,10.0,3.2668986412628747,6.714662644809364,2.8884180528751853,4.0,48.0,67.0,137.0,COMPLETE
1409,0.40985135063136025,2024-04-11 16:14:03.823665,2024-04-11 16:14:04.645036,0 days 00:00:00.821371,96.7052376918992,0.7762441383600087,sigmoid,59,48.0,47.0,6.0,8.0,6.0,59.0,,,4.882117308820375,0.5053388194522332,2.084554960827748,20.0,23.0,54.0,29.0,COMPLETE
1410,0.5342234715390021,2024-04-11 16:14:04.647037,2024-04-11 16:14:05.300151,0 days 00:00:00.653114,98.27437779785647,0.4328715839289885,sigmoid,60,35.0,2.0,4.0,1.0,3.0,30.0,44.0,23.0,,,,,,,,COMPLETE
1411,0.36535632419856995,2024-04-11 16:14:05.301208,2024-04-11 16:14:05.920602,0 days 00:00:00.619394,95.14268419040553,0.8646308797029517,sigmoid,44,25.0,32.0,42.0,,,,3.0,43.0,,,,,,,,COMPLETE
1412,0.5784713722290222,2024-04-11 16:14:05.921604,2024-04-11 16:14:06.481580,0 days 00:00:00.559976,98.35705782660771,0.6687086847690287,sigmoid,2,,,,,,,,,9.91177623401632,8.130108329399324,1.1857968016594231,16.0,21.0,74.0,,COMPLETE
1413,0.4958427452299707,2024-04-11 16:14:06.483772,2024-04-11 16:14:07.197864,0 days 00:00:00.714092,93.28979369714895,0.12982331252675094,sigmoid,23,,,,2.0,5.0,81.0,47.0,18.0,4.558781265731449,8.50268659574903,9.45967273532605,5.0,49.0,99.0,191.0,COMPLETE
1414,0.5164701439301749,2024-04-11 16:14:07.198865,2024-04-11 16:14:07.875288,0 days 00:00:00.676423,96.50516785153776,0.9343169385405155,sigmoid,13,,35.0,16.0,,,,45.0,45.0,,,,,,,65.0,COMPLETE
1415,0.5863711449328822,2024-04-11 16:14:07.876291,2024-04-11 16:14:08.290977,0 days 00:00:00.414686,94.46260651197576,0.5838025695487083,sigmoid,0,,,,,,,,,,,,,,,,COMPLETE
1416,0.3530941801235505,2024-04-11 16:14:08.291976,2024-04-11 16:14:08.949587,0 days 00:00:00.657611,96.67929542627097,0.9496466484264035,sigmoid,7,,,,,,,28.0,11.0,5.768109082172286,5.367856508312114,2.3017349835217633,9.0,36.0,89.0,92.0,COMPLETE
1417,0.12158321707228854,2024-04-11 16:14:08.950595,2024-04-11 16:14:09.376312,0 days 00:00:00.425717,94.13935939043577,0.3272923938766795,sigmoid,0,,,,,,,,,,,,,,,,COMPLETE
1418,0.5500398391609688,2024-04-11 16:14:09.377674,2024-04-11 16:14:09.885852,0 days 00:00:00.508178,99.86621761399653,0.7679586606885627,sigmoid,36,19.0,,,,,,9.0,47.0,,,,,,,,COMPLETE
1419,0.34124941082629345,2024-04-11 16:14:09.886853,2024-04-11 16:14:10.620851,0 days 00:00:00.733998,95.87234200384843,1.1017406753883965,sigmoid,54,38.0,,,4.0,4.0,46.0,21.0,50.0,6.344784516186535,9.14651951151918,3.4127320383694917,2.0,37.0,64.0,,COMPLETE
1420,0.13026268441885572,2024-04-11 16:14:10.622999,2024-04-11 16:14:11.133179,0 days 00:00:00.510180,99.97454748002473,1.322263618397133,sigmoid,32,5.0,,,,,,,,,,,,,,,COMPLETE
1421,0.5333025996672747,2024-04-11 16:14:11.134179,2024-04-11 16:14:11.669943,0 days 00:00:00.535764,93.10135423541591,0.9638742073370947,sigmoid,40,16.0,10.0,12.0,,,,,,,,,,,,,COMPLETE
1422,0.5863711449328822,2024-04-11 16:14:11.670943,2024-04-11 16:14:12.085360,0 days 00:00:00.414417,97.98140136705777,0.6781082946903558,sigmoid,0,,,,,,,,,,,,,,,,COMPLETE
1423,0.537996258574101,2024-04-11 16:14:12.086368,2024-04-11 16:14:12.723839,0 days 00:00:00.637471,94.93450348493275,1.1061306933327053,sigmoid,56,42.0,14.0,9.0,5.0,6.0,6.0,,,,,,,,,,COMPLETE
1424,0.4869591211419177,2024-04-11 16:14:12.725832,2024-04-11 16:14:13.461842,0 days 00:00:00.736010,96.9937690350679,0.8408529588339524,sigmoid,61,49.0,42.0,21.0,2.0,1.0,18.0,17.0,19.0,,,,,,,72.0,COMPLETE
1425,0.5881014021858113,2024-04-11 16:14:13.462957,2024-04-11 16:14:13.930178,0 days 00:00:00.467221,91.93292277418226,1.2673768769838354,sigmoid,0,,,,,,,,,,,,,,,,COMPLETE
1426,0.39531420629405345,2024-04-11 16:14:13.931182,2024-04-11 16:14:15.661895,0 days 00:00:01.730713,98.23708247850779,0.5470710918143515,rbf,27,,16.0,38.0,3.0,3.0,62.0,,,7.819923604028473,7.802477648669868,7.580885479282413,6.0,30.0,79.0,18.0,COMPLETE
1427,0.5179662621568122,2024-04-11 16:14:15.662892,2024-04-11 16:14:16.143721,0 days 00:00:00.480829,19.748849026038638,1.4531990106401542,sigmoid,1,,,,,,,,,,,,,,,144.0,COMPLETE
1428,0.5457907413377837,2024-04-11 16:14:16.144722,2024-04-11 16:14:16.742513,0 days 00:00:00.597791,93.75177043704262,0.9897586952944902,sigmoid,12,,46.0,27.0,,,,34.0,13.0,,,,,,,,COMPLETE
1429,0.4404930130318731,2024-04-11 16:14:16.743515,2024-04-11 16:14:17.559731,0 days 00:00:00.816216,95.68784097725707,0.7608982363472916,sigmoid,30,,27.0,33.0,1.0,4.0,95.0,8.0,5.0,3.0879467745766918,5.049281473866666,3.0592012388265153,7.0,27.0,81.0,,COMPLETE
1430,0.45807598445361697,2024-04-11 16:14:17.560731,2024-04-11 16:14:18.047318,0 days 00:00:00.486587,92.1874801010652,1.9106026542483385,sigmoid,8,,11.0,24.0,,,,,,,,,,,,,COMPLETE
1431,0.439025103012946,2024-04-11 16:14:18.048318,2024-04-11 16:14:18.578088,0 days 00:00:00.529770,98.13428309453121,1.183303480462528,sigmoid,5,,,,,,,37.0,20.0,,,,,,,130.0,COMPLETE
1432,0.12158321707228854,2024-04-11 16:14:18.579089,2024-04-11 16:14:19.019583,0 days 00:00:00.440494,94.74912619567108,0.36261563037824274,sigmoid,0,,,,,,,,,,,,,,,,COMPLETE
1433,0.25049863638213865,2024-04-11 16:14:19.020583,2024-04-11 16:14:19.634761,0 days 00:00:00.614178,60.97926470752347,7.572800583682529,sigmoid,34,17.0,,,,,,,,2.472456525220205,8.280444461718053,8.412161965163644,3.0,38.0,50.0,,COMPLETE
1434,0.32010765090349863,2024-04-11 16:14:19.635819,2024-04-11 16:14:20.132793,0 days 00:00:00.496974,96.78568933581843,1.6416658742095236,sigmoid,33,22.0,,,,,,,,,,,,,,42.0,COMPLETE
1435,0.5871571537475874,2024-04-11 16:14:20.133794,2024-04-11 16:14:20.555417,0 days 00:00:00.421623,93.25511175329599,0.9243571896029995,sigmoid,0,,,,,,,,,,,,,,,,COMPLETE
1436,0.5881803882253297,2024-04-11 16:14:20.556574,2024-04-11 16:14:20.981409,0 days 00:00:00.424835,99.9612821910241,1.2257884630998677,sigmoid,0,,,,,,,,,,,,,,,,COMPLETE
1437,0.5034996410624551,2024-04-11 16:14:20.983403,2024-04-11 16:14:21.739877,0 days 00:00:00.756474,95.4441319545355,0.5633071422147891,sigmoid,51,4.0,,,8.0,5.0,51.0,,,9.082472469767648,4.253427635093559,4.000793200324749,5.0,46.0,97.0,150.0,COMPLETE
1438,0.44674683580633123,2024-04-11 16:14:21.742121,2024-04-11 16:14:22.194640,0 days 00:00:00.452519,98.23740116634738,3.7195178827491677,sigmoid,4,,,,,,,41.0,32.0,,,,,,,,COMPLETE
1439,0.49477478349218634,2024-04-11 16:14:22.196640,2024-04-11 16:14:22.983206,0 days 00:00:00.786566,91.55030235294815,1.451474821903508,sigmoid,19,,,,6.0,7.0,37.0,,,6.812368986269436,9.997656500500586,1.7939622083854574,15.0,34.0,94.0,117.0,COMPLETE
1440,0.413461839346622,2024-04-11 16:14:22.984315,2024-04-11 16:14:23.609192,0 days 00:00:00.624877,93.94342491627214,2.1898386827622502,sigmoid,53,41.0,,,3.0,2.0,70.0,48.0,37.0,,,,,,,51.0,COMPLETE
1441,0.5857799611637595,2024-04-11 16:14:23.611193,2024-04-11 16:14:24.061062,0 days 00:00:00.449869,96.57018001416908,1.0407946423450856,sigmoid,0,,,,,,,,,,,,,,,,COMPLETE
1442,0.16309399601631414,2024-04-11 16:14:24.062132,2024-04-11 16:14:24.642963,0 days 00:00:00.580831,91.4824142958939,0.7790694891223374,sigmoid,17,,,,4.0,8.0,20.0,,,,,,,,,58.0,COMPLETE
1443,0.5129537349739036,2024-04-11 16:14:24.644375,2024-04-11 16:14:25.418218,0 days 00:00:00.773843,93.8743302794992,1.3044828673280207,sigmoid,58,31.0,25.0,41.0,7.0,6.0,14.0,,,3.7763004984841158,7.031404922734413,6.065099843558386,13.0,32.0,73.0,,COMPLETE
1444,0.48833585300616345,2024-04-11 16:14:25.419419,2024-04-11 16:14:26.175912,0 days 00:00:00.756493,98.21929892574823,1.0315401415789551,sigmoid,50,9.0,,,1.0,5.0,76.0,,,1.7278294851760019,1.7398729209932755,5.11294402069626,19.0,24.0,91.0,,COMPLETE
1445,0.5873898933704218,2024-04-11 16:14:26.177119,2024-04-11 16:14:26.620515,0 days 00:00:00.443396,96.02421581303294,0.8263188691628929,sigmoid,0,,,,,,,,,,,,,,,,COMPLETE
1446,0.4092485907204361,2024-04-11 16:14:26.621524,2024-04-11 16:14:28.357786,0 days 00:00:01.736262,99.90172871057439,0.5620785837122391,rbf,47,43.0,37.0,13.0,,,,25.0,28.0,8.328146614932674,3.7138569807903687,1.3174912095627929,7.0,44.0,57.0,32.0,COMPLETE
1447,0.3943477854897445,2024-04-11 16:14:28.358787,2024-04-11 16:14:29.097895,0 days 00:00:00.739108,91.01777634465502,1.2185078795579614,sigmoid,45,36.0,29.0,45.0,,,,23.0,2.0,,,,,,,26.0,COMPLETE
1448,0.4602383207857606,2024-04-11 16:14:29.098895,2024-04-11 16:14:29.702457,0 days 00:00:00.603562,93.80351892698317,0.9702500526971054,sigmoid,49,45.0,,,2.0,7.0,93.0,,,,,,,,,170.0,COMPLETE
1449,0.4934793474803472,2024-04-11 16:14:29.703674,2024-04-11 16:14:30.340898,0 days 00:00:00.637224,96.77891014921863,0.15640030228187385,sigmoid,29,,9.0,29.0,5.0,4.0,4.0,31.0,30.0,,,,,,,160.0,COMPLETE
1450,0.2744387819567872,2024-04-11 16:14:30.341888,2024-04-11 16:14:31.014664,0 days 00:00:00.672776,95.13297069122025,1.4633352468119785,sigmoid,6,,,,,,,2.0,34.0,4.1955496515055,6.086124374129455,7.040470453286426,10.0,39.0,77.0,,COMPLETE
1451,0.5873898933704218,2024-04-11 16:14:31.016700,2024-04-11 16:14:31.474039,0 days 00:00:00.457339,98.29818854540417,0.7803426327264721,sigmoid,0,,,,,,,,,,,,,,,,COMPLETE
1452,0.3825725292332868,2024-04-11 16:14:31.475041,2024-04-11 16:14:32.087400,0 days 00:00:00.612359,92.72194332711655,1.1454679695089234,sigmoid,25,,20.0,49.0,6.0,3.0,86.0,,,,,,,,,179.0,COMPLETE
