number,value,datetime_start,datetime_complete,duration,params_C,params_aws_w1,params_aws_w2,params_gamma,params_kernel,params_kma_pow1,params_kma_pow2,params_kma_window,params_mask_number,params_ppo_wfast,params_ppo_wsign,params_ppo_wslow,params_roc_window,params_rsi_window,params_so_smooth,params_so_window,params_srsi_smooth1,params_srsi_smooth2,params_srsi_window,params_tsi_window_fast,params_tsi_window_slow,params_ult_weight_1,params_ult_weight_2,params_ult_weight_3,params_ult_window_1,params_ult_window_2,params_ult_window_3,params_williams_lbp,state
83,0.6274041292971444,2024-04-12 03:12:28.045193,2024-04-12 03:12:28.782638,0 days 00:00:00.737445,9.69647647940077,70.0,88.0,9.620537842002262,rbf,,,,683,11.0,26.0,47.0,,25.0,5.0,30.0,,,,,,2.401464362889479,8.784715218735013,9.424633823536766,16.0,34.0,100.0,99.0,COMPLETE
84,0.5803012227855652,2024-04-12 03:12:28.783633,2024-04-12 03:12:29.421687,0 days 00:00:00.638054,8.768889804699599,,,9.491458635313569,rbf,,,,244,12.0,26.0,50.0,37.0,11.0,,,6.0,6.0,74.0,46.0,23.0,,,,,,,,COMPLETE
85,0.5434482456332596,2024-04-12 03:12:29.424687,2024-04-12 03:12:30.131464,0 days 00:00:00.706777,10.30851939603986,72.0,85.0,3.6030057545713694,rbf,,,,662,16.0,31.0,45.0,,,,,3.0,7.0,36.0,39.0,12.0,2.4700375997554262,8.889676082280625,9.432184253465062,16.0,33.0,100.0,,COMPLETE
86,0.5610710050554435,2024-04-12 03:12:30.133461,2024-04-12 03:12:30.716850,0 days 00:00:00.583389,5.4777005575107705,,,9.792913395741255,rbf,17.0,12.0,13.0,273,,,,,,,,1.0,4.0,65.0,,,,,,,,,103.0,COMPLETE
87,0.6281559631435562,2024-04-12 03:12:30.718849,2024-04-12 03:12:31.424517,0 days 00:00:00.705668,17.296275250387332,,,9.498165615744385,rbf,24.0,4.0,12.0,467,10.0,36.0,41.0,46.0,,,,5.0,6.0,13.0,,,2.2228881174476007,8.282290965939161,8.045555929160024,15.0,37.0,98.0,85.0,COMPLETE
88,0.5725886074674083,2024-04-12 03:12:31.426641,2024-04-12 03:12:32.047008,0 days 00:00:00.620367,16.93621109035406,79.0,97.0,9.472007453259465,rbf,25.0,2.0,8.0,776,,,,,,12.0,27.0,,,,,,,,,,,,,COMPLETE
89,0.6223600600043824,2024-04-12 03:12:32.049174,2024-04-12 03:12:32.821872,0 days 00:00:00.772698,23.094219279399468,54.0,100.0,9.842251798452505,rbf,,,,683,10.0,36.0,42.0,,25.0,5.0,25.0,,,,,,2.1464433220681496,8.1692831369708,8.67053396747804,15.0,37.0,98.0,89.0,COMPLETE
90,0.62382601802547,2024-04-12 03:12:32.824883,2024-04-12 03:12:33.508227,0 days 00:00:00.683344,20.395719059622365,70.0,89.0,8.988380325003458,rbf,,,,675,3.0,28.0,47.0,,17.0,,,,,,,,1.7108194721724495,9.202209062930008,8.018888411313126,17.0,36.0,95.0,99.0,COMPLETE
91,0.5833363852774218,2024-04-12 03:12:33.509231,2024-04-12 03:12:34.128591,0 days 00:00:00.619360,33.7954392848489,,,9.268390727808125,rbf,,,,216,8.0,44.0,40.0,29.0,,9.0,30.0,5.0,6.0,18.0,,,,,,,,,,COMPLETE
92,0.5763304386550878,2024-04-12 03:12:34.132693,2024-04-12 03:12:34.971728,0 days 00:00:00.839035,28.382725227773932,,,9.560856045804156,rbf,,,,131,13.0,32.0,43.0,,,,,,,,,,1.1543045080410597,7.45018965535459,9.404354773647285,19.0,34.0,92.0,115.0,COMPLETE
93,0.6313706418018078,2024-04-12 03:12:34.973724,2024-04-12 03:12:35.811835,0 days 00:00:00.838111,25.8867214344268,,,9.997538933789466,rbf,15.0,5.0,12.0,511,6.0,35.0,3.0,40.0,20.0,14.0,36.0,6.0,7.0,14.0,44.0,5.0,0.7553822984596043,8.53365319456622,8.3798854859381,15.0,36.0,98.0,71.0,COMPLETE
94,0.619809139738219,2024-04-12 03:12:35.814826,2024-04-12 03:12:36.690641,0 days 00:00:00.875815,25.968821116301157,50.0,97.0,8.765458415741062,rbf,14.0,5.0,11.0,876,,,,47.0,19.0,14.0,37.0,,,,44.0,4.0,,,,,,,,COMPLETE
95,0.6167327753411732,2024-04-12 03:12:36.691783,2024-04-12 03:12:37.312391,0 days 00:00:00.620608,15.290768595116786,,,9.832117657480024,rbf,,,,173,6.0,36.0,5.0,,25.0,4.0,34.0,,,,48.0,7.0,,,,,,,72.0,COMPLETE
96,0.6240303395966212,2024-04-12 03:12:37.315524,2024-04-12 03:12:38.098970,0 days 00:00:00.783446,37.45419999797421,89.0,84.0,9.981771093057374,rbf,11.0,4.0,4.0,984,21.0,25.0,10.0,40.0,,7.0,30.0,6.0,8.0,9.0,,,,,,,,,,COMPLETE
97,0.622554444993104,2024-04-12 03:12:38.100535,2024-04-12 03:12:38.870953,0 days 00:00:00.770418,19.174674348447443,58.0,89.0,9.416998348143874,rbf,,,,583,,,,45.0,,,,,,,45.0,27.0,0.5291895239029318,8.686984284601136,8.34784723876819,15.0,38.0,98.0,87.0,COMPLETE
98,0.40799293307746204,2024-04-12 03:12:38.875158,2024-04-12 03:12:39.530438,0 days 00:00:00.655280,11.680857762964443,,,9.085999097272744,sigmoid,18.0,7.0,5.0,511,10.0,43.0,21.0,33.0,21.0,8.0,26.0,7.0,6.0,14.0,41.0,22.0,1.0975627956180478,8.117020101070725,8.894984086494315,17.0,36.0,96.0,82.0,COMPLETE
99,0.6062463254289226,2024-04-12 03:12:39.534608,2024-04-12 03:12:40.337340,0 days 00:00:00.802732,5.172676308378309,,,9.655437055195737,rbf,29.0,8.0,15.0,442,5.0,35.0,12.0,,27.0,4.0,33.0,5.0,7.0,30.0,,,0.6927488422409868,7.077173490231426,9.684066576135436,14.0,33.0,99.0,,COMPLETE
