number,value,datetime_start,datetime_complete,duration,params_C,params_gamma,params_kernel,params_mask_number,params_rsi_window,params_so_smooth,params_so_window,params_srsi_smooth1,params_srsi_smooth2,params_srsi_window,params_tsi_window_fast,params_tsi_window_slow,params_ult_weight_1,params_ult_weight_2,params_ult_weight_3,params_ult_window_1,params_ult_window_2,params_ult_window_3,params_williams_lbp,state
8777,0.42037536877785453,2024-04-11 19:04:45.061491,2024-04-11 19:04:47.568954,0 days 00:00:02.507463,95.293694514039,7.88987127586127,sigmoid,15,,25.0,32.0,,,,21.0,13.0,7.121920441942733,0.687349546944982,8.58142839579333,12.0,40.0,73.0,89.0,COMPLETE
8778,0.5002378633078858,2024-04-11 19:04:47.571950,2024-04-11 19:04:50.297111,0 days 00:00:02.725161,98.22114657581285,8.243698181875963,sigmoid,38,31.0,,,,,,48.0,17.0,8.274576452068835,5.756656362055684,9.426083760921129,19.0,33.0,78.0,,COMPLETE
8779,0.6009432182607054,2024-04-11 19:04:50.302087,2024-04-11 19:04:52.012182,0 days 00:00:01.710095,98.1671327920369,7.709622003404019,sigmoid,8,,24.0,31.0,,,,,,,,,,,,,COMPLETE
8780,0.5098976280906508,2024-04-11 19:04:52.016183,2024-04-11 19:04:54.651059,0 days 00:00:02.634876,96.70149924657514,8.073593447668252,sigmoid,57,3.0,28.0,30.0,3.0,8.0,68.0,,,,,,,,,21.0,COMPLETE
8781,0.5929369437606513,2024-04-11 19:04:54.656058,2024-04-11 19:04:56.567766,0 days 00:00:01.911708,98.2341899611428,8.44238967547886,sigmoid,8,,26.0,33.0,,,,,,,,,,,,,COMPLETE
8782,0.49938821045560317,2024-04-11 19:04:56.571759,2024-04-11 19:04:59.001763,0 days 00:00:02.430004,93.65156175418018,7.951472993198317,sigmoid,42,12.0,25.0,32.0,,,,,,9.814695297696147,9.49681176411936,5.579720920214919,16.0,42.0,97.0,,COMPLETE
8783,0.4442392650943175,2024-04-11 19:04:59.004760,2024-04-11 19:05:01.157315,0 days 00:00:02.152555,90.04072515364372,8.280413180245137,sigmoid,16,,,,7.0,7.0,46.0,,,,,,,,,,COMPLETE
8784,0.4774465840147718,2024-04-11 19:05:01.160309,2024-04-11 19:05:03.063068,0 days 00:00:01.902759,96.67119897735192,8.706183468564431,sigmoid,8,,24.0,40.0,,,,,,,,,,,,,COMPLETE
8785,0.4540726997151593,2024-04-11 19:05:03.067066,2024-04-11 19:05:05.624874,0 days 00:00:02.557808,98.14553081515159,7.794265287113622,sigmoid,28,,27.0,30.0,8.0,6.0,6.0,33.0,18.0,,,,,,,,COMPLETE
8786,0.5008559435311774,2024-04-11 19:05:05.629894,2024-04-11 19:05:07.840568,0 days 00:00:02.210674,95.51089965221335,6.610806426021031,sigmoid,14,,22.0,31.0,,,,2.0,38.0,3.166572425756859,7.115494063625464,7.486135436271633,6.0,38.0,84.0,,COMPLETE
8787,0.22764611091459339,2024-04-11 19:05:07.844096,2024-04-11 19:05:09.846795,0 days 00:00:02.002699,98.23090232648575,7.572260599066153,sigmoid,2,,,,,,,,,4.493151295546809,3.9337780901604438,3.5246209100390264,13.0,20.0,86.0,,COMPLETE
8788,0.4130364822562242,2024-04-11 19:05:09.850801,2024-04-11 19:05:12.866998,0 days 00:00:03.016197,96.7376032572293,8.120538172275854,sigmoid,63,50.0,30.0,29.0,1.0,2.0,18.0,19.0,21.0,3.4506677206785503,4.87786252791666,8.086600185747859,20.0,46.0,91.0,49.0,COMPLETE
8789,0.5931679318644695,2024-04-11 19:05:12.869994,2024-04-11 19:05:14.818186,0 days 00:00:01.948192,99.96273267925177,8.351390029003296,sigmoid,8,,23.0,27.0,,,,,,,,,,,,,COMPLETE
8790,0.49779000098222176,2024-04-11 19:05:14.821181,2024-04-11 19:05:17.734073,0 days 00:00:02.912892,94.13101010404876,6.331466660375946,sigmoid,46,10.0,26.0,32.0,,,,12.0,33.0,6.195325557260565,8.697368100824999,1.5831989737846648,14.0,22.0,75.0,,COMPLETE
8791,0.6009432182607054,2024-04-11 19:05:17.736073,2024-04-11 19:05:19.652449,0 days 00:00:01.916376,96.60472554606305,7.9946756609262675,sigmoid,8,,24.0,31.0,,,,,,,,,,,,,COMPLETE
8792,0.45022721836881124,2024-04-11 19:05:19.655446,2024-04-11 19:05:21.442573,0 days 00:00:01.787127,91.51421196471043,8.478345271720617,sigmoid,8,,25.0,28.0,,,,,,,,,,,,,COMPLETE
8793,0.34952795487984306,2024-04-11 19:05:21.445573,2024-04-11 19:05:24.560508,0 days 00:00:03.114935,99.95382579596897,7.758225956232657,sigmoid,26,,27.0,33.0,5.0,6.0,34.0,,,9.98841104837936,3.4262102902844953,7.0410461177118,15.0,41.0,69.0,,COMPLETE
8794,0.4198005367615387,2024-04-11 19:05:24.565509,2024-04-11 19:05:27.597795,0 days 00:00:03.032286,98.13297513205607,8.166539820864655,rbf,10,,29.0,30.0,,,,,,4.72607270768017,0.912173242011165,3.9623765390324754,9.0,31.0,93.0,,COMPLETE
8795,0.5883953883953884,2024-04-11 19:05:27.602788,2024-04-11 19:05:29.707432,0 days 00:00:02.104644,72.36173145697651,7.447857620959349,sigmoid,8,,12.0,34.0,,,,,,,,,,,,,COMPLETE
8796,0.12622036262203626,2024-04-11 19:05:29.710426,2024-04-11 19:05:31.624766,0 days 00:00:01.914340,95.33529069004089,7.972775304737057,sigmoid,8,,26.0,29.0,,,,,,,,,,,,,COMPLETE
8797,0.35082208260927683,2024-04-11 19:05:31.627762,2024-04-11 19:05:34.055064,0 days 00:00:02.427302,96.72943422891503,8.989335636429171,sigmoid,11,,25.0,32.0,,,,,,1.2518647230114075,6.232936644283756,4.830070963243439,16.0,29.0,67.0,35.0,COMPLETE
8798,0.4346681326312134,2024-04-11 19:05:34.058075,2024-04-11 19:05:37.222746,0 days 00:00:03.164671,99.99500728849665,8.18233173515966,sigmoid,62,26.0,24.0,31.0,2.0,4.0,27.0,45.0,31.0,1.4372212873762296,1.4120950585396175,1.3151462278931851,10.0,24.0,89.0,,COMPLETE
8799,0.3652193408564382,2024-04-11 19:05:37.225746,2024-04-11 19:05:39.287001,0 days 00:00:02.061255,99.96298739623158,8.549235275108087,sigmoid,41,39.0,28.0,30.0,,,,,,,,,,,,97.0,COMPLETE
8800,0.38129344849378555,2024-04-11 19:05:39.288995,2024-04-11 19:05:41.463845,0 days 00:00:02.174850,98.3201579333594,7.695590638277749,sigmoid,56,8.0,23.0,31.0,4.0,5.0,24.0,,,,,,,,,,COMPLETE
8801,0.43050322028915794,2024-04-11 19:05:41.467839,2024-04-11 19:05:43.812206,0 days 00:00:02.344367,29.325740553936395,7.955721683543712,sigmoid,20,,,,1.0,7.0,53.0,8.0,9.0,,,,,,,,COMPLETE
8802,0.5389883864380822,2024-04-11 19:05:43.815204,2024-04-11 19:05:46.060525,0 days 00:00:02.245321,93.85980679771967,8.33058584331067,sigmoid,37,13.0,,,,,,29.0,44.0,,,,,,,172.0,COMPLETE
8803,0.5952371952371952,2024-04-11 19:05:46.063537,2024-04-11 19:05:48.127758,0 days 00:00:02.064221,99.99147255174636,8.129378433271329,sigmoid,8,,26.0,32.0,,,,,,,,,,,,,COMPLETE
8804,0.5227155172413793,2024-04-11 19:05:48.130765,2024-04-11 19:05:50.405903,0 days 00:00:02.275138,98.13749554434078,7.81593296801566,sigmoid,13,,20.0,34.0,,,,24.0,48.0,,,,,,,104.0,COMPLETE
8805,0.12622036262203626,2024-04-11 19:05:50.410913,2024-04-11 19:05:52.530315,0 days 00:00:02.119402,96.63857074101071,8.345832501338744,sigmoid,8,,25.0,29.0,,,,,,,,,,,,,COMPLETE
8806,0.5630068505832254,2024-04-11 19:05:52.534317,2024-04-11 19:05:54.821531,0 days 00:00:02.287214,95.2434415597696,7.626432593315382,sigmoid,48,43.0,,,6.0,8.0,14.0,,,,,,,,,,COMPLETE
8807,0.5929369437606513,2024-04-11 19:05:54.824536,2024-04-11 19:05:56.687370,0 days 00:00:01.862834,98.17867365639363,8.053903015701716,sigmoid,8,,27.0,33.0,,,,,,,,,,,,,COMPLETE
8808,0.4931546948885386,2024-04-11 19:05:56.690366,2024-04-11 19:05:59.211403,0 days 00:00:02.521037,92.17084946474039,8.75103424995943,sigmoid,44,27.0,23.0,30.0,,,,5.0,4.0,,,,,,,,COMPLETE
8809,0.5964036904537752,2024-04-11 19:05:59.215407,2024-04-11 19:06:01.162970,0 days 00:00:01.947563,96.47591872100706,7.322070093956261,sigmoid,8,,26.0,31.0,,,,,,,,,,,,,COMPLETE
8810,0.4853460036693795,2024-04-11 19:06:01.168481,2024-04-11 19:06:03.598459,0 days 00:00:02.429978,98.08942971803461,7.867325000656922,sigmoid,52,44.0,,,3.0,3.0,86.0,17.0,5.0,,,,,,,,COMPLETE
8811,0.45564152843287936,2024-04-11 19:06:03.602441,2024-04-11 19:06:06.741545,0 days 00:00:03.139104,95.27677601071278,8.225658822190487,sigmoid,54,36.0,,,7.0,1.0,57.0,6.0,24.0,0.9449778325201956,4.573547763638683,2.703041387437234,14.0,48.0,63.0,,COMPLETE
8812,0.39376359680928213,2024-04-11 19:06:06.746539,2024-04-11 19:06:10.034380,0 days 00:00:03.287841,98.28333296133307,8.53331877425568,sigmoid,55,29.0,,,8.0,5.0,20.0,18.0,32.0,1.7118970755475273,6.578038651576768,8.40312388626177,5.0,37.0,54.0,134.0,COMPLETE
8813,0.18532739466543796,2024-04-11 19:06:10.039380,2024-04-11 19:06:12.477290,0 days 00:00:02.437910,98.17085470510153,7.9549467588084175,rbf,7,,,,,,,25.0,27.0,7.602212496217759,5.136114461493359,8.821527874455363,4.0,27.0,92.0,179.0,COMPLETE
8814,0.44422949210290763,2024-04-11 19:06:12.480286,2024-04-11 19:06:15.785090,0 days 00:00:03.304804,93.5775403373336,8.120512581478385,sigmoid,23,,,,4.0,4.0,90.0,41.0,6.0,6.9263304254841325,2.9103085380923552,2.3762464101497494,8.0,40.0,57.0,67.0,COMPLETE
8815,0.4373913299737719,2024-04-11 19:06:15.790083,2024-04-11 19:06:19.285512,0 days 00:00:03.495429,96.82795027005056,7.507669780494728,sigmoid,59,48.0,24.0,25.0,5.0,3.0,98.0,,,4.9182260466119025,4.259745148647922,2.955713118037988,7.0,35.0,80.0,54.0,COMPLETE
8816,0.496136487157069,2024-04-11 19:06:19.289505,2024-04-11 19:06:21.052709,0 days 00:00:01.763204,96.58674649158029,8.371138680513262,sigmoid,1,,,,,,,,,,,,,,,123.0,COMPLETE
8817,0.5411924173261307,2024-04-11 19:06:21.055701,2024-04-11 19:06:23.593736,0 days 00:00:02.538035,94.93365080553656,7.783060851885534,sigmoid,12,,28.0,32.0,,,,26.0,29.0,,,,,,,,COMPLETE
8818,0.42215112280596834,2024-04-11 19:06:23.599734,2024-04-11 19:06:25.923522,0 days 00:00:02.323788,98.20750170003195,8.207557676555012,sigmoid,36,46.0,,,,,,37.0,36.0,,,,,,,,COMPLETE
8819,0.586650796557407,2024-04-11 19:06:25.927523,2024-04-11 19:06:27.704889,0 days 00:00:01.777366,98.32438456835038,7.975549331708272,sigmoid,32,34.0,,,,,,,,,,,,,,,COMPLETE
8820,0.1286120322122217,2024-04-11 19:06:27.707886,2024-04-11 19:06:29.928788,0 days 00:00:02.220902,57.253846068716456,5.708334396096939,sigmoid,8,,22.0,29.0,,,,,,,,,,,,,COMPLETE
8821,0.4662924395270637,2024-04-11 19:06:29.931788,2024-04-11 19:06:32.604312,0 days 00:00:02.672524,98.2959520138091,8.440899266295808,sigmoid,60,17.0,25.0,31.0,6.0,1.0,79.0,15.0,19.0,,,,,,,,COMPLETE
8822,0.4389166836838881,2024-04-11 19:06:32.608305,2024-04-11 19:06:35.023062,0 days 00:00:02.414757,95.6675087529806,7.735442634510468,sigmoid,61,25.0,27.0,32.0,1.0,8.0,75.0,38.0,22.0,,,,,,,112.0,COMPLETE
8823,0.5202666111226828,2024-04-11 19:06:35.030062,2024-04-11 19:06:36.896296,0 days 00:00:01.866234,93.69698087104825,8.65800624913832,sigmoid,40,20.0,25.0,27.0,,,,,,,,,,,,,COMPLETE
8824,0.41839302434456926,2024-04-11 19:06:36.899289,2024-04-11 19:06:40.083699,0 days 00:00:03.184410,98.26226461144529,8.14308959160075,sigmoid,27,,26.0,30.0,2.0,4.0,49.0,,,2.9815648205280354,7.835906936673315,6.315644214754739,2.0,25.0,68.0,155.0,COMPLETE
8825,0.5335324839756271,2024-04-11 19:06:40.087208,2024-04-11 19:06:42.076160,0 days 00:00:01.988952,89.12871832401079,7.891820661244176,sigmoid,8,,23.0,48.0,,,,,,,,,,,,,COMPLETE
8826,0.5929369437606513,2024-04-11 19:06:42.081152,2024-04-11 19:06:43.989370,0 days 00:00:01.908218,98.25025828755496,7.544738402915734,sigmoid,8,,24.0,33.0,,,,,,,,,,,,,COMPLETE
8827,0.35612395474667974,2024-04-11 19:06:43.991901,2024-04-11 19:06:46.919138,0 days 00:00:02.927237,96.33051417106205,9.580584587731481,sigmoid,30,,26.0,31.0,3.0,2.0,12.0,43.0,34.0,9.513571323778596,3.6910785629544964,5.941000607137325,3.0,33.0,87.0,,COMPLETE
8828,0.19345047240391602,2024-04-11 19:06:46.922135,2024-04-11 19:06:48.819333,0 days 00:00:01.897198,96.5920908517448,8.312939945414001,sigmoid,4,,,,,,,10.0,25.0,,,,,,,,COMPLETE
8829,0.44701971028259324,2024-04-11 19:06:48.824319,2024-04-11 19:06:50.750197,0 days 00:00:01.925878,99.99522503524994,8.034264333338543,sigmoid,8,,25.0,30.0,,,,,,,,,,,,,COMPLETE
8830,0.5432569458527683,2024-04-11 19:06:50.755194,2024-04-11 19:06:52.422198,0 days 00:00:01.667004,99.94863596397487,7.805573062609659,sigmoid,5,,,,,,,30.0,10.0,,,,,,,13.0,COMPLETE
8831,0.5963643249384587,2024-04-11 19:06:52.425194,2024-04-11 19:06:53.962771,0 days 00:00:01.537577,99.95300901945885,8.25209901490626,sigmoid,8,,24.0,32.0,,,,,,,,,,,,,COMPLETE
8832,0.21811271783463107,2024-04-11 19:06:53.965769,2024-04-11 19:06:56.853424,0 days 00:00:02.887655,95.07111911974441,7.233845312936518,rbf,45,14.0,27.0,29.0,,,,32.0,37.0,,,,,,,141.0,COMPLETE
8833,0.6009432182607054,2024-04-11 19:06:56.856424,2024-04-11 19:06:58.935797,0 days 00:00:02.079373,99.94970793105223,8.045641906636313,sigmoid,8,,26.0,31.0,,,,,,,,,,,,,COMPLETE
8834,0.4196368715083799,2024-04-11 19:06:58.940787,2024-04-11 19:07:01.759270,0 days 00:00:02.818483,98.28491463750946,7.662840955326791,sigmoid,18,,,,6.0,7.0,39.0,,,8.067139216280662,2.2471677642159187,5.184344889693262,11.0,39.0,100.0,,COMPLETE
8835,0.5963643249384587,2024-04-11 19:07:01.764280,2024-04-11 19:07:03.776224,0 days 00:00:02.011944,93.0894748100237,8.51903215840661,sigmoid,8,,30.0,32.0,,,,,,,,,,,,,COMPLETE
8836,0.49632791263293435,2024-04-11 19:07:03.780238,2024-04-11 19:07:06.260660,0 days 00:00:02.480422,5.8823006161891485,7.915987646329431,sigmoid,49,38.0,,,7.0,6.0,60.0,,,,,,,,,43.0,COMPLETE
8837,0.4695815680487457,2024-04-11 19:07:06.263661,2024-04-11 19:07:08.465210,0 days 00:00:02.201549,96.58296557396115,8.322487245229535,sigmoid,17,,,,4.0,6.0,93.0,,,,,,,,,18.0,COMPLETE
8838,0.3288746279042796,2024-04-11 19:07:08.469208,2024-04-11 19:07:10.958699,0 days 00:00:02.489491,99.9803750013881,8.229943331982163,sigmoid,34,22.0,,,,,,,,8.686782237309401,1.7203596194048711,7.336959750961364,19.0,50.0,55.0,,COMPLETE
8839,0.12003789673140693,2024-04-11 19:07:10.962692,2024-04-11 19:07:13.160626,0 days 00:00:02.197934,96.73582599716197,8.080735917396371,sigmoid,8,,28.0,28.0,,,,,,,,,,,,,COMPLETE
8840,0.3175912790263571,2024-04-11 19:07:13.163626,2024-04-11 19:07:15.216065,0 days 00:00:02.052439,98.2697373067432,8.592695422213524,sigmoid,33,24.0,,,,,,,,,,,,,,60.0,COMPLETE
8841,0.4280291244010206,2024-04-11 19:07:15.220055,2024-04-11 19:07:18.181559,0 days 00:00:02.961504,94.5678610000991,7.652102632516857,sigmoid,50,40.0,,,5.0,8.0,67.0,,,2.3183580257756873,8.187016807992356,3.2402325849445037,17.0,49.0,62.0,,COMPLETE
8842,0.5349753694581281,2024-04-11 19:07:18.185179,2024-04-11 19:07:20.541848,0 days 00:00:02.356669,99.99619941268176,7.902750882260058,sigmoid,6,,,,,,,14.0,42.0,5.848317375390418,6.966195801146658,9.784556657438308,8.0,45.0,65.0,,COMPLETE
8843,0.4848136987611805,2024-04-11 19:07:20.547849,2024-04-11 19:07:23.585781,0 days 00:00:03.037932,96.65782163283653,7.414113405687534,sigmoid,51,4.0,,,8.0,3.0,63.0,,,3.660667062795801,3.197959332471597,5.744733198637588,13.0,38.0,77.0,193.0,COMPLETE
8844,0.4844776904141672,2024-04-11 19:07:23.588794,2024-04-11 19:07:26.166694,0 days 00:00:02.577900,99.99258363884361,8.41973382431782,sigmoid,53,2.0,,,2.0,2.0,35.0,23.0,40.0,,,,,,,73.0,COMPLETE
8845,0.42332666564086785,2024-04-11 19:07:26.169694,2024-04-11 19:07:28.772751,0 days 00:00:02.603057,91.78511643414963,8.780749563357757,sigmoid,29,,24.0,36.0,3.0,4.0,77.0,49.0,15.0,,,,,,,120.0,COMPLETE
8846,0.5895095625828441,2024-04-11 19:07:28.775751,2024-04-11 19:07:30.644012,0 days 00:00:01.868261,98.30099994143642,8.075363680354045,sigmoid,8,,25.0,34.0,,,,,,,,,,,,,COMPLETE
8847,0.4026891081447088,2024-04-11 19:07:30.649003,2024-04-11 19:07:33.584366,0 days 00:00:02.935363,42.014499958088294,7.827286905699198,sigmoid,43,28.0,29.0,30.0,,,,,,3.9262147282250845,6.4039546537499605,8.67412353497966,16.0,30.0,53.0,162.0,COMPLETE
8848,0.48033447662919665,2024-04-11 19:07:33.589367,2024-04-11 19:07:36.989419,0 days 00:00:03.400052,95.28977726251452,8.194774126436949,sigmoid,47,30.0,23.0,15.0,,,,36.0,49.0,7.372894498476462,9.05165344712598,0.8173646898192635,10.0,36.0,50.0,78.0,COMPLETE
8849,0.6009432182607054,2024-04-11 19:07:36.992419,2024-04-11 19:07:38.641117,0 days 00:00:01.648698,98.16561506114523,7.648876447721502,sigmoid,8,,27.0,31.0,,,,,,,,,,,,,COMPLETE
8850,0.4032410657063509,2024-04-11 19:07:38.644115,2024-04-11 19:07:41.644327,0 days 00:00:03.000212,96.40265067748365,9.146398246270616,sigmoid,39,33.0,,,,,,20.0,16.0,2.6749338008556047,5.568431730686452,4.162924893603615,9.0,32.0,52.0,26.0,COMPLETE
8851,0.395614903862573,2024-04-11 19:07:41.649319,2024-04-11 19:07:45.000645,0 days 00:00:03.351326,98.17559910410795,2.4145465532517822,rbf,19,,,,8.0,5.0,45.0,,,5.2741713396161085,4.71323928183155,7.855089821426927,12.0,28.0,70.0,94.0,COMPLETE
8852,0.5929369437606513,2024-04-11 19:07:45.002645,2024-04-11 19:07:47.210576,0 days 00:00:02.207931,93.35470237967473,8.391557130001043,sigmoid,8,,24.0,33.0,,,,,,,,,,,,,COMPLETE
8853,0.49459478894508496,2024-04-11 19:07:47.213575,2024-04-11 19:07:50.548889,0 days 00:00:03.335314,99.93846850051918,8.02045076060119,sigmoid,58,7.0,25.0,30.0,7.0,7.0,54.0,,,3.330839347929727,7.440200410044103,4.740810220018583,18.0,21.0,74.0,,COMPLETE
8854,0.4338399520618838,2024-04-11 19:07:50.551881,2024-04-11 19:07:53.012439,0 days 00:00:02.460558,96.49340795587372,8.175179979018813,sigmoid,24,,22.0,33.0,5.0,1.0,84.0,,,,,,,,,,COMPLETE
8855,0.5038247418299265,2024-04-11 19:07:53.014434,2024-04-11 19:07:55.494136,0 days 00:00:02.479702,98.15906223054142,7.911795125672436,sigmoid,38,42.0,,,,,,50.0,39.0,7.801383001937785,6.777360840124058,6.6083158572117355,6.0,44.0,61.0,,COMPLETE
8856,0.4741211965292233,2024-04-11 19:07:55.498137,2024-04-11 19:07:58.485876,0 days 00:00:02.987739,95.12474212474649,7.791206749683681,sigmoid,22,,,,1.0,2.0,70.0,13.0,8.0,6.364158698890899,9.42435012338564,9.068912939230792,7.0,47.0,98.0,,COMPLETE
8857,0.4674252109434927,2024-04-11 19:07:58.489874,2024-04-11 19:08:00.816089,0 days 00:00:02.326215,99.96572983875895,8.44957716253526,sigmoid,25,,26.0,29.0,6.0,3.0,9.0,,,,,,,,,23.0,COMPLETE
8858,0.5116284414211518,2024-04-11 19:08:00.821088,2024-04-11 19:08:03.213720,0 days 00:00:02.392632,96.89658003390278,8.232250391295795,sigmoid,35,35.0,,,,,,,,0.7641960450088838,4.4566626579005515,1.961610318448452,3.0,23.0,76.0,167.0,COMPLETE
8859,0.5952371952371952,2024-04-11 19:08:03.216721,2024-04-11 19:08:05.143079,0 days 00:00:01.926358,98.25495549941827,7.556535697505758,sigmoid,8,,27.0,32.0,,,,,,,,,,,,,COMPLETE
8860,0.6009432182607054,2024-04-11 19:08:05.146078,2024-04-11 19:08:07.089215,0 days 00:00:01.943137,94.41211947321636,8.007058761841957,sigmoid,8,,25.0,31.0,,,,,,,,,,,,,COMPLETE
8861,0.4943061781831298,2024-04-11 19:08:07.094205,2024-04-11 19:08:10.741510,0 days 00:00:03.647305,96.69796510052726,8.667998504528793,sigmoid,31,,26.0,35.0,3.0,5.0,25.0,22.0,46.0,2.0132703024211955,9.734623088697637,4.479060362831445,14.0,34.0,88.0,187.0,COMPLETE
8862,0.4939276231684532,2024-04-11 19:08:10.745511,2024-04-11 19:08:13.978984,0 days 00:00:03.233473,99.96931753934254,7.773609589761658,sigmoid,15,,23.0,30.0,,,,28.0,28.0,6.565103444738382,5.864014405000247,6.823434688860713,20.0,25.0,59.0,146.0,COMPLETE
8863,0.12003789673140693,2024-04-11 19:08:13.982978,2024-04-11 19:08:16.180540,0 days 00:00:02.197562,96.64087544213254,8.095328749241071,sigmoid,8,,28.0,28.0,,,,,,,,,,,,,COMPLETE
8864,0.5611209045042855,2024-04-11 19:08:16.183541,2024-04-11 19:08:17.853282,0 days 00:00:01.669741,32.29012644287421,8.336774469461787,sigmoid,0,,,,,,,,,,,,,,,,COMPLETE
8865,0.44260224646638363,2024-04-11 19:08:17.857278,2024-04-11 19:08:20.489525,0 days 00:00:02.632247,98.19067697725302,7.324460629525119,sigmoid,28,,24.0,32.0,4.0,8.0,96.0,34.0,3.0,,,,,,,,COMPLETE
8866,0.5368591571790367,2024-04-11 19:08:20.492513,2024-04-11 19:08:22.787109,0 days 00:00:02.294596,67.89803207963269,7.922375258406777,sigmoid,9,,25.0,31.0,,,,,,,,,,,,46.0,COMPLETE
8867,0.4357114915896849,2024-04-11 19:08:22.791110,2024-04-11 19:08:25.088016,0 days 00:00:02.296906,92.36337116281273,8.899042611933357,sigmoid,21,,,,2.0,7.0,22.0,45.0,41.0,,,,,,,200.0,COMPLETE
8868,0.3487720281680272,2024-04-11 19:08:25.092016,2024-04-11 19:08:27.695391,0 days 00:00:02.603375,94.61625286220789,8.495041636146274,sigmoid,42,11.0,26.0,31.0,,,,,,8.367783947297006,4.121808369324355,3.7378714986375154,4.0,43.0,85.0,,COMPLETE
8869,0.45510451378370187,2024-04-11 19:08:27.698390,2024-04-11 19:08:30.431669,0 days 00:00:02.733279,98.22871935685555,8.177707488759536,rbf,8,,21.0,29.0,,,,,,,,,,,,,COMPLETE
8870,0.5931111524855706,2024-04-11 19:08:30.434672,2024-04-11 19:08:32.529572,0 days 00:00:02.094900,96.67479995597907,7.630913443541052,sigmoid,8,,27.0,26.0,,,,,,,,,,,,,COMPLETE
8871,0.3717685388483603,2024-04-11 19:08:32.532574,2024-04-11 19:08:35.061917,0 days 00:00:02.529343,98.1362072822635,7.956345795967881,sigmoid,3,,,,,,,,,9.011245450511389,1.021252069876561,3.4140375222271166,15.0,26.0,96.0,115.0,COMPLETE
8872,0.49272051138711326,2024-04-11 19:08:35.066917,2024-04-11 19:08:38.089560,0 days 00:00:03.022643,98.23708647343851,8.296935934872765,sigmoid,46,21.0,24.0,33.0,,,,31.0,12.0,4.099096140919475,9.998438526511354,7.61681568867526,17.0,42.0,72.0,,COMPLETE
8873,0.46192136648473825,2024-04-11 19:08:38.094553,2024-04-11 19:08:40.883238,0 days 00:00:02.788685,95.49869904851325,7.081021031766754,sigmoid,57,23.0,25.0,30.0,5.0,6.0,73.0,,,,,,,,,130.0,COMPLETE
8874,0.41541342030561096,2024-04-11 19:08:40.886237,2024-04-11 19:08:42.960775,0 days 00:00:02.074538,93.8183728379457,8.105190929925149,sigmoid,16,,,,1.0,4.0,88.0,,,,,,,,,,COMPLETE
8875,0.2548228758418629,2024-04-11 19:08:42.963764,2024-04-11 19:08:45.448120,0 days 00:00:02.484356,98.19182103962157,7.756043100001472,sigmoid,2,,,,,,,,,5.539571678496978,2.494923060948266,1.486066751172665,12.0,37.0,90.0,,COMPLETE
8876,0.5963643249384587,2024-04-11 19:08:45.453639,2024-04-11 19:08:47.617608,0 days 00:00:02.163969,80.24053872901378,8.551146924734477,sigmoid,8,,23.0,32.0,,,,,,,,,,,,,COMPLETE
8877,0.5348085793848181,2024-04-11 19:08:47.621600,2024-04-11 19:08:50.541837,0 days 00:00:02.920237,98.2247614642532,7.482866845092191,sigmoid,10,,26.0,30.0,,,,,,7.228145364790745,8.785124062746778,9.54345056499131,5.0,35.0,81.0,,COMPLETE
8878,0.44973439195750275,2024-04-11 19:08:50.546838,2024-04-11 19:08:54.082665,0 days 00:00:03.535827,96.41148035038746,8.284112689379047,sigmoid,63,45.0,27.0,31.0,7.0,1.0,81.0,9.0,35.0,9.669605635559499,7.586997667896383,8.206492084578837,11.0,31.0,64.0,107.0,COMPLETE
