number,value,datetime_start,datetime_complete,duration,params_C,params_gamma,params_kernel,params_mask_number,params_rsi_window,params_so_smooth,params_so_window,params_srsi_smooth1,params_srsi_smooth2,params_srsi_window,params_tsi_window_fast,params_tsi_window_slow,params_ult_weight_1,params_ult_weight_2,params_ult_weight_3,params_ult_window_1,params_ult_window_2,params_ult_window_3,params_williams_lbp,state
3638,0.28333467126916595,2024-04-11 16:50:18.173226,2024-04-11 16:50:19.026155,0 days 00:00:00.852929,94.8378336717852,7.931279798706912,sigmoid,5,,,,,,,49.0,35.0,,,,,,,183.0,COMPLETE
3639,0.3901740613236382,2024-04-11 16:50:19.034514,2024-04-11 16:50:20.115935,0 days 00:00:01.081421,98.28695648421514,7.617018418132122,sigmoid,45,17.0,24.0,30.0,,,,7.0,17.0,,,,,,,99.0,COMPLETE
3640,0.5963643249384587,2024-04-11 16:50:20.115935,2024-04-11 16:50:20.996882,0 days 00:00:00.880947,96.7807585840961,8.204203399442113,sigmoid,8,,26.0,32.0,,,,,,,,,,,,,COMPLETE
3641,0.5050977807075369,2024-04-11 16:50:21.000725,2024-04-11 16:50:21.963384,0 days 00:00:00.962659,98.17637259373126,7.830416251888497,sigmoid,40,8.0,25.0,29.0,,,,,,,,,,,,,COMPLETE
3642,0.18028669178467802,2024-04-11 16:50:21.963384,2024-04-11 16:50:22.783278,0 days 00:00:00.819894,93.62467521095616,8.51525992276437,sigmoid,4,,,,,,,10.0,27.0,,,,,,,,COMPLETE
3643,0.5284210000998103,2024-04-11 16:50:22.783278,2024-04-11 16:50:23.711755,0 days 00:00:00.928477,41.39617946338825,8.802462871421728,sigmoid,17,,,,4.0,3.0,22.0,,,,,,,,,149.0,COMPLETE
3644,0.4728561995808573,2024-04-11 16:50:23.712625,2024-04-11 16:50:25.085826,0 days 00:00:01.373201,96.56129018593299,8.029956990387289,sigmoid,30,,20.0,34.0,7.0,7.0,100.0,14.0,29.0,5.997527448313903,4.632867790753336,7.794606810007753,13.0,28.0,78.0,,COMPLETE
3645,0.3919688157406261,2024-04-11 16:50:25.085826,2024-04-11 16:50:26.239050,0 days 00:00:01.153224,98.30169349976691,7.547226856477068,sigmoid,53,22.0,,,1.0,1.0,26.0,42.0,33.0,,,,,,,15.0,COMPLETE
3646,0.5963245096172158,2024-04-11 16:50:26.239050,2024-04-11 16:50:27.109684,0 days 00:00:00.870634,46.4882634064527,8.357529393113936,sigmoid,8,,22.0,31.0,,,,,,,,,,,,,COMPLETE
3647,0.45497364310816096,2024-04-11 16:50:27.109684,2024-04-11 16:50:28.119718,0 days 00:00:01.010034,95.20979033298117,8.144702271971436,sigmoid,49,25.0,,,3.0,4.0,73.0,,,,,,,,,136.0,COMPLETE
3648,0.28838876717785294,2024-04-11 16:50:28.119718,2024-04-11 16:50:28.965498,0 days 00:00:00.845780,99.99499343511978,7.289688598115749,sigmoid,33,4.0,,,,,,,,,,,,,,64.0,COMPLETE
3649,0.5952371952371952,2024-04-11 16:50:28.965498,2024-04-11 16:50:29.834738,0 days 00:00:00.869240,59.02278119966201,7.807149864500978,sigmoid,8,,28.0,32.0,,,,,,,,,,,,,COMPLETE
3650,0.3622220070365708,2024-04-11 16:50:29.834738,2024-04-11 16:50:31.068641,0 days 00:00:01.233903,99.97323886609114,7.987445322233158,sigmoid,19,,,,5.0,2.0,29.0,,,7.592852263412722,8.068116523595563,5.098989052360601,7.0,47.0,85.0,92.0,COMPLETE
3651,0.45345352376492626,2024-04-11 16:50:31.068641,2024-04-11 16:50:31.959676,0 days 00:00:00.891035,98.17773736122909,8.284707530809575,sigmoid,8,,23.0,30.0,,,,,,,,,,,,,COMPLETE
3652,0.47835996411512255,2024-04-11 16:50:31.959676,2024-04-11 16:50:33.302001,0 days 00:00:01.342325,99.99954729554877,8.56855386342863,sigmoid,58,44.0,25.0,33.0,8.0,3.0,43.0,,,9.204519935552522,5.509613450713266,1.8717929704836331,17.0,26.0,82.0,,COMPLETE
3653,0.6009432182607054,2024-04-11 16:50:33.302001,2024-04-11 16:50:34.162285,0 days 00:00:00.860284,96.53909541821912,7.719744582744572,sigmoid,8,,27.0,31.0,,,,,,,,,,,,,COMPLETE
3654,0.41713273938337875,2024-04-11 16:50:34.162285,2024-04-11 16:50:35.485809,0 days 00:00:01.323524,96.37888691816276,7.9992160184431125,sigmoid,47,14.0,24.0,35.0,,,,22.0,7.0,9.856031556419232,8.767829643581038,4.643086353521287,11.0,44.0,97.0,40.0,COMPLETE
3655,0.1272235739389024,2024-04-11 16:50:35.485809,2024-04-11 16:50:37.003704,0 days 00:00:01.517895,99.98523256617591,8.198175107822877,rbf,29,,26.0,29.0,2.0,5.0,77.0,35.0,45.0,,,,,,,106.0,COMPLETE
3656,0.5449190627863344,2024-04-11 16:50:37.003704,2024-04-11 16:50:38.219429,0 days 00:00:01.215725,92.94640626095767,7.8441640450525245,sigmoid,18,,,,6.0,8.0,58.0,,,6.465721875636438,2.682279385272184,6.178378003766348,4.0,29.0,100.0,,COMPLETE
3657,0.269071277677803,2024-04-11 16:50:38.228257,2024-04-11 16:50:39.434540,0 days 00:00:01.206283,95.12815524024887,8.426234752426128,sigmoid,50,19.0,,,5.0,4.0,12.0,,,8.151636900542345,1.4115618212193608,2.8585996038751307,14.0,49.0,94.0,,COMPLETE
3658,0.2654760364091282,2024-04-11 16:50:39.443589,2024-04-11 16:50:40.522636,0 days 00:00:01.079047,98.26155767283721,8.111680603624963,sigmoid,6,,,,,,,44.0,31.0,2.4440454658300848,9.698829011471993,5.681172324177504,9.0,21.0,90.0,,COMPLETE
3659,0.5013971190441778,2024-04-11 16:50:40.522636,2024-04-11 16:50:41.824610,0 days 00:00:01.301974,99.99205128090641,7.5473848567829345,sigmoid,25,,24.0,32.0,3.0,6.0,94.0,,,,,,,,,52.0,COMPLETE
3660,0.4784349646689349,2024-04-11 16:50:41.824610,2024-04-11 16:50:42.886190,0 days 00:00:01.061580,96.80603474263816,7.943795919067022,sigmoid,8,,26.0,38.0,,,,,,,,,,,,,COMPLETE
3661,0.5963245096172158,2024-04-11 16:50:42.886190,2024-04-11 16:50:43.615636,0 days 00:00:00.729446,98.04537897984594,8.351752829329289,sigmoid,8,,28.0,31.0,,,,,,,,,,,,,COMPLETE
3662,0.35434364621569653,2024-04-11 16:50:43.615636,2024-04-11 16:50:44.562330,0 days 00:00:00.946694,94.38791195685603,8.660935740831476,sigmoid,39,46.0,,,,,,27.0,25.0,7.3397446998725,7.031548393426148,0.9206352716199895,2.0,27.0,65.0,34.0,COMPLETE
3663,0.44484992924703953,2024-04-11 16:50:44.562330,2024-04-11 16:50:45.597136,0 days 00:00:01.034806,96.67210693103242,6.147449850671349,sigmoid,24,,25.0,30.0,7.0,7.0,50.0,,,,,,,,,,COMPLETE
3664,0.5251756184824817,2024-04-11 16:50:45.597136,2024-04-11 16:50:46.811276,0 days 00:00:01.214140,98.32038200318365,7.684266498974504,sigmoid,35,39.0,,,,,,,,5.25777188255785,3.6211356066869396,4.090862072383032,3.0,32.0,72.0,120.0,COMPLETE
3665,0.4818345460537992,2024-04-11 16:50:46.819277,2024-04-11 16:50:48.247130,0 days 00:00:01.427853,99.97498574654072,8.168355211690677,sigmoid,43,30.0,23.0,33.0,,,,,,3.8650820779931054,6.4282011282207785,9.32214543465137,5.0,48.0,61.0,74.0,COMPLETE
3666,0.5952371952371952,2024-04-11 16:50:48.247130,2024-04-11 16:50:49.182233,0 days 00:00:00.935103,91.45969089051816,7.944013440076451,sigmoid,8,,27.0,32.0,,,,,,,,,,,,,COMPLETE
3667,0.3438047925189947,2024-04-11 16:50:49.182233,2024-04-11 16:50:50.241080,0 days 00:00:01.058847,95.05803522639934,8.33635196768327,sigmoid,3,,,,,,,,,1.6796565956929337,2.039823432465825,9.77493666379318,6.0,23.0,50.0,155.0,COMPLETE
3668,0.45723235487293484,2024-04-11 16:50:50.241080,2024-04-11 16:50:51.363929,0 days 00:00:01.122849,98.18260185595236,7.765086584085668,sigmoid,21,,,,1.0,2.0,18.0,18.0,21.0,,,,,,,59.0,COMPLETE
3669,0.4486112233626983,2024-04-11 16:50:51.363929,2024-04-11 16:50:52.749412,0 days 00:00:01.385483,96.68035700481913,8.14212171795513,sigmoid,22,,,,7.0,1.0,63.0,41.0,13.0,2.923356320674935,4.077925514311638,1.4599232899074792,18.0,45.0,98.0,,COMPLETE
3670,0.45022721836881124,2024-04-11 16:50:52.749412,2024-04-11 16:50:53.734444,0 days 00:00:00.985032,99.93828140537846,8.472940594337421,sigmoid,8,,26.0,28.0,,,,,,,,,,,,,COMPLETE
3671,0.41833182177232964,2024-04-11 16:50:53.735021,2024-04-11 16:50:55.031717,0 days 00:00:01.296696,98.20603024293948,7.391673653214382,sigmoid,57,47.0,24.0,30.0,4.0,3.0,47.0,,,,,,,,,29.0,COMPLETE
3672,0.47110322389825504,2024-04-11 16:50:55.031717,2024-04-11 16:50:56.915538,0 days 00:00:01.883821,93.88541126090327,7.99535645139279,rbf,8,,25.0,31.0,,,,,,,,,,,,,COMPLETE
3673,0.3810662289466172,2024-04-11 16:50:56.915538,2024-04-11 16:50:58.331520,0 days 00:00:01.415982,95.64444564450628,8.228106155196619,sigmoid,38,13.0,,,,,,4.0,50.0,3.350917536358792,0.8783404756797317,8.851186306664484,20.0,25.0,68.0,,COMPLETE
3674,0.12622036262203626,2024-04-11 16:50:58.331520,2024-04-11 16:50:59.983252,0 days 00:00:01.651732,99.99198473388266,7.7845011154614845,sigmoid,8,,25.0,29.0,,,,,,,,,,,,,COMPLETE
3675,0.39192069560510195,2024-04-11 16:50:59.983252,2024-04-11 16:51:01.735102,0 days 00:00:01.751850,99.95602888585884,7.504212107931427,sigmoid,15,,27.0,32.0,,,,37.0,18.0,6.944725033530133,3.0276505226570305,7.254042580575895,12.0,44.0,52.0,140.0,COMPLETE
3676,0.41541342030561096,2024-04-11 16:51:01.743107,2024-04-11 16:51:02.829541,0 days 00:00:01.086434,97.1079378184348,8.014095874660086,sigmoid,16,,,,8.0,7.0,88.0,,,,,,,,,,COMPLETE
3677,0.49532688605950975,2024-04-11 16:51:02.829541,2024-04-11 16:51:04.136277,0 days 00:00:01.306736,99.99711597596138,8.722991657265045,sigmoid,28,,23.0,31.0,2.0,6.0,65.0,15.0,43.0,,,,,,,,COMPLETE
3678,0.45345352376492626,2024-04-11 16:51:04.136277,2024-04-11 16:51:05.237857,0 days 00:00:01.101580,96.76184341717429,8.465802729342556,sigmoid,8,,28.0,30.0,,,,,,,,,,,,,COMPLETE
3679,0.49471494569818353,2024-04-11 16:51:05.237857,2024-04-11 16:51:06.835521,0 days 00:00:01.597664,93.17956145285632,8.187983369999502,sigmoid,31,,21.0,34.0,5.0,5.0,31.0,25.0,14.0,3.56918637407491,9.191658631639445,6.671505322422375,10.0,20.0,73.0,19.0,COMPLETE
3680,0.3510855509426257,2024-04-11 16:51:06.843943,2024-04-11 16:51:08.081941,0 days 00:00:01.237998,96.63778597770565,7.205384432157661,sigmoid,42,2.0,26.0,33.0,,,,,,4.147473600515664,6.088901749155258,5.982399428317385,16.0,24.0,59.0,,COMPLETE
3681,0.39185697325232205,2024-04-11 16:51:08.089372,2024-04-11 16:51:09.043819,0 days 00:00:00.954447,98.26502239279002,7.657757611810817,sigmoid,9,,29.0,31.0,,,,,,,,,,,,133.0,COMPLETE
3682,0.4953122025509233,2024-04-11 16:51:09.051709,2024-04-11 16:51:10.319529,0 days 00:00:01.267820,98.24132913479416,7.855666675333256,sigmoid,14,,24.0,36.0,,,,39.0,5.0,9.999336701159613,3.3662401531500965,3.1700201341578276,8.0,40.0,74.0,,COMPLETE
3683,0.48591213588579174,2024-04-11 16:51:10.319529,2024-04-11 16:51:11.878797,0 days 00:00:01.559268,94.96885329118861,8.06311089952487,sigmoid,63,5.0,24.0,29.0,3.0,2.0,68.0,13.0,48.0,1.2448842042318553,7.716549642719475,7.614253945799534,15.0,34.0,75.0,13.0,COMPLETE
3684,0.41924615708570223,2024-04-11 16:51:11.880538,2024-04-11 16:51:13.391805,0 days 00:00:01.511267,99.94960189187054,8.314890920501163,sigmoid,62,9.0,26.0,32.0,6.0,8.0,5.0,19.0,3.0,4.612364106732696,5.2860726375462495,8.070379650631601,13.0,38.0,70.0,,COMPLETE
3685,0.44701971028259324,2024-04-11 16:51:13.391805,2024-04-11 16:51:14.285716,0 days 00:00:00.893911,98.19348261977035,7.88166820173076,sigmoid,8,,22.0,30.0,,,,,,,,,,,,,COMPLETE
3686,0.4079849317606373,2024-04-11 16:51:14.294583,2024-04-11 16:51:15.853906,0 days 00:00:01.559323,95.09817957899006,8.517362322745605,sigmoid,46,36.0,25.0,31.0,,,,31.0,8.0,8.650132151144783,9.875045246244962,0.6648259597497308,14.0,28.0,57.0,,COMPLETE
3687,0.3280034111501972,2024-04-11 16:51:15.853906,2024-04-11 16:51:17.480312,0 days 00:00:01.626406,99.96761147328853,8.135689442246054,sigmoid,2,,,,,,,,,7.828287824626077,8.273953972687133,3.705703279434458,7.0,31.0,80.0,,COMPLETE
3688,0.33140273522158287,2024-04-11 16:51:17.480312,2024-04-11 16:51:18.827136,0 days 00:00:01.346824,96.53306157653525,7.681360979767995,sigmoid,10,,27.0,32.0,,,,,,6.31542765888877,4.8231125124058245,2.0931069958380917,19.0,37.0,95.0,,COMPLETE
3689,0.5240323914841744,2024-04-11 16:51:18.827136,2024-04-11 16:51:19.867902,0 days 00:00:01.040766,91.17898049437986,8.291130779934406,sigmoid,41,42.0,23.0,29.0,,,,,,,,,,,,111.0,COMPLETE
3690,0.6009432182607054,2024-04-11 16:51:19.875908,2024-04-11 16:51:20.755188,0 days 00:00:00.879280,99.96810558313423,7.964392793471906,sigmoid,8,,25.0,31.0,,,,,,,,,,,,,COMPLETE
3691,0.44962132687064527,2024-04-11 16:51:20.755188,2024-04-11 16:51:22.396944,0 days 00:00:01.641756,96.97872882297067,7.517820050307597,rbf,8,,26.0,33.0,,,,,,,,,,,,,COMPLETE
3692,0.36285302289593074,2024-04-11 16:51:22.396944,2024-04-11 16:51:23.570735,0 days 00:00:01.173791,98.10073217279714,8.831594084940726,sigmoid,11,,24.0,30.0,,,,,,9.010513557490244,4.292961001163101,5.450142819635713,6.0,50.0,85.0,179.0,COMPLETE
3693,0.12003789673140693,2024-04-11 16:51:23.578686,2024-04-11 16:51:24.523249,0 days 00:00:00.944563,93.88581187873389,8.117103060338323,sigmoid,8,,28.0,28.0,,,,,,,,,,,,,COMPLETE
3694,0.5008256348462533,2024-04-11 16:51:24.523249,2024-04-11 16:51:25.593407,0 days 00:00:01.070158,98.22314038285468,8.438248798684738,sigmoid,37,12.0,,,,,,2.0,16.0,,,,,,,165.0,COMPLETE
3695,0.5952371952371952,2024-04-11 16:51:25.593407,2024-04-11 16:51:26.578948,0 days 00:00:00.985541,95.54537136245003,7.875670265504829,sigmoid,8,,26.0,32.0,,,,,,,,,,,,,COMPLETE
3696,0.4531522646233214,2024-04-11 16:51:26.586476,2024-04-11 16:51:27.938040,0 days 00:00:01.351564,97.96789801704386,8.28189555536281,sigmoid,26,,25.0,31.0,1.0,4.0,41.0,,,1.9830836726347574,3.11375503714301,9.98886047562651,16.0,39.0,54.0,,COMPLETE
3697,0.40984667141101117,2024-04-11 16:51:27.938040,2024-04-11 16:51:29.009633,0 days 00:00:01.071593,96.5309250716922,7.76150784681525,sigmoid,52,21.0,,,4.0,1.0,82.0,8.0,41.0,,,,,,,,COMPLETE
3698,0.12622036262203626,2024-04-11 16:51:29.009633,2024-04-11 16:51:29.909618,0 days 00:00:00.899985,93.1318663664454,7.994247780206763,sigmoid,8,,27.0,29.0,,,,,,,,,,,,,COMPLETE
3699,0.48450750935708536,2024-04-11 16:51:29.918610,2024-04-11 16:51:30.958505,0 days 00:00:01.039895,98.01304211633301,8.58891799182277,sigmoid,20,,,,6.0,5.0,97.0,17.0,4.0,,,,,,,,COMPLETE
3700,0.3791779082685288,2024-04-11 16:51:30.965082,2024-04-11 16:51:32.102129,0 days 00:00:01.137047,94.9458439972153,8.158562891176171,sigmoid,56,23.0,23.0,33.0,2.0,6.0,33.0,,,,,,,,,,COMPLETE
3701,0.44701971028259324,2024-04-11 16:51:32.102129,2024-04-11 16:51:33.008469,0 days 00:00:00.906340,99.96181990156953,7.64341084543818,sigmoid,8,,24.0,30.0,,,,,,,,,,,,,COMPLETE
3702,0.3336405529953917,2024-04-11 16:51:33.008984,2024-04-11 16:51:34.064973,0 days 00:00:01.055989,96.81222345489445,8.31739612624385,sigmoid,44,28.0,22.0,31.0,,,,6.0,20.0,,,,,,,,COMPLETE
3703,0.5361153290966012,2024-04-11 16:51:34.064973,2024-04-11 16:51:35.061038,0 days 00:00:00.996065,96.68181584338647,7.967177243367693,sigmoid,12,,29.0,32.0,,,,36.0,35.0,,,,,,,,COMPLETE
3704,0.5168452275544537,2024-04-11 16:51:35.061038,2024-04-11 16:51:36.005639,0 days 00:00:00.944601,99.9609446903663,8.146765441026194,sigmoid,48,48.0,,,8.0,7.0,75.0,,,,,,,,,,COMPLETE
3705,0.5443724319057907,2024-04-11 16:51:36.005639,2024-04-11 16:51:37.095197,0 days 00:00:01.089558,99.97850257028371,7.340593563786794,sigmoid,13,,25.0,26.0,,,,43.0,40.0,,,,,,,189.0,COMPLETE
3706,0.4751261532188186,2024-04-11 16:51:37.095197,2024-04-11 16:51:38.531964,0 days 00:00:01.436767,99.99339870690245,7.812848268271429,sigmoid,59,37.0,27.0,34.0,7.0,3.0,56.0,,,8.065350296349454,7.119577251636983,4.451612503893039,17.0,42.0,87.0,77.0,COMPLETE
3707,0.45345352376492626,2024-04-11 16:51:38.531964,2024-04-11 16:51:39.385513,0 days 00:00:00.853549,95.18501948910863,8.494066670131266,sigmoid,8,,26.0,30.0,,,,,,,,,,,,,COMPLETE
3708,0.5952371952371952,2024-04-11 16:51:39.385513,2024-04-11 16:51:40.282033,0 days 00:00:00.896520,9.17806304683959,8.004763054705604,sigmoid,8,,23.0,32.0,,,,,,,,,,,,,COMPLETE
3709,0.12622036262203626,2024-04-11 16:51:40.282033,2024-04-11 16:51:41.140248,0 days 00:00:00.858215,98.24360763605303,8.338934009211606,sigmoid,8,,25.0,29.0,,,,,,,,,,,,,COMPLETE
3710,0.4118836915297093,2024-04-11 16:51:41.140248,2024-04-11 16:51:42.539669,0 days 00:00:01.399421,99.99500966565495,7.680320942095455,sigmoid,55,26.0,,,3.0,4.0,80.0,21.0,36.0,1.5339332270108734,2.5630006903202434,5.2690875029145285,5.0,33.0,58.0,126.0,COMPLETE
3711,0.3919230108266025,2024-04-11 16:51:42.539669,2024-04-11 16:51:44.080933,0 days 00:00:01.541264,92.68029939068956,8.12749970213395,rbf,1,,,,,,,,,,,,,,,151.0,COMPLETE
3712,0.4448341684562156,2024-04-11 16:51:44.088382,2024-04-11 16:51:44.954326,0 days 00:00:00.865944,61.17153873549012,8.667122785130287,sigmoid,8,,27.0,30.0,,,,,,,,,,,,,COMPLETE
3713,0.48423041994943916,2024-04-11 16:51:44.963422,2024-04-11 16:51:46.250018,0 days 00:00:01.286596,50.319678132153946,7.489607891740429,sigmoid,61,17.0,24.0,31.0,4.0,1.0,10.0,12.0,15.0,,,,,,,83.0,COMPLETE
3714,0.4767750887838378,2024-04-11 16:51:46.250018,2024-04-11 16:51:47.582973,0 days 00:00:01.332955,98.05123925811372,6.3654790341137275,sigmoid,54,35.0,,,1.0,8.0,61.0,28.0,33.0,0.9514291319736738,1.1497083333032316,9.46827780361049,8.0,43.0,88.0,,COMPLETE
3715,0.533560090702948,2024-04-11 16:51:47.582973,2024-04-11 16:51:48.510227,0 days 00:00:00.927254,96.52039355293948,7.88798718970958,sigmoid,40,32.0,26.0,33.0,,,,,,,,,,,,,COMPLETE
3716,0.42311265621722066,2024-04-11 16:51:48.510227,2024-04-11 16:51:49.720838,0 days 00:00:01.210611,95.1164312830335,8.266562694455928,sigmoid,60,6.0,25.0,28.0,5.0,2.0,25.0,30.0,26.0,,,,,,,,COMPLETE
3717,0.3336465825712943,2024-04-11 16:51:49.720838,2024-04-11 16:51:50.625231,0 days 00:00:00.904393,98.34690491973247,8.102094335053927,sigmoid,36,40.0,,,,,,5.0,46.0,,,,,,,,COMPLETE
3718,0.503337041156841,2024-04-11 16:51:50.633540,2024-04-11 16:51:51.446418,0 days 00:00:00.812878,98.11352178032551,7.839081509737565,sigmoid,32,49.0,,,,,,,,,,,,,,,COMPLETE
3719,0.44930117101073874,2024-04-11 16:51:51.446418,2024-04-11 16:51:52.790969,0 days 00:00:01.344551,96.64421211264533,8.45800026986982,sigmoid,23,,,,7.0,6.0,14.0,45.0,44.0,6.6984268351138265,1.5773726964371608,1.6728765934605634,3.0,36.0,76.0,68.0,COMPLETE
3720,0.35059571668737666,2024-04-11 16:51:52.790969,2024-04-11 16:51:53.967703,0 days 00:00:01.176734,93.40798361477822,7.664535261693204,sigmoid,7,,,,,,,48.0,6.0,5.824445593030663,2.754703524999627,3.457162212831558,5.0,46.0,60.0,95.0,COMPLETE
3721,0.5975287681569516,2024-04-11 16:51:53.975762,2024-04-11 16:51:54.812961,0 days 00:00:00.837199,98.29663457294897,9.331634402089543,sigmoid,8,,28.0,32.0,,,,,,,,,,,,,COMPLETE
3722,0.6009432182607054,2024-04-11 16:51:54.812961,2024-04-11 16:51:55.685046,0 days 00:00:00.872085,95.74301931706458,8.015755885238455,sigmoid,8,,21.0,31.0,,,,,,,,,,,,,COMPLETE
3723,0.4353130957618419,2024-04-11 16:51:55.693250,2024-04-11 16:51:57.128071,0 days 00:00:01.434821,98.14258361056527,8.900548719892871,sigmoid,30,,26.0,30.0,8.0,5.0,85.0,34.0,34.0,2.2914495126862158,6.822580835431099,2.510948546533775,4.0,30.0,56.0,,COMPLETE
3724,0.5580315329378708,2024-04-11 16:51:57.128071,2024-04-11 16:51:57.994614,0 days 00:00:00.866543,99.96293090827966,8.33896798843975,sigmoid,4,,,,,,,10.0,38.0,,,,,,,,COMPLETE
3725,0.378030871650948,2024-04-11 16:51:57.994614,2024-04-11 16:51:58.867232,0 days 00:00:00.872618,96.70830383428782,8.204339844007434,sigmoid,5,,,,,,,50.0,23.0,,,,,,,55.0,COMPLETE
3726,0.5175978882534096,2024-04-11 16:51:58.867232,2024-04-11 16:52:00.260880,0 days 00:00:01.393648,94.58517043326951,7.808017297396644,sigmoid,27,,24.0,32.0,3.0,4.0,49.0,,,3.1299824906094567,9.527756869280818,6.507710996536678,15.0,48.0,81.0,172.0,COMPLETE
3727,0.5248985002899992,2024-04-11 16:52:00.268907,2024-04-11 16:52:01.134816,0 days 00:00:00.865909,98.18716089572332,8.557227556607751,sigmoid,33,3.0,,,,,,,,,,,,,,146.0,COMPLETE
3728,0.4920985556499576,2024-04-11 16:52:01.134816,2024-04-11 16:52:02.944122,0 days 00:00:01.809306,96.33142990636655,6.830591925917808,rbf,8,,25.0,31.0,,,,,,,,,,,,,COMPLETE
3729,0.5025718057262506,2024-04-11 16:52:02.944122,2024-04-11 16:52:04.055660,0 days 00:00:01.111538,91.45443415383245,7.989980810358163,sigmoid,45,45.0,30.0,33.0,,,,24.0,9.0,,,,,,,114.0,COMPLETE
3730,0.29706576998518874,2024-04-11 16:52:04.055660,2024-04-11 16:52:05.184608,0 days 00:00:01.128948,97.8843501743119,8.195736326484221,sigmoid,34,7.0,,,,,,,,5.103177482717323,5.729875080596515,1.3017796255819731,12.0,27.0,91.0,,COMPLETE
3731,0.4549315305945571,2024-04-11 16:52:05.184608,2024-04-11 16:52:06.467155,0 days 00:00:01.282547,99.97526136942156,7.477165031993668,sigmoid,51,9.0,,,6.0,3.0,91.0,,,7.138459716648926,8.622648435259887,6.990562415693853,11.0,41.0,63.0,36.0,COMPLETE
3732,0.126809901914993,2024-04-11 16:52:06.475179,2024-04-11 16:52:07.324433,0 days 00:00:00.849254,94.86628033613749,7.213708592942545,sigmoid,8,,23.0,29.0,,,,,,,,,,,,,COMPLETE
3733,0.40802763708756623,2024-04-11 16:52:07.324433,2024-04-11 16:52:08.575516,0 days 00:00:01.251083,98.03931736263675,7.9116810583903066,sigmoid,19,,,,1.0,8.0,70.0,,,5.438903579103527,7.924605833168925,1.0370153430563356,9.0,21.0,66.0,47.0,COMPLETE
3734,0.4892575849373164,2024-04-11 16:52:08.575516,2024-04-11 16:52:09.697076,0 days 00:00:01.121560,96.67994521137847,8.370124292327995,sigmoid,53,29.0,,,2.0,7.0,36.0,16.0,39.0,,,,,,,161.0,COMPLETE
3735,0.44321465301924684,2024-04-11 16:52:09.698336,2024-04-11 16:52:10.687750,0 days 00:00:00.989414,98.21862704344333,7.6881137226048955,sigmoid,17,,,,5.0,2.0,21.0,,,,,,,,,119.0,COMPLETE
3736,0.6009432182607054,2024-04-11 16:52:10.687750,2024-04-11 16:52:11.593456,0 days 00:00:00.905706,93.26270841081937,8.110525492022331,sigmoid,8,,27.0,31.0,,,,,,,,,,,,,COMPLETE
3737,0.4448341684562156,2024-04-11 16:52:11.593456,2024-04-11 16:52:12.509650,0 days 00:00:00.916194,99.96301491417248,8.619265139340168,sigmoid,8,,24.0,30.0,,,,,,,,,,,,,COMPLETE
3738,0.17691330270745775,2024-04-11 16:52:12.509650,2024-04-11 16:52:13.613106,0 days 00:00:01.103456,95.22204192085186,7.9832005935763375,sigmoid,6,,,,,,,40.0,49.0,2.6672067620310123,2.186274026347024,2.9766417432671304,10.0,26.0,68.0,,COMPLETE
3739,0.5963643249384587,2024-04-11 16:52:13.613106,2024-04-11 16:52:14.519531,0 days 00:00:00.906425,96.67278804779156,8.310768947071791,sigmoid,8,,31.0,32.0,,,,,,,,,,,,,COMPLETE
3740,0.3837691669483453,2024-04-11 16:52:14.520150,2024-04-11 16:52:15.593045,0 days 00:00:01.072895,98.13691606783577,7.7867302450150815,sigmoid,49,33.0,,,4.0,5.0,40.0,,,,,,,,,63.0,COMPLETE
