number,value,datetime_start,datetime_complete,duration,params_C,params_gamma,params_kernel,params_mask_number,params_rsi_window,params_so_smooth,params_so_window,params_srsi_smooth1,params_srsi_smooth2,params_srsi_window,params_tsi_window_fast,params_tsi_window_slow,params_ult_weight_1,params_ult_weight_2,params_ult_weight_3,params_ult_window_1,params_ult_window_2,params_ult_window_3,params_williams_lbp,state
5280,0.5083482606868794,2024-04-11 17:20:52.055148,2024-04-11 17:20:53.092760,0 days 00:00:01.037612,92.28564546611531,7.414071840766846,sigmoid,13,,23.0,31.0,,,,29.0,16.0,,,,,,,127.0,COMPLETE
5281,0.44531298660853313,2024-04-11 17:20:53.094759,2024-04-11 17:20:54.534323,0 days 00:00:01.439564,96.38425046602083,8.412710107699784,rbf,8,,26.0,33.0,,,,,,,,,,,,,COMPLETE
5282,0.3520005762235747,2024-04-11 17:20:54.536317,2024-04-11 17:20:55.559245,0 days 00:00:01.022928,98.2104736632867,8.016892745408743,sigmoid,44,36.0,27.0,30.0,,,,39.0,14.0,,,,,,,,COMPLETE
5283,0.34032591063265005,2024-04-11 17:20:55.561258,2024-04-11 17:20:56.956576,0 days 00:00:01.395318,95.50640286728435,7.779173694618745,sigmoid,54,43.0,,,8.0,5.0,19.0,41.0,30.0,8.009536715678404,0.9498514056880358,7.098439627297834,17.0,22.0,75.0,,COMPLETE
5284,0.4853237785634625,2024-04-11 17:20:56.958577,2024-04-11 17:20:57.923636,0 days 00:00:00.965059,96.68482417158523,8.222729706928554,sigmoid,48,14.0,,,6.0,3.0,37.0,,,,,,,,,,COMPLETE
5285,0.46041779079626916,2024-04-11 17:20:57.926269,2024-04-11 17:20:59.130885,0 days 00:00:01.204616,98.02228359962932,8.014882465564867,sigmoid,60,50.0,25.0,31.0,1.0,4.0,64.0,2.0,3.0,,,,,,,,COMPLETE
5286,0.12622036262203626,2024-04-11 17:20:59.132884,2024-04-11 17:21:00.027228,0 days 00:00:00.894344,15.76330846279356,8.60232674070996,sigmoid,8,,24.0,29.0,,,,,,,,,,,,,COMPLETE
5287,0.4794457745402679,2024-04-11 17:21:00.029224,2024-04-11 17:21:01.474075,0 days 00:00:01.444851,98.38790284191433,7.695635582961805,sigmoid,59,33.0,26.0,34.0,5.0,2.0,48.0,,,4.76908215397432,8.056822049671052,4.370187814504814,18.0,29.0,68.0,74.0,COMPLETE
5288,0.5353987467403573,2024-04-11 17:21:01.477077,2024-04-11 17:21:02.409964,0 days 00:00:00.932887,94.24249196563666,8.327119732470889,sigmoid,36,4.0,,,,,,34.0,25.0,,,,,,,,COMPLETE
5289,0.5952371952371952,2024-04-11 17:21:02.411964,2024-04-11 17:21:03.270633,0 days 00:00:00.858669,99.94907708758159,7.901964248347088,sigmoid,8,,23.0,32.0,,,,,,,,,,,,,COMPLETE
5290,0.5164670006534524,2024-04-11 17:21:03.272674,2024-04-11 17:21:04.312116,0 days 00:00:01.039442,96.74468945025531,8.105191665607187,sigmoid,12,,21.0,30.0,,,,18.0,7.0,,,,,,,,COMPLETE
5291,0.561853681832375,2024-04-11 17:21:04.314117,2024-04-11 17:21:05.354192,0 days 00:00:01.040075,98.1695814562704,8.4402707878409,sigmoid,20,,,,7.0,7.0,13.0,40.0,39.0,,,,,,,,COMPLETE
5292,0.5794263805393736,2024-04-11 17:21:05.356190,2024-04-11 17:21:06.189819,0 days 00:00:00.833629,98.24342195901689,8.11479159061484,sigmoid,32,46.0,,,,,,,,,,,,,,,COMPLETE
5293,0.6009432182607054,2024-04-11 17:21:06.190822,2024-04-11 17:21:07.090034,0 days 00:00:00.899212,95.16754578021879,7.608978157392187,sigmoid,8,,28.0,31.0,,,,,,,,,,,,,COMPLETE
5294,0.4774465840147718,2024-04-11 17:21:07.092051,2024-04-11 17:21:07.899768,0 days 00:00:00.807717,99.99573874573387,7.882818820169712,sigmoid,1,,,,,,,,,,,,,,,40.0,COMPLETE
5295,0.4268867924528301,2024-04-11 17:21:07.902405,2024-04-11 17:21:09.309629,0 days 00:00:01.407224,92.5431864716019,4.968482171286947,sigmoid,27,,24.0,28.0,3.0,1.0,29.0,,,6.801738815812656,9.443334769762632,9.529045178099864,5.0,21.0,98.0,157.0,COMPLETE
5296,0.4367786015409217,2024-04-11 17:21:09.311628,2024-04-11 17:21:10.682806,0 days 00:00:01.371178,99.96723907213884,8.847481557450287,sigmoid,23,,,,8.0,6.0,80.0,43.0,13.0,9.433699375405595,4.042955418397496,7.557514343998539,8.0,30.0,58.0,27.0,COMPLETE
5297,0.36025560444165095,2024-04-11 17:21:10.684806,2024-04-11 17:21:11.890663,0 days 00:00:01.205857,99.96380628440184,7.091342285224682,sigmoid,7,,,,,,,31.0,27.0,9.16906159946871,3.1797862409856403,4.019889735402712,20.0,46.0,69.0,131.0,COMPLETE
5298,0.44530017382002934,2024-04-11 17:21:11.892660,2024-04-11 17:21:13.202075,0 days 00:00:01.309415,96.62638696262225,8.130309681977048,sigmoid,61,13.0,26.0,32.0,4.0,5.0,76.0,13.0,43.0,,,,,,,51.0,COMPLETE
5299,0.45963271499798714,2024-04-11 17:21:13.204106,2024-04-11 17:21:14.621262,0 days 00:00:01.417156,98.18855307954632,8.246848358774384,rbf,8,,27.0,35.0,,,,,,,,,,,,,COMPLETE
5300,0.47512335026614494,2024-04-11 17:21:14.624262,2024-04-11 17:21:16.317242,0 days 00:00:01.692980,94.59851066183924,7.332762045770899,sigmoid,30,,25.0,29.0,2.0,2.0,43.0,27.0,22.0,9.677825848549364,6.995465952956004,1.565790131680862,11.0,33.0,72.0,,COMPLETE
5301,0.2127944216970041,2024-04-11 17:21:16.320231,2024-04-11 17:21:17.214658,0 days 00:00:00.894427,98.19014833306596,7.821122162539367,sigmoid,4,,,,,,,23.0,33.0,,,,,,,,COMPLETE
5302,0.5194184044384925,2024-04-11 17:21:17.216633,2024-04-11 17:21:18.303825,0 days 00:00:01.087192,99.99168674477667,8.55309107573144,sigmoid,34,19.0,,,,,,,,8.749884037013171,8.960164724826026,1.9649105386621395,12.0,36.0,80.0,,COMPLETE
5303,0.512598053538918,2024-04-11 17:21:18.305438,2024-04-11 17:21:19.262678,0 days 00:00:00.957240,95.74604069307031,8.382359832796189,sigmoid,5,,,,,,,9.0,10.0,,,,,,,21.0,COMPLETE
5304,0.5929369437606513,2024-04-11 17:21:19.264677,2024-04-11 17:21:20.146421,0 days 00:00:00.881744,91.02321297928768,8.011722423433303,sigmoid,8,,25.0,33.0,,,,,,,,,,,,,COMPLETE
5305,0.6009432182607054,2024-04-11 17:21:20.148414,2024-04-11 17:21:21.029426,0 days 00:00:00.881012,96.6601417012025,7.546166192561768,sigmoid,8,,23.0,31.0,,,,,,,,,,,,,COMPLETE
5306,0.5447087438677495,2024-04-11 17:21:21.031407,2024-04-11 17:21:21.874557,0 days 00:00:00.843150,99.99469327668318,7.764569259626063,sigmoid,33,42.0,,,,,,,,,,,,,,194.0,COMPLETE
5307,0.42902153490388784,2024-04-11 17:21:21.876582,2024-04-11 17:21:23.176867,0 days 00:00:01.300285,99.99512947130565,8.263071040250306,sigmoid,51,29.0,,,5.0,1.0,85.0,,,4.080870536381334,5.811836389478552,8.797587190058739,13.0,32.0,94.0,32.0,COMPLETE
5308,0.5294813278008298,2024-04-11 17:21:23.178868,2024-04-11 17:21:24.150404,0 days 00:00:00.971536,93.84091411906482,7.967126202344439,sigmoid,17,,,,2.0,3.0,31.0,,,,,,,,,104.0,COMPLETE
5309,0.5108072631809233,2024-04-11 17:21:24.152405,2024-04-11 17:21:25.124842,0 days 00:00:00.972437,98.08494963866964,8.696620389285126,sigmoid,40,8.0,26.0,30.0,,,,,,,,,,,,,COMPLETE
5310,0.5236861424191389,2024-04-11 17:21:25.126841,2024-04-11 17:21:26.311877,0 days 00:00:01.185036,96.70791082241777,8.179001483891811,sigmoid,53,34.0,,,6.0,8.0,7.0,24.0,44.0,,,,,,,176.0,COMPLETE
5311,0.4408266534250786,2024-04-11 17:21:26.313874,2024-04-11 17:21:27.192707,0 days 00:00:00.878833,98.0908976237667,7.69506756878284,sigmoid,8,,22.0,22.0,,,,,,,,,,,,,COMPLETE
5312,0.4927404718693285,2024-04-11 17:21:27.194718,2024-04-11 17:21:28.322031,0 days 00:00:01.127313,95.39796106090022,7.970951027853236,sigmoid,45,16.0,24.0,32.0,,,,25.0,24.0,,,,,,,144.0,COMPLETE
5313,0.34411794136286317,2024-04-11 17:21:28.323568,2024-04-11 17:21:29.580725,0 days 00:00:01.257157,98.30230346576482,8.405094122158506,sigmoid,19,,,,1.0,6.0,22.0,,,2.637805158557019,2.5294735291448314,8.396535992114547,3.0,41.0,92.0,56.0,COMPLETE
5314,0.4591779485303086,2024-04-11 17:21:29.583310,2024-04-11 17:21:30.592795,0 days 00:00:01.009485,96.69350527515003,8.207923797443197,sigmoid,49,12.0,,,7.0,4.0,59.0,,,,,,,,,170.0,COMPLETE
5315,0.6009432182607054,2024-04-11 17:21:30.594795,2024-04-11 17:21:31.493411,0 days 00:00:00.898616,98.21827404376495,7.85868001162188,sigmoid,8,,29.0,31.0,,,,,,,,,,,,,COMPLETE
5316,0.5348085793848181,2024-04-11 17:21:31.496402,2024-04-11 17:21:32.751435,0 days 00:00:01.255033,99.96623528391773,7.4461838681878465,sigmoid,18,,,,3.0,5.0,40.0,,,7.299327743318523,9.630840682223898,5.346454064647358,6.0,50.0,76.0,,COMPLETE
5317,0.2515579466487335,2024-04-11 17:21:32.753017,2024-04-11 17:21:34.044229,0 days 00:00:01.291212,94.11327801421712,8.523709344583931,sigmoid,50,44.0,,,4.0,7.0,27.0,,,1.3593907597504296,6.1465881325343,9.146921636383908,15.0,48.0,61.0,,COMPLETE
5318,0.44540141494924634,2024-04-11 17:21:34.046248,2024-04-11 17:21:35.513454,0 days 00:00:01.467206,96.75114503588816,8.092319642383048,rbf,8,,27.0,33.0,,,,,,,,,,,,,COMPLETE
5319,0.459160094439142,2024-04-11 17:21:35.514973,2024-04-11 17:21:36.644217,0 days 00:00:01.129244,98.19418335814804,7.701994210338414,sigmoid,25,,25.0,30.0,6.0,4.0,89.0,,,,,,,,,88.0,COMPLETE
5320,0.2654932159882655,2024-04-11 17:21:36.646225,2024-04-11 17:21:37.820643,0 days 00:00:01.174418,95.58622820447818,8.325958691001665,sigmoid,6,,,,,,,47.0,40.0,7.8697701311884,1.4655802234549093,5.036078586211384,9.0,47.0,54.0,,COMPLETE
5321,0.4141756459274707,2024-04-11 17:21:37.822663,2024-04-11 17:21:39.244589,0 days 00:00:01.421926,92.23116862244,9.745564827375247,sigmoid,58,21.0,24.0,26.0,8.0,2.0,35.0,,,5.701322231647577,7.441265905091138,6.220089888320627,14.0,40.0,51.0,,COMPLETE
5322,0.5952371952371952,2024-04-11 17:21:39.246589,2024-04-11 17:21:40.148617,0 days 00:00:00.902028,98.06986921542307,7.934866635138662,sigmoid,8,,26.0,32.0,,,,,,,,,,,,,COMPLETE
5323,0.12622036262203626,2024-04-11 17:21:40.150627,2024-04-11 17:21:41.033396,0 days 00:00:00.882769,89.16538682816207,8.15651445902813,sigmoid,8,,25.0,29.0,,,,,,,,,,,,,COMPLETE
5324,0.47152106833931917,2024-04-11 17:21:41.035397,2024-04-11 17:21:42.274871,0 days 00:00:01.239474,95.19063356373654,7.876416778543239,sigmoid,29,,28.0,30.0,4.0,8.0,55.0,8.0,19.0,,,,,,,120.0,COMPLETE
5325,0.5963245096172158,2024-04-11 17:21:42.276873,2024-04-11 17:21:43.162864,0 days 00:00:00.885991,99.9762024681837,8.355693145431912,sigmoid,8,,27.0,31.0,,,,,,,,,,,,,COMPLETE
5326,0.48046555948815683,2024-04-11 17:21:43.164447,2024-04-11 17:21:44.228016,0 days 00:00:01.063569,96.72638522988345,8.039230212388157,sigmoid,24,,22.0,34.0,2.0,3.0,73.0,,,,,,,,,,COMPLETE
5327,0.3975564554876793,2024-04-11 17:21:44.230013,2024-04-11 17:21:45.315456,0 days 00:00:01.085443,93.76379578662683,7.573129297689717,sigmoid,21,,,,3.0,1.0,10.0,49.0,42.0,,,,,,,115.0,COMPLETE
5328,0.4363944522689837,2024-04-11 17:21:45.318066,2024-04-11 17:21:46.245647,0 days 00:00:00.927581,98.36572590167548,8.680218355334182,sigmoid,8,,23.0,18.0,,,,,,,,,,,,,COMPLETE
5329,0.38144234047168935,2024-04-11 17:21:46.247634,2024-04-11 17:21:47.536260,0 days 00:00:01.288626,96.99381196012561,8.249757115756513,sigmoid,43,10.0,20.0,27.0,,,,,,2.210881799668253,7.8672868986470466,2.3933955639936815,17.0,27.0,56.0,13.0,COMPLETE
5330,0.5952371952371952,2024-04-11 17:21:47.538264,2024-04-11 17:21:48.444813,0 days 00:00:00.906549,99.99481671186025,7.774546264326155,sigmoid,8,,26.0,32.0,,,,,,,,,,,,,COMPLETE
5331,0.46512823148481264,2024-04-11 17:21:48.447341,2024-04-11 17:21:50.001800,0 days 00:00:01.554459,98.19491105041836,8.508621549322273,sigmoid,31,,24.0,31.0,5.0,6.0,82.0,16.0,29.0,3.05240147258582,0.7103596249597253,6.605976755059345,16.0,39.0,65.0,36.0,COMPLETE
5332,0.5280309369275651,2024-04-11 17:21:50.004825,2024-04-11 17:21:51.446429,0 days 00:00:01.441604,95.25079720113169,8.045257443310872,sigmoid,22,,,,7.0,5.0,53.0,42.0,35.0,6.991300287864776,4.900393828096348,3.5698722366684748,7.0,38.0,66.0,,COMPLETE
5333,0.5389883864380822,2024-04-11 17:21:51.448421,2024-04-11 17:21:52.526654,0 days 00:00:01.078233,98.19068806594713,7.362822340066404,sigmoid,3,,,,,,,,,5.334239013983032,8.36274817082043,7.875239636806935,5.0,24.0,86.0,163.0,COMPLETE
5334,0.5198023108261538,2024-04-11 17:21:52.528654,2024-04-11 17:21:53.909198,0 days 00:00:01.380544,96.43443642043782,8.211412148148293,sigmoid,15,,25.0,29.0,,,,35.0,37.0,5.865314668507137,3.367070416014597,1.3313805136668564,2.0,44.0,81.0,108.0,COMPLETE
5335,0.41780621785881245,2024-04-11 17:21:53.912721,2024-04-11 17:21:55.345340,0 days 00:00:01.432619,92.99238948858651,7.660192660283294,sigmoid,47,23.0,28.0,33.0,,,,30.0,31.0,6.514650135004621,5.448272584445511,3.2385103379819093,8.0,35.0,74.0,18.0,COMPLETE
5336,0.45347172512526845,2024-04-11 17:21:55.347925,2024-04-11 17:21:56.281664,0 days 00:00:00.933739,36.821085359039905,7.934458340399755,sigmoid,8,,27.0,28.0,,,,,,,,,,,,,COMPLETE
5337,0.19365820445481957,2024-04-11 17:21:56.283658,2024-04-11 17:21:57.704234,0 days 00:00:01.420576,98.281869644643,8.340461059858853,rbf,38,5.0,,,,,,12.0,10.0,0.844421788046505,1.9675626506440054,5.947200435358234,19.0,49.0,88.0,,COMPLETE
5338,0.33728722451173626,2024-04-11 17:21:57.706234,2024-04-11 17:21:58.652181,0 days 00:00:00.945947,98.16030253190381,8.090404558429112,sigmoid,9,,26.0,30.0,,,,,,,,,,,,66.0,COMPLETE
5339,0.3593556845851283,2024-04-11 17:21:58.654176,2024-04-11 17:21:59.799064,0 days 00:00:01.144888,11.46097368395499,7.797931796079805,sigmoid,35,37.0,,,,,,,,1.7931250291703638,6.570689694136721,4.129383026042195,18.0,43.0,55.0,153.0,COMPLETE
5340,0.5963643249384587,2024-04-11 17:21:59.801061,2024-04-11 17:22:00.684457,0 days 00:00:00.883396,95.2144398652921,8.491915113499847,sigmoid,8,,17.0,32.0,,,,,,,,,,,,,COMPLETE
5341,0.6009158557527189,2024-04-11 17:22:00.686457,2024-04-11 17:22:01.568947,0 days 00:00:00.882490,96.773521118472,8.814466440302558,sigmoid,8,,24.0,31.0,,,,,,,,,,,,,COMPLETE
5342,0.5076270606744647,2024-04-11 17:22:01.570927,2024-04-11 17:22:02.920773,0 days 00:00:01.349846,99.94460228219877,8.059461432983285,sigmoid,39,40.0,,,,,,7.0,32.0,8.342235654987036,1.230138129203513,6.876887005573288,4.0,20.0,90.0,136.0,COMPLETE
5343,0.4758942052376738,2024-04-11 17:22:02.922767,2024-04-11 17:22:04.517241,0 days 00:00:01.594474,98.22868360024017,7.570401563637924,sigmoid,63,9.0,25.0,30.0,1.0,2.0,24.0,14.0,28.0,9.836992539258272,9.248621675856059,1.063483031459878,10.0,31.0,100.0,189.0,COMPLETE
5344,0.4270195997096339,2024-04-11 17:22:04.519815,2024-04-11 17:22:05.495257,0 days 00:00:00.975442,95.37279558197777,7.869903582650925,sigmoid,16,,,,5.0,7.0,5.0,,,,,,,,,,COMPLETE
5345,0.4727766084244161,2024-04-11 17:22:05.497260,2024-04-11 17:22:06.726159,0 days 00:00:01.228899,99.9547751200786,8.30046033447485,sigmoid,57,31.0,23.0,32.0,8.0,3.0,98.0,,,,,,,,,10.0,COMPLETE
5346,0.5119175238920695,2024-04-11 17:22:06.729155,2024-04-11 17:22:07.986779,0 days 00:00:01.257624,96.70484721413406,8.13294616036115,sigmoid,42,38.0,26.0,29.0,,,,,,7.548857651693669,4.655746889277876,1.77685379022437,13.0,46.0,77.0,,COMPLETE
5347,0.5963245096172158,2024-04-11 17:22:07.988783,2024-04-11 17:22:08.863713,0 days 00:00:00.874930,93.57039427153637,8.576383007453742,sigmoid,8,,25.0,31.0,,,,,,,,,,,,,COMPLETE
5348,0.37281762898057935,2024-04-11 17:22:08.865717,2024-04-11 17:22:10.172845,0 days 00:00:01.307128,99.95889187373122,7.9513480662793325,sigmoid,14,,27.0,33.0,,,,32.0,20.0,3.7092332241843424,4.3338662512144985,2.289543180831829,11.0,45.0,59.0,,COMPLETE
5349,0.3752202605120409,2024-04-11 17:22:10.174830,2024-04-11 17:22:11.571990,0 days 00:00:01.397160,96.71048656930537,7.66527290651752,sigmoid,46,20.0,29.0,30.0,,,,37.0,49.0,3.3321254690993696,7.170111571820255,9.35011671372917,16.0,26.0,79.0,,COMPLETE
5350,0.21300166375847096,2024-04-11 17:22:11.574987,2024-04-11 17:22:12.658946,0 days 00:00:01.083959,90.84870281771676,8.295689859057983,sigmoid,2,,,,,,,,,4.288740032015752,2.6947125690568283,2.663813261187395,15.0,23.0,83.0,,COMPLETE
5351,0.42732610932865184,2024-04-11 17:22:12.660947,2024-04-11 17:22:13.877112,0 days 00:00:01.216165,98.32967327164536,7.849909069654413,sigmoid,28,,24.0,34.0,4.0,1.0,66.0,4.0,46.0,,,,,,,,COMPLETE
5352,0.4957990930644753,2024-04-11 17:22:13.879109,2024-04-11 17:22:14.918913,0 days 00:00:01.039804,99.99135802547177,8.123350487064542,sigmoid,41,28.0,26.0,31.0,,,,,,,,,,,,80.0,COMPLETE
5353,0.45309819143250923,2024-04-11 17:22:14.921430,2024-04-11 17:22:15.864735,0 days 00:00:00.943305,95.0843539462746,8.400734129864215,sigmoid,8,,23.0,7.0,,,,,,,,,,,,,COMPLETE
5354,0.27144779850028844,2024-04-11 17:22:15.867302,2024-04-11 17:22:17.075243,0 days 00:00:01.207941,98.16500829070544,7.452082488391951,sigmoid,10,,25.0,32.0,,,,,,5.081064160156215,5.88532144164062,5.676751062266342,20.0,28.0,63.0,,COMPLETE
5355,0.4537299909392932,2024-04-11 17:22:17.077185,2024-04-11 17:22:18.538252,0 days 00:00:01.461067,99.94578543159743,7.974138599561318,rbf,8,,28.0,29.0,,,,,,,,,,,,,COMPLETE
5356,0.3259181453276813,2024-04-11 17:22:18.539844,2024-04-11 17:22:19.586802,0 days 00:00:01.046958,96.41036736805795,7.222677998224032,sigmoid,20,,,,6.0,6.0,69.0,18.0,4.0,,,,,,,,COMPLETE
5357,0.45743987910684974,2024-04-11 17:22:19.588798,2024-04-11 17:22:21.003568,0 days 00:00:01.414770,98.11271910636125,8.206765177433963,sigmoid,26,,27.0,31.0,2.0,8.0,50.0,,,9.033206504801619,3.0006774777499237,7.98512443660515,3.0,24.0,50.0,,COMPLETE
5358,0.5929369437606513,2024-04-11 17:22:21.005564,2024-04-11 17:22:21.917923,0 days 00:00:00.912359,71.19528508570252,6.638196322141632,sigmoid,8,,23.0,33.0,,,,,,,,,,,,,COMPLETE
5359,0.5232628273122439,2024-04-11 17:22:21.919929,2024-04-11 17:22:22.933206,0 days 00:00:01.013277,92.77107079679182,7.772799318238684,sigmoid,37,25.0,,,,,,43.0,21.0,,,,,,,92.0,COMPLETE
5360,0.5092148868702763,2024-04-11 17:22:22.936180,2024-04-11 17:22:24.173493,0 days 00:00:01.237313,99.96350463236851,8.690607407936998,sigmoid,11,,26.0,30.0,,,,,,6.012957330648599,6.880861379752379,7.694994643013364,19.0,42.0,71.0,49.0,COMPLETE
5361,0.4709226692363286,2024-04-11 17:22:24.175495,2024-04-11 17:22:25.311057,0 days 00:00:01.135562,99.96550304839519,8.447474435794275,sigmoid,56,15.0,24.0,28.0,1.0,4.0,15.0,,,,,,,,,,COMPLETE
5362,0.5816943051806145,2024-04-11 17:22:25.313060,2024-04-11 17:22:26.385407,0 days 00:00:01.072347,96.69380118201545,8.065882425767509,sigmoid,8,,25.0,3.0,,,,,,,,,,,,,COMPLETE
5363,0.5952371952371952,2024-04-11 17:22:26.387390,2024-04-11 17:22:27.274949,0 days 00:00:00.887559,94.7761928097017,7.636994706451023,sigmoid,8,,22.0,32.0,,,,,,,,,,,,,COMPLETE
5364,0.36639676113360325,2024-04-11 17:22:27.276897,2024-04-11 17:22:28.240078,0 days 00:00:00.963181,96.84150112784268,8.253303762889852,sigmoid,48,32.0,,,3.0,5.0,79.0,,,,,,,,,,COMPLETE
5365,0.46609842144567765,2024-04-11 17:22:28.242062,2024-04-11 17:22:29.782213,0 days 00:00:01.540151,98.20666251163219,6.270552410162849,sigmoid,59,47.0,12.0,31.0,8.0,4.0,90.0,,,8.526998436229782,3.557418504787811,4.790660655108968,6.0,25.0,97.0,97.0,COMPLETE
5366,0.44701971028259324,2024-04-11 17:22:29.784230,2024-04-11 17:22:30.729265,0 days 00:00:00.945035,93.7845072407373,7.916986569284308,sigmoid,8,,27.0,30.0,,,,,,,,,,,,,COMPLETE
5367,0.5952371952371952,2024-04-11 17:22:30.731220,2024-04-11 17:22:31.627761,0 days 00:00:00.896541,98.20180642818698,8.096909449014907,sigmoid,8,,26.0,32.0,,,,,,,,,,,,,COMPLETE
5368,0.48609658712805404,2024-04-11 17:22:31.629757,2024-04-11 17:22:32.789614,0 days 00:00:01.159857,99.94250406893856,4.09181787767217,sigmoid,52,2.0,,,7.0,2.0,75.0,5.0,38.0,,,,,,,,COMPLETE
5369,0.47383427075503487,2024-04-11 17:22:32.791172,2024-04-11 17:22:34.249409,0 days 00:00:01.458237,96.74218925055985,7.783879042976496,sigmoid,55,11.0,,,1.0,7.0,45.0,20.0,18.0,6.292666746223209,2.334196030027494,8.969538704699442,9.0,30.0,93.0,61.0,COMPLETE
5370,0.4765015600624025,2024-04-11 17:22:34.251382,2024-04-11 17:22:35.798542,0 days 00:00:01.547160,95.16529155465385,8.495185038895634,sigmoid,62,22.0,24.0,25.0,5.0,3.0,38.0,50.0,8.0,2.848783095858008,7.642389241796573,4.500066980587182,14.0,33.0,75.0,,COMPLETE
5371,0.5039903529927647,2024-04-11 17:22:35.801100,2024-04-11 17:22:36.786092,0 days 00:00:00.984992,2.6090898883121625,9.022628647533656,sigmoid,12,,25.0,33.0,,,,21.0,9.0,,,,,,,,COMPLETE
5372,0.12622036262203626,2024-04-11 17:22:36.788089,2024-04-11 17:22:37.658769,0 days 00:00:00.870680,98.36409184626086,8.28567541874399,sigmoid,8,,26.0,29.0,,,,,,,,,,,,,COMPLETE
5373,0.5022420529213283,2024-04-11 17:22:37.660767,2024-04-11 17:22:38.779176,0 days 00:00:01.118409,98.1679548248117,7.507806685252193,sigmoid,44,49.0,28.0,31.0,,,,26.0,11.0,,,,,,,,COMPLETE
5374,0.12573474404189378,2024-04-11 17:22:38.781176,2024-04-11 17:22:40.356164,0 days 00:00:01.574988,99.98171783720375,7.9945366634984865,rbf,23,,,,6.0,1.0,12.0,10.0,47.0,5.544260925879914,1.7577512134246365,9.60564271488613,18.0,29.0,96.0,182.0,COMPLETE
5375,0.5527967875120186,2024-04-11 17:22:40.358165,2024-04-11 17:22:41.306273,0 days 00:00:00.948108,96.56011804063884,7.740321040475542,sigmoid,36,7.0,,,,,,28.0,50.0,,,,,,,,COMPLETE
5376,0.44701971028259324,2024-04-11 17:22:41.308271,2024-04-11 17:22:42.239403,0 days 00:00:00.931132,99.98775077965828,8.159334366400394,sigmoid,8,,24.0,30.0,,,,,,,,,,,,,COMPLETE
5377,0.3537648189682794,2024-04-11 17:22:42.241366,2024-04-11 17:22:43.323860,0 days 00:00:01.082494,95.13795611271705,8.371041842829277,sigmoid,13,,25.0,31.0,,,,2.0,22.0,,,,,,,23.0,COMPLETE
5378,0.4547495589886139,2024-04-11 17:22:43.324864,2024-04-11 17:22:44.718416,0 days 00:00:01.393552,96.77812351389038,7.923505542851978,sigmoid,54,18.0,,,4.0,6.0,94.0,22.0,6.0,1.1022482326418226,4.098622927800828,7.1760939168216265,4.0,37.0,69.0,,COMPLETE
5379,0.5303184713375797,2024-04-11 17:22:44.720457,2024-04-11 17:22:45.941202,0 days 00:00:01.220745,98.30093443708958,8.116841426218746,sigmoid,7,,,,,,,6.0,3.0,4.6193905929828,0.5031921282962353,6.117435441809208,7.0,28.0,87.0,101.0,COMPLETE
5380,0.27083066136548245,2024-04-11 17:22:45.943200,2024-04-11 17:22:46.896111,0 days 00:00:00.952911,93.0756284679542,8.637944226874223,sigmoid,40,36.0,22.0,34.0,,,,,,,,,,,,,COMPLETE
5381,0.41005890348889895,2024-04-11 17:22:46.898105,2024-04-11 17:22:48.148903,0 days 00:00:01.250798,62.01473223668262,7.870260692823232,sigmoid,60,45.0,23.0,32.0,3.0,8.0,32.0,34.0,14.0,,,,,,,,COMPLETE
5382,0.44701971028259324,2024-04-11 17:22:48.150904,2024-04-11 17:22:49.048410,0 days 00:00:00.897506,98.25212946393336,7.6088812722501284,sigmoid,8,,30.0,30.0,,,,,,,,,,,,,COMPLETE
