number,value,datetime_start,datetime_complete,duration,params_C,params_gamma,params_kernel,params_mask_number,params_rsi_window,params_so_smooth,params_so_window,params_srsi_smooth1,params_srsi_smooth2,params_srsi_window,params_tsi_window_fast,params_tsi_window_slow,params_ult_weight_1,params_ult_weight_2,params_ult_weight_3,params_ult_window_1,params_ult_window_2,params_ult_window_3,params_williams_lbp,state
1453,0.34865801977655064,2024-04-11 16:14:32.088399,2024-04-11 16:14:32.680682,0 days 00:00:00.592283,95.53991173164019,1.7640790452675437,sigmoid,24,,18.0,47.0,4.0,8.0,25.0,,,,,,,,,,COMPLETE
1454,0.5863711449328822,2024-04-11 16:14:32.681875,2024-04-11 16:14:33.097307,0 days 00:00:00.415432,90.44248021111864,0.6622528341370713,sigmoid,0,,,,,,,,,,,,,,,,COMPLETE
1455,0.4711993995966039,2024-04-11 16:14:33.098307,2024-04-11 16:14:33.752181,0 days 00:00:00.653874,99.94643504303194,1.3474540213345856,sigmoid,18,,,,2.0,6.0,66.0,,,5.571181664992922,5.691226919625102,4.605821852250049,4.0,41.0,59.0,,COMPLETE
1456,0.31587051738297295,2024-04-11 16:14:33.754181,2024-04-11 16:14:34.490977,0 days 00:00:00.736796,92.94710468941443,0.9430218556891337,sigmoid,43,37.0,5.0,3.0,,,,,,3.4540926166786856,6.307149716999993,0.8467440238883519,12.0,43.0,76.0,14.0,COMPLETE
1457,0.10973929339139063,2024-04-11 16:14:34.491979,2024-04-11 16:14:35.053681,0 days 00:00:00.561702,97.0867535676398,0.43749066059175246,sigmoid,2,,,,,,,,,4.008744983652471,4.522503994523119,3.6350816468427367,8.0,50.0,80.0,,COMPLETE
1458,0.25815411177419956,2024-04-11 16:14:35.055676,2024-04-11 16:14:35.768891,0 days 00:00:00.713215,90.68228038707613,1.1351272718721934,sigmoid,22,,,,3.0,1.0,43.0,14.0,21.0,7.274371552603084,9.46300777639964,3.279019000386576,2.0,31.0,83.0,,COMPLETE
1459,0.5073173862809707,2024-04-11 16:14:35.770113,2024-04-11 16:14:36.440288,0 days 00:00:00.670175,94.61477646718122,1.6241330341912437,sigmoid,35,20.0,,,,,,,,0.7649915967924592,8.927110806227292,2.647750770431254,11.0,46.0,68.0,111.0,COMPLETE
1460,0.3635178464465663,2024-04-11 16:14:36.441337,2024-04-11 16:14:37.158634,0 days 00:00:00.717297,97.28664895912745,0.882518790764054,sigmoid,39,14.0,,,,,,19.0,38.0,7.518596593734667,1.9554261683546832,5.605543609841156,14.0,29.0,87.0,99.0,COMPLETE
1461,0.4690153269379203,2024-04-11 16:14:37.160634,2024-04-11 16:14:38.006522,0 days 00:00:00.845888,92.81116378575645,0.7100731273134335,sigmoid,31,,6.0,20.0,5.0,7.0,73.0,42.0,8.0,5.189063654016152,6.798796284309863,2.2400959916787584,4.0,36.0,92.0,76.0,COMPLETE
1462,0.5402409124826778,2024-04-11 16:14:38.008509,2024-04-11 16:14:38.790792,0 days 00:00:00.782283,98.25938156273524,1.3784673522554887,sigmoid,38,33.0,,,,,,6.0,25.0,8.642986110932364,9.66908424948386,1.9768476791498166,2.0,45.0,62.0,,COMPLETE
1463,0.5875733772896237,2024-04-11 16:14:38.791790,2024-04-11 16:14:39.301537,0 days 00:00:00.509747,95.15144685370795,1.0976072616068115,sigmoid,0,,,,,,,,,,,,,,,,COMPLETE
1464,0.3267263653417336,2024-04-11 16:14:39.303566,2024-04-11 16:14:40.196646,0 days 00:00:00.893080,92.05279541395117,0.9463819091417462,rbf,0,,,,,,,,,,,,,,,,COMPLETE
1465,0.2020383402086872,2024-04-11 16:14:40.197646,2024-04-11 16:14:40.894198,0 days 00:00:00.696552,32.06300775374582,0.2835458256220389,sigmoid,3,,,,,,,,,6.026167456540759,7.342261029410951,7.829943581440314,12.0,43.0,60.0,22.0,COMPLETE
1466,0.3690913953332887,2024-04-11 16:14:40.895193,2024-04-11 16:14:41.695394,0 days 00:00:00.800201,48.842729518994915,1.3121512195258922,sigmoid,15,,43.0,22.0,,,,22.0,48.0,0.5099215026328725,7.654039804096539,1.053294645519685,9.0,35.0,51.0,166.0,COMPLETE
1467,0.5863711449328822,2024-04-11 16:14:41.697388,2024-04-11 16:14:42.129620,0 days 00:00:00.432232,90.33147557168496,0.5690836344341776,sigmoid,0,,,,,,,,,,,,,,,,COMPLETE
1468,0.4725966081464167,2024-04-11 16:14:42.130671,2024-04-11 16:14:42.882118,0 days 00:00:00.751447,96.40506614821321,1.137888784979869,sigmoid,57,26.0,11.0,11.0,8.0,4.0,97.0,,,,,,,,,104.0,COMPLETE
1469,0.43290533736153075,2024-04-11 16:14:42.883151,2024-04-11 16:14:43.525728,0 days 00:00:00.642577,99.96631139165001,7.953684730490814,sigmoid,21,,,,4.0,2.0,79.0,26.0,35.0,,,,,,,69.0,COMPLETE
1470,0.5794344378415175,2024-04-11 16:14:43.526728,2024-04-11 16:14:43.992689,0 days 00:00:00.465961,93.98800045008164,1.5614208747505285,sigmoid,0,,,,,,,,,,,,,,,,COMPLETE
1471,0.4877940291478061,2024-04-11 16:14:43.993868,2024-04-11 16:14:44.668539,0 days 00:00:00.674671,96.84138387179311,0.8067404911800155,sigmoid,28,,24.0,28.0,1.0,5.0,54.0,20.0,33.0,,,,,,,,COMPLETE
1472,0.5042527595449653,2024-04-11 16:14:44.669719,2024-04-11 16:14:45.143490,0 days 00:00:00.473771,92.70921854907647,1.0143638692777992,sigmoid,1,,,,,,,,,,,,,,,91.0,COMPLETE
1473,0.5860647931709175,2024-04-11 16:14:45.144491,2024-04-11 16:14:45.630327,0 days 00:00:00.485836,89.96292426070474,1.2425341438808917,sigmoid,0,,,,,,,,,,,,,,,,COMPLETE
1474,0.44463119787963024,2024-04-11 16:14:45.631323,2024-04-11 16:14:46.172141,0 days 00:00:00.540818,94.81562012198793,0.6510837851939528,sigmoid,16,,,,7.0,6.0,58.0,,,,,,,,,,COMPLETE
1475,0.514904143475572,2024-04-11 16:14:46.173232,2024-04-11 16:14:46.801588,0 days 00:00:00.628356,98.18530991164077,0.8779021221954371,sigmoid,9,,7.0,7.0,,,,,,,,,,,,39.0,COMPLETE
1476,0.5225580276332975,2024-04-11 16:14:46.802589,2024-04-11 16:14:47.509403,0 days 00:00:00.706814,95.61002782025105,1.467409806545291,sigmoid,42,3.0,33.0,35.0,,,,,,4.705899459990255,7.980741542441604,4.780412000215801,3.0,25.0,85.0,,COMPLETE
1477,0.36440880395836883,2024-04-11 16:14:47.510398,2024-04-11 16:14:48.248894,0 days 00:00:00.738496,91.87970256079925,1.0833476455025195,sigmoid,46,50.0,39.0,23.0,,,,39.0,26.0,1.4594758345454422,2.639713308715707,4.365426503625011,6.0,49.0,66.0,,COMPLETE
1478,0.24848323812054382,2024-04-11 16:14:48.251120,2024-04-11 16:14:48.966259,0 days 00:00:00.715139,97.67204344192744,0.45629305780842006,sigmoid,14,,19.0,8.0,,,,29.0,14.0,2.0220823675042703,2.313916948033591,2.4456880214569465,5.0,26.0,93.0,,COMPLETE
1479,0.5854322450482764,2024-04-11 16:14:48.968544,2024-04-11 16:14:49.437857,0 days 00:00:00.469313,89.6095627165906,0.7415709482546491,sigmoid,0,,,,,,,,,,,,,,,,COMPLETE
1480,0.5975287681569516,2024-04-11 16:14:49.438858,2024-04-11 16:14:49.906206,0 days 00:00:00.467348,99.9536774459601,9.761583016265629,sigmoid,8,,22.0,32.0,,,,,,,,,,,,,COMPLETE
1481,0.5952371952371952,2024-04-11 16:14:49.908204,2024-04-11 16:14:50.397455,0 days 00:00:00.489251,99.72091786497737,7.8899621294621785,sigmoid,8,,22.0,32.0,,,,,,,,,,,,,COMPLETE
1482,0.44646993351983877,2024-04-11 16:14:50.399465,2024-04-11 16:14:50.893914,0 days 00:00:00.494449,99.37086770626813,0.0768713218998548,sigmoid,41,13.0,26.0,31.0,,,,,,,,,,,,83.0,COMPLETE
1483,0.4625093565289214,2024-04-11 16:14:50.894914,2024-04-11 16:14:51.693607,0 days 00:00:00.798693,98.59443756022938,8.026023333210404,sigmoid,63,48.0,28.0,32.0,6.0,3.0,9.0,27.0,42.0,4.441207164793826,3.327255016036877,5.4506745111935935,10.0,40.0,73.0,47.0,COMPLETE
1484,0.4699194270367055,2024-04-11 16:14:51.695603,2024-04-11 16:14:53.046035,0 days 00:00:01.350432,98.58653369878945,9.269770375557613,rbf,8,,22.0,34.0,,,,,,,,,,,,,COMPLETE
1485,0.45345352376492626,2024-04-11 16:14:53.047088,2024-04-11 16:14:53.501354,0 days 00:00:00.454266,99.82163326118587,8.356260866864517,sigmoid,8,,24.0,30.0,,,,,,,,,,,,,COMPLETE
1486,0.4223368093564556,2024-04-11 16:14:53.502406,2024-04-11 16:14:54.225365,0 days 00:00:00.722959,99.69593311597193,9.725639938372762,sigmoid,26,,21.0,33.0,3.0,2.0,84.0,,,5.0041588718515095,9.251259531148001,1.6293756842678997,17.0,38.0,78.0,,COMPLETE
1487,0.4863132132691335,2024-04-11 16:14:54.226353,2024-04-11 16:14:54.700333,0 days 00:00:00.473980,98.36153737315362,7.307424022897715,sigmoid,8,,31.0,37.0,,,,,,,,,,,,,COMPLETE
1488,0.3698953525245762,2024-04-11 16:14:54.701333,2024-04-11 16:14:55.388317,0 days 00:00:00.686984,99.85566204298023,5.167337541120323,sigmoid,11,,19.0,28.0,,,,,,6.667217394030144,6.521049526038878,6.765108665939377,7.0,42.0,90.0,86.0,COMPLETE
1489,0.4408578067695065,2024-04-11 16:14:55.390492,2024-04-11 16:14:56.196847,0 days 00:00:00.806355,99.95283255757643,7.198321266867952,sigmoid,62,29.0,25.0,25.0,2.0,5.0,61.0,38.0,9.0,7.679098792426528,8.699662167330809,3.9382525830227464,3.0,44.0,69.0,,COMPLETE
1490,0.12622036262203626,2024-04-11 16:14:56.197954,2024-04-11 16:14:56.682225,0 days 00:00:00.484271,98.28567300042143,8.36448698584279,sigmoid,8,,23.0,29.0,,,,,,,,,,,,,COMPLETE
1491,0.589816700610998,2024-04-11 16:14:56.683225,2024-04-11 16:14:57.166781,0 days 00:00:00.483556,96.99055273878109,5.513676899867246,sigmoid,8,,30.0,26.0,,,,,,,,,,,,,COMPLETE
1492,0.5103176725080816,2024-04-11 16:14:57.168788,2024-04-11 16:14:57.811073,0 days 00:00:00.642285,99.85282782026796,8.572197198225936,sigmoid,18,,,,7.0,7.0,29.0,,,8.071897079111121,7.029424478495158,4.211992695396611,8.0,39.0,82.0,,COMPLETE
1493,0.519853249475891,2024-04-11 16:14:57.813292,2024-04-11 16:14:58.642188,0 days 00:00:00.828896,97.27637752257417,9.057093478911426,sigmoid,10,,30.0,26.0,,,,,,2.2789055871414567,5.156694686290965,7.24122865980219,4.0,33.0,100.0,,COMPLETE
1494,0.4889008938218249,2024-04-11 16:14:58.643189,2024-04-11 16:14:59.227105,0 days 00:00:00.583916,97.23547297369069,5.193050084934918,sigmoid,20,,,,4.0,8.0,35.0,33.0,44.0,,,,,,,,COMPLETE
1495,0.4439811124057153,2024-04-11 16:14:59.228338,2024-04-11 16:14:59.817800,0 days 00:00:00.589462,99.92954488500331,8.83899697028125,sigmoid,56,18.0,29.0,27.0,5.0,4.0,91.0,,,,,,,,,,COMPLETE
1496,0.6009432182607054,2024-04-11 16:14:59.819801,2024-04-11 16:15:00.391153,0 days 00:00:00.571352,97.35907502821735,7.625841924241047,sigmoid,8,,27.0,31.0,,,,,,,,,,,,,COMPLETE
1497,0.5952371952371952,2024-04-11 16:15:00.392176,2024-04-11 16:15:00.929286,0 days 00:00:00.537110,99.91519926101392,7.842355807498541,sigmoid,8,,26.0,32.0,,,,,,,,,,,,,COMPLETE
1498,0.5963643249384587,2024-04-11 16:15:00.930257,2024-04-11 16:15:01.434875,0 days 00:00:00.504618,98.6242098849759,8.399952075848855,sigmoid,8,,26.0,32.0,,,,,,,,,,,,,COMPLETE
1499,0.5952371952371952,2024-04-11 16:15:01.435875,2024-04-11 16:15:01.985659,0 days 00:00:00.549784,99.77775250697276,7.793250014645579,sigmoid,8,,25.0,32.0,,,,,,,,,,,,,COMPLETE
1500,0.5952371952371952,2024-04-11 16:15:01.987660,2024-04-11 16:15:02.466374,0 days 00:00:00.478714,99.62821023771093,7.814555348796173,sigmoid,8,,27.0,32.0,,,,,,,,,,,,,COMPLETE
1501,0.6009432182607054,2024-04-11 16:15:02.467375,2024-04-11 16:15:02.924342,0 days 00:00:00.456967,98.57941917105386,7.8758888908670714,sigmoid,8,,26.0,31.0,,,,,,,,,,,,,COMPLETE
1502,0.5952371952371952,2024-04-11 16:15:02.925343,2024-04-11 16:15:03.379896,0 days 00:00:00.454553,99.82243326350245,7.866911292507806,sigmoid,8,,26.0,32.0,,,,,,,,,,,,,COMPLETE
1503,0.5952371952371952,2024-04-11 16:15:03.380897,2024-04-11 16:15:03.945372,0 days 00:00:00.564475,99.99573519041628,7.877862498725528,sigmoid,8,,26.0,32.0,,,,,,,,,,,,,COMPLETE
1504,0.5952371952371952,2024-04-11 16:15:03.946383,2024-04-11 16:15:04.409688,0 days 00:00:00.463305,99.50537886323617,7.87693765104762,sigmoid,8,,26.0,32.0,,,,,,,,,,,,,COMPLETE
1505,0.6009432182607054,2024-04-11 16:15:04.411689,2024-04-11 16:15:04.880186,0 days 00:00:00.468497,97.58761329350614,7.701333301491742,sigmoid,8,,26.0,31.0,,,,,,,,,,,,,COMPLETE
1506,0.5952371952371952,2024-04-11 16:15:04.881187,2024-04-11 16:15:05.336407,0 days 00:00:00.455220,99.2656690464461,7.864263868268548,sigmoid,8,,26.0,32.0,,,,,,,,,,,,,COMPLETE
1507,0.5952371952371952,2024-04-11 16:15:05.337409,2024-04-11 16:15:05.816273,0 days 00:00:00.478864,99.88111316349284,7.599672211690485,sigmoid,8,,26.0,32.0,,,,,,,,,,,,,COMPLETE
1508,0.5952371952371952,2024-04-11 16:15:05.817361,2024-04-11 16:15:06.285026,0 days 00:00:00.467665,99.40225846721557,7.731765895688159,sigmoid,8,,26.0,32.0,,,,,,,,,,,,,COMPLETE
1509,0.5952371952371952,2024-04-11 16:15:06.287025,2024-04-11 16:15:06.780562,0 days 00:00:00.493537,99.59808134159148,7.746040537888107,sigmoid,8,,26.0,32.0,,,,,,,,,,,,,COMPLETE
1510,0.5952371952371952,2024-04-11 16:15:06.781570,2024-04-11 16:15:07.336683,0 days 00:00:00.555113,99.84893033716108,7.85654747564292,sigmoid,8,,26.0,32.0,,,,,,,,,,,,,COMPLETE
1511,0.5952371952371952,2024-04-11 16:15:07.338695,2024-04-11 16:15:07.837407,0 days 00:00:00.498712,99.81310087041557,7.757251868091384,sigmoid,8,,26.0,32.0,,,,,,,,,,,,,COMPLETE
1512,0.5952371952371952,2024-04-11 16:15:07.839412,2024-04-11 16:15:08.326561,0 days 00:00:00.487149,99.8245214822796,7.733142700862838,sigmoid,8,,26.0,32.0,,,,,,,,,,,,,COMPLETE
1513,0.4496894409937888,2024-04-11 16:15:08.327562,2024-04-11 16:15:09.579284,0 days 00:00:01.251722,99.9984296227926,7.7637422612662474,rbf,8,,26.0,32.0,,,,,,,,,,,,,COMPLETE
1514,0.5952371952371952,2024-04-11 16:15:09.580341,2024-04-11 16:15:10.050919,0 days 00:00:00.470578,99.59842833215193,7.863427933286319,sigmoid,8,,27.0,32.0,,,,,,,,,,,,,COMPLETE
1515,0.5952371952371952,2024-04-11 16:15:10.052086,2024-04-11 16:15:10.511120,0 days 00:00:00.459034,99.9436608358516,7.822843918038847,sigmoid,8,,27.0,32.0,,,,,,,,,,,,,COMPLETE
1516,0.5952371952371952,2024-04-11 16:15:10.512144,2024-04-11 16:15:10.967652,0 days 00:00:00.455508,99.63557665852834,7.785451183050019,sigmoid,8,,27.0,32.0,,,,,,,,,,,,,COMPLETE
1517,0.5952371952371952,2024-04-11 16:15:10.968679,2024-04-11 16:15:11.443432,0 days 00:00:00.474753,99.6159123219148,7.824054828991903,sigmoid,8,,27.0,32.0,,,,,,,,,,,,,COMPLETE
1518,0.5952371952371952,2024-04-11 16:15:11.444440,2024-04-11 16:15:11.921054,0 days 00:00:00.476614,99.6092151270344,7.571356833456715,sigmoid,8,,27.0,32.0,,,,,,,,,,,,,COMPLETE
1519,0.5952371952371952,2024-04-11 16:15:11.922180,2024-04-11 16:15:12.381242,0 days 00:00:00.459062,99.59128726829063,7.780902197949907,sigmoid,8,,27.0,32.0,,,,,,,,,,,,,COMPLETE
1520,0.5952371952371952,2024-04-11 16:15:12.382348,2024-04-11 16:15:12.838325,0 days 00:00:00.455977,99.77626239833455,7.62459683314016,sigmoid,8,,27.0,32.0,,,,,,,,,,,,,COMPLETE
1521,0.5952371952371952,2024-04-11 16:15:12.840380,2024-04-11 16:15:13.375202,0 days 00:00:00.534822,99.68019149516228,7.794621849785555,sigmoid,8,,26.0,32.0,,,,,,,,,,,,,COMPLETE
1522,0.6009432182607054,2024-04-11 16:15:13.376196,2024-04-11 16:15:13.851586,0 days 00:00:00.475390,99.92382089216196,8.150237515141377,sigmoid,8,,27.0,31.0,,,,,,,,,,,,,COMPLETE
1523,0.6009432182607054,2024-04-11 16:15:13.852595,2024-04-11 16:15:14.326432,0 days 00:00:00.473837,99.98105954008763,8.138514322857207,sigmoid,8,,26.0,31.0,,,,,,,,,,,,,COMPLETE
1524,0.5986580986580987,2024-04-11 16:15:14.327573,2024-04-11 16:15:14.828076,0 days 00:00:00.500503,99.94250154467528,8.178580721323335,sigmoid,8,,26.0,31.0,,,,,,,,,,,,,COMPLETE
1525,0.5986580986580987,2024-04-11 16:15:14.829240,2024-04-11 16:15:15.302314,0 days 00:00:00.473074,99.55038607701854,8.185437687672001,sigmoid,8,,26.0,31.0,,,,,,,,,,,,,COMPLETE
1526,0.6009432182607054,2024-04-11 16:15:15.303386,2024-04-11 16:15:15.762003,0 days 00:00:00.458617,99.4849723463495,8.126076511295247,sigmoid,8,,26.0,31.0,,,,,,,,,,,,,COMPLETE
1527,0.6009432182607054,2024-04-11 16:15:15.763004,2024-04-11 16:15:16.224168,0 days 00:00:00.461164,99.98419931104455,8.12841106312896,sigmoid,8,,25.0,31.0,,,,,,,,,,,,,COMPLETE
1528,0.6009432182607054,2024-04-11 16:15:16.225174,2024-04-11 16:15:16.686171,0 days 00:00:00.460997,99.90531017964905,8.109076072836425,sigmoid,8,,25.0,31.0,,,,,,,,,,,,,COMPLETE
1529,0.6009432182607054,2024-04-11 16:15:16.687367,2024-04-11 16:15:17.147959,0 days 00:00:00.460592,99.83468792345677,8.159969713440658,sigmoid,8,,25.0,31.0,,,,,,,,,,,,,COMPLETE
1530,0.6009432182607054,2024-04-11 16:15:17.148960,2024-04-11 16:15:17.605279,0 days 00:00:00.456319,99.90150156634246,8.144690980695708,sigmoid,8,,25.0,31.0,,,,,,,,,,,,,COMPLETE
1531,0.5986580986580987,2024-04-11 16:15:17.606468,2024-04-11 16:15:18.062487,0 days 00:00:00.456019,99.9705759947609,8.169684351261404,sigmoid,8,,25.0,31.0,,,,,,,,,,,,,COMPLETE
1532,0.6009432182607054,2024-04-11 16:15:18.063541,2024-04-11 16:15:18.522163,0 days 00:00:00.458622,99.62291177500974,8.151182362401993,sigmoid,8,,25.0,31.0,,,,,,,,,,,,,COMPLETE
1533,0.6009432182607054,2024-04-11 16:15:18.523164,2024-04-11 16:15:18.974408,0 days 00:00:00.451244,99.98714027779276,8.156230709177242,sigmoid,8,,25.0,31.0,,,,,,,,,,,,,COMPLETE
1534,0.45345352376492626,2024-04-11 16:15:18.975528,2024-04-11 16:15:19.444215,0 days 00:00:00.468687,99.7103646622231,8.24758545070068,sigmoid,8,,25.0,30.0,,,,,,,,,,,,,COMPLETE
1535,0.6009432182607054,2024-04-11 16:15:19.445214,2024-04-11 16:15:20.009927,0 days 00:00:00.564713,99.63499610094809,8.13091254974746,sigmoid,8,,25.0,31.0,,,,,,,,,,,,,COMPLETE
1536,0.6009432182607054,2024-04-11 16:15:20.012101,2024-04-11 16:15:20.574155,0 days 00:00:00.562054,99.91336834919984,8.130415143178512,sigmoid,8,,25.0,31.0,,,,,,,,,,,,,COMPLETE
1537,0.47961457392351703,2024-04-11 16:15:20.575154,2024-04-11 16:15:21.926218,0 days 00:00:01.351064,98.86453572890431,8.04440533031964,rbf,8,,24.0,30.0,,,,,,,,,,,,,COMPLETE
1538,0.6009432182607054,2024-04-11 16:15:21.928211,2024-04-11 16:15:22.394578,0 days 00:00:00.466367,99.59778631426495,8.166142023743586,sigmoid,8,,25.0,31.0,,,,,,,,,,,,,COMPLETE
1539,0.5986580986580987,2024-04-11 16:15:22.395575,2024-04-11 16:15:22.857466,0 days 00:00:00.461891,99.47266234905501,8.192768016810609,sigmoid,8,,25.0,31.0,,,,,,,,,,,,,COMPLETE
1540,0.44701971028259324,2024-04-11 16:15:22.858463,2024-04-11 16:15:23.321302,0 days 00:00:00.462839,99.9988110014346,8.160332819227433,sigmoid,8,,25.0,30.0,,,,,,,,,,,,,COMPLETE
1541,0.5974957313602731,2024-04-11 16:15:23.323303,2024-04-11 16:15:23.804807,0 days 00:00:00.481504,99.73390378039052,8.476482153337876,sigmoid,8,,24.0,31.0,,,,,,,,,,,,,COMPLETE
1542,0.5963245096172158,2024-04-11 16:15:23.805808,2024-04-11 16:15:24.320789,0 days 00:00:00.514981,99.58798359169496,8.522303425565148,sigmoid,8,,24.0,31.0,,,,,,,,,,,,,COMPLETE
1543,0.5963245096172158,2024-04-11 16:15:24.321792,2024-04-11 16:15:24.915778,0 days 00:00:00.593986,98.56925771213393,8.394150628193463,sigmoid,8,,24.0,31.0,,,,,,,,,,,,,COMPLETE
1544,0.5974957313602731,2024-04-11 16:15:24.918027,2024-04-11 16:15:25.392126,0 days 00:00:00.474099,99.79702060196857,8.458908875888447,sigmoid,8,,24.0,31.0,,,,,,,,,,,,,COMPLETE
1545,0.45345352376492626,2024-04-11 16:15:25.393132,2024-04-11 16:15:25.858780,0 days 00:00:00.465648,98.4836103520537,8.52768090365801,sigmoid,8,,24.0,30.0,,,,,,,,,,,,,COMPLETE
1546,0.5986314388899449,2024-04-11 16:15:25.859790,2024-04-11 16:15:26.319160,0 days 00:00:00.459370,98.06845607097378,8.490338270311955,sigmoid,8,,24.0,31.0,,,,,,,,,,,,,COMPLETE
1547,0.4502698896972542,2024-04-11 16:15:26.320368,2024-04-11 16:15:26.793615,0 days 00:00:00.473247,98.31876584488077,8.208524058851681,sigmoid,8,,24.0,30.0,,,,,,,,,,,,,COMPLETE
1548,0.5963245096172158,2024-04-11 16:15:26.794618,2024-04-11 16:15:27.256363,0 days 00:00:00.461745,99.83425726401079,8.636249453310068,sigmoid,8,,25.0,31.0,,,,,,,,,,,,,COMPLETE
1549,0.5974957313602731,2024-04-11 16:15:27.257362,2024-04-11 16:15:27.715988,0 days 00:00:00.458626,99.9810149556853,8.46579674632723,sigmoid,8,,25.0,31.0,,,,,,,,,,,,,COMPLETE
1550,0.4502698896972542,2024-04-11 16:15:27.717209,2024-04-11 16:15:28.206035,0 days 00:00:00.488826,98.26941663931686,8.20213130569656,sigmoid,8,,25.0,30.0,,,,,,,,,,,,,COMPLETE
1551,0.5963245096172158,2024-04-11 16:15:28.208044,2024-04-11 16:15:28.667022,0 days 00:00:00.458978,99.89104063380015,8.405728615763607,sigmoid,8,,25.0,31.0,,,,,,,,,,,,,COMPLETE
1552,0.44701971028259324,2024-04-11 16:15:28.668020,2024-04-11 16:15:29.179903,0 days 00:00:00.511883,99.86669938826498,8.095015367734112,sigmoid,8,,24.0,30.0,,,,,,,,,,,,,COMPLETE
1553,0.5963245096172158,2024-04-11 16:15:29.180904,2024-04-11 16:15:29.660130,0 days 00:00:00.479226,99.98794260688156,8.728753641813576,sigmoid,8,,25.0,31.0,,,,,,,,,,,,,COMPLETE
1554,0.45345352376492626,2024-04-11 16:15:29.662132,2024-04-11 16:15:30.124457,0 days 00:00:00.462325,98.24612754917091,8.243244035247866,sigmoid,8,,24.0,30.0,,,,,,,,,,,,,COMPLETE
1555,0.476743489973062,2024-04-11 16:15:30.125610,2024-04-11 16:15:31.381184,0 days 00:00:01.255574,98.1926754489145,8.472314187159485,rbf,8,,24.0,31.0,,,,,,,,,,,,,COMPLETE
1556,0.6009432182607054,2024-04-11 16:15:31.383371,2024-04-11 16:15:31.887425,0 days 00:00:00.504054,99.95153270496691,8.145792395376576,sigmoid,8,,25.0,31.0,,,,,,,,,,,,,COMPLETE
1557,0.44701971028259324,2024-04-11 16:15:31.888421,2024-04-11 16:15:32.360508,0 days 00:00:00.472087,99.93780222719835,8.126868807694967,sigmoid,8,,23.0,30.0,,,,,,,,,,,,,COMPLETE
1558,0.12622036262203626,2024-04-11 16:15:32.361517,2024-04-11 16:15:32.828080,0 days 00:00:00.466563,99.93640100393833,8.109755328343288,sigmoid,8,,25.0,29.0,,,,,,,,,,,,,COMPLETE
1559,0.5986580986580987,2024-04-11 16:15:32.829082,2024-04-11 16:15:33.296107,0 days 00:00:00.467025,99.90099594807576,8.275114952322442,sigmoid,8,,25.0,31.0,,,,,,,,,,,,,COMPLETE
1560,0.5986580986580987,2024-04-11 16:15:33.298107,2024-04-11 16:15:33.759485,0 days 00:00:00.461378,98.17568675638198,8.243671809946873,sigmoid,8,,25.0,31.0,,,,,,,,,,,,,COMPLETE
1561,0.44701971028259324,2024-04-11 16:15:33.760606,2024-04-11 16:15:34.240792,0 days 00:00:00.480186,99.9726588354764,8.089258749498718,sigmoid,8,,25.0,30.0,,,,,,,,,,,,,COMPLETE
1562,0.12622036262203626,2024-04-11 16:15:34.242792,2024-04-11 16:15:34.725950,0 days 00:00:00.483158,98.64523099495,8.231929189288744,sigmoid,8,,23.0,29.0,,,,,,,,,,,,,COMPLETE
1563,0.5986580986580987,2024-04-11 16:15:34.728501,2024-04-11 16:15:35.180351,0 days 00:00:00.451850,98.11986448768438,8.28567964125799,sigmoid,8,,25.0,31.0,,,,,,,,,,,,,COMPLETE
1564,0.12622036262203626,2024-04-11 16:15:35.181353,2024-04-11 16:15:35.645688,0 days 00:00:00.464335,97.77639432170776,8.054840389213787,sigmoid,8,,25.0,29.0,,,,,,,,,,,,,COMPLETE
