number,value,datetime_start,datetime_complete,duration,params_C,params_gamma,params_kernel,params_mask_number,params_rsi_window,params_so_smooth,params_so_window,params_srsi_smooth1,params_srsi_smooth2,params_srsi_window,params_tsi_window_fast,params_tsi_window_slow,params_ult_weight_1,params_ult_weight_2,params_ult_weight_3,params_ult_window_1,params_ult_window_2,params_ult_window_3,params_williams_lbp,state
1565,0.5929369437606513,2024-04-11 16:15:35.646697,2024-04-11 16:15:36.116206,0 days 00:00:00.469509,97.73351126199609,8.27740639830806,sigmoid,8,,28.0,33.0,,,,,,,,,,,,,COMPLETE
1566,0.44701971028259324,2024-04-11 16:15:36.117218,2024-04-11 16:15:36.599532,0 days 00:00:00.482314,98.01210751010119,8.092261694379875,sigmoid,8,,25.0,30.0,,,,,,,,,,,,,COMPLETE
1567,0.5963245096172158,2024-04-11 16:15:36.600530,2024-04-11 16:15:37.092221,0 days 00:00:00.491691,97.5389703669224,8.706992546991373,sigmoid,8,,25.0,31.0,,,,,,,,,,,,,COMPLETE
1568,0.5929369437606513,2024-04-11 16:15:37.093221,2024-04-11 16:15:37.566569,0 days 00:00:00.473348,98.02710246804496,8.25813527429051,sigmoid,8,,28.0,33.0,,,,,,,,,,,,,COMPLETE
1569,0.6009432182607054,2024-04-11 16:15:37.567566,2024-04-11 16:15:38.057956,0 days 00:00:00.490390,98.16372041453958,8.08287805328249,sigmoid,8,,24.0,31.0,,,,,,,,,,,,,COMPLETE
1570,0.44701971028259324,2024-04-11 16:15:38.058964,2024-04-11 16:15:38.530345,0 days 00:00:00.471381,97.85869480475183,8.026320794539854,sigmoid,8,,25.0,30.0,,,,,,,,,,,,,COMPLETE
1571,0.5986580986580987,2024-04-11 16:15:38.532353,2024-04-11 16:15:39.000275,0 days 00:00:00.467922,97.95739216378821,8.305169637094396,sigmoid,8,,27.0,31.0,,,,,,,,,,,,,COMPLETE
1572,0.12622036262203626,2024-04-11 16:15:39.001274,2024-04-11 16:15:39.455029,0 days 00:00:00.453755,97.97083834995176,8.262385116304745,sigmoid,8,,27.0,29.0,,,,,,,,,,,,,COMPLETE
1573,0.6009432182607054,2024-04-11 16:15:39.456054,2024-04-11 16:15:39.931713,0 days 00:00:00.475659,99.99237143308252,8.049383223166585,sigmoid,8,,28.0,31.0,,,,,,,,,,,,,COMPLETE
1574,0.47961457392351703,2024-04-11 16:15:39.932750,2024-04-11 16:15:41.219977,0 days 00:00:01.287227,99.9630756980216,8.017232749836614,rbf,8,,28.0,30.0,,,,,,,,,,,,,COMPLETE
1575,0.5986580986580987,2024-04-11 16:15:41.221191,2024-04-11 16:15:41.696908,0 days 00:00:00.475717,99.997264217807,7.442035665640251,sigmoid,8,,26.0,31.0,,,,,,,,,,,,,COMPLETE
1576,0.12622036262203626,2024-04-11 16:15:41.698082,2024-04-11 16:15:42.164539,0 days 00:00:00.466457,98.15566023459411,8.066995042160148,sigmoid,8,,25.0,29.0,,,,,,,,,,,,,COMPLETE
1577,0.5986580986580987,2024-04-11 16:15:42.165565,2024-04-11 16:15:42.642969,0 days 00:00:00.477404,98.03870128405995,8.25657632183235,sigmoid,8,,23.0,31.0,,,,,,,,,,,,,COMPLETE
1578,0.4448341684562156,2024-04-11 16:15:42.643970,2024-04-11 16:15:43.108226,0 days 00:00:00.464256,98.06172128076774,8.655856277620575,sigmoid,8,,27.0,30.0,,,,,,,,,,,,,COMPLETE
1579,0.5929369437606513,2024-04-11 16:15:43.109229,2024-04-11 16:15:43.577334,0 days 00:00:00.468105,98.17118401427632,8.029566426059256,sigmoid,8,,26.0,33.0,,,,,,,,,,,,,COMPLETE
1580,0.5986580986580987,2024-04-11 16:15:43.578357,2024-04-11 16:15:44.043848,0 days 00:00:00.465491,98.13766861453885,8.290714186677986,sigmoid,8,,28.0,31.0,,,,,,,,,,,,,COMPLETE
1581,0.5929369437606513,2024-04-11 16:15:44.044844,2024-04-11 16:15:44.544264,0 days 00:00:00.499420,97.95360621119252,8.042957187591073,sigmoid,8,,25.0,33.0,,,,,,,,,,,,,COMPLETE
1582,0.5986580986580987,2024-04-11 16:15:44.549468,2024-04-11 16:15:45.027356,0 days 00:00:00.477888,99.98497917768506,8.198303600288844,sigmoid,8,,24.0,31.0,,,,,,,,,,,,,COMPLETE
1583,0.44701971028259324,2024-04-11 16:15:45.029371,2024-04-11 16:15:45.504549,0 days 00:00:00.475178,97.92907498044771,7.478067957866249,sigmoid,8,,26.0,30.0,,,,,,,,,,,,,COMPLETE
1584,0.5929369437606513,2024-04-11 16:15:45.505592,2024-04-11 16:15:45.966861,0 days 00:00:00.461269,98.02102359554075,8.579669634020384,sigmoid,8,,23.0,33.0,,,,,,,,,,,,,COMPLETE
1585,0.12622036262203626,2024-04-11 16:15:45.967862,2024-04-11 16:15:46.438163,0 days 00:00:00.470301,99.93281539793493,8.035238870684658,sigmoid,8,,27.0,29.0,,,,,,,,,,,,,COMPLETE
1586,0.45345352376492626,2024-04-11 16:15:46.440765,2024-04-11 16:15:46.924729,0 days 00:00:00.483964,99.85299475691494,8.3407243251722,sigmoid,8,,25.0,30.0,,,,,,,,,,,,,COMPLETE
1587,0.6009432182607054,2024-04-11 16:15:46.925748,2024-04-11 16:15:47.386092,0 days 00:00:00.460344,98.02668530013808,8.004885777657487,sigmoid,8,,24.0,31.0,,,,,,,,,,,,,COMPLETE
1588,0.6009432182607054,2024-04-11 16:15:47.387095,2024-04-11 16:15:47.847769,0 days 00:00:00.460674,97.94517165214481,8.022188133993676,sigmoid,8,,23.0,31.0,,,,,,,,,,,,,COMPLETE
1589,0.44701971028259324,2024-04-11 16:15:47.849982,2024-04-11 16:15:48.320445,0 days 00:00:00.470463,97.9000525007375,7.551912002811222,sigmoid,8,,23.0,30.0,,,,,,,,,,,,,COMPLETE
1590,0.5929369437606513,2024-04-11 16:15:48.321446,2024-04-11 16:15:48.789818,0 days 00:00:00.468372,99.96532202273792,7.990269496751772,sigmoid,8,,24.0,33.0,,,,,,,,,,,,,COMPLETE
1591,0.12622036262203626,2024-04-11 16:15:48.790937,2024-04-11 16:15:49.286649,0 days 00:00:00.495712,97.87388426904499,8.006023809353088,sigmoid,8,,28.0,29.0,,,,,,,,,,,,,COMPLETE
1592,0.473906575423981,2024-04-11 16:15:49.288649,2024-04-11 16:15:50.642611,0 days 00:00:01.353962,97.98393046908505,8.14922420984998,rbf,8,,24.0,31.0,,,,,,,,,,,,,COMPLETE
1593,0.5906279643331437,2024-04-11 16:15:50.643132,2024-04-11 16:15:51.121506,0 days 00:00:00.478374,97.89299796765076,8.8611018134719,sigmoid,8,,23.0,34.0,,,,,,,,,,,,,COMPLETE
1594,0.5929369437606513,2024-04-11 16:15:51.123682,2024-04-11 16:15:51.590058,0 days 00:00:00.466376,99.88319116715786,7.9868759443307225,sigmoid,8,,26.0,33.0,,,,,,,,,,,,,COMPLETE
1595,0.12622036262203626,2024-04-11 16:15:51.591068,2024-04-11 16:15:52.071639,0 days 00:00:00.480571,99.86601390430033,8.501734333140742,sigmoid,8,,27.0,29.0,,,,,,,,,,,,,COMPLETE
1596,0.6009432182607054,2024-04-11 16:15:52.073639,2024-04-11 16:15:52.542841,0 days 00:00:00.469202,99.90356958976516,7.556779861133594,sigmoid,8,,24.0,31.0,,,,,,,,,,,,,COMPLETE
1597,0.44701971028259324,2024-04-11 16:15:52.544363,2024-04-11 16:15:53.022247,0 days 00:00:00.477884,97.69696990671686,7.604454884918231,sigmoid,8,,24.0,30.0,,,,,,,,,,,,,COMPLETE
1598,0.44701971028259324,2024-04-11 16:15:53.024245,2024-04-11 16:15:53.505625,0 days 00:00:00.481380,97.93405985647433,7.44231598012515,sigmoid,8,,23.0,30.0,,,,,,,,,,,,,COMPLETE
1599,0.6009432182607054,2024-04-11 16:15:53.506625,2024-04-11 16:15:53.975159,0 days 00:00:00.468534,99.9205154606856,7.964105705369765,sigmoid,8,,26.0,31.0,,,,,,,,,,,,,COMPLETE
1600,0.5929369437606513,2024-04-11 16:15:53.976160,2024-04-11 16:15:54.474891,0 days 00:00:00.498731,97.89250701618606,7.657683675729142,sigmoid,8,,26.0,33.0,,,,,,,,,,,,,COMPLETE
1601,0.12622036262203626,2024-04-11 16:15:54.475890,2024-04-11 16:15:54.972168,0 days 00:00:00.496278,99.92464274736443,7.952836354781859,sigmoid,8,,27.0,29.0,,,,,,,,,,,,,COMPLETE
1602,0.5964036904537752,2024-04-11 16:15:54.973172,2024-04-11 16:15:55.454173,0 days 00:00:00.481001,97.80956853051715,7.274726627111177,sigmoid,8,,28.0,31.0,,,,,,,,,,,,,COMPLETE
1603,0.6009432182607054,2024-04-11 16:15:55.455175,2024-04-11 16:15:55.924199,0 days 00:00:00.469024,97.56742961109751,7.952007987874515,sigmoid,8,,26.0,31.0,,,,,,,,,,,,,COMPLETE
1604,0.5929369437606513,2024-04-11 16:15:55.925197,2024-04-11 16:15:56.435509,0 days 00:00:00.510312,97.50791384867722,7.576571242503873,sigmoid,8,,28.0,33.0,,,,,,,,,,,,,COMPLETE
1605,0.44701971028259324,2024-04-11 16:15:56.436503,2024-04-11 16:15:56.921816,0 days 00:00:00.485313,97.56182760779329,7.999272448848315,sigmoid,8,,27.0,30.0,,,,,,,,,,,,,COMPLETE
1606,0.12622036262203626,2024-04-11 16:15:56.922984,2024-04-11 16:15:57.416294,0 days 00:00:00.493310,97.23655638736511,7.947403721140283,sigmoid,8,,26.0,29.0,,,,,,,,,,,,,COMPLETE
1607,0.5963245096172158,2024-04-11 16:15:57.417475,2024-04-11 16:15:57.906247,0 days 00:00:00.488772,97.59955074100257,8.411974337875234,sigmoid,8,,26.0,31.0,,,,,,,,,,,,,COMPLETE
1608,0.5895095625828441,2024-04-11 16:15:57.908250,2024-04-11 16:15:58.393898,0 days 00:00:00.485648,97.66877621339454,7.591202852846843,sigmoid,8,,27.0,34.0,,,,,,,,,,,,,COMPLETE
1609,0.44701971028259324,2024-04-11 16:15:58.394900,2024-04-11 16:15:58.869324,0 days 00:00:00.474424,99.92993442253878,7.9607650333533675,sigmoid,8,,24.0,30.0,,,,,,,,,,,,,COMPLETE
1610,0.5963245096172158,2024-04-11 16:15:58.870498,2024-04-11 16:15:59.328969,0 days 00:00:00.458471,97.68424097964031,8.610688283420865,sigmoid,8,,23.0,31.0,,,,,,,,,,,,,COMPLETE
1611,0.5929369437606513,2024-04-11 16:15:59.329970,2024-04-11 16:15:59.831562,0 days 00:00:00.501592,99.9529187184068,7.388312038493329,sigmoid,8,,26.0,33.0,,,,,,,,,,,,,COMPLETE
1612,0.6009432182607054,2024-04-11 16:15:59.832587,2024-04-11 16:16:00.338795,0 days 00:00:00.506208,99.96041416646474,8.138611112507535,sigmoid,8,,24.0,31.0,,,,,,,,,,,,,COMPLETE
1613,0.48429873566598064,2024-04-11 16:16:00.339796,2024-04-11 16:16:01.631240,0 days 00:00:01.291444,97.70793777753397,7.670884448275442,rbf,8,,23.0,30.0,,,,,,,,,,,,,COMPLETE
1614,0.12622036262203626,2024-04-11 16:16:01.632388,2024-04-11 16:16:02.109780,0 days 00:00:00.477392,99.98531356976756,7.942723379777551,sigmoid,8,,24.0,29.0,,,,,,,,,,,,,COMPLETE
1615,0.5929369437606513,2024-04-11 16:16:02.110781,2024-04-11 16:16:02.720623,0 days 00:00:00.609842,97.46220054544607,8.369471923305433,sigmoid,8,,24.0,33.0,,,,,,,,,,,,,COMPLETE
1616,0.6009432182607054,2024-04-11 16:16:02.721624,2024-04-11 16:16:03.205990,0 days 00:00:00.484366,99.94177759129953,8.121533191800383,sigmoid,8,,25.0,31.0,,,,,,,,,,,,,COMPLETE
1617,0.12622036262203626,2024-04-11 16:16:03.207988,2024-04-11 16:16:03.729100,0 days 00:00:00.521112,99.99934428232329,7.945821029316887,sigmoid,8,,23.0,29.0,,,,,,,,,,,,,COMPLETE
1618,0.6009432182607054,2024-04-11 16:16:03.730101,2024-04-11 16:16:04.199761,0 days 00:00:00.469660,99.99342300581885,7.644364447678702,sigmoid,8,,25.0,31.0,,,,,,,,,,,,,COMPLETE
1619,0.5929369437606513,2024-04-11 16:16:04.200762,2024-04-11 16:16:04.682144,0 days 00:00:00.481382,97.01789465133758,8.097915204503268,sigmoid,8,,23.0,33.0,,,,,,,,,,,,,COMPLETE
1620,0.44701971028259324,2024-04-11 16:16:04.683243,2024-04-11 16:16:05.165139,0 days 00:00:00.481896,97.52037998277297,7.917409224087476,sigmoid,8,,24.0,30.0,,,,,,,,,,,,,COMPLETE
1621,0.45022721836881124,2024-04-11 16:16:05.166141,2024-04-11 16:16:05.664554,0 days 00:00:00.498413,97.79929751910775,8.371790079909875,sigmoid,8,,25.0,28.0,,,,,,,,,,,,,COMPLETE
1622,0.5952371952371952,2024-04-11 16:16:05.666553,2024-04-11 16:16:06.146480,0 days 00:00:00.479927,97.44334638547555,7.69187976372203,sigmoid,8,,25.0,32.0,,,,,,,,,,,,,COMPLETE
1623,0.5963245096172158,2024-04-11 16:16:06.147477,2024-04-11 16:16:06.616982,0 days 00:00:00.469505,97.59029298121233,8.631640157485958,sigmoid,8,,24.0,31.0,,,,,,,,,,,,,COMPLETE
1624,0.5895095625828441,2024-04-11 16:16:06.618151,2024-04-11 16:16:07.089593,0 days 00:00:00.471442,97.38250581606214,8.116550948568678,sigmoid,8,,28.0,34.0,,,,,,,,,,,,,COMPLETE
1625,0.45345352376492626,2024-04-11 16:16:07.091593,2024-04-11 16:16:07.552630,0 days 00:00:00.461037,97.38632059154,8.401052042822046,sigmoid,8,,22.0,30.0,,,,,,,,,,,,,COMPLETE
1626,0.5986580986580987,2024-04-11 16:16:07.553865,2024-04-11 16:16:08.024536,0 days 00:00:00.470671,98.20742085300859,7.452874581532118,sigmoid,8,,27.0,31.0,,,,,,,,,,,,,COMPLETE
1627,0.12622036262203626,2024-04-11 16:16:08.025537,2024-04-11 16:16:08.496842,0 days 00:00:00.471305,99.93763908104224,7.921894132903194,sigmoid,8,,25.0,29.0,,,,,,,,,,,,,COMPLETE
1628,0.5963643249384587,2024-04-11 16:16:08.497843,2024-04-11 16:16:08.970661,0 days 00:00:00.472818,97.15268911240223,8.169152565688583,sigmoid,8,,24.0,32.0,,,,,,,,,,,,,COMPLETE
1629,0.5929369437606513,2024-04-11 16:16:08.971846,2024-04-11 16:16:09.449193,0 days 00:00:00.477347,99.89959554405752,7.807784310355814,sigmoid,8,,26.0,33.0,,,,,,,,,,,,,COMPLETE
1630,0.47961457392351703,2024-04-11 16:16:09.450220,2024-04-11 16:16:10.710449,0 days 00:00:01.260229,97.64488723173758,8.06285042822357,rbf,8,,26.0,30.0,,,,,,,,,,,,,COMPLETE
1631,0.5963245096172158,2024-04-11 16:16:10.711449,2024-04-11 16:16:11.264264,0 days 00:00:00.552815,97.86385230111078,8.393009882973747,sigmoid,8,,23.0,31.0,,,,,,,,,,,,,COMPLETE
1632,0.5975287681569516,2024-04-11 16:16:11.266288,2024-04-11 16:16:11.735645,0 days 00:00:00.469357,97.9184712143876,8.756103316707534,sigmoid,8,,27.0,32.0,,,,,,,,,,,,,COMPLETE
1633,0.1274049741905209,2024-04-11 16:16:11.736646,2024-04-11 16:16:12.211698,0 days 00:00:00.475052,99.87083660891635,7.131844282797181,sigmoid,8,,24.0,29.0,,,,,,,,,,,,,COMPLETE
1634,0.44701971028259324,2024-04-11 16:16:12.212700,2024-04-11 16:16:12.731885,0 days 00:00:00.519185,99.98419732680273,7.68475685662267,sigmoid,8,,25.0,30.0,,,,,,,,,,,,,COMPLETE
1635,0.6009432182607054,2024-04-11 16:16:12.733884,2024-04-11 16:16:13.204440,0 days 00:00:00.470556,97.13592331946423,8.129597690921333,sigmoid,8,,28.0,31.0,,,,,,,,,,,,,COMPLETE
1636,0.5929369437606513,2024-04-11 16:16:13.205440,2024-04-11 16:16:13.692027,0 days 00:00:00.486587,97.37518245621172,7.922183428712164,sigmoid,8,,26.0,33.0,,,,,,,,,,,,,COMPLETE
1637,0.45022721836881124,2024-04-11 16:16:13.693029,2024-04-11 16:16:14.198923,0 days 00:00:00.505894,96.97109232578612,8.479481167821035,sigmoid,8,,24.0,28.0,,,,,,,,,,,,,COMPLETE
1638,0.5963643249384587,2024-04-11 16:16:14.199922,2024-04-11 16:16:14.693849,0 days 00:00:00.493927,98.13917162449641,8.271293787272581,sigmoid,8,,27.0,32.0,,,,,,,,,,,,,COMPLETE
1639,0.5941143180531975,2024-04-11 16:16:14.694863,2024-04-11 16:16:15.184347,0 days 00:00:00.489484,98.14635207556857,7.427413156147725,sigmoid,8,,25.0,31.0,,,,,,,,,,,,,COMPLETE
1640,0.44701971028259324,2024-04-11 16:16:15.185347,2024-04-11 16:16:15.699631,0 days 00:00:00.514284,96.76115791256504,7.951094319985962,sigmoid,8,,23.0,30.0,,,,,,,,,,,,,COMPLETE
1641,0.5929369437606513,2024-04-11 16:16:15.700622,2024-04-11 16:16:16.185171,0 days 00:00:00.484549,99.84647588835907,7.677520572591885,sigmoid,8,,29.0,33.0,,,,,,,,,,,,,COMPLETE
1642,0.44701971028259324,2024-04-11 16:16:16.186181,2024-04-11 16:16:16.665517,0 days 00:00:00.479336,96.84717083849624,8.137175418660796,sigmoid,8,,26.0,30.0,,,,,,,,,,,,,COMPLETE
1643,0.5986580986580987,2024-04-11 16:16:16.666525,2024-04-11 16:16:17.153286,0 days 00:00:00.486761,98.22784954385683,8.315829632661426,sigmoid,8,,22.0,31.0,,,,,,,,,,,,,COMPLETE
1644,0.12622036262203626,2024-04-11 16:16:17.154471,2024-04-11 16:16:17.620470,0 days 00:00:00.465999,99.93457743414808,8.52294567731899,sigmoid,8,,25.0,29.0,,,,,,,,,,,,,COMPLETE
1645,0.5952371952371952,2024-04-11 16:16:17.621494,2024-04-11 16:16:18.092397,0 days 00:00:00.470903,96.77400423924479,7.930989064165665,sigmoid,8,,27.0,32.0,,,,,,,,,,,,,COMPLETE
1646,0.6009432182607054,2024-04-11 16:16:18.094403,2024-04-11 16:16:18.566070,0 days 00:00:00.471667,98.06549143448123,7.800529600489035,sigmoid,8,,25.0,31.0,,,,,,,,,,,,,COMPLETE
1647,0.5895095625828441,2024-04-11 16:16:18.568070,2024-04-11 16:16:19.081207,0 days 00:00:00.513137,98.21420950261584,8.081466269338813,sigmoid,8,,24.0,34.0,,,,,,,,,,,,,COMPLETE
1648,0.5963643249384587,2024-04-11 16:16:19.082209,2024-04-11 16:16:19.574987,0 days 00:00:00.492778,96.67407030365823,8.296035971915195,sigmoid,8,,26.0,32.0,,,,,,,,,,,,,COMPLETE
1649,0.4685212734305266,2024-04-11 16:16:19.575988,2024-04-11 16:16:20.853482,0 days 00:00:01.277494,98.22940590730016,7.557050017315546,rbf,8,,23.0,29.0,,,,,,,,,,,,,COMPLETE
1650,0.45345352376492626,2024-04-11 16:16:20.855482,2024-04-11 16:16:21.367371,0 days 00:00:00.511889,99.85385232866011,8.60799688800731,sigmoid,8,,28.0,30.0,,,,,,,,,,,,,COMPLETE
1651,0.5952371952371952,2024-04-11 16:16:21.368371,2024-04-11 16:16:21.857534,0 days 00:00:00.489163,96.75425008193885,8.093333289483155,sigmoid,8,,25.0,32.0,,,,,,,,,,,,,COMPLETE
1652,0.5929369437606513,2024-04-11 16:16:21.858553,2024-04-11 16:16:22.360460,0 days 00:00:00.501907,99.8980501038549,8.347503716199286,sigmoid,8,,27.0,33.0,,,,,,,,,,,,,COMPLETE
1653,0.6009432182607054,2024-04-11 16:16:22.361459,2024-04-11 16:16:22.840119,0 days 00:00:00.478660,96.67565081763279,7.7424489597572395,sigmoid,8,,24.0,31.0,,,,,,,,,,,,,COMPLETE
1654,0.6009432182607054,2024-04-11 16:16:22.841119,2024-04-11 16:16:23.380301,0 days 00:00:00.539182,98.16081727905383,7.962367623509621,sigmoid,8,,26.0,31.0,,,,,,,,,,,,,COMPLETE
1655,0.12003789673140693,2024-04-11 16:16:23.382311,2024-04-11 16:16:23.938968,0 days 00:00:00.556657,98.26608562488266,8.161649493192686,sigmoid,8,,24.0,28.0,,,,,,,,,,,,,COMPLETE
1656,0.4491845899314583,2024-04-11 16:16:23.939981,2024-04-11 16:16:24.539870,0 days 00:00:00.599889,99.96371869797153,7.26000682373852,sigmoid,8,,22.0,30.0,,,,,,,,,,,,,COMPLETE
1657,0.5952371952371952,2024-04-11 16:16:24.542059,2024-04-11 16:16:25.080806,0 days 00:00:00.538747,96.46987806739418,7.855226735196265,sigmoid,8,,23.0,32.0,,,,,,,,,,,,,COMPLETE
1658,0.45345352376492626,2024-04-11 16:16:25.081866,2024-04-11 16:16:25.612218,0 days 00:00:00.530352,98.19026488040515,8.453287985366389,sigmoid,8,,25.0,30.0,,,,,,,,,,,,,COMPLETE
1659,0.5895095625828441,2024-04-11 16:16:25.613206,2024-04-11 16:16:26.120524,0 days 00:00:00.507318,96.54283300266351,8.174966268760606,sigmoid,8,,28.0,34.0,,,,,,,,,,,,,COMPLETE
1660,0.12622036262203626,2024-04-11 16:16:26.121550,2024-04-11 16:16:26.680465,0 days 00:00:00.558915,98.23265939663933,8.948204389642886,sigmoid,8,,27.0,29.0,,,,,,,,,,,,,COMPLETE
1661,0.5929369437606513,2024-04-11 16:16:26.681465,2024-04-11 16:16:27.153139,0 days 00:00:00.471674,99.82101495712423,7.617571378851765,sigmoid,8,,26.0,33.0,,,,,,,,,,,,,COMPLETE
1662,0.6009432182607054,2024-04-11 16:16:27.154164,2024-04-11 16:16:27.634401,0 days 00:00:00.480237,96.62380859039386,7.932131266449323,sigmoid,8,,25.0,31.0,,,,,,,,,,,,,COMPLETE
1663,0.5952371952371952,2024-04-11 16:16:27.635402,2024-04-11 16:16:28.103824,0 days 00:00:00.468422,99.9776533103003,8.650451002216737,sigmoid,8,,26.0,32.0,,,,,,,,,,,,,COMPLETE
1664,0.5986580986580987,2024-04-11 16:16:28.106951,2024-04-11 16:16:28.576453,0 days 00:00:00.469502,99.89609554222083,8.26483323979141,sigmoid,8,,24.0,31.0,,,,,,,,,,,,,COMPLETE
1665,0.44701971028259324,2024-04-11 16:16:28.578662,2024-04-11 16:16:29.065085,0 days 00:00:00.486423,96.51397600209233,7.756214510238262,sigmoid,8,,29.0,30.0,,,,,,,,,,,,,COMPLETE
1666,0.5952371952371952,2024-04-11 16:16:29.066085,2024-04-11 16:16:29.593271,0 days 00:00:00.527186,98.17257143850921,8.058999359998497,sigmoid,8,,27.0,32.0,,,,,,,,,,,,,COMPLETE
1667,0.45347172512526845,2024-04-11 16:16:29.594441,2024-04-11 16:16:30.091076,0 days 00:00:00.496635,96.60009308830219,7.465799579624154,sigmoid,8,,25.0,28.0,,,,,,,,,,,,,COMPLETE
1668,0.5906279643331437,2024-04-11 16:16:30.092076,2024-04-11 16:16:30.643030,0 days 00:00:00.550954,98.20383654697979,8.370081125892439,sigmoid,8,,23.0,34.0,,,,,,,,,,,,,COMPLETE
1669,0.44701971028259324,2024-04-11 16:16:30.644029,2024-04-11 16:16:31.149087,0 days 00:00:00.505058,99.9514219167244,7.968574781844611,sigmoid,8,,26.0,30.0,,,,,,,,,,,,,COMPLETE
1670,0.6009432182607054,2024-04-11 16:16:31.150221,2024-04-11 16:16:31.621528,0 days 00:00:00.471307,96.5667740108017,7.74660920090401,sigmoid,8,,24.0,31.0,,,,,,,,,,,,,COMPLETE
1671,0.5929369437606513,2024-04-11 16:16:31.622647,2024-04-11 16:16:32.102219,0 days 00:00:00.479572,99.96390859299902,8.131002911845219,sigmoid,8,,26.0,33.0,,,,,,,,,,,,,COMPLETE
1672,0.44821155609905233,2024-04-11 16:16:32.104334,2024-04-11 16:16:33.309203,0 days 00:00:01.204869,99.99437456452347,8.40810250965971,rbf,8,,22.0,29.0,,,,,,,,,,,,,COMPLETE
1673,0.5952371952371952,2024-04-11 16:16:33.310211,2024-04-11 16:16:33.792059,0 days 00:00:00.481848,96.6526879851197,7.941081539767564,sigmoid,8,,24.0,32.0,,,,,,,,,,,,,COMPLETE
1674,0.4502698896972542,2024-04-11 16:16:33.793070,2024-04-11 16:16:34.276803,0 days 00:00:00.483733,99.93487054684515,8.208748605312707,sigmoid,8,,28.0,30.0,,,,,,,,,,,,,COMPLETE
1675,0.5963245096172158,2024-04-11 16:16:34.277813,2024-04-11 16:16:34.758969,0 days 00:00:00.481156,98.15450528197127,8.598992418838645,sigmoid,8,,25.0,31.0,,,,,,,,,,,,,COMPLETE
1676,0.5952371952371952,2024-04-11 16:16:34.759969,2024-04-11 16:16:35.279105,0 days 00:00:00.519136,96.74139400441534,7.73404562169651,sigmoid,8,,27.0,32.0,,,,,,,,,,,,,COMPLETE
1677,0.12622036262203626,2024-04-11 16:16:35.280129,2024-04-11 16:16:35.769086,0 days 00:00:00.488957,99.98871801536924,7.411657174061648,sigmoid,8,,23.0,29.0,,,,,,,,,,,,,COMPLETE
1678,0.5940618478467085,2024-04-11 16:16:35.770096,2024-04-11 16:16:36.250556,0 days 00:00:00.480460,96.72936882626841,8.782167688494189,sigmoid,8,,25.0,33.0,,,,,,,,,,,,,COMPLETE
1679,0.6009432182607054,2024-04-11 16:16:36.251582,2024-04-11 16:16:36.729888,0 days 00:00:00.478306,98.04170296004435,7.987760993231286,sigmoid,8,,26.0,31.0,,,,,,,,,,,,,COMPLETE
1680,0.5986580986580987,2024-04-11 16:16:36.731061,2024-04-11 16:16:37.278466,0 days 00:00:00.547405,98.16483828078901,8.299410867337023,sigmoid,8,,25.0,31.0,,,,,,,,,,,,,COMPLETE
1681,0.4491845899314583,2024-04-11 16:16:37.279466,2024-04-11 16:16:37.775579,0 days 00:00:00.496113,99.90675082130922,6.868066896792117,sigmoid,8,,24.0,30.0,,,,,,,,,,,,,COMPLETE
1682,0.5952371952371952,2024-04-11 16:16:37.776589,2024-04-11 16:16:38.282311,0 days 00:00:00.505722,99.97364552144614,8.128748114321722,sigmoid,8,,28.0,32.0,,,,,,,,,,,,,COMPLETE
1683,0.44701971028259324,2024-04-11 16:16:38.283308,2024-04-11 16:16:38.773706,0 days 00:00:00.490398,96.54440520872194,7.82393596123557,sigmoid,8,,27.0,30.0,,,,,,,,,,,,,COMPLETE
1684,0.45347172512526845,2024-04-11 16:16:38.774837,2024-04-11 16:16:39.255245,0 days 00:00:00.480408,97.90502295843295,7.632608771259399,sigmoid,8,,26.0,28.0,,,,,,,,,,,,,COMPLETE
