number,value,datetime_start,datetime_complete,duration,params_C,params_gamma,params_kernel,params_mask_number,params_rsi_window,params_so_smooth,params_so_window,params_srsi_smooth1,params_srsi_smooth2,params_srsi_window,params_tsi_window_fast,params_tsi_window_slow,params_ult_weight_1,params_ult_weight_2,params_ult_weight_3,params_ult_window_1,params_ult_window_2,params_ult_window_3,params_williams_lbp,state
7955,0.5929369437606513,2024-04-11 18:37:24.228387,2024-04-11 18:37:25.732194,0 days 00:00:01.503807,54.974494919162,8.310883314383325,sigmoid,8,,26.0,33.0,,,,,,,,,,,,,COMPLETE
7956,0.4535264018568339,2024-04-11 18:37:25.735106,2024-04-11 18:37:27.801720,0 days 00:00:02.066614,96.65811219039706,7.2500498940575815,sigmoid,29,,24.0,31.0,3.0,7.0,93.0,28.0,4.0,,,,,,,45.0,COMPLETE
7957,0.3498948653598318,2024-04-11 18:37:27.803773,2024-04-11 18:37:30.013527,0 days 00:00:02.209754,98.22857206655446,8.052811702291397,sigmoid,50,25.0,,,5.0,3.0,18.0,,,9.8049581292337,8.803586005255701,3.95011151417756,16.0,27.0,59.0,,COMPLETE
7958,0.5259334592474213,2024-04-11 18:37:30.018502,2024-04-11 18:37:32.003916,0 days 00:00:01.985414,94.23500990805759,8.534709768775883,sigmoid,6,,,,,,,37.0,48.0,3.5857827644840947,2.0083801489820976,2.8224766285005094,10.0,45.0,99.0,,COMPLETE
7959,0.46794208893485,2024-04-11 18:37:32.005928,2024-04-11 18:37:33.710282,0 days 00:00:01.704354,99.99886186933001,7.570422299625658,sigmoid,49,21.0,,,4.0,4.0,86.0,,,,,,,,,177.0,COMPLETE
7960,0.41984968917205334,2024-04-11 18:37:33.712797,2024-04-11 18:37:35.633475,0 days 00:00:01.920678,96.70257952075652,8.203438075458944,sigmoid,25,,25.0,29.0,7.0,1.0,100.0,,,,,,,,,51.0,COMPLETE
7961,0.44879060823803263,2024-04-11 18:37:35.636467,2024-04-11 18:37:37.790817,0 days 00:00:02.154350,43.97488602008336,7.814771978569566,sigmoid,19,,,,1.0,2.0,30.0,,,1.202070404248186,7.279596252727285,8.459863450978078,4.0,38.0,74.0,59.0,COMPLETE
7962,0.3648335404978668,2024-04-11 18:37:37.794406,2024-04-11 18:37:40.236684,0 days 00:00:02.442278,98.28236016311779,8.02745158313971,sigmoid,39,48.0,,,,,,8.0,23.0,4.251267902452194,3.006235165264696,5.829646809728309,5.0,34.0,50.0,39.0,COMPLETE
7963,0.48763798488424764,2024-04-11 18:37:40.240848,2024-04-11 18:37:42.734382,0 days 00:00:02.493534,96.61552003518374,8.41402004636281,sigmoid,43,41.0,27.0,32.0,,,,,,8.182621915214261,3.8102766035451827,0.7729148016340046,7.0,48.0,84.0,80.0,COMPLETE
7964,0.6009432182607054,2024-04-11 18:37:42.737380,2024-04-11 18:37:44.305418,0 days 00:00:01.568038,99.99623144832634,7.750015551169832,sigmoid,8,,25.0,31.0,,,,,,,,,,,,,COMPLETE
7965,0.5906279643331437,2024-04-11 18:37:44.307417,2024-04-11 18:37:45.809060,0 days 00:00:01.501643,95.11222291122712,8.682511009589117,sigmoid,8,,22.0,34.0,,,,,,,,,,,,,COMPLETE
7966,0.5963643249384587,2024-04-11 18:37:45.814627,2024-04-11 18:37:47.410769,0 days 00:00:01.596142,96.56998599723332,8.2190342132546,sigmoid,8,,28.0,32.0,,,,,,,,,,,,,COMPLETE
7967,0.48090335436731985,2024-04-11 18:37:47.413285,2024-04-11 18:37:50.007921,0 days 00:00:02.594636,99.96003927419513,7.4573280554847425,sigmoid,47,33.0,29.0,29.0,,,,21.0,15.0,5.167362481708501,2.5143210789767863,1.805013466729886,14.0,21.0,54.0,71.0,COMPLETE
7968,0.438338301043219,2024-04-11 18:37:50.010911,2024-04-11 18:37:51.869839,0 days 00:00:01.858928,92.9376503244037,7.9519960265810585,sigmoid,24,,26.0,30.0,8.0,5.0,75.0,,,,,,,,,,COMPLETE
7969,0.43660253135819277,2024-04-11 18:37:51.872483,2024-04-11 18:37:54.018313,0 days 00:00:02.145830,99.9437273747838,8.11804557259936,sigmoid,22,,,,6.0,3.0,57.0,18.0,21.0,1.0156807377283403,6.80249994639137,6.690146475057321,19.0,29.0,73.0,,COMPLETE
7970,0.3373063633187095,2024-04-11 18:37:54.021322,2024-04-11 18:37:55.995683,0 days 00:00:01.974361,98.11360068821563,8.282868592014335,sigmoid,35,9.0,,,,,,,,1.8327942217101487,4.320448288463281,6.018091163220371,11.0,28.0,88.0,135.0,COMPLETE
7971,0.3212979728050556,2024-04-11 18:37:55.998669,2024-04-11 18:37:58.108630,0 days 00:00:02.109961,98.21255161066036,7.812974090283208,sigmoid,38,30.0,,,,,,10.0,8.0,8.658143855597748,7.47283327460544,4.929942160139484,15.0,23.0,55.0,,COMPLETE
7972,0.020827340199067946,2024-04-11 18:37:58.111616,2024-04-11 18:38:01.145125,0 days 00:00:03.033509,99.9813272023742,8.3861594945851,rbf,31,,23.0,27.0,7.0,8.0,13.0,16.0,26.0,2.733765384117106,4.828125251639444,4.522963109768691,18.0,41.0,57.0,93.0,COMPLETE
7973,0.39612595544522117,2024-04-11 18:38:01.148129,2024-04-11 18:38:03.124206,0 days 00:00:01.976077,95.2497641339403,8.007063534551152,sigmoid,21,,,,2.0,7.0,21.0,6.0,6.0,,,,,,,174.0,COMPLETE
7974,0.5929369437606513,2024-04-11 18:38:03.127208,2024-04-11 18:38:04.639660,0 days 00:00:01.512452,99.95677710347611,7.084402043376828,sigmoid,8,,24.0,33.0,,,,,,,,,,,,,COMPLETE
7975,0.5042541977260748,2024-04-11 18:38:04.643165,2024-04-11 18:38:06.550177,0 days 00:00:01.907012,96.54367833448093,7.624636952981328,sigmoid,18,,,,3.0,4.0,4.0,,,6.457021355820947,5.302108967844011,9.394774493534213,2.0,37.0,83.0,,COMPLETE
7976,0.45345352376492626,2024-04-11 18:38:06.553738,2024-04-11 18:38:07.956363,0 days 00:00:01.402625,99.98701083252936,8.5235344079746,sigmoid,8,,25.0,30.0,,,,,,,,,,,,,COMPLETE
7977,0.6009432182607054,2024-04-11 18:38:07.958987,2024-04-11 18:38:09.377390,0 days 00:00:01.418403,94.09735074292938,8.097578793906289,sigmoid,8,,27.0,31.0,,,,,,,,,,,,,COMPLETE
7978,0.5033035459644454,2024-04-11 18:38:09.379385,2024-04-11 18:38:11.721988,0 days 00:00:02.342603,99.95787666228655,7.8725327546529735,sigmoid,15,,26.0,32.0,,,,27.0,36.0,6.060780898467251,8.032804665536624,9.079044968867567,8.0,20.0,96.0,148.0,COMPLETE
7979,0.5636462904171639,2024-04-11 18:38:11.724583,2024-04-11 18:38:12.986654,0 days 00:00:01.262071,91.3102574729256,8.266971992492307,sigmoid,0,,,,,,,,,,,,,,,,COMPLETE
7980,0.5101224156106797,2024-04-11 18:38:12.989656,2024-04-11 18:38:14.887704,0 days 00:00:01.898048,96.51940127874389,8.773508730775097,sigmoid,3,,,,,,,,,7.447723129731671,1.377318215811726,4.1262007623413535,4.0,35.0,92.0,87.0,COMPLETE
7981,0.45347172512526845,2024-04-11 18:38:14.890719,2024-04-11 18:38:16.412343,0 days 00:00:01.521624,97.01890401157034,7.695651732909243,sigmoid,8,,24.0,28.0,,,,,,,,,,,,,COMPLETE
7982,0.5009304766903661,2024-04-11 18:38:16.415904,2024-04-11 18:38:18.512461,0 days 00:00:02.096557,98.29401201194564,8.022318499160486,sigmoid,57,3.0,21.0,31.0,4.0,1.0,38.0,,,,,,,,,166.0,COMPLETE
7983,0.45345352376492626,2024-04-11 18:38:18.517006,2024-04-11 18:38:20.086646,0 days 00:00:01.569640,98.17364286180985,8.461380032808094,sigmoid,8,,26.0,30.0,,,,,,,,,,,,,COMPLETE
7984,0.4124594794107263,2024-04-11 18:38:20.089626,2024-04-11 18:38:22.154235,0 days 00:00:02.064609,95.6889625434715,5.925225383963176,sigmoid,28,,25.0,32.0,5.0,6.0,70.0,40.0,39.0,,,,,,,,COMPLETE
7985,0.18258771929824563,2024-04-11 18:38:22.157271,2024-04-11 18:38:23.713604,0 days 00:00:01.556333,37.50745876191925,8.195626426078649,sigmoid,16,,,,5.0,5.0,52.0,,,,,,,,,,COMPLETE
7986,0.332297698065245,2024-04-11 18:38:23.716574,2024-04-11 18:38:25.991956,0 days 00:00:02.275382,23.78721811426061,7.4532650348985445,sigmoid,42,19.0,23.0,30.0,,,,,,5.618828308287448,1.6143439265203297,5.467620201415685,3.0,33.0,69.0,,COMPLETE
7987,0.5335735342286275,2024-04-11 18:38:25.995533,2024-04-11 18:38:27.597807,0 days 00:00:01.602274,98.0614369995082,7.870312425789387,sigmoid,9,,27.0,33.0,,,,,,,,,,,,158.0,COMPLETE
7988,0.326006248851314,2024-04-11 18:38:27.600807,2024-04-11 18:38:29.821123,0 days 00:00:02.220316,93.29828543925123,8.09932937241709,sigmoid,14,,29.0,29.0,,,,29.0,20.0,4.467829233581129,0.500412696987997,0.5370296953173295,6.0,44.0,63.0,,COMPLETE
7989,0.5962842367362575,2024-04-11 18:38:29.824685,2024-04-11 18:38:31.354285,0 days 00:00:01.529600,96.73392007072185,9.39797298541697,sigmoid,8,,24.0,31.0,,,,,,,,,,,,,COMPLETE
7990,0.47819753086419753,2024-04-11 18:38:31.358324,2024-04-11 18:38:33.994637,0 days 00:00:02.636313,95.2543421412202,8.288168431461454,sigmoid,62,7.0,27.0,31.0,1.0,2.0,11.0,22.0,10.0,7.814665831147847,0.7107559592023556,1.0647258437643146,9.0,26.0,100.0,,COMPLETE
7991,0.24522422435984287,2024-04-11 18:38:33.998643,2024-04-11 18:38:36.122084,0 days 00:00:02.123441,80.81684772641157,7.691165261616622,sigmoid,10,,28.0,34.0,,,,,,1.4723341734247075,2.269857394111342,8.0683450844491,12.0,39.0,85.0,,COMPLETE
7992,0.44831393613846615,2024-04-11 18:38:36.124632,2024-04-11 18:38:38.234309,0 days 00:00:02.109677,96.72150483994578,7.927114510777466,rbf,8,,25.0,32.0,,,,,,,,,,,,,COMPLETE
7993,0.48130225427017703,2024-04-11 18:38:38.237240,2024-04-11 18:38:40.757238,0 days 00:00:02.519998,21.0329459072257,8.54734139331839,sigmoid,46,15.0,24.0,30.0,,,,35.0,38.0,5.318619644652632,9.127778615197663,7.451289964252105,10.0,50.0,61.0,,COMPLETE
7994,0.19384826286252838,2024-04-11 18:38:40.760240,2024-04-11 18:38:42.508143,0 days 00:00:01.747903,94.08262040744599,8.372881673271376,sigmoid,2,,,,,,,,,3.076382057621599,1.1908664312433164,9.776519120210398,13.0,40.0,82.0,,COMPLETE
7995,0.33016645131868966,2024-04-11 18:38:42.511141,2024-04-11 18:38:44.328594,0 days 00:00:01.817453,88.77502013012538,6.706057911926713,sigmoid,41,38.0,22.0,32.0,,,,,,,,,,,,182.0,COMPLETE
7996,0.12622036262203626,2024-04-11 18:38:44.331605,2024-04-11 18:38:45.772713,0 days 00:00:01.441108,35.27366871017529,8.054972305688198,sigmoid,8,,26.0,29.0,,,,,,,,,,,,,COMPLETE
7997,0.43287016014288743,2024-04-11 18:38:45.776257,2024-04-11 18:38:48.620722,0 days 00:00:02.844465,98.2650392580203,7.577479715867711,sigmoid,63,17.0,26.0,31.0,6.0,3.0,27.0,47.0,35.0,3.9478621241934935,7.851810273789818,1.5148408680589278,18.0,31.0,89.0,195.0,COMPLETE
7998,0.378463146889702,2024-04-11 18:38:48.622722,2024-04-11 18:38:50.593284,0 days 00:00:01.970562,98.20342795729904,7.833206641179572,sigmoid,11,,23.0,33.0,,,,,,7.100416736019348,7.030023096182966,7.11276286039362,14.0,22.0,90.0,154.0,COMPLETE
7999,0.5105228899978304,2024-04-11 18:38:50.596883,2024-04-11 18:38:52.482726,0 days 00:00:01.885843,98.27560385318154,8.172235685168298,sigmoid,56,26.0,25.0,28.0,8.0,8.0,46.0,,,,,,,,,,COMPLETE
8000,0.4522714585714666,2024-04-11 18:38:52.487291,2024-04-11 18:38:54.748553,0 days 00:00:02.261262,99.94163335627307,7.893606172074147,sigmoid,26,,27.0,30.0,2.0,6.0,65.0,,,6.6060636601204825,9.329999595898439,3.1086768486748304,7.0,47.0,75.0,,COMPLETE
8001,0.5355708669738343,2024-04-11 18:38:54.752553,2024-04-11 18:38:56.471232,0 days 00:00:01.718679,95.05816470070849,8.682082627562151,sigmoid,37,12.0,,,,,,24.0,45.0,,,,,,,162.0,COMPLETE
8002,0.5975287681569516,2024-04-11 18:38:56.474247,2024-04-11 18:38:58.003574,0 days 00:00:01.529327,96.63333355455043,7.360820440505081,sigmoid,8,,25.0,32.0,,,,,,,,,,,,,COMPLETE
8003,0.2833749418186434,2024-04-11 18:38:58.006189,2024-04-11 18:38:59.667791,0 days 00:00:01.661602,58.37537903555544,8.35731614719088,sigmoid,48,46.0,,,1.0,5.0,98.0,,,,,,,,,,COMPLETE
8004,0.6009432182607054,2024-04-11 18:38:59.670816,2024-04-11 18:39:01.059593,0 days 00:00:01.388777,98.3769497864591,8.078736757060732,sigmoid,8,,23.0,31.0,,,,,,,,,,,,,COMPLETE
8005,0.5069140556625241,2024-04-11 18:39:01.062592,2024-04-11 18:39:02.567727,0 days 00:00:01.505135,98.21949771541384,7.761458803216465,sigmoid,8,,28.0,35.0,,,,,,,,,,,,,COMPLETE
8006,0.5963643249384587,2024-04-11 18:39:02.572724,2024-04-11 18:39:04.189462,0 days 00:00:01.616738,92.54820236110669,8.231859147971967,sigmoid,8,,24.0,32.0,,,,,,,,,,,,,COMPLETE
8007,0.5539291682606158,2024-04-11 18:39:04.193591,2024-04-11 18:39:05.897906,0 days 00:00:01.704315,95.33113576577486,8.563001184640205,sigmoid,12,,26.0,4.0,,,,13.0,43.0,,,,,,,,COMPLETE
8008,0.24533502010572453,2024-04-11 18:39:05.900936,2024-04-11 18:39:07.558013,0 days 00:00:01.657077,98.21273376259667,7.934638309609165,sigmoid,20,,,,7.0,7.0,90.0,43.0,33.0,,,,,,,,COMPLETE
8009,0.12622036262203626,2024-04-11 18:39:07.560991,2024-04-11 18:39:08.933324,0 days 00:00:01.372333,96.65443697434662,7.637142422604563,sigmoid,8,,25.0,29.0,,,,,,,,,,,,,COMPLETE
8010,0.22049383872932576,2024-04-11 18:39:08.935926,2024-04-11 18:39:11.609654,0 days 00:00:02.673728,94.06932399139562,8.165340888347917,rbf,54,14.0,,,3.0,4.0,36.0,14.0,28.0,4.687021550353143,0.886692952211237,2.4956872344882535,17.0,30.0,80.0,,COMPLETE
8011,0.4603372415371703,2024-04-11 18:39:11.612650,2024-04-11 18:39:14.345573,0 days 00:00:02.732923,98.19184074330492,8.376053190765504,sigmoid,59,45.0,24.0,34.0,3.0,3.0,61.0,,,8.30163324810606,2.7977825775868013,3.485482337074307,20.0,46.0,72.0,130.0,COMPLETE
8012,0.4399217767844671,2024-04-11 18:39:14.348621,2024-04-11 18:39:17.239884,0 days 00:00:02.891263,99.95914049693485,8.058177993236193,sigmoid,55,29.0,,,4.0,1.0,77.0,39.0,32.0,0.6869592144905798,3.701916235391166,2.179661981139206,9.0,49.0,87.0,67.0,COMPLETE
8013,0.5160960320397014,2024-04-11 18:39:17.243902,2024-04-11 18:39:19.228376,0 days 00:00:01.984474,96.7453014788923,7.798056398951924,sigmoid,52,33.0,,,8.0,2.0,40.0,50.0,24.0,,,,,,,,COMPLETE
8014,0.5181925008011964,2024-04-11 18:39:19.231376,2024-04-11 18:39:21.604306,0 days 00:00:02.372930,99.99364152736257,7.509487535812794,sigmoid,44,32.0,26.0,30.0,,,,26.0,40.0,,,,,,,,COMPLETE
8015,0.4449937861349759,2024-04-11 18:39:21.606899,2024-04-11 18:39:23.723551,0 days 00:00:02.116652,90.43828506730495,7.976502910274759,sigmoid,60,36.0,27.0,33.0,6.0,4.0,88.0,41.0,31.0,,,,,,,,COMPLETE
8016,0.32783915957254117,2024-04-11 18:39:23.727077,2024-04-11 18:39:25.457610,0 days 00:00:01.730533,96.6811460113671,8.418632719630363,sigmoid,36,22.0,,,,,,32.0,30.0,,,,,,,,COMPLETE
8017,0.5986044733320588,2024-04-11 18:39:25.461599,2024-04-11 18:39:27.027695,0 days 00:00:01.566096,98.27290294636592,8.9057764431571,sigmoid,8,,23.0,31.0,,,,,,,,,,,,,COMPLETE
8018,0.5122245418696358,2024-04-11 18:39:27.029689,2024-04-11 18:39:28.966900,0 days 00:00:01.937211,94.7257173331322,8.258283867455615,sigmoid,13,,25.0,29.0,,,,17.0,22.0,,,,,,,42.0,COMPLETE
8019,0.5952371952371952,2024-04-11 18:39:28.970897,2024-04-11 18:39:30.414390,0 days 00:00:01.443493,99.99052579369032,7.952941363546438,sigmoid,1,,,,,,,,,,,,,,,32.0,COMPLETE
8020,0.5964036904537752,2024-04-11 18:39:30.417904,2024-04-11 18:39:32.037125,0 days 00:00:01.619221,98.3200618780833,7.215212970704689,sigmoid,8,,28.0,31.0,,,,,,,,,,,,,COMPLETE
8021,0.4580112340804183,2024-04-11 18:39:32.040133,2024-04-11 18:39:34.515706,0 days 00:00:02.475573,96.69436487352195,8.631746315108739,sigmoid,61,42.0,22.0,30.0,4.0,6.0,48.0,5.0,6.0,,,,,,,19.0,COMPLETE
8022,0.48445012908879886,2024-04-11 18:39:34.518234,2024-04-11 18:39:37.112150,0 days 00:00:02.593916,95.18674968597746,7.721196797320728,sigmoid,23,,,,5.0,7.0,6.0,19.0,47.0,2.4949969231396123,3.16913211632413,6.307177797671155,13.0,36.0,94.0,106.0,COMPLETE
8023,0.3639044332004156,2024-04-11 18:39:37.115685,2024-04-11 18:39:39.914140,0 days 00:00:02.798455,98.15451866264591,8.180210128943491,sigmoid,7,,,,,,,23.0,13.0,9.254401899392974,6.408712510990702,0.5082265535308927,19.0,25.0,77.0,54.0,COMPLETE
8024,0.5929369437606513,2024-04-11 18:39:39.917652,2024-04-11 18:39:42.146549,0 days 00:00:02.228897,99.99458458009589,8.012159281547863,sigmoid,8,,26.0,33.0,,,,,,,,,,,,,COMPLETE
8025,0.5240366590293689,2024-04-11 18:39:42.150551,2024-04-11 18:39:43.936533,0 days 00:00:01.785982,92.63472038021715,8.49249257738427,sigmoid,40,26.0,25.0,32.0,,,,,,,,,,,,,COMPLETE
8026,0.6009432182607054,2024-04-11 18:39:43.940543,2024-04-11 18:39:45.513386,0 days 00:00:01.572843,99.99170078703332,7.638114587380312,sigmoid,8,,24.0,31.0,,,,,,,,,,,,,COMPLETE
8027,0.12622036262203626,2024-04-11 18:39:45.516907,2024-04-11 18:39:47.204561,0 days 00:00:01.687654,99.95356960741489,8.265210094646493,sigmoid,8,,27.0,29.0,,,,,,,,,,,,,COMPLETE
8028,0.39486491021983555,2024-04-11 18:39:47.208093,2024-04-11 18:39:49.869312,0 days 00:00:02.661219,95.34804309249809,4.495610951612244,sigmoid,30,,25.0,32.0,2.0,1.0,2.0,12.0,19.0,2.1871069082231753,8.411876651606136,5.119572159005337,5.0,24.0,60.0,,COMPLETE
8029,0.4933996314899417,2024-04-11 18:39:49.872304,2024-04-11 18:39:52.515203,0 days 00:00:02.642899,96.54823565708813,7.828821757668647,sigmoid,27,,29.0,28.0,7.0,8.0,59.0,,,9.54876181271236,9.61803584478487,9.589094283561924,16.0,32.0,62.0,125.0,COMPLETE
8030,0.5703197048877959,2024-04-11 18:39:52.517789,2024-04-11 18:39:54.181256,0 days 00:00:01.663467,99.9776261269341,7.3707256746380825,sigmoid,4,,,,,,,33.0,15.0,,,,,,,,COMPLETE
8031,0.38287273967929036,2024-04-11 18:39:54.183247,2024-04-11 18:39:56.418953,0 days 00:00:02.235706,98.22513779950437,8.154546926162304,rbf,32,40.0,,,,,,,,,,,,,,,COMPLETE
8032,0.44701971028259324,2024-04-11 18:39:56.421948,2024-04-11 18:39:58.117081,0 days 00:00:01.695133,98.18490782211897,7.965969032977037,sigmoid,8,,24.0,30.0,,,,,,,,,,,,,COMPLETE
8033,0.5378624859104416,2024-04-11 18:39:58.121079,2024-04-11 18:39:59.807394,0 days 00:00:01.686315,72.22189356352507,8.430361937867664,sigmoid,5,,,,,,,25.0,42.0,,,,,,,170.0,COMPLETE
8034,0.29345686160972784,2024-04-11 18:39:59.811409,2024-04-11 18:40:01.855195,0 days 00:00:02.043786,94.06454643379189,8.126785240271266,sigmoid,34,11.0,,,,,,,,6.854657433256224,8.851295808568153,2.6809851240915945,11.0,43.0,64.0,,COMPLETE
8035,0.5192153554102511,2024-04-11 18:40:01.857711,2024-04-11 18:40:03.458948,0 days 00:00:01.601237,96.67907558288779,7.813880319245098,sigmoid,33,19.0,,,,,,,,,,,,,,26.0,COMPLETE
8036,0.46509818713312434,2024-04-11 18:40:03.461941,2024-04-11 18:40:05.973039,0 days 00:00:02.511098,96.49462562570314,7.553111503941486,sigmoid,51,5.0,,,6.0,2.0,55.0,,,5.814758534581038,4.128724106456094,7.759863900185704,3.0,45.0,81.0,14.0,COMPLETE
8037,0.3983401389404465,2024-04-11 18:40:05.976552,2024-04-11 18:40:07.749687,0 days 00:00:01.773135,98.05964442577775,8.307740892617511,sigmoid,17,,,,2.0,3.0,96.0,,,,,,,,,139.0,COMPLETE
8038,0.5940618478467085,2024-04-11 18:40:07.752680,2024-04-11 18:40:09.362552,0 days 00:00:01.609872,69.50583626526459,8.665141449708859,sigmoid,8,,26.0,33.0,,,,,,,,,,,,,COMPLETE
8039,0.42723350253807113,2024-04-11 18:40:09.365550,2024-04-11 18:40:11.225452,0 days 00:00:01.859902,98.215188507147,8.024913064428011,sigmoid,49,2.0,,,1.0,5.0,25.0,,,,,,,,,101.0,COMPLETE
8040,0.3782359179090512,2024-04-11 18:40:11.227969,2024-04-11 18:40:13.454498,0 days 00:00:02.226529,95.22990765389731,7.783225059958919,sigmoid,19,,,,5.0,4.0,9.0,,,8.00311724831667,3.4866627356303175,8.68040152036432,8.0,42.0,70.0,90.0,COMPLETE
8041,0.5986580986580987,2024-04-11 18:40:13.457007,2024-04-11 18:40:15.108284,0 days 00:00:01.651277,99.99070115971256,8.309546281168522,sigmoid,8,,24.0,31.0,,,,,,,,,,,,,COMPLETE
8042,0.5000123325851565,2024-04-11 18:40:15.111282,2024-04-11 18:40:17.319224,0 days 00:00:02.207942,92.48992177140057,8.083783844424897,sigmoid,45,8.0,23.0,32.0,,,,36.0,37.0,,,,,,,48.0,COMPLETE
8043,0.473687933229594,2024-04-11 18:40:17.321218,2024-04-11 18:40:19.724718,0 days 00:00:02.403500,96.64498890002228,8.46972677419786,sigmoid,50,35.0,,,7.0,6.0,84.0,,,7.631562216346207,4.980242406610439,5.377066106848278,10.0,41.0,68.0,,COMPLETE
8044,0.44701971028259324,2024-04-11 18:40:19.729155,2024-04-11 18:40:21.393659,0 days 00:00:01.664504,99.95152662068217,7.874268157924061,sigmoid,8,,27.0,30.0,,,,,,,,,,,,,COMPLETE
8045,0.6009432182607054,2024-04-11 18:40:21.396655,2024-04-11 18:40:22.991285,0 days 00:00:01.594630,98.25491661768278,7.650041132738676,sigmoid,8,,26.0,31.0,,,,,,,,,,,,,COMPLETE
8046,0.44701971028259324,2024-04-11 18:40:22.994283,2024-04-11 18:40:24.579460,0 days 00:00:01.585177,99.99540770836192,8.197517240736907,sigmoid,8,,21.0,30.0,,,,,,,,,,,,,COMPLETE
8047,0.2405701452862184,2024-04-11 18:40:24.582460,2024-04-11 18:40:27.044193,0 days 00:00:02.461733,99.95563526808318,7.963931166659552,rbf,53,27.0,,,3.0,8.0,44.0,9.0,25.0,,,,,,,121.0,COMPLETE
8048,0.43748067788988504,2024-04-11 18:40:27.047192,2024-04-11 18:40:29.605859,0 days 00:00:02.558667,94.1238838473127,7.448976776823968,sigmoid,58,9.0,25.0,28.0,8.0,7.0,50.0,,,8.977632221503699,6.623985271811082,6.922835372307166,15.0,35.0,51.0,,COMPLETE
8049,0.44519144051816023,2024-04-11 18:40:29.609391,2024-04-11 18:40:31.944230,0 days 00:00:02.334839,99.99424718110659,9.159832723643461,sigmoid,29,,40.0,33.0,4.0,5.0,16.0,2.0,9.0,,,,,,,37.0,COMPLETE
8050,0.17512093987560468,2024-04-11 18:40:31.947758,2024-04-11 18:40:34.163851,0 days 00:00:02.216093,96.34532335221114,8.809236410034888,sigmoid,18,,,,1.0,1.0,20.0,,,5.007897392972034,5.890636325352444,3.7312823422490844,2.0,23.0,66.0,,COMPLETE
8051,0.2589104780069138,2024-04-11 18:40:34.165843,2024-04-11 18:40:36.507230,0 days 00:00:02.341387,96.68985979452147,8.389918018772939,sigmoid,6,,,,,,,20.0,11.0,3.5091800939674522,9.99481827637414,5.6984617317358985,7.0,48.0,52.0,,COMPLETE
8052,0.4765775254144153,2024-04-11 18:40:36.510240,2024-04-11 18:40:38.475605,0 days 00:00:01.965365,98.12200966612247,8.154606790075492,sigmoid,24,,28.0,31.0,6.0,3.0,73.0,,,,,,,,,,COMPLETE
8053,0.4870372970190462,2024-04-11 18:40:38.479126,2024-04-11 18:40:40.362858,0 days 00:00:01.883732,95.19602545944004,7.733076049356666,sigmoid,25,,25.0,32.0,5.0,2.0,33.0,,,,,,,,,117.0,COMPLETE
8054,0.465250497114312,2024-04-11 18:40:40.364856,2024-04-11 18:40:42.840380,0 days 00:00:02.475524,98.27020763664312,7.973866203194951,sigmoid,43,47.0,30.0,29.0,,,,,,1.2844297225245915,2.0306674809131158,8.974798503033405,14.0,28.0,56.0,111.0,COMPLETE
8055,0.5885628854419735,2024-04-11 18:40:42.844381,2024-04-11 18:40:44.523042,0 days 00:00:01.678661,91.03948461257383,6.172427552528488,sigmoid,8,,22.0,34.0,,,,,,,,,,,,,COMPLETE
8056,0.4448341684562156,2024-04-11 18:40:44.526038,2024-04-11 18:40:45.984593,0 days 00:00:01.458555,96.58248573745567,8.559491771883287,sigmoid,8,,27.0,30.0,,,,,,,,,,,,,COMPLETE
8057,0.32114975159687725,2024-04-11 18:40:45.987590,2024-04-11 18:40:48.139662,0 days 00:00:02.152072,93.65153025167872,8.26752172737456,sigmoid,38,21.0,,,,,,38.0,50.0,9.843232611381852,4.46376697282447,6.130555576046724,12.0,38.0,86.0,,COMPLETE
