number,value,datetime_start,datetime_complete,duration,params_C,params_gamma,params_kernel,params_mask_number,params_rsi_window,params_so_smooth,params_so_window,params_srsi_smooth1,params_srsi_smooth2,params_srsi_window,params_tsi_window_fast,params_tsi_window_slow,params_ult_weight_1,params_ult_weight_2,params_ult_weight_3,params_ult_window_1,params_ult_window_2,params_ult_window_3,params_williams_lbp,state
4767,0.48033447662919665,2024-04-11 17:11:42.200097,2024-04-11 17:11:43.348512,0 days 00:00:01.148415,96.87495628168607,8.074238118501619,sigmoid,60,8.0,26.0,31.0,8.0,8.0,28.0,37.0,34.0,,,,,,,,COMPLETE
4768,0.32442022093788864,2024-04-11 17:11:43.350543,2024-04-11 17:11:44.437383,0 days 00:00:01.086840,98.06476788052275,7.740376567779129,sigmoid,7,,,,,,,23.0,13.0,5.126775431490268,6.75739082625893,7.400985060244056,9.0,32.0,51.0,131.0,COMPLETE
4769,0.5593948214831186,2024-04-11 17:11:44.439390,2024-04-11 17:11:45.265755,0 days 00:00:00.826365,99.95745115160392,9.188692885457309,sigmoid,32,4.0,,,,,,,,,,,,,,,COMPLETE
4770,0.12622036262203626,2024-04-11 17:11:45.267799,2024-04-11 17:11:46.076321,0 days 00:00:00.808522,93.48927672252071,8.42297905646526,sigmoid,8,,30.0,29.0,,,,,,,,,,,,,COMPLETE
4771,0.4595783269099978,2024-04-11 17:11:46.078876,2024-04-11 17:11:46.957238,0 days 00:00:00.878362,96.71873374940095,2.7212337802395496,sigmoid,8,,24.0,30.0,,,,,,,,,,,,,COMPLETE
4772,0.5929369437606513,2024-04-11 17:11:46.959217,2024-04-11 17:11:47.756664,0 days 00:00:00.797447,98.16354078370762,7.957725361568152,sigmoid,8,,18.0,33.0,,,,,,,,,,,,,COMPLETE
4773,0.42767130480441057,2024-04-11 17:11:47.758645,2024-04-11 17:11:49.022133,0 days 00:00:01.263488,95.27615187030509,8.163070961823442,sigmoid,54,7.0,,,7.0,3.0,47.0,26.0,5.0,6.620688046672555,4.307499787956425,2.49366760028317,13.0,35.0,90.0,,COMPLETE
4774,0.5197603553351926,2024-04-11 17:11:49.024130,2024-04-11 17:11:49.818911,0 days 00:00:00.794781,93.91193397618186,7.292000318297779,sigmoid,4,,,,,,,42.0,24.0,,,,,,,,COMPLETE
4775,0.5939550949913645,2024-04-11 17:11:49.820914,2024-04-11 17:11:50.839501,0 days 00:00:01.018587,98.12804867530272,9.757280125728853,sigmoid,8,,28.0,31.0,,,,,,,,,,,,,COMPLETE
4776,0.22051258911650576,2024-04-11 17:11:50.841505,2024-04-11 17:11:53.133188,0 days 00:00:02.291683,98.17040337158481,8.587209874862934,rbf,27,,27.0,32.0,1.0,7.0,11.0,,,2.1390768658661172,5.95818006606767,8.131217539001158,11.0,22.0,88.0,35.0,COMPLETE
4777,0.48647812953404845,2024-04-11 17:11:53.136180,2024-04-11 17:11:54.309274,0 days 00:00:01.173094,95.80519481166499,7.676783765125845,sigmoid,45,33.0,24.0,34.0,,,,12.0,27.0,,,,,,,80.0,COMPLETE
4778,0.44701971028259324,2024-04-11 17:11:54.311289,2024-04-11 17:11:55.137011,0 days 00:00:00.825722,98.19528367719623,7.880871974562393,sigmoid,8,,21.0,30.0,,,,,,,,,,,,,COMPLETE
4779,0.5424650172588413,2024-04-11 17:11:55.139015,2024-04-11 17:11:56.103622,0 days 00:00:00.964607,96.156365685017,8.859435589803613,sigmoid,34,35.0,,,,,,,,7.590060238099548,4.0633806806369,4.720489682489273,16.0,34.0,99.0,,COMPLETE
4780,0.5412910667748964,2024-04-11 17:11:56.106198,2024-04-11 17:11:56.993647,0 days 00:00:00.887449,13.513771224733965,8.19062318660197,sigmoid,17,,,,6.0,6.0,51.0,,,,,,,,,193.0,COMPLETE
4781,0.4417969431045505,2024-04-11 17:11:56.994649,2024-04-11 17:11:58.329786,0 days 00:00:01.335137,99.95205742788107,6.3263510495862265,sigmoid,30,,26.0,28.0,3.0,1.0,88.0,22.0,37.0,9.171251255794273,7.665733904072789,0.7081028596003343,10.0,50.0,76.0,,COMPLETE
4782,0.5963643249384587,2024-04-11 17:11:58.331352,2024-04-11 17:11:59.110435,0 days 00:00:00.779083,98.27204689970377,8.36548838913438,sigmoid,8,,25.0,32.0,,,,,,,,,,,,,COMPLETE
4783,0.451087254203867,2024-04-11 17:11:59.113972,2024-04-11 17:12:00.356729,0 days 00:00:01.242757,93.69993208519313,6.923866392554166,sigmoid,53,38.0,,,5.0,2.0,81.0,36.0,3.0,,,,,,,48.0,COMPLETE
4784,0.5450305058059437,2024-04-11 17:12:00.359728,2024-04-11 17:12:01.264517,0 days 00:00:00.904789,99.93732031663326,8.021966266730631,sigmoid,36,44.0,,,,,,8.0,14.0,,,,,,,,COMPLETE
4785,0.3184050428791322,2024-04-11 17:12:01.267046,2024-04-11 17:12:02.090247,0 days 00:00:00.823201,99.9380119950644,7.599237245274004,sigmoid,5,,,,,,,15.0,31.0,,,,,,,58.0,COMPLETE
4786,0.6009432182607054,2024-04-11 17:12:02.092240,2024-04-11 17:12:02.877553,0 days 00:00:00.785313,96.48595109907293,7.8357183718950205,sigmoid,8,,23.0,31.0,,,,,,,,,,,,,COMPLETE
4787,0.5274976412621868,2024-04-11 17:12:02.879530,2024-04-11 17:12:03.633175,0 days 00:00:00.753645,57.98866269787924,8.195793471328013,sigmoid,33,29.0,,,,,,,,,,,,,,158.0,COMPLETE
4788,0.4027336300063573,2024-04-11 17:12:03.635215,2024-04-11 17:12:04.715607,0 days 00:00:01.080392,91.90542790941828,8.506059353250247,sigmoid,18,,,,3.0,4.0,92.0,,,7.066480216569928,7.500288089142174,2.872153690601465,12.0,45.0,81.0,,COMPLETE
4789,0.5418147801683816,2024-04-11 17:12:04.717611,2024-04-11 17:12:05.915196,0 days 00:00:01.197585,96.5883219783236,8.037765232126244,sigmoid,50,49.0,,,2.0,8.0,23.0,,,2.5557680450050886,0.9780947877531974,8.502160790252443,2.0,40.0,63.0,,COMPLETE
4790,0.4960731477003156,2024-04-11 17:12:05.917200,2024-04-11 17:12:07.122719,0 days 00:00:01.205519,95.1149904592408,7.4320250397985435,sigmoid,51,11.0,,,7.0,7.0,18.0,,,3.6946979590519353,2.33251946184912,3.2794942949358443,20.0,37.0,89.0,125.0,COMPLETE
4791,0.12622036262203626,2024-04-11 17:12:07.124708,2024-04-11 17:12:07.946434,0 days 00:00:00.821726,98.2685770899329,8.327406600727532,sigmoid,8,,25.0,29.0,,,,,,,,,,,,,COMPLETE
4792,0.39548434085943185,2024-04-11 17:12:07.948431,2024-04-11 17:12:09.065768,0 days 00:00:01.117337,98.070713635169,7.773993734382351,sigmoid,19,,,,8.0,5.0,73.0,,,7.420149602695874,9.996472375417515,5.753581850703073,4.0,47.0,69.0,200.0,COMPLETE
4793,0.46406537937665254,2024-04-11 17:12:09.067764,2024-04-11 17:12:10.021864,0 days 00:00:00.954100,96.73097683551666,8.0635477763199,sigmoid,49,24.0,,,4.0,4.0,41.0,,,,,,,,,64.0,COMPLETE
4794,0.46257950222170596,2024-04-11 17:12:10.023404,2024-04-11 17:12:11.284947,0 days 00:00:01.261543,94.46072712859053,8.752455761740224,sigmoid,58,37.0,26.0,33.0,6.0,2.0,98.0,,,1.6171026135682856,8.539067601712084,6.598435234497063,11.0,23.0,95.0,,COMPLETE
4795,0.4154391469827711,2024-04-11 17:12:11.286944,2024-04-11 17:12:12.276053,0 days 00:00:00.989109,98.12637039907322,8.264474201742193,sigmoid,25,,22.0,31.0,5.0,3.0,63.0,,,,,,,,,43.0,COMPLETE
4796,0.10882754851052198,2024-04-11 17:12:12.278045,2024-04-11 17:12:13.597661,0 days 00:00:01.319616,98.32838241112218,7.885317980567983,rbf,29,,24.0,30.0,2.0,6.0,13.0,28.0,23.0,,,,,,,152.0,COMPLETE
4797,0.4777406299489706,2024-04-11 17:12:13.600245,2024-04-11 17:12:14.866818,0 days 00:00:01.266573,99.94663182938417,8.50052409213893,sigmoid,47,45.0,27.0,32.0,,,,30.0,45.0,8.892785002892733,9.466699469724116,9.189790374292313,7.0,20.0,65.0,98.0,COMPLETE
4798,0.44701971028259324,2024-04-11 17:12:14.869339,2024-04-11 17:12:15.689853,0 days 00:00:00.820514,96.76931940491977,7.606919903519066,sigmoid,8,,28.0,30.0,,,,,,,,,,,,,COMPLETE
4799,0.5952371952371952,2024-04-11 17:12:15.691874,2024-04-11 17:12:16.494290,0 days 00:00:00.802416,95.06978317079421,8.064538586382028,sigmoid,8,,25.0,32.0,,,,,,,,,,,,,COMPLETE
4800,0.3763372346490493,2024-04-11 17:12:16.496263,2024-04-11 17:12:17.681420,0 days 00:00:01.185157,99.95926604985067,8.27904531350782,sigmoid,43,27.0,26.0,31.0,,,,,,5.937788216328489,2.9599686775953824,9.980834565854199,9.0,29.0,80.0,106.0,COMPLETE
4801,0.4819341267939399,2024-04-11 17:12:17.683020,2024-04-11 17:12:18.631333,0 days 00:00:00.948313,75.12402490987319,7.783183187339333,sigmoid,24,,24.0,34.0,1.0,1.0,68.0,,,,,,,,,,COMPLETE
4802,0.3484182617222969,2024-04-11 17:12:18.633339,2024-04-11 17:12:19.796020,0 days 00:00:01.162681,98.24728341971016,7.909792053977264,sigmoid,39,48.0,,,,,,17.0,9.0,4.61408454434447,1.6365766383338864,8.844860304947638,13.0,48.0,59.0,178.0,COMPLETE
4803,0.25313578951968885,2024-04-11 17:12:19.797614,2024-04-11 17:12:21.025518,0 days 00:00:01.227904,96.86623323714876,8.134798017193425,sigmoid,22,,,,7.0,3.0,30.0,25.0,50.0,3.9170065806298533,2.0742881747192103,7.014300426878003,5.0,24.0,97.0,,COMPLETE
4804,0.5027425717153328,2024-04-11 17:12:21.027534,2024-04-11 17:12:22.108279,0 days 00:00:01.080745,92.62016864024241,8.401837794532343,sigmoid,35,16.0,,,,,,,,8.595627276945146,5.444317936739066,1.6557583418804094,17.0,41.0,86.0,84.0,COMPLETE
4805,0.44701971028259324,2024-04-11 17:12:22.110292,2024-04-11 17:12:22.940140,0 days 00:00:00.829848,98.26268821575765,7.4660288571479,sigmoid,8,,23.0,30.0,,,,,,,,,,,,,COMPLETE
4806,0.31304802509854396,2024-04-11 17:12:22.941136,2024-04-11 17:12:24.074238,0 days 00:00:01.133102,95.054526691564,8.002036059617925,sigmoid,38,18.0,,,,,,50.0,46.0,5.6827266873854105,2.6385803907328507,1.02758445017544,6.0,25.0,83.0,,COMPLETE
4807,0.5300260534418534,2024-04-11 17:12:24.076238,2024-04-11 17:12:25.072282,0 days 00:00:00.996044,96.48456116621611,8.688012424854996,sigmoid,21,,,,4.0,5.0,34.0,40.0,33.0,,,,,,,13.0,COMPLETE
4808,0.5263939742650905,2024-04-11 17:12:25.074282,2024-04-11 17:12:26.074240,0 days 00:00:00.999958,89.72568322726195,7.670615834083873,sigmoid,3,,,,,,,,,8.366268604790925,5.651750787759096,2.169122562971453,15.0,38.0,77.0,170.0,COMPLETE
4809,0.4742076613928881,2024-04-11 17:12:26.076274,2024-04-11 17:12:27.450619,0 days 00:00:01.374345,96.76302966822158,8.248865475955736,sigmoid,31,,26.0,33.0,3.0,7.0,53.0,10.0,19.0,0.9078490033613047,9.261246254896456,5.265818953867152,19.0,27.0,50.0,188.0,COMPLETE
4810,0.24140601471410747,2024-04-11 17:12:27.452620,2024-04-11 17:12:28.545006,0 days 00:00:01.092386,98.11806382321701,7.832366690868527,sigmoid,6,,,,,,,13.0,38.0,1.2934143318601912,8.177546424761033,3.816584190786153,18.0,30.0,79.0,,COMPLETE
4811,0.12622036262203626,2024-04-11 17:12:28.546980,2024-04-11 17:12:29.476482,0 days 00:00:00.929502,99.98068016760058,8.106571597889372,sigmoid,8,,27.0,29.0,,,,,,,,,,,,,COMPLETE
4812,0.5974957313602731,2024-04-11 17:12:29.478705,2024-04-11 17:12:30.280009,0 days 00:00:00.801304,94.15423836682618,8.459289360238438,sigmoid,8,,25.0,31.0,,,,,,,,,,,,,COMPLETE
4813,0.5069140556625241,2024-04-11 17:12:30.282457,2024-04-11 17:12:31.131640,0 days 00:00:00.849183,99.92741154722916,7.1063006542929035,sigmoid,8,,24.0,35.0,,,,,,,,,,,,,COMPLETE
4814,0.20862703373675576,2024-04-11 17:12:31.134169,2024-04-11 17:12:32.597914,0 days 00:00:01.463745,99.99608861874114,4.130549200948995,rbf,15,,28.0,32.0,,,,2.0,11.0,6.2902830508961,4.531061489269095,4.4665745258724145,14.0,39.0,53.0,135.0,COMPLETE
4815,0.4263281863386549,2024-04-11 17:12:32.599908,2024-04-11 17:12:33.474612,0 days 00:00:00.874704,98.26534282206079,7.953671563013625,sigmoid,9,,26.0,30.0,,,,,,,,,,,,21.0,COMPLETE
4816,0.48764358666634,2024-04-11 17:12:33.476618,2024-04-11 17:12:34.581262,0 days 00:00:01.104644,95.75292711880898,8.28723412176856,sigmoid,28,,30.0,27.0,6.0,1.0,4.0,33.0,12.0,,,,,,,,COMPLETE
4817,0.5929369437606513,2024-04-11 17:12:34.582259,2024-04-11 17:12:35.403477,0 days 00:00:00.821218,92.08703015776076,8.580454072040565,sigmoid,8,,25.0,33.0,,,,,,,,,,,,,COMPLETE
4818,0.4662477731234051,2024-04-11 17:12:35.404478,2024-04-11 17:12:36.497659,0 days 00:00:01.093181,98.22716569284378,7.66355890289696,sigmoid,57,2.0,22.0,31.0,8.0,4.0,66.0,,,,,,,,,119.0,COMPLETE
4819,0.4433140219490368,2024-04-11 17:12:36.499628,2024-04-11 17:12:37.303919,0 days 00:00:00.804291,96.56531808653153,8.135104192598888,sigmoid,16,,,,4.0,6.0,45.0,,,,,,,,,,COMPLETE
4820,0.4497676614566509,2024-04-11 17:12:37.305918,2024-04-11 17:12:38.485113,0 days 00:00:01.179195,98.25030795004768,7.953480126243439,sigmoid,14,,27.0,32.0,,,,21.0,35.0,2.309193998102131,5.195582532249659,1.9193001955448712,8.0,26.0,85.0,,COMPLETE
4821,0.4014321018946834,2024-04-11 17:12:38.487111,2024-04-11 17:12:39.736597,0 days 00:00:01.249486,17.26255053723027,8.334715833697624,sigmoid,46,31.0,24.0,29.0,,,,24.0,29.0,9.827504372356783,4.873078449764948,5.556465084121334,10.0,33.0,87.0,,COMPLETE
4822,0.4513290990355211,2024-04-11 17:12:39.739772,2024-04-11 17:12:40.547582,0 days 00:00:00.807810,31.204996046912072,7.326076435080936,sigmoid,8,,25.0,30.0,,,,,,,,,,,,,COMPLETE
4823,0.6009432182607054,2024-04-11 17:12:40.549577,2024-04-11 17:12:41.350420,0 days 00:00:00.800843,94.3414876930749,7.829569354057073,sigmoid,8,,23.0,31.0,,,,,,,,,,,,,COMPLETE
4824,0.31881913619389846,2024-04-11 17:12:41.352424,2024-04-11 17:12:42.460446,0 days 00:00:01.108022,96.76795897152192,8.155227403050786,sigmoid,42,21.0,27.0,32.0,,,,,,6.575993334373907,3.8675454941066576,7.224963634103944,2.0,28.0,57.0,,COMPLETE
4825,0.3760836856057892,2024-04-11 17:12:42.461992,2024-04-11 17:12:43.404168,0 days 00:00:00.942176,98.30970248921821,7.56366625274721,sigmoid,41,14.0,26.0,29.0,,,,,,,,,,,,165.0,COMPLETE
4826,0.45347172512526845,2024-04-11 17:12:43.405800,2024-04-11 17:12:44.219720,0 days 00:00:00.813920,99.96700083224425,8.003143930734906,sigmoid,8,,25.0,28.0,,,,,,,,,,,,,COMPLETE
4827,0.393465682043413,2024-04-11 17:12:44.221719,2024-04-11 17:12:45.378717,0 days 00:00:01.156998,99.99864448249305,8.413383499921906,sigmoid,11,,29.0,31.0,,,,,,9.387761369668874,8.89088653549602,3.4448546401869216,19.0,32.0,70.0,92.0,COMPLETE
4828,0.47610926434455847,2024-04-11 17:12:45.380719,2024-04-11 17:12:46.827434,0 days 00:00:01.446715,95.2633039951103,7.819471551374141,sigmoid,63,47.0,24.0,33.0,1.0,2.0,85.0,34.0,48.0,1.9383945637834716,6.217392818228418,6.333217287976652,12.0,43.0,73.0,115.0,COMPLETE
4829,0.4448341684562156,2024-04-11 17:12:46.829997,2024-04-11 17:12:47.623822,0 days 00:00:00.793825,96.72942484662285,8.9145931903525,sigmoid,8,,26.0,30.0,,,,,,,,,,,,,COMPLETE
4830,0.6009432182607054,2024-04-11 17:12:47.625805,2024-04-11 17:12:48.439171,0 days 00:00:00.813366,99.98187296836734,8.11231976235793,sigmoid,8,,23.0,31.0,,,,,,,,,,,,,COMPLETE
4831,0.40268173892129155,2024-04-11 17:12:48.440167,2024-04-11 17:12:49.813367,0 days 00:00:01.373200,93.84641534926627,8.607177661654019,sigmoid,62,12.0,27.0,32.0,5.0,8.0,20.0,20.0,40.0,3.419077478505092,9.774493638605385,4.126897817819907,3.0,30.0,96.0,,COMPLETE
4832,0.34354477470295713,2024-04-11 17:12:49.815960,2024-04-11 17:12:51.065258,0 days 00:00:01.249298,98.14488762336202,8.249843716307916,rbf,20,,,,8.0,6.0,36.0,29.0,17.0,,,,,,,,COMPLETE
4833,0.12622036262203626,2024-04-11 17:12:51.067300,2024-04-11 17:12:51.869906,0 days 00:00:00.802606,96.66365248247146,7.740677755844282,sigmoid,8,,24.0,29.0,,,,,,,,,,,,,COMPLETE
4834,0.3013653013653014,2024-04-11 17:12:51.871902,2024-04-11 17:12:52.941193,0 days 00:00:01.069291,99.94910502522134,7.885713613492065,sigmoid,10,,28.0,34.0,,,,,,3.0170439474552593,1.2922469315388962,7.566345986802927,16.0,36.0,74.0,,COMPLETE
4835,0.5144772288568823,2024-04-11 17:12:52.943194,2024-04-11 17:12:53.844708,0 days 00:00:00.901514,95.56478363021165,7.51716378062311,sigmoid,37,36.0,,,,,,46.0,25.0,,,,,,,50.0,COMPLETE
4836,0.5437033925007877,2024-04-11 17:12:53.845708,2024-04-11 17:12:54.792068,0 days 00:00:00.946360,79.11195863116191,8.37315661000914,sigmoid,2,,,,,,,,,7.230606384496738,7.259094703353306,5.973980476688467,8.0,21.0,62.0,,COMPLETE
4837,0.3198586260216479,2024-04-11 17:12:54.794588,2024-04-11 17:12:55.721631,0 days 00:00:00.927043,98.32698197169009,8.071221638681711,sigmoid,48,19.0,,,2.0,7.0,49.0,,,,,,,,,,COMPLETE
4838,0.5986580986580987,2024-04-11 17:12:55.723631,2024-04-11 17:12:56.518525,0 days 00:00:00.794894,99.98265373756969,8.243761766811264,sigmoid,8,,25.0,31.0,,,,,,,,,,,,,COMPLETE
4839,0.44701971028259324,2024-04-11 17:12:56.521040,2024-04-11 17:12:57.392417,0 days 00:00:00.871377,96.66547838045358,8.036629067238305,sigmoid,8,,26.0,30.0,,,,,,,,,,,,,COMPLETE
4840,0.5106070864364703,2024-04-11 17:12:57.394415,2024-04-11 17:12:58.508361,0 days 00:00:01.113946,92.06363566268203,8.538792880947907,sigmoid,52,22.0,,,7.0,4.0,16.0,4.0,4.0,,,,,,,,COMPLETE
4841,0.4495244546044648,2024-04-11 17:12:58.510364,2024-04-11 17:12:59.759817,0 days 00:00:01.249453,98.18179261866244,7.649697310247702,sigmoid,26,,25.0,33.0,3.0,5.0,90.0,,,9.589868399233975,0.5020879151885209,9.00988927446136,20.0,49.0,60.0,,COMPLETE
4842,0.3672132238001796,2024-04-11 17:12:59.761463,2024-04-11 17:13:00.760812,0 days 00:00:00.999349,93.99648632716296,7.905743345046902,sigmoid,44,28.0,22.0,32.0,,,,48.0,7.0,,,,,,,,COMPLETE
4843,0.3875551518297431,2024-04-11 17:13:00.762812,2024-04-11 17:13:01.713867,0 days 00:00:00.951055,4.2226266139449535,8.215536641653305,sigmoid,12,,24.0,31.0,,,,45.0,32.0,,,,,,,,COMPLETE
4844,0.4553979871912168,2024-04-11 17:13:01.715854,2024-04-11 17:13:02.744612,0 days 00:00:01.028758,98.1220262830813,8.382145259632546,sigmoid,56,23.0,26.0,32.0,6.0,3.0,79.0,,,,,,,,,,COMPLETE
4845,0.47108155002891844,2024-04-11 17:13:02.746606,2024-04-11 17:13:04.112705,0 days 00:00:01.366099,99.95665943919303,7.952799213382304,sigmoid,59,32.0,27.0,28.0,5.0,8.0,58.0,,,4.9152881745388735,1.8151694734109975,7.835411903827135,17.0,46.0,52.0,70.0,COMPLETE
4846,0.3669203416303878,2024-04-11 17:13:04.114702,2024-04-11 17:13:05.107239,0 days 00:00:00.992537,99.97293527169506,7.734675754406836,sigmoid,13,,23.0,30.0,,,,15.0,20.0,,,,,,,26.0,COMPLETE
4847,0.126809901914993,2024-04-11 17:13:05.109234,2024-04-11 17:13:05.928897,0 days 00:00:00.819663,99.95571332324266,7.343910461772998,sigmoid,8,,25.0,29.0,,,,,,,,,,,,,COMPLETE
4848,0.5940618478467085,2024-04-11 17:13:05.929900,2024-04-11 17:13:06.729592,0 days 00:00:00.799692,95.6235443606518,8.728738053436702,sigmoid,8,,26.0,33.0,,,,,,,,,,,,,COMPLETE
4849,0.39599101229895933,2024-04-11 17:13:06.731135,2024-04-11 17:13:08.079878,0 days 00:00:01.348743,96.76332832327236,8.068273739916641,sigmoid,55,5.0,,,1.0,2.0,6.0,18.0,18.0,4.462402584933278,3.389402290971906,0.9244070601287175,14.0,44.0,68.0,32.0,COMPLETE
4850,0.43052821522309714,2024-04-11 17:13:08.081874,2024-04-11 17:13:09.201618,0 days 00:00:01.119744,95.21649939223865,8.200663165418732,sigmoid,60,25.0,20.0,25.0,4.0,1.0,75.0,11.0,14.0,,,,,,,,COMPLETE
4851,0.15590008613264425,2024-04-11 17:13:09.203615,2024-04-11 17:13:10.640042,0 days 00:00:01.436427,99.99298584607604,7.834155129235782,rbf,54,10.0,,,2.0,7.0,71.0,36.0,42.0,2.702866174464117,6.874976679757562,3.1196863830370054,3.0,42.0,64.0,,COMPLETE
4852,0.36071609525418,2024-04-11 17:13:10.642573,2024-04-11 17:13:11.490917,0 days 00:00:00.848344,99.97330696450031,8.47839464524326,sigmoid,36,43.0,,,,,,38.0,23.0,,,,,,,,COMPLETE
4853,0.4998641796450562,2024-04-11 17:13:11.492921,2024-04-11 17:13:12.222286,0 days 00:00:00.729365,99.9728464281611,7.542533516407287,sigmoid,1,,,,,,,,,,,,,,,145.0,COMPLETE
4854,0.3697129776369079,2024-04-11 17:13:12.224291,2024-04-11 17:13:13.482572,0 days 00:00:01.258281,99.98332102626496,8.10768604912155,sigmoid,23,,,,6.0,6.0,10.0,14.0,8.0,6.940536101978937,5.866025312178728,8.249345154050957,4.0,34.0,91.0,160.0,COMPLETE
4855,0.5963245096172158,2024-04-11 17:13:13.484566,2024-04-11 17:13:14.293785,0 days 00:00:00.809219,96.3742610126291,8.354302810422096,sigmoid,8,,24.0,31.0,,,,,,,,,,,,,COMPLETE
4856,0.44701971028259324,2024-04-11 17:13:14.295785,2024-04-11 17:13:15.112616,0 days 00:00:00.816831,93.1057820372015,7.890798035519309,sigmoid,8,,28.0,30.0,,,,,,,,,,,,,COMPLETE
4857,0.5952371952371952,2024-04-11 17:13:15.114621,2024-04-11 17:13:15.910006,0 days 00:00:00.795385,96.85302414879763,7.68028885322153,sigmoid,8,,29.0,32.0,,,,,,,,,,,,,COMPLETE
4858,0.24478066097540357,2024-04-11 17:13:15.912973,2024-04-11 17:13:16.897653,0 days 00:00:00.984680,98.03892799427297,8.199942301055861,sigmoid,34,41.0,,,,,,,,8.05076989710855,6.617247555139067,9.529199569893379,9.0,48.0,94.0,,COMPLETE
4859,0.5346622598636646,2024-04-11 17:13:16.900205,2024-04-11 17:13:17.802896,0 days 00:00:00.902691,98.20795404260105,8.001646857595974,sigmoid,40,30.0,22.0,31.0,,,,,,,,,,,,,COMPLETE
4860,0.4864234464924068,2024-04-11 17:13:17.804443,2024-04-11 17:13:19.156241,0 days 00:00:01.351798,54.30970037936093,8.60079599039621,sigmoid,30,,27.0,34.0,8.0,5.0,25.0,6.0,2.0,4.198935730165996,2.4983067099692438,2.370252256355156,18.0,31.0,71.0,,COMPLETE
4861,0.5624266074106191,2024-04-11 17:13:19.158245,2024-04-11 17:13:19.899040,0 days 00:00:00.740795,93.99129312170948,8.325630225769954,sigmoid,32,6.0,,,,,,,,,,,,,,,COMPLETE
4862,0.44932598216089825,2024-04-11 17:13:19.901041,2024-04-11 17:13:20.684119,0 days 00:00:00.783078,90.65506207479518,7.815872979046647,sigmoid,4,,,,,,,43.0,28.0,,,,,,,,COMPLETE
4863,0.4470712773465067,2024-04-11 17:13:20.686117,2024-04-11 17:13:21.516539,0 days 00:00:00.830422,96.78548781242273,4.889359765518709,sigmoid,8,,25.0,30.0,,,,,,,,,,,,,COMPLETE
4864,0.4644002565747274,2024-04-11 17:13:21.518553,2024-04-11 17:13:22.727936,0 days 00:00:01.209383,98.11992457393748,7.446260737927587,sigmoid,61,34.0,26.0,32.0,7.0,3.0,56.0,8.0,21.0,,,,,,,140.0,COMPLETE
4865,0.4892619779783751,2024-04-11 17:13:22.729942,2024-04-11 17:13:23.765764,0 days 00:00:01.035822,94.95384872218321,8.028786268680179,sigmoid,45,13.0,23.0,27.0,,,,35.0,6.0,,,,,,,77.0,COMPLETE
4866,0.42035440460662366,2024-04-11 17:13:23.768347,2024-04-11 17:13:24.990861,0 days 00:00:01.222514,98.1240322780502,8.174994642358415,sigmoid,51,49.0,,,2.0,8.0,96.0,,,1.4510652795189523,4.202264633043603,2.69929537688128,15.0,40.0,98.0,196.0,COMPLETE
4867,0.32590735771783647,2024-04-11 17:13:24.992860,2024-04-11 17:13:26.118418,0 days 00:00:01.125558,96.43950598578466,8.484167979398618,sigmoid,7,,,,,,,20.0,40.0,7.8276617357985625,3.6591323058623493,5.0037112759875955,13.0,20.0,67.0,41.0,COMPLETE
4868,0.12622036262203626,2024-04-11 17:13:26.120417,2024-04-11 17:13:26.937885,0 days 00:00:00.817468,98.08223157075294,7.750979995834829,sigmoid,8,,24.0,29.0,,,,,,,,,,,,,COMPLETE
4869,0.4807221724858251,2024-04-11 17:13:26.939882,2024-04-11 17:13:28.324756,0 days 00:00:01.384874,95.1603685093062,7.958686747718338,rbf,8,,31.0,30.0,,,,,,,,,,,,,COMPLETE
