number,value,datetime_start,datetime_complete,duration,params_C,params_gamma,params_kernel,params_mask_number,params_rsi_window,params_so_smooth,params_so_window,params_srsi_smooth1,params_srsi_smooth2,params_srsi_window,params_tsi_window_fast,params_tsi_window_slow,params_ult_weight_1,params_ult_weight_2,params_ult_weight_3,params_ult_window_1,params_ult_window_2,params_ult_window_3,params_williams_lbp,state
4357,0.3796636979471132,2024-04-11 17:04:17.880550,2024-04-11 17:04:19.361643,0 days 00:00:01.481093,90.47944964844662,7.830319743775124,sigmoid,43,36.0,26.0,31.0,,,,,,6.719041146594002,2.2423143032785107,2.8055678708516227,7.0,47.0,90.0,91.0,COMPLETE
4358,0.5062829776864233,2024-04-11 17:04:19.364647,2024-04-11 17:04:20.609139,0 days 00:00:01.244492,99.98339009713844,8.752795701058059,sigmoid,17,,,,6.0,7.0,8.0,,,,,,,,,16.0,COMPLETE
4359,0.12622036262203626,2024-04-11 17:04:20.611141,2024-04-11 17:04:21.397663,0 days 00:00:00.786522,98.11107105025816,8.104633198628072,sigmoid,8,,23.0,29.0,,,,,,,,,,,,,COMPLETE
4360,0.5963643249384587,2024-04-11 17:04:21.399697,2024-04-11 17:04:22.281100,0 days 00:00:00.881403,95.40899406580264,8.449267414589956,sigmoid,8,,47.0,31.0,,,,,,,,,,,,,COMPLETE
4361,0.39468444837720823,2024-04-11 17:04:22.282071,2024-04-11 17:04:23.458666,0 days 00:00:01.176595,98.15715423824597,7.641926059940017,sigmoid,50,39.0,,,5.0,2.0,42.0,,,4.078851510886078,9.598481212794127,7.912050047751366,20.0,35.0,52.0,,COMPLETE
4362,0.44056178832218895,2024-04-11 17:04:23.461262,2024-04-11 17:04:24.828505,0 days 00:00:01.367243,93.88973393382648,8.257222262314793,sigmoid,47,10.0,25.0,34.0,,,,50.0,16.0,9.953281817374537,5.294468477681132,1.8129357774159693,18.0,36.0,80.0,69.0,COMPLETE
4363,0.5138787864567447,2024-04-11 17:04:24.831057,2024-04-11 17:04:26.076004,0 days 00:00:01.244947,98.24700676229646,8.08274324484395,sigmoid,22,,,,3.0,5.0,54.0,38.0,42.0,7.345567738362999,2.0597346723018535,6.1090356561912,14.0,45.0,61.0,,COMPLETE
4364,0.09354542322269438,2024-04-11 17:04:26.078774,2024-04-11 17:04:27.745058,0 days 00:00:01.666284,96.65719061645403,7.894254306343754,rbf,39,7.0,,,,,,27.0,26.0,2.81803748047131,4.081613731416333,9.49286691590722,4.0,48.0,57.0,175.0,COMPLETE
4365,0.41449909423385867,2024-04-11 17:04:27.747605,2024-04-11 17:04:28.741322,0 days 00:00:00.993717,98.17236364528057,8.449891413284277,sigmoid,33,17.0,,,,,,,,,,,,,,136.0,COMPLETE
4366,0.5359415359415359,2024-04-11 17:04:28.743928,2024-04-11 17:04:29.823230,0 days 00:00:01.079302,95.0227687386296,7.950154131194428,sigmoid,35,6.0,,,,,,,,6.4175150542710035,5.843148306479187,4.806403319681404,10.0,40.0,69.0,122.0,COMPLETE
4367,0.5929369437606513,2024-04-11 17:04:29.826146,2024-04-11 17:04:30.968878,0 days 00:00:01.142732,98.15533210236863,7.680850308297398,sigmoid,8,,27.0,33.0,,,,,,,,,,,,,COMPLETE
4368,0.4502698896972542,2024-04-11 17:04:30.970867,2024-04-11 17:04:31.889264,0 days 00:00:00.918397,96.58515554995891,7.365075649364357,sigmoid,8,,24.0,30.0,,,,,,,,,,,,,COMPLETE
4369,0.34823814444008977,2024-04-11 17:04:31.891851,2024-04-11 17:04:33.010792,0 days 00:00:01.118941,98.22503941494526,8.252073363704444,sigmoid,38,47.0,,,,,,5.0,31.0,9.362943521400162,2.7595351600726548,6.917158821001483,11.0,43.0,50.0,,COMPLETE
4370,0.5952371952371952,2024-04-11 17:04:33.012786,2024-04-11 17:04:33.791853,0 days 00:00:00.779067,92.10239437408507,8.121937004496234,sigmoid,8,,26.0,32.0,,,,,,,,,,,,,COMPLETE
4371,0.4277913610431947,2024-04-11 17:04:33.793903,2024-04-11 17:04:34.809803,0 days 00:00:01.015900,95.29865360824972,8.684689378259295,sigmoid,24,,21.0,31.0,2.0,3.0,5.0,,,,,,,,,,COMPLETE
4372,0.5040664432176656,2024-04-11 17:04:34.812802,2024-04-11 17:04:36.211573,0 days 00:00:01.398771,99.97089209611023,7.8242882280185615,sigmoid,31,,25.0,28.0,8.0,4.0,48.0,12.0,49.0,7.017362308916948,1.571051359634445,1.4484052333380641,3.0,22.0,86.0,147.0,COMPLETE
4373,0.5001922429951459,2024-04-11 17:04:36.213571,2024-04-11 17:04:37.145358,0 days 00:00:00.931787,96.77085058199171,8.314126157513327,sigmoid,21,,,,7.0,2.0,56.0,47.0,27.0,,,,,,,189.0,COMPLETE
4374,0.48497607655502395,2024-04-11 17:04:37.147355,2024-04-11 17:04:38.402163,0 days 00:00:01.254808,98.12920971021794,8.048484191614671,sigmoid,15,,23.0,30.0,,,,16.0,5.0,8.795791984161234,7.085576307435894,7.508182475746876,5.0,27.0,81.0,103.0,COMPLETE
4375,0.42182849441230974,2024-04-11 17:04:38.404721,2024-04-11 17:04:39.474540,0 days 00:00:01.069819,99.94367982933358,8.555146700751102,sigmoid,28,,28.0,33.0,5.0,8.0,82.0,32.0,22.0,,,,,,,,COMPLETE
4376,0.5998117115420825,2024-04-11 17:04:39.476525,2024-04-11 17:04:40.245053,0 days 00:00:00.768528,93.56417926509464,7.208910221653382,sigmoid,8,,24.0,32.0,,,,,,,,,,,,,COMPLETE
4377,0.49112200695006425,2024-04-11 17:04:40.247055,2024-04-11 17:04:41.231325,0 days 00:00:00.984270,99.96813481786504,7.543355633270075,sigmoid,16,,,,4.0,6.0,88.0,,,,,,,,,,COMPLETE
4378,0.41880051829456405,2024-04-11 17:04:41.233306,2024-04-11 17:04:42.690919,0 days 00:00:01.457613,96.6709387762999,7.961922617804816,sigmoid,57,3.0,26.0,36.0,1.0,1.0,23.0,,,,,,,,,166.0,COMPLETE
4379,0.5398568335469047,2024-04-11 17:04:42.693335,2024-04-11 17:04:43.711498,0 days 00:00:01.018163,94.96404891099574,7.772802403560835,sigmoid,3,,,,,,,,,2.4917427181578478,0.8608897344017263,2.469105899578124,16.0,34.0,95.0,23.0,COMPLETE
4380,0.4523933034661636,2024-04-11 17:04:43.712501,2024-04-11 17:04:44.572406,0 days 00:00:00.859905,98.11046699734048,6.8132388140876845,sigmoid,8,,27.0,30.0,,,,,,,,,,,,,COMPLETE
4381,0.4950883619151821,2024-04-11 17:04:44.574399,2024-04-11 17:04:45.733571,0 days 00:00:01.159172,98.21425906044101,8.26055370465436,sigmoid,14,,29.0,31.0,,,,20.0,45.0,5.932034596307595,3.7319413308532083,3.4818191389353066,12.0,31.0,71.0,,COMPLETE
4382,0.3988075951007712,2024-04-11 17:04:45.736561,2024-04-11 17:04:47.100723,0 days 00:00:01.364162,63.48245383242684,8.108984993915675,sigmoid,46,45.0,24.0,30.0,,,,41.0,8.0,8.236245654738601,9.340028353506469,3.0471522302101013,15.0,26.0,88.0,,COMPLETE
4383,0.23220526432205263,2024-04-11 17:04:47.103723,2024-04-11 17:04:48.735427,0 days 00:00:01.631704,99.97789221897185,8.37771724149434,rbf,42,38.0,22.0,29.0,,,,,,4.785201651276103,1.352044101793883,8.466061631658238,6.0,30.0,66.0,,COMPLETE
4384,0.5955035642478522,2024-04-11 17:04:48.737382,2024-04-11 17:04:49.587426,0 days 00:00:00.850044,96.64016370264544,7.903116357129292,sigmoid,8,,25.0,41.0,,,,,,,,,,,,,COMPLETE
4385,0.47377031301123357,2024-04-11 17:04:49.590009,2024-04-11 17:04:51.184856,0 days 00:00:01.594847,95.23431984623025,7.6877754430138365,sigmoid,63,29.0,26.0,34.0,2.0,3.0,79.0,26.0,35.0,1.6556864265630131,7.8297903644877715,7.162250602772163,17.0,44.0,53.0,129.0,COMPLETE
4386,0.25642582473183567,2024-04-11 17:04:51.187857,2024-04-11 17:04:52.134576,0 days 00:00:00.946719,98.21626763494032,8.136364578189735,sigmoid,2,,,,,,,,,1.9636609868911745,5.0124718714609084,9.077775704580022,19.0,22.0,65.0,,COMPLETE
4387,0.5963643249384587,2024-04-11 17:04:52.137132,2024-04-11 17:04:52.945623,0 days 00:00:00.808491,99.92657732251465,8.579623620431521,sigmoid,8,,27.0,32.0,,,,,,,,,,,,,COMPLETE
4388,0.339249512297747,2024-04-11 17:04:52.947631,2024-04-11 17:04:53.838742,0 days 00:00:00.891111,99.98832135794709,5.610056582438777,sigmoid,9,,25.0,31.0,,,,,,,,,,,,82.0,COMPLETE
4389,0.3965895017624083,2024-04-11 17:04:53.840743,2024-04-11 17:04:54.786762,0 days 00:00:00.946019,92.99581216867945,7.955674241369939,sigmoid,41,2.0,23.0,29.0,,,,,,,,,,,,35.0,COMPLETE
4390,0.4809565987599646,2024-04-11 17:04:54.787764,2024-04-11 17:04:56.023501,0 days 00:00:01.235737,99.97981053722084,8.345248582414051,sigmoid,26,,24.0,35.0,8.0,6.0,68.0,,,3.0912581802531918,8.655288333391782,0.5067127373033715,8.0,49.0,84.0,,COMPLETE
4391,0.592071705784513,2024-04-11 17:04:56.025497,2024-04-11 17:04:56.850883,0 days 00:00:00.825386,96.63850544684762,8.962851210543517,sigmoid,8,,26.0,27.0,,,,,,,,,,,,,COMPLETE
4392,0.5952371952371952,2024-04-11 17:04:56.853422,2024-04-11 17:04:57.693960,0 days 00:00:00.840538,99.99176452473453,7.4983712160183025,sigmoid,8,,28.0,32.0,,,,,,,,,,,,,COMPLETE
4393,0.46130053941703375,2024-04-11 17:04:57.696567,2024-04-11 17:04:58.631302,0 days 00:00:00.934735,96.49231414622379,7.794384412535691,sigmoid,20,,,,7.0,7.0,97.0,24.0,30.0,,,,,,,,COMPLETE
4394,0.5149751319418804,2024-04-11 17:04:58.634297,2024-04-11 17:04:59.502254,0 days 00:00:00.867957,94.49150095034136,8.111572085013492,sigmoid,37,19.0,,,,,,35.0,38.0,,,,,,,42.0,COMPLETE
4395,0.5929369437606513,2024-04-11 17:04:59.504851,2024-04-11 17:05:00.311145,0 days 00:00:00.806294,99.9835420377393,8.402991900591166,sigmoid,8,,25.0,33.0,,,,,,,,,,,,,COMPLETE
4396,0.5439961009686656,2024-04-11 17:05:00.313171,2024-04-11 17:05:01.245118,0 days 00:00:00.931947,96.66744277156454,7.959116806081047,sigmoid,48,43.0,,,6.0,5.0,44.0,,,,,,,,,,COMPLETE
4397,0.41713273938337875,2024-04-11 17:05:01.247119,2024-04-11 17:05:02.899715,0 days 00:00:01.652596,98.10734441034633,7.658690993019903,sigmoid,62,21.0,27.0,30.0,4.0,8.0,37.0,48.0,46.0,9.685813508934611,8.177214404186099,4.021372309424159,11.0,20.0,98.0,,COMPLETE
4398,0.5107275408002441,2024-04-11 17:05:02.902716,2024-04-11 17:05:03.917078,0 days 00:00:01.014362,28.703146327182225,8.216877649106122,sigmoid,56,9.0,24.0,31.0,3.0,4.0,59.0,,,,,,,,,,COMPLETE
4399,0.5963643249384587,2024-04-11 17:05:03.919068,2024-04-11 17:05:04.828509,0 days 00:00:00.909441,98.12220746003419,8.593972438161632,sigmoid,8,,23.0,32.0,,,,,,,,,,,,,COMPLETE
4400,0.4620037177815387,2024-04-11 17:05:04.831493,2024-04-11 17:05:05.968175,0 days 00:00:01.136682,95.03002342566131,7.975744491557069,sigmoid,10,,25.0,29.0,,,,,,3.7239080263396627,3.5319447578904812,5.492965866272994,9.0,28.0,72.0,,COMPLETE
4401,0.3609558064171504,2024-04-11 17:05:05.970162,2024-04-11 17:05:07.111814,0 days 00:00:01.141652,24.573356009008748,8.187064710589043,sigmoid,11,,26.0,31.0,,,,,,4.459683739866702,1.8524179758107748,8.233430728042542,13.0,21.0,97.0,18.0,COMPLETE
4402,0.2764883099248949,2024-04-11 17:05:07.114396,2024-04-11 17:05:08.396754,0 days 00:00:01.282358,99.97076689567105,7.768192862650968,rbf,52,40.0,,,6.0,2.0,29.0,14.0,19.0,,,,,,,,COMPLETE
4403,0.5963643249384587,2024-04-11 17:05:08.398755,2024-04-11 17:05:09.252875,0 days 00:00:00.854120,96.67911810902994,8.384759020101164,sigmoid,8,,27.0,32.0,,,,,,,,,,,,,COMPLETE
4404,0.4646374685666387,2024-04-11 17:05:09.256490,2024-04-11 17:05:10.968651,0 days 00:00:01.712161,91.78162496679599,8.82940289040894,sigmoid,55,34.0,,,2.0,7.0,74.0,4.0,12.0,3.558158311886362,4.400923157249488,5.16172370125027,2.0,50.0,74.0,52.0,COMPLETE
4405,0.3424846045343517,2024-04-11 17:05:10.970655,2024-04-11 17:05:12.000912,0 days 00:00:01.030257,98.22240923948253,9.942982076502725,sigmoid,44,12.0,25.0,28.0,,,,29.0,24.0,,,,,,,,COMPLETE
4406,0.46857538319577585,2024-04-11 17:05:12.002906,2024-04-11 17:05:13.369306,0 days 00:00:01.366400,99.96956558160666,8.07225626374551,sigmoid,59,25.0,22.0,30.0,1.0,1.0,95.0,,,6.132375355255461,6.6199580279416175,3.195799208312379,7.0,41.0,92.0,113.0,COMPLETE
4407,0.5986580986580987,2024-04-11 17:05:13.371910,2024-04-11 17:05:14.270926,0 days 00:00:00.899016,94.02016651707102,7.472688265242487,sigmoid,8,,29.0,31.0,,,,,,,,,,,,,COMPLETE
4408,0.5929369437606513,2024-04-11 17:05:14.273933,2024-04-11 17:05:15.216987,0 days 00:00:00.943054,96.0696775383267,7.865724095816086,sigmoid,8,,23.0,33.0,,,,,,,,,,,,,COMPLETE
4409,0.5456399343884382,2024-04-11 17:05:15.218988,2024-04-11 17:05:16.297063,0 days 00:00:01.078075,98.08742957155573,8.254186461573628,sigmoid,13,,24.0,34.0,,,,19.0,50.0,,,,,,,194.0,COMPLETE
4410,0.3526423824931288,2024-04-11 17:05:16.299118,2024-04-11 17:05:17.215127,0 days 00:00:00.916009,96.75342247789644,8.501680984117801,sigmoid,12,,26.0,30.0,,,,31.0,43.0,,,,,,,,COMPLETE
4411,0.5964426137427449,2024-04-11 17:05:17.218134,2024-04-11 17:05:18.039762,0 days 00:00:00.821628,15.382702011535265,4.755704582530734,sigmoid,8,,28.0,31.0,,,,,,,,,,,,,COMPLETE
4412,0.48448716388855095,2024-04-11 17:05:18.041768,2024-04-11 17:05:19.368144,0 days 00:00:01.326376,97.99593373341384,7.693328196707329,sigmoid,23,,,,5.0,3.0,46.0,45.0,39.0,5.468317919845583,6.033656710954032,6.391175179567574,20.0,25.0,63.0,153.0,COMPLETE
4413,0.557214219330855,2024-04-11 17:05:19.370141,2024-04-11 17:05:20.341173,0 days 00:00:00.971032,93.8470660385456,7.2565368009927305,sigmoid,40,48.0,26.0,32.0,,,,,,,,,,,,,COMPLETE
4414,0.5158430950136887,2024-04-11 17:05:20.343156,2024-04-11 17:05:21.693942,0 days 00:00:01.350786,99.98557523109433,7.9953543987755324,sigmoid,7,,,,,,,30.0,9.0,8.03167606218853,5.534277382453569,4.477592070537525,4.0,45.0,67.0,88.0,COMPLETE
4415,0.4742268041237113,2024-04-11 17:05:21.695942,2024-04-11 17:05:23.030636,0 days 00:00:01.334694,95.20805590453276,8.201988109861283,sigmoid,54,36.0,,,7.0,5.0,91.0,33.0,41.0,1.5121076860241103,7.6965778984963045,6.7675511698753095,14.0,33.0,79.0,,COMPLETE
4416,0.12622036262203626,2024-04-11 17:05:23.032215,2024-04-11 17:05:23.798037,0 days 00:00:00.765822,98.218112440415,7.890364962990065,sigmoid,8,,24.0,29.0,,,,,,,,,,,,,COMPLETE
4417,0.5929369437606513,2024-04-11 17:05:23.800036,2024-04-11 17:05:24.627253,0 days 00:00:00.827217,96.82057219210051,7.568134697497093,sigmoid,8,,25.0,33.0,,,,,,,,,,,,,COMPLETE
4418,0.46393602296611475,2024-04-11 17:05:24.629181,2024-04-11 17:05:26.488551,0 days 00:00:01.859370,96.89675647274494,8.409709832432359,sigmoid,60,37.0,27.0,30.0,3.0,6.0,86.0,2.0,4.0,,,,,,,,COMPLETE
4419,0.5480980628033351,2024-04-11 17:05:26.490552,2024-04-11 17:05:27.275476,0 days 00:00:00.784924,98.14833069617458,8.05549488910992,sigmoid,1,,,,,,,,,,,,,,,162.0,COMPLETE
4420,0.5963245096172158,2024-04-11 17:05:27.279001,2024-04-11 17:05:28.588237,0 days 00:00:01.309236,95.33470993867633,8.67642457305415,sigmoid,8,,24.0,31.0,,,,,,,,,,,,,COMPLETE
4421,0.3759330174595963,2024-04-11 17:05:28.589784,2024-04-11 17:05:30.260750,0 days 00:00:01.670966,99.94953887168064,8.227444610217333,sigmoid,27,,26.0,32.0,8.0,2.0,13.0,,,0.8753723273627632,3.1451827722318724,0.8492433667738384,10.0,31.0,60.0,173.0,COMPLETE
4422,0.426530246987233,2024-04-11 17:05:30.263726,2024-04-11 17:05:31.167816,0 days 00:00:00.904090,90.64575634346564,7.722142375807572,sigmoid,36,16.0,,,,,,43.0,33.0,,,,,,,,COMPLETE
4423,0.39889141178041926,2024-04-11 17:05:31.169460,2024-04-11 17:05:32.553072,0 days 00:00:01.383612,98.23143361727544,7.858524027727411,rbf,32,50.0,,,,,,,,,,,,,,,COMPLETE
4424,0.44701971028259324,2024-04-11 17:05:32.555070,2024-04-11 17:05:33.325135,0 days 00:00:00.770065,99.94027855898426,8.093563993790976,sigmoid,8,,25.0,30.0,,,,,,,,,,,,,COMPLETE
4425,0.5963643249384587,2024-04-11 17:05:33.326146,2024-04-11 17:05:34.097496,0 days 00:00:00.771350,93.23451480751544,8.451901744549167,sigmoid,8,,23.0,32.0,,,,,,,,,,,,,COMPLETE
4426,0.5046956211381026,2024-04-11 17:05:34.099499,2024-04-11 17:05:35.004563,0 days 00:00:00.905064,58.74701636642588,8.28287104557434,sigmoid,5,,,,,,,10.0,17.0,,,,,,,46.0,COMPLETE
4427,0.4737156958049802,2024-04-11 17:05:35.006559,2024-04-11 17:05:36.967048,0 days 00:00:01.960489,96.49764914939023,7.9928291510182445,sigmoid,30,,27.0,29.0,5.0,8.0,65.0,37.0,29.0,8.630775693992662,2.460562635164131,9.613183223969056,3.0,38.0,76.0,,COMPLETE
4428,0.2661553135680789,2024-04-11 17:05:36.969050,2024-04-11 17:05:38.006634,0 days 00:00:01.037584,99.98371300130866,7.463471895148263,sigmoid,34,22.0,,,,,,,,6.771213497107417,8.476932369406903,2.076130796446771,15.0,32.0,94.0,,COMPLETE
4429,0.3430279174866973,2024-04-11 17:05:38.008230,2024-04-11 17:05:39.276471,0 days 00:00:01.268241,95.35950420270937,7.747875566837222,sigmoid,51,42.0,,,2.0,4.0,20.0,,,3.3272599341867943,6.893654904575106,8.778864026818116,12.0,39.0,51.0,134.0,COMPLETE
4430,0.5661677221262714,2024-04-11 17:05:39.278414,2024-04-11 17:05:40.105365,0 days 00:00:00.826951,98.1007870351464,8.183380817012697,sigmoid,4,,,,,,,23.0,11.0,,,,,,,,COMPLETE
4431,0.5039941571187292,2024-04-11 17:05:40.107382,2024-04-11 17:05:41.338747,0 days 00:00:01.231365,99.97689546930805,8.606020053227809,sigmoid,53,33.0,,,6.0,6.0,33.0,49.0,2.0,,,,,,,185.0,COMPLETE
4432,0.44576114040679143,2024-04-11 17:05:41.341117,2024-04-11 17:05:42.560650,0 days 00:00:01.219533,96.84060492237387,7.914180737424855,sigmoid,61,23.0,21.0,31.0,4.0,7.0,52.0,13.0,37.0,,,,,,,181.0,COMPLETE
4433,0.34354477470295713,2024-04-11 17:05:42.562647,2024-04-11 17:05:43.334822,0 days 00:00:00.772175,99.98892006096108,8.318809708767091,sigmoid,33,28.0,,,,,,,,,,,,,,73.0,COMPLETE
4434,0.12003789673140693,2024-04-11 17:05:43.335824,2024-04-11 17:05:44.123160,0 days 00:00:00.787336,92.68334265348824,8.087942806867735,sigmoid,8,,26.0,28.0,,,,,,,,,,,,,COMPLETE
4435,0.5475150714696547,2024-04-11 17:05:44.126187,2024-04-11 17:05:45.581690,0 days 00:00:01.455503,95.07247774538176,7.650060478901541,sigmoid,18,,,,1.0,5.0,16.0,,,9.127525610458967,3.8561740286400985,9.28672536341061,6.0,21.0,83.0,,COMPLETE
4436,0.34156596589968546,2024-04-11 17:05:45.583673,2024-04-11 17:05:46.592396,0 days 00:00:01.008723,34.279550572127306,8.424169715962263,sigmoid,49,14.0,,,7.0,3.0,10.0,,,,,,,,,67.0,COMPLETE
4437,0.5929369437606513,2024-04-11 17:05:46.594375,2024-04-11 17:05:47.452441,0 days 00:00:00.858066,98.22468155874067,7.837039217653291,sigmoid,8,,25.0,33.0,,,,,,,,,,,,,COMPLETE
4438,0.4197317051692253,2024-04-11 17:05:47.454463,2024-04-11 17:05:48.516539,0 days 00:00:01.062076,96.68835178566894,8.144652550317028,sigmoid,45,20.0,28.0,31.0,,,,6.0,14.0,,,,,,,56.0,COMPLETE
4439,0.4518624712657884,2024-04-11 17:05:48.518536,2024-04-11 17:05:49.454204,0 days 00:00:00.935668,97.93463987078908,7.30886350224209,sigmoid,17,,,,3.0,1.0,70.0,,,,,,,,,27.0,COMPLETE
4440,0.17589038433506635,2024-04-11 17:05:49.456755,2024-04-11 17:05:50.992143,0 days 00:00:01.535388,98.09619405522261,7.9716382019672505,rbf,58,32.0,30.0,30.0,8.0,2.0,50.0,,,7.556302222434139,6.284662673996676,9.99397270535092,18.0,49.0,55.0,,COMPLETE
4441,0.5975287681569516,2024-04-11 17:05:50.994137,2024-04-11 17:05:51.758964,0 days 00:00:00.764827,95.11223951769027,8.82591522668544,sigmoid,8,,22.0,32.0,,,,,,,,,,,,,COMPLETE
4442,0.46589446589446587,2024-04-11 17:05:51.760965,2024-04-11 17:05:53.082487,0 days 00:00:01.321522,98.19009737253849,8.291596604974162,sigmoid,19,,,,5.0,8.0,63.0,,,7.829538047497977,7.2393269357497925,4.236241289724514,16.0,37.0,87.0,99.0,COMPLETE
4443,0.6009432182607054,2024-04-11 17:05:53.086069,2024-04-11 17:05:54.018042,0 days 00:00:00.931973,99.98862689123092,7.79815483318565,sigmoid,8,,24.0,31.0,,,,,,,,,,,,,COMPLETE
4444,0.5886452332280246,2024-04-11 17:05:54.020055,2024-04-11 17:05:54.980553,0 days 00:00:00.960498,93.83519844823594,2.5080100561519005,sigmoid,8,,23.0,29.0,,,,,,,,,,,,,COMPLETE
4445,0.401474377793,2024-04-11 17:05:54.982235,2024-04-11 17:05:56.329857,0 days 00:00:01.347622,5.314220996749427,8.542990449675788,sigmoid,47,18.0,27.0,33.0,,,,47.0,7.0,5.08825261080508,0.670140118253336,8.084549692975855,7.0,36.0,91.0,140.0,COMPLETE
4446,0.3655950176737923,2024-04-11 17:05:56.334476,2024-04-11 17:05:57.407485,0 days 00:00:01.073009,96.35936710000341,8.052258146185421,sigmoid,24,,35.0,30.0,6.0,4.0,31.0,,,,,,,,,,COMPLETE
4447,0.4686026915467846,2024-04-11 17:05:57.409487,2024-04-11 17:05:58.869768,0 days 00:00:01.460281,96.76184818519532,7.551980132548462,sigmoid,39,30.0,,,,,,28.0,6.0,9.989120424561785,5.7225580321068295,2.284228506856115,8.0,30.0,58.0,78.0,COMPLETE
4448,0.3969430137896662,2024-04-11 17:05:58.871744,2024-04-11 17:06:00.065510,0 days 00:00:01.193766,98.292159734648,7.0110925937241495,sigmoid,50,4.0,,,4.0,1.0,80.0,,,5.678574826224015,9.728119081241818,7.66772137979793,2.0,35.0,64.0,,COMPLETE
4449,0.517922282169459,2024-04-11 17:06:00.067505,2024-04-11 17:06:01.201842,0 days 00:00:01.134337,95.13204392831462,8.226500403530682,sigmoid,6,,,,,,,22.0,25.0,0.7227848511126833,4.592638304311885,2.6028225687924436,17.0,47.0,99.0,,COMPLETE
4450,0.41560819648306924,2024-04-11 17:06:01.203842,2024-04-11 17:06:02.351984,0 days 00:00:01.148142,98.27478011680283,7.881200401024641,sigmoid,25,,25.0,27.0,1.0,5.0,27.0,,,,,,,,,61.0,COMPLETE
4451,0.39684637332932876,2024-04-11 17:06:02.353984,2024-04-11 17:06:03.641968,0 days 00:00:01.287984,98.15134773605773,8.420635446174083,sigmoid,29,,26.0,32.0,7.0,3.0,4.0,25.0,40.0,,,,,,,157.0,COMPLETE
4452,0.6009432182607054,2024-04-11 17:06:03.643968,2024-04-11 17:06:04.427248,0 days 00:00:00.783280,92.32403273203465,8.031665522859251,sigmoid,8,,24.0,31.0,,,,,,,,,,,,,COMPLETE
4453,0.5895095625828441,2024-04-11 17:06:04.429249,2024-04-11 17:06:05.268555,0 days 00:00:00.839306,71.33210380301642,7.727039696187332,sigmoid,8,,29.0,34.0,,,,,,,,,,,,,COMPLETE
4454,0.5427228649200408,2024-04-11 17:06:05.270520,2024-04-11 17:06:06.556836,0 days 00:00:01.286316,96.68230461739635,8.110443650133373,sigmoid,22,,,,3.0,6.0,39.0,38.0,28.0,9.495397240067726,1.1459575677583418,1.3321702428033917,5.0,23.0,56.0,,COMPLETE
4455,0.4591779485303086,2024-04-11 17:06:06.558838,2024-04-11 17:06:07.710620,0 days 00:00:01.151782,99.96933417846078,8.299281335147066,sigmoid,21,,,,2.0,2.0,77.0,11.0,13.0,,,,,,,94.0,COMPLETE
4456,0.4934334364655229,2024-04-11 17:06:07.712123,2024-04-11 17:06:08.956989,0 days 00:00:01.244866,94.97489421882929,7.55443585508101,sigmoid,35,27.0,,,,,,,,8.928552373461008,4.809113359182266,5.705011900524403,13.0,42.0,75.0,107.0,COMPLETE
4457,0.5069140556625241,2024-04-11 17:06:08.958998,2024-04-11 17:06:09.761944,0 days 00:00:00.802946,99.99291066429468,7.951225505308199,sigmoid,8,,25.0,35.0,,,,,,,,,,,,,COMPLETE
4458,0.07983239607453965,2024-04-11 17:06:09.764564,2024-04-11 17:06:11.514576,0 days 00:00:01.750012,99.98883043235442,8.492880182399697,rbf,31,,27.0,29.0,8.0,7.0,35.0,44.0,18.0,4.736142529295508,5.400530949058445,3.5785931615182767,20.0,24.0,62.0,116.0,COMPLETE
